id,user_id,book_id,quantity,unit_price,timestamp_raw,shipping,unit_price_clean,unit_price_usd,paid_price,timestamp_parsed,date,year,month,day,cluster_id,authors,author_set
71389,47288,18976,2,27.00$,10/01/24 10:38:08 A.M.,,27.0,27.0,54.0,2024-10-01 10:38:08.000,2024-10-01,2024,10,1,47288,[],()
66343,47049,19403,1,€50¢50,10:14;19-Oct-2024,"4940 Arnoldo Keys, West Arnette, KS 77599",6060.0,6060.0,6060.0,2024-10-19 10:14:00.000,2024-10-19,2024,10,19,47049,[],()
72606,46685,19500,1,USD 45.99,"22:13:35,2025-07-02",,45.99,45.99,45.99,2025-07-02 22:13:35.000,2025-07-02,2025,7,2,46299,[],()
68462,45336,18992,1,€ 71.00,2025-10-20 16:25:20,,85.2,85.2,85.2,2025-10-20 16:25:20.000,2025-10-20,2025,10,20,45336,[],()
72691,45311,19388,1,52.25 $,"08:48:47 A.M.,28-August-2024",,52.25,52.25,52.25,2024-08-28 08:48:47.000,2024-08-28,2024,8,28,45311,[],()
68274,45939,19251,3,22$75¢,"00:52:59, 2024-07-01","Suite 161 84822 Volkman Gateway, Luketon, LA 46335",2275.0,2275.0,6825.0,2024-07-01 00:52:59.000,2024-07-01,2024,7,1,45939,[],()
66248,45486,19550,1,35 USD,22:10:29 02/07/25,,35.0,35.0,35.0,2025-02-07 22:10:29.000,2025-02-07,2025,2,7,45486,[],()
64098,46656,19558,1,33.00 USD,"30-Oct-2024, 15:56",,33.0,33.0,33.0,2024-10-30 15:56:00.000,2024-10-30,2024,10,30,46656,[],()
73454,44440,18990,1,44.75USD,01:34:17 P.M. 11-November-2024,,44.75,44.75,44.75,2024-11-11 13:34:17.000,2024-11-11,2024,11,11,44440,[],()
67871,46293,19212,1,49.0USD,"15-Jul-2024,01:16:06 A.M.",,49.0,49.0,49.0,2024-07-15 01:16:06.000,2024-07-15,2024,7,15,46293,[],()
71951,45542,18854,2,€46¢00,"16:02:39, 2024-12-23",,5520.0,5520.0,11040.0,2024-12-23 16:02:39.000,2024-12-23,2024,12,23,45542,[],()
66491,45800,19187,3,€ 59.5,"03:37,  2-Apr-2025",NULL,71.39999999999999,71.39999999999999,214.2,2025-04-02 03:37:00.000,2025-04-02,2025,4,2,45800,[],()
69129,44820,18933,1,40.00 USD,"12:18:07,05/17/24",,40.0,40.0,40.0,2024-05-17 12:18:07.000,2024-05-17,2024,5,17,44820,[],()
69460,46705,19544,4,40 $,"07:22, 04/25/24",NULL,40.0,40.0,160.0,2024-04-25 07:22:00.000,2024-04-25,2024,4,25,46705,[],()
67187,47497,19429,1,USD 69.,2025-01-20 21:14,,69.0,69.0,69.0,2025-01-20 21:14:00.000,2025-01-20,2025,1,20,47497,[],()
64981,46213,19450,1,EUR 31.99,"19:46, 10/03/24",,38.388,38.388,38.39,2024-10-03 19:46:00.000,2024-10-03,2024,10,3,46213,[],()
68626,44898,18911,1,USD65.50,12:23:47 A.M.;23-September-2024,,65.5,65.5,65.5,2024-09-23 00:23:47.000,2024-09-23,2024,9,23,44898,[],()
71724,45512,18966,2,55.50 $,11/01/24 01:56:57 pm,,55.5,55.5,111.0,2024-11-01 13:56:57.000,2024-11-01,2024,11,1,45512,[],()
65678,46448,19495,1,30.25USD," 3-OCT-2024, 03:34",,30.25,30.25,30.25,2024-10-03 03:34:00.000,2024-10-03,2024,10,3,46448,[],()
73631,46411,19325,1,€32¢00,2024-08-09T16:02:42.627,"72116 Guy Inlet, West Dionton, WA 64694",3840.0,3840.0,3840.0,2024-08-09 16:02:42.627,2024-08-09,2024,8,9,46411,[],()
66496,46161,19565,1,$67.5,2024-09-08T22:25:43.253,"Apt. 906 66777 Doyle Islands, Donettatown, MD 67566",67.5,67.5,67.5,2024-09-08 22:25:43.253,2024-09-08,2024,9,8,46711,[],()
71989,45265,19314,3,31.99 USD,05:41:37 05/11/24,"939 Colby Square, Boganbury, AL 07963",31.99,31.99,95.97,2024-05-11 05:41:37.000,2024-05-11,2024,5,11,45265,[],()
71813,47305,19584,1,$43.,2024-08-08T07:18:18.046,"Suite 719 168 Bayer Land, Lake Jaimie, CO 89572-5698",43.0,43.0,43.0,2024-08-08 07:18:18.046,2024-08-08,2024,8,8,47305,[],()
64706,45141,19127,1,58.00USD,"20:43:05, 03/18/25",NULL,58.0,58.0,58.0,2025-03-18 20:43:05.000,2025-03-18,2025,3,18,45141,[],()
64702,46531,18880,1,EUR70.,09:16:50 AM 24-December-2024,"Apt. 264 3599 Balistreri Turnpike, West Luigistad, MT 75332",84.0,84.0,84.0,2024-12-24 09:16:50.000,2024-12-24,2024,12,24,46531,[],()
64069,46100,19296,1,27.75 €,06:51:44 P.M.;2025-04-02,,33.3,33.3,33.3,2025-04-02 18:51:44.000,2025-04-02,2025,4,2,46100,[],()
71292,44947,19474,1,33.00USD, 2-Aug-2024;18:44:05,NULL,33.0,33.0,33.0,2024-08-02 18:44:05.000,2024-08-02,2024,8,2,44947,[],()
63887,47049,19056,1,25.25 $,02:59:55 am 04/06/25,NULL,25.25,25.25,25.25,2025-04-06 02:59:55.000,2025-04-06,2025,4,6,47049,[],()
63957,45745,19026,1,20.99USD,11/11/24 10:55:32 PM,NULL,20.99,20.99,20.99,2024-11-11 22:55:32.000,2024-11-11,2024,11,11,45745,[],()
72487,45195,18949,1,32.75€,"01/26/25, 03:09:51",NULL,39.3,39.3,39.3,2025-01-26 03:09:51.000,2025-01-26,2025,1,26,45195,[],()
68824,46313,19138,2,USD 29.50,"10-Jul-2024,07:22:34 P.M.",,29.5,29.5,59.0,2024-07-10 19:22:34.000,2024-07-10,2024,7,10,46313,[],()
69385,45952,19052,2,EUR71.99,2024-12-07T17:37:37.240,"418 Tempie Mills, Rowemouth, WA 72824-4137",86.38799999999999,86.38799999999999,172.78,2024-12-07 17:37:37.240,2024-12-07,2024,12,7,45952,[],()
72317,45007,19180,1,$42.,03:49:29 PM;2024-09-03,NULL,42.0,42.0,42.0,2024-09-03 15:49:29.000,2024-09-03,2024,9,3,45007,[],()
63225,45415,19344,1,$27.75,21:35:15 2025-07-28,NULL,27.75,27.75,27.75,2025-07-28 21:35:15.000,2025-07-28,2025,7,28,45415,[],()
68712,45241,19480,1,$74.00,"23:03,2025-01-15",,74.0,74.0,74.0,2025-01-15 23:03:00.000,2025-01-15,2025,1,15,46821,[],()
73890,45747,19445,1,EUR 62.50,00:34; 8-FEB-2025,,75.0,75.0,75.0,2025-02-08 00:34:00.000,2025-02-08,2025,2,8,45747,[],()
68918,46647,19046,2,23.00 €,"2025-01-06,15:01",NULL,27.599999999999998,27.599999999999998,55.2,2025-01-06 15:01:00.000,2025-01-06,2025,1,6,46647,[],()
71959,46402,19041,1,USD16.25,"09/09/24, 19:32:30",,16.25,16.25,16.25,2024-09-09 19:32:30.000,2024-09-09,2024,9,9,46402,[],()
65704,45546,19403,1,$54¢25,2025-05-19T19:56:20,,5425.0,5425.0,5425.0,2025-05-19 19:56:20.000,2025-05-19,2025,5,19,45546,[],()
70138,46958,19111,4,EUR 26.75,2024-09-13T17:28:31.138,NULL,32.1,32.1,128.4,2024-09-13 17:28:31.138,2024-09-13,2024,9,13,46958,[],()
72306,45040,19456,1,$ 31.0,"2024-08-28,16:50:42","Apt. 928 289 Oleta Course, Jannietown, AR 98094-3397",31.0,31.0,31.0,2024-08-28 16:50:42.000,2024-08-28,2024,8,28,45040,[],()
64092,44593,19415,4,$ 13.00, 6-Aug-2024 11:49,,13.0,13.0,52.0,2024-08-06 11:49:00.000,2024-08-06,2024,8,6,44593,[],()
67909,44600,19361,5,36.99EUR,"07/31/24, 15:31:21",,44.388,44.388,221.94,2024-07-31 15:31:21.000,2024-07-31,2024,7,31,44600,[],()
64994,47232,19124,2,56.99€,00:44 2024-05-22,NULL,68.388,68.388,136.78,2024-05-22 00:44:00.000,2024-05-22,2024,5,22,47232,[],()
71762,44367,19490,2,$ 51.25,09/08/24;08:44:41 A.M.,,51.25,51.25,102.5,2024-09-08 08:44:41.000,2024-09-08,2024,9,8,44367,[],()
73787,46946,19449,1,$49.00,"2024-10-31,23:39:16",,49.0,49.0,49.0,2024-10-31 23:39:16.000,2024-10-31,2024,10,31,46946,[],()
71212,45052,18968,4,USD66,"10:05:25 AM,  5-AUG-2024",,66.0,66.0,264.0,2024-08-05 10:05:25.000,2024-08-05,2024,8,5,45052,[],()
67853,45503,19262,5,67.75 EUR,18:33 28-Aug-2024,,81.3,81.3,406.5,2024-08-28 18:33:00.000,2024-08-28,2024,8,28,45503,[],()
73029,46314,18923,2,26.75USD,03/30/25;12:25:53,"Suite 277 5242 Blick Glens, New Breanaton, HI 59699-1995",26.75,26.75,53.5,2025-03-30 12:25:53.000,2025-03-30,2025,3,30,46314,[],()
66475,46631,19275,2,53.75 €,2024-05-23T14:20:41,,64.5,64.5,129.0,2024-05-23 14:20:41.000,2024-05-23,2024,5,23,46631,[],()
63058,44643,19061,1,$58.50,16:36;2024-12-03,"3570 Kulas Track, New Carie, WA 37270-0647",58.5,58.5,58.5,2024-12-03 16:36:00.000,2024-12-03,2024,12,3,44643,[],()
71145,45381,19126,1,EUR 26.25,2024-11-09T09:22:28.569,NULL,31.5,31.5,31.5,2024-11-09 09:22:28.569,2024-11-09,2024,11,9,45381,[],()
67549,44642,18874,1,54.USD,"01:51:01 A.M.,09/03/24",,54.0,54.0,54.0,2024-09-03 01:51:01.000,2024-09-03,2024,9,3,44642,[],()
70982,46397,19175,2,USD42.50,"11/02/24, 17:52:38",NULL,42.5,42.5,85.0,2024-11-02 17:52:38.000,2024-11-02,2024,11,2,46397,[],()
69688,46686,19585,1,USD 67.50,2025-01-14T18:43:22,NULL,67.5,67.5,67.5,2025-01-14 18:43:22.000,2025-01-14,2025,1,14,46686,[],()
67093,46519,19188,2,$ 44.00,2024-08-06;07:17:52,,44.0,44.0,88.0,2024-08-06 07:17:52.000,2024-08-06,2024,8,6,46519,[],()
66816,46704,18993,1,65.99$,"18-December-2024, 11:23:08",NULL,65.99,65.99,65.99,2024-12-18 11:23:08.000,2024-12-18,2024,12,18,45219,[],()
72327,45131,19408,2,$22¢75,13-November-2024;22:48,"7640 Reichel Island, Swaniawskichester, VA 38440-8395",2275.0,2275.0,4550.0,2024-11-13 22:48:00.000,2024-11-13,2024,11,13,45131,[],()
73206,44765,19211,1,44.25 €,18:28 2025-04-26,"9556 Wilber Lights, North Jerrodhaven, MN 46135-2278",53.1,53.1,53.1,2025-04-26 18:28:00.000,2025-04-26,2025,4,26,44765,[],()
71747,47604,19373,1,€51¢50,2025-02-10T02:39:59,"Apt. 490 3379 Griselda Plains, Lake Lenstad, SD 14094-0246",6180.0,6180.0,6180.0,2025-02-10 02:39:59.000,2025-02-10,2025,2,10,47604,[],()
70937,47539,19339,1,€43¢00,2024-07-03T22:34:56.461,"Suite 242 7639 Dania Cape, Michalebury, RI 33128",5160.0,5160.0,5160.0,2024-07-03 22:34:56.461,2024-07-03,2024,7,3,47539,[],()
70434,46608,19558,1,€33¢99,2024-08-08T15:46:33.401,,4078.7999999999997,4078.7999999999997,4078.8,2024-08-08 15:46:33.401,2024-08-08,2024,8,8,46608,[],()
73791,46548,18992,1,68.5 EUR,"04/15/25,13:12:56",,82.2,82.2,82.2,2025-04-15 13:12:56.000,2025-04-15,2025,4,15,46548,[],()
66576,45440,19461,3,69.25$,"01:39:35 am,31-March-2025",NULL,69.25,69.25,207.75,2025-03-31 01:39:35.000,2025-03-31,2025,3,31,45440,[],()
72939,45726,19557,1,55.99 USD,"2024-12-09,21:27",,55.99,55.99,55.99,2024-12-09 21:27:00.000,2024-12-09,2024,12,9,45726,[],()
69785,44614,19188,1,$43.0,04:17:28 am 01/18/25,"Suite 175 882 Collette Summit, North Averyburgh, PA 38143-4918",43.0,43.0,43.0,2025-01-18 04:17:28.000,2025-01-18,2025,1,18,44614,[],()
68121,46884,19105,1,34.75 $,"2024-12-17, 16:18",,34.75,34.75,34.75,2024-12-17 16:18:00.000,2024-12-17,2024,12,17,46884,[],()
69933,46026,19502,3,USD35.0,"10:30:26, 1-Nov-2024",,35.0,35.0,105.0,2024-11-01 10:30:26.000,2024-11-01,2024,11,1,46026,[],()
73060,47063,19220,1,60.0 $,"13:20:16, 2025-02-18",,60.0,60.0,60.0,2025-02-18 13:20:16.000,2025-02-18,2025,2,18,47063,[],()
71636,47564,18875,2,€45¢75," 6-OCT-2024, 02:41:16 am","47931 Botsford Meadow, West Nan, GA 47842-9623",5490.0,5490.0,10980.0,2024-10-06 02:41:16.000,2024-10-06,2024,10,6,47564,[],()
67096,44895,19553,1,$ 46.00,"06/20/24,06:48:24 A.M.","86663 Kyle Extensions, Paucekmouth, IN 36524",46.0,46.0,46.0,2024-06-20 06:48:24.000,2024-06-20,2024,6,20,44895,[],()
63683,45800,19069,1,USD 41.5,11/24/24;08:18:57 A.M.,"Apt. 234 157 Candyce Dam, North Deidra, CA 96389-7424",41.5,41.5,41.5,2024-11-24 08:18:57.000,2024-11-24,2024,11,24,45800,[],()
68810,45797,19286,2,USD21.99,"2025-03-27, 17:26","4588 Mohr Brook, Schroederton, ME 92095-0124",21.99,21.99,43.98,2025-03-27 17:26:00.000,2025-03-27,2025,3,27,45932,[],()
70293,44786,18921,2,USD 46.00,"30-May-2025,17:23",NULL,46.0,46.0,92.0,2025-05-30 17:23:00.000,2025-05-30,2025,5,30,44786,[],()
64273,46662,19377,1,50.25€,10:45;2025-05-23,NULL,60.3,60.3,60.3,2025-05-23 10:45:00.000,2025-05-23,2025,5,23,46662,[],()
63762,45324,19179,1,USD55.00,"12:06:01 A.M., 23-APR-2025",NULL,55.0,55.0,55.0,2025-04-23 00:06:01.000,2025-04-23,2025,4,23,45324,[],()
71692,45794,18983,2,EUR 36.00,2024-08-03T20:04:37.717,,43.199999999999996,43.199999999999996,86.4,2024-08-03 20:04:37.717,2024-08-03,2024,8,3,45794,[],()
73838,44473,19174,1,EUR29.50,"2024-11-22, 10:35:55","Suite 976 87479 Torp Mountains, North Roycebury, WV 77879-1670",35.4,35.4,35.4,2024-11-22 10:35:55.000,2024-11-22,2024,11,22,44473,[],()
71146,46332,19544,3,39.50€,2024-10-24T11:23:05,"Apt. 840 3260 Machelle Canyon, East Ernestfort, MT 18852-8508",47.4,47.4,142.2,2024-10-24 11:23:05.000,2024-10-24,2024,10,24,46332,[],()
62747,46959,19309,1,€70.5," 6-SEP-2024,11:26","Apt. 417 8075 Enriqueta Pines, Lucinaberg, MD 96464-3899",84.6,84.6,84.6,2024-09-06 11:26:00.000,2024-09-06,2024,9,6,46959,[],()
68448,47358,19020,1,USD 19.0,"19-September-2024, 05:25:16",,19.0,19.0,19.0,2024-09-19 05:25:16.000,2024-09-19,2024,9,19,47358,[],()
67051,44340,19514,1,USD16.0,"07:43:26, 2025-02-22",NULL,16.0,16.0,16.0,2025-02-22 07:43:26.000,2025-02-22,2025,2,22,44340,[],()
64443,45263,18999,1,51. USD,"11/09/24,19:31:34",,51.0,51.0,51.0,2024-11-09 19:31:34.000,2024-11-09,2024,11,9,45263,[],()
72788,46138,19393,1,23.0 USD,26.11.2024 14:33:33,,23.0,23.0,23.0,2024-11-26 14:33:33.000,2024-11-26,2024,11,26,46138,[],()
66571,44870,19407,1,21.5USD,"08/11/24,07:43:17 pm",,21.5,21.5,21.5,2024-08-11 19:43:17.000,2024-08-11,2024,8,11,44870,[],()
63638,46383,19435,1,70.00USD,08:56:23 am  5-November-2024,,70.0,70.0,70.0,2024-11-05 08:56:23.000,2024-11-05,2024,11,5,46383,[],()
72451,47170,19156,1,38.99$,"12/14/24, 08:36:12 AM",,38.99,38.99,38.99,2024-12-14 08:36:12.000,2024-12-14,2024,12,14,47170,[],()
69856,44343,19102,1,EUR61.25,"20-Mar-2025,23:17:51",NULL,73.5,73.5,73.5,2025-03-20 23:17:51.000,2025-03-20,2025,3,20,44343,[],()
73571,44563,19495,1,$30¢00,08:15:41 09/18/24,NULL,3000.0,3000.0,3000.0,2024-09-18 08:15:41.000,2024-09-18,2024,9,18,44563,[],()
70565,45575,18990,2,USD48.00,2024-12-26T13:51:04.650,,48.0,48.0,96.0,2024-12-26 13:51:04.650,2024-12-26,2024,12,26,45575,[],()
66726,44346,19005,1,39.25 USD,24.09.2024 21:31:31,,39.25,39.25,39.25,2024-09-24 21:31:31.000,2024-09-24,2024,9,24,44346,[],()
63079,45617,19210,1,$38,"16:51,22-June-2024",NULL,38.0,38.0,38.0,2024-06-22 16:51:00.000,2024-06-22,2024,6,22,45617,[],()
68403,44533,19474,2,32.99$,2024-08-13T23:12:25.714,"Apt. 300 8604 Ashlyn Wells, Effertzstad, ID 02997",32.99,32.99,65.98,2024-08-13 23:12:25.714,2024-08-13,2024,8,13,44533,[],()
67247,47452,19383,1,62.75 USD,"03/12/25,10:08:23 pm",NULL,62.75,62.75,62.75,2025-03-12 22:08:23.000,2025-03-12,2025,3,12,46216,[],()
69471,46982,19192,1,61.USD,06/15/24;18:37,,61.0,61.0,61.0,2024-06-15 18:37:00.000,2024-06-15,2024,6,15,46982,[],()
65450,47123,19336,5,48.50USD,2025-02-06;17:00,,48.5,48.5,242.5,2025-02-06 17:00:00.000,2025-02-06,2025,2,6,47123,[],()
69839,44847,18942,1,25.50$,Mon Oct 21 11:52:31 2024,,25.5,25.5,25.5,2024-10-21 11:52:31.000,2024-10-21,2024,10,21,44847,[],()
73299,45152,19448,2,USD55.0,"25-Oct-2024,11:43:40 P.M.",,55.0,55.0,110.0,2024-10-25 23:43:40.000,2024-10-25,2024,10,25,45152,[],()
68273,45665,19506,2,60USD,"06:20, 02/06/25","97329 O'Conner Vista, North Sanjuana, ID 59014-1661",60.0,60.0,120.0,2025-02-06 06:20:00.000,2025-02-06,2025,2,6,46459,[],()
73968,45506,19173,1,63.5EUR,"14:37,2025-02-17","657 Jenny Squares, Rolandton, AR 78477",76.2,76.2,76.2,2025-02-17 14:37:00.000,2025-02-17,2025,2,17,45506,[],()
68693,44663,19143,1,$27.5,"09:35, 09/16/24",NULL,27.5,27.5,27.5,2024-09-16 09:35:00.000,2024-09-16,2024,9,16,44663,[],()
63129,47428,19577,1,USD70.50,01/29/25;17:37,,70.5,70.5,70.5,2025-01-29 17:37:00.000,2025-01-29,2025,1,29,47428,[],()
72876,46100,19112,3,EUR16.5,05.01.2025 14:40:40,,19.8,19.8,59.4,2025-05-01 14:40:40.000,2025-05-01,2025,5,1,46100,[],()
66154,45312,19361,1,EUR 37,2024-07-18T02:33:32,,44.4,44.4,44.4,2024-07-18 02:33:32.000,2024-07-18,2024,7,18,45312,[],()
73023,44549,19153,4,$ 57.99,"10-May-2025,06:27:08 pm",NULL,57.99,57.99,231.96,2025-05-10 18:27:08.000,2025-05-10,2025,5,10,44549,[],()
69494,45664,19126,2,30.50EUR,2025-02-07T19:28:18.677,,36.6,36.6,73.2,2025-02-07 19:28:18.677,2025-02-07,2025,2,7,45664,[],()
68222,45222,19512,1,45.5 €,23-Aug-2024 00:50,,54.6,54.6,54.6,2024-08-23 00:50:00.000,2024-08-23,2024,8,23,45222,[],()
71380,46657,19510,1,17.00$,21:10:24 04/14/25,,17.0,17.0,17.0,2025-04-14 21:10:24.000,2025-04-14,2025,4,14,46657,[],()
66638,45958,19323,1,$ 43.5,08/21/24;08:45:14 P.M.,"Suite 952 502 Homer Track, Carlenebury, IA 75313",43.5,43.5,43.5,2024-08-21 20:45:14.000,2024-08-21,2024,8,21,45958,[],()
68844,46678,19215,1,USD20.99,09/30/24 10:16:28 pm,"Suite 372 2685 Casper Trail, Port Bettina, OR 68920",20.99,20.99,20.99,2024-09-30 22:16:28.000,2024-09-30,2024,9,30,46678,[],()
73074,46137,19458,1,56.25 $,2025-10-05T12:50:56,NULL,56.25,56.25,56.25,2025-10-05 12:50:56.000,2025-10-05,2025,10,5,46137,[],()
71172,45094,19237,4,USD68.0,12-May-2025 12:11:02,,68.0,68.0,272.0,2025-05-12 12:11:02.000,2025-05-12,2025,5,12,45094,[],()
64598,47564,19191,2,USD27.50,"09/09/24,06:20:31 pm",,27.5,27.5,55.0,2024-09-09 18:20:31.000,2024-09-09,2024,9,9,47564,[],()
70881,45409,19152,1,EUR28.5,"09:40,11-Aug-2025","6207 Gil Wells, New Ottoville, ME 69653-6209",34.199999999999996,34.199999999999996,34.2,2025-08-11 09:40:00.000,2025-08-11,2025,8,11,45409,[],()
67892,45976,19232,1,31.99EUR,"12/25/24,01:12:33 pm",,38.388,38.388,38.39,2024-12-25 13:12:33.000,2024-12-25,2024,12,25,44971,[],()
68034,46667,19012,2,42.5$,2024-07-07;03:15:22,"Apt. 279 98511 Cronin Center, Reynafort, NV 66956",42.5,42.5,85.0,2024-07-07 03:15:22.000,2024-07-07,2024,7,7,46667,[],()
69319,44617,19345,1,USD 61.00,"2024-08-08,21:49:06",,61.0,61.0,61.0,2024-08-08 21:49:06.000,2024-08-08,2024,8,8,44617,[],()
67872,45903,18868,1,$25.75,"2024-11-19,10:19",NULL,25.75,25.75,25.75,2024-11-19 10:19:00.000,2024-11-19,2024,11,19,45903,[],()
67619,44944,19171,1,43.5 $,00:32 26-Dec-2024,,43.5,43.5,43.5,2024-12-26 00:32:00.000,2024-12-26,2024,12,26,44944,[],()
73472,46747,19421,1,23.0USD,20:49;29-October-2024,"Apt. 764 37440 Billie Station, North Liseview, PA 93331-5412",23.0,23.0,23.0,2024-10-29 20:49:00.000,2024-10-29,2024,10,29,46747,[],()
68798,44414,19011,1,55.75 $,20:14:27 2025-05-23,NULL,55.75,55.75,55.75,2025-05-23 20:14:27.000,2025-05-23,2025,5,23,44414,[],()
65776,47480,18859,2,51.5USD,"09:45,2024-04-03","8509 Cammy Cliffs, North Nellieton, RI 15636-6629",51.5,51.5,103.0,2024-04-03 09:45:00.000,2024-04-03,2024,4,3,47480,[],()
62861,47348,19233,1,69.75$,"04:38:40 P.M., 09/24/24",,69.75,69.75,69.75,2024-09-24 16:38:40.000,2024-09-24,2024,9,24,47348,[],()
69736,45480,19428,2,$43.99,"2025-03-31,11:24:07 pm",,43.99,43.99,87.98,2025-03-31 23:24:07.000,2025-03-31,2025,3,31,45480,[],()
70332,44989,19589,1,$ 54.75,2024-08-01T01:30:26,,54.75,54.75,54.75,2024-08-01 01:30:26.000,2024-08-01,2024,8,1,44989,[],()
64336,46537,19168,1,USD63.5,"2024-09-23,15:39:14",NULL,63.5,63.5,63.5,2024-09-23 15:39:14.000,2024-09-23,2024,9,23,44592,[],()
68264,45317,18960,1,34.5 USD,2024-12-24T06:21:47,NULL,34.5,34.5,34.5,2024-12-24 06:21:47.000,2024-12-24,2024,12,24,47534,[],()
66231,44697,19054,3,$ 46.,"16:56:04, 02/18/25",NULL,46.0,46.0,138.0,2025-02-18 16:56:04.000,2025-02-18,2025,2,18,44697,[],()
66931,44384,19159,1,$19.99,"2025-07-19, 11:41","6652 Larson Courts, Carlosmouth, MN 12932-3500",19.99,19.99,19.99,2025-07-19 11:41:00.000,2025-07-19,2025,7,19,44384,[],()
73535,45699,19419,1,53.25 $,"2024-11-18,21:46",NULL,53.25,53.25,53.25,2024-11-18 21:46:00.000,2024-11-18,2024,11,18,45699,[],()
66062,44867,18875,2,$45.75,"20:44:32,28-JUL-2024","Apt. 994 593 Hyatt Station, East Walter, CT 91789-8543",45.75,45.75,91.5,2024-07-28 20:44:32.000,2024-07-28,2024,7,28,44867,[],()
64340,45778,19447,1,€26¢99,2024-11-13;04:43:42 AM,,3238.7999999999997,3238.7999999999997,3238.8,2024-11-13 04:43:42.000,2024-11-13,2024,11,13,45778,[],()
72220,46054,19015,1,62.5 $,08:04:53 P.M. 27-Jun-2025,NULL,62.5,62.5,62.5,2025-06-27 20:04:53.000,2025-06-27,2025,6,27,46054,[],()
66819,45432,19562,1,USD51.5,2024-10-13T15:48:23,NULL,51.5,51.5,51.5,2024-10-13 15:48:23.000,2024-10-13,2024,10,13,45432,[],()
65627,46238,19524,1,EUR 45.50,"06:52:37,21-Jul-2024",,54.6,54.6,54.6,2024-07-21 06:52:37.000,2024-07-21,2024,7,21,46238,[],()
72663,45665,19238,1,EUR 18.25,2024-12-19;21:53:50,,21.9,21.9,21.9,2024-12-19 21:53:50.000,2024-12-19,2024,12,19,46459,[],()
65493,45427,19124,1,52.0$,"14:26:23,2024-12-28",,52.0,52.0,52.0,2024-12-28 14:26:23.000,2024-12-28,2024,12,28,45427,[],()
71608,47488,19444,1,45.75€,22:01;2025-06-14,NULL,54.9,54.9,54.9,2025-06-14 22:01:00.000,2025-06-14,2025,6,14,47488,[],()
70349,47110,18961,1,69$50¢, 3-November-2024;15:05,,6950.0,6950.0,6950.0,2024-11-03 15:05:00.000,2024-11-03,2024,11,3,47110,[],()
63750,46463,19305,1,€ 57.5,"11/17/24, 15:15",,69.0,69.0,69.0,2024-11-17 15:15:00.000,2024-11-17,2024,11,17,46463,[],()
67554,47617,19322,1,EUR 67.0,"27-Jan-2025, 06:21",,80.39999999999999,80.39999999999999,80.4,2025-01-27 06:21:00.000,2025-01-27,2025,1,27,47617,[],()
63899,46424,18982,1,57.0USD,07:15:52 AM;06/30/24,,57.0,57.0,57.0,2024-06-30 07:15:52.000,2024-06-30,2024,6,30,46424,[],()
66079,45136,19199,1,USD 15.0,"04/06/25,07:18:45 A.M.",,15.0,15.0,15.0,2025-04-06 07:18:45.000,2025-04-06,2025,4,6,45136,[],()
73226,45486,18956,1,€53¢50,10-AUG-2024 07:21,"47540 Elwood Ridge, Gradyport, AR 72615-0740",6420.0,6420.0,6420.0,2024-08-10 07:21:00.000,2024-08-10,2024,8,10,45486,[],()
67350,46877,18898,1,EUR 74.99,2024-08-04;22:22:25,"99087 Herman Place, Geneviveside, NH 66990",89.98799999999999,89.98799999999999,89.99,2024-08-04 22:22:25.000,2024-08-04,2024,8,4,46877,[],()
70252,47195,19199,1,€17¢25,14:37 09/09/24,NULL,2070.0,2070.0,2070.0,2024-09-09 14:37:00.000,2024-09-09,2024,9,9,47195,[],()
68435,44877,19538,1,€ 54.50,"2024-07-01, 13:28:08",,65.39999999999999,65.39999999999999,65.4,2024-07-01 13:28:08.000,2024-07-01,2024,7,1,44877,[],()
65434,46885,19527,1,73.99 $,2024-05-01T19:23:44.305,"Suite 707 59997 Friesen Mews, New Stanfordton, AK 89574-4868",73.99,73.99,73.99,2024-05-01 19:23:44.305,2024-05-01,2024,5,1,46885,[],()
68666,44703,19568,1,45.00 $,2024-08-20;01:03:14 pm,"Apt. 575 40000 Leone Springs, North Sidney, WI 54095",45.0,45.0,45.0,2024-08-20 13:03:14.000,2024-08-20,2024,8,20,44703,[],()
72708,44346,19259,1,61.00USD,"03:07, 04/25/25",,61.0,61.0,61.0,2025-04-25 03:07:00.000,2025-04-25,2025,4,25,44346,[],()
63063,44661,18846,5,23.25 USD,Thu Mar 28 13:47:42 2024,,23.25,23.25,116.25,2024-03-28 13:47:42.000,2024-03-28,2024,3,28,47317,[],()
67636,44685,18856,2,46.99 €,23:03:55; 9-Jul-2025,,56.388,56.388,112.78,2025-07-09 23:03:55.000,2025-07-09,2025,7,9,44685,[],()
67681,45101,18983,3,35.00$,23:54 12/22/24,,35.0,35.0,105.0,2024-12-22 23:54:00.000,2024-12-22,2024,12,22,45101,[],()
67983,46893,19018,1,16.99€,"21-March-2024, 10:08",,20.387999999999998,20.387999999999998,20.39,2024-03-21 10:08:00.000,2024-03-21,2024,3,21,46893,[],()
64287,45450,19523,1,$ 33.50,23.08.2024 14:24:24,,33.5,33.5,33.5,2024-08-23 14:24:24.000,2024-08-23,2024,8,23,45450,[],()
69537,44751,19148,1,$39.,17.01.2025 20:58:58,"Apt. 706 165 Cordell Tunnel, Rashadfurt, VT 62232",39.0,39.0,39.0,2025-01-17 20:58:58.000,2025-01-17,2025,1,17,44751,[],()
73593,46039,18887,2,47.99€, 4.07.2025  0:59:59,NULL,57.588,57.588,115.18,2025-04-07 00:59:59.000,2025-04-07,2025,4,7,46039,[],()
69740,46721,18870,2,€53.99,07:45:20;16-May-2024,,64.788,64.788,129.58,2024-05-16 07:45:20.000,2024-05-16,2024,5,16,46721,[],()
70910,45921,19502,2,USD 39.99,07:19:52;2024-04-03,,39.99,39.99,79.98,2024-04-03 07:19:52.000,2024-04-03,2024,4,3,45921,[],()
68132,45299,19052,3,71. EUR,"12:26:01, 12/20/24",NULL,85.2,85.2,255.6,2024-12-20 12:26:01.000,2024-12-20,2024,12,20,45299,[],()
69041,45992,19032,1,$73.50,2024-05-12 03:17:30 P.M.,,73.5,73.5,73.5,2024-05-12 15:17:30.000,2024-05-12,2024,5,12,45992,[],()
70726,47038,19053,4,$ 53.25,17:30;04/06/25,"Suite 805 356 Grady Hollow, North Kevin, NJ 82342",53.25,53.25,213.0,2025-04-06 17:30:00.000,2025-04-06,2025,4,6,47038,[],()
69312,47298,19043,1,17.50$,2024-09-25;01:10:57 A.M.,NULL,17.5,17.5,17.5,2024-09-25 01:10:57.000,2024-09-25,2024,9,25,47298,[],()
71022,46000,19219,1,$30.5,12:54:26 07/16/24,"Suite 505 56935 Beier Forge, Cruickshankfurt, NE 78924-9065",30.5,30.5,30.5,2024-07-16 12:54:26.000,2024-07-16,2024,7,16,46000,[],()
72356,44487,19024,2,59.5 €,"08:20:58 am,21-February-2025","91073 Conn Extensions, North Luella, AL 73096-7135",71.39999999999999,71.39999999999999,142.8,2025-02-21 08:20:58.000,2025-02-21,2025,2,21,44487,[],()
70505,45048,19162,2,USD66.25,2025-07-06T19:47:06.288,"Suite 256 4320 Bernhard Divide, Lake Janeenborough, UT 46104",66.25,66.25,132.5,2025-07-06 19:47:06.288,2025-07-06,2025,7,6,45048,[],()
68067,46601,19144,1,47.75 €,"04:56, 11-NOV-2024",,57.3,57.3,57.3,2024-11-11 04:56:00.000,2024-11-11,2024,11,11,46601,[],()
66424,47563,18912,1,$ 63.50, 6-January-2025 22:43:32,NULL,63.5,63.5,63.5,2025-01-06 22:43:32.000,2025-01-06,2025,1,6,47563,[],()
71119,45998,19574,1,USD50.25,02/28/24 02:08:19 am,NULL,50.25,50.25,50.25,2024-02-28 02:08:19.000,2024-02-28,2024,2,28,45998,[],()
73715,44888,19589,2,56€75¢,2024-07-28T10:41:53.082,,6810.0,6810.0,13620.0,2024-07-28 10:41:53.082,2024-07-28,2024,7,28,44888,[],()
67863,44592,18893,1,53.50 EUR,"16-October-2024, 23:30",,64.2,64.2,64.2,2024-10-16 23:30:00.000,2024-10-16,2024,10,16,44592,[],()
68100,46753,19024,1,55.25 €,2024-11-26T10:52:03,,66.3,66.3,66.3,2024-11-26 10:52:03.000,2024-11-26,2024,11,26,46753,[],()
66862,46171,18862,1,USD30.75,31-MAY-2024 17:23:54,,30.75,30.75,30.75,2024-05-31 17:23:54.000,2024-05-31,2024,5,31,46171,[],()
73882,47407,19020,1,16.0USD,11:29:45 PM;2025-01-21,,16.0,16.0,16.0,2025-01-21 23:29:45.000,2025-01-21,2025,1,21,47407,[],()
69179,44752,18839,4,€23.99,07/01/24 22:27,NULL,28.787999999999997,28.787999999999997,115.15,2024-07-01 22:27:00.000,2024-07-01,2024,7,1,44752,[],()
69595,45414,19497,5,USD54.0,2025-01-17T03:27:10.591,,54.0,54.0,270.0,2025-01-17 03:27:10.591,2025-01-17,2025,1,17,45414,[],()
66186,45561,19401,1,57USD,"2024-09-27, 10:58:53 AM",NULL,57.0,57.0,57.0,2024-09-27 10:58:53.000,2024-09-27,2024,9,27,45561,[],()
63097,46819,19129,1,$22.50,"02:08:22 PM,2025-02-24",,22.5,22.5,22.5,2025-02-24 14:08:22.000,2025-02-24,2025,2,24,46819,[],()
72182,46745,19004,3,69.50USD,2024-10-12T10:05:50.642,"Apt. 921 35048 Hilll Overpass, Lesleechester, SC 00463",69.5,69.5,208.5,2024-10-12 10:05:50.642,2024-10-12,2024,10,12,46745,[],()
62891,45415,18961,1,USD 70.50,00:26;14-Mar-2025,NULL,70.5,70.5,70.5,2025-03-14 00:26:00.000,2025-03-14,2025,3,14,45415,[],()
70319,44515,19563,1,USD 67.5,06/08/25 08:01,,67.5,67.5,67.5,2025-06-08 08:01:00.000,2025-06-08,2025,6,8,44515,[],()
64805,44463,19336,1,46 $,12:10:38 PM;2024-10-14,NULL,46.0,46.0,46.0,2024-10-14 12:10:38.000,2024-10-14,2024,10,14,44463,[],()
70315,44955,18961,1,$ 72.99,"12:58:46 pm,12/16/24",NULL,72.99,72.99,72.99,2024-12-16 12:58:46.000,2024-12-16,2024,12,16,44955,[],()
72544,47320,18980,2,60.0$,"04:40,03/30/25","Apt. 971 974 Eli Hill, Georgettemouth, RI 40360-8776",60.0,60.0,120.0,2025-03-30 04:40:00.000,2025-03-30,2025,3,30,47320,[],()
69433,46807,19379,1,USD53.5,2025-09-17T19:31:53.578,,53.5,53.5,53.5,2025-09-17 19:31:53.578,2025-09-17,2025,9,17,46807,[],()
66285,44605,19086,1,$73.25, 2-Nov-2024;02:00:57,NULL,73.25,73.25,73.25,2024-11-02 02:00:57.000,2024-11-02,2024,11,2,44605,[],()
70530,46362,18918,1,USD70,"04:38:36,2025-07-14",,70.0,70.0,70.0,2025-07-14 04:38:36.000,2025-07-14,2025,7,14,46362,[],()
68228,45306,19119,3,USD 61.5,"2025-04-04, 09:04",,61.5,61.5,184.5,2025-04-04 09:04:00.000,2025-04-04,2025,4,4,45306,[],()
66596,45623,18944,3,€ 16,29-Jan-2025 13:24,"505 Schiller Roads, East Cary, NM 02146",19.2,19.2,57.6,2025-01-29 13:24:00.000,2025-01-29,2025,1,29,45623,[],()
64557,46358,19299,2,€32,"02/20/25,08:49:31",,38.4,38.4,76.8,2025-02-20 08:49:31.000,2025-02-20,2025,2,20,46358,[],()
66441,46832,19333,5,31.99 $,"24-June-2025,21:06","63207 Blythe Cove, Lehnerstad, SD 62983",31.99,31.99,159.95,2025-06-24 21:06:00.000,2025-06-24,2025,6,24,46832,[],()
63110,45921,18887,1,48.50 USD,25.08.2024 17:14:14,NULL,48.5,48.5,48.5,2024-08-25 17:14:14.000,2024-08-25,2024,8,25,45921,[],()
70108,47025,19526,2,69.99 €,19:12:05;21-DEC-2024,,83.98799999999999,83.98799999999999,167.98,2024-12-21 19:12:05.000,2024-12-21,2024,12,21,47025,[],()
71434,47263,19404,2,USD 32.75,17:14:13;2024-09-20,"303 Dooley Loaf, West Jodymouth, WY 46761-3550",32.75,32.75,65.5,2024-09-20 17:14:13.000,2024-09-20,2024,9,20,47263,[],()
65667,45474,19434,1,15.50€,"2024-08-01,15:37","Apt. 488 7704 Boehm Trace, Hoppeburgh, NV 03223-7801",18.599999999999998,18.599999999999998,18.6,2024-08-01 15:37:00.000,2024-08-01,2024,8,1,45474,[],()
68858,45634,18921,1,$ 45.0,02:54:41;31-August-2024,NULL,45.0,45.0,45.0,2024-08-31 02:54:41.000,2024-08-31,2024,8,31,45634,[],()
65529,46393,19309,1,68.5 USD,"22-APR-2025, 19:21:47","2050 Larkin Center, East Marshallburgh, MO 84051",68.5,68.5,68.5,2025-04-22 19:21:47.000,2025-04-22,2025,4,22,46393,[],()
69996,44369,19243,1,38.99$,2024-12-27T09:03:17,NULL,38.99,38.99,38.99,2024-12-27 09:03:17.000,2024-12-27,2024,12,27,44369,[],()
70334,47017,19553,4,46 €,08:01:03 P.M.;2025-02-03,"Suite 437 234 Metz Land, Robinborough, TX 07017",55.199999999999996,55.199999999999996,220.8,2025-02-03 20:01:03.000,2025-02-03,2025,2,3,47017,[],()
65857,45231,18877,1,52.0$,2025-06-24T06:44:36.194,,52.0,52.0,52.0,2025-06-24 06:44:36.194,2025-06-24,2025,6,24,45231,[],()
67357,44490,19309,5,USD 69.,27-May-2025 01:56,,69.0,69.0,345.0,2025-05-27 01:56:00.000,2025-05-27,2025,5,27,44490,[],()
71915,45389,19161,1,36.00 $,00:33:46;2024-08-27,"Suite 254 63023 Beer Estate, Greenholtport, ID 11766-7363",36.0,36.0,36.0,2024-08-27 00:33:46.000,2024-08-27,2024,8,27,45389,[],()
63408,45326,19157,2,$31.99,04/01/24 00:27:38,,31.99,31.99,63.98,2024-04-01 00:27:38.000,2024-04-01,2024,4,1,45326,[],()
66174,47165,18909,1,USD 27.0,"07:58,07/28/24",NULL,27.0,27.0,27.0,2024-07-28 07:58:00.000,2024-07-28,2024,7,28,47165,[],()
73201,47370,19005,1,USD 35.5,"26-June-2025, 19:10:46",NULL,35.5,35.5,35.5,2025-06-26 19:10:46.000,2025-06-26,2025,6,26,47370,[],()
68221,46480,19562,1,€52.99,"09:44, 2025-08-09",,63.588,63.588,63.59,2025-08-09 09:44:00.000,2025-08-09,2025,8,9,46480,[],()
73941,44976,18954,1,€33¢75,"03:45:37,03/05/25","5125 Luvenia Views, Natoshaview, OK 17568-4608",4050.0,4050.0,4050.0,2025-03-05 03:45:37.000,2025-03-05,2025,3,5,44976,[],()
71575,45708,19050,1,€65¢99,2024-07-24T02:18:38,,7918.799999999999,7918.799999999999,7918.8,2024-07-24 02:18:38.000,2024-07-24,2024,7,24,45708,[],()
64165,45911,19548,1,50.99USD,2025-04-10;23:41,NULL,50.99,50.99,50.99,2025-04-10 23:41:00.000,2025-04-10,2025,4,10,45911,[],()
65968,46236,19588,1,65.0$,2024-11-15T16:19:59,NULL,65.0,65.0,65.0,2024-11-15 16:19:59.000,2024-11-15,2024,11,15,46236,[],()
69696,44418,19582,3,47.25 USD, 6-JAN-2025 15:10:16,NULL,47.25,47.25,141.75,2025-01-06 15:10:16.000,2025-01-06,2025,1,6,44418,[],()
64908,47135,19336,5,$49.00,09:46;06/04/25,,49.0,49.0,245.0,2025-06-04 09:46:00.000,2025-06-04,2025,6,4,47135,[],()
69771,45123,19495,1,31.25€,"09:26:30 am,08/28/24","697 Lien Track, Sipeshaven, OR 60574-6267",37.5,37.5,37.5,2024-08-28 09:26:30.000,2024-08-28,2024,8,28,45123,[],()
68660,46240,19354,3,EUR41.75,00:18:24 2025-02-12,,50.1,50.1,150.3,2025-02-12 00:18:24.000,2025-02-12,2025,2,12,46240,[],()
72758,44945,18840,3,$ 48.5,2025-04-12T05:49:10,,48.5,48.5,145.5,2025-04-12 05:49:10.000,2025-04-12,2025,4,12,44945,[],()
68655,46316,19449,1,47.5 EUR,"07/12/24,10:09:51",,57.0,57.0,57.0,2024-07-12 10:09:51.000,2024-07-12,2024,7,12,46797,[],()
73963,44395,19211,1,48.75 $,2025-02-05;02:03:59 AM,"855 Monte Stream, South Ilene, UT 39916-4716",48.75,48.75,48.75,2025-02-05 02:03:59.000,2025-02-05,2025,2,5,45009,[],()
68424,44676,19504,2,EUR 61.75,2024-08-23T09:13:56.648,,74.1,74.1,148.2,2024-08-23 09:13:56.648,2024-08-23,2024,8,23,44676,[],()
63415,47174,18956,1,54.5 EUR,02:10:43  3-Mar-2024,"39676 Moen Station, Boyleshire, DE 28150",65.39999999999999,65.39999999999999,65.4,2024-03-03 02:10:43.000,2024-03-03,2024,3,3,47174,[],()
70366,44340,19052,1,66.75€,2024-12-28T14:44:10,,80.1,80.1,80.1,2024-12-28 14:44:10.000,2024-12-28,2024,12,28,44340,[],()
63651,45404,19448,3,$58.00,2024-07-31T11:29:04.622,,58.0,58.0,174.0,2024-07-31 11:29:04.622,2024-07-31,2024,7,31,45404,[],()
73626,44668,19564,1,$53¢75,2024-09-07T20:16:19.131,"880 Cormier Trafficway, Lake Abbyton, NM 64905",5375.0,5375.0,5375.0,2024-09-07 20:16:19.131,2024-09-07,2024,9,7,44668,[],()
64904,46454,19397,4,USD27.00,30.11.2024 17:54:54,,27.0,27.0,108.0,2024-11-30 17:54:54.000,2024-11-30,2024,11,30,45702,[],()
65669,46587,19188,2,43.99 EUR,"21:56, 12/26/24","406 Schoen Mill, Lake Kathrynborough, KS 90295",52.788000000000004,52.788000000000004,105.58,2024-12-26 21:56:00.000,2024-12-26,2024,12,26,46587,[],()
66899,46626,19273,1,$44,"01/17/25,07:07:38 A.M.",NULL,44.0,44.0,44.0,2025-01-17 07:07:38.000,2025-01-17,2025,1,17,46626,[],()
68363,45293,18916,1,USD53.5,23:22;09/28/24,"6246 Wisozk Park, West Reita, AL 58927",53.5,53.5,53.5,2024-09-28 23:22:00.000,2024-09-28,2024,9,28,45293,[],()
68186,45862,18845,2,58.75 €,2024-08-08T03:28:35.822,NULL,70.5,70.5,141.0,2024-08-08 03:28:35.822,2024-08-08,2024,8,8,45862,[],()
68549,46474,19305,1,$55.75,08:27:29 am;11/20/24,"Suite 794 46675 Dalton Well, Sammieville, NC 01680-2830",55.75,55.75,55.75,2024-11-20 08:27:29.000,2024-11-20,2024,11,20,46474,[],()
73068,44927,18974,1,40.00 EUR,"09:29, 12/24/24",,48.0,48.0,48.0,2024-12-24 09:29:00.000,2024-12-24,2024,12,24,44927,[],()
67009,46834,19058,2,EUR18.,"05/20/25, 03:24",NULL,21.599999999999998,21.599999999999998,43.2,2025-05-20 03:24:00.000,2025-05-20,2025,5,20,46834,[],()
63370,46822,19095,1,64.0€,"02/08/24,05:33:26",,76.8,76.8,76.8,2024-02-08 05:33:26.000,2024-02-08,2024,2,8,46822,[],()
68635,47594,19359,2,48.0USD,01/07/25;10:42,"Apt. 655 417 Schiller Road, Lake Nicol, UT 46098-3131",48.0,48.0,96.0,2025-01-07 10:42:00.000,2025-01-07,2025,1,7,47594,[],()
70733,45760,19107,1,74.5€,"02/16/25, 00:51:04",NULL,89.39999999999999,89.39999999999999,89.4,2025-02-16 00:51:04.000,2025-02-16,2025,2,16,45760,[],()
65558,46465,18967,1,70.0 USD,"03/19/24, 02:13",NULL,70.0,70.0,70.0,2024-03-19 02:13:00.000,2024-03-19,2024,3,19,46465,[],()
66668,45300,19525,1,$61¢75,2024-08-29 18:39,,6175.0,6175.0,6175.0,2024-08-29 18:39:00.000,2024-08-29,2024,8,29,45300,[],()
69119,45030,19025,2,35. €,"12-Feb-2025, 21:25",NULL,42.0,42.0,84.0,2025-02-12 21:25:00.000,2025-02-12,2025,2,12,45030,[],()
66282,46804,19333,1,29 €,"15:37:32, 21-October-2024",,34.8,34.8,34.8,2024-10-21 15:37:32.000,2024-10-21,2024,10,21,46804,[],()
69244,44418,19561,1,26.99EUR,"12:54:52 PM, 7-September-2024",,32.388,32.388,32.39,2024-09-07 12:54:52.000,2024-09-07,2024,9,7,44418,[],()
68351,46405,19215,1,20.00USD,25-October-2024;12:48:59 am,"7422 Reynolds Isle, West Vinnie, VT 69097-2973",20.0,20.0,20.0,2024-10-25 00:48:59.000,2024-10-25,2024,10,25,46405,[],()
64902,46213,18937,1,$66.,"22:19, 08/16/25",,66.0,66.0,66.0,2025-08-16 22:19:00.000,2025-08-16,2025,8,16,46213,[],()
67472,46970,18840,1,€ 49.75,06:59:37 P.M. 22-JAN-2025,NULL,59.699999999999996,59.699999999999996,59.7,2025-01-22 18:59:37.000,2025-01-22,2025,1,22,46970,[],()
63170,45885,18857,1,73.25$,2024-07-10;05:20:31 AM,,73.25,73.25,73.25,2024-07-10 05:20:31.000,2024-07-10,2024,7,10,47052,[],()
63487,47045,19479,1,57.25 €,"04/25/24,05:32:23",,68.7,68.7,68.7,2024-04-25 05:32:23.000,2024-04-25,2024,4,25,47045,[],()
66034,47298,19374,5,USD 21.50,07:03:15 am 06/17/25,NULL,21.5,21.5,107.5,2025-06-17 07:03:15.000,2025-06-17,2025,6,17,47298,[],()
68056,47525,18981,1,68.25 USD,2024-10-02 14:06:06,NULL,68.25,68.25,68.25,2024-10-02 14:06:06.000,2024-10-02,2024,10,2,47525,[],()
72367,46912,19417,1,22.75USD,"01:40,05/29/25",,22.75,22.75,22.75,2025-05-29 01:40:00.000,2025-05-29,2025,5,29,46912,[],()
62893,46982,19533,1,49.00USD,"11/16/24,08:44:52 P.M.",,49.0,49.0,49.0,2024-11-16 20:44:52.000,2024-11-16,2024,11,16,46982,[],()
66378,45149,19169,1,$ 70.5,22-JUL-2024 20:24,,70.5,70.5,70.5,2024-07-22 20:24:00.000,2024-07-22,2024,7,22,45149,[],()
72987,46976,19439,1,USD 71.75,"2025-05-27, 09:45:01","Suite 663 9525 Wolff Station, Lake Margarito, NE 15324-0895",71.75,71.75,71.75,2025-05-27 09:45:01.000,2025-05-27,2025,5,27,46976,[],()
72772,45385,19017,1,EUR 53.50,2024-06-28T15:49:10,"507 Sidney Mission, East Lula, AR 90860",64.2,64.2,64.2,2024-06-28 15:49:10.000,2024-06-28,2024,6,28,45385,[],()
68418,44665,19220,1,$61.0," 2-November-2024, 03:03:07 pm",,61.0,61.0,61.0,2024-11-02 15:03:07.000,2024-11-02,2024,11,2,44665,[],()
68299,45246,19443,1,24.50 EUR,2025-01-29T04:00:58,,29.4,29.4,29.4,2025-01-29 04:00:58.000,2025-01-29,2025,1,29,45246,[],()
72209,47551,18926,1,37.99 $,2024-08-03T20:44:05.091,NULL,37.99,37.99,37.99,2024-08-03 20:44:05.091,2024-08-03,2024,8,3,47551,[],()
65297,45027,19012,2,45.5$,01/28/25 06:59,,45.5,45.5,91.0,2025-01-28 06:59:00.000,2025-01-28,2025,1,28,45027,[],()
63473,46202,19467,1,USD71.,10:44:09;2024-04-12,"Apt. 504 15137 Denver Bridge, Port Monroe, WA 84929",71.0,71.0,71.0,2024-04-12 10:44:09.000,2024-04-12,2024,4,12,46202,[],()
66183,46809,19099,1,$ 56.75,"2024-12-20,02:50",,56.75,56.75,56.75,2024-12-20 02:50:00.000,2024-12-20,2024,12,20,46809,[],()
65412,47189,19358,3,€52¢50,"21:06,2024-12-06",,6300.0,6300.0,18900.0,2024-12-06 21:06:00.000,2024-12-06,2024,12,6,47189,[],()
68837,44603,18906,2,42.99$,"2024-11-25,03:08:11 A.M.",,42.99,42.99,85.98,2024-11-25 03:08:11.000,2024-11-25,2024,11,25,44603,[],()
70402,46790,19033,1,32.EUR,"2024-07-24, 23:54","1926 Rachelle Alley, South Dorine, NH 44890-6255",38.4,38.4,38.4,2024-07-24 23:54:00.000,2024-07-24,2024,7,24,46790,[],()
68930,45691,19253,1,$ 38.,2024-10-27T23:16:28.602,,38.0,38.0,38.0,2024-10-27 23:16:28.602,2024-10-27,2024,10,27,45691,[],()
71869,44674,19307,1,$26.99,02:06:55 A.M. 03/19/25,"Suite 721 76916 Myles Course, Lake Inell, HI 54112-2593",26.99,26.99,26.99,2025-03-19 02:06:55.000,2025-03-19,2025,3,19,44674,[],()
71350,47260,19451,1,USD 54.99,19-Jul-2024;06:36:11,NULL,54.99,54.99,54.99,2024-07-19 06:36:11.000,2024-07-19,2024,7,19,47260,[],()
65799,47157,19276,1,EUR 17.25,21:40:21;2024-11-16,"482 Ruben Isle, North Julianhaven, WV 95003",20.7,20.7,20.7,2024-11-16 21:40:21.000,2024-11-16,2024,11,16,47157,[],()
69109,47015,19059,1,€52¢50,04:15:29 A.M.; 7-Dec-2024,"Apt. 421 32379 Bauch Branch, North Elliottland, IA 60167",6300.0,6300.0,6300.0,2024-12-07 04:15:29.000,2024-12-07,2024,12,7,47015,[],()
72931,45089,19372,2,$59.0,"2024-07-15, 04:39",NULL,59.0,59.0,118.0,2024-07-15 04:39:00.000,2024-07-15,2024,7,15,45089,[],()
72838,44610,18994,2,38.75 USD,00:50:11 2024-10-21,,38.75,38.75,77.5,2024-10-21 00:50:11.000,2024-10-21,2024,10,21,44610,[],()
69514,46123,19105,1,EUR33.25,"04:00:12 am, 2025-01-01","86955 Sharda Oval, New Dannyton, ME 18995-9403",39.9,39.9,39.9,2025-01-01 04:00:12.000,2025-01-01,2025,1,1,46123,[],()
66295,46000,19494,1,32.99$,12:09:08 AM;07/12/25,,32.99,32.99,32.99,2025-07-12 00:09:08.000,2025-07-12,2025,7,12,46000,[],()
73240,45415,19236,1,USD69.0,"06:45:32 AM,  1-July-2025","33116 Schamberger Ridge, Reingerton, WY 45449",69.0,69.0,69.0,2025-07-01 06:45:32.000,2025-07-01,2025,7,1,45415,[],()
73425,47578,19311,1,64.75$,11/01/24;05:31:01 pm,"Apt. 353 950 Schoen Mountain, South Davinachester, NE 21867-9337",64.75,64.75,64.75,2024-11-01 17:31:01.000,2024-11-01,2024,11,1,47578,[],()
69184,46169,19097,1,63. $,"09/16/24, 00:21:55",,63.0,63.0,63.0,2024-09-16 00:21:55.000,2024-09-16,2024,9,16,46169,[],()
63401,47032,18972,1,$29.0,2025-08-18T18:19:48.743,NULL,29.0,29.0,29.0,2025-08-18 18:19:48.743,2025-08-18,2025,8,18,47032,[],()
68504,45344,19356,1,€ 54.00,07:45:30 PM; 7-JUL-2024,"Apt. 726 922 Becker Shore, New Dirk, ME 76953-7711",64.8,64.8,64.8,2024-07-07 19:45:30.000,2024-07-07,2024,7,7,45344,[],()
65353,46525,19402,2,26.99 $,"21:20,16-December-2024","Suite 734 28378 Leuschke Wall, Wittingfort, IL 71594",26.99,26.99,53.98,2024-12-16 21:20:00.000,2024-12-16,2024,12,16,46525,[],()
72749,46143,19160,1,USD72.00,03:16:59 PM;02/18/25,NULL,72.0,72.0,72.0,2025-02-18 15:16:59.000,2025-02-18,2025,2,18,46143,[],()
63272,47312,19573,1,36.0$,2024-11-18T06:32:05.315,,36.0,36.0,36.0,2024-11-18 06:32:05.315,2024-11-18,2024,11,18,47312,[],()
65726,44771,19330,3,63.50 USD,"07/23/24, 05:17","24442 Kunze Key, Kihnberg, OR 34857",63.5,63.5,190.5,2024-07-23 05:17:00.000,2024-07-23,2024,7,23,44771,[],()
72127,44556,19392,1,49 €,"05/30/25, 03:20",,58.8,58.8,58.8,2025-05-30 03:20:00.000,2025-05-30,2025,5,30,44677,[],()
65153,45651,19360,1,62.25$,2025-06-08T09:59:42.338,NULL,62.25,62.25,62.25,2025-06-08 09:59:42.338,2025-06-08,2025,6,8,45651,[],()
71074,47136,19263,1,27.25€,12:42;2025-03-09,NULL,32.699999999999996,32.699999999999996,32.7,2025-03-09 12:42:00.000,2025-03-09,2025,3,9,47136,[],()
63579,46746,19345,1,$ 62," 3-Jan-2025,10:42",NULL,62.0,62.0,62.0,2025-01-03 10:42:00.000,2025-01-03,2025,1,3,46746,[],()
69872,46684,18976,1,25.50 EUR,"26-JAN-2025,13:06:15",,30.599999999999998,30.599999999999998,30.6,2025-01-26 13:06:15.000,2025-01-26,2025,1,26,46684,[],()
69168,47234,19031,1,17.00 €,"14-AUG-2024, 00:57:08",,20.4,20.4,20.4,2024-08-14 00:57:08.000,2024-08-14,2024,8,14,47234,[],()
72824,44567,19169,1,70$, 9-Sep-2024;02:15:13,"Apt. 705 147 Ralph Viaduct, Gorczanyton, WV 17753",70.0,70.0,70.0,2024-09-09 02:15:13.000,2024-09-09,2024,9,9,44567,[],()
68346,45392,19430,1,EUR 53.5,23-Mar-2025 11:25:23 AM,NULL,64.2,64.2,64.2,2025-03-23 11:25:23.000,2025-03-23,2025,3,23,45392,[],()
66577,46935,19433,3,67.99€,"12:04:11, 10/03/24","5324 Pacocha Hill, Cheriseton, IN 14427-1229",81.588,81.588,244.76,2024-10-03 12:04:11.000,2024-10-03,2024,10,3,46935,[],()
69363,45384,19562,1,$53.5,15:53; 6-Nov-2024,,53.5,53.5,53.5,2024-11-06 15:53:00.000,2024-11-06,2024,11,6,45384,[],()
72485,44469,19309,1,USD 68.00,2024-10-04T02:06:46,,68.0,68.0,68.0,2024-10-04 02:06:46.000,2024-10-04,2024,10,4,44469,[],()
69250,46489,19207,1,54.0$,"12:39:01, 08/21/24",NULL,54.0,54.0,54.0,2024-08-21 12:39:01.000,2024-08-21,2024,8,21,46489,[],()
63605,47421,19412,4,30.50$,"04/11/24, 16:46:16",,30.5,30.5,122.0,2024-04-11 16:46:16.000,2024-04-11,2024,4,11,47421,[],()
71578,47517,19229,1,18.99 €,"06:32:03 PM, 05/19/24","Apt. 588 352 Gleichner Crescent, South Lupefurt, VT 24808",22.787999999999997,22.787999999999997,22.79,2024-05-19 18:32:03.000,2024-05-19,2024,5,19,47517,[],()
73293,46774,19218,1,69.50 USD," 2-Oct-2024, 12:00:34",NULL,69.5,69.5,69.5,2024-10-02 12:00:34.000,2024-10-02,2024,10,2,46774,[],()
68214,45647,19365,1,EUR65.25,09/05/24 05:44:50,"Suite 547 7112 Nita Villages, Lindgrenside, WI 74504",78.3,78.3,78.3,2024-09-05 05:44:50.000,2024-09-05,2024,9,5,45647,[],()
71327,45036,19217,1,USD 32.50,2025-01-08T09:40:06,"Apt. 203 119 Kertzmann Via, Stromanton, AK 32810-6470",32.5,32.5,32.5,2025-01-08 09:40:06.000,2025-01-08,2025,1,8,45036,[],()
62995,47386,19583,3,$56¢99,2024-10-28 01:08,,5699.0,5699.0,17097.0,2024-10-28 01:08:00.000,2024-10-28,2024,10,28,47386,[],()
67974,45669,19356,1,USD 50, 7-Oct-2024;19:16,NULL,50.0,50.0,50.0,2024-10-07 19:16:00.000,2024-10-07,2024,10,7,45669,[],()
64867,46413,19541,2,30.50 USD,05:05:50 A.M.;2025-01-06,"Suite 634 3828 Hintz Square, Port Dennisland, MS 33380-9653",30.5,30.5,61.0,2025-01-06 05:05:50.000,2025-01-06,2025,1,6,46413,[],()
68756,47247,19527,2,$ 73.00,12:36:47 08/31/24,,73.0,73.0,146.0,2024-08-31 12:36:47.000,2024-08-31,2024,8,31,47015,[],()
64237,45620,19139,1,EUR 56.0,2024-11-05T14:26:04.950,"1910 Pollich Skyway, Charleyberg, MS 29517-1132",67.2,67.2,67.2,2024-11-05 14:26:04.950,2024-11-05,2024,11,5,45620,[],()
67047,45685,19062,1,18.25EUR,23:43:29;2025-05-21,"916 Hipolito Camp, West Scotthaven, WI 65023",21.9,21.9,21.9,2025-05-21 23:43:29.000,2025-05-21,2025,5,21,45685,[],()
63534,45705,18984,1,€19.25,2025-05-06T21:52:45.085,"Apt. 514 32569 Howe Islands, South Eliasburgh, NH 31192",23.099999999999998,23.099999999999998,23.1,2025-05-06 21:52:45.085,2025-05-06,2025,5,6,45905,[],()
64518,46229,19490,1,$ 50.00,11:48:40 A.M. 11/09/24,NULL,50.0,50.0,50.0,2024-11-09 11:48:40.000,2024-11-09,2024,11,9,46229,[],()
63189,45964,19473,1,23.00EUR,02/08/25;08:46:36 PM,"5919 Christiansen Skyway, Burlport, OH 77054-2675",27.599999999999998,27.599999999999998,27.6,2025-02-08 20:46:36.000,2025-02-08,2025,2,8,45964,[],()
69487,44496,19411,1,44.25EUR,29-Jan-2025;06:57:40 am,"14371 Kozey Cove, North Beata, MT 93735",53.1,53.1,53.1,2025-01-29 06:57:40.000,2025-01-29,2025,1,29,44496,[],()
67996,47280,18922,1,18.0 USD,"16:15:15,19-September-2024",,18.0,18.0,18.0,2024-09-19 16:15:15.000,2024-09-19,2024,9,19,47494,[],()
73303,45345,19176,1,USD22.0,"14:46:41,12-Jan-2025",,22.0,22.0,22.0,2025-01-12 14:46:41.000,2025-01-12,2025,1,12,45345,[],()
69120,47189,19127,1,€62¢25,18:15:01 12/01/24,,7470.0,7470.0,7470.0,2024-12-01 18:15:01.000,2024-12-01,2024,12,1,47189,[],()
72166,47274,19011,1,54.99USD,"07:18:45,  4-APR-2024",NULL,54.99,54.99,54.99,2024-04-04 07:18:45.000,2024-04-04,2024,4,4,47274,[],()
63484,46090,19163,2,13.5USD,"11:28:15 PM,09/14/24",NULL,13.5,13.5,27.0,2024-09-14 23:28:15.000,2024-09-14,2024,9,14,46090,[],()
65711,47022,19520,2,USD29.50,2025-02-10T17:10:06,"68076 Marty Fork, Quintonfurt, NM 31831-9435",29.5,29.5,59.0,2025-02-10 17:10:06.000,2025-02-10,2025,2,10,47022,[],()
70603,44931,19250,1,$30.50,"09/21/24,03:01:19 pm",NULL,30.5,30.5,30.5,2024-09-21 15:01:19.000,2024-09-21,2024,9,21,44931,[],()
71252,46252,19010,1,66€25¢,2024-06-27T21:12:47.990,NULL,7950.0,7950.0,7950.0,2024-06-27 21:12:47.990,2024-06-27,2024,6,27,45989,[],()
72384,46790,19309,3,USD 66,"2024-10-02,16:23","1926 Rachelle Alley, South Dorine, NH 44890-6255",66.0,66.0,198.0,2024-10-02 16:23:00.000,2024-10-02,2024,10,2,46790,[],()
65333,45470,19559,1,68.75$,04/16/25 09:05:06,,68.75,68.75,68.75,2025-04-16 09:05:06.000,2025-04-16,2025,4,16,45470,[],()
63746,45594,19529,1,€18¢99,2025-02-17T04:21:49,,2278.7999999999997,2278.7999999999997,2278.8,2025-02-17 04:21:49.000,2025-02-17,2025,2,17,45594,[],()
72622,47121,19301,4,$68¢50,"03:51,15-OCT-2024",NULL,6850.0,6850.0,27400.0,2024-10-15 03:51:00.000,2024-10-15,2024,10,15,47121,[],()
73204,46957,18867,1,$ 56.75,01/19/25;22:37,"2112 Luann Port, Jacelynberg, NJ 27829-3725",56.75,56.75,56.75,2025-01-19 22:37:00.000,2025-01-19,2025,1,19,46957,[],()
68376,46280,19561,4,23.75 USD, 8-AUG-2024 13:01:21,,23.75,23.75,95.0,2024-08-08 13:01:21.000,2024-08-08,2024,8,8,46280,[],()
63503,45624,19229,3,$ 19.0,29.01.2025 17:10:10,NULL,19.0,19.0,57.0,2025-01-29 17:10:10.000,2025-01-29,2025,1,29,45624,[],()
64192,47552,19020,1,$20,2025-03-29;15:01:38,,20.0,20.0,20.0,2025-03-29 15:01:38.000,2025-03-29,2025,3,29,47552,[],()
63655,47452,19201,4,€39¢99,15:39  8-MAR-2025,"Apt. 354 29008 Roberto Lakes, Novellaland, NV 96667",4798.8,4798.8,19195.2,2025-03-08 15:39:00.000,2025-03-08,2025,3,8,46216,[],()
73834,45034,19355,1,USD 40.75,01:18:34 P.M.;2025-02-07,"Suite 169 865 Moira Row, New Ezekielshire, MT 63914",40.75,40.75,40.75,2025-02-07 13:18:34.000,2025-02-07,2025,2,7,45034,[],()
73370,47088,19419,1,USD49.00,2025-09-14T10:37:47,"7469 Ortiz Fork, South Maynard, CT 36117",49.0,49.0,49.0,2025-09-14 10:37:47.000,2025-09-14,2025,9,14,47088,[],()
73084,46827,18951,2,$ 66.00,12:14:04 04/15/25,,66.0,66.0,132.0,2025-04-15 12:14:04.000,2025-04-15,2025,4,15,46827,[],()
64844,46903,18856,1,$48¢75,"20:35,28-FEB-2025",,4875.0,4875.0,4875.0,2025-02-28 20:35:00.000,2025-02-28,2025,2,28,46903,[],()
70498,44780,19095,1,59€75¢,03:17:28 am;08/01/24,,7170.0,7170.0,7170.0,2024-08-01 03:17:28.000,2024-08-01,2024,8,1,44780,[],()
63594,44417,19535,1,$ 65.25,"2024-02-27,05:38:28 pm",,65.25,65.25,65.25,2024-02-27 17:38:28.000,2024-02-27,2024,2,27,44417,[],()
64718,46505,19021,1,35.0 $,2025-04-04T21:53:42.494,,35.0,35.0,35.0,2025-04-04 21:53:42.494,2025-04-04,2025,4,4,46505,[],()
69561,46388,19016,1,45.75€,2024-03-14T10:36:31.661,,54.9,54.9,54.9,2024-03-14 10:36:31.661,2024-03-14,2024,3,14,46388,[],()
64911,45288,19114,1,43.0 €,"02:02:55, 12/03/24","881 Maud Well, Renaburgh, CA 20556-8196",51.6,51.6,51.6,2024-12-03 02:02:55.000,2024-12-03,2024,12,3,45288,[],()
64338,45593,19055,2,€19.5,04/19/25;17:50,,23.4,23.4,46.8,2025-04-19 17:50:00.000,2025-04-19,2025,4,19,45593,[],()
67363,46104,19352,1,USD34.75,"18-January-2025, 10:03:40 A.M.",,34.75,34.75,34.75,2025-01-18 10:03:40.000,2025-01-18,2025,1,18,46104,[],()
64829,44997,19396,1,45.50EUR,15:44:09;07/11/24,"41395 Powlowski Villages, East Joaquina, AZ 23988",54.6,54.6,54.6,2024-07-11 15:44:09.000,2024-07-11,2024,7,11,44997,[],()
71848,46873,19456,2,34.50 $,07:08:30 P.M. 25-OCT-2024,,34.5,34.5,69.0,2024-10-25 19:08:30.000,2024-10-25,2024,10,25,46873,[],()
65088,45680,19293,1,$30¢00,"08/06/25, 10:56:50",,3000.0,3000.0,3000.0,2025-08-06 10:56:50.000,2025-08-06,2025,8,6,45680,[],()
73611,45443,18959,1,51.5 EUR, 8-Feb-2024;02:21:06 pm,NULL,61.8,61.8,61.8,2024-02-08 14:21:06.000,2024-02-08,2024,2,8,45443,[],()
71321,47501,19250,1,$ 27,"12:56:03 AM,12/08/24",,27.0,27.0,27.0,2024-12-08 00:56:03.000,2024-12-08,2024,12,8,47501,[],()
66658,45275,19274,3,$ 73.0," 2-November-2024, 21:22",,73.0,73.0,219.0,2024-11-02 21:22:00.000,2024-11-02,2024,11,2,45275,[],()
72241,47414,18943,2,71.25 €,2025-02-10T03:39:55.487,,85.5,85.5,171.0,2025-02-10 03:39:55.487,2025-02-10,2025,2,10,47414,[],()
71200,45303,19456,1,32.5 EUR,"12:01:11 pm,05/24/25",,39.0,39.0,39.0,2025-05-24 12:01:11.000,2025-05-24,2025,5,24,45303,[],()
70812,45115,19465,1,46.00EUR,2024-08-07T00:37:50.377,,55.199999999999996,55.199999999999996,55.2,2024-08-07 00:37:50.377,2024-08-07,2024,8,7,45115,[],()
72085,46471,19330,1,58.5 $,04:16:32 A.M.;25-Sep-2024,,58.5,58.5,58.5,2024-09-25 04:16:32.000,2024-09-25,2024,9,25,46471,[],()
67024,44830,19150,1,45.$,"12:41:09, 29-August-2024","62427 Yolonda Avenue, New Normand, MO 49902-1345",45.0,45.0,45.0,2024-08-29 12:41:09.000,2024-08-29,2024,8,29,44830,[],()
71827,46121,19287,1,34.75$,08/17/24 11:56:15 PM,"Suite 441 2318 Lianne Mall, West Baoland, AL 06257",34.75,34.75,34.75,2024-08-17 23:56:15.000,2024-08-17,2024,8,17,46121,[],()
69687,45021,19032,1,€69.5, 2-Dec-2024 02:56:09,"Apt. 583 98429 Romona Locks, Carmeloton, ME 35184",83.39999999999999,83.39999999999999,83.4,2024-12-02 02:56:09.000,2024-12-02,2024,12,2,45021,[],()
67155,46515,19437,1,€ 36.5,13:20 2024-10-24,"6737 Eden Cove, Murazikburgh, UT 62610-9281",43.8,43.8,43.8,2024-10-24 13:20:00.000,2024-10-24,2024,10,24,46515,[],()
71345,45960,19542,2,€ 58.25,"04:18,31-DEC-2024",NULL,69.89999999999999,69.89999999999999,139.8,2024-12-31 04:18:00.000,2024-12-31,2024,12,31,45960,[],()
68174,45074,19359,1,46.99 USD,2025-03-13T09:56:21.407,,46.99,46.99,46.99,2025-03-13 09:56:21.407,2025-03-13,2025,3,13,45074,[],()
70925,46123,19121,2,EUR74.75,08:17:48; 4-Jun-2024,"86955 Sharda Oval, New Dannyton, ME 18995-9403",89.7,89.7,179.4,2024-06-04 08:17:48.000,2024-06-04,2024,6,4,46123,[],()
73876,46648,19412,1,€27.5,"07/04/24,22:28:12","63753 Lurlene Land, Franeckibury, NJ 86647-7842",33.0,33.0,33.0,2024-07-04 22:28:12.000,2024-07-04,2024,7,4,46648,[],()
70969,46268,19011,1,EUR56.0,2024-12-30;06:13:59 A.M.,"Suite 277 6065 Jeremiah Turnpike, North Mathew, ID 92997-3282",67.2,67.2,67.2,2024-12-30 06:13:59.000,2024-12-30,2024,12,30,46268,[],()
67462,46341,19021,2,34.99 €,12/26/24;03:55:22,,41.988,41.988,83.98,2024-12-26 03:55:22.000,2024-12-26,2024,12,26,46341,[],()
70023,46551,19115,1,53.5 USD,09:10:38 P.M. 25-March-2024,NULL,53.5,53.5,53.5,2024-03-25 21:10:38.000,2024-03-25,2024,3,25,46551,[],()
70761,44543,19037,1,$ 30.75,2024-07-12T06:48:00,,30.75,30.75,30.75,2024-07-12 06:48:00.000,2024-07-12,2024,7,12,44543,[],()
66674,45692,19435,1,€69.75,03:57:04 12/20/24,"Suite 649 409 Leandro Mountains, West Bobby, OK 78671-4430",83.7,83.7,83.7,2024-12-20 03:57:04.000,2024-12-20,2024,12,20,45692,[],()
65122,45534,19182,2,EUR55.25,2024-08-14;06:43,NULL,66.3,66.3,132.6,2024-08-14 06:43:00.000,2024-08-14,2024,8,14,45534,[],()
73493,46059,19073,2,$ 76,"04/17/25,12:00:37 am",NULL,76.0,76.0,152.0,2025-04-17 00:00:37.000,2025-04-17,2025,4,17,46059,[],()
65975,46729,19072,3,$63.00, 2-Jun-2025 12:28,,63.0,63.0,189.0,2025-06-02 12:28:00.000,2025-06-02,2025,6,2,46729,[],()
68044,45052,19451,2,54.75$,"12/01/24,10:18:44",NULL,54.75,54.75,109.5,2024-12-01 10:18:44.000,2024-12-01,2024,12,1,45052,[],()
63569,44365,19018,2,USD 14.,"10:50:03 am,01/04/25",NULL,14.0,14.0,28.0,2025-01-04 10:50:03.000,2025-01-04,2025,1,4,44365,[],()
73289,45979,19359,1,46.75$,2025-02-23;15:11,"Apt. 893 161 Romaguera Vista, Alfredomouth, MI 36698",46.75,46.75,46.75,2025-02-23 15:11:00.000,2025-02-23,2025,2,23,45979,[],()
68596,46909,18950,3,USD 48.0,2024-12-29T12:55:21.016,"5621 Soila Knolls, East Zackmouth, MO 82794-3011",48.0,48.0,144.0,2024-12-29 12:55:21.016,2024-12-29,2024,12,29,46909,[],()
68434,47335,18850,3,33.99 USD,"2024-08-30,03:02:16 A.M.",,33.99,33.99,101.97,2024-08-30 03:02:16.000,2024-08-30,2024,8,30,47335,[],()
73637,44367,19524,2,49.50$, 5.08.2024  5:20:20,NULL,49.5,49.5,99.0,2024-05-08 05:20:20.000,2024-05-08,2024,5,8,44367,[],()
70741,45638,18944,5,13.0USD,"08:38, 2024-11-04",,13.0,13.0,65.0,2024-11-04 08:38:00.000,2024-11-04,2024,11,4,45638,[],()
73594,45261,19309,1,$67.25,"14:53,16-FEB-2025","Suite 737 54143 Miyoko Hollow, South Youngshire, HI 02561",67.25,67.25,67.25,2025-02-16 14:53:00.000,2025-02-16,2025,2,16,45261,[],()
72494,44734,19072,1,USD 58.5,"12:39,30-DEC-2024",NULL,58.5,58.5,58.5,2024-12-30 12:39:00.000,2024-12-30,2024,12,30,44734,[],()
72628,44637,19243,4,€38¢99,19:40:43 02/16/25,,4678.8,4678.8,18715.2,2025-02-16 19:40:43.000,2025-02-16,2025,2,16,44637,[],()
69705,45249,19552,5,36.75 EUR,2025-01-24T21:56:15.627,,44.1,44.1,220.5,2025-01-24 21:56:15.627,2025-01-24,2025,1,24,45249,[],()
69789,45384,19028,1,60.99 USD,09:56:03 P.M.;12/22/24,"40080 Koss Cove, Marindastad, LA 55721-7761",60.99,60.99,60.99,2024-12-22 21:56:03.000,2024-12-22,2024,12,22,45384,[],()
72979,47192,19404,1,USD27.0,08/09/24;03:04:50 A.M.,"18688 Altenwerth Glens, Port Shakita, AK 01009-9695",27.0,27.0,27.0,2024-08-09 03:04:50.000,2024-08-09,2024,8,9,47192,[],()
72842,44594,19328,2,EUR26.50,25-Dec-2024 09:08:21 am,NULL,31.799999999999997,31.799999999999997,63.6,2024-12-25 09:08:21.000,2024-12-25,2024,12,25,44594,[],()
66743,46007,18982,1,60.75 €,"04:16:11 pm,08/25/24",,72.89999999999999,72.89999999999999,72.9,2024-08-25 16:16:11.000,2024-08-25,2024,8,25,46007,[],()
68869,44924,19513,1,EUR 24.0,05/30/25;20:51:36,"Apt. 168 52445 O'Reilly Green, Lake Lance, OK 82814-0503",28.799999999999997,28.799999999999997,28.8,2025-05-30 20:51:36.000,2025-05-30,2025,5,30,44924,[],()
70081,44338,19518,1,29.0€,2024-06-02T20:18:55,,34.8,34.8,34.8,2024-06-02 20:18:55.000,2024-06-02,2024,6,2,44338,[],()
71943,44479,19533,2,USD 48.75,12/23/24 12:18:47 P.M.,"Suite 645 290 Swaniawski Common, North Fatimah, DE 91912",48.75,48.75,97.5,2024-12-23 12:18:47.000,2024-12-23,2024,12,23,44479,[],()
71001,47319,18943,1,70.00$,2024-11-13;10:25:06 A.M.,,70.0,70.0,70.0,2024-11-13 10:25:06.000,2024-11-13,2024,11,13,45960,[],()
68417,45196,18967,1,73.5€,10/31/24;11:06:22 PM,NULL,88.2,88.2,88.2,2024-10-31 23:06:22.000,2024-10-31,2024,10,31,45196,[],()
73827,47400,19064,1,64.25€,08/17/24 04:59,"3563 Kindra Light, Gleichnerside, KY 19277",77.1,77.1,77.1,2024-08-17 04:59:00.000,2024-08-17,2024,8,17,47400,[],()
69708,47097,19396,1,$46¢75,08/23/24 05:45:20 A.M.,,4675.0,4675.0,4675.0,2024-08-23 05:45:20.000,2024-08-23,2024,8,23,47097,[],()
70575,46659,19039,3,42.75 USD,"18:22:21,23-NOV-2024",,42.75,42.75,128.25,2024-11-23 18:22:21.000,2024-11-23,2024,11,23,46659,[],()
70955,45178,19521,1,15.75 USD,2025-04-06T12:34:20,"84832 Del Plains, Sengerborough, WI 53162-2381",15.75,15.75,15.75,2025-04-06 12:34:20.000,2025-04-06,2025,4,6,45178,[],()
63849,44364,18989,3,EUR 42.0,"17:55:21, 10/15/24",,50.4,50.4,151.2,2024-10-15 17:55:21.000,2024-10-15,2024,10,15,44364,[],()
73277,46942,19413,2,USD37.5," 4-Jul-2025,12:23",,37.5,37.5,75.0,2025-07-04 12:23:00.000,2025-07-04,2025,7,4,46942,[],()
63508,45099,19533,4,$49¢75,05:46:36 03/14/25,,4975.0,4975.0,19900.0,2025-03-14 05:46:36.000,2025-03-14,2025,3,14,45099,[],()
66119,44622,19188,1,€ 41.25,"2024-11-14,04:14",,49.5,49.5,49.5,2024-11-14 04:14:00.000,2024-11-14,2024,11,14,44622,[],()
63186,45640,19201,1,€37¢25,"24-MAR-2025,05:18","Apt. 660 15981 Little Junction, Fayview, MA 28265",4470.0,4470.0,4470.0,2025-03-24 05:18:00.000,2025-03-24,2025,3,24,45640,[],()
65488,44826,19213,2,34.00 $,2024-08-27 09:56:53,"7733 Tyrone Shores, Brakusland, ID 91099-2022",34.0,34.0,68.0,2024-08-27 09:56:53.000,2024-08-27,2024,8,27,44826,[],()
63488,45877,19376,3,$46.0,"2024-11-09, 07:27:22 am",,46.0,46.0,138.0,2024-11-09 07:27:22.000,2024-11-09,2024,11,9,45877,[],()
65013,46830,19464,1,€43¢25,03/16/25 10:53,,5190.0,5190.0,5190.0,2025-03-16 10:53:00.000,2025-03-16,2025,3,16,46830,[],()
71238,45084,19188,3,€45¢25,14:32;2025-07-24,,5430.0,5430.0,16290.0,2025-07-24 14:32:00.000,2025-07-24,2025,7,24,45084,[],()
66426,45726,19069,1,€46.25,25-NOV-2024;06:44:18,,55.5,55.5,55.5,2024-11-25 06:44:18.000,2024-11-25,2024,11,25,45726,[],()
67891,45081,18863,3,23.5EUR,"13:51,08/05/24","Apt. 167 4735 Douglas Bridge, West Lourie, MO 84030-7523",28.2,28.2,84.6,2024-08-05 13:51:00.000,2024-08-05,2024,8,5,45081,[],()
69580,44660,18838,1,EUR54.25,09:10:42 pm;31-December-2024,"132 Mohr Key, Lake Angel, OK 72861",65.1,65.1,65.1,2024-12-31 21:10:42.000,2024-12-31,2024,12,31,44660,[],()
68979,46367,19522,2,USD 69.0,"25-July-2025,04:33:58 A.M.",,69.0,69.0,138.0,2025-07-25 04:33:58.000,2025-07-25,2025,7,25,46367,[],()
70748,45913,19056,1,24$00¢,01/11/25;16:19,,2400.0,2400.0,2400.0,2025-01-11 16:19:00.000,2025-01-11,2025,1,11,45913,[],()
67516,46480,19026,2,$ 19.0,23:00:34;12/11/24,,19.0,19.0,38.0,2024-12-11 23:00:34.000,2024-12-11,2024,12,11,46480,[],()
64229,45433,19017,1,53.99EUR,"10/09/24,21:46:51",,64.788,64.788,64.79,2024-10-09 21:46:51.000,2024-10-09,2024,10,9,45433,[],()
65953,47065,19571,5,14.75 $,2024-10-01T09:51:32.967,NULL,14.75,14.75,73.75,2024-10-01 09:51:32.967,2024-10-01,2024,10,1,47065,[],()
65618,46442,18900,1,67.99€,24-January-2025;02:40,NULL,81.588,81.588,81.59,2025-01-24 02:40:00.000,2025-01-24,2025,1,24,46442,[],()
69719,45160,19581,1,USD 28.99,06:19;01/17/25,NULL,28.99,28.99,28.99,2025-01-17 06:19:00.000,2025-01-17,2025,1,17,45160,[],()
67917,45272,19537,1,$54.,"00:51:09, 3-May-2025",NULL,54.0,54.0,54.0,2025-05-03 00:51:09.000,2025-05-03,2025,5,3,45272,[],()
72074,45055,19225,1,EUR 64.5,2025-01-01T19:33:42.233,"8614 Sporer Drives, Ricardoville, NH 46195-0457",77.39999999999999,77.39999999999999,77.4,2025-01-01 19:33:42.233,2025-01-01,2025,1,1,45055,[],()
73157,45791,18942,1,21.25USD,"15-MAR-2025,09:45",,21.25,21.25,21.25,2025-03-15 09:45:00.000,2025-03-15,2025,3,15,45791,[],()
73501,45811,18909,1,€ 25.00,"08:07:02 P.M.,  4-May-2025","Suite 112 290 Parker Stravenue, Russelfurt, MN 30548-1014",30.0,30.0,30.0,2025-05-04 20:07:02.000,2025-05-04,2025,5,4,45811,[],()
64031,47034,19154,1,74$75¢,2025-04-14;06:37:17 AM,,7475.0,7475.0,7475.0,2025-04-14 06:37:17.000,2025-04-14,2025,4,14,47034,[],()
67465,47459,19144,4,$46.5,19:14;04/18/24,,46.5,46.5,186.0,2024-04-18 19:14:00.000,2024-04-18,2024,4,18,47459,[],()
63271,46111,19193,1,18.0USD,"01:28:48 PM,10/03/24",,18.0,18.0,18.0,2024-10-03 13:28:48.000,2024-10-03,2024,10,3,47332,[],()
65361,45522,19146,1,65.0 €,11-JAN-2025 10:22:42,"Suite 682 7178 Gavin Trace, Cummingsville, VA 62547",78.0,78.0,78.0,2025-01-11 10:22:42.000,2025-01-11,2025,1,11,45522,[],()
63153,45631,19116,1,EUR16.50,"10/02/24, 13:28","62801 Ruben Villages, Ferdinandburgh, KS 65210",19.8,19.8,19.8,2024-10-02 13:28:00.000,2024-10-02,2024,10,2,45631,[],()
68727,44500,19099,1,USD 53.00,04/01/25 07:20:14 PM,,53.0,53.0,53.0,2025-04-01 19:20:14.000,2025-04-01,2025,4,1,44500,[],()
69717,47368,18841,2,€ 19.75,2024-10-22T06:01:57.950,,23.7,23.7,47.4,2024-10-22 06:01:57.950,2024-10-22,2024,10,22,47368,[],()
71031,44747,19178,1,36.50 EUR,"2025-04-23,15:56:15",,43.8,43.8,43.8,2025-04-23 15:56:15.000,2025-04-23,2025,4,23,44747,[],()
72553,46327,19215,1,USD 17.25,02/08/24 07:39:23,"9677 Ferry Falls, North Chungside, MN 73940",17.25,17.25,17.25,2024-02-08 07:39:23.000,2024-02-08,2024,2,8,46327,[],()
63834,45589,19028,1,62.0 USD,2025-03-25T09:01:41.109,,62.0,62.0,62.0,2025-03-25 09:01:41.109,2025-03-25,2025,3,25,45589,[],()
64499,45804,19563,5,67.75 EUR,21.01.2025 10:58:58,,81.3,81.3,406.5,2025-01-21 10:58:58.000,2025-01-21,2025,1,21,45804,[],()
65305,47173,18982,1,59.0 USD,"2025-01-29,13:32",NULL,59.0,59.0,59.0,2025-01-29 13:32:00.000,2025-01-29,2025,1,29,47173,[],()
69149,46694,18947,2,$ 71.50,23:12 11/16/24,,71.5,71.5,143.0,2024-11-16 23:12:00.000,2024-11-16,2024,11,16,46694,[],()
73849,45692,18879,1,66.00 USD,29-APR-2025;01:12:59 AM,,66.0,66.0,66.0,2025-04-29 01:12:59.000,2025-04-29,2025,4,29,45692,[],()
66022,45940,18976,1,€28.,"09/05/25,15:41",,33.6,33.6,33.6,2025-09-05 15:41:00.000,2025-09-05,2025,9,5,45940,[],()
73040,46716,19373,2,$ 49.0,"11:56:47, 11-SEP-2024",,49.0,49.0,98.0,2024-09-11 11:56:47.000,2024-09-11,2024,9,11,46716,[],()
64076,45896,19162,1,€ 64.75,"2024-12-13,11:37",,77.7,77.7,77.7,2024-12-13 11:37:00.000,2024-12-13,2024,12,13,45896,[],()
67425,47358,19041,2,$ 17,2025-03-13T04:20:40.644,,17.0,17.0,34.0,2025-03-13 04:20:40.644,2025-03-13,2025,3,13,47358,[],()
69246,46694,19494,1,31.50USD,"01:51:45 PM,12/01/24",,31.5,31.5,31.5,2024-12-01 13:51:45.000,2024-12-01,2024,12,1,46694,[],()
73006,47610,19291,5,61.5EUR,"11/24/24,05:49:31",NULL,73.8,73.8,369.0,2024-11-24 05:49:31.000,2024-11-24,2024,11,24,47610,[],()
64011,45057,19458,1,58 €,2025-03-30T15:47:50.733,,69.6,69.6,69.6,2025-03-30 15:47:50.733,2025-03-30,2025,3,30,45057,[],()
66458,44740,19037,2,30.50 $,"2025-01-22,10:32:19 AM",NULL,30.5,30.5,61.0,2025-01-22 10:32:19.000,2025-01-22,2025,1,22,45627,[],()
67232,47047,19504,1,$ 59.75,08/27/24;06:43:34 pm,,59.75,59.75,59.75,2024-08-27 18:43:34.000,2024-08-27,2024,8,27,47047,[],()
69695,46789,19530,1,USD 22.25,"09:25:03 P.M.,2025-02-05",NULL,22.25,22.25,22.25,2025-02-05 21:25:03.000,2025-02-05,2025,2,5,46789,[],()
66102,45572,19127,1,59$,01:48:11 pm 07/26/24,"73032 Octavio Hill, Penelopeside, CT 43365-4603",59.0,59.0,59.0,2024-07-26 13:48:11.000,2024-07-26,2024,7,26,45572,[],()
68621,47290,18992,1,€71¢75,2025-04-18T03:34:23.178,"13685 Wally Way, Russelmouth, TX 18986-7669",8610.0,8610.0,8610.0,2025-04-18 03:34:23.178,2025-04-18,2025,4,18,47290,[],()
65094,45498,19373,1,49.50 $,18:32;2024-10-14,,49.5,49.5,49.5,2024-10-14 18:32:00.000,2024-10-14,2024,10,14,45498,[],()
65272,46280,19570,1,$46.25,"10/10/24, 17:47:48",,46.25,46.25,46.25,2024-10-10 17:47:48.000,2024-10-10,2024,10,10,46280,[],()
66005,44421,19069,2,$41.00, 8-Nov-2024;06:42,"5086 Erdman Fall, West Elois, CO 77141-0250",41.0,41.0,82.0,2024-11-08 06:42:00.000,2024-11-08,2024,11,8,45627,[],()
64315,44526,18883,3,$ 22.,07:24:45;05/10/24,,22.0,22.0,66.0,2024-05-10 07:24:45.000,2024-05-10,2024,5,10,44526,[],()
72811,46648,18919,5,21.25USD,03:37:39 P.M. 2025-02-12,,21.25,21.25,106.25,2025-02-12 15:37:39.000,2025-02-12,2025,2,12,46648,[],()
66221,47452,18976,2,$28¢25,10/27/24;03:00,"Apt. 354 29008 Roberto Lakes, Novellaland, NV 96667",2825.0,2825.0,5650.0,2024-10-27 03:00:00.000,2024-10-27,2024,10,27,46216,[],()
68652,44390,18981,1,USD 70.0,"23:06,  4-July-2024",NULL,70.0,70.0,70.0,2024-07-04 23:06:00.000,2024-07-04,2024,7,4,44390,[],()
70996,46398,19466,1,22.25EUR,20.04.2024  8:01:01,NULL,26.7,26.7,26.7,2024-04-20 08:01:01.000,2024-04-20,2024,4,20,46398,[],()
67964,45623,19516,2,37.50$,"12/12/24,09:59:43",,37.5,37.5,75.0,2024-12-12 09:59:43.000,2024-12-12,2024,12,12,45623,[],()
64622,44848,19092,1,48.50 USD,03/06/25;02:03,"Suite 192 12975 Halvorson Points, South Fredrick, MD 79230-3027",48.5,48.5,48.5,2025-03-06 02:03:00.000,2025-03-06,2025,3,6,44848,[],()
70861,46616,19499,1,28.25 $,24-October-2024 23:04,"Apt. 811 40723 Demetrice Route, Heidenreichton, CA 47819-7679",28.25,28.25,28.25,2024-10-24 23:04:00.000,2024-10-24,2024,10,24,46616,[],()
66414,44671,18992,1,$70¢00,"08:17:46 am,  6-JUL-2025","47854 Schiller Court, Ernserchester, SD 13935-1819",7000.0,7000.0,7000.0,2025-07-06 08:17:46.000,2025-07-06,2025,7,6,44671,[],()
71067,46296,19315,1,USD58.50,Sun Jan 12 08:04:00 2025,NULL,58.5,58.5,58.5,2025-01-12 08:04:00.000,2025-01-12,2025,1,12,47391,[],()
63667,45076,19146,1,$ 67.99,"07:43:35, 12/05/24","4965 Homenick Ford, Durganmouth, NH 04710-8940",67.99,67.99,67.99,2024-12-05 07:43:35.000,2024-12-05,2024,12,5,45076,[],()
72228,47160,19366,1,$ 25.5,2024-08-10T08:27:42,,25.5,25.5,25.5,2024-08-10 08:27:42.000,2024-08-10,2024,8,10,47160,[],()
69451,44519,19311,1,69.5 $,"01/09/25, 23:15:18",NULL,69.5,69.5,69.5,2025-01-09 23:15:18.000,2025-01-09,2025,1,9,44519,[],()
72413,46667,19120,1,64.00$,08:30 01/11/25,"Apt. 279 98511 Cronin Center, Reynafort, NV 66956",64.0,64.0,64.0,2025-01-11 08:30:00.000,2025-01-11,2025,1,11,46667,[],()
63845,45651,18844,1,40.75€," 8-MAR-2025, 12:56:40 AM",,48.9,48.9,48.9,2025-03-08 00:56:40.000,2025-03-08,2025,3,8,45651,[],()
66897,45640,19108,1,$ 37.5,2024-06-07T19:19:07.885,"Apt. 660 15981 Little Junction, Fayview, MA 28265",37.5,37.5,37.5,2024-06-07 19:19:07.885,2024-06-07,2024,6,7,45640,[],()
63567,47317,19580,2,72.25 $,22:19:19 2025-01-24,NULL,72.25,72.25,144.5,2025-01-24 22:19:19.000,2025-01-24,2025,1,24,47317,[],()
73531,47271,19005,1,USD 38.,2024-06-29 10:57:55 AM,NULL,38.0,38.0,38.0,2024-06-29 10:57:55.000,2024-06-29,2024,6,29,47271,[],()
66192,47086,18990,1,49.00EUR,2024-05-10T17:38:19,"Apt. 909 942 Christiansen Flat, Gilbertview, IA 00046",58.8,58.8,58.8,2024-05-10 17:38:19.000,2024-05-10,2024,5,10,47086,[],()
69977,46276,19137,1,50.0€,06:58:00 PM;29-APR-2025,"381 Herman Groves, North Darenview, WA 40932-2806",60.0,60.0,60.0,2025-04-29 18:58:00.000,2025-04-29,2025,4,29,46276,[],()
66592,45932,18986,1,63.0USD,04:04 10-May-2024,"4588 Mohr Brook, Schroederton, ME 92095-0124",63.0,63.0,63.0,2024-05-10 04:04:00.000,2024-05-10,2024,5,10,45932,[],()
65902,47363,18924,1,28.99 USD,"2025-03-05, 10:28:35 AM",,28.99,28.99,28.99,2025-03-05 10:28:35.000,2025-03-05,2025,3,5,47363,[],()
65577,44424,19589,1,EUR 56.5,2024-12-15 20:09,,67.8,67.8,67.8,2024-12-15 20:09:00.000,2024-12-15,2024,12,15,44424,[],()
73394,46194,19485,1,$63.25,"04:29:00 P.M.,2024-10-11","Apt. 310 129 Stamm Drive, Hintzville, WV 49645",63.25,63.25,63.25,2024-10-11 16:29:00.000,2024-10-11,2024,10,11,46194,[],()
67603,44605,19072,1,62.75EUR,12:03:13 P.M.;12/12/24,,75.3,75.3,75.3,2024-12-12 12:03:13.000,2024-12-12,2024,12,12,44605,[],()
66310,44940,19569,1,USD 70.0,02:11 2024-09-18,,70.0,70.0,70.0,2024-09-18 02:11:00.000,2024-09-18,2024,9,18,44940,[],()
71424,44567,19396,1,46.75€,"13:18:54,11-Jan-2025",,56.1,56.1,56.1,2025-01-11 13:18:54.000,2025-01-11,2025,1,11,44567,[],()
65804,45444,18922,3,19.00 USD,2025-03-11T18:21:35.420,NULL,19.0,19.0,57.0,2025-03-11 18:21:35.420,2025-03-11,2025,3,11,45444,[],()
70860,46378,18874,1,$ 55.0,"2025-05-02,16:16",,55.0,55.0,55.0,2025-05-02 16:16:00.000,2025-05-02,2025,5,2,46378,[],()
67706,47518,19521,1,14$,"11/18/24,03:33:14 am",NULL,14.0,14.0,14.0,2024-11-18 03:33:14.000,2024-11-18,2024,11,18,47518,[],()
68020,45175,19406,1,57.00USD,"06/03/25, 13:12",,57.0,57.0,57.0,2025-06-03 13:12:00.000,2025-06-03,2025,6,3,45175,[],()
63840,47148,18867,5,58.00 $,2024-09-18T21:37:28,"Apt. 251 84540 Tiffiny Dale, Shiraside, AR 09535",58.0,58.0,290.0,2024-09-18 21:37:28.000,2024-09-18,2024,9,18,47148,[],()
66949,44807,19443,5,USD 28.50,18:40;12/23/24,,28.5,28.5,142.5,2024-12-23 18:40:00.000,2024-12-23,2024,12,23,44807,[],()
63904,44750,19285,4,USD61.5,09/08/24;13:48,NULL,61.5,61.5,246.0,2024-09-08 13:48:00.000,2024-09-08,2024,9,8,44750,[],()
72094,47401,19357,1,USD 12.0,"18:25,23-September-2024",,12.0,12.0,12.0,2024-09-23 18:25:00.000,2024-09-23,2024,9,23,47401,[],()
70139,47086,19568,2,EUR 48.25,"06/15/24, 11:30:54 P.M.","Apt. 909 942 Christiansen Flat, Gilbertview, IA 00046",57.9,57.9,115.8,2024-06-15 23:30:54.000,2024-06-15,2024,6,15,47086,[],()
71423,46769,18985,1,$55.,"23:55, 11/08/24","3502 Jeromy Corner, North Sol, HI 45275-4149",55.0,55.0,55.0,2024-11-08 23:55:00.000,2024-11-08,2024,11,8,46769,[],()
63841,45466,19399,1,€ 15.50,2025-01-10T12:11:08.630,NULL,18.599999999999998,18.599999999999998,18.6,2025-01-10 12:11:08.630,2025-01-10,2025,1,10,45466,[],()
66093,46681,18843,1,14.EUR,2025-02-07T14:35:46,NULL,16.8,16.8,16.8,2025-02-07 14:35:46.000,2025-02-07,2025,2,7,46681,[],()
71137,46752,18919,3,USD 18.99,"01:29:28 am,01/11/25",,18.99,18.99,56.97,2025-01-11 01:29:28.000,2025-01-11,2025,1,11,46752,[],()
64422,46071,19036,1,USD 65.5,"2025-04-29, 06:07", ,65.5,65.5,65.5,2025-04-29 06:07:00.000,2025-04-29,2025,4,29,46071,[],()
67043,44509,19561,1,22.50 EUR,2025-01-30 06:09:54 pm,"62222 Keneth Neck, West Brockbury, WV 10426-4853",27.0,27.0,27.0,2025-01-30 18:09:54.000,2025-01-30,2025,1,30,44378,[],()
72665,46521,19039,2,43.25EUR,"11:11, 09/08/24",,51.9,51.9,103.8,2024-09-08 11:11:00.000,2024-09-08,2024,9,8,46521,[],()
65058,46515,19187,1,60.USD,06:17 26-DEC-2024,"6737 Eden Cove, Murazikburgh, UT 62610-9281",60.0,60.0,60.0,2024-12-26 06:17:00.000,2024-12-26,2024,12,26,46515,[],()
64781,47325,18977,1,USD31.75,05:13:31 P.M.;25-AUG-2024,,31.75,31.75,31.75,2024-08-25 17:13:31.000,2024-08-25,2024,8,25,47325,[],()
65310,45468,19538,1,58.25 USD,"10:25:24 P.M., 24-MAR-2025",,58.25,58.25,58.25,2025-03-24 22:25:24.000,2025-03-24,2025,3,24,45468,[],()
70866,45259,19164,1,36.5 $,22:12:53;22-Jul-2024,NULL,36.5,36.5,36.5,2024-07-22 22:12:53.000,2024-07-22,2024,7,22,45259,[],()
72419,45758,19239,1,$73.75,"04/22/25,05:25:06 A.M.",,73.75,73.75,73.75,2025-04-22 05:25:06.000,2025-04-22,2025,4,22,45758,[],()
69423,45225,19073,4,$76.75,"14-MAY-2024, 23:31",,76.75,76.75,307.0,2024-05-14 23:31:00.000,2024-05-14,2024,5,14,45225,[],()
73696,45007,19578,1,USD 43.25,18:54;06/05/24,,43.25,43.25,43.25,2024-06-05 18:54:00.000,2024-06-05,2024,6,5,45007,[],()
70664,46365,18985,2,58.5 EUR,"21-OCT-2024,12:23:37 am",,70.2,70.2,140.4,2024-10-21 00:23:37.000,2024-10-21,2024,10,21,46365,[],()
65941,46360,19013,2,44€50¢,"14:42, 2024-07-22","22074 McGlynn Plains, North Helen, NM 53887-9972",5340.0,5340.0,10680.0,2024-07-22 14:42:00.000,2024-07-22,2024,7,22,46360,[],()
65395,47118,19170,3,$72.75,12/25/24 11:51:44,NULL,72.75,72.75,218.25,2024-12-25 11:51:44.000,2024-12-25,2024,12,25,47118,[],()
68142,46381,19283,3,EUR 18,"18:49:42, 7-NOV-2024",,21.599999999999998,21.599999999999998,64.8,2024-11-07 18:49:42.000,2024-11-07,2024,11,7,46381,[],()
71993,45913,19022,1,66.EUR,12:30:48 am 31-January-2025,,79.2,79.2,79.2,2025-01-31 00:30:48.000,2025-01-31,2025,1,31,45913,[],()
69659,46289,19147,3,27 $,2024-10-25T15:35:52.953,,27.0,27.0,81.0,2024-10-25 15:35:52.953,2024-10-25,2024,10,25,46289,[],()
71922,45716,19412,1,30.00USD,2025-06-26T00:24:30.036,NULL,30.0,30.0,30.0,2025-06-26 00:24:30.036,2025-06-26,2025,6,26,47099,[],()
66170,46466,18984,1,15$99¢,"2024-07-16, 00:41",NULL,1599.0,1599.0,1599.0,2024-07-16 00:41:00.000,2024-07-16,2024,7,16,46466,[],()
68354,46168,19143,1,31.5 USD,"05:19:36 pm,04/19/25",NULL,31.5,31.5,31.5,2025-04-19 17:19:36.000,2025-04-19,2025,4,19,46168,[],()
73805,44643,19437,2,€36,"13:53:50, 5-NOV-2024",,43.199999999999996,43.199999999999996,86.4,2024-11-05 13:53:50.000,2024-11-05,2024,11,5,44643,[],()
72692,44961,19219,1,$ 25.00,01/04/25;20:48:39,,25.0,25.0,25.0,2025-01-04 20:48:39.000,2025-01-04,2025,1,4,44961,[],()
72344,44399,19036,1,68.50 $,2024-03-18 13:14,"3608 Zack Parkway, New Florenechester, NE 15739",68.5,68.5,68.5,2024-03-18 13:14:00.000,2024-03-18,2024,3,18,44399,[],()
70728,44543,18935,1,€57¢50,"13-Jul-2024,20:34:02",NULL,6900.0,6900.0,6900.0,2024-07-13 20:34:02.000,2024-07-13,2024,7,13,44543,[],()
70491,45137,19399,1,$15.0,"01:27:04 am,01/07/25","Apt. 829 65212 Rippin Walk, Eveliatown, SD 99712",15.0,15.0,15.0,2025-01-07 01:27:04.000,2025-01-07,2025,1,7,45137,[],()
72465,45498,19040,1,USD15.99,"13-Apr-2025, 14:39","78873 Joe Lakes, Dachchester, HI 15241-7083",15.99,15.99,15.99,2025-04-13 14:39:00.000,2025-04-13,2025,4,13,45498,[],()
65495,45621,19076,1,USD18.00,03:17:01 AM;27-JAN-2025,,18.0,18.0,18.0,2025-01-27 03:17:01.000,2025-01-27,2025,1,27,45621,[],()
71955,46559,18971,1,$ 58.25,"07/30/25,12:57",NULL,58.25,58.25,58.25,2025-07-30 12:57:00.000,2025-07-30,2025,7,30,46559,[],()
63360,47097,19086,1,76. $,2025-01-07T00:30:42.907,,76.0,76.0,76.0,2025-01-07 00:30:42.907,2025-01-07,2025,1,7,47097,[],()
72434,46528,19134,1,69.99 $,"2025-01-26, 10:23:09 P.M.",,69.99,69.99,69.99,2025-01-26 22:23:09.000,2025-01-26,2025,1,26,46528,[],()
64495,46239,19508,5,35$00¢,2025-02-18T23:37:44,NULL,3500.0,3500.0,17500.0,2025-02-18 23:37:44.000,2025-02-18,2025,2,18,46239,[],()
64605,46115,19086,1,USD71.00,2024-11-10T07:38:05,"Apt. 643 6908 Lucille Underpass, Yongfort, HI 97467",71.0,71.0,71.0,2024-11-10 07:38:05.000,2024-11-10,2024,11,10,46115,[],()
65077,46563,19168,1,USD 64.5,"05/13/25,05:31:39 PM","Suite 377 438 Matilda Squares, Denvermouth, FL 61165-1096",64.5,64.5,64.5,2025-05-13 17:31:39.000,2025-05-13,2025,5,13,46563,[],()
68225,46785,19439,1,$71.0,"01/07/25,12:15:33 PM",,71.0,71.0,71.0,2025-01-07 12:15:33.000,2025-01-07,2025,1,7,46785,[],()
64686,46140,19508,3,33.EUR,2025-08-07T06:15:12,,39.6,39.6,118.8,2025-08-07 06:15:12.000,2025-08-07,2025,8,7,46140,[],()
66395,46942,19038,1,EUR 60.5,"09:14, 2025-02-27",,72.6,72.6,72.6,2025-02-27 09:14:00.000,2025-02-27,2025,2,27,46942,[],()
68690,44816,19154,2,74.75$,17:18 02/21/25,,74.75,74.75,149.5,2025-02-21 17:18:00.000,2025-02-21,2025,2,21,44816,[],()
62793,44658,19136,1,50.99$,"09/17/24,03:05:17 am",NULL,50.99,50.99,50.99,2024-09-17 03:05:17.000,2024-09-17,2024,9,17,44658,[],()
72058,47263,19458,1,59.99 €,"16:59,10/16/24",,71.988,71.988,71.99,2024-10-16 16:59:00.000,2024-10-16,2024,10,16,47263,[],()
73162,46323,18923,2,29.00 $,11/20/24;23:36,"22072 Dewey Club, West Stewart, WY 50687-3584",29.0,29.0,58.0,2024-11-20 23:36:00.000,2024-11-20,2024,11,20,46323,[],()
70432,45582,18863,1,USD26.75,"01/05/25, 12:18",NULL,26.75,26.75,26.75,2025-01-05 12:18:00.000,2025-01-05,2025,1,5,45582,[],()
66744,46385,19551,1,$27.50,"16-Jun-2024,04:37","Suite 407 98812 Runte Drive, Juttafort, TX 02557",27.5,27.5,27.5,2024-06-16 04:37:00.000,2024-06-16,2024,6,16,46385,[],()
66805,45308,19502,1,37.75 USD,30-AUG-2024;07:32,,37.75,37.75,37.75,2024-08-30 07:32:00.000,2024-08-30,2024,8,30,45308,[],()
68988,45297,19116,1,$19.0,2025-03-15T13:36:25.917,,19.0,19.0,19.0,2025-03-15 13:36:25.917,2025-03-15,2025,3,15,45297,[],()
63698,47080,19303,1,$64,"2025-01-27, 19:30:34",,64.0,64.0,64.0,2025-01-27 19:30:34.000,2025-01-27,2025,1,27,47080,[],()
70780,46909,19475,3,USD39.5,2024-08-30T23:12:09,,39.5,39.5,118.5,2024-08-30 23:12:09.000,2024-08-30,2024,8,30,46909,[],()
70212,46409,19439,1,$71¢25,01:24:53 am; 2-JAN-2025,,7125.0,7125.0,7125.0,2025-01-02 01:24:53.000,2025-01-02,2025,1,2,46409,[],()
73142,45855,19418,1,55.25$,"15:22:13, 2024-09-14",NULL,55.25,55.25,55.25,2024-09-14 15:22:13.000,2024-09-14,2024,9,14,45855,[],()
69400,46794,19491,1,35.0$,"07:03:01 am,2025-03-19",NULL,35.0,35.0,35.0,2025-03-19 07:03:01.000,2025-03-19,2025,3,19,46794,[],()
70152,44896,19388,1,52.75 $,"10:24:59 PM, 5-Oct-2024","721 Heidenreich Valley, New Anibal, KS 99441-3145",52.75,52.75,52.75,2024-10-05 22:24:59.000,2024-10-05,2024,10,5,44896,[],()
67523,45145,19533,1,48.0EUR,2024-10-05 11:02:29 pm,,57.599999999999994,57.599999999999994,57.6,2024-10-05 23:02:29.000,2024-10-05,2024,10,5,45145,[],()
67624,47287,18938,1,$ 50.50,2024-06-15 09:40:53 A.M.,,50.5,50.5,50.5,2024-06-15 09:40:53.000,2024-06-15,2024,6,15,47287,[],()
69257,44504,19579,3,€ 22.0,2025-09-18 05:59:56 P.M.,NULL,26.4,26.4,79.2,2025-09-18 17:59:56.000,2025-09-18,2025,9,18,44504,[],()
72907,47009,19337,2,62.0 USD,01:21:01; 3-OCT-2024,,62.0,62.0,124.0,2024-10-03 01:21:01.000,2024-10-03,2024,10,3,47009,[],()
65132,45065,19568,2,47.00 $,2024-12-11T18:46:50.091,,47.0,47.0,94.0,2024-12-11 18:46:50.091,2024-12-11,2024,12,11,45065,[],()
68946,45738,19588,1,65.5USD,09:03:32 10/26/24,,65.5,65.5,65.5,2024-10-26 09:03:32.000,2024-10-26,2024,10,26,45738,[],()
71727,45403,19108,1,42.EUR,"17-Dec-2024, 01:58",,50.4,50.4,50.4,2024-12-17 01:58:00.000,2024-12-17,2024,12,17,45403,[],()
68991,47007,18990,3,€44.75,11:14 01/26/25,"Apt. 987 936 Parisian Via, Kathyrnton, FL 82582",53.699999999999996,53.699999999999996,161.1,2025-01-26 11:14:00.000,2025-01-26,2025,1,26,47007,[],()
67338,45883,19020,3,EUR 20.25,10:51:09 06/12/25,,24.3,24.3,72.9,2025-06-12 10:51:09.000,2025-06-12,2025,6,12,45883,[],()
70949,44921,19459,1,USD43.50,"01/09/25, 01:52","Suite 446 40867 Elida Brooks, Metzview, NJ 50431-4166",43.5,43.5,43.5,2025-01-09 01:52:00.000,2025-01-09,2025,1,9,44921,[],()
64355,45660,19210,1,36.99EUR,"11:06:11 PM,2024-06-17",,44.388,44.388,44.39,2024-06-17 23:06:11.000,2024-06-17,2024,6,17,45660,[],()
68743,45322,19432,1,25.75 EUR,10.01.2025  8:22:22,NULL,30.9,30.9,30.9,2025-10-01 08:22:22.000,2025-10-01,2025,10,1,45322,[],()
73430,45310,19044,3,63.75 €,"2024-12-01, 15:15",,76.5,76.5,229.5,2024-12-01 15:15:00.000,2024-12-01,2024,12,1,45310,[],()
71665,45966,18853,1,64.$,2024-11-01 01:31:21 pm,NULL,64.0,64.0,64.0,2024-11-01 13:31:21.000,2024-11-01,2024,11,1,45966,[],()
65689,45716,19168,1,EUR 61.75,21:33;11-February-2025,,74.1,74.1,74.1,2025-02-11 21:33:00.000,2025-02-11,2025,2,11,47099,[],()
67962,45471,18976,1,23.99 $,"09/01/24, 04:43:52",,23.99,23.99,23.99,2024-09-01 04:43:52.000,2024-09-01,2024,9,1,45471,[],()
64494,45579,18902,4,€ 18.75,"09:38:42 P.M., 02/27/25",NULL,22.5,22.5,90.0,2025-02-27 21:38:42.000,2025-02-27,2025,2,27,45579,[],()
63086,44727,19071,2,15.75 USD,07/17/25 08:52:37,NULL,15.75,15.75,31.5,2025-07-17 08:52:37.000,2025-07-17,2025,7,17,45612,[],()
64961,44574,19190,1,44.5USD,12:31; 6-NOV-2024,,44.5,44.5,44.5,2024-11-06 12:31:00.000,2024-11-06,2024,11,6,44574,[],()
64133,46067,19202,5,55.USD,2025-01-01T15:44:32,,55.0,55.0,275.0,2025-01-01 15:44:32.000,2025-01-01,2025,1,1,46067,[],()
63402,47220,19504,1,61.99 USD,2024-05-18T14:17:29.207,NULL,61.99,61.99,61.99,2024-05-18 14:17:29.207,2024-05-18,2024,5,18,47220,[],()
68736,44415,19098,1,$60,2024-09-25;03:48:07 am,NULL,60.0,60.0,60.0,2024-09-25 03:48:07.000,2024-09-25,2024,9,25,44415,[],()
69658,44608,19223,1,$21.,"17-April-2024,19:45:45",NULL,21.0,21.0,21.0,2024-04-17 19:45:45.000,2024-04-17,2024,4,17,44608,[],()
70448,44516,19424,1,16.99USD,"07:30:39 am,22-Nov-2024",,16.99,16.99,16.99,2024-11-22 07:30:39.000,2024-11-22,2024,11,22,44516,[],()
65362,47447,19361,1,39.75USD,2025-06-04T18:17:46.523,NULL,39.75,39.75,39.75,2025-06-04 18:17:46.523,2025-06-04,2025,6,4,47063,[],()
72636,45396,19534,1,USD 39.5,10/07/24 20:15,,39.5,39.5,39.5,2024-10-07 20:15:00.000,2024-10-07,2024,10,7,45396,[],()
70571,44770,18993,1,$64.50,10:07:37 AM;06/17/25,,64.5,64.5,64.5,2025-06-17 10:07:37.000,2025-06-17,2025,6,17,44770,[],()
71617,46911,18963,1,54.99$,"2025-02-06,07:44:05 AM",,54.99,54.99,54.99,2025-02-06 07:44:05.000,2025-02-06,2025,2,6,46911,[],()
68058,46317,19572,3,16.5$,2025-05-18T22:51:33,,16.5,16.5,49.5,2025-05-18 22:51:33.000,2025-05-18,2025,5,18,46317,[],()
65520,44969,19219,1,€26¢75,05:48:50 pm;2025-01-18,NULL,3210.0,3210.0,3210.0,2025-01-18 17:48:50.000,2025-01-18,2025,1,18,44969,[],()
70831,45882,19383,2,63$25¢,2024-07-10T09:36:04.456,,6325.0,6325.0,12650.0,2024-07-10 09:36:04.456,2024-07-10,2024,7,10,45882,[],()
69961,45560,18922,1,15.0 EUR,30-March-2025;22:51:32,"44499 Thi Center, West Kiethport, NY 20467",18.0,18.0,18.0,2025-03-30 22:51:32.000,2025-03-30,2025,3,30,45560,[],()
70229,47238,19397,1,EUR28.0,2024-10-28 04:43:56 A.M.,,33.6,33.6,33.6,2024-10-28 04:43:56.000,2024-10-28,2024,10,28,47238,[],()
71659,45151,19556,1,32.99$," 4-Jan-2025,10:40:20 pm",,32.99,32.99,32.99,2025-01-04 22:40:20.000,2025-01-04,2025,1,4,45151,[],()
64567,45479,18889,2,71.$,2025-06-14T12:19:48.496,,71.0,71.0,142.0,2025-06-14 12:19:48.496,2025-06-14,2025,6,14,45479,[],()
66513,45811,19166,1,USD60.75,02/21/25;07:58:04 PM,,60.75,60.75,60.75,2025-02-21 19:58:04.000,2025-02-21,2025,2,21,45811,[],()
73375,44792,18961,1,EUR 72.50,14-Jan-2025;06:06:46,,87.0,87.0,87.0,2025-01-14 06:06:46.000,2025-01-14,2025,1,14,44792,[],()
62892,46650,19551,1,26.0 $,"12/08/24,01:35:08 am",NULL,26.0,26.0,26.0,2024-12-08 01:35:08.000,2024-12-08,2024,12,8,46650,[],()
72769,44487,19508,1,$36¢75,2025-01-17T21:53:05.471,,3675.0,3675.0,3675.0,2025-01-17 21:53:05.471,2025-01-17,2025,1,17,44487,[],()
65818,46176,19380,1,65.USD,"03:04:05 P.M.,2024-08-13",NULL,65.0,65.0,65.0,2024-08-13 15:04:05.000,2024-08-13,2024,8,13,46176,[],()
68447,46128,19526,1,69.99USD,2024-07-25T09:35:11.730,NULL,69.99,69.99,69.99,2024-07-25 09:35:11.730,2024-07-25,2024,7,25,46128,[],()
70436,46574,19275,1,51.75 EUR,23:06:35;28-APR-2025,"Suite 622 1945 Dante Extension, New Deonna, NV 91785-4245",62.099999999999994,62.099999999999994,62.1,2025-04-28 23:06:35.000,2025-04-28,2025,4,28,46574,[],()
70952,47166,19509,5,55.00USD,"2025-02-12, 23:15:18","9951 Joshua Brook, Kevinport, IN 25774",55.0,55.0,275.0,2025-02-12 23:15:18.000,2025-02-12,2025,2,12,47166,[],()
73479,46067,19285,2,EUR65.25,"02/19/25, 04:27:59 PM",,78.3,78.3,156.6,2025-02-19 16:27:59.000,2025-02-19,2025,2,19,46067,[],()
70082,46289,19416,1,USD 63.0,2025-02-27 09:27:41 am,"Suite 321 16570 Patricia Parkways, Hudsonchester, AZ 72447",63.0,63.0,63.0,2025-02-27 09:27:41.000,2025-02-27,2025,2,27,46289,[],()
71213,46338,19131,1,58.25$,16:31 10/04/24,,58.25,58.25,58.25,2024-10-04 16:31:00.000,2024-10-04,2024,10,4,46338,[],()
68151,46209,19390,1,$ 35.00,2024-04-23T07:16:14,NULL,35.0,35.0,35.0,2024-04-23 07:16:14.000,2024-04-23,2024,4,23,46209,[],()
70242,47277,19202,4,EUR 54.75,04/25/24;08:07,,65.7,65.7,262.8,2024-04-25 08:07:00.000,2024-04-25,2024,4,25,47277,[],()
63789,47199,19050,1,€68¢25,2025-08-20T04:37:57.668,"Suite 491 98613 Alexis Spur, South Frankview, WA 89970",8190.0,8190.0,8190.0,2025-08-20 04:37:57.668,2025-08-20,2025,8,20,47199,[],()
71929,45825,18880,1,71.99 EUR,01.12.2024 08:47:47,NULL,86.38799999999999,86.38799999999999,86.39,2024-01-12 08:47:47.000,2024-01-12,2024,1,12,45825,[],()
64862,47308,18852,3,15€00¢,2024-04-02;01:21,,1800.0,1800.0,5400.0,2024-04-02 01:21:00.000,2024-04-02,2024,4,2,47308,[],()
65738,44537,19391,1,52.5 USD,07:51:19 am 23-Mar-2025,"9751 Casper Drives, West Will, NY 99845-0973",52.5,52.5,52.5,2025-03-23 07:51:19.000,2025-03-23,2025,3,23,44537,[],()
67086,47437,19493,1,67.99USD,"10-Apr-2025, 09:20:46 P.M.",NULL,67.99,67.99,67.99,2025-04-10 21:20:46.000,2025-04-10,2025,4,10,47437,[],()
66027,45569,19498,2,EUR49.5,10/16/24 03:05,,59.4,59.4,118.8,2024-10-16 03:05:00.000,2024-10-16,2024,10,16,45569,[],()
64875,46229,18973,1,$56.50,"11/06/24,10:37:11 AM","Apt. 798 9730 Freeda Stravenue, McDermottshire, NE 73109-8477",56.5,56.5,56.5,2024-11-06 10:37:11.000,2024-11-06,2024,11,6,46229,[],()
68694,44339,19407,2,20.50 USD,2024-11-19T07:42:42,"217 Erik Ports, O'Keefefort, NM 29616",20.5,20.5,41.0,2024-11-19 07:42:42.000,2024-11-19,2024,11,19,44339,[],()
69557,46581,19138,1,28.99$,"02/24/25,06:23:25 AM",,28.99,28.99,28.99,2025-02-24 06:23:25.000,2025-02-24,2025,2,24,46581,[],()
70951,45399,18973,1,USD53.25,21:18 05/07/25,,53.25,53.25,53.25,2025-05-07 21:18:00.000,2025-05-07,2025,5,7,45399,[],()
63903,45154,18903,2,$ 17.5, 6-Jan-2025;03:41:19 PM,NULL,17.5,17.5,35.0,2025-01-06 15:41:19.000,2025-01-06,2025,1,6,45154,[],()
72969,45289,19136,1,52 USD,"11/13/24,16:53",NULL,52.0,52.0,52.0,2024-11-13 16:53:00.000,2024-11-13,2024,11,13,45289,[],()
63795,45605,18973,1,$54.99,19:34:57;09/02/24,NULL,54.99,54.99,54.99,2024-09-02 19:34:57.000,2024-09-02,2024,9,2,45605,[],()
64735,45646,19508,1,38.50 USD,12/31/24;03:54:23 pm,,38.5,38.5,38.5,2024-12-31 15:54:23.000,2024-12-31,2024,12,31,44936,[],()
69923,46916,19379,1,€57.50,14:41:07;2025-09-08,,69.0,69.0,69.0,2025-09-08 14:41:07.000,2025-09-08,2025,9,8,46916,[],()
64454,46114,18971,1,EUR 58.50,04/26/24 05:05:36 P.M.,NULL,70.2,70.2,70.2,2024-04-26 17:05:36.000,2024-04-26,2024,4,26,46114,[],()
64356,47317,18975,1,EUR54.00,02.11.2024 16:37:37,"1661 Alexis Ranch, East Larrymouth, AZ 54352-4120",64.8,64.8,64.8,2024-02-11 16:37:37.000,2024-02-11,2024,2,11,47317,[],()
63054,46260,19009,2,EUR75.75,"2024-03-08,05:29:07",,90.89999999999999,90.89999999999999,181.8,2024-03-08 05:29:07.000,2024-03-08,2024,3,8,46260,[],()
68145,47216,19066,1,39.0€,"05:32:22,03/29/25",,46.8,46.8,46.8,2025-03-29 05:32:22.000,2025-03-29,2025,3,29,47216,[],()
68137,45953,18960,1,$30.5,2024-12-10T22:22:17,,30.5,30.5,30.5,2024-12-10 22:22:17.000,2024-12-10,2024,12,10,45953,[],()
73092,47446,19152,2,$27¢50,"10:41, 11/21/24",,2750.0,2750.0,5500.0,2024-11-21 10:41:00.000,2024-11-21,2024,11,21,47446,[],()
64378,47027,19163,2,USD12.,"05:39:05,2024-09-04",,12.0,12.0,24.0,2024-09-04 05:39:05.000,2024-09-04,2024,9,4,47027,[],()
70447,46307,19587,1,35$75¢,2024-11-22T10:28:29.457,NULL,3575.0,3575.0,3575.0,2024-11-22 10:28:29.457,2024-11-22,2024,11,22,46307,[],()
73072,45192,19366,3,$27.25,"11:39:56 pm,2024-08-03",,27.25,27.25,81.75,2024-08-03 23:39:56.000,2024-08-03,2024,8,3,45192,[],()
63391,47017,19476,1,€20.99,2024-05-27 02:37:57 pm,,25.188,25.188,25.19,2024-05-27 14:37:57.000,2024-05-27,2024,5,27,47017,[],()
63511,47356,19054,1,45.0 $,2025-03-06T06:23:03.532,NULL,45.0,45.0,45.0,2025-03-06 06:23:03.532,2025-03-06,2025,3,6,47356,[],()
66132,44783,19095,3,EUR 60,"12/08/24, 07:21:10",,72.0,72.0,216.0,2024-12-08 07:21:10.000,2024-12-08,2024,12,8,44783,[],()
73716,44715,19588,1,EUR 68.5,"09:41:30 AM,01/11/25","8203 Jarvis Place, Keshiamouth, MA 46617",82.2,82.2,82.2,2025-01-11 09:41:30.000,2025-01-11,2025,1,11,44715,[],()
69218,45901,18959,3,51.€,17-Sep-2024;07:18:30,,61.199999999999996,61.199999999999996,183.6,2024-09-17 07:18:30.000,2024-09-17,2024,9,17,45901,[],()
67326,46274,19005,1,36.0 USD,"17:47:16,12-Feb-2025",NULL,36.0,36.0,36.0,2025-02-12 17:47:16.000,2025-02-12,2025,2,12,46274,[],()
71050,47215,19294,2,51.99$,"02/10/25,04:51:21",,51.99,51.99,103.98,2025-02-10 04:51:21.000,2025-02-10,2025,2,10,47215,[],()
62942,47382,18849,4,33.50 $,18-NOV-2024 00:03,"4410 Tianna Springs, East Erick, OK 44094",33.5,33.5,134.0,2024-11-18 00:03:00.000,2024-11-18,2024,11,18,47382,[],()
71719,46954,19038,1,€ 59.0,"07/19/24,23:33:49",,70.8,70.8,70.8,2024-07-19 23:33:49.000,2024-07-19,2024,7,19,46954,[],()
64004,44840,19157,3,EUR 31.75,01:51:39;02/11/25,"Suite 340 9107 Schneider Village, West Lilianatown, VA 20093-5251",38.1,38.1,114.3,2025-02-11 01:51:39.000,2025-02-11,2025,2,11,44840,[],()
72091,46434,19383,2,$ 60.50,10:32:47 P.M. 12/14/24,,60.5,60.5,121.0,2024-12-14 22:32:47.000,2024-12-14,2024,12,14,46434,[],()
70856,45604,19200,3,23.50 USD,2024-06-21T08:16:53.967,,23.5,23.5,70.5,2024-06-21 08:16:53.967,2024-06-21,2024,6,21,45604,[],()
68320,44403,19554,1,$60¢25,"07:25:07,13-March-2025",,6025.0,6025.0,6025.0,2025-03-13 07:25:07.000,2025-03-13,2025,3,13,44403,[],()
67211,45809,19552,5,EUR38,2025-03-02T11:12:31.673,,45.6,45.6,228.0,2025-03-02 11:12:31.673,2025-03-02,2025,3,2,45809,[],()
70652,47256,19345,1,61.25$," 5-Apr-2025, 06:53:49","Suite 246 56446 Dierdre Stravenue, North Rachaelborough, CT 53090",61.25,61.25,61.25,2025-04-05 06:53:49.000,2025-04-05,2025,4,5,47256,[],()
65482,45899,19261,1,68.75 EUR,2024-12-21 06:02:08 AM,"Apt. 587 75990 Jonas Views, Port Donnie, NC 36293",82.5,82.5,82.5,2024-12-21 06:02:08.000,2024-12-21,2024,12,21,45899,[],()
71875,45941,19044,3,$58.,"08/07/24,04:01:20 PM",,58.0,58.0,174.0,2024-08-07 16:01:20.000,2024-08-07,2024,8,7,45941,[],()
64537,45999,19025,1,37.00 EUR,2025-03-22;05:12:08,,44.4,44.4,44.4,2025-03-22 05:12:08.000,2025-03-22,2025,3,22,45999,[],()
66855,45226,19520,4,28.5 EUR,2024-07-09 14:15:39,"Suite 407 206 Waters Vista, Irvinton, IA 44691-1102",34.199999999999996,34.199999999999996,136.8,2024-07-09 14:15:39.000,2024-07-09,2024,7,9,45226,[],()
73719,47087,19197,1,42.5 USD,"10:16:23, 26-Dec-2024","762 Connie Valleys, New Inell, IL 43005",42.5,42.5,42.5,2024-12-26 10:16:23.000,2024-12-26,2024,12,26,47087,[],()
67029,46280,19568,3,48.5 €,"21-November-2024, 06:44:14 pm",,58.199999999999996,58.199999999999996,174.6,2024-11-21 18:44:14.000,2024-11-21,2024,11,21,46280,[],()
66009,46646,18939,1,USD52.00,2025-03-04;07:10:32,NULL,52.0,52.0,52.0,2025-03-04 07:10:32.000,2025-03-04,2025,3,4,46646,[],()
72205,45228,19556,1,30.5USD,17:16:27 25-June-2024,NULL,30.5,30.5,30.5,2024-06-25 17:16:27.000,2024-06-25,2024,6,25,45228,[],()
71963,44709,19486,1,USD 44.75,2024-08-25T13:33:40,,44.75,44.75,44.75,2024-08-25 13:33:40.000,2024-08-25,2024,8,25,44709,[],()
73307,45028,18917,1,67. USD,08:17:52 AM;10/23/24,NULL,67.0,67.0,67.0,2024-10-23 08:17:52.000,2024-10-23,2024,10,23,44738,[],()
73873,46719,19167,1,44.50 $,"22:11:10,  4-January-2025",,44.5,44.5,44.5,2025-01-04 22:11:10.000,2025-01-04,2025,1,4,46719,[],()
69567,46659,19167,1,41.50USD,"16:17,24-APR-2024",,41.5,41.5,41.5,2024-04-24 16:17:00.000,2024-04-24,2024,4,24,46659,[],()
73136,47297,19185,1,55.25USD,2024-10-29T15:59:04.614,,55.25,55.25,55.25,2024-10-29 15:59:04.614,2024-10-29,2024,10,29,47297,[],()
72711,46393,18868,1,25$,2025-01-16 02:26:53 PM,NULL,25.0,25.0,25.0,2025-01-16 14:26:53.000,2025-01-16,2025,1,16,46393,[],()
70289,47063,19068,1,USD 51.00,"2025-09-15, 10:06:13",NULL,51.0,51.0,51.0,2025-09-15 10:06:13.000,2025-09-15,2025,9,15,47063,[],()
64116,46468,19046,2,$ 21.99,23-Feb-2025;07:04:30,"Apt. 142 81315 Marvin Junctions, North Gabrielleburgh, HI 94074",21.99,21.99,43.98,2025-02-23 07:04:30.000,2025-02-23,2025,2,23,46468,[],()
73869,46303,19087,1,$ 53.0,"08/21/24,05:02:03 am",,53.0,53.0,53.0,2024-08-21 05:02:03.000,2024-08-21,2024,8,21,46303,[],()
69863,44703,19532,2,32.99 $,2025-02-03T11:32:15.456,,32.99,32.99,65.98,2025-02-03 11:32:15.456,2025-02-03,2025,2,3,44703,[],()
71068,45818,18884,1,$ 70.99,"09/02/24,07:54:04 P.M.",,70.99,70.99,70.99,2024-09-02 19:54:04.000,2024-09-02,2024,9,2,45818,[],()
64484,45620,18883,1,€19.75,04:16;07/19/25,"1910 Pollich Skyway, Charleyberg, MS 29517-1132",23.7,23.7,23.7,2025-07-19 04:16:00.000,2025-07-19,2025,7,19,45620,[],()
67434,46883,18900,1,$62.00, 2.05.2025  9:11:11,"202 Russel Prairie, East Eliasborough, AK 73480-8372",62.0,62.0,62.0,2025-02-05 09:11:11.000,2025-02-05,2025,2,5,46883,[],()
66269,46891,19016,1,USD 48,"07/03/25,03:22:13 A.M.",NULL,48.0,48.0,48.0,2025-07-03 03:22:13.000,2025-07-03,2025,7,3,46891,[],()
67930,45482,19223,1,21.00 USD,"19:16, 10/03/24",,21.0,21.0,21.0,2024-10-03 19:16:00.000,2024-10-03,2024,10,3,45482,[],()
69507,46740,18948,1,EUR 21.99,17:10:55;10/11/24,,26.387999999999998,26.387999999999998,26.39,2024-10-11 17:10:55.000,2024-10-11,2024,10,11,46740,[],()
64298,45500,19553,1,EUR47.00,"07:51:55,2025-03-03",,56.4,56.4,56.4,2025-03-03 07:51:55.000,2025-03-03,2025,3,3,45500,[],()
73111,45276,19361,1,USD 34.5,14:17; 9-Aug-2024,,34.5,34.5,34.5,2024-08-09 14:17:00.000,2024-08-09,2024,8,9,45276,[],()
63825,47119,18983,2,$33¢99,2025-05-17T07:35:20,"99554 Legros Circle, North Lovettaton, HI 70352",3399.0,3399.0,6798.0,2025-05-17 07:35:20.000,2025-05-17,2025,5,17,47119,[],()
63493,45101,19321,1,$47.99,2025-02-02 03:00:33,,47.99,47.99,47.99,2025-02-02 03:00:33.000,2025-02-02,2025,2,2,45101,[],()
65186,46283,19063,1,USD 48.50,"2024-12-16,06:21:25",,48.5,48.5,48.5,2024-12-16 06:21:25.000,2024-12-16,2024,12,16,46283,[],()
69661,47420,19425,1,€46¢75,"28-APR-2025,18:57:20",NULL,5610.0,5610.0,5610.0,2025-04-28 18:57:20.000,2025-04-28,2025,4,28,47420,[],()
70744,46761,18891,3,$24.75,"22-March-2025, 13:14:23",,24.75,24.75,74.25,2025-03-22 13:14:23.000,2025-03-22,2025,3,22,47344,[],()
62973,44570,19453,2,$30¢25,"03:53:53, 30-January-2025",,3025.0,3025.0,6050.0,2025-01-30 03:53:53.000,2025-01-30,2025,1,30,44570,[],()
65003,45182,19422,1,27.25 €,"2025-04-08, 16:07",NULL,32.699999999999996,32.699999999999996,32.7,2025-04-08 16:07:00.000,2025-04-08,2025,4,8,45182,[],()
65228,46621,19198,2,USD48.50,"2024-09-06,09:31:04",,48.5,48.5,97.0,2024-09-06 09:31:04.000,2024-09-06,2024,9,6,46621,[],()
68523,46828,18946,2,50.00 USD,11/09/24;18:37,,50.0,50.0,100.0,2024-11-09 18:37:00.000,2024-11-09,2024,11,9,46828,[],()
69151,44868,19282,5,70.00 EUR,"04:48,  4-December-2024",,84.0,84.0,420.0,2024-12-04 04:48:00.000,2024-12-04,2024,12,4,44868,[],()
71023,46953,19040,1,$14¢75,"05/06/25, 00:09",,1475.0,1475.0,1475.0,2025-05-06 00:09:00.000,2025-05-06,2025,5,6,46953,[],()
63185,47574,19015,1,$ 61.25,"10:47, 2025-05-05",NULL,61.25,61.25,61.25,2025-05-05 10:47:00.000,2025-05-05,2025,5,5,47574,[],()
62784,45754,19334,3,USD 70.75,"13:41:58,10-March-2025",,70.75,70.75,212.25,2025-03-10 13:41:58.000,2025-03-10,2025,3,10,45754,[],()
67765,46804,19496,2,27.50 USD,2025-04-13T18:20:55.055,NULL,27.5,27.5,55.0,2025-04-13 18:20:55.055,2025-04-13,2025,4,13,46804,[],()
67060,46153,19040,1,USD19,2024-08-16T17:56:23,,19.0,19.0,19.0,2024-08-16 17:56:23.000,2024-08-16,2024,8,16,46153,[],()
69143,47124,19246,1,$ 25.00,2024-09-29T07:49:14.671,,25.0,25.0,25.0,2024-09-29 07:49:14.671,2024-09-29,2024,9,29,47124,[],()
66716,46885,19067,1,39.25EUR,06:35:26  6-JUN-2025,,47.1,47.1,47.1,2025-06-06 06:35:26.000,2025-06-06,2025,6,6,46885,[],()
66606,46510,19585,1,66.0 $,20:22 2024-06-10,NULL,66.0,66.0,66.0,2024-06-10 20:22:00.000,2024-06-10,2024,6,10,46510,[],()
64321,46515,19292,1,USD 49.99,03/09/25 04:00:15 am,,49.99,49.99,49.99,2025-03-09 04:00:15.000,2025-03-09,2025,3,9,46515,[],()
66056,45226,19126,1,€ 26.50,2024-11-05T19:28:10.755,,31.799999999999997,31.799999999999997,31.8,2024-11-05 19:28:10.755,2024-11-05,2024,11,5,45226,[],()
67313,47158,18896,1,USD29.0,2024-11-23T08:31:50,,29.0,29.0,29.0,2024-11-23 08:31:50.000,2024-11-23,2024,11,23,47158,[],()
62839,45151,19214,1,€43¢25,09/19/24 15:46,NULL,5190.0,5190.0,5190.0,2024-09-19 15:46:00.000,2024-09-19,2024,9,19,45151,[],()
67678,45719,18910,1,50.5USD,"2024-10-14,01:51",,50.5,50.5,50.5,2024-10-14 01:51:00.000,2024-10-14,2024,10,14,45719,[],()
65601,44677,18960,3,USD31.00,15-August-2024 21:52,NULL,31.0,31.0,93.0,2024-08-15 21:52:00.000,2024-08-15,2024,8,15,44677,[],()
64955,45135,18997,5,$ 36.25,"10/24/24, 04:31:03 P.M.",,36.25,36.25,181.25,2024-10-24 16:31:03.000,2024-10-24,2024,10,24,45135,[],()
73267,47262,18981,1,67.50 €,2025-04-02T04:25:19,NULL,81.0,81.0,81.0,2025-04-02 04:25:19.000,2025-04-02,2025,4,2,47262,[],()
70804,44705,19268,1,48.$,"05/20/24, 16:05","Apt. 732 77242 Ryan Views, East Mariel, SD 16508",48.0,48.0,48.0,2024-05-20 16:05:00.000,2024-05-20,2024,5,20,44705,[],()
70567,45336,19245,1,€69¢50,12:03:03 am 2025-01-09,"590 Abbott Orchard, West Karlmouth, VA 27190-8995",8340.0,8340.0,8340.0,2025-01-09 00:03:03.000,2025-01-09,2025,1,9,45336,[],()
63972,46446,18991,1,USD 56.75,2025-01-11;05:43:28 PM,,56.75,56.75,56.75,2025-01-11 17:43:28.000,2025-01-11,2025,1,11,46446,[],()
71630,44546,19208,2,55.99$, 1-NOV-2024;11:37:32 pm,NULL,55.99,55.99,111.98,2024-11-01 23:37:32.000,2024-11-01,2024,11,1,44546,[],()
73738,46895,19360,1,$ 62.5, 5-September-2024;11:31,"Suite 439 2889 Marcene Plains, Lake Isaias, MO 91614-2737",62.5,62.5,62.5,2024-09-05 11:31:00.000,2024-09-05,2024,9,5,46895,[],()
71892,47184,19474,1,USD31,"11/20/24, 01:10:24 A.M.","Apt. 808 5228 Kemmer Camp, Leaton, WY 11036",31.0,31.0,31.0,2024-11-20 01:10:24.000,2024-11-20,2024,11,20,47184,[],()
73450,46374,19471,1,42.50€," 4-Feb-2025,03:56:06",,51.0,51.0,51.0,2025-02-04 03:56:06.000,2025-02-04,2025,2,4,46374,[],()
66593,45931,19311,5,68.00USD,11-February-2025 10:12:46,NULL,68.0,68.0,340.0,2025-02-11 10:12:46.000,2025-02-11,2025,2,11,45931,[],()
68397,46711,19274,1,$ 73.,"2025-04-25,11:43:19 PM","648 Zora Green, North Clemente, RI 74989-8786",73.0,73.0,73.0,2025-04-25 23:43:19.000,2025-04-25,2025,4,25,46711,[],()
70718,47364,19550,1,EUR 34.75,2025-03-10 06:56,"Suite 734 963 O'Connell Drive, North Althaton, WV 79190",41.699999999999996,41.699999999999996,41.7,2025-03-10 06:56:00.000,2025-03-10,2025,3,10,47364,[],()
71184,47583,18909,1,USD 26.5,"19:09:44,2024-08-18",NULL,26.5,26.5,26.5,2024-08-18 19:09:44.000,2024-08-18,2024,8,18,47583,[],()
66892,46305,18972,1,$ 25.99,2024-06-25;01:41:37 AM,NULL,25.99,25.99,25.99,2024-06-25 01:41:37.000,2024-06-25,2024,6,25,46305,[],()
67508,45292,19277,1,$ 57.25,2024-04-14T14:34:05,"Suite 116 819 Will Extension, North Leon, AZ 30216-4569",57.25,57.25,57.25,2024-04-14 14:34:05.000,2024-04-14,2024,4,14,45292,[],()
72631,44685,19525,1,€65.25,2024-11-17T07:13:50,,78.3,78.3,78.3,2024-11-17 07:13:50.000,2024-11-17,2024,11,17,44685,[],()
63049,46756,19523,1,$28.0,20.12.2024 20:29:29,"50289 Blaine Overpass, West Edward, SC 50608",28.0,28.0,28.0,2024-12-20 20:29:29.000,2024-12-20,2024,12,20,46974,[],()
72542,45305,19360,1,$58¢75,"07:15:20 pm,2024-07-20","9981 Russel Rapid, Lake Leonida, WY 69820",5875.0,5875.0,5875.0,2024-07-20 19:15:20.000,2024-07-20,2024,7,20,45305,[],()
64271,46935,18874,1,USD 55.75,31.07.2025 09:03:03,"5324 Pacocha Hill, Cheriseton, IN 14427-1229",55.75,55.75,55.75,2025-07-31 09:03:03.000,2025-07-31,2025,7,31,46935,[],()
72767,44677,19496,2,27.0 USD,2025-04-10 11:26:13 P.M.,"55639 Osinski Turnpike, New Jewellbury, CO 02218",27.0,27.0,54.0,2025-04-10 23:26:13.000,2025-04-10,2025,4,10,44677,[],()
62996,45088,18900,1,EUR 62.25,2025-05-01T12:35:35.789,,74.7,74.7,74.7,2025-05-01 12:35:35.789,2025-05-01,2025,5,1,45088,[],()
66338,46081,19280,3,€43.5,"11:06:34 am, 9-September-2024",,52.199999999999996,52.199999999999996,156.6,2024-09-09 11:06:34.000,2024-09-09,2024,9,9,46081,[],()
70679,45383,19505,2,17.0 USD,2025-02-12T14:40:00,"Apt. 265 68237 Keith Harbor, Port Shannon, MI 05606-6953",17.0,17.0,34.0,2025-02-12 14:40:00.000,2025-02-12,2025,2,12,45383,[],()
64029,44851,19343,1,$ 73.99,07:55:59 PM 2024-10-19,,73.99,73.99,73.99,2024-10-19 19:55:59.000,2024-10-19,2024,10,19,44851,[],()
67454,45777,19455,2,USD15.25,2025-05-14 08:54,,15.25,15.25,30.5,2025-05-14 08:54:00.000,2025-05-14,2025,5,14,45777,[],()
69023,46124,19537,1,USD 52.00,02:45;19-DEC-2024,"790 Nikolaus Bridge, South Billy, MN 35409",52.0,52.0,52.0,2024-12-19 02:45:00.000,2024-12-19,2024,12,19,46124,[],()
70231,47131,19421,4,22.00USD,"07:58:17 pm,03/30/25",NULL,22.0,22.0,88.0,2025-03-30 19:58:17.000,2025-03-30,2025,3,30,46733,[],()
72446,45150,18853,3,EUR 61.5,"08:19:35 A.M., 12/06/24",,73.8,73.8,221.4,2024-12-06 08:19:35.000,2024-12-06,2024,12,6,45150,[],()
63920,44833,18980,1,61.5$,18:26;04/15/24,"349 Langosh Field, Dannychester, DE 98655",61.5,61.5,61.5,2024-04-15 18:26:00.000,2024-04-15,2024,4,15,44833,[],()
69880,45863,19516,2,37.0 $,2024-11-12;07:41:55 A.M.,NULL,37.0,37.0,74.0,2024-11-12 07:41:55.000,2024-11-12,2024,11,12,45863,[],()
72999,44810,19530,1,€ 19.0,09/05/24 17:40:20,,22.8,22.8,22.8,2024-09-05 17:40:20.000,2024-09-05,2024,9,5,44619,[],()
64186,46050,19389,1,22.75 $,06/01/25 11:41:52 am,,22.75,22.75,22.75,2025-06-01 11:41:52.000,2025-06-01,2025,6,1,46050,[],()
63201,44879,19502,1,USD 38.99,2024-11-24 05:43:40 P.M.,NULL,38.99,38.99,38.99,2024-11-24 17:43:40.000,2024-11-24,2024,11,24,44685,[],()
72462,45206,19222,1,$ 53.00,"15-June-2024, 10:35:53 PM",,53.0,53.0,53.0,2024-06-15 22:35:53.000,2024-06-15,2024,6,15,45206,[],()
67500,44879,19313,1,30.0$,2024-06-24;20:17,,30.0,30.0,30.0,2024-06-24 20:17:00.000,2024-06-24,2024,6,24,44685,[],()
70162,45524,19236,1,66.99 $, 7.01.2025  8:41:41,,66.99,66.99,66.99,2025-07-01 08:41:41.000,2025-07-01,2025,7,1,45524,[],()
65498,44950,19185,1,EUR 58.99,2024-08-21T00:57:17,NULL,70.788,70.788,70.79,2024-08-21 00:57:17.000,2024-08-21,2024,8,21,44950,[],()
66604,45564,18936,1,USD 62.75,20.12.2024  0:37:37,,62.75,62.75,62.75,2024-12-20 00:37:37.000,2024-12-20,2024,12,20,45564,[],()
69481,46870,19494,1,31.99 $,09:21;2025-05-10,"Apt. 860 462 Mann Station, New Eulah, WV 06469-1344",31.99,31.99,31.99,2025-05-10 09:21:00.000,2025-05-10,2025,5,10,46870,[],()
66545,46888,19325,2,$32.99,"10:03:45 pm,03/23/25",,32.99,32.99,65.98,2025-03-23 22:03:45.000,2025-03-23,2025,3,23,46888,[],()
64380,47274,19056,1,$ 24.00,2025-08-11;22:03:48,,24.0,24.0,24.0,2025-08-11 22:03:48.000,2025-08-11,2025,8,11,47274,[],()
68083,46695,19403,1,$ 50.75,06:16 02/10/25,,50.75,50.75,50.75,2025-02-10 06:16:00.000,2025-02-10,2025,2,10,46695,[],()
66428,47182,19086,1,75.$,08:57 2025-03-12,,75.0,75.0,75.0,2025-03-12 08:57:00.000,2025-03-12,2025,3,12,47182,[],()
73639,46749,19056,5,23.00 $,"17:02, 12-Mar-2025",,23.0,23.0,115.0,2025-03-12 17:02:00.000,2025-03-12,2025,3,12,46749,[],()
71116,47068,18922,1,14.75EUR,"29-September-2024,16:38:09","Apt. 641 4087 Elbert Rapids, South Hanghaven, OK 72880-4177",17.7,17.7,17.7,2024-09-29 16:38:09.000,2024-09-29,2024,9,29,47068,[],()
71300,44989,19565,3,68. USD,2025-08-29T06:50:51,"644 Schuppe Manors, Mayertown, VT 68494",68.0,68.0,204.0,2025-08-29 06:50:51.000,2025-08-29,2025,8,29,44989,[],()
66941,47100,19578,3,USD 44.99,2025-01-31T05:24:18.565,NULL,44.99,44.99,134.97,2025-01-31 05:24:18.565,2025-01-31,2025,1,31,47100,[],()
65546,44403,19168,1,64.00USD,2024-08-08T13:25:40.793,"Suite 351 44680 Adalberto Groves, Abernathyton, MA 75554",64.0,64.0,64.0,2024-08-08 13:25:40.793,2024-08-08,2024,8,8,44403,[],()
70633,45833,19280,2,USD45.00,"2025-01-30,10:43:33 P.M.",,45.0,45.0,90.0,2025-01-30 22:43:33.000,2025-01-30,2025,1,30,45833,[],()
69121,45000,19107,1,USD 70.5,2025-06-08T23:40:55.996,"Apt. 177 2538 Daniel Avenue, East Kristofermouth, WI 52206-0586",70.5,70.5,70.5,2025-06-08 23:40:55.996,2025-06-08,2025,6,8,45000,[],()
68675,47178,19315,2,58.5$,"22:47:58, 12-Jul-2024","6111 Krajcik Avenue, Jessietown, IL 61465-0515",58.5,58.5,117.0,2024-07-12 22:47:58.000,2024-07-12,2024,7,12,47178,[],()
72223,47305,19113,1,EUR74.0,20:51:44 11-October-2024,,88.8,88.8,88.8,2024-10-11 20:51:44.000,2024-10-11,2024,10,11,47305,[],()
64658,44415,18875,1,49.75€,"13:10,29-JAN-2025",,59.699999999999996,59.699999999999996,59.7,2025-01-29 13:10:00.000,2025-01-29,2025,1,29,44415,[],()
71232,45176,19306,4,34.25 €,"01:44:46 pm, 13-Apr-2025",NULL,41.1,41.1,164.4,2025-04-13 13:44:46.000,2025-04-13,2025,4,13,45176,[],()
71526,46890,19165,1,29.25USD,"2024-12-17,01:17:57","36563 Elwanda Plaza, Lake Mindy, ME 82126-2731",29.25,29.25,29.25,2024-12-17 01:17:57.000,2024-12-17,2024,12,17,46890,[],()
66018,45778,18991,1,$58.5,08:53:32 am; 2-Dec-2024,NULL,58.5,58.5,58.5,2024-12-02 08:53:32.000,2024-12-02,2024,12,2,45778,[],()
70892,44760,19448,1,USD 54.0,"14-OCT-2024,21:29:45",,54.0,54.0,54.0,2024-10-14 21:29:45.000,2024-10-14,2024,10,14,44760,[],()
65521,46437,19336,1,€46¢00,"05:41:41 am, 03/29/25","Suite 553 2462 Fabiola Shoal, Lake Thanh, ME 76171",5520.0,5520.0,5520.0,2025-03-29 05:41:41.000,2025-03-29,2025,3,29,46437,[],()
72616,45563,18995,1,€34.5,"2025-03-06,14:18",NULL,41.4,41.4,41.4,2025-03-06 14:18:00.000,2025-03-06,2025,3,6,45563,[],()
66835,47407,19243,1,USD41,2024-07-22T04:01:58.782,NULL,41.0,41.0,41.0,2024-07-22 04:01:58.782,2024-07-22,2024,7,22,47407,[],()
66078,44874,19474,4,$31¢99,"04/12/24, 12:00:48 am",,3199.0,3199.0,12796.0,2024-04-12 00:00:48.000,2024-04-12,2024,4,12,44874,[],()
70956,45581,19132,1,USD 65.00,09/17/24 02:31:15 A.M.,,65.0,65.0,65.0,2024-09-17 02:31:15.000,2024-09-17,2024,9,17,45581,[],()
71185,46363,19366,1,27.0 $,"07:48:29 A.M.,10-December-2024",,27.0,27.0,27.0,2024-12-10 07:48:29.000,2024-12-10,2024,12,10,46363,[],()
69003,45541,18917,1,68.99 $,07:52;2024-09-14,NULL,68.99,68.99,68.99,2024-09-14 07:52:00.000,2024-09-14,2024,9,14,45541,[],()
73750,44664,19053,1,$53¢00,04/05/25;11:34:28 pm,"361 Padberg Circles, Josueshire, IN 05808-6345",5300.0,5300.0,5300.0,2025-04-05 23:34:28.000,2025-04-05,2025,4,5,44664,[],()
64060,46292,18927,1,68.99USD,2024-09-11T16:47:23.180,NULL,68.99,68.99,68.99,2024-09-11 16:47:23.180,2024-09-11,2024,9,11,46292,[],()
71728,46161,19165,1,USD32.50,"03:18:46 PM,2024-12-13",,32.5,32.5,32.5,2024-12-13 15:18:46.000,2024-12-13,2024,12,13,46711,[],()
62758,45121,19246,1,21.USD,"24-Oct-2024,09:41:53","35124 Marquardt Prairie, Manuelport, TN 74769-2788",21.0,21.0,21.0,2024-10-24 09:41:53.000,2024-10-24,2024,10,24,45121,[],()
65051,44542,19320,1,USD 23.25,11:48:13 A.M. 10/13/24,,23.25,23.25,23.25,2024-10-13 11:48:13.000,2024-10-13,2024,10,13,44542,[],()
63019,44855,19161,1,$35.50,2025-01-15 07:04,,35.5,35.5,35.5,2025-01-15 07:04:00.000,2025-01-15,2025,1,15,44855,[],()
68210,46817,19527,2,USD75.50,"21:30:18,2024-11-02",,75.5,75.5,151.0,2024-11-02 21:30:18.000,2024-11-02,2024,11,2,46817,[],()
71585,46579,19533,1,USD 49.00,"01:14:08 AM,  1-February-2025",,49.0,49.0,49.0,2025-02-01 01:14:08.000,2025-02-01,2025,2,1,46579,[],()
73389,45524,19007,1,49.99$,2025-04-27T21:45:29.782,"Suite 740 17083 Jeramy Forge, West Paulina, TX 84836",49.99,49.99,49.99,2025-04-27 21:45:29.782,2025-04-27,2025,4,27,45524,[],()
66940,44983,18992,1,67.0$,2025-02-20;01:32,,67.0,67.0,67.0,2025-02-20 01:32:00.000,2025-02-20,2025,2,20,44983,[],()
73315,45847,19174,4,$ 32.,"10-Jun-2025, 08:28","Suite 624 56805 Jeffie Locks, South Mireyaview, SC 68975-2283",32.0,32.0,128.0,2025-06-10 08:28:00.000,2025-06-10,2025,6,10,45847,[],()
73002,47195,19260,1,73.99 €,"12-Dec-2024, 03:43:09 A.M.",NULL,88.788,88.788,88.79,2024-12-12 03:43:09.000,2024-12-12,2024,12,12,47195,[],()
68705,45922,18940,4,$19, 3-September-2024;01:29,,19.0,19.0,76.0,2024-09-03 01:29:00.000,2024-09-03,2024,9,3,45922,[],()
71573,46133,19034,1,46.5 EUR,"15:28:27,25-March-2025",NULL,55.8,55.8,55.8,2025-03-25 15:28:27.000,2025-03-25,2025,3,25,46133,[],()
73586,45992,19097,1,$ 66.00,23:07;2024-06-28,NULL,66.0,66.0,66.0,2024-06-28 23:07:00.000,2024-06-28,2024,6,28,45992,[],()
71494,46852,18840,1,€45¢75,14-August-2024 05:05:56 am,,5490.0,5490.0,5490.0,2024-08-14 05:05:56.000,2024-08-14,2024,8,14,46852,[],()
72174,46666,19274,2,76.00 €,19-May-2025;15:18,NULL,91.2,91.2,182.4,2025-05-19 15:18:00.000,2025-05-19,2025,5,19,46666,[],()
69441,45555,19584,1,43.50 $,2024-11-06T17:37:05,,43.5,43.5,43.5,2024-11-06 17:37:05.000,2024-11-06,2024,11,6,45555,[],()
67566,45819,19187,1,€59.75,04:53:14 pm;2024-10-17,,71.7,71.7,71.7,2024-10-17 16:53:14.000,2024-10-17,2024,10,17,47251,[],()
69045,46779,18977,3,33.99€,"30-Jun-2024, 07:03:35 PM",,40.788000000000004,40.788000000000004,122.36,2024-06-30 19:03:35.000,2024-06-30,2024,6,30,46779,[],()
65911,45508,18944,1,14.99 €,2024-10-29T10:56:03,NULL,17.988,17.988,17.99,2024-10-29 10:56:03.000,2024-10-29,2024,10,29,45508,[],()
67911,47017,19309,1,EUR68.99,"05/24/25,07:36:39 pm","Suite 437 234 Metz Land, Robinborough, TX 07017",82.788,82.788,82.79,2025-05-24 19:36:39.000,2025-05-24,2025,5,24,47017,[],()
64786,47488,19356,1,$ 49.25,"2024-09-02,04:45:50 P.M.",,49.25,49.25,49.25,2024-09-02 16:45:50.000,2024-09-02,2024,9,2,47488,[],()
72531,46684,18871,4,59 $,2024-06-30;14:26,NULL,59.0,59.0,236.0,2024-06-30 14:26:00.000,2024-06-30,2024,6,30,46684,[],()
65419,47402,19116,1,17.25$,14:46;2024-11-28,,17.25,17.25,17.25,2024-11-28 14:46:00.000,2024-11-28,2024,11,28,47402,[],()
69283,46374,19306,1,39.0$,"03:00:34 PM, 23-Feb-2025",,39.0,39.0,39.0,2025-02-23 15:00:34.000,2025-02-23,2025,2,23,46374,[],()
69369,46312,19554,1,60.50 $,2024-07-04T05:48:21,,60.5,60.5,60.5,2024-07-04 05:48:21.000,2024-07-04,2024,7,4,46312,[],()
66676,46077,19558,2,USD28.5,2024-08-11;08:14:36 pm,NULL,28.5,28.5,57.0,2024-08-11 20:14:36.000,2024-08-11,2024,8,11,46077,[],()
70975,47114,19447,1,€28.25,03/24/25;07:09,,33.9,33.9,33.9,2025-03-24 07:09:00.000,2025-03-24,2025,3,24,47114,[],()
70615,45675,19455,1,$ 13.25,2024-10-16T19:40:10,,13.25,13.25,13.25,2024-10-16 19:40:10.000,2024-10-16,2024,10,16,44398,[],()
67684,46412,19267,1,$20.75,"22:43:11,11/08/24",NULL,20.75,20.75,20.75,2024-11-08 22:43:11.000,2024-11-08,2024,11,8,46412,[],()
72591,47494,19081,1,15.75USD,20-Oct-2024 11:00:18 AM,,15.75,15.75,15.75,2024-10-20 11:00:18.000,2024-10-20,2024,10,20,47494,[],()
65285,44452,18969,2,43$,01:11:30 P.M. 2024-09-18,"Apt. 460 6773 Armando Gardens, Port Harold, FL 81026-2358",43.0,43.0,86.0,2024-09-18 13:11:30.000,2024-09-18,2024,9,18,44452,[],()
72723,46925,18936,1,EUR 63.99,04/18/25 09:52:20 am,,76.788,76.788,76.79,2025-04-18 09:52:20.000,2025-04-18,2025,4,18,46925,[],()
66172,47435,19418,1,$59¢99,29-Jul-2024;11:58:46 pm,NULL,5999.0,5999.0,5999.0,2024-07-29 23:58:46.000,2024-07-29,2024,7,29,47435,[],()
65211,45715,19204,1,47.EUR,"2024-11-30, 11:05:24 AM",,56.4,56.4,56.4,2024-11-30 11:05:24.000,2024-11-30,2024,11,30,45715,[],()
70299,46305,18877,1,47€00¢,11:48:50;2024-08-26,NULL,5640.0,5640.0,5640.0,2024-08-26 11:48:50.000,2024-08-26,2024,8,26,46305,[],()
63637,46196,19003,1,€ 35.0, 7-Sep-2024;18:45:06,"Apt. 858 1090 Cordia Spurs, East Mistie, OH 62889-6932",42.0,42.0,42.0,2024-09-07 18:45:06.000,2024-09-07,2024,9,7,46196,[],()
73841,46647,19540,1,$68,"06:37:11,08/13/24","1487 Nikolaus Flat, West Rubinstad, NY 47647",68.0,68.0,68.0,2024-08-13 06:37:11.000,2024-08-13,2024,8,13,46647,[],()
67958,45510,19326,1,29. USD,2024-09-07T10:12:18,NULL,29.0,29.0,29.0,2024-09-07 10:12:18.000,2024-09-07,2024,9,7,45510,[],()
67333,45949,18951,1,EUR 69.00,06:55 03/10/25,,82.8,82.8,82.8,2025-03-10 06:55:00.000,2025-03-10,2025,3,10,45949,[],()
66666,45811,19018,1,€13¢99,"11/08/24,02:22:46 P.M.",,1678.8,1678.8,1678.8,2024-11-08 14:22:46.000,2024-11-08,2024,11,8,45811,[],()
65679,47583,19448,5,57.99 $,08:33:48 25-FEB-2025,,57.99,57.99,289.95,2025-02-25 08:33:48.000,2025-02-25,2025,2,25,47583,[],()
71058,47467,19084,1,$ 50.75, 6-SEP-2024 02:35:14 PM,,50.75,50.75,50.75,2024-09-06 14:35:14.000,2024-09-06,2024,9,6,47467,[],()
73340,46628,19095,1,$64.50,"19:23:08, 2025-07-17",,64.5,64.5,64.5,2025-07-17 19:23:08.000,2025-07-17,2025,7,17,46628,[],()
73867,44577,19441,1,17.25 $,23.10.2024 17:41:41,"539 Klocko Alley, West Jamison, WV 96625",17.25,17.25,17.25,2024-10-23 17:41:41.000,2024-10-23,2024,10,23,44577,[],()
71333,47111,19222,1,55.0 $,01/01/25;02:09:16 am,"44426 Mann Junction, East Ruthe, WY 17390-1199",55.0,55.0,55.0,2025-01-01 02:09:16.000,2025-01-01,2025,1,1,47111,[],()
67567,44537,18980,1,62.0 USD,"2024-07-16, 07:07:41 AM",NULL,62.0,62.0,62.0,2024-07-16 07:07:41.000,2024-07-16,2024,7,16,44537,[],()
66608,45644,18921,1,44.00USD,00:37:36;08/19/24,NULL,44.0,44.0,44.0,2024-08-19 00:37:36.000,2024-08-19,2024,8,19,45644,[],()
65542,45906,19565,1,70.99USD," 2-January-2025, 22:50:10",NULL,70.99,70.99,70.99,2025-01-02 22:50:10.000,2025-01-02,2025,1,2,45906,[],()
72263,45760,19544,3,$ 39.50,2025-06-16 05:03:58 A.M.,,39.5,39.5,118.5,2025-06-16 05:03:58.000,2025-06-16,2025,6,16,45760,[],()
67054,47548,19129,1,USD 23.50,16:29:44 27-OCT-2024,,23.5,23.5,23.5,2024-10-27 16:29:44.000,2024-10-27,2024,10,27,47548,[],()
69372,47159,19568,5,47 USD,"07:12:46 pm,2025-01-05",,47.0,47.0,235.0,2025-01-05 19:12:46.000,2025-01-05,2025,1,5,45146,[],()
71343,44900,19557,1,USD53.0,"14:10, 2024-09-17",,53.0,53.0,53.0,2024-09-17 14:10:00.000,2024-09-17,2024,9,17,44900,[],()
68884,46749,18995,1,USD31,"22:45,14-July-2024","Suite 863 9780 Tromp Parkways, Randellfort, OH 22811-9532",31.0,31.0,31.0,2024-07-14 22:45:00.000,2024-07-14,2024,7,14,46749,[],()
67181,45174,19100,1,USD 19.25,"07/21/24, 20:03:17",,19.25,19.25,19.25,2024-07-21 20:03:17.000,2024-07-21,2024,7,21,45174,[],()
70161,47586,19468,1,$40,2024-07-13T16:33:31.713,,40.0,40.0,40.0,2024-07-13 16:33:31.713,2024-07-13,2024,7,13,47586,[],()
69379,46609,19089,1,48.99USD,"21:11:52,2025-01-06",,48.99,48.99,48.99,2025-01-06 21:11:52.000,2025-01-06,2025,1,6,46609,[],()
66264,46840,19240,1,$ 68.5,2024-09-13T13:18:52.069,,68.5,68.5,68.5,2024-09-13 13:18:52.069,2024-09-13,2024,9,13,46840,[],()
64429,47544,19348,1,$30.99,09:40:44;01/09/25,,30.99,30.99,30.99,2025-01-09 09:40:44.000,2025-01-09,2025,1,9,47544,[],()
67393,47249,19174,1,$32.25,"2024-11-14, 22:21",,32.25,32.25,32.25,2024-11-14 22:21:00.000,2024-11-14,2024,11,14,46700,[],()
64189,47000,19043,1,€16¢75," 4-March-2025,00:27","Apt. 973 6559 Dare Centers, Hoegerhaven, ME 53034-7047",2010.0,2010.0,2010.0,2025-03-04 00:27:00.000,2025-03-04,2025,3,4,47000,[],()
73609,46497,19139,1,60.25USD,2024-12-04 22:26:34,"Apt. 158 707 Leroy Drive, New Keenanport, WI 44546",60.25,60.25,60.25,2024-12-04 22:26:34.000,2024-12-04,2024,12,4,46497,[],()
68724,45000,19012,1,42.99$,"10-OCT-2024,05:41:44 PM",,42.99,42.99,42.99,2024-10-10 17:41:44.000,2024-10-10,2024,10,10,45000,[],()
72885,46344,19497,1,USD 57.00,26-May-2025;07:31:25 PM,,57.0,57.0,57.0,2025-05-26 19:31:25.000,2025-05-26,2025,5,26,46344,[],()
66392,46844,19498,2,USD 49.5,"05:57, 2024-09-03",,49.5,49.5,99.0,2024-09-03 05:57:00.000,2024-09-03,2024,9,3,46844,[],()
67048,47344,19139,1,EUR 56.99,2024-08-10;14:39:53,"2013 Crooks Terrace, South Martha, NH 84406-6951",68.388,68.388,68.39,2024-08-10 14:39:53.000,2024-08-10,2024,8,10,47344,[],()
67227,45522,19439,1,€ 72.50,"07:27:28, 12/18/24","Suite 682 7178 Gavin Trace, Cummingsville, VA 62547",87.0,87.0,87.0,2024-12-18 07:27:28.000,2024-12-18,2024,12,18,45522,[],()
62913,47528,19440,2,€30¢25,"17:33:54,  2-August-2024",,3630.0,3630.0,7260.0,2024-08-02 17:33:54.000,2024-08-02,2024,8,2,47528,[],()
73519,44529,18986,2,61$99¢,"16:38:51, 2024-11-03",,6199.0,6199.0,12398.0,2024-11-03 16:38:51.000,2024-11-03,2024,11,3,44529,[],()
73127,46889,19474,1,USD34.5,13:36:47  8-Nov-2024,,34.5,34.5,34.5,2024-11-08 13:36:47.000,2024-11-08,2024,11,8,46889,[],()
63692,46016,19276,1,€17¢00,2024-08-15T13:31:36.440,NULL,2040.0,2040.0,2040.0,2024-08-15 13:31:36.440,2024-08-15,2024,8,15,46016,[],()
67415,45679,19319,3,36.5 EUR,12:45:14 am 04/11/25,,43.8,43.8,131.4,2025-04-11 00:45:14.000,2025-04-11,2025,4,11,45679,[],()
71286,45013,19055,3,€ 19.50,"09:49:37 P.M., 05/09/24",,23.4,23.4,70.2,2024-05-09 21:49:37.000,2024-05-09,2024,5,9,45013,[],()
73285,44352,18917,1,68 USD,2024-11-17T18:21:46,NULL,68.0,68.0,68.0,2024-11-17 18:21:46.000,2024-11-17,2024,11,17,44352,[],()
64306,45194,19504,1,$ 60.50,"04/20/24, 19:14",,60.5,60.5,60.5,2024-04-20 19:14:00.000,2024-04-20,2024,4,20,45194,[],()
72325,45763,19477,1,40.5USD,2025-05-03 04:49:23,,40.5,40.5,40.5,2025-05-03 04:49:23.000,2025-05-03,2025,5,3,45763,[],()
72967,44670,19205,1,USD 16.5,"21-AUG-2024, 22:41",,16.5,16.5,16.5,2024-08-21 22:41:00.000,2024-08-21,2024,8,21,44670,[],()
71475,45445,18986,1,EUR65.50,2025-06-13T02:42:11,NULL,78.6,78.6,78.6,2025-06-13 02:42:11.000,2025-06-13,2025,6,13,45445,[],()
69267,45564,19496,1,EUR 30.25,10/09/24 03:55,,36.3,36.3,36.3,2024-10-09 03:55:00.000,2024-10-09,2024,10,9,45564,[],()
73762,45541,19476,2,$ 16.," 8-September-2024, 10:17",,16.0,16.0,32.0,2024-09-08 10:17:00.000,2024-09-08,2024,9,8,45541,[],()
71178,45888,19049,1,USD58.75,2024-06-14T06:04:56.572,NULL,58.75,58.75,58.75,2024-06-14 06:04:56.572,2024-06-14,2024,6,14,45888,[],()
64258,45921,18859,1,USD 56.5,2024-07-23 11:20:58,NULL,56.5,56.5,56.5,2024-07-23 11:20:58.000,2024-07-23,2024,7,23,45921,[],()
73940,45677,18934,1,$ 18.0,2024-12-17T11:37:23.628,"Apt. 120 24570 Thiel Haven, Leonorburgh, OH 37052",18.0,18.0,18.0,2024-12-17 11:37:23.628,2024-12-17,2024,12,17,45677,[],()
67121,46844,18983,1,EUR36.0,"06:05,29-SEP-2024",,43.199999999999996,43.199999999999996,43.2,2024-09-29 06:05:00.000,2024-09-29,2024,9,29,46844,[],()
66216,44774,19008,1,49 $,"01/26/25,09:54:32","Apt. 441 353 Borer Dam, Maeganstad, IL 79653",49.0,49.0,49.0,2025-01-26 09:54:32.000,2025-01-26,2025,1,26,44774,[],()
72176,44699,19104,1,$55.99,"2024-11-11, 15:29",,55.99,55.99,55.99,2024-11-11 15:29:00.000,2024-11-11,2024,11,11,44699,[],()
70100,47470,19425,1,$45,"07/14/24, 05:42:43",NULL,45.0,45.0,45.0,2024-07-14 05:42:43.000,2024-07-14,2024,7,14,47470,[],()
73542,45114,19077,1,USD 40.50,2025-03-31T16:08:13.407,NULL,40.5,40.5,40.5,2025-03-31 16:08:13.407,2025-03-31,2025,3,31,45114,[],()
66775,44855,19421,1,EUR 23.25,"13:50:10,2025-03-13",,27.9,27.9,27.9,2025-03-13 13:50:10.000,2025-03-13,2025,3,13,44855,[],()
73920,44622,19273,1,42.75$,"23-Nov-2024,22:49:09",,42.75,42.75,42.75,2024-11-23 22:49:09.000,2024-11-23,2024,11,23,44622,[],()
73487,47530,19443,2,€28,07:17 30-Sep-2024,"Suite 332 440 Maurice Crossroad, Port Akilah, HI 57077-7615",33.6,33.6,67.2,2024-09-30 07:17:00.000,2024-09-30,2024,9,30,47530,[],()
73872,45886,18956,1,$52¢50,"30-SEP-2024, 13:40",,5250.0,5250.0,5250.0,2024-09-30 13:40:00.000,2024-09-30,2024,9,30,45886,[],()
63322,47389,19311,1,67.0USD,2024-12-29T16:04:45.457,,67.0,67.0,67.0,2024-12-29 16:04:45.457,2024-12-29,2024,12,29,47389,[],()
73644,44514,19340,1,32.0 USD,07:36 08/26/24,NULL,32.0,32.0,32.0,2024-08-26 07:36:00.000,2024-08-26,2024,8,26,44514,[],()
68982,47099,19429,2,68.25 USD,2025-07-24T10:30:14,NULL,68.25,68.25,136.5,2025-07-24 10:30:14.000,2025-07-24,2025,7,24,47099,[],()
65964,45243,19343,4,EUR74.0,03:43:48 2024-04-05,NULL,88.8,88.8,355.2,2024-04-05 03:43:48.000,2024-04-05,2024,4,5,45243,[],()
72215,47088,19013,1,$ 49.25,03/11/25;13:54:01,,49.25,49.25,49.25,2025-03-11 13:54:01.000,2025-03-11,2025,3,11,47088,[],()
63088,47074,18873,1,72.0EUR,2025-07-03 12:24:45 am,"955 Kirlin Parkways, Lake Chan, AK 17376",86.39999999999999,86.39999999999999,86.4,2025-07-03 00:24:45.000,2025-07-03,2025,7,3,46580,[],()
69252,44418,19224,2,$59.00,"2024-09-19,11:28:14 A.M.",NULL,59.0,59.0,118.0,2024-09-19 11:28:14.000,2024-09-19,2024,9,19,44418,[],()
68510,47507,18994,3,39€99¢,08:35:29 AM 11/23/24,,4798.8,4798.8,14396.4,2024-11-23 08:35:29.000,2024-11-23,2024,11,23,47507,[],()
67650,44818,19094,3,49.5 USD,"16:30, 08/14/24",NULL,49.5,49.5,148.5,2024-08-14 16:30:00.000,2024-08-14,2024,8,14,46526,[],()
67124,45176,18956,1,53.5$,"14-Jul-2025,07:22:48",,53.5,53.5,53.5,2025-07-14 07:22:48.000,2025-07-14,2025,7,14,45176,[],()
65803,45956,19198,1,46.25$,"10:31:59 A.M., 02/15/25",NULL,46.25,46.25,46.25,2025-02-15 10:31:59.000,2025-02-15,2025,2,15,45956,[],()
63546,46925,18842,1,€ 59.0,2025-03-10 11:28:23 AM,NULL,70.8,70.8,70.8,2025-03-10 11:28:23.000,2025-03-10,2025,3,10,46925,[],()
69464,44738,19508,1,$33¢25,03/17/25 11:08:48 P.M.,NULL,3325.0,3325.0,3325.0,2025-03-17 23:08:48.000,2025-03-17,2025,3,17,44738,[],()
65992,46083,19568,1,47$75¢,"09:27, 29-Jan-2025",,4775.0,4775.0,4775.0,2025-01-29 09:27:00.000,2025-01-29,2025,1,29,46083,[],()
67464,46351,18930,4,33.50 USD,"19:32, 4-JUL-2024","2199 Prohaska Rest, Terryfort, WY 30783",33.5,33.5,134.0,2024-07-04 19:32:00.000,2024-07-04,2024,7,4,46351,[],()
73545,44711,19383,1,60.75USD,21:00 2025-04-23,"1669 Mai Skyway, South Coraliefort, SC 51908",60.75,60.75,60.75,2025-04-23 21:00:00.000,2025-04-23,2025,4,23,44711,[],()
68886,45805,19330,2,58EUR,09:40:42 P.M. 07/05/24,,69.6,69.6,139.2,2024-07-05 21:40:42.000,2024-07-05,2024,7,5,45805,[],()
70853,47264,19229,1,21.75 €,21-JAN-2025;04:49:00,,26.099999999999998,26.099999999999998,26.1,2025-01-21 04:49:00.000,2025-01-21,2025,1,21,47264,[],()
69972,45794,18857,1,72€,"06:08,  9-Apr-2025",NULL,86.39999999999999,86.39999999999999,86.4,2025-04-09 06:08:00.000,2025-04-09,2025,4,9,45794,[],()
71543,47106,18889,1,76$25¢,"11/22/24, 00:19",,7625.0,7625.0,7625.0,2024-11-22 00:19:00.000,2024-11-22,2024,11,22,47106,[],()
73104,45856,18852,1,USD 14.00,2025-02-13 08:44,,14.0,14.0,14.0,2025-02-13 08:44:00.000,2025-02-13,2025,2,13,46436,[],()
70309,45222,19230,1,60.5€,"27-February-2025, 12:48:20 A.M.",NULL,72.6,72.6,72.6,2025-02-27 00:48:20.000,2025-02-27,2025,2,27,45222,[],()
69082,46764,19430,1,USD 52.50,2024-06-13 18:31,NULL,52.5,52.5,52.5,2024-06-13 18:31:00.000,2024-06-13,2024,6,13,46764,[],()
71678,47112,19426,1,USD43.0,2025-05-04;10:56:43,"91023 Homenick Station, West Barryland, WV 79948-9542",43.0,43.0,43.0,2025-05-04 10:56:43.000,2025-05-04,2025,5,4,47112,[],()
72153,45385,19504,4,63.25€,"2024-07-14, 05:04",,75.89999999999999,75.89999999999999,303.6,2024-07-14 05:04:00.000,2024-07-14,2024,7,14,45385,[],()
66077,44574,19015,4,€ 59.,13:52;13-Jan-2025,"638 Merrie Plain, North Darinstad, TN 95854-6741",70.8,70.8,283.2,2025-01-13 13:52:00.000,2025-01-13,2025,1,13,44574,[],()
65655,45457,18975,2,53.5 USD,21:44:26 12/03/24,,53.5,53.5,107.0,2024-12-03 21:44:26.000,2024-12-03,2024,12,3,45457,[],()
73152,46960,19374,2,$19¢00,"12/25/24, 04:01:41",NULL,1900.0,1900.0,3800.0,2024-12-25 04:01:41.000,2024-12-25,2024,12,25,46354,[],()
66955,45630,19439,1,€73¢25,"06/15/25, 09:46:35 A.M.","Apt. 662 25839 Maxwell Valley, Port Zachariah, AR 15403-3302",8790.0,8790.0,8790.0,2025-06-15 09:46:35.000,2025-06-15,2025,6,15,45630,[],()
68431,44493,19319,1,USD36.25,"02/16/25,12:08:07 P.M.",,36.25,36.25,36.25,2025-02-16 12:08:07.000,2025-02-16,2025,2,16,44493,[],()
67493,46428,19197,1,$43.25,"10/24/24,03:44:22",,43.25,43.25,43.25,2024-10-24 03:44:22.000,2024-10-24,2024,10,24,46428,[],()
65389,45088,18954,2,USD 32.0,"03/02/25, 21:53","9984 Kohler Trace, South Gilbert, NM 56438",32.0,32.0,64.0,2025-03-02 21:53:00.000,2025-03-02,2025,3,2,45088,[],()
69643,45990,19106,1,USD 48.25,2025-04-18;19:37:08,"89764 Karan Camp, Jamalville, IL 11917",48.25,48.25,48.25,2025-04-18 19:37:08.000,2025-04-18,2025,4,18,45990,[],()
66485,45423,18891,1,EUR23.50,05:19:59 P.M.;2024-06-03,NULL,28.2,28.2,28.2,2024-06-03 17:19:59.000,2024-06-03,2024,6,3,45423,[],()
72080,45352,19123,2,52.99 EUR,17-June-2024 07:23:04 A.M.,,63.588,63.588,127.18,2024-06-17 07:23:04.000,2024-06-17,2024,6,17,45352,[],()
65698,46439,19092,1,$50.,07:37:25 12/07/24,,50.0,50.0,50.0,2024-12-07 07:37:25.000,2024-12-07,2024,12,7,46439,[],()
64374,45132,18850,1,34.50USD,2025-01-05T16:21:46,,34.5,34.5,34.5,2025-01-05 16:21:46.000,2025-01-05,2025,1,5,45132,[],()
72518,47161,19560,1,29.99EUR,09:51; 4-May-2025,NULL,35.988,35.988,35.99,2025-05-04 09:51:00.000,2025-05-04,2025,5,4,47161,[],()
70099,47003,18944,1,USD 14.0, 5-Dec-2024;06:15:36 PM,,14.0,14.0,14.0,2024-12-05 18:15:36.000,2024-12-05,2024,12,5,47003,[],()
63475,46608,19433,2,€71¢25,11:00:51;24-Feb-2025,,8550.0,8550.0,17100.0,2025-02-24 11:00:51.000,2025-02-24,2025,2,24,46608,[],()
64050,44871,19481,1,$64.00,06:13:35 P.M. 16-June-2025,NULL,64.0,64.0,64.0,2025-06-16 18:13:35.000,2025-06-16,2025,6,16,44871,[],()
63577,46996,19474,1,€32¢50,2025-06-04T06:06:06,"Suite 257 7562 Ron Fort, Meliaborough, RI 67819",3900.0,3900.0,3900.0,2025-06-04 06:06:06.000,2025-06-04,2025,6,4,46996,[],()
63295,47599,19467,1,74.5 €,09:29:07 AM  7-June-2024,,89.39999999999999,89.39999999999999,89.4,2024-06-07 09:29:07.000,2024-06-07,2024,6,7,47599,[],()
73435,44709,19089,1,52.0USD,14-NOV-2024;17:41,,52.0,52.0,52.0,2024-11-14 17:41:00.000,2024-11-14,2024,11,14,44709,[],()
69716,46436,19545,1,49.5EUR,"07:42,2025-05-29",,59.4,59.4,59.4,2025-05-29 07:42:00.000,2025-05-29,2025,5,29,46436,[],()
69981,46201,18867,2,55.5$,"19-December-2024,14:07:59","Apt. 627 54011 Argelia Dale, Port Renataland, NM 91711",55.5,55.5,111.0,2024-12-19 14:07:59.000,2024-12-19,2024,12,19,46201,[],()
66291,47282,18960,1,30.50$, 4-JUN-2024;08:33,"Suite 398 9885 Rolland Crescent, North Ona, VA 02994",30.5,30.5,30.5,2024-06-04 08:33:00.000,2024-06-04,2024,6,4,47282,[],()
69641,44705,19184,3,$16.50,2025-06-08T05:46:29.632,,16.5,16.5,49.5,2025-06-08 05:46:29.632,2025-06-08,2025,6,8,44705,[],()
71958,46959,18955,1,USD67.99,01/21/25 06:58:44,"Apt. 417 8075 Enriqueta Pines, Lucinaberg, MD 96464-3899",67.99,67.99,67.99,2025-01-21 06:58:44.000,2025-01-21,2025,1,21,46959,[],()
71014,45231,19085,1,$ 56.0,17.12.2024 06:41:41,,56.0,56.0,56.0,2024-12-17 06:41:41.000,2024-12-17,2024,12,17,45231,[],()
66024,45445,19038,1,$61.50,2024-10-25T20:38:23.253,NULL,61.5,61.5,61.5,2024-10-25 20:38:23.253,2024-10-25,2024,10,25,45445,[],()
64890,46297,19151,4,USD40.,12:57 04/18/25,,40.0,40.0,160.0,2025-04-18 12:57:00.000,2025-04-18,2025,4,18,46297,[],()
68239,47360,19385,1,17.99USD,"07:54:28 AM, 2024-09-17",NULL,17.99,17.99,17.99,2024-09-17 07:54:28.000,2024-09-17,2024,9,17,47360,[],()
67778,44529,18867,1,54.25 $,2024-11-09T01:50:03,NULL,54.25,54.25,54.25,2024-11-09 01:50:03.000,2024-11-09,2024,11,9,44529,[],()
65213,46403,18846,1,USD20.0,"02/10/25, 15:20","270 Nathanial Burg, East Kandis, NV 06358-0153",20.0,20.0,20.0,2025-02-10 15:20:00.000,2025-02-10,2025,2,10,46403,[],()
72110,44637,18968,2,69EUR,"03:08:31 P.M.,12/04/24",,82.8,82.8,165.6,2024-12-04 15:08:31.000,2024-12-04,2024,12,4,44637,[],()
73599,45039,18917,2,66.25USD,"20:24:06, 08/23/25","Apt. 676 12220 Zemlak Avenue, Allysonport, VT 58780",66.25,66.25,132.5,2025-08-23 20:24:06.000,2025-08-23,2025,8,23,45039,[],()
66996,46776,19242,1,USD 46.50,Mon Jun 23 22:18:28 2025,"Apt. 368 608 Emmerich Mountain, Lake Dariofurt, OK 20563-5232",46.5,46.5,46.5,2025-06-23 22:18:28.000,2025-06-23,2025,6,23,46776,[],()
66306,46088,19010,1,USD64.00,07/21/25 11:52,,64.0,64.0,64.0,2025-07-21 11:52:00.000,2025-07-21,2025,7,21,46088,[],()
67114,47135,19540,1,USD 70.,19:58:05 06/13/25,NULL,70.0,70.0,70.0,2025-06-13 19:58:05.000,2025-06-13,2025,6,13,47135,[],()
66243,44882,18974,3,39.50USD,"11/08/24, 17:32:47",,39.5,39.5,118.5,2024-11-08 17:32:47.000,2024-11-08,2024,11,8,44882,[],()
64859,45075,19015,1,$58.0," 1-JAN-2025, 00:28",,58.0,58.0,58.0,2025-01-01 00:28:00.000,2025-01-01,2025,1,1,45075,[],()
73175,47251,19129,1,USD 25.5,"30-MAY-2024,05:06:13","Apt. 202 74428 Leffler Ways, West Randa, SD 51766",25.5,25.5,25.5,2024-05-30 05:06:13.000,2024-05-30,2024,5,30,47251,[],()
64038,45547,19559,1,$69¢50,09:01:24 21-NOV-2024,,6950.0,6950.0,6950.0,2024-11-21 09:01:24.000,2024-11-21,2024,11,21,45547,[],()
69908,44402,19204,3,$ 49.50,"08/02/24,09:39","720 Emmett Plaza, Jamieport, KS 86141",49.5,49.5,148.5,2024-08-02 09:39:00.000,2024-08-02,2024,8,2,44402,[],()
70604,44746,19007,1,51.0€,2024-10-18T23:41:10,,61.199999999999996,61.199999999999996,61.2,2024-10-18 23:41:10.000,2024-10-18,2024,10,18,44746,[],()
73500,45727,19309,1,€68¢75,2025-01-19T23:12:22.051,NULL,8250.0,8250.0,8250.0,2025-01-19 23:12:22.051,2025-01-19,2025,1,19,45727,[],()
66315,46657,18904,5,34.75 $,"15:05:06, 30-October-2024",,34.75,34.75,173.75,2024-10-30 15:05:06.000,2024-10-30,2024,10,30,46657,[],()
71819,47458,18950,1,48.75 €,06/14/24;07:27,NULL,58.5,58.5,58.5,2024-06-14 07:27:00.000,2024-06-14,2024,6,14,47458,[],()
69623,46790,19128,2,USD 71.5,18-Jan-2025 10:57:15,,71.5,71.5,143.0,2025-01-18 10:57:15.000,2025-01-18,2025,1,18,46790,[],()
66382,46759,19455,1,17€25¢,"04:13:26 AM,17-Dec-2024",,2070.0,2070.0,2070.0,2024-12-17 04:13:26.000,2024-12-17,2024,12,17,46759,[],()
68062,46784,19184,1,19.99 €,2024-10-04T17:14:41,,23.987999999999996,23.987999999999996,23.99,2024-10-04 17:14:41.000,2024-10-04,2024,10,4,46784,[],()
71362,47133,19445,2,61.75$,"16:24, 03/06/25",,61.75,61.75,123.5,2025-03-06 16:24:00.000,2025-03-06,2025,3,6,47133,[],()
67935,46382,19220,1,USD 59.50,"12:45, 2025-05-20",,59.5,59.5,59.5,2025-05-20 12:45:00.000,2025-05-20,2025,5,20,46382,[],()
63192,47444,19429,1,USD 69.75,"2025-05-24, 07:31:34 A.M.",,69.75,69.75,69.75,2025-05-24 07:31:34.000,2025-05-24,2025,5,24,47444,[],()
67203,45792,19030,1,24$75¢,"01/25/25, 10:06:15 AM",NULL,2475.0,2475.0,2475.0,2025-01-25 10:06:15.000,2025-01-25,2025,1,25,45792,[],()
72155,44847,19383,1,$ 62.25,"07/01/25,12:10","Apt. 465 6924 Mayer Forges, Pourosmouth, MA 05075",62.25,62.25,62.25,2025-07-01 12:10:00.000,2025-07-01,2025,7,1,44847,[],()
67979,44668,19521,1,$15.0,2024-07-20T07:42:29,"880 Cormier Trafficway, Lake Abbyton, NM 64905",15.0,15.0,15.0,2024-07-20 07:42:29.000,2024-07-20,2024,7,20,44668,[],()
69790,46154,19359,1,50.25$,07/30/25 03:18:47,,50.25,50.25,50.25,2025-07-30 03:18:47.000,2025-07-30,2025,7,30,46154,[],()
69787,45104,18965,1,$62.99,03:02 2025-01-30,"67051 Lucrecia Greens, Lake Burtonchester, TN 95808-6533",62.99,62.99,62.99,2025-01-30 03:02:00.000,2025-01-30,2025,1,30,45104,[],()
69060,46764,19074,1,USD72.0,10.09.2024 23:08:08,"39517 Sammy Brooks, Olsonchester, CO 78383",72.0,72.0,72.0,2024-10-09 23:08:08.000,2024-10-09,2024,10,9,46764,[],()
62802,45737,19170,2,72EUR,"21:57:03,01/28/25",NULL,86.39999999999999,86.39999999999999,172.8,2025-01-28 21:57:03.000,2025-01-28,2025,1,28,45529,[],()
66654,46419,19143,2,31.00USD,14:49:45 2025-06-29,,31.0,31.0,62.0,2025-06-29 14:49:45.000,2025-06-29,2025,6,29,46419,[],()
63543,45397,18956,2,54.50USD,2024-10-14T16:48:08.111,,54.5,54.5,109.0,2024-10-14 16:48:08.111,2024-10-14,2024,10,14,45397,[],()
65909,47322,19141,1,51.99 $,2024-09-12T09:35:10.696,NULL,51.99,51.99,51.99,2024-09-12 09:35:10.696,2024-09-12,2024,9,12,47322,[],()
66983,46727,19257,1,69.50 €,21:51 2024-09-06,,83.39999999999999,83.39999999999999,83.4,2024-09-06 21:51:00.000,2024-09-06,2024,9,6,46727,[],()
64919,45845,19482,1,EUR 27,"10:37,12/31/24",,32.4,32.4,32.4,2024-12-31 10:37:00.000,2024-12-31,2024,12,31,45845,[],()
71149,46555,19267,1,17$00¢,"2024-08-22, 03:01:18 AM","986 Keebler Keys, Purdytown, ME 23731-6143",1700.0,1700.0,1700.0,2024-08-22 03:01:18.000,2024-08-22,2024,8,22,46555,[],()
69774,45969,19180,1,€43¢99,01:38:55  2-NOV-2024,,5278.8,5278.8,5278.8,2024-11-02 01:38:55.000,2024-11-02,2024,11,2,45969,[],()
66133,44548,19245,1,67.99 EUR,"2025-02-06, 03:28:24",NULL,81.588,81.588,81.59,2025-02-06 03:28:24.000,2025-02-06,2025,2,6,47207,[],()
72713,47511,19146,1,$68¢75, 7-November-2024 02:56:07,,6875.0,6875.0,6875.0,2024-11-07 02:56:07.000,2024-11-07,2024,11,7,47511,[],()
63874,45936,19033,1,€33.99,12/25/24;04:29,,40.788000000000004,40.788000000000004,40.79,2024-12-25 04:29:00.000,2024-12-25,2024,12,25,45936,[],()
65485,44949,19273,2,45.25EUR,04/05/24 10:52:41 PM,NULL,54.3,54.3,108.6,2024-04-05 22:52:41.000,2024-04-05,2024,4,5,44949,[],()
73214,45807,19579,1,22.75USD,"28-Feb-2025,08:56",,22.75,22.75,22.75,2025-02-28 08:56:00.000,2025-02-28,2025,2,28,45807,[],()
65458,45075,19226,1,25.0 $,04:58;2024-08-18,,25.0,25.0,25.0,2024-08-18 04:58:00.000,2024-08-18,2024,8,18,45075,[],()
69262,45570,19498,1,€50¢50,29-Aug-2024;02:30,"531 Naida Walk, Darellport, MO 34560",6060.0,6060.0,6060.0,2024-08-29 02:30:00.000,2024-08-29,2024,8,29,45570,[],()
71275,47211,19557,1,$ 54.0,03/05/24 03:22,NULL,54.0,54.0,54.0,2024-03-05 03:22:00.000,2024-03-05,2024,3,5,47211,[],()
71117,47258,19212,2,50.€,"09:04:10, 09/11/24","1295 Schroeder Freeway, East Vincenttown, ID 93024",60.0,60.0,120.0,2024-09-11 09:04:10.000,2024-09-11,2024,9,11,47258,[],()
64701,47197,19019,1,USD 17.75,2025-02-25T11:22:30,NULL,17.75,17.75,17.75,2025-02-25 11:22:30.000,2025-02-25,2025,2,25,47197,[],()
69010,47296,19080,5,52.75€,"2024-12-26, 15:08:41",,63.3,63.3,316.5,2024-12-26 15:08:41.000,2024-12-26,2024,12,26,47296,[],()
71906,44694,19270,2,22.99 EUR,"24-April-2025,10:09:17 A.M.",NULL,27.587999999999997,27.587999999999997,55.18,2025-04-24 10:09:17.000,2025-04-24,2025,4,24,44694,[],()
67686,45518,19270,1,20. $,2024-08-14T20:50:56.907,"Apt. 331 7662 Shon Vista, Hillshaven, MN 97319-3379",20.0,20.0,20.0,2024-08-14 20:50:56.907,2024-08-14,2024,8,14,45518,[],()
67036,46805,19512,1,EUR 45.0,08:32:17 PM;2024-06-03,,54.0,54.0,54.0,2024-06-03 20:32:17.000,2024-06-03,2024,6,3,46805,[],()
63867,45762,19408,4,$22¢50,2025-05-07T11:50:19.092,,2250.0,2250.0,9000.0,2025-05-07 11:50:19.092,2025-05-07,2025,5,7,45762,[],()
63596,47453,18941,1,56. USD,"22:37:27,  7-Apr-2025",NULL,56.0,56.0,56.0,2025-04-07 22:37:27.000,2025-04-07,2025,4,7,47453,[],()
69610,45876,19324,1,USD64.,Tue Jun  3 20:29:53 2025,,64.0,64.0,64.0,2025-06-03 20:29:53.000,2025-06-03,2025,6,3,45876,[],()
66995,47404,19137,1,50 $,07/10/24;13:12,,50.0,50.0,50.0,2024-07-10 13:12:00.000,2024-07-10,2024,7,10,47404,[],()
63285,46866,18914,2,47.25 $,11:46:19  3-FEB-2025,NULL,47.25,47.25,94.5,2025-02-03 11:46:19.000,2025-02-03,2025,2,3,46866,[],()
68874,45818,18860,1,EUR44.50,16:35;12/14/24,,53.4,53.4,53.4,2024-12-14 16:35:00.000,2024-12-14,2024,12,14,45818,[],()
62761,45224,19235,1,62.75 USD,08:06;01/05/25,"59671 Howard Springs, Lefflershire, CO 17472-4372",62.75,62.75,62.75,2025-01-05 08:06:00.000,2025-01-05,2025,1,5,45224,[],()
64528,45337,19023,1,43.0 €,"01/11/25,19:26:01",,51.6,51.6,51.6,2025-01-11 19:26:01.000,2025-01-11,2025,1,11,45337,[],()
68288,44881,18890,4,72.75€,"11:34:49 A.M.,2025-05-01",,87.3,87.3,349.2,2025-05-01 11:34:49.000,2025-05-01,2025,5,1,44881,[],()
70330,44494,19355,1,38EUR,08/25/24;10:16:57 A.M.,"136 Rico Mountain, Celestinaton, MS 59406",45.6,45.6,45.6,2024-08-25 10:16:57.000,2024-08-25,2024,8,25,44494,[],()
63892,47515,19463,1,61.25 €,12-OCT-2024 09:49:20 AM,,73.5,73.5,73.5,2024-10-12 09:49:20.000,2024-10-12,2024,10,12,47515,[],()
63001,46084,19518,1,$25¢25," 7-Jul-2025,09:46:02 pm",,2525.0,2525.0,2525.0,2025-07-07 21:46:02.000,2025-07-07,2025,7,7,46084,[],()
62984,45844,18946,1,$ 50.99,"07:52:17, 2025-01-30","3862 Turcotte Falls, Dominiqueview, GA 15866-7380",50.99,50.99,50.99,2025-01-30 07:52:17.000,2025-01-30,2025,1,30,45844,[],()
67659,45177,19054,1,USD 41.25,30-SEP-2024 03:50,,41.25,41.25,41.25,2024-09-30 03:50:00.000,2024-09-30,2024,9,30,45177,[],()
63210,44768,19538,1,$59.,17-Sep-2024;06:49,,59.0,59.0,59.0,2024-09-17 06:49:00.000,2024-09-17,2024,9,17,44768,[],()
71772,45427,18853,1,59$,"2024-06-18, 04:19:36","Apt. 390 18478 Nola Streets, Katharinachester, SC 29161-6753",59.0,59.0,59.0,2024-06-18 04:19:36.000,2024-06-18,2024,6,18,45427,[],()
67551,46238,19456,3,36.5USD,"24-MAR-2024,17:05:41",,36.5,36.5,109.5,2024-03-24 17:05:41.000,2024-03-24,2024,3,24,46238,[],()
73408,46285,19452,2,38.0 EUR, 3-Aug-2025;11:54:03, ,45.6,45.6,91.2,2025-08-03 11:54:03.000,2025-08-03,2025,8,3,46285,[],()
70743,45773,19326,3,USD26.00,"2024-04-21, 20:40",,26.0,26.0,78.0,2024-04-21 20:40:00.000,2024-04-21,2024,4,21,45773,[],()
67416,45889,19240,1,USD65.99,14:25;06/08/25,"Suite 523 3321 Cronin Parkway, Buckfort, NJ 69110-9433",65.99,65.99,65.99,2025-06-08 14:25:00.000,2025-06-08,2025,6,8,45889,[],()
65950,44878,19582,1,EUR43,"18:34, 02/28/24",,51.6,51.6,51.6,2024-02-28 18:34:00.000,2024-02-28,2024,2,28,44878,[],()
73309,46376,19166,1,64.0EUR,16:30:53;02/08/25,NULL,76.8,76.8,76.8,2025-02-08 16:30:53.000,2025-02-08,2025,2,8,46376,[],()
65722,46562,19248,5,$55.5,"12:54,2024-07-18",,55.5,55.5,277.5,2024-07-18 12:54:00.000,2024-07-18,2024,7,18,46562,[],()
70281,45458,19005,1,36.€,"20:58:02, 10/24/24",,43.199999999999996,43.199999999999996,43.2,2024-10-24 20:58:02.000,2024-10-24,2024,10,24,45458,[],()
70066,46655,19584,1,43.5 USD,"03:03:37 am,07/21/24",NULL,43.5,43.5,43.5,2024-07-21 03:03:37.000,2024-07-21,2024,7,21,46655,[],()
65808,44754,18901,2,74.75 USD,00:28;09/02/24,NULL,74.75,74.75,149.5,2024-09-02 00:28:00.000,2024-09-02,2024,9,2,44754,[],()
72612,45826,19495,1,30.25USD,18:51:21 25-Jul-2025,,30.25,30.25,30.25,2025-07-25 18:51:21.000,2025-07-25,2025,7,25,45826,[],()
64966,44530,19101,1,71.5$,2024-11-07T16:17:15,NULL,71.5,71.5,71.5,2024-11-07 16:17:15.000,2024-11-07,2024,11,7,44530,[],()
65846,44395,19066,1,$38.00,2024-11-20T16:56:04.839,"855 Monte Stream, South Ilene, UT 39916-4716",38.0,38.0,38.0,2024-11-20 16:56:04.839,2024-11-20,2024,11,20,45009,[],()
64312,45002,18871,1,$58.99,"14:05, 5-NOV-2024",,58.99,58.99,58.99,2024-11-05 14:05:00.000,2024-11-05,2024,11,5,45002,[],()
65312,47567,19456,1,€36¢00,"22:35:47, 12/01/24",,4320.0,4320.0,4320.0,2024-12-01 22:35:47.000,2024-12-01,2024,12,1,47567,[],()
73702,45745,18855,1,EUR 31.75,"08:38:47 A.M., 3-April-2025",NULL,38.1,38.1,38.1,2025-04-03 08:38:47.000,2025-04-03,2025,4,3,45745,[],()
68563,47105,19299,3,28.0 $,"07:14,  2-January-2025","59282 Norman Mountain, Lake Soila, ID 56112",28.0,28.0,84.0,2025-01-02 07:14:00.000,2025-01-02,2025,1,2,47105,[],()
65828,44704,18885,1,EUR27.50,"16:10:26, 13-Apr-2025",,33.0,33.0,33.0,2025-04-13 16:10:26.000,2025-04-13,2025,4,13,44704,[],()
64006,46896,19293,1,$32.,"23:08:32,23-DEC-2024",NULL,32.0,32.0,32.0,2024-12-23 23:08:32.000,2024-12-23,2024,12,23,46896,[],()
67143,45183,18838,1,$ 53.0,"18-Sep-2024,22:10",,53.0,53.0,53.0,2024-09-18 22:10:00.000,2024-09-18,2024,9,18,45183,[],()
67495,45312,18869,2,€23¢25,"05:38:08, 18-March-2025",,2790.0,2790.0,5580.0,2025-03-18 05:38:08.000,2025-03-18,2025,3,18,45312,[],()
65373,44947,19309,1,USD 65.50,"2025-04-17,11:41:25",,65.5,65.5,65.5,2025-04-17 11:41:25.000,2025-04-17,2025,4,17,44947,[],()
68325,46122,19076,1,EUR 22.,13:02:18;2025-01-21,,26.4,26.4,26.4,2025-01-21 13:02:18.000,2025-01-21,2025,1,21,46122,[],()
73228,45851,19382,2,EUR27.99,21-May-2025;01:13,NULL,33.587999999999994,33.587999999999994,67.18,2025-05-21 01:13:00.000,2025-05-21,2025,5,21,45851,[],()
64924,46752,19579,1,22.75 €,"2024-03-13, 07:43:24","Apt. 738 32871 Wehner Loop, North Floystad, VA 93316-1243",27.3,27.3,27.3,2024-03-13 07:43:24.000,2024-03-13,2024,3,13,46752,[],()
73276,47160,19131,1,56.99 $,01/23/25 23:05:50,,56.99,56.99,56.99,2025-01-23 23:05:50.000,2025-01-23,2025,1,23,47160,[],()
68216,45040,19218,4,72.75€,"07:35:09 pm, 11/06/24",,87.3,87.3,349.2,2024-11-06 19:35:09.000,2024-11-06,2024,11,6,45040,[],()
73379,44431,19007,3,EUR47.0, 9-Dec-2024;11:31:57 PM,NULL,56.4,56.4,169.2,2024-12-09 23:31:57.000,2024-12-09,2024,12,9,44431,[],()
65848,44736,19341,1,30.25 USD,"17:29,02/14/25",,30.25,30.25,30.25,2025-02-14 17:29:00.000,2025-02-14,2025,2,14,44736,[],()
72881,46405,19466,1,EUR22.75,"01/25/25,20:50:27",NULL,27.3,27.3,27.3,2025-01-25 20:50:27.000,2025-01-25,2025,1,25,46405,[],()
70360,46747,19524,1,$45.75, 3-Mar-2025 01:28:44 AM,,45.75,45.75,45.75,2025-03-03 01:28:44.000,2025-03-03,2025,3,3,46747,[],()
71325,46350,18846,1,21.99 $,"03:04, 02/26/25",,21.99,21.99,21.99,2025-02-26 03:04:00.000,2025-02-26,2025,2,26,46350,[],()
67147,44762,19135,1,$51.0,"12-October-2024,13:07:21","Apt. 366 7355 Nitzsche Islands, Dariusland, WV 07936-1315",51.0,51.0,51.0,2024-10-12 13:07:21.000,2024-10-12,2024,10,12,44762,[],()
64246,45705,19488,3,EUR71.99,"01:13:23, 18-October-2024",,86.38799999999999,86.38799999999999,259.16,2024-10-18 01:13:23.000,2024-10-18,2024,10,18,45905,[],()
66460,44732,18963,3,$53.5,2024-04-30T10:13:25.542,NULL,53.5,53.5,160.5,2024-04-30 10:13:25.542,2024-04-30,2024,4,30,44732,[],()
71642,45555,19371,1,$63.25,05:17; 6-Nov-2024,NULL,63.25,63.25,63.25,2024-11-06 05:17:00.000,2024-11-06,2024,11,6,45555,[],()
72797,44943,18842,2,$58¢99,01:45:41 09/15/24,"Suite 281 547 Paulette Well, Priceville, TX 01224-2413",5899.0,5899.0,11798.0,2024-09-15 01:45:41.000,2024-09-15,2024,9,15,44943,[],()
71620,46045,19018,1,14.50EUR,07:17:35 pm;08/30/24,,17.4,17.4,17.4,2024-08-30 19:17:35.000,2024-08-30,2024,8,30,46045,[],()
73842,45377,19353,2,$13¢75,"09:24, 03/24/25","Apt. 904 86789 Jesenia Ridges, Dennyland, FL 30283",1375.0,1375.0,2750.0,2025-03-24 09:24:00.000,2025-03-24,2025,3,24,45377,[],()
64170,46936,19437,1,USD35.00,"03/31/25, 07:21:39 am",,35.0,35.0,35.0,2025-03-31 07:21:39.000,2025-03-31,2025,3,31,46936,[],()
68190,45207,19552,1,39.00USD,2024-07-12T02:27:09.078,,39.0,39.0,39.0,2024-07-12 02:27:09.078,2024-07-12,2024,7,12,45207,[],()
71274,44990,19543,1,EUR39.25,19.09.2024 23:47:47,,47.1,47.1,47.1,2024-09-19 23:47:47.000,2024-09-19,2024,9,19,44990,[],()
68536,46133,18850,1,$32.99,2024-11-29T11:52:25,"56131 Towne Forge, West Leifmouth, MA 84172",32.99,32.99,32.99,2024-11-29 11:52:25.000,2024-11-29,2024,11,29,46133,[],()
69417,45209,18923,3,$ 27.50,26.11.2024 03:47:47,"Apt. 615 8699 Conn Points, Kirlintown, KS 94033-6195",27.5,27.5,82.5,2024-11-26 03:47:47.000,2024-11-26,2024,11,26,45209,[],()
66126,45240,19254,1,53.5EUR,2025-05-14T12:34:58.539,,64.2,64.2,64.2,2025-05-14 12:34:58.539,2025-05-14,2025,5,14,45240,[],()
66864,46737,19205,1,USD 12.5,"11:49,18-FEB-2025",,12.5,12.5,12.5,2025-02-18 11:49:00.000,2025-02-18,2025,2,18,45965,[],()
66552,45538,19190,1,USD49.00,09:33; 4-Jul-2024,,49.0,49.0,49.0,2024-07-04 09:33:00.000,2024-07-04,2024,7,4,45538,[],()
66207,47463,18875,1,EUR 48.5,26-November-2024 16:42:07,NULL,58.199999999999996,58.199999999999996,58.2,2024-11-26 16:42:07.000,2024-11-26,2024,11,26,47463,[],()
73468,45760,19496,1,USD 30.99,2025-04-03 02:32:51,,30.99,30.99,30.99,2025-04-03 02:32:51.000,2025-04-03,2025,4,3,45760,[],()
70967,45415,19024,2,58.75$,03:22:23; 5-Oct-2024,"33116 Schamberger Ridge, Reingerton, WY 45449",58.75,58.75,117.5,2024-10-05 03:22:23.000,2024-10-05,2024,10,5,45415,[],()
64612,44777,18989,1,42.00$,2024-10-07 22:45:39,"Suite 822 38408 Anthony Plaza, Lake Lakita, MD 80255-5391",42.0,42.0,42.0,2024-10-07 22:45:39.000,2024-10-07,2024,10,7,44777,[],()
63490,46701,19028,1,60.0 $,"27-JUN-2024,10:34:10 P.M.",,60.0,60.0,60.0,2024-06-27 22:34:10.000,2024-06-27,2024,6,27,46701,[],()
65031,46238,18896,2,EUR 26.75," 9-October-2024,09:33","55178 Lanell Curve, Port Damonfort, IA 67155-2886",32.1,32.1,64.2,2024-10-09 09:33:00.000,2024-10-09,2024,10,9,46238,[],()
70271,46011,19558,1,33.75 $,13:28:33;12-FEB-2025,"Suite 231 894 Luciano Spring, West Rebecaview, WV 67744",33.75,33.75,33.75,2025-02-12 13:28:33.000,2025-02-12,2025,2,12,46011,[],()
71699,47307,19063,1,$49.0,"03/03/24, 06:40:44 pm",,49.0,49.0,49.0,2024-03-03 18:40:44.000,2024-03-03,2024,3,3,47307,[],()
71155,46440,19115,1,USD54.25,2024-08-15T13:30:57,NULL,54.25,54.25,54.25,2024-08-15 13:30:57.000,2024-08-15,2024,8,15,46440,[],()
64487,47016,19110,1,61.75 USD,"07:27, 4-JUL-2024",,61.75,61.75,61.75,2024-07-04 07:27:00.000,2024-07-04,2024,7,4,47016,[],()
71436,44376,19032,1,USD70.75,2025-02-25T01:58:50,,70.75,70.75,70.75,2025-02-25 01:58:50.000,2025-02-25,2025,2,25,44376,[],()
64475,45751,19409,1,16.5€,"00:29:35, 24-AUG-2024","15881 Eduardo Islands, Rodriguezstad, AR 92734",19.8,19.8,19.8,2024-08-24 00:29:35.000,2024-08-24,2024,8,24,45751,[],()
70170,45331,19534,1,41.00 $,02:01:21 18-November-2024,,41.0,41.0,41.0,2024-11-18 02:01:21.000,2024-11-18,2024,11,18,45331,[],()
69444,46360,19442,1,EUR 44.25,"19:36, 2025-07-08",,53.1,53.1,53.1,2025-07-08 19:36:00.000,2025-07-08,2025,7,8,46360,[],()
70259,45341,19020,4,20.00EUR,04:44:16 P.M.;04/22/25,NULL,24.0,24.0,96.0,2025-04-22 16:44:16.000,2025-04-22,2025,4,22,45341,[],()
68084,45201,19177,1,$ 14.75,11:05 2024-03-27,,14.75,14.75,14.75,2024-03-27 11:05:00.000,2024-03-27,2024,3,27,45201,[],()
64361,47165,19165,2,$ 27.5,"31-MAY-2025, 04:23","Suite 648 473 Rolfson Mountains, VonRuedenton, MO 08425",27.5,27.5,55.0,2025-05-31 04:23:00.000,2025-05-31,2025,5,31,47165,[],()
73396,46109,19167,1,$40¢99,"05:47,2025-05-29",NULL,4099.0,4099.0,4099.0,2025-05-29 05:47:00.000,2025-05-29,2025,5,29,46109,[],()
63174,45060,19007,2,$48¢50,"2025-01-16,10:24:33 am",,4850.0,4850.0,9700.0,2025-01-16 10:24:33.000,2025-01-16,2025,1,16,45060,[],()
69026,47136,18967,1,EUR 70.00,18-September-2024;07:21:26 P.M.,NULL,84.0,84.0,84.0,2024-09-18 19:21:26.000,2024-09-18,2024,9,18,47136,[],()
66400,45983,19028,2,USD58.0,2024-07-31T03:10:53,,58.0,58.0,116.0,2024-07-31 03:10:53.000,2024-07-31,2024,7,31,45983,[],()
67580,45960,18840,1,EUR 44.25,"08:37, 04/27/25","Suite 203 51030 Quitzon Port, Melvinberg, NY 25307-0477",53.1,53.1,53.1,2025-04-27 08:37:00.000,2025-04-27,2025,4,27,45960,[],()
67961,47142,18988,2,62.5USD,"18-August-2024, 07:58:49","4695 Ledner Park, Boylebury, KS 65638",62.5,62.5,125.0,2024-08-18 07:58:49.000,2024-08-18,2024,8,18,47142,[],()
67305,44367,19051,3,$ 69.99,"22:46, 11/09/24",,69.99,69.99,209.97,2024-11-09 22:46:00.000,2024-11-09,2024,11,9,44367,[],()
72741,46123,19394,2,19.$,"23:19:31,02/28/25",,19.0,19.0,38.0,2025-02-28 23:19:31.000,2025-02-28,2025,2,28,46123,[],()
63933,47359,19085,1,56.5 USD,"08:18:31,2024-11-21",,56.5,56.5,56.5,2024-11-21 08:18:31.000,2024-11-21,2024,11,21,47359,[],()
63669,46038,19486,1,$ 48.75,"11:18:38 AM,2024-10-28","28981 Cruickshank Loop, Charmainechester, OH 21571",48.75,48.75,48.75,2024-10-28 11:18:38.000,2024-10-28,2024,10,28,46038,[],()
66331,47043,18993,1,EUR64.00,29-Sep-2024 06:17:26 P.M.,NULL,76.8,76.8,76.8,2024-09-29 18:17:26.000,2024-09-29,2024,9,29,47043,[],()
73897,44940,19087,1,54.75€,12/01/24;19:09,,65.7,65.7,65.7,2024-12-01 19:09:00.000,2024-12-01,2024,12,1,44940,[],()
71016,44363,18909,1,$ 26.99,2024-08-16T12:06:45.509,"4656 Torp Viaduct, Cliffordside, MA 86136-4484",26.99,26.99,26.99,2024-08-16 12:06:45.509,2024-08-16,2024,8,16,44363,[],()
63902,44913,19385,1,$20.99,2024-09-19T02:57:30,,20.99,20.99,20.99,2024-09-19 02:57:30.000,2024-09-19,2024,9,19,44913,[],()
69005,46034,19514,5,19€50¢,14:02 27-Aug-2024,"Apt. 867 498 Ryan Unions, South Jenaehaven, NV 23464",2340.0,2340.0,11700.0,2024-08-27 14:02:00.000,2024-08-27,2024,8,27,46034,[],()
64877,44876,19101,1,70.25USD,09/21/24 04:56,,70.25,70.25,70.25,2024-09-21 04:56:00.000,2024-09-21,2024,9,21,44876,[],()
67452,46952,19061,1,59.50€,16-JAN-2025;01:36:57 AM,,71.39999999999999,71.39999999999999,71.4,2025-01-16 01:36:57.000,2025-01-16,2025,1,16,46952,[],()
68792,45729,19416,1,EUR 65.75,"2025-02-03,16:10:25",,78.89999999999999,78.89999999999999,78.9,2025-02-03 16:10:25.000,2025-02-03,2025,2,3,45729,[],()
64269,44898,19095,4,USD 62.0,2024-08-02T16:19:10.763,,62.0,62.0,248.0,2024-08-02 16:19:10.763,2024-08-02,2024,8,2,44898,[],()
72732,44617,18917,1,$70¢75,"09:21,18-Dec-2024",,7075.0,7075.0,7075.0,2024-12-18 09:21:00.000,2024-12-18,2024,12,18,44617,[],()
64122,46255,18920,1,$41¢99,"09/24/24,11:40:14",,4199.0,4199.0,4199.0,2024-09-24 11:40:14.000,2024-09-24,2024,9,24,46255,[],()
73879,45292,18872,1,$ 42.5," 6-Feb-2025,01:19:54",,42.5,42.5,42.5,2025-02-06 01:19:54.000,2025-02-06,2025,2,6,45292,[],()
71914,47504,19428,1,USD 44,"10:00:07, 2024-10-20",NULL,44.0,44.0,44.0,2024-10-20 10:00:07.000,2024-10-20,2024,10,20,47504,[],()
64080,47522,19569,1,65.99 $,2024-08-03;11:05:30,,65.99,65.99,65.99,2024-08-03 11:05:30.000,2024-08-03,2024,8,3,47522,[],()
70579,45374,18854,1,€ 41.99,2024-11-19T00:20:47,,50.388,50.388,50.39,2024-11-19 00:20:47.000,2024-11-19,2024,11,19,45374,[],()
63124,47129,19167,1,40.5USD,07:16:40 AM 10/03/25,NULL,40.5,40.5,40.5,2025-10-03 07:16:40.000,2025-10-03,2025,10,3,47129,[],()
71428,46205,19106,2,EUR46.5,2024-09-17T18:43:33.216,,55.8,55.8,111.6,2024-09-17 18:43:33.216,2024-09-17,2024,9,17,46386,[],()
71473,47366,19581,1,27.00 $,14:44;07/05/24,NULL,27.0,27.0,27.0,2024-07-05 14:44:00.000,2024-07-05,2024,7,5,47366,[],()
72056,46752,19369,2,31 €,"2024-09-23, 14:50",,37.199999999999996,37.199999999999996,74.4,2024-09-23 14:50:00.000,2024-09-23,2024,9,23,46752,[],()
66921,46497,19104,1,EUR 60.25,2024-07-05T22:19:12.056,NULL,72.3,72.3,72.3,2024-07-05 22:19:12.056,2024-07-05,2024,7,5,46497,[],()
66572,46916,19473,1,24.50 EUR,03/11/25;09:46:43 AM,"Suite 690 8928 Franecki Ramp, Miltonland, RI 54545",29.4,29.4,29.4,2025-03-11 09:46:43.000,2025-03-11,2025,3,11,46916,[],()
69842,44623,19299,1,USD30.99,11:31;25-Mar-2024,,30.99,30.99,30.99,2024-03-25 11:31:00.000,2024-03-25,2024,3,25,44623,[],()
71218,46708,19539,1,USD62.50,"07:59, 2024-12-22",NULL,62.5,62.5,62.5,2024-12-22 07:59:00.000,2024-12-22,2024,12,22,46708,[],()
65767,46890,19011,1,USD54.75,"2025-05-20, 08:07:02 AM","36563 Elwanda Plaza, Lake Mindy, ME 82126-2731",54.75,54.75,54.75,2025-05-20 08:07:02.000,2025-05-20,2025,5,20,46890,[],()
70958,44604,19134,3,$65.,07:50;2024-09-25,"18011 Koch Harbor, Nicolashire, TN 19153-8468",65.0,65.0,195.0,2024-09-25 07:50:00.000,2024-09-25,2024,9,25,44604,[],()
70345,44933,19349,2,44.5 $,02.11.2024 17:12:12,,44.5,44.5,89.0,2024-02-11 17:12:12.000,2024-02-11,2024,2,11,44933,[],()
65706,46006,18937,3,64.50USD,18-May-2024;14:13:32,NULL,64.5,64.5,193.5,2024-05-18 14:13:32.000,2024-05-18,2024,5,18,46006,[],()
64931,45792,19302,2,$28.75,"15:18:32, 03/02/25","33031 Swift Place, Shieldsberg, LA 06604",28.75,28.75,57.5,2025-03-02 15:18:32.000,2025-03-02,2025,3,2,45792,[],()
70443,47285,19446,1,USD 50.5,"08/15/24, 06:53:19 P.M.",,50.5,50.5,50.5,2024-08-15 18:53:19.000,2024-08-15,2024,8,15,47285,[],()
68718,46008,19400,1,33.50$,06:15:16 pm;29-Jan-2025,,33.5,33.5,33.5,2025-01-29 18:15:16.000,2025-01-29,2025,1,29,46008,[],()
69236,45507,18880,1,$70.75, 1-July-2024;02:45,,70.75,70.75,70.75,2024-07-01 02:45:00.000,2024-07-01,2024,7,1,45507,[],()
70095,45839,19106,1,49.99USD,Fri Jan 24 19:42:31 2025,,49.99,49.99,49.99,2025-01-24 19:42:31.000,2025-01-24,2025,1,24,45839,[],()
68883,45972,19538,1,$55.,01/18/25;03:11:13 am,"Apt. 986 418 Mason Road, Tempiefurt, HI 03862-6516",55.0,55.0,55.0,2025-01-18 03:11:13.000,2025-01-18,2025,1,18,46526,[],()
69540,47273,19532,1,€32.50,"07/18/25,09:03:08 PM",NULL,39.0,39.0,39.0,2025-07-18 21:03:08.000,2025-07-18,2025,7,18,47273,[],()
68130,47497,18959,1,51.99 €,10:39 2024-08-18,"888 Derrick Port, West Renateberg, WA 00789-1098",62.388,62.388,62.39,2024-08-18 10:39:00.000,2024-08-18,2024,8,18,47497,[],()
65057,47023,18887,1,46.75€,2025-01-02T04:32:03,"Suite 880 7602 Petronila Knolls, Rempelmouth, LA 03861-7890",56.1,56.1,56.1,2025-01-02 04:32:03.000,2025-01-02,2025,1,2,47056,[],()
64968,46828,19335,1,14.75EUR,21:34;10/31/24,,17.7,17.7,17.7,2024-10-31 21:34:00.000,2024-10-31,2024,10,31,46828,[],()
70120,47601,19092,1,$46.75,2024-11-23T21:53:01,,46.75,46.75,46.75,2024-11-23 21:53:01.000,2024-11-23,2024,11,23,47601,[],()
70324,46396,18839,1,EUR 20.25,02/08/25 20:31,"Suite 791 6039 Rodrigo Fort, Port Isiah, OR 70687",24.3,24.3,24.3,2025-02-08 20:31:00.000,2025-02-08,2025,2,8,46396,[],()
64595,44351,19430,1,56.75 $,07:28:13 AM 2025-02-08,"7957 Predovic Harbors, Schroederborough, VA 28741",56.75,56.75,56.75,2025-02-08 07:28:13.000,2025-02-08,2025,2,8,44351,[],()
71010,46647,18879,1,67.25$,04/04/24 02:43:35 P.M.,"1487 Nikolaus Flat, West Rubinstad, NY 47647",67.25,67.25,67.25,2024-04-04 14:43:35.000,2024-04-04,2024,4,4,46647,[],()
68203,45497,18999,5,USD 54.25,09:57:55 P.M. 14-Oct-2024,"6871 Sylvester Drive, Lake Aleaseland, IN 95488-5289",54.25,54.25,271.25,2024-10-14 21:57:55.000,2024-10-14,2024,10,14,45497,[],()
67836,47521,19083,3,46.0 USD,"2025-05-17,10:46:03 PM","207 Terry Shoal, New Elijah, TN 87146-8770",46.0,46.0,138.0,2025-05-17 22:46:03.000,2025-05-17,2025,5,17,47521,[],()
71450,47042,19562,1,$53.75,"31-OCT-2024,08:33","Apt. 690 5926 Kip Crest, Zboncakport, KS 45297",53.75,53.75,53.75,2024-10-31 08:33:00.000,2024-10-31,2024,10,31,47042,[],()
72404,46670,19411,4,45. $,10:00 2024-11-14,"550 Thomas Brooks, Teodoraside, NM 21885",45.0,45.0,180.0,2024-11-14 10:00:00.000,2024-11-14,2024,11,14,46670,[],()
73062,44689,19192,1,62.00 $,2024-08-07T02:15:27.938,,62.0,62.0,62.0,2024-08-07 02:15:27.938,2024-08-07,2024,8,7,44689,[],()
71877,47479,19041,4,15.00 €,2024-09-06T23:15:17.253,"5315 Tonisha Knolls, West Lillianaside, IA 85442-4187",18.0,18.0,72.0,2024-09-06 23:15:17.253,2024-09-06,2024,9,6,47479,[],()
69418,45708,19125,4,USD14.50,"03/27/24, 16:42","254 Balistreri Isle, Lake Magaret, OH 16696-3538",14.5,14.5,58.0,2024-03-27 16:42:00.000,2024-03-27,2024,3,27,45708,[],()
71656,46111,18923,2,€ 24.50,"2025-02-18,15:19",,29.4,29.4,58.8,2025-02-18 15:19:00.000,2025-02-18,2025,2,18,47332,[],()
71480,47522,18920,2,41.5USD,2024-11-05T20:37:16,,41.5,41.5,83.0,2024-11-05 20:37:16.000,2024-11-05,2024,11,5,47522,[],()
69896,46448,19507,1,19.99€,01/21/25;17:32,,23.987999999999996,23.987999999999996,23.99,2025-01-21 17:32:00.000,2025-01-21,2025,1,21,46448,[],()
70709,46749,19463,1,€62¢50,15:27;09/12/24,NULL,7500.0,7500.0,7500.0,2024-09-12 15:27:00.000,2024-09-12,2024,9,12,46749,[],()
66746,44726,19377,1,51.5 USD, 5-MAR-2025 13:40,,51.5,51.5,51.5,2025-03-05 13:40:00.000,2025-03-05,2025,3,5,44726,[],()
71027,47392,19089,1,USD47,"10-May-2024,02:40","Apt. 116 489 Wintheiser Lakes, North Dannymouth, AR 95901-5753",47.0,47.0,47.0,2024-05-10 02:40:00.000,2024-05-10,2024,5,10,47392,[],()
66308,47266,19174,1,31.5 USD,05/02/25 08:29:21 P.M.,"97172 Kerstin Square, Jessicastad, MI 13023-8484",31.5,31.5,31.5,2025-05-02 20:29:21.000,2025-05-02,2025,5,2,47266,[],()
67677,46032,19361,2,USD35.50,"09:35,2025-05-16",,35.5,35.5,71.0,2025-05-16 09:35:00.000,2025-05-16,2025,5,16,46032,[],()
63912,44789,18941,1,57.5 USD,"2025-07-03,18:00:19",,57.5,57.5,57.5,2025-07-03 18:00:19.000,2025-07-03,2025,7,3,44789,[],()
73660,45168,19385,1,$19¢50,"2024-07-19,01:16:52 AM",,1950.0,1950.0,1950.0,2024-07-19 01:16:52.000,2024-07-19,2024,7,19,45168,[],()
66563,44598,19130,1,22. EUR,"10:00:01 PM, 05/02/24",,26.4,26.4,26.4,2024-05-02 22:00:01.000,2024-05-02,2024,5,2,44598,[],()
62959,47177,18839,1,€24.00,2025-01-30;12:11,"Apt. 835 9778 Dee Junctions, Lefflerhaven, KY 68337-6185",28.799999999999997,28.799999999999997,28.8,2025-01-30 12:11:00.000,2025-01-30,2025,1,30,47177,[],()
70736,46056,19200,2,20.50€,"01:49:26, 17-February-2025",,24.599999999999998,24.599999999999998,49.2,2025-02-17 01:49:26.000,2025-02-17,2025,2,17,46056,[],()
68286,46099,18945,1,USD 47.75,2025-02-10T14:05:59,"85111 Ryan Parkways, Arthurport, KS 53532",47.75,47.75,47.75,2025-02-10 14:05:59.000,2025-02-10,2025,2,10,46099,[],()
67216,44878,19488,1,USD70.5,13:39:27; 5-Oct-2024,,70.5,70.5,70.5,2024-10-05 13:39:27.000,2024-10-05,2024,10,5,44878,[],()
71207,46510,19091,1,USD 25.,07/25/24;06:59:00 am,NULL,25.0,25.0,25.0,2024-07-25 06:59:00.000,2024-07-25,2024,7,25,46510,[],()
71255,46555,19441,1,USD 17.5,"19:21:51,2025-02-16",NULL,17.5,17.5,17.5,2025-02-16 19:21:51.000,2025-02-16,2025,2,16,46555,[],()
69858,47128,19356,1,$49.00,"22-DEC-2024, 23:20",NULL,49.0,49.0,49.0,2024-12-22 23:20:00.000,2024-12-22,2024,12,22,47128,[],()
67254,44808,19377,1,53.00 €,2024-10-30T13:46:21.927,,63.599999999999994,63.599999999999994,63.6,2024-10-30 13:46:21.927,2024-10-30,2024,10,30,44808,[],()
66761,45235,19325,1,32.75 USD,"25-September-2024, 03:26:58",,32.75,32.75,32.75,2024-09-25 03:26:58.000,2024-09-25,2024,9,25,45235,[],()
72437,46037,18862,1,27.00 USD,"04:11:43, 21-SEP-2024",,27.0,27.0,27.0,2024-09-21 04:11:43.000,2024-09-21,2024,9,21,46037,[],()
65680,46649,19426,1,40. $,12:07:09 06/13/24,"271 Owen Cove, Jorgebury, NH 88980",40.0,40.0,40.0,2024-06-13 12:07:09.000,2024-06-13,2024,6,13,46649,[],()
67725,45168,19473,1,USD 25.,03:46:49;2024-04-27,,25.0,25.0,25.0,2024-04-27 03:46:49.000,2024-04-27,2024,4,27,45168,[],()
64984,44943,19151,1,39.25USD, 7-June-2025;03:14:02,NULL,39.25,39.25,39.25,2025-06-07 03:14:02.000,2025-06-07,2025,6,7,44943,[],()
71744,44908,19311,1,69.99 $,25-December-2024 01:24:54 P.M.,"Apt. 650 66088 Cassy Prairie, Jacobsbury, NJ 83792",69.99,69.99,69.99,2024-12-25 13:24:54.000,2024-12-25,2024,12,25,45667,[],()
65076,47595,18882,1,USD 47.99,2025-05-08T18:13:38,,47.99,47.99,47.99,2025-05-08 18:13:38.000,2025-05-08,2025,5,8,47595,[],()
62957,44562,19031,1,EUR22.5,11:19:26 08/17/24,,27.0,27.0,27.0,2024-08-17 11:19:26.000,2024-08-17,2024,8,17,44562,[],()
63112,44850,19240,1,68€,"23-Oct-2024, 05:50","Apt. 245 5042 Annette Islands, South Andreville, AZ 43566",81.6,81.6,81.6,2024-10-23 05:50:00.000,2024-10-23,2024,10,23,46955,[],()
69775,46170,19541,3,$29.50,13:22 2024-09-13,,29.5,29.5,88.5,2024-09-13 13:22:00.000,2024-09-13,2024,9,13,46170,[],()
64400,47562,19182,1,USD50.5,2025-06-17;09:01:22,"Suite 177 3837 Stroman Bridge, West Eliseoshire, CT 10734",50.5,50.5,50.5,2025-06-17 09:01:22.000,2025-06-17,2025,6,17,47562,[],()
63790,46456,19183,3,16.25USD,"2024-12-19,00:35:24",,16.25,16.25,48.75,2024-12-19 00:35:24.000,2024-12-19,2024,12,19,46456,[],()
71476,46474,19316,1,22.75$,04:27:47 A.M.;02/03/25,,22.75,22.75,22.75,2025-02-03 04:27:47.000,2025-02-03,2025,2,3,46474,[],()
70147,46776,18948,1,EUR 17.99,"05:27:42 PM, 2024-06-06",,21.587999999999997,21.587999999999997,21.59,2024-06-06 17:27:42.000,2024-06-06,2024,6,6,46776,[],()
72177,46152,19473,1,22.50 $,"01:15:51 AM, 15-Jun-2024",,22.5,22.5,22.5,2024-06-15 01:15:51.000,2024-06-15,2024,6,15,46152,[],()
64937,45540,18930,1,33.€,"17-April-2025, 10:22:54","Apt. 550 11393 Lee Viaduct, East Dessieport, IL 37240",39.6,39.6,39.6,2025-04-17 10:22:54.000,2025-04-17,2025,4,17,45540,[],()
68940,47140,18860,1,46.99 €,2024-11-30 12:32:36 PM,,56.388,56.388,56.39,2024-11-30 12:32:36.000,2024-11-30,2024,11,30,47140,[],()
68244,45027,19354,1,40.0 USD,"12/12/24,05:52:21 A.M.",NULL,40.0,40.0,40.0,2024-12-12 05:52:21.000,2024-12-12,2024,12,12,45027,[],()
67932,47126,19379,1,55.0$,2024-07-31T17:58:53.894,"Suite 699 8868 Maryann Avenue, West Karie, HI 57915-6303",55.0,55.0,55.0,2024-07-31 17:58:53.894,2024-07-31,2024,7,31,47126,[],()
72218,47060,19335,3,EUR 14.99,24-AUG-2024;12:14:11 P.M.,,17.988,17.988,53.96,2024-08-24 12:14:11.000,2024-08-24,2024,8,24,47060,[],()
70824,45270,19000,1,57.USD,2025-04-03T01:09:46,"923 Jaime Wall, East Hipolitomouth, CT 79827-3690",57.0,57.0,57.0,2025-04-03 01:09:46.000,2025-04-03,2025,4,3,45270,[],()
69943,46247,19046,1,EUR22.,"17:17, 22-JUL-2024",NULL,26.4,26.4,26.4,2024-07-22 17:17:00.000,2024-07-22,2024,7,22,46247,[],()
73576,45590,19293,1,32.5$,"2024-09-18, 23:07:45",,32.5,32.5,32.5,2024-09-18 23:07:45.000,2024-09-18,2024,9,18,45590,[],()
67663,44654,19514,1,USD20.99,20:21;24-Oct-2024,"455 Man Stream, Hicklefurt, DE 44027",20.99,20.99,20.99,2024-10-24 20:21:00.000,2024-10-24,2024,10,24,44654,[],()
63482,44494,19081,1,USD17.50,2024-07-01 09:38:44 pm,,17.5,17.5,17.5,2024-07-01 21:38:44.000,2024-07-01,2024,7,1,44494,[],()
72491,47128,19379,1,€58¢99,03/15/25 04:46:22,NULL,7078.8,7078.8,7078.8,2025-03-15 04:46:22.000,2025-03-15,2025,3,15,47128,[],()
73871,45313,19189,2,21.00 $,01:08:18;11/28/24,NULL,21.0,21.0,42.0,2024-11-28 01:08:18.000,2024-11-28,2024,11,28,45313,[],()
72740,45014,19162,2,EUR65,"13:15:31, 01/12/25","24424 Jamika Turnpike, Port Sherwoodfurt, LA 57202-0184",78.0,78.0,156.0,2025-01-12 13:15:31.000,2025-01-12,2025,1,12,45014,[],()
72573,44726,18916,1,55.5USD,"2025-01-20,05:10:51 AM",,55.5,55.5,55.5,2025-01-20 05:10:51.000,2025-01-20,2025,1,20,44726,[],()
72360,46044,19076,1,21.00EUR,"21:55, 2024-08-05","Apt. 116 9264 MacGyver Avenue, Codyfort, ND 07587-0313",25.2,25.2,25.2,2024-08-05 21:55:00.000,2024-08-05,2024,8,5,46044,[],()
65044,44775,18989,1,46USD,2024-09-05T23:31:43,,46.0,46.0,46.0,2024-09-05 23:31:43.000,2024-09-05,2024,9,5,44775,[],()
73155,45214,19249,1,EUR 64.99,06:11:27 AM;29-September-2024,"Apt. 168 541 Kulas Prairie, Beattyfurt, MN 69910",77.98799999999999,77.98799999999999,77.99,2024-09-29 06:11:27.000,2024-09-29,2024,9,29,45214,[],()
70756,47620,18847,1,USD 40.25,"06/16/24,07:32:28",NULL,40.25,40.25,40.25,2024-06-16 07:32:28.000,2024-06-16,2024,6,16,47620,[],()
66153,45391,19251,2,USD 23.75, 9-November-2024 10:23,,23.75,23.75,47.5,2024-11-09 10:23:00.000,2024-11-09,2024,11,9,44823,[],()
63832,47573,19034,1,51.0USD,2024-08-04T07:29:35,"3236 Hane Parks, East Johnny, RI 16057-8533",51.0,51.0,51.0,2024-08-04 07:29:35.000,2024-08-04,2024,8,4,47573,[],()
68750,45084,19438,1,€ 69.25,2024-11-05T19:42:25,,83.1,83.1,83.1,2024-11-05 19:42:25.000,2024-11-05,2024,11,5,45084,[],()
72049,46894,19053,2,$ 55.5,"2025-03-07,12:56:34 pm",,55.5,55.5,111.0,2025-03-07 12:56:34.000,2025-03-07,2025,3,7,46894,[],()
71470,46702,19322,1,65.0 $,2024-09-06T07:17:19.203,NULL,65.0,65.0,65.0,2024-09-06 07:17:19.203,2024-09-06,2024,9,6,46702,[],()
66644,45394,19348,1,$ 33.75,"23-APR-2024,02:52",,33.75,33.75,33.75,2024-04-23 02:52:00.000,2024-04-23,2024,4,23,45394,[],()
66439,44533,19394,1,$18¢00,2025-07-04T06:28:32.036,NULL,1800.0,1800.0,1800.0,2025-07-04 06:28:32.036,2025-07-04,2025,7,4,44533,[],()
67244,46005,19115,3,$55.50,03/16/25 02:40:25 A.M.,NULL,55.5,55.5,166.5,2025-03-16 02:40:25.000,2025-03-16,2025,3,16,46005,[],()
66233,44972,19310,1,€ 26.50,09:32:50 2025-01-20,,31.799999999999997,31.799999999999997,31.8,2025-01-20 09:32:50.000,2025-01-20,2025,1,20,44972,[],()
65794,45883,19409,1,18.0$,2024-12-13T02:32:15.936,"7048 David Hill, Port Winford, MI 90386-0113",18.0,18.0,18.0,2024-12-13 02:32:15.936,2024-12-13,2024,12,13,45883,[],()
72068,47521,19452,1,39.00 USD,"08/25/24, 04:30:11",NULL,39.0,39.0,39.0,2024-08-25 04:30:11.000,2024-08-25,2024,8,25,47521,[],()
68653,44894,19297,1,EUR49.5, 2.11.2024  3:07:07,"3491 Mario Alley, Gloverchester, TX 56900-8052",59.4,59.4,59.4,2024-02-11 03:07:07.000,2024-02-11,2024,2,11,44894,[],()
70058,44719,19273,1,45.0 USD,06:02;10/06/24,NULL,45.0,45.0,45.0,2024-10-06 06:02:00.000,2024-10-06,2024,10,6,44719,[],()
68030,46476,19201,1,40.25USD,2024-10-25;20:39,"35515 Stoltenberg Springs, North Donnell, NY 82445",40.25,40.25,40.25,2024-10-25 20:39:00.000,2024-10-25,2024,10,25,46476,[],()
68958,45273,19022,3,67.0$,06/10/24;17:49:27,"30382 Hackett Harbors, East Haywoodhaven, NC 67446-6875",67.0,67.0,201.0,2024-06-10 17:49:27.000,2024-06-10,2024,6,10,45273,[],()
73011,45787,18922,4,14.0 USD,07:51 03/28/25,,14.0,14.0,56.0,2025-03-28 07:51:00.000,2025-03-28,2025,3,28,45787,[],()
66178,44504,18858,1,$14.99,2024-11-14T11:26:39.894,"981 Nader Hills, Houstonton, IN 42502",14.99,14.99,14.99,2024-11-14 11:26:39.894,2024-11-14,2024,11,14,44504,[],()
69739,47284,19295,1,39.0 €,"13:30,09/04/24",NULL,46.8,46.8,46.8,2024-09-04 13:30:00.000,2024-09-04,2024,9,4,47284,[],()
63928,45455,19317,1,24.99 USD,2025-03-12T13:08:39.424,NULL,24.99,24.99,24.99,2025-03-12 13:08:39.424,2025-03-12,2025,3,12,45455,[],()
70165,45539,19280,1,USD 45.00,13:55;2024-10-01,NULL,45.0,45.0,45.0,2024-10-01 13:55:00.000,2024-10-01,2024,10,1,45539,[],()
64807,46533,19224,1,55.50 €,"11/20/24, 09:04",,66.6,66.6,66.6,2024-11-20 09:04:00.000,2024-11-20,2024,11,20,46533,[],()
73720,44641,19397,1,$29.0,2025-02-03T13:11:05,"5126 Mel Fields, North Gordonchester, NC 77962",29.0,29.0,29.0,2025-02-03 13:11:05.000,2025-02-03,2025,2,3,44641,[],()
62736,46557,19241,2,37.50€,08/10/24 02:36:02 P.M.,,45.0,45.0,90.0,2024-08-10 14:36:02.000,2024-08-10,2024,8,10,46557,[],()
68529,45041,18953,2,60 €,"21:28:38, 23-May-2025","Suite 863 10897 Ullrich Squares, North Lloyd, IA 50117",72.0,72.0,144.0,2025-05-23 21:28:38.000,2025-05-23,2025,5,23,45041,[],()
68011,47155,19120,2,USD61.25,"11:31:16 AM,01/16/25",,61.25,61.25,122.5,2025-01-16 11:31:16.000,2025-01-16,2025,1,16,47155,[],()
63020,46440,18921,1,46.00 $,2025-03-17T21:32:29,NULL,46.0,46.0,46.0,2025-03-17 21:32:29.000,2025-03-17,2025,3,17,46440,[],()
63694,45074,19459,2,$42.25,2025-01-15T22:44:34,,42.25,42.25,84.5,2025-01-15 22:44:34.000,2025-01-15,2025,1,15,45074,[],()
65760,44654,19505,3,USD 18.99,"12:24,23-Nov-2024",,18.99,18.99,56.97,2024-11-23 12:24:00.000,2024-11-23,2024,11,23,44654,[],()
69920,47183,19424,2,16.50 €,07:41:33 PM;2025-01-03,,19.8,19.8,39.6,2025-01-03 19:41:33.000,2025-01-03,2025,1,3,47183,[],()
73466,45844,18962,1,61.25USD,"19:29, 06/15/24",NULL,61.25,61.25,61.25,2024-06-15 19:29:00.000,2024-06-15,2024,6,15,45844,[],()
73684,47345,19205,1,13USD,"18-Nov-2024, 18:32:48","Apt. 172 812 Nikolaus Parkway, Mayerport, MI 37744-0114",13.0,13.0,13.0,2024-11-18 18:32:48.000,2024-11-18,2024,11,18,47345,[],()
64876,44364,19208,1,54.00 EUR,"2025-01-25, 04:21",,64.8,64.8,64.8,2025-01-25 04:21:00.000,2025-01-25,2025,1,25,44364,[],()
72735,46146,18945,1,€ 48.99,"08:34:35 am,05/05/25",,58.788,58.788,58.79,2025-05-05 08:34:35.000,2025-05-05,2025,5,5,46146,[],()
71109,47304,19553,4,51.0$,2025-04-19T01:44:54,,51.0,51.0,204.0,2025-04-19 01:44:54.000,2025-04-19,2025,4,19,47304,[],()
67195,46660,19505,5,USD 21.99,"22:42:51, 12/01/24",,21.99,21.99,109.95,2024-12-01 22:42:51.000,2024-12-01,2024,12,1,46660,[],()
64505,47223,19277,1,USD 59.,"2025-02-26,16:23:10",,59.0,59.0,59.0,2025-02-26 16:23:10.000,2025-02-26,2025,2,26,47223,[],()
68023,45239,18983,1,33.0€,"16:44,04/22/24",,39.6,39.6,39.6,2024-04-22 16:44:00.000,2024-04-22,2024,4,22,45239,[],()
68171,47540,19081,1,18.99 EUR,2025-01-23;01:26:18 P.M.,,22.787999999999997,22.787999999999997,22.79,2025-01-23 13:26:18.000,2025-01-23,2025,1,23,47540,[],()
67448,46813,19383,1,$ 61.50,05:14:46;2024-07-13,NULL,61.5,61.5,61.5,2024-07-13 05:14:46.000,2024-07-13,2024,7,13,46813,[],()
70119,45240,19125,1,18.99€,2024-08-02T22:47:22.108,NULL,22.787999999999997,22.787999999999997,22.79,2024-08-02 22:47:22.108,2024-08-02,2024,8,2,45240,[],()
72244,46750,19213,2,USD31,28-Sep-2024;07:55:01 am,NULL,31.0,31.0,62.0,2024-09-28 07:55:01.000,2024-09-28,2024,9,28,46750,[],()
73161,46474,18952,1,50.50 $,"19:19,01/16/25",,50.5,50.5,50.5,2025-01-16 19:19:00.000,2025-01-16,2025,1,16,46474,[],()
64999,46570,19234,1,22.USD,"20:45:52,2024-02-06",,22.0,22.0,22.0,2024-02-06 20:45:52.000,2024-02-06,2024,2,6,46570,[],()
68882,45348,19266,3,46 €,27.10.2024 19:47:47,NULL,55.199999999999996,55.199999999999996,165.6,2024-10-27 19:47:47.000,2024-10-27,2024,10,27,45348,[],()
72071,47447,19270,1,18.00$,2024-12-16;02:46,"34578 Ramon Skyway, Wilkinsonhaven, VT 92035",18.0,18.0,18.0,2024-12-16 02:46:00.000,2024-12-16,2024,12,16,47063,[],()
67176,45716,18873,2,68.USD,09/27/24 15:58:32,,68.0,68.0,136.0,2024-09-27 15:58:32.000,2024-09-27,2024,9,27,47099,[],()
63211,46107,19513,3,$ 26.,"2024-06-29, 07:24",,26.0,26.0,78.0,2024-06-29 07:24:00.000,2024-06-29,2024,6,29,46107,[],()
65337,46698,19346,1,$36.0,"2025-07-23,12:44:01 P.M.",NULL,36.0,36.0,36.0,2025-07-23 12:44:01.000,2025-07-23,2025,7,23,46698,[],()
65306,44360,19043,1,$ 19.25,"15:49, 12/07/24",NULL,19.25,19.25,19.25,2024-12-07 15:49:00.000,2024-12-07,2024,12,7,44360,[],()
66595,46345,19231,1,$13.,09:46 02/06/24,"Suite 844 9967 Katelin Spurs, Manuelberg, OH 67031-4056",13.0,13.0,13.0,2024-02-06 09:46:00.000,2024-02-06,2024,2,6,46345,[],()
71557,46091,18993,2,64.50€,"08/15/24,04:18",,77.39999999999999,77.39999999999999,154.8,2024-08-15 04:18:00.000,2024-08-15,2024,8,15,46091,[],()
67003,46419,18944,4,16.25$,"06/16/24, 01:08",,16.25,16.25,65.0,2024-06-16 01:08:00.000,2024-06-16,2024,6,16,46419,[],()
73323,46104,19065,1,20.75 EUR,"2025-03-16,21:58",NULL,24.9,24.9,24.9,2025-03-16 21:58:00.000,2025-03-16,2025,3,16,46104,[],()
73153,46300,19021,2,35.50 $,06:08:46 P.M.;2024-10-25,NULL,35.5,35.5,71.0,2024-10-25 18:08:46.000,2024-10-25,2024,10,25,46300,[],()
65120,47567,19256,1,USD63.5,"2024-07-22,06:48:45 PM",NULL,63.5,63.5,63.5,2024-07-22 18:48:45.000,2024-07-22,2024,7,22,47567,[],()
71760,44852,19189,2,21.5EUR,03:51:53;05/02/25,,25.8,25.8,51.6,2025-05-02 03:51:53.000,2025-05-02,2025,5,2,44852,[],()
73613,46919,19554,3,EUR61., 2-DEC-2024;10:30:52,NULL,73.2,73.2,219.6,2024-12-02 10:30:52.000,2024-12-02,2024,12,2,46919,[],()
62787,45119,18859,1,USD 55.00,2024-05-10T09:10:03,"474 Ignacio Ports, Port Vernellville, NY 69844-0415",55.0,55.0,55.0,2024-05-10 09:10:03.000,2024-05-10,2024,5,10,45119,[],()
71737,44728,18966,1,$ 55.50,18.03.2025 09:38:38,"Apt. 635 872 Cummings Unions, East Manie, FL 28054",55.5,55.5,55.5,2025-03-18 09:38:38.000,2025-03-18,2025,3,18,44728,[],()
62858,45218,19447,1,$26¢75,2024-12-23;07:54:34,NULL,2675.0,2675.0,2675.0,2024-12-23 07:54:34.000,2024-12-23,2024,12,23,46014,[],()
71776,45998,19409,1,19.0$,"07:14:15 PM,  7-Jan-2025",NULL,19.0,19.0,19.0,2025-01-07 19:14:15.000,2025-01-07,2025,1,7,45998,[],()
72718,45678,19170,1,€68¢50,21:51:42;2025-02-27,NULL,8220.0,8220.0,8220.0,2025-02-27 21:51:42.000,2025-02-27,2025,2,27,45678,[],()
65126,47274,19506,4,61.75 $,2024-12-31 23:10,"Suite 541 86944 Bennett Squares, West Timmyside, KY 70868-7635",61.75,61.75,247.0,2024-12-31 23:10:00.000,2024-12-31,2024,12,31,47274,[],()
70608,46364,19464,1,USD42.00,"05:41,06/12/24",,42.0,42.0,42.0,2024-06-12 05:41:00.000,2024-06-12,2024,6,12,46364,[],()
70661,46491,19523,1,32.50USD,2024-10-25T17:55:18.217,"1841 Volkman Valley, VonRuedenmouth, WA 84133",32.5,32.5,32.5,2024-10-25 17:55:18.217,2024-10-25,2024,10,25,46491,[],()
69036,47553,19481,1,64.0$,"23:02:10,11/22/24",NULL,64.0,64.0,64.0,2024-11-22 23:02:10.000,2024-11-22,2024,11,22,47553,[],()
72417,46208,19038,1,61.99 EUR,"05:39:57 PM,2024-12-23",,74.388,74.388,74.39,2024-12-23 17:39:57.000,2024-12-23,2024,12,23,46208,[],()
64018,46186,19389,4,18.75€,07/02/25 13:32:17,,22.5,22.5,90.0,2025-07-02 13:32:17.000,2025-07-02,2025,7,2,46186,[],()
72160,46995,19012,1,45.00 $,2025-01-01 05:12:27,,45.0,45.0,45.0,2025-01-01 05:12:27.000,2025-01-01,2025,1,1,46995,[],()
65184,47245,19583,1,54.5$,11/11/24 20:04,,54.5,54.5,54.5,2024-11-11 20:04:00.000,2024-11-11,2024,11,11,47245,[],()
63758,45448,19338,3,€69.5,09/10/24 06:33:10 A.M.,,83.39999999999999,83.39999999999999,250.2,2024-09-10 06:33:10.000,2024-09-10,2024,9,10,45448,[],()
66438,45013,19233,1,€ 69.,"2024-08-08, 02:45:27 PM",,82.8,82.8,82.8,2024-08-08 14:45:27.000,2024-08-08,2024,8,8,45013,[],()
67997,45956,19289,1,USD 31.0,Mon Sep  9 11:10:02 2024,,31.0,31.0,31.0,2024-09-09 11:10:02.000,2024-09-09,2024,9,9,45956,[],()
72540,45215,19047,3,46.25 EUR,"03:40:30 am,04/06/25",,55.5,55.5,166.5,2025-04-06 03:40:30.000,2025-04-06,2025,4,6,45215,[],()
69883,46419,19449,1,47.5 $,"2025-02-18, 22:35:13",,47.5,47.5,47.5,2025-02-18 22:35:13.000,2025-02-18,2025,2,18,46419,[],()
69975,47078,18975,1,$55.,03:51 2025-06-05,,55.0,55.0,55.0,2025-06-05 03:51:00.000,2025-06-05,2025,6,5,47078,[],()
67799,45493,19543,3,USD42.25,26-Dec-2024 00:41:37,NULL,42.25,42.25,126.75,2024-12-26 00:41:37.000,2024-12-26,2024,12,26,45493,[],()
71217,44516,19281,1,38.99USD,21:25;2024-09-13,,38.99,38.99,38.99,2024-09-13 21:25:00.000,2024-09-13,2024,9,13,44516,[],()
63423,46623,19444,1,€44¢25,"07:25:42,2024-10-04","8132 Marcie Fort, New Barrett, NJ 08508",5310.0,5310.0,5310.0,2024-10-04 07:25:42.000,2024-10-04,2024,10,4,46623,[],()
62867,45203,19371,2,USD67.75,05/18/25;15:55:43,,67.75,67.75,135.5,2025-05-18 15:55:43.000,2025-05-18,2025,5,18,45203,[],()
67816,47275,19189,1,€23.75,2024-11-25 04:37:27,,28.5,28.5,28.5,2024-11-25 04:37:27.000,2024-11-25,2024,11,25,47275,[],()
66128,46864,18998,1,47€50¢,22:57 25-SEP-2024,,5700.0,5700.0,5700.0,2024-09-25 22:57:00.000,2024-09-25,2024,9,25,46864,[],()
66859,45349,19488,3,73 $,"02:29:05 AM,12/27/24",,73.0,73.0,219.0,2024-12-27 02:29:05.000,2024-12-27,2024,12,27,46480,[],()
65475,47017,19074,5,69.75€,12/30/24;09:34:48,,83.7,83.7,418.5,2024-12-30 09:34:48.000,2024-12-30,2024,12,30,47017,[],()
68646,44824,18943,1,69.99 $,"11:41:25 PM,06/02/25","Apt. 897 9422 Jeremy Common, East Katharynmouth, NE 70113-1548",69.99,69.99,69.99,2025-06-02 23:41:25.000,2025-06-02,2025,6,2,44824,[],()
65639,45953,19283,1,17.50EUR,06:43:40 P.M.;09/01/24,NULL,21.0,21.0,21.0,2024-09-01 18:43:40.000,2024-09-01,2024,9,1,45953,[],()
69054,46721,19146,1,€64¢75,08:56;12/12/24,,7770.0,7770.0,7770.0,2024-12-12 08:56:00.000,2024-12-12,2024,12,12,46721,[],()
63183,46819,19404,1,29 $,11-MAY-2024;10:37:07 AM,NULL,29.0,29.0,29.0,2024-05-11 10:37:07.000,2024-05-11,2024,5,11,46819,[],()
68470,44659,19517,1,71.25 USD,"03:17:34 am,2024-10-22",NULL,71.25,71.25,71.25,2024-10-22 03:17:34.000,2024-10-22,2024,10,22,44659,[],()
67723,45918,19438,1,USD 72,"21:26, 12/27/24",,72.0,72.0,72.0,2024-12-27 21:26:00.000,2024-12-27,2024,12,27,45918,[],()
70977,45096,19312,1,€73¢25,"07:47:42, 05/11/24",,8790.0,8790.0,8790.0,2024-05-11 07:47:42.000,2024-05-11,2024,5,11,45096,[],()
70609,44439,18930,1,35.75 USD,19:43 2024-11-01,,35.75,35.75,35.75,2024-11-01 19:43:00.000,2024-11-01,2024,11,1,44439,[],()
64375,46703,19253,1,USD 39.,02:51:37 A.M.  1-May-2025,,39.0,39.0,39.0,2025-05-01 02:51:37.000,2025-05-01,2025,5,1,46703,[],()
70177,47608,19407,1,21.00 USD,2024-12-07T23:54:04.292,"Suite 878 40616 Robin Street, Kunzeland, NC 48154",21.0,21.0,21.0,2024-12-07 23:54:04.292,2024-12-07,2024,12,7,47608,[],()
62894,45240,19098,1,USD60.75,2024-12-19T23:16:00,,60.75,60.75,60.75,2024-12-19 23:16:00.000,2024-12-19,2024,12,19,45240,[],()
73645,46637,19262,1,71 EUR, 5-Mar-2025 09:11:21 pm,NULL,85.2,85.2,85.2,2025-03-05 21:11:21.000,2025-03-05,2025,3,5,46637,[],()
66978,46225,19138,1,EUR 28.75," 6-March-2025, 06:14:24 PM","2620 Stoltenberg Village, Huelmouth, SD 33087",34.5,34.5,34.5,2025-03-06 18:14:24.000,2025-03-06,2025,3,6,46225,[],()
65079,45864,18985,1,54 €,"01:32:25, 2024-10-13",,64.8,64.8,64.8,2024-10-13 01:32:25.000,2024-10-13,2024,10,13,45203,[],()
64126,45647,19184,1,17.00$,"11:56:16 A.M.,2024-08-10","Suite 547 7112 Nita Villages, Lindgrenside, WI 74504",17.0,17.0,17.0,2024-08-10 11:56:16.000,2024-08-10,2024,8,10,45647,[],()
63654,45935,19168,2,62.75USD,11/01/24 00:38,,62.75,62.75,125.5,2024-11-01 00:38:00.000,2024-11-01,2024,11,1,45935,[],()
65291,47206,19271,3,USD 45.50,"23:33,21-OCT-2024","Suite 151 73077 Milissa Ports, Gleasonchester, WY 07834-2282",45.5,45.5,136.5,2024-10-21 23:33:00.000,2024-10-21,2024,10,21,47206,[],()
71775,44345,19313,2,€25.75,2025-04-17 05:30:59 pm,"Apt. 931 2246 Bradtke Forge, East Dawne, SD 34463",30.9,30.9,61.8,2025-04-17 17:30:59.000,2025-04-17,2025,4,17,44345,[],()
67869,44505,19471,2,40.5 EUR,2024-09-05;20:35:45,,48.6,48.6,97.2,2024-09-05 20:35:45.000,2024-09-05,2024,9,5,44505,[],()
66922,47429,19394,1,USD16.0,"07/24/24,05:58:22 pm",,16.0,16.0,16.0,2024-07-24 17:58:22.000,2024-07-24,2024,7,24,47429,[],()
72163,46856,19246,1,22.0$,06/18/24;04:49:58,"Suite 174 6532 Pfeffer Fork, North Alexia, NJ 59004",22.0,22.0,22.0,2024-06-18 04:49:58.000,2024-06-18,2024,6,18,46856,[],()
71478,45948,19560,1,26.25USD,2024-06-21;02:13:45 PM,NULL,26.25,26.25,26.25,2024-06-21 14:13:45.000,2024-06-21,2024,6,21,45948,[],()
67336,44761,19217,1,€ 31.0,2024-11-07;02:49:32 AM,"Apt. 309 1105 Rudolph Lodge, North Ismael, KS 36239",37.199999999999996,37.199999999999996,37.2,2024-11-07 02:49:32.000,2024-11-07,2024,11,7,44761,[],()
68790,46547,19296,1,$25.50,"14:32:14,2024-12-26",,25.5,25.5,25.5,2024-12-26 14:32:14.000,2024-12-26,2024,12,26,46547,[],()
66694,46012,18939,1,52.75 $,2024-06-13T01:59:29,,52.75,52.75,52.75,2024-06-13 01:59:29.000,2024-06-13,2024,6,13,46579,[],()
70681,45926,19523,1,$ 30.25," 7-OCT-2024,08:07:24 AM",,30.25,30.25,30.25,2024-10-07 08:07:24.000,2024-10-07,2024,10,7,45926,[],()
68021,46079,19387,1,60$99¢,03:51:18 14-March-2025,"Suite 110 8617 Wes Manor, Nienowmouth, AZ 40156-4440",6099.0,6099.0,6099.0,2025-03-14 03:51:18.000,2025-03-14,2025,3,14,46079,[],()
70057,45546,19581,1,$ 25.50,Sat Mar 15 13:22:37 2025,,25.5,25.5,25.5,2025-03-15 13:22:37.000,2025-03-15,2025,3,15,45546,[],()
63862,46281,19226,1,25.$,"11:33:23 A.M.,11/30/24",,25.0,25.0,25.0,2024-11-30 11:33:23.000,2024-11-30,2024,11,30,46281,[],()
71602,46496,19235,3,62.50$,08:12:52 AM;17-Dec-2024,,62.5,62.5,187.5,2024-12-17 08:12:52.000,2024-12-17,2024,12,17,46496,[],()
65937,46642,18894,1,USD 24.75,20:29;2024-12-09,,24.75,24.75,24.75,2024-12-09 20:29:00.000,2024-12-09,2024,12,9,46642,[],()
72158,44378,19460,1,$36.00,"16-Jun-2025, 09:22:34 pm",,36.0,36.0,36.0,2025-06-16 21:22:34.000,2025-06-16,2025,6,16,44378,[],()
67072,45530,19163,1,16€50¢,2024-11-28T12:37:16,,1980.0,1980.0,1980.0,2024-11-28 12:37:16.000,2024-11-28,2024,11,28,45530,[],()
68328,45630,19331,1,32.25$,"2024-09-23,21:11",NULL,32.25,32.25,32.25,2024-09-23 21:11:00.000,2024-09-23,2024,9,23,45630,[],()
69689,47034,18840,3,€48.75,13.07.2024 23:41:41,"7390 Dietrich Brook, Port Cole, AR 60542-4610",58.5,58.5,175.5,2024-07-13 23:41:41.000,2024-07-13,2024,7,13,47034,[],()
69096,44519,19218,2,70.0 €,16:32;05/19/25,,84.0,84.0,168.0,2025-05-19 16:32:00.000,2025-05-19,2025,5,19,44519,[],()
64871,45429,19051,1,73.00 $," 4-April-2025,23:35:00",,73.0,73.0,73.0,2025-04-04 23:35:00.000,2025-04-04,2025,4,4,45429,[],()
63770,46815,19292,1,USD51.50,04:29;11/13/24,,51.5,51.5,51.5,2024-11-13 04:29:00.000,2024-11-13,2024,11,13,46815,[],()
67190,45806,19392,2,USD 49.,2024-09-24;10:33:12 P.M.,,49.0,49.0,98.0,2024-09-24 22:33:12.000,2024-09-24,2024,9,24,45806,[],()
72571,46374,18916,5,EUR 56,"06:21, 11/22/24",NULL,67.2,67.2,336.0,2024-11-22 06:21:00.000,2024-11-22,2024,11,22,46374,[],()
68804,44785,19352,1,EUR 33.99,22:53 08/12/24,,40.788000000000004,40.788000000000004,40.79,2024-08-12 22:53:00.000,2024-08-12,2024,8,12,44785,[],()
71971,47492,19323,1,45.99 EUR,"08/03/24, 19:38:17",,55.188,55.188,55.19,2024-08-03 19:38:17.000,2024-08-03,2024,8,3,47492,[],()
65910,47364,19083,1,51$25¢,2024-10-20T04:04:06,,5125.0,5125.0,5125.0,2024-10-20 04:04:06.000,2024-10-20,2024,10,20,47364,[],()
70051,45513,19396,1,46.5$,"06:40, 11/13/24",NULL,46.5,46.5,46.5,2024-11-13 06:40:00.000,2024-11-13,2024,11,13,45513,[],()
72212,46737,19516,1,41€99¢,"23:43, 2024-10-16","314 Welch Land, North Chelsie, ND 63976-7158",5038.8,5038.8,5038.8,2024-10-16 23:43:00.000,2024-10-16,2024,10,16,45965,[],()
73019,46234,19301,5,EUR68.99,"16-Mar-2025,11:49:55 AM",,82.788,82.788,413.94,2025-03-16 11:49:55.000,2025-03-16,2025,3,16,46234,[],()
68942,44736,18937,1,65.99 USD,02/17/25 05:31,NULL,65.99,65.99,65.99,2025-02-17 05:31:00.000,2025-02-17,2025,2,17,44736,[],()
72113,46813,18900,2,63.25$,2025-03-22 02:47:17 PM,NULL,63.25,63.25,126.5,2025-03-22 14:47:17.000,2025-03-22,2025,3,22,46813,[],()
67773,45430,19046,1,EUR 19.00,07:43:52;30-MAR-2025,,22.8,22.8,22.8,2025-03-30 07:43:52.000,2025-03-30,2025,3,30,45430,[],()
70503,45340,19377,1,51.25 USD,20-JUL-2025 11:13,,51.25,51.25,51.25,2025-07-20 11:13:00.000,2025-07-20,2025,7,20,45340,[],()
69377,47621,19013,1,$ 49.,"2025-04-21, 02:27:30",,49.0,49.0,49.0,2025-04-21 02:27:30.000,2025-04-21,2025,4,21,47621,[],()
66391,45204,19492,1,€48.25,"12:41:38 pm,11/08/24",,57.9,57.9,57.9,2024-11-08 12:41:38.000,2024-11-08,2024,11,8,45204,[],()
70247,46020,19071,1,14.$,"19:59:45,05/05/25",,14.0,14.0,14.0,2025-05-05 19:59:45.000,2025-05-05,2025,5,5,46020,[],()
63126,47002,19482,1,EUR25.99,"10:27,2024-07-13",,31.187999999999995,31.187999999999995,31.19,2024-07-13 10:27:00.000,2024-07-13,2024,7,13,47002,[],()
68702,46870,19352,2,USD33.0,04:28:09 A.M.; 2-Jul-2024,,33.0,33.0,66.0,2024-07-02 04:28:09.000,2024-07-02,2024,7,2,46870,[],()
73141,44676,19220,2,60.00$,09:42;12-Aug-2024,,60.0,60.0,120.0,2024-08-12 09:42:00.000,2024-08-12,2024,8,12,44676,[],()
68629,45667,19123,1,53.5USD,08:44:07 AM 09/08/24,,53.5,53.5,53.5,2024-09-08 08:44:07.000,2024-09-08,2024,9,8,45667,[],()
66511,44383,19320,1,27.5€,25-Feb-2025;13:17:08,,33.0,33.0,33.0,2025-02-25 13:17:08.000,2025-02-25,2025,2,25,44383,[],()
66980,47028,19269,3,€ 27.0,2024-08-11T10:04:41,"2810 Jama Junction, Bennyfort, SD 74014",32.4,32.4,97.2,2024-08-11 10:04:41.000,2024-08-11,2024,8,11,47028,[],()
66033,44557,19567,1,46.50 $,04/24/24;07:54:36 pm,"Suite 335 1633 Cole Loaf, Kingville, LA 22356-2257",46.5,46.5,46.5,2024-04-24 19:54:36.000,2024-04-24,2024,4,24,44557,[],()
73837,45027,19111,2,26.75 €,"08:30:47,08/29/24",,32.1,32.1,64.2,2024-08-29 08:30:47.000,2024-08-29,2024,8,29,45027,[],()
63132,45608,19175,1,37.00USD,02:35:39; 1-SEP-2024,,37.0,37.0,37.0,2024-09-01 02:35:39.000,2024-09-01,2024,9,1,45608,[],()
64413,44770,19156,2,$41.00,11:57:06 P.M.;11/22/24,NULL,41.0,41.0,82.0,2024-11-22 23:57:06.000,2024-11-22,2024,11,22,44770,[],()
62853,44570,19445,1,59. USD,"09:31:42 pm, 8-March-2025",,59.0,59.0,59.0,2025-03-08 21:31:42.000,2025-03-08,2025,3,8,44570,[],()
64088,44953,18917,1,67.0USD,2025-01-06T04:09:10,"6584 Vanessa Loaf, South Keisha, NE 95393",67.0,67.0,67.0,2025-01-06 04:09:10.000,2025-01-06,2025,1,6,44953,[],()
64580,45433,19388,2,52.50 $,02/13/25 15:14:41,,52.5,52.5,105.0,2025-02-13 15:14:41.000,2025-02-13,2025,2,13,45433,[],()
69011,47167,19478,1,57.00USD,25.03.2025 01:27:27,NULL,57.0,57.0,57.0,2025-03-25 01:27:27.000,2025-03-25,2025,3,25,47208,[],()
63597,47450,18886,1,$67,"22:45:05, 12-Sep-2024",,67.0,67.0,67.0,2024-09-12 22:45:05.000,2024-09-12,2024,9,12,47450,[],()
72028,46326,18857,1,68USD,"03:12,2024-09-24",,68.0,68.0,68.0,2024-09-24 03:12:00.000,2024-09-24,2024,9,24,46326,[],()
72556,45782,19107,2,72.25 USD,03:17:08 am 2025-02-15,NULL,72.25,72.25,144.5,2025-02-15 03:17:08.000,2025-02-15,2025,2,15,45782,[],()
69720,45772,19072,1,62.75€,"06/22/24, 10:56",,75.3,75.3,75.3,2024-06-22 10:56:00.000,2024-06-22,2024,6,22,45772,[],()
69783,44567,18919,1,$20.5,20-October-2024 14:25,,20.5,20.5,20.5,2024-10-20 14:25:00.000,2024-10-20,2024,10,20,44567,[],()
65991,45679,19550,2,$35¢25,"01:39:20 AM,  1-December-2024",,3525.0,3525.0,7050.0,2024-12-01 01:39:20.000,2024-12-01,2024,12,1,45679,[],()
68143,46695,19237,2,67.€, 1-Sep-2024;02:56,NULL,80.39999999999999,80.39999999999999,160.8,2024-09-01 02:56:00.000,2024-09-01,2024,9,1,46695,[],()
69992,45855,18866,1,EUR21.5,30.01.2025 04:45:45,,25.8,25.8,25.8,2025-01-30 04:45:45.000,2025-01-30,2025,1,30,45855,[],()
64838,45094,19488,1,71.5 USD,06:02;2025-01-03,NULL,71.5,71.5,71.5,2025-01-03 06:02:00.000,2025-01-03,2025,1,3,45094,[],()
70300,45252,19185,1,USD 59.5,"10/18/24,03:51:00",,59.5,59.5,59.5,2024-10-18 03:51:00.000,2024-10-18,2024,10,18,45252,[],()
68224,45906,19167,2,$ 42.99,"18:44, 2025-01-26",,42.99,42.99,85.98,2025-01-26 18:44:00.000,2025-01-26,2025,1,26,45906,[],()
65551,46166,19247,1,€63,"24-November-2024, 18:21:57","Suite 440 722 Rocco Glens, Bahringerville, NV 68760",75.6,75.6,75.6,2024-11-24 18:21:57.000,2024-11-24,2024,11,24,46166,[],()
69156,45817,18901,1,€76.25,03/04/24;06:22:56,"2516 Esther Loaf, East Laticiaborough, NH 32278-0141",91.5,91.5,91.5,2024-03-04 06:22:56.000,2024-03-04,2024,3,4,45817,[],()
67440,45850,19211,1,USD48.99,"07:21, 01/01/25","78819 Sawayn Mountains, Trompmouth, OK 00497-1474",48.99,48.99,48.99,2025-01-01 07:21:00.000,2025-01-01,2025,1,1,45850,[],()
71790,46769,19137,1,$ 51.,16-October-2024;01:00,"3502 Jeromy Corner, North Sol, HI 45275-4149",51.0,51.0,51.0,2024-10-16 01:00:00.000,2024-10-16,2024,10,16,46769,[],()
69690,47172,19173,1,USD59,"2024-09-02, 06:45:36 am",,59.0,59.0,59.0,2024-09-02 06:45:36.000,2024-09-02,2024,9,2,47172,[],()
73402,46720,19289,1,USD32.0,04:01:29 08/02/24,,32.0,32.0,32.0,2024-08-02 04:01:29.000,2024-08-02,2024,8,2,46720,[],()
67793,46090,19563,3,69.25 €," 5-February-2025, 04:03:34 P.M.",NULL,83.1,83.1,249.3,2025-02-05 16:03:34.000,2025-02-05,2025,2,5,46090,[],()
67022,47066,19121,1,71.0 EUR,00:30 2025-01-21,,85.2,85.2,85.2,2025-01-21 00:30:00.000,2025-01-21,2025,1,21,47066,[],()
72017,46937,19587,5,32.25 EUR,10/21/24 22:00:14,"721 Mante Fork, New Leif, OH 96093",38.699999999999996,38.699999999999996,193.5,2024-10-21 22:00:14.000,2024-10-21,2024,10,21,46937,[],()
72873,44440,19438,2,$ 72.75,"2024-09-21,07:28",,72.75,72.75,145.5,2024-09-21 07:28:00.000,2024-09-21,2024,9,21,44440,[],()
65562,45920,19279,1,18.0 $,"28-Jan-2025, 16:55:11",,18.0,18.0,18.0,2025-01-28 16:55:11.000,2025-01-28,2025,1,28,45920,[],()
64564,46305,18974,2,€40¢25,"2024-05-03, 00:11:58","Apt. 702 769 Murazik Highway, Willyborough, WV 10452-3464",4830.0,4830.0,9660.0,2024-05-03 00:11:58.000,2024-05-03,2024,5,3,46305,[],()
70314,44826,19040,4,$19.75,"17:49,23-December-2024",,19.75,19.75,79.0,2024-12-23 17:49:00.000,2024-12-23,2024,12,23,44826,[],()
72971,45539,19142,1,38.00USD,09/06/24 10:10:58 P.M.,,38.0,38.0,38.0,2024-09-06 22:10:58.000,2024-09-06,2024,9,6,45539,[],()
66444,46668,18874,1,USD 55.00,"2024-07-03,04:41:22",NULL,55.0,55.0,55.0,2024-07-03 04:41:22.000,2024-07-03,2024,7,3,46668,[],()
72142,46081,19486,1,€45¢50,26-December-2024;10:24:05 PM,"78420 Chester Tunnel, Kuphaltown, MD 79070-0817",5460.0,5460.0,5460.0,2024-12-26 22:24:05.000,2024-12-26,2024,12,26,46081,[],()
70801,47447,18971,1,EUR 54.5,"2025-07-17,07:44:29 A.M.",NULL,65.39999999999999,65.39999999999999,65.4,2025-07-17 07:44:29.000,2025-07-17,2025,7,17,47063,[],()
66418,45427,18948,1,20$75¢,2025-05-10T07:37:23.898,NULL,2075.0,2075.0,2075.0,2025-05-10 07:37:23.898,2025-05-10,2025,5,10,45427,[],()
62998,45044,18927,1,$63.75,Sun Dec 15 02:21:09 2024,"4267 Dirk Cliff, New Marjorymouth, PA 73279",63.75,63.75,63.75,2024-12-15 02:21:09.000,2024-12-15,2024,12,15,45044,[],()
64650,45563,19101,1,€ 70.75,"10/04/24,11:56:37",,84.89999999999999,84.89999999999999,84.9,2024-10-04 11:56:37.000,2024-10-04,2024,10,4,45563,[],()
65104,46010,18929,2,45.0$, 7-Jul-2024 06:06,"Apt. 278 682 Yost Avenue, West Corrina, AZ 55572-5900",45.0,45.0,90.0,2024-07-07 06:06:00.000,2024-07-07,2024,7,7,46010,[],()
66501,47007,19411,2,43.75 EUR,21:02 07/06/24,,52.5,52.5,105.0,2024-07-06 21:02:00.000,2024-07-06,2024,7,6,47007,[],()
67972,45311,19535,2,64.0€,2024-08-13T14:19:03.322,,76.8,76.8,153.6,2024-08-13 14:19:03.322,2024-08-13,2024,8,13,45311,[],()
64477,46890,19475,1,39.50€,2024-11-05T05:31:43.089,NULL,47.4,47.4,47.4,2024-11-05 05:31:43.089,2024-11-05,2024,11,5,46890,[],()
65835,47013,19368,1,$28.5,07:02:20;22-October-2024,,28.5,28.5,28.5,2024-10-22 07:02:20.000,2024-10-22,2024,10,22,47013,[],()
67862,45257,19359,1,EUR 47.00, 9-Sep-2024;04:53:40 A.M.,,56.4,56.4,56.4,2024-09-09 04:53:40.000,2024-09-09,2024,9,9,45257,[],()
71987,46759,19266,1,€49¢50,2025-02-15 11:10:46,,5940.0,5940.0,5940.0,2025-02-15 11:10:46.000,2025-02-15,2025,2,15,46759,[],()
71242,44940,19414,1,$ 58.25,"04:19:36, 08/07/25",,58.25,58.25,58.25,2025-08-07 04:19:36.000,2025-08-07,2025,8,7,44940,[],()
72791,46079,18908,1,43.5$,"2025-01-20, 16:52:58","Suite 110 8617 Wes Manor, Nienowmouth, AZ 40156-4440",43.5,43.5,43.5,2025-01-20 16:52:58.000,2025-01-20,2025,1,20,46079,[],()
65440,47065,19193,1,16.00€,21-Sep-2024;08:06:04 P.M.,NULL,19.2,19.2,19.2,2024-09-21 20:06:04.000,2024-09-21,2024,9,21,47065,[],()
69204,46793,19030,3,24.75 $,2025-04-19 11:52,,24.75,24.75,74.25,2025-04-19 11:52:00.000,2025-04-19,2025,4,19,46793,[],()
68414,45049,19091,1,$ 24.50,2024-06-14 07:22:42 AM,"46135 Deon Forge, Tabethaburgh, MS 52009",24.5,24.5,24.5,2024-06-14 07:22:42.000,2024-06-14,2024,6,14,45049,[],()
72729,47096,18850,1,$33.0, 9-November-2024 22:39:14,"Suite 407 2662 Lashay Common, East Garrett, KS 18559-8428",33.0,33.0,33.0,2024-11-09 22:39:14.000,2024-11-09,2024,11,9,47096,[],()
65243,46789,19544,1,USD41.75,11:16:58 P.M.;2024-06-08,,41.75,41.75,41.75,2024-06-08 23:16:58.000,2024-06-08,2024,6,8,46789,[],()
70336,46137,19208,2,56.99 €,2024-08-13T03:46:44.565,"84208 Rolf Roads, Sharitafurt, DE 85104-3737",68.388,68.388,136.78,2024-08-13 03:46:44.565,2024-08-13,2024,8,13,46137,[],()
68728,45490,19186,1,26$,2024-09-28T17:51:03,,26.0,26.0,26.0,2024-09-28 17:51:03.000,2024-09-28,2024,9,28,45490,[],()
65761,47066,19571,2,17.5 USD," 1-December-2024,21:28:42",,17.5,17.5,35.0,2024-12-01 21:28:42.000,2024-12-01,2024,12,1,47066,[],()
73811,47323,18897,1,53.5 USD,"2025-02-27, 12:20:56 AM",,53.5,53.5,53.5,2025-02-27 00:20:56.000,2025-02-27,2025,2,27,47323,[],()
73438,46228,19350,1,€ 28.25,2024-10-06;18:39:26,"Apt. 646 83932 Eugenio Ports, Lake Silvanashire, NM 73569",33.9,33.9,33.9,2024-10-06 18:39:26.000,2024-10-06,2024,10,6,46228,[],()
67506,47096,19415,1,15.50USD,09:54:49 12/11/24,NULL,15.5,15.5,15.5,2024-12-11 09:54:49.000,2024-12-11,2024,12,11,47096,[],()
69249,46841,18923,1,27. €,"08:02, 06/01/25","251 Gidget Crossing, West Tilda, VA 82627",32.4,32.4,32.4,2025-06-01 08:02:00.000,2025-06-01,2025,6,1,46841,[],()
65185,46957,19146,1,65 $,15-March-2025 21:25:26,"2112 Luann Port, Jacelynberg, NJ 27829-3725",65.0,65.0,65.0,2025-03-15 21:25:26.000,2025-03-15,2025,3,15,46957,[],()
66632,45491,18899,1,$ 28.00,"17:42, 01/10/25","Suite 948 8062 Rosenbaum Springs, Harveyhaven, MA 14197",28.0,28.0,28.0,2025-01-10 17:42:00.000,2025-01-10,2025,1,10,45491,[],()
72678,47387,19026,5,USD21.00,"2024-09-21, 20:31",NULL,21.0,21.0,105.0,2024-09-21 20:31:00.000,2024-09-21,2024,9,21,47387,[],()
64733,44474,19531,1,€29¢75,15:39;2025-02-21,"Suite 714 684 Botsford Pine, Tannerville, CA 17350",3570.0,3570.0,3570.0,2025-02-21 15:39:00.000,2025-02-21,2025,2,21,44474,[],()
72100,47363,18933,1,$ 37.50,"26-Aug-2025,21:10:51",NULL,37.5,37.5,37.5,2025-08-26 21:10:51.000,2025-08-26,2025,8,26,47363,[],()
67726,47483,19192,3,USD62.00,01:09:23 2024-10-26,"59839 Hauck Pine, Metzchester, OH 04201-3616",62.0,62.0,186.0,2024-10-26 01:09:23.000,2024-10-26,2024,10,26,47483,[],()
70506,46314,18996,1,$47.50,2024-12-30T10:53:05,NULL,47.5,47.5,47.5,2024-12-30 10:53:05.000,2024-12-30,2024,12,30,46314,[],()
71601,46584,19505,1,17$,"2024-12-22, 01:49:23 P.M.",,17.0,17.0,17.0,2024-12-22 13:49:23.000,2024-12-22,2024,12,22,46584,[],()
71726,47084,19216,1,62.00USD,2024-12-15T00:53:24,,62.0,62.0,62.0,2024-12-15 00:53:24.000,2024-12-15,2024,12,15,47084,[],()
72588,46458,18851,1,61.5$,15:40;2025-05-24,,61.5,61.5,61.5,2025-05-24 15:40:00.000,2025-05-24,2025,5,24,46458,[],()
69766,47580,18928,3,USD 18.75,"07:47:18 A.M., 21-Jan-2025",NULL,18.75,18.75,56.25,2025-01-21 07:47:18.000,2025-01-21,2025,1,21,47580,[],()
64044,47338,19476,1,EUR 20.5,"19-October-2024, 08:27:59","958 Zulauf Lodge, Izolaburgh, ME 53005-8321",24.599999999999998,24.599999999999998,24.6,2024-10-19 08:27:59.000,2024-10-19,2024,10,19,47338,[],()
63863,47578,19333,1,30.25USD,06:30:48 2024-09-17,"Apt. 353 950 Schoen Mountain, South Davinachester, NE 21867-9337",30.25,30.25,30.25,2024-09-17 06:30:48.000,2024-09-17,2024,9,17,47578,[],()
67556,47015,19516,1,36.5$,2024-11-21T14:48:37,"Apt. 421 32379 Bauch Branch, North Elliottland, IA 60167",36.5,36.5,36.5,2024-11-21 14:48:37.000,2024-11-21,2024,11,21,47015,[],()
70322,44982,19079,1,€25¢75,11:45 2024-10-24,"559 Elida Cape, Clorindaport, MD 85716-7691",3090.0,3090.0,3090.0,2024-10-24 11:45:00.000,2024-10-24,2024,10,24,44982,[],()
65879,46075,19131,5,USD56.75,2024-07-17T09:25:57,"Apt. 857 20568 Murazik Springs, West Kortneyshire, TN 54642",56.75,56.75,283.75,2024-07-17 09:25:57.000,2024-07-17,2024,7,17,45712,[],()
71935,44434,19163,2,14.50 $,"2024-10-24, 09:20:27 AM",NULL,14.5,14.5,29.0,2024-10-24 09:20:27.000,2024-10-24,2024,10,24,44434,[],()
64112,46059,19524,1,$47.5,"18:36:09,2025-04-24","Apt. 331 81341 Koelpin Knolls, East Ernestside, CA 96086",47.5,47.5,47.5,2025-04-24 18:36:09.000,2025-04-24,2025,4,24,46059,[],()
66304,46508,19310,1,23.00$,"09/02/24, 04:14:57",,23.0,23.0,23.0,2024-09-02 04:14:57.000,2024-09-02,2024,9,2,46508,[],()
71735,45177,19093,2,27.25USD,"20:48:52, 2025-03-22",NULL,27.25,27.25,54.5,2025-03-22 20:48:52.000,2025-03-22,2025,3,22,45177,[],()
72745,45680,19284,1,€50.99,"2024-06-02, 11:57:19 am",NULL,61.188,61.188,61.19,2024-06-02 11:57:19.000,2024-06-02,2024,6,2,45680,[],()
66952,45352,18945,1,47.99USD,03/02/25 18:27,"Suite 535 1879 Kessler Skyway, Port Adalbertoside, NV 83592-1230",47.99,47.99,47.99,2025-03-02 18:27:00.000,2025-03-02,2025,3,2,45352,[],()
68603,45658,19518,1,$ 25.5,19:10:43;15-Oct-2024,"Apt. 492 174 Homenick Vista, Effertztown, UT 72944-0170",25.5,25.5,25.5,2024-10-15 19:10:43.000,2024-10-15,2024,10,15,45658,[],()
68080,46233,19054,1,USD41.99,2024-11-17T11:27:04,,41.99,41.99,41.99,2024-11-17 11:27:04.000,2024-11-17,2024,11,17,46233,[],()
69515,44848,18972,1,25.USD,"10:24:00 PM, 8-January-2025",,25.0,25.0,25.0,2025-01-08 22:24:00.000,2025-01-08,2025,1,8,44848,[],()
66893,46686,19323,1,EUR41.25,28-March-2025;11:21:40,"5497 Marco Turnpike, Schillerfort, ND 60769",49.5,49.5,49.5,2025-03-28 11:21:40.000,2025-03-28,2025,3,28,46686,[],()
69596,46297,18857,1,$73.99,10/06/24 00:14,,73.99,73.99,73.99,2024-10-06 00:14:00.000,2024-10-06,2024,10,6,46297,[],()
66083,46847,19157,1,€ 30.0,05:14 2024-03-24,,36.0,36.0,36.0,2024-03-24 05:14:00.000,2024-03-24,2024,3,24,46847,[],()
68551,47213,19385,1,€17¢75,09:18:03 2025-05-21,"669 Roselia Way, Howardfurt, WA 59466",2130.0,2130.0,2130.0,2025-05-21 09:18:03.000,2025-05-21,2025,5,21,47213,[],()
66195,46088,19475,1,$44,"03:33:46, 2024-04-23",NULL,44.0,44.0,44.0,2024-04-23 03:33:46.000,2024-04-23,2024,4,23,46088,[],()
64569,46904,19330,2,EUR 63.0,"01/15/25,10:17",NULL,75.6,75.6,151.2,2025-01-15 10:17:00.000,2025-01-15,2025,1,15,46904,[],()
68261,46128,19070,2,EUR62.50,"21:47,12-APR-2025",,75.0,75.0,150.0,2025-04-12 21:47:00.000,2025-04-12,2025,4,12,46128,[],()
65166,46926,18994,1,40.50 $,05:32:08 2025-02-01,"576 Loriann Lock, East Nannetteland, CT 87816",40.5,40.5,40.5,2025-02-01 05:32:08.000,2025-02-01,2025,2,1,46926,[],()
70158,46688,19093,2,USD 27.75,"00:38,24-Apr-2025",,27.75,27.75,55.5,2025-04-24 00:38:00.000,2025-04-24,2025,4,24,46688,[],()
70198,46917,19534,1,$37¢75,"01:25:54 AM, 01/04/25",,3775.0,3775.0,3775.0,2025-01-04 01:25:54.000,2025-01-04,2025,1,4,46917,[],()
65645,46849,19416,1,€ 62.0,"11/07/24, 08:17:14 PM","Suite 995 3430 Sipes Ville, Port Lanelle, ID 65573-0998",74.39999999999999,74.39999999999999,74.4,2024-11-07 20:17:14.000,2024-11-07,2024,11,7,46849,[],()
63050,46948,19456,3,34.25 $,09:42 24-January-2025,,34.25,34.25,102.75,2025-01-24 09:42:00.000,2025-01-24,2025,1,24,46948,[],()
71446,46705,19281,1,39.USD,2024-12-13T00:23:44.111,NULL,39.0,39.0,39.0,2024-12-13 00:23:44.111,2024-12-13,2024,12,13,46705,[],()
72372,47224,19401,1,58.75 $,2024-08-14T00:36:49,"Apt. 462 900 Feeney Mountains, Lesfurt, NH 62145",58.75,58.75,58.75,2024-08-14 00:36:49.000,2024-08-14,2024,8,14,47224,[],()
68095,45700,19306,2,USD38.99,"26-March-2025,01:50:34 A.M.",,38.99,38.99,77.98,2025-03-26 01:50:34.000,2025-03-26,2025,3,26,45700,[],()
67083,47283,18941,1,USD 59.99,"07:14:13 AM, 10/04/24","Suite 270 498 Daugherty Lodge, East Candyce, UT 45835-6645",59.99,59.99,59.99,2024-10-04 07:14:13.000,2024-10-04,2024,10,4,47283,[],()
63267,44633,19003,1,38.5€,"02/20/25,10:23:50","Suite 431 157 Schmitt Mountain, East Cyrus, VA 15045-0451",46.199999999999996,46.199999999999996,46.2,2025-02-20 10:23:50.000,2025-02-20,2025,2,20,44633,[],()
72565,45624,19541,1,EUR 27.0,"19:20, 14-Jul-2024","Suite 539 3643 Jordan Lane, Samtown, AK 73368-2876",32.4,32.4,32.4,2024-07-14 19:20:00.000,2024-07-14,2024,7,14,45624,[],()
69458,46590,19442,1,49€75¢,"08:09:42, 4-Sep-2024",,5970.0,5970.0,5970.0,2024-09-04 08:09:42.000,2024-09-04,2024,9,4,46590,[],()
63589,46595,19115,1,€ 53.0,2025-01-13T13:15:25,NULL,63.599999999999994,63.599999999999994,63.6,2025-01-13 13:15:25.000,2025-01-13,2025,1,13,46595,[],()
67404,45126,18908,3,€ 48.99,"01:52, 2024-10-22",,58.788,58.788,176.36,2024-10-22 01:52:00.000,2024-10-22,2024,10,22,45126,[],()
72460,45100,19306,1,38.50USD,"19:40,2025-01-04",,38.5,38.5,38.5,2025-01-04 19:40:00.000,2025-01-04,2025,1,4,45796,[],()
72189,46013,19320,1,22.50$,05:24:29 PM 02/10/25,,22.5,22.5,22.5,2025-02-10 17:24:29.000,2025-02-10,2025,2,10,46013,[],()
64991,44894,19273,5,$ 46.00,2024-07-30T22:50:10,,46.0,46.0,230.0,2024-07-30 22:50:10.000,2024-07-30,2024,7,30,44894,[],()
70535,47242,19342,1,EUR 37.75,"04:27:34 A.M.,2024-11-06",NULL,45.3,45.3,45.3,2024-11-06 04:27:34.000,2024-11-06,2024,11,6,47242,[],()
68643,47208,19518,2,$ 27.0,02/11/25 07:29,"Apt. 964 28310 Erick Hill, Zboncakmouth, AK 07825",27.0,27.0,54.0,2025-02-11 07:29:00.000,2025-02-11,2025,2,11,47208,[],()
70223,47001,19217,1,31.0$,02:39;22-June-2024,NULL,31.0,31.0,31.0,2024-06-22 02:39:00.000,2024-06-22,2024,6,22,47001,[],()
72593,46066,19116,2,USD 16.75,"2024-11-17,14:14",NULL,16.75,16.75,33.5,2024-11-17 14:14:00.000,2024-11-17,2024,11,17,46066,[],()
66386,47270,19211,1,$ 46.0,"09:48, 03/11/24",,46.0,46.0,46.0,2024-03-11 09:48:00.000,2024-03-11,2024,3,11,47270,[],()
73441,45974,18930,1,$37¢50,2025-02-10T13:15:04.464,NULL,3750.0,3750.0,3750.0,2025-02-10 13:15:04.464,2025-02-10,2025,2,10,45974,[],()
72313,44576,18915,1,66.00USD,"2024-12-26,09:36",,66.0,66.0,66.0,2024-12-26 09:36:00.000,2024-12-26,2024,12,26,44576,[],()
66073,46452,19199,1,EUR 19.0,2024-07-01;06:39:29 pm,,22.8,22.8,22.8,2024-07-01 18:39:29.000,2024-07-01,2024,7,1,46452,[],()
69887,47407,19024,1,$ 60.5,"04:04:37 PM, 2024-07-12","90448 Francisco Alley, West Rachalland, MN 19192",60.5,60.5,60.5,2024-07-12 16:04:37.000,2024-07-12,2024,7,12,47407,[],()
69600,45187,19057,1,$ 70.0,"2024-06-17, 23:34",NULL,70.0,70.0,70.0,2024-06-17 23:34:00.000,2024-06-17,2024,6,17,45187,[],()
66214,46118,19579,1,25.75€,"28-Oct-2024, 07:41:51 pm",NULL,30.9,30.9,30.9,2024-10-28 19:41:51.000,2024-10-28,2024,10,28,46118,[],()
65590,47163,19004,1,$ 71.00,"10:51:48 pm, 08/02/24",NULL,71.0,71.0,71.0,2024-08-02 22:51:48.000,2024-08-02,2024,8,2,47163,[],()
69677,47430,18949,1,€ 32.0,"10:10,12/25/24",NULL,38.4,38.4,38.4,2024-12-25 10:10:00.000,2024-12-25,2024,12,25,47430,[],()
73388,46007,19417,1,21€50¢," 9-JAN-2025,09:44:30",,2580.0,2580.0,2580.0,2025-01-09 09:44:30.000,2025-01-09,2025,1,9,46007,[],()
66998,44461,18956,1,USD53.,2025-02-08 11:17:01 am,NULL,53.0,53.0,53.0,2025-02-08 11:17:01.000,2025-02-08,2025,2,8,44461,[],()
67223,46802,19588,1,67.0 $,"19:03:02, 2025-04-24","Apt. 973 6559 Dare Centers, Hoegerhaven, ME 53034-7047",67.0,67.0,67.0,2025-04-24 19:03:02.000,2025-04-24,2025,4,24,47000,[],()
68206,46476,19093,1,25.75$,20-July-2024;07:13,NULL,25.75,25.75,25.75,2024-07-20 07:13:00.000,2024-07-20,2024,7,20,46476,[],()
71091,46172,19174,1,30.5 USD,"2024-10-26, 22:47:15","Suite 976 2985 Zandra Vista, Lynchhaven, AK 06345-0951",30.5,30.5,30.5,2024-10-26 22:47:15.000,2024-10-26,2024,10,26,46172,[],()
72820,44480,19437,1,€35¢25,11/05/24 00:17,,4230.0,4230.0,4230.0,2024-11-05 00:17:00.000,2024-11-05,2024,11,5,44480,[],()
70382,45195,19239,1,USD74.75,21:02 2025-05-21,,74.75,74.75,74.75,2025-05-21 21:02:00.000,2025-05-21,2025,5,21,45195,[],()
69253,46139,19479,1,$ 61.0,00:26 08/26/24,"500 O'Reilly Motorway, Schimmelstad, WV 01380-1692",61.0,61.0,61.0,2024-08-26 00:26:00.000,2024-08-26,2024,8,26,46139,[],()
70054,46861,19330,4,59.0USD,2025-05-25;11:37:42 AM,"Suite 537 5066 Bauch Summit, Port Clark, NJ 65206",59.0,59.0,236.0,2025-05-25 11:37:42.000,2025-05-25,2025,5,25,46861,[],()
67826,46842,19089,1,48. $,"2025-03-11,19:22:43",,48.0,48.0,48.0,2025-03-11 19:22:43.000,2025-03-11,2025,3,11,46842,[],()
66478,44618,19062,1,$16.50,14:34:05 2024-10-26,,16.5,16.5,16.5,2024-10-26 14:34:05.000,2024-10-26,2024,10,26,44618,[],()
71399,47343,18986,1,$63.99,"12:06,23-Dec-2024",,63.99,63.99,63.99,2024-12-23 12:06:00.000,2024-12-23,2024,12,23,47343,[],()
67943,46254,19377,1,50.25 $,17:11 09/30/24,,50.25,50.25,50.25,2024-09-30 17:11:00.000,2024-09-30,2024,9,30,46254,[],()
65868,46094,19136,1,53.00EUR,"08:35,2024-12-16",NULL,63.599999999999994,63.599999999999994,63.6,2024-12-16 08:35:00.000,2024-12-16,2024,12,16,46094,[],()
72288,47453,19242,1,$51¢25,2025-04-15;03:51:18 am,NULL,5125.0,5125.0,5125.0,2025-04-15 03:51:18.000,2025-04-15,2025,4,15,47453,[],()
73361,45885,19195,1,USD 71.00,04:17:34 2024-12-31,,71.0,71.0,71.0,2024-12-31 04:17:34.000,2024-12-31,2024,12,31,47052,[],()
64434,47546,19185,1,$57.50,06:56:59 P.M.; 2-June-2024,,57.5,57.5,57.5,2024-06-02 18:56:59.000,2024-06-02,2024,6,2,47546,[],()
69639,44791,19022,3,$ 69.00,19:25:18 2025-04-16,"7913 Alvera Throughway, Johnstown, TN 23013-6173",69.0,69.0,207.0,2025-04-16 19:25:18.000,2025-04-16,2025,4,16,44791,[],()
70255,44405,19261,4,$69¢99,2025-03-19;12:21,,6999.0,6999.0,27996.0,2025-03-19 12:21:00.000,2025-03-19,2025,3,19,44405,[],()
73821,46043,19296,5,24.5 €,22-March-2025;03:45,,29.4,29.4,147.0,2025-03-22 03:45:00.000,2025-03-22,2025,3,22,46043,[],()
71024,45096,19144,1,45.5 EUR,19.03.2025  6:37:37,NULL,54.6,54.6,54.6,2025-03-19 06:37:37.000,2025-03-19,2025,3,19,45096,[],()
63118,45878,19281,2,€ 37.00,2024-06-16T15:02:06,"41410 Ina Springs, New Winford, OK 10699",44.4,44.4,88.8,2024-06-16 15:02:06.000,2024-06-16,2024,6,16,45878,[],()
63852,44827,19286,1,21.50$,03:08:45;07/19/25,"Apt. 304 61298 Andra Shores, Kihnchester, NC 57670-7207",21.5,21.5,21.5,2025-07-19 03:08:45.000,2025-07-19,2025,7,19,44827,[],()
65696,47304,19396,1,44.50€,23-October-2024;06:26,,53.4,53.4,53.4,2024-10-23 06:26:00.000,2024-10-23,2024,10,23,47304,[],()
63369,45418,19128,1,74.25 $," 5-SEP-2024,11:19","280 Del Pines, Labadieborough, WV 61147-1842",74.25,74.25,74.25,2024-09-05 11:19:00.000,2024-09-05,2024,9,5,45418,[],()
67128,46661,19031,1,21.00$,29-SEP-2024 06:40:02 PM,,21.0,21.0,21.0,2024-09-29 18:40:02.000,2024-09-29,2024,9,29,46661,[],()
68505,46672,19201,1,40.25€,"02/08/25,09:41:51","2003 Graig Throughway, Coyshire, OR 03738",48.3,48.3,48.3,2025-02-08 09:41:51.000,2025-02-08,2025,2,8,46672,[],()
65056,47574,19560,1,€29.5,2025-02-27T13:25:20.755,"902 Effertz Port, Greenstad, CA 70345-8303",35.4,35.4,35.4,2025-02-27 13:25:20.755,2025-02-27,2025,2,27,47574,[],()
67883,47434,19539,1,64.$,2025-03-03T02:48:48,,64.0,64.0,64.0,2025-03-03 02:48:48.000,2025-03-03,2025,3,3,47434,[],()
67050,46369,19358,1,$47.75, 7.02.2025 11:08:08,"Suite 962 2175 Paucek Fords, New Nora, OR 14926",47.75,47.75,47.75,2025-07-02 11:08:08.000,2025-07-02,2025,7,2,46369,[],()
72953,44752,19447,5,USD26.50,2024-11-15;16:35:49,,26.5,26.5,132.5,2024-11-15 16:35:49.000,2024-11-15,2024,11,15,44752,[],()
66705,45644,19523,1,USD32.25,11:03:38;2025-01-24,,32.25,32.25,32.25,2025-01-24 11:03:38.000,2025-01-24,2025,1,24,45644,[],()
67528,45454,18861,1,36.5 EUR,2024-06-29;18:14,,43.8,43.8,43.8,2024-06-29 18:14:00.000,2024-06-29,2024,6,29,45454,[],()
69403,45446,18917,1,66.0 USD,"03:46:13,08/28/24",,66.0,66.0,66.0,2024-08-28 03:46:13.000,2024-08-28,2024,8,28,45446,[],()
73863,45704,18966,1,$ 53.99,00:48:32;10-Sep-2024,,53.99,53.99,53.99,2024-09-10 00:48:32.000,2024-09-10,2024,9,10,45704,[],()
70923,46285,19535,2,66USD,"10:43, 11-Dec-2024",,66.0,66.0,132.0,2024-12-11 10:43:00.000,2024-12-11,2024,12,11,46285,[],()
67065,45204,19377,1,52.00USD,"10:24:12,03/27/24",,52.0,52.0,52.0,2024-03-27 10:24:12.000,2024-03-27,2024,3,27,45204,[],()
68250,45652,19449,1,48.5 EUR,18:54:12 2024-07-31,NULL,58.199999999999996,58.199999999999996,58.2,2024-07-31 18:54:12.000,2024-07-31,2024,7,31,45652,[],()
65191,45910,19499,1,USD27.99,11:17:16 P.M. 09/29/25,,27.99,27.99,27.99,2025-09-29 23:17:16.000,2025-09-29,2025,9,29,45910,[],()
64804,45262,19049,1,57.99 USD,10/18/24 14:15:13,NULL,57.99,57.99,57.99,2024-10-18 14:15:13.000,2024-10-18,2024,10,18,45262,[],()
66071,46710,19507,1,EUR22.5,"08/10/25,08:58:22 pm",NULL,27.0,27.0,27.0,2025-08-10 20:58:22.000,2025-08-10,2025,8,10,46710,[],()
73745,44593,19077,2,€41¢75,23-Dec-2024 07:17,"Suite 691 172 Hane Skyway, Denitaton, SC 59643-2000",5010.0,5010.0,10020.0,2024-12-23 07:17:00.000,2024-12-23,2024,12,23,44593,[],()
69242,45124,19454,1,USD 65.0,22:24:12;16-Feb-2025,"8172 Wyman Ville, South Kiethchester, SC 49176",65.0,65.0,65.0,2025-02-16 22:24:12.000,2025-02-16,2025,2,16,45124,[],()
67950,46631,19491,1,33.99 EUR,2024-12-30;03:27:53 AM,,40.788000000000004,40.788000000000004,40.79,2024-12-30 03:27:53.000,2024-12-30,2024,12,30,46631,[],()
66967,46493,19324,1,USD 62,2025-02-01T21:22:59,"Suite 290 4624 Wilderman Lane, South Jennifferfurt, DE 66543-9957",62.0,62.0,62.0,2025-02-01 21:22:59.000,2025-02-01,2025,2,1,46493,[],()
67040,45256,18938,1,45.00 USD, 6-November-2024 17:20,,45.0,45.0,45.0,2024-11-06 17:20:00.000,2024-11-06,2024,11,6,45256,[],()
69350,45940,19490,1,53.75USD,"17:32,12/01/24",NULL,53.75,53.75,53.75,2024-12-01 17:32:00.000,2024-12-01,2024,12,1,45940,[],()
64776,46572,19255,2,43.99USD,23-August-2024 12:43,,43.99,43.99,87.98,2024-08-23 12:43:00.000,2024-08-23,2024,8,23,46572,[],()
67239,44638,19292,1,$51.00,"22:31,20-NOV-2024","Suite 215 8882 Predovic Trafficway, Carlyshire, SC 29349-9768",51.0,51.0,51.0,2024-11-20 22:31:00.000,2024-11-20,2024,11,20,44638,[],()
67382,44961,19153,1,57.00$,30-JUN-2025;12:43,,57.0,57.0,57.0,2025-06-30 12:43:00.000,2025-06-30,2025,6,30,44961,[],()
63213,45731,19268,1,€ 43.5, 9.06.2025 17:36:36,,52.199999999999996,52.199999999999996,52.2,2025-09-06 17:36:36.000,2025-09-06,2025,9,6,45731,[],()
69888,44823,19049,1,55.0EUR,"03:27,11/24/24","Apt. 118 53303 Patsy Green, Legrosburgh, TN 22372",66.0,66.0,66.0,2024-11-24 03:27:00.000,2024-11-24,2024,11,24,44823,[],()
66209,45557,19268,2,46.25 $,22:18:32 2024-08-06,,46.25,46.25,92.5,2024-08-06 22:18:32.000,2024-08-06,2024,8,6,45557,[],()
66184,45299,19266,2,48.25€,Sun Dec 29 18:21:45 2024,"Apt. 770 25793 Reilly Motorway, West Georgianneberg, AR 19918-9583",57.9,57.9,115.8,2024-12-29 18:21:45.000,2024-12-29,2024,12,29,45299,[],()
63015,47361,18881,1,31.50USD,"01:16:38, 2025-05-01","Apt. 993 84470 Garry Viaduct, South Clementeport, SC 99488",31.5,31.5,31.5,2025-05-01 01:16:38.000,2025-05-01,2025,5,1,47361,[],()
68609,46914,19455,1,16.99 $,"05:49:54,22-DEC-2024",,16.99,16.99,16.99,2024-12-22 05:49:54.000,2024-12-22,2024,12,22,46914,[],()
63668,44936,19585,2,$ 65.,"02:17:04, 2024-08-17",,65.0,65.0,130.0,2024-08-17 02:17:04.000,2024-08-17,2024,8,17,44936,[],()
71633,47345,19486,1,43.50 USD,2025-03-25;00:32,NULL,43.5,43.5,43.5,2025-03-25 00:32:00.000,2025-03-25,2025,3,25,47345,[],()
65463,47500,19296,1,USD24.99,02:59:30;2024-06-10,,24.99,24.99,24.99,2024-06-10 02:59:30.000,2024-06-10,2024,6,10,47500,[],()
64864,47514,19135,1,56€00¢, 5-April-2025;02:11:00 PM,"203 Wisozk Stream, Lake Lynda, FL 95719",6720.0,6720.0,6720.0,2025-04-05 14:11:00.000,2025-04-05,2025,4,5,47514,[],()
63419,45549,19581,1,USD24.75,08/13/24;02:51:53 AM,NULL,24.75,24.75,24.75,2024-08-13 02:51:53.000,2024-08-13,2024,8,13,45549,[],()
72959,44607,19008,1,€49¢75,"06:57:26, 24-Nov-2024",,5970.0,5970.0,5970.0,2024-11-24 06:57:26.000,2024-11-24,2024,11,24,44607,[],()
68843,45780,19130,1,23.0 EUR,"06:05,2025-07-02",,27.599999999999998,27.599999999999998,27.6,2025-07-02 06:05:00.000,2025-07-02,2025,7,2,45780,[],()
71134,44843,19568,1,€46.00,"04/11/25,05:51",,55.199999999999996,55.199999999999996,55.2,2025-04-11 05:51:00.000,2025-04-11,2025,4,11,44843,[],()
64099,45874,19001,2,USD32.50,"2024-09-12, 11:16",,32.5,32.5,65.0,2024-09-12 11:16:00.000,2024-09-12,2024,9,12,45874,[],()
64344,46116,19227,5,51.0 EUR,"28-January-2025, 06:38:40",,61.199999999999996,61.199999999999996,306.0,2025-01-28 06:38:40.000,2025-01-28,2025,1,28,46116,[],()
63314,45556,19250,2,29.00€,"05:12:19,08/31/24","97577 Johnson Stream, New Ginoberg, NV 03805",34.8,34.8,69.6,2024-08-31 05:12:19.000,2024-08-31,2024,8,31,45556,[],()
72722,44618,19139,2,USD 57.99,00:40:11;13-Sep-2024,"Apt. 451 46447 Alphonso Plaza, Carriefurt, RI 86347-8862",57.99,57.99,115.98,2024-09-13 00:40:11.000,2024-09-13,2024,9,13,44618,[],()
72035,45978,19123,1,€51.99,"03/14/24, 03:26:30",,62.388,62.388,62.39,2024-03-14 03:26:30.000,2024-03-14,2024,3,14,45978,[],()
68818,47195,19538,1,USD 54.5,09/01/24;01:51:36,,54.5,54.5,54.5,2024-09-01 01:51:36.000,2024-09-01,2024,9,1,47195,[],()
65745,45617,19383,5,60.99 USD,11:08 20-Mar-2025,,60.99,60.99,304.95,2025-03-20 11:08:00.000,2025-03-20,2025,3,20,45617,[],()
71012,47025,19100,5,15.00USD,"10:59:47 P.M., 15-Dec-2024",,15.0,15.0,75.0,2024-12-15 22:59:47.000,2024-12-15,2024,12,15,47025,[],()
68953,45620,19158,1,64.5 $,22:00; 5-DEC-2024,"1910 Pollich Skyway, Charleyberg, MS 29517-1132",64.5,64.5,64.5,2024-12-05 22:00:00.000,2024-12-05,2024,12,5,45620,[],()
71328,47391,19147,1,26.0USD,2024-10-19T04:23:04.594,"Suite 195 610 Kulas Greens, Port Sonny, KY 53422",26.0,26.0,26.0,2024-10-19 04:23:04.594,2024-10-19,2024,10,19,47391,[],()
68909,46068,19328,1,EUR 28.50,04:31; 3-DEC-2024,,34.199999999999996,34.199999999999996,34.2,2024-12-03 04:31:00.000,2024-12-03,2024,12,3,46068,[],()
69277,45292,18968,2,USD 68.75,"01:30:13,29-Sep-2024",NULL,68.75,68.75,137.5,2024-09-29 01:30:13.000,2024-09-29,2024,9,29,45292,[],()
65256,46852,18893,1,$49.75,2024-09-01;10:34:40 AM,,49.75,49.75,49.75,2024-09-01 10:34:40.000,2024-09-01,2024,9,1,46852,[],()
70130,46393,19163,4,12.99EUR,"17:50, 05/28/25",,15.588,15.588,62.35,2025-05-28 17:50:00.000,2025-05-28,2025,5,28,46393,[],()
69748,44531,19217,1,28.99USD,2024-07-30T06:10:44,NULL,28.99,28.99,28.99,2024-07-30 06:10:44.000,2024-07-30,2024,7,30,44531,[],()
71598,45108,19500,1,$45.5,2025-04-15;03:24:50,NULL,45.5,45.5,45.5,2025-04-15 03:24:50.000,2025-04-15,2025,4,15,45108,[],()
70536,47389,19105,1,USD 37.00,07:46:23 am;2025-04-24,,37.0,37.0,37.0,2025-04-24 07:46:23.000,2025-04-24,2025,4,24,47389,[],()
68746,46025,19011,1,€55¢50,2025-02-14T04:30:45,,6660.0,6660.0,6660.0,2025-02-14 04:30:45.000,2025-02-14,2025,2,14,46025,[],()
68530,45233,18986,2,€66¢99,"2025-05-20, 12:14:03","824 Mercedes Skyway, Burlside, GA 04649-9920",8038.799999999999,8038.799999999999,16077.6,2025-05-20 12:14:03.000,2025-05-20,2025,5,20,45233,[],()
69608,44891,19431,2,$33¢99,"11/11/24, 14:59:30",,3399.0,3399.0,6798.0,2024-11-11 14:59:30.000,2024-11-11,2024,11,11,44891,[],()
68348,46036,19005,5,40.75USD,"05/27/24, 18:25:13","Suite 412 6556 Arnold Turnpike, Cummerataview, HI 15088-5645",40.75,40.75,203.75,2024-05-27 18:25:13.000,2024-05-27,2024,5,27,46036,[],()
71864,47496,19581,1,EUR27.25,2025-02-21T20:33:13.723,NULL,32.699999999999996,32.699999999999996,32.7,2025-02-21 20:33:13.723,2025-02-21,2025,2,21,47496,[],()
71368,44540,18961,1,73.99 $,"19:59:30,2024-03-18",NULL,73.99,73.99,73.99,2024-03-18 19:59:30.000,2024-03-18,2024,3,18,44540,[],()
70073,45174,19174,1,EUR32,21.09.2024  9:15:15,,38.4,38.4,38.4,2024-09-21 09:15:15.000,2024-09-21,2024,9,21,45174,[],()
64697,46031,19417,3,USD 22.25,08:32:59 02/01/25,,22.25,22.25,66.75,2025-02-01 08:32:59.000,2025-02-01,2025,2,1,46031,[],()
65899,46216,18939,1,56.50 $,2025-01-18 12:51,NULL,56.5,56.5,56.5,2025-01-18 12:51:00.000,2025-01-18,2025,1,18,46216,[],()
70596,46663,19157,1,30. USD,2024-11-15T11:13:49.043,NULL,30.0,30.0,30.0,2024-11-15 11:13:49.043,2024-11-15,2024,11,15,46663,[],()
71537,44571,19248,1,€59¢99,"25-AUG-2024,00:00",,7198.8,7198.8,7198.8,2024-08-25 00:00:00.000,2024-08-25,2024,8,25,44571,[],()
70186,44675,19455,1,12.50USD,13:07:50;11/23/24,"Suite 378 3587 Weimann Skyway, Lake Tainaland, RI 69983-5455",12.5,12.5,12.5,2024-11-23 13:07:50.000,2024-11-23,2024,11,23,44675,[],()
69346,46480,19366,1,29.5 $,"16:45:11,14-May-2025",NULL,29.5,29.5,29.5,2025-05-14 16:45:11.000,2025-05-14,2025,5,14,46480,[],()
66813,44669,19585,2,68.00 $,2024-10-10;04:15,,68.0,68.0,136.0,2024-10-10 04:15:00.000,2024-10-10,2024,10,10,44669,[],()
69738,47143,18946,1,USD50.50,06:57:53 AM 03/02/25,NULL,50.5,50.5,50.5,2025-03-02 06:57:53.000,2025-03-02,2025,3,2,47143,[],()
70257,47001,19015,1,61.75 $,2025-02-21T18:59:26,NULL,61.75,61.75,61.75,2025-02-21 18:59:26.000,2025-02-21,2025,2,21,47001,[],()
68518,46637,19036,1,69.0$,2025-03-07;10:10:17 A.M.,"Suite 350 939 Lynch Views, Borerhaven, MO 19809",69.0,69.0,69.0,2025-03-07 10:10:17.000,2025-03-07,2025,3,7,46637,[],()
69732,45253,19099,2,$ 54.0,2025-01-18T00:15:34.302,NULL,54.0,54.0,108.0,2025-01-18 00:15:34.302,2025-01-18,2025,1,18,45253,[],()
68548,46494,19118,1,$ 72,"03/21/25, 22:43:02",,72.0,72.0,72.0,2025-03-21 22:43:02.000,2025-03-21,2025,3,21,46494,[],()
71759,47203,19251,1,USD 23.,"10:15:55 am,2025-01-02","14508 Turcotte Loop, East Jed, WI 66882",23.0,23.0,23.0,2025-01-02 10:15:55.000,2025-01-02,2025,1,2,47203,[],()
66490,47143,19561,1,€22¢00,"02:10:21 P.M.,2025-07-13","5184 Ethan Street, Port Nereidaberg, NE 76544",2640.0,2640.0,2640.0,2025-07-13 14:10:21.000,2025-07-13,2025,7,13,47143,[],()
69421,46291,19562,2,53.00 $,"2024-09-12,04:52:34 AM",,53.0,53.0,106.0,2024-09-12 04:52:34.000,2024-09-12,2024,9,12,46291,[],()
64483,46278,19560,2,USD 28.75,"11:50:19,09/04/24","Apt. 777 4159 Silva Alley, Hyattmouth, LA 34173-2294",28.75,28.75,57.5,2024-09-04 11:50:19.000,2024-09-04,2024,9,4,46278,[],()
68590,47291,18969,1,44.50$,09:28:56 A.M. 24-APR-2025,,44.5,44.5,44.5,2025-04-24 09:28:56.000,2025-04-24,2025,4,24,47291,[],()
70240,44969,18934,5,17.0 USD,"22:12:30, 2025-02-15",NULL,17.0,17.0,85.0,2025-02-15 22:12:30.000,2025-02-15,2025,2,15,44969,[],()
64556,45774,19387,1,64.75 $,26-JUL-2024 12:11:30 pm,NULL,64.75,64.75,64.75,2024-07-26 12:11:30.000,2024-07-26,2024,7,26,45142,[],()
71897,45230,19050,1,70.50€,"01/16/25, 00:23",,84.6,84.6,84.6,2025-01-16 00:23:00.000,2025-01-16,2025,1,16,45499,[],()
64548,46014,19417,1,25.00$,2024-09-21T05:04:36.470,NULL,25.0,25.0,25.0,2024-09-21 05:04:36.470,2024-09-21,2024,9,21,46014,[],()
68791,44533,19533,3,$ 46.75,"12:40:41 P.M., 12-Jul-2025",,46.75,46.75,140.25,2025-07-12 12:40:41.000,2025-07-12,2025,7,12,44533,[],()
65988,47026,19339,1,$ 45.0,"2025-02-17,07:27:34 PM","839 Neil Ranch, East Nannieview, SD 96510-4324",45.0,45.0,45.0,2025-02-17 19:27:34.000,2025-02-17,2025,2,17,47026,[],()
71324,47480,18859,3,EUR 51.0,19-JAN-2025;01:05:30 PM,"8509 Cammy Cliffs, North Nellieton, RI 15636-6629",61.199999999999996,61.199999999999996,183.6,2025-01-19 13:05:30.000,2025-01-19,2025,1,19,47480,[],()
62769,46200,19472,1,67$50¢,2025-05-13T19:31:32.424,"Apt. 177 516 Shay Brooks, Lake Newtonside, FL 83587-6444",6750.0,6750.0,6750.0,2025-05-13 19:31:32.424,2025-05-13,2025,5,13,46200,[],()
72375,47423,19444,5,USD42.00,"02/24/25, 02:10",,42.0,42.0,210.0,2025-02-24 02:10:00.000,2025-02-24,2025,2,24,47423,[],()
66788,46095,18903,1,EUR20.50,00:50;2025-02-05,,24.599999999999998,24.599999999999998,24.6,2025-02-05 00:50:00.000,2025-02-05,2025,2,5,46095,[],()
68552,46880,19370,2,USD 17.0,2025-03-07;08:19,"Suite 316 14792 Reichert Estates, Kuhlmanview, CO 96931-5507",17.0,17.0,34.0,2025-03-07 08:19:00.000,2025-03-07,2025,3,7,46880,[],()
63812,44925,19318,1,26.50 EUR,08/13/24 22:46,,31.799999999999997,31.799999999999997,31.8,2024-08-13 22:46:00.000,2024-08-13,2024,8,13,44925,[],()
65231,45806,18929,1,48. EUR,"00:04,  9-November-2024","Suite 946 59106 Ledner Village, Port Sid, MD 21744-3099",57.599999999999994,57.599999999999994,57.6,2024-11-09 00:04:00.000,2024-11-09,2024,11,9,45806,[],()
65687,46538,19509,2,57 $,11-FEB-2025;05:33,,57.0,57.0,114.0,2025-02-11 05:33:00.000,2025-02-11,2025,2,11,46538,[],()
68452,44912,19014,1,USD 22.50,04:42 2025-01-04,,22.5,22.5,22.5,2025-01-04 04:42:00.000,2025-01-04,2025,1,4,44912,[],()
63107,46086,19346,2,USD39.5,2024-12-02T09:48:34.884,,39.5,39.5,79.0,2024-12-02 09:48:34.884,2024-12-02,2024,12,2,46086,[],()
73666,45006,19294,1,46USD,03:31:47;2025-04-16,,46.0,46.0,46.0,2025-04-16 03:31:47.000,2025-04-16,2025,4,16,45006,[],()
65864,46205,19420,1,USD 52.00,"03:29:57 am,02/06/24",NULL,52.0,52.0,52.0,2024-02-06 03:29:57.000,2024-02-06,2024,2,6,46386,[],()
66982,45821,19155,1,53.00$,"09/27/24, 03:04:32 PM",NULL,53.0,53.0,53.0,2024-09-27 15:04:32.000,2024-09-27,2024,9,27,45821,[],()
66031,44588,19125,5,17.25 $,16:51;08/06/24,NULL,17.25,17.25,86.25,2024-08-06 16:51:00.000,2024-08-06,2024,8,6,44588,[],()
68416,47002,19153,5,54.25USD,2024-11-14T03:38:20,,54.25,54.25,271.25,2024-11-14 03:38:20.000,2024-11-14,2024,11,14,47002,[],()
70820,44504,19008,1,49.0 €,"02:08:37, 09/10/24",,58.8,58.8,58.8,2024-09-10 02:08:37.000,2024-09-10,2024,9,10,44504,[],()
62788,47065,19313,1,USD26.50,2024-11-29;22:23,"Suite 560 6971 Koepp Square, New Trenttown, MD 44347-6973",26.5,26.5,26.5,2024-11-29 22:23:00.000,2024-11-29,2024,11,29,47065,[],()
65535,45383,19494,1,$28.5,"2024-11-08, 23:34","Apt. 265 68237 Keith Harbor, Port Shannon, MI 05606-6953",28.5,28.5,28.5,2024-11-08 23:34:00.000,2024-11-08,2024,11,8,45383,[],()
63005,44456,19205,4,12.50$,2024-10-11T08:53:04.528,,12.5,12.5,50.0,2024-10-11 08:53:04.528,2024-10-11,2024,10,11,44456,[],()
72112,46077,19031,2,USD 18.50,"09/20/24, 12:49",NULL,18.5,18.5,37.0,2024-09-20 12:49:00.000,2024-09-20,2024,9,20,46077,[],()
71177,47033,19478,1,€ 53.50,2024-07-14T17:07:43,"247 Lemke Orchard, South Toshiafurt, HI 89577",64.2,64.2,64.2,2024-07-14 17:07:43.000,2024-07-14,2024,7,14,47033,[],()
63206,44374,19370,1,€ 18.,08:56:48 A.M. 03/18/25,,21.599999999999998,21.599999999999998,21.6,2025-03-18 08:56:48.000,2025-03-18,2025,3,18,44374,[],()
64640,46078,19053,2,56.5USD,"15:22, 28-Jul-2024",NULL,56.5,56.5,113.0,2024-07-28 15:22:00.000,2024-07-28,2024,7,28,46078,[],()
70573,45613,19129,3,€ 21.75,"2024-07-26,11:34:33 pm",NULL,26.099999999999998,26.099999999999998,78.3,2024-07-26 23:34:33.000,2024-07-26,2024,7,26,45613,[],()
71000,45361,19020,2,€19.50,11/14/24;11:21:13,NULL,23.4,23.4,46.8,2024-11-14 11:21:13.000,2024-11-14,2024,11,14,45361,[],()
68446,45386,19480,1,73 $,04:08:50 pm;30-Jan-2025,NULL,73.0,73.0,73.0,2025-01-30 16:08:50.000,2025-01-30,2025,1,30,45386,[],()
66419,45878,19286,1,EUR 25.75,2025-02-13T23:25:27.717,,30.9,30.9,30.9,2025-02-13 23:25:27.717,2025-02-13,2025,2,13,45878,[],()
73297,47184,19093,1,€28.5,2024-09-16 22:10:04,,34.199999999999996,34.199999999999996,34.2,2024-09-16 22:10:04.000,2024-09-16,2024,9,16,47184,[],()
64587,46776,19072,3,$ 63.50,2025-09-23T15:30:11,,63.5,63.5,190.5,2025-09-23 15:30:11.000,2025-09-23,2025,9,23,46776,[],()
71806,44767,19550,3,$30.25,00:14 2024-10-13,,30.25,30.25,90.75,2024-10-13 00:14:00.000,2024-10-13,2024,10,13,47069,[],()
71279,44579,18903,2,$17¢75,2025-02-18T12:37:55.628,"Apt. 190 410 Reichert Road, Fisherland, SD 86798",1775.0,1775.0,3550.0,2025-02-18 12:37:55.628,2025-02-18,2025,2,18,44579,[],()
68755,47533,18963,1,€58¢99,21-NOV-2024 12:46:00,"Suite 574 181 Vernetta Isle, West Ronshire, CA 95416-3248",7078.8,7078.8,7078.8,2024-11-21 12:46:00.000,2024-11-21,2024,11,21,47533,[],()
63114,45538,19385,1,EUR 16.5,04/15/25;22:31:33,,19.8,19.8,19.8,2025-04-15 22:31:33.000,2025-04-15,2025,4,15,45538,[],()
73951,46705,19154,1,71.50$,14:01:59 29-Mar-2025,,71.5,71.5,71.5,2025-03-29 14:01:59.000,2025-03-29,2025,3,29,46705,[],()
73756,47190,18884,1,68.00$,2025-06-10T19:14:02,NULL,68.0,68.0,68.0,2025-06-10 19:14:02.000,2025-06-10,2025,6,10,47190,[],()
72412,47071,19417,1,21.99 USD,09/12/24;21:10:23,,21.99,21.99,21.99,2024-09-12 21:10:23.000,2024-09-12,2024,9,12,47071,[],()
62895,46644,19395,1,42.5 €,"16:47:51, 28-MAR-2025",NULL,51.0,51.0,51.0,2025-03-28 16:47:51.000,2025-03-28,2025,3,28,46644,[],()
64645,44721,19035,1,22.5 $,12:01 2025-02-10,"796 Garnett Plaza, Chloeport, OR 99943",22.5,22.5,22.5,2025-02-10 12:01:00.000,2025-02-10,2025,2,10,44721,[],()
70384,45201,18838,2,57.0€,2025-03-02T04:32:23,"299 Dorethea Squares, Volkmanport, CT 62305-7413",68.39999999999999,68.39999999999999,136.8,2025-03-02 04:32:23.000,2025-03-02,2025,3,2,45201,[],()
63456,46634,19362,2,40.00 USD,"03:12:47 pm,2025-03-06",,40.0,40.0,80.0,2025-03-06 15:12:47.000,2025-03-06,2025,3,6,46634,[],()
67614,45516,19415,1,17. USD,"02:50:13, 01/25/25",,17.0,17.0,17.0,2025-01-25 02:50:13.000,2025-01-25,2025,1,25,45516,[],()
66981,44795,18862,3,30.0 $,"05:40, 16-MAR-2025",NULL,30.0,30.0,90.0,2025-03-16 05:40:00.000,2025-03-16,2025,3,16,44795,[],()
66938,46337,18893,1,51.€,2024-11-18;00:33:08,NULL,61.199999999999996,61.199999999999996,61.2,2024-11-18 00:33:08.000,2024-11-18,2024,11,18,46337,[],()
69724,45114,19377,2,$ 48.99,"31-Jul-2025,08:07:23 P.M.",,48.99,48.99,97.98,2025-07-31 20:07:23.000,2025-07-31,2025,7,31,45114,[],()
69150,44813,19548,1,$ 47.50,Sun Feb 16 21:13:30 2025,NULL,47.5,47.5,47.5,2025-02-16 21:13:30.000,2025-02-16,2025,2,16,44813,[],()
69334,46114,19340,1,29.50EUR,"06:31,08/05/24",,35.4,35.4,35.4,2024-08-05 06:31:00.000,2024-08-05,2024,8,5,46114,[],()
68350,44737,18949,1,EUR31.50,"2025-04-30, 13:00:01",,37.8,37.8,37.8,2025-04-30 13:00:01.000,2025-04-30,2025,4,30,44737,[],()
69008,46506,19143,3,32$50¢,"03/10/25,01:49","4800 Kohler Falls, Deangeloview, AL 35484-8617",3250.0,3250.0,9750.0,2025-03-10 01:49:00.000,2025-03-10,2025,3,10,46506,[],()
65900,46151,19413,1,34.75 USD,01/09/25 03:13:59 A.M.,NULL,34.75,34.75,34.75,2025-01-09 03:13:59.000,2025-01-09,2025,1,9,46151,[],()
69254,46489,18932,1,$22.75,22:50; 4-Oct-2024,,22.75,22.75,22.75,2024-10-04 22:50:00.000,2024-10-04,2024,10,4,46489,[],()
70492,47586,19445,5,$ 60.25,2024-08-16T14:56:28.158,"Apt. 840 384 Leffler Views, Considinetown, DE 64278",60.25,60.25,301.25,2024-08-16 14:56:28.158,2024-08-16,2024,8,16,47586,[],()
63865,46892,19478,1,55.00$,19:14;2024-10-06,,55.0,55.0,55.0,2024-10-06 19:14:00.000,2024-10-06,2024,10,6,46892,[],()
64462,44667,19430,2,55.5USD,2025-03-03T19:24:12.459,NULL,55.5,55.5,111.0,2025-03-03 19:24:12.459,2025-03-03,2025,3,3,44667,[],()
63349,44514,19360,2,61$,"21-NOV-2024,05:35","618 Schroeder Stream, Port Lesterchester, TX 55651",61.0,61.0,122.0,2024-11-21 05:35:00.000,2024-11-21,2024,11,21,44514,[],()
65807,44776,19345,1,60.50€,01:28:03 P.M.;2025-04-18,,72.6,72.6,72.6,2025-04-18 13:28:03.000,2025-04-18,2025,4,18,44776,[],()
73485,46352,19224,1,USD 57.5,02:19:50 am 04/29/25,NULL,57.5,57.5,57.5,2025-04-29 02:19:50.000,2025-04-29,2025,4,29,46352,[],()
73460,44414,19074,1,73.75 $,13-November-2024;15:33:04,"Apt. 638 51645 Batz Road, Port Teresita, VA 09155",73.75,73.75,73.75,2024-11-13 15:33:04.000,2024-11-13,2024,11,13,44414,[],()
73131,46832,19143,2,28.25USD,2024-10-10T02:40:33,,28.25,28.25,56.5,2024-10-10 02:40:33.000,2024-10-10,2024,10,10,46832,[],()
63388,46745,18866,1,20.25 €,"22:15:17,2024-11-30",NULL,24.3,24.3,24.3,2024-11-30 22:15:17.000,2024-11-30,2024,11,30,46745,[],()
63355,45077,19286,1,USD21.25,"05/09/24, 06:46:45",NULL,21.25,21.25,21.25,2024-05-09 06:46:45.000,2024-05-09,2024,5,9,45077,[],()
70368,45560,18891,2,22.50 $,2025-01-29 05:08:58 PM,"44499 Thi Center, West Kiethport, NY 20467",22.5,22.5,45.0,2025-01-29 17:08:58.000,2025-01-29,2025,1,29,45560,[],()
67762,47019,19458,1,$ 56.99,"11/10/24,23:16:23","78233 Luvenia Throughway, East Marita, CA 67277-1186",56.99,56.99,56.99,2024-11-10 23:16:23.000,2024-11-10,2024,11,10,47019,[],()
73311,45136,18861,1,USD35.0,"09/18/24, 13:15",,35.0,35.0,35.0,2024-09-18 13:15:00.000,2024-09-18,2024,9,18,45136,[],()
66498,46938,19423,1,30.00 $,2024-08-18T19:39:09,NULL,30.0,30.0,30.0,2024-08-18 19:39:09.000,2024-08-18,2024,8,18,46938,[],()
64292,47394,18838,1,EUR 56.0,Wed Feb  5 17:46:05 2025,,67.2,67.2,67.2,2025-02-05 17:46:05.000,2025-02-05,2025,2,5,47394,[],()
69501,47021,19302,1,27.99€," 3-Oct-2024,05:13:11",,33.587999999999994,33.587999999999994,33.59,2024-10-03 05:13:11.000,2024-10-03,2024,10,3,47021,[],()
70808,44441,19235,3,EUR 66.5,"23:26,17-May-2025","Suite 802 3924 Onita Trace, Delbertview, DE 92731-3465",79.8,79.8,239.4,2025-05-17 23:26:00.000,2025-05-17,2025,5,17,44441,[],()
62740,45165,19377,1,53€99¢,"21:40:57, 08/11/24",NULL,6478.8,6478.8,6478.8,2024-08-11 21:40:57.000,2024-08-11,2024,8,11,45165,[],()
73227,47060,19168,1,63.25 €,2024-12-02T05:18:19.763,NULL,75.89999999999999,75.89999999999999,75.9,2024-12-02 05:18:19.763,2024-12-02,2024,12,2,47060,[],()
73382,46994,19129,1,25.5 EUR,2024-10-03;08:26:30,,30.599999999999998,30.599999999999998,30.6,2024-10-03 08:26:30.000,2024-10-03,2024,10,3,46994,[],()
70561,45297,19187,1,USD63.25,10:32:55 AM; 5-October-2024,NULL,63.25,63.25,63.25,2024-10-05 10:32:55.000,2024-10-05,2024,10,5,45297,[],()
71110,46426,19447,3,24€75¢,00:15  2-Jun-2024,,2970.0,2970.0,8910.0,2024-06-02 00:15:00.000,2024-06-02,2024,6,2,46426,[],()
64785,45920,19445,1,60.5 $,"04/10/25,09:24:33 A.M.",,60.5,60.5,60.5,2025-04-10 09:24:33.000,2025-04-10,2025,4,10,45920,[],()
71571,44337,19122,1,$34.5,08:12 2024-08-27,NULL,34.5,34.5,34.5,2024-08-27 08:12:00.000,2024-08-27,2024,8,27,44337,[],()
68415,45127,19037,1,30.25 $,2024-07-05T19:05:29.059,,30.25,30.25,30.25,2024-07-05 19:05:29.059,2024-07-05,2024,7,5,45127,[],()
64685,45840,19516,1,36USD,2024-09-09T12:15:09,,36.0,36.0,36.0,2024-09-09 12:15:09.000,2024-09-09,2024,9,9,45840,[],()
71167,44540,19002,1,24.99 USD,"2025-01-26,07:24","Suite 857 87933 Erdman Circle, Goldnerton, IN 18447-4289",24.99,24.99,24.99,2025-01-26 07:24:00.000,2025-01-26,2025,1,26,44540,[],()
66411,44953,18894,1,USD20.50,11:17:36  1-Oct-2024,,20.5,20.5,20.5,2024-10-01 11:17:36.000,2024-10-01,2024,10,1,44953,[],()
66718,44382,19503,1,19.25 USD,02/03/25 11:04:51 pm,,19.25,19.25,19.25,2025-02-03 23:04:51.000,2025-02-03,2025,2,3,44382,[],()
73956,47503,19260,1,USD73.75,"03:09:09,10/20/24","2302 Wiza Springs, Terryport, RI 52943-7974",73.75,73.75,73.75,2024-10-20 03:09:09.000,2024-10-20,2024,10,20,47503,[],()
71198,45275,19510,1,$ 19.00,04/05/25 22:00:40,"Apt. 279 5485 Sidney Islands, North Mistie, ND 56675",19.0,19.0,19.0,2025-04-05 22:00:40.000,2025-04-05,2025,4,5,45275,[],()
72410,46372,19402,2,26.50$,02:46;24-June-2024,NULL,26.5,26.5,53.0,2024-06-24 02:46:00.000,2024-06-24,2024,6,24,46372,[],()
64750,46088,19405,1,49.99$,2024-04-10T13:30:29,"88203 Kasey Green, Feilville, AL 86004-9672",49.99,49.99,49.99,2024-04-10 13:30:29.000,2024-04-10,2024,4,10,46088,[],()
63828,46228,19498,1,47.00EUR,06.08.2025 11:04:04,,56.4,56.4,56.4,2025-06-08 11:04:04.000,2025-06-08,2025,6,8,46228,[],()
69773,46402,18906,1,$41.00,04.06.2025 12:12:12,,41.0,41.0,41.0,2025-04-06 12:12:12.000,2025-04-06,2025,4,6,46402,[],()
68277,44773,19336,1,51.5$,11:29:46 P.M.;22-April-2025,,51.5,51.5,51.5,2025-04-22 23:29:46.000,2025-04-22,2025,4,22,45061,[],()
67647,44777,18856,1,48.50$,2024-11-26T09:25:13.655,,48.5,48.5,48.5,2024-11-26 09:25:13.655,2024-11-26,2024,11,26,44777,[],()
73259,44827,19227,2,51.5€,00:04:30 2024-07-16,,61.8,61.8,123.6,2024-07-16 00:04:30.000,2024-07-16,2024,7,16,44827,[],()
64920,46765,19318,1,USD28.25,02:18:15 P.M. 15-APR-2025,,28.25,28.25,28.25,2025-04-15 14:18:15.000,2025-04-15,2025,4,15,46765,[],()
65364,44378,19583,1,€ 58.,"06:48,12-Dec-2024",,69.6,69.6,69.6,2024-12-12 06:48:00.000,2024-12-12,2024,12,12,44378,[],()
68932,44410,18935,2,59€,"11:20:03, 07/19/25",,70.8,70.8,141.6,2025-07-19 11:20:03.000,2025-07-19,2025,7,19,44410,[],()
66734,47243,19051,1,72.99$,"16:36:35, 03/21/25",,72.99,72.99,72.99,2025-03-21 16:36:35.000,2025-03-21,2025,3,21,47243,[],()
64393,46272,18932,3,$21¢00,12/28/24 11:03:50 AM,,2100.0,2100.0,6300.0,2024-12-28 11:03:50.000,2024-12-28,2024,12,28,46272,[],()
65307,47390,19478,1,$55.75,"10/07/24, 09:18:53 AM",,55.75,55.75,55.75,2024-10-07 09:18:53.000,2024-10-07,2024,10,7,47390,[],()
66080,45820,18848,1,$ 21.75,2024-11-18 22:24:21,"Apt. 475 8364 Mayer Light, Auermouth, AZ 61452",21.75,21.75,21.75,2024-11-18 22:24:21.000,2024-11-18,2024,11,18,45820,[],()
66425,45934,19387,1,$61.0,06:47:25;03/01/25,"Suite 716 90296 Lueilwitz Canyon, McLaughlinview, SC 74515-5870",61.0,61.0,61.0,2025-03-01 06:47:25.000,2025-03-01,2025,3,1,45934,[],()
66735,45143,18987,1,$ 60.00,2025-09-10T05:26:37,,60.0,60.0,60.0,2025-09-10 05:26:37.000,2025-09-10,2025,9,10,45143,[],()
64288,45330,18934,1,14.0 $,08/16/24 17:20,,14.0,14.0,14.0,2024-08-16 17:20:00.000,2024-08-16,2024,8,16,45330,[],()
65271,45800,19094,1,$53.0,08/08/24;13:37,NULL,53.0,53.0,53.0,2024-08-08 13:37:00.000,2024-08-08,2024,8,8,45800,[],()
73449,45657,19520,1,33.00 $,"08:48:59 PM,  2-DEC-2024",NULL,33.0,33.0,33.0,2024-12-02 20:48:59.000,2024-12-02,2024,12,2,45657,[],()
71004,44482,19026,1,20$,06:38:21 A.M. 01/25/25,,20.0,20.0,20.0,2025-01-25 06:38:21.000,2025-01-25,2025,1,25,44482,[],()
67837,47453,19321,2,49.25EUR,"07:05:54 am, 08/09/24",,59.099999999999994,59.099999999999994,118.2,2024-08-09 07:05:54.000,2024-08-09,2024,8,9,47453,[],()
64559,45100,19197,1,$ 44.75,12-June-2025 00:53,,44.75,44.75,44.75,2025-06-12 00:53:00.000,2025-06-12,2025,6,12,45796,[],()
69273,47229,19432,1,USD25.5,23-March-2025;00:06,,25.5,25.5,25.5,2025-03-23 00:06:00.000,2025-03-23,2025,3,23,47229,[],()
73646,45200,19024,1,€ 60.00,"12:19,2025-03-02",,72.0,72.0,72.0,2025-03-02 12:19:00.000,2025-03-02,2025,3,2,45200,[],()
70865,47437,18953,1,62€25¢,15-Jul-2024 15:11:33,NULL,7470.0,7470.0,7470.0,2024-07-15 15:11:33.000,2024-07-15,2024,7,15,47437,[],()
70230,44979,19571,1,EUR 17.00,"08/11/25,03:05:01 AM",,20.4,20.4,20.4,2025-08-11 03:05:01.000,2025-08-11,2025,8,11,44979,[],()
67963,45030,19084,1,USD 49.5,11/28/24 21:46,"81741 Schroeder Radial, South Carmineview, AR 57320",49.5,49.5,49.5,2024-11-28 21:46:00.000,2024-11-28,2024,11,28,45030,[],()
73069,47493,19359,1,$ 50.75,10:38:07 06/18/24,"719 Latrina Ville, Elinamouth, SD 82304",50.75,50.75,50.75,2024-06-18 10:38:07.000,2024-06-18,2024,6,18,47493,[],()
66408,45879,19114,1,EUR 44.99,24-Oct-2024;08:16:07,NULL,53.988,53.988,53.99,2024-10-24 08:16:07.000,2024-10-24,2024,10,24,45879,[],()
68051,46611,19174,1,28.00 EUR,"28-Jan-2025, 11:56:35",NULL,33.6,33.6,33.6,2025-01-28 11:56:35.000,2025-01-28,2025,1,28,45365,[],()
68748,46034,19397,2,26.0 USD,"04/20/25,17:33:06","Apt. 867 498 Ryan Unions, South Jenaehaven, NV 23464",26.0,26.0,52.0,2025-04-20 17:33:06.000,2025-04-20,2025,4,20,46034,[],()
64123,47547,19394,1,20.50€,"11:45:13, 04/28/24","169 Donnie Causeway, Gulgowskifurt, AR 79551-4307",24.599999999999998,24.599999999999998,24.6,2024-04-28 11:45:13.000,2024-04-28,2024,4,28,47547,[],()
71612,47360,19471,1,USD40.0,"15-Dec-2024, 15:57:05",,40.0,40.0,40.0,2024-12-15 15:57:05.000,2024-12-15,2024,12,15,47360,[],()
65806,47133,19232,1,$ 35.99,"2024-12-20, 07:56","Apt. 797 800 Cole Center, Morarville, VT 69147-0051",35.99,35.99,35.99,2024-12-20 07:56:00.000,2024-12-20,2024,12,20,47133,[],()
73556,46844,18897,1,53.99 USD,03/25/25;20:07:13,"373 Alayna Cliff, Bahringerstad, OK 91787-1786",53.99,53.99,53.99,2025-03-25 20:07:13.000,2025-03-25,2025,3,25,46844,[],()
66984,45626,19372,2,USD 58,"06/26/24, 07:32:10 PM",NULL,58.0,58.0,116.0,2024-06-26 19:32:10.000,2024-06-26,2024,6,26,45149,[],()
63973,45709,19147,1,26.75 USD,"12/07/24, 05:28",,26.75,26.75,26.75,2024-12-07 05:28:00.000,2024-12-07,2024,12,7,45709,[],()
62799,45258,19246,1,22. USD,2024-11-02;09:16:42,,22.0,22.0,22.0,2024-11-02 09:16:42.000,2024-11-02,2024,11,2,45258,[],()
68035,47533,19278,2,36.99 €,"08/09/24, 11:14:57 AM",NULL,44.388,44.388,88.78,2024-08-09 11:14:57.000,2024-08-09,2024,8,9,47533,[],()
65020,44683,19145,1,73.00€,"05/12/24,09:26","Apt. 204 74948 Stokes Loaf, Jinport, AZ 98041",87.6,87.6,87.6,2024-05-12 09:26:00.000,2024-05-12,2024,5,12,44683,[],()
70796,45955,19506,2,$ 56.50,20:23;25-FEB-2025,"Suite 141 98787 Tenesha Plain, Fishermouth, NV 36046",56.5,56.5,113.0,2025-02-25 20:23:00.000,2025-02-25,2025,2,25,45955,[],()
73101,44360,18998,1,USD 48.,"00:21, 08/28/24",NULL,48.0,48.0,48.0,2024-08-28 00:21:00.000,2024-08-28,2024,8,28,44360,[],()
69000,45760,18957,1,61.99$,"10:16:29,12-Dec-2024",,61.99,61.99,61.99,2024-12-12 10:16:29.000,2024-12-12,2024,12,12,45760,[],()
64794,44569,19568,1,45.0 USD,2025-02-15;08:06:06,,45.0,45.0,45.0,2025-02-15 08:06:06.000,2025-02-15,2025,2,15,44569,[],()
73533,44499,19253,2,39.0USD,15:39;11/05/24,NULL,39.0,39.0,78.0,2024-11-05 15:39:00.000,2024-11-05,2024,11,5,44499,[],()
65238,46266,19380,1,$68.0,17-JUN-2025 12:08:43 P.M.,,68.0,68.0,68.0,2025-06-17 12:08:43.000,2025-06-17,2025,6,17,46266,[],()
64293,44534,19143,1,$ 31.00,10:53:43 pm 2024-09-23,"Suite 510 46728 Christopher Tunnel, Nolanhaven, HI 07848-0539",31.0,31.0,31.0,2024-09-23 22:53:43.000,2024-09-23,2024,9,23,44534,[],()
68053,45963,19267,2,21.25€,02:52 20-September-2024,NULL,25.5,25.5,51.0,2024-09-20 02:52:00.000,2024-09-20,2024,9,20,45963,[],()
70477,45855,19375,2,USD18.5,22-Aug-2024 19:52,,18.5,18.5,37.0,2024-08-22 19:52:00.000,2024-08-22,2024,8,22,45855,[],()
64977,46208,19268,2,46.0 EUR,01:50:46 am;03/27/25,,55.199999999999996,55.199999999999996,110.4,2025-03-27 01:50:46.000,2025-03-27,2025,3,27,46208,[],()
66249,47530,19458,2,$ 56,"17:58:46, 15-Nov-2024",,56.0,56.0,112.0,2024-11-15 17:58:46.000,2024-11-15,2024,11,15,47530,[],()
63864,47218,19063,1,USD49.75,"2025-03-02, 11:06:29 P.M.",,49.75,49.75,49.75,2025-03-02 23:06:29.000,2025-03-02,2025,3,2,47218,[],()
67978,45326,18965,1,66.25€,"2025-05-25, 08:07:26",,79.5,79.5,79.5,2025-05-25 08:07:26.000,2025-05-25,2025,5,25,45326,[],()
69866,46273,18858,1,17.50€,"23:42, 03/02/25","867 Maya Glen, Samshire, TN 59248",21.0,21.0,21.0,2025-03-02 23:42:00.000,2025-03-02,2025,3,2,46273,[],()
62929,47507,18873,1,68.5USD,2024-09-10T14:36:17.664,"6087 Issac Valley, New Shielaton, WY 54283",68.5,68.5,68.5,2024-09-10 14:36:17.664,2024-09-10,2024,9,10,47507,[],()
63995,46549,19292,1,€54¢25, 1-June-2025 06:38,,6510.0,6510.0,6510.0,2025-06-01 06:38:00.000,2025-06-01,2025,6,1,46549,[],()
63376,47451,19525,1,EUR61.0,2024-08-15T16:55:40.286,,73.2,73.2,73.2,2024-08-15 16:55:40.286,2024-08-15,2024,8,15,46068,[],()
73755,45764,18846,1,$ 20.00,"2025-01-04,14:03",,20.0,20.0,20.0,2025-01-04 14:03:00.000,2025-01-04,2025,1,4,45764,[],()
73700,44961,19295,1,35.5$,2024-11-14T20:40:30.615,NULL,35.5,35.5,35.5,2024-11-14 20:40:30.615,2024-11-14,2024,11,14,44961,[],()
62854,44791,18961,1,$70.25,11-AUG-2024 05:43:42 PM,NULL,70.25,70.25,70.25,2024-08-11 17:43:42.000,2024-08-11,2024,8,11,44791,[],()
68574,46849,19152,2,USD32.25,2024-06-12T00:21:38.565,"Suite 995 3430 Sipes Ville, Port Lanelle, ID 65573-0998",32.25,32.25,64.5,2024-06-12 00:21:38.565,2024-06-12,2024,6,12,46849,[],()
73446,45221,19519,1,€ 31.25,"11-Jul-2024,01:13","Apt. 977 91588 Reynolds Bypass, Herschelburgh, MO 77269",37.5,37.5,37.5,2024-07-11 01:13:00.000,2024-07-11,2024,7,11,45221,[],()
71979,47124,19221,1,EUR54.25,"2024-11-16,14:50",,65.1,65.1,65.1,2024-11-16 14:50:00.000,2024-11-16,2024,11,16,47124,[],()
70714,47463,19056,1,24.75EUR,"02:42:15 PM,2025-11-09",,29.7,29.7,29.7,2025-11-09 14:42:15.000,2025-11-09,2025,11,9,47463,[],()
71579,45897,19428,3,USD 41.75,08:26:55 pm;04/27/25,"Suite 997 28140 Sharleen Isle, D'Amoreburgh, ID 05811",41.75,41.75,125.25,2025-04-27 20:26:55.000,2025-04-27,2025,4,27,45897,[],()
64880,46032,19370,1,€22¢50,"18:21:12, 11-June-2024",,2700.0,2700.0,2700.0,2024-06-11 18:21:12.000,2024-06-11,2024,6,11,46032,[],()
64625,46685,18918,4,70.50EUR,07:49;08/15/24,,84.6,84.6,338.4,2024-08-15 07:49:00.000,2024-08-15,2024,8,15,46299,[],()
73887,45675,19194,1,39.25 $,2025-01-09 02:27,NULL,39.25,39.25,39.25,2025-01-09 02:27:00.000,2025-01-09,2025,1,9,44398,[],()
70344,44499,18946,1,$ 46.25,"2024-06-10, 06:37:14","Suite 935 99382 King Unions, Schuppetown, TN 87229",46.25,46.25,46.25,2024-06-10 06:37:14.000,2024-06-10,2024,6,10,44499,[],()
65791,47442,18880,2,67.5 USD,2024-10-19T15:37:27,,67.5,67.5,135.0,2024-10-19 15:37:27.000,2024-10-19,2024,10,19,47442,[],()
71136,45630,19166,1,$60.,"00:28,2024-11-11",,60.0,60.0,60.0,2024-11-11 00:28:00.000,2024-11-11,2024,11,11,45630,[],()
62815,44367,19543,2,€ 42,2024-08-09T01:26:54.355,,50.4,50.4,100.8,2024-08-09 01:26:54.355,2024-08-09,2024,8,9,44367,[],()
69522,46075,19016,1,€47¢00," 6-JAN-2025,06:25",NULL,5640.0,5640.0,5640.0,2025-01-06 06:25:00.000,2025-01-06,2025,1,6,45712,[],()
69448,46838,19245,1,67.75 USD,16:40:25;12/26/24,"Apt. 395 98750 DuBuque Forest, East Shanice, MN 55505-8629",67.75,67.75,67.75,2024-12-26 16:40:25.000,2024-12-26,2024,12,26,46838,[],()
72469,47466,19372,5,58.75 USD,2024-09-01;08:09:28 PM,,58.75,58.75,293.75,2024-09-01 20:09:28.000,2024-09-01,2024,9,1,47466,[],()
70059,46032,19408,1,25.50 USD,2024-06-14 08:20:35 PM, ,25.5,25.5,25.5,2024-06-14 20:20:35.000,2024-06-14,2024,6,14,46032,[],()
62879,45702,18923,1,$26.0,"02:59:47, 2025-01-17",,26.0,26.0,26.0,2025-01-17 02:59:47.000,2025-01-17,2025,1,17,45702,[],()
73322,45572,19339,1,43 USD,"03:12:54 P.M.,09/02/24",,43.0,43.0,43.0,2024-09-02 15:12:54.000,2024-09-02,2024,9,2,45572,[],()
67019,44986,19166,2,59.99 $,23:12:18  6-Mar-2025,NULL,59.99,59.99,119.98,2025-03-06 23:12:18.000,2025-03-06,2025,3,6,44986,[],()
67513,45918,18926,5,37.25 $,11/21/24 10:34,,37.25,37.25,186.25,2024-11-21 10:34:00.000,2024-11-21,2024,11,21,45918,[],()
64729,46151,19105,1,€37¢50,"2025-04-09, 12:15:05 P.M.",,4500.0,4500.0,4500.0,2025-04-09 12:15:05.000,2025-04-09,2025,4,9,46151,[],()
73552,46640,18916,1,54.5 USD,18:01 23-Jul-2025,,54.5,54.5,54.5,2025-07-23 18:01:00.000,2025-07-23,2025,7,23,46640,[],()
72666,44991,18989,1,43.5 $,2024-09-25T04:53:09,,43.5,43.5,43.5,2024-09-25 04:53:09.000,2024-09-25,2024,9,25,44991,[],()
71835,45497,19216,1,66$50¢,"02:18:09 P.M., 6-NOV-2024",,6650.0,6650.0,6650.0,2024-11-06 14:18:09.000,2024-11-06,2024,11,6,45497,[],()
62994,46996,18859,2,54.0 EUR,Sun Sep 22 07:31:36 2024,NULL,64.8,64.8,129.6,2024-09-22 07:31:36.000,2024-09-22,2024,9,22,46996,[],()
69950,46268,19466,1,EUR22.75,11:04:37;11/22/24,"Suite 277 6065 Jeremiah Turnpike, North Mathew, ID 92997-3282",27.3,27.3,27.3,2024-11-22 11:04:37.000,2024-11-22,2024,11,22,46268,[],()
67925,44652,18890,5,69.5 €,14:42:46 04/01/25,NULL,83.39999999999999,83.39999999999999,417.0,2025-04-01 14:42:46.000,2025-04-01,2025,4,1,44652,[],()
68266,44627,19532,1,$28¢75,2024-11-22T20:36:54,,2875.0,2875.0,2875.0,2024-11-22 20:36:54.000,2024-11-22,2024,11,22,44627,[],()
71176,44852,19236,1,USD68.5,"01:56:59 A.M., 06/02/25",,68.5,68.5,68.5,2025-06-02 01:56:59.000,2025-06-02,2025,6,2,44852,[],()
63123,45662,19408,1,22.25€,"00:33:39, 2025-04-13",,26.7,26.7,26.7,2025-04-13 00:33:39.000,2025-04-13,2025,4,13,45662,[],()
64754,44970,19482,1,€26¢25,2025-03-09T07:56:55,NULL,3150.0,3150.0,3150.0,2025-03-09 07:56:55.000,2025-03-09,2025,3,9,44970,[],()
68559,44999,18917,2,USD 66.75,2024-10-15T17:21:58.220,NULL,66.75,66.75,133.5,2024-10-15 17:21:58.220,2024-10-15,2024,10,15,44999,[],()
68996,46229,19490,1,49.00 $,"11:19:15 am,11/09/24","Apt. 798 9730 Freeda Stravenue, McDermottshire, NE 73109-8477",49.0,49.0,49.0,2024-11-09 11:19:15.000,2024-11-09,2024,11,9,46229,[],()
72307,47472,18840,2,46.25$,2024-11-10;06:34:15 P.M.,,46.25,46.25,92.5,2024-11-10 18:34:15.000,2024-11-10,2024,11,10,47472,[],()
69227,47094,18987,2,$ 62.75,2025-01-14 05:25:21 am,"27694 Eloise Trace, Hortensiastad, MN 25025-2894",62.75,62.75,125.5,2025-01-14 05:25:21.000,2025-01-14,2025,1,14,47094,[],()
67916,44864,19559,1,$ 68.5,"2025-02-05, 14:30",,68.5,68.5,68.5,2025-02-05 14:30:00.000,2025-02-05,2025,2,5,44864,[],()
68642,46761,19333,2,28.25 $,"02:23:24 A.M., 2024-05-12",,28.25,28.25,56.5,2024-05-12 02:23:24.000,2024-05-12,2024,5,12,47344,[],()
64863,44836,19084,1,53.00 $,07:59;2024-09-01,NULL,53.0,53.0,53.0,2024-09-01 07:59:00.000,2024-09-01,2024,9,1,44836,[],()
68173,44844,18876,2,17.5USD,09.01.2025 00:33:33,"5426 Micaela Place, Runolfsdottirberg, NY 15352-7238",17.5,17.5,35.0,2025-09-01 00:33:33.000,2025-09-01,2025,9,1,44844,[],()
72097,44985,18977,1,€31¢25,"00:22, 2024-10-02",,3750.0,3750.0,3750.0,2024-10-02 00:22:00.000,2024-10-02,2024,10,2,44985,[],()
72890,45809,19387,1,USD62.00,10-NOV-2024;05:52:21 PM,,62.0,62.0,62.0,2024-11-10 17:52:21.000,2024-11-10,2024,11,10,45809,[],()
66354,47283,19112,1,$19,"04:07:39, 10/24/24",,19.0,19.0,19.0,2024-10-24 04:07:39.000,2024-10-24,2024,10,24,47283,[],()
62897,44510,18986,1,65.99 USD,2024-10-18T19:30:42,,65.99,65.99,65.99,2024-10-18 19:30:42.000,2024-10-18,2024,10,18,44510,[],()
67332,46380,18976,1,27€25¢,"10:18,07/19/25",,3270.0,3270.0,3270.0,2025-07-19 10:18:00.000,2025-07-19,2025,7,19,46380,[],()
64555,46075,18931,4,37.25$,"10/22/24, 06:01","Apt. 857 20568 Murazik Springs, West Kortneyshire, TN 54642",37.25,37.25,149.0,2024-10-22 06:01:00.000,2024-10-22,2024,10,22,45712,[],()
73255,45277,19063,1,46.50 EUR,2024-06-15T04:14:45.687,NULL,55.8,55.8,55.8,2024-06-15 04:14:45.687,2024-06-15,2024,6,15,45277,[],()
65793,44411,19052,2,68.0EUR,17:52:26 29-May-2025,,81.6,81.6,163.2,2025-05-29 17:52:26.000,2025-05-29,2025,5,29,44411,[],()
65497,46573,19425,5,€41¢99,21-Jun-2025;04:56:52 P.M.,,5038.8,5038.8,25194.0,2025-06-21 16:56:52.000,2025-06-21,2025,6,21,46573,[],()
70131,45535,19442,1,48.5 EUR,2025-02-09T20:27:03,,58.199999999999996,58.199999999999996,58.2,2025-02-09 20:27:03.000,2025-02-09,2025,2,9,45535,[],()
66561,46081,19110,1,57. USD,09/21/24 05:58:54 pm,NULL,57.0,57.0,57.0,2024-09-21 17:58:54.000,2024-09-21,2024,9,21,46081,[],()
66518,46921,19440,1,USD 26.75,18:54:41 09/17/25,"Apt. 617 77229 Braun Oval, West Tuantown, GA 51903-8013",26.75,26.75,26.75,2025-09-17 18:54:41.000,2025-09-17,2025,9,17,46921,[],()
68188,44892,18898,1,$ 69,"2025-03-13, 11:44:40 A.M.", ,69.0,69.0,69.0,2025-03-13 11:44:40.000,2025-03-13,2025,3,13,44892,[],()
68805,45293,19472,1,66.75$,"14:10, 2024-07-10",,66.75,66.75,66.75,2024-07-10 14:10:00.000,2024-07-10,2024,7,10,45293,[],()
66260,44594,18881,1,32.00$," 7-Jun-2024,09:38:18 am",NULL,32.0,32.0,32.0,2024-06-07 09:38:18.000,2024-06-07,2024,6,7,44594,[],()
65730,45972,18951,1,70.00 $,03/25/25;00:16,"Apt. 986 418 Mason Road, Tempiefurt, HI 03862-6516",70.0,70.0,70.0,2025-03-25 00:16:00.000,2025-03-25,2025,3,25,46526,[],()
63483,44409,19405,1,$52.50,"10:18, 8-APR-2025",,52.5,52.5,52.5,2025-04-08 10:18:00.000,2025-04-08,2025,4,8,44409,[],()
67487,45136,19133,1,USD26.0,24-SEP-2024;21:52,"Suite 594 216 Zieme Square, Gerardoview, PA 07120-0022",26.0,26.0,26.0,2024-09-24 21:52:00.000,2024-09-24,2024,9,24,45136,[],()
65483,46306,19494,1,$31¢25,2024-11-02T21:03:11,NULL,3125.0,3125.0,3125.0,2024-11-02 21:03:11.000,2024-11-02,2024,11,2,46306,[],()
70750,44921,19202,1,USD 53.00,17:04;23-Sep-2024,NULL,53.0,53.0,53.0,2024-09-23 17:04:00.000,2024-09-23,2024,9,23,44921,[],()
66394,44520,18914,1,45.99EUR,2024-10-05;07:34,NULL,55.188,55.188,55.19,2024-10-05 07:34:00.000,2024-10-05,2024,10,5,44520,[],()
72476,46980,18942,1,$ 23.99,Thu Jul 10 18:33:00 2025,NULL,23.99,23.99,23.99,2025-07-10 18:33:00.000,2025-07-10,2025,7,10,46980,[],()
70711,46693,19175,3,38.50 USD,"2024-07-23, 14:31",,38.5,38.5,115.5,2024-07-23 14:31:00.000,2024-07-23,2024,7,23,46693,[],()
72974,44676,19280,1,€44¢50,"01:37:26 am, 2025-05-21",,5340.0,5340.0,5340.0,2025-05-21 01:37:26.000,2025-05-21,2025,5,21,44676,[],()
72502,45573,18850,1,USD 29.00,05:07:50 10/23/24,,29.0,29.0,29.0,2024-10-23 05:07:50.000,2024-10-23,2024,10,23,45573,[],()
71114,44995,19449,2,47.00 USD,"12-November-2024, 02:59",NULL,47.0,47.0,94.0,2024-11-12 02:59:00.000,2024-11-12,2024,11,12,44995,[],()
64329,46947,19349,4,43.00 EUR,"12/13/24,07:58:22 P.M.",NULL,51.6,51.6,206.4,2024-12-13 19:58:22.000,2024-12-13,2024,12,13,46947,[],()
68004,45897,19120,2,$63.75,"15:35, 2024-09-01",NULL,63.75,63.75,127.5,2024-09-01 15:35:00.000,2024-09-01,2024,9,1,45897,[],()
70197,46866,19449,1,50€99¢,"2025-03-19,05:15",,6118.8,6118.8,6118.8,2025-03-19 05:15:00.000,2025-03-19,2025,3,19,46866,[],()
72956,44636,19111,1,USD26.25,"03/24/25,07:57:08","Suite 394 64743 Bayer Well, New Carlos, CO 77839",26.25,26.25,26.25,2025-03-24 07:57:08.000,2025-03-24,2025,3,24,44636,[],()
71688,44922,19512,1,$44¢25,10:11 2024-08-21,,4425.0,4425.0,4425.0,2024-08-21 10:11:00.000,2024-08-21,2024,8,21,44922,[],()
71061,46919,19428,2,41.50 USD,2025-01-31 02:25:04 AM,NULL,41.5,41.5,83.0,2025-01-31 02:25:04.000,2025-01-31,2025,1,31,46919,[],()
71755,46692,19399,1,USD18.00,2025-04-12;05:32:52 AM,"5125 Elwood Heights, Port Silas, UT 73157-7364",18.0,18.0,18.0,2025-04-12 05:32:52.000,2025-04-12,2025,4,12,46692,[],()
64033,45051,19370,2,17.25$,"04/20/25, 04:24",,17.25,17.25,34.5,2025-04-20 04:24:00.000,2025-04-20,2025,4,20,45051,[],()
63695,45777,18917,5,69.0 USD,"04/15/24,04:34:43 PM",,69.0,69.0,345.0,2024-04-15 16:34:43.000,2024-04-15,2024,4,15,45777,[],()
71863,47604,19075,5,45.00$,18:48 2024-10-10,,45.0,45.0,225.0,2024-10-10 18:48:00.000,2024-10-10,2024,10,10,47604,[],()
68865,47232,19333,1,30.75 EUR," 1-Sep-2024, 05:02:02 AM",,36.9,36.9,36.9,2024-09-01 05:02:02.000,2024-09-01,2024,9,1,47232,[],()
62955,44387,19138,1,31.25$,"09/11/24,21:32",NULL,31.25,31.25,31.25,2024-09-11 21:32:00.000,2024-09-11,2024,9,11,44387,[],()
65131,47254,19276,2,$16¢50,"2025-01-31, 08:52:49",,1650.0,1650.0,3300.0,2025-01-31 08:52:49.000,2025-01-31,2025,1,31,47254,[],()
70367,47281,19034,1,47.00 €,"19-Mar-2025,01:46:45 am","73957 Raeann Haven, Littleborough, MI 55020-7040",56.4,56.4,56.4,2025-03-19 01:46:45.000,2025-03-19,2025,3,19,47281,[],()
63793,47280,19295,1,37.50 USD,"05/29/24,01:35:01",,37.5,37.5,37.5,2024-05-29 01:35:01.000,2024-05-29,2024,5,29,47494,[],()
65792,46905,19336,1,$ 51.5,"05:17,2024-08-24","Suite 811 84859 Opal Turnpike, Kuvalisberg, MT 73227-8224",51.5,51.5,51.5,2024-08-24 05:17:00.000,2024-08-24,2024,8,24,46905,[],()
66296,44881,18882,1,$ 47.25,2024-12-14T17:52:15.711,NULL,47.25,47.25,47.25,2024-12-14 17:52:15.711,2024-12-14,2024,12,14,44881,[],()
66605,44770,18857,2,$ 72.0,"09/06/24, 15:50",,72.0,72.0,144.0,2024-09-06 15:50:00.000,2024-09-06,2024,9,6,44770,[],()
73426,45429,18976,1,$ 28.0,Mon Jan 20 20:34:30 2025,NULL,28.0,28.0,28.0,2025-01-20 20:34:30.000,2025-01-20,2025,1,20,45429,[],()
64979,44486,19306,1,36.25 $,"05/25/25, 02:42:52 AM",,36.25,36.25,36.25,2025-05-25 02:42:52.000,2025-05-25,2025,5,25,44486,[],()
64365,46229,19140,3,64.25$,"21:15, 7-OCT-2024",NULL,64.25,64.25,192.75,2024-10-07 21:15:00.000,2024-10-07,2024,10,7,46229,[],()
66143,46400,19203,2,$ 58.75,"14:27,11/01/24",,58.75,58.75,117.5,2024-11-01 14:27:00.000,2024-11-01,2024,11,1,46400,[],()
68241,47109,19551,1,$27.50,2024-09-30;01:24,"Apt. 614 60412 Joselyn Tunnel, Meryltown, MO 58507",27.5,27.5,27.5,2024-09-30 01:24:00.000,2024-09-30,2024,9,30,47109,[],()
70237,44540,18930,5,33.75 USD,2024-08-29T04:22:01.920,NULL,33.75,33.75,168.75,2024-08-29 04:22:01.920,2024-08-29,2024,8,29,44540,[],()
69714,45992,18935,1,61.00 €," 6-JUN-2025,08:19:10 PM",,73.2,73.2,73.2,2025-06-06 20:19:10.000,2025-06-06,2025,6,6,45992,[],()
64814,46474,19224,1,54.00 €,"08:47:10,2025-03-10",,64.8,64.8,64.8,2025-03-10 08:47:10.000,2025-03-10,2025,3,10,46474,[],()
65161,45522,19128,1,74.5€,08:33:29;01/04/25,"Suite 682 7178 Gavin Trace, Cummingsville, VA 62547",89.39999999999999,89.39999999999999,89.4,2025-01-04 08:33:29.000,2025-01-04,2025,1,4,45522,[],()
65288,45585,19189,1,$18.00,"23-FEB-2025,10:14:32",,18.0,18.0,18.0,2025-02-23 10:14:32.000,2025-02-23,2025,2,23,45585,[],()
64363,47060,18960,1,32 $,04:43:47 PM 13-March-2025,NULL,32.0,32.0,32.0,2025-03-13 16:43:47.000,2025-03-13,2025,3,13,47060,[],()
63281,45734,19479,1,USD 62.0,"08/01/25, 01:44:59 P.M.",,62.0,62.0,62.0,2025-08-01 13:44:59.000,2025-08-01,2025,8,1,45734,[],()
72250,46511,19267,1,$18.0,07/12/24;05:58:27,,18.0,18.0,18.0,2024-07-12 05:58:27.000,2024-07-12,2024,7,12,46511,[],()
68054,44466,18917,1,$70.0,14:24:00;2024-08-03,NULL,70.0,70.0,70.0,2024-08-03 14:24:00.000,2024-08-03,2024,8,3,44466,[],()
73779,47021,19171,1,43.25USD,"01:16:39 AM, 2025-02-02",,43.25,43.25,43.25,2025-02-02 01:16:39.000,2025-02-02,2025,2,2,47021,[],()
64049,47463,19161,1,33.00USD,"04:57:35,10-Aug-2024",,33.0,33.0,33.0,2024-08-10 04:57:35.000,2024-08-10,2024,8,10,47463,[],()
63465,46909,19315,2,58.99$,"19:20:14, 29-Mar-2025",NULL,58.99,58.99,117.98,2025-03-29 19:20:14.000,2025-03-29,2025,3,29,46909,[],()
65289,46026,18979,2,69.0EUR,2024-07-14T04:07:52,,82.8,82.8,165.6,2024-07-14 04:07:52.000,2024-07-14,2024,7,14,46026,[],()
68226,46009,19145,1,USD 73.99,"03:33:37 AM, 01/04/25",,73.99,73.99,73.99,2025-01-04 03:33:37.000,2025-01-04,2025,1,4,46009,[],()
69462,46766,19419,1,49.5USD,2025-03-31T02:14:15,"Apt. 844 221 Lang Passage, Simonismouth, OH 75192-3215",49.5,49.5,49.5,2025-03-31 02:14:15.000,2025-03-31,2025,3,31,46766,[],()
72558,44383,18924,1,26.99USD,"12:31:33, 2024-07-06",,26.99,26.99,26.99,2024-07-06 12:31:33.000,2024-07-06,2024,7,6,44383,[],()
72119,46860,19243,1,41.5 $,"18-September-2024, 05:57:19 P.M.",,41.5,41.5,41.5,2024-09-18 17:57:19.000,2024-09-18,2024,9,18,46860,[],()
69779,44711,19464,1,42.5€,"11-Jun-2024, 06:38:15 am",,51.0,51.0,51.0,2024-06-11 06:38:15.000,2024-06-11,2024,6,11,44711,[],()
65359,45867,19213,1,EUR 31.25,12/08/24 11:01,,37.5,37.5,37.5,2024-12-08 11:01:00.000,2024-12-08,2024,12,8,45734,[],()
68986,47379,19114,1,EUR42.75,"09/24/24, 02:17:04 PM",,51.3,51.3,51.3,2024-09-24 14:17:04.000,2024-09-24,2024,9,24,47379,[],()
66469,44341,19549,1,37.5 $,09:37:05 PM 12-Feb-2025,,37.5,37.5,37.5,2025-02-12 21:37:05.000,2025-02-12,2025,2,12,44341,[],()
71141,45574,18940,1,18.0USD,11-NOV-2024 07:11:33 am,,18.0,18.0,18.0,2024-11-11 07:11:33.000,2024-11-11,2024,11,11,45574,[],()
66780,45772,19387,1,$ 65.50,02.08.2025 01:13:13,NULL,65.5,65.5,65.5,2025-02-08 01:13:13.000,2025-02-08,2025,2,8,45772,[],()
63460,47269,19450,2,32.5 EUR,"2024-12-13,07:28",,39.0,39.0,78.0,2024-12-13 07:28:00.000,2024-12-13,2024,12,13,47269,[],()
70343,44564,19257,3,€ 67.25,"16:55, 2-September-2024","Suite 104 395 Stokes Mall, Bobbietown, OK 94404-6479",80.7,80.7,242.1,2024-09-02 16:55:00.000,2024-09-02,2024,9,2,44564,[],()
69733,44958,18847,1,38.99EUR,04:27;2025-02-03,"18047 Prince Street, Joeyside, MI 52666-1599",46.788000000000004,46.788000000000004,46.79,2025-02-03 04:27:00.000,2025-02-03,2025,2,3,44958,[],()
63171,45381,19106,4,EUR 48.99,01:17;2025-04-05,NULL,58.788,58.788,235.15,2025-04-05 01:17:00.000,2025-04-05,2025,4,5,45381,[],()
66257,44947,19545,1,46.5€,10/22/24;05:17:19,"1631 Delmar Ports, North Yukochester, OK 69159-7522",55.8,55.8,55.8,2024-10-22 05:17:19.000,2024-10-22,2024,10,22,44947,[],()
65338,46960,18865,2,$44.,"02:06,11-Oct-2024",,44.0,44.0,88.0,2024-10-11 02:06:00.000,2024-10-11,2024,10,11,46354,[],()
62832,46764,19195,4,67.50 EUR,2025-04-07T10:17:03.019,NULL,81.0,81.0,324.0,2025-04-07 10:17:03.019,2025-04-07,2025,4,7,46764,[],()
66603,46158,18907,2,40€00¢,"02/20/25,20:48","183 Cummings Keys, New Randall, WA 36663",4800.0,4800.0,9600.0,2025-02-20 20:48:00.000,2025-02-20,2025,2,20,46158,[],()
71438,45884,19178,1,36$25¢,09/24/24 04:24:40 AM,,3625.0,3625.0,3625.0,2024-09-24 04:24:40.000,2024-09-24,2024,9,24,45884,[],()
64615,44673,19397,2,EUR26.75,"04:30:26 A.M., 18-Dec-2024",,32.1,32.1,64.2,2024-12-18 04:30:26.000,2024-12-18,2024,12,18,44673,[],()
66910,46592,19406,2,$56¢50,08/15/25;15:13:12,,5650.0,5650.0,11300.0,2025-08-15 15:13:12.000,2025-08-15,2025,8,15,46592,[],()
69231,44723,19509,1,53.0 USD, 8.06.2025  6:00:00,"29409 Rath Place, Lake Clintonhaven, GA 76167",53.0,53.0,53.0,2025-08-06 06:00:00.000,2025-08-06,2025,8,6,44723,[],()
67772,45689,19329,1,65.25$,11-FEB-2025;07:53:18 A.M.,"1960 Jack Wells, Archieport, AK 55513",65.25,65.25,65.25,2025-02-11 07:53:18.000,2025-02-11,2025,2,11,45689,[],()
63205,47315,19300,1,76.50$,"2024-12-02, 17:28","90844 Blick Throughway, Graigfort, WA 57208",76.5,76.5,76.5,2024-12-02 17:28:00.000,2024-12-02,2024,12,2,47315,[],()
66198,45809,19546,1,€44.50,2025-03-28T23:02:34,,53.4,53.4,53.4,2025-03-28 23:02:34.000,2025-03-28,2025,3,28,45809,[],()
63455,46320,19119,1,60.5USD,18-APR-2025;11:00:59 pm,"458 Bahringer Pass, Port Wesleyshire, WV 81773-4090",60.5,60.5,60.5,2025-04-18 23:00:59.000,2025-04-18,2025,4,18,46320,[],()
66585,46258,19526,2,69.50EUR,"12-Jul-2024,11:49",NULL,83.39999999999999,83.39999999999999,166.8,2024-07-12 11:49:00.000,2024-07-12,2024,7,12,46258,[],()
66123,46810,18942,2,USD 25.00,17:16:06 20-Oct-2024,,25.0,25.0,50.0,2024-10-20 17:16:06.000,2024-10-20,2024,10,20,46810,[],()
72264,45617,19252,1,€26¢75,"12:40:30,25-October-2024",NULL,3210.0,3210.0,3210.0,2024-10-25 12:40:30.000,2024-10-25,2024,10,25,45617,[],()
71794,46281,19173,2,60.00USD,21-Oct-2024;01:48:27 P.M.,,60.0,60.0,120.0,2024-10-21 13:48:27.000,2024-10-21,2024,10,21,46281,[],()
69162,44929,19435,3,68.25 €,"2025-01-25,04:12:21 pm",,81.89999999999999,81.89999999999999,245.7,2025-01-25 16:12:21.000,2025-01-25,2025,1,25,44929,[],()
67126,44337,19247,1,$ 64.0,30-April-2025 07:02,NULL,64.0,64.0,64.0,2025-04-30 07:02:00.000,2025-04-30,2025,4,30,44337,[],()
63214,45515,18953,5,59.75 USD,"18:22:17,2024-07-01",,59.75,59.75,298.75,2024-07-01 18:22:17.000,2024-07-01,2024,7,1,45515,[],()
65409,45942,18927,2,$ 67.5,08:42:53;09/14/24,,67.5,67.5,135.0,2024-09-14 08:42:53.000,2024-09-14,2024,9,14,45942,[],()
66531,47281,19071,2,USD17.5, 7-OCT-2024;03:34,,17.5,17.5,35.0,2024-10-07 03:34:00.000,2024-10-07,2024,10,7,47281,[],()
66402,45075,18938,1,USD 46.50,12:40:05 01/16/25,"165 Charley Center, Fabiolaport, CT 35360-0914",46.5,46.5,46.5,2025-01-16 12:40:05.000,2025-01-16,2025,1,16,45075,[],()
66175,44458,18938,1,46.25 €,15-December-2024 01:18:45 P.M.,,55.5,55.5,55.5,2024-12-15 13:18:45.000,2024-12-15,2024,12,15,44458,[],()
64286,45949,19491,1,$ 37.25," 2-Sep-2024,01:02",NULL,37.25,37.25,37.25,2024-09-02 01:02:00.000,2024-09-02,2024,9,2,45949,[],()
67578,45393,19148,1,€ 36.0,10:50:38 PM  1-FEB-2025,,43.199999999999996,43.199999999999996,43.2,2025-02-01 22:50:38.000,2025-02-01,2025,2,1,45393,[],()
69226,47089,19420,1,53.99USD,2024-06-01T18:48:01,,53.99,53.99,53.99,2024-06-01 18:48:01.000,2024-06-01,2024,6,1,47089,[],()
70009,45011,19041,1,15.75 €,2024-07-21T17:59:03,NULL,18.9,18.9,18.9,2024-07-21 17:59:03.000,2024-07-21,2024,7,21,45011,[],()
70236,44930,19310,1,$22¢50,"12:16:24 pm,2024-11-09",NULL,2250.0,2250.0,2250.0,2024-11-09 12:16:24.000,2024-11-09,2024,11,9,44930,[],()
64311,45446,19273,1,42.00$,15-Oct-2024;05:41,,42.0,42.0,42.0,2024-10-15 05:41:00.000,2024-10-15,2024,10,15,45446,[],()
68742,44919,19477,1,44. €,"03:04:18 PM, 25-February-2025",NULL,52.8,52.8,52.8,2025-02-25 15:04:18.000,2025-02-25,2025,2,25,44919,[],()
63507,46579,19046,1,20.99$,"09:35:24 pm, 2024-08-04","91869 Gregorio Mountain, West Lester, WY 78873-4165",20.99,20.99,20.99,2024-08-04 21:35:24.000,2024-08-04,2024,8,4,46579,[],()
69088,47151,19512,1,47€25¢," 3-Sep-2024, 19:47:39",,5670.0,5670.0,5670.0,2024-09-03 19:47:39.000,2024-09-03,2024,9,3,47151,[],()
66945,44731,19341,1,32.25 USD,"12:57:52 am, 05/13/25","18081 Nader Extensions, Nienowborough, UT 42531",32.25,32.25,32.25,2025-05-13 00:57:52.000,2025-05-13,2025,5,13,44731,[],()
66629,45758,19303,1,$ 62.0,00:50:59 13-Nov-2024,NULL,62.0,62.0,62.0,2024-11-13 00:50:59.000,2024-11-13,2024,11,13,45758,[],()
69803,45247,19326,1,25.99USD,30-NOV-2024 16:19:29,,25.99,25.99,25.99,2024-11-30 16:19:29.000,2024-11-30,2024,11,30,45247,[],()
66348,46052,19034,1,EUR47.99,18:15 01/13/25,NULL,57.588,57.588,57.59,2025-01-13 18:15:00.000,2025-01-13,2025,1,13,46052,[],()
71280,47273,18966,1,€ 58.5,2025-05-06 06:38,NULL,70.2,70.2,70.2,2025-05-06 06:38:00.000,2025-05-06,2025,5,6,47273,[],()
69847,47391,19506,1,60.0USD,"00:30,09/23/24",NULL,60.0,60.0,60.0,2024-09-23 00:30:00.000,2024-09-23,2024,9,23,47391,[],()
71626,45199,19260,1,EUR73.5," 5-JUL-2024, 05:43:07 AM",NULL,88.2,88.2,88.2,2024-07-05 05:43:07.000,2024-07-05,2024,7,5,45199,[],()
71245,45686,19194,2,34.5 USD,"07:08:14 pm, 10/02/24",NULL,34.5,34.5,69.0,2024-10-02 19:08:14.000,2024-10-02,2024,10,2,45686,[],()
64679,47079,18997,1,37.25 €,"2024-04-29,04:45",,44.699999999999996,44.699999999999996,44.7,2024-04-29 04:45:00.000,2024-04-29,2024,4,29,44764,[],()
68557,45823,18964,1,€ 48.50,"2025-05-14,14:38",,58.199999999999996,58.199999999999996,58.2,2025-05-14 14:38:00.000,2025-05-14,2025,5,14,45823,[],()
71648,45906,19299,3,32.99 EUR,2024-11-21T17:40:17,,39.588,39.588,118.76,2024-11-21 17:40:17.000,2024-11-21,2024,11,21,45906,[],()
68055,44906,19134,1,67.25 USD,11.12.2024 10:53:53,,67.25,67.25,67.25,2024-11-12 10:53:53.000,2024-11-12,2024,11,12,44906,[],()
70352,46009,18925,1,25.25$,01/16/25 09:35:07 P.M.,,25.25,25.25,25.25,2025-01-16 21:35:07.000,2025-01-16,2025,1,16,46009,[],()
64244,46118,19465,1,42.5USD,"17:11, 03/23/25",NULL,42.5,42.5,42.5,2025-03-23 17:11:00.000,2025-03-23,2025,3,23,46118,[],()
65453,46201,19502,1,$35.99,18-November-2024;16:00:23,"Apt. 627 54011 Argelia Dale, Port Renataland, NM 91711",35.99,35.99,35.99,2024-11-18 16:00:23.000,2024-11-18,2024,11,18,46201,[],()
71802,46724,19434,1,17.50 EUR,"24-Aug-2024,05:03:46 AM",,21.0,21.0,21.0,2024-08-24 05:03:46.000,2024-08-24,2024,8,24,46724,[],()
67488,45015,18890,1,72$50¢,"14:48:37,  5-APR-2025",,7250.0,7250.0,7250.0,2025-04-05 14:48:37.000,2025-04-05,2025,4,5,45015,[],()
69655,45713,19517,1,€72¢99,"11-APR-2024,10:42:02",NULL,8758.8,8758.8,8758.8,2024-04-11 10:42:02.000,2024-04-11,2024,4,11,45713,[],()
62920,45997,19588,1,USD 68.00,2024-06-29T05:23:41.467,"8822 O'Keefe Cliffs, Dougfurt, NH 25644",68.0,68.0,68.0,2024-06-29 05:23:41.467,2024-06-29,2024,6,29,45997,[],()
65716,47431,18895,1,$41.0,"18:47:29, 2025-05-02",NULL,41.0,41.0,41.0,2025-05-02 18:47:29.000,2025-05-02,2025,5,2,47431,[],()
69329,44912,18982,5,USD60.,"07:35:35 am, 08/15/24",,60.0,60.0,300.0,2024-08-15 07:35:35.000,2024-08-15,2024,8,15,44912,[],()
72232,44391,19329,1,EUR 68.5,"16:24:52,28-Jan-2025","43960 Bernhard Rue, Lake Murraychester, RI 54985",82.2,82.2,82.2,2025-01-28 16:24:52.000,2025-01-28,2025,1,28,44391,[],()
71986,44948,18933,2,$40.5," 8-MAY-2025, 15:44:27",,40.5,40.5,81.0,2025-05-08 15:44:27.000,2025-05-08,2025,5,8,45667,[],()
64331,47520,19304,1,USD 23,"19-SEP-2024, 23:36:56",,23.0,23.0,23.0,2024-09-19 23:36:56.000,2024-09-19,2024,9,19,47520,[],()
63216,46385,19545,2,$47¢25,"18:51, 10/17/24","Suite 407 98812 Runte Drive, Juttafort, TX 02557",4725.0,4725.0,9450.0,2024-10-17 18:51:00.000,2024-10-17,2024,10,17,46385,[],()
68731,46534,19474,2,31.00USD,22:05:31;14-Jul-2024,NULL,31.0,31.0,62.0,2024-07-14 22:05:31.000,2024-07-14,2024,7,14,46534,[],()
69597,46569,18948,1,20.75USD,15:29:37;09/22/25,,20.75,20.75,20.75,2025-09-22 15:29:37.000,2025-09-22,2025,9,22,46569,[],()
65827,46413,19298,1,$ 63.5,2024-09-11T01:09:14,NULL,63.5,63.5,63.5,2024-09-11 01:09:14.000,2024-09-11,2024,9,11,46413,[],()
71007,47284,18873,5,EUR 68.50,27.12.2024 06:46:46,NULL,82.2,82.2,411.0,2024-12-27 06:46:46.000,2024-12-27,2024,12,27,47284,[],()
67090,45251,19405,2,$49.50,"07:24:23,2024-12-24",,49.5,49.5,99.0,2024-12-24 07:24:23.000,2024-12-24,2024,12,24,45251,[],()
65178,45333,19544,3,EUR40.75,30.12.2024 18:32:32,,48.9,48.9,146.7,2024-12-30 18:32:32.000,2024-12-30,2024,12,30,45333,[],()
73037,46956,19229,1,19.00 EUR,18-March-2025 07:41,,22.8,22.8,22.8,2025-03-18 07:41:00.000,2025-03-18,2025,3,18,46956,[],()
66801,46506,19149,2,€25.5,"13:15,2024-05-28",,30.599999999999998,30.599999999999998,61.2,2024-05-28 13:15:00.000,2024-05-28,2024,5,28,46506,[],()
64316,46633,19227,1,EUR 52.25,"26-September-2024, 04:33:41 am",NULL,62.699999999999996,62.699999999999996,62.7,2024-09-26 04:33:41.000,2024-09-26,2024,9,26,46633,[],()
65602,46569,19271,1,46.00$,12/01/24;04:12,,46.0,46.0,46.0,2024-12-01 04:12:00.000,2024-12-01,2024,12,1,46569,[],()
63756,47628,19497,1,USD 56.25,"17:48,2024-08-02",,56.25,56.25,56.25,2024-08-02 17:48:00.000,2024-08-02,2024,8,2,47628,[],()
71782,44653,19001,1,$29.99,05:22:09 P.M.;07/03/24,,29.99,29.99,29.99,2024-07-03 17:22:09.000,2024-07-03,2024,7,3,44653,[],()
66524,45923,19433,2,66.USD,"23:31, 03/25/25",,66.0,66.0,132.0,2025-03-25 23:31:00.000,2025-03-25,2025,3,25,45923,[],()
64291,46775,19396,1,EUR45.75,2024-10-16;06:22:55,,54.9,54.9,54.9,2024-10-16 06:22:55.000,2024-10-16,2024,10,16,46775,[],()
73489,46901,19172,1,65.25 USD,2025-01-25T22:25:32.377,,65.25,65.25,65.25,2025-01-25 22:25:32.377,2025-01-25,2025,1,25,46901,[],()
73151,44946,19465,1,$ 45.5,"16:21:51,15-APR-2025",,45.5,45.5,45.5,2025-04-15 16:21:51.000,2025-04-15,2025,4,15,44946,[],()
73343,47475,19191,1,$ 27.00,"2025-06-08, 03:44:27","3126 Block Plain, O'Reillyberg, NV 31671",27.0,27.0,27.0,2025-06-08 03:44:27.000,2025-06-08,2025,6,8,47475,[],()
72072,46069,19182,3,$ 51.25,2024-11-13T15:21:42,"4666 O'Conner Via, Oberbrunnerbury, UT 56165",51.25,51.25,153.75,2024-11-13 15:21:42.000,2024-11-13,2024,11,13,46069,[],()
69498,47516,19194,1,€ 36.00,12:09:41 PM 03/28/25,,43.199999999999996,43.199999999999996,43.2,2025-03-28 12:09:41.000,2025-03-28,2025,3,28,47516,[],()
70473,46173,19329,1,USD66.,2024-05-24T11:13:34,,66.0,66.0,66.0,2024-05-24 11:13:34.000,2024-05-24,2024,5,24,46173,[],()
70469,45312,19386,1,71$25¢,"13-Oct-2024,08:51:21 pm",,7125.0,7125.0,7125.0,2024-10-13 20:51:21.000,2024-10-13,2024,10,13,45312,[],()
62960,46244,19439,1,USD 71.00,11:00:10 AM;04/12/25,,71.0,71.0,71.0,2025-04-12 11:00:10.000,2025-04-12,2025,4,12,46244,[],()
64492,45861,19223,3,20.50 $," 8-AUG-2024,23:13",NULL,20.5,20.5,61.5,2024-08-08 23:13:00.000,2024-08-08,2024,8,8,45861,[],()
70656,46205,19019,1,16.75 $,03:15:42 P.M.;10-MAR-2025,,16.75,16.75,16.75,2025-03-10 15:15:42.000,2025-03-10,2025,3,10,46386,[],()
68915,45028,19164,2,USD37.00,"09:29, 7-November-2024",NULL,37.0,37.0,74.0,2024-11-07 09:29:00.000,2024-11-07,2024,11,7,44738,[],()
70218,46177,18929,2,47.0USD,"2025-01-12, 21:35",NULL,47.0,47.0,94.0,2025-01-12 21:35:00.000,2025-01-12,2025,1,12,46177,[],()
71949,47465,19124,1,56$99¢,10/15/24 04:23:52 PM,,5699.0,5699.0,5699.0,2024-10-15 16:23:52.000,2024-10-15,2024,10,15,47465,[],()
63454,44612,19472,1,€67.25,Tue Oct  1 11:36:01 2024,,80.7,80.7,80.7,2024-10-01 11:36:01.000,2024-10-01,2024,10,1,44612,[],()
67507,47596,19481,1,$63.25,"12-Nov-2024,09:57:54 am",NULL,63.25,63.25,63.25,2024-11-12 09:57:54.000,2024-11-12,2024,11,12,47596,[],()
65198,46455,19074,1,$ 69.99,04/19/25;12:36:31 P.M.,,69.99,69.99,69.99,2025-04-19 12:36:31.000,2025-04-19,2025,4,19,46455,[],()
66710,44749,19312,2,EUR75.,"2025-03-10, 23:25:42",NULL,90.0,90.0,180.0,2025-03-10 23:25:42.000,2025-03-10,2025,3,10,44749,[],()
67501,46114,19300,3,71.50 €,"12/02/24,11:29:18 AM",,85.8,85.8,257.4,2024-12-02 11:29:18.000,2024-12-02,2024,12,2,46114,[],()
64205,46565,19204,1,48 EUR,01/07/25;11:21:25 am,NULL,57.599999999999994,57.599999999999994,57.6,2025-01-07 11:21:25.000,2025-01-07,2025,1,7,46565,[],()
69656,47293,19409,1,$17.00,07/02/24 04:39,,17.0,17.0,17.0,2024-07-02 04:39:00.000,2024-07-02,2024,7,2,47293,[],()
65110,45937,19227,1,52.0 USD,03:31:44 am 2024-11-14,"Apt. 762 134 Noble Mills, Sontown, TX 04350-6377",52.0,52.0,52.0,2024-11-14 03:31:44.000,2024-11-14,2024,11,14,45937,[],()
65632,44983,19304,1,22.5USD,"08/31/24,15:52:40",,22.5,22.5,22.5,2024-08-31 15:52:40.000,2024-08-31,2024,8,31,44983,[],()
65906,45716,19122,2,34.99USD,21:55 19-SEP-2024,"82379 Marcus Ports, Basilmouth, LA 71919",34.99,34.99,69.98,2024-09-19 21:55:00.000,2024-09-19,2024,9,19,47099,[],()
70817,47512,18881,1,30.75USD,12:21;2024-10-22, ,30.75,30.75,30.75,2024-10-22 12:21:00.000,2024-10-22,2024,10,22,47512,[],()
67127,47397,18895,1,USD 41.50,08:34;2025-02-02,NULL,41.5,41.5,41.5,2025-02-02 08:34:00.000,2025-02-02,2025,2,2,47397,[],()
71713,47267,19362,1,USD 36.50,2025-04-21T21:38:12,,36.5,36.5,36.5,2025-04-21 21:38:12.000,2025-04-21,2025,4,21,47267,[],()
69330,44407,19467,1,$76.50,"07/02/24, 02:51:13",,76.5,76.5,76.5,2024-07-02 02:51:13.000,2024-07-02,2024,7,2,44407,[],()
71064,47290,19455,3,16.0 €,23-Jul-2024 06:52,,19.2,19.2,57.6,2024-07-23 06:52:00.000,2024-07-23,2024,7,23,47290,[],()
73622,45021,19499,1,28.$,"14:37, 11-MAR-2025",,28.0,28.0,28.0,2025-03-11 14:37:00.000,2025-03-11,2025,3,11,45021,[],()
67469,46699,18986,4,USD65.99,"07:37, 05/25/24",,65.99,65.99,263.96,2024-05-25 07:37:00.000,2024-05-25,2024,5,25,47417,[],()
69862,46257,19121,1,72.99USD,2025-04-26;09:26,,72.99,72.99,72.99,2025-04-26 09:26:00.000,2025-04-26,2025,4,26,44866,[],()
63430,47266,19104,1,60.75 $,11:35:22; 3-JUL-2025,,60.75,60.75,60.75,2025-07-03 11:35:22.000,2025-07-03,2025,7,3,47266,[],()
65547,46713,19338,1,65. EUR,2025-03-13T13:00:44,,78.0,78.0,78.0,2025-03-13 13:00:44.000,2025-03-13,2025,3,13,46713,[],()
68384,46707,19405,2,$53¢75,"22:25:28,2025-03-29",,5375.0,5375.0,10750.0,2025-03-29 22:25:28.000,2025-03-29,2025,3,29,46707,[],()
73674,45462,19003,1,USD 39.99,14:05 05/31/25,,39.99,39.99,39.99,2025-05-31 14:05:00.000,2025-05-31,2025,5,31,45462,[],()
68542,46899,19421,2,24. EUR,09:46:31 AM;05/30/25,"352 McGlynn Dam, Mirnafort, WY 15197-1632",28.799999999999997,28.799999999999997,57.6,2025-05-30 09:46:31.000,2025-05-30,2025,5,30,46899,[],()
67056,46123,19008,1,$47.25,06:50:28;2024-07-12,,47.25,47.25,47.25,2024-07-12 06:50:28.000,2024-07-12,2024,7,12,46123,[],()
72382,46982,19492,1,52 EUR,"13:05:37,2024-11-01",,62.4,62.4,62.4,2024-11-01 13:05:37.000,2024-11-01,2024,11,1,46982,[],()
67246,44916,19505,1,20.25$,2024-08-31;08:34:21 PM,,20.25,20.25,20.25,2024-08-31 20:34:21.000,2024-08-31,2024,8,31,44916,[],()
68698,44971,18875,1,44. USD,"11:34:44 AM, 11/10/24",,44.0,44.0,44.0,2024-11-10 11:34:44.000,2024-11-10,2024,11,10,44971,[],()
69339,47411,19354,2,39.USD,"08/02/25,09:34",,39.0,39.0,78.0,2025-08-02 09:34:00.000,2025-08-02,2025,8,2,47411,[],()
66711,47319,18958,1,14.50€,00:02:39;03/16/25,,17.4,17.4,17.4,2025-03-16 00:02:39.000,2025-03-16,2025,3,16,45960,[],()
67705,45805,19342,1,37.0 USD,"2025-06-30,08:22:54",,37.0,37.0,37.0,2025-06-30 08:22:54.000,2025-06-30,2025,6,30,45805,[],()
66776,45607,19389,1,18.00 USD,"05/25/24, 20:16:55",,18.0,18.0,18.0,2024-05-25 20:16:55.000,2024-05-25,2024,5,25,45607,[],()
67273,47438,19541,2,25.25$,"16:41,2025-03-12",NULL,25.25,25.25,50.5,2025-03-12 16:41:00.000,2025-03-12,2025,3,12,46811,[],()
62814,46100,19511,1,$41.5,03:11:48 2024-12-15,"Apt. 218 6968 Smitham Cove, South Sammy, IL 82143-1917",41.5,41.5,41.5,2024-12-15 03:11:48.000,2024-12-15,2024,12,15,46100,[],()
67174,46911,19412,3,28.0$,"2024-02-17, 11:29:41","Apt. 305 9983 Dare Center, East Omerburgh, TN 70868-7903",28.0,28.0,84.0,2024-02-17 11:29:41.000,2024-02-17,2024,2,17,46911,[],()
69777,46949,19418,2,56.25USD,2024-07-02;08:52:03 pm,NULL,56.25,56.25,112.5,2024-07-02 20:52:03.000,2024-07-02,2024,7,2,46949,[],()
71974,45039,19425,1,USD 42.25,05:22:25 A.M.;20-September-2024,,42.25,42.25,42.25,2024-09-20 05:22:25.000,2024-09-20,2024,9,20,45039,[],()
66377,47221,19120,2,65.0EUR,"12/11/24, 20:55:33",,78.0,78.0,156.0,2024-12-11 20:55:33.000,2024-12-11,2024,12,11,47221,[],()
71777,44495,19149,2,USD 25.50,2024-09-17T18:04:20.385,"6698 Bruen Dale, East Raelene, NY 03151-0579",25.5,25.5,51.0,2024-09-17 18:04:20.385,2024-09-17,2024,9,17,44495,[],()
73783,45552,19532,2,30.00 USD,03/27/25 17:46:04,,30.0,30.0,60.0,2025-03-27 17:46:04.000,2025-03-27,2025,3,27,45552,[],()
70427,44694,19222,1,USD57.,"17:26:27, 2024-08-21",,57.0,57.0,57.0,2024-08-21 17:26:27.000,2024-08-21,2024,8,21,44694,[],()
64304,46457,19440,1,29.99EUR,"19:13,05/15/24","Suite 830 931 Emard Divide, Port Taville, TX 58940-5985",35.988,35.988,35.99,2024-05-15 19:13:00.000,2024-05-15,2024,5,15,46457,[],()
66075,47005,19378,2,15.25USD,"01:54:39 AM,07/19/25",NULL,15.25,15.25,30.5,2025-07-19 01:54:39.000,2025-07-19,2025,7,19,47005,[],()
73944,45296,19582,1,€ 42.50,"2025-03-25, 04:41:02",,51.0,51.0,51.0,2025-03-25 04:41:02.000,2025-03-25,2025,3,25,45296,[],()
69799,44576,19515,2,66.00 $,04/28/25 18:37,NULL,66.0,66.0,132.0,2025-04-28 18:37:00.000,2025-04-28,2025,4,28,44576,[],()
71824,45993,18990,5,49.0 USD,"2025-05-10, 11:54",,49.0,49.0,245.0,2025-05-10 11:54:00.000,2025-05-10,2025,5,10,45993,[],()
73427,45817,19576,1,59.25USD,12/18/24 13:00:46,,59.25,59.25,59.25,2024-12-18 13:00:46.000,2024-12-18,2024,12,18,45817,[],()
62878,45667,18861,2,€34.99,"02:44:04 am,22-Aug-2024",NULL,41.988,41.988,83.98,2024-08-22 02:44:04.000,2024-08-22,2024,8,22,45667,[],()
63350,47061,19497,2,USD57.75,04:45:34 PM 2024-07-20,"Suite 690 54001 Barrows Views, Kingfurt, KY 51700-9955",57.75,57.75,115.5,2024-07-20 16:45:34.000,2024-07-20,2024,7,20,47061,[],()
67304,44711,19553,3,USD51.25,17:26:32 2024-07-21,NULL,51.25,51.25,153.75,2024-07-21 17:26:32.000,2024-07-21,2024,7,21,44711,[],()
67035,46023,19031,2,22.75EUR,08:40:36 am;2025-07-23,,27.3,27.3,54.6,2025-07-23 08:40:36.000,2025-07-23,2025,7,23,46023,[],()
66298,44548,19521,2,$16.75,25-NOV-2024 00:18:52,"9777 Bobette Valleys, Ritchiefort, CO 33803-2865",16.75,16.75,33.5,2024-11-25 00:18:52.000,2024-11-25,2024,11,25,47207,[],()
68735,47055,19471,1,$ 38.,Mon Oct 21 06:06:00 2024,,38.0,38.0,38.0,2024-10-21 06:06:00.000,2024-10-21,2024,10,21,47055,[],()
65365,44546,19405,1,USD 51.0,23:54:50 07/10/24,,51.0,51.0,51.0,2024-07-10 23:54:50.000,2024-07-10,2024,7,10,44546,[],()
62792,45094,19590,1,31.0 EUR,"00:20:16,2024-09-21","Suite 846 9257 Marketta Mews, Sherleyhaven, WA 31025",37.199999999999996,37.199999999999996,37.2,2024-09-21 00:20:16.000,2024-09-21,2024,9,21,45094,[],()
68468,47067,19191,1,USD 29.00,"11:25:03 am, 13-September-2025",,29.0,29.0,29.0,2025-09-13 11:25:03.000,2025-09-13,2025,9,13,47067,[],()
73895,46352,18865,2,$ 42.00,2025-04-15T16:06:06.043,NULL,42.0,42.0,84.0,2025-04-15 16:06:06.043,2025-04-15,2025,4,15,46352,[],()
64161,45323,19513,1,EUR 26.0,14:38 01/03/25,,31.2,31.2,31.2,2025-01-03 14:38:00.000,2025-01-03,2025,1,3,45323,[],()
71966,45800,19345,5,61€75¢,2024-12-17 02:11:23,,7410.0,7410.0,37050.0,2024-12-17 02:11:23.000,2024-12-17,2024,12,17,45800,[],()
67664,44798,19123,2,$48¢75,13:46:39 18-Jul-2024,,4875.0,4875.0,9750.0,2024-07-18 13:46:39.000,2024-07-18,2024,7,18,44798,[],()
62875,45465,19292,2,51.0€,03:59 14-Aug-2024,,61.199999999999996,61.199999999999996,122.4,2024-08-14 03:59:00.000,2024-08-14,2024,8,14,45465,[],()
66821,46586,19508,3,€35¢00,2024-08-16T22:22:28.242,NULL,4200.0,4200.0,12600.0,2024-08-16 22:22:28.242,2024-08-16,2024,8,16,46586,[],()
63471,46171,18954,2,31.50 $,23:22:25;03/27/25,,31.5,31.5,63.0,2025-03-27 23:22:25.000,2025-03-27,2025,3,27,46171,[],()
63437,46768,19057,1,$ 70.5,Sun Jun 30 12:24:10 2024,,70.5,70.5,70.5,2024-06-30 12:24:10.000,2024-06-30,2024,6,30,46768,[],()
73447,45968,19248,1,USD 56.00,"01:32:50 am,09/26/24",,56.0,56.0,56.0,2024-09-26 01:32:50.000,2024-09-26,2024,9,26,45968,[],()
64385,45703,18881,1,USD 28.,07:45:38;24-Feb-2025,,28.0,28.0,28.0,2025-02-24 07:45:38.000,2025-02-24,2025,2,24,45703,[],()
70342,47356,19358,1,EUR 51.,"12/13/24, 05:55:23 am",,61.199999999999996,61.199999999999996,61.2,2024-12-13 05:55:23.000,2024-12-13,2024,12,13,47356,[],()
63481,47179,18998,1,$48¢00,11:43:20 2024-10-25,"Apt. 654 84404 Shonna Court, Kazukoberg, NY 07190",4800.0,4800.0,4800.0,2024-10-25 11:43:20.000,2024-10-25,2024,10,25,47179,[],()
68179,46765,19109,1,41.00 $,"23:28,11-NOV-2024",NULL,41.0,41.0,41.0,2024-11-11 23:28:00.000,2024-11-11,2024,11,11,46765,[],()
63378,46212,18946,4,$46.5,2025-02-01T03:21:14.020,,46.5,46.5,186.0,2025-02-01 03:21:14.020,2025-02-01,2025,2,1,46212,[],()
67767,44398,19504,1,$ 62.0,"22:46:06, 05/12/25",,62.0,62.0,62.0,2025-05-12 22:46:06.000,2025-05-12,2025,5,12,44398,[],()
65625,45150,19188,3,40.50USD,2024-10-23;01:07,NULL,40.5,40.5,121.5,2024-10-23 01:07:00.000,2024-10-23,2024,10,23,45150,[],()
63026,46617,19208,1,55.25 $,14.01.2025  0:42:42,NULL,55.25,55.25,55.25,2025-01-14 00:42:42.000,2025-01-14,2025,1,14,46617,[],()
69139,46325,19283,1,16.00 $,2025-01-07T00:53:11,"5717 Dora Burg, Bostad, IN 20059",16.0,16.0,16.0,2025-01-07 00:53:11.000,2025-01-07,2025,1,7,46325,[],()
64476,44735,19015,1,$ 60,"07/28/25,17:40:33","Suite 706 8695 Jorge Viaduct, West Scottieshire, NE 19857",60.0,60.0,60.0,2025-07-28 17:40:33.000,2025-07-28,2025,7,28,44735,[],()
71957,46391,19075,2,€44¢00,"08:28:55 A.M.,30-December-2024","Apt. 183 86710 Grimes Villages, Linomouth, OR 84864",5280.0,5280.0,10560.0,2024-12-30 08:28:55.000,2024-12-30,2024,12,30,46391,[],()
65824,44667,19567,2,USD 46.5,"12:20:58 AM,28-FEB-2025",,46.5,46.5,93.0,2025-02-28 00:20:58.000,2025-02-28,2025,2,28,44667,[],()
66888,44703,18848,1,USD17.0,2025-07-08T04:33:28.568,,17.0,17.0,17.0,2025-07-08 04:33:28.568,2025-07-08,2025,7,8,44703,[],()
69897,47222,19012,2,USD 46.25,23:57:27;2025-05-14,,46.25,46.25,92.5,2025-05-14 23:57:27.000,2025-05-14,2025,5,14,47222,[],()
63287,44551,18855,3,$29.75,2025-05-13T10:51:24.319,,29.75,29.75,89.25,2025-05-13 10:51:24.319,2025-05-13,2025,5,13,44551,[],()
71069,45579,18918,1,USD 71.50,"2025-01-03,09:57","8523 Jacobs Estate, North Rosalieport, GA 09433",71.5,71.5,71.5,2025-01-03 09:57:00.000,2025-01-03,2025,1,3,45579,[],()
65587,46563,19171,2,USD39.0,15:49:24 2024-09-13,,39.0,39.0,78.0,2024-09-13 15:49:24.000,2024-09-13,2024,9,13,46563,[],()
63590,45386,19011,1,$55.0,14-FEB-2025 20:39,,55.0,55.0,55.0,2025-02-14 20:39:00.000,2025-02-14,2025,2,14,45386,[],()
64600,46651,19393,1,USD 19.5,"12/01/24, 10:41:04 pm","545 Anderson Fords, Rennermouth, ME 06103",19.5,19.5,19.5,2024-12-01 22:41:04.000,2024-12-01,2024,12,1,46651,[],()
73505,44579,19182,1,53.0USD,"2024-07-05,12:16","Apt. 190 410 Reichert Road, Fisherland, SD 86798",53.0,53.0,53.0,2024-07-05 12:16:00.000,2024-07-05,2024,7,5,44579,[],()
63223,46728,19250,2,29.75 EUR,"01:12:12 AM, 19-Dec-2024",,35.699999999999996,35.699999999999996,71.4,2024-12-19 01:12:12.000,2024-12-19,2024,12,19,46728,[],()
72982,44460,18910,1,USD50.50,"2024-10-25,08:13:36 pm",NULL,50.5,50.5,50.5,2024-10-25 20:13:36.000,2024-10-25,2024,10,25,44460,[],()
62781,45624,19194,1,EUR36.99,"10:43, 07/27/24","Suite 539 3643 Jordan Lane, Samtown, AK 73368-2876",44.388,44.388,44.39,2024-07-27 10:43:00.000,2024-07-27,2024,7,27,45624,[],()
64682,45958,19315,1,63.0 USD,"14:24:55, 2024-07-13",NULL,63.0,63.0,63.0,2024-07-13 14:24:55.000,2024-07-13,2024,7,13,45958,[],()
62876,47327,19092,1,$50¢50,29-SEP-2024;23:14,,5050.0,5050.0,5050.0,2024-09-29 23:14:00.000,2024-09-29,2024,9,29,47327,[],()
69584,45272,19396,1,€43¢50,"04:57:46 pm,2024-07-19",,5220.0,5220.0,5220.0,2024-07-19 16:57:46.000,2024-07-19,2024,7,19,45272,[],()
70595,47365,19329,1,$65.00,02/24/25;07:48:22,,65.0,65.0,65.0,2025-02-24 07:48:22.000,2025-02-24,2025,2,24,47365,[],()
71342,46818,18885,1,€ 29.99,"12-JAN-2025,10:53:01 AM",,35.988,35.988,35.99,2025-01-12 10:53:01.000,2025-01-12,2025,1,12,46818,[],()
69626,46112,19530,1,$19,16-Sep-2025;07:45:39 pm,"Suite 578 441 Thanh Brook, Balistreriberg, AL 69798",19.0,19.0,19.0,2025-09-16 19:45:39.000,2025-09-16,2025,9,16,46112,[],()
63650,45302,19003,2,35.5 $,"02:37:12, 9-Dec-2024",,35.5,35.5,71.0,2024-12-09 02:37:12.000,2024-12-09,2024,12,9,45302,[],()
67729,45275,19212,1,51.5EUR,2025-01-05T20:02:14.040,,61.8,61.8,61.8,2025-01-05 20:02:14.040,2025-01-05,2025,1,5,45275,[],()
73758,47516,19498,2,$47¢75,"21-MAR-2025,20:36:55",NULL,4775.0,4775.0,9550.0,2025-03-21 20:36:55.000,2025-03-21,2025,3,21,47516,[],()
66107,44626,19554,1,58.99 $,2025-06-14T03:14:18.000,,58.99,58.99,58.99,2025-06-14 03:14:18.000,2025-06-14,2025,6,14,44626,[],()
71037,46385,19088,1,€ 37.00,"04/15/25, 02:29:35 AM",,44.4,44.4,44.4,2025-04-15 02:29:35.000,2025-04-15,2025,4,15,46385,[],()
68677,47269,19092,1,$46¢50,05:23:04;2025-04-07,NULL,4650.0,4650.0,4650.0,2025-04-07 05:23:04.000,2025-04-07,2025,4,7,47269,[],()
68280,46117,19253,1,36.50USD,"03/11/24,01:20:33 P.M.",NULL,36.5,36.5,36.5,2024-03-11 13:20:33.000,2024-03-11,2024,3,11,46117,[],()
68019,45922,18942,1,EUR25.5,"11:44:30 AM,25-Jan-2025",,30.599999999999998,30.599999999999998,30.6,2025-01-25 11:44:30.000,2025-01-25,2025,1,25,45922,[],()
65710,44924,18940,1,15.75 $,24-May-2025;16:30:44,"Apt. 168 52445 O'Reilly Green, Lake Lance, OK 82814-0503",15.75,15.75,15.75,2025-05-24 16:30:44.000,2025-05-24,2025,5,24,44924,[],()
72363,45207,19120,1,$65¢75,2024-09-22T22:36:30,NULL,6575.0,6575.0,6575.0,2024-09-22 22:36:30.000,2024-09-22,2024,9,22,45207,[],()
70819,44677,19173,1,€ 58.0,"12/01/24, 03:57:51 pm",NULL,69.6,69.6,69.6,2024-12-01 15:57:51.000,2024-12-01,2024,12,1,44677,[],()
66087,46546,19339,1,43.5EUR,2025-01-12;18:01,"83359 Doretha Motorway, Runolfsdottirbury, ND 70812",52.199999999999996,52.199999999999996,52.2,2025-01-12 18:01:00.000,2025-01-12,2025,1,12,46546,[],()
66573,46964,19240,1,$ 67.99,"2025-01-25,06:01:49","912 Hollis Forest, Huelsmouth, MI 69728-4505",67.99,67.99,67.99,2025-01-25 06:01:49.000,2025-01-25,2025,1,25,46964,[],()
73199,47519,18980,3,62.25 €,11:24:40 11/10/24,,74.7,74.7,224.1,2024-11-10 11:24:40.000,2024-11-10,2024,11,10,47519,[],()
66569,46306,19279,1,21.75USD,"03:30:38 PM, 6-August-2024",,21.75,21.75,21.75,2024-08-06 15:30:38.000,2024-08-06,2024,8,6,46306,[],()
73045,45708,19380,1,EUR66.75,2025-02-14;02:41:33 am,NULL,80.1,80.1,80.1,2025-02-14 02:41:33.000,2025-02-14,2025,2,14,45708,[],()
73616,46567,19152,4,29.99USD,"2024-12-19, 15:05:56",NULL,29.99,29.99,119.96,2024-12-19 15:05:56.000,2024-12-19,2024,12,19,46567,[],()
73612,44411,19452,1,€38¢75,"18:53:40,31-May-2024",,4650.0,4650.0,4650.0,2024-05-31 18:53:40.000,2024-05-31,2024,5,31,44411,[],()
64768,45037,19064,1,$60.00,"11/21/24, 23:02",NULL,60.0,60.0,60.0,2024-11-21 23:02:00.000,2024-11-21,2024,11,21,45037,[],()
67823,46569,19587,1,USD35.25,2024-12-27T14:15:10,,35.25,35.25,35.25,2024-12-27 14:15:10.000,2024-12-27,2024,12,27,46569,[],()
64823,44977,19590,1,$30¢25,"08:41, 2024-06-28",,3025.0,3025.0,3025.0,2024-06-28 08:41:00.000,2024-06-28,2024,6,28,44977,[],()
73803,45740,19567,3,€ 49.50,2024-10-04T18:26:59.471,,59.4,59.4,178.2,2024-10-04 18:26:59.471,2024-10-04,2024,10,4,45740,[],()
67331,45335,19205,1,16.50USD,02:13:40; 5-DEC-2024,"Apt. 715 110 Quigley Valley, New Alainamouth, UT 59219-6048",16.5,16.5,16.5,2024-12-05 02:13:40.000,2024-12-05,2024,12,5,45335,[],()
63647,46624,19448,1,USD53.0,"15:21, 16-July-2024",NULL,53.0,53.0,53.0,2024-07-16 15:21:00.000,2024-07-16,2024,7,16,46624,[],()
70036,46279,19322,1,USD67.25,2025-02-07;18:12,"Apt. 766 899 Della Mountains, West Alyssa, WI 99369",67.25,67.25,67.25,2025-02-07 18:12:00.000,2025-02-07,2025,2,7,46279,[],()
73118,46400,18914,2,47.$," 8-May-2025,18:09",NULL,47.0,47.0,94.0,2025-05-08 18:09:00.000,2025-05-08,2025,5,8,46400,[],()
64801,46075,19075,2,€47.25,2024-04-15;16:58:32,"Apt. 857 20568 Murazik Springs, West Kortneyshire, TN 54642",56.699999999999996,56.699999999999996,113.4,2024-04-15 16:58:32.000,2024-04-15,2024,4,15,45712,[],()
65240,47448,19244,1,49.99 €,04:33:36 09/18/25,"Suite 507 3609 Vern Mills, New Josephview, AR 12313-6151",59.988,59.988,59.99,2025-09-18 04:33:36.000,2025-09-18,2025,9,18,47448,[],()
67927,46101,19152,1,€30¢25,2025-01-25T17:54:36,,3630.0,3630.0,3630.0,2025-01-25 17:54:36.000,2025-01-25,2025,1,25,46101,[],()
73748,45681,19296,1,$ 24.0,"19:35:41,2025-08-03",,24.0,24.0,24.0,2025-08-03 19:35:41.000,2025-08-03,2025,8,3,45681,[],()
69964,45425,19337,1,64. EUR,22:42:52 2024-09-19,,76.8,76.8,76.8,2024-09-19 22:42:52.000,2024-09-19,2024,9,19,45425,[],()
68714,47543,19285,1,64 $,02/03/25 04:50:27 PM,NULL,64.0,64.0,64.0,2025-02-03 16:50:27.000,2025-02-03,2025,2,3,47543,[],()
70429,44993,19328,5,USD 29.5,2024-11-20T15:03:33,NULL,29.5,29.5,147.5,2024-11-20 15:03:33.000,2024-11-20,2024,11,20,44993,[],()
66303,44729,18838,1,USD57.00,"09:52:46,01/21/25",,57.0,57.0,57.0,2025-01-21 09:52:46.000,2025-01-21,2025,1,21,44729,[],()
70248,46387,19140,1,65.50$,17:38:56 2025-05-08,NULL,65.5,65.5,65.5,2025-05-08 17:38:56.000,2025-05-08,2025,5,8,46387,[],()
65244,46146,19245,1,69.5 EUR,12:23 09/27/24,"Suite 705 6546 Zboncak Light, Lake Missy, WA 38865",83.39999999999999,83.39999999999999,83.4,2024-09-27 12:23:00.000,2024-09-27,2024,9,27,46146,[],()
71774,45175,19405,1,USD48.99,21:22;2024-06-22,"Suite 958 62517 Fidel Shore, North Bertie, NE 95638-8002",48.99,48.99,48.99,2024-06-22 21:22:00.000,2024-06-22,2024,6,22,45175,[],()
66989,44463,18945,1,43.50$,"05:29:40 AM, 03/15/25",,43.5,43.5,43.5,2025-03-15 05:29:40.000,2025-03-15,2025,3,15,44463,[],()
67002,44379,18991,2,55.25€,09/27/24;14:25,,66.3,66.3,132.6,2024-09-27 14:25:00.000,2024-09-27,2024,9,27,44379,[],()
64207,44484,19244,4,€ 52.75,"05/21/25,12:49",,63.3,63.3,253.2,2025-05-21 12:49:00.000,2025-05-21,2025,5,21,44484,[],()
66721,45658,19186,1,29.50 USD,"2025-01-02,04:04:16 AM",,29.5,29.5,29.5,2025-01-02 04:04:16.000,2025-01-02,2025,1,2,45658,[],()
65320,46276,19068,1,53.99 $,"10-Dec-2024, 09:47:14",,53.99,53.99,53.99,2024-12-10 09:47:14.000,2024-12-10,2024,12,10,46276,[],()
62782,46585,19323,1,45.50 $,17:33;09/24/24,"483 Reynaldo Valleys, New Giuseppina, MD 05828",45.5,45.5,45.5,2024-09-24 17:33:00.000,2024-09-24,2024,9,24,46585,[],()
69409,45384,19271,1,45.50$,"2025-04-21,10:01:15 am",,45.5,45.5,45.5,2025-04-21 10:01:15.000,2025-04-21,2025,4,21,45384,[],()
70798,44947,19486,1,44.99USD,10-Mar-2025;13:53,"1631 Delmar Ports, North Yukochester, OK 69159-7522",44.99,44.99,44.99,2025-03-10 13:53:00.000,2025-03-10,2025,3,10,44947,[],()
66762,45922,19507,1,EUR24.0,03/27/24 11:33:17 pm,,28.799999999999997,28.799999999999997,28.8,2024-03-27 23:33:17.000,2024-03-27,2024,3,27,45922,[],()
65270,46557,19442,1,$45¢50,16:10 2024-09-25,"Suite 495 2516 Joel Trafficway, North Earlmouth, NV 11707",4550.0,4550.0,4550.0,2024-09-25 16:10:00.000,2024-09-25,2024,9,25,46557,[],()
64800,46555,18989,1,44.75 $,2024-07-30T22:16:42,NULL,44.75,44.75,44.75,2024-07-30 22:16:42.000,2024-07-30,2024,7,30,46555,[],()
64610,45067,19422,1,EUR 29,02:56:58 pm;01/06/25,"6216 Crist Falls, Howebury, WY 19946-6263",34.8,34.8,34.8,2025-01-06 14:56:58.000,2025-01-06,2025,1,6,45067,[],()
71621,46253,19345,4,€61.5,07:04:35 P.M. 04/04/24,,73.8,73.8,295.2,2024-04-04 19:04:35.000,2024-04-04,2024,4,4,46253,[],()
73875,47511,19542,2,EUR 58.50,23:10:48  3-Oct-2024,NULL,70.2,70.2,140.4,2024-10-03 23:10:48.000,2024-10-03,2024,10,3,47511,[],()
64866,46789,18889,3,$ 72.5,23:56:34;2025-05-17,NULL,72.5,72.5,217.5,2025-05-17 23:56:34.000,2025-05-17,2025,5,17,46789,[],()
71781,46298,19118,1,74 €,17:03 2025-07-28,,88.8,88.8,88.8,2025-07-28 17:03:00.000,2025-07-28,2025,7,28,46298,[],()
72291,45366,19567,3,48.25 €,2025-04-11T21:50:52,NULL,57.9,57.9,173.7,2025-04-11 21:50:52.000,2025-04-11,2025,4,11,45366,[],()
66548,45890,18965,1,66 $,19:16:10  9-JAN-2025,,66.0,66.0,66.0,2025-01-09 19:16:10.000,2025-01-09,2025,1,9,45890,[],()
65372,47467,19428,1,$42¢99,"10:19:25 P.M., 2025-02-16","Apt. 918 227 Trey Plaza, Runteville, NM 39569",4299.0,4299.0,4299.0,2025-02-16 22:19:25.000,2025-02-16,2025,2,16,47467,[],()
68955,46830,18877,1,$ 47.00,03/13/25 14:55:49,,47.0,47.0,47.0,2025-03-13 14:55:49.000,2025-03-13,2025,3,13,46830,[],()
68983,46324,19116,1,14.75$,05:34 08/26/24,,14.75,14.75,14.75,2024-08-26 05:34:00.000,2024-08-26,2024,8,26,46324,[],()
72613,46100,19136,1,$ 49.25,2024-11-04T09:19:58,,49.25,49.25,49.25,2024-11-04 09:19:58.000,2024-11-04,2024,11,4,46100,[],()
69055,45386,19261,1,68.75 USD,2025-02-22T17:29:04,,68.75,68.75,68.75,2025-02-22 17:29:04.000,2025-02-22,2025,2,22,45386,[],()
63303,45064,19437,2,EUR38.5,"14:44:53,09/26/24",,46.199999999999996,46.199999999999996,92.4,2024-09-26 14:44:53.000,2024-09-26,2024,9,26,45064,[],()
67409,45210,19506,1,USD58.0,2025-03-31T02:34:12.209,"9516 Rubie Loop, North Tammibury, NE 90300",58.0,58.0,58.0,2025-03-31 02:34:12.209,2025-03-31,2025,3,31,45210,[],()
72654,45328,19468,2,USD 41.50,"11:15, 12/01/24","Apt. 852 591 Strosin Lodge, Cyrusborough, CO 74204-4100",41.5,41.5,83.0,2024-12-01 11:15:00.000,2024-12-01,2024,12,1,45328,[],()
64693,47287,19015,4,61.99 €,22-JUL-2024;03:42:03 PM,"Apt. 126 548 Friesen Vista, Treutelfort, NJ 65314",74.388,74.388,297.55,2024-07-22 15:42:03.000,2024-07-22,2024,7,22,47287,[],()
70635,46720,19172,1,67.99 USD,11:59;12/23/24,,67.99,67.99,67.99,2024-12-23 11:59:00.000,2024-12-23,2024,12,23,46720,[],()
63584,45877,18933,2,37.99 USD,"2025-03-22, 23:03:36",,37.99,37.99,75.98,2025-03-22 23:03:36.000,2025-03-22,2025,3,22,45877,[],()
64210,46839,19079,1,29.75 $,"17:14, 2024-07-06",NULL,29.75,29.75,29.75,2024-07-06 17:14:00.000,2024-07-06,2024,7,6,46839,[],()
70396,45860,19242,3,$ 46.50,02:34 2025-05-26,"725 Medhurst Key, Owenville, CT 76004-3587",46.5,46.5,139.5,2025-05-26 02:34:00.000,2025-05-26,2025,5,26,45860,[],()
69987,44583,19413,3,33.00USD,"09/02/24,15:28",NULL,33.0,33.0,99.0,2024-09-02 15:28:00.000,2024-09-02,2024,9,2,44583,[],()
65309,45488,19161,1,34.5$,2025-03-26 06:35:07 pm,,34.5,34.5,34.5,2025-03-26 18:35:07.000,2025-03-26,2025,3,26,45488,[],()
67214,45112,18845,1,61.75USD,2024-11-22T13:15:38.934,"Apt. 909 3669 Champlin Ramp, South Conceptionbury, AL 21578-8008",61.75,61.75,61.75,2024-11-22 13:15:38.934,2024-11-22,2024,11,22,45112,[],()
72733,46494,18963,3,57€99¢,"14:19:13,2025-06-24",,6958.8,6958.8,20876.4,2025-06-24 14:19:13.000,2025-06-24,2025,6,24,46494,[],()
65809,45817,18902,5,21USD,2024-02-10;09:10,,21.0,21.0,105.0,2024-02-10 09:10:00.000,2024-02-10,2024,2,10,45817,[],()
70331,46836,19062,1,14.0 $,2025-02-11T18:27:00.055,"Suite 186 9845 Richie Stream, Kyleberg, IL 02927",14.0,14.0,14.0,2025-02-11 18:27:00.055,2025-02-11,2025,2,11,46836,[],()
73823,45275,19310,3,$23.99,2024-04-11T06:42:31.717,NULL,23.99,23.99,71.97,2024-04-11 06:42:31.717,2024-04-11,2024,4,11,45275,[],()
64720,46486,19155,1,54.00EUR,07/19/25;04:45,,64.8,64.8,64.8,2025-07-19 04:45:00.000,2025-07-19,2025,7,19,46486,[],()
64015,45336,19416,2,67.75USD,"00:30:44, 2025-02-05",NULL,67.75,67.75,135.5,2025-02-05 00:30:44.000,2025-02-05,2025,2,5,45336,[],()
66246,46391,18856,1,USD 50.75,2024-11-17T21:20:41.752,,50.75,50.75,50.75,2024-11-17 21:20:41.752,2024-11-17,2024,11,17,46391,[],()
66473,45727,18879,1,EUR68.75,2024-04-13;02:24:45,,82.5,82.5,82.5,2024-04-13 02:24:45.000,2024-04-13,2024,4,13,45727,[],()
73917,45127,19020,1,USD 18.5,"08:47:00 AM,09/24/24",,18.5,18.5,18.5,2024-09-24 08:47:00.000,2024-09-24,2024,9,24,45127,[],()
68553,45066,18983,5,34USD,07:03:24 12-Oct-2024,"Suite 918 4225 Romeo Row, Schaeferport, NJ 93713-7752",34.0,34.0,170.0,2024-10-12 07:03:24.000,2024-10-12,2024,10,12,45066,[],()
72381,44480,19169,3,71.00 $,31-Dec-2024;03:01,,71.0,71.0,213.0,2024-12-31 03:01:00.000,2024-12-31,2024,12,31,44480,[],()
65169,47415,19394,1,$ 16.50,06.12.2024 16:06:06,,16.5,16.5,16.5,2024-06-12 16:06:06.000,2024-06-12,2024,6,12,47415,[],()
66534,46063,19514,3,15EUR,"23:47:30, 6-Dec-2024",NULL,18.0,18.0,54.0,2024-12-06 23:47:30.000,2024-12-06,2024,12,6,46063,[],()
65133,46287,19511,1,$ 41.99,08:35 2024-09-21,,41.99,41.99,41.99,2024-09-21 08:35:00.000,2024-09-21,2024,9,21,46287,[],()
69823,46256,19404,2,€30¢25,2025-02-23T08:19:55.875,,3630.0,3630.0,7260.0,2025-02-23 08:19:55.875,2025-02-23,2025,2,23,46256,[],()
67918,46720,19447,1,$ 26.0,06:15:28 2025-07-28,,26.0,26.0,26.0,2025-07-28 06:15:28.000,2025-07-28,2025,7,28,46720,[],()
70864,47565,19434,1,17.50 €,07/29/24;12:12,,21.0,21.0,21.0,2024-07-29 12:12:00.000,2024-07-29,2024,7,29,47565,[],()
69190,46334,19375,1,20.99EUR,"25-MAY-2025,22:22",,25.188,25.188,25.19,2025-05-25 22:22:00.000,2025-05-25,2025,5,25,46334,[],()
73788,45540,18875,1,USD46.,"02/03/25, 02:38:25","Apt. 550 11393 Lee Viaduct, East Dessieport, IL 37240",46.0,46.0,46.0,2025-02-03 02:38:25.000,2025-02-03,2025,2,3,45540,[],()
67672,45156,19005,1,USD35., 8-Jul-2024 03:57:12 A.M.,,35.0,35.0,35.0,2024-07-08 03:57:12.000,2024-07-08,2024,7,8,45156,[],()
71639,46599,19258,5,72.0 USD,2025-07-07T10:39:11.927,,72.0,72.0,360.0,2025-07-07 10:39:11.927,2025-07-07,2025,7,7,46768,[],()
67099,46954,19326,1,USD25.,"23:26:05, 06/18/25",,25.0,25.0,25.0,2025-06-18 23:26:05.000,2025-06-18,2025,6,18,46954,[],()
71340,45827,18904,1,USD 32.50,2025-06-10T03:01:32,NULL,32.5,32.5,32.5,2025-06-10 03:01:32.000,2025-06-10,2025,6,10,45827,[],()
64642,44883,19452,2,36$99¢,2025-01-29T11:26:12,NULL,3699.0,3699.0,7398.0,2025-01-29 11:26:12.000,2025-01-29,2025,1,29,44883,[],()
73731,44582,19372,2,$58¢75,05:17:37 A.M.;2024-11-20,,5875.0,5875.0,11750.0,2024-11-20 05:17:37.000,2024-11-20,2024,11,20,44582,[],()
67412,46895,19065,1,USD 19.,2025-02-13T06:56:25,,19.0,19.0,19.0,2025-02-13 06:56:25.000,2025-02-13,2025,2,13,46895,[],()
67524,44431,19217,2,$31.99,2025-05-06T17:08:34.446,"14452 Gutkowski Fields, McLaughlinhaven, MN 36847",31.99,31.99,63.98,2025-05-06 17:08:34.446,2025-05-06,2025,5,6,44431,[],()
67848,47115,19532,2,30$99¢,00:36:01 2025-01-21,NULL,3099.0,3099.0,6198.0,2025-01-21 00:36:01.000,2025-01-21,2025,1,21,47115,[],()
63444,47210,18930,2,34.5EUR,"11:38:37, 23-July-2025",,41.4,41.4,82.8,2025-07-23 11:38:37.000,2025-07-23,2025,7,23,47210,[],()
72014,46873,19509,1,€53.5,2025-01-18T01:18:44.842,,64.2,64.2,64.2,2025-01-18 01:18:44.842,2025-01-18,2025,1,18,46873,[],()
63182,47193,19258,1,70 USD,2024-05-30T15:12:40,"Suite 875 796 Hodkiewicz Keys, Gastonview, WY 54993",70.0,70.0,70.0,2024-05-30 15:12:40.000,2024-05-30,2024,5,30,47193,[],()
66288,44405,19446,1,$51.,2024-08-30T04:17:42.697,,51.0,51.0,51.0,2024-08-30 04:17:42.697,2024-08-30,2024,8,30,44405,[],()
65826,46121,19161,2,USD 36.25,"07:06,31-May-2025",,36.25,36.25,72.5,2025-05-31 07:06:00.000,2025-05-31,2025,5,31,46121,[],()
73061,47282,19469,1,30.0USD,16-JUN-2024;14:38:35,"Suite 398 9885 Rolland Crescent, North Ona, VA 02994",30.0,30.0,30.0,2024-06-16 14:38:35.000,2024-06-16,2024,6,16,47282,[],()
66203,45917,18887,1,$ 50.75,"00:45, 12-Jan-2025",NULL,50.75,50.75,50.75,2025-01-12 00:45:00.000,2025-01-12,2025,1,12,45917,[],()
73555,46624,19399,1,$ 20.0,04:23:32;2024-09-12,"Apt. 437 404 Jonna Ridges, New Olivia, WI 79994",20.0,20.0,20.0,2024-09-12 04:23:32.000,2024-09-12,2024,9,12,46624,[],()
70701,44613,19294,1,EUR 49.,03:59;2025-02-25,NULL,58.8,58.8,58.8,2025-02-25 03:59:00.000,2025-02-25,2025,2,25,44613,[],()
72658,46252,19548,1,$46.99,19:15:07 18-DEC-2024,,46.99,46.99,46.99,2024-12-18 19:15:07.000,2024-12-18,2024,12,18,45989,[],()
64992,45472,19431,1,€ 32.50,"07:45:21 AM, 07/10/24",,39.0,39.0,39.0,2024-07-10 07:45:21.000,2024-07-10,2024,7,10,45472,[],()
64935,47612,19406,1,EUR59.0,02:26:52 PM 03/06/25,"419 Quitzon Road, Port Frankie, OH 66531-2454",70.8,70.8,70.8,2025-03-06 14:26:52.000,2025-03-06,2025,3,6,47612,[],()
72851,45320,19263,2,USD 27.50,2025-07-23T21:11:49.158,,27.5,27.5,55.0,2025-07-23 21:11:49.158,2025-07-23,2025,7,23,45320,[],()
70578,45801,19165,1,31.99€,01/28/25;07:00:00,,38.388,38.388,38.39,2025-01-28 07:00:00.000,2025-01-28,2025,1,28,45801,[],()
67894,45640,19544,2,38.99 $,01/27/25 09:14:50 AM,NULL,38.99,38.99,77.98,2025-01-27 09:14:50.000,2025-01-27,2025,1,27,45640,[],()
68094,46803,19135,1,52.25 USD,"02/26/25, 04:58:27",,52.25,52.25,52.25,2025-02-26 04:58:27.000,2025-02-26,2025,2,26,46803,[],()
73718,45742,19379,3,$57.5,"16-October-2024,15:37",,57.5,57.5,172.5,2024-10-16 15:37:00.000,2024-10-16,2024,10,16,45742,[],()
64780,45916,19341,1,32.5EUR,11:57:17 P.M.;03/27/25,,39.0,39.0,39.0,2025-03-27 23:57:17.000,2025-03-27,2025,3,27,45916,[],()
70906,44836,19110,1,57 USD,16:51:48 2024-12-11,,57.0,57.0,57.0,2024-12-11 16:51:48.000,2024-12-11,2024,12,11,44836,[],()
64951,45785,19491,4,€36¢99,"2024-10-26,05:02",,4438.8,4438.8,17755.2,2024-10-26 05:02:00.000,2024-10-26,2024,10,26,45785,[],()
73475,44760,19528,1,$32.25,"01/29/25, 06:57:50 PM","24211 Porter Knolls, Vitotown, RI 83631",32.25,32.25,32.25,2025-01-29 18:57:50.000,2025-01-29,2025,1,29,44760,[],()
69388,47564,19175,1,$ 38.99,"10/27/24,01:24:11",NULL,38.99,38.99,38.99,2024-10-27 01:24:11.000,2024-10-27,2024,10,27,47564,[],()
67366,47469,18941,2,57.25EUR,"16:46, 18-July-2025",,68.7,68.7,137.4,2025-07-18 16:46:00.000,2025-07-18,2025,7,18,47469,[],()
70874,45036,18922,4,17.00 $,01/23/25;12:15:53 PM,"Apt. 203 119 Kertzmann Via, Stromanton, AK 32810-6470",17.0,17.0,68.0,2025-01-23 12:15:53.000,2025-01-23,2025,1,23,45036,[],()
73187,44919,18909,1,USD22.25,2024-06-17T17:22:24,NULL,22.25,22.25,22.25,2024-06-17 17:22:24.000,2024-06-17,2024,6,17,44919,[],()
70645,47011,18930,1,EUR37.99,09/19/24 15:29,,45.588,45.588,45.59,2024-09-19 15:29:00.000,2024-09-19,2024,9,19,47011,[],()
71387,47039,19245,1,71.0USD,"2024-12-04,11:12:42 A.M.",,71.0,71.0,71.0,2024-12-04 11:12:42.000,2024-12-04,2024,12,4,47039,[],()
69590,46013,19041,2,17.99 $,"2024-10-12,05:51:39 PM",,17.99,17.99,35.98,2024-10-12 17:51:39.000,2024-10-12,2024,10,12,46013,[],()
63552,45598,19040,2,EUR 19.5,"15:54:45, 10-May-2024",NULL,23.4,23.4,46.8,2024-05-10 15:54:45.000,2024-05-10,2024,5,10,45598,[],()
71634,46643,19294,1,49.75 USD,04.06.2025 18:26:26,NULL,49.75,49.75,49.75,2025-04-06 18:26:26.000,2025-04-06,2025,4,6,46643,[],()
64621,45728,19115,1,USD 52.0,09:58:26 P.M.;2024-12-30,,52.0,52.0,52.0,2024-12-30 21:58:26.000,2024-12-30,2024,12,30,45728,[],()
64945,46123,19254,1,USD 56.00,"2025-02-01,01:52",,56.0,56.0,56.0,2025-02-01 01:52:00.000,2025-02-01,2025,2,1,46123,[],()
73085,44652,19148,1,39.50USD,"12/27/24,21:14:19","20215 Travis Forge, West Estebanburgh, NM 96110-1719",39.5,39.5,39.5,2024-12-27 21:14:19.000,2024-12-27,2024,12,27,44652,[],()
62993,47602,19228,3,$ 68.75,2024-10-31T15:49:35.796,,68.75,68.75,206.25,2024-10-31 15:49:35.796,2024-10-31,2024,10,31,47602,[],()
73216,47156,19527,3,USD74.75," 3-OCT-2025,03:09:28 am",,74.75,74.75,224.25,2025-10-03 03:09:28.000,2025-10-03,2025,10,3,47156,[],()
62819,46118,19014,4,22.25 €,"22-October-2024, 22:50:32",,26.7,26.7,106.8,2024-10-22 22:50:32.000,2024-10-22,2024,10,22,46118,[],()
65930,44903,19525,1,64. $,2024-06-25T21:34:29.755,,64.0,64.0,64.0,2024-06-25 21:34:29.755,2024-06-25,2024,6,25,44903,[],()
70655,45536,19036,3,USD 69.,"08:13,  3-November-2024",,69.0,69.0,207.0,2024-11-03 08:13:00.000,2024-11-03,2024,11,3,45536,[],()
68729,44504,18847,1,38.75 USD, 4-NOV-2024;00:27,NULL,38.75,38.75,38.75,2024-11-04 00:27:00.000,2024-11-04,2024,11,4,44504,[],()
69466,46150,19037,1,USD 27.99,"2025-01-01,02:50","Apt. 897 34292 Farrell Crossing, Morganfort, OK 63835",27.99,27.99,27.99,2025-01-01 02:50:00.000,2025-01-01,2025,1,1,46150,[],()
72336,45132,19453,1,USD30.99,10/26/24;20:51,,30.99,30.99,30.99,2024-10-26 20:51:00.000,2024-10-26,2024,10,26,45132,[],()
64222,47111,19068,1,USD54,05:22;2025-02-15,,54.0,54.0,54.0,2025-02-15 05:22:00.000,2025-02-15,2025,2,15,47111,[],()
67675,47027,19528,1,USD 28," 1-November-2024,23:10:18",NULL,28.0,28.0,28.0,2024-11-01 23:10:18.000,2024-11-01,2024,11,1,47027,[],()
65476,47273,19441,1,USD17.75,02:13:32 PM 02/16/25,"Apt. 909 7850 Lowe Lodge, North Petrinaville, TN 11597",17.75,17.75,17.75,2025-02-16 14:13:32.000,2025-02-16,2025,2,16,47273,[],()
64249,47318,18924,1,€28.0,"07:02:09 AM,14-NOV-2024",,33.6,33.6,33.6,2024-11-14 07:02:09.000,2024-11-14,2024,11,14,47318,[],()
64747,46680,19248,1,56€99¢,"07/26/24, 00:18",NULL,6838.8,6838.8,6838.8,2024-07-26 00:18:00.000,2024-07-26,2024,7,26,46680,[],()
70420,46476,19221,1,USD 57.,"04/07/25,12:55",NULL,57.0,57.0,57.0,2025-04-07 12:55:00.000,2025-04-07,2025,4,7,46476,[],()
70090,45445,19537,1,53.75 $,"13:34,2024-08-30","129 Boehm Causeway, Giovanniberg, NV 71368-4344",53.75,53.75,53.75,2024-08-30 13:34:00.000,2024-08-30,2024,8,30,45445,[],()
73384,46975,19543,5,42.00USD,04:53:43 P.M.;08/17/24,NULL,42.0,42.0,210.0,2024-08-17 16:53:43.000,2024-08-17,2024,8,17,46975,[],()
66300,47546,19549,1,€ 37.0,"2024-10-06,11:02:22",,44.4,44.4,44.4,2024-10-06 11:02:22.000,2024-10-06,2024,10,6,47546,[],()
72492,45355,19317,2,23.99USD,04:41 2024-11-26,"4612 Lizbeth Vista, North Maxwell, ID 81032",23.99,23.99,47.98,2024-11-26 04:41:00.000,2024-11-26,2024,11,26,45355,[],()
64725,45992,18917,1,68.50USD,"11:55:40 PM,21-Jan-2025","Suite 967 2310 Marks Parkway, Port Josiahview, OR 21813",68.5,68.5,68.5,2025-01-21 23:55:40.000,2025-01-21,2025,1,21,45992,[],()
67593,44563,19472,1,$ 69.0,2024-05-10T22:31:00.848,,69.0,69.0,69.0,2024-05-10 22:31:00.848,2024-05-10,2024,5,10,44563,[],()
72138,44801,19336,1,USD 46.99,"05:55:25 AM,28-Jan-2025","408 Noreen Centers, South Johnson, WI 25627-8844",46.99,46.99,46.99,2025-01-28 05:55:25.000,2025-01-28,2025,1,28,44801,[],()
68163,47337,19241,1,€37,"13:29:19,2024-11-16",,44.4,44.4,44.4,2024-11-16 13:29:19.000,2024-11-16,2024,11,16,47337,[],()
64176,46080,18935,1,$ 59.50,"30-Nov-2024, 15:16","Suite 641 5277 Marcelo Causeway, Ruthieview, SC 25122-6347",59.5,59.5,59.5,2024-11-30 15:16:00.000,2024-11-30,2024,11,30,46080,[],()
67795,44484,19265,1,€ 50.99,"11:24:32,02/23/25",,61.188,61.188,61.19,2025-02-23 11:24:32.000,2025-02-23,2025,2,23,44484,[],()
64639,46866,19311,1,65.75 USD,18:23:32;28-July-2024,,65.75,65.75,65.75,2024-07-28 18:23:32.000,2024-07-28,2024,7,28,46866,[],()
72310,44359,19292,2,$50.00,"2024-11-02, 12:23:00 pm",NULL,50.0,50.0,100.0,2024-11-02 12:23:00.000,2024-11-02,2024,11,2,44359,[],()
64091,44809,19548,1,$49.75,2024-03-23T13:34:13,,49.75,49.75,49.75,2024-03-23 13:34:13.000,2024-03-23,2024,3,23,44809,[],()
66831,45653,19562,1,50.75 €,"10:33:02 A.M., 01/05/25","Apt. 711 43938 Alexia Forge, Littelview, GA 77350",60.9,60.9,60.9,2025-01-05 10:33:02.000,2025-01-05,2025,1,5,45653,[],()
67474,45710,19354,1,44.25€," 8-JUN-2025, 08:51:38 pm",,53.1,53.1,53.1,2025-06-08 20:51:38.000,2025-06-08,2025,6,8,45710,[],()
67073,45497,18896,1,$ 30.50,"12:31:34 AM, 2025-02-11","6871 Sylvester Drive, Lake Aleaseland, IN 95488-5289",30.5,30.5,30.5,2025-02-11 00:31:34.000,2025-02-11,2025,2,11,45497,[],()
67875,47577,19010,1,USD 61.0,19:38:35;31-JAN-2025,"Suite 304 605 Nathan Mountain, Mellisamouth, FL 41859-3279",61.0,61.0,61.0,2025-01-31 19:38:35.000,2025-01-31,2025,1,31,47577,[],()
70700,45389,19061,1,$61.5,"05/23/24,14:23",,61.5,61.5,61.5,2024-05-23 14:23:00.000,2024-05-23,2024,5,23,45389,[],()
73028,45964,19287,2,37.75 USD,2024-04-04T01:47:51,NULL,37.75,37.75,75.5,2024-04-04 01:47:51.000,2024-04-04,2024,4,4,45964,[],()
69816,45566,19551,2,$ 31.50,2025-02-11;08:34,NULL,31.5,31.5,63.0,2025-02-11 08:34:00.000,2025-02-11,2025,2,11,45566,[],()
63628,44614,18931,1,USD37,15-Jun-2024;22:43,"Suite 175 882 Collette Summit, North Averyburgh, PA 38143-4918",37.0,37.0,37.0,2024-06-15 22:43:00.000,2024-06-15,2024,6,15,44614,[],()
64013,45649,19581,1,$29.00,2025-02-07T22:32:48.960,NULL,29.0,29.0,29.0,2025-02-07 22:32:48.960,2025-02-07,2025,2,7,45649,[],()
65148,46928,19589,1,USD59.50,"08:02:00, 08/30/24",,59.5,59.5,59.5,2024-08-30 08:02:00.000,2024-08-30,2024,8,30,46928,[],()
68981,46238,18911,1,68.50 USD,2024-11-09 11:17:07 A.M.,,68.5,68.5,68.5,2024-11-09 11:17:07.000,2024-11-09,2024,11,9,46238,[],()
68507,45935,19101,2,71.0 EUR,"2024-10-07, 16:08",,85.2,85.2,170.4,2024-10-07 16:08:00.000,2024-10-07,2024,10,7,45935,[],()
68460,45176,19292,1,50.$," 3-Sep-2025, 02:56:34",NULL,50.0,50.0,50.0,2025-09-03 02:56:34.000,2025-09-03,2025,9,3,45176,[],()
63606,45770,19247,1,EUR 61.00,2024-08-25T21:19:35.032,,73.2,73.2,73.2,2024-08-25 21:19:35.032,2024-08-25,2024,8,25,45770,[],()
63791,47317,19109,1,39.0USD,2024-12-29 19:39,,39.0,39.0,39.0,2024-12-29 19:39:00.000,2024-12-29,2024,12,29,47317,[],()
65292,46410,19211,1,USD 46.75,2024-04-02T00:42:37.960,NULL,46.75,46.75,46.75,2024-04-02 00:42:37.960,2024-04-02,2024,4,2,46410,[],()
63233,46007,19054,5,46.00$,"03:27,2024-09-29",,46.0,46.0,230.0,2024-09-29 03:27:00.000,2024-09-29,2024,9,29,46007,[],()
63190,46789,19445,1,USD 61.99,25.04.2025 00:08:08,"Suite 781 56516 Kelvin Passage, South Saul, MO 61817",61.99,61.99,61.99,2025-04-25 00:08:08.000,2025-04-25,2025,4,25,46789,[],()
63324,46346,19472,1,EUR 65.5,"01/18/25, 19:00:56",,78.6,78.6,78.6,2025-01-18 19:00:56.000,2025-01-18,2025,1,18,46346,[],()
72200,47399,18980,1,60.00 USD,2024-09-25T06:27:02,,60.0,60.0,60.0,2024-09-25 06:27:02.000,2024-09-25,2024,9,25,47399,[],()
73868,44744,19447,1,26.25 $,"03:51:41, 06/20/25",,26.25,26.25,26.25,2025-06-20 03:51:41.000,2025-06-20,2025,6,20,44744,[],()
63571,46718,19131,2,60.$," 2-JAN-2025,05:22:19",,60.0,60.0,120.0,2025-01-02 05:22:19.000,2025-01-02,2025,1,2,46718,[],()
73932,46706,19435,2,$ 69.50,"10:11:27 A.M., 2024-09-06",,69.5,69.5,139.0,2024-09-06 10:11:27.000,2024-09-06,2024,9,6,46706,[],()
65016,44606,19457,1,27.0 USD,03:07:13;2024-08-17,"40091 Russel Loop, Boyerfurt, OK 13343",27.0,27.0,27.0,2024-08-17 03:07:13.000,2024-08-17,2024,8,17,44606,[],()
63161,45938,19332,1,39.5 €,"2024-09-20,08:51:13 A.M.",,47.4,47.4,47.4,2024-09-20 08:51:13.000,2024-09-20,2024,9,20,45938,[],()
71555,45004,19177,2,16.50USD,"22:12:02, 04/04/25",,16.5,16.5,33.0,2025-04-04 22:12:02.000,2025-04-04,2025,4,4,45004,[],()
73093,45192,19431,5,USD35.0,"02:55:56 P.M.,17-AUG-2024",NULL,35.0,35.0,175.0,2024-08-17 14:55:56.000,2024-08-17,2024,8,17,45192,[],()
73734,45019,19109,1,42€50¢,"2025-04-08, 12:08:27 AM",NULL,5100.0,5100.0,5100.0,2025-04-08 00:08:27.000,2025-04-08,2025,4,8,45019,[],()
66520,46759,19080,4,USD50.00,11-NOV-2024 16:26,"Apt. 889 449 Emard Plaza, Marloton, VT 06274-4881",50.0,50.0,200.0,2024-11-11 16:26:00.000,2024-11-11,2024,11,11,46759,[],()
64989,47247,18928,1,$21.5,10:26 2025-09-18,NULL,21.5,21.5,21.5,2025-09-18 10:26:00.000,2025-09-18,2025,9,18,47015,[],()
71379,44427,18951,3,$67.5,19-November-2024 10:17:42 AM,NULL,67.5,67.5,202.5,2024-11-19 10:17:42.000,2024-11-19,2024,11,19,44427,[],()
64827,44495,19246,1,EUR 26.00,"2025-03-25,01:38","6698 Bruen Dale, East Raelene, NY 03151-0579",31.2,31.2,31.2,2025-03-25 01:38:00.000,2025-03-25,2025,3,25,44495,[],()
66068,46684,19143,2,29.99 $,"05:17:03 AM,03/11/25",,29.99,29.99,59.98,2025-03-11 05:17:03.000,2025-03-11,2025,3,11,46684,[],()
65861,45829,19306,2,35.0EUR,01:47:30 AM 10/10/24,,42.0,42.0,84.0,2024-10-10 01:47:30.000,2024-10-10,2024,10,10,45829,[],()
71831,45094,19003,1,39.75 USD,04/08/25 04:21,,39.75,39.75,39.75,2025-04-08 04:21:00.000,2025-04-08,2025,4,8,45094,[],()
66882,44739,19307,1,22.0 USD,"09:56:21, 2025-03-30","652 Herzog Unions, Lake Lizzieview, MI 90707-6308",22.0,22.0,22.0,2025-03-30 09:56:21.000,2025-03-30,2025,3,30,44739,[],()
73764,46749,19400,1,36.99 $,12-AUG-2024 09:05:13 pm,,36.99,36.99,36.99,2024-08-12 21:05:13.000,2024-08-12,2024,8,12,46749,[],()
69353,47378,19590,1,USD26.50,"20:29,11/03/24",,26.5,26.5,26.5,2024-11-03 20:29:00.000,2024-11-03,2024,11,3,47378,[],()
70509,47299,19146,1,66.75USD,"2024-11-28, 01:58:12 AM",NULL,66.75,66.75,66.75,2024-11-28 01:58:12.000,2024-11-28,2024,11,28,47299,[],()
71796,45959,19303,1,$ 63.99,02:08;30-May-2025,,63.99,63.99,63.99,2025-05-30 02:08:00.000,2025-05-30,2025,5,30,45959,[],()
73881,46444,19484,1,51.75USD,"07/27/24,10:07:39 am",NULL,51.75,51.75,51.75,2024-07-27 10:07:39.000,2024-07-27,2024,7,27,46444,[],()
63227,46906,19027,2,72.$,"02:00:57 pm, 29-Apr-2025",,72.0,72.0,144.0,2025-04-29 14:00:57.000,2025-04-29,2025,4,29,46906,[],()
63719,44602,18889,3,USD73.50,19:42:37 17-Aug-2024,NULL,73.5,73.5,220.5,2024-08-17 19:42:37.000,2024-08-17,2024,8,17,44602,[],()
63175,45630,19124,1,57.50 USD,"21-Apr-2025, 10:59:19",NULL,57.5,57.5,57.5,2025-04-21 10:59:19.000,2025-04-21,2025,4,21,45630,[],()
63516,47106,18844,1,€ 43.0,2025-03-22T21:58:21.641,"Apt. 388 2201 Wyman Cliffs, South Wilfordburgh, NJ 78452-7876",51.6,51.6,51.6,2025-03-22 21:58:21.641,2025-03-22,2025,3,22,47106,[],()
67356,44522,19534,2,EUR38.00,02:02;09/22/24,,45.6,45.6,91.2,2024-09-22 02:02:00.000,2024-09-22,2024,9,22,44522,[],()
66470,44932,18870,2,56.5 EUR,2024-08-19T17:24:51.802,,67.8,67.8,135.6,2024-08-19 17:24:51.802,2024-08-19,2024,8,19,44932,[],()
71299,47189,19249,4,60.99 $,"14-Aug-2024,09:12:33",,60.99,60.99,243.96,2024-08-14 09:12:33.000,2024-08-14,2024,8,14,47189,[],()
70941,44756,19380,1,$67.75,"03:26,14-MAY-2024",NULL,67.75,67.75,67.75,2024-05-14 03:26:00.000,2024-05-14,2024,5,14,44756,[],()
69384,45632,19580,2,71.25 €,"05:32:52 P.M., 2024-06-17",NULL,85.5,85.5,171.0,2024-06-17 17:32:52.000,2024-06-17,2024,6,17,45632,[],()
67754,46689,19252,3,EUR 22.5,"12/16/24,05:23:41 am",,27.0,27.0,81.0,2024-12-16 05:23:41.000,2024-12-16,2024,12,16,45285,[],()
68285,45056,18917,1,71 USD,"2025-01-05, 01:30:39 PM",,71.0,71.0,71.0,2025-01-05 13:30:39.000,2025-01-05,2025,1,5,45056,[],()
68765,45943,19254,1,54.5$, 7-February-2025;21:01,NULL,54.5,54.5,54.5,2025-02-07 21:01:00.000,2025-02-07,2025,2,7,45943,[],()
66375,46610,19579,1,USD 20.00,"01:17:35 A.M., 05/27/25",NULL,20.0,20.0,20.0,2025-05-27 01:17:35.000,2025-05-27,2025,5,27,46610,[],()
69202,44875,19130,1,25.99 $,05/02/25 10:47:47,"672 Block Point, Durganbury, PA 31363",25.99,25.99,25.99,2025-05-02 10:47:47.000,2025-05-02,2025,5,2,44875,[],()
63587,44803,18944,2,15.25 $,08:07:26;30-Nov-2024,,15.25,15.25,30.5,2024-11-30 08:07:26.000,2024-11-30,2024,11,30,44803,[],()
67695,44486,18901,1,$75,"2024-10-10,10:12:22 AM",NULL,75.0,75.0,75.0,2024-10-10 10:12:22.000,2024-10-10,2024,10,10,44486,[],()
67377,45501,19452,1,37.00EUR,04/08/25;13:44:19,,44.4,44.4,44.4,2025-04-08 13:44:19.000,2025-04-08,2025,4,8,45501,[],()
68184,44669,19134,1,USD65.99,"00:29, 12/15/24",NULL,65.99,65.99,65.99,2024-12-15 00:29:00.000,2024-12-15,2024,12,15,44669,[],()
65573,44842,19571,2,€ 17.,"02/27/25, 15:06:51",,20.4,20.4,40.8,2025-02-27 15:06:51.000,2025-02-27,2025,2,27,44842,[],()
68784,46670,19314,3,31.25$,06:14:15 pm;01/14/25,,31.25,31.25,93.75,2025-01-14 18:14:15.000,2025-01-14,2025,1,14,46670,[],()
73473,47498,19589,1,$ 58.50,"00:04,09/26/24",,58.5,58.5,58.5,2024-09-26 00:04:00.000,2024-09-26,2024,9,26,47498,[],()
63352,47189,19166,1,USD60.75," 2-MAR-2025,11:01:17 P.M.","Apt. 137 35101 Riley Green, Scottfurt, MT 53227",60.75,60.75,60.75,2025-03-02 23:01:17.000,2025-03-02,2025,3,2,47189,[],()
65686,45252,19565,1,$68.50,"2025-02-02, 00:37:12",,68.5,68.5,68.5,2025-02-02 00:37:12.000,2025-02-02,2025,2,2,45252,[],()
73156,46343,19436,1,€27¢00,"08:22:42 PM, 09/02/24","98940 Wilton Square, South Sammiefurt, TX 59675-7724",3240.0,3240.0,3240.0,2024-09-02 20:22:42.000,2024-09-02,2024,9,2,46343,[],()
67877,44896,19131,1,$ 60.50,2024-12-24;08:25,"721 Heidenreich Valley, New Anibal, KS 99441-3145",60.5,60.5,60.5,2024-12-24 08:25:00.000,2024-12-24,2024,12,24,44896,[],()
66450,45984,19096,1,$ 19,16:34:08;2024-03-19,NULL,19.0,19.0,19.0,2024-03-19 16:34:08.000,2024-03-19,2024,3,19,45984,[],()
72321,46199,19427,1,USD 41.00,"13:36:56, 2025-07-18",NULL,41.0,41.0,41.0,2025-07-18 13:36:56.000,2025-07-18,2025,7,18,46199,[],()
69602,46509,19414,1,57.99 USD,"04/01/25,08:51:43 PM",,57.99,57.99,57.99,2025-04-01 20:51:43.000,2025-04-01,2025,4,1,46509,[],()
73397,47163,18865,1,44.25 $,"10/05/24, 17:46:28",,44.25,44.25,44.25,2024-10-05 17:46:28.000,2024-10-05,2024,10,5,47163,[],()
66224,47257,19575,1,USD 51,"16:33,2024-12-05",NULL,51.0,51.0,51.0,2024-12-05 16:33:00.000,2024-12-05,2024,12,5,47257,[],()
66054,46703,19245,2,67. $,23-Nov-2024;08:59:01,,67.0,67.0,134.0,2024-11-23 08:59:01.000,2024-11-23,2024,11,23,46703,[],()
70637,46984,18977,3,€ 35.5,19:22:29;05/16/24,,42.6,42.6,127.8,2024-05-16 19:22:29.000,2024-05-16,2024,5,16,46984,[],()
64900,45463,19227,2,USD49.00,"02:08:27 pm,2025-03-02",,49.0,49.0,98.0,2025-03-02 14:08:27.000,2025-03-02,2025,3,2,45463,[],()
72169,46862,19009,2,74.99 $, 2.01.2025 18:47:47,NULL,74.99,74.99,149.98,2025-02-01 18:47:47.000,2025-02-01,2025,2,1,46862,[],()
73135,45885,19503,1,$19¢25,20:40  1-SEP-2024,,1925.0,1925.0,1925.0,2024-09-01 20:40:00.000,2024-09-01,2024,9,1,47052,[],()
68235,46079,19029,1,64.€,2024-11-16T17:24:54,,76.8,76.8,76.8,2024-11-16 17:24:54.000,2024-11-16,2024,11,16,46079,[],()
73030,46660,18846,2,22.75 USD,"11:04:33, 27-July-2024","Apt. 115 85045 Larson Course, West Dorla, MI 07774",22.75,22.75,45.5,2024-07-27 11:04:33.000,2024-07-27,2024,7,27,46660,[],()
73539,46116,19126,3,25.5 USD,2025-06-04T18:07:34,,25.5,25.5,76.5,2025-06-04 18:07:34.000,2025-06-04,2025,6,4,46116,[],()
73619,44791,19225,1,USD 64.0,"06:34, 2024-08-28",,64.0,64.0,64.0,2024-08-28 06:34:00.000,2024-08-28,2024,8,28,44791,[],()
72923,45730,18872,2,40€75¢,06:03:35 10/25/24,,4890.0,4890.0,9780.0,2024-10-25 06:03:35.000,2024-10-25,2024,10,25,46176,[],()
63188,44361,19452,3,37.0 USD,13-November-2024;05:01:42 am,NULL,37.0,37.0,111.0,2024-11-13 05:01:42.000,2024-11-13,2024,11,13,44361,[],()
69219,45118,18946,1,USD 48,"10:37:57 PM, 06/03/24",,48.0,48.0,48.0,2024-06-03 22:37:57.000,2024-06-03,2024,6,3,45118,[],()
68118,46836,18905,1,57.0USD,"21-AUG-2025,16:23:02","Suite 186 9845 Richie Stream, Kyleberg, IL 02927",57.0,57.0,57.0,2025-08-21 16:23:02.000,2025-08-21,2025,8,21,46836,[],()
64397,47607,19051,1,69.5€,20-OCT-2024;05:23:37 A.M.,,83.39999999999999,83.39999999999999,83.4,2024-10-20 05:23:37.000,2024-10-20,2024,10,20,47607,[],()
69092,44352,19450,1,$28.5,"12:14,2024-06-22",,28.5,28.5,28.5,2024-06-22 12:14:00.000,2024-06-22,2024,6,22,44352,[],()
67194,46690,19296,1,$ 27.5,2025-01-08 12:43,NULL,27.5,27.5,27.5,2025-01-08 12:43:00.000,2025-01-08,2025,1,8,46690,[],()
64332,46902,19413,1,$35.50,10/23/24 08:14:18 am,NULL,35.5,35.5,35.5,2024-10-23 08:14:18.000,2024-10-23,2024,10,23,46902,[],()
69266,47292,18985,2,€54,"14-April-2024, 23:00:29",,64.8,64.8,129.6,2024-04-14 23:00:29.000,2024-04-14,2024,4,14,47292,[],()
72032,46158,19410,4,49.50 USD,2024-07-13T16:50:06,,49.5,49.5,198.0,2024-07-13 16:50:06.000,2024-07-13,2024,7,13,46158,[],()
67937,47145,19138,1,29.00 €,30-Nov-2024;16:18,,34.8,34.8,34.8,2024-11-30 16:18:00.000,2024-11-30,2024,11,30,47145,[],()
63965,47337,19458,1,56.75€,2024-05-08T21:44:22,,68.1,68.1,68.1,2024-05-08 21:44:22.000,2024-05-08,2024,5,8,47337,[],()
71457,45863,19529,2,$ 14.,"07:22:42 am, 14-October-2024","Suite 393 54811 Quigley Trafficway, New Tyler, FL 65078-3181",14.0,14.0,28.0,2024-10-14 07:22:42.000,2024-10-14,2024,10,14,45863,[],()
70182,45290,19092,2,USD47.00,"2025-03-01,05:20:08",NULL,47.0,47.0,94.0,2025-03-01 05:20:08.000,2025-03-01,2025,3,1,45290,[],()
73596,46608,19366,1,USD 25.0,24.12.2024 13:52:52,NULL,25.0,25.0,25.0,2024-12-24 13:52:52.000,2024-12-24,2024,12,24,46608,[],()
70788,45347,19324,1,$65.50,"04:46:40 am, 7-MAY-2025","Apt. 866 398 Feest Keys, Konopelskiport, IL 72357-2557",65.5,65.5,65.5,2025-05-07 04:46:40.000,2025-05-07,2025,5,7,45347,[],()
67604,44518,19045,2,€ 42.5,"15:47, 17-FEB-2025",,51.0,51.0,102.0,2025-02-17 15:47:00.000,2025-02-17,2025,2,17,45909,[],()
69599,47482,18965,1,64.00 $,26-Dec-2024;01:35:46 am,"Apt. 120 5119 Hilpert Port, East Trinidad, VA 30086",64.0,64.0,64.0,2024-12-26 01:35:46.000,2024-12-26,2024,12,26,47482,[],()
71269,45523,19281,1,EUR 37.5,"01/14/25,09:23:06 AM",,45.0,45.0,45.0,2025-01-14 09:23:06.000,2025-01-14,2025,1,14,45523,[],()
72234,46097,19288,2,USD 55.,"22-May-2025, 03:32:50",NULL,55.0,55.0,110.0,2025-05-22 03:32:50.000,2025-05-22,2025,5,22,46097,[],()
63764,45215,19221,1,57.25 EUR,"09:15,16-OCT-2024",,68.7,68.7,68.7,2024-10-16 09:15:00.000,2024-10-16,2024,10,16,45215,[],()
71646,44357,19470,3,58.0$,"04:54:36 P.M.,2025-04-25",,58.0,58.0,174.0,2025-04-25 16:54:36.000,2025-04-25,2025,4,25,44357,[],()
70359,46706,19472,3,65.50 €,18-Oct-2025;11:25:16 am,NULL,78.6,78.6,235.8,2025-10-18 11:25:16.000,2025-10-18,2025,10,18,46706,[],()
62954,44581,19322,1,EUR67.50,05:34:26 A.M.;10/14/24,NULL,81.0,81.0,81.0,2024-10-14 05:34:26.000,2024-10-14,2024,10,14,44581,[],()
66074,45032,19115,2,53.25€,05/17/24;01:16:43 A.M.,,63.9,63.9,127.8,2024-05-17 01:16:43.000,2024-05-17,2024,5,17,45032,[],()
72498,46072,19090,1,€ 65.75,"09:09:44 AM, 6-Mar-2025","Apt. 140 3289 Hane Land, Nicolabury, CA 30754-2061",78.89999999999999,78.89999999999999,78.9,2025-03-06 09:09:44.000,2025-03-06,2025,3,6,46072,[],()
72149,46780,19483,1,59.99USD,10:51 2025-04-04,,59.99,59.99,59.99,2025-04-04 10:51:00.000,2025-04-04,2025,4,4,46780,[],()
66432,45788,19313,1,28. €,05:27:41 A.M.;07/31/24,,33.6,33.6,33.6,2024-07-31 05:27:41.000,2024-07-31,2024,7,31,45788,[],()
73651,44348,19166,1,62.0EUR,2024-04-30T11:04:52,NULL,74.39999999999999,74.39999999999999,74.4,2024-04-30 11:04:52.000,2024-04-30,2024,4,30,44348,[],()
71880,45714,19527,1,USD71.,"10-OCT-2024,11:52:51 PM","Apt. 273 697 Hannelore Fall, North Romeoburgh, VT 89439-4491",71.0,71.0,71.0,2024-10-10 23:52:51.000,2024-10-10,2024,10,10,46422,[],()
66163,45192,18947,2,70.5USD,"23-May-2024,13:53:14","Apt. 472 85518 Gottlieb Rapids, Port Dane, OK 65923-9837",70.5,70.5,141.0,2024-05-23 13:53:14.000,2024-05-23,2024,5,23,45192,[],()
64155,46998,19065,2,21.25USD,18:43 15-Sep-2024,NULL,21.25,21.25,42.5,2024-09-15 18:43:00.000,2024-09-15,2024,9,15,46998,[],()
63822,44994,19222,1,56.99USD,"04/08/24, 04:48:03 am",NULL,56.99,56.99,56.99,2024-04-08 04:48:03.000,2024-04-08,2024,4,8,44994,[],()
66011,45319,19318,1,27.00$,"05/25/25,10:47:00",,27.0,27.0,27.0,2025-05-25 10:47:00.000,2025-05-25,2025,5,25,45319,[],()
64178,46740,19113,3,€75.,11/12/24;00:37,NULL,90.0,90.0,270.0,2024-11-12 00:37:00.000,2024-11-12,2024,11,12,46740,[],()
64704,44434,19400,1,EUR 37.25,07/09/24 01:21:12,NULL,44.699999999999996,44.699999999999996,44.7,2024-07-09 01:21:12.000,2024-07-09,2024,7,9,44434,[],()
73302,45206,18859,1,EUR54,2025-05-09T20:00:52.203,,64.8,64.8,64.8,2025-05-09 20:00:52.203,2025-05-09,2025,5,9,45206,[],()
71769,46457,19471,1,EUR 41.75,"13:55:57,  8-Sep-2025","Suite 830 931 Emard Divide, Port Taville, TX 58940-5985",50.1,50.1,50.1,2025-09-08 13:55:57.000,2025-09-08,2025,9,8,46457,[],()
66311,45401,19243,1,$ 41.,31-Jan-2025;01:59,NULL,41.0,41.0,41.0,2025-01-31 01:59:00.000,2025-01-31,2025,1,31,45401,[],()
70891,46783,19583,2,$53.99,"14:05:28,01/27/25","Suite 195 183 Runolfsson Stream, Kubtown, IA 92186",53.99,53.99,107.98,2025-01-27 14:05:28.000,2025-01-27,2025,1,27,46783,[],()
65742,44448,19297,4,$50.0,19:23:52;04/25/25,,50.0,50.0,200.0,2025-04-25 19:23:52.000,2025-04-25,2025,4,25,44448,[],()
72677,46839,19486,1,EUR46.75,"23:08:46,2024-11-06",,56.1,56.1,56.1,2024-11-06 23:08:46.000,2024-11-06,2024,11,6,46839,[],()
63620,47314,19053,1,54.50 USD,04/20/25 12:58:03 PM,,54.5,54.5,54.5,2025-04-20 12:58:03.000,2025-04-20,2025,4,20,47314,[],()
73766,45862,19257,3,€66.5,2025-02-06T07:50:48,,79.8,79.8,239.4,2025-02-06 07:50:48.000,2025-02-06,2025,2,6,45862,[],()
66610,45373,19257,1,€67.00,"2024-08-24, 18:58:16","Apt. 864 1718 Grant Corner, Lakenyaberg, AL 49133-8781",80.39999999999999,80.39999999999999,80.4,2024-08-24 18:58:16.000,2024-08-24,2024,8,24,45373,[],()
67655,46585,19089,1,50.0 USD,06/17/25;04:44,"483 Reynaldo Valleys, New Giuseppina, MD 05828",50.0,50.0,50.0,2025-06-17 04:44:00.000,2025-06-17,2025,6,17,46585,[],()
63312,46770,19271,1,42.99EUR,16:29;24-DEC-2024,"Suite 669 5658 Reginia Isle, Schillershire, NJ 14256-0106",51.588,51.588,51.59,2024-12-24 16:29:00.000,2024-12-24,2024,12,24,46770,[],()
69622,44507,18907,1,$ 37.75,"06:53:46 pm, 15-Oct-2024",,37.75,37.75,37.75,2024-10-15 18:53:46.000,2024-10-15,2024,10,15,44507,[],()
70417,44438,19017,1,USD57,"23-August-2024,10:01:33",,57.0,57.0,57.0,2024-08-23 10:01:33.000,2024-08-23,2024,8,23,44438,[],()
68856,47457,19097,1,€68¢25,05/27/25 10:23:03 A.M.,NULL,8190.0,8190.0,8190.0,2025-05-27 10:23:03.000,2025-05-27,2025,5,27,47457,[],()
73095,46363,19455,1,12.50EUR,"2024-09-21, 16:54:22",,15.0,15.0,15.0,2024-09-21 16:54:22.000,2024-09-21,2024,9,21,46363,[],()
71932,45467,18898,2,USD 69,"02:26:37 P.M., 2024-10-22",,69.0,69.0,138.0,2024-10-22 14:26:37.000,2024-10-22,2024,10,22,44994,[],()
63450,44584,19346,5,$ 40.99,2024-12-02T05:47:28,,40.99,40.99,204.95,2024-12-02 05:47:28.000,2024-12-02,2024,12,2,44584,[],()
73655,47335,18887,2,USD 48.00,01:33:01 am;09/30/24,,48.0,48.0,96.0,2024-09-30 01:33:01.000,2024-09-30,2024,9,30,47335,[],()
67449,47290,19219,1,USD 28.0,"03:27:44 P.M., 2024-10-20",NULL,28.0,28.0,28.0,2024-10-20 15:27:44.000,2024-10-20,2024,10,20,47290,[],()
63659,46033,19123,1,51.00 €,"2024-11-30,07:49:20 pm","6255 Brakus Trafficway, East Charisse, IA 61491-3513",61.199999999999996,61.199999999999996,61.2,2024-11-30 19:49:20.000,2024-11-30,2024,11,30,45084,[],()
64819,46754,18969,1,43.5 $,07/30/24 12:52:03 PM,"3722 Kip Junctions, Prohaskastad, VA 33854-8136",43.5,43.5,43.5,2024-07-30 12:52:03.000,2024-07-30,2024,7,30,46754,[],()
62766,46257,19491,1,$35.75,"2024-11-29,17:15:00","Suite 554 768 Toya Spurs, West Dominick, UT 16766-5351",35.75,35.75,35.75,2024-11-29 17:15:00.000,2024-11-29,2024,11,29,44866,[],()
66932,47234,18872,1,39 USD,20:43:33 11/22/24,,39.0,39.0,39.0,2024-11-22 20:43:33.000,2024-11-22,2024,11,22,47234,[],()
70176,45585,19179,1,53.50 €,"2024-11-20, 10:46:32 AM","Suite 644 77149 Schiller Villages, Beattyfort, OH 69481-8065",64.2,64.2,64.2,2024-11-20 10:46:32.000,2024-11-20,2024,11,20,45585,[],()
71521,46498,19419,1,54.50 $,2024-11-05T12:19:00.582,"27323 Young Club, New Teofilastad, PA 01531",54.5,54.5,54.5,2024-11-05 12:19:00.582,2024-11-05,2024,11,5,46498,[],()
63830,45501,19221,1,55.75 USD,"19:46:15,  1-January-2025",NULL,55.75,55.75,55.75,2025-01-01 19:46:15.000,2025-01-01,2025,1,1,45501,[],()
73504,45443,18957,1,62.25 $,"15:55, 2024-11-05",,62.25,62.25,62.25,2024-11-05 15:55:00.000,2024-11-05,2024,11,5,45443,[],()
67775,45091,19170,1,USD70,"01:21,11/21/24","71804 Kulas Pass, Tulaville, VA 22476-5783",70.0,70.0,70.0,2024-11-21 01:21:00.000,2024-11-21,2024,11,21,45091,[],()
68713,46210,19192,2,59.50$,"02/24/24, 19:03",,59.5,59.5,119.0,2024-02-24 19:03:00.000,2024-02-24,2024,2,24,46210,[],()
63513,47179,19017,1,$57.25,"2024-10-31, 17:27","Apt. 654 84404 Shonna Court, Kazukoberg, NY 07190",57.25,57.25,57.25,2024-10-31 17:27:00.000,2024-10-31,2024,10,31,47179,[],()
64782,45332,19478,2,54.00 USD,2025-04-07T11:21:30,"267 Daniel Centers, New Marcelinofurt, PA 44079",54.0,54.0,108.0,2025-04-07 11:21:30.000,2025-04-07,2025,4,7,45332,[],()
66256,45859,19403,3,51.25EUR,02:46:09 am 2024-11-30,NULL,61.5,61.5,184.5,2024-11-30 02:46:09.000,2024-11-30,2024,11,30,45859,[],()
73585,45391,19150,1,42.0USD, 2-MAR-2025;06:22:56 am,,42.0,42.0,42.0,2025-03-02 06:22:56.000,2025-03-02,2025,3,2,44823,[],()
63217,46446,19158,5,65.USD,"06:25:00 am, 30-MAR-2025",,65.0,65.0,325.0,2025-03-30 06:25:00.000,2025-03-30,2025,3,30,46446,[],()
67520,45330,19095,1,61.75 $,"08/11/24,22:06",,61.75,61.75,61.75,2024-08-11 22:06:00.000,2024-08-11,2024,8,11,45330,[],()
65955,45356,19063,1,€46.75,"02:01,01/23/25",NULL,56.1,56.1,56.1,2025-01-23 02:01:00.000,2025-01-23,2025,1,23,45356,[],()
64232,46268,19209,1,28.00USD,2024-09-06T08:37:19.697,NULL,28.0,28.0,28.0,2024-09-06 08:37:19.697,2024-09-06,2024,9,6,46268,[],()
70063,46357,19473,2,USD20.50,22.04.2025 02:23:23,,20.5,20.5,41.0,2025-04-22 02:23:23.000,2025-04-22,2025,4,22,46357,[],()
62912,46816,19505,4,17.5$,2025-01-12T23:45:33,,17.5,17.5,70.0,2025-01-12 23:45:33.000,2025-01-12,2025,1,12,46816,[],()
66362,45588,19298,1,€63.75,"2024-08-29, 06:52:31 A.M.","64565 Valery Orchard, Hilpertton, CA 85445-9043",76.5,76.5,76.5,2024-08-29 06:52:31.000,2024-08-29,2024,8,29,45588,[],()
64175,47382,19436,1,€ 24.25,"07/09/24, 12:57:05 PM",NULL,29.099999999999998,29.099999999999998,29.1,2024-07-09 12:57:05.000,2024-07-09,2024,7,9,47382,[],()
64265,44445,19477,1,45.00 USD,"09:56:57 am,09/02/24","Apt. 322 72061 Frederick Ports, New Arturofort, AL 45038-7958",45.0,45.0,45.0,2024-09-02 09:56:57.000,2024-09-02,2024,9,2,44445,[],()
71853,47079,19446,1,USD 53.50,03:25;22-Jul-2025,,53.5,53.5,53.5,2025-07-22 03:25:00.000,2025-07-22,2025,7,22,44764,[],()
72440,44806,19565,2,$ 68.00,"2024-11-11,10:04:45","8465 Goyette Shores, Colinchester, MI 26685",68.0,68.0,136.0,2024-11-11 10:04:45.000,2024-11-11,2024,11,11,44806,[],()
66181,47614,18906,1,38.25 $,22-Feb-2025;03:06,NULL,38.25,38.25,38.25,2025-02-22 03:06:00.000,2025-02-22,2025,2,22,47614,[],()
72582,45693,19275,1,52.99 €,2024-05-01 06:07,,63.588,63.588,63.59,2024-05-01 06:07:00.000,2024-05-01,2024,5,1,45693,[],()
71611,46333,19453,1,29.50USD,2024-12-19T23:28:13.599,,29.5,29.5,29.5,2024-12-19 23:28:13.599,2024-12-19,2024,12,19,46333,[],()
72900,47138,18842,1,62.5 $,20:18:48 11-Dec-2024,NULL,62.5,62.5,62.5,2024-12-11 20:18:48.000,2024-12-11,2024,12,11,47138,[],()
68175,47241,19211,2,EUR45.5,Fri Dec 20 12:30:12 2024,"913 Brakus Keys, Tieshaborough, KS 74048",54.6,54.6,109.2,2024-12-20 12:30:12.000,2024-12-20,2024,12,20,47241,[],()
70205,44414,19473,1,USD25.5,"12:31:30 pm, 10/01/24","Apt. 638 51645 Batz Road, Port Teresita, VA 09155",25.5,25.5,25.5,2024-10-01 12:31:30.000,2024-10-01,2024,10,1,44414,[],()
67095,44389,18844,1,EUR41.,"13:59, 7-June-2024",NULL,49.199999999999996,49.199999999999996,49.2,2024-06-07 13:59:00.000,2024-06-07,2024,6,7,44389,[],()
68492,45538,18928,2,19.75 €,2024-10-14T03:05:53,NULL,23.7,23.7,47.4,2024-10-14 03:05:53.000,2024-10-14,2024,10,14,45538,[],()
71086,45940,19101,1,72.99 $,23:30:14 02/19/25,,72.99,72.99,72.99,2025-02-19 23:30:14.000,2025-02-19,2025,2,19,45940,[],()
70518,44526,19032,1,$ 70,"2025-04-06,13:56:39","1648 Faviola Bridge, Carlton, KY 11380-4565",70.0,70.0,70.0,2025-04-06 13:56:39.000,2025-04-06,2025,4,6,44526,[],()
68726,45976,18923,1,$26.0,"20:21:47,2024-05-10",NULL,26.0,26.0,26.0,2024-05-10 20:21:47.000,2024-05-10,2024,5,10,44971,[],()
72046,47445,19195,1,67.5 $,"13:40,  5-MAR-2025",,67.5,67.5,67.5,2025-03-05 13:40:00.000,2025-03-05,2025,3,5,47445,[],()
63894,47419,19362,1,EUR 35.75,20:16:31 2025-10-15,,42.9,42.9,42.9,2025-10-15 20:16:31.000,2025-10-15,2025,10,15,47419,[],()
72093,44784,19254,2,USD56.75,"2024-10-15, 16:07","Apt. 449 9304 Price Inlet, Saturninaborough, MN 18182",56.75,56.75,113.5,2024-10-15 16:07:00.000,2024-10-15,2024,10,15,44784,[],()
73017,47477,19333,1,USD 29.5,"11/11/24,22:31:07",,29.5,29.5,29.5,2024-11-11 22:31:07.000,2024-11-11,2024,11,11,45253,[],()
64261,45339,19190,1,45.5 €,2024-11-06T10:01:19,"Suite 185 649 Bashirian Plaza, East Roger, IN 48531-6359",54.6,54.6,54.6,2024-11-06 10:01:19.000,2024-11-06,2024,11,6,45339,[],()
70164,44604,19428,1,€ 42.5,00:08:27 2025-08-05,,51.0,51.0,51.0,2025-08-05 00:08:27.000,2025-08-05,2025,8,5,44604,[],()
69541,44862,19048,1,USD29.,23:57;13-SEP-2025,,29.0,29.0,29.0,2025-09-13 23:57:00.000,2025-09-13,2025,9,13,46434,[],()
73041,46349,19589,2,55EUR, 2-June-2025 08:03:44 PM,"Apt. 220 2072 Lamar Hills, Port Rivaview, IL 78383-0258",66.0,66.0,132.0,2025-06-02 20:03:44.000,2025-06-02,2025,6,2,46349,[],()
68297,44858,19584,1,€41.,"02/25/25,19:13:22",NULL,49.199999999999996,49.199999999999996,49.2,2025-02-25 19:13:22.000,2025-02-25,2025,2,25,44858,[],()
69397,47056,19080,2,EUR50.00,"08:00, 06/09/25","Suite 880 7602 Petronila Knolls, Rempelmouth, LA 03861-7890",60.0,60.0,120.0,2025-06-09 08:00:00.000,2025-06-09,2025,6,9,47056,[],()
66731,44584,19488,1,$73.5,2024-11-10T09:13:27,NULL,73.5,73.5,73.5,2024-11-10 09:13:27.000,2024-11-10,2024,11,10,44584,[],()
70121,45918,19589,1,54.50$,"07:12:53,02/08/25",,54.5,54.5,54.5,2025-02-08 07:12:53.000,2025-02-08,2025,2,8,45918,[],()
64923,46592,19569,1,USD66.00, 2.12.2024  9:07:07,"82400 Schuppe Parkways, Krisville, ID 11904",66.0,66.0,66.0,2024-02-12 09:07:07.000,2024-02-12,2024,2,12,46592,[],()
69291,45319,19426,2,EUR44.00,16:44 10-May-2025,NULL,52.8,52.8,105.6,2025-05-10 16:44:00.000,2025-05-10,2025,5,10,45319,[],()
73923,45017,19033,1,$28.99,"17-May-2025,10:49",,28.99,28.99,28.99,2025-05-17 10:49:00.000,2025-05-17,2025,5,17,45017,[],()
73024,46886,18904,1,$ 34.0,"2025-02-25,02:56:11 pm",NULL,34.0,34.0,34.0,2025-02-25 14:56:11.000,2025-02-25,2025,2,25,46886,[],()
64566,44854,19410,2,USD45.00,2025-07-09 12:34:27 am,,45.0,45.0,90.0,2025-07-09 00:34:27.000,2025-07-09,2025,7,9,44854,[],()
67685,46134,18954,3,USD34.0,02:51 22-Apr-2025,NULL,34.0,34.0,102.0,2025-04-22 02:51:00.000,2025-04-22,2025,4,22,46134,[],()
63855,46321,19429,3,$ 70.5,2025-02-28T06:33:47.963,NULL,70.5,70.5,211.5,2025-02-28 06:33:47.963,2025-02-28,2025,2,28,46321,[],()
66589,44601,19422,3,$26.25,"04:29:43,07/21/24","Apt. 620 28011 Bruno Unions, Gerholdland, CA 53798",26.25,26.25,78.75,2024-07-21 04:29:43.000,2024-07-21,2024,7,21,44601,[],()
71832,47495,19434,1,14.50 €,"09:30:12 pm,11/26/24","8280 Kathline Mountain, Cyrilville, CT 99081-9641",17.4,17.4,17.4,2024-11-26 21:30:12.000,2024-11-26,2024,11,26,47495,[],()
73128,46690,18910,4,USD51.0,2024-12-14T09:17:03,"2600 Brice River, Lake Lesleyfurt, NC 21183-2451",51.0,51.0,204.0,2024-12-14 09:17:03.000,2024-12-14,2024,12,14,46690,[],()
69913,46687,19401,1,$57¢75,"17:30, 2025-03-22",,5775.0,5775.0,5775.0,2025-03-22 17:30:00.000,2025-03-22,2025,3,22,46687,[],()
69942,44589,18939,1,$55.99,2025-06-09T08:09:38.832,,55.99,55.99,55.99,2025-06-09 08:09:38.832,2025-06-09,2025,6,9,45729,[],()
63027,44561,19339,1,44$,01:40:27 A.M.;2025-04-02,,44.0,44.0,44.0,2025-04-02 01:40:27.000,2025-04-02,2025,4,2,44561,[],()
69074,45195,18843,1,19. €, 1-MAY-2025 06:29:23 P.M.,,22.8,22.8,22.8,2025-05-01 18:29:23.000,2025-05-01,2025,5,1,45195,[],()
65177,45062,18964,1,48.0 $,23:01:19 08/06/24,"Apt. 245 5042 Annette Islands, South Andreville, AZ 43566",48.0,48.0,48.0,2024-08-06 23:01:19.000,2024-08-06,2024,8,6,46955,[],()
64423,44708,19197,1,$ 40.50,"07:42:19,28-April-2025",,40.5,40.5,40.5,2025-04-28 07:42:19.000,2025-04-28,2025,4,28,44708,[],()
68016,46703,19360,1,$ 58.0, 8-DEC-2024;06:03:36 P.M.,NULL,58.0,58.0,58.0,2024-12-08 18:03:36.000,2024-12-08,2024,12,8,46703,[],()
67606,44649,19546,2,48.99 USD,19.07.2024 11:12:12,,48.99,48.99,97.98,2024-07-19 11:12:12.000,2024-07-19,2024,7,19,44649,[],()
72038,46420,19581,1,29.75EUR,07:08;30-MAR-2025,,35.699999999999996,35.699999999999996,35.7,2025-03-30 07:08:00.000,2025-03-30,2025,3,30,46420,[],()
72664,47367,19197,1,42.99 $,"11/16/24,03:23:46 AM","8139 Lowe Prairie, Schummshire, NM 96104",42.99,42.99,42.99,2024-11-16 03:23:46.000,2024-11-16,2024,11,16,47367,[],()
67402,46073,19114,2,42.0 USD,"09:59:44,14-May-2025",,42.0,42.0,84.0,2025-05-14 09:59:44.000,2025-05-14,2025,5,14,46073,[],()
64317,44650,18886,1,$69¢99,"15:23:24,27-May-2025",,6999.0,6999.0,6999.0,2025-05-27 15:23:24.000,2025-05-27,2025,5,27,44650,[],()
69635,45350,19545,3,49.75USD,2025-02-03T06:00:15.099,NULL,49.75,49.75,149.25,2025-02-03 06:00:15.099,2025-02-03,2025,2,3,45350,[],()
69852,45241,19039,1,47.5€,"23:16:55, 11/05/24","Suite 155 8709 Alonzo Field, Rickeyview, NH 31527-0270",57.0,57.0,57.0,2024-11-05 23:16:55.000,2024-11-05,2024,11,5,46821,[],()
72554,46821,19005,1,$ 35.0,2024-12-31T14:38:27,NULL,35.0,35.0,35.0,2024-12-31 14:38:27.000,2024-12-31,2024,12,31,46821,[],()
67748,46814,19270,1,18. USD,15:30:26 12/21/24,,18.0,18.0,18.0,2024-12-21 15:30:26.000,2024-12-21,2024,12,21,46814,[],()
73263,47046,19406,1,55.99 USD,03:29:41 P.M. 2025-06-06,,55.99,55.99,55.99,2025-06-06 15:29:41.000,2025-06-06,2025,6,6,47046,[],()
72684,45551,19213,2,$ 32.99,2025-03-21T03:14:02.792,,32.99,32.99,65.98,2025-03-21 03:14:02.792,2025-03-21,2025,3,21,45551,[],()
73795,45169,19164,1,37.50 USD,01:29:37;2024-11-30,,37.5,37.5,37.5,2024-11-30 01:29:37.000,2024-11-30,2024,11,30,45169,[],()
66886,44865,19358,1,$ 52.00,"09:42,06/12/25",NULL,52.0,52.0,52.0,2025-06-12 09:42:00.000,2025-06-12,2025,6,12,44865,[],()
67224,46223,19395,1,45.25$,"2025-01-17,05:26:35 A.M.","Apt. 624 6601 O'Keefe Cove, Goyettefort, AZ 63179",45.25,45.25,45.25,2025-01-17 05:26:35.000,2025-01-17,2025,1,17,46223,[],()
71535,45392,19203,3,€57¢99,"02:33:40 AM,2025-09-01",,6958.8,6958.8,20876.4,2025-09-01 02:33:40.000,2025-09-01,2025,9,1,45392,[],()
69166,46244,19394,1,EUR17,12:39 16-JUL-2024,,20.4,20.4,20.4,2024-07-16 12:39:00.000,2024-07-16,2024,7,16,46244,[],()
63313,46100,19212,2,54.99 €,"02/02/24,10:30:07 pm",NULL,65.988,65.988,131.98,2024-02-02 22:30:07.000,2024-02-02,2024,2,2,46100,[],()
68834,44464,19302,1,$26¢50,"09:50:45,04/01/24",,2650.0,2650.0,2650.0,2024-04-01 09:50:45.000,2024-04-01,2024,4,1,44464,[],()
67395,47064,19431,1,34€,01/16/25;05:28,"Suite 892 260 Ernser Canyon, Lake Kassie, LA 04588-2376",40.8,40.8,40.8,2025-01-16 05:28:00.000,2025-01-16,2025,1,16,47064,[],()
73049,45963,18954,1,USD 34.,09:28:39 pm;01/22/25,"Apt. 829 203 Gottlieb Via, North Monte, NE 73168-6756",34.0,34.0,34.0,2025-01-22 21:28:39.000,2025-01-22,2025,1,22,45963,[],()
71444,45361,19292,1,USD49.25,20:36;2025-01-18,NULL,49.25,49.25,49.25,2025-01-18 20:36:00.000,2025-01-18,2025,1,18,45361,[],()
63877,45182,18860,1,45.50USD,"12:28:36, 03/15/24",,45.5,45.5,45.5,2024-03-15 12:28:36.000,2024-03-15,2024,3,15,45182,[],()
73188,47057,18949,2,29.50 $,"12/22/24,11:54",,29.5,29.5,59.0,2024-12-22 11:54:00.000,2024-12-22,2024,12,22,47057,[],()
73099,44394,19143,3,$31¢50,"28-NOV-2024,06:01",,3150.0,3150.0,9450.0,2024-11-28 06:01:00.000,2024-11-28,2024,11,28,44394,[],()
66082,44497,19102,1,62.0 €,"23-March-2025,10:02:58 pm","Apt. 604 66787 Lemke Courts, New Robbie, NH 24175",74.39999999999999,74.39999999999999,74.4,2025-03-23 22:02:58.000,2025-03-23,2025,3,23,45303,[],()
64547,46280,18874,2,$ 53.75,2024-07-31;12:44:19,NULL,53.75,53.75,107.5,2024-07-31 12:44:19.000,2024-07-31,2024,7,31,46280,[],()
71209,46823,19206,3,28$25¢,"16:15,23-Jan-2025",,2825.0,2825.0,8475.0,2025-01-23 16:15:00.000,2025-01-23,2025,1,23,46823,[],()
67796,46699,19536,1,$65¢99,"08/23/24, 15:40","Apt. 681 73213 Katherin Fall, Bergeshire, TN 98665-5699",6599.0,6599.0,6599.0,2024-08-23 15:40:00.000,2024-08-23,2024,8,23,47417,[],()
66707,45637,19253,1,36.00$,2024-09-28T04:52:16,,36.0,36.0,36.0,2024-09-28 04:52:16.000,2024-09-28,2024,9,28,45637,[],()
65069,45879,19242,1,47.75$,12:45:48 P.M.;27-Sep-2024,,47.75,47.75,47.75,2024-09-27 12:45:48.000,2024-09-27,2024,9,27,45879,[],()
73690,45791,19260,1,$75.00,2024-08-09T20:47:07,,75.0,75.0,75.0,2024-08-09 20:47:07.000,2024-08-09,2024,8,9,45791,[],()
65367,46555,18881,1,30.25 $,03:36:21 am; 3-Dec-2024,,30.25,30.25,30.25,2024-12-03 03:36:21.000,2024-12-03,2024,12,3,46555,[],()
69178,47178,19193,1,USD16.75,"09/19/24, 00:04",,16.75,16.75,16.75,2024-09-19 00:04:00.000,2024-09-19,2024,9,19,47178,[],()
67576,46267,19217,1,32.75 USD,04:19;07/01/25,"Suite 323 528 Cruickshank Club, Cormierbury, UT 52957-6639",32.75,32.75,32.75,2025-07-01 04:19:00.000,2025-07-01,2025,7,1,45298,[],()
65352,44834,19505,1,USD 21.0,22:48:23 31-Jul-2024,NULL,21.0,21.0,21.0,2024-07-31 22:48:23.000,2024-07-31,2024,7,31,44834,[],()
65262,45729,19411,4,EUR 43.50,"09:10:36 pm, 08/25/24","Suite 943 584 Dario Green, North Risa, AZ 50989-5863",52.199999999999996,52.199999999999996,208.8,2024-08-25 21:10:36.000,2024-08-25,2024,8,25,45729,[],()
69474,46752,19247,1,65.5 EUR,"2024-12-15,08:19",NULL,78.6,78.6,78.6,2024-12-15 08:19:00.000,2024-12-15,2024,12,15,46752,[],()
70888,47152,19001,1,28.99USD,02/09/25 11:22:26 AM,,28.99,28.99,28.99,2025-02-09 11:22:26.000,2025-02-09,2025,2,9,47152,[],()
73190,45707,19259,2,58.99$,04:07:50 P.M.;30-Aug-2024,NULL,58.99,58.99,117.98,2024-08-30 16:07:50.000,2024-08-30,2024,8,30,45707,[],()
63308,44550,19263,1,$ 27.99,01:52:08 PM;10/20/24,,27.99,27.99,27.99,2024-10-20 13:52:08.000,2024-10-20,2024,10,20,44550,[],()
64707,45689,19026,1,EUR 22.25,2025-02-23T18:02:31,,26.7,26.7,26.7,2025-02-23 18:02:31.000,2025-02-23,2025,2,23,45689,[],()
66519,45253,19247,1,61€, 2.11.2024 18:01:01,"64595 Flatley Island, Constanceberg, DE 82479",73.2,73.2,73.2,2024-02-11 18:01:01.000,2024-02-11,2024,2,11,45253,[],()
68009,47572,19567,1,48$,02:26;19-February-2025,NULL,48.0,48.0,48.0,2025-02-19 02:26:00.000,2025-02-19,2025,2,19,47572,[],()
72144,46866,19124,1,56.5$,2024-06-05T00:15:44.454,NULL,56.5,56.5,56.5,2024-06-05 00:15:44.454,2024-06-05,2024,6,5,46866,[],()
68323,47542,18903,4,EUR 18.99,02/01/25;10:59:58 pm,NULL,22.787999999999997,22.787999999999997,91.15,2025-02-01 22:59:58.000,2025-02-01,2025,2,1,47542,[],()
69426,47617,19049,2,53.0 $,2024-10-24;02:28,"114 Cruickshank Plains, Romaguerahaven, SC 40127-1388",53.0,53.0,106.0,2024-10-24 02:28:00.000,2024-10-24,2024,10,24,47617,[],()
69853,44901,19381,1,$29¢50,24-Dec-2024 05:54:09 AM,,2950.0,2950.0,2950.0,2024-12-24 05:54:09.000,2024-12-24,2024,12,24,44901,[],()
70251,44714,19571,1,17.99 $,"08:11:05,2025-05-05",,17.99,17.99,17.99,2025-05-05 08:11:05.000,2025-05-05,2025,5,5,44714,[],()
69953,46414,18861,2,36USD,07:29:52 am 2025-08-08,,36.0,36.0,72.0,2025-08-08 07:29:52.000,2025-08-08,2025,8,8,46414,[],()
67045,44630,19356,2,$50.25,17:02 2024-09-13,"9919 Sharen Isle, New Chishire, OR 15090",50.25,50.25,100.5,2024-09-13 17:02:00.000,2024-09-13,2024,9,13,44630,[],()
64394,46586,19152,1,EUR 27.5,"04:07:19 am, 7-MAY-2024","Suite 395 1584 Herzog Forks, Kuphalbury, AL 33521-6675",33.0,33.0,33.0,2024-05-07 04:07:19.000,2024-05-07,2024,5,7,46586,[],()
65516,45224,19367,2,$ 51.0,"11/14/24,16:10",,51.0,51.0,102.0,2024-11-14 16:10:00.000,2024-11-14,2024,11,14,45224,[],()
67102,46012,19571,2,$ 16.50,02:36; 7-Jul-2024,,16.5,16.5,33.0,2024-07-07 02:36:00.000,2024-07-07,2024,7,7,46579,[],()
66241,46970,19049,1,USD 57.99,"2024-04-27, 02:55:44 AM",,57.99,57.99,57.99,2024-04-27 02:55:44.000,2024-04-27,2024,4,27,46970,[],()
65673,46132,18957,1,$ 61.25,"03:13:33 P.M., 10/08/24",,61.25,61.25,61.25,2024-10-08 15:13:33.000,2024-10-08,2024,10,8,46132,[],()
67715,45757,18924,1,$28.5,03:58; 7-December-2024,,28.5,28.5,28.5,2024-12-07 03:58:00.000,2024-12-07,2024,12,7,45757,[],()
73776,47154,18946,3,46.75USD,"12/07/24,21:50","76172 Heriberto Islands, Mraztown, IA 60277-8330",46.75,46.75,140.25,2024-12-07 21:50:00.000,2024-12-07,2024,12,7,47154,[],()
63944,46521,19324,1,64.50 USD,"10/18/24,07:07:42",NULL,64.5,64.5,64.5,2024-10-18 07:07:42.000,2024-10-18,2024,10,18,46521,[],()
73706,47205,19093,3,$26.25,06:28:51 pm 14-September-2024,,26.25,26.25,78.75,2024-09-14 18:28:51.000,2024-09-14,2024,9,14,47205,[],()
66763,44940,18850,1,33.00$,"09/14/24, 01:56:32 PM","136 Shondra Heights, Hagenesville, NV 00393-9327",33.0,33.0,33.0,2024-09-14 13:56:32.000,2024-09-14,2024,9,14,44940,[],()
65536,45841,19421,1,USD22.0, 6-Sep-2024;03:54,NULL,22.0,22.0,22.0,2024-09-06 03:54:00.000,2024-09-06,2024,9,6,45841,[],()
71298,47267,19055,1,EUR14., 4-MAY-2025 11:27,,16.8,16.8,16.8,2025-05-04 11:27:00.000,2025-05-04,2025,5,4,47267,[],()
71360,44931,19317,1,€ 21,"2024-12-18,06:52:20",,25.2,25.2,25.2,2024-12-18 06:52:20.000,2024-12-18,2024,12,18,44931,[],()
73482,46139,19013,1,48.5 $,"02:51:42 P.M., 10-January-2025",,48.5,48.5,48.5,2025-01-10 14:51:42.000,2025-01-10,2025,1,10,46139,[],()
67428,46355,19189,1,USD19.99,21:53:57 2024-11-28,,19.99,19.99,19.99,2024-11-28 21:53:57.000,2024-11-28,2024,11,28,46355,[],()
67934,45907,19014,1,18.EUR,05:49;2024-05-09,,21.599999999999998,21.599999999999998,21.6,2024-05-09 05:49:00.000,2024-05-09,2024,5,9,45907,[],()
68081,47368,19186,1,€ 28.0,"12/20/24,22:16",,33.6,33.6,33.6,2024-12-20 22:16:00.000,2024-12-20,2024,12,20,47368,[],()
72259,46798,18924,1,30.99€,22-JUN-2024 03:24:16 P.M.,"Suite 822 4405 Prosacco Mountains, New Lemueltown, KS 31728",37.187999999999995,37.187999999999995,37.19,2024-06-22 15:24:16.000,2024-06-22,2024,6,22,46798,[],()
73686,45870,19527,1,75.75USD,2024-10-18T21:29:41,NULL,75.75,75.75,75.75,2024-10-18 21:29:41.000,2024-10-18,2024,10,18,45870,[],()
64137,47119,18861,1,37.25 $,"08:22:59 A.M., 31-January-2025","99554 Legros Circle, North Lovettaton, HI 70352",37.25,37.25,37.25,2025-01-31 08:22:59.000,2025-01-31,2025,1,31,47119,[],()
73298,46174,19050,3,€69.75,"04:23:03 P.M., 23-September-2024",,83.7,83.7,251.1,2024-09-23 16:23:03.000,2024-09-23,2024,9,23,46174,[],()
65140,47041,19384,2,23.5EUR,"03:33:29 A.M., 09/02/24","510 Barton Crossroad, Kuvalisfort, PA 81406",28.2,28.2,56.4,2024-09-02 03:33:29.000,2024-09-02,2024,9,2,47041,[],()
67763,46904,19029,1,€66¢75," 3-June-2024,11:48:02 AM",,8010.0,8010.0,8010.0,2024-06-03 11:48:02.000,2024-06-03,2024,6,3,46904,[],()
63563,46366,19126,4,26.00 $,"12:22, 20-Dec-2024","Suite 140 5078 Preston Lodge, Willieland, SD 18649",26.0,26.0,104.0,2024-12-20 12:22:00.000,2024-12-20,2024,12,20,46366,[],()
71525,45490,19590,1,€28.99,2024-11-19T07:30:13.214,,34.788,34.788,34.79,2024-11-19 07:30:13.214,2024-11-19,2024,11,19,45490,[],()
71780,46177,18916,2,$ 57.50,"21:24:17,2024-07-13","602 Anderson Unions, Hyattchester, OK 08668",57.5,57.5,115.0,2024-07-13 21:24:17.000,2024-07-13,2024,7,13,46177,[],()
70884,46897,18915,1,$67.00,20:38:29 10/07/24,,67.0,67.0,67.0,2024-10-07 20:38:29.000,2024-10-07,2024,10,7,46897,[],()
71896,44398,19097,1,68.00USD,2024-09-08T04:02:52.627,,68.0,68.0,68.0,2024-09-08 04:02:52.627,2024-09-08,2024,9,8,44398,[],()
71938,45901,18979,1,68.00 USD,18:02; 4-Mar-2025,NULL,68.0,68.0,68.0,2025-03-04 18:02:00.000,2025-03-04,2025,3,4,45901,[],()
67822,44696,19293,1,29.99 USD,"08/02/24, 04:01",,29.99,29.99,29.99,2024-08-02 04:01:00.000,2024-08-02,2024,8,2,44696,[],()
65969,46196,19038,1,58.00$,"19:39:21, 07/01/25",,58.0,58.0,58.0,2025-07-01 19:39:21.000,2025-07-01,2025,7,1,46196,[],()
66006,44661,19021,1,32.25 €,04:03:27 A.M.;23-May-2025,NULL,38.699999999999996,38.699999999999996,38.7,2025-05-23 04:03:27.000,2025-05-23,2025,5,23,47317,[],()
68943,46279,19445,1,60.99 $,12:57:06;2024-08-13,"Apt. 766 899 Della Mountains, West Alyssa, WI 99369",60.99,60.99,60.99,2024-08-13 12:57:06.000,2024-08-13,2024,8,13,46279,[],()
63591,46945,19021,1,USD 32.00,"12:46, 2024-12-29",,32.0,32.0,32.0,2024-12-29 12:46:00.000,2024-12-29,2024,12,29,46945,[],()
70283,45652,19150,1,$42¢25,09/03/24;11:05,,4225.0,4225.0,4225.0,2024-09-03 11:05:00.000,2024-09-03,2024,9,3,45652,[],()
69997,46878,19218,1,69.00$,"2024-11-04, 19:14","Suite 214 96246 Lekisha Stravenue, Lake Fredericberg, MS 55426-5002",69.0,69.0,69.0,2024-11-04 19:14:00.000,2024-11-04,2024,11,4,46878,[],()
70096,45719,19332,1,42.99 USD,"2025-05-26,09:37:07",,42.99,42.99,42.99,2025-05-26 09:37:07.000,2025-05-26,2025,5,26,45719,[],()
63930,47461,19439,1,USD 70.50,"07/27/25,11:58:44","767 Kohler Crossing, Wilburbury, VA 76654",70.5,70.5,70.5,2025-07-27 11:58:44.000,2025-07-27,2025,7,27,47461,[],()
72743,44498,19025,2,USD 34.5,"09/08/25,11:17","Apt. 499 94257 Jude Lane, West Jenelle, OR 29177-7799",34.5,34.5,69.0,2025-09-08 11:17:00.000,2025-09-08,2025,9,8,44498,[],()
70619,47451,19581,2,USD 27.99,"2024-09-06,11:04:08 P.M.","Apt. 373 660 Strosin Falls, West Joliestad, MA 11281",27.99,27.99,55.98,2024-09-06 23:04:08.000,2024-09-06,2024,9,6,46068,[],()
64764,46219,18931,1,$37.99,10/07/24 14:59:44,"Apt. 353 287 Grant Lights, Hilllhaven, SD 34439",37.99,37.99,37.99,2024-10-07 14:59:44.000,2024-10-07,2024,10,7,46219,[],()
63847,44763,18908,1,€ 44.25,"11:45:12 pm,10-APR-2025",NULL,53.1,53.1,53.1,2025-04-10 23:45:12.000,2025-04-10,2025,4,10,44763,[],()
68516,45083,19304,1,22.50 $,2025-07-22 10:13,NULL,22.5,22.5,22.5,2025-07-22 10:13:00.000,2025-07-22,2025,7,22,45083,[],()
70898,46944,19060,1,64.75$," 6-MAR-2025,17:40",NULL,64.75,64.75,64.75,2025-03-06 17:40:00.000,2025-03-06,2025,3,6,46944,[],()
70676,46087,19082,1,$15.00,06:30;26-February-2025,"374 Petra Summit, South Clemmieville, NY 22379-2170",15.0,15.0,15.0,2025-02-26 06:30:00.000,2025-02-26,2025,2,26,46087,[],()
71947,46544,18845,1,€61.50,"09:50:37 pm, 04/24/24",,73.8,73.8,73.8,2024-04-24 21:50:37.000,2024-04-24,2024,4,24,46544,[],()
64228,45353,19090,1,EUR60.25,18:15;12/26/24,,72.3,72.3,72.3,2024-12-26 18:15:00.000,2024-12-26,2024,12,26,45353,[],()
65676,44799,18876,4,20.75 EUR,11:50:58 14-Apr-2024,NULL,24.9,24.9,99.6,2024-04-14 11:50:58.000,2024-04-14,2024,4,14,44799,[],()
63334,45606,18951,1,€68.75,09:08:04 PM 2024-06-20,,82.5,82.5,82.5,2024-06-20 21:08:04.000,2024-06-20,2024,6,20,45606,[],()
69135,45000,19562,2,51.75USD,2025-03-27T07:36:21.670,,51.75,51.75,103.5,2025-03-27 07:36:21.670,2025-03-27,2025,3,27,45000,[],()
68042,47340,19316,1,22.0 €,"2024-07-11,10:21",,26.4,26.4,26.4,2024-07-11 10:21:00.000,2024-07-11,2024,7,11,46170,[],()
71797,47292,18981,1,71.25 EUR,29.05.2024 23:01:01,NULL,85.5,85.5,85.5,2024-05-29 23:01:01.000,2024-05-29,2024,5,29,47292,[],()
65246,47193,19259,1,€59¢50,2024-12-22T12:08:57.622,"Suite 875 796 Hodkiewicz Keys, Gastonview, WY 54993",7140.0,7140.0,7140.0,2024-12-22 12:08:57.622,2024-12-22,2024,12,22,47193,[],()
63007,44904,19287,1,€ 37.00,"2024-12-11, 07:40",,44.4,44.4,44.4,2024-12-11 07:40:00.000,2024-12-11,2024,12,11,44904,[],()
68588,46762,19165,1,27.00 $,2024-04-06T20:04:20,"79414 Sandy Parks, Kohlertown, NH 53063-0093",27.0,27.0,27.0,2024-04-06 20:04:20.000,2024-04-06,2024,4,6,47617,[],()
69340,44736,19508,1,€37.99,01/06/25 17:18,NULL,45.588,45.588,45.59,2025-01-06 17:18:00.000,2025-01-06,2025,1,6,44736,[],()
67870,47444,19073,2,USD 71.,"21:27, 08/28/24",,71.0,71.0,142.0,2024-08-28 21:27:00.000,2024-08-28,2024,8,28,47444,[],()
65324,45756,19078,1,EUR51,01/18/25 18:25,NULL,61.199999999999996,61.199999999999996,61.2,2025-01-18 18:25:00.000,2025-01-18,2025,1,18,45756,[],()
64129,46631,18850,1,32.75 USD,"08:57:31 P.M.,21-June-2024",,32.75,32.75,32.75,2024-06-21 20:57:31.000,2024-06-21,2024,6,21,46631,[],()
70668,46162,18983,1,$ 32.50,"14:54,09/27/24",,32.5,32.5,32.5,2024-09-27 14:54:00.000,2024-09-27,2024,9,27,46162,[],()
73442,44656,19468,1,38.99$,04:27 02/21/25,"Apt. 892 61936 Cory Prairie, Cedrichaven, PA 57987",38.99,38.99,38.99,2025-02-21 04:27:00.000,2025-02-21,2025,2,21,44656,[],()
72805,45126,18978,1,$ 60.50,"03:56:01,03/31/24",,60.5,60.5,60.5,2024-03-31 03:56:01.000,2024-03-31,2024,3,31,45126,[],()
64903,47031,19106,1,46.00EUR,"17:16:04, 3-December-2024","269 Schumm Station, Port Nannie, CO 79823-5971",55.199999999999996,55.199999999999996,55.2,2024-12-03 17:16:04.000,2024-12-03,2024,12,3,47031,[],()
69492,44939,19073,2,€72¢99,2025-03-30T04:58:11.960,,8758.8,8758.8,17517.6,2025-03-30 04:58:11.960,2025-03-30,2025,3,30,44939,[],()
73242,47574,19422,1,27.75 €,04:08:49; 9-Jan-2025,NULL,33.3,33.3,33.3,2025-01-09 04:08:49.000,2025-01-09,2025,1,9,47574,[],()
68306,44829,19525,1,62€00¢,"07/18/24,10:11",,7440.0,7440.0,7440.0,2024-07-18 10:11:00.000,2024-07-18,2024,7,18,44829,[],()
63626,47586,18881,1,32.99 USD,2024-08-30 07:44:16 AM,"Apt. 840 384 Leffler Views, Considinetown, DE 64278",32.99,32.99,32.99,2024-08-30 07:44:16.000,2024-08-30,2024,8,30,47586,[],()
64690,44874,18995,3,$ 31.50,"09/20/24,20:28",NULL,31.5,31.5,94.5,2024-09-20 20:28:00.000,2024-09-20,2024,9,20,44874,[],()
73945,45047,19134,5,70.99EUR,08:59:26;20-October-2024,,85.18799999999999,85.18799999999999,425.94,2024-10-20 08:59:26.000,2024-10-20,2024,10,20,45047,[],()
72337,44842,18979,2,€ 69.75,2025-06-14T19:57:53,,83.7,83.7,167.4,2025-06-14 19:57:53.000,2025-06-14,2025,6,14,44842,[],()
68361,45187,19041,1,16.25$,12:21:44 PM;2024-12-16,"64946 Schulist Stravenue, Barrybury, OH 84978-1202",16.25,16.25,16.25,2024-12-16 12:21:44.000,2024-12-16,2024,12,16,45187,[],()
72863,45258,19110,1,56.99 $,03/31/24 10:50:39 PM,,56.99,56.99,56.99,2024-03-31 22:50:39.000,2024-03-31,2024,3,31,45258,[],()
71372,44807,19456,2,35.0USD,30-Nov-2024 18:53:31,NULL,35.0,35.0,70.0,2024-11-30 18:53:31.000,2024-11-30,2024,11,30,44807,[],()
63364,46802,19056,2,$ 25.50,"15-May-2025,02:45",NULL,25.5,25.5,51.0,2025-05-15 02:45:00.000,2025-05-15,2025,5,15,47000,[],()
65524,47186,19230,1,€ 61.99,"2025-03-02, 10:48:14 PM",NULL,74.388,74.388,74.39,2025-03-02 22:48:14.000,2025-03-02,2025,3,2,47186,[],()
73806,46689,19020,1,$18¢99,2025-06-23T07:53:36.887,,1899.0,1899.0,1899.0,2025-06-23 07:53:36.887,2025-06-23,2025,6,23,45285,[],()
63755,45833,19434,2,$14.00,"2025-01-12,16:39:37",NULL,14.0,14.0,28.0,2025-01-12 16:39:37.000,2025-01-12,2025,1,12,45833,[],()
68237,45465,19249,1,USD65.99,"04/13/24,09:06:44 P.M.",,65.99,65.99,65.99,2024-04-13 21:06:44.000,2024-04-13,2024,4,13,45465,[],()
64592,45793,19306,1,38.75 USD,16-Mar-2025;13:08,"Apt. 238 3284 Murazik Islands, Minervaside, MN 23872-9593",38.75,38.75,38.75,2025-03-16 13:08:00.000,2025-03-16,2025,3,16,45793,[],()
72928,47464,19222,1,$56.50,00:16:31 22-Feb-2025,,56.5,56.5,56.5,2025-02-22 00:16:31.000,2025-02-22,2025,2,22,47464,[],()
71536,46510,19284,1,51.75USD, 9.12.2024  6:05:05,,51.75,51.75,51.75,2024-09-12 06:05:05.000,2024-09-12,2024,9,12,46510,[],()
65566,46888,19202,1,$55.0, 6-January-2025;18:29:39,,55.0,55.0,55.0,2025-01-06 18:29:39.000,2025-01-06,2025,1,6,46888,[],()
68291,45116,19239,4,72.00€,"12/29/24, 10:12",,86.39999999999999,86.39999999999999,345.6,2024-12-29 10:12:00.000,2024-12-29,2024,12,29,45116,[],()
70557,46509,18954,1,USD32.5,"19:27:50, 6-September-2025",,32.5,32.5,32.5,2025-09-06 19:27:50.000,2025-09-06,2025,9,6,46509,[],()
73213,45339,18901,3,76.00 USD,"23-June-2025,03:45:15 PM",NULL,76.0,76.0,228.0,2025-06-23 15:45:15.000,2025-06-23,2025,6,23,45339,[],()
66149,47252,18967,2,72.50€,30-Jan-2025 07:16:17 PM,,87.0,87.0,174.0,2025-01-30 19:16:17.000,2025-01-30,2025,1,30,47252,[],()
63013,47106,19577,1,USD 74.5, 4-Jan-2025;02:38:22 P.M.,,74.5,74.5,74.5,2025-01-04 14:38:22.000,2025-01-04,2025,1,4,47106,[],()
69237,45154,19568,1,EUR44.50,"00:09:18, 2024-12-19","69735 Brakus Cliff, North Luciana, ND 65719",53.4,53.4,53.4,2024-12-19 00:09:18.000,2024-12-19,2024,12,19,45154,[],()
65766,44992,19166,1,60.5 €,05:06:41 P.M.;21-June-2024,"740 Stokes Shore, MacGyvermouth, TN 70563-3196",72.6,72.6,72.6,2024-06-21 17:06:41.000,2024-06-21,2024,6,21,44992,[],()
72748,46875,19235,1,$62," 3-September-2024,06:26:02 am",,62.0,62.0,62.0,2024-09-03 06:26:02.000,2024-09-03,2024,9,3,46875,[],()
65422,46737,18928,2,EUR18.75,"2024-10-31, 03:25",,22.5,22.5,45.0,2024-10-31 03:25:00.000,2024-10-31,2024,10,31,45965,[],()
67629,46533,19380,1,$63¢25,22-September-2024 01:48,"786 Crooks Landing, Dooleyshire, GA 72554",6325.0,6325.0,6325.0,2024-09-22 01:48:00.000,2024-09-22,2024,9,22,46533,[],()
64523,45095,19168,1,64$00¢,2025-01-23T14:51:49,NULL,6400.0,6400.0,6400.0,2025-01-23 14:51:49.000,2025-01-23,2025,1,23,45095,[],()
62759,47180,19395,2,USD 43.,"05:34:25 am,2024-10-17",NULL,43.0,43.0,86.0,2024-10-17 05:34:25.000,2024-10-17,2024,10,17,47180,[],()
65881,44586,19091,1,26.75€,2025-01-31T22:47:49,,32.1,32.1,32.1,2025-01-31 22:47:49.000,2025-01-31,2025,1,31,44586,[],()
72013,46025,18873,1,68.5 EUR,"23:26, 09/20/24",NULL,82.2,82.2,82.2,2024-09-20 23:26:00.000,2024-09-20,2024,9,20,46025,[],()
64585,46482,19431,1,30.75USD,"10-May-2025,04:34",,30.75,30.75,30.75,2025-05-10 04:34:00.000,2025-05-10,2025,5,10,46482,[],()
71305,46195,19245,1,70.0 $,"11:33, 1-December-2024",,70.0,70.0,70.0,2024-12-01 11:33:00.000,2024-12-01,2024,12,1,46195,[],()
67638,45052,19238,2,$ 18.99,04/13/25;01:32:37,,18.99,18.99,37.98,2025-04-13 01:32:37.000,2025-04-13,2025,4,13,45052,[],()
63310,44675,19424,1,USD20.,"2024-08-29,03:40:53",NULL,20.0,20.0,20.0,2024-08-29 03:40:53.000,2024-08-29,2024,8,29,44675,[],()
68929,45048,19544,1,USD41.00,"01/05/25, 13:00:55",,41.0,41.0,41.0,2025-01-05 13:00:55.000,2025-01-05,2025,1,5,45048,[],()
69752,44864,18945,1,47USD,"10/05/24,03:06:13 PM",,47.0,47.0,47.0,2024-10-05 15:06:13.000,2024-10-05,2024,10,5,44864,[],()
73181,46121,19216,2,USD 62.,2024-08-22T09:27:37.000,,62.0,62.0,124.0,2024-08-22 09:27:37.000,2024-08-22,2024,8,22,46121,[],()
71192,45645,19404,1,$ 28.00,"14:48,  6-Mar-2025","Suite 525 51538 Oliver Fields, Mickeyville, MT 83500-4442",28.0,28.0,28.0,2025-03-06 14:48:00.000,2025-03-06,2025,3,6,45645,[],()
68877,47046,19293,1,32.50EUR,17:06:53;19-AUG-2024,NULL,39.0,39.0,39.0,2024-08-19 17:06:53.000,2024-08-19,2024,8,19,47046,[],()
71870,47038,19503,1,19.5USD,2024-08-11T11:32:44.025,"Suite 805 356 Grady Hollow, North Kevin, NJ 82342",19.5,19.5,19.5,2024-08-11 11:32:44.025,2024-08-11,2024,8,11,47038,[],()
66151,45994,19305,1,53.75$,"2025-02-15, 03:48:18",NULL,53.75,53.75,53.75,2025-02-15 03:48:18.000,2025-02-15,2025,2,15,45994,[],()
73698,46724,18996,1,USD46.25,2024-06-08 04:32:13,"Apt. 372 367 Earle Views, West Desiremouth, SC 19399",46.25,46.25,46.25,2024-06-08 04:32:13.000,2024-06-08,2024,6,8,46724,[],()
63738,45913,19260,2,€ 72.5,10/17/24;17:25,"Apt. 137 310 Ryan River, Shanaberg, MO 76150-4425",87.0,87.0,174.0,2024-10-17 17:25:00.000,2024-10-17,2024,10,17,45913,[],()
73865,45922,19384,1,22. $,"20:53:25, 2025-05-14",NULL,22.0,22.0,22.0,2025-05-14 20:53:25.000,2025-05-14,2025,5,14,45922,[],()
64173,46570,19481,1,66.5EUR,2025-04-09T10:35:53.894,,79.8,79.8,79.8,2025-04-09 10:35:53.894,2025-04-09,2025,4,9,46570,[],()
68317,46825,19002,2,24.50 €,"08:13:41,2024-04-30",,29.4,29.4,58.8,2024-04-30 08:13:41.000,2024-04-30,2024,4,30,46825,[],()
67608,46368,19035,1,EUR20.5,"12:47:52 AM,26-Mar-2025",,24.599999999999998,24.599999999999998,24.6,2025-03-26 00:47:52.000,2025-03-26,2025,3,26,46368,[],()
67592,45370,19295,2,38.75 USD,"21:53, 01/14/25",NULL,38.75,38.75,77.5,2025-01-14 21:53:00.000,2025-01-14,2025,1,14,45370,[],()
66713,44679,19009,1,USD75.25,"06:21:47, 26-Mar-2024",,75.25,75.25,75.25,2024-03-26 06:21:47.000,2024-03-26,2024,3,26,44679,[],()
65075,47023,19395,1,$43.99,2024-12-07T22:17:58.155,,43.99,43.99,43.99,2024-12-07 22:17:58.155,2024-12-07,2024,12,7,47056,[],()
73653,45900,19121,1,71$50¢,"19:26:58,03/01/25",,7150.0,7150.0,7150.0,2025-03-01 19:26:58.000,2025-03-01,2025,3,1,45900,[],()
71751,45292,19411,1,48USD,2025-06-01 12:05:39 A.M.,"Suite 116 819 Will Extension, North Leon, AZ 30216-4569",48.0,48.0,48.0,2025-06-01 00:05:39.000,2025-06-01,2025,6,1,45292,[],()
70354,45865,19448,1,53 EUR,2024-09-20T18:09:03,"87156 Van Mountain, Lake Jodyland, NV 30740",63.599999999999994,63.599999999999994,63.6,2024-09-20 18:09:03.000,2024-09-20,2024,9,20,45865,[],()
72443,45179,19172,2,USD65.99,2025-05-25;19:13:07,,65.99,65.99,131.98,2025-05-25 19:13:07.000,2025-05-25,2025,5,25,45179,[],()
69693,46149,19001,1,USD28.99,22-NOV-2024 17:49:47,,28.99,28.99,28.99,2024-11-22 17:49:47.000,2024-11-22,2024,11,22,45698,[],()
72913,46305,19521,2,USD14.00,"06/06/25, 02:59:53","Apt. 702 769 Murazik Highway, Willyborough, WV 10452-3464",14.0,14.0,28.0,2025-06-06 02:59:53.000,2025-06-06,2025,6,6,46305,[],()
73757,46451,19022,1,65USD," 1-May-2024,11:00:50 am","1175 Geneva Parkways, North Marylou, MA 04321-0039",65.0,65.0,65.0,2024-05-01 11:00:50.000,2024-05-01,2024,5,1,46451,[],()
65421,47259,19455,1,EUR 13.50,2025-05-01T23:22:30.385,,16.2,16.2,16.2,2025-05-01 23:22:30.385,2025-05-01,2025,5,1,47259,[],()
64762,45319,18996,1,$45.75,2024-03-28;01:41:14 PM,NULL,45.75,45.75,45.75,2024-03-28 13:41:14.000,2024-03-28,2024,3,28,45319,[],()
64204,45119,19467,1,$71.00,"03:46, 06/19/24","474 Ignacio Ports, Port Vernellville, NY 69844-0415",71.0,71.0,71.0,2024-06-19 03:46:00.000,2024-06-19,2024,6,19,45119,[],()
70166,46494,19335,2,15.25 $,2024-08-20T16:26:01,,15.25,15.25,30.5,2024-08-20 16:26:01.000,2024-08-20,2024,8,20,46494,[],()
73324,44691,19065,2,$ 19.50,"2024-06-08,04:45:10 AM",,19.5,19.5,39.0,2024-06-08 04:45:10.000,2024-06-08,2024,6,8,44691,[],()
63932,47596,19517,2,68.75$,22:52 2024-09-18,"Suite 351 406 Shields Union, Yongstad, OK 54996",68.75,68.75,137.5,2024-09-18 22:52:00.000,2024-09-18,2024,9,18,47596,[],()
66508,46601,19210,1,37.25 USD,"08:35:56,2024-10-07",NULL,37.25,37.25,37.25,2024-10-07 08:35:56.000,2024-10-07,2024,10,7,46601,[],()
69197,47601,18838,1,EUR56,19:46:13;2025-04-03,NULL,67.2,67.2,67.2,2025-04-03 19:46:13.000,2025-04-03,2025,4,3,47601,[],()
72696,44782,19030,1,19$,"2024-11-17, 22:44",,19.0,19.0,19.0,2024-11-17 22:44:00.000,2024-11-17,2024,11,17,44782,[],()
72777,47377,19459,1,USD 41.50,05:48:22;02/25/25,,41.5,41.5,41.5,2025-02-25 05:48:22.000,2025-02-25,2025,2,25,47377,[],()
70378,44812,19162,1,$ 63.25,08:37:38 PM 11-March-2024,,63.25,63.25,63.25,2024-03-11 20:37:38.000,2024-03-11,2024,3,11,44812,[],()
66808,44635,19387,1,62.00 USD,01.05.2024 17:22:22,NULL,62.0,62.0,62.0,2024-01-05 17:22:22.000,2024-01-05,2024,1,5,44635,[],()
73063,47090,19468,1,36$75¢,09:28:55 pm 2024-04-04,"87336 Carlton Run, Chanelletown, NC 17507",3675.0,3675.0,3675.0,2024-04-04 21:28:55.000,2024-04-04,2024,4,4,47090,[],()
65222,44902,19206,1,USD25.50,"02:55:58,01/25/25","60923 Steuber Burgs, Penelopehaven, AZ 67908-7880",25.5,25.5,25.5,2025-01-25 02:55:58.000,2025-01-25,2025,1,25,44902,[],()
71725,44653,19437,3,EUR37.25,02:38:21 2024-10-09,NULL,44.699999999999996,44.699999999999996,134.1,2024-10-09 02:38:21.000,2024-10-09,2024,10,9,44653,[],()
63083,46407,19435,2,67.75$,01:06  7-Dec-2024,"Apt. 174 39450 Mohr Rapids, Port Neomistad, AL 80283",67.75,67.75,135.5,2024-12-07 01:06:00.000,2024-12-07,2024,12,7,46407,[],()
70893,46365,18975,1,52.50 USD,23.10.2024 21:18:18,,52.5,52.5,52.5,2024-10-23 21:18:18.000,2024-10-23,2024,10,23,46365,[],()
69430,46789,19167,1,39.5USD,"04:08,2025-03-04","Suite 781 56516 Kelvin Passage, South Saul, MO 61817",39.5,39.5,39.5,2025-03-04 04:08:00.000,2025-03-04,2025,3,4,46789,[],()
63085,46482,19168,1,USD 65.99,27-DEC-2024 02:17:59 P.M.,"Apt. 924 640 Neida Plaza, Nanton, NE 09974",65.99,65.99,65.99,2024-12-27 14:17:59.000,2024-12-27,2024,12,27,46482,[],()
70497,47000,18973,1,51.75USD,"18-April-2025, 07:08:20 am",,51.75,51.75,51.75,2025-04-18 07:08:20.000,2025-04-18,2025,4,18,47000,[],()
67240,44728,19483,1,54.5 EUR,10.12.2024 18:56:56,,65.39999999999999,65.39999999999999,65.4,2024-10-12 18:56:56.000,2024-10-12,2024,10,12,44728,[],()
67242,45673,18913,3,41.75$,2024-11-08 08:31:29,"8012 Sal Pike, Carlenaberg, SC 03961-4632",41.75,41.75,125.25,2024-11-08 08:31:29.000,2024-11-08,2024,11,8,45673,[],()
66379,45000,19475,2,39.0 USD,"11/06/24,14:36",,39.0,39.0,78.0,2024-11-06 14:36:00.000,2024-11-06,2024,11,6,45000,[],()
64163,47014,19406,2,EUR 60.5,"20:56:53,2024-10-24",,72.6,72.6,145.2,2024-10-24 20:56:53.000,2024-10-24,2024,10,24,47014,[],()
63909,45096,18946,1,45.5 €,04:27:04 A.M.;10/06/24,,54.6,54.6,54.6,2024-10-06 04:27:04.000,2024-10-06,2024,10,6,45096,[],()
73937,46958,19023,1,€ 45.99,Tue Jul 22 10:46:13 2025,NULL,55.188,55.188,55.19,2025-07-22 10:46:13.000,2025-07-22,2025,7,22,46958,[],()
65437,46833,18906,1,$ 43.99,"07:22, 05/20/24",NULL,43.99,43.99,43.99,2024-05-20 07:22:00.000,2024-05-20,2024,5,20,46833,[],()
64881,45321,19407,1,19.00$,11:27:12 P.M.;02/25/25,,19.0,19.0,19.0,2025-02-25 23:27:12.000,2025-02-25,2025,2,25,45321,[],()
72675,45882,19223,2,€ 18.99,12:52:04 AM 2024-09-27,"Apt. 656 274 Zack Harbors, Andersonton, VA 22253-2785",22.787999999999997,22.787999999999997,45.58,2024-09-27 00:52:04.000,2024-09-27,2024,9,27,45882,[],()
67341,45654,18946,2,50.50 USD,"02/23/25, 13:29:31","69165 Jaime Summit, West Walterfort, SD 98333-3054",50.5,50.5,101.0,2025-02-23 13:29:31.000,2025-02-23,2025,2,23,45654,[],()
69616,46905,19512,1,$47.5,11/14/24;00:27:55,NULL,47.5,47.5,47.5,2024-11-14 00:27:55.000,2024-11-14,2024,11,14,46905,[],()
67830,45175,18940,2,$19.75,"05:40,2025-07-07",NULL,19.75,19.75,39.5,2025-07-07 05:40:00.000,2025-07-07,2025,7,7,45175,[],()
68000,46313,19304,1,$ 25.00,"13:19:01,  9-August-2024",,25.0,25.0,25.0,2024-08-09 13:19:01.000,2024-08-09,2024,8,9,46313,[],()
66023,45708,19298,1,66 $,2025-06-05T06:49:46.198,"254 Balistreri Isle, Lake Magaret, OH 16696-3538",66.0,66.0,66.0,2025-06-05 06:49:46.198,2025-06-05,2025,6,5,45708,[],()
73395,46153,19503,1,20.50USD,"2024-02-19, 05:59",,20.5,20.5,20.5,2024-02-19 05:59:00.000,2024-02-19,2024,2,19,46153,[],()
73624,44852,19505,3,18.25USD,"21:13:58,02/10/25",,18.25,18.25,54.75,2025-02-10 21:13:58.000,2025-02-10,2025,2,10,44852,[],()
68619,46987,19158,5,$ 67.0,19:02;21-Jan-2025,NULL,67.0,67.0,335.0,2025-01-21 19:02:00.000,2025-01-21,2025,1,21,46987,[],()
64535,45943,19056,2,24.5$,"07/23/25, 20:35",NULL,24.5,24.5,49.0,2025-07-23 20:35:00.000,2025-07-23,2025,7,23,45943,[],()
72645,45725,19395,1,USD44.75,02:04:51 A.M. 2024-10-07,NULL,44.75,44.75,44.75,2024-10-07 02:04:51.000,2024-10-07,2024,10,7,45725,[],()
67479,47158,19313,2,28.25€,"01:50:14 am, 12/16/24",,33.9,33.9,67.8,2024-12-16 01:50:14.000,2024-12-16,2024,12,16,47158,[],()
68676,44934,18980,2,EUR63.50,06/18/24 09:24:50 P.M.,,76.2,76.2,152.4,2024-06-18 21:24:50.000,2024-06-18,2024,6,18,44934,[],()
67391,44481,19081,2,USD18.99,"2024-04-12,12:08:33 PM",NULL,18.99,18.99,37.98,2024-04-12 12:08:33.000,2024-04-12,2024,4,12,44481,[],()
69445,45576,19079,1,USD28.75," 9-September-2024, 02:40:43 pm",NULL,28.75,28.75,28.75,2024-09-09 14:40:43.000,2024-09-09,2024,9,9,45576,[],()
73816,45990,19506,1,$57¢50,23:03;2024-12-30,,5750.0,5750.0,5750.0,2024-12-30 23:03:00.000,2024-12-30,2024,12,30,45990,[],()
71411,47500,19083,1,46.00USD,2025-04-02T14:03:29.865,"585 Gutmann Streets, Waelchiberg, IA 02335-2013",46.0,46.0,46.0,2025-04-02 14:03:29.865,2025-04-02,2025,4,2,47500,[],()
72862,47211,19461,1,68.50USD,"2024-08-28, 08:19",,68.5,68.5,68.5,2024-08-28 08:19:00.000,2024-08-28,2024,8,28,47211,[],()
73528,46510,19261,1,€70¢00,11:40:02 am 10/17/24,,8400.0,8400.0,8400.0,2024-10-17 11:40:02.000,2024-10-17,2024,10,17,46510,[],()
66902,45423,19114,1,$40.25,"13:57, 2025-04-11",,40.25,40.25,40.25,2025-04-11 13:57:00.000,2025-04-11,2025,4,11,45423,[],()
69140,46105,19348,5,EUR 33.,2025-01-23;10:21:20 PM,,39.6,39.6,198.0,2025-01-23 22:21:20.000,2025-01-23,2025,1,23,45971,[],()
73770,47475,19484,1,EUR53.50,10:31:14 AM 2025-07-02,,64.2,64.2,64.2,2025-07-02 10:31:14.000,2025-07-02,2025,7,2,47475,[],()
67571,46702,19197,1,€44.25,"08:24:11 P.M., 2024-05-11",NULL,53.1,53.1,53.1,2024-05-11 20:24:11.000,2024-05-11,2024,5,11,46702,[],()
72463,44850,19130,1,27EUR,20:32;25-January-2025,"Apt. 245 5042 Annette Islands, South Andreville, AZ 43566",32.4,32.4,32.4,2025-01-25 20:32:00.000,2025-01-25,2025,1,25,46955,[],()
72637,45430,19481,2,64.0USD,01:32;19-MAY-2025,NULL,64.0,64.0,128.0,2025-05-19 01:32:00.000,2025-05-19,2025,5,19,45430,[],()
63967,46277,19335,1,$15.75,"16-Aug-2024, 14:10:22","Apt. 974 3426 Ira Light, Jeannetteton, IA 81895",15.75,15.75,15.75,2024-08-16 14:10:22.000,2024-08-16,2024,8,16,46277,[],()
73558,46955,19395,1,USD 45.25,"10/02/24, 22:42",,45.25,45.25,45.25,2024-10-02 22:42:00.000,2024-10-02,2024,10,2,46955,[],()
65194,46864,18918,1,68.25EUR,07:22:28;2024-08-27,"35884 Janetta Forge, Lake Harlanshire, NE 81832-4288",81.89999999999999,81.89999999999999,81.9,2024-08-27 07:22:28.000,2024-08-27,2024,8,27,46864,[],()
73400,46444,19154,1,75.00$,"08/24/25, 09:36:11",,75.0,75.0,75.0,2025-08-24 09:36:11.000,2025-08-24,2025,8,24,46444,[],()
73392,46411,19174,1,30.00 USD,2024-10-17T04:56:42,"72116 Guy Inlet, West Dionton, WA 64694",30.0,30.0,30.0,2024-10-17 04:56:42.000,2024-10-17,2024,10,17,46411,[],()
68517,45374,19329,5,USD67.75,22:54:40 10/27/24,,67.75,67.75,338.75,2024-10-27 22:54:40.000,2024-10-27,2024,10,27,45374,[],()
70499,47401,19360,1,60.25USD,12:28:30 A.M. 15-August-2024,,60.25,60.25,60.25,2024-08-15 00:28:30.000,2024-08-15,2024,8,15,47401,[],()
64594,44974,19456,1,36.75$,13:42 2024-10-06,,36.75,36.75,36.75,2024-10-06 13:42:00.000,2024-10-06,2024,10,6,44974,[],()
70227,44730,18847,1,USD40.5,21-September-2024 02:43:37 PM,"Apt. 699 187 Kozey Skyway, West Antioneburgh, NC 79374-3922",40.5,40.5,40.5,2024-09-21 14:43:37.000,2024-09-21,2024,9,21,44730,[],()
65109,47005,19220,2,$62.75,"01/01/25,03:58:46",,62.75,62.75,125.5,2025-01-01 03:58:46.000,2025-01-01,2025,1,1,47005,[],()
73018,45567,19063,1,$ 50.99,2025-04-27 09:43:57,"87797 Maggio Harbor, North Ursulaville, KY 92002",50.99,50.99,50.99,2025-04-27 09:43:57.000,2025-04-27,2025,4,27,45567,[],()
67299,47290,19030,2,21.99USD,02:52:58 P.M. 2024-11-18,NULL,21.99,21.99,43.98,2024-11-18 14:52:58.000,2024-11-18,2024,11,18,47290,[],()
69559,47248,18875,1,49.00$,"25-July-2024, 19:03:41",,49.0,49.0,49.0,2024-07-25 19:03:41.000,2024-07-25,2024,7,25,47248,[],()
70919,46788,19226,3,USD 22.50,22:46  3-DEC-2024, ,22.5,22.5,67.5,2024-12-03 22:46:00.000,2024-12-03,2024,12,3,46788,[],()
65387,47081,19378,2,USD 17.0,06:31:55 PM;20-AUG-2024,,17.0,17.0,34.0,2024-08-20 18:31:55.000,2024-08-20,2024,8,20,47081,[],()
71503,46511,19438,2,EUR 73.75,08:09;09/19/24,NULL,88.5,88.5,177.0,2024-09-19 08:09:00.000,2024-09-19,2024,9,19,46511,[],()
69754,47168,18989,3,$42.99,"06:23,2025-07-05",,42.99,42.99,128.97,2025-07-05 06:23:00.000,2025-07-05,2025,7,5,47168,[],()
71919,44632,19435,1,€ 69.0,"09:11:32 PM,  8-FEB-2024",,82.8,82.8,82.8,2024-02-08 21:11:32.000,2024-02-08,2024,2,8,44632,[],()
73238,45840,19563,2,69.5$, 1-Oct-2024;11:31:09 AM,"5904 Genevive Views, North Willene, NM 60089",69.5,69.5,139.0,2024-10-01 11:31:09.000,2024-10-01,2024,10,1,45840,[],()
70168,46136,19366,1,USD28.00,2025-03-02T15:28:43,,28.0,28.0,28.0,2025-03-02 15:28:43.000,2025-03-02,2025,3,2,46136,[],()
71352,47326,19258,1,USD71.,03:13; 5-January-2025,,71.0,71.0,71.0,2025-01-05 03:13:00.000,2025-01-05,2025,1,5,47326,[],()
71078,45996,19059,4,USD 51.99,2024-03-19 08:15:13 PM,,51.99,51.99,207.96,2024-03-19 20:15:13.000,2024-03-19,2024,3,19,45996,[],()
72555,46865,19262,2,71.99 USD," 6-May-2024,19:02:02","Apt. 711 80500 Liberty Bridge, Cummeratastad, WY 92479-4778",71.99,71.99,143.98,2024-05-06 19:02:02.000,2024-05-06,2024,5,6,46865,[],()
69367,46311,19308,1,61.75$,12/12/24 06:21:42,,61.75,61.75,61.75,2024-12-12 06:21:42.000,2024-12-12,2024,12,12,46311,[],()
69322,46890,18848,1,€ 17.25,23:45 07/22/24,NULL,20.7,20.7,20.7,2024-07-22 23:45:00.000,2024-07-22,2024,7,22,46890,[],()
71029,47412,19358,2,$ 52.5,30-Dec-2024 19:19,,52.5,52.5,105.0,2024-12-30 19:19:00.000,2024-12-30,2024,12,30,47412,[],()
65006,44814,19205,1,$ 14.,21:30; 3-FEB-2025,NULL,14.0,14.0,14.0,2025-02-03 21:30:00.000,2025-02-03,2025,2,3,44814,[],()
69758,47264,19239,2,$72.00,"24-OCT-2024,15:26",NULL,72.0,72.0,144.0,2024-10-24 15:26:00.000,2024-10-24,2024,10,24,47264,[],()
73477,46343,18991,1,55.5$,"08/22/24, 18:55","98940 Wilton Square, South Sammiefurt, TX 59675-7724",55.5,55.5,55.5,2024-08-22 18:55:00.000,2024-08-22,2024,8,22,46343,[],()
69884,45322,18853,1,EUR 64.25,2024-08-01T17:29:45,,77.1,77.1,77.1,2024-08-01 17:29:45.000,2024-08-01,2024,8,1,45322,[],()
66323,47138,19239,1,70.0 €,"2024-12-27,12:56",NULL,84.0,84.0,84.0,2024-12-27 12:56:00.000,2024-12-27,2024,12,27,47138,[],()
68382,47483,19167,1,$42¢75,2024-10-16T21:14:02.569,NULL,4275.0,4275.0,4275.0,2024-10-16 21:14:02.569,2024-10-16,2024,10,16,47483,[],()
66060,45777,19465,1,$ 45.0,2024-12-14T05:02:06,,45.0,45.0,45.0,2024-12-14 05:02:06.000,2024-12-14,2024,12,14,45777,[],()
63394,46148,19562,1,USD53,2024-09-27T12:27:53,,53.0,53.0,53.0,2024-09-27 12:27:53.000,2024-09-27,2024,9,27,46148,[],()
63954,44432,19134,1,69.50 USD,"2024-09-28, 05:36:53 am","Suite 358 62564 Burl Shore, South Hiediview, NM 34663",69.5,69.5,69.5,2024-09-28 05:36:53.000,2024-09-28,2024,9,28,44432,[],()
64468,44575,19025,1,USD 37.99,2025-02-09 21:24:48,,37.99,37.99,37.99,2025-02-09 21:24:48.000,2025-02-09,2025,2,9,44575,[],()
73638,45360,19315,1,USD 62.0,2024-09-23T00:16:16.301,NULL,62.0,62.0,62.0,2024-09-23 00:16:16.301,2024-09-23,2024,9,23,45360,[],()
71838,45904,18860,1,49.5USD,12:18:26 2025-05-09,,49.5,49.5,49.5,2025-05-09 12:18:26.000,2025-05-09,2025,5,9,45904,[],()
64474,46611,19216,1,67.5 €,"04:50:10 am, 2024-12-11",,81.0,81.0,81.0,2024-12-11 04:50:10.000,2024-12-11,2024,12,11,45365,[],()
65901,46385,19481,5,$68,23-Mar-2024 17:08,,68.0,68.0,340.0,2024-03-23 17:08:00.000,2024-03-23,2024,3,23,46385,[],()
70157,44956,19356,1,€50.99,"08:42, 2024-11-17","9193 Sheila Knoll, North Wilburnport, KS 10666-7675",61.188,61.188,61.19,2024-11-17 08:42:00.000,2024-11-17,2024,11,17,44956,[],()
70112,45310,19569,1,€ 69.25,16-Aug-2024 03:57:32 pm,"Apt. 379 49052 Kunze Prairie, Bodeshire, KY 30773-2218",83.1,83.1,83.1,2024-08-16 15:57:32.000,2024-08-16,2024,8,16,45310,[],()
66199,44944,19020,2,19.00USD,07:15:41 2024-12-13,,19.0,19.0,38.0,2024-12-13 07:15:41.000,2024-12-13,2024,12,13,44944,[],()
67477,46670,19589,1,EUR57,"14:57,06/26/24",,68.39999999999999,68.39999999999999,68.4,2024-06-26 14:57:00.000,2024-06-26,2024,6,26,46670,[],()
63354,46167,19356,1,EUR 54.0,14:53:22 10/26/24,NULL,64.8,64.8,64.8,2024-10-26 14:53:22.000,2024-10-26,2024,10,26,46167,[],()
73021,47236,18944,1,$17¢00,"20:58:01, 02/16/25",,1700.0,1700.0,1700.0,2025-02-16 20:58:01.000,2025-02-16,2025,2,16,47236,[],()
63624,44876,19533,1,47.99 $,2025-02-09T08:39:42.415,,47.99,47.99,47.99,2025-02-09 08:39:42.415,2025-02-09,2025,2,9,44876,[],()
65951,45062,19005,1,USD 37.5,"2024-10-17, 22:11",,37.5,37.5,37.5,2024-10-17 22:11:00.000,2024-10-17,2024,10,17,46955,[],()
66602,46069,19021,1,33.00$,"11/25/24, 12:41:37 PM",NULL,33.0,33.0,33.0,2024-11-25 12:41:37.000,2024-11-25,2024,11,25,46069,[],()
73166,47590,19014,1,EUR18.99,"11/14/24,18:02:26",NULL,22.787999999999997,22.787999999999997,22.79,2024-11-14 18:02:26.000,2024-11-14,2024,11,14,47590,[],()
69478,45704,19353,2,12.99EUR,17:45;15-JUN-2025,,15.588,15.588,31.18,2025-06-15 17:45:00.000,2025-06-15,2025,6,15,45704,[],()
72280,47365,19123,1,48$,2025-04-01T09:55:34,NULL,48.0,48.0,48.0,2025-04-01 09:55:34.000,2025-04-01,2025,4,1,47365,[],()
66043,44770,19064,3,USD59.0,2025-07-11T05:33:08.654, ,59.0,59.0,177.0,2025-07-11 05:33:08.654,2025-07-11,2025,7,11,44770,[],()
64467,46085,18843,4,$18¢50,"18:55:07, 31-Oct-2024",NULL,1850.0,1850.0,7400.0,2024-10-31 18:55:07.000,2024-10-31,2024,10,31,46085,[],()
63554,47136,19377,1,EUR49.00,"12/15/24, 02:07:44 pm",,58.8,58.8,58.8,2024-12-15 14:07:44.000,2024-12-15,2024,12,15,47136,[],()
63446,44407,19022,2,65.00 USD,10/22/24 08:13,"704 O'Kon Islands, South Jamey, VA 04309-4326",65.0,65.0,130.0,2024-10-22 08:13:00.000,2024-10-22,2024,10,22,44407,[],()
69620,46202,19020,1,19$,2024-11-23T11:16:52,NULL,19.0,19.0,19.0,2024-11-23 11:16:52.000,2024-11-23,2024,11,23,46202,[],()
67745,44451,19102,1,USD 63,2024-11-04T14:44:16.799,NULL,63.0,63.0,63.0,2024-11-04 14:44:16.799,2024-11-04,2024,11,4,44451,[],()
69004,46720,19015,1,63.5USD,09:56:11 PM;2024-08-27,,63.5,63.5,63.5,2024-08-27 21:56:11.000,2024-08-27,2024,8,27,46720,[],()
64828,47049,18909,1,USD25.00,20:43;2024-11-19,,25.0,25.0,25.0,2024-11-19 20:43:00.000,2024-11-19,2024,11,19,47049,[],()
68977,44871,19152,3,32.75 $,"17:20:59,09/21/24","9767 Gusikowski Via, Mariannburgh, UT 30830-9999",32.75,32.75,98.25,2024-09-21 17:20:59.000,2024-09-21,2024,9,21,44871,[],()
70706,46411,19370,1,$ 18.75,2025-02-09T06:33:37,NULL,18.75,18.75,18.75,2025-02-09 06:33:37.000,2025-02-09,2025,2,9,46411,[],()
72019,45801,18977,2,$33¢50,"12:05, 2025-04-16","534 Louis Park, Erinfurt, AZ 30515",3350.0,3350.0,6700.0,2025-04-16 12:05:00.000,2025-04-16,2025,4,16,45801,[],()
64830,47081,19133,1,$26¢25,2024-09-08 06:33,,2625.0,2625.0,2625.0,2024-09-08 06:33:00.000,2024-09-08,2024,9,8,47081,[],()
71707,44765,19105,1,37.99 $,2025-02-07T13:47:04,,37.99,37.99,37.99,2025-02-07 13:47:04.000,2025-02-07,2025,2,7,44765,[],()
71158,46076,19113,3,$71.0, 2-January-2025 13:10:39,"2199 Schultz Shoals, Emelinaburgh, UT 07223-4075",71.0,71.0,213.0,2025-01-02 13:10:39.000,2025-01-02,2025,1,2,46076,[],()
69873,44960,19351,1,$ 29.00,2024-10-22T10:36:10,,29.0,29.0,29.0,2024-10-22 10:36:10.000,2024-10-22,2024,10,22,44960,[],()
66647,46569,19171,1,38.00 USD,"10-JUL-2025, 09:15:08 PM",NULL,38.0,38.0,38.0,2025-07-10 21:15:08.000,2025-07-10,2025,7,10,46569,[],()
71983,47469,19242,1,48.50 USD,"00:33,02/03/25",,48.5,48.5,48.5,2025-02-03 00:33:00.000,2025-02-03,2025,2,3,47469,[],()
63531,46647,19544,1,36$25¢,"12/16/24, 20:31:37",,3625.0,3625.0,3625.0,2024-12-16 20:31:37.000,2024-12-16,2024,12,16,46647,[],()
67400,46391,19388,1,$57.25,13:51;04/15/24,NULL,57.25,57.25,57.25,2024-04-15 13:51:00.000,2024-04-15,2024,4,15,46391,[],()
73960,47609,19046,3,24.5$,"22:45, 2024-06-04",,24.5,24.5,73.5,2024-06-04 22:45:00.000,2024-06-04,2024,6,4,47609,[],()
70916,46204,19248,1,$55.,"01:28:59 PM, 24-January-2025",,55.0,55.0,55.0,2025-01-24 13:28:59.000,2025-01-24,2025,1,24,46204,[],()
68373,45383,19145,1,$ 70.75," 3-Oct-2024,03:20","Apt. 265 68237 Keith Harbor, Port Shannon, MI 05606-6953",70.75,70.75,70.75,2024-10-03 03:20:00.000,2024-10-03,2024,10,3,45383,[],()
71981,46663,19083,2,46.0 $,12:06:07 2025-01-31,"Apt. 844 10040 Jc Road, Port Geraldofurt, VA 82204-2647",46.0,46.0,92.0,2025-01-31 12:06:07.000,2025-01-31,2025,1,31,46663,[],()
64460,46077,19225,1,66.00USD,"19-February-2025,02:45:03 AM",NULL,66.0,66.0,66.0,2025-02-19 02:45:03.000,2025-02-19,2025,2,19,46077,[],()
68477,45497,18973,1,55.5 $,11/13/24;04:55:47,NULL,55.5,55.5,55.5,2024-11-13 04:55:47.000,2024-11-13,2024,11,13,45497,[],()
71969,47596,19495,1,29.50USD,"2025-06-05, 16:47:48",NULL,29.5,29.5,29.5,2025-06-05 16:47:48.000,2025-06-05,2025,6,5,47596,[],()
72634,46304,19468,3,USD 40,"2025-02-04,07:59:16",,40.0,40.0,120.0,2025-02-04 07:59:16.000,2025-02-04,2025,2,4,46304,[],()
66786,47177,19110,1,USD59.50,2024-09-04T19:57:24.019,,59.5,59.5,59.5,2024-09-04 19:57:24.019,2024-09-04,2024,9,4,47177,[],()
64364,47004,19321,2,45.5$,"16:18,12/22/24",,45.5,45.5,91.0,2024-12-22 16:18:00.000,2024-12-22,2024,12,22,47004,[],()
64688,47056,18920,2,€39.25,2024-11-23T22:59:24.700,NULL,47.1,47.1,94.2,2024-11-23 22:59:24.700,2024-11-23,2024,11,23,47056,[],()
66185,47159,18897,1,$54.75,02:03:50 pm 25-October-2024,NULL,54.75,54.75,54.75,2024-10-25 14:03:50.000,2024-10-25,2024,10,25,45146,[],()
66152,46955,18917,2,$71¢99,09/06/24;10:04:57,"Apt. 245 5042 Annette Islands, South Andreville, AZ 43566",7199.0,7199.0,14398.0,2024-09-06 10:04:57.000,2024-09-06,2024,9,6,46955,[],()
63095,44809,19111,1,€30.25,"06:44:28 am, 04/28/25",,36.3,36.3,36.3,2025-04-28 06:44:28.000,2025-04-28,2025,4,28,44809,[],()
64054,45529,18963,1,56.50€,Tue Mar 25 07:20:10 2025,"717 Dewey Manor, West Loria, CO 30826-9944",67.8,67.8,67.8,2025-03-25 07:20:10.000,2025-03-25,2025,3,25,45529,[],()
72669,46161,19118,1,USD72.75,03:05;06/19/24,,72.75,72.75,72.75,2024-06-19 03:05:00.000,2024-06-19,2024,6,19,46711,[],()
69760,47338,19155,1,52.25$,2024-10-09 04:37:30,"958 Zulauf Lodge, Izolaburgh, ME 53005-8321",52.25,52.25,52.25,2024-10-09 04:37:30.000,2024-10-09,2024,10,9,47338,[],()
68978,44961,19135,1,$52¢75,07:54:06 AM;05/08/25,,5275.0,5275.0,5275.0,2025-05-08 07:54:06.000,2025-05-08,2025,5,8,44961,[],()
68498,47256,19206,1,29.50EUR,09:42:24 P.M. 2025-03-24,,35.4,35.4,35.4,2025-03-24 21:42:24.000,2025-03-24,2025,3,24,47256,[],()
69685,45668,19088,1,39.5 EUR,"2024-07-07, 12:56:20 AM",NULL,47.4,47.4,47.4,2024-07-07 00:56:20.000,2024-07-07,2024,7,7,45668,[],()
65363,45814,18938,1,USD 45.0,"22:53:55,22-June-2024","1039 Caroll Mountain, Pacochaborough, OR 59716",45.0,45.0,45.0,2024-06-22 22:53:55.000,2024-06-22,2024,6,22,45814,[],()
65429,45532,18986,1,61.25USD,"16:27:36,2025-02-23",,61.25,61.25,61.25,2025-02-23 16:27:36.000,2025-02-23,2025,2,23,45532,[],()
68697,44873,19019,1,$ 12.00,02/08/25;12:28:46,"Apt. 576 12277 Orn Vista, North Rocky, IL 11370",12.0,12.0,12.0,2025-02-08 12:28:46.000,2025-02-08,2025,2,8,44873,[],()
69362,47603,19081,1,$ 14.99,"02:22:46, 2024-12-30","587 Howe Underpass, Port Jacalyn, KS 99399-1384",14.99,14.99,14.99,2024-12-30 02:22:46.000,2024-12-30,2024,12,30,47603,[],()
73410,45400,18923,2,28.99$,19:41:11;14-OCT-2024,,28.99,28.99,57.98,2024-10-14 19:41:11.000,2024-10-14,2024,10,14,45400,[],()
66901,45674,19270,1,€22.0,29-March-2025 02:06,"99047 Veum Stream, Lake Freemanburgh, ND 89022-6695",26.4,26.4,26.4,2025-03-29 02:06:00.000,2025-03-29,2025,3,29,45674,[],()
68329,45889,19261,1,70.99 USD,26-Feb-2024;02:29:41 P.M.,,70.99,70.99,70.99,2024-02-26 14:29:41.000,2024-02-26,2024,2,26,45889,[],()
65944,47219,19097,1,$66.50, 9-Mar-2025 12:10,,66.5,66.5,66.5,2025-03-09 12:10:00.000,2025-03-09,2025,3,9,47219,[],()
63458,44733,19445,1,$ 58.25,"02:37, 17-Dec-2024","374 Parker Prairie, West Destinyshire, OR 37793-0986",58.25,58.25,58.25,2024-12-17 02:37:00.000,2024-12-17,2024,12,17,44733,[],()
70670,44739,19383,1,63.99 USD,16-Dec-2024;14:59,,63.99,63.99,63.99,2024-12-16 14:59:00.000,2024-12-16,2024,12,16,44739,[],()
73355,47054,19566,1,20.50 USD,09/29/24 05:29,,20.5,20.5,20.5,2024-09-29 05:29:00.000,2024-09-29,2024,9,29,47054,[],()
66430,47007,19545,1,45$00¢,03/20/25;22:24:03,"Apt. 987 936 Parisian Via, Kathyrnton, FL 82582",4500.0,4500.0,4500.0,2025-03-20 22:24:03.000,2025-03-20,2025,3,20,47007,[],()
70371,45090,19272,2,48.75 $,2024-12-05 14:59,,48.75,48.75,97.5,2024-12-05 14:59:00.000,2024-12-05,2024,12,5,45090,[],()
68533,47047,19556,3,€31¢00,"22:11, 2025-05-15",,3720.0,3720.0,11160.0,2025-05-15 22:11:00.000,2025-05-15,2025,5,15,47047,[],()
67810,45076,19273,1,$ 42.25,2025-05-29;05:05:22 AM,,42.25,42.25,42.25,2025-05-29 05:05:22.000,2025-05-29,2025,5,29,45076,[],()
72076,47607,19261,1,65.5USD,17:02:11 30-Jan-2025, ,65.5,65.5,65.5,2025-01-30 17:02:11.000,2025-01-30,2025,1,30,47607,[],()
64681,47396,19134,5,67.$,"11:16, 04/05/25","Suite 102 38460 Monet Crescent, Hansenberg, OK 87514",67.0,67.0,335.0,2025-04-05 11:16:00.000,2025-04-05,2025,4,5,47396,[],()
64190,46793,19250,1,$ 32.0,2024-08-01T22:45:31,"85673 Yer Flat, Patrickmouth, AZ 10432",32.0,32.0,32.0,2024-08-01 22:45:31.000,2024-08-01,2024,8,1,46793,[],()
63514,47475,18849,4,EUR31.50,07:23:23 P.M. 22-FEB-2025,,37.8,37.8,151.2,2025-02-22 19:23:23.000,2025-02-22,2025,2,22,47475,[],()
64997,46302,19148,1,USD41.0,"2025-03-06,14:40:56",,41.0,41.0,41.0,2025-03-06 14:40:56.000,2025-03-06,2025,3,6,46302,[],()
68370,46070,19245,1,67.5 USD,11:22:12 am  5-March-2025,NULL,67.5,67.5,67.5,2025-03-05 11:22:12.000,2025-03-05,2025,3,5,46070,[],()
70127,45904,19229,1,USD 19.50,2025-03-18T11:21:54.654,,19.5,19.5,19.5,2025-03-18 11:21:54.654,2025-03-18,2025,3,18,45904,[],()
71702,46866,18988,5,$59¢00,2025-03-29;06:26:30 AM,"Suite 333 5339 Greenfelder Junctions, Danetown, UT 12504",5900.0,5900.0,29500.0,2025-03-29 06:26:30.000,2025-03-29,2025,3,29,46866,[],()
72579,45896,19447,2,EUR24.25,"10/30/24, 18:22:30",,29.099999999999998,29.099999999999998,58.2,2024-10-30 18:22:30.000,2024-10-30,2024,10,30,45896,[],()
70472,45372,19165,1,31.50$,"06/15/24,01:38:17",,31.5,31.5,31.5,2024-06-15 01:38:17.000,2024-06-15,2024,6,15,45372,[],()
65408,44410,19022,3,USD68.5,08:30 2024-11-24,NULL,68.5,68.5,205.5,2024-11-24 08:30:00.000,2024-11-24,2024,11,24,44410,[],()
63703,44829,19063,1,$ 51.0,12-Dec-2024;22:02:02,"Apt. 621 74688 Gislason Fort, Cliffordmouth, MO 13471",51.0,51.0,51.0,2024-12-12 22:02:02.000,2024-12-12,2024,12,12,44829,[],()
73087,45878,19412,1,$ 31.0,"25-January-2025,17:33",NULL,31.0,31.0,31.0,2025-01-25 17:33:00.000,2025-01-25,2025,1,25,45878,[],()
65768,47243,19109,2,USD39.75,"07/28/24,12:50:52 PM","55140 Lorenza Vista, West Consuela, IA 53416",39.75,39.75,79.5,2024-07-28 12:50:52.000,2024-07-28,2024,7,28,47243,[],()
73511,46968,19351,2,$26¢50,2025-07-25;12:39:02,,2650.0,2650.0,5300.0,2025-07-25 12:39:02.000,2025-07-25,2025,7,25,46968,[],()
70465,45593,18851,1,59.50$,2024-10-14T07:21:54.280,,59.5,59.5,59.5,2024-10-14 07:21:54.280,2024-10-14,2024,10,14,45593,[],()
70421,47585,19125,1,€ 14.75,17:42  5-Aug-2025,,17.7,17.7,17.7,2025-08-05 17:42:00.000,2025-08-05,2025,8,5,47585,[],()
66704,44421,19038,1,$59¢99,"11:19:11 A.M.,  5-Oct-2024",,5999.0,5999.0,5999.0,2024-10-05 11:19:11.000,2024-10-05,2024,10,5,45627,[],()
73529,45414,18993,1,USD66.00,02/09/25 23:03,"Apt. 528 11358 Minna Islands, Vandervortmouth, ID 92098-6314",66.0,66.0,66.0,2025-02-09 23:03:00.000,2025-02-09,2025,2,9,45414,[],()
73059,45028,19106,4,USD 48.0,09:34:48 P.M.;2024-05-21,NULL,48.0,48.0,192.0,2024-05-21 21:34:48.000,2024-05-21,2024,5,21,44738,[],()
64894,47288,19376,1,EUR 46.5,"05:36:29,  8-December-2024",,55.8,55.8,55.8,2024-12-08 05:36:29.000,2024-12-08,2024,12,8,47288,[],()
73184,46044,18965,4,64$,11:00:35 A.M.  2-August-2024,NULL,64.0,64.0,256.0,2024-08-02 11:00:35.000,2024-08-02,2024,8,2,46044,[],()
69710,45308,19413,1,€33.75,"14:27, 2025-02-21","245 Corwin Ranch, Rippinchester, CT 94004-0403",40.5,40.5,40.5,2025-02-21 14:27:00.000,2025-02-21,2025,2,21,45308,[],()
63044,46385,19570,1,€ 47.,"27-APR-2025, 13:27:28",,56.4,56.4,56.4,2025-04-27 13:27:28.000,2025-04-27,2025,4,27,46385,[],()
67285,46396,19185,1,USD 56.50,07:41;20-December-2024,,56.5,56.5,56.5,2024-12-20 07:41:00.000,2024-12-20,2024,12,20,46396,[],()
73140,46605,18935,1,USD 61.50, 8-APR-2025 05:09:59 am,,61.5,61.5,61.5,2025-04-08 05:09:59.000,2025-04-08,2025,4,8,46605,[],()
67515,46602,19372,1,USD 63.50,2024-05-12;13:55,,63.5,63.5,63.5,2024-05-12 13:55:00.000,2024-05-12,2024,5,12,46602,[],()
73459,46550,19092,5,USD 47.0,"00:39,2024-09-08",,47.0,47.0,235.0,2024-09-08 00:39:00.000,2024-09-08,2024,9,8,46550,[],()
66493,45002,19105,1,$37.00,23:19:12; 6-DEC-2024,,37.0,37.0,37.0,2024-12-06 23:19:12.000,2024-12-06,2024,12,6,45002,[],()
71867,47611,19197,3,$ 42.75,"27-November-2024, 05:42:01 A.M.",NULL,42.75,42.75,128.25,2024-11-27 05:42:01.000,2024-11-27,2024,11,27,47611,[],()
71250,44731,19077,1,41.00$,2024-04-23T01:04:58,"18081 Nader Extensions, Nienowborough, UT 42531",41.0,41.0,41.0,2024-04-23 01:04:58.000,2024-04-23,2024,4,23,44731,[],()
72007,46880,19221,1,54$,22:08:19 01/10/25,,54.0,54.0,54.0,2025-01-10 22:08:19.000,2025-01-10,2025,1,10,46880,[],()
68521,46357,19510,2,19. $,06:27:29 am 2025-01-07,,19.0,19.0,38.0,2025-01-07 06:27:29.000,2025-01-07,2025,1,7,46357,[],()
71706,45816,19216,1,USD 65.00,"07:08,02/17/25","984 Schmitt Shores, Lake Lidiaville, TN 25807-2437",65.0,65.0,65.0,2025-02-17 07:08:00.000,2025-02-17,2025,2,17,45816,[],()
68614,46478,19141,1,$52¢00,2024-11-06T01:26:54.362,NULL,5200.0,5200.0,5200.0,2024-11-06 01:26:54.362,2024-11-06,2024,11,6,46478,[],()
64664,45475,19288,1,52.0 $,10:46:56 P.M. 2025-02-03,NULL,52.0,52.0,52.0,2025-02-03 22:46:56.000,2025-02-03,2025,2,3,45475,[],()
70326,47536,19347,1,$21.00,04:21:41 2025-01-06,,21.0,21.0,21.0,2025-01-06 04:21:41.000,2025-01-06,2025,1,6,47536,[],()
65670,47473,19312,1,USD 72,19-Jul-2024;06:37:14 am,,72.0,72.0,72.0,2024-07-19 06:37:14.000,2024-07-19,2024,7,19,47473,[],()
69551,46420,19572,1,19€,2025-05-05T01:25:01,NULL,22.8,22.8,22.8,2025-05-05 01:25:01.000,2025-05-05,2025,5,5,46420,[],()
66159,44811,19079,1,€24¢00,"09:14:34 P.M.,07/17/24",NULL,2880.0,2880.0,2880.0,2024-07-17 21:14:34.000,2024-07-17,2024,7,17,44811,[],()
67702,45329,19184,1,20.0 EUR,"23:40:52, 04/11/25",NULL,24.0,24.0,24.0,2025-04-11 23:40:52.000,2025-04-11,2025,4,11,45329,[],()
69320,45675,19089,1,49. EUR," 2-Jun-2024, 08:34:16 P.M.",,58.8,58.8,58.8,2024-06-02 20:34:16.000,2024-06-02,2024,6,2,44398,[],()
72278,45054,19292,1,49.75 USD,06:31;2025-08-08,NULL,49.75,49.75,49.75,2025-08-08 06:31:00.000,2025-08-08,2025,8,8,45054,[],()
69999,47294,18882,1,USD 45.00,01:19:13 PM;07/28/24,,45.0,45.0,45.0,2024-07-28 13:19:13.000,2024-07-28,2024,7,28,47294,[],()
71533,46506,19087,2,57.5 EUR,"09:38:01 PM,29-May-2025",,69.0,69.0,138.0,2025-05-29 21:38:01.000,2025-05-29,2025,5,29,46506,[],()
71087,45143,19300,1,76.25EUR,"27-Jun-2024, 06:51",,91.5,91.5,91.5,2024-06-27 06:51:00.000,2024-06-27,2024,6,27,45143,[],()
71003,45330,19498,3,52.00EUR,"20:24, 2025-02-18","3708 Schamberger Lodge, Streichstad, MD 05843-7086",62.4,62.4,187.2,2025-02-18 20:24:00.000,2025-02-18,2025,2,18,45330,[],()
72061,45095,19499,1,EUR27.5,07/06/25;09:26:47 P.M.,,33.0,33.0,33.0,2025-07-06 21:26:47.000,2025-07-06,2025,7,6,45095,[],()
71017,46302,19091,2,24.00$,2024-05-12 20:28:30,NULL,24.0,24.0,48.0,2024-05-12 20:28:30.000,2024-05-12,2024,5,12,46302,[],()
69456,44482,19337,2,EUR 66.75,2025-03-12T05:20:36,"Suite 387 15722 Powlowski Rue, East Robertachester, OR 75085",80.1,80.1,160.2,2025-03-12 05:20:36.000,2025-03-12,2025,3,12,44482,[],()
71551,47091,19053,1,55USD,"06/06/25,12:01:32 A.M.",NULL,55.0,55.0,55.0,2025-06-06 00:01:32.000,2025-06-06,2025,6,6,47091,[],()
68316,45778,19004,3,USD 70.0,"11:25:32 am, 06/11/24",NULL,70.0,70.0,210.0,2024-06-11 11:25:32.000,2024-06-11,2024,6,11,45778,[],()
70005,46454,19132,1,68.50USD,"16:54:34,2025-01-05","Suite 159 5513 Leffler Walk, Kovacekfort, WY 93132",68.5,68.5,68.5,2025-01-05 16:54:34.000,2025-01-05,2025,1,5,45702,[],()
70199,45796,19236,1,USD65.0,2024-10-15 08:32:34 PM,,65.0,65.0,65.0,2024-10-15 20:32:34.000,2024-10-15,2024,10,15,45796,[],()
68931,45576,19012,3,$ 47.0,"2024-04-29, 09:33",,47.0,47.0,141.0,2024-04-29 09:33:00.000,2024-04-29,2024,4,29,45576,[],()
67666,44724,19120,1,€64¢99,01:19:25 A.M. 08/09/24,,7798.799999999999,7798.799999999999,7798.8,2024-08-09 01:19:25.000,2024-08-09,2024,8,9,44724,[],()
62970,47611,18908,1,€46¢25,"11/26/24, 03:33:58 P.M.",,5550.0,5550.0,5550.0,2024-11-26 15:33:58.000,2024-11-26,2024,11,26,47611,[],()
71404,46933,19038,1,60$50¢,16:39:28;15-September-2024,,6050.0,6050.0,6050.0,2024-09-15 16:39:28.000,2024-09-15,2024,9,15,46933,[],()
70220,44708,19495,1,32.75 $,"07:17:34 AM,2024-08-24","896 Suzette Fort, East Doria, MI 13785",32.75,32.75,32.75,2024-08-24 07:17:34.000,2024-08-24,2024,8,24,44708,[],()
65538,47247,18856,1,47.75USD,22:07 11-Aug-2024,,47.75,47.75,47.75,2024-08-11 22:07:00.000,2024-08-11,2024,8,11,47015,[],()
73717,44400,18940,1,$ 16.5,18:18;2025-02-10,,16.5,16.5,16.5,2025-02-10 18:18:00.000,2025-02-10,2025,2,10,44400,[],()
71461,45558,19045,1,43.50 $,21:38:03 2024-11-21,"Suite 600 792 Kozey Run, East Michealhaven, MD 59075-5533",43.5,43.5,43.5,2024-11-21 21:38:03.000,2024-11-21,2024,11,21,45558,[],()
72680,46529,19031,1,$22.00,2024-09-18T10:29:22,,22.0,22.0,22.0,2024-09-18 10:29:22.000,2024-09-18,2024,9,18,46529,[],()
67704,46658,19365,2,62.5€,23-AUG-2024;19:58:08,,75.0,75.0,150.0,2024-08-23 19:58:08.000,2024-08-23,2024,8,23,46658,[],()
67369,45647,19415,2,€ 14.0,"2024-08-02,08:55:04 P.M.",NULL,16.8,16.8,33.6,2024-08-02 20:55:04.000,2024-08-02,2024,8,2,45647,[],()
70966,47189,19278,1,$39.99,2024-12-17T19:46:02,,39.99,39.99,39.99,2024-12-17 19:46:02.000,2024-12-17,2024,12,17,47189,[],()
69969,47318,19256,1,$ 64.50,"2024-09-21,09:19:18 P.M.","7156 Jason Walks, Christopherland, NV 36927-6340",64.5,64.5,64.5,2024-09-21 21:19:18.000,2024-09-21,2024,9,21,47318,[],()
70539,47399,19287,1,€ 34.50,20:08:21  3-October-2024,"Apt. 523 78219 Simon Branch, North Elinore, SC 27160-5086",41.4,41.4,41.4,2024-10-03 20:08:21.000,2024-10-03,2024,10,3,47399,[],()
72963,47451,19216,1,€ 62.00,"05/10/24, 07:12:03",NULL,74.39999999999999,74.39999999999999,74.4,2024-05-10 07:12:03.000,2024-05-10,2024,5,10,46068,[],()
63139,46934,18939,3,56. $,"27-OCT-2024, 01:47",,56.0,56.0,168.0,2024-10-27 01:47:00.000,2024-10-27,2024,10,27,46934,[],()
72922,45315,19392,1,$ 49.99,04:50  5-Oct-2024,"Apt. 819 452 Bayer Parkways, East Elina, FL 89405-9039",49.99,49.99,49.99,2024-10-05 04:50:00.000,2024-10-05,2024,10,5,45315,[],()
71259,46640,19242,1,$50¢00,Sun Jun  9 19:08:33 2024,,5000.0,5000.0,5000.0,2024-06-09 19:08:33.000,2024-06-09,2024,6,9,46640,[],()
72857,45358,19051,1,€72.00,18:17:00;30-January-2025,NULL,86.39999999999999,86.39999999999999,86.4,2025-01-30 18:17:00.000,2025-01-30,2025,1,30,45358,[],()
70878,45159,19110,1,EUR58.75,02/12/25;09:30:43 A.M.,,70.5,70.5,70.5,2025-02-12 09:30:43.000,2025-02-12,2025,2,12,45159,[],()
63509,44499,19399,1,15.25 €,2025-01-12;05:55:07,,18.3,18.3,18.3,2025-01-12 05:55:07.000,2025-01-12,2025,1,12,44499,[],()
71654,46861,18861,2,38.00USD,11:45 30-Apr-2025,"Suite 537 5066 Bauch Summit, Port Clark, NJ 65206",38.0,38.0,76.0,2025-04-30 11:45:00.000,2025-04-30,2025,4,30,46861,[],()
69770,47249,19410,1,47.50 EUR,04:04;07/29/24,,57.0,57.0,57.0,2024-07-29 04:04:00.000,2024-07-29,2024,7,29,46700,[],()
71689,45342,19546,4,47.25 €,08:36:27;06/27/25,"3356 Mitsuko Plaza, Lake Cassibury, RI 49171",56.699999999999996,56.699999999999996,226.8,2025-06-27 08:36:27.000,2025-06-27,2025,6,27,45342,[],()
65653,44685,19089,1,47.75 $, 8-March-2024;11:45:25,"Apt. 117 1124 Lowe Mall, Theoport, MT 42371-1495",47.75,47.75,47.75,2024-03-08 11:45:25.000,2024-03-08,2024,3,8,44685,[],()
70667,45956,19210,2,$ 40.50,"10:00:45 PM, 08/30/24","90838 Cordia Orchard, South Emile, MT 88379",40.5,40.5,81.0,2024-08-30 22:00:45.000,2024-08-30,2024,8,30,45956,[],()
73403,46136,19399,1,20.25EUR,"18:58:39,14-April-2025",,24.3,24.3,24.3,2025-04-14 18:58:39.000,2025-04-14,2025,4,14,46136,[],()
66597,46603,19244,1,EUR48.75,2024-12-31 03:50,,58.5,58.5,58.5,2024-12-31 03:50:00.000,2024-12-31,2024,12,31,46603,[],()
73912,46616,19417,1,€25.5,"21:39, 05/24/24",,30.599999999999998,30.599999999999998,30.6,2024-05-24 21:39:00.000,2024-05-24,2024,5,24,46616,[],()
70628,46081,18979,1,€ 69.25,2025-03-20;00:44:50,,83.1,83.1,83.1,2025-03-20 00:44:50.000,2025-03-20,2025,3,20,46081,[],()
63374,44632,19102,1,€65.50,25-Mar-2025;22:25:14,NULL,78.6,78.6,78.6,2025-03-25 22:25:14.000,2025-03-25,2025,3,25,44632,[],()
64200,44560,18848,1,21.00 $,2024-11-12T06:11:56,"Apt. 973 6559 Dare Centers, Hoegerhaven, ME 53034-7047",21.0,21.0,21.0,2024-11-12 06:11:56.000,2024-11-12,2024,11,12,47000,[],()
69550,44717,19513,4,€ 26.50,"08/18/24, 02:53:53",,31.799999999999997,31.799999999999997,127.2,2024-08-18 02:53:53.000,2024-08-18,2024,8,18,44717,[],()
68773,45508,19525,1,EUR62.99,10/29/24 08:01,,75.588,75.588,75.59,2024-10-29 08:01:00.000,2024-10-29,2024,10,29,45508,[],()
69917,44340,19100,1,17.75 €,08:18:31 AM;24-Aug-2024,"Apt. 796 73165 Ankunding Roads, Ezekielfurt, PA 89948",21.3,21.3,21.3,2024-08-24 08:18:31.000,2024-08-24,2024,8,24,44340,[],()
67311,46997,19045,1,44.75 EUR,"2025-08-19,02:06:11 A.M.",,53.699999999999996,53.699999999999996,53.7,2025-08-19 02:06:11.000,2025-08-19,2025,8,19,46908,[],()
64861,44770,19470,4,$57.50,2024-06-06T11:38:50.421,,57.5,57.5,230.0,2024-06-06 11:38:50.421,2024-06-06,2024,6,6,44770,[],()
66270,45777,19232,1,$ 32.99,2025-05-16T08:19:38.467,,32.99,32.99,32.99,2025-05-16 08:19:38.467,2025-05-16,2025,5,16,45777,[],()
67569,46965,19134,1,66.USD,2024-09-28;23:36,,66.0,66.0,66.0,2024-09-28 23:36:00.000,2024-09-28,2024,9,28,46538,[],()
64395,44445,19213,1,USD 31.00,"04/09/25, 23:03",NULL,31.0,31.0,31.0,2025-04-09 23:03:00.000,2025-04-09,2025,4,9,44445,[],()
64093,45226,19454,1,69.99USD,"23:59:48, 30-October-2024",NULL,69.99,69.99,69.99,2024-10-30 23:59:48.000,2024-10-30,2024,10,30,45226,[],()
68796,47618,19292,1,49.00USD,05:01 2025-07-15,NULL,49.0,49.0,49.0,2025-07-15 05:01:00.000,2025-07-15,2025,7,15,47618,[],()
68540,46862,19535,2,64.75 $,"24-Jul-2024, 04:28:34 A.M.","Suite 273 500 Fahey Mountains, Thielview, NC 93489",64.75,64.75,129.5,2024-07-24 04:28:34.000,2024-07-24,2024,7,24,46862,[],()
67107,47306,19228,1,68.5 EUR,08:16:33 27-NOV-2024,,82.2,82.2,82.2,2024-11-27 08:16:33.000,2024-11-27,2024,11,27,47306,[],()
66148,45703,19192,1,$58.50,12/09/24;04:56,,58.5,58.5,58.5,2024-12-09 04:56:00.000,2024-12-09,2024,12,9,45703,[],()
65298,44411,19338,2,USD69.00,21:45:33;01/18/25,NULL,69.0,69.0,138.0,2025-01-18 21:45:33.000,2025-01-18,2025,1,18,44411,[],()
66814,44905,19115,1,$ 55.75,10/08/24;11:18:20 PM,,55.75,55.75,55.75,2024-10-08 23:18:20.000,2024-10-08,2024,10,8,44905,[],()
71337,46334,19374,1,EUR17.5,"01/24/25, 12:42:28",,21.0,21.0,21.0,2025-01-24 12:42:28.000,2025-01-24,2025,1,24,46334,[],()
67998,46565,19160,1,$ 70.0,"10:53:26 am, 08/14/24",,70.0,70.0,70.0,2024-08-14 10:53:26.000,2024-08-14,2024,8,14,46565,[],()
68059,46109,19521,1,18€00¢,2025-04-25;09:23,,2160.0,2160.0,2160.0,2025-04-25 09:23:00.000,2025-04-25,2025,4,25,46109,[],()
66536,45787,19029,1,€67¢25,"2025-01-17,19:13:34",,8070.0,8070.0,8070.0,2025-01-17 19:13:34.000,2025-01-17,2025,1,17,45787,[],()
68830,47557,19201,1,$37.75,08:39:21 am 2025-06-18,,37.75,37.75,37.75,2025-06-18 08:39:21.000,2025-06-18,2025,6,18,47557,[],()
66271,47378,19490,1,52.99USD,28.04.2025 15:16:16,,52.99,52.99,52.99,2025-04-28 15:16:16.000,2025-04-28,2025,4,28,47378,[],()
63043,45411,18883,1,$ 22.99,09:25 2024-11-28,,22.99,22.99,22.99,2024-11-28 09:25:00.000,2024-11-28,2024,11,28,45411,[],()
69980,46673,19429,1,69.00 $,2024-10-07T01:46:17,,69.0,69.0,69.0,2024-10-07 01:46:17.000,2024-10-07,2024,10,7,46673,[],()
65570,46944,19305,1,55.75 $,06/30/24 08:36:51 pm,,55.75,55.75,55.75,2024-06-30 20:36:51.000,2024-06-30,2024,6,30,46944,[],()
66973,47479,19257,1,EUR71.0,2024-11-13 05:56:05 pm,"5315 Tonisha Knolls, West Lillianaside, IA 85442-4187",85.2,85.2,85.2,2024-11-13 17:56:05.000,2024-11-13,2024,11,13,47479,[],()
71224,45530,19332,1,39.75USD,"13-July-2024,14:23","Suite 600 147 Waters Expressway, Blandaville, WY 10919-9411",39.75,39.75,39.75,2024-07-13 14:23:00.000,2024-07-13,2024,7,13,45530,[],()
68102,45097,19299,1,USD 29.0,"05:36:08 AM,11-Jul-2025",,29.0,29.0,29.0,2025-07-11 05:36:08.000,2025-07-11,2025,7,11,46036,[],()
70020,46008,19069,2,44.75USD,14:16:29; 5-Jan-2025,NULL,44.75,44.75,89.5,2025-01-05 14:16:29.000,2025-01-05,2025,1,5,46008,[],()
63871,46219,18987,2,63.0$,10:43:08 A.M. 07/11/24,"Apt. 353 287 Grant Lights, Hilllhaven, SD 34439",63.0,63.0,126.0,2024-07-11 10:43:08.000,2024-07-11,2024,7,11,46219,[],()
69938,47125,19546,1,48.50 USD,"2025-02-27, 19:26",,48.5,48.5,48.5,2025-02-27 19:26:00.000,2025-02-27,2025,2,27,47125,[],()
73623,44419,19456,1,€ 31.5,2024-07-19;15:07,,37.8,37.8,37.8,2024-07-19 15:07:00.000,2024-07-19,2024,7,19,44419,[],()
65709,46316,19352,1,$ 33.50,12/25/24 17:59,,33.5,33.5,33.5,2024-12-25 17:59:00.000,2024-12-25,2024,12,25,46797,[],()
72427,47546,19036,1,67.99 €, 1-October-2024;12:14,"Apt. 434 173 Kemmer Common, North Vicente, KS 96400-9928",81.588,81.588,81.59,2024-10-01 12:14:00.000,2024-10-01,2024,10,1,47546,[],()
67245,46765,19410,1,$46.50,"20:32,11/30/24",,46.5,46.5,46.5,2024-11-30 20:32:00.000,2024-11-30,2024,11,30,46765,[],()
69424,46772,19117,1,USD39.25,2024-09-26;07:59:55,"Suite 210 93768 Hunter Lakes, Hiltonview, UT 26940",39.25,39.25,39.25,2024-09-26 07:59:55.000,2024-09-26,2024,9,26,46772,[],()
67552,44872,18961,1,USD 70.5,"23-Aug-2024, 11:09:42","Apt. 822 57376 Jast Crescent, South Deandreland, AL 75021-2859",70.5,70.5,70.5,2024-08-23 11:09:42.000,2024-08-23,2024,8,23,47218,[],()
62743,45301,18897,1,55.99 $,"03:15:20 pm, 14-October-2024","768 Tiffanie Squares, Turnerburgh, TX 25764",55.99,55.99,55.99,2024-10-14 15:15:20.000,2024-10-14,2024,10,14,45301,[],()
67814,45955,19384,2,22€25¢,12.05.2025 22:24:24,"Suite 141 98787 Tenesha Plain, Fishermouth, NV 36046",2670.0,2670.0,5340.0,2025-12-05 22:24:24.000,2025-12-05,2025,12,5,45955,[],()
67840,46894,19391,1,$50.50,2025-02-23 22:26:38,,50.5,50.5,50.5,2025-02-23 22:26:38.000,2025-02-23,2025,2,23,46894,[],()
63337,44593,19463,1,€61.99,2025-01-12 06:41:32 P.M.,,74.388,74.388,74.39,2025-01-12 18:41:32.000,2025-01-12,2025,1,12,44593,[],()
70651,46475,18981,2,69.50EUR,"12:34:53,23-December-2024","Suite 254 794 Katy Stravenue, Harberfort, NE 25072-7989",83.39999999999999,83.39999999999999,166.8,2024-12-23 12:34:53.000,2024-12-23,2024,12,23,46475,[],()
63194,46776,19561,5,24.75$,2025-03-30T03:18:43.684,NULL,24.75,24.75,123.75,2025-03-30 03:18:43.684,2025-03-30,2025,3,30,46776,[],()
63602,46137,19537,4,USD 56.50,2024-11-23 11:32:32 A.M.,,56.5,56.5,226.0,2024-11-23 11:32:32.000,2024-11-23,2024,11,23,46137,[],()
72048,45508,19230,5,59.00 $,12/14/24;11:38:54 P.M.,NULL,59.0,59.0,295.0,2024-12-14 23:38:54.000,2024-12-14,2024,12,14,45508,[],()
68632,45895,19060,3,$63.5,16:57;01/09/25,NULL,63.5,63.5,190.5,2025-01-09 16:57:00.000,2025-01-09,2025,1,9,45895,[],()
64673,46344,18951,1,68.50 €,02:34 2025-02-26,"Apt. 795 937 Hoppe Falls, Krisborough, IL 77348-3667",82.2,82.2,82.2,2025-02-26 02:34:00.000,2025-02-26,2025,2,26,46344,[],()
72036,46865,19555,1,42.75 EUR,06:33:09 pm 24-July-2024,,51.3,51.3,51.3,2024-07-24 18:33:09.000,2024-07-24,2024,7,24,46865,[],()
66131,46785,19285,1,61.0$,"12:23,2024-12-17",,61.0,61.0,61.0,2024-12-17 12:23:00.000,2024-12-17,2024,12,17,46785,[],()
70478,45651,19028,1,EUR62.,2024-07-07 20:47:53,"Suite 943 891 Morgan Loaf, Lake Anitraland, ID 20303-3920",74.39999999999999,74.39999999999999,74.4,2024-07-07 20:47:53.000,2024-07-07,2024,7,7,45651,[],()
71701,46496,19091,1,$25¢75,"21-Nov-2024, 11:57",,2575.0,2575.0,2575.0,2024-11-21 11:57:00.000,2024-11-21,2024,11,21,46496,[],()
65739,45238,19192,5,USD 61.,2024-10-07T19:19:28.911,"Suite 470 2735 Schoen Cliffs, Marceneshire, MD 89714-3447",61.0,61.0,305.0,2024-10-07 19:19:28.911,2024-10-07,2024,10,7,45238,[],()
63960,44877,19365,1,EUR62.,"14-JUN-2024,05:01:47 pm",NULL,74.39999999999999,74.39999999999999,74.4,2024-06-14 17:01:47.000,2024-06-14,2024,6,14,44877,[],()
64925,45013,18923,2,€29.25,2024-12-12 07:59:32 AM,,35.1,35.1,70.2,2024-12-12 07:59:32.000,2024-12-12,2024,12,12,45013,[],()
69802,45484,19312,1,72.99 $,"21:21, 09/05/25",,72.99,72.99,72.99,2025-09-05 21:21:00.000,2025-09-05,2025,9,5,45484,[],()
70546,44904,19433,1,71.0 €,09:56 05/17/24,"975 Roxann Rapid, Bednarton, WV 72616",85.2,85.2,85.2,2024-05-17 09:56:00.000,2024-05-17,2024,5,17,44904,[],()
65360,45190,19135,1,USD52.00,00:38; 3-Feb-2025,,52.0,52.0,52.0,2025-02-03 00:38:00.000,2025-02-03,2025,2,3,45190,[],()
68984,46604,19047,4,USD 47.75,2025-02-21T23:32:27,"9964 Raynor Mill, Rachalland, WY 74080",47.75,47.75,191.0,2025-02-21 23:32:27.000,2025-02-21,2025,2,21,46604,[],()
63221,45153,19478,1,$ 56.00,18:29;2024-08-06,"87072 Daniella Rapid, East Kassandra, AZ 69657-8677",56.0,56.0,56.0,2024-08-06 18:29:00.000,2024-08-06,2024,8,6,45153,[],()
64689,46771,19229,1,18$,"07:45:14 P.M., 2025-03-11","Apt. 108 642 Georgina Ways, West Antoniaberg, CT 23981",18.0,18.0,18.0,2025-03-11 19:45:14.000,2025-03-11,2025,3,11,46771,[],()
69318,46794,18922,2,EUR 14.25,"04:20, 2024-08-09",NULL,17.099999999999998,17.099999999999998,34.2,2024-08-09 04:20:00.000,2024-08-09,2024,8,9,46794,[],()
68408,45512,19033,2,€32.99,2025-04-21T05:23:20,,39.588,39.588,79.18,2025-04-21 05:23:20.000,2025-04-21,2025,4,21,45512,[],()
72274,46902,19297,1,$ 50.50,"00:35, 12/11/24",,50.5,50.5,50.5,2024-12-11 00:35:00.000,2024-12-11,2024,12,11,46902,[],()
67680,44615,19158,1,67.50€,2024-09-16T09:28:08.671,"Suite 349 3475 Caryn Dam, North Roxanna, CT 77094-8727",81.0,81.0,81.0,2024-09-16 09:28:08.671,2024-09-16,2024,9,16,44615,[],()
69563,44716,19484,1,54.75 $,02:11:26;2024-04-03,,54.75,54.75,54.75,2024-04-03 02:11:26.000,2024-04-03,2024,4,3,44716,[],()
73627,44459,19168,3,61.75USD,06:31:20 am 11/17/24,NULL,61.75,61.75,185.25,2024-11-17 06:31:20.000,2024-11-17,2024,11,17,44459,[],()
65225,46707,18943,1,$ 72.75,25-DEC-2024 08:25:57 A.M.,NULL,72.75,72.75,72.75,2024-12-25 08:25:57.000,2024-12-25,2024,12,25,46707,[],()
67878,45326,19415,1,12.5 $,16:38:49 10/13/24,,12.5,12.5,12.5,2024-10-13 16:38:49.000,2024-10-13,2024,10,13,45326,[],()
72530,46881,19405,5,50.75 €,Sat Jun  7 11:38:25 2025,,60.9,60.9,304.5,2025-06-07 11:38:25.000,2025-06-07,2025,6,7,46881,[],()
71539,47197,19008,2,46.75EUR,"08/09/24, 14:37",NULL,56.1,56.1,112.2,2024-08-09 14:37:00.000,2024-08-09,2024,8,9,47197,[],()
68550,44969,19027,2,€ 73.25,Fri Aug 30 16:45:54 2024,,87.89999999999999,87.89999999999999,175.8,2024-08-30 16:45:54.000,2024-08-30,2024,8,30,44969,[],()
66267,47552,19399,1,15. €,"12/18/24, 05:24",NULL,18.0,18.0,18.0,2024-12-18 05:24:00.000,2024-12-18,2024,12,18,47552,[],()
68433,44708,18905,1,59.50 EUR,2024-07-08 03:43,,71.39999999999999,71.39999999999999,71.4,2024-07-08 03:43:00.000,2024-07-08,2024,7,8,44708,[],()
70419,44340,19414,1,$58¢25,06/23/24 00:05:57,,5825.0,5825.0,5825.0,2024-06-23 00:05:57.000,2024-06-23,2024,6,23,44340,[],()
68182,44978,19532,1,31.50 €,05/15/24 09:30:24 P.M.,"Suite 217 1846 Beier Roads, Haagmouth, MS 82421",37.8,37.8,37.8,2024-05-15 21:30:24.000,2024-05-15,2024,5,15,44978,[],()
65423,44591,19100,1,16.00USD,"21:58:09,15-Jan-2025",,16.0,16.0,16.0,2025-01-15 21:58:09.000,2025-01-15,2025,1,15,44591,[],()
68075,44472,19073,1,72.99 $,"01:38:40, 2025-01-14","31453 Ryan Landing, East Oda, MO 83023",72.99,72.99,72.99,2025-01-14 01:38:40.000,2025-01-14,2025,1,14,44472,[],()
67132,46792,19107,1,$69.50,2024-10-20 10:44,NULL,69.5,69.5,69.5,2024-10-20 10:44:00.000,2024-10-20,2024,10,20,46792,[],()
67902,45264,18868,1,24.25 USD,"31-Jan-2025, 14:55",NULL,24.25,24.25,24.25,2025-01-31 14:55:00.000,2025-01-31,2025,1,31,45264,[],()
71670,47372,18921,1,€43¢75,08/11/24 04:04:58,NULL,5250.0,5250.0,5250.0,2024-08-11 04:04:58.000,2024-08-11,2024,8,11,47372,[],()
72754,46009,19505,5,EUR 21.75,21-OCT-2024;11:29:47 pm,NULL,26.099999999999998,26.099999999999998,130.5,2024-10-21 23:29:47.000,2024-10-21,2024,10,21,46009,[],()
69700,46347,19343,1,EUR 72.,2025-01-03 07:07,,86.39999999999999,86.39999999999999,86.4,2025-01-03 07:07:00.000,2025-01-03,2025,1,3,46347,[],()
71903,44461,19197,2,40.75 USD,"2025-07-23,01:29:39 pm",,40.75,40.75,81.5,2025-07-23 13:29:39.000,2025-07-23,2025,7,23,44461,[],()
70666,45339,18930,1,USD36.5,"15:23,27-APR-2025",,36.5,36.5,36.5,2025-04-27 15:23:00.000,2025-04-27,2025,4,27,45339,[],()
73641,45404,19455,1,€14.0,2024-07-18T06:16:56.903,,16.8,16.8,16.8,2024-07-18 06:16:56.903,2024-07-18,2024,7,18,45404,[],()
63600,45479,19463,1,59.25$,02:26:47 PM;09/12/24,NULL,59.25,59.25,59.25,2024-09-12 14:26:47.000,2024-09-12,2024,9,12,45479,[],()
63848,47492,19223,3,20. USD,23:52:14;13-Mar-2025,"Apt. 235 69224 Candida Green, Bernierport, HI 49564",20.0,20.0,60.0,2025-03-13 23:52:14.000,2025-03-13,2025,3,13,47492,[],()
64042,46620,19229,2,$ 18.25," 7-Mar-2024, 16:42:10",NULL,18.25,18.25,36.5,2024-03-07 16:42:10.000,2024-03-07,2024,3,7,46620,[],()
72304,46184,19544,3,36.50$,"2025-02-25,16:38:43",NULL,36.5,36.5,109.5,2025-02-25 16:38:43.000,2025-02-25,2025,2,25,46184,[],()
71748,47539,19455,1,$15.,"15-JAN-2025,16:14",,15.0,15.0,15.0,2025-01-15 16:14:00.000,2025-01-15,2025,1,15,47539,[],()
66936,44956,19477,5,41EUR,"22:05:46,25-Nov-2024",,49.199999999999996,49.199999999999996,246.0,2024-11-25 22:05:46.000,2024-11-25,2024,11,25,44956,[],()
63305,46746,19215,2,€17¢00,2025-04-24T00:54:22,,2040.0,2040.0,4080.0,2025-04-24 00:54:22.000,2025-04-24,2025,4,24,46746,[],()
70050,45298,19224,2,EUR58,"10-March-2025,16:38",,69.6,69.6,139.2,2025-03-10 16:38:00.000,2025-03-10,2025,3,10,45298,[],()
69629,46057,19191,1,USD25.50,"03:28:19,17-Oct-2024",NULL,25.5,25.5,25.5,2024-10-17 03:28:19.000,2024-10-17,2024,10,17,46057,[],()
72781,45634,18867,5,57.0USD,06:19:35 P.M.;2024-10-26,"392 Upton Spur, New Honeyside, OR 44734-8556",57.0,57.0,285.0,2024-10-26 18:19:35.000,2024-10-26,2024,10,26,45634,[],()
72917,46753,19086,1,71.50€," 4-Oct-2024, 05:33:23 PM","1001 Kris Path, Tiffaniemouth, KY 68291",85.8,85.8,85.8,2024-10-04 17:33:23.000,2024-10-04,2024,10,4,46753,[],()
66841,44789,18987,1,€60.99,"25-November-2024, 02:23:01 P.M.",,73.188,73.188,73.19,2024-11-25 14:23:01.000,2024-11-25,2024,11,25,44789,[],()
65811,44449,19551,1,28.5€,"2025-09-01,11:54:04 PM",NULL,34.199999999999996,34.199999999999996,34.2,2025-09-01 23:54:04.000,2025-09-01,2025,9,1,47254,[],()
70552,45198,19190,1,EUR44,09:23  9-October-2025,NULL,52.8,52.8,52.8,2025-10-09 09:23:00.000,2025-10-09,2025,10,9,45198,[],()
69939,45888,19386,1,75.$,"26-APR-2025, 17:12:14","Apt. 472 3217 Dach Branch, Stammburgh, OR 03707-1772",75.0,75.0,75.0,2025-04-26 17:12:14.000,2025-04-26,2025,4,26,45888,[],()
64235,46780,19447,1,USD27.,"09:20:22 pm, 06/26/25",NULL,27.0,27.0,27.0,2025-06-26 21:20:22.000,2025-06-26,2025,6,26,46780,[],()
71624,46486,18992,5,70.5 $,"2024-10-02,03:30:02 AM",,70.5,70.5,352.5,2024-10-02 03:30:02.000,2024-10-02,2024,10,2,46486,[],()
63282,46062,19544,1,EUR39.75,2025-03-29T13:09:34.757,"Suite 967 37446 Shelby Vista, MacGyverton, NV 13885",47.699999999999996,47.699999999999996,47.7,2025-03-29 13:09:34.757,2025-03-29,2025,3,29,46062,[],()
67910,44996,18914,1,$ 49.,09:28 06/21/24,,49.0,49.0,49.0,2024-06-21 09:28:00.000,2024-06-21,2024,6,21,44996,[],()
72399,45574,18856,3,€49.99,02:22:55;2025-01-06,NULL,59.988,59.988,179.96,2025-01-06 02:22:55.000,2025-01-06,2025,1,6,45574,[],()
72794,44874,19230,1,USD 58.00,2024-12-13;10:31:04,,58.0,58.0,58.0,2024-12-13 10:31:04.000,2024-12-13,2024,12,13,44874,[],()
72103,47572,19052,1,67 USD,11/20/24 14:54,,67.0,67.0,67.0,2024-11-20 14:54:00.000,2024-11-20,2024,11,20,47572,[],()
72993,46528,19420,1,USD53.50,"08/18/24,10:22",NULL,53.5,53.5,53.5,2024-08-18 10:22:00.000,2024-08-18,2024,8,18,46528,[],()
70605,44467,19501,1,18.0USD,"03:54:37,02/20/24",,18.0,18.0,18.0,2024-02-20 03:54:37.000,2024-02-20,2024,2,20,44467,[],()
64967,46592,19424,1,$20¢50,21-September-2024;14:09,,2050.0,2050.0,2050.0,2024-09-21 14:09:00.000,2024-09-21,2024,9,21,46592,[],()
70699,47430,18980,2,$ 63.5,07:39:37;04/12/25,,63.5,63.5,127.0,2025-04-12 07:39:37.000,2025-04-12,2025,4,12,47430,[],()
67644,46308,19583,5,$ 58.5,2024-11-22T05:28:09,"Suite 733 75566 Wiegand Drives, Ashliemouth, ID 74587",58.5,58.5,292.5,2024-11-22 05:28:09.000,2024-11-22,2024,11,22,46308,[],()
72738,45071,19421,1,20.€,01:56:45 pm 10/12/24,"8195 Okuneva Ports, Markstown, SC 30511",24.0,24.0,24.0,2024-10-12 13:56:45.000,2024-10-12,2024,10,12,45071,[],()
68265,44673,19034,1,€ 49.25,2025-01-23;17:59:22,"792 Bayer Station, Gutkowskiberg, AZ 89448-7475",59.099999999999994,59.099999999999994,59.1,2025-01-23 17:59:22.000,2025-01-23,2025,1,23,44673,[],()
70296,47292,19529,1,18.5$,"09/21/24,07:51",,18.5,18.5,18.5,2024-09-21 07:51:00.000,2024-09-21,2024,9,21,47292,[],()
68070,45163,19205,4,12.75USD,2025-04-22T12:01:46.631,"5675 Yost Rue, East Grantland, OK 99543",12.75,12.75,51.0,2025-04-22 12:01:46.631,2025-04-22,2025,4,22,44741,[],()
69594,46005,19063,5,46.99USD,07/30/24 15:58:55,NULL,46.99,46.99,234.95,2024-07-30 15:58:55.000,2024-07-30,2024,7,30,46005,[],()
65322,46077,19401,1,USD 60.00,14:19;15-Nov-2024,,60.0,60.0,60.0,2024-11-15 14:19:00.000,2024-11-15,2024,11,15,46077,[],()
64710,47207,19108,1,38.00$,06:56:25 pm 03/15/25,,38.0,38.0,38.0,2025-03-15 18:56:25.000,2025-03-15,2025,3,15,47207,[],()
66820,46854,19500,2,USD 48.0,2025-02-19T19:31:12.746,NULL,48.0,48.0,96.0,2025-02-19 19:31:12.746,2025-02-19,2025,2,19,46854,[],()
70084,47009,19410,1,€48.75,04:44 2024-12-02,,58.5,58.5,58.5,2024-12-02 04:44:00.000,2024-12-02,2024,12,2,47009,[],()
64398,45090,19096,1,$22¢00,26-Feb-2025;03:18:58 A.M.,NULL,2200.0,2200.0,2200.0,2025-02-26 03:18:58.000,2025-02-26,2025,2,26,45090,[],()
72167,45318,19492,1,€51.,"2025-01-03,17:30:59","Apt. 825 6477 Marvin Mews, Port Lavera, IN 00653-7528",61.199999999999996,61.199999999999996,61.2,2025-01-03 17:30:59.000,2025-01-03,2025,1,3,45318,[],()
72005,45247,18849,1,35.99 $,2024-11-04 03:34:23 AM,,35.99,35.99,35.99,2024-11-04 03:34:23.000,2024-11-04,2024,11,4,45247,[],()
67262,44878,19184,1,19. EUR,"31-December-2024, 03:38:05 P.M.","Apt. 940 3043 Lorraine Field, Lake Paulette, UT 01238",22.8,22.8,22.8,2024-12-31 15:38:05.000,2024-12-31,2024,12,31,44878,[],()
65456,46863,19017,2,53.00 €,"2025-03-27,17:47:39","Suite 409 9378 Graig Fields, Farrellburgh, CT 94476",63.599999999999994,63.599999999999994,127.2,2025-03-27 17:47:39.000,2025-03-27,2025,3,27,45799,[],()
63700,46258,19325,5,USD29.00,2024-10-20T12:23:44.473,"Suite 605 2088 Jermaine Ridges, South Xochitl, CA 46947-6074",29.0,29.0,145.0,2024-10-20 12:23:44.473,2024-10-20,2024,10,20,46258,[],()
65635,45927,19411,1,USD45.00,09:07:07 A.M.;2024-06-20,,45.0,45.0,45.0,2024-06-20 09:07:07.000,2024-06-20,2024,6,20,45927,[],()
69331,44651,19453,2,$ 25.0,"03:45:11 am,12/22/24",NULL,25.0,25.0,50.0,2024-12-22 03:45:11.000,2024-12-22,2024,12,22,44651,[],()
64719,47158,19332,1,38 $,"07/18/25, 01:32","1058 Kary Turnpike, West Malcomchester, MT 15938-9175",38.0,38.0,38.0,2025-07-18 01:32:00.000,2025-07-18,2025,7,18,47158,[],()
62816,44624,19447,1,USD 28,14-Feb-2025;06:47,"Apt. 791 878 McDermott Neck, East Mickie, OH 00702-7290",28.0,28.0,28.0,2025-02-14 06:47:00.000,2025-02-14,2025,2,14,44624,[],()
71382,47614,19126,3,$ 27.0,2025-02-11;13:53,NULL,27.0,27.0,81.0,2025-02-11 13:53:00.000,2025-02-11,2025,2,11,47614,[],()
72877,46673,19289,1,$31.00,02/24/24;21:58,,31.0,31.0,31.0,2024-02-24 21:58:00.000,2024-02-24,2024,2,24,46673,[],()
68233,44944,19001,2,€28.0,16:55  3-FEB-2025,NULL,33.6,33.6,67.2,2025-02-03 16:55:00.000,2025-02-03,2025,2,3,44944,[],()
73386,44349,19538,1,58.25 €,"20-November-2024, 01:56",,69.89999999999999,69.89999999999999,69.9,2024-11-20 01:56:00.000,2024-11-20,2024,11,20,44349,[],()
72276,46861,19314,1,EUR35.,2025-03-10T12:14:07,NULL,42.0,42.0,42.0,2025-03-10 12:14:07.000,2025-03-10,2025,3,10,46861,[],()
71477,46176,19483,1,USD56.99,10/30/24 10:36:33 pm,NULL,56.99,56.99,56.99,2024-10-30 22:36:33.000,2024-10-30,2024,10,30,46176,[],()
69857,47276,19281,1,37.5USD,"08:12:59, 2025-05-29", ,37.5,37.5,37.5,2025-05-29 08:12:59.000,2025-05-29,2025,5,29,47276,[],()
69609,44988,19347,4,$17¢99,"2024-10-16,12:11:27 am",,1799.0,1799.0,7196.0,2024-10-16 00:11:27.000,2024-10-16,2024,10,16,44988,[],()
67113,46480,19537,3,€ 54.50,19:51:04 10/20/24,,65.39999999999999,65.39999999999999,196.2,2024-10-20 19:51:04.000,2024-10-20,2024,10,20,46480,[],()
71301,46124,19295,5,40.0 USD,"2024-04-23, 03:40:01 am",,40.0,40.0,200.0,2024-04-23 03:40:01.000,2024-04-23,2024,4,23,46124,[],()
67274,44619,19013,1,45.50 €,"23-FEB-2025, 03:16:57 A.M.",,54.6,54.6,54.6,2025-02-23 03:16:57.000,2025-02-23,2025,2,23,44619,[],()
70481,46322,19509,1,57.$,00:02  2-Aug-2024,,57.0,57.0,57.0,2024-08-02 00:02:00.000,2024-08-02,2024,8,2,46322,[],()
63774,45268,19453,5,USD 26.5,2024-05-09T22:04:23.114,NULL,26.5,26.5,132.5,2024-05-09 22:04:23.114,2024-05-09,2024,5,9,45268,[],()
65878,47473,19258,2,USD68.75,"2025-02-12, 00:18:15","Apt. 154 516 Hessel Stream, Dareburgh, CT 14053",68.75,68.75,137.5,2025-02-12 00:18:15.000,2025-02-12,2025,2,12,47473,[],()
67053,47601,19505,1,16.25 $,01:05:58 pm;02/06/25,,16.25,16.25,16.25,2025-02-06 13:05:58.000,2025-02-06,2025,2,6,47601,[],()
71262,44423,19563,2,65.75USD,2024-09-04T05:36:33,"Apt. 412 364 Macejkovic Track, New Cary, VA 35961",65.75,65.75,131.5,2024-09-04 05:36:33.000,2024-09-04,2024,9,4,44423,[],()
73163,46187,18978,1,€ 62.00,"14:47:58,30-April-2025",NULL,74.39999999999999,74.39999999999999,74.4,2025-04-30 14:47:58.000,2025-04-30,2025,4,30,46187,[],()
64742,46624,19028,1,61$00¢,05/02/25;18:04:56,,6100.0,6100.0,6100.0,2025-05-02 18:04:56.000,2025-05-02,2025,5,2,46624,[],()
69265,47577,18912,1,USD61.75,"2024-05-07, 03:27",,61.75,61.75,61.75,2024-05-07 03:27:00.000,2024-05-07,2024,5,7,47577,[],()
71363,47333,19387,2,$ 61.99,2024-10-24T06:36:17,,61.99,61.99,123.98,2024-10-24 06:36:17.000,2024-10-24,2024,10,24,47333,[],()
70338,47119,18875,1,$45.5,04:08:39 AM;01/19/25,"99554 Legros Circle, North Lovettaton, HI 70352",45.5,45.5,45.5,2025-01-19 04:08:39.000,2025-01-19,2025,1,19,47119,[],()
67300,45568,19378,2,14.75 EUR,"04:55:49 A.M., 2025-02-10","Suite 581 732 Ollie Falls, West Tracyburgh, MD 84670",17.7,17.7,35.4,2025-02-10 04:55:49.000,2025-02-10,2025,2,10,45568,[],()
69019,45662,18924,3,29. EUR,"03:30:56 pm,2025-05-15",,34.8,34.8,104.4,2025-05-15 15:30:56.000,2025-05-15,2025,5,15,45662,[],()
64571,45921,18880,1,66.0USD, 9-March-2025 07:49,,66.0,66.0,66.0,2025-03-09 07:49:00.000,2025-03-09,2025,3,9,45921,[],()
66833,46341,19262,1,71.25€,"16:55:16, 01/07/25",,85.5,85.5,85.5,2025-01-07 16:55:16.000,2025-01-07,2025,1,7,46341,[],()
64604,45096,19203,1,USD 58.00,"10-Nov-2024, 02:56:43","670 Turcotte Via, Roscoeberg, GA 52608",58.0,58.0,58.0,2024-11-10 02:56:43.000,2024-11-10,2024,11,10,45096,[],()
71619,45943,19142,1,41.00€,2025-01-06T21:15:55,,49.199999999999996,49.199999999999996,49.2,2025-01-06 21:15:55.000,2025-01-06,2025,1,6,45943,[],()
64419,46962,19556,1,29$75¢," 1-JUL-2024, 09:17",,2975.0,2975.0,2975.0,2024-07-01 09:17:00.000,2024-07-01,2024,7,1,46962,[],()
72140,45042,18841,1,USD19.25,05:39:53 pm;07/23/24,NULL,19.25,19.25,19.25,2024-07-23 17:39:53.000,2024-07-23,2024,7,23,45042,[],()
63476,47377,19048,1,EUR33.00,08/17/24;18:39:22,NULL,39.6,39.6,39.6,2024-08-17 18:39:22.000,2024-08-17,2024,8,17,47377,[],()
73262,47352,19346,4,40.0USD, 1.02.2025  0:51:51,,40.0,40.0,160.0,2025-01-02 00:51:51.000,2025-01-02,2025,1,2,47352,[],()
71597,45470,19279,1,USD18.50,2025-02-25T10:54:21,"2573 Carlton Forges, West Amandabury, IN 88994-4870",18.5,18.5,18.5,2025-02-25 10:54:21.000,2025-02-25,2025,2,25,45470,[],()
73751,46702,19506,4,EUR 60.99,2025-07-02T14:28:20.276,NULL,73.188,73.188,292.75,2025-07-02 14:28:20.276,2025-07-02,2025,7,2,46702,[],()
64043,45957,19131,1,57.00$,"03:19:50 P.M., 20-FEB-2025",,57.0,57.0,57.0,2025-02-20 15:19:50.000,2025-02-20,2025,2,20,45957,[],()
66717,45739,18992,1,69.99$,01:43;02/13/25,NULL,69.99,69.99,69.99,2025-02-13 01:43:00.000,2025-02-13,2025,2,13,45739,[],()
70882,45038,19550,1,$33¢25,"2024-11-01, 03:57:45 PM",NULL,3325.0,3325.0,3325.0,2024-11-01 15:57:45.000,2024-11-01,2024,11,1,45038,[],()
71858,46184,19219,2,€ 29.50,"06:18:59 PM, 18-January-2025","Suite 277 9430 Feeney Lane, Leandroville, SC 25280",35.4,35.4,70.8,2025-01-18 18:18:59.000,2025-01-18,2025,1,18,46184,[],()
67923,47137,19326,3,29.5$,"08:18:25 am,10/16/24",,29.5,29.5,88.5,2024-10-16 08:18:25.000,2024-10-16,2024,10,16,47137,[],()
72898,46525,18928,1,18€,2024-08-31;11:41:12,"Suite 734 28378 Leuschke Wall, Wittingfort, IL 71594",21.599999999999998,21.599999999999998,21.6,2024-08-31 11:41:12.000,2024-08-31,2024,8,31,46525,[],()
65576,46256,19298,4,€64.75,10:50:17 2024-11-15,NULL,77.7,77.7,310.8,2024-11-15 10:50:17.000,2024-11-15,2024,11,15,46256,[],()
73916,46149,19167,1,40.25EUR,19.05.2025 15:46:46,NULL,48.3,48.3,48.3,2025-05-19 15:46:46.000,2025-05-19,2025,5,19,45698,[],()
63549,47379,19139,1,56.0$,"11:05:41 pm, 31-Mar-2025",,56.0,56.0,56.0,2025-03-31 23:05:41.000,2025-03-31,2025,3,31,47379,[],()
65887,45216,19048,1,28.99 $,06:37 11/24/24,NULL,28.99,28.99,28.99,2024-11-24 06:37:00.000,2024-11-24,2024,11,24,45216,[],()
68730,44928,18907,1,EUR 38.99,08/05/24;03:45,,46.788000000000004,46.788000000000004,46.79,2024-08-05 03:45:00.000,2024-08-05,2024,8,5,44928,[],()
72105,47269,19216,2,USD64.50,17:19;03/02/25,"20967 Balistreri Tunnel, Franeckiton, HI 94693-7261",64.5,64.5,129.0,2025-03-02 17:19:00.000,2025-03-02,2025,3,2,47269,[],()
70598,47196,19349,1,$39.,2024-10-27T09:21:10.867,,39.0,39.0,39.0,2024-10-27 09:21:10.867,2024-10-27,2024,10,27,47196,[],()
71975,45803,18841,3,17. €,30.06.2024  8:31:31,,20.4,20.4,61.2,2024-06-30 08:31:31.000,2024-06-30,2024,6,30,45803,[],()
65467,45014,18976,1,USD 26.75,03:25:18 AM 27-AUG-2024,,26.75,26.75,26.75,2024-08-27 03:25:18.000,2024-08-27,2024,8,27,45014,[],()
64578,44676,18882,1,USD46,11/17/24 07:43:57 am,,46.0,46.0,46.0,2024-11-17 07:43:57.000,2024-11-17,2024,11,17,44676,[],()
66544,44806,19494,2,32USD,"08/19/24,16:04",,32.0,32.0,64.0,2024-08-19 16:04:00.000,2024-08-19,2024,8,19,44806,[],()
66336,47498,19064,1,62.0 USD,"12:20:38 pm,05/20/24","Suite 885 6407 Haley Mills, South Johnathontown, NJ 53886",62.0,62.0,62.0,2024-05-20 12:20:38.000,2024-05-20,2024,5,20,47498,[],()
73158,44349,19012,1,USD 46.00,"07:29:07 A.M., 2025-04-25",,46.0,46.0,46.0,2025-04-25 07:29:07.000,2025-04-25,2025,4,25,44349,[],()
72878,44392,19340,1,USD31.75,2025-01-06T05:12:31.390,,31.75,31.75,31.75,2025-01-06 05:12:31.390,2025-01-06,2025,1,6,44392,[],()
63286,46777,19399,1,19.25 €,"03:39:27 PM,30-May-2024",,23.099999999999998,23.099999999999998,23.1,2024-05-30 15:39:27.000,2024-05-30,2024,5,30,46777,[],()
65302,44837,19510,1,€ 18.5,2025-04-27T07:32:14,,22.2,22.2,22.2,2025-04-27 07:32:14.000,2025-04-27,2025,4,27,44837,[],()
73588,45681,19539,4,$ 63.75,"02/14/25, 07:41:25",,63.75,63.75,255.0,2025-02-14 07:41:25.000,2025-02-14,2025,2,14,45681,[],()
66789,46910,19093,3,27.0USD,04:35:40 07/18/24,,27.0,27.0,81.0,2024-07-18 04:35:40.000,2024-07-18,2024,7,18,46910,[],()
66724,44468,18970,1,$46.,23:18;2024-04-20,"Suite 927 811 Boyce Curve, Deckowfurt, VT 11698-5534",46.0,46.0,46.0,2024-04-20 23:18:00.000,2024-04-20,2024,4,20,44468,[],()
68278,45827,19032,5,72.50$,"23:54:35, 25-AUG-2024",,72.5,72.5,362.5,2024-08-25 23:54:35.000,2024-08-25,2024,8,25,45827,[],()
69374,45920,19281,2,38.00USD,"02:52:27 P.M., 2025-01-17","Apt. 280 83572 O'Reilly Locks, Lake Wai, NV 87077",38.0,38.0,76.0,2025-01-17 14:52:27.000,2025-01-17,2025,1,17,45920,[],()
67431,45958,19086,2,$73.25,"12:19:07 A.M.,12/29/24",,73.25,73.25,146.5,2024-12-29 00:19:07.000,2024-12-29,2024,12,29,45958,[],()
65331,45716,19355,2,$37¢00,2024-12-03T04:03:30,NULL,3700.0,3700.0,7400.0,2024-12-03 04:03:30.000,2024-12-03,2024,12,3,47099,[],()
64107,45518,19306,1,USD 37.00,2025-04-01T17:58:08,,37.0,37.0,37.0,2025-04-01 17:58:08.000,2025-04-01,2025,4,1,45518,[],()
67858,45940,19218,3,72.99USD,07:24:51;2025-03-07,NULL,72.99,72.99,218.97,2025-03-07 07:24:51.000,2025-03-07,2025,3,7,45940,[],()
70545,47214,19097,1,68.5EUR,"2025-03-05, 02:10",,82.2,82.2,82.2,2025-03-05 02:10:00.000,2025-03-05,2025,3,5,47214,[],()
65596,45665,18938,2,45.50 $,"08:07:25,2024-09-12",NULL,45.5,45.5,91.0,2024-09-12 08:07:25.000,2024-09-12,2024,9,12,46459,[],()
72453,47100,18899,1,$ 28.,2024-10-08T13:30:51.236,NULL,28.0,28.0,28.0,2024-10-08 13:30:51.236,2024-10-08,2024,10,8,47100,[],()
73160,46137,18854,1,EUR 41.75,"14-JUL-2024,10:07:41 PM",,50.1,50.1,50.1,2024-07-14 22:07:41.000,2024-07-14,2024,7,14,46137,[],()
68503,45646,19392,1,50.75EUR,23:33 2025-04-24,"Apt. 789 75617 Sporer Run, Koeppland, MT 93779",60.9,60.9,60.9,2025-04-24 23:33:00.000,2025-04-24,2025,4,24,44936,[],()
63468,46291,19239,1,€75.0,2025-06-08T14:25:21.644,"Suite 889 96192 Watsica Fords, North Graigchester, PA 81978-8551",90.0,90.0,90.0,2025-06-08 14:25:21.644,2025-06-08,2025,6,8,46291,[],()
67718,47175,19117,1,34.0EUR,17:58 06/08/25,,40.8,40.8,40.8,2025-06-08 17:58:00.000,2025-06-08,2025,6,8,47175,[],()
66363,44501,19255,1,45.0USD,10:53:58 P.M. 08/16/24,"Apt. 523 9030 Bobbi Pike, Mackton, RI 50112-4793",45.0,45.0,45.0,2024-08-16 22:53:58.000,2024-08-16,2024,8,16,44501,[],()
71435,44356,19405,1,52€50¢,"20:15:59, 09/10/24","3280 Bosco Port, Madeleinemouth, AZ 69561-5178",6300.0,6300.0,6300.0,2024-09-10 20:15:59.000,2024-09-10,2024,9,10,44356,[],()
68827,46312,19325,4,29.0 USD,2024-09-06T16:10:36.878,,29.0,29.0,116.0,2024-09-06 16:10:36.878,2024-09-06,2024,9,6,46312,[],()
68579,46609,18959,1,54.50$,04:50:15 11/30/24,,54.5,54.5,54.5,2024-11-30 04:50:15.000,2024-11-30,2024,11,30,46609,[],()
73747,45534,19478,2,USD 53.99,19:33;17-May-2025,,53.99,53.99,107.98,2025-05-17 19:33:00.000,2025-05-17,2025,5,17,45534,[],()
63346,46759,19205,1,15.00EUR,2025-02-20T13:29:00,,18.0,18.0,18.0,2025-02-20 13:29:00.000,2025-02-20,2025,2,20,46759,[],()
71705,45667,19010,1,63.5 $,2024-10-14T21:27:04.391,"Apt. 650 66088 Cassy Prairie, Jacobsbury, NJ 83792",63.5,63.5,63.5,2024-10-14 21:27:04.391,2024-10-14,2024,10,14,45667,[],()
64014,46500,19186,5,30.75USD,"23-July-2024,09:21:46",NULL,30.75,30.75,153.75,2024-07-23 09:21:46.000,2024-07-23,2024,7,23,46500,[],()
70088,45223,18909,1,USD 22.75,02/02/25 07:55:47,,22.75,22.75,22.75,2025-02-02 07:55:47.000,2025-02-02,2025,2,2,45223,[],()
65561,46349,19200,1,22$,"01:08:08, 11-January-2025","Apt. 220 2072 Lamar Hills, Port Rivaview, IL 78383-0258",22.0,22.0,22.0,2025-01-11 01:08:08.000,2025-01-11,2025,1,11,46349,[],()
72859,46075,19309,5,€67.25,04:26:19;2025-01-07,,80.7,80.7,403.5,2025-01-07 04:26:19.000,2025-01-07,2025,1,7,45712,[],()
68577,46495,19122,1,USD34.25,2025-08-08T06:50:58,,34.25,34.25,34.25,2025-08-08 06:50:58.000,2025-08-08,2025,8,8,46495,[],()
63173,46372,19087,1,54.50€,06:51:23 A.M. 2024-10-05,,65.39999999999999,65.39999999999999,65.4,2024-10-05 06:51:23.000,2024-10-05,2024,10,5,46372,[],()
71496,45885,19343,1,74.50 USD,"01:12:11 P.M.,11-Jul-2025",,74.5,74.5,74.5,2025-07-11 13:12:11.000,2025-07-11,2025,7,11,47052,[],()
70840,47387,19232,3,34.5 $,2024-12-24T05:23:37,"94652 Hartmann Fall, Veumport, LA 99406-0551",34.5,34.5,103.5,2024-12-24 05:23:37.000,2024-12-24,2024,12,24,47387,[],()
65268,46918,19294,1,51.50 USD,02:38:26 pm 03/25/25,NULL,51.5,51.5,51.5,2025-03-25 14:38:26.000,2025-03-25,2025,3,25,46918,[],()
70228,47497,18894,1,USD21.99,25-January-2025;08:45:09 am,"888 Derrick Port, West Renateberg, WA 00789-1098",21.99,21.99,21.99,2025-01-25 08:45:09.000,2025-01-25,2025,1,25,47497,[],()
66847,47475,18846,1,USD21.,"22:39:12, 03/24/24",,21.0,21.0,21.0,2024-03-24 22:39:12.000,2024-03-24,2024,3,24,47475,[],()
65180,45877,19364,1,62.5 USD,2024-12-16T20:18:44.130,,62.5,62.5,62.5,2024-12-16 20:18:44.130,2024-12-16,2024,12,16,45877,[],()
66670,46704,19245,5,68.25$,2024-09-15T14:19:00,,68.25,68.25,341.25,2024-09-15 14:19:00.000,2024-09-15,2024,9,15,45219,[],()
69504,47150,19499,1,$26.25,Fri Oct 11 14:21:11 2024,"Suite 479 745 Torp Summit, New Aline, NH 73339-9530",26.25,26.25,26.25,2024-10-11 14:21:11.000,2024-10-11,2024,10,11,47150,[],()
73183,46728,19131,1,USD56.99,2025-01-18T01:06:06.733,"18525 Trantow Junctions, New Stevefort, NC 77676",56.99,56.99,56.99,2025-01-18 01:06:06.733,2025-01-18,2025,1,18,46728,[],()
73583,44809,19315,3,59.99 $,"01/02/25, 05:57:40 PM",,59.99,59.99,179.97,2025-01-02 17:57:40.000,2025-01-02,2025,1,2,44809,[],()
67430,46390,19174,2,30.5 EUR,2025-03-09T03:13:27,NULL,36.6,36.6,73.2,2025-03-09 03:13:27.000,2025-03-09,2025,3,9,46390,[],()
65078,46980,19019,4,12.99$,"00:33:56,  5-Jan-2025",NULL,12.99,12.99,51.96,2025-01-05 00:33:56.000,2025-01-05,2025,1,5,46980,[],()
65384,47178,19329,1,USD68.75,"08:56:27, 31-Mar-2024",NULL,68.75,68.75,68.75,2024-03-31 08:56:27.000,2024-03-31,2024,3,31,47178,[],()
63159,45744,19025,1,$37¢50,2024-12-29 20:17:05,"34743 Vincenzo Centers, Brownton, IL 32795-1577",3750.0,3750.0,3750.0,2024-12-29 20:17:05.000,2024-12-29,2024,12,29,45744,[],()
72273,46058,19481,1,63.00$,07:47:49 pm;2025-03-23,NULL,63.0,63.0,63.0,2025-03-23 19:47:49.000,2025-03-23,2025,3,23,46058,[],()
73621,45885,19074,1,74.99 EUR,"20:48:47,05/29/25","Apt. 178 5565 Murphy Prairie, Port Dorian, FL 95580-9960",89.98799999999999,89.98799999999999,89.99,2025-05-29 20:48:47.000,2025-05-29,2025,5,29,47052,[],()
65534,46161,18942,1,25. EUR,19.11.2024 12:47:47,NULL,30.0,30.0,30.0,2024-11-19 12:47:47.000,2024-11-19,2024,11,19,46711,[],()
70838,45822,19354,1,42 USD,16:15;2025-04-16,,42.0,42.0,42.0,2025-04-16 16:15:00.000,2025-04-16,2025,4,16,45822,[],()
63996,46503,19118,1,73.$,"08:38:01 AM, 18-JAN-2024",,73.0,73.0,73.0,2024-01-18 08:38:01.000,2024-01-18,2024,1,18,46503,[],()
64711,45513,19420,1,USD 52.50,"07:27:01 am,05/28/25","Apt. 939 57837 Delsie Wall, Julianburgh, KY 53517-4395",52.5,52.5,52.5,2025-05-28 07:27:01.000,2025-05-28,2025,5,28,45513,[],()
68638,46561,19133,3,24.00$,30.05.2024 16:17:17,,24.0,24.0,72.0,2024-05-30 16:17:17.000,2024-05-30,2024,5,30,46561,[],()
65939,47255,19318,1,$25¢25,"03:39:55,19-Nov-2024",,2525.0,2525.0,2525.0,2024-11-19 03:39:55.000,2024-11-19,2024,11,19,47255,[],()
63526,45953,19473,1,25.5EUR,05/19/25 18:47,,30.599999999999998,30.599999999999998,30.6,2025-05-19 18:47:00.000,2025-05-19,2025,5,19,45953,[],()
68475,47319,19080,5,48.00 €,"09:48:16 PM, 8-May-2025","845 Niesha Plaza, Ricechester, KY 20730-6392",57.599999999999994,57.599999999999994,288.0,2025-05-08 21:48:16.000,2025-05-08,2025,5,8,45960,[],()
65171,45679,19094,1,53.$,"19:52, 07/13/24",NULL,53.0,53.0,53.0,2024-07-13 19:52:00.000,2024-07-13,2024,7,13,45679,[],()
68393,45706,19102,2,€ 64.50,"05/26/25,02:42:01",,77.39999999999999,77.39999999999999,154.8,2025-05-26 02:42:01.000,2025-05-26,2025,5,26,45706,[],()
67376,44616,19276,1,$21.50,"23-OCT-2024,10:46",,21.5,21.5,21.5,2024-10-23 10:46:00.000,2024-10-23,2024,10,23,44616,[],()
69646,45436,19390,1,36.25$,"06:26:57 P.M.,18-September-2024",,36.25,36.25,36.25,2024-09-18 18:26:57.000,2024-09-18,2024,9,18,45436,[],()
66872,47054,19408,1,€ 26.5,"06/03/24,00:15:23",,31.799999999999997,31.799999999999997,31.8,2024-06-03 00:15:23.000,2024-06-03,2024,6,3,47054,[],()
72789,44424,18936,2,63.99EUR,Sun Dec  8 18:22:44 2024,"6179 Fisher Mill, Wiegandbury, MA 85583",76.788,76.788,153.58,2024-12-08 18:22:44.000,2024-12-08,2024,12,8,44424,[],()
63882,47198,19307,1,24.50EUR,08/03/25;08:27:44 PM,NULL,29.4,29.4,29.4,2025-08-03 20:27:44.000,2025-08-03,2025,8,3,47198,[],()
72731,46093,18895,5,EUR 39.0,"11/10/24,10:53:54 AM",,46.8,46.8,234.0,2024-11-10 10:53:54.000,2024-11-10,2024,11,10,46093,[],()
70411,46452,19174,5,32.50 EUR,06:34:42 am; 1-Nov-2024,,39.0,39.0,195.0,2024-11-01 06:34:42.000,2024-11-01,2024,11,1,46452,[],()
67564,45137,19273,3,USD43.50,2025-01-28T23:48:58.852,"Apt. 829 65212 Rippin Walk, Eveliatown, SD 99712",43.5,43.5,130.5,2025-01-28 23:48:58.852,2025-01-28,2025,1,28,45137,[],()
63037,45769,19328,1,€ 30.5,23:49:51 28-Oct-2024,,36.6,36.6,36.6,2024-10-28 23:49:51.000,2024-10-28,2024,10,28,45769,[],()
65248,44350,19566,1,$ 16.99,"16:59:16, 02/11/25",NULL,16.99,16.99,16.99,2025-02-11 16:59:16.000,2025-02-11,2025,2,11,44350,[],()
69727,44445,19295,1,EUR 35.5,"02:02,2024-12-02","Apt. 322 72061 Frederick Ports, New Arturofort, AL 45038-7958",42.6,42.6,42.6,2024-12-02 02:02:00.000,2024-12-02,2024,12,2,44445,[],()
66066,47544,19034,1,USD46.00,"06/28/24, 01:29","88137 Tom Crest, Mistifort, MT 38766",46.0,46.0,46.0,2024-06-28 01:29:00.000,2024-06-28,2024,6,28,47544,[],()
70446,44668,18956,1,USD 53.5,2025-05-18 14:10:11,NULL,53.5,53.5,53.5,2025-05-18 14:10:11.000,2025-05-18,2025,5,18,44668,[],()
70795,47574,19118,1,76.00€, 1-Feb-2025 12:04:14 P.M.,NULL,91.2,91.2,91.2,2025-02-01 12:04:14.000,2025-02-01,2025,2,1,47574,[],()
64030,46450,19306,1,39.5USD," 7-MAR-2025, 14:51:51","449 O'Kon Forge, Port Rollandview, SD 56432",39.5,39.5,39.5,2025-03-07 14:51:51.000,2025-03-07,2025,3,7,46450,[],()
66482,47592,18996,2,USD 48, 4-MAY-2025;02:44:29,,48.0,48.0,96.0,2025-05-04 02:44:29.000,2025-05-04,2025,5,4,47592,[],()
64168,46312,19252,1,23.5 USD,"22:49:44,2024-11-03","Suite 997 718 Leffler Estate, Joeystad, ND 72225-1682",23.5,23.5,23.5,2024-11-03 22:49:44.000,2024-11-03,2024,11,3,46312,[],()
66556,47413,19187,4,61.99USD,02:48:07 PM 2024-12-06,"Apt. 269 209 Tod Inlet, North Man, OR 50112-8912",61.99,61.99,247.96,2024-12-06 14:48:07.000,2024-12-06,2024,12,6,47413,[],()
65474,46795,18880,1,68.99 USD,2024-08-04T01:35:13,,68.99,68.99,68.99,2024-08-04 01:35:13.000,2024-08-04,2024,8,4,46795,[],()
70924,45502,18899,3,29€00¢,15:33:56 2024-12-17,,3480.0,3480.0,10440.0,2024-12-17 15:33:56.000,2024-12-17,2024,12,17,45502,[],()
73147,44893,19232,1,$ 34.50,"21:11:45, 6-MAR-2025",,34.5,34.5,34.5,2025-03-06 21:11:45.000,2025-03-06,2025,3,6,44893,[],()
66124,46903,19339,1,EUR48.00,"01:14, 12/11/24",,57.599999999999994,57.599999999999994,57.6,2024-12-11 01:14:00.000,2024-12-11,2024,12,11,46903,[],()
64350,45098,19337,3,63.0EUR,05:27:05 pm 2024-07-29,,75.6,75.6,226.8,2024-07-29 17:27:05.000,2024-07-29,2024,7,29,45098,[],()
73513,46449,19056,2,$ 25.,"28-Mar-2025, 00:35",,25.0,25.0,50.0,2025-03-28 00:35:00.000,2025-03-28,2025,3,28,46449,[],()
69743,45550,19008,2,47.50 $,2025-04-03T19:30:46.111,NULL,47.5,47.5,95.0,2025-04-03 19:30:46.111,2025-04-03,2025,4,3,45550,[],()
73579,45157,19346,1,€40¢00,"09:44:01 PM,  9-Jan-2025",,4800.0,4800.0,4800.0,2025-01-09 21:44:01.000,2025-01-09,2025,1,9,45157,[],()
63878,46960,18950,3,USD44.0,2024-10-29T05:01:39,,44.0,44.0,132.0,2024-10-29 05:01:39.000,2024-10-29,2024,10,29,46354,[],()
65351,46781,19567,1,50USD,"17:15,2025-05-31","69015 Zemlak Mountain, Augustineburgh, TX 35059",50.0,50.0,50.0,2025-05-31 17:15:00.000,2025-05-31,2025,5,31,46781,[],()
65675,45826,19540,3,EUR66.25,"2025-01-27, 03:06:57 PM",,79.5,79.5,238.5,2025-01-27 15:06:57.000,2025-01-27,2025,1,27,45826,[],()
68522,45003,19298,1,$62.75,"22:11, 16-NOV-2024","Apt. 257 885 Windler Drive, Satterfieldton, TN 97639",62.75,62.75,62.75,2024-11-16 22:11:00.000,2024-11-16,2024,11,16,45003,[],()
66905,44603,18932,1,20.99 $,2024-09-23T21:09:21.163,NULL,20.99,20.99,20.99,2024-09-23 21:09:21.163,2024-09-23,2024,9,23,44603,[],()
70541,46015,19156,1,38.25 USD,02/17/25 01:52:49,,38.25,38.25,38.25,2025-02-17 01:52:49.000,2025-02-17,2025,2,17,46015,[],()
67971,45303,19541,5,27.75 EUR,"02:47:11,02/27/25",,33.3,33.3,166.5,2025-02-27 02:47:11.000,2025-02-27,2025,2,27,45303,[],()
68881,44925,19386,1,74.50€,2024-09-08;23:34,,89.39999999999999,89.39999999999999,89.4,2024-09-08 23:34:00.000,2024-09-08,2024,9,8,44925,[],()
66046,47007,19289,1,31.75USD,12-June-2024;10:19:51 A.M.,,31.75,31.75,31.75,2024-06-12 10:19:51.000,2024-06-12,2024,6,12,47007,[],()
63275,44626,19048,1,28.99 $,05:30:26 pm 02/20/25,,28.99,28.99,28.99,2025-02-20 17:30:26.000,2025-02-20,2025,2,20,44626,[],()
71448,45433,19104,1,$57¢25,"21:47:13,16-December-2024",NULL,5725.0,5725.0,5725.0,2024-12-16 21:47:13.000,2024-12-16,2024,12,16,45433,[],()
70256,46113,19124,1,$52.75, 2-Mar-2025 08:37:53 am,,52.75,52.75,52.75,2025-03-02 08:37:53.000,2025-03-02,2025,3,2,47440,[],()
69274,46915,19377,3,49.50$," 8-Dec-2024, 02:06:30 pm",NULL,49.5,49.5,148.5,2024-12-08 14:06:30.000,2024-12-08,2024,12,8,46492,[],()
69078,45621,19462,1,$ 60.5,"04:24,13-Jul-2024","294 Cronin Fords, East Lawerenceland, AK 10778",60.5,60.5,60.5,2024-07-13 04:24:00.000,2024-07-13,2024,7,13,45621,[],()
70412,45253,18862,2,USD 31.75,23-Jan-2025 08:21:33,,31.75,31.75,63.5,2025-01-23 08:21:33.000,2025-01-23,2025,1,23,45253,[],()
68310,46325,19274,1,$ 74.5,"07/09/24, 09:47","5717 Dora Burg, Bostad, IN 20059",74.5,74.5,74.5,2024-07-09 09:47:00.000,2024-07-09,2024,7,9,46325,[],()
70311,47330,18843,2,15.25$,2024-08-24T23:25:14.742,,15.25,15.25,30.5,2024-08-24 23:25:14.742,2024-08-24,2024,8,24,47330,[],()
68956,45475,18859,3,52. USD,08/14/24 09:34:24 PM,NULL,52.0,52.0,156.0,2024-08-14 21:34:24.000,2024-08-14,2024,8,14,45475,[],()
71615,44657,19545,1,USD46.75,"19-Sep-2024,13:26","5692 Robel Trafficway, Boscotown, OH 53613-9194",46.75,46.75,46.75,2024-09-19 13:26:00.000,2024-09-19,2024,9,19,44657,[],()
72339,47149,18916,3,55.0 USD,"17:25,22-AUG-2024","Apt. 668 899 Amado Valley, Percyton, VT 72619-1110",55.0,55.0,165.0,2024-08-22 17:25:00.000,2024-08-22,2024,8,22,47149,[],()
69338,46642,19413,1,32.0$,2025-08-10T08:23:27.736,NULL,32.0,32.0,32.0,2025-08-10 08:23:27.736,2025-08-10,2025,8,10,46642,[],()
69737,47036,19321,1,48.0€,2024-07-10T18:14:07,,57.599999999999994,57.599999999999994,57.6,2024-07-10 18:14:07.000,2024-07-10,2024,7,10,47036,[],()
67421,46389,19563,3,€67.,"20-SEP-2024,01:33:41",,80.39999999999999,80.39999999999999,241.2,2024-09-20 01:33:41.000,2024-09-20,2024,9,20,46389,[],()
65972,45542,19273,1,$45¢99,2024-04-23 07:18:53 A.M.,NULL,4599.0,4599.0,4599.0,2024-04-23 07:18:53.000,2024-04-23,2024,4,23,45542,[],()
72858,47170,19099,2,USD 54, 4-Feb-2025;04:40:14 am,,54.0,54.0,108.0,2025-02-04 04:40:14.000,2025-02-04,2025,2,4,47170,[],()
64787,47259,18962,1,$ 58.99,12/08/24 11:13:50 PM,,58.99,58.99,58.99,2024-12-08 23:13:50.000,2024-12-08,2024,12,8,47259,[],()
69697,46967,18995,1,30.50 $, 1-Jul-2025;09:55:03,NULL,30.5,30.5,30.5,2025-07-01 09:55:03.000,2025-07-01,2025,7,1,46967,[],()
64552,46982,19338,1,65.0$,2025-10-25T15:42:39.857,,65.0,65.0,65.0,2025-10-25 15:42:39.857,2025-10-25,2025,10,25,46982,[],()
69836,44930,19199,1,€17¢99,"10/06/24, 22:37:18",,2158.7999999999997,2158.7999999999997,2158.8,2024-10-06 22:37:18.000,2024-10-06,2024,10,6,44930,[],()
70241,46138,19008,1,51. $, 3-August-2024;19:30:19,,51.0,51.0,51.0,2024-08-03 19:30:19.000,2024-08-03,2024,8,3,46138,[],()
73851,45215,19127,1,58.75USD,27-June-2024;08:59:08 PM,,58.75,58.75,58.75,2024-06-27 20:59:08.000,2024-06-27,2024,6,27,45215,[],()
71469,45321,19060,2,63$,"12/12/24,16:26:00","Apt. 279 70333 Margareta Creek, Medhursttown, MS 25312-0419",63.0,63.0,126.0,2024-12-12 16:26:00.000,2024-12-12,2024,12,12,45321,[],()
73264,47151,18914,1,50.75 $,26-Aug-2024;02:28:46 P.M.,,50.75,50.75,50.75,2024-08-26 14:28:46.000,2024-08-26,2024,8,26,47151,[],()
67482,46351,18956,1,USD 56.50,"04:24:09 am,2025-04-17",NULL,56.5,56.5,56.5,2025-04-17 04:24:09.000,2025-04-17,2025,4,17,46351,[],()
70461,45281,18966,2,55.75 $,18:44 25-April-2025,,55.75,55.75,111.5,2025-04-25 18:44:00.000,2025-04-25,2025,4,25,45281,[],()
66213,47584,19348,1,34.75EUR,18-Jan-2025 14:42:00,"Apt. 247 28230 Prohaska Fall, North Burt, NE 59494-3720",41.699999999999996,41.699999999999996,41.7,2025-01-18 14:42:00.000,2025-01-18,2025,1,18,47584,[],()
68240,44353,19343,2,74.0USD,"11:05:03,2024-10-28",,74.0,74.0,148.0,2024-10-28 11:05:03.000,2024-10-28,2024,10,28,44353,[],()
66630,46838,18847,1,€38¢99,2024-05-28;09:53:45,NULL,4678.8,4678.8,4678.8,2024-05-28 09:53:45.000,2024-05-28,2024,5,28,46838,[],()
71316,46040,19419,2,51.5 $,"10-Aug-2024, 05:20:04 am",,51.5,51.5,103.0,2024-08-10 05:20:04.000,2024-08-10,2024,8,10,46040,[],()
64698,45727,19224,1,USD 55.50,"07/31/24,02:34:45 A.M.",,55.5,55.5,55.5,2024-07-31 02:34:45.000,2024-07-31,2024,7,31,45727,[],()
73012,47061,19507,1,$24.50,2024-12-10T08:49:57,,24.5,24.5,24.5,2024-12-10 08:49:57.000,2024-12-10,2024,12,10,47061,[],()
68838,46515,19484,1,53 €,2024-08-01T06:09:32.891,"6737 Eden Cove, Murazikburgh, UT 62610-9281",63.599999999999994,63.599999999999994,63.6,2024-08-01 06:09:32.891,2024-08-01,2024,8,1,46515,[],()
69566,44909,19182,1,EUR53.0,"01/23/25, 04:54:31",NULL,63.599999999999994,63.599999999999994,63.6,2025-01-23 04:54:31.000,2025-01-23,2025,1,23,44909,[],()
67436,46888,19258,1,68.00 USD,"08:23:51 P.M.,  6-AUG-2025",,68.0,68.0,68.0,2025-08-06 20:23:51.000,2025-08-06,2025,8,6,46888,[],()
73088,47363,19276,2,EUR20.99,06:06:24; 4-FEB-2025,NULL,25.188,25.188,50.38,2025-02-04 06:06:24.000,2025-02-04,2025,2,4,47363,[],()
69245,46189,19210,1,40.$," 1-Apr-2025, 21:43:23",,40.0,40.0,40.0,2025-04-01 21:43:23.000,2025-04-01,2025,4,1,46189,[],()
68061,44566,19420,3,54.00 USD,11:08:21 A.M.;05/16/25,,54.0,54.0,162.0,2025-05-16 11:08:21.000,2025-05-16,2025,5,16,46814,[],()
63273,46984,19416,1,67.00 $,"10:00:59 pm,2024-12-30",NULL,67.0,67.0,67.0,2024-12-30 22:00:59.000,2024-12-30,2024,12,30,46984,[],()
66349,45074,19373,1,USD53.50,2024-12-30T15:17:00,"Suite 253 68530 Schuster Locks, Port Dayna, HI 52968-7117",53.5,53.5,53.5,2024-12-30 15:17:00.000,2024-12-30,2024,12,30,45074,[],()
70335,47098,19077,1,44.25€,2024-05-05T08:02:32,,53.1,53.1,53.1,2024-05-05 08:02:32.000,2024-05-05,2024,5,5,47098,[],()
68674,45130,18871,1,$56.00,"2025-01-07,23:02:29",,56.0,56.0,56.0,2025-01-07 23:02:29.000,2025-01-07,2025,1,7,45130,[],()
65189,45249,19441,1,17.00 €,"23:59, 2024-11-30","Apt. 310 5269 Dorthea Lakes, Eliaburgh, MA 83179-2789",20.4,20.4,20.4,2024-11-30 23:59:00.000,2024-11-30,2024,11,30,45249,[],()
66347,47042,19124,1,EUR 56,2024-12-13T04:45:31.703,NULL,67.2,67.2,67.2,2024-12-13 04:45:31.703,2024-12-13,2024,12,13,47042,[],()
64630,46649,19172,2,67.00$,2024-10-10T18:48:42,,67.0,67.0,134.0,2024-10-10 18:48:42.000,2024-10-10,2024,10,10,46649,[],()
71899,45777,19442,1,49.75EUR,08/03/24 10:35,,59.699999999999996,59.699999999999996,59.7,2024-08-03 10:35:00.000,2024-08-03,2024,8,3,45777,[],()
67832,46026,19488,1,$ 71.0," 4-AUG-2024, 23:47:12",NULL,71.0,71.0,71.0,2024-08-04 23:47:12.000,2024-08-04,2024,8,4,46026,[],()
68116,46029,19053,1,USD 55.0,2025-01-06;02:31:40 AM,,55.0,55.0,55.0,2025-01-06 02:31:40.000,2025-01-06,2025,1,6,46029,[],()
63662,46652,19454,3,$ 68.5,"2024-12-29, 12:14:53 P.M.",,68.5,68.5,205.5,2024-12-29 12:14:53.000,2024-12-29,2024,12,29,45804,[],()
73538,44589,18868,1,USD26.99,"11:37,03/19/24",NULL,26.99,26.99,26.99,2024-03-19 11:37:00.000,2024-03-19,2024,3,19,45729,[],()
68485,45539,19327,2,EUR 43.99,10:37:16 AM 01/13/25,,52.788000000000004,52.788000000000004,105.58,2025-01-13 10:37:16.000,2025-01-13,2025,1,13,45539,[],()
73712,44629,18884,1,€ 67.99,06:30:38 P.M.;2025-03-17,,81.588,81.588,81.59,2025-03-17 18:30:38.000,2025-03-17,2025,3,17,44629,[],()
62934,47392,19235,1,66.5€,"09/30/25, 07:42:07 PM",NULL,79.8,79.8,79.8,2025-09-30 19:42:07.000,2025-09-30,2025,9,30,47392,[],()
68461,46208,19009,3,70.75$,2025-02-07 04:51,NULL,70.75,70.75,212.25,2025-02-07 04:51:00.000,2025-02-07,2025,2,7,46208,[],()
68788,45779,19392,1,$ 51.99,11:25:58 A.M.  7-AUG-2024,,51.99,51.99,51.99,2024-08-07 11:25:58.000,2024-08-07,2024,8,7,45779,[],()
71055,46814,19015,1,60.25 USD,"09:39:46 AM, 14-Jul-2024",,60.25,60.25,60.25,2024-07-14 09:39:46.000,2024-07-14,2024,7,14,46814,[],()
68664,45322,18880,1,$70.5,25-August-2024;19:07,,70.5,70.5,70.5,2024-08-25 19:07:00.000,2024-08-25,2024,8,25,45322,[],()
70053,45004,19511,1,36.25$,"03/08/25, 17:07:21",,36.25,36.25,36.25,2025-03-08 17:07:21.000,2025-03-08,2025,3,8,45004,[],()
63541,45164,19209,1,30€00¢,"11/22/24,17:23:12","Suite 905 362 Wehner Mission, Jannetteborough, AR 35018-1710",3600.0,3600.0,3600.0,2024-11-22 17:23:12.000,2024-11-22,2024,11,22,45164,[],()
71344,45868,19320,1,24.50 EUR,2025-05-22;10:18:48 A.M.,NULL,29.4,29.4,29.4,2025-05-22 10:18:48.000,2025-05-22,2025,5,22,45868,[],()
63289,47207,19091,2,€ 26.99,"02:02,02/12/25","9777 Bobette Valleys, Ritchiefort, CO 33803-2865",32.388,32.388,64.78,2025-02-12 02:02:00.000,2025-02-12,2025,2,12,47207,[],()
67020,45450,19380,1,64.50 EUR,"01:54:53 am,06/28/25",,77.39999999999999,77.39999999999999,77.4,2025-06-28 01:54:53.000,2025-06-28,2025,6,28,45450,[],()
66600,46159,19009,4,74.75 USD,2024-07-19T17:52:59,NULL,74.75,74.75,299.0,2024-07-19 17:52:59.000,2024-07-19,2024,7,19,46159,[],()
63796,44787,19009,1,75.25 USD,2025-01-21T18:43:44,,75.25,75.25,75.25,2025-01-21 18:43:44.000,2025-01-21,2025,1,21,44787,[],()
64084,45114,19160,1,$71.00,2024-08-28 01:57:44 AM,,71.0,71.0,71.0,2024-08-28 01:57:44.000,2024-08-28,2024,8,28,45114,[],()
72316,47596,19356,1,EUR 53.75,"12/04/24, 07:03","Suite 351 406 Shields Union, Yongstad, OK 54996",64.5,64.5,64.5,2024-12-04 07:03:00.000,2024-12-04,2024,12,4,47596,[],()
73261,47012,19543,1,USD38.0,07:06:35 AM;2024-11-21,,38.0,38.0,38.0,2024-11-21 07:06:35.000,2024-11-21,2024,11,21,47012,[],()
64417,46589,19093,2,USD 29.00,04:19 10/23/24,,29.0,29.0,58.0,2024-10-23 04:19:00.000,2024-10-23,2024,10,23,46589,[],()
67800,46213,18929,5,$ 47.00,13:26 10/12/24,"Apt. 225 4158 Mario Lodge, Garyhaven, CO 16804",47.0,47.0,235.0,2024-10-12 13:26:00.000,2024-10-12,2024,10,12,46213,[],()
73053,45187,19520,2,USD 29.75,"20-OCT-2024, 19:16:04","64946 Schulist Stravenue, Barrybury, OH 84978-1202",29.75,29.75,59.5,2024-10-20 19:16:04.000,2024-10-20,2024,10,20,45187,[],()
66581,44817,18975,1,USD51.0,"12:11:01 AM,12/07/24",,51.0,51.0,51.0,2024-12-07 00:11:01.000,2024-12-07,2024,12,7,44817,[],()
63009,46980,19188,3,USD41.25,2024-09-02T02:34:09.696,,41.25,41.25,123.75,2024-09-02 02:34:09.696,2024-09-02,2024,9,2,46980,[],()
71563,47320,19223,2,22.99USD,"09:48:30 AM,12/26/24",,22.99,22.99,45.98,2024-12-26 09:48:30.000,2024-12-26,2024,12,26,47320,[],()
70674,44680,19566,1,20.25 EUR,2024-06-16T03:15:23,NULL,24.3,24.3,24.3,2024-06-16 03:15:23.000,2024-06-16,2024,6,16,44680,[],()
66715,46895,19110,1,$56.99,"06:26:45,12/09/24",,56.99,56.99,56.99,2024-12-09 06:26:45.000,2024-12-09,2024,12,9,46895,[],()
68185,45627,18875,3,46.75 USD,"21-Sep-2024,22:47",,46.75,46.75,140.25,2024-09-21 22:47:00.000,2024-09-21,2024,9,21,45627,[],()
72256,46702,19089,1,47.99 €,"08:16:01 A.M., 2025-02-03",NULL,57.588,57.588,57.59,2025-02-03 08:16:01.000,2025-02-03,2025,2,3,46702,[],()
64589,45391,19400,2,38.5 $,"10:27:14 A.M., 2024-11-24",,38.5,38.5,77.0,2024-11-24 10:27:14.000,2024-11-24,2024,11,24,44823,[],()
66008,44486,19212,4,EUR54.25,"08:57:36 P.M., 2024-09-08",NULL,65.1,65.1,260.4,2024-09-08 20:57:36.000,2024-09-08,2024,9,8,44486,[],()
70028,46023,19035,1,EUR22.0,00:34:52;06/18/24,NULL,26.4,26.4,26.4,2024-06-18 00:34:52.000,2024-06-18,2024,6,18,46023,[],()
72662,46318,19052,5,USD 69.99,"14:55:42,2025-07-04",NULL,69.99,69.99,349.95,2025-07-04 14:55:42.000,2025-07-04,2025,7,4,46318,[],()
67078,47357,19452,1,38.25EUR,"09/22/24, 17:01",,45.9,45.9,45.9,2024-09-22 17:01:00.000,2024-09-22,2024,9,22,47357,[],()
72252,46153,18899,1,€ 29.25,2025-01-28T20:03:51.459,,35.1,35.1,35.1,2025-01-28 20:03:51.459,2025-01-28,2025,1,28,46153,[],()
67062,45398,19528,1,USD30.25,"09:27,02/01/25",,30.25,30.25,30.25,2025-02-01 09:27:00.000,2025-02-01,2025,2,1,45398,[],()
72785,45489,18919,3,€19.50,"01:42:25 P.M., 12/16/24",NULL,23.4,23.4,70.2,2024-12-16 13:42:25.000,2024-12-16,2024,12,16,45489,[],()
67505,47437,19170,1,72.75USD,2025-05-06T23:17:49,"37826 Leticia Port, South Bruce, CO 65004",72.75,72.75,72.75,2025-05-06 23:17:49.000,2025-05-06,2025,5,6,47437,[],()
69826,44964,19319,2,38USD,"2025-03-21,05:04:23",,38.0,38.0,76.0,2025-03-21 05:04:23.000,2025-03-21,2025,3,21,44964,[],()
70826,45307,19043,1,EUR20.5,"07:06:56 pm,2024-11-27",,24.599999999999998,24.599999999999998,24.6,2024-11-27 19:06:56.000,2024-11-27,2024,11,27,45307,[],()
68017,46835,19434,1,13.5 EUR,"29-July-2024,08:11:19 P.M.",NULL,16.2,16.2,16.2,2024-07-29 20:11:19.000,2024-07-29,2024,7,29,46835,[],()
72685,46848,19374,3,€20¢50,2024-10-16T08:59:06.523,NULL,2460.0,2460.0,7380.0,2024-10-16 08:59:06.523,2024-10-16,2024,10,16,46848,[],()
72207,44563,19328,1,30.0 $,26-DEC-2024 03:08,,30.0,30.0,30.0,2024-12-26 03:08:00.000,2024-12-26,2024,12,26,44563,[],()
64683,45727,19321,2,49.0 €,Wed Dec  4 00:19:13 2024,,58.8,58.8,117.6,2024-12-04 00:19:13.000,2024-12-04,2024,12,4,45727,[],()
64692,46602,19216,2,EUR64.75,"08:09:42, 4-NOV-2024",,77.7,77.7,155.4,2024-11-04 08:09:42.000,2024-11-04,2024,11,4,46602,[],()
71371,45333,19478,1,$ 55.00,2024-12-30;08:47:05 PM,"Apt. 995 6701 Clement Mountain, West Rudolf, FL 19092-9440",55.0,55.0,55.0,2024-12-30 20:47:05.000,2024-12-30,2024,12,30,45333,[],()
64988,47200,18929,2,USD 44.5,"2024-09-07, 04:15:10",,44.5,44.5,89.0,2024-09-07 04:15:10.000,2024-09-07,2024,9,7,47200,[],()
66092,44902,19103,1,34.00USD,2024-05-01 02:45:53,"60923 Steuber Burgs, Penelopehaven, AZ 67908-7880",34.0,34.0,34.0,2024-05-01 02:45:53.000,2024-05-01,2024,5,1,44902,[],()
73172,47055,19428,1,$44,"04/21/25,02:02",,44.0,44.0,44.0,2025-04-21 02:02:00.000,2025-04-21,2025,4,21,47055,[],()
68923,45663,18856,1,USD46.00,30-September-2024;06:56:32 P.M.,"Suite 314 2178 Abdul Falls, Schultzview, SD 22536",46.0,46.0,46.0,2024-09-30 18:56:32.000,2024-09-30,2024,9,30,45663,[],()
68466,47352,19158,1,USD 67.00,02:32:12 PM;25-Jul-2025,"65914 Brett Estate, Tommyfort, WI 97150-5506",67.0,67.0,67.0,2025-07-25 14:32:12.000,2025-07-25,2025,7,25,47352,[],()
69509,46263,19405,1,50.50 EUR,"17-FEB-2025, 20:04:26",,60.599999999999994,60.599999999999994,60.6,2025-02-17 20:04:26.000,2025-02-17,2025,2,17,46263,[],()
70105,44681,19482,1,€26¢50,"29-Sep-2024,07:39:50 A.M.",,3180.0,3180.0,3180.0,2024-09-29 07:39:50.000,2024-09-29,2024,9,29,44681,[],()
62869,47181,19134,1,68.99 EUR,"03:38:30 P.M., 2025-05-02",,82.788,82.788,82.79,2025-05-02 15:38:30.000,2025-05-02,2025,5,2,45635,[],()
72132,45381,19075,2,€46.99,01:58 2025-08-13,NULL,56.388,56.388,112.78,2025-08-13 01:58:00.000,2025-08-13,2025,8,13,45381,[],()
65505,45344,18890,3,67.5USD,18-DEC-2024;16:14,"Apt. 726 922 Becker Shore, New Dirk, ME 76953-7711",67.5,67.5,202.5,2024-12-18 16:14:00.000,2024-12-18,2024,12,18,45344,[],()
71313,47093,19295,1,37.25 USD,01:23 2024-06-18,"Apt. 864 7136 Russel Cliffs, Thurmanberg, GA 06731",37.25,37.25,37.25,2024-06-18 01:23:00.000,2024-06-18,2024,6,18,47093,[],()
73058,45294,19099,1,USD56.0,"2024-12-21,20:34:55","3642 Mueller Curve, Mariaborough, MO 87077-4585",56.0,56.0,56.0,2024-12-21 20:34:55.000,2024-12-21,2024,12,21,45946,[],()
71924,46768,19524,2,50.99$,"10:02:59 AM, 12/28/24",,50.99,50.99,101.98,2024-12-28 10:02:59.000,2024-12-28,2024,12,28,46768,[],()
64148,45418,19211,1,$44¢99,"2025-02-18,21:15:58",,4499.0,4499.0,4499.0,2025-02-18 21:15:58.000,2025-02-18,2025,2,18,45418,[],()
68207,45791,18963,2,54.5 $,00:12 2024-07-29,,54.5,54.5,109.0,2024-07-29 00:12:00.000,2024-07-29,2024,7,29,45791,[],()
70049,46957,19150,1,USD 45.00,10:48 24-January-2025,,45.0,45.0,45.0,2025-01-24 10:48:00.000,2025-01-24,2025,1,24,46957,[],()
68689,44479,19027,5,€ 71.5,21:07;05/28/25,"Suite 645 290 Swaniawski Common, North Fatimah, DE 91912",85.8,85.8,429.0,2025-05-28 21:07:00.000,2025-05-28,2025,5,28,44479,[],()
64513,44874,19524,3,47.50 USD,07:49:53 pm;2025-06-09,,47.5,47.5,142.5,2025-06-09 19:49:53.000,2025-06-09,2025,6,9,44874,[],()
71054,44424,19152,1,29.99$,"08/10/24,20:39",,29.99,29.99,29.99,2024-08-10 20:39:00.000,2024-08-10,2024,8,10,44424,[],()
67316,46576,19050,2,$ 66.99,26-SEP-2024 00:44:06,,66.99,66.99,133.98,2024-09-26 00:44:06.000,2024-09-26,2024,9,26,46576,[],()
63989,46260,19169,1,73. USD,2024-04-26T10:25:11,,73.0,73.0,73.0,2024-04-26 10:25:11.000,2024-04-26,2024,4,26,46260,[],()
64915,45197,19114,2,42.25$,"2024-04-05, 23:16:00","Suite 314 871 Vandervort Loaf, Ziemannberg, KY 39822-7962",42.25,42.25,84.5,2024-04-05 23:16:00.000,2024-04-05,2024,4,5,45197,[],()
68167,47181,18943,1,$69¢75,"10:35:20 PM, 2024-07-10","Suite 999 2136 Willms Vista, South Omaburgh, NM 51106",6975.0,6975.0,6975.0,2024-07-10 22:35:20.000,2024-07-10,2024,7,10,45635,[],()
68133,45801,18843,1,18.99 €,13:47 2025-06-03,,22.787999999999997,22.787999999999997,22.79,2025-06-03 13:47:00.000,2025-06-03,2025,6,3,45801,[],()
71613,45916,19413,2,35$25¢,10-AUG-2024 04:15:38,"Apt. 431 343 Ollie Mission, West Leoniafurt, MT 42173-8989",3525.0,3525.0,7050.0,2024-08-10 04:15:38.000,2024-08-10,2024,8,10,45916,[],()
73125,44490,19433,1,$ 70.75,"01/12/25, 02:06:59","Suite 748 42833 Melvin Turnpike, Delmouth, OK 81353",70.75,70.75,70.75,2025-01-12 02:06:59.000,2025-01-12,2025,1,12,44490,[],()
72652,45199,19161,3,USD37.99,"03/08/25, 16:21:37",NULL,37.99,37.99,113.97,2025-03-08 16:21:37.000,2025-03-08,2025,3,8,45199,[],()
65468,47284,19484,1,€53.5,"03/17/25,15:53",NULL,64.2,64.2,64.2,2025-03-17 15:53:00.000,2025-03-17,2025,3,17,47284,[],()
73605,47101,18893,5,$ 50.00,23:04 03/18/25,NULL,50.0,50.0,250.0,2025-03-18 23:04:00.000,2025-03-18,2025,3,18,47101,[],()
73348,45874,18926,2,33.00USD,21:23;01/02/25,NULL,33.0,33.0,66.0,2025-01-02 21:23:00.000,2025-01-02,2025,1,2,45874,[],()
62840,45955,19258,1,USD70.25,2024-12-26 10:30:21 AM,"Suite 141 98787 Tenesha Plain, Fishermouth, NV 36046",70.25,70.25,70.25,2024-12-26 10:30:21.000,2024-12-26,2024,12,26,45955,[],()
71181,45496,18868,1,€26.99,"2025-04-03,03:22:12 P.M.",,32.388,32.388,32.39,2025-04-03 15:22:12.000,2025-04-03,2025,4,3,45496,[],()
71679,45575,19402,2,29.00USD,"04:18,  3-July-2025","Suite 480 129 Trantow Rue, Osinskitown, NJ 35367-7129",29.0,29.0,58.0,2025-07-03 04:18:00.000,2025-07-03,2025,7,3,45575,[],()
68934,45626,19208,1,53.75€,"02:45,2024-12-18",NULL,64.5,64.5,64.5,2024-12-18 02:45:00.000,2024-12-18,2024,12,18,45149,[],()
69571,44589,19550,2,€30¢50,2025-05-14T10:16:21,"Suite 568 103 Lueilwitz Gateway, Martyville, ND 53881-8629",3660.0,3660.0,7320.0,2025-05-14 10:16:21.000,2025-05-14,2025,5,14,45729,[],()
70405,44439,19474,1,31.00 USD,22:24;2024-12-01,,31.0,31.0,31.0,2024-12-01 22:24:00.000,2024-12-01,2024,12,1,44439,[],()
72262,47230,19252,1,23.25EUR,04:26:21 08/21/24,NULL,27.9,27.9,27.9,2024-08-21 04:26:21.000,2024-08-21,2024,8,21,47230,[],()
67427,47120,19379,1,53.5 $,"03/09/25,01:34:22 am","8182 Toby Forges, Lake Bernieberg, NV 90823-7190",53.5,53.5,53.5,2025-03-09 01:34:22.000,2025-03-09,2025,3,9,47120,[],()
62928,45676,19499,4,29.USD,"2025-07-04, 01:07:26",,29.0,29.0,116.0,2025-07-04 01:07:26.000,2025-07-04,2025,7,4,45676,[],()
63191,47094,19530,2,18.25USD,"18:31:09, 12-JUL-2025","27694 Eloise Trace, Hortensiastad, MN 25025-2894",18.25,18.25,36.5,2025-07-12 18:31:09.000,2025-07-12,2025,7,12,47094,[],()
64333,45106,18950,1,46.99 EUR,13:53 24-SEP-2024,NULL,56.388,56.388,56.39,2024-09-24 13:53:00.000,2024-09-24,2024,9,24,45106,[],()
71923,45492,19396,1,USD 43.50,"2024-12-11, 08:50:27 AM",NULL,43.5,43.5,43.5,2024-12-11 08:50:27.000,2024-12-11,2024,12,11,45492,[],()
63108,46950,19373,1,$48.25,"12:50:20,02/03/25",,48.25,48.25,48.25,2025-02-03 12:50:20.000,2025-02-03,2025,2,3,46950,[],()
68631,46697,19425,3,41.25$,"03:00:32 PM,24-August-2024","595 Hermann Rapids, New Jarodstad, MO 49716-1096",41.25,41.25,123.75,2024-08-24 15:00:32.000,2024-08-24,2024,8,24,46697,[],()
73723,45033,18852,1,18.25USD,25-Dec-2024 11:54:10,,18.25,18.25,18.25,2024-12-25 11:54:10.000,2024-12-25,2024,12,25,46468,[],()
68259,47048,19278,2,$38,2024-03-21;17:38:38,,38.0,38.0,76.0,2024-03-21 17:38:38.000,2024-03-21,2024,3,21,47048,[],()
66767,44425,18883,1,23.75 €,"06:19, 27-October-2024","Apt. 210 1172 Greenfelder Coves, East Ashley, CT 83754-4190",28.5,28.5,28.5,2024-10-27 06:19:00.000,2024-10-27,2024,10,27,44425,[],()
63699,45912,19415,1,13.25$,"2024-08-17, 16:56",,13.25,13.25,13.25,2024-08-17 16:56:00.000,2024-08-17,2024,8,17,45912,[],()
72199,44806,18906,1,$38.75,10:24:23 AM 2024-10-20,"8465 Goyette Shores, Colinchester, MI 26685",38.75,38.75,38.75,2024-10-20 10:24:23.000,2024-10-20,2024,10,20,44806,[],()
73091,45133,18868,2,USD 26.25,09/11/24;07:39:47 A.M.,,26.25,26.25,52.5,2024-09-11 07:39:47.000,2024-09-11,2024,9,11,45133,[],()
64643,45915,19311,1,$69¢50,"23:07,10-OCT-2024",NULL,6950.0,6950.0,6950.0,2024-10-10 23:07:00.000,2024-10-10,2024,10,10,45915,[],()
65141,47600,19582,1,$ 42.0,10/21/24;06:21:56 AM,,42.0,42.0,42.0,2024-10-21 06:21:56.000,2024-10-21,2024,10,21,44896,[],()
62963,45895,18983,1,31.50 USD,"08/25/24,03:13:21 PM",NULL,31.5,31.5,31.5,2024-08-25 15:13:21.000,2024-08-25,2024,8,25,45895,[],()
63686,45561,19269,2,€ 25.00,"12/22/24,11:34:54 P.M.",,30.0,30.0,60.0,2024-12-22 23:34:54.000,2024-12-22,2024,12,22,45561,[],()
68501,44927,19189,2,19.50 USD,03:23:21; 8-August-2024,,19.5,19.5,39.0,2024-08-08 03:23:21.000,2024-08-08,2024,8,8,44927,[],()
72504,45763,19446,1,53.0USD,2024-08-29T23:17:11,"Suite 718 2504 Connelly Mountains, Funkfurt, OR 36196-0952",53.0,53.0,53.0,2024-08-29 23:17:11.000,2024-08-29,2024,8,29,45763,[],()
63573,44681,19190,1,EUR45.50,"2024-09-17, 23:23:13",,54.6,54.6,54.6,2024-09-17 23:23:13.000,2024-09-17,2024,9,17,44681,[],()
63393,46619,19164,2,34.0 €,2024-04-16T23:24:47.302,,40.8,40.8,81.6,2024-04-16 23:24:47.302,2024-04-16,2024,4,16,46619,[],()
70306,46027,18998,1,48.5 $," 7-AUG-2025,08:28:05 PM",,48.5,48.5,48.5,2025-08-07 20:28:05.000,2025-08-07,2025,8,7,46027,[],()
73742,45514,19426,1,42USD,"01/05/25,02:57:04 PM",NULL,42.0,42.0,42.0,2025-01-05 14:57:04.000,2025-01-05,2025,1,5,45514,[],()
67370,46060,19071,1,$ 14.25,"29-Nov-2024,14:11","8816 Isaiah Neck, Port Sebastian, OR 91569-4521",14.25,14.25,14.25,2024-11-29 14:11:00.000,2024-11-29,2024,11,29,46060,[],()
63907,44572,19348,1,31.99$," 2-October-2024, 11:14:26",,31.99,31.99,31.99,2024-10-02 11:14:26.000,2024-10-02,2024,10,2,44572,[],()
70822,44381,19121,1,71.00USD,22-JAN-2025 22:16:09,,71.0,71.0,71.0,2025-01-22 22:16:09.000,2025-01-22,2025,1,22,44381,[],()
68165,45978,19505,1,17.5 USD,09/14/24 02:41:51 pm,,17.5,17.5,17.5,2024-09-14 14:41:51.000,2024-09-14,2024,9,14,45978,[],()
65983,46671,19510,1,17.0 USD,"2025-03-19,07:05:34 A.M.",,17.0,17.0,17.0,2025-03-19 07:05:34.000,2025-03-19,2025,3,19,46671,[],()
66659,47047,19040,1,17.00 $,25.06.2025 15:54:54,NULL,17.0,17.0,17.0,2025-06-25 15:54:54.000,2025-06-25,2025,6,25,47047,[],()
64136,47546,19571,3,$16,22:55:04 07/20/24,,16.0,16.0,48.0,2024-07-20 22:55:04.000,2024-07-20,2024,7,20,47546,[],()
63753,46825,19005,1,USD 40.75,"2024-09-29, 16:23:25",,40.75,40.75,40.75,2024-09-29 16:23:25.000,2024-09-29,2024,9,29,46825,[],()
66045,45141,19349,1,USD42.25,01/18/25;01:36,,42.25,42.25,42.25,2025-01-18 01:36:00.000,2025-01-18,2025,1,18,45141,[],()
72474,44717,18931,2,$35.50,"11:49,2024-11-26",NULL,35.5,35.5,71.0,2024-11-26 11:49:00.000,2024-11-26,2024,11,26,44717,[],()
64458,45040,19154,1,70.50 $,2025-03-23T18:40:13,,70.5,70.5,70.5,2025-03-23 18:40:13.000,2025-03-23,2025,3,23,45040,[],()
72509,46801,19235,1,64.0 €,"2024-07-18,04:58:25 PM",NULL,76.8,76.8,76.8,2024-07-18 16:58:25.000,2024-07-18,2024,7,18,46801,[],()
73825,45698,19110,2,58.75$,24-Aug-2024;10:58:03 PM,NULL,58.75,58.75,117.5,2024-08-24 22:58:03.000,2024-08-24,2024,8,24,45698,[],()
70391,46079,18904,2,36.5$,2024-10-27 02:52:26 am,"Suite 110 8617 Wes Manor, Nienowmouth, AZ 40156-4440",36.5,36.5,73.0,2024-10-27 02:52:26.000,2024-10-27,2024,10,27,46079,[],()
67811,46377,19038,1,USD61.5,02:04:43 P.M. 04/06/25,,61.5,61.5,61.5,2025-04-06 14:04:43.000,2025-04-06,2025,4,6,46377,[],()
71607,46093,19460,1,€35.99,2024-09-25;11:55:20 A.M.,NULL,43.188,43.188,43.19,2024-09-25 11:55:20.000,2024-09-25,2024,9,25,46093,[],()
69527,47321,19520,4,29.0 USD,"07:03:04 AM, 24-February-2025",,29.0,29.0,116.0,2025-02-24 07:03:04.000,2025-02-24,2025,2,24,47321,[],()
68104,47533,19095,3,EUR 61.75,"02:15, 26-Mar-2024",,74.1,74.1,222.3,2024-03-26 02:15:00.000,2024-03-26,2024,3,26,47533,[],()
71825,44500,19362,2,38.50 €,09:18:39 pm 07/07/25,"Suite 302 27763 Lesch Trace, Bahringerview, VA 23707-7571",46.199999999999996,46.199999999999996,92.4,2025-07-07 21:18:39.000,2025-07-07,2025,7,7,44500,[],()
67251,44689,19584,2,€38¢75,"08/12/24,10:30:24 am",,4650.0,4650.0,9300.0,2024-08-12 10:30:24.000,2024-08-12,2024,8,12,44689,[],()
70312,44459,19048,1,33.99€,2024-05-08T06:09:30.331,,40.788000000000004,40.788000000000004,40.79,2024-05-08 06:09:30.331,2024-05-08,2024,5,8,44459,[],()
70275,46455,19104,1,60.00 €,26.04.2024  6:12:12,,72.0,72.0,72.0,2024-04-26 06:12:12.000,2024-04-26,2024,4,26,46455,[],()
69536,47359,18841,4,$ 19.75,09:40:45 PM;2024-10-16,,19.75,19.75,79.0,2024-10-16 21:40:45.000,2024-10-16,2024,10,16,47359,[],()
68960,47187,19379,1,55.00 USD,"06:52:55,05/15/25",,55.0,55.0,55.0,2025-05-15 06:52:55.000,2025-05-15,2025,5,15,47187,[],()
66852,44882,19024,1,56.25 USD,Thu Aug 29 07:50:27 2024,"6022 Coleen Course, North Jennetteport, MA 90025",56.25,56.25,56.25,2024-08-29 07:50:27.000,2024-08-29,2024,8,29,44882,[],()
72597,47171,19379,2,$53.,07/14/24;00:27,,53.0,53.0,106.0,2024-07-14 00:27:00.000,2024-07-14,2024,7,14,47171,[],()
68069,45949,18965,2,62.75 USD,"06:13,26-Jan-2025",,62.75,62.75,125.5,2025-01-26 06:13:00.000,2025-01-26,2025,1,26,45949,[],()
72771,46341,18876,1,18.50 EUR,02:54:09 P.M. 14-June-2025,,22.2,22.2,22.2,2025-06-14 14:54:09.000,2025-06-14,2025,6,14,46341,[],()
73233,44720,19402,1,28.99USD,01/20/25;06:03,"20172 Stehr Cliff, Hagenesborough, NE 31405-2619",28.99,28.99,28.99,2025-01-20 06:03:00.000,2025-01-20,2025,1,20,44720,[],()
72520,46967,18917,1,USD68.0,05:31:44;11-Dec-2024,,68.0,68.0,68.0,2024-12-11 05:31:44.000,2024-12-11,2024,12,11,46967,[],()
70827,45871,19206,1,25.50 $,16-February-2025 04:46:56 A.M.,"Suite 672 745 Mohamed Field, New Kenny, MN 26611-4016",25.5,25.5,25.5,2025-02-16 04:46:56.000,2025-02-16,2025,2,16,45871,[],()
70380,47181,19055,3,USD19.00,21:34;03/07/24,"Suite 999 2136 Willms Vista, South Omaburgh, NM 51106",19.0,19.0,57.0,2024-03-07 21:34:00.000,2024-03-07,2024,3,7,45635,[],()
72783,46316,19293,2,30.99EUR,"04/15/25,17:32:09","7883 Rasheeda Wells, Port Hugochester, KY 86234-1032",37.187999999999995,37.187999999999995,74.38,2025-04-15 17:32:09.000,2025-04-15,2025,4,15,46797,[],()
65414,46080,19223,2,20.5 $,"05:47:20 PM, 9-Apr-2025","Suite 641 5277 Marcelo Causeway, Ruthieview, SC 25122-6347",20.5,20.5,41.0,2025-04-09 17:47:20.000,2025-04-09,2025,4,9,46080,[],()
65694,47334,19220,1,62.25USD,18:19 12/06/24,NULL,62.25,62.25,62.25,2024-12-06 18:19:00.000,2024-12-06,2024,12,6,45315,[],()
72265,47547,19122,1,35.99 USD,"12:44:46 A.M., 2025-04-18",NULL,35.99,35.99,35.99,2025-04-18 00:44:46.000,2025-04-18,2025,4,18,47547,[],()
66407,47241,19577,2,€73,"31-DEC-2024, 04:56:34 A.M.",,87.6,87.6,175.2,2024-12-31 04:56:34.000,2024-12-31,2024,12,31,47241,[],()
71977,46048,19052,1,67.0 €,2024-12-13T11:01:20,"4482 Streich Ford, South Berryberg, MO 63965",80.39999999999999,80.39999999999999,80.4,2024-12-13 11:01:20.000,2024-12-13,2024,12,13,46048,[],()
68041,46325,18844,1,$ 41.50,"27-DEC-2024,11:22:18",NULL,41.5,41.5,41.5,2024-12-27 11:22:18.000,2024-12-27,2024,12,27,46325,[],()
73713,47316,19333,1,$27.5,20:05 2025-02-14,NULL,27.5,27.5,27.5,2025-02-14 20:05:00.000,2025-02-14,2025,2,14,47316,[],()
69386,46971,18862,2,27USD,31-MAR-2025 12:05:28,"Apt. 702 965 Edra Shoal, Langbury, WI 56179-3244",27.0,27.0,54.0,2025-03-31 12:05:28.000,2025-03-31,2025,3,31,46971,[],()
72328,47390,19543,1,37.5 USD,"2024-10-17, 03:18",,37.5,37.5,37.5,2024-10-17 03:18:00.000,2024-10-17,2024,10,17,47390,[],()
69545,46561,19009,2,$ 74.5,"2024-10-26, 12:53:58 P.M.",NULL,74.5,74.5,149.0,2024-10-26 12:53:58.000,2024-10-26,2024,10,26,46561,[],()
71393,46874,19204,1,47 EUR,"27-October-2024,06:28:47",,56.4,56.4,56.4,2024-10-27 06:28:47.000,2024-10-27,2024,10,27,46874,[],()
72183,46863,19150,1,$43,05/19/25 04:25,,43.0,43.0,43.0,2025-05-19 04:25:00.000,2025-05-19,2025,5,19,45799,[],()
64062,45476,19529,1,18.99$,"11:00:11 AM,11/16/24",NULL,18.99,18.99,18.99,2024-11-16 11:00:11.000,2024-11-16,2024,11,16,45476,[],()
70981,47361,19444,1,41USD,"21:56,04/01/25",,41.0,41.0,41.0,2025-04-01 21:56:00.000,2025-04-01,2025,4,1,47361,[],()
69573,46129,19381,1,27.75USD,"26-Jul-2024, 03:38:47 A.M.",,27.75,27.75,27.75,2024-07-26 03:38:47.000,2024-07-26,2024,7,26,46129,[],()
72830,46182,18891,2,$22.75,"00:52:31,2025-08-10","Apt. 534 7541 Ortiz Grove, South Marianmouth, CO 48259",22.75,22.75,45.5,2025-08-10 00:52:31.000,2025-08-10,2025,8,10,46182,[],()
73067,45267,19279,1,USD 18.,2024-05-11 04:39:05 AM,,18.0,18.0,18.0,2024-05-11 04:39:05.000,2024-05-11,2024,5,11,45267,[],()
72290,44665,19286,1,22.25USD,"10/27/24,02:24:17",NULL,22.25,22.25,22.25,2024-10-27 02:24:17.000,2024-10-27,2024,10,27,44665,[],()
65024,46564,19013,1,48.50 $,"11:39:15,01/09/25","Apt. 613 47227 Runolfsson Parkways, West Rudolph, RI 65324",48.5,48.5,48.5,2025-01-09 11:39:15.000,2025-01-09,2025,1,9,46564,[],()
69601,44950,19507,2,$ 22,2024-06-23T03:47:01,,22.0,22.0,44.0,2024-06-23 03:47:01.000,2024-06-23,2024,6,23,44950,[],()
64611,46100,19094,1,50.0 $,03/21/25 10:03:44 PM,"Apt. 218 6968 Smitham Cove, South Sammy, IL 82143-1917",50.0,50.0,50.0,2025-03-21 22:03:44.000,2025-03-21,2025,3,21,46100,[],()
69978,47024,19401,1,60.25 $,"2024-10-24, 22:06:24",NULL,60.25,60.25,60.25,2024-10-24 22:06:24.000,2024-10-24,2024,10,24,47024,[],()
67185,46370,19361,1,$38¢50,"2024-05-30, 14:32",,3850.0,3850.0,3850.0,2024-05-30 14:32:00.000,2024-05-30,2024,5,30,46370,[],()
72986,45145,19032,1,USD71.50,"10:55:52,17-November-2024",,71.5,71.5,71.5,2024-11-17 10:55:52.000,2024-11-17,2024,11,17,45145,[],()
63532,45816,19288,1,€ 52.,09:15:56 pm;2024-11-18,,62.4,62.4,62.4,2024-11-18 21:15:56.000,2024-11-18,2024,11,18,45816,[],()
65054,44761,19216,2,USD 64.25,"2024-07-18, 07:52","Apt. 309 1105 Rudolph Lodge, North Ismael, KS 36239",64.25,64.25,128.5,2024-07-18 07:52:00.000,2024-07-18,2024,7,18,44761,[],()
72580,47432,18903,1,18.25$,04/14/25 04:41:28 pm,NULL,18.25,18.25,18.25,2025-04-14 16:41:28.000,2025-04-14,2025,4,14,47432,[],()
65469,45903,19555,1,41.5 €,2025-05-29T04:28:14,,49.8,49.8,49.8,2025-05-29 04:28:14.000,2025-05-29,2025,5,29,45903,[],()
67117,45677,19197,1,USD41.99, 1-Jun-2024 03:23:47 P.M.,,41.99,41.99,41.99,2024-06-01 15:23:47.000,2024-06-01,2024,6,1,45677,[],()
68752,44698,19101,1,USD73.25,23:40:56 11/22/24,,73.25,73.25,73.25,2024-11-22 23:40:56.000,2024-11-22,2024,11,22,44698,[],()
72734,45002,19289,1,32.25 $,"10:14, 26-Dec-2024","Apt. 136 20762 Victor Prairie, Port Lavonna, CO 65250",32.25,32.25,32.25,2024-12-26 10:14:00.000,2024-12-26,2024,12,26,45002,[],()
63103,45062,18921,2,€45¢50,01:11  6-NOV-2024,,5460.0,5460.0,10920.0,2024-11-06 01:11:00.000,2024-11-06,2024,11,6,46955,[],()
64354,44492,19363,1,26.5 €,2025-07-02T08:39:32,"Suite 320 58516 Pfannerstill Junctions, Manualbury, FL 09480",31.799999999999997,31.799999999999997,31.8,2025-07-02 08:39:32.000,2025-07-02,2025,7,2,44492,[],()
66570,47311,19458,1,58.0 EUR,2025-05-18T23:42:41,"2350 Alina Brooks, Lake Theronberg, AK 12260-5997",69.6,69.6,69.6,2025-05-18 23:42:41.000,2025-05-18,2025,5,18,47311,[],()
70978,45205,19231,1,18.0 €,"06:04:49 AM, 02/25/25",,21.599999999999998,21.599999999999998,21.6,2025-02-25 06:04:49.000,2025-02-25,2025,2,25,45205,[],()
67104,44854,18962,3,56.50€,10:47:39;07/07/24,,67.8,67.8,203.4,2024-07-07 10:47:39.000,2024-07-07,2024,7,7,44854,[],()
70591,47234,19542,1,USD 61,2024-07-25;12:01:32 AM,,61.0,61.0,61.0,2024-07-25 00:01:32.000,2024-07-25,2024,7,25,47234,[],()
65609,45601,18958,1,13 $,16-APR-2025 05:52,,13.0,13.0,13.0,2025-04-16 05:52:00.000,2025-04-16,2025,4,16,45601,[],()
69819,46622,19472,1,€ 67.0,"01/13/25,06:54:44 am",,80.39999999999999,80.39999999999999,80.4,2025-01-13 06:54:44.000,2025-01-13,2025,1,13,46622,[],()
73080,47389,19100,3,18.0$,"2025-03-21,07:41:02 AM",,18.0,18.0,54.0,2025-03-21 07:41:02.000,2025-03-21,2025,3,21,47389,[],()
63860,45560,18961,1,USD 70.5,"14:35:43,10/06/24",,70.5,70.5,70.5,2024-10-06 14:35:43.000,2024-10-06,2024,10,6,45560,[],()
62887,44921,19123,1,49.50USD,"03:22,2025-04-08","Suite 446 40867 Elida Brooks, Metzview, NJ 50431-4166",49.5,49.5,49.5,2025-04-08 03:22:00.000,2025-04-08,2025,4,8,44921,[],()
70437,45906,18859,1,53 USD,"03:43:00,12/06/24","Suite 570 9103 Casandra Lake, McGlynnville, MS 22248",53.0,53.0,53.0,2024-12-06 03:43:00.000,2024-12-06,2024,12,6,45906,[],()
64946,45876,19097,1,$63¢99,2024-09-16T22:11:31,NULL,6399.0,6399.0,6399.0,2024-09-16 22:11:31.000,2024-09-16,2024,9,16,45876,[],()
72827,46348,19032,2,$ 70.00,2024-07-13T02:09:07.038,"4553 Elicia Ford, New Elliot, AZ 32744-9417",70.0,70.0,140.0,2024-07-13 02:09:07.038,2024-07-13,2024,7,13,46348,[],()
71268,44846,18866,1,21.99 EUR,09.10.2024 13:46:46,,26.387999999999998,26.387999999999998,26.39,2024-09-10 13:46:46.000,2024-09-10,2024,9,10,44846,[],()
69037,47295,19361,1,USD39.5,"22-Apr-2025, 07:00:59",,39.5,39.5,39.5,2025-04-22 07:00:59.000,2025-04-22,2025,4,22,47295,[],()
73606,44695,19454,1,USD68.0,"2024-10-28, 17:28",,68.0,68.0,68.0,2024-10-28 17:28:00.000,2024-10-28,2024,10,28,44695,[],()
67952,45798,19336,1,USD 46.75,18.07.2024  4:05:05,"Suite 752 196 Pacocha Keys, North Tyrellside, TX 83870-5314",46.75,46.75,46.75,2024-07-18 04:05:05.000,2024-07-18,2024,7,18,45798,[],()
64596,47298,18875,2,$48¢50,"2024-11-20, 06:39",,4850.0,4850.0,9700.0,2024-11-20 06:39:00.000,2024-11-20,2024,11,20,47298,[],()
71588,45935,18928,1,21.25 $," 4-March-2025, 09:15:34",NULL,21.25,21.25,21.25,2025-03-04 09:15:34.000,2025-03-04,2025,3,4,45935,[],()
72322,44557,19560,1,26.00 USD,Sat Sep 14 05:44:58 2024,,26.0,26.0,26.0,2024-09-14 05:44:58.000,2024-09-14,2024,9,14,44557,[],()
72849,46284,19208,1,53.5 USD,01:33:50 P.M.;03/01/25,"Suite 164 9361 Bogan Pass, West Glenborough, CT 50209",53.5,53.5,53.5,2025-03-01 13:33:50.000,2025-03-01,2025,3,1,46284,[],()
69612,45120,18999,1,52.99 USD,"10:13:02 A.M.,05/24/25",,52.99,52.99,52.99,2025-05-24 10:13:02.000,2025-05-24,2025,5,24,45120,[],()
65030,46894,19476,1,20.25USD,04:33; 8-NOV-2024,NULL,20.25,20.25,20.25,2024-11-08 04:33:00.000,2024-11-08,2024,11,8,46894,[],()
71964,46366,19483,1,59 USD,"12/29/24, 08:37","Suite 140 5078 Preston Lodge, Willieland, SD 18649",59.0,59.0,59.0,2024-12-29 08:37:00.000,2024-12-29,2024,12,29,46366,[],()
68607,44504,19570,1,USD 45.5,2025-01-11T23:26:26,NULL,45.5,45.5,45.5,2025-01-11 23:26:26.000,2025-01-11,2025,1,11,44504,[],()
72422,44425,19016,1,$49¢75, 3-Feb-2024 07:44,,4975.0,4975.0,4975.0,2024-02-03 07:44:00.000,2024-02-03,2024,2,3,44425,[],()
65252,44409,19076,1,$18.75,14:53:48;2024-04-18,NULL,18.75,18.75,18.75,2024-04-18 14:53:48.000,2024-04-18,2024,4,18,44409,[],()
66607,45870,19346,1,39 USD,21:25;2024-12-05,"Suite 562 132 Mario Junctions, Stuartport, DE 29043-3232",39.0,39.0,39.0,2024-12-05 21:25:00.000,2024-12-05,2024,12,5,45870,[],()
66455,47150,19140,1,USD67.99,08:00 2024-11-12,,67.99,67.99,67.99,2024-11-12 08:00:00.000,2024-11-12,2024,11,12,47150,[],()
72456,46782,19136,1,$48.00,2025-03-29T19:38:25.407,NULL,48.0,48.0,48.0,2025-03-29 19:38:25.407,2025-03-29,2025,3,29,46782,[],()
64396,44569,18872,4,$41.,2025-03-14T06:54:41,,41.0,41.0,164.0,2025-03-14 06:54:41.000,2025-03-14,2025,3,14,44569,[],()
66373,46344,19334,1,67.00 USD,08:16:57 08/28/24,"Apt. 795 937 Hoppe Falls, Krisborough, IL 77348-3667",67.0,67.0,67.0,2024-08-28 08:16:57.000,2024-08-28,2024,8,28,46344,[],()
66542,46604,19126,1,30.00 $,06:49;2024-07-30,,30.0,30.0,30.0,2024-07-30 06:49:00.000,2024-07-30,2024,7,30,46604,[],()
63696,46725,19342,1,USD40.99,2024-09-20T01:49:20.836,NULL,40.99,40.99,40.99,2024-09-20 01:49:20.836,2024-09-20,2024,9,20,46725,[],()
64154,45750,18844,2,40.25EUR,2025-02-10T02:43:55.483,,48.3,48.3,96.6,2025-02-10 02:43:55.483,2025-02-10,2025,2,10,45750,[],()
67865,46126,19547,1,€62.50,05:18 10/19/24,NULL,75.0,75.0,75.0,2024-10-19 05:18:00.000,2024-10-19,2024,10,19,46126,[],()
62989,45431,19049,2,54.00$," 3-OCT-2024,04:43",,54.0,54.0,108.0,2024-10-03 04:43:00.000,2024-10-03,2024,10,3,45431,[],()
70428,44363,18851,2,63.50USD,"10:22:22,2025-04-14",,63.5,63.5,127.0,2025-04-14 10:22:22.000,2025-04-14,2025,4,14,44363,[],()
68797,45216,18842,1,60.0€,16:39:00;10/05/24,"404 Teena Passage, New Lennaland, IL 85293",72.0,72.0,72.0,2024-10-05 16:39:00.000,2024-10-05,2024,10,5,45216,[],()
69497,46070,19318,1,26.00$,2025-04-23;15:35,"Suite 186 2226 Talia Alley, Fritschshire, FL 52192",26.0,26.0,26.0,2025-04-23 15:35:00.000,2025-04-23,2025,4,23,46070,[],()
70753,46304,19241,1,$37.5,2024-06-04;08:20:59,,37.5,37.5,37.5,2024-06-04 08:20:59.000,2024-06-04,2024,6,4,46304,[],()
67766,46306,19151,1,41.00 USD,2024-09-30T19:35:17,"Apt. 371 6460 Mraz Crescent, Larkinborough, KY 48918",41.0,41.0,41.0,2024-09-30 19:35:17.000,2024-09-30,2024,9,30,46306,[],()
71047,47137,19125,1,14.00USD,2025-02-20 06:30,"Apt. 168 5943 Ankunding Rapid, Mandibury, VA 28100",14.0,14.0,14.0,2025-02-20 06:30:00.000,2025-02-20,2025,2,20,47137,[],()
63975,45624,18902,3,16.99USD,"2025-07-26, 10:33:53",,16.99,16.99,50.97,2025-07-26 10:33:53.000,2025-07-26,2025,7,26,45624,[],()
62818,45890,19578,2,44 USD,"20:20:16,22-May-2024",,44.0,44.0,88.0,2024-05-22 20:20:16.000,2024-05-22,2024,5,22,45890,[],()
73699,47083,19051,1,USD 74.0,2024-11-17T01:28:42,"1832 Kuphal Lock, Boganfort, TN 90349",74.0,74.0,74.0,2024-11-17 01:28:42.000,2024-11-17,2024,11,17,47083,[],()
71940,44891,19215,1,17 USD,13:50:47 27-SEP-2024,"4765 Conchita Green, Lake Claytonshire, NJ 71932-6685",17.0,17.0,17.0,2024-09-27 13:50:47.000,2024-09-27,2024,9,27,44891,[],()
71355,46301,19106,1,USD 44.25,08/07/24 03:24:25 am,,44.25,44.25,44.25,2024-08-07 03:24:25.000,2024-08-07,2024,8,7,46301,[],()
65105,47301,19463,1,EUR 63.5,10:27;2024-10-10,,76.2,76.2,76.2,2024-10-10 10:27:00.000,2024-10-10,2024,10,10,47301,[],()
68833,46606,19127,1,61.0 EUR,23-OCT-2024;22:20,,73.2,73.2,73.2,2024-10-23 22:20:00.000,2024-10-23,2024,10,23,46606,[],()
70740,45459,18930,1,33.75 USD,2025-04-09T19:17:41.025,,33.75,33.75,33.75,2025-04-09 19:17:41.025,2025-04-09,2025,4,9,45459,[],()
70449,47318,19487,1,EUR 70.00,"2024-12-29, 08:59:57 PM",,84.0,84.0,84.0,2024-12-29 20:59:57.000,2024-12-29,2024,12,29,47318,[],()
70375,45428,19469,1,34.5 €,2025-08-18 08:49:05 PM,"Apt. 530 5821 Abshire Crossroad, North Obdulia, NC 18814",41.4,41.4,41.4,2025-08-18 20:49:05.000,2025-08-18,2025,8,18,45428,[],()
63067,46379,18851,1,61.USD,"22:05,05/29/24",,61.0,61.0,61.0,2024-05-29 22:05:00.000,2024-05-29,2024,5,29,46379,[],()
65154,47300,19224,3,$58.25,20:22:35;14-March-2024,,58.25,58.25,174.75,2024-03-14 20:22:35.000,2024-03-14,2024,3,14,47300,[],()
63448,46064,19011,5,56.25 EUR,16.04.2025  5:43:43,NULL,67.5,67.5,337.5,2025-04-16 05:43:43.000,2025-04-16,2025,4,16,46064,[],()
70114,45406,18890,1,€67.75,"03:01:07, 09/11/24","Apt. 225 804 Tillman Hill, Chasemouth, NC 11865-4288",81.3,81.3,81.3,2024-09-11 03:01:07.000,2024-09-11,2024,9,11,45406,[],()
62746,46750,19502,4,39$50¢,"06:06:15 P.M., 2-Jan-2025",,3950.0,3950.0,15800.0,2025-01-02 18:06:15.000,2025-01-02,2025,1,2,46750,[],()
73075,44740,19457,1,EUR 29.99,"00:04:16, 2024-12-01",,35.988,35.988,35.99,2024-12-01 00:04:16.000,2024-12-01,2024,12,1,45627,[],()
70383,45605,19555,1,USD 42.,02/17/25 12:37:44 am,"7070 Fisher Mountains, South Isabel, AK 91706-3406",42.0,42.0,42.0,2025-02-17 00:37:44.000,2025-02-17,2025,2,17,45605,[],()
71251,47129,18863,1,28.0USD,"04:56:37,15-Sep-2024",,28.0,28.0,28.0,2024-09-15 04:56:37.000,2024-09-15,2024,9,15,47129,[],()
68814,47556,19113,1,71.$," 1-October-2024, 05:10:24 AM",,71.0,71.0,71.0,2024-10-01 05:10:24.000,2024-10-01,2024,10,1,47556,[],()
69830,44552,19091,5,EUR23.00,"05:46:05 AM, 12/13/24",NULL,27.599999999999998,27.599999999999998,138.0,2024-12-13 05:46:05.000,2024-12-13,2024,12,13,44552,[],()
66926,45165,19158,1,64.00 EUR,2024-10-06;18:19,,76.8,76.8,76.8,2024-10-06 18:19:00.000,2024-10-06,2024,10,6,45165,[],()
63741,46976,18979,1,€68.0,2025-03-06;06:48:40 PM,,81.6,81.6,81.6,2025-03-06 18:48:40.000,2025-03-06,2025,3,6,46976,[],()
64296,47376,19046,1,€24.50,"2024-12-07, 07:41:37 am","Apt. 542 9413 Rayford Mall, South Renato, KY 56989-3821",29.4,29.4,29.4,2024-12-07 07:41:37.000,2024-12-07,2024,12,7,47376,[],()
70938,46098,18985,1,$54.5,"04/04/25,10:43:37 pm",,54.5,54.5,54.5,2025-04-04 22:43:37.000,2025-04-04,2025,4,4,46098,[],()
68949,45170,18972,3,$ 26.75,"2025-01-06, 06:50:10 A.M.",NULL,26.75,26.75,80.25,2025-01-06 06:50:10.000,2025-01-06,2025,1,6,45170,[],()
69855,44735,19587,1,USD33.50,"10/23/24, 17:03","Suite 706 8695 Jorge Viaduct, West Scottieshire, NE 19857",33.5,33.5,33.5,2024-10-23 17:03:00.000,2024-10-23,2024,10,23,44735,[],()
67059,45462,19479,2,60.0$,20-Apr-2025 10:51,,60.0,60.0,120.0,2025-04-20 10:51:00.000,2025-04-20,2025,4,20,45462,[],()
63693,45465,19362,1,$ 37.50,"01:53:55 AM,2025-03-04",,37.5,37.5,37.5,2025-03-04 01:53:55.000,2025-03-04,2025,3,4,45465,[],()
66599,47046,18931,1,39.99€,2025-02-11T04:54:34,,47.988,47.988,47.99,2025-02-11 04:54:34.000,2025-02-11,2025,2,11,47046,[],()
70876,44658,19454,2,EUR68.,"17:40:16,2025-09-07",,81.6,81.6,163.2,2025-09-07 17:40:16.000,2025-09-07,2025,9,7,44658,[],()
71437,44463,19494,4,30.50USD,01:37:41 2024-11-23,,30.5,30.5,122.0,2024-11-23 01:37:41.000,2024-11-23,2024,11,23,44463,[],()
64297,47473,18928,5,19$,Tue May  6 20:12:24 2025,NULL,19.0,19.0,95.0,2025-05-06 20:12:24.000,2025-05-06,2025,5,6,47473,[],()
73844,45299,19000,1,USD 57.99,2024-11-22T04:43:24.371,,57.99,57.99,57.99,2024-11-22 04:43:24.371,2024-11-22,2024,11,22,45299,[],()
71757,45275,18856,1,$ 50.25,08:37:19 PM;12/20/24,"Apt. 279 5485 Sidney Islands, North Mistie, ND 56675",50.25,50.25,50.25,2024-12-20 20:37:19.000,2024-12-20,2024,12,20,45275,[],()
65917,44938,19332,1,USD 40.25,2024-10-09 10:07:06 pm,NULL,40.25,40.25,40.25,2024-10-09 22:07:06.000,2024-10-09,2024,10,9,46170,[],()
63876,45849,18885,1,$28.00,"19:34,04/27/25","89159 Nathan Turnpike, Bayerport, VT 42787",28.0,28.0,28.0,2025-04-27 19:34:00.000,2025-04-27,2025,4,27,45849,[],()
66240,44999,19140,1,66.50 USD,06:18:41 P.M.;07/30/25,,66.5,66.5,66.5,2025-07-30 18:18:41.000,2025-07-30,2025,7,30,44999,[],()
64209,47189,19182,1,€ 55.25, 4-SEP-2024 19:05,,66.3,66.3,66.3,2024-09-04 19:05:00.000,2024-09-04,2024,9,4,47189,[],()
65584,46865,19270,1,20.0USD,2025-03-10T23:12:54,NULL,20.0,20.0,20.0,2025-03-10 23:12:54.000,2025-03-10,2025,3,10,46865,[],()
72865,46230,18875,1,USD 45.75,14:03:51  5-JUN-2025,"2452 Sanford Passage, Georgettaton, WA 11960-7469",45.75,45.75,45.75,2025-06-05 14:03:51.000,2025-06-05,2025,6,5,46230,[],()
72601,46643,19289,1,32.5 $,"19-Sep-2024, 03:24:09",,32.5,32.5,32.5,2024-09-19 03:24:09.000,2024-09-19,2024,9,19,46643,[],()
64002,47529,19452,2,36.25 €,"11-NOV-2024, 15:20","Apt. 300 912 Shay Summit, Rayeville, IL 74149",43.5,43.5,87.0,2024-11-11 15:20:00.000,2024-11-11,2024,11,11,47529,[],()
73737,44482,19399,1,€18.00,11/01/24;08:34:57 PM,,21.599999999999998,21.599999999999998,21.6,2024-11-01 20:34:57.000,2024-11-01,2024,11,1,44482,[],()
71818,44363,19405,1,$52¢75,2025-01-16T03:54:19,"4656 Torp Viaduct, Cliffordside, MA 86136-4484",5275.0,5275.0,5275.0,2025-01-16 03:54:19.000,2025-01-16,2025,1,16,44363,[],()
67315,47474,19526,1,USD 67.0,2025-04-24T21:53:22.091,,67.0,67.0,67.0,2025-04-24 21:53:22.091,2025-04-24,2025,4,24,47474,[],()
66869,44491,19464,1,$43¢75,28-MAY-2025;16:36,,4375.0,4375.0,4375.0,2025-05-28 16:36:00.000,2025-05-28,2025,5,28,44491,[],()
66709,46782,18964,1,53.0 USD,2024-05-19T20:08:37.253,NULL,53.0,53.0,53.0,2024-05-19 20:08:37.253,2024-05-19,2024,5,19,46782,[],()
73752,46593,18936,5,65.00$,2025-03-14T19:16:50.109,NULL,65.0,65.0,325.0,2025-03-14 19:16:50.109,2025-03-14,2025,3,14,46593,[],()
69157,45797,18860,5,USD 47.50,06:03:20 09/04/24,,47.5,47.5,237.5,2024-09-04 06:03:20.000,2024-09-04,2024,9,4,45932,[],()
73687,44479,18992,1,$72.25,00:28:04; 1-DEC-2024,"Suite 645 290 Swaniawski Common, North Fatimah, DE 91912",72.25,72.25,72.25,2024-12-01 00:28:04.000,2024-12-01,2024,12,1,44479,[],()
65616,44547,19209,1,27.25USD,18:56;10/31/24,"113 Cristopher Hill, Deangeloport, VT 20897-4351",27.25,27.25,27.25,2024-10-31 18:56:00.000,2024-10-31,2024,10,31,44547,[],()
71577,44968,19158,1,64.50 USD,2024-09-24T12:30:05,,64.5,64.5,64.5,2024-09-24 12:30:05.000,2024-09-24,2024,9,24,44968,[],()
67573,45620,18879,2,70.25USD,2024-02-04T22:04:23,"1910 Pollich Skyway, Charleyberg, MS 29517-1132",70.25,70.25,140.5,2024-02-04 22:04:23.000,2024-02-04,2024,2,4,45620,[],()
73810,44719,19335,1,16.0$,00:26:03  8-August-2024,,16.0,16.0,16.0,2024-08-08 00:26:03.000,2024-08-08,2024,8,8,44719,[],()
64869,46697,18966,3,57.50 USD,06:51:01 am;08/19/24,NULL,57.5,57.5,172.5,2024-08-19 06:51:01.000,2024-08-19,2024,8,19,46697,[],()
72644,47358,19371,5,USD 62.25,"2024-11-19, 16:14",,62.25,62.25,311.25,2024-11-19 16:14:00.000,2024-11-19,2024,11,19,47358,[],()
68338,46770,19109,1,40.5€,"06/18/25, 01:06:39 AM","Suite 669 5658 Reginia Isle, Schillershire, NJ 14256-0106",48.6,48.6,48.6,2025-06-18 01:06:39.000,2025-06-18,2025,6,18,46770,[],()
63259,44938,19494,1,30.50$,"2024-11-20,10:16:36 pm",,30.5,30.5,30.5,2024-11-20 22:16:36.000,2024-11-20,2024,11,20,46170,[],()
68136,46621,19053,1,55.25€,2025-05-21T14:24:10,NULL,66.3,66.3,66.3,2025-05-21 14:24:10.000,2025-05-21,2025,5,21,46621,[],()
71159,45192,19398,1,66.5 $,2024-09-05T04:13:01,"Apt. 472 85518 Gottlieb Rapids, Port Dane, OK 65923-9837",66.5,66.5,66.5,2024-09-05 04:13:01.000,2024-09-05,2024,9,5,45192,[],()
66703,47299,19524,1,USD 49.75,"08:33:27 AM, 2025-07-09",NULL,49.75,49.75,49.75,2025-07-09 08:33:27.000,2025-07-09,2025,7,9,47299,[],()
68785,45925,19119,1,USD59.50,"03/21/25,04:52:11 pm",,59.5,59.5,59.5,2025-03-21 16:52:11.000,2025-03-21,2025,3,21,45925,[],()
67924,47017,19358,1,47$,2024-10-30T11:50:56,"Suite 437 234 Metz Land, Robinborough, TX 07017",47.0,47.0,47.0,2024-10-30 11:50:56.000,2024-10-30,2024,10,30,47017,[],()
63879,46922,19091,1,27.25 EUR,"19:41, 17-APR-2025","Suite 420 3138 Alda Forges, New Weston, WA 98391-2919",32.699999999999996,32.699999999999996,32.7,2025-04-17 19:41:00.000,2025-04-17,2025,4,17,46922,[],()
72958,46326,19048,1,33.0 $,2025-06-18;00:49,NULL,33.0,33.0,33.0,2025-06-18 00:49:00.000,2025-06-18,2025,6,18,46326,[],()
67295,47414,19104,1,USD 57.00,13.11.2024 06:06:06,,57.0,57.0,57.0,2024-11-13 06:06:06.000,2024-11-13,2024,11,13,47414,[],()
73349,46874,19540,1,$70.50,"06/25/24,07:21",,70.5,70.5,70.5,2024-06-25 07:21:00.000,2024-06-25,2024,6,25,46874,[],()
66826,46896,19055,1,$ 18.,"2024-12-22,06:32:05 A.M.",,18.0,18.0,18.0,2024-12-22 06:32:05.000,2024-12-22,2024,12,22,46896,[],()
67348,47103,19340,1,$30¢50,2024-07-31;18:06,,3050.0,3050.0,3050.0,2024-07-31 18:06:00.000,2024-07-31,2024,7,31,47103,[],()
71487,44440,18999,1,50.99 EUR,01/21/25;11:00:47 pm,,61.188,61.188,61.19,2025-01-21 23:00:47.000,2025-01-21,2025,1,21,44440,[],()
72850,47406,19489,1,37.00 USD,"2025-03-02,02:13","40954 Fritsch Lodge, West Nanette, IL 75628",37.0,37.0,37.0,2025-03-02 02:13:00.000,2025-03-02,2025,3,2,47406,[],()
69804,47489,19468,2,36.99$,"13-February-2025, 03:50",,36.99,36.99,73.98,2025-02-13 03:50:00.000,2025-02-13,2025,2,13,47489,[],()
63478,45201,18983,1,$ 36.,28.07.2024 11:43:43,,36.0,36.0,36.0,2024-07-28 11:43:43.000,2024-07-28,2024,7,28,45201,[],()
65002,44370,19312,2,EUR 74.5, 4-June-2025 02:43:51 AM,,89.39999999999999,89.39999999999999,178.8,2025-06-04 02:43:51.000,2025-06-04,2025,6,4,44370,[],()
70064,45841,19108,2,$ 42.75,19:35:39 04/07/25,NULL,42.75,42.75,85.5,2025-04-07 19:35:39.000,2025-04-07,2025,4,7,45841,[],()
63407,45994,19263,1,32. USD,"21:24, 25-Jan-2025",NULL,32.0,32.0,32.0,2025-01-25 21:24:00.000,2025-01-25,2025,1,25,45994,[],()
71348,45513,19302,1,EUR28.00,2025-03-10T14:02:03.492,NULL,33.6,33.6,33.6,2025-03-10 14:02:03.492,2025-03-10,2025,3,10,45513,[],()
63400,45118,19497,2,$ 54.75,"2025-03-01,11:41:37",,54.75,54.75,109.5,2025-03-01 11:41:37.000,2025-03-01,2025,3,1,45118,[],()
73670,46755,19423,1,35.50€,"12/25/24,07:34:10 PM",,42.6,42.6,42.6,2024-12-25 19:34:10.000,2024-12-25,2024,12,25,46755,[],()
71319,47402,19018,2,17$,"01:30:17 pm,2024-07-21",,17.0,17.0,34.0,2024-07-21 13:30:17.000,2024-07-21,2024,7,21,47402,[],()
68219,44660,18895,1,EUR 38.5,"03/15/25, 09:33",,46.199999999999996,46.199999999999996,46.2,2025-03-15 09:33:00.000,2025-03-15,2025,3,15,44660,[],()
66832,45171,18845,1,59.0 USD,11:43;2024-04-09,NULL,59.0,59.0,59.0,2024-04-09 11:43:00.000,2024-04-09,2024,4,9,45171,[],()
66618,45957,19434,1,€ 17.5,"05:14:09, 2024-06-01",NULL,21.0,21.0,21.0,2024-06-01 05:14:09.000,2024-06-01,2024,6,1,45957,[],()
73428,45071,19546,3,46.99 EUR,2025-02-14T06:20:17.654,"8195 Okuneva Ports, Markstown, SC 30511",56.388,56.388,169.16,2025-02-14 06:20:17.654,2025-02-14,2025,2,14,45071,[],()
64260,44914,18961,1,71.75 USD,2024-09-07T00:59:57.834,NULL,71.75,71.75,71.75,2024-09-07 00:59:57.834,2024-09-07,2024,9,7,44914,[],()
72403,46497,19238,1,USD18.25,10/01/24 17:07,NULL,18.25,18.25,18.25,2024-10-01 17:07:00.000,2024-10-01,2024,10,1,46497,[],()
71650,46080,19432,1,23.75 €,"11:11:35,12/11/24",,28.5,28.5,28.5,2024-12-11 11:11:35.000,2024-12-11,2024,12,11,46080,[],()
64921,45404,19313,2,$ 29.5,2024-08-12T14:58:05,,29.5,29.5,59.0,2024-08-12 14:58:05.000,2024-08-12,2024,8,12,45404,[],()
66026,44734,18944,1,17.00 USD,"11-Aug-2024,08:23:58 am",,17.0,17.0,17.0,2024-08-11 08:23:58.000,2024-08-11,2024,8,11,44734,[],()
67282,45560,18924,1,28.75 USD,"2025-02-19, 12:02:26 PM",NULL,28.75,28.75,28.75,2025-02-19 12:02:26.000,2025-02-19,2025,2,19,45560,[],()
65708,44984,19303,1,63.0 USD,06:49:39 am 11-NOV-2024,"196 Ronny Route, Port Emile, CT 28207",63.0,63.0,63.0,2024-11-11 06:49:39.000,2024-11-11,2024,11,11,44984,[],()
65065,45153,18947,5,72.5USD,2025-07-04;21:28,,72.5,72.5,362.5,2025-07-04 21:28:00.000,2025-07-04,2025,7,4,45153,[],()
64096,46781,19378,5,USD 15.75,2024-12-25T07:36:11,,15.75,15.75,78.75,2024-12-25 07:36:11.000,2024-12-25,2024,12,25,46781,[],()
68293,45325,19411,4,45.0 USD,2025-07-19T10:36:44,,45.0,45.0,180.0,2025-07-19 10:36:44.000,2025-07-19,2025,7,19,45325,[],()
69535,46936,19523,3,31.50USD,2024-09-12T11:40:25,"Apt. 744 285 Camie Neck, New Miquel, CO 64984",31.5,31.5,94.5,2024-09-12 11:40:25.000,2024-09-12,2024,9,12,46936,[],()
68396,45301,19220,2,58 USD,"12/28/24,10:06",,58.0,58.0,116.0,2024-12-28 10:06:00.000,2024-12-28,2024,12,28,45301,[],()
71999,45453,19497,2,55.5 $,02:16:29 A.M. 2024-12-23,,55.5,55.5,111.0,2024-12-23 02:16:29.000,2024-12-23,2024,12,23,45199,[],()
63900,46352,19275,1,$53¢25,Wed May 28 12:04:44 2025,NULL,5325.0,5325.0,5325.0,2025-05-28 12:04:44.000,2025-05-28,2025,5,28,46352,[],()
70133,44341,19071,1,16.99€,18:15 2025-01-19,,20.387999999999998,20.387999999999998,20.39,2025-01-19 18:15:00.000,2025-01-19,2025,1,19,44341,[],()
73444,45136,19456,1,$ 33.5,"10:46:02,12/03/24","Suite 594 216 Zieme Square, Gerardoview, PA 07120-0022",33.5,33.5,33.5,2024-12-03 10:46:02.000,2024-12-03,2024,12,3,45136,[],()
73859,44441,19391,1,54.5 USD,2025-04-26T14:43:07.121,"Suite 802 3924 Onita Trace, Delbertview, DE 92731-3465",54.5,54.5,54.5,2025-04-26 14:43:07.121,2025-04-26,2025,4,26,44441,[],()
65628,45560,19237,2,66.5USD,"11/14/24, 06:27:16 pm","44499 Thi Center, West Kiethport, NY 20467",66.5,66.5,133.0,2024-11-14 18:27:16.000,2024-11-14,2024,11,14,45560,[],()
69554,46138,19213,1,$29.75,01:07:56;11/30/24,,29.75,29.75,29.75,2024-11-30 01:07:56.000,2024-11-30,2024,11,30,46138,[],()
71731,44435,18886,2,70 USD,"04/04/25,04:40","491 Juan Orchard, Iveyville, WY 75887",70.0,70.0,140.0,2025-04-04 04:40:00.000,2025-04-04,2025,4,4,44435,[],()
73889,47529,19021,1,USD37.99,"14:24:33,  5-October-2024","Apt. 300 912 Shay Summit, Rayeville, IL 74149",37.99,37.99,37.99,2024-10-05 14:24:33.000,2024-10-05,2024,10,5,47529,[],()
69851,47618,19443,1,28.50 USD,24.09.2024 04:34:34,"Suite 691 50530 Breitenberg Cape, Delphinemouth, CO 39175",28.5,28.5,28.5,2024-09-24 04:34:34.000,2024-09-24,2024,9,24,47618,[],()
66503,47162,19302,1,28.99$,04/26/25;12:20,,28.99,28.99,28.99,2025-04-26 12:20:00.000,2025-04-26,2025,4,26,47162,[],()
64193,46983,19407,1,USD 17,2024-04-27T09:58:34.387,NULL,17.0,17.0,17.0,2024-04-27 09:58:34.387,2024-04-27,2024,4,27,46983,[],()
67542,45434,19500,1,48. $,2025-04-14 23:01:06,,48.0,48.0,48.0,2025-04-14 23:01:06.000,2025-04-14,2025,4,14,45434,[],()
63629,45930,19008,3,$49.75,09/16/24;12:40:08 PM,,49.75,49.75,149.25,2024-09-16 12:40:08.000,2024-09-16,2024,9,16,45268,[],()
71201,45087,19026,1,€21.00,"19-JUL-2025, 18:43:11",,25.2,25.2,25.2,2025-07-19 18:43:11.000,2025-07-19,2025,7,19,45087,[],()
68166,46059,19521,1,15. $,"29-DEC-2024,05:41:26 AM",,15.0,15.0,15.0,2024-12-29 05:41:26.000,2024-12-29,2024,12,29,46059,[],()
66346,45367,18903,1,EUR19,19.11.2024 16:38:38,NULL,22.8,22.8,22.8,2024-11-19 16:38:38.000,2024-11-19,2024,11,19,45367,[],()
69916,46569,19190,2,EUR 44.,"28-JUN-2025,17:17:27","130 McDermott Glen, West Clintshire, CO 61705-7034",52.8,52.8,105.6,2025-06-28 17:17:27.000,2025-06-28,2025,6,28,46569,[],()
68524,45970,19086,1,72.75 EUR,10:13:09 PM;02/16/25,NULL,87.3,87.3,87.3,2025-02-16 22:13:09.000,2025-02-16,2025,2,16,45970,[],()
70441,46901,19134,1,65.€,2024-12-06T10:06:05,,78.0,78.0,78.0,2024-12-06 10:06:05.000,2024-12-06,2024,12,6,46901,[],()
63718,45709,18939,1,EUR 56.50,"2025-02-25, 04:14:24","2098 Signe Cape, North Stanford, CA 31636-8900",67.8,67.8,67.8,2025-02-25 04:14:24.000,2025-02-25,2025,2,25,45709,[],()
64983,45080,19369,1,USD32.99," 9-Jul-2024, 03:25:33 am",NULL,32.99,32.99,32.99,2024-07-09 03:25:33.000,2024-07-09,2024,7,9,45080,[],()
73969,46044,18875,1,$ 44.50, 5-FEB-2025;01:02:40 PM,,44.5,44.5,44.5,2025-02-05 13:02:40.000,2025-02-05,2025,2,5,46044,[],()
73174,46220,18860,1,$ 45.5,2024-12-25 14:43,,45.5,45.5,45.5,2024-12-25 14:43:00.000,2024-12-25,2024,12,25,46220,[],()
65356,44519,19194,1,38.99 $,09:17;06/12/24,NULL,38.99,38.99,38.99,2024-06-12 09:17:00.000,2024-06-12,2024,6,12,44519,[],()
66948,44897,19315,1,$ 59.00,13:37 25-Apr-2025,NULL,59.0,59.0,59.0,2025-04-25 13:37:00.000,2025-04-25,2025,4,25,44897,[],()
66049,46618,19348,4,$35¢99,"20:04:30,2024-11-15",,3599.0,3599.0,14396.0,2024-11-15 20:04:30.000,2024-11-15,2024,11,15,46618,[],()
68283,44878,18844,1,42.50$,"19-Apr-2025, 02:45",,42.5,42.5,42.5,2025-04-19 02:45:00.000,2025-04-19,2025,4,19,44878,[],()
63593,45330,18884,3,€ 68.99,"09/20/24, 13:18",,82.788,82.788,248.36,2024-09-20 13:18:00.000,2024-09-20,2024,9,20,45330,[],()
69216,44650,19235,1,$65.75,"04:00:37 pm,2025-02-03","Suite 952 474 Corkery Haven, Port Clair, KY 93222",65.75,65.75,65.75,2025-02-03 16:00:37.000,2025-02-03,2025,2,3,44650,[],()
68124,46692,18851,1,59.25$,2024-12-06T20:59:47.842,"5125 Elwood Heights, Port Silas, UT 73157-7364",59.25,59.25,59.25,2024-12-06 20:59:47.842,2024-12-06,2024,12,6,46692,[],()
73208,46665,19370,1,22.75 $,10:50:17 pm;2024-09-23,"158 Walter Mews, East Hung, GA 90026-2041",22.75,22.75,22.75,2024-09-23 22:50:17.000,2024-09-23,2024,9,23,46665,[],()
63893,46878,19037,1,$29.0,02:21;2025-10-10,NULL,29.0,29.0,29.0,2025-10-10 02:21:00.000,2025-10-10,2025,10,10,46878,[],()
64521,46617,18984,2,$17¢75,13:46:41;20-March-2025,NULL,1775.0,1775.0,3550.0,2025-03-20 13:46:41.000,2025-03-20,2025,3,20,46617,[],()
71675,45837,19343,1,€ 72.75,"14:38:36,10/29/24",,87.3,87.3,87.3,2024-10-29 14:38:36.000,2024-10-29,2024,10,29,45837,[],()
70828,47083,19326,1,$ 28.0,2025-02-07;04:39:41 PM,NULL,28.0,28.0,28.0,2025-02-07 16:39:41.000,2025-02-07,2025,2,7,47083,[],()
69214,47417,19319,1,USD 39.00,"00:01,07/01/24",,39.0,39.0,39.0,2024-07-01 00:01:00.000,2024-07-01,2024,7,1,47417,[],()
62904,46265,19183,1,USD 16.5, 7-AUG-2024;11:53,,16.5,16.5,16.5,2024-08-07 11:53:00.000,2024-08-07,2024,8,7,46265,[],()
67371,47017,19212,1,USD 50.0,"05:03, 02/10/25",,50.0,50.0,50.0,2025-02-10 05:03:00.000,2025-02-10,2025,2,10,47017,[],()
73540,45994,19278,1,34.75€,2024-08-15T12:34:56.187,,41.699999999999996,41.699999999999996,41.7,2024-08-15 12:34:56.187,2024-08-15,2024,8,15,45994,[],()
63539,44559,19325,1,USD29.75,2025-03-15T14:12:23,NULL,29.75,29.75,29.75,2025-03-15 14:12:23.000,2025-03-15,2025,3,15,44559,[],()
65074,44989,19082,2,19$25¢,2024-09-05T16:08:46,,1925.0,1925.0,3850.0,2024-09-05 16:08:46.000,2024-09-05,2024,9,5,44989,[],()
68043,46186,18858,1,€ 15.25,21:37;30-Oct-2024,,18.3,18.3,18.3,2024-10-30 21:37:00.000,2024-10-30,2024,10,30,46186,[],()
69958,45245,19251,1,€24.99,04:21:27 P.M. 10-October-2024,,29.987999999999996,29.987999999999996,29.99,2024-10-10 16:21:27.000,2024-10-10,2024,10,10,45245,[],()
66036,44635,18957,1,USD64.00,"09:08,2025-01-22",,64.0,64.0,64.0,2025-01-22 09:08:00.000,2025-01-22,2025,1,22,44635,[],()
69383,46744,18886,1,67.00€,05:54:02 2025-07-19,NULL,80.39999999999999,80.39999999999999,80.4,2025-07-19 05:54:02.000,2025-07-19,2025,7,19,46744,[],()
66109,45811,19101,1,72.50 $, 4-August-2024 07:59:47 PM,"Suite 112 290 Parker Stravenue, Russelfurt, MN 30548-1014",72.5,72.5,72.5,2024-08-04 19:59:47.000,2024-08-04,2024,8,4,45811,[],()
67450,46766,19392,1,€47.50,2025-01-04T01:24:28,,57.0,57.0,57.0,2025-01-04 01:24:28.000,2025-01-04,2025,1,4,46766,[],()
73559,45579,19008,1,EUR50.5,22:57:59;2025-03-10,,60.599999999999994,60.599999999999994,60.6,2025-03-10 22:57:59.000,2025-03-10,2025,3,10,45579,[],()
73850,46012,19272,1,$45.50,"02/28/25,00:20:10",,45.5,45.5,45.5,2025-02-28 00:20:10.000,2025-02-28,2025,2,28,46579,[],()
67995,47486,19176,3,$ 22.0,22:11 06/08/25,,22.0,22.0,66.0,2025-06-08 22:11:00.000,2025-06-08,2025,6,8,47486,[],()
71297,45524,19435,1,EUR 66.75,11:18:05 AM;12/07/24,,80.1,80.1,80.1,2024-12-07 11:18:05.000,2024-12-07,2024,12,7,45524,[],()
64755,45605,19020,1,18.50$,2025-06-05T12:55:09.171,,18.5,18.5,18.5,2025-06-05 12:55:09.171,2025-06-05,2025,6,5,45605,[],()
67476,45614,19525,1,61.00EUR,"03/30/24, 20:46:57",,73.2,73.2,73.2,2024-03-30 20:46:57.000,2024-03-30,2024,3,30,45614,[],()
67884,46558,19355,1,37.00USD,19:17:54;2024-04-29,,37.0,37.0,37.0,2024-04-29 19:17:54.000,2024-04-29,2024,4,29,46558,[],()
70513,45744,19482,1,USD27.00,"2024-09-19,01:15:39 A.M.",NULL,27.0,27.0,27.0,2024-09-19 01:15:39.000,2024-09-19,2024,9,19,45744,[],()
65405,44401,19186,1,USD 28.75,02:17:33 2024-12-11,"92094 Yuri Lights, South Dorseybury, HI 71170",28.75,28.75,28.75,2024-12-11 02:17:33.000,2024-12-11,2024,12,11,44401,[],()
70953,45048,18888,1,47. $,2025-05-06;23:18,NULL,47.0,47.0,47.0,2025-05-06 23:18:00.000,2025-05-06,2025,5,6,45048,[],()
63442,46008,19479,2,USD57.25,"07:40:22 pm, 25-JUN-2024",,57.25,57.25,114.5,2024-06-25 19:40:22.000,2024-06-25,2024,6,25,46008,[],()
66727,45523,19478,4,USD 53.50,"16:16,02/22/25","Apt. 163 80312 Runte Mountain, Yundtland, AR 54710",53.5,53.5,214.0,2025-02-22 16:16:00.000,2025-02-22,2025,2,22,45523,[],()
65176,47556,19364,3,€65.75,09/06/24 07:35:58 AM,,78.89999999999999,78.89999999999999,236.7,2024-09-06 07:35:58.000,2024-09-06,2024,9,6,47556,[],()
69769,46184,19369,1,28.50 USD,"12:08:29,02/09/25",,28.5,28.5,28.5,2025-02-09 12:08:29.000,2025-02-09,2025,2,9,46184,[],()
72548,44362,19160,2,71.50 USD,"11/07/24,08:36",NULL,71.5,71.5,143.0,2024-11-07 08:36:00.000,2024-11-07,2024,11,7,44362,[],()
66640,46268,19464,1,$ 43.50,"29-Sep-2024,09:07:57 P.M.",,43.5,43.5,43.5,2024-09-29 21:07:57.000,2024-09-29,2024,9,29,46268,[],()
63113,45964,19378,2,EUR 17.0,"00:45:22, 10-NOV-2024",NULL,20.4,20.4,40.8,2024-11-10 00:45:22.000,2024-11-10,2024,11,10,45964,[],()
64345,45104,18881,1,28.75 $,"23:52,2025-01-21",NULL,28.75,28.75,28.75,2025-01-21 23:52:00.000,2025-01-21,2025,1,21,45104,[],()
69076,44463,19117,1,EUR 38.25,2024-08-16T23:53:43.746,"Suite 447 864 Rosenbaum Islands, North Wanetta, VT 07261",45.9,45.9,45.9,2024-08-16 23:53:43.746,2024-08-16,2024,8,16,44463,[],()
64848,47548,18932,1,$18¢75,22:58;10/12/24,,1875.0,1875.0,1875.0,2024-10-12 22:58:00.000,2024-10-12,2024,10,12,47548,[],()
72926,46642,19250,1,29.99USD," 5-Mar-2025,09:58:11 am",,29.99,29.99,29.99,2025-03-05 09:58:11.000,2025-03-05,2025,3,5,46642,[],()
65783,47279,19284,1,EUR53.0,"14:54:40,2024-10-20",,63.599999999999994,63.599999999999994,63.6,2024-10-20 14:54:40.000,2024-10-20,2024,10,20,47279,[],()
71166,45229,18908,1,$45¢75,2024-12-22 18:54:17,,4575.0,4575.0,4575.0,2024-12-22 18:54:17.000,2024-12-22,2024,12,22,45229,[],()
63274,46529,19310,1,22.00 $,2024-08-21T06:39:18.045,NULL,22.0,22.0,22.0,2024-08-21 06:39:18.045,2024-08-21,2024,8,21,46529,[],()
63811,44535,19299,1,€ 33.0,"19:02,07/10/25",,39.6,39.6,39.6,2025-07-10 19:02:00.000,2025-07-10,2025,7,10,44535,[],()
64276,46124,19560,2,30.50$,"01/25/25,05:56:12 AM",,30.5,30.5,61.0,2025-01-25 05:56:12.000,2025-01-25,2025,1,25,46124,[],()
65115,46563,18873,1,€ 68.00,2025-04-22T22:53:28,,81.6,81.6,81.6,2025-04-22 22:53:28.000,2025-04-22,2025,4,22,46563,[],()
66085,47078,19543,1,41.75USD,2025-03-19T05:02:36.253,"Suite 118 9394 Stroman Creek, Cedricfort, KS 39363",41.75,41.75,41.75,2025-03-19 05:02:36.253,2025-03-19,2025,3,19,47078,[],()
70550,46820,19537,2,53.5 USD,"14-January-2025,10:07",,53.5,53.5,107.0,2025-01-14 10:07:00.000,2025-01-14,2025,1,14,46820,[],()
67667,47434,19456,1,USD33.5,2025-03-06 00:20,NULL,33.5,33.5,33.5,2025-03-06 00:20:00.000,2025-03-06,2025,3,6,47434,[],()
73089,47349,19309,2,65.00EUR,"2025-02-09, 06:41","Suite 729 24407 McDermott Lock, Port Marianelaton, GA 32200",78.0,78.0,156.0,2025-02-09 06:41:00.000,2025-02-09,2025,2,9,47349,[],()
69381,47335,18906,1,42.0$,17-January-2025;16:20:30,"Suite 176 7509 Rosenbaum Wells, Hillsfort, LA 25765",42.0,42.0,42.0,2025-01-17 16:20:30.000,2025-01-17,2025,1,17,47335,[],()
63970,44376,19450,2,30.25 $,2024-08-13;01:50:18,"Suite 759 7720 Chong Square, Noelleland, SD 18297-9433",30.25,30.25,60.5,2024-08-13 01:50:18.000,2024-08-13,2024,8,13,44376,[],()
72114,46348,19131,1,58.0EUR,"2024-12-30, 13:34:03",NULL,69.6,69.6,69.6,2024-12-30 13:34:03.000,2024-12-30,2024,12,30,46348,[],()
67172,47227,19014,2,€19¢99,18.05.2025 18:38:38,,2398.7999999999997,2398.7999999999997,4797.6,2025-05-18 18:38:38.000,2025-05-18,2025,5,18,47227,[],()
70377,46671,18999,2,53.75 USD,"04/30/25,08:30","404 Gutmann Plains, North Latoshashire, ND 91027",53.75,53.75,107.5,2025-04-30 08:30:00.000,2025-04-30,2025,4,30,46671,[],()
64335,45642,19321,2,45.99USD,03:02:58 05/18/25,NULL,45.99,45.99,91.98,2025-05-18 03:02:58.000,2025-05-18,2025,5,18,45642,[],()
73026,44732,19055,1,18.00 $,2024-09-07T04:16:49,"Apt. 453 41653 Maggio Fork, Windlerside, IL 09420-4076",18.0,18.0,18.0,2024-09-07 04:16:49.000,2024-09-07,2024,9,7,44732,[],()
67880,45061,19285,1,65.0 €,2024-09-03T11:47:10,"8700 Yesenia Cliff, East Jerrodberg, ME 10052-2533",78.0,78.0,78.0,2024-09-03 11:47:10.000,2024-09-03,2024,9,3,45061,[],()
70080,45931,19040,1,14.00 $,19:28:54 2025-03-18,,14.0,14.0,14.0,2025-03-18 19:28:54.000,2025-03-18,2025,3,18,45931,[],()
66055,46824,19416,1,64.99$,2024-09-09T20:40:56,NULL,64.99,64.99,64.99,2024-09-09 20:40:56.000,2024-09-09,2024,9,9,46824,[],()
66697,45896,19469,1,30.00$,23.01.2025 07:32:32,,30.0,30.0,30.0,2025-01-23 07:32:32.000,2025-01-23,2025,1,23,45896,[],()
70847,45477,19465,1,47.75USD,"08:42:08 am, 2024-11-13",,47.75,47.75,47.75,2024-11-13 08:42:08.000,2024-11-13,2024,11,13,45477,[],()
71307,46397,19071,1,14 $,2025-04-12;07:51:02,,14.0,14.0,14.0,2025-04-12 07:51:02.000,2025-04-12,2025,4,12,46397,[],()
69209,44728,19006,2,USD 45.75,"19:09, 16-Jul-2025","Apt. 635 872 Cummings Unions, East Manie, FL 28054",45.75,45.75,91.5,2025-07-16 19:09:00.000,2025-07-16,2025,7,16,44728,[],()
69729,45237,19488,1,$ 75.75, 3-Jan-2025;05:16:38,,75.75,75.75,75.75,2025-01-03 05:16:38.000,2025-01-03,2025,1,3,45237,[],()
67292,45892,19589,1,€ 57.75,"20-April-2024, 05:52:50 P.M.","230 Effertz River, Alphonsoview, RI 45912-5883",69.3,69.3,69.3,2024-04-20 17:52:50.000,2024-04-20,2024,4,20,45892,[],()
65607,46743,19293,1,$28.25,"11:27,12/14/24",,28.25,28.25,28.25,2024-12-14 11:27:00.000,2024-12-14,2024,12,14,46743,[],()
64215,46016,19199,2,USD15.50,"09/25/24, 05:48",,15.5,15.5,31.0,2024-09-25 05:48:00.000,2024-09-25,2024,9,25,46016,[],()
71671,45698,19246,1,$21¢00,"2025-07-29, 13:28",,2100.0,2100.0,2100.0,2025-07-29 13:28:00.000,2025-07-29,2025,7,29,45698,[],()
70626,44987,19534,1,$38.00,20:00 26-Feb-2025,,38.0,38.0,38.0,2025-02-26 20:00:00.000,2025-02-26,2025,2,26,44987,[],()
63885,45596,18859,1,$53¢25,09/12/25;03:02:47,NULL,5325.0,5325.0,5325.0,2025-09-12 03:02:47.000,2025-09-12,2025,9,12,45596,[],()
69389,44519,19342,1,37.99EUR,2025-06-12T11:19:10,,45.588,45.588,45.59,2025-06-12 11:19:10.000,2025-06-12,2025,6,12,44519,[],()
71850,46012,18846,1,23.0 €,02:32; 5-Sep-2024,"91869 Gregorio Mountain, West Lester, WY 78873-4165",27.599999999999998,27.599999999999998,27.6,2024-09-05 02:32:00.000,2024-09-05,2024,9,5,46579,[],()
71647,46402,18908,2,$43.00,"2024-09-01,23:29:55",,43.0,43.0,86.0,2024-09-01 23:29:55.000,2024-09-01,2024,9,1,46402,[],()
68101,45912,19056,1,25$,22:38 19-NOV-2024,,25.0,25.0,25.0,2024-11-19 22:38:00.000,2024-11-19,2024,11,19,45912,[],()
65454,46617,19330,3,63.0 USD,24-Apr-2025 14:22:48,NULL,63.0,63.0,189.0,2025-04-24 14:22:48.000,2025-04-24,2025,4,24,46617,[],()
64337,47234,18953,2,61.5 USD,07:12:36 am 30-OCT-2024,"72546 Jean View, Kurtside, WA 02016-8049",61.5,61.5,123.0,2024-10-30 07:12:36.000,2024-10-30,2024,10,30,47234,[],()
70072,45399,19330,1,USD 60.99,22:09:53;28-Oct-2024,,60.99,60.99,60.99,2024-10-28 22:09:53.000,2024-10-28,2024,10,28,45399,[],()
65283,45973,18844,1,USD43.50,09:01:32 04/19/25,"4990 Earle Gardens, North Brittani, MD 08333",43.5,43.5,43.5,2025-04-19 09:01:32.000,2025-04-19,2025,4,19,45973,[],()
66088,44356,19299,3,28.99 EUR,10:55:15 11-SEP-2024,,34.788,34.788,104.36,2024-09-11 10:55:15.000,2024-09-11,2024,9,11,44356,[],()
64367,44568,19453,1,26.75USD,"07:45:29,  8-February-2025","9751 Elliott Views, Bergeburgh, WA 02357",26.75,26.75,26.75,2025-02-08 07:45:29.000,2025-02-08,2025,2,8,44568,[],()
70766,47180,19534,1,41.99$,11/21/24;18:07,"49903 Zachariah Island, Eduardoburgh, CA 30316-5148",41.99,41.99,41.99,2024-11-21 18:07:00.000,2024-11-21,2024,11,21,47180,[],()
66138,45748,19274,1,EUR76.50,"01/25/25, 13:46","441 Larkin Fort, West Refugio, MT 41538-7413",91.8,91.8,91.8,2025-01-25 13:46:00.000,2025-01-25,2025,1,25,45748,[],()
72031,46151,19277,1,58$00¢,"21-OCT-2024,19:57",,5800.0,5800.0,5800.0,2024-10-21 19:57:00.000,2024-10-21,2024,10,21,46151,[],()
65502,44962,18951,1,70.0USD,03:43:17 am;02/14/25,,70.0,70.0,70.0,2025-02-14 03:43:17.000,2025-02-14,2025,2,14,44962,[],()
70029,45211,19363,1,21.75$,"22:40:57, 2024-11-16",,21.75,21.75,21.75,2024-11-16 22:40:57.000,2024-11-16,2024,11,16,45211,[],()
62933,44689,19362,2,36.5EUR,2025-01-31T11:24:31,,43.8,43.8,87.6,2025-01-31 11:24:31.000,2025-01-31,2025,1,31,44689,[],()
72475,46677,19462,1,$59.00,2024-12-25T07:59:44,"5305 Oberbrunner Alley, Francescobury, TN 36425",59.0,59.0,59.0,2024-12-25 07:59:44.000,2024-12-25,2024,12,25,46677,[],()
68208,46146,19357,1,14.0 EUR,10/25/24;05:19,,16.8,16.8,16.8,2024-10-25 05:19:00.000,2024-10-25,2024,10,25,46146,[],()
65093,46047,18855,1,USD27.5,09/24/24;23:03:53,,27.5,27.5,27.5,2024-09-24 23:03:53.000,2024-09-24,2024,9,24,46047,[],()
67000,46993,19135,1,USD 54.99,"18-Oct-2024,04:41:09",,54.99,54.99,54.99,2024-10-18 04:41:09.000,2024-10-18,2024,10,18,46993,[],()
73647,47529,19238,1,$17.25,"06:29:26 pm, 2025-01-06",,17.25,17.25,17.25,2025-01-06 18:29:26.000,2025-01-06,2025,1,6,47529,[],()
67237,47536,19449,1,USD51.50,2025-02-24;04:35:40 P.M.,,51.5,51.5,51.5,2025-02-24 16:35:40.000,2025-02-24,2025,2,24,47536,[],()
69175,46359,19212,5,54$,15-November-2024 15:13:57,"3387 Abbott Passage, New Jonathonhaven, KY 83934-4451",54.0,54.0,270.0,2024-11-15 15:13:57.000,2024-11-15,2024,11,15,46359,[],()
67671,44391,19258,1,USD 70,2024-06-04 14:15,"43960 Bernhard Rue, Lake Murraychester, RI 54985",70.0,70.0,70.0,2024-06-04 14:15:00.000,2024-06-04,2024,6,4,44391,[],()
72391,45058,18959,1,USD 51.75,2025-02-04;08:50:52 AM,,51.75,51.75,51.75,2025-02-04 08:50:52.000,2025-02-04,2025,2,4,45058,[],()
66968,45762,18995,1,USD29.25,Sat Sep 28 21:19:42 2024,"Apt. 347 88306 Margarette Ports, East Gil, KY 00881",29.25,29.25,29.25,2024-09-28 21:19:42.000,2024-09-28,2024,9,28,45762,[],()
67742,47172,19120,2,$65.5,2025-03-13 15:09:08,"Apt. 743 33339 Dori Landing, North Elanortown, OR 95080",65.5,65.5,131.0,2025-03-13 15:09:08.000,2025-03-13,2025,3,13,47172,[],()
66557,47164,18873,1,EUR 72.75,22:01:48;2024-10-15,,87.3,87.3,87.3,2024-10-15 22:01:48.000,2024-10-15,2024,10,15,47164,[],()
64926,45877,19244,1,USD49.5,12:19:47 PM;24-August-2025,,49.5,49.5,49.5,2025-08-24 12:19:47.000,2025-08-24,2025,8,24,45877,[],()
71468,44948,19399,2,17USD," 6-SEP-2024, 12:21",NULL,17.0,17.0,34.0,2024-09-06 12:21:00.000,2024-09-06,2024,9,6,45667,[],()
69100,44654,19043,2,$ 21.75,"2025-04-19, 00:47","455 Man Stream, Hicklefurt, DE 44027",21.75,21.75,43.5,2025-04-19 00:47:00.000,2025-04-19,2025,4,19,44654,[],()
71051,44994,19149,3,EUR 25.75,10:01:56 pm;2025-02-10,,30.9,30.9,92.7,2025-02-10 22:01:56.000,2025-02-10,2025,2,10,44994,[],()
66685,45421,19351,1,27$,"16:49:24,19-Apr-2025",,27.0,27.0,27.0,2025-04-19 16:49:24.000,2025-04-19,2025,4,19,45421,[],()
66302,45609,19182,2,53.75 €,"10:00:07 PM,2024-12-13",,64.5,64.5,129.0,2024-12-13 22:00:07.000,2024-12-13,2024,12,13,45609,[],()
64003,46941,19232,1,€ 35,"08/23/24, 13:47","278 Kerluke Corner, Lake Augusta, OR 24390",42.0,42.0,42.0,2024-08-23 13:47:00.000,2024-08-23,2024,8,23,46941,[],()
64239,47005,18882,1,€44¢75,"14:15,08/06/24",NULL,5370.0,5370.0,5370.0,2024-08-06 14:15:00.000,2024-08-06,2024,8,6,47005,[],()
67263,45788,19333,3,USD28,"02:20:17 AM,  5-DEC-2024","2388 Jewell Viaduct, Lake Isabelton, KS 87394",28.0,28.0,84.0,2024-12-05 02:20:17.000,2024-12-05,2024,12,5,45788,[],()
66741,47484,18913,2,43.0$,03/24/24 11:34,,43.0,43.0,86.0,2024-03-24 11:34:00.000,2024-03-24,2024,3,24,44841,[],()
66468,44926,18915,1,$ 65.75,"12:34:09 A.M.,2025-04-01",NULL,65.75,65.75,65.75,2025-04-01 00:34:09.000,2025-04-01,2025,4,1,44926,[],()
69349,45572,19341,2,$29.50,"28-Feb-2024, 05:02:33 AM","73032 Octavio Hill, Penelopeside, CT 43365-4603",29.5,29.5,59.0,2024-02-28 05:02:33.000,2024-02-28,2024,2,28,45572,[],()
63035,47270,19562,2,EUR49.99," 3-August-2024,07:36:09",,59.988,59.988,119.98,2024-08-03 07:36:09.000,2024-08-03,2024,8,3,47270,[],()
71810,44729,19146,1,€64¢50,"12:08:48 A.M., 03/04/25",,7740.0,7740.0,7740.0,2025-03-04 00:08:48.000,2025-03-04,2025,3,4,44729,[],()
65619,47277,19506,2,EUR 61.75,"00:48,  3-MAR-2025",NULL,74.1,74.1,148.2,2025-03-03 00:48:00.000,2025-03-03,2025,3,3,47277,[],()
72977,44785,19058,1,USD 18.99,"18-JUN-2025, 23:59",,18.99,18.99,18.99,2025-06-18 23:59:00.000,2025-06-18,2025,6,18,44785,[],()
67888,46708,19183,1,USD 16.25,2025-01-15T22:46:40,,16.25,16.25,16.25,2025-01-15 22:46:40.000,2025-01-15,2025,1,15,46708,[],()
68149,44982,19514,2,USD20.00,2024-08-27T08:34:15,,20.0,20.0,40.0,2024-08-27 08:34:15.000,2024-08-27,2024,8,27,44982,[],()
73081,45986,18871,1,USD 56.25,"2024-09-03, 00:39",,56.25,56.25,56.25,2024-09-03 00:39:00.000,2024-09-03,2024,9,3,45986,[],()
70035,46601,18971,1,USD 58.0,03:52 2024-10-12,"Apt. 584 87121 Tabatha Forest, South Terisa, AR 06805-6608",58.0,58.0,58.0,2024-10-12 03:52:00.000,2024-10-12,2024,10,12,46601,[],()
69499,47445,19516,1,$38.00,"16:32:40, 8-Feb-2025","824 Pacocha Locks, North Mauricio, SC 48743",38.0,38.0,38.0,2025-02-08 16:32:40.000,2025-02-08,2025,2,8,47445,[],()
63135,46620,19170,1,$69¢75,08/21/24 16:33,,6975.0,6975.0,6975.0,2024-08-21 16:33:00.000,2024-08-21,2024,8,21,46620,[],()
65382,45644,19389,1,$18.0,10:25:47 2024-10-08,"Suite 811 860 Susie Well, South Isidrashire, MS 20327",18.0,18.0,18.0,2024-10-08 10:25:47.000,2024-10-08,2024,10,8,45644,[],()
70554,46317,19083,1,USD51.75,"05:50,15-Nov-2024","32224 Armstrong Landing, Townebury, MN 00975",51.75,51.75,51.75,2024-11-15 05:50:00.000,2024-11-15,2024,11,15,46317,[],()
73013,45771,19292,4,€50¢00,2025-01-20T14:40:13,,6000.0,6000.0,24000.0,2025-01-20 14:40:13.000,2025-01-20,2025,1,20,45771,[],()
72839,47293,19189,1,$23,14-February-2025 05:03:07 AM,,23.0,23.0,23.0,2025-02-14 05:03:07.000,2025-02-14,2025,2,14,47293,[],()
63184,46532,19048,1,$33¢99,"2024-11-11, 04:58:27 pm",,3399.0,3399.0,3399.0,2024-11-11 16:58:27.000,2024-11-11,2024,11,11,44820,[],()
63588,44966,18980,2,58EUR," 2-March-2024, 07:21:33 A.M.",NULL,69.6,69.6,139.2,2024-03-02 07:21:33.000,2024-03-02,2024,3,2,44966,[],()
71008,46463,19331,2,USD 30.75,06/24/24;06:27,NULL,30.75,30.75,61.5,2024-06-24 06:27:00.000,2024-06-24,2024,6,24,46463,[],()
70305,45041,18884,1,67.25 $," 4-SEP-2024,09:32:33 A.M.",NULL,67.25,67.25,67.25,2024-09-04 09:32:33.000,2024-09-04,2024,9,4,45041,[],()
70680,44979,19527,1,72.00USD,18:51;03/23/24,,72.0,72.0,72.0,2024-03-23 18:51:00.000,2024-03-23,2024,3,23,44979,[],()
73212,46663,18949,1,€32¢50,09/24/24;00:03:04,NULL,3900.0,3900.0,3900.0,2024-09-24 00:03:04.000,2024-09-24,2024,9,24,46663,[],()
66108,47212,19283,1,$ 17.75,"15:21,02/03/25",NULL,17.75,17.75,17.75,2025-02-03 15:21:00.000,2025-02-03,2025,2,3,47212,[],()
68026,46330,19474,1,31.99 €,2025-02-10T21:47:36,NULL,38.388,38.388,38.39,2025-02-10 21:47:36.000,2025-02-10,2025,2,10,45801,[],()
66506,47005,19577,1,$ 70.50,15:14:55 01/09/25,NULL,70.5,70.5,70.5,2025-01-09 15:14:55.000,2025-01-09,2025,1,9,47005,[],()
73774,45773,18864,1,68.99 USD,09:39:15;2025-02-05,NULL,68.99,68.99,68.99,2025-02-05 09:39:15.000,2025-02-05,2025,2,5,45773,[],()
63057,44398,19219,1,$ 30.0,"12/19/24, 12:05:37 PM",,30.0,30.0,30.0,2024-12-19 12:05:37.000,2024-12-19,2024,12,19,44398,[],()
63857,47110,19048,1,USD32.00,"05:36,21-Jul-2024",,32.0,32.0,32.0,2024-07-21 05:36:00.000,2024-07-21,2024,7,21,47110,[],()
69811,47202,19156,1,37$50¢,10:34:40 am;12/06/24,NULL,3750.0,3750.0,3750.0,2024-12-06 10:34:40.000,2024-12-06,2024,12,6,47202,[],()
73753,46797,18857,1,68.25 $,23:58;07/10/24,"7883 Rasheeda Wells, Port Hugochester, KY 86234-1032",68.25,68.25,68.25,2024-07-10 23:58:00.000,2024-07-10,2024,7,10,46797,[],()
66116,46980,19056,1,22.5 USD,"12:33:22 PM,  1-JUN-2024","948 Bobette Gardens, East Jospehfort, AZ 25293",22.5,22.5,22.5,2024-06-01 12:33:22.000,2024-06-01,2024,6,1,46980,[],()
70931,47248,19096,3,USD 20.25,2024-08-31;05:47:58 P.M.,,20.25,20.25,60.75,2024-08-31 17:47:58.000,2024-08-31,2024,8,31,47248,[],()
69949,45644,19087,1,$ 57.,18:49 2025-08-04,"Suite 811 860 Susie Well, South Isidrashire, MS 20327",57.0,57.0,57.0,2025-08-04 18:49:00.000,2025-08-04,2025,8,4,45644,[],()
66313,45199,18935,2,60.0$,04/01/25;07:55:43 A.M.,"557 Douglas Corners, South Jarodburgh, NJ 33448-6118",60.0,60.0,120.0,2025-04-01 07:55:43.000,2025-04-01,2025,4,1,45199,[],()
66459,44793,19278,1,EUR38.,01/04/25;19:57,,45.6,45.6,45.6,2025-01-04 19:57:00.000,2025-01-04,2025,1,4,44793,[],()
71189,47484,19459,1,EUR 41.75,10-May-2024 09:35,"Suite 635 41755 Kerri Mission, Port Juan, IA 72365",50.1,50.1,50.1,2024-05-10 09:35:00.000,2024-05-10,2024,5,10,44841,[],()
70640,45920,19549,3,USD37,2024-10-26T10:53:39,NULL,37.0,37.0,111.0,2024-10-26 10:53:39.000,2024-10-26,2024,10,26,45920,[],()
68257,44926,19285,1,USD64.25,12:57;18-JUL-2024,,64.25,64.25,64.25,2024-07-18 12:57:00.000,2024-07-18,2024,7,18,44926,[],()
69704,47545,19524,1,€48.5,"11/26/24,03:34:05",NULL,58.199999999999996,58.199999999999996,58.2,2024-11-26 03:34:05.000,2024-11-26,2024,11,26,47545,[],()
68753,45240,19315,1,$ 61,02:52:16 2025-04-28,"Suite 288 475 Kuphal Mountain, Kacistad, SD 13939",61.0,61.0,61.0,2025-04-28 02:52:16.000,2025-04-28,2025,4,28,45240,[],()
66541,46956,19500,1,USD50.0,03:09:21 AM 31-March-2024,,50.0,50.0,50.0,2024-03-31 03:09:21.000,2024-03-31,2024,3,31,46956,[],()
70381,45195,19119,2,$58.5,"04:04:17,2024-11-18",,58.5,58.5,117.0,2024-11-18 04:04:17.000,2024-11-18,2024,11,18,45195,[],()
68644,44456,19172,2,65.50USD,2025-01-29T19:09:45,"Suite 631 66701 Jennine Place, New Bryonville, MS 61790-3757",65.5,65.5,131.0,2025-01-29 19:09:45.000,2025-01-29,2025,1,29,44456,[],()
70590,45631,19332,5,EUR 40.00,"17-September-2024,11:55",NULL,48.0,48.0,240.0,2024-09-17 11:55:00.000,2024-09-17,2024,9,17,45631,[],()
72950,46864,19107,1,73.75 $,"10:15,10/01/24","35884 Janetta Forge, Lake Harlanshire, NE 81832-4288",73.75,73.75,73.75,2024-10-01 10:15:00.000,2024-10-01,2024,10,1,46864,[],()
66236,45019,19315,1,USD62.25,"28-Feb-2025, 21:14","Apt. 883 28219 Kittie Trafficway, Ellsworthland, NV 08815-3756",62.25,62.25,62.25,2025-02-28 21:14:00.000,2025-02-28,2025,2,28,45019,[],()
70621,44713,18986,1,66 $,"08/21/24,16:48:46",,66.0,66.0,66.0,2024-08-21 16:48:46.000,2024-08-21,2024,8,21,44713,[],()
72701,46935,19172,1,USD66.00,2024-05-24T01:41:36.096,,66.0,66.0,66.0,2024-05-24 01:41:36.096,2024-05-24,2024,5,24,46935,[],()
63727,44366,18926,1,37 $,2024-11-22 07:49:40 am,NULL,37.0,37.0,37.0,2024-11-22 07:49:40.000,2024-11-22,2024,11,22,44366,[],()
73908,44803,19374,1,19.25 EUR,"06/28/24, 11:55",,23.099999999999998,23.099999999999998,23.1,2024-06-28 11:55:00.000,2024-06-28,2024,6,28,44803,[],()
72117,44988,18868,4,26USD,16.03.2025 18:06:06,,26.0,26.0,104.0,2025-03-16 18:06:06.000,2025-03-16,2025,3,16,44988,[],()
63386,46170,19255,3,43.25USD,2024-09-14 13:49:47,,43.25,43.25,129.75,2024-09-14 13:49:47.000,2024-09-14,2024,9,14,46170,[],()
73144,46304,19227,1,51.99 EUR,"2025-04-07,05:52:28 AM",,62.388,62.388,62.39,2025-04-07 05:52:28.000,2025-04-07,2025,4,7,46304,[],()
71550,46540,19006,1,USD 45.00,"2025-03-21, 13:57",NULL,45.0,45.0,45.0,2025-03-21 13:57:00.000,2025-03-21,2025,3,21,46540,[],()
67992,47163,19488,3,$74.0,2024-10-09T00:03:05.928,"Apt. 719 6055 Pouros Crescent, Hilllfort, CT 09541-4347",74.0,74.0,222.0,2024-10-09 00:03:05.928,2024-10-09,2024,10,9,47163,[],()
65242,47586,19439,1,USD 73.25,13:25;10/20/24,"Apt. 840 384 Leffler Views, Considinetown, DE 64278",73.25,73.25,73.25,2024-10-20 13:25:00.000,2024-10-20,2024,10,20,47586,[],()
64779,47504,19351,1,$26.00,2024-06-29T02:05:28,NULL,26.0,26.0,26.0,2024-06-29 02:05:28.000,2024-06-29,2024,6,29,47504,[],()
65610,45976,19198,2,USD44.00,2024-10-30;08:44:30 AM,,44.0,44.0,88.0,2024-10-30 08:44:30.000,2024-10-30,2024,10,30,44971,[],()
69131,45227,19304,2,24.75USD,10/29/24 05:44:53 AM,"Apt. 600 2964 Murazik Plaza, Grimesbury, MS 26992-8665",24.75,24.75,49.5,2024-10-29 05:44:53.000,2024-10-29,2024,10,29,45227,[],()
67813,47234,19335,1,13.5$,02:28:13;2025-03-20,NULL,13.5,13.5,13.5,2025-03-20 02:28:13.000,2025-03-20,2025,3,20,47234,[],()
70356,45327,19072,1,$ 62.25," 9-Nov-2024,10:15:30 pm","6013 Robbi Lodge, West Paolaland, OK 02548-8216",62.25,62.25,62.25,2024-11-09 22:15:30.000,2024-11-09,2024,11,9,45327,[],()
69837,46393,19225,1,64.25 €," 8-Sep-2024,10:30:33 pm",,77.1,77.1,77.1,2024-09-08 22:30:33.000,2024-09-08,2024,9,8,46393,[],()
66986,45735,19418,2,56.50USD,09:58:42 PM;02/22/25,NULL,56.5,56.5,113.0,2025-02-22 21:58:42.000,2025-02-22,2025,2,22,45735,[],()
70279,46905,19080,1,49.75 USD,2024-05-23T10:51:02.753,,49.75,49.75,49.75,2024-05-23 10:51:02.753,2024-05-23,2024,5,23,46905,[],()
72860,46610,19206,2,24. USD,13-NOV-2024;18:58:38,"Suite 213 714 Danyell Ports, Jarvisview, NE 69492",24.0,24.0,48.0,2024-11-13 18:58:38.000,2024-11-13,2024,11,13,46610,[],()
65042,44782,19388,1,USD 52.5,"07/15/24, 10:51","1322 Johns Centers, Port Ivanmouth, TX 74712",52.5,52.5,52.5,2024-07-15 10:51:00.000,2024-07-15,2024,7,15,44782,[],()
63120,47163,19368,1,$ 30,"05:20, 3-Sep-2024",,30.0,30.0,30.0,2024-09-03 05:20:00.000,2024-09-03,2024,9,3,47163,[],()
66530,44557,19223,1,22.0 $,"08:23,05/21/24",,22.0,22.0,22.0,2024-05-21 08:23:00.000,2024-05-21,2024,5,21,44557,[],()
69251,46435,19444,1,41.5 $,06/30/25;03:13,NULL,41.5,41.5,41.5,2025-06-30 03:13:00.000,2025-06-30,2025,6,30,46435,[],()
66104,44341,19508,1,USD 37.00,"2024-09-17,11:44:40",NULL,37.0,37.0,37.0,2024-09-17 11:44:40.000,2024-09-17,2024,9,17,44341,[],()
68888,45370,18882,1,47.$,08:54:52 P.M.;08/19/24,,47.0,47.0,47.0,2024-08-19 20:54:52.000,2024-08-19,2024,8,19,45370,[],()
67857,47000,19064,1,63.25€,"10:11:02,  3-AUG-2024",,75.89999999999999,75.89999999999999,75.9,2024-08-03 10:11:02.000,2024-08-03,2024,8,3,47000,[],()
70630,45424,19487,1,69€50¢,10.02.2025 09:19:19,NULL,8340.0,8340.0,8340.0,2025-10-02 09:19:19.000,2025-10-02,2025,10,2,45424,[],()
68620,45686,19267,1,USD20.00,21:00;04/02/24,,20.0,20.0,20.0,2024-04-02 21:00:00.000,2024-04-02,2024,4,2,45686,[],()
73338,45185,19111,2,29. USD,Tue Sep 24 06:36:59 2024,,29.0,29.0,58.0,2024-09-24 06:36:59.000,2024-09-24,2024,9,24,45185,[],()
68793,46281,19038,1,59$75¢,"2024-04-18,04:56:32 P.M.","Apt. 295 270 Wolf Locks, South Theronburgh, WA 84914",5975.0,5975.0,5975.0,2024-04-18 16:56:32.000,2024-04-18,2024,4,18,46281,[],()
65659,45750,19003,1,USD 39.0,2024-06-04;13:58,NULL,39.0,39.0,39.0,2024-06-04 13:58:00.000,2024-06-04,2024,6,4,45750,[],()
63765,45633,19323,1,$44.25,2024-08-15T05:52:25.196,,44.25,44.25,44.25,2024-08-15 05:52:25.196,2024-08-15,2024,8,15,45608,[],()
69155,45267,18928,1,EUR17.25,2024-11-15T11:19:05.746,,20.7,20.7,20.7,2024-11-15 11:19:05.746,2024-11-15,2024,11,15,45267,[],()
69118,46779,19384,1,23.75$,17-Nov-2024;16:14,,23.75,23.75,23.75,2024-11-17 16:14:00.000,2024-11-17,2024,11,17,46779,[],()
65424,45724,19087,1,$55.50,11:55:51; 7-Jul-2025,,55.5,55.5,55.5,2025-07-07 11:55:51.000,2025-07-07,2025,7,7,45724,[],()
66623,46522,19559,5,$ 66.75,00:31;2024-09-08,,66.75,66.75,333.75,2024-09-08 00:31:00.000,2024-09-08,2024,9,8,46522,[],()
70868,47205,19363,1,26.75 $,05/07/24 12:08,NULL,26.75,26.75,26.75,2024-05-07 12:08:00.000,2024-05-07,2024,5,7,47205,[],()
70146,45146,19518,3,29€25¢,"12:28,05/14/24",,3510.0,3510.0,10530.0,2024-05-14 12:28:00.000,2024-05-14,2024,5,14,45146,[],()
67423,44390,19360,1,EUR 59.50,11/02/24 04:39,"Suite 861 36112 Nelia Road, O'Keefefort, KY 90565",71.39999999999999,71.39999999999999,71.4,2024-11-02 04:39:00.000,2024-11-02,2024,11,2,44390,[],()
71375,44643,19018,2,€ 14.50,12/09/24;10:30:18 am,,17.4,17.4,34.8,2024-12-09 10:30:18.000,2024-12-09,2024,12,9,44643,[],()
62825,45469,18935,1,59. USD,"12:27:17 am,03/28/25",,59.0,59.0,59.0,2025-03-28 00:27:17.000,2025-03-28,2025,3,28,45469,[],()
71787,46775,19258,1,67.0 USD,08:57:57 A.M. 03/23/25,,67.0,67.0,67.0,2025-03-23 08:57:57.000,2025-03-23,2025,3,23,46775,[],()
73145,45317,19342,1,40.50 $, 5-March-2025;07:47:04 A.M.,NULL,40.5,40.5,40.5,2025-03-05 07:47:04.000,2025-03-05,2025,3,5,47534,[],()
67599,46245,19212,2,50.50 USD,"08/12/24,12:48:16 P.M.","Suite 776 5651 Tromp Vista, Port Alinamouth, MD 86888-7738",50.5,50.5,101.0,2024-08-12 12:48:16.000,2024-08-12,2024,8,12,46245,[],()
70070,46163,19277,1,€57¢99,"06:46:12 AM,05/11/25","Suite 354 78387 Herman Landing, North Tessietown, ME 46944-8707",6958.8,6958.8,6958.8,2025-05-11 06:46:12.000,2025-05-11,2025,5,11,46163,[],()
72976,47359,19298,1,$62.75,"08:48:29 am,18-January-2025",,62.75,62.75,62.75,2025-01-18 08:48:29.000,2025-01-18,2025,1,18,47359,[],()
68253,47007,19454,2,66. $, 7-July-2025 20:46:11,,66.0,66.0,132.0,2025-07-07 20:46:11.000,2025-07-07,2025,7,7,47007,[],()
67034,47084,19336,1,47.99 USD,2024-04-28T13:20:12.216,,47.99,47.99,47.99,2024-04-28 13:20:12.216,2024-04-28,2024,4,28,47084,[],()
65989,45610,19293,1,31.99USD,"2024-12-12, 23:11:03",,31.99,31.99,31.99,2024-12-12 23:11:03.000,2024-12-12,2024,12,12,45610,[],()
71635,47285,19035,1,22.99USD,"2024-09-08, 17:17:39","Apt. 510 978 Coleman Wall, New Ollie, GA 01171-2209",22.99,22.99,22.99,2024-09-08 17:17:39.000,2024-09-08,2024,9,8,47285,[],()
64501,46500,19552,1,€37¢75,2024-05-12;11:40:31 P.M.,,4530.0,4530.0,4530.0,2024-05-12 23:40:31.000,2024-05-12,2024,5,12,46500,[],()
66547,46053,19013,2,$49.75,"2025-05-16,09:38",,49.75,49.75,99.5,2025-05-16 09:38:00.000,2025-05-16,2025,5,16,46053,[],()
71431,47418,19297,3,51.00 $,25.04.2025 15:47:47,"762 Connie Valleys, New Inell, IL 43005",51.0,51.0,153.0,2025-04-25 15:47:47.000,2025-04-25,2025,4,25,47087,[],()
68860,44759,18950,1,45.99EUR,2024-12-20;11:32:26 AM,,55.188,55.188,55.19,2024-12-20 11:32:26.000,2024-12-20,2024,12,20,44759,[],()
73523,44802,18973,2,53.50$,"12:22:24 am, 25-January-2025","Apt. 285 16786 Trinidad Mews, East Joesph, ME 62197",53.5,53.5,107.0,2025-01-25 00:22:24.000,2025-01-25,2025,1,25,44802,[],()
65216,45910,19559,1,68.0 €,2025-06-24T17:01:26.066,,81.6,81.6,81.6,2025-06-24 17:01:26.066,2025-06-24,2025,6,24,45910,[],()
64048,46022,18969,1,45.5 $,2025-01-15T20:15:07,"Apt. 589 4687 Greenholt Pike, West Chuckport, KS 65336",45.5,45.5,45.5,2025-01-15 20:15:07.000,2025-01-15,2025,1,15,46022,[],()
63404,44833,19400,1,€ 33.00,12:47:55 08/09/25,,39.6,39.6,39.6,2025-08-09 12:47:55.000,2025-08-09,2025,8,9,44833,[],()
72272,44532,19232,1,$32¢75,"2025-03-25,17:36",,3275.0,3275.0,3275.0,2025-03-25 17:36:00.000,2025-03-25,2025,3,25,44532,[],()
63162,47386,19142,1,38.5 USD,"00:10, 04/19/25","586 Mohammed Inlet, Barrowsville, ME 23410",38.5,38.5,38.5,2025-04-19 00:10:00.000,2025-04-19,2025,4,19,47386,[],()
66358,46250,19303,5,61.5 USD,"2024-11-16, 06:46","Suite 469 672 Courtney Valleys, West Haitown, ME 84349-1521",61.5,61.5,307.5,2024-11-16 06:46:00.000,2024-11-16,2024,11,16,46250,[],()
71695,44550,19043,1,USD20.99,2024-08-13T14:02:21.158,,20.99,20.99,20.99,2024-08-13 14:02:21.158,2024-08-13,2024,8,13,44550,[],()
68015,45453,18954,1,30.25$,"11:24, 2024-10-18",,30.25,30.25,30.25,2024-10-18 11:24:00.000,2024-10-18,2024,10,18,45199,[],()
68258,46937,19534,2,USD 37.99,2025-01-11T18:39:45.844,"721 Mante Fork, New Leif, OH 96093",37.99,37.99,75.98,2025-01-11 18:39:45.844,2025-01-11,2025,1,11,46937,[],()
70037,47418,18863,1,$28.50,2024-09-23T12:35:32.644,"762 Connie Valleys, New Inell, IL 43005",28.5,28.5,28.5,2024-09-23 12:35:32.644,2024-09-23,2024,9,23,47087,[],()
