id,user_id,book_id,quantity,unit_price,timestamp_raw,shipping,unit_price_clean,unit_price_usd,paid_price,timestamp_parsed,date,year,month,day,cluster_id,authors,author_set
75198,55590,21465,1,73.5$,"08:47:31 P.M.,10/07/24",NULL,73.5,73.5,73.5,2024-10-07 20:47:31.000,2024-10-07,2024,10,7,55590,[],()
82023,53482,21374,1,$25.00,2024-09-11T05:27:49,NULL,25.0,25.0,25.0,2024-09-11 05:27:49.000,2024-09-11,2024,9,11,53482,[],()
81439,55123,21408,1,USD22.50,"2024-08-06,06:53",,22.5,22.5,22.5,2024-08-06 06:53:00.000,2024-08-06,2024,8,6,55123,[],()
80259,54387,21013,1,42.5$,03/18/25;09:32:41 AM,,42.5,42.5,42.5,2025-03-18 09:32:41.000,2025-03-18,2025,3,18,54387,[],()
80176,54916,21437,1,$ 62.5,"04:55:14 pm,09/24/24",NULL,62.5,62.5,62.5,2024-09-24 16:55:14.000,2024-09-24,2024,9,24,54916,[],()
75145,54881,21487,4,$ 73.0,2024-10-16T16:44:45,NULL,73.0,73.0,292.0,2024-10-16 16:44:45.000,2024-10-16,2024,10,16,54881,[],()
77748,53943,21283,3,$ 41.75,19.02.2025 06:46:46,"22571 Shena Oval, West Mellissastad, MN 91780",41.75,41.75,125.25,2025-02-19 06:46:46.000,2025-02-19,2025,2,19,54718,[],()
81737,54468,21519,1,46.0 $,"2025-02-01,02:52:35 am",NULL,46.0,46.0,46.0,2025-02-01 02:52:35.000,2025-02-01,2025,2,1,54468,[],()
78876,54627,21302,5,22.USD,03/09/25 17:13:59,NULL,22.0,22.0,110.0,2025-03-09 17:13:59.000,2025-03-09,2025,3,9,54627,[],()
74442,54189,20936,2,57.00EUR,"11/12/24,16:18",NULL,68.39999999999999,68.39999999999999,136.8,2024-11-12 16:18:00.000,2024-11-12,2024,11,12,54189,[],()
77997,54202,21385,4,17.0€,Fri Dec 20 03:15:05 2024,,20.4,20.4,81.6,2024-12-20 03:15:05.000,2024-12-20,2024,12,20,54202,[],()
79367,54283,21226,1,$58.0,17:47;28-Jul-2025,NULL,58.0,58.0,58.0,2025-07-28 17:47:00.000,2025-07-28,2025,7,28,54283,[],()
75499,53171,21041,1,EUR70.00,"14:25:24, 4-Nov-2024",,84.0,84.0,84.0,2024-11-04 14:25:24.000,2024-11-04,2024,11,4,53171,[],()
76091,53999,20921,2,19.25 $, 1-September-2024 11:34:07 AM,,19.25,19.25,38.5,2024-09-01 11:34:07.000,2024-09-01,2024,9,1,53999,[],()
79132,55304,21105,1,€52.99,13:42:13 17-Dec-2024,"Suite 319 586 Halvorson Lane, Lucioborough, MO 43284-4515",63.588,63.588,63.59,2024-12-17 13:42:13.000,2024-12-17,2024,12,17,55304,[],()
76575,53032,20939,1,67.0 €,19:36; 9-April-2025,"Apt. 145 402 Maxwell Causeway, Deweytown, ND 75473",80.39999999999999,80.39999999999999,80.4,2025-04-09 19:36:00.000,2025-04-09,2025,4,9,53032,[],()
82150,54747,21413,1,USD 55.,"05:53:53 AM,2025-01-03","Suite 704 1963 Hyatt Isle, Lanastad, WV 00496",55.0,55.0,55.0,2025-01-03 05:53:53.000,2025-01-03,2025,1,3,54747,[],()
78844,54893,21578,1,39.0$,2024-10-06T00:19:37,"747 Hegmann Street, Coleborough, TX 69056",39.0,39.0,39.0,2024-10-06 00:19:37.000,2024-10-06,2024,10,6,54893,[],()
74470,53359,20976,1,$53.75,"05:28:54 PM,31-DEC-2024",NULL,53.75,53.75,53.75,2024-12-31 17:28:54.000,2024-12-31,2024,12,31,53359,[],()
75990,54905,21227,3,$ 69.0,28-NOV-2024;04:26:03 am,,69.0,69.0,207.0,2024-11-28 04:26:03.000,2024-11-28,2024,11,28,54905,[],()
80770,53277,21011,1,€33.00,"11-May-2024, 05:50","3334 Tom Bridge, Moenchester, ID 49650-2509",39.6,39.6,39.6,2024-05-11 05:50:00.000,2024-05-11,2024,5,11,53277,[],()
75867,53052,21071,1,EUR 54.,2025-02-02T17:01:49,,64.8,64.8,64.8,2025-02-02 17:01:49.000,2025-02-02,2025,2,2,53052,[],()
78026,54691,21498,2,USD 17.50, 6-July-2024;15:55:31,,17.5,17.5,35.0,2024-07-06 15:55:31.000,2024-07-06,2024,7,6,54691,[],()
73367,54764,21476,5,71.99 EUR,2025-01-06 07:14:37 P.M.,,86.38799999999999,86.38799999999999,431.94,2025-01-06 19:14:37.000,2025-01-06,2025,1,6,54764,[],()
76983,54311,21312,1,61.00USD,2025-01-12 05:32:06,,61.0,61.0,61.0,2025-01-12 05:32:06.000,2025-01-12,2025,1,12,54311,[],()
77073,54191,21339,2,71.99 USD,"12/20/24, 19:18",,71.99,71.99,143.98,2024-12-20 19:18:00.000,2024-12-20,2024,12,20,54191,[],()
77141,55469,20996,1,43 USD,"28-Jan-2025, 02:26:47",,43.0,43.0,43.0,2025-01-28 02:26:47.000,2025-01-28,2025,1,28,55469,[],()
80729,53203,21280,1,USD 16.00,28-AUG-2024;05:24:48 AM,,16.0,16.0,16.0,2024-08-28 05:24:48.000,2024-08-28,2024,8,28,53203,[],()
82110,54086,21183,1,49€00¢,"10:58:10 A.M., 10/14/24","317 Shamika Tunnel, South Otha, NY 71529",5880.0,5880.0,5880.0,2024-10-14 10:58:10.000,2024-10-14,2024,10,14,54086,[],()
80541,53621,21454,1,36.5€,"07:12:25 am,2024-09-17",,43.8,43.8,43.8,2024-09-17 07:12:25.000,2024-09-17,2024,9,17,53621,[],()
74246,55814,21161,1,38.75 $,12:02;2024-12-13,NULL,38.75,38.75,38.75,2024-12-13 12:02:00.000,2024-12-13,2024,12,13,55814,[],()
80465,55372,21283,3,40.50 $,2025-03-14T13:30:56.519,,40.5,40.5,121.5,2025-03-14 13:30:56.519,2025-03-14,2025,3,14,55372,[],()
74118,54263,21111,1,30.5€,"05:22:33,06/24/24","Apt. 295 4743 Louvenia Light, East Chantetown, CA 29331",36.6,36.6,36.6,2024-06-24 05:22:33.000,2024-06-24,2024,6,24,54263,[],()
79398,53822,21245,1,46.5USD,"11/11/24, 04:44",NULL,46.5,46.5,46.5,2024-11-11 04:44:00.000,2024-11-11,2024,11,11,53822,[],()
74166,53103,21160,1,$22¢50,21:19;12/12/24,,2250.0,2250.0,2250.0,2024-12-12 21:19:00.000,2024-12-12,2024,12,12,53103,[],()
76226,54616,21267,2,USD48,"11:46:04 A.M., 04/17/25","5926 Lynch Dam, North Lera, MT 68108",48.0,48.0,96.0,2025-04-17 11:46:04.000,2025-04-17,2025,4,17,54616,[],()
74634,55754,21234,4,$34.0,"16:58:08, 01/18/25","537 Retha Extension, Raymondtown, WY 35853",34.0,34.0,136.0,2025-01-18 16:58:08.000,2025-01-18,2025,1,18,55754,[],()
75743,53888,20926,2,€ 66.50,13:40:43;2024-10-09,,79.8,79.8,159.6,2024-10-09 13:40:43.000,2024-10-09,2024,10,9,53888,[],()
73688,53816,21073,1,€ 38.75,2025-03-14;01:58,NULL,46.5,46.5,46.5,2025-03-14 01:58:00.000,2025-03-14,2025,3,14,53816,[],()
78528,55429,21032,1,14€25¢,2024-06-06T03:52:31.438,NULL,1710.0,1710.0,1710.0,2024-06-06 03:52:31.438,2024-06-06,2024,6,6,55429,[],()
79147,53606,21207,1,USD23.99,07:15:59 pm 10/04/24,"Apt. 722 230 Davis Radial, Heaneyville, FL 87032-1474",23.99,23.99,23.99,2024-10-04 19:15:59.000,2024-10-04,2024,10,4,53606,[],()
81731,54031,21170,1,USD 70.99,2024-09-25T11:15:45,,70.99,70.99,70.99,2024-09-25 11:15:45.000,2024-09-25,2024,9,25,54031,[],()
74929,53091,21200,1,USD 43.0,11/04/24;07:29:10,,43.0,43.0,43.0,2024-11-04 07:29:10.000,2024-11-04,2024,11,4,53091,[],()
75462,53147,21538,1,68.0USD,"06/05/24,11:50:54 A.M.","Suite 745 84902 Tana Drive, New Zenaida, ME 48169",68.0,68.0,68.0,2024-06-05 11:50:54.000,2024-06-05,2024,6,5,53147,[],()
78295,53695,21547,2,21.75USD,02/18/25;08:22:23 A.M.,"502 Monty Mountain, New Earlburgh, AZ 34015-3985",21.75,21.75,43.5,2025-02-18 08:22:23.000,2025-02-18,2025,2,18,53695,[],()
82553,53449,21593,1,$59.,"06/24/24, 23:16:07",NULL,59.0,59.0,59.0,2024-06-24 23:16:07.000,2024-06-24,2024,6,24,53449,[],()
75656,54288,21194,1,USD 19.00,12:11:49 A.M.;25-February-2025,NULL,19.0,19.0,19.0,2025-02-25 00:11:49.000,2025-02-25,2025,2,25,54288,[],()
81895,54332,21062,1,72.25 $, 7-October-2024;11:26:16 am,NULL,72.25,72.25,72.25,2024-10-07 11:26:16.000,2024-10-07,2024,10,7,54332,[],()
75096,53795,21503,1,€ 68.25,09/11/24;13:04:36,,81.89999999999999,81.89999999999999,81.9,2024-09-11 13:04:36.000,2024-09-11,2024,9,11,53795,[],()
75278,55602,21426,1,26.5 USD,2024-02-17T00:36:05.190,"Suite 644 95021 Ron Flat, Jefferytown, NE 56551-7954",26.5,26.5,26.5,2024-02-17 00:36:05.190,2024-02-17,2024,2,17,55602,[],()
76393,53213,21086,1,USD66.50,2024-07-21T20:15:17.420,,66.5,66.5,66.5,2024-07-21 20:15:17.420,2024-07-21,2024,7,21,53213,[],()
73500,55060,21489,3,€61¢99, 4.12.2024  1:45:45,,7438.799999999999,7438.799999999999,22316.4,2024-04-12 01:45:45.000,2024-04-12,2024,4,12,55060,[],()
77797,53391,21066,1,32$75¢,04:46:18 PM 2025-05-30,NULL,3275.0,3275.0,3275.0,2025-05-30 16:46:18.000,2025-05-30,2025,5,30,53391,[],()
78052,54269,21486,1,39.99 USD,02:07;2024-07-12,"197 Chi Center, Groverhaven, ME 93867-0353",39.99,39.99,39.99,2024-07-12 02:07:00.000,2024-07-12,2024,7,12,54269,[],()
83086,54919,21288,1,€21¢50,2024-09-30T13:16:22,,2580.0,2580.0,2580.0,2024-09-30 13:16:22.000,2024-09-30,2024,9,30,54919,[],()
81294,54439,21462,1,26.25EUR,19:33:07 2025-03-29,NULL,31.5,31.5,31.5,2025-03-29 19:33:07.000,2025-03-29,2025,3,29,54439,[],()
81651,55073,21596,1,EUR 52.99,14-July-2024 07:12:30 am,,63.588,63.588,63.59,2024-07-14 07:12:30.000,2024-07-14,2024,7,14,55073,[],()
81143,54414,21495,1,$21¢75,2025-01-11T09:11:27.280,,2175.0,2175.0,2175.0,2025-01-11 09:11:27.280,2025-01-11,2025,1,11,54414,[],()
74280,54340,21037,1,55.5$,2024-11-02T18:39:26.903,NULL,55.5,55.5,55.5,2024-11-02 18:39:26.903,2024-11-02,2024,11,2,54340,[],()
81487,54937,21616,1,68 EUR,11:24:50; 2-December-2024,,81.6,81.6,81.6,2024-12-02 11:24:50.000,2024-12-02,2024,12,2,54937,[],()
79943,53656,21094,1,$69.50, 1-March-2024;05:03:56,NULL,69.5,69.5,69.5,2024-03-01 05:03:56.000,2024-03-01,2024,3,1,55640,[],()
75709,55629,21634,1,29.00USD,2025-01-10;07:41:10 A.M.,"2415 Cruickshank Curve, Brekkefort, AL 45291-3623",29.0,29.0,29.0,2025-01-10 07:41:10.000,2025-01-10,2025,1,10,55629,[],()
81224,53942,21270,1,$68¢25,"11/01/24,04:50:12",,6825.0,6825.0,6825.0,2024-11-01 04:50:12.000,2024-11-01,2024,11,1,53942,[],()
76874,54799,21545,1,EUR 63.99,2025-01-10T20:30:54.836,,76.788,76.788,76.79,2025-01-10 20:30:54.836,2025-01-10,2025,1,10,54799,[],()
73455,54786,20925,1,40.00 €,"17-Jul-2024, 09:14",,48.0,48.0,48.0,2024-07-17 09:14:00.000,2024-07-17,2024,7,17,54786,[],()
79898,55313,20941,1,EUR 22.25,"06/03/25, 14:38:34",,26.7,26.7,26.7,2025-06-03 14:38:34.000,2025-06-03,2025,6,3,53102,[],()
77534,54774,21625,2,28.0 $,2024-06-08T03:52:26.641,,28.0,28.0,56.0,2024-06-08 03:52:26.641,2024-06-08,2024,6,8,54774,[],()
76336,53506,21279,2,USD35.50,2025-01-23T08:18:27.934,,35.5,35.5,71.0,2025-01-23 08:18:27.934,2025-01-23,2025,1,23,53506,[],()
75273,55186,21522,1,USD 50.99, 6.02.2025 20:34:34,,50.99,50.99,50.99,2025-06-02 20:34:34.000,2025-06-02,2025,6,2,55186,[],()
80869,55278,21108,1,25.5USD,18:27:00 16-FEB-2025,,25.5,25.5,25.5,2025-02-16 18:27:00.000,2025-02-16,2025,2,16,55278,[],()
75357,53199,21289,1,USD50.0,2024-08-31;07:40:09,,50.0,50.0,50.0,2024-08-31 07:40:09.000,2024-08-31,2024,8,31,53199,[],()
82224,53832,21499,2,70€99¢,"06:47:54 A.M., 18-Apr-2025",NULL,8518.8,8518.8,17037.6,2025-04-18 06:47:54.000,2025-04-18,2025,4,18,53832,[],()
77605,53480,21577,1,$ 26.5,11:53 2025-01-21,,26.5,26.5,26.5,2025-01-21 11:53:00.000,2025-01-21,2025,1,21,53480,[],()
81521,53716,20997,3,$71.00,"03/05/25,07:47:08 AM",,71.0,71.0,213.0,2025-03-05 07:47:08.000,2025-03-05,2025,3,5,53716,[],()
79922,55373,21549,1,€53.99,"07:10, 2024-04-27",,64.788,64.788,64.79,2024-04-27 07:10:00.000,2024-04-27,2024,4,27,55373,[],()
73622,54695,21241,1,19$75¢,"16:20:59, 2025-05-31",,1975.0,1975.0,1975.0,2025-05-31 16:20:59.000,2025-05-31,2025,5,31,54695,[],()
73694,54521,21067,1,56.25USD, 9-DEC-2024;05:12,NULL,56.25,56.25,56.25,2024-12-09 05:12:00.000,2024-12-09,2024,12,9,54521,[],()
78594,55788,21045,1,€22¢75,"2025-04-17,01:45",,2730.0,2730.0,2730.0,2025-04-17 01:45:00.000,2025-04-17,2025,4,17,55788,[],()
76182,55177,21242,1,USD 55.50,23:02 31-July-2024,,55.5,55.5,55.5,2024-07-31 23:02:00.000,2024-07-31,2024,7,31,55177,[],()
76045,54718,21112,1,30.00 USD,18.11.2024  5:49:49,,30.0,30.0,30.0,2024-11-18 05:49:49.000,2024-11-18,2024,11,18,54718,[],()
74565,54367,21616,1,65.5USD,"2024-09-27,10:45:03",,65.5,65.5,65.5,2024-09-27 10:45:03.000,2024-09-27,2024,9,27,54367,[],()
74879,54822,21549,1,$51.25,2025-06-08 02:39:10 A.M.,NULL,51.25,51.25,51.25,2025-06-08 02:39:10.000,2025-06-08,2025,6,8,54822,[],()
79867,55733,21206,1,$ 65.,"08:06:05 PM,2025-04-27",,65.0,65.0,65.0,2025-04-27 20:06:05.000,2025-04-27,2025,4,27,55733,[],()
81274,55087,20987,1,67. €,2025-01-02T14:01:11.119,"Suite 457 4115 Tracey Keys, South Tobie, ID 63071",80.39999999999999,80.39999999999999,80.4,2025-01-02 14:01:11.119,2025-01-02,2025,1,2,55087,[],()
78648,55509,21512,3,61.0 $,"05:39,04/06/25","2950 Quitzon Gateway, Bernhardhaven, MO 57934-8061",61.0,61.0,183.0,2025-04-06 05:39:00.000,2025-04-06,2025,4,6,55509,[],()
75522,53165,21060,2,$34.00,22.09.2024 10:28:28,,34.0,34.0,68.0,2024-09-22 10:28:28.000,2024-09-22,2024,9,22,53165,[],()
82179,55688,21446,1,€35.0,22:47:47 21-Apr-2025,"190 Lauren Square, Port Pingshire, NC 02325-9094",42.0,42.0,42.0,2025-04-21 22:47:47.000,2025-04-21,2025,4,21,55688,[],()
81170,53791,21559,1,€71¢75,2024-11-07T19:45:30,NULL,8610.0,8610.0,8610.0,2024-11-07 19:45:30.000,2024-11-07,2024,11,7,53791,[],()
82400,55071,21486,1,41. USD,2025-02-12;07:20,NULL,41.0,41.0,41.0,2025-02-12 07:20:00.000,2025-02-12,2025,2,12,55071,[],()
73862,54077,21185,1,$ 32.5,"10/11/24,06:43:07 pm",,32.5,32.5,32.5,2024-10-11 18:43:07.000,2024-10-11,2024,10,11,54077,[],()
74190,53682,20974,1,62.0 $,2024-11-23;08:26:51 AM,,62.0,62.0,62.0,2024-11-23 08:26:51.000,2024-11-23,2024,11,23,53682,[],()
79513,54998,21011,1,EUR33.,2024-12-02T14:50:26.275,"Suite 658 15821 Shonta Forges, New Stellahaven, SD 53542-2097",39.6,39.6,39.6,2024-12-02 14:50:26.275,2024-12-02,2024,12,2,54998,[],()
73639,53341,21277,1,$63.5,"11:04:16 pm, 2025-07-23",,63.5,63.5,63.5,2025-07-23 23:04:16.000,2025-07-23,2025,7,23,53341,[],()
76947,53252,21125,1,16.00 $,2024-05-31T18:11:13,,16.0,16.0,16.0,2024-05-31 18:11:13.000,2024-05-31,2024,5,31,53252,[],()
79482,53666,21258,2,21.00 USD,10/02/24;17:17:26,,21.0,21.0,42.0,2024-10-02 17:17:26.000,2024-10-02,2024,10,2,53666,[],()
78178,53658,21432,1,75.00 USD,2024-06-18 18:04,,75.0,75.0,75.0,2024-06-18 18:04:00.000,2024-06-18,2024,6,18,53658,[],()
74038,54860,21071,1,$ 53.00,10:25:20 pm 25-Jul-2025,,53.0,53.0,53.0,2025-07-25 22:25:20.000,2025-07-25,2025,7,25,54860,[],()
82504,55595,20994,1,€19¢99,"15-Sep-2024,11:51","3658 Harvey Corners, North Morton, RI 62872-2002",2398.7999999999997,2398.7999999999997,2398.8,2024-09-15 11:51:00.000,2024-09-15,2024,9,15,55595,[],()
80647,54784,21100,4,€24¢00,"19:08:47,03/30/25",NULL,2880.0,2880.0,11520.0,2025-03-30 19:08:47.000,2025-03-30,2025,3,30,54784,[],()
75023,55829,21325,1,69.00 $,"2024-05-01, 08:52:28 A.M.","Suite 979 188 Roderick Track, New Devorahton, DE 12079",69.0,69.0,69.0,2024-05-01 08:52:28.000,2024-05-01,2024,5,1,55829,[],()
81252,54927,20969,3,18.25 USD," 7-November-2024,06:53",,18.25,18.25,54.75,2024-11-07 06:53:00.000,2024-11-07,2024,11,7,54927,[],()
81430,54974,21479,2,59.50 USD,"07:38:07 am,10/12/24",,59.5,59.5,119.0,2024-10-12 07:38:07.000,2024-10-12,2024,10,12,54974,[],()
82686,53107,21195,5,$39.00,"12:03:54 PM,2025-01-09",NULL,39.0,39.0,195.0,2025-01-09 12:03:54.000,2025-01-09,2025,1,9,53107,[],()
73364,54535,21196,1,$ 43.0,20:31;17-April-2025,,43.0,43.0,43.0,2025-04-17 20:31:00.000,2025-04-17,2025,4,17,54535,[],()
79420,54906,21542,5,USD 50.50, 1-Jul-2024 01:12,,50.5,50.5,252.5,2024-07-01 01:12:00.000,2024-07-01,2024,7,1,54906,[],()
78043,54913,21360,1,49$25¢,2025-03-02T12:48:47.749,,4925.0,4925.0,4925.0,2025-03-02 12:48:47.749,2025-03-02,2025,3,2,54913,[],()
80726,53029,21297,1,$ 67,"10:35:43 AM, 2024-11-01","80507 Runte Trail, Predovicshire, FL 46193-0659",67.0,67.0,67.0,2024-11-01 10:35:43.000,2024-11-01,2024,11,1,53029,[],()
79456,55565,21038,2,USD 54.25,2024-12-07T14:08:22,,54.25,54.25,108.5,2024-12-07 14:08:22.000,2024-12-07,2024,12,7,55565,[],()
79904,53524,21556,1,€ 22.99,"10:30,  1-NOV-2024",,27.587999999999997,27.587999999999997,27.59,2024-11-01 10:30:00.000,2024-11-01,2024,11,1,53524,[],()
82187,54777,21004,3,20.50$,17:27 07/12/24,,20.5,20.5,61.5,2024-07-12 17:27:00.000,2024-07-12,2024,7,12,54777,[],()
80251,55595,21041,3,$70.25,19:22  6-MAR-2025,NULL,70.25,70.25,210.75,2025-03-06 19:22:00.000,2025-03-06,2025,3,6,55595,[],()
74228,53378,21156,1,72.25USD,09:52:38 am;01/28/25,NULL,72.25,72.25,72.25,2025-01-28 09:52:38.000,2025-01-28,2025,1,28,53378,[],()
79104,55393,21515,2,$70.50,2024-06-12T03:05:13.668,,70.5,70.5,141.0,2024-06-12 03:05:13.668,2024-06-12,2024,6,12,55393,[],()
75252,53587,21370,1,43.0 €,08:06:46 pm;07/14/24,NULL,51.6,51.6,51.6,2024-07-14 20:06:46.000,2024-07-14,2024,7,14,53587,[],()
75849,55172,21543,1,$30.99,"13-Dec-2024, 05:02:58 A.M.",NULL,30.99,30.99,30.99,2024-12-13 05:02:58.000,2024-12-13,2024,12,13,55172,[],()
79514,55377,21301,4,59.99USD,2024-08-28T08:24:40,,59.99,59.99,239.96,2024-08-28 08:24:40.000,2024-08-28,2024,8,28,55377,[],()
82265,55082,21532,2,€ 40.75,"01:17:52,2024-11-07",,48.9,48.9,97.8,2024-11-07 01:17:52.000,2024-11-07,2024,11,7,55082,[],()
74096,54771,20935,1,31$25¢,"29-Apr-2024,10:34:07",,3125.0,3125.0,3125.0,2024-04-29 10:34:07.000,2024-04-29,2024,4,29,54771,[],()
80843,53207,21320,1,38.75 €,"12:08,15-April-2025",,46.5,46.5,46.5,2025-04-15 12:08:00.000,2025-04-15,2025,4,15,53207,[],()
80804,55117,21103,1,$ 67.99,"15-Aug-2025, 03:14",,67.99,67.99,67.99,2025-08-15 03:14:00.000,2025-08-15,2025,8,15,55117,[],()
76960,53621,21403,1,€23¢50,"24-JUL-2024,05:42:47 P.M.",NULL,2820.0,2820.0,2820.0,2024-07-24 17:42:47.000,2024-07-24,2024,7,24,53621,[],()
78437,53972,21257,1,$44.50,12:21:31 PM 03/26/25,NULL,44.5,44.5,44.5,2025-03-26 12:21:31.000,2025-03-26,2025,3,26,53972,[],()
81002,53348,21339,1,$73.50,"17-APR-2024, 23:59",NULL,73.5,73.5,73.5,2024-04-17 23:59:00.000,2024-04-17,2024,4,17,53348,[],()
80632,53114,21187,1,64.0 USD,2024-05-31;01:27,,64.0,64.0,64.0,2024-05-31 01:27:00.000,2024-05-31,2024,5,31,53114,[],()
75938,55432,21632,1,USD17.00,22.11.2024  6:56:56,,17.0,17.0,17.0,2024-11-22 06:56:56.000,2024-11-22,2024,11,22,55432,[],()
82646,53874,21570,1,49.50 USD,"28-December-2024, 08:19:23 PM","Suite 271 568 Cummerata Mountain, South Otha, MS 82966-0747",49.5,49.5,49.5,2024-12-28 20:19:23.000,2024-12-28,2024,12,28,53874,[],()
75942,54572,21419,1,$71.75,Mon Apr 28 13:00:51 2025,,71.75,71.75,71.75,2025-04-28 13:00:51.000,2025-04-28,2025,4,28,54572,[],()
79773,55365,21151,1,USD36.99,08/08/24;04:34:47 A.M.,,36.99,36.99,36.99,2024-08-08 04:34:47.000,2024-08-08,2024,8,8,55365,[],()
80180,54366,21628,1,EUR 29.25,02:34:07 pm 2025-01-03,NULL,35.1,35.1,35.1,2025-01-03 14:34:07.000,2025-01-03,2025,1,3,54366,[],()
81840,53411,21049,1,69.25 EUR,"2024-05-17, 08:46:11 A.M.",,83.1,83.1,83.1,2024-05-17 08:46:11.000,2024-05-17,2024,5,17,53411,[],()
73571,54705,21567,2,$59¢50,"27-Nov-2024, 07:08:15 P.M.",NULL,5950.0,5950.0,11900.0,2024-11-27 19:08:15.000,2024-11-27,2024,11,27,54705,[],()
74182,55025,20984,1,31.75 USD,18-Jan-2025 04:40:03 AM,,31.75,31.75,31.75,2025-01-18 04:40:03.000,2025-01-18,2025,1,18,55025,[],()
74382,55291,21115,2,68.50€,2024-09-25 12:41:51,"Suite 302 4607 Joeann Rue, Raquelfort, NY 81761-3457",82.2,82.2,164.4,2024-09-25 12:41:51.000,2024-09-25,2024,9,25,55291,[],()
81096,55305,21539,5,64.75 €,19:50:53 2024-11-10,,77.7,77.7,388.5,2024-11-10 19:50:53.000,2024-11-10,2024,11,10,55305,[],()
74762,54390,20970,1,39.$,"12-Feb-2025,08:25:36 pm",NULL,39.0,39.0,39.0,2025-02-12 20:25:36.000,2025-02-12,2025,2,12,54390,[],()
73337,54490,21250,2,USD20.0,"01/05/25,10:55:26",NULL,20.0,20.0,40.0,2025-01-05 10:55:26.000,2025-01-05,2025,1,5,54490,[],()
82068,53454,21379,2,€67.25,2024-09-27 08:02:59 PM,,80.7,80.7,161.4,2024-09-27 20:02:59.000,2024-09-27,2024,9,27,53454,[],()
75387,53573,21519,2,49€,"04:31, 02/15/25",NULL,58.8,58.8,117.6,2025-02-15 04:31:00.000,2025-02-15,2025,2,15,53573,[],()
75091,53567,21650,4,$ 42.25,2025-03-23 16:17,NULL,42.25,42.25,169.0,2025-03-23 16:17:00.000,2025-03-23,2025,3,23,53741,[],()
80386,54100,21567,4,$ 58.00,"20:04,07/16/24",NULL,58.0,58.0,232.0,2024-07-16 20:04:00.000,2024-07-16,2024,7,16,54100,[],()
77968,54018,21515,1,€ 74.0,2024-11-23T14:21:28.694,,88.8,88.8,88.8,2024-11-23 14:21:28.694,2024-11-23,2024,11,23,54018,[],()
81813,53229,21437,1,$66.99,2025-01-14T03:19:09.986,NULL,66.99,66.99,66.99,2025-01-14 03:19:09.986,2025-01-14,2025,1,14,53229,[],()
81397,53609,21601,1,USD30.00,02/13/25 03:15:41 am,NULL,30.0,30.0,30.0,2025-02-13 03:15:41.000,2025-02-13,2025,2,13,53609,[],()
78724,55290,21245,1,USD 50.0,"02:06:02 AM, 4-May-2025",,50.0,50.0,50.0,2025-05-04 02:06:02.000,2025-05-04,2025,5,4,55290,[],()
76130,54519,21245,1,EUR 49.99,2024-10-03 23:17,"705 Hollis Mountains, West Jesushaven, MT 24371-5614",59.988,59.988,59.99,2024-10-03 23:17:00.000,2024-10-03,2024,10,3,54519,[],()
79631,55154,21575,1,50.5 $,16:14;2025-02-16,"Suite 815 97097 Sonja Crossing, Lolitaview, OR 22914",50.5,50.5,50.5,2025-02-16 16:14:00.000,2025-02-16,2025,2,16,55154,[],()
78600,53457,21631,1,USD17.99,"05:46:59 A.M.,03/08/24","Apt. 308 186 Volkman Burgs, New Cornell, HI 06024-9257",17.99,17.99,17.99,2024-03-08 05:46:59.000,2024-03-08,2024,3,8,53457,[],()
75332,54744,21622,1,35.0USD,2024-07-31 03:15:41 P.M.,"520 Robel Via, Eldenborough, MN 89634",35.0,35.0,35.0,2024-07-31 15:15:41.000,2024-07-31,2024,7,31,54744,[],()
80296,54517,21595,1,51.00 $,01/25/25;02:30:44 pm,,51.0,51.0,51.0,2025-01-25 14:30:44.000,2025-01-25,2025,1,25,54517,[],()
74726,55567,21270,1,USD72.99,"01:31:19 am, 2024-11-16",,72.99,72.99,72.99,2024-11-16 01:31:19.000,2024-11-16,2024,11,16,55567,[],()
82357,53107,20953,2,47.00EUR,04/14/25;11:25:19 am,NULL,56.4,56.4,112.8,2025-04-14 11:25:19.000,2025-04-14,2025,4,14,53107,[],()
77920,54345,21278,1,32.00USD,2025-03-01T08:15:20,,32.0,32.0,32.0,2025-03-01 08:15:20.000,2025-03-01,2025,3,1,54345,[],()
75199,55201,20934,1,$22,2025-02-12T22:20:16.098,,22.0,22.0,22.0,2025-02-12 22:20:16.098,2025-02-12,2025,2,12,55201,[],()
81723,55272,21255,1,$ 36,"2024-04-05,06:38",NULL,36.0,36.0,36.0,2024-04-05 06:38:00.000,2024-04-05,2024,4,5,55272,[],()
79172,53354,21027,1,USD 28.50,2024-04-13T02:54:40.719,NULL,28.5,28.5,28.5,2024-04-13 02:54:40.719,2024-04-13,2024,4,13,53354,[],()
79953,53183,21521,1,$49¢75,06:10:57 2024-12-01,"6885 Stanton Inlet, South Emery, NM 97746-3600",4975.0,4975.0,4975.0,2024-12-01 06:10:57.000,2024-12-01,2024,12,1,53183,[],()
78986,55521,21615,1,47 €,01/06/25;15:39,NULL,56.4,56.4,56.4,2025-01-06 15:39:00.000,2025-01-06,2025,1,6,55521,[],()
75840,54721,21234,1,$31.99,06/12/25;06:13:16 AM,"Apt. 987 6044 Jaskolski Curve, Auershire, MO 12984-0414",31.99,31.99,31.99,2025-06-12 06:13:16.000,2025-06-12,2025,6,12,54721,[],()
80559,55255,20998,1,47.75EUR,"09:34:31, 17-July-2024",,57.3,57.3,57.3,2024-07-17 09:34:31.000,2024-07-17,2024,7,17,55255,[],()
76454,55571,20932,1,USD18.75,"19:53, 23-Jan-2025",,18.75,18.75,18.75,2025-01-23 19:53:00.000,2025-01-23,2025,1,23,53687,[],()
73592,53460,21229,4,USD 20.25,02/09/25 07:43:32 PM,,20.25,20.25,81.0,2025-02-09 19:43:32.000,2025-02-09,2025,2,9,53460,[],()
76238,53563,21617,1,21.75 USD,2024-09-09T03:10:42,,21.75,21.75,21.75,2024-09-09 03:10:42.000,2024-09-09,2024,9,9,53563,[],()
74858,55048,21612,1,63.75 $,2024-10-03T15:28:31.934,"Apt. 393 7866 Gutmann Creek, New Rhea, AZ 48159",63.75,63.75,63.75,2024-10-03 15:28:31.934,2024-10-03,2024,10,3,55048,[],()
75018,53597,21514,1,35.0 EUR,10/17/24 02:08:34 PM,,42.0,42.0,42.0,2024-10-17 14:08:34.000,2024-10-17,2024,10,17,53597,[],()
75456,53570,20975,1,€71¢99,17:59:19;02/28/25,,8638.8,8638.8,8638.8,2025-02-28 17:59:19.000,2025-02-28,2025,2,28,53570,[],()
76008,53658,21657,1,13€00¢, 8-Jan-2025 11:18:21,NULL,1560.0,1560.0,1560.0,2025-01-08 11:18:21.000,2025-01-08,2025,1,8,53658,[],()
75551,55658,21217,1,€32¢25,2025-08-16T17:12:34,,3870.0,3870.0,3870.0,2025-08-16 17:12:34.000,2025-08-16,2025,8,16,55658,[],()
74497,54826,21465,2,$71.99,"04:25:26 pm,07/24/24","Suite 817 6245 Keeling Oval, North Cristina, NE 41402-8263",71.99,71.99,143.98,2024-07-24 16:25:26.000,2024-07-24,2024,7,24,54826,[],()
76231,54323,21563,1,€55¢50,2025-04-26T04:47:14.605,,6660.0,6660.0,6660.0,2025-04-26 04:47:14.605,2025-04-26,2025,4,26,54323,[],()
78205,54715,21248,5,40.99$,08:03;03/10/25,NULL,40.99,40.99,204.95,2025-03-10 08:03:00.000,2025-03-10,2025,3,10,54715,[],()
82589,53404,21104,1,USD21.00,12/30/24 20:31,NULL,21.0,21.0,21.0,2024-12-30 20:31:00.000,2024-12-30,2024,12,30,53404,[],()
75992,53652,21505,3,USD 30.75,01:52:51 PM 2025-06-10,,30.75,30.75,92.25,2025-06-10 13:52:51.000,2025-06-10,2025,6,10,53652,[],()
80394,53619,21038,2,51.25$,"08:27,2024-07-01",NULL,51.25,51.25,102.5,2024-07-01 08:27:00.000,2024-07-01,2024,7,1,53619,[],()
82256,55244,20998,1,46.0EUR,07:30:26 am;10/05/24,NULL,55.199999999999996,55.199999999999996,55.2,2024-10-05 07:30:26.000,2024-10-05,2024,10,5,54374,[],()
82985,54487,21178,1,50.75$,"15-JAN-2025,07:28",,50.75,50.75,50.75,2025-01-15 07:28:00.000,2025-01-15,2025,1,15,54487,[],()
80345,55077,21019,1,65.99 $,"08:03:38 A.M.,2025-03-14",,65.99,65.99,65.99,2025-03-14 08:03:38.000,2025-03-14,2025,3,14,55077,[],()
78142,55522,21348,1,$24.,2025-01-04T15:18:18,NULL,24.0,24.0,24.0,2025-01-04 15:18:18.000,2025-01-04,2025,1,4,55522,[],()
74817,54865,21431,1,64$,"11/05/24,06:37:14",NULL,64.0,64.0,64.0,2024-11-05 06:37:14.000,2024-11-05,2024,11,5,54865,[],()
74331,53350,21326,1,$ 71.75,10/21/24 15:12,NULL,71.75,71.75,71.75,2024-10-21 15:12:00.000,2024-10-21,2024,10,21,53131,[],()
80892,55368,21083,1,$21.,"2025-03-29, 01:31:24 P.M.",,21.0,21.0,21.0,2025-03-29 13:31:24.000,2025-03-29,2025,3,29,55368,[],()
77165,53541,21303,5,26.00USD,Tue Jul  8 04:04:11 2025,,26.0,26.0,130.0,2025-07-08 04:04:11.000,2025-07-08,2025,7,8,53541,[],()
77659,53263,21164,1,19.0 EUR,"00:21:41,08/03/24",,22.8,22.8,22.8,2024-08-03 00:21:41.000,2024-08-03,2024,8,3,53263,[],()
77833,53488,21277,1,$ 63.0,29-Oct-2024 12:24:12 am,NULL,63.0,63.0,63.0,2024-10-29 00:24:12.000,2024-10-29,2024,10,29,53488,[],()
74139,55015,21153,1,USD44.99,2024-12-07T20:46:53,,44.99,44.99,44.99,2024-12-07 20:46:53.000,2024-12-07,2024,12,7,55015,[],()
74044,53180,21421,1,54.0USD,2024-07-08T03:13:00,,54.0,54.0,54.0,2024-07-08 03:13:00.000,2024-07-08,2024,7,8,53180,[],()
82340,55352,21433,2,USD 47.25,02:07 01/15/25,"747 Rowe Summit, Guillermoport, IL 70568",47.25,47.25,94.5,2025-01-15 02:07:00.000,2025-01-15,2025,1,15,55352,[],()
79067,54211,20976,5,50.00 $,08:14:38 A.M.;2024-12-08,NULL,50.0,50.0,250.0,2024-12-08 08:14:38.000,2024-12-08,2024,12,8,54211,[],()
78925,54234,21072,3,EUR70.00,"11/08/24,05:06:40 am","7815 Travis Circles, Port Cassey, VT 82665-3251",84.0,84.0,252.0,2024-11-08 05:06:40.000,2024-11-08,2024,11,8,54234,[],()
81523,53112,21454,1,40.50USD,"2025-03-14,10:59:51 pm",,40.5,40.5,40.5,2025-03-14 22:59:51.000,2025-03-14,2025,3,14,53112,[],()
81890,53610,21295,1,€15¢99,2024-11-23T23:28:36,,1918.8,1918.8,1918.8,2024-11-23 23:28:36.000,2024-11-23,2024,11,23,53610,[],()
81991,54110,21266,1,USD 61.,03/13/25 03:24:59 P.M.,"Suite 903 3432 Booker Crossing, Homerview, MI 51434-8114",61.0,61.0,61.0,2025-03-13 15:24:59.000,2025-03-13,2025,3,13,54110,[],()
77854,54053,21523,2,$ 47.,"20:44:58,17-SEP-2024",,47.0,47.0,94.0,2024-09-17 20:44:58.000,2024-09-17,2024,9,17,54053,[],()
77525,54266,20984,1,31$25¢,03/07/25;10:40:57 P.M.,"5543 Dane Flats, Port Eddie, CT 42308-9323",3125.0,3125.0,3125.0,2025-03-07 22:40:57.000,2025-03-07,2025,3,7,54266,[],()
79601,55754,21212,1,35.00 €,"10/26/24,11:59:08 P.M.",,42.0,42.0,42.0,2024-10-26 23:59:08.000,2024-10-26,2024,10,26,55754,[],()
74137,55590,21124,2,EUR 35.25,"15:53, 11-Aug-2025",NULL,42.3,42.3,84.6,2025-08-11 15:53:00.000,2025-08-11,2025,8,11,55590,[],()
77197,55727,21124,1,37.0 USD,06.11.2024 13:12:12,NULL,37.0,37.0,37.0,2024-06-11 13:12:12.000,2024-06-11,2024,6,11,55727,[],()
78999,54883,21106,2,44.5€,"2025-07-22, 02:17:23",,53.4,53.4,106.8,2025-07-22 02:17:23.000,2025-07-22,2025,7,22,54883,[],()
78333,53069,21258,3,21.99USD,07:51:37 pm  4-Jan-2025,NULL,21.99,21.99,65.97,2025-01-04 19:51:37.000,2025-01-04,2025,1,4,53069,[],()
79490,53098,21093,1,68.25$,"09/29/24, 19:35:59","928 Modesto Forest, East Luzland, MS 15591",68.25,68.25,68.25,2024-09-29 19:35:59.000,2024-09-29,2024,9,29,53098,[],()
82282,54825,21101,3,USD 21,"2024-12-28, 16:06:45",,21.0,21.0,63.0,2024-12-28 16:06:45.000,2024-12-28,2024,12,28,54825,[],()
76285,53558,21463,1,75.50$,11:14:52 A.M. 2024-09-01,,75.5,75.5,75.5,2024-09-01 11:14:52.000,2024-09-01,2024,9,1,53558,[],()
78854,54485,21475,1,35.0USD,"04/19/25, 17:32:18",NULL,35.0,35.0,35.0,2025-04-19 17:32:18.000,2025-04-19,2025,4,19,54485,[],()
78023,53541,21210,2,$18¢25,04/28/24 18:29:07,,1825.0,1825.0,3650.0,2024-04-28 18:29:07.000,2024-04-28,2024,4,28,53541,[],()
77873,55682,21150,4,USD65.0,"01/15/25,01:00",,65.0,65.0,260.0,2025-01-15 01:00:00.000,2025-01-15,2025,1,15,55682,[],()
81880,53667,21631,1,USD 16,2025-06-02 01:43:14,NULL,16.0,16.0,16.0,2025-06-02 01:43:14.000,2025-06-02,2025,6,2,53667,[],()
74945,55708,21142,2,USD34.75,2024-10-05T15:52:51,,34.75,34.75,69.5,2024-10-05 15:52:51.000,2024-10-05,2024,10,5,55708,[],()
82404,55694,21096,1,74.75 USD,"13:12, 2025-04-12","357 Wintheiser Island, Lake Jeffstad, AL 43786-2998",74.75,74.75,74.75,2025-04-12 13:12:00.000,2025-04-12,2025,4,12,55694,[],()
73928,53713,21525,1,49.$,2024-09-15T08:44:46.517,,49.0,49.0,49.0,2024-09-15 08:44:46.517,2024-09-15,2024,9,15,53713,[],()
82409,53334,21657,1,USD 16.5,"12:09:48 AM,13-July-2025",,16.5,16.5,16.5,2025-07-13 00:09:48.000,2025-07-13,2025,7,13,53334,[],()
80522,55085,21321,4,€ 74.0,"04/06/24, 03:52:22",,88.8,88.8,355.2,2024-04-06 03:52:22.000,2024-04-06,2024,4,6,55085,[],()
77561,53782,21052,1,74 EUR,00:43  1-October-2024,NULL,88.8,88.8,88.8,2024-10-01 00:43:00.000,2024-10-01,2024,10,1,53782,[],()
79492,55819,21636,1,53.75$,2024-10-15T02:43:01.079,NULL,53.75,53.75,53.75,2024-10-15 02:43:01.079,2024-10-15,2024,10,15,55819,[],()
75660,54135,21543,1,29.0 EUR,2025-04-27T09:38:25,NULL,34.8,34.8,34.8,2025-04-27 09:38:25.000,2025-04-27,2025,4,27,54135,[],()
78319,53086,21349,1,61.5 USD,"08/22/24,12:25:22 PM",,61.5,61.5,61.5,2024-08-22 12:25:22.000,2024-08-22,2024,8,22,53086,[],()
82464,54485,21594,1,USD 59.75,2025-02-02T16:40:28,"9940 Norbert Flat, Port Jimmiefort, WV 00220-4552",59.75,59.75,59.75,2025-02-02 16:40:28.000,2025-02-02,2025,2,2,54485,[],()
75754,53211,21369,1,61.0EUR,"08:38:51,21-August-2024","2457 Michelina Fords, Theahaven, ND 24426-1878",73.2,73.2,73.2,2024-08-21 08:38:51.000,2024-08-21,2024,8,21,53211,[],()
81317,53445,21197,1,$ 70.50,15:30:05 2025-04-13,"8032 Nienow Port, Anibalberg, AZ 18004-7408",70.5,70.5,70.5,2025-04-13 15:30:05.000,2025-04-13,2025,4,13,53445,[],()
75280,54270,21496,1,30.75 USD, 7-December-2024;08:37,"Apt. 872 285 Skye Tunnel, Lake Garlandton, WV 37697",30.75,30.75,30.75,2024-12-07 08:37:00.000,2024-12-07,2024,12,7,54270,[],()
79222,55077,21580,1,$ 61,"03:12:53, 7-SEP-2024","Suite 318 51519 Winfred Skyway, Milanburgh, CO 73834-6173",61.0,61.0,61.0,2024-09-07 03:12:53.000,2024-09-07,2024,9,7,55077,[],()
81300,53987,21505,1,EUR 26.75,"2025-01-10,09:16:31","Apt. 813 8872 Harber Islands, Streichfort, NY 99247",32.1,32.1,32.1,2025-01-10 09:16:31.000,2025-01-10,2025,1,10,53987,[],()
79874,53870,21505,1,29.75USD,02.12.2024 22:14:14,NULL,29.75,29.75,29.75,2024-02-12 22:14:14.000,2024-02-12,2024,2,12,55678,[],()
74567,54000,21243,3,69.50USD,02:23:56 am  8-Jan-2025,,69.5,69.5,208.5,2025-01-08 02:23:56.000,2025-01-08,2025,1,8,54000,[],()
73438,53770,21410,2,EUR 27,2025-04-09;08:43:46 am,,32.4,32.4,64.8,2025-04-09 08:43:46.000,2025-04-09,2025,4,9,53770,[],()
77342,55615,21419,1,USD69.99,"27-May-2024,22:34",NULL,69.99,69.99,69.99,2024-05-27 22:34:00.000,2024-05-27,2024,5,27,55615,[],()
74427,54531,21286,1,$33¢50,13:29;2024-09-23,NULL,3350.0,3350.0,3350.0,2024-09-23 13:29:00.000,2024-09-23,2024,9,23,54531,[],()
81334,53646,21223,1,70.$,17:29;2024-07-12,NULL,70.0,70.0,70.0,2024-07-12 17:29:00.000,2024-07-12,2024,7,12,53646,[],()
76905,54942,21458,1,EUR44.25,10:41 11/23/24,NULL,53.1,53.1,53.1,2024-11-23 10:41:00.000,2024-11-23,2024,11,23,54942,[],()
73419,53781,21437,2,66.75 EUR,"00:42,05/18/24",NULL,80.1,80.1,160.2,2024-05-18 00:42:00.000,2024-05-18,2024,5,18,53781,[],()
78172,54259,21176,1,23.75 $,10/13/24 15:04,"Apt. 948 8750 Monahan Street, North Meri, NJ 34137",23.75,23.75,23.75,2024-10-13 15:04:00.000,2024-10-13,2024,10,13,54259,[],()
74177,55044,21649,1,21.99$,02/03/25 09:11,,21.99,21.99,21.99,2025-02-03 09:11:00.000,2025-02-03,2025,2,3,55044,[],()
78975,53479,21428,1,$25.75,11/11/24 19:08:19,,25.75,25.75,25.75,2024-11-11 19:08:19.000,2024-11-11,2024,11,11,53479,[],()
79735,53581,21025,1,EUR53.75," 7-Feb-2025,05:33:42",NULL,64.5,64.5,64.5,2025-02-07 05:33:42.000,2025-02-07,2025,2,7,53581,[],()
75720,55306,21403,1,$ 24.,"07/27/24, 19:16:26",NULL,24.0,24.0,24.0,2024-07-27 19:16:26.000,2024-07-27,2024,7,27,55306,[],()
79364,55689,21072,1,70.00 USD,2024-09-28T19:40:09.155,,70.0,70.0,70.0,2024-09-28 19:40:09.155,2024-09-28,2024,9,28,55689,[],()
77980,53295,21282,2,60.50$,"04:08:56 A.M., 11/15/24",,60.5,60.5,121.0,2024-11-15 04:08:56.000,2024-11-15,2024,11,15,53295,[],()
75839,53025,21635,2,24.25 $,2024-10-04T20:43:41.256,,24.25,24.25,48.5,2024-10-04 20:43:41.256,2024-10-04,2024,10,4,53025,[],()
75429,55311,21531,5,USD 57.00,"2024-04-20,09:41:17 PM",,57.0,57.0,285.0,2024-04-20 21:41:17.000,2024-04-20,2024,4,20,55311,[],()
78017,53290,21264,2,USD 43.0,04:24 09/16/24,,43.0,43.0,86.0,2024-09-16 04:24:00.000,2024-09-16,2024,9,16,53290,[],()
78734,53843,20960,1,26. USD,21-July-2025 05:05:23 P.M.,,26.0,26.0,26.0,2025-07-21 17:05:23.000,2025-07-21,2025,7,21,53843,[],()
78674,55295,21284,1,19.0$,"06:09, 01/03/25",,19.0,19.0,19.0,2025-01-03 06:09:00.000,2025-01-03,2025,1,3,55295,[],()
76107,53037,21573,5,27.USD,"26-Jan-2025,14:50:02","Apt. 344 8039 Batz Drives, Jacquelynntown, NJ 54337",27.0,27.0,135.0,2025-01-26 14:50:02.000,2025-01-26,2025,1,26,53037,[],()
74685,53894,20984,4,31.25$,2024-07-31T16:45:22,,31.25,31.25,125.0,2024-07-31 16:45:22.000,2024-07-31,2024,7,31,53894,[],()
76881,53148,20983,5,17.0$,23-Apr-2025 13:53,,17.0,17.0,85.0,2025-04-23 13:53:00.000,2025-04-23,2025,4,23,53148,[],()
76823,55310,21053,1,52.0USD,10/05/24 11:44:18,,52.0,52.0,52.0,2024-10-05 11:44:18.000,2024-10-05,2024,10,5,55310,[],()
78156,55233,21558,3,27.00$,"01/24/25,07:44:07 AM",,27.0,27.0,81.0,2025-01-24 07:44:07.000,2025-01-24,2025,1,24,55233,[],()
76667,53837,21022,1,€61¢00,10.08.2024  1:55:55,"8360 Benton Parkways, South Marlinbury, VT 71725",7320.0,7320.0,7320.0,2024-10-08 01:55:55.000,2024-10-08,2024,10,8,53837,[],()
74344,53901,21262,1,35.25USD,"09/05/24,10:44:25","337 Wilfred Burgs, Port Anitra, NY 95796-8869",35.25,35.25,35.25,2024-09-05 10:44:25.000,2024-09-05,2024,9,5,53901,[],()
77835,55809,21155,1,$65.50,"09/13/24, 02:21:59 am",NULL,65.5,65.5,65.5,2024-09-13 02:21:59.000,2024-09-13,2024,9,13,53875,[],()
75613,54767,20930,1,$32.75,14-Mar-2025 10:24,,32.75,32.75,32.75,2025-03-14 10:24:00.000,2025-03-14,2025,3,14,54767,[],()
80501,54314,21380,1,33.5 EUR,09:03:34 am 14-Feb-2025,,40.199999999999996,40.199999999999996,40.2,2025-02-14 09:03:34.000,2025-02-14,2025,2,14,54314,[],()
76286,55327,20949,1,$47¢99," 2-DEC-2024, 03:40:00 pm",NULL,4799.0,4799.0,4799.0,2024-12-02 15:40:00.000,2024-12-02,2024,12,2,55327,[],()
81305,54013,21195,1,38.50 €,2024-10-22T02:40:47,"644 Hugh Mills, Mayaside, WV 71225-1346",46.199999999999996,46.199999999999996,46.2,2024-10-22 02:40:47.000,2024-10-22,2024,10,22,54013,[],()
81784,53806,21127,1,$ 56.5,"03:03:04 pm,30-MAR-2025",,56.5,56.5,56.5,2025-03-30 15:03:04.000,2025-03-30,2025,3,30,53806,[],()
75028,53862,21459,1,€22¢75,Fri Jun 13 12:24:04 2025,,2730.0,2730.0,2730.0,2025-06-13 12:24:04.000,2025-06-13,2025,6,13,53862,[],()
74229,54787,20965,1,58€50¢,10:56:09;2025-02-27,,7020.0,7020.0,7020.0,2025-02-27 10:56:09.000,2025-02-27,2025,2,27,54787,[],()
81916,53921,20919,1,$74.5,07:56:48 A.M.;2024-12-03,,74.5,74.5,74.5,2024-12-03 07:56:48.000,2024-12-03,2024,12,3,53921,[],()
74749,53853,21177,1,20.75$,"10/08/24,04:59:28","Suite 201 56092 Jast Islands, North Corey, MO 79516-1642",20.75,20.75,20.75,2024-10-08 04:59:28.000,2024-10-08,2024,10,8,53853,[],()
81792,54140,20946,1,22.50 EUR,23:27:09 24-Feb-2025,,27.0,27.0,27.0,2025-02-24 23:27:09.000,2025-02-24,2025,2,24,54140,[],()
77982,53228,21471,5,19.99 $,"10:52,05/28/24",NULL,19.99,19.99,99.95,2024-05-28 10:52:00.000,2024-05-28,2024,5,28,53228,[],()
78962,54920,21439,2,USD41.99,03/13/24;05:40:46 pm,"Apt. 217 138 Leo Street, West Harold, GA 36989",41.99,41.99,83.98,2024-03-13 17:40:46.000,2024-03-13,2024,3,13,54920,[],()
82873,54435,21155,1,$ 69.00,17:55;12/14/24,"7786 O'Hara Hills, Starkside, WA 70892",69.0,69.0,69.0,2024-12-14 17:55:00.000,2024-12-14,2024,12,14,54435,[],()
81864,53250,20923,3,USD 32.5,"10-August-2024,23:11:36",NULL,32.5,32.5,97.5,2024-08-10 23:11:36.000,2024-08-10,2024,8,10,53250,[],()
80081,54928,21377,1,€ 49.00,01/09/25 18:51:52,NULL,58.8,58.8,58.8,2025-01-09 18:51:52.000,2025-01-09,2025,1,9,54928,[],()
77489,53532,21356,4,17 $,"11:44, 15-Mar-2025",NULL,17.0,17.0,68.0,2025-03-15 11:44:00.000,2025-03-15,2025,3,15,53532,[],()
76031,54355,21225,1,$ 54.0,"08:37, 2025-05-06","Apt. 195 21113 Clyde Heights, Lake Loriahaven, MD 22076",54.0,54.0,54.0,2025-05-06 08:37:00.000,2025-05-06,2025,5,6,54355,[],()
73799,55720,21043,1,EUR 20.5,12/04/24;10:50:00 A.M.,,24.599999999999998,24.599999999999998,24.6,2024-12-04 10:50:00.000,2024-12-04,2024,12,4,55720,[],()
74585,54057,21331,1,€60¢75,05:24:17  6-Apr-2025,"794 Veum Mews, Boganside, NH 20021",7290.0,7290.0,7290.0,2025-04-06 05:24:17.000,2025-04-06,2025,4,6,54057,[],()
75562,54779,20960,1,$24¢25,19-APR-2025;04:52,,2425.0,2425.0,2425.0,2025-04-19 04:52:00.000,2025-04-19,2025,4,19,54779,[],()
81750,55430,21473,1,EUR58.25,16:07:05 2024-09-16,"Apt. 591 77416 Brakus Grove, Denicechester, KS 91092-7489",69.89999999999999,69.89999999999999,69.9,2024-09-16 16:07:05.000,2024-09-16,2024,9,16,55430,[],()
82081,54325,20949,2,USD47.5,"01/01/25, 06:12",,47.5,47.5,95.0,2025-01-01 06:12:00.000,2025-01-01,2025,1,1,54325,[],()
82321,55791,21088,1,57.99€,"11:03:20 pm,07/05/24",,69.588,69.588,69.59,2024-07-05 23:03:20.000,2024-07-05,2024,7,5,55791,[],()
77726,54124,21300,1,56.00 USD,2024-09-15T12:53:45,,56.0,56.0,56.0,2024-09-15 12:53:45.000,2024-09-15,2024,9,15,54124,[],()
80569,54086,21607,2,USD 68.25, 2-Sep-2024;07:08,"317 Shamika Tunnel, South Otha, NY 71529",68.25,68.25,136.5,2024-09-02 07:08:00.000,2024-09-02,2024,9,2,54086,[],()
77369,54159,21337,2,68.25 €,03:47 2024-05-29,,81.89999999999999,81.89999999999999,163.8,2024-05-29 03:47:00.000,2024-05-29,2024,5,29,54159,[],()
78559,55614,21557,1,65.0USD,"01/04/25, 12:23:49",NULL,65.0,65.0,65.0,2025-01-04 12:23:49.000,2025-01-04,2025,1,4,55614,[],()
75460,53398,21181,2,49. $,02:05 02/21/24,NULL,49.0,49.0,98.0,2024-02-21 02:05:00.000,2024-02-21,2024,2,21,53398,[],()
77512,54545,21542,1,USD 46.0,01/17/25 03:44:55 am,NULL,46.0,46.0,46.0,2025-01-17 03:44:55.000,2025-01-17,2025,1,17,54545,[],()
78381,55711,21099,2,29.75 €," 9-JAN-2025, 12:47:57",NULL,35.699999999999996,35.699999999999996,71.4,2025-01-09 12:47:57.000,2025-01-09,2025,1,9,55711,[],()
82924,54953,21314,1,16.5 EUR,18:37;11/08/24,NULL,19.8,19.8,19.8,2024-11-08 18:37:00.000,2024-11-08,2024,11,8,54953,[],()
80038,55567,21126,1,64. USD,"01:33:11 P.M., 24-March-2025",NULL,64.0,64.0,64.0,2025-03-24 13:33:11.000,2025-03-24,2025,3,24,55567,[],()
75229,53142,21598,1,39.0€,17-DEC-2024 04:01:50,NULL,46.8,46.8,46.8,2024-12-17 04:01:50.000,2024-12-17,2024,12,17,53142,[],()
76976,55103,21116,1,€33¢25,12/03/24 17:28,"2366 Hills Branch, North Barrieberg, VT 66095-9712",3990.0,3990.0,3990.0,2024-12-03 17:28:00.000,2024-12-03,2024,12,3,55103,[],()
81870,54049,21157,1,32.5 EUR,"04/25/25, 01:49:45",NULL,39.0,39.0,39.0,2025-04-25 01:49:45.000,2025-04-25,2025,4,25,54049,[],()
78130,54247,21472,2,$63.50, 1-Oct-2024 04:45,,63.5,63.5,127.0,2024-10-01 04:45:00.000,2024-10-01,2024,10,1,54247,[],()
75139,54145,21482,1,USD 45,22:03 06/29/25,,45.0,45.0,45.0,2025-06-29 22:03:00.000,2025-06-29,2025,6,29,54145,[],()
81642,54133,21332,1,44.99 USD,"21:35, 07/17/24",NULL,44.99,44.99,44.99,2024-07-17 21:35:00.000,2024-07-17,2024,7,17,54133,[],()
73966,53940,21459,1,€22.75,13:53:24;01/26/25,,27.3,27.3,27.3,2025-01-26 13:53:24.000,2025-01-26,2025,1,26,53940,[],()
82405,54658,21018,2,41.50$,"25-JUL-2024, 20:49:58",,41.5,41.5,83.0,2024-07-25 20:49:58.000,2024-07-25,2024,7,25,54658,[],()
79775,55223,21137,1,43$50¢, 5-Nov-2024;12:34:44 A.M.,,4350.0,4350.0,4350.0,2024-11-05 00:34:44.000,2024-11-05,2024,11,5,55223,[],()
82841,54650,21628,1,29.75 €,"09/24/24,20:10",,35.699999999999996,35.699999999999996,35.7,2024-09-24 20:10:00.000,2024-09-24,2024,9,24,53784,[],()
78661,54523,21392,1,75.00$,16:51:12;02/04/25,NULL,75.0,75.0,75.0,2025-02-04 16:51:12.000,2025-02-04,2025,2,4,54523,[],()
76993,55513,21598,1,€ 39.50,2025-05-23T12:32:11,,47.4,47.4,47.4,2025-05-23 12:32:11.000,2025-05-23,2025,5,23,55513,[],()
75893,54168,21525,1,$46.50,"28-Sep-2024,09:17:36",,46.5,46.5,46.5,2024-09-28 09:17:36.000,2024-09-28,2024,9,28,54168,[],()
78532,53644,21029,2,$47.00,"12:33:50 AM,17-Feb-2025",NULL,47.0,47.0,94.0,2025-02-17 00:33:50.000,2025-02-17,2025,2,17,53644,[],()
77779,54465,21277,2,60.50€,"2024-10-21, 23:25",NULL,72.6,72.6,145.2,2024-10-21 23:25:00.000,2024-10-21,2024,10,21,54465,[],()
78288,55680,21656,1,$75.75,15-January-2025 20:18,,75.75,75.75,75.75,2025-01-15 20:18:00.000,2025-01-15,2025,1,15,55680,[],()
81755,54284,21599,1,$17.5,"2025-04-19,06:51:22 am","924 Scotty Mills, Lehnerland, AZ 95677-4845",17.5,17.5,17.5,2025-04-19 06:51:22.000,2025-04-19,2025,4,19,54284,[],()
75321,53267,21102,1,52.USD,"06:02:48, 2024-07-24","Suite 990 83182 Elene Trail, East Kerry, SC 67579",52.0,52.0,52.0,2024-07-24 06:02:48.000,2024-07-24,2024,7,24,53267,[],()
74317,53850,21441,1,USD 15.25,"20:18:02, 1-Nov-2024","Apt. 179 48941 Kenton Overpass, Carrollhaven, PA 84786-7217",15.25,15.25,15.25,2024-11-01 20:18:02.000,2024-11-01,2024,11,1,53850,[],()
75031,54740,21110,1,37.99 $,"22:50,29-Jul-2024","Apt. 741 453 Shields Mountains, Hellerstad, MD 91072",37.99,37.99,37.99,2024-07-29 22:50:00.000,2024-07-29,2024,7,29,54950,[],()
73995,54493,21339,1,€ 72.00,2024-10-05 12:43:18,,86.39999999999999,86.39999999999999,86.4,2024-10-05 12:43:18.000,2024-10-05,2024,10,5,54493,[],()
79124,55121,21013,1,40.50 EUR,"24-Nov-2024,04:53:00",,48.6,48.6,48.6,2024-11-24 04:53:00.000,2024-11-24,2024,11,24,55121,[],()
77192,54907,21047,2,55.99 USD,"2024-09-07,20:34:00",NULL,55.99,55.99,111.98,2024-09-07 20:34:00.000,2024-09-07,2024,9,7,54907,[],()
82071,54887,21151,1,38$00¢,06:42:54 A.M.; 7-May-2025,,3800.0,3800.0,3800.0,2025-05-07 06:42:54.000,2025-05-07,2025,5,7,54887,[],()
83152,53025,21346,3,USD50,22.02.2025 05:02:02,,50.0,50.0,150.0,2025-02-22 05:02:02.000,2025-02-22,2025,2,22,53025,[],()
78959,54072,21336,1,$64.99,"00:42,10/20/24",,64.99,64.99,64.99,2024-10-20 00:42:00.000,2024-10-20,2024,10,20,54072,[],()
73372,53714,20983,5,15.0$,2025-01-30T15:44:30,,15.0,15.0,75.0,2025-01-30 15:44:30.000,2025-01-30,2025,1,30,53714,[],()
78768,55351,21057,1,$36,2024-08-16 11:17:15 AM,,36.0,36.0,36.0,2024-08-16 11:17:15.000,2024-08-16,2024,8,16,55351,[],()
74573,53447,20977,1,$22.5,"02:53:25,01/21/25",NULL,22.5,22.5,22.5,2025-01-21 02:53:25.000,2025-01-21,2025,1,21,53447,[],()
77033,55768,21008,1,USD18.00,"12/03/24, 12:35",NULL,18.0,18.0,18.0,2024-12-03 12:35:00.000,2024-12-03,2024,12,3,55768,[],()
73686,55487,21476,1,76.5 USD,"12/24/24, 18:27",,76.5,76.5,76.5,2024-12-24 18:27:00.000,2024-12-24,2024,12,24,55487,[],()
75305,53565,21429,3,40.5USD,06/16/24 03:05:45 pm,NULL,40.5,40.5,121.5,2024-06-16 15:05:45.000,2024-06-16,2024,6,16,53565,[],()
80845,54762,21175,2,25.75$,"09/25/24, 22:32","Suite 943 80911 Kozey Lights, West Brandy, ND 75238-4847",25.75,25.75,51.5,2024-09-25 22:32:00.000,2024-09-25,2024,9,25,54762,[],()
77350,54396,20959,1,44.50USD,Wed Apr  2 08:03:50 2025,NULL,44.5,44.5,44.5,2025-04-02 08:03:50.000,2025-04-02,2025,4,2,54396,[],()
79110,53312,21473,1,EUR60.0,"02/11/24, 17:13",NULL,72.0,72.0,72.0,2024-02-11 17:13:00.000,2024-02-11,2024,2,11,53312,[],()
78281,55263,21366,1,52.0€,2025-03-31T06:33:31.276,"596 Bergstrom Trace, Dwainside, IL 90551",62.4,62.4,62.4,2025-03-31 06:33:31.276,2025-03-31,2025,3,31,55263,[],()
79865,53855,21236,1,72.99 EUR,"05:45,10/26/24",,87.588,87.588,87.59,2024-10-26 05:45:00.000,2024-10-26,2024,10,26,53855,[],()
81876,53083,21509,1,€16.50,"19:58, 2-JAN-2025","8343 Ellan Island, Hassanton, ID 38924",19.8,19.8,19.8,2025-01-02 19:58:00.000,2025-01-02,2025,1,2,53083,[],()
81041,54086,21123,1,€ 65.5,Sun Oct 20 22:57:43 2024,NULL,78.6,78.6,78.6,2024-10-20 22:57:43.000,2024-10-20,2024,10,20,54086,[],()
78826,53028,21575,2,EUR 50.0,"10/26/24, 11:31:00",,60.0,60.0,120.0,2024-10-26 11:31:00.000,2024-10-26,2024,10,26,53028,[],()
78256,54282,21033,1,67.99 $,2025-03-02T19:36:34,,67.99,67.99,67.99,2025-03-02 19:36:34.000,2025-03-02,2025,3,2,54282,[],()
80739,55118,21263,1,$59.5,03/12/25;03:18:02 AM,"Apt. 599 25534 Karen Ports, West Rigobertomouth, MO 92040",59.5,59.5,59.5,2025-03-12 03:18:02.000,2025-03-12,2025,3,12,55118,[],()
82079,55048,21245,1,46.$,20-October-2024 00:33,,46.0,46.0,46.0,2024-10-20 00:33:00.000,2024-10-20,2024,10,20,55048,[],()
79632,54802,20943,2,73.25 USD,08:56 07/11/24,,73.25,73.25,146.5,2024-07-11 08:56:00.000,2024-07-11,2024,7,11,54388,[],()
82649,55294,21096,1,73.00€," 8-March-2025, 10:14:35 P.M.","84009 Irving Mountains, Lake Rufusfurt, WY 85279",87.6,87.6,87.6,2025-03-08 22:14:35.000,2025-03-08,2025,3,8,55294,[],()
83027,55191,21356,1,13€,2024-11-17T07:02:51,,15.6,15.6,15.6,2024-11-17 07:02:51.000,2024-11-17,2024,11,17,55191,[],()
76151,55357,21243,1,USD 66.25,15:50:13;2024-12-26,NULL,66.25,66.25,66.25,2024-12-26 15:50:13.000,2024-12-26,2024,12,26,55357,[],()
73844,53534,21089,1,49.25 $,23:36:42;27-April-2024,"32038 Kling Wells, North Winfredfurt, ND 36112-4705",49.25,49.25,49.25,2024-04-27 23:36:42.000,2024-04-27,2024,4,27,53534,[],()
80153,53282,21630,1,53.75EUR,"2025-01-21,13:24",NULL,64.5,64.5,64.5,2025-01-21 13:24:00.000,2025-01-21,2025,1,21,53282,[],()
82760,54045,21041,2,$ 71.0,Mon Mar 10 23:10:38 2025,"Apt. 226 135 Considine Forges, Hyattberg, WV 77481-7209",71.0,71.0,142.0,2025-03-10 23:10:38.000,2025-03-10,2025,3,10,54045,[],()
74129,55042,21191,1,EUR 42.99,"19:53, 2025-03-25",,51.588,51.588,51.59,2025-03-25 19:53:00.000,2025-03-25,2025,3,25,55042,[],()
74240,55546,21648,1,USD29.5,13:34:40 06/06/24,NULL,29.5,29.5,29.5,2024-06-06 13:34:40.000,2024-06-06,2024,6,6,55546,[],()
80075,55822,21471,1,USD19," 4-February-2025,17:52",,19.0,19.0,19.0,2025-02-04 17:52:00.000,2025-02-04,2025,2,4,55822,[],()
80245,54218,21443,1,36.25 $,20:43:36  5-OCT-2024,,36.25,36.25,36.25,2024-10-05 20:43:36.000,2024-10-05,2024,10,5,54218,[],()
76221,53248,21528,1,72.00 $,"11/14/24, 01:11:01 A.M.",NULL,72.0,72.0,72.0,2024-11-14 01:11:01.000,2024-11-14,2024,11,14,53248,[],()
75756,53142,21352,5,34.25 USD,05:49:06 A.M. 04/20/25,"25445 Austin Estates, South Basil, DE 20328",34.25,34.25,171.25,2025-04-20 05:49:06.000,2025-04-20,2025,4,20,53142,[],()
80556,54088,21583,1,$17¢75,03:12:19 PM; 7-Jul-2024,,1775.0,1775.0,1775.0,2024-07-07 15:12:19.000,2024-07-07,2024,7,7,54088,[],()
80685,54382,21639,1,$ 16.50,"2025-02-12, 04:39:15 am",NULL,16.5,16.5,16.5,2025-02-12 04:39:15.000,2025-02-12,2025,2,12,54375,[],()
80929,53639,21233,2,44.0 €,16:48:37;03/04/25,"65561 Terrie Parkway, East Veraborough, CO 04838",52.8,52.8,105.6,2025-03-04 16:48:37.000,2025-03-04,2025,3,4,53639,[],()
74865,54307,21313,3,35.00 $,"01:42:33 pm,03/13/25",,35.0,35.0,105.0,2025-03-13 13:42:33.000,2025-03-13,2025,3,13,54307,[],()
76781,55066,21492,1,26.99$,"02/11/25,01:53:20",,26.99,26.99,26.99,2025-02-11 01:53:20.000,2025-02-11,2025,2,11,55066,[],()
80937,54443,21139,2,53.5 $,2025-01-17T17:05:20.657,NULL,53.5,53.5,107.0,2025-01-17 17:05:20.657,2025-01-17,2025,1,17,54443,[],()
76518,54418,21154,1,USD68.50,30.03.2025 10:40:40,NULL,68.5,68.5,68.5,2025-03-30 10:40:40.000,2025-03-30,2025,3,30,54418,[],()
77243,54194,21293,1,57.50 EUR," 9-JUN-2025,21:09:25",,69.0,69.0,69.0,2025-06-09 21:09:25.000,2025-06-09,2025,6,9,54194,[],()
78126,54964,21389,1,32.5$,12:29:27 08/21/24,,32.5,32.5,32.5,2024-08-21 12:29:27.000,2024-08-21,2024,8,21,54964,[],()
83014,55146,21356,1,EUR 18.25,08/21/24 17:13:42,,21.9,21.9,21.9,2024-08-21 17:13:42.000,2024-08-21,2024,8,21,55146,[],()
75209,54056,21579,3,55€25¢,"02:31,24-FEB-2025",NULL,6630.0,6630.0,19890.0,2025-02-24 02:31:00.000,2025-02-24,2025,2,24,54056,[],()
78427,55410,21470,2,$ 69,18.07.2024 23:16:16,"221 Iesha Lodge, West Lula, OK 94752-5296",69.0,69.0,138.0,2024-07-18 23:16:16.000,2024-07-18,2024,7,18,55410,[],()
82390,53370,21558,2,26.75USD,2025-07-10T18:08:51.142,,26.75,26.75,53.5,2025-07-10 18:08:51.142,2025-07-10,2025,7,10,53370,[],()
73812,54541,21308,1,59.50 $," 6-Oct-2024,17:21:05",NULL,59.5,59.5,59.5,2024-10-06 17:21:05.000,2024-10-06,2024,10,6,54541,[],()
77327,53288,21326,1,72$75¢,"2025-05-14,06:47:21",NULL,7275.0,7275.0,7275.0,2025-05-14 06:47:21.000,2025-05-14,2025,5,14,53288,[],()
74239,55080,21242,1,$57¢99,"08:19,01/08/25",,5799.0,5799.0,5799.0,2025-01-08 08:19:00.000,2025-01-08,2025,1,8,55080,[],()
78789,55776,21356,1,18.00EUR,"10/31/24,07:30",,21.599999999999998,21.599999999999998,21.6,2024-10-31 07:30:00.000,2024-10-31,2024,10,31,55776,[],()
78408,55175,21081,2,$74.0,2024-04-24 02:51:18,,74.0,74.0,148.0,2024-04-24 02:51:18.000,2024-04-24,2024,4,24,55175,[],()
80412,55098,21566,3,48.00USD,"23:39:16, 21-Sep-2024",NULL,48.0,48.0,144.0,2024-09-21 23:39:16.000,2024-09-21,2024,9,21,55098,[],()
74530,55172,21585,1,41.25EUR,07:57:14 AM;17-FEB-2025,,49.5,49.5,49.5,2025-02-17 07:57:14.000,2025-02-17,2025,2,17,55172,[],()
79293,55048,21492,1,23.0 $,21:52 11/01/24,"Apt. 393 7866 Gutmann Creek, New Rhea, AZ 48159",23.0,23.0,23.0,2024-11-01 21:52:00.000,2024-11-01,2024,11,1,55048,[],()
77798,55247,21192,2,71.99$,05:42:22 PM;2025-02-27,,71.99,71.99,143.98,2025-02-27 17:42:22.000,2025-02-27,2025,2,27,55247,[],()
79268,54046,21582,1,56.99EUR,"11:26:32 P.M.,2024-06-16",NULL,68.388,68.388,68.39,2024-06-16 23:26:32.000,2024-06-16,2024,6,16,54046,[],()
73852,54696,21117,1,€ 37.5,2025-05-27T03:35:19.075,NULL,45.0,45.0,45.0,2025-05-27 03:35:19.075,2025-05-27,2025,5,27,54696,[],()
75750,55712,21271,1,27.25$,01:12:06 pm;2024-07-24,NULL,27.25,27.25,27.25,2024-07-24 13:12:06.000,2024-07-24,2024,7,24,55712,[],()
82559,53479,21548,2,$ 64.25,"08/12/24,03:36:30 PM",,64.25,64.25,128.5,2024-08-12 15:36:30.000,2024-08-12,2024,8,12,53479,[],()
78775,53292,21363,1,30.5 $,"08:27:25, 2025-01-18",NULL,30.5,30.5,30.5,2025-01-18 08:27:25.000,2025-01-18,2025,1,18,53292,[],()
81325,54897,21133,3,USD 69.,"00:30:43,05/26/25",NULL,69.0,69.0,207.0,2025-05-26 00:30:43.000,2025-05-26,2025,5,26,54897,[],()
77877,55638,21305,1,EUR44.75,12:54:53;16-NOV-2024,"15998 Crona Manor, Grahamfurt, AL 66190",53.699999999999996,53.699999999999996,53.7,2024-11-16 12:54:53.000,2024-11-16,2024,11,16,55638,[],()
76401,54971,21045,1,USD25.50,"2025-02-01,18:06:07","8216 Savanna Manor, Wisozkfort, NE 60556",25.5,25.5,25.5,2025-02-01 18:06:07.000,2025-02-01,2025,2,1,54971,[],()
77508,55255,21279,1,EUR38.75,"11:47:17 P.M.,07/22/24",NULL,46.5,46.5,46.5,2024-07-22 23:47:17.000,2024-07-22,2024,7,22,55255,[],()
81999,55100,21125,1,USD15.0,"2024-06-07,11:35:13 A.M.","Apt. 406 45068 Valeria Parks, Lakinland, MN 96142-1205",15.0,15.0,15.0,2024-06-07 11:35:13.000,2024-06-07,2024,6,7,55100,[],()
74067,53731,21593,2,57.50 $,"12:28:23, 2024-11-02",,57.5,57.5,115.0,2024-11-02 12:28:23.000,2024-11-02,2024,11,2,53731,[],()
81972,54738,21610,5,EUR45.99," 6-May-2025, 11:22:18 pm",,55.188,55.188,275.94,2025-05-06 23:22:18.000,2025-05-06,2025,5,6,54738,[],()
81206,53156,21363,1,$ 28.00,21:55:49 19-FEB-2025,NULL,28.0,28.0,28.0,2025-02-19 21:55:49.000,2025-02-19,2025,2,19,53156,[],()
73516,54363,21441,1,19.00 USD,"06/26/25,03:37:38 A.M.",,19.0,19.0,19.0,2025-06-26 03:37:38.000,2025-06-26,2025,6,26,54363,[],()
77590,54912,21502,2,32.0$,"11:59:31 am, 2024-09-23",,32.0,32.0,64.0,2024-09-23 11:59:31.000,2024-09-23,2024,9,23,54912,[],()
74793,53269,21421,1,USD55.5,06/28/24;12:39,,55.5,55.5,55.5,2024-06-28 12:39:00.000,2024-06-28,2024,6,28,53269,[],()
74449,54223,20998,1,46.0USD,10:11:46 P.M.;17-MAR-2024,"84373 Stark Course, West Angle, OK 43852-1048",46.0,46.0,46.0,2024-03-17 22:11:46.000,2024-03-17,2024,3,17,54223,[],()
82999,53610,21233,2,40.99 EUR,11:58:36 A.M.;2024-12-28,,49.188,49.188,98.38,2024-12-28 11:58:36.000,2024-12-28,2024,12,28,53610,[],()
78861,54322,21364,1,USD66,"11:59:38 P.M., 2025-02-04",,66.0,66.0,66.0,2025-02-04 23:59:38.000,2025-02-04,2025,2,4,54322,[],()
77202,53973,21331,2,USD 62.75,13:29 08/03/24,"Apt. 300 19581 Orville Forge, Parkerfort, WV 00515-1341",62.75,62.75,125.5,2024-08-03 13:29:00.000,2024-08-03,2024,8,3,53973,[],()
81707,53780,21393,1,$ 39.75,"03:30:15 PM, 2024-08-21",,39.75,39.75,39.75,2024-08-21 15:30:15.000,2024-08-21,2024,8,21,53780,[],()
77231,55436,21425,1,44.5 €,2024-10-21T05:48:45,"Suite 224 84167 Kulas Mills, Kennyland, MN 67963",53.4,53.4,53.4,2024-10-21 05:48:45.000,2024-10-21,2024,10,21,55436,[],()
79592,53460,21026,2,20.00 $,19:40:22;2025-01-09,,20.0,20.0,40.0,2025-01-09 19:40:22.000,2025-01-09,2025,1,9,53460,[],()
79687,54269,21481,3,22.00 USD,2024-07-26 03:10,"197 Chi Center, Groverhaven, ME 93867-0353",22.0,22.0,66.0,2024-07-26 03:10:00.000,2024-07-26,2024,7,26,54269,[],()
75503,55738,21219,2,$59¢99,01:07:58 09/05/24,,5999.0,5999.0,11998.0,2024-09-05 01:07:58.000,2024-09-05,2024,9,5,55738,[],()
75777,54857,21409,1,73.00$,"14-JAN-2025,19:03","27067 Ellis Mountains, New Arthurborough, KY 66430-9560",73.0,73.0,73.0,2025-01-14 19:03:00.000,2025-01-14,2025,1,14,54857,[],()
74557,54235,21435,3,€ 57.25,2024-10-28;09:43,,68.7,68.7,206.1,2024-10-28 09:43:00.000,2024-10-28,2024,10,28,54235,[],()
82781,54508,21593,5,USD 59.0,2024-09-03T14:11:39.124,NULL,59.0,59.0,295.0,2024-09-03 14:11:39.124,2024-09-03,2024,9,3,54508,[],()
73736,55322,21503,1,$ 68.0,04:17:37 pm;12-APR-2025,,68.0,68.0,68.0,2025-04-12 16:17:37.000,2025-04-12,2025,4,12,55322,[],()
82370,53655,21383,2,EUR 40.0,"09/16/24,08:25:35 A.M.",,48.0,48.0,96.0,2024-09-16 08:25:35.000,2024-09-16,2024,9,16,53655,[],()
78001,55379,21021,1,46.99 USD,"2024-12-02,16:30",NULL,46.99,46.99,46.99,2024-12-02 16:30:00.000,2024-12-02,2024,12,2,55379,[],()
80199,54821,21056,1,42.0USD,05/12/24 09:23:18,,42.0,42.0,42.0,2024-05-12 09:23:18.000,2024-05-12,2024,5,12,54821,[],()
79606,55415,21386,1,USD 43.5,05:45:50 PM 21-DEC-2024,NULL,43.5,43.5,43.5,2024-12-21 17:45:50.000,2024-12-21,2024,12,21,54739,[],()
81313,54047,21003,1,36.5 $,"30-November-2024,02:06:37 pm","6834 Nikolaus Landing, Natalyaport, NM 05463-1339",36.5,36.5,36.5,2024-11-30 14:06:37.000,2024-11-30,2024,11,30,54047,[],()
76117,55042,21354,1,17.75 $,"2024-11-14,11:22:20 A.M.","Suite 932 37015 Cormier Knolls, North Arnettachester, ME 62955-1053",17.75,17.75,17.75,2024-11-14 11:22:20.000,2024-11-14,2024,11,14,55042,[],()
81660,54142,21594,1,EUR 59.0,2025-01-24T22:21:28,,70.8,70.8,70.8,2025-01-24 22:21:28.000,2025-01-24,2025,1,24,54142,[],()
82799,53641,21243,1,67.99 $,10:30:54;07/18/24,"Apt. 462 16017 Bernard Villages, Linoton, KS 42421-7376",67.99,67.99,67.99,2024-07-18 10:30:54.000,2024-07-18,2024,7,18,53641,[],()
75496,55141,21613,1,23.00€,2025-03-25T05:09:24.095,,27.599999999999998,27.599999999999998,27.6,2025-03-25 05:09:24.095,2025-03-25,2025,3,25,55141,[],()
82564,54560,21518,2,55.99 $,"21:41:55,24-October-2024",NULL,55.99,55.99,111.98,2024-10-24 21:41:55.000,2024-10-24,2024,10,24,54560,[],()
78254,55284,21612,1,$63,08:47:49 AM;19-Jan-2025,,63.0,63.0,63.0,2025-01-19 08:47:49.000,2025-01-19,2025,1,19,55284,[],()
75723,55055,21269,1,32.99 $,"23:54, 15-June-2025","9211 Douglas Street, Strackebury, IL 21201-6503",32.99,32.99,32.99,2025-06-15 23:54:00.000,2025-06-15,2025,6,15,55055,[],()
82356,53496,21395,1,$ 44.,26-March-2025 06:36,NULL,44.0,44.0,44.0,2025-03-26 06:36:00.000,2025-03-26,2025,3,26,53496,[],()
78898,53206,20949,1,€ 47.75,2024-12-21;03:34:14 AM,"Apt. 463 952 Lockman Lights, South Jayne, MI 15569",57.3,57.3,57.3,2024-12-21 03:34:14.000,2024-12-21,2024,12,21,53241,[],()
76868,53772,21172,4,15.5 $,"17:54:05,01/01/25",NULL,15.5,15.5,62.0,2025-01-01 17:54:05.000,2025-01-01,2025,1,1,53772,[],()
78719,54223,21551,1,42.0USD,2024-10-19T20:13:14,NULL,42.0,42.0,42.0,2024-10-19 20:13:14.000,2024-10-19,2024,10,19,54223,[],()
81156,55354,21319,2,$ 54.,Fri Oct 18 17:04:05 2024,NULL,54.0,54.0,108.0,2024-10-18 17:04:05.000,2024-10-18,2024,10,18,55354,[],()
76072,54794,21277,1,$59.5,07:53 2025-03-31,"Suite 475 898 Hettinger View, Ziemeside, LA 03443",59.5,59.5,59.5,2025-03-31 07:53:00.000,2025-03-31,2025,3,31,54794,[],()
81246,53943,21154,1,$ 68.0,08:22;01/20/25,"22571 Shena Oval, West Mellissastad, MN 91780",68.0,68.0,68.0,2025-01-20 08:22:00.000,2025-01-20,2025,1,20,54718,[],()
80062,55230,20928,1,23.25$,"2024-08-09,09:33",,23.25,23.25,23.25,2024-08-09 09:33:00.000,2024-08-09,2024,8,9,55230,[],()
75015,55082,21628,1,$ 26.25,"09:49:10 A.M.,02/14/25",,26.25,26.25,26.25,2025-02-14 09:49:10.000,2025-02-14,2025,2,14,55082,[],()
76128,53095,20923,4,32.0€,2025-05-04 01:13:16 A.M.,"10104 Mueller Garden, Jerehaven, GA 06024-4527",38.4,38.4,153.6,2025-05-04 01:13:16.000,2025-05-04,2025,5,4,53095,[],()
81222,53475,20981,1,19.99$,"2024-09-12,01:40:23 PM",,19.99,19.99,19.99,2024-09-12 13:40:23.000,2024-09-12,2024,9,12,53475,[],()
75502,53554,21653,1,39.25 EUR,2025-04-19 08:18:32,NULL,47.1,47.1,47.1,2025-04-19 08:18:32.000,2025-04-19,2025,4,19,53554,[],()
81080,53065,21425,1,40.50 $,02/27/25 05:26:28,,40.5,40.5,40.5,2025-02-27 05:26:28.000,2025-02-27,2025,2,27,53065,[],()
78003,55059,21274,3,34€75¢,11-JAN-2025 06:33:13 PM,,4170.0,4170.0,12510.0,2025-01-11 18:33:13.000,2025-01-11,2025,1,11,55059,[],()
78236,54788,21380,1,USD37.0,2024-09-25T02:57:24.608,NULL,37.0,37.0,37.0,2024-09-25 02:57:24.608,2024-09-25,2024,9,25,54788,[],()
83137,55453,21326,1,73.00 USD,"06:32:56 A.M., 12/23/24","202 Adena Field, Port Manualport, NV 18516-8708",73.0,73.0,73.0,2024-12-23 06:32:56.000,2024-12-23,2024,12,23,55453,[],()
80800,55596,21648,1,30.75EUR,"05:49:32 am,20-Nov-2024",NULL,36.9,36.9,36.9,2024-11-20 05:49:32.000,2024-11-20,2024,11,20,55596,[],()
77120,53230,21632,1,USD 21.0,07:25:05 12/25/24,,21.0,21.0,21.0,2024-12-25 07:25:05.000,2024-12-25,2024,12,25,53230,[],()
76127,55078,21035,1,43.25USD,"2024-06-27,06:35",,43.25,43.25,43.25,2024-06-27 06:35:00.000,2024-06-27,2024,6,27,55078,[],()
81090,53740,21332,1,$ 44.0,2024-09-23 07:04,,44.0,44.0,44.0,2024-09-23 07:04:00.000,2024-09-23,2024,9,23,53740,[],()
78199,54942,21107,1,67.50€,"07/18/24, 08:28:26 am","8037 Shields Way, Estebanstad, WY 56038",81.0,81.0,81.0,2024-07-18 08:28:26.000,2024-07-18,2024,7,18,54942,[],()
76116,53555,21080,1,USD 27.25,06:16;2024-10-22,,27.25,27.25,27.25,2024-10-22 06:16:00.000,2024-10-22,2024,10,22,53807,[],()
77155,54315,21002,1,40.00 $,"19-October-2024, 10:58:15 am",,40.0,40.0,40.0,2024-10-19 10:58:15.000,2024-10-19,2024,10,19,54315,[],()
73463,53973,21446,1,$31.0," 5-JUL-2025, 01:52:26 am",,31.0,31.0,31.0,2025-07-05 01:52:26.000,2025-07-05,2025,7,5,53973,[],()
83122,54745,21365,3,€55¢75,11:05:42 A.M.;07/30/24,"Suite 369 531 Joesph Ports, East Casey, WI 94704-2283",6690.0,6690.0,20070.0,2024-07-30 11:05:42.000,2024-07-30,2024,7,30,54380,[],()
73980,54772,21420,1,68.99$,13.11.2024 07:22:22,"25384 Senger Ports, North Bill, TX 87946-7820",68.99,68.99,68.99,2024-11-13 07:22:22.000,2024-11-13,2024,11,13,54772,[],()
76040,55640,21323,1,25 EUR,2024-12-15T04:32:15,,30.0,30.0,30.0,2024-12-15 04:32:15.000,2024-12-15,2024,12,15,55640,[],()
78439,54449,21148,1,€59,2024-07-23 07:05:00,,70.8,70.8,70.8,2024-07-23 07:05:00.000,2024-07-23,2024,7,23,54449,[],()
74061,54889,20925,1,USD43.50, 8-MAY-2024 09:32,"Suite 824 104 Jaime Village, Marlonland, NH 68094",43.5,43.5,43.5,2024-05-08 09:32:00.000,2024-05-08,2024,5,8,54889,[],()
83092,53879,20931,2,USD 54.75,2024-11-20T14:48:28.313,,54.75,54.75,109.5,2024-11-20 14:48:28.313,2024-11-20,2024,11,20,53879,[],()
79725,55703,21595,3,USD 49.0,"18:37:37,02/12/25",NULL,49.0,49.0,147.0,2025-02-12 18:37:37.000,2025-02-12,2025,2,12,55703,[],()
80224,53533,21586,1,19.50€,2025-03-30T15:49:02,NULL,23.4,23.4,23.4,2025-03-30 15:49:02.000,2025-03-30,2025,3,30,53533,[],()
75086,53307,21314,1,14.5 $,14-November-2024;03:17:29,"16795 Kiehn Shore, Rickieton, VA 19786-0527",14.5,14.5,14.5,2024-11-14 03:17:29.000,2024-11-14,2024,11,14,53307,[],()
80029,53818,21245,1,48 USD,"01:41:35 P.M.,08/19/24",,48.0,48.0,48.0,2024-08-19 13:41:35.000,2024-08-19,2024,8,19,53818,[],()
76602,54800,21599,1,$18¢00,2025-05-26;01:51:03 A.M.,NULL,1800.0,1800.0,1800.0,2025-05-26 01:51:03.000,2025-05-26,2025,5,26,54800,[],()
76137,55657,21240,1,18.USD,08:32:41 01/27/24,NULL,18.0,18.0,18.0,2024-01-27 08:32:41.000,2024-01-27,2024,1,27,55657,[],()
77912,53742,21608,1,$60,"10-Oct-2024,11:53:11 A.M.",NULL,60.0,60.0,60.0,2024-10-10 11:53:11.000,2024-10-10,2024,10,10,53742,[],()
76195,54324,21149,1,15.00USD, 5.10.2024 10:29:29,NULL,15.0,15.0,15.0,2024-05-10 10:29:29.000,2024-05-10,2024,5,10,54324,[],()
78759,53084,21293,2,USD57.25,"01:24:06 pm, 2025-08-11",,57.25,57.25,114.5,2025-08-11 13:24:06.000,2025-08-11,2025,8,11,53084,[],()
82986,53634,21091,1,EUR 26.75,"02:32,2025-03-16",,32.1,32.1,32.1,2025-03-16 02:32:00.000,2025-03-16,2025,3,16,53634,[],()
75817,54119,21440,1,36.75$,"21-January-2025,11:56:30",,36.75,36.75,36.75,2025-01-21 11:56:30.000,2025-01-21,2025,1,21,54119,[],()
76666,53817,21571,1,USD16,"12:40:54 pm, 10/19/24",,16.0,16.0,16.0,2024-10-19 12:40:54.000,2024-10-19,2024,10,19,53817,[],()
74772,55632,21390,2,USD 47,21:04:08;10/29/24,NULL,47.0,47.0,94.0,2024-10-29 21:04:08.000,2024-10-29,2024,10,29,55632,[],()
77628,55040,21108,1,€24¢25, 1-December-2024;06:05,"76366 Margarito Squares, Port Rollandborough, AL 53023",2910.0,2910.0,2910.0,2024-12-01 06:05:00.000,2024-12-01,2024,12,1,55040,[],()
74134,53882,21211,1,43.0 USD,2024-06-26T03:00:04.835,"91843 Simone Passage, Lashandachester, NM 85233-0871",43.0,43.0,43.0,2024-06-26 03:00:04.835,2024-06-26,2024,6,26,53882,[],()
73435,55499,21189,4,27.€,"11:03:08 P.M.,26-November-2024","138 Gordon Islands, Mendyside, KY 57682-2228",32.4,32.4,129.6,2024-11-26 23:03:08.000,2024-11-26,2024,11,26,55499,[],()
78382,54116,21517,1,EUR67.0,2025-06-10T21:18:53,"Suite 149 8408 Rath Port, West Drusilla, NM 08493-1575",80.39999999999999,80.39999999999999,80.4,2025-06-10 21:18:53.000,2025-06-10,2025,6,10,54116,[],()
77096,53305,21045,1,21.99EUR, 9.12.2024 10:25:25,,26.387999999999998,26.387999999999998,26.39,2024-09-12 10:25:25.000,2024-09-12,2024,9,12,53305,[],()
82228,55185,21162,3,53.75 USD,"02/10/25,21:18:55",,53.75,53.75,161.25,2025-02-10 21:18:55.000,2025-02-10,2025,2,10,55185,[],()
73376,54355,21219,1,56.50 €,2025-01-23T04:48:35,"Apt. 195 21113 Clyde Heights, Lake Loriahaven, MD 22076",67.8,67.8,67.8,2025-01-23 04:48:35.000,2025-01-23,2025,1,23,54355,[],()
76572,53373,21190,3,€35.5,10:31:42 P.M. 06/21/24,"3065 Ritchie Camp, Cecilview, MT 13548",42.6,42.6,127.8,2024-06-21 22:31:42.000,2024-06-21,2024,6,21,53373,[],()
77677,55056,21423,1,72.0 USD,"2025-02-28, 11:46:58 pm","2173 Stiedemann Greens, Dickiton, VT 11674-3839",72.0,72.0,72.0,2025-02-28 23:46:58.000,2025-02-28,2025,2,28,55056,[],()
78574,53688,21617,2,USD20.5,05/09/25;00:48:47,NULL,20.5,20.5,41.0,2025-05-09 00:48:47.000,2025-05-09,2025,5,9,53688,[],()
81764,54717,21301,2,58.75 €,"08/30/24,00:21","Suite 975 270 Fabian Summit, Gregoryville, IA 24086-7553",70.5,70.5,141.0,2024-08-30 00:21:00.000,2024-08-30,2024,8,30,54717,[],()
82430,54075,21409,4,USD 68.75,06/10/24 03:00:51,NULL,68.75,68.75,275.0,2024-06-10 03:00:51.000,2024-06-10,2024,6,10,54075,[],()
77782,53109,21042,1,USD 17.00, 9-Nov-2024 07:32:54 A.M.,"Apt. 756 352 Kub Locks, North Daniabury, OH 40616",17.0,17.0,17.0,2024-11-09 07:32:54.000,2024-11-09,2024,11,9,53109,[],()
76636,53270,21450,1,52.50$,"07:08:30 am, 2024-08-20",,52.5,52.5,52.5,2024-08-20 07:08:30.000,2024-08-20,2024,8,20,53270,[],()
74350,53023,21196,4,$ 43.50,Sun Feb  9 09:20:59 2025,"Suite 533 1705 Wisoky Gateway, West Zada, PA 85781",43.5,43.5,174.0,2025-02-09 09:20:59.000,2025-02-09,2025,2,9,53023,[],()
78631,53489,21654,2,€12¢50,"2024-07-07,08:34",NULL,1500.0,1500.0,3000.0,2024-07-07 08:34:00.000,2024-07-07,2024,7,7,53489,[],()
74873,54557,21442,1,67.25EUR,"20:42, 12/31/24",,80.7,80.7,80.7,2024-12-31 20:42:00.000,2024-12-31,2024,12,31,54557,[],()
80858,55575,21014,1,$ 72.99,08:59:14 PM 2024-04-06,,72.99,72.99,72.99,2024-04-06 20:59:14.000,2024-04-06,2024,4,6,55575,[],()
76320,55168,21255,2,37.5USD,04:00 25-Dec-2024,NULL,37.5,37.5,75.0,2024-12-25 04:00:00.000,2024-12-25,2024,12,25,55168,[],()
74705,53241,21078,1,70.99 $,02:08:47 A.M.;03/25/25,"Apt. 463 952 Lockman Lights, South Jayne, MI 15569",70.99,70.99,70.99,2025-03-25 02:08:47.000,2025-03-25,2025,3,25,53241,[],()
80248,53207,21023,2,14.99$,"2024-10-14, 09:40:07","Suite 242 7656 Schoen Fork, Corkerymouth, CA 75388-0245",14.99,14.99,29.98,2024-10-14 09:40:07.000,2024-10-14,2024,10,14,53207,[],()
79047,55448,21382,1,$71.75,"2024-07-10,11:09:23 P.M.",,71.75,71.75,71.75,2024-07-10 23:09:23.000,2024-07-10,2024,7,10,55448,[],()
81412,54992,21365,1,52.0 USD,2024-11-05;16:43:43,NULL,52.0,52.0,52.0,2024-11-05 16:43:43.000,2024-11-05,2024,11,5,54992,[],()
74365,55024,21183,1,50.00 $,"15-MAR-2025,09:11","Apt. 591 76097 Charise Rapid, Lake Tad, NH 94791-5789",50.0,50.0,50.0,2025-03-15 09:11:00.000,2025-03-15,2025,3,15,55024,[],()
74906,53485,21282,1,59.€,12-Sep-2024;15:19,NULL,70.8,70.8,70.8,2024-09-12 15:19:00.000,2024-09-12,2024,9,12,53485,[],()
80192,54924,21066,1,32.00€,2024-10-04 13:57:06,,38.4,38.4,38.4,2024-10-04 13:57:06.000,2024-10-04,2024,10,4,54924,[],()
76885,54049,21135,1,76.5 USD,12:39 13-AUG-2024,,76.5,76.5,76.5,2024-08-13 12:39:00.000,2024-08-13,2024,8,13,54049,[],()
79860,55350,21175,1,25.5USD,2024-08-20 19:56,NULL,25.5,25.5,25.5,2024-08-20 19:56:00.000,2024-08-20,2024,8,20,55350,[],()
78047,55276,21322,5,26€,08:37:15;07/21/24,,31.2,31.2,156.0,2024-07-21 08:37:15.000,2024-07-21,2024,7,21,55276,[],()
77388,55761,21262,1,USD36.99,06:15:11 20-Dec-2024,NULL,36.99,36.99,36.99,2024-12-20 06:15:11.000,2024-12-20,2024,12,20,55761,[],()
81530,54328,21601,1,28.5USD,"06:25:20 am, 1-February-2025",NULL,28.5,28.5,28.5,2025-02-01 06:25:20.000,2025-02-01,2025,2,1,54328,[],()
75367,54717,20964,4,USD 72.50,"06/05/25,17:05:45",NULL,72.5,72.5,290.0,2025-06-05 17:05:45.000,2025-06-05,2025,6,5,54717,[],()
74520,54176,21051,1,$ 73.25,2025-03-05;10:55,,73.25,73.25,73.25,2025-03-05 10:55:00.000,2025-03-05,2025,3,5,54176,[],()
78301,54958,21128,2,66.0 EUR,05:21:20 AM;16-Mar-2024,"681 Mitchell Road, Port Laronda, AK 62957",79.2,79.2,158.4,2024-03-16 05:21:20.000,2024-03-16,2024,3,16,54958,[],()
79626,55700,21346,1,$ 47.75,2024-07-18T15:22:43.325,NULL,47.75,47.75,47.75,2024-07-18 15:22:43.325,2024-07-18,2024,7,18,55700,[],()
80321,53516,21196,3,$ 42.00,2024-11-09T21:57:44.790,,42.0,42.0,126.0,2024-11-09 21:57:44.790,2024-11-09,2024,11,9,53516,[],()
75082,53822,21647,1,68.00 €,"06:36:29 PM,29-SEP-2024",NULL,81.6,81.6,81.6,2024-09-29 18:36:29.000,2024-09-29,2024,9,29,53822,[],()
79537,53045,21605,3,$ 26.99,"05:21:09 pm, 7-July-2024",,26.99,26.99,80.97,2024-07-07 17:21:09.000,2024-07-07,2024,7,7,53045,[],()
83145,55379,21624,2,€64.50,11:14:01 PM;26-SEP-2024,"11840 Sherman Knoll, North Edmundobury, NY 46554-0570",77.39999999999999,77.39999999999999,154.8,2024-09-26 23:14:01.000,2024-09-26,2024,9,26,55379,[],()
80722,53131,21568,1,USD 73.75,"10:44:12 pm, 2025-07-06","Suite 291 5379 Rory Orchard, Port Sebastian, KS 40530-1828",73.75,73.75,73.75,2025-07-06 22:44:12.000,2025-07-06,2025,7,6,53131,[],()
78468,53222,21063,1,52.50€,2025-01-03T17:14:45,,63.0,63.0,63.0,2025-01-03 17:14:45.000,2025-01-03,2025,1,3,53222,[],()
74471,54253,20963,1,60.5$,"07:12, 2024-09-19","Apt. 456 7787 Jarred Skyway, North Alyse, ME 47960-0740",60.5,60.5,60.5,2024-09-19 07:12:00.000,2024-09-19,2024,9,19,54253,[],()
77347,54198,20991,1,EUR 42.,2025-10-06T19:18:16.507,NULL,50.4,50.4,50.4,2025-10-06 19:18:16.507,2025-10-06,2025,10,6,54198,[],()
82145,54660,21507,1,49.99$,2024-12-23;05:52:42 am,"893 Nick Forge, Wilkinsonmouth, NY 74911",49.99,49.99,49.99,2024-12-23 05:52:42.000,2024-12-23,2024,12,23,54660,[],()
77783,55458,21197,1,USD 67.99,"2024-09-18,10:38:42",,67.99,67.99,67.99,2024-09-18 10:38:42.000,2024-09-18,2024,9,18,55458,[],()
80401,53789,21269,1,33.25$,13.11.2024 23:52:52,NULL,33.25,33.25,33.25,2024-11-13 23:52:52.000,2024-11-13,2024,11,13,53789,[],()
78092,53056,21631,1,18.5$,"2024-11-14, 19:53:53",,18.5,18.5,18.5,2024-11-14 19:53:53.000,2024-11-14,2024,11,14,53056,[],()
76571,55251,21516,4,32.00EUR,2025-02-01T20:10:10.181,"959 Kiehn Lane, West Cleotilde, CA 51390",38.4,38.4,153.6,2025-02-01 20:10:10.181,2025-02-01,2025,2,1,55251,[],()
77050,55177,21133,1,USD 66.5,01:59:14 pm 27-MAY-2024,,66.5,66.5,66.5,2024-05-27 13:59:14.000,2024-05-27,2024,5,27,55177,[],()
80323,54717,21269,1,34.0 USD,2024-09-24;21:08:18,,34.0,34.0,34.0,2024-09-24 21:08:18.000,2024-09-24,2024,9,24,54717,[],()
82425,54173,21213,1,21$99¢,17:46:11 29-MAR-2025,,2199.0,2199.0,2199.0,2025-03-29 17:46:11.000,2025-03-29,2025,3,29,54173,[],()
78000,53745,21190,1,EUR 34.25,07:39:01 AM;22-July-2024,"Suite 767 55542 Paucek Knoll, Kautzermouth, WV 23094-0989",41.1,41.1,41.1,2024-07-22 07:39:01.000,2024-07-22,2024,7,22,54690,[],()
82488,54519,21363,1,€28.0,2025-01-22T00:28:23.437,,33.6,33.6,33.6,2025-01-22 00:28:23.437,2025-01-22,2025,1,22,54519,[],()
79543,53950,21616,5,USD65.0,"16:17:44,2024-10-06",,65.0,65.0,325.0,2024-10-06 16:17:44.000,2024-10-06,2024,10,6,53950,[],()
76829,55422,21082,1,USD20.75,"01:53:40 P.M.,2024-12-24",NULL,20.75,20.75,20.75,2024-12-24 13:53:40.000,2024-12-24,2024,12,24,55422,[],()
76284,55289,21623,1,$ 44,"04/15/25, 05:20","Apt. 782 286 Zieme Mountain, Deangelohaven, NM 47413-7785",44.0,44.0,44.0,2025-04-15 05:20:00.000,2025-04-15,2025,4,15,55289,[],()
77586,53603,21204,3,$ 15.75,"08:55:03 AM, 2024-04-20","Suite 856 747 Siu Highway, Lehnerside, UT 58668",15.75,15.75,47.25,2024-04-20 08:55:03.000,2024-04-20,2024,4,20,53603,[],()
73591,55509,21320,1,34.5$,11:22;15-February-2025,NULL,34.5,34.5,34.5,2025-02-15 11:22:00.000,2025-02-15,2025,2,15,55509,[],()
74439,54526,21495,5,22.EUR,"13:36, 08/18/24",,26.4,26.4,132.0,2024-08-18 13:36:00.000,2024-08-18,2024,8,18,54526,[],()
80204,55593,21209,1,$46.99,"05/03/24,14:50",,46.99,46.99,46.99,2024-05-03 14:50:00.000,2024-05-03,2024,5,3,55593,[],()
81268,55157,21561,2,30€99¢," 6-Jun-2024,09:25",,3718.7999999999997,3718.7999999999997,7437.6,2024-06-06 09:25:00.000,2024-06-06,2024,6,6,55157,[],()
80786,53048,20988,1,63.00 USD,"2024-11-24, 01:19:50 AM",NULL,63.0,63.0,63.0,2024-11-24 01:19:50.000,2024-11-24,2024,11,24,53048,[],()
79175,53068,21242,1,57.0 USD,"11/06/24, 00:55:15","Suite 264 20676 Dale Track, West Madelene, LA 03705",57.0,57.0,57.0,2024-11-06 00:55:15.000,2024-11-06,2024,11,6,53068,[],()
81834,53251,21157,1,33.99USD,"07:47:35 PM, 2024-11-17",,33.99,33.99,33.99,2024-11-17 19:47:35.000,2024-11-17,2024,11,17,53251,[],()
78239,54723,21371,1,18.25 $,"27-May-2024,11:48",,18.25,18.25,18.25,2024-05-27 11:48:00.000,2024-05-27,2024,5,27,54723,[],()
75764,54512,20936,2,55.50 USD,"2024-09-17,14:15:49",NULL,55.5,55.5,111.0,2024-09-17 14:15:49.000,2024-09-17,2024,9,17,54512,[],()
77592,54646,21598,1,38€50¢,2024-10-25T18:18:33,NULL,4620.0,4620.0,4620.0,2024-10-25 18:18:33.000,2024-10-25,2024,10,25,54646,[],()
79919,53743,21048,1,€ 64.00,"11:20:05, 12-SEP-2024","85083 Corkery Shoal, Gutmannside, CO 90245-5210",76.8,76.8,76.8,2024-09-12 11:20:05.000,2024-09-12,2024,9,12,53743,[],()
73745,53885,21421,1,EUR52.75,2025-04-18T22:59:23.865,,63.3,63.3,63.3,2025-04-18 22:59:23.865,2025-04-18,2025,4,18,53885,[],()
82383,55167,21645,1,50 $,2025-02-12 04:30,,50.0,50.0,50.0,2025-02-12 04:30:00.000,2025-02-12,2025,2,12,55167,[],()
73432,54688,20992,1,EUR51.75,2024-06-01 17:59,"Apt. 797 7008 Gilbert Plain, Beerfurt, MT 64743-3731",62.099999999999994,62.099999999999994,62.1,2024-06-01 17:59:00.000,2024-06-01,2024,6,1,54688,[],()
78094,55653,21460,2,EUR 30.0,07:21 09/08/24,NULL,36.0,36.0,72.0,2024-09-08 07:21:00.000,2024-09-08,2024,9,8,55653,[],()
75451,54672,21107,1,62 USD,Fri Sep 27 17:13:26 2024,"120 Brekke Lakes, Arlieside, WV 11440",62.0,62.0,62.0,2024-09-27 17:13:26.000,2024-09-27,2024,9,27,54672,[],()
75505,54638,21357,1,USD42.00,"27-Apr-2024, 12:29:12 PM",NULL,42.0,42.0,42.0,2024-04-27 12:29:12.000,2024-04-27,2024,4,27,54638,[],()
78684,55374,21353,2,22.50 EUR, 5-Apr-2025 08:29:33 am,"Apt. 756 9929 Grant Ports, Port Lacy, OK 12741",27.0,27.0,54.0,2025-04-05 08:29:33.000,2025-04-05,2025,4,5,55374,[],()
78991,53530,21271,1,27.99 €,"19-JUL-2025,10:00:44 PM",NULL,33.587999999999994,33.587999999999994,33.59,2025-07-19 22:00:44.000,2025-07-19,2025,7,19,53530,[],()
74312,55080,21197,1,67.25$,"26-April-2025, 01:24",NULL,67.25,67.25,67.25,2025-04-26 01:24:00.000,2025-04-26,2025,4,26,55080,[],()
82207,54811,21592,1,USD 31.00,"06:27:57,02/06/25","Apt. 865 24041 Rogahn Junctions, Heeborough, OH 80608-0693",31.0,31.0,31.0,2025-02-06 06:27:57.000,2025-02-06,2025,2,6,54811,[],()
78111,53451,21375,1,USD 28.75,"12/25/24, 12:37:46 am",,28.75,28.75,28.75,2024-12-25 00:37:46.000,2024-12-25,2024,12,25,53451,[],()
74498,53098,21178,2,USD 47.5,02:39:08 A.M.;12/07/24,"928 Modesto Forest, East Luzland, MS 15591",47.5,47.5,95.0,2024-12-07 02:39:08.000,2024-12-07,2024,12,7,53098,[],()
76657,55354,21456,1,52.75 €,"04:16, 10/22/24",NULL,63.3,63.3,63.3,2024-10-22 04:16:00.000,2024-10-22,2024,10,22,55354,[],()
75742,55570,21088,1,57.0$,06:30 19-APR-2024,,57.0,57.0,57.0,2024-04-19 06:30:00.000,2024-04-19,2024,4,19,55570,[],()
78865,53981,21633,1,€ 71.99,2024-10-25;15:49:21,,86.38799999999999,86.38799999999999,86.39,2024-10-25 15:49:21.000,2024-10-25,2024,10,25,53981,[],()
75676,53204,21651,1,$ 51,2025-03-16;03:41:06 AM,"3646 Dare Valleys, Marionfort, VT 29307",51.0,51.0,51.0,2025-03-16 03:41:06.000,2025-03-16,2025,3,16,53204,[],()
80783,55399,21532,1,$ 38.5,03:13;19-Nov-2024,,38.5,38.5,38.5,2024-11-19 03:13:00.000,2024-11-19,2024,11,19,55399,[],()
74619,54185,21413,4,56.25€,"01:36,05/27/25",NULL,67.5,67.5,270.0,2025-05-27 01:36:00.000,2025-05-27,2025,5,27,54185,[],()
80775,54088,21126,1,USD 60.5,11/11/24;04:19:45,"957 Nicolas Hill, McLaughlinland, HI 92788",60.5,60.5,60.5,2024-11-11 04:19:45.000,2024-11-11,2024,11,11,54088,[],()
77680,55107,21363,1,29.50$,2024-10-20T12:33:07.904,"Suite 202 1933 Emard Keys, West Annita, IL 18429-2492",29.5,29.5,29.5,2024-10-20 12:33:07.904,2024-10-20,2024,10,20,55107,[],()
78766,53261,21163,1,45.25 $,2024-12-22T07:05:12.973,,45.25,45.25,45.25,2024-12-22 07:05:12.973,2024-12-22,2024,12,22,53261,[],()
75825,54741,21532,1,USD 36.00,"09/02/24,18:21",NULL,36.0,36.0,36.0,2024-09-02 18:21:00.000,2024-09-02,2024,9,2,54741,[],()
74116,55086,21001,2,$ 33.99,"01:43:22 P.M., 07/04/24",NULL,33.99,33.99,67.98,2024-07-04 13:43:22.000,2024-07-04,2024,7,4,55086,[],()
75985,55507,20957,1,60.25USD,"2024-06-11, 03:40:36 PM",NULL,60.25,60.25,60.25,2024-06-11 15:40:36.000,2024-06-11,2024,6,11,55507,[],()
74527,54246,21017,3,$ 59.99,2024-06-29T02:01:17,"8497 Bosco Mills, Reynoldsville, OH 84829",59.99,59.99,179.97,2024-06-29 02:01:17.000,2024-06-29,2024,6,29,54246,[],()
78657,54077,21382,4,74.50 €,"2024-12-14,22:32:50","Suite 369 66134 Simonis Flats, Smithamshire, HI 41707-9843",89.39999999999999,89.39999999999999,357.6,2024-12-14 22:32:50.000,2024-12-14,2024,12,14,54077,[],()
74758,54761,21258,1,19.99USD,17:31:58;05/10/25,NULL,19.99,19.99,19.99,2025-05-10 17:31:58.000,2025-05-10,2025,5,10,54761,[],()
74003,55320,21049,1,69.50 USD,00:38:29;11/05/24,,69.5,69.5,69.5,2024-11-05 00:38:29.000,2024-11-05,2024,11,5,55320,[],()
73960,55670,20922,2,62.50EUR,2025-02-05T19:35:56.532,"607 Stacey Fort, Montychester, PA 69882",75.0,75.0,150.0,2025-02-05 19:35:56.532,2025-02-05,2025,2,5,55670,[],()
79540,55424,21564,1,38.75$,Wed Jul 17 06:39:21 2024,"Apt. 845 1797 Tamisha Wells, Ortiztown, OK 16189",38.75,38.75,38.75,2024-07-17 06:39:21.000,2024-07-17,2024,7,17,55424,[],()
76250,54256,21366,1,$57¢99,29-June-2024;23:18,,5799.0,5799.0,5799.0,2024-06-29 23:18:00.000,2024-06-29,2024,6,29,54256,[],()
79959,55372,21494,1,27.0 $,2024-09-15T05:50:43.683,NULL,27.0,27.0,27.0,2024-09-15 05:50:43.683,2024-09-15,2024,9,15,55372,[],()
74367,53258,21173,1,$ 18.99,2024-10-13T01:16:13.404,,18.99,18.99,18.99,2024-10-13 01:16:13.404,2024-10-13,2024,10,13,53258,[],()
75426,54807,21395,1,€43.25,2025-01-27T09:43:25.552,,51.9,51.9,51.9,2025-01-27 09:43:25.552,2025-01-27,2025,1,27,54807,[],()
76722,55568,21353,1,20.0USD,07:42:04;11/24/24,,20.0,20.0,20.0,2024-11-24 07:42:04.000,2024-11-24,2024,11,24,55568,[],()
73605,54976,21454,1,38.25€,2024-08-13T00:38:24.433,,45.9,45.9,45.9,2024-08-13 00:38:24.433,2024-08-13,2024,8,13,54976,[],()
76870,54238,21021,1,$42.5,"30-JUL-2024, 08:28:52 AM",NULL,42.5,42.5,42.5,2024-07-30 08:28:52.000,2024-07-30,2024,7,30,54238,[],()
77515,54388,21216,1,$31.75,11/21/24 22:52:32,"61056 Wisozk Roads, Lake Andresland, VA 80835-0660",31.75,31.75,31.75,2024-11-21 22:52:32.000,2024-11-21,2024,11,21,54388,[],()
77899,55039,21348,1,28.5USD,07/14/24 01:23,NULL,28.5,28.5,28.5,2024-07-14 01:23:00.000,2024-07-14,2024,7,14,53119,[],()
77282,54764,21054,1,20.25 EUR,10/27/24 02:53,,24.3,24.3,24.3,2024-10-27 02:53:00.000,2024-10-27,2024,10,27,54764,[],()
80517,55116,21482,1,USD45.75,"03:13:18 A.M., 2025-02-05",,45.75,45.75,45.75,2025-02-05 03:13:18.000,2025-02-05,2025,2,5,55116,[],()
74960,53311,21457,3,$ 72.0,"08:28:47 am,04/08/25","8265 Schroeder Spurs, East Wandaview, OK 08759",72.0,72.0,216.0,2025-04-08 08:28:47.000,2025-04-08,2025,4,8,53311,[],()
81422,53061,21048,4,$65.0,09:32:25 am;01/04/25,,65.0,65.0,260.0,2025-01-04 09:32:25.000,2025-01-04,2025,1,4,53061,[],()
77012,55050,21626,5,64.99$,"2025-05-27, 01:02:16 A.M.",NULL,64.99,64.99,324.95,2025-05-27 01:02:16.000,2025-05-27,2025,5,27,55050,[],()
82142,54697,21206,5,€66.99," 4-MAY-2024, 04:37",,80.38799999999999,80.38799999999999,401.94,2024-05-04 04:37:00.000,2024-05-04,2024,5,4,54697,[],()
76550,54413,21582,1,56.25$, 1-DEC-2024 06:46:39 A.M.,,56.25,56.25,56.25,2024-12-01 06:46:39.000,2024-12-01,2024,12,1,54413,[],()
81779,55023,21503,1,64.5 USD,2024-10-31T20:42:25,"99136 Farrell Dale, Fadelbury, NC 41261",64.5,64.5,64.5,2024-10-31 20:42:25.000,2024-10-31,2024,10,31,55023,[],()
74388,53398,21613,1,€ 28.75,23-OCT-2024 04:44,"Apt. 509 5538 Stiedemann Rapid, Mintaview, IN 81294-2378",34.5,34.5,34.5,2024-10-23 04:44:00.000,2024-10-23,2024,10,23,53398,[],()
74347,54536,21311,1,$22.75,2024-11-15 16:51,"Apt. 253 794 Cory Extensions, South Brittniview, CO 96541-2058",22.75,22.75,22.75,2024-11-15 16:51:00.000,2024-11-15,2024,11,15,54536,[],()
82906,53799,21017,2,62.75€,"10:39,09/23/24","Suite 688 8754 Maxwell Valleys, East Jerricatown, CA 30514",75.3,75.3,150.6,2024-09-23 10:39:00.000,2024-09-23,2024,9,23,53799,[],()
77908,54350,21516,1,$32¢25,02:33:26 P.M. 06/11/25,,3225.0,3225.0,3225.0,2025-06-11 14:33:26.000,2025-06-11,2025,6,11,54350,[],()
77582,55803,21309,1,47.99 USD,"04/01/25,22:30",,47.99,47.99,47.99,2025-04-01 22:30:00.000,2025-04-01,2025,4,1,55803,[],()
81016,54228,21294,2,EUR22.99,07/12/24 03:46,,27.587999999999997,27.587999999999997,55.18,2024-07-12 03:46:00.000,2024-07-12,2024,7,12,54228,[],()
80598,54527,21331,1,65.99USD,2024-06-18;04:50:58,NULL,65.99,65.99,65.99,2024-06-18 04:50:58.000,2024-06-18,2024,6,18,54527,[],()
74300,55181,21411,2,21.0 USD,"06:26:45 AM,02/26/25","11190 Kozey Springs, Lake Summer, UT 70544",21.0,21.0,42.0,2025-02-26 06:26:45.000,2025-02-26,2025,2,26,55181,[],()
77040,53113,21322,2,26.99$,2024-12-05 02:16:31 PM,,26.99,26.99,53.98,2024-12-05 14:16:31.000,2024-12-05,2024,12,5,53113,[],()
75916,54606,20998,1,45.25 €,"11/15/24,03:50:19",,54.3,54.3,54.3,2024-11-15 03:50:19.000,2024-11-15,2024,11,15,54606,[],()
80637,53160,21569,2,USD65.5,"16:26,  3-December-2024",NULL,65.5,65.5,131.0,2024-12-03 16:26:00.000,2024-12-03,2024,12,3,53160,[],()
82217,54966,21185,1,€ 31.0,"12:14:08, 04/02/25",NULL,37.199999999999996,37.199999999999996,37.2,2025-04-02 12:14:08.000,2025-04-02,2025,4,2,54966,[],()
80316,54486,21450,1,USD53.25,01/13/25;19:35,NULL,53.25,53.25,53.25,2025-01-13 19:35:00.000,2025-01-13,2025,1,13,54486,[],()
76317,54914,21412,1,$44.99,"2024-10-18, 03:24:36 PM",,44.99,44.99,44.99,2024-10-18 15:24:36.000,2024-10-18,2024,10,18,54914,[],()
77843,54053,21102,2,49.99 $,"2024-12-21, 06:03",NULL,49.99,49.99,99.98,2024-12-21 06:03:00.000,2024-12-21,2024,12,21,54053,[],()
74080,55577,21217,1,$ 32.00,2024-09-28;09:33:23 am,NULL,32.0,32.0,32.0,2024-09-28 09:33:23.000,2024-09-28,2024,9,28,55577,[],()
74680,54188,21428,1,26.99 $,"03:57:41 AM, 04/07/25","Apt. 558 7552 Ryan Inlet, Margretfurt, CO 95701",26.99,26.99,26.99,2025-04-07 03:57:41.000,2025-04-07,2025,4,7,54188,[],()
80754,54106,21327,2,EUR72.75,"10:30:31 AM, 30-JAN-2025",,87.3,87.3,174.6,2025-01-30 10:30:31.000,2025-01-30,2025,1,30,54106,[],()
76642,54850,21162,1,$ 54.99,19:27 02/18/25,NULL,54.99,54.99,54.99,2025-02-18 19:27:00.000,2025-02-18,2025,2,18,54850,[],()
74203,54873,21413,2,55.00 $,"10:06,10-Jul-2024","31834 Violeta Way, South Hilde, MS 09245",55.0,55.0,110.0,2024-07-10 10:06:00.000,2024-07-10,2024,7,10,54873,[],()
79764,54425,21544,2,27.5 EUR,"2024-10-10, 07:26:25 am","Apt. 204 1419 Mosciski Summit, Boscoborough, KS 88713",33.0,33.0,66.0,2024-10-10 07:26:25.000,2024-10-10,2024,10,10,54425,[],()
79260,54653,20920,1,€19.99,2024-10-06T10:04:22,,23.987999999999996,23.987999999999996,23.99,2024-10-06 10:04:22.000,2024-10-06,2024,10,6,54653,[],()
78515,53177,21162,1,53.25€,2024-10-11T07:21:00,"950 Jones Village, West Maxinestad, NY 56990-7024",63.9,63.9,63.9,2024-10-11 07:21:00.000,2024-10-11,2024,10,11,53177,[],()
78069,54991,21192,1,71.50USD,"09/24/24,11:17",,71.5,71.5,71.5,2024-09-24 11:17:00.000,2024-09-24,2024,9,24,54991,[],()
73726,53766,21322,1,24.0 USD,03/18/25 06:03:01 A.M.,,24.0,24.0,24.0,2025-03-18 06:03:01.000,2025-03-18,2025,3,18,53766,[],()
81763,55547,21264,1,USD41.00,04/26/25;03:52,NULL,41.0,41.0,41.0,2025-04-26 03:52:00.000,2025-04-26,2025,4,26,55547,[],()
74704,54823,21542,1,$ 48,"10:49:23 P.M.,27-December-2024",,48.0,48.0,48.0,2024-12-27 22:49:23.000,2024-12-27,2024,12,27,54823,[],()
81461,55481,21204,1,€ 15.25,06:15:32 04/14/24,,18.3,18.3,18.3,2024-04-14 06:15:32.000,2024-04-14,2024,4,14,55481,[],()
75729,54520,21575,1,$50¢00,"07:23:36, 25-May-2024",,5000.0,5000.0,5000.0,2024-05-25 07:23:36.000,2024-05-25,2024,5,25,54520,[],()
74234,53847,21019,5,62.99 $,"03/06/25,15:23",NULL,62.99,62.99,314.95,2025-03-06 15:23:00.000,2025-03-06,2025,3,6,53847,[],()
76405,55188,21037,4,52. €,18-September-2024;08:02:01 A.M.,,62.4,62.4,249.6,2024-09-18 08:02:01.000,2024-09-18,2024,9,18,55188,[],()
76733,55296,21599,1,$ 18.00,17:27;02/23/25,"Apt. 176 945 Jenkins Islands, Mellisafort, SD 15225-6689",18.0,18.0,18.0,2025-02-23 17:27:00.000,2025-02-23,2025,2,23,53969,[],()
74739,54811,21307,1,USD68.75,2025-02-03T18:28:54.693,"Apt. 865 24041 Rogahn Junctions, Heeborough, OH 80608-0693",68.75,68.75,68.75,2025-02-03 18:28:54.693,2025-02-03,2025,2,3,54811,[],()
73730,55692,21449,1,$ 66,"08:36:24 pm, 12-September-2024",,66.0,66.0,66.0,2024-09-12 20:36:24.000,2024-09-12,2024,9,12,55829,[],()
73774,54638,21083,1,USD19.00,"2025-01-30,08:43:04 pm",NULL,19.0,19.0,19.0,2025-01-30 20:43:04.000,2025-01-30,2025,1,30,54638,[],()
78220,53656,21423,1,73.0 USD,"19:38,2025-03-11",,73.0,73.0,73.0,2025-03-11 19:38:00.000,2025-03-11,2025,3,11,55640,[],()
75631,53594,21180,1,21€,2025-04-16T21:51:07,,25.2,25.2,25.2,2025-04-16 21:51:07.000,2025-04-16,2025,4,16,53594,[],()
79249,53321,21342,1,48.99USD,04.01.2025 17:44:44,NULL,48.99,48.99,48.99,2025-04-01 17:44:44.000,2025-04-01,2025,4,1,53321,[],()
81816,55221,21224,1,57.USD,2025-01-11T19:59:22.538,"Suite 129 435 Olson Light, East Corneliuschester, SC 91325",57.0,57.0,57.0,2025-01-11 19:59:22.538,2025-01-11,2025,1,11,55221,[],()
76894,53043,20935,3,$34.0,14.01.2025 21:02:02,"Apt. 670 24058 Parker Plains, New Lavernemouth, NV 30542",34.0,34.0,102.0,2025-01-14 21:02:02.000,2025-01-14,2025,1,14,53043,[],()
74010,55826,21337,1,73.25 USD,10-Apr-2025 12:59:23 AM,"867 Bailey Mountain, North Traceyton, WY 18248",73.25,73.25,73.25,2025-04-10 00:59:23.000,2025-04-10,2025,4,10,55826,[],()
74453,55100,21294,2,EUR 22.,07:42:18 2025-01-26,,26.4,26.4,52.8,2025-01-26 07:42:18.000,2025-01-26,2025,1,26,55100,[],()
82325,54668,21027,1,EUR 32.99,"07:20:45 PM, 19-Mar-2025",,39.588,39.588,39.59,2025-03-19 19:20:45.000,2025-03-19,2025,3,19,54668,[],()
82246,54347,21449,2,65.00 USD," 7-May-2025,23:31",,65.0,65.0,130.0,2025-05-07 23:31:00.000,2025-05-07,2025,5,7,54347,[],()
76295,55828,21195,1,EUR 41.50,"20:32, 08/09/24","Apt. 431 95735 Runte Throughway, South Johnnie, ID 20187",49.8,49.8,49.8,2024-08-09 20:32:00.000,2024-08-09,2024,8,9,55828,[],()
81280,53819,21161,2,$35.50,18:33;02/28/25,NULL,35.5,35.5,71.0,2025-02-28 18:33:00.000,2025-02-28,2025,2,28,53819,[],()
77636,54659,21438,1,62.0EUR,2024-11-01T01:45:48.578,NULL,74.39999999999999,74.39999999999999,74.4,2024-11-01 01:45:48.578,2024-11-01,2024,11,1,54659,[],()
77381,53188,21174,1,12.50€,22.12.2024 15:18:18,"254 Paulene Path, Bayerfurt, CA 38951",15.0,15.0,15.0,2024-12-22 15:18:18.000,2024-12-22,2024,12,22,53188,[],()
79314,55194,21510,1,€ 16.0,2025-01-12 15:40,"8173 Otha Fork, Sauertown, ND 81578-3470",19.2,19.2,19.2,2025-01-12 15:40:00.000,2025-01-12,2025,1,12,55194,[],()
76005,54743,21565,1,61.50USD,"09/22/24, 05:02",NULL,61.5,61.5,61.5,2024-09-22 05:02:00.000,2024-09-22,2024,9,22,54743,[],()
76922,54838,21281,1,EUR70.75,"00:52:30,2025-08-02","991 Dietrich Burg, Richfort, AZ 36306",84.89999999999999,84.89999999999999,84.9,2025-08-02 00:52:30.000,2025-08-02,2025,8,2,54838,[],()
82033,53424,21141,1,USD22.50,2025-01-03T06:47:33,"Suite 831 48777 Gerlach Walk, East Markfort, AR 27295-1898",22.5,22.5,22.5,2025-01-03 06:47:33.000,2025-01-03,2025,1,3,53424,[],()
80182,55491,21124,1,USD38.50,"2024-08-23,07:31:29",NULL,38.5,38.5,38.5,2024-08-23 07:31:29.000,2024-08-23,2024,8,23,55491,[],()
74922,55564,20995,1,53.50EUR,"12/14/24,02:52",,64.2,64.2,64.2,2024-12-14 02:52:00.000,2024-12-14,2024,12,14,55564,[],()
81584,53317,21546,1,46.75 $,"2024-09-14, 21:12:27",,46.75,46.75,46.75,2024-09-14 21:12:27.000,2024-09-14,2024,9,14,53317,[],()
79346,54806,21589,1,USD 42.,2025-03-26T15:26:55,"773 Jaskolski Unions, Lake Mattie, SC 50870-4465",42.0,42.0,42.0,2025-03-26 15:26:55.000,2025-03-26,2025,3,26,54806,[],()
78298,54650,20988,1,$ 60.5,"05/14/25,11:58",,60.5,60.5,60.5,2025-05-14 11:58:00.000,2025-05-14,2025,5,14,53784,[],()
75838,53185,21607,1,71.99EUR,2024-07-05T07:04:16,"Suite 821 1680 Stokes Stream, Floraville, MD 72041-1137",86.38799999999999,86.38799999999999,86.39,2024-07-05 07:04:16.000,2024-07-05,2024,7,5,53185,[],()
81623,53391,21428,4,28.00USD,"04:35:43, 02/17/25","Apt. 510 12150 Mason Mountains, Goldnerhaven, VA 69780",28.0,28.0,112.0,2025-02-17 04:35:43.000,2025-02-17,2025,2,17,53391,[],()
82227,54214,21183,1,49.0 EUR,"03:57:10 AM,2024-12-02",,58.8,58.8,58.8,2024-12-02 03:57:10.000,2024-12-02,2024,12,2,54214,[],()
79845,53419,21417,1,18. €,2024-12-29T08:38:11,"299 Casimira Ways, New German, HI 40125",21.599999999999998,21.599999999999998,21.6,2024-12-29 08:38:11.000,2024-12-29,2024,12,29,53419,[],()
75173,53916,21606,3,$ 17.5,01:54:55 AM;10-Jun-2024,NULL,17.5,17.5,52.5,2024-06-10 01:54:55.000,2024-06-10,2024,6,10,53916,[],()
75044,54672,21084,3,€ 72.99,"28-MAY-2025, 07:51:41 P.M.","120 Brekke Lakes, Arlieside, WV 11440",87.588,87.588,262.76,2025-05-28 19:51:41.000,2025-05-28,2025,5,28,54672,[],()
75057,54929,21414,1,31.75 $,02:28:49 AM 2024-11-07,"Apt. 431 892 Ortiz Via, Port Bernadine, MI 79086-5459",31.75,31.75,31.75,2024-11-07 02:28:49.000,2024-11-07,2024,11,7,54929,[],()
82311,53254,20960,1,26.99$,"12:51, 2025-04-18","13554 Leilani Valleys, South Eleanora, NJ 74130-4964",26.99,26.99,26.99,2025-04-18 12:51:00.000,2025-04-18,2025,4,18,53254,[],()
77661,54020,21525,5,€ 45.75,"05:12,  7-APR-2025",,54.9,54.9,274.5,2025-04-07 05:12:00.000,2025-04-07,2025,4,7,54020,[],()
75143,53702,20999,1,$ 29.50,"30-APR-2024,10:22:14 A.M.","Suite 257 802 Lynn Canyon, New Lacyfort, WV 85212",29.5,29.5,29.5,2024-04-30 10:22:14.000,2024-04-30,2024,4,30,53702,[],()
79412,53858,21557,2,$64.50,03:08:40 P.M.; 5-Jan-2025,,64.5,64.5,129.0,2025-01-05 15:08:40.000,2025-01-05,2025,1,5,53858,[],()
81356,54178,21187,1,64.99 $,"18:08,06/25/24",,64.99,64.99,64.99,2024-06-25 18:08:00.000,2024-06-25,2024,6,25,54178,[],()
75466,55051,21583,1,$ 12.,"07/22/24, 19:36",NULL,12.0,12.0,12.0,2024-07-22 19:36:00.000,2024-07-22,2024,7,22,55051,[],()
74459,54558,21578,1,41.5USD,2024-05-17T02:44:20,NULL,41.5,41.5,41.5,2024-05-17 02:44:20.000,2024-05-17,2024,5,17,54558,[],()
74507,54759,21175,1,27.99 $,Fri Nov  8 16:32:24 2024,,27.99,27.99,27.99,2024-11-08 16:32:24.000,2024-11-08,2024,11,8,54759,[],()
78009,54388,20997,1,EUR 72.00, 9-OCT-2024 04:21,,86.39999999999999,86.39999999999999,86.4,2024-10-09 04:21:00.000,2024-10-09,2024,10,9,54388,[],()
82719,53349,21033,2,66.00 USD,"03:49:04 PM, 09/29/24","Apt. 947 9255 Kozey Loop, East Jenifferfurt, MA 55333",66.0,66.0,132.0,2024-09-29 15:49:04.000,2024-09-29,2024,9,29,53349,[],()
82932,54476,21365,1,EUR 55,"12:13, 03/11/25","Suite 129 48133 Lettie Shore, East Mapleview, VT 16888-9877",66.0,66.0,66.0,2025-03-11 12:13:00.000,2025-03-11,2025,3,11,54476,[],()
77481,55551,21173,3,€17.00,"2024-12-16,08:02:48","Apt. 462 3115 Harris Cape, New Blairfort, OH 81761-2522",20.4,20.4,61.2,2024-12-16 08:02:48.000,2024-12-16,2024,12,16,55551,[],()
80756,54315,21263,1,58.0$,"09:27:23 P.M.,08/05/24",NULL,58.0,58.0,58.0,2024-08-05 21:27:23.000,2024-08-05,2024,8,5,54315,[],()
77043,53550,21244,1,18.99 $,"07:51, 2024-09-23",NULL,18.99,18.99,18.99,2024-09-23 07:51:00.000,2024-09-23,2024,9,23,53550,[],()
74987,53812,21545,2,€61.5,"04/21/25,04:14:50",,73.8,73.8,147.6,2025-04-21 04:14:50.000,2025-04-21,2025,4,21,53812,[],()
76936,54292,20948,1,71.75 $,"25-JAN-2024, 09:40:10 A.M.",NULL,71.75,71.75,71.75,2024-01-25 09:40:10.000,2024-01-25,2024,1,25,54292,[],()
73404,54970,21179,1,53.99USD,05:38:48 P.M. 28-June-2024,,53.99,53.99,53.99,2024-06-28 17:38:48.000,2024-06-28,2024,6,28,54970,[],()
73808,53220,21338,1,€48¢00,05:44:43 AM;24-Sep-2024,,5760.0,5760.0,5760.0,2024-09-24 05:44:43.000,2024-09-24,2024,9,24,53220,[],()
75776,54765,21066,1,€31.25,03:01:22 AM;19-SEP-2024,NULL,37.5,37.5,37.5,2024-09-19 03:01:22.000,2024-09-19,2024,9,19,54765,[],()
81652,54781,21069,3,$ 25.0,27-MAR-2025;09:16:50 pm,,25.0,25.0,75.0,2025-03-27 21:16:50.000,2025-03-27,2025,3,27,54781,[],()
79777,55054,21497,1,$68.50, 2-May-2024;10:32:03 PM,,68.5,68.5,68.5,2024-05-02 22:32:03.000,2024-05-02,2024,5,2,55054,[],()
77832,53057,21022,2,64.$,"04/21/25, 19:23:58",,64.0,64.0,128.0,2025-04-21 19:23:58.000,2025-04-21,2025,4,21,53057,[],()
73550,54624,21125,1,16.50 EUR,04/07/24;21:13,NULL,19.8,19.8,19.8,2024-04-07 21:13:00.000,2024-04-07,2024,4,7,54624,[],()
80701,55700,21151,1,36.75 $,22:27:30 15-February-2025,,36.75,36.75,36.75,2025-02-15 22:27:30.000,2025-02-15,2025,2,15,55700,[],()
76523,54861,21061,1,47.50$,Sun Mar 23 10:21:02 2025,"Suite 568 354 Robel Branch, Windychester, WY 79665-6258",47.5,47.5,47.5,2025-03-23 10:21:02.000,2025-03-23,2025,3,23,53224,[],()
77179,54331,21001,2,USD 34.25," 2-OCT-2025,04:41",NULL,34.25,34.25,68.5,2025-10-02 04:41:00.000,2025-10-02,2025,10,2,54331,[],()
83064,54356,21306,1,35 USD,"2024-04-26,05:43:14 P.M.",NULL,35.0,35.0,35.0,2024-04-26 17:43:14.000,2024-04-26,2024,4,26,54356,[],()
80675,53415,21398,1,USD25.00,20-APR-2025 08:14:37,,25.0,25.0,25.0,2025-04-20 08:14:37.000,2025-04-20,2025,4,20,53322,[],()
81027,55574,21619,1,USD14.50,"05:05:18 AM,06/30/24",NULL,14.5,14.5,14.5,2024-06-30 05:05:18.000,2024-06-30,2024,6,30,55574,[],()
74314,54060,21617,2,USD23.75,"10/18/24, 21:12",NULL,23.75,23.75,47.5,2024-10-18 21:12:00.000,2024-10-18,2024,10,18,54060,[],()
74675,53404,21466,4,13.50€,Sat Mar 15 13:19:15 2025,,16.2,16.2,64.8,2025-03-15 13:19:15.000,2025-03-15,2025,3,15,53404,[],()
78924,53169,20933,1,18USD,20.09.2024  4:13:13,"2073 Cummings Trail, Maynardton, AK 15884-0764",18.0,18.0,18.0,2024-09-20 04:13:13.000,2024-09-20,2024,9,20,53169,[],()
78573,54570,21472,1,64.0USD,01/24/25;11:14:47,NULL,64.0,64.0,64.0,2025-01-24 11:14:47.000,2025-01-24,2025,1,24,54570,[],()
82315,53034,21518,2,56.75€,"19:26, 11/02/24",NULL,68.1,68.1,136.2,2024-11-02 19:26:00.000,2024-11-02,2024,11,2,53034,[],()
76415,53810,21320,1,35.50 $,27.08.2024 15:37:37,NULL,35.5,35.5,35.5,2024-08-27 15:37:37.000,2024-08-27,2024,8,27,53810,[],()
75491,53946,21135,3,76.25€,Sun Sep 22 14:33:41 2024,NULL,91.5,91.5,274.5,2024-09-22 14:33:41.000,2024-09-22,2024,9,22,53946,[],()
81934,55437,21201,1,67.5USD,19.09.2024  0:37:37,"56013 Schroeder Forge, Port Darrell, MD 03919-0469",67.5,67.5,67.5,2024-09-19 00:37:37.000,2024-09-19,2024,9,19,55437,[],()
83003,55034,21525,1,$50.99,2025-03-09T18:53:46,NULL,50.99,50.99,50.99,2025-03-09 18:53:46.000,2025-03-09,2025,3,9,55034,[],()
80119,54979,21058,1,$50.5,"03/03/25,18:33:29","29664 Teodoro Fort, East Odell, AK 19569-6939",50.5,50.5,50.5,2025-03-03 18:33:29.000,2025-03-03,2025,3,3,54979,[],()
77309,54121,20988,2,€63.00, 4-Oct-2024 11:50:55 P.M.,NULL,75.6,75.6,151.2,2024-10-04 23:50:55.000,2024-10-04,2024,10,4,54121,[],()
82049,53566,21139,2,53.0 $,"16:38, 07/15/24",,53.0,53.0,106.0,2024-07-15 16:38:00.000,2024-07-15,2024,7,15,53566,[],()
82842,53498,21277,4,€60¢50,04:10:42;05/21/25,"78227 Schulist Highway, New Lydiatown, IN 15731-7014",7260.0,7260.0,29040.0,2025-05-21 04:10:42.000,2025-05-21,2025,5,21,53498,[],()
78306,55540,21470,3,€67.0,"08:53:18 am, 01/15/25",,80.39999999999999,80.39999999999999,241.2,2025-01-15 08:53:18.000,2025-01-15,2025,1,15,55540,[],()
77979,55629,21196,1,43USD,"09/02/25,03:58:25 PM","2415 Cruickshank Curve, Brekkefort, AL 45291-3623",43.0,43.0,43.0,2025-09-02 15:58:25.000,2025-09-02,2025,9,2,55629,[],()
81318,54878,21109,1,56.00USD,"08:13:47 AM,2025-06-07","19867 Miller Streets, Ivoryfort, NV 31841-8043",56.0,56.0,56.0,2025-06-07 08:13:47.000,2025-06-07,2025,6,7,54878,[],()
81189,54257,21077,2,66.25USD,08:17;19-November-2024,,66.25,66.25,132.5,2024-11-19 08:17:00.000,2024-11-19,2024,11,19,54257,[],()
79679,53298,21149,2,16.00 USD,11:22:05 P.M. 13-January-2025,NULL,16.0,16.0,32.0,2025-01-13 23:22:05.000,2025-01-13,2025,1,13,53298,[],()
75174,55188,21435,1,$54¢00,25-Jul-2024;10:09:00 PM,,5400.0,5400.0,5400.0,2024-07-25 22:09:00.000,2024-07-25,2024,7,25,55188,[],()
74770,53336,21476,1,EUR 72.5,"23:49,27-Jan-2025","Suite 711 8351 Lowe Run, Mathewstad, TN 84445",87.0,87.0,87.0,2025-01-27 23:49:00.000,2025-01-27,2025,1,27,53336,[],()
75571,54731,21609,1,$ 20.50,"2024-04-16,07:47",NULL,20.5,20.5,20.5,2024-04-16 07:47:00.000,2024-04-16,2024,4,16,54731,[],()
78902,53680,21355,2,51.5 USD, 5.03.2024  0:11:11,,51.5,51.5,103.0,2024-05-03 00:11:11.000,2024-05-03,2024,5,3,53680,[],()
74731,55441,21332,2,45.0 $,10:35:24 AM 2025-03-12,"185 Alden Lock, Lake Broderickhaven, MD 75939",45.0,45.0,90.0,2025-03-12 10:35:24.000,2025-03-12,2025,3,12,55441,[],()
76223,54956,21638,3,$ 59.99,05:56:57;23-December-2024,,59.99,59.99,179.97,2024-12-23 05:56:57.000,2024-12-23,2024,12,23,54956,[],()
78590,53023,21234,2,€ 33.75,"16:48:13,15-SEP-2024",,40.5,40.5,81.0,2024-09-15 16:48:13.000,2024-09-15,2024,9,15,53023,[],()
77249,54561,21440,1,35.75 $,14:53 2024-12-27,,35.75,35.75,35.75,2024-12-27 14:53:00.000,2024-12-27,2024,12,27,54561,[],()
77414,55794,21368,1,€ 22.75,"08:01:24 am, 05/28/25","516 Reichert Dam, West Elane, ME 99006-2407",27.3,27.3,27.3,2025-05-28 08:01:24.000,2025-05-28,2025,5,28,55794,[],()
77918,53643,20956,2,63.99 USD,07:27:25 A.M.;01/29/25,"2115 Kelley Parks, South Altha, NV 69047",63.99,63.99,127.98,2025-01-29 07:27:25.000,2025-01-29,2025,1,29,53643,[],()
76846,53366,21568,1,$69.5,"2025-07-05, 08:27:15 AM",NULL,69.5,69.5,69.5,2025-07-05 08:27:15.000,2025-07-05,2025,7,5,53366,[],()
73824,54833,20921,4,15€50¢,2024-12-24T00:51:32,,1860.0,1860.0,7440.0,2024-12-24 00:51:32.000,2024-12-24,2024,12,24,54833,[],()
77380,54848,21621,1,$ 45.0,"02:58:51, 03/14/25",,45.0,45.0,45.0,2025-03-14 02:58:51.000,2025-03-14,2025,3,14,54848,[],()
74849,55023,21324,1,EUR45.00,"23-JAN-2025, 07:02:33",NULL,54.0,54.0,54.0,2025-01-23 07:02:33.000,2025-01-23,2025,1,23,55023,[],()
80638,53335,21419,1,$68.99,"18:55:55,03/29/25",NULL,68.99,68.99,68.99,2025-03-29 18:55:55.000,2025-03-29,2025,3,29,53335,[],()
78607,54465,21132,1,USD23.5,"2024-12-17, 02:23:20 AM",,23.5,23.5,23.5,2024-12-17 02:23:20.000,2024-12-17,2024,12,17,54465,[],()
78102,54542,21206,1,64.50€,05:33:19 19-JAN-2025,,77.39999999999999,77.39999999999999,77.4,2025-01-19 05:33:19.000,2025-01-19,2025,1,19,54542,[],()
79770,55105,21272,1,$65.75,"08:04, 07/04/24",,65.75,65.75,65.75,2024-07-04 08:04:00.000,2024-07-04,2024,7,4,55105,[],()
77597,55614,21092,5,30.00 USD,30-Oct-2024;16:29:27,,30.0,30.0,150.0,2024-10-30 16:29:27.000,2024-10-30,2024,10,30,55614,[],()
82273,55627,21051,1,73.5USD,2025-01-19;08:24:34 P.M.,,73.5,73.5,73.5,2025-01-19 20:24:34.000,2025-01-19,2025,1,19,55627,[],()
77559,53508,21526,4,$25¢99,"11-APR-2025,18:36","Apt. 555 70806 Gibson Fork, Gleichnerville, ND 45856-8737",2599.0,2599.0,10396.0,2025-04-11 18:36:00.000,2025-04-11,2025,4,11,53508,[],()
74627,53393,21330,2,€44.99,2024-12-01T10:15:09.953,,53.988,53.988,107.98,2024-12-01 10:15:09.953,2024-12-01,2024,12,1,53393,[],()
76412,53660,21147,3,EUR 27.75,"10:07:53 A.M., 16-NOV-2024",,33.3,33.3,99.9,2024-11-16 10:07:53.000,2024-11-16,2024,11,16,53660,[],()
80072,53970,21425,1,USD 42.99,06:37:45;2025-02-18,,42.99,42.99,42.99,2025-02-18 06:37:45.000,2025-02-18,2025,2,18,53970,[],()
74247,55155,21205,3,$ 29.50,"28-Jul-2024,07:42:26","Suite 270 942 Padberg Neck, Lindgrenville, WV 80161",29.5,29.5,88.5,2024-07-28 07:42:26.000,2024-07-28,2024,7,28,55155,[],()
74579,53195,21573,1,27.00$,04/30/25;18:46:48,"926 Volkman Center, Lake Luveniaview, FL 35701",27.0,27.0,27.0,2025-04-30 18:46:48.000,2025-04-30,2025,4,30,53195,[],()
76926,53621,21323,1,28.00€,"00:38:17, 11/15/24",NULL,33.6,33.6,33.6,2024-11-15 00:38:17.000,2024-11-15,2024,11,15,53621,[],()
81353,53317,21079,1,USD 58.00,2024-11-27T02:11:14.325,"487 Alberto Route, Kosshaven, NH 81926-6204",58.0,58.0,58.0,2024-11-27 02:11:14.325,2024-11-27,2024,11,27,53317,[],()
73883,55650,21448,1,15.25$,2025-05-14;03:16:13 PM,,15.25,15.25,15.25,2025-05-14 15:16:13.000,2025-05-14,2025,5,14,55650,[],()
77900,54474,21230,1,26.5$,08/09/24;17:13,,26.5,26.5,26.5,2024-08-09 17:13:00.000,2024-08-09,2024,8,9,54474,[],()
79389,55234,21055,2,49.50 USD,21:30:37 03/27/25,,49.5,49.5,99.0,2025-03-27 21:30:37.000,2025-03-27,2025,3,27,55234,[],()
75182,54820,20943,2,USD 69.,"2024-05-22, 00:01:36","Suite 925 408 Hoeger Plains, New Jacklyn, MO 71356",69.0,69.0,138.0,2024-05-22 00:01:36.000,2024-05-22,2024,5,22,54820,[],()
82726,53264,21197,1,69.00 $,"11:31, 2025-04-06","Apt. 877 900 McClure Mission, South Buenachester, NE 46667-9317",69.0,69.0,69.0,2025-04-06 11:31:00.000,2025-04-06,2025,4,6,53264,[],()
81898,53580,21583,1,16.5 USD,"09:41,2024-09-22","5091 Dibbert Ridge, Dennisview, FL 20637-8528",16.5,16.5,16.5,2024-09-22 09:41:00.000,2024-09-22,2024,9,22,53580,[],()
74720,55807,21129,2,39.00USD,07.11.2024 22:04:04,,39.0,39.0,78.0,2024-07-11 22:04:04.000,2024-07-11,2024,7,11,55807,[],()
73427,54392,20961,1,$35¢25,04:35;02/03/25,,3525.0,3525.0,3525.0,2025-02-03 04:35:00.000,2025-02-03,2025,2,3,54392,[],()
80130,54061,20995,1,52 USD,05:27:21 P.M.;2025-03-07,,52.0,52.0,52.0,2025-03-07 17:27:21.000,2025-03-07,2025,3,7,54061,[],()
81308,54193,21458,1,$44.75,"2024-09-26,06:04:11 AM","35253 Robt Mission, New Mindy, NV 32751",44.75,44.75,44.75,2024-09-26 06:04:11.000,2024-09-26,2024,9,26,54193,[],()
77539,53655,21530,1,USD69.75,"10-Mar-2025, 19:49:53",,69.75,69.75,69.75,2025-03-10 19:49:53.000,2025-03-10,2025,3,10,53655,[],()
73559,54832,21627,1,25.USD,"17:03, 2024-08-07",NULL,25.0,25.0,25.0,2024-08-07 17:03:00.000,2024-08-07,2024,8,7,54832,[],()
74418,53660,21587,1,EUR16.25,"01:09:31 A.M.,16-Jan-2025",,19.5,19.5,19.5,2025-01-16 01:09:31.000,2025-01-16,2025,1,16,53660,[],()
75596,54326,21483,1,€ 66.,2024-10-30 11:41,NULL,79.2,79.2,79.2,2024-10-30 11:41:00.000,2024-10-30,2024,10,30,54326,[],()
82579,55533,21586,3,EUR21.25,2025-01-02T16:10:43.033,NULL,25.5,25.5,76.5,2025-01-02 16:10:43.033,2025-01-02,2025,1,2,55533,[],()
74084,54880,21583,2,15.5EUR,18:38;17-August-2024,NULL,18.599999999999998,18.599999999999998,37.2,2024-08-17 18:38:00.000,2024-08-17,2024,8,17,54880,[],()
73804,54311,21177,1,20.5 $,"06:38:55, 2024-10-20",,20.5,20.5,20.5,2024-10-20 06:38:55.000,2024-10-20,2024,10,20,54311,[],()
79297,53310,21417,1,13.99$,"09/01/24,22:36:26","526 Deshawn Point, Erdmanmouth, ME 43691",13.99,13.99,13.99,2024-09-01 22:36:26.000,2024-09-01,2024,9,1,53310,[],()
79762,53121,21534,1,23.00$,"10/05/24,20:31","344 Walter Mission, Karlynborough, AR 51837",23.0,23.0,23.0,2024-10-05 20:31:00.000,2024-10-05,2024,10,5,53121,[],()
78841,53185,21495,2,24.5 USD,04:12:49 A.M.; 8-Nov-2024,,24.5,24.5,49.0,2024-11-08 04:12:49.000,2024-11-08,2024,11,8,53185,[],()
74252,53919,21440,1,$ 32.75,"17:47,2024-05-05",NULL,32.75,32.75,32.75,2024-05-05 17:47:00.000,2024-05-05,2024,5,5,53919,[],()
81407,53538,21212,1,35.75 €,18:07 24-Dec-2024,,42.9,42.9,42.9,2024-12-24 18:07:00.000,2024-12-24,2024,12,24,53538,[],()
79246,55768,21108,2,USD26.00,"14:16:56, 2025-02-04",,26.0,26.0,52.0,2025-02-04 14:16:56.000,2025-02-04,2025,2,4,55768,[],()
80302,53464,21102,2,EUR53.25,"10-January-2025, 09:13:36 am",,63.9,63.9,127.8,2025-01-10 09:13:36.000,2025-01-10,2025,1,10,53464,[],()
77766,53830,20928,2,€20¢75,2024-07-23 10:13:01 P.M.,NULL,2490.0,2490.0,4980.0,2024-07-23 22:13:01.000,2024-07-23,2024,7,23,53830,[],()
78676,53409,21517,1,EUR 65.75,"13:52:12,08/17/24",NULL,78.89999999999999,78.89999999999999,78.9,2024-08-17 13:52:12.000,2024-08-17,2024,8,17,53409,[],()
78659,54325,21632,1,USD 21.25,08/26/24;15:31:21,"6338 Ward Mission, Hagenesstad, MA 95189-6627",21.25,21.25,21.25,2024-08-26 15:31:21.000,2024-08-26,2024,8,26,54325,[],()
75563,53785,21100,1,24.0 $,"07:01:08 AM, 20-June-2024","2389 Daniela Drives, Jeaneside, TX 67187-0343",24.0,24.0,24.0,2024-06-20 07:01:08.000,2024-06-20,2024,6,20,53785,[],()
74855,54948,21292,4,$ 40.25,"08:04,23-Sep-2024",,40.25,40.25,161.0,2024-09-23 08:04:00.000,2024-09-23,2024,9,23,54948,[],()
79925,55722,21336,1,64.50€,16:22:46;07/09/24,,77.39999999999999,77.39999999999999,77.4,2024-07-09 16:22:46.000,2024-07-09,2024,7,9,55722,[],()
76817,55103,21375,1,USD29.0,03:55:41 pm 10/26/24,"2366 Hills Branch, North Barrieberg, VT 66095-9712",29.0,29.0,29.0,2024-10-26 15:55:41.000,2024-10-26,2024,10,26,55103,[],()
79836,54307,21349,1,$59.75,"03:58:15,01/23/25","16402 Ingrid Forge, East Elizbeth, SC 75429",59.75,59.75,59.75,2025-01-23 03:58:15.000,2025-01-23,2025,1,23,54307,[],()
81435,54860,21349,1,59$,2025-09-25T18:29:21.957,,59.0,59.0,59.0,2025-09-25 18:29:21.957,2025-09-25,2025,9,25,54860,[],()
79280,55559,21175,4,$ 22.50,07:32:13 P.M. 09/30/24,"Suite 266 690 Alverta Club, Lake Weston, OR 92970",22.5,22.5,90.0,2024-09-30 19:32:13.000,2024-09-30,2024,9,30,55559,[],()
74483,53946,21081,1,69.50 USD,2025-07-09T13:49:14.772,"Apt. 829 14333 Stacy Field, New Johniebury, WV 50677-5178",69.5,69.5,69.5,2025-07-09 13:49:14.772,2025-07-09,2025,7,9,53946,[],()
82715,55080,21435,1,EUR 57.75,04:42:15 am 07/06/24,"5194 Pfeffer Station, Port Natoshamouth, AZ 19271",69.3,69.3,69.3,2024-07-06 04:42:15.000,2024-07-06,2024,7,6,55080,[],()
78097,55528,21091,1,$26.99,"03:06:51 am, 02/02/25",NULL,26.99,26.99,26.99,2025-02-02 03:06:51.000,2025-02-02,2025,2,2,55528,[],()
77538,55165,21514,1,38.00 USD,2025-01-18T18:43:30.217,NULL,38.0,38.0,38.0,2025-01-18 18:43:30.217,2025-01-18,2025,1,18,55165,[],()
79585,53106,21481,1,18.00USD,"10/04/25,15:17:26",,18.0,18.0,18.0,2025-10-04 15:17:26.000,2025-10-04,2025,10,4,53106,[],()
75970,54443,21596,2,$53.50,"2024-08-08,03:41:02 PM","Apt. 910 662 Rice Coves, Breannmouth, KS 21201",53.5,53.5,107.0,2024-08-08 15:41:02.000,2024-08-08,2024,8,8,54443,[],()
76977,53204,21059,1,48USD,"09:31:15,27-Mar-2025",NULL,48.0,48.0,48.0,2025-03-27 09:31:15.000,2025-03-27,2025,3,27,53204,[],()
81431,53307,21183,1,52.75€,12:36:15 pm;01/07/25,,63.3,63.3,63.3,2025-01-07 12:36:15.000,2025-01-07,2025,1,7,53307,[],()
74211,54204,21283,1,39.0$,18:26;2025-01-12,NULL,39.0,39.0,39.0,2025-01-12 18:26:00.000,2025-01-12,2025,1,12,54204,[],()
79392,55320,21494,1,23.50 EUR,27-July-2024;00:40,"Suite 126 584 Dominic Village, McClureport, IA 22450-5496",28.2,28.2,28.2,2024-07-27 00:40:00.000,2024-07-27,2024,7,27,55320,[],()
75548,55211,21361,4,$47¢25,2024-08-24T13:34:53.907,"Apt. 806 4213 Schinner Lake, South Rosalina, MI 46936-2743",4725.0,4725.0,18900.0,2024-08-24 13:34:53.907,2024-08-24,2024,8,24,55211,[],()
80268,54357,21444,2,60.0 EUR,2024-07-02T21:55:33,NULL,72.0,72.0,144.0,2024-07-02 21:55:33.000,2024-07-02,2024,7,2,54220,[],()
80064,54107,21424,1,33.25 USD,01:32 04/04/25,"Apt. 240 280 Borer Mountains, South Gertrudeview, CT 40713",33.25,33.25,33.25,2025-04-04 01:32:00.000,2025-04-04,2025,4,4,54107,[],()
81022,55805,21596,2,52.00$,"00:48,17-Mar-2025",,52.0,52.0,104.0,2025-03-17 00:48:00.000,2025-03-17,2025,3,17,55805,[],()
81672,55596,21543,1,30.99$,10:57:23 am;2024-11-11,NULL,30.99,30.99,30.99,2024-11-11 10:57:23.000,2024-11-11,2024,11,11,55596,[],()
82119,54610,21526,1,$ 20.00,"2025-04-13,02:55",,20.0,20.0,20.0,2025-04-13 02:55:00.000,2025-04-13,2025,4,13,54610,[],()
75583,54191,20918,3,17.75€,07:01 24-AUG-2024,,21.3,21.3,63.9,2024-08-24 07:01:00.000,2024-08-24,2024,8,24,54191,[],()
81057,53748,21329,1,40 €,09/11/24 02:54:32 pm,"Apt. 788 4277 Kris Island, North Jeanettemouth, NJ 16962",48.0,48.0,48.0,2024-09-11 14:54:32.000,2024-09-11,2024,9,11,53748,[],()
73402,55478,21253,1,68. $,04:28:33 PM;2024-11-07,"4772 Reinger Street, Raymundobury, VT 41821-1820",68.0,68.0,68.0,2024-11-07 16:28:33.000,2024-11-07,2024,11,7,55478,[],()
77177,54675,21258,2,EUR23.0,03:20:02;2024-12-13,,27.599999999999998,27.599999999999998,55.2,2024-12-13 03:20:02.000,2024-12-13,2024,12,13,54675,[],()
79593,55618,21113,2,USD51.99,"19:59:00, 2025-05-05","Suite 192 51985 Prosacco Mount, Kaitlinton, WY 29246-0730",51.99,51.99,103.98,2025-05-05 19:59:00.000,2025-05-05,2025,5,5,55618,[],()
74283,55752,21324,1,$47.,2024-08-27;06:41:18,NULL,47.0,47.0,47.0,2024-08-27 06:41:18.000,2024-08-27,2024,8,27,55752,[],()
76984,54413,21399,1,68.25 EUR,2025-01-09T13:26:15.789,,81.89999999999999,81.89999999999999,81.9,2025-01-09 13:26:15.789,2025-01-09,2025,1,9,54413,[],()
81869,53348,21093,1,66.0USD,2024-09-29T12:34:49.989,,66.0,66.0,66.0,2024-09-29 12:34:49.989,2024-09-29,2024,9,29,53348,[],()
82272,53449,21112,1,32.75EUR,06:33:43 am 22-Oct-2024,NULL,39.3,39.3,39.3,2024-10-22 06:33:43.000,2024-10-22,2024,10,22,53449,[],()
78836,55305,20922,2,64.50 $,09/14/24;01:15:30 am,,64.5,64.5,129.0,2024-09-14 01:15:30.000,2024-09-14,2024,9,14,55305,[],()
80363,53205,21139,1,USD 51.50,2025-01-14 05:55:22,,51.5,51.5,51.5,2025-01-14 05:55:22.000,2025-01-14,2025,1,14,53205,[],()
74495,53864,21244,1,15.00USD,"18:32,11-MAY-2024",,15.0,15.0,15.0,2024-05-11 18:32:00.000,2024-05-11,2024,5,11,53864,[],()
77427,53916,21311,1,USD19.5,"11:09:21 PM, 02/13/25",,19.5,19.5,19.5,2025-02-13 23:09:21.000,2025-02-13,2025,2,13,53916,[],()
79949,53583,21033,1,67.25 €,"03:52:55 pm,11-Jul-2024","3740 Lemke Creek, Konopelskihaven, ME 71939-4348",80.7,80.7,80.7,2024-07-11 15:52:55.000,2024-07-11,2024,7,11,53583,[],()
82804,55569,21009,1,65.75$,"09:14:54 am,2024-12-24",,65.75,65.75,65.75,2024-12-24 09:14:54.000,2024-12-24,2024,12,24,55569,[],()
82129,53648,20958,2,EUR 30.0,"2025-07-07, 03:06:02","Apt. 441 4423 Ondricka Run, East Curtismouth, CO 96842",36.0,36.0,72.0,2025-07-07 03:06:02.000,2025-07-07,2025,7,7,53648,[],()
77849,53658,21016,3,USD 76.0,14:05;22-AUG-2024,"Apt. 446 240 Jennine River, New Sangberg, OH 08147-0248",76.0,76.0,228.0,2024-08-22 14:05:00.000,2024-08-22,2024,8,22,53658,[],()
78828,53243,21630,1,54.5 $,2024-08-28;22:18,"2397 Marvis Valley, Marishamouth, ND 60616",54.5,54.5,54.5,2024-08-28 22:18:00.000,2024-08-28,2024,8,28,53243,[],()
78707,54723,20956,2,$60.25,02:38:20;07/07/24,NULL,60.25,60.25,120.5,2024-07-07 02:38:20.000,2024-07-07,2024,7,7,54723,[],()
80396,54234,21272,1,62.5 €,"09/09/24,19:20",,75.0,75.0,75.0,2024-09-09 19:20:00.000,2024-09-09,2024,9,9,54234,[],()
74218,55524,21655,1,29 USD,11:09:48 07/09/24,"299 Ebert Motorway, North Wilmerville, SD 01390",29.0,29.0,29.0,2024-07-09 11:09:48.000,2024-07-09,2024,7,9,55524,[],()
82346,54638,21596,1,$51.0,"12:31,27-Aug-2024",NULL,51.0,51.0,51.0,2024-08-27 12:31:00.000,2024-08-27,2024,8,27,54638,[],()
74513,53848,21518,1,€51.0,"10/14/24,19:03",,61.199999999999996,61.199999999999996,61.2,2024-10-14 19:03:00.000,2024-10-14,2024,10,14,53848,[],()
80679,53757,21648,1,€27.25,"06/29/24,15:44","Apt. 353 8237 Goldner Harbor, Raulland, IA 19842",32.699999999999996,32.699999999999996,32.7,2024-06-29 15:44:00.000,2024-06-29,2024,6,29,53757,[],()
75607,55293,21116,1,38.25 USD,"01:31,  6-Jul-2024",NULL,38.25,38.25,38.25,2024-07-06 01:31:00.000,2024-07-06,2024,7,6,55293,[],()
81464,55555,21341,2,53.99 USD,"15-December-2024,19:54:11","39903 Dimple Hollow, Littelmouth, NE 68902-4204",53.99,53.99,107.98,2024-12-15 19:54:11.000,2024-12-15,2024,12,15,55555,[],()
79551,54521,21313,1,€35.25,"2024-11-20,01:19:34",NULL,42.3,42.3,42.3,2024-11-20 01:19:34.000,2024-11-20,2024,11,20,54521,[],()
79108,53995,20943,1,EUR 72.5,05:47;2024-10-31,,87.0,87.0,87.0,2024-10-31 05:47:00.000,2024-10-31,2024,10,31,53995,[],()
79838,55813,21045,1,USD22.75,"10/18/24, 11:55:38 PM","Suite 279 31701 Mae Loop, New Travisfurt, TN 97824",22.75,22.75,22.75,2024-10-18 23:55:38.000,2024-10-18,2024,10,18,55813,[],()
73392,54174,21652,5,€49¢50,"21:54, 08/11/24",,5940.0,5940.0,29700.0,2024-08-11 21:54:00.000,2024-08-11,2024,8,11,54174,[],()
75040,53947,21143,5,40.50 EUR,"10/30/24,03:07",,48.6,48.6,243.0,2024-10-30 03:07:00.000,2024-10-30,2024,10,30,53947,[],()
78905,54904,20976,1,€54.75,03/11/25;06:42:37,"Suite 593 240 Stark Loaf, Schuppeview, CT 74254",65.7,65.7,65.7,2025-03-11 06:42:37.000,2025-03-11,2025,3,11,53755,[],()
77613,53810,21488,1,EUR28.25,"07:59:16, 01/10/25",,33.9,33.9,33.9,2025-01-10 07:59:16.000,2025-01-10,2025,1,10,53810,[],()
74480,53284,21648,1,EUR32.50,2024-12-05 15:01,,39.0,39.0,39.0,2024-12-05 15:01:00.000,2024-12-05,2024,12,5,54285,[],()
73902,54773,21025,1,USD 55.99,10/31/24;22:30,"2397 Shante Lock, Rutherfordtown, MT 20374",55.99,55.99,55.99,2024-10-31 22:30:00.000,2024-10-31,2024,10,31,54773,[],()
83059,55299,21020,1,59.5 USD,12:33:23;2025-01-24,,59.5,59.5,59.5,2025-01-24 12:33:23.000,2025-01-24,2025,1,24,55299,[],()
77446,53960,21067,1,USD 57.00,"2025-05-21,00:13:23","48220 Rippin Manor, Lake Jackieburgh, NV 82582-3175",57.0,57.0,57.0,2025-05-21 00:13:23.000,2025-05-21,2025,5,21,53960,[],()
80444,54215,21576,1,$47.99,31.08.2024 19:48:48,NULL,47.99,47.99,47.99,2024-08-31 19:48:48.000,2024-08-31,2024,8,31,54215,[],()
75041,55157,21550,1,€38¢25, 4.04.2024 16:44:44,,4590.0,4590.0,4590.0,2024-04-04 16:44:44.000,2024-04-04,2024,4,4,55157,[],()
80628,54319,21083,1,20.5 EUR,09/20/24;00:07:55,,24.599999999999998,24.599999999999998,24.6,2024-09-20 00:07:55.000,2024-09-20,2024,9,20,54319,[],()
82987,54370,21297,1,$ 69.75," 2-APR-2025, 05:20:12",,69.75,69.75,69.75,2025-04-02 05:20:12.000,2025-04-02,2025,4,2,54370,[],()
80228,55660,21240,1,13.75 USD,"11:14:53,  1-MAR-2025","1396 O'Kon Junction, Darrylbury, NM 21343-4485",13.75,13.75,13.75,2025-03-01 11:14:53.000,2025-03-01,2025,3,1,55660,[],()
76296,55469,21642,5,$54.75,"00:24,12/30/24","544 Price Motorway, North Nanshire, KS 33595",54.75,54.75,273.75,2024-12-30 00:24:00.000,2024-12-30,2024,12,30,55469,[],()
75874,54160,21192,1,72.5 EUR,02:05:16 P.M. 10-Jul-2024,,87.0,87.0,87.0,2024-07-10 14:05:16.000,2024-07-10,2024,7,10,54160,[],()
76669,55808,20950,1,€ 30.0,"15-Dec-2024,03:56",,36.0,36.0,36.0,2024-12-15 03:56:00.000,2024-12-15,2024,12,15,55808,[],()
80049,55303,21151,1,38 USD,"2025-08-24, 12:13:21 PM",NULL,38.0,38.0,38.0,2025-08-24 12:13:21.000,2025-08-24,2025,8,24,55303,[],()
77009,53477,21226,1,58.50$,"2025-03-26,11:10:47",NULL,58.5,58.5,58.5,2025-03-26 11:10:47.000,2025-03-26,2025,3,26,53477,[],()
74106,54830,21085,1,28.00 USD,"2024-04-27, 08:58:50 PM",,28.0,28.0,28.0,2024-04-27 20:58:50.000,2024-04-27,2024,4,27,54830,[],()
74903,54529,21463,1,75.99 €,"07:13:18, 2024-09-22","Suite 441 8556 Jayme Canyon, Colettachester, LA 21299",91.18799999999999,91.18799999999999,91.19,2024-09-22 07:13:18.000,2024-09-22,2024,9,22,54529,[],()
77293,53179,21634,1,24.5USD, 1.09.2024  1:46:46,,24.5,24.5,24.5,2024-01-09 01:46:46.000,2024-01-09,2024,1,9,53179,[],()
75331,54217,21564,1,USD 38.50,11:00:39 pm 19-Apr-2025,NULL,38.5,38.5,38.5,2025-04-19 23:00:39.000,2025-04-19,2025,4,19,54217,[],()
76327,55490,21219,1,56.0$,"11:38:17 P.M.,08/07/24","Apt. 143 80499 Graham Islands, Schillerland, ND 13668",56.0,56.0,56.0,2024-08-07 23:38:17.000,2024-08-07,2024,8,7,55490,[],()
80243,54281,21358,1,$41¢50,"2024-06-28,09:06:35 PM","4461 Muller Brook, Greenholtview, VT 10980",4150.0,4150.0,4150.0,2024-06-28 21:06:35.000,2024-06-28,2024,6,28,54281,[],()
77793,55185,21329,2,41€25¢,11:57:20 A.M. 16-August-2024,,4950.0,4950.0,9900.0,2024-08-16 11:57:20.000,2024-08-16,2024,8,16,55185,[],()
82388,53651,20985,1,$ 30.0,2024-10-12T13:13:04,"Apt. 396 2199 Kuhn Turnpike, Linnville, AL 42155",30.0,30.0,30.0,2024-10-12 13:13:04.000,2024-10-12,2024,10,12,53651,[],()
82552,53295,21585,2,42.50$,07:43:03 10/22/24,,42.5,42.5,85.0,2024-10-22 07:43:03.000,2024-10-22,2024,10,22,53295,[],()
82852,54563,21362,1,47.25 $,2024-07-03T12:19:14,"45223 Feil Loaf, Tannerberg, OR 17495-1293",47.25,47.25,47.25,2024-07-03 12:19:14.000,2024-07-03,2024,7,3,54563,[],()
82840,54126,21036,1,USD65.5,2024-06-16T02:39:21.243,,65.5,65.5,65.5,2024-06-16 02:39:21.243,2024-06-16,2024,6,16,54126,[],()
80982,54602,21169,1,62.00 €,"15-November-2024,15:18",NULL,74.39999999999999,74.39999999999999,74.4,2024-11-15 15:18:00.000,2024-11-15,2024,11,15,54602,[],()
80117,53840,21337,1,73.5$,07:39 10/24/24,,73.5,73.5,73.5,2024-10-24 07:39:00.000,2024-10-24,2024,10,24,53840,[],()
76140,54203,21030,2,22.00 EUR,"03:58:33 am,05/16/25",,26.4,26.4,52.8,2025-05-16 03:58:33.000,2025-05-16,2025,5,16,54203,[],()
82534,53959,21604,1,USD 49,06:27:16 am 2025-05-15,,49.0,49.0,49.0,2025-05-15 06:27:16.000,2025-05-15,2025,5,15,53959,[],()
82451,54506,21629,1,€ 54.5,01/03/25 06:48:27 pm,NULL,65.39999999999999,65.39999999999999,65.4,2025-01-03 18:48:27.000,2025-01-03,2025,1,3,54506,[],()
75706,54458,21234,1,USD29.75,2024-10-19T23:55:46,,29.75,29.75,29.75,2024-10-19 23:55:46.000,2024-10-19,2024,10,19,54458,[],()
76735,55489,21007,1,$ 34.99,"2024-07-28, 06:52:18 P.M.",,34.99,34.99,34.99,2024-07-28 18:52:18.000,2024-07-28,2024,7,28,55489,[],()
77723,55253,21374,1,25.00 €,2024-11-08T07:50:28,NULL,30.0,30.0,30.0,2024-11-08 07:50:28.000,2024-11-08,2024,11,8,55253,[],()
76077,53890,21653,4,€42.00,12/08/24 19:14:19,,50.4,50.4,201.6,2024-12-08 19:14:19.000,2024-12-08,2024,12,8,53890,[],()
75791,53556,21653,1,39.50€,12-Apr-2024;11:46,NULL,47.4,47.4,47.4,2024-04-12 11:46:00.000,2024-04-12,2024,4,12,53556,[],()
81817,53691,21138,2,36.50 USD,"12:54:26, 03/29/24",,36.5,36.5,73.0,2024-03-29 12:54:26.000,2024-03-29,2024,3,29,54823,[],()
74691,54132,20963,2,62€75¢,2024-07-19T18:33:47,,7530.0,7530.0,15060.0,2024-07-19 18:33:47.000,2024-07-19,2024,7,19,54132,[],()
81113,55056,21524,1,63USD,2024-09-18;06:59:36 am,,63.0,63.0,63.0,2024-09-18 06:59:36.000,2024-09-18,2024,9,18,55056,[],()
82639,54624,21221,1,$73.75,09:10:28 am 2024-09-07,,73.75,73.75,73.75,2024-09-07 09:10:28.000,2024-09-07,2024,9,7,54624,[],()
75138,54381,21126,1,63.75$, 6-May-2025;19:58:26,,63.75,63.75,63.75,2025-05-06 19:58:26.000,2025-05-06,2025,5,6,54381,[],()
81579,53615,21570,1,$50¢25,05:33:11 P.M. 07/26/24,"Suite 804 7505 Haley Ferry, East Preston, TN 30069",5025.0,5025.0,5025.0,2024-07-26 17:33:11.000,2024-07-26,2024,7,26,53615,[],()
74493,53214,21345,1,58.25 USD,"05/23/25, 05:11:17","Apt. 421 24296 Lang Views, Feeneyside, WI 75929",58.25,58.25,58.25,2025-05-23 05:11:17.000,2025-05-23,2025,5,23,53214,[],()
77397,54690,21461,2,50.75USD,03:34:26;04/02/25,,50.75,50.75,101.5,2025-04-02 03:34:26.000,2025-04-02,2025,4,2,54690,[],()
75100,54551,21044,4,$ 26.,"12/13/24, 10:29:58 pm",,26.0,26.0,104.0,2024-12-13 22:29:58.000,2024-12-13,2024,12,13,54551,[],()
77693,53787,21256,1,USD62.5,2025-01-29;02:45:23,NULL,62.5,62.5,62.5,2025-01-29 02:45:23.000,2025-01-29,2025,1,29,53787,[],()
73360,53689,21429,1,USD37.0,"29-JUL-2025, 04:54:12 pm",,37.0,37.0,37.0,2025-07-29 16:54:12.000,2025-07-29,2025,7,29,53689,[],()
77744,55632,21121,1,20USD,01/25/25;14:05,,20.0,20.0,20.0,2025-01-25 14:05:00.000,2025-01-25,2025,1,25,55632,[],()
75111,54905,21282,1,57 $,"03:23:57 pm,2025-05-16",NULL,57.0,57.0,57.0,2025-05-16 15:23:57.000,2025-05-16,2025,5,16,54905,[],()
78820,54930,21140,1,$ 69.0,"19-Mar-2025, 11:35",,69.0,69.0,69.0,2025-03-19 11:35:00.000,2025-03-19,2025,3,19,54930,[],()
78915,53298,21637,1,USD 39.99,2024-10-21T04:40:51.821,"411 Kathe Cliffs, North Henry, NH 82799-2597",39.99,39.99,39.99,2024-10-21 04:40:51.821,2024-10-21,2024,10,21,53298,[],()
80208,54067,21016,1,$72.,31-OCT-2024 11:33:45 AM,NULL,72.0,72.0,72.0,2024-10-31 11:33:45.000,2024-10-31,2024,10,31,54067,[],()
79896,55739,20962,1,€65¢50,"04:08:58,11/03/24","Suite 367 4510 Evelynn Keys, Candiberg, ID 37918-7430",7860.0,7860.0,7860.0,2024-11-03 04:08:58.000,2024-11-03,2024,11,3,55739,[],()
73665,53984,21074,1,69.00 USD,2024-05-28 13:49:39,"912 Gino Bypass, North Tillieberg, HI 88423",69.0,69.0,69.0,2024-05-28 13:49:39.000,2024-05-28,2024,5,28,53984,[],()
79416,53627,21500,1,€73.00,07:59:10 A.M.;10-Sep-2024,NULL,87.6,87.6,87.6,2024-09-10 07:59:10.000,2024-09-10,2024,9,10,53627,[],()
82946,54976,21653,2,EUR 39.0, 5-January-2025;08:06,"72654 Kris Harbors, West Randalville, RI 09522-8936",46.8,46.8,93.6,2025-01-05 08:06:00.000,2025-01-05,2025,1,5,54976,[],()
81643,55563,21331,1,USD 65.5,"10:33,2025-02-20",NULL,65.5,65.5,65.5,2025-02-20 10:33:00.000,2025-02-20,2025,2,20,55563,[],()
76024,53154,21041,1,69.0$,01/18/25 15:57,,69.0,69.0,69.0,2025-01-18 15:57:00.000,2025-01-18,2025,1,18,53154,[],()
77100,54155,20992,1,51.0 €,14:48;05/24/24,"199 Walker Shore, Lake Erinton, KY 94827-9444",61.199999999999996,61.199999999999996,61.2,2024-05-24 14:48:00.000,2024-05-24,2024,5,24,54155,[],()
77745,54982,21390,2,49.5$,"07:39, 02/01/25",,49.5,49.5,99.0,2025-02-01 07:39:00.000,2025-02-01,2025,2,1,54982,[],()
78363,53309,21232,1,58.75 EUR,2024-10-25 12:53,"95656 Isaiah Grove, New Lawandafort, CT 10683-0718",70.5,70.5,70.5,2024-10-25 12:53:00.000,2024-10-25,2024,10,25,53309,[],()
79277,53023,21424,2,34.5EUR,2024-11-05T02:59:13,,41.4,41.4,82.8,2024-11-05 02:59:13.000,2024-11-05,2024,11,5,53023,[],()
75598,55322,21155,1,€65¢25,02:43:03 PM;29-Aug-2024,NULL,7830.0,7830.0,7830.0,2024-08-29 14:43:03.000,2024-08-29,2024,8,29,55322,[],()
80572,53138,21069,4,USD22.,"02:28:53 pm,2024-12-22","159 Filiberto Hills, Oberbrunnerberg, FL 39162",22.0,22.0,88.0,2024-12-22 14:28:53.000,2024-12-22,2024,12,22,53138,[],()
74254,53336,21008,1,20EUR,20:12 2025-02-13,,24.0,24.0,24.0,2025-02-13 20:12:00.000,2025-02-13,2025,2,13,53336,[],()
75864,54083,21342,1,EUR46.,"06/02/25,15:22:07",NULL,55.199999999999996,55.199999999999996,55.2,2025-06-02 15:22:07.000,2025-06-02,2025,6,2,54083,[],()
78543,53460,21519,1,EUR 48.50,"08:40:58,02/22/25","Suite 581 479 Sauer Pass, New Felipe, KS 84720",58.199999999999996,58.199999999999996,58.2,2025-02-22 08:40:58.000,2025-02-22,2025,2,22,53460,[],()
81217,55691,21213,1,USD16.5,06:08:11 2024-09-19,,16.5,16.5,16.5,2024-09-19 06:08:11.000,2024-09-19,2024,9,19,55691,[],()
75530,55428,20975,1,€ 69.25,"31-January-2025, 12:01:32 AM",,83.1,83.1,83.1,2025-01-31 00:01:32.000,2025-01-31,2025,1,31,55428,[],()
75939,53119,21605,1,26.5USD,21:28;2024-11-21,NULL,26.5,26.5,26.5,2024-11-21 21:28:00.000,2024-11-21,2024,11,21,53119,[],()
74919,53620,20956,2,$ 61.50,20:31 09/28/24,"1183 Schneider Trail, Port Gabrielchester, HI 58744",61.5,61.5,123.0,2024-09-28 20:31:00.000,2024-09-28,2024,9,28,53620,[],()
82196,54309,21118,1,46.99USD,11-MAY-2024;01:48:11 am,,46.99,46.99,46.99,2024-05-11 01:48:11.000,2024-05-11,2024,5,11,54309,[],()
74948,53353,21070,1,USD 21,09/26/24 17:27,NULL,21.0,21.0,21.0,2024-09-26 17:27:00.000,2024-09-26,2024,9,26,53353,[],()
76105,53614,21412,2,$46¢00,2024-05-29T00:01:45,NULL,4600.0,4600.0,9200.0,2024-05-29 00:01:45.000,2024-05-29,2024,5,29,53614,[],()
78537,53854,21544,1,EUR26.25,"09/09/25, 03:49:12",,31.5,31.5,31.5,2025-09-09 03:49:12.000,2025-09-09,2025,9,9,53854,[],()
80194,54775,21499,2,74.99$,"05/28/25, 20:49:35",,74.99,74.99,149.98,2025-05-28 20:49:35.000,2025-05-28,2025,5,28,54775,[],()
75240,54712,21392,3,EUR 73.50,"10-March-2025, 09:47:17",NULL,88.2,88.2,264.6,2025-03-10 09:47:17.000,2025-03-10,2025,3,10,54712,[],()
82458,53332,21387,2,14.$,19-Feb-2025 10:57:14 pm,,14.0,14.0,28.0,2025-02-19 22:57:14.000,2025-02-19,2025,2,19,53332,[],()
79825,53309,21228,4,24.00USD,04:45:28 pm;03/14/25,,24.0,24.0,96.0,2025-03-14 16:45:28.000,2025-03-14,2025,3,14,53309,[],()
83082,53773,21651,1,$51.5, 8-October-2024;21:16,,51.5,51.5,51.5,2024-10-08 21:16:00.000,2024-10-08,2024,10,8,54065,[],()
73831,53350,21480,1,70.25€,2025-05-24T10:17:32,,84.3,84.3,84.3,2025-05-24 10:17:32.000,2025-05-24,2025,5,24,53131,[],()
78064,54062,20987,1,71.$,"06/08/25, 21:38",,71.0,71.0,71.0,2025-06-08 21:38:00.000,2025-06-08,2025,6,8,54062,[],()
78105,53670,21458,1,45.50 $,09:57:18;2024-08-15,"72715 Ali Field, West Montymouth, NV 62022",45.5,45.5,45.5,2024-08-15 09:57:18.000,2024-08-15,2024,8,15,53670,[],()
76471,54303,20995,1,51.25 $,Mon Sep  9 23:32:09 2024,,51.25,51.25,51.25,2024-09-09 23:32:09.000,2024-09-09,2024,9,9,54303,[],()
80446,54826,20918,1,€17.25,"07:15:02 P.M., 11-October-2024",,20.7,20.7,20.7,2024-10-11 19:15:02.000,2024-10-11,2024,10,11,54826,[],()
75434,55505,21650,1,38.75USD,"07:41:07, 2024-07-13","Suite 461 420 Rudy Trail, New Judeborough, WY 19525-3199",38.75,38.75,38.75,2024-07-13 07:41:07.000,2024-07-13,2024,7,13,55505,[],()
77169,53905,21115,1,USD68.50,"01:29, 2025-04-23",,68.5,68.5,68.5,2025-04-23 01:29:00.000,2025-04-23,2025,4,23,53905,[],()
82910,55144,21231,1,€68¢75,01:58:02 20-DEC-2024,NULL,8250.0,8250.0,8250.0,2024-12-20 01:58:02.000,2024-12-20,2024,12,20,53627,[],()
75771,55392,20923,1,$ 32.0,22.12.2024 22:23:23,NULL,32.0,32.0,32.0,2024-12-22 22:23:23.000,2024-12-22,2024,12,22,55392,[],()
77960,54106,21186,1,EUR43.25,"08/17/24,00:27",,51.9,51.9,51.9,2024-08-17 00:27:00.000,2024-08-17,2024,8,17,54106,[],()
79715,55526,21371,1,USD18.,"10/04/24,07:46:41 AM",,18.0,18.0,18.0,2024-10-04 07:46:41.000,2024-10-04,2024,10,4,55526,[],()
78386,53571,21579,2,$ 53.50,"10:48:26 pm,10/15/24",,53.5,53.5,107.0,2024-10-15 22:48:26.000,2024-10-15,2024,10,15,53571,[],()
75423,54941,21616,1,EUR65.75,2025-02-08;13:28:48,,78.89999999999999,78.89999999999999,78.9,2025-02-08 13:28:48.000,2025-02-08,2025,2,8,54941,[],()
75672,54667,21031,1,44€99¢, 6.10.2024 21:25:25,NULL,5398.8,5398.8,5398.8,2024-06-10 21:25:25.000,2024-06-10,2024,6,10,54667,[],()
74763,54596,21623,1,€ 45.0,21-December-2024;08:40:02 AM,NULL,54.0,54.0,54.0,2024-12-21 08:40:02.000,2024-12-21,2024,12,21,54596,[],()
79441,54773,21144,1,USD71.25,"17:03:34,06/22/25",,71.25,71.25,71.25,2025-06-22 17:03:34.000,2025-06-22,2025,6,22,54773,[],()
75657,55193,21067,1,55.25USD,"15:16, 06/04/25","8602 Friesen Row, Lebsackhaven, FL 83214-6246",55.25,55.25,55.25,2025-06-04 15:16:00.000,2025-06-04,2025,6,4,55193,[],()
80002,55099,20990,1,USD19.5,10/18/24 03:28:37 PM,NULL,19.5,19.5,19.5,2024-10-18 15:28:37.000,2024-10-18,2024,10,18,55099,[],()
76073,53263,21203,1,$ 35.00,"02:26,10/24/24",,35.0,35.0,35.0,2024-10-24 02:26:00.000,2024-10-24,2024,10,24,53263,[],()
76440,54397,20983,2,20.25$,"2025-04-14, 07:50",,20.25,20.25,40.5,2025-04-14 07:50:00.000,2025-04-14,2025,4,14,54397,[],()
73894,55147,21419,1,67.5 USD,07:32:32 A.M. 10-March-2025,,67.5,67.5,67.5,2025-03-10 07:32:32.000,2025-03-10,2025,3,10,55147,[],()
73875,54633,21164,1,18.00 $,2024-12-31T21:20:39,,18.0,18.0,18.0,2024-12-31 21:20:39.000,2024-12-31,2024,12,31,54633,[],()
74512,54906,21625,1,$ 29.75,"02:25:01 PM,2025-05-21",,29.75,29.75,29.75,2025-05-21 14:25:01.000,2025-05-21,2025,5,21,54906,[],()
77466,54754,20938,1,€22¢00,01/13/25 17:12:34,,2640.0,2640.0,2640.0,2025-01-13 17:12:34.000,2025-01-13,2025,1,13,54941,[],()
77094,54896,21296,1,35.0 €,2025-05-31T06:40:58.549,,42.0,42.0,42.0,2025-05-31 06:40:58.549,2025-05-31,2025,5,31,54896,[],()
79908,53672,21645,1,USD54.75,"04/30/25, 18:52:29",,54.75,54.75,54.75,2025-04-30 18:52:29.000,2025-04-30,2025,4,30,53672,[],()
83073,54812,21368,1,22 EUR,2024-08-01T01:35:48.030,,26.4,26.4,26.4,2024-08-01 01:35:48.030,2024-08-01,2024,8,1,54812,[],()
77572,53658,21417,3,13.50 USD,22.12.2024 18:14:14,,13.5,13.5,40.5,2024-12-22 18:14:14.000,2024-12-22,2024,12,22,53658,[],()
79941,55704,21535,1,€ 71.0,11:42:42 2025-07-25,,85.2,85.2,85.2,2025-07-25 11:42:42.000,2025-07-25,2025,7,25,55704,[],()
74535,54774,21106,2,$43.75,"11:32:27,20-AUG-2024",NULL,43.75,43.75,87.5,2024-08-20 11:32:27.000,2024-08-20,2024,8,20,54774,[],()
76472,53604,21038,1,52.00 $,2025-06-08T06:53:52,,52.0,52.0,52.0,2025-06-08 06:53:52.000,2025-06-08,2025,6,8,53604,[],()
75710,55378,21190,1,35.00$,05/28/25 07:31,,35.0,35.0,35.0,2025-05-28 07:31:00.000,2025-05-28,2025,5,28,55378,[],()
74862,55471,21286,1,30.25 €,2025-07-17 23:29,,36.3,36.3,36.3,2025-07-17 23:29:00.000,2025-07-17,2025,7,17,55471,[],()
82774,54068,21583,1,16.0$,25-January-2025 17:18,,16.0,16.0,16.0,2025-01-25 17:18:00.000,2025-01-25,2025,1,25,54068,[],()
80114,55512,20979,1,USD 70.50,"2024-11-27,20:10",,70.5,70.5,70.5,2024-11-27 20:10:00.000,2024-11-27,2024,11,27,55512,[],()
75945,53339,20929,1,$49.99,"16:45, 2025-07-08",NULL,49.99,49.99,49.99,2025-07-08 16:45:00.000,2025-07-08,2025,7,8,53339,[],()
76067,54404,21164,2,14.5 EUR,2025-06-24T14:59:34,,17.4,17.4,34.8,2025-06-24 14:59:34.000,2025-06-24,2025,6,24,54404,[],()
81043,54079,21559,1,$ 75.0,2024-10-08 18:16:49,,75.0,75.0,75.0,2024-10-08 18:16:49.000,2024-10-08,2024,10,8,54079,[],()
76267,53444,21420,1,67.75 USD,2025-01-24;09:20,,67.75,67.75,67.75,2025-01-24 09:20:00.000,2025-01-24,2025,1,24,53444,[],()
78364,54698,21272,1,$64.00,"12:33:00 am,  7-FEB-2025",,64.0,64.0,64.0,2025-02-07 00:33:00.000,2025-02-07,2025,2,7,54698,[],()
82884,53033,21595,1,USD53.75,04/23/25;05:06:54 am,NULL,53.75,53.75,53.75,2025-04-23 05:06:54.000,2025-04-23,2025,4,23,53033,[],()
82974,54697,21017,2,€59.5,2025-05-22 17:27,"Suite 134 3178 Onita Grove, North Diane, MN 07074",71.39999999999999,71.39999999999999,142.8,2025-05-22 17:27:00.000,2025-05-22,2025,5,22,54697,[],()
80748,54471,21431,1,USD 64.0,"14:54, 08/04/24",NULL,64.0,64.0,64.0,2024-08-04 14:54:00.000,2024-08-04,2024,8,4,54471,[],()
76578,55603,21473,1,USD 57.00,2024-12-13;01:33:43 P.M.,"5239 Marcene Club, West Abeview, OK 24669",57.0,57.0,57.0,2024-12-13 13:33:43.000,2024-12-13,2024,12,13,55603,[],()
76052,53222,21281,2,71.0 €,"09/08/24,15:36:21",,85.2,85.2,170.4,2024-09-08 15:36:21.000,2024-09-08,2024,9,8,53222,[],()
76161,53571,21177,1,€21.25,"04/19/25,02:57",NULL,25.5,25.5,25.5,2025-04-19 02:57:00.000,2025-04-19,2025,4,19,53571,[],()
76848,55250,20936,1,USD 60.5,2024-06-29T21:19:04.716,NULL,60.5,60.5,60.5,2024-06-29 21:19:04.716,2024-06-29,2024,6,29,55250,[],()
76540,55092,21271,3,27.00EUR, 2-Sep-2024 01:29:28,"Apt. 776 229 Lannie Port, New Nathan, OR 97278",32.4,32.4,97.2,2024-09-02 01:29:28.000,2024-09-02,2024,9,2,55092,[],()
81657,55383,21502,2,$ 30.99,2024-12-14T23:13:46.825,"Apt. 337 900 Dewitt Groves, Jamisonborough, PA 15063-0361",30.99,30.99,61.98,2024-12-14 23:13:46.825,2024-12-14,2024,12,14,55383,[],()
77568,53804,21097,1,15.5USD,2024-11-23 13:30:38,"570 Kris Drive, New Ezequielfurt, RI 58711",15.5,15.5,15.5,2024-11-23 13:30:38.000,2024-11-23,2024,11,23,53804,[],()
78649,55053,21429,3,USD 39.25,"01:59:10 am,2025-05-20",,39.25,39.25,117.75,2025-05-20 01:59:10.000,2025-05-20,2025,5,20,55053,[],()
78336,55005,21401,1,USD 21.0,12/22/24 22:34:08,,21.0,21.0,21.0,2024-12-22 22:34:08.000,2024-12-22,2024,12,22,55005,[],()
76319,54401,20940,1,USD58.5,"02/18/25,09:23:07",,58.5,58.5,58.5,2025-02-18 09:23:07.000,2025-02-18,2025,2,18,54401,[],()
79797,53853,21192,1,74.99 USD,09:04 2024-11-12,"Suite 201 56092 Jast Islands, North Corey, MO 79516-1642",74.99,74.99,74.99,2024-11-12 09:04:00.000,2024-11-12,2024,11,12,53853,[],()
73526,53172,20971,1,17.0 €,"15:20, 16-May-2024","94444 Ambrose Prairie, Rivabury, SC 95910",20.4,20.4,20.4,2024-05-16 15:20:00.000,2024-05-16,2024,5,16,53172,[],()
74156,55353,21225,2,EUR 59,"10/13/24, 03:27:38 AM",NULL,70.8,70.8,141.6,2024-10-13 03:27:38.000,2024-10-13,2024,10,13,55353,[],()
82283,53769,21447,1,€ 64.,"01/28/25,05:47:08 am","Apt. 741 453 Shields Mountains, Hellerstad, MD 91072",76.8,76.8,76.8,2025-01-28 05:47:08.000,2025-01-28,2025,1,28,54950,[],()
82633,54843,21372,2,EUR31.50,"25-Oct-2024, 09:12:49 P.M.",,37.8,37.8,75.6,2024-10-25 21:12:49.000,2024-10-25,2024,10,25,54843,[],()
82037,53939,21504,1,USD 52.5,2024-12-16T15:30:52,NULL,52.5,52.5,52.5,2024-12-16 15:30:52.000,2024-12-16,2024,12,16,53939,[],()
76837,53453,21198,1,€38¢50, 4-August-2024 22:27:20,,4620.0,4620.0,4620.0,2024-08-04 22:27:20.000,2024-08-04,2024,8,4,53453,[],()
80972,53797,20958,3,32.0$,2024-08-11T12:44:04.184,,32.0,32.0,96.0,2024-08-11 12:44:04.184,2024-08-11,2024,8,11,53797,[],()
81193,53308,21402,1,EUR 66.0,10:52  2-MAY-2024,"16821 Wehner Canyon, East Devon, AK 09404",79.2,79.2,79.2,2024-05-02 10:52:00.000,2024-05-02,2024,5,2,53308,[],()
76548,53514,21219,1,USD54.5,"2024-12-03,08:21:42 am",NULL,54.5,54.5,54.5,2024-12-03 08:21:42.000,2024-12-03,2024,12,3,53514,[],()
76489,55004,21249,3,72.50 USD,2024-04-11T23:13:20.040,,72.5,72.5,217.5,2024-04-11 23:13:20.040,2024-04-11,2024,4,11,55004,[],()
80461,54141,20920,3,18.€,00:28:43 2025-03-18,NULL,21.599999999999998,21.599999999999998,64.8,2025-03-18 00:28:43.000,2025-03-18,2025,3,18,54141,[],()
77016,53634,21612,1,66.75 EUR,"11:11:46 A.M., 12/16/24",,80.1,80.1,80.1,2024-12-16 11:11:46.000,2024-12-16,2024,12,16,53634,[],()
73368,53056,21643,1,USD32.0, 7-May-2025 12:06:37,,32.0,32.0,32.0,2025-05-07 12:06:37.000,2025-05-07,2025,5,7,53056,[],()
79744,53617,21390,1,48.99 USD,2024-09-12T10:31:00,,48.99,48.99,48.99,2024-09-12 10:31:00.000,2024-09-12,2024,9,12,53617,[],()
79703,55807,21101,1,USD 20.00,18:29  5-July-2024,,20.0,20.0,20.0,2024-07-05 18:29:00.000,2024-07-05,2024,7,5,55807,[],()
77791,53061,21201,1,68.99 EUR,2024-11-30T02:48:39,"95044 Lan Springs, Rogahnland, UT 74142",82.788,82.788,82.79,2024-11-30 02:48:39.000,2024-11-30,2024,11,30,53061,[],()
75755,53536,21607,2,71.99 USD,"07:03:26 A.M.,07/08/24",,71.99,71.99,143.98,2024-07-08 07:03:26.000,2024-07-08,2024,7,8,53536,[],()
81628,53667,21537,1,USD21.99,2025-01-21;02:03:37,,21.99,21.99,21.99,2025-01-21 02:03:37.000,2025-01-21,2025,1,21,53667,[],()
78341,55708,21226,1,EUR 58.25,02:30:53 P.M. 15-January-2025,,69.89999999999999,69.89999999999999,69.9,2025-01-15 14:30:53.000,2025-01-15,2025,1,15,55708,[],()
83142,53791,21069,1,$21.75,"14:06,2025-01-30",,21.75,21.75,21.75,2025-01-30 14:06:00.000,2025-01-30,2025,1,30,53791,[],()
78627,54504,21132,1,USD21.5,28-Jun-2025;18:35,,21.5,21.5,21.5,2025-06-28 18:35:00.000,2025-06-28,2025,6,28,54504,[],()
82923,54929,21230,5,26.0USD,18:47 2024-11-10,,26.0,26.0,130.0,2024-11-10 18:47:00.000,2024-11-10,2024,11,10,54929,[],()
80692,53728,21266,1,60$,"04:29:55, 10/08/24",,60.0,60.0,60.0,2024-10-08 04:29:55.000,2024-10-08,2024,10,8,53728,[],()
80260,55592,21569,1,$ 65.75,2024-07-09T07:30:57.608,NULL,65.75,65.75,65.75,2024-07-09 07:30:57.608,2024-07-09,2024,7,9,55592,[],()
81741,54809,21537,1,17$,10:27:17 pm 09/12/24,,17.0,17.0,17.0,2024-09-12 22:27:17.000,2024-09-12,2024,9,12,54809,[],()
77166,54494,21301,2,$61.75,Tue Mar  4 14:12:53 2025,,61.75,61.75,123.5,2025-03-04 14:12:53.000,2025-03-04,2025,3,4,54494,[],()
80514,55801,20927,1,19.99 €,"05:25:34 PM, 02/25/25",NULL,23.987999999999996,23.987999999999996,23.99,2025-02-25 17:25:34.000,2025-02-25,2025,2,25,55801,[],()
75118,53222,21080,1,USD23.0,2024-09-25 02:13,,23.0,23.0,23.0,2024-09-25 02:13:00.000,2024-09-25,2024,9,25,53222,[],()
78312,53404,21012,3,$62.5,12:25  5-November-2024,"6943 Jamel Inlet, West Haywoodborough, CA 82903",62.5,62.5,187.5,2024-11-05 12:25:00.000,2024-11-05,2024,11,5,53404,[],()
77117,54956,21293,2,60.50 $,2024-09-16T04:38:52,,60.5,60.5,121.0,2024-09-16 04:38:52.000,2024-09-16,2024,9,16,54956,[],()
80163,54958,21142,1,38.00 $,"14-April-2025, 10:58:01",,38.0,38.0,38.0,2025-04-14 10:58:01.000,2025-04-14,2025,4,14,54958,[],()
77996,55483,21369,2,$ 61,"2024-12-13, 14:32",NULL,61.0,61.0,122.0,2024-12-13 14:32:00.000,2024-12-13,2024,12,13,55483,[],()
76215,55147,21627,1,20.0USD,2024-07-23T00:55:24,"Apt. 213 936 Stephenie Branch, Zackbury, CA 85488-5676",20.0,20.0,20.0,2024-07-23 00:55:24.000,2024-07-23,2024,7,23,55147,[],()
78822,54015,21598,1,37.99€,"07/02/24, 07:36",,45.588,45.588,45.59,2024-07-02 07:36:00.000,2024-07-02,2024,7,2,54015,[],()
78499,55383,21106,2,45.00USD,"02/17/25,03:49:30 am",,45.0,45.0,90.0,2025-02-17 03:49:30.000,2025-02-17,2025,2,17,55383,[],()
82768,54537,21537,1,€ 16.,2025-03-01T17:35:27,,19.2,19.2,19.2,2025-03-01 17:35:27.000,2025-03-01,2025,3,1,54537,[],()
77769,55590,21635,2,23.25EUR,"2025-04-08, 06:41:43 PM",NULL,27.9,27.9,55.8,2025-04-08 18:41:43.000,2025-04-08,2025,4,8,55590,[],()
75495,53467,21310,3,16.00$,12:20;2025-03-07,,16.0,16.0,48.0,2025-03-07 12:20:00.000,2025-03-07,2025,3,7,53467,[],()
73503,55323,21561,1,27.99 €,"2024-11-27, 04:15:44 am","Apt. 883 667 Morissette Neck, West Dallasburgh, CO 16143",33.587999999999994,33.587999999999994,33.59,2024-11-27 04:15:44.000,2024-11-27,2024,11,27,55323,[],()
82457,55664,21129,1,36.00€,2025-02-06 10:31,,43.199999999999996,43.199999999999996,43.2,2025-02-06 10:31:00.000,2025-02-06,2025,2,6,55664,[],()
78821,55101,21141,4,$23.0,19:31:05 30-Sep-2024,,23.0,23.0,92.0,2024-09-30 19:31:05.000,2024-09-30,2024,9,30,55101,[],()
80478,55679,21019,1,63.25EUR,"09:52:57,2025-03-27",,75.89999999999999,75.89999999999999,75.9,2025-03-27 09:52:57.000,2025-03-27,2025,3,27,55679,[],()
81559,54264,21074,1,USD 71.75,04/08/25 08:45:36 am,,71.75,71.75,71.75,2025-04-08 08:45:36.000,2025-04-08,2025,4,8,55133,[],()
80171,55125,21194,4,24.50USD,08/25/24 17:58,"654 Chong Plaza, North Boyceburgh, CO 06882-3195",24.5,24.5,98.0,2024-08-25 17:58:00.000,2024-08-25,2024,8,25,54606,[],()
75659,54202,20924,1,66.50USD,"16:34:09, 10-SEP-2024","799 Lesch Lakes, Port Simoneland, KY 92472-8071",66.5,66.5,66.5,2024-09-10 16:34:09.000,2024-09-10,2024,9,10,54202,[],()
75701,54462,21122,1,63.99 $,2025-07-19T16:55:23,"53335 Monnie Grove, Lake Sidney, NV 63739",63.99,63.99,63.99,2025-07-19 16:55:23.000,2025-07-19,2025,7,19,54462,[],()
75095,53511,21504,1,50.25USD,2025-04-22T08:02:10,"7931 Noe Green, Lake Louis, NE 22889-7160",50.25,50.25,50.25,2025-04-22 08:02:10.000,2025-04-22,2025,4,22,53511,[],()
73546,55608,21313,1,32.00$,"2024-11-14, 12:35:57",NULL,32.0,32.0,32.0,2024-11-14 12:35:57.000,2024-11-14,2024,11,14,53516,[],()
80890,54046,20989,3,€66¢25,2024-11-04T02:38:24.868,,7950.0,7950.0,23850.0,2024-11-04 02:38:24.868,2024-11-04,2024,11,4,54046,[],()
76961,54927,21407,3,€27¢25,11:16:04 PM 2024-09-14,,3270.0,3270.0,9810.0,2024-09-14 23:16:04.000,2024-09-14,2024,9,14,54927,[],()
74921,53116,21455,1,$54,"07/03/24, 21:58","759 Toby Pine, Nestorshire, KY 82705",54.0,54.0,54.0,2024-07-03 21:58:00.000,2024-07-03,2024,7,3,53116,[],()
76586,54829,21534,1,$ 24,2024-09-29T23:54:00,"Suite 389 232 Baumbach Port, Valdaton, IN 33229-3147",24.0,24.0,24.0,2024-09-29 23:54:00.000,2024-09-29,2024,9,29,53147,[],()
79058,55569,21627,5,EUR 23.99,2025-05-11T06:44:31.213,,28.787999999999997,28.787999999999997,143.94,2025-05-11 06:44:31.213,2025-05-11,2025,5,11,55569,[],()
75279,53071,21574,1,26.25 USD,"05:57,07/14/24",NULL,26.25,26.25,26.25,2024-07-14 05:57:00.000,2024-07-14,2024,7,14,53071,[],()
81049,53024,21425,1,42.75USD, 3-April-2024 06:17:19 A.M.,NULL,42.75,42.75,42.75,2024-04-03 06:17:19.000,2024-04-03,2024,4,3,53024,[],()
78713,54932,21542,1,USD50.75,2025-05-01 07:09:17 pm,,50.75,50.75,50.75,2025-05-01 19:09:17.000,2025-05-01,2025,5,1,55535,[],()
75678,53805,20970,1,43.99 $,"21:03,15-March-2025",,43.99,43.99,43.99,2025-03-15 21:03:00.000,2025-03-15,2025,3,15,53805,[],()
76941,54191,21453,2,66.50$,11:35;16-MAR-2025,,66.5,66.5,133.0,2025-03-16 11:35:00.000,2025-03-16,2025,3,16,54191,[],()
80961,53942,20956,1,64. USD,"2024-11-08,09:24",,64.0,64.0,64.0,2024-11-08 09:24:00.000,2024-11-08,2024,11,8,53942,[],()
75133,53505,21316,3,21.50EUR,2025-06-04 09:52,"9449 Schamberger Radial, South Evie, AZ 82383",25.8,25.8,77.4,2025-06-04 09:52:00.000,2025-06-04,2025,6,4,53505,[],()
79273,54043,21332,2,USD47.5,"03:25:43 am, 25-NOV-2024",,47.5,47.5,95.0,2024-11-25 03:25:43.000,2024-11-25,2024,11,25,54043,[],()
80855,54382,20957,1,€ 55.99,"13:16:02,09/08/24","8297 Collins Place, Welchfort, RI 90317-8953",67.188,67.188,67.19,2024-09-08 13:16:02.000,2024-09-08,2024,9,8,54375,[],()
81073,53133,21047,1,USD 55.0,2024-09-07;02:06:32 PM,,55.0,55.0,55.0,2024-09-07 14:06:32.000,2024-09-07,2024,9,7,53133,[],()
78476,54008,21307,1,64.50USD,12/28/24;05:45:00 P.M.,"Apt. 414 54462 Hallie Divide, North Adena, NV 12774-1085",64.5,64.5,64.5,2024-12-28 17:45:00.000,2024-12-28,2024,12,28,54008,[],()
74789,54436,21630,1,USD 56.0,"2024-06-29,12:52:29 pm",,56.0,56.0,56.0,2024-06-29 12:52:29.000,2024-06-29,2024,6,29,54436,[],()
73777,54846,21299,2,USD24.50,11-March-2025;08:15,NULL,24.5,24.5,49.0,2025-03-11 08:15:00.000,2025-03-11,2025,3,11,54846,[],()
76986,55555,21500,1,USD72.75,2025-02-13T15:57:22.107,"39903 Dimple Hollow, Littelmouth, NE 68902-4204",72.75,72.75,72.75,2025-02-13 15:57:22.107,2025-02-13,2025,2,13,55555,[],()
82098,55374,21337,1,EUR 68.25,22:51 11-December-2024,"Apt. 756 9929 Grant Ports, Port Lacy, OK 12741",81.89999999999999,81.89999999999999,81.9,2024-12-11 22:51:00.000,2024-12-11,2024,12,11,55374,[],()
75823,54252,21288,1,25.75$,14:50:30 28-JAN-2025,NULL,25.75,25.75,25.75,2025-01-28 14:50:30.000,2025-01-28,2025,1,28,54252,[],()
79117,54744,21602,1,68.99 USD,"10:44:04 A.M.,02/04/25",NULL,68.99,68.99,68.99,2025-02-04 10:44:04.000,2025-02-04,2025,2,4,54744,[],()
75951,55064,21433,1,46.00 $,10/06/24;14:47,NULL,46.0,46.0,46.0,2024-10-06 14:47:00.000,2024-10-06,2024,10,6,55064,[],()
82542,55085,20942,1,35$,14:31:46 10-NOV-2024,,35.0,35.0,35.0,2024-11-10 14:31:46.000,2024-11-10,2024,11,10,55085,[],()
81906,55641,21379,1,63.25 EUR,23:45;03/21/25,NULL,75.89999999999999,75.89999999999999,75.9,2025-03-21 23:45:00.000,2025-03-21,2025,3,21,55641,[],()
78423,55689,21080,1,USD 26.75,2025-02-17T00:34:21.138,,26.75,26.75,26.75,2025-02-17 00:34:21.138,2025-02-17,2025,2,17,55689,[],()
83146,55783,21360,1,49.99€,"12:22:07 A.M., 31-JAN-2025",NULL,59.988,59.988,59.99,2025-01-31 00:22:07.000,2025-01-31,2025,1,31,55783,[],()
77366,53201,21346,2,47.99$,2024-10-01T02:21:24,,47.99,47.99,95.98,2024-10-01 02:21:24.000,2024-10-01,2024,10,1,53201,[],()
80088,54832,21253,1,$68¢50,06.08.2024 09:56:56,NULL,6850.0,6850.0,6850.0,2024-06-08 09:56:56.000,2024-06-08,2024,6,8,54832,[],()
76904,54438,21386,1,USD 45.5,"19:13:41,08/20/24","Apt. 440 66310 Abbott Circles, Arlieside, SD 44591",45.5,45.5,45.5,2024-08-20 19:13:41.000,2024-08-20,2024,8,20,54438,[],()
76849,55465,21181,1,USD 48.5,"16-MAY-2024,10:38",,48.5,48.5,48.5,2024-05-16 10:38:00.000,2024-05-16,2024,5,16,55465,[],()
81988,53661,21247,2,$52.00,"23-September-2024,07:18",,52.0,52.0,104.0,2024-09-23 07:18:00.000,2024-09-23,2024,9,23,53661,[],()
75827,55490,20918,2,$ 15.,"30-Aug-2024, 11:09",,15.0,15.0,30.0,2024-08-30 11:09:00.000,2024-08-30,2024,8,30,55490,[],()
80183,53364,21369,1,56.5 USD,"2025-02-10,16:46",,56.5,56.5,56.5,2025-02-10 16:46:00.000,2025-02-10,2025,2,10,53364,[],()
81225,54893,20973,2,28.50$,01:27 2025-07-28,,28.5,28.5,57.0,2025-07-28 01:27:00.000,2025-07-28,2025,7,28,54893,[],()
78445,54085,21524,1,61.50USD,01:58:43 A.M.;2024-10-25,,61.5,61.5,61.5,2024-10-25 01:58:43.000,2024-10-25,2024,10,25,54085,[],()
79201,54868,21358,1,USD46.,2025-01-27T10:15:39.763,,46.0,46.0,46.0,2025-01-27 10:15:39.763,2025-01-27,2025,1,27,53394,[],()
81785,54229,21068,1,$66.,15:29;11/14/24,NULL,66.0,66.0,66.0,2024-11-14 15:29:00.000,2024-11-14,2024,11,14,54229,[],()
77458,55198,21054,2,16.99 USD,02:46:23 pm;2024-11-04,NULL,16.99,16.99,33.98,2024-11-04 14:46:23.000,2024-11-04,2024,11,4,55198,[],()
75526,53477,20928,1,$24.25,"03:21:45 A.M., 2025-06-15",,24.25,24.25,24.25,2025-06-15 03:21:45.000,2025-06-15,2025,6,15,53477,[],()
80725,55783,21013,1,44.00EUR,2025-02-20T07:58:16.134,,52.8,52.8,52.8,2025-02-20 07:58:16.134,2025-02-20,2025,2,20,55783,[],()
76101,55180,21636,2,52.5 $,"2024-11-13, 07:48:08",,52.5,52.5,105.0,2024-11-13 07:48:08.000,2024-11-13,2024,11,13,55180,[],()
79500,53632,21330,1,€ 44.25,11:56:58; 7-December-2024,NULL,53.1,53.1,53.1,2024-12-07 11:56:58.000,2024-12-07,2024,12,7,53632,[],()
77684,53765,21101,1,$18.,"12-Jan-2025,21:35",NULL,18.0,18.0,18.0,2025-01-12 21:35:00.000,2025-01-12,2025,1,12,53765,[],()
73945,53529,20976,1,52.5 USD,"05/03/25,08:25:05 pm","4619 Isreal Centers, Rauside, MI 67336-4452",52.5,52.5,52.5,2025-05-03 20:25:05.000,2025-05-03,2025,5,3,53529,[],()
75472,53686,21420,1,USD 63,"2024-09-25,19:54",,63.0,63.0,63.0,2024-09-25 19:54:00.000,2024-09-25,2024,9,25,53686,[],()
74294,53405,21270,1,70.25 USD,"2024-07-09,13:23:42",,70.25,70.25,70.25,2024-07-09 13:23:42.000,2024-07-09,2024,7,9,53405,[],()
76668,53658,21554,2,€32.75,11:13:19;09/21/24,NULL,39.3,39.3,78.6,2024-09-21 11:13:19.000,2024-09-21,2024,9,21,53658,[],()
73802,53749,21349,1,57.00 $,"09/08/24,11:59:54 PM","88826 Amos Knolls, Bobbyview, WY 80462-5136",57.0,57.0,57.0,2024-09-08 23:59:54.000,2024-09-08,2024,9,8,53749,[],()
75162,55243,20970,1,USD40.25,"15:35,24-June-2024",NULL,40.25,40.25,40.25,2024-06-24 15:35:00.000,2024-06-24,2024,6,24,55243,[],()
82838,53840,21352,3,36 USD,2024-06-21 11:35:14 A.M.,"Suite 587 4393 Chad Harbor, East Corazonton, KS 61879-2960",36.0,36.0,108.0,2024-06-21 11:35:14.000,2024-06-21,2024,6,21,53840,[],()
74549,54809,21310,1,$17.0,"01:43:32 pm, 31-March-2025",,17.0,17.0,17.0,2025-03-31 13:43:32.000,2025-03-31,2025,3,31,54809,[],()
77838,54104,21464,1,32.0$,2024-12-30T16:16:38.069,"Apt. 558 7552 Ryan Inlet, Margretfurt, CO 95701",32.0,32.0,32.0,2024-12-30 16:16:38.069,2024-12-30,2024,12,30,54188,[],()
74738,53928,21040,1,56.99$,2025-03-20T01:33:05,,56.99,56.99,56.99,2025-03-20 01:33:05.000,2025-03-20,2025,3,20,53928,[],()
79394,55089,21367,1,38.25 $,13:27 05/20/25,,38.25,38.25,38.25,2025-05-20 13:27:00.000,2025-05-20,2025,5,20,55089,[],()
73362,54384,21371,1,19.5 $,07:04:41 pm 24-DEC-2024,,19.5,19.5,19.5,2024-12-24 19:04:41.000,2024-12-24,2024,12,24,54384,[],()
79988,55246,21161,1,€35.75,"10:46,06/12/24",,42.9,42.9,42.9,2024-06-12 10:46:00.000,2024-06-12,2024,6,12,55246,[],()
78742,53630,21340,1,18.75 USD,2025-05-14;18:53,,18.75,18.75,18.75,2025-05-14 18:53:00.000,2025-05-14,2025,5,14,53630,[],()
74540,54070,21456,3,51 USD,"11/18/24, 19:40:46","Apt. 329 733 Hettinger View, Christiansenhaven, MO 19022-8044",51.0,51.0,153.0,2024-11-18 19:40:46.000,2024-11-18,2024,11,18,54070,[],()
81953,54565,21402,3,USD 70.50,15:30:29 2024-12-20,NULL,70.5,70.5,211.5,2024-12-20 15:30:29.000,2024-12-20,2024,12,20,54565,[],()
79757,55348,21076,2,56.5 EUR,2025-02-12T05:22:14,NULL,67.8,67.8,135.6,2025-02-12 05:22:14.000,2025-02-12,2025,2,12,55348,[],()
82469,53211,20996,1,46.25$,"27-APR-2024, 21:29:35",,46.25,46.25,46.25,2024-04-27 21:29:35.000,2024-04-27,2024,4,27,53211,[],()
78817,54657,21200,1,42.0 USD,2025-01-23T11:50:06,NULL,42.0,42.0,42.0,2025-01-23 11:50:06.000,2025-01-23,2025,1,23,53318,[],()
75224,55626,21420,1,USD 68.00,21:11:30 11-April-2025,,68.0,68.0,68.0,2025-04-11 21:11:30.000,2025-04-11,2025,4,11,55626,[],()
74395,55539,21087,1,29.00 $,2024-07-22T10:57:34,,29.0,29.0,29.0,2024-07-22 10:57:34.000,2024-07-22,2024,7,22,55539,[],()
79734,55528,21302,1,EUR19.5,02:27 2024-10-10,NULL,23.4,23.4,23.4,2024-10-10 02:27:00.000,2024-10-10,2024,10,10,55528,[],()
76059,53191,21280,3,EUR19.99,2024-12-30;06:11:01 P.M.,NULL,23.987999999999996,23.987999999999996,71.96,2024-12-30 18:11:01.000,2024-12-30,2024,12,30,53191,[],()
78554,55283,21185,1,USD 35.99,22:14;2024-09-24,,35.99,35.99,35.99,2024-09-24 22:14:00.000,2024-09-24,2024,9,24,55283,[],()
82139,53071,21551,1,€ 41.50,"21:52, 09/30/24","5401 Lesli Shore, East Noble, NC 28507-2500",49.8,49.8,49.8,2024-09-30 21:52:00.000,2024-09-30,2024,9,30,53071,[],()
80247,55497,21153,2,42.99 $,"2025-02-01,01:16",,42.99,42.99,85.98,2025-02-01 01:16:00.000,2025-02-01,2025,2,1,55497,[],()
74360,55347,21620,1,12.25EUR,2025-01-21T08:50:10,,14.7,14.7,14.7,2025-01-21 08:50:10.000,2025-01-21,2025,1,21,55347,[],()
78996,53212,21146,5,48.25 EUR," 4-DEC-2024,14:14",,57.9,57.9,289.5,2024-12-04 14:14:00.000,2024-12-04,2024,12,4,53212,[],()
75508,53121,21360,1,49.0USD,18:32:41  8-JUN-2024,"344 Walter Mission, Karlynborough, AR 51837",49.0,49.0,49.0,2024-06-08 18:32:41.000,2024-06-08,2024,6,8,53121,[],()
73542,55665,21368,1,$ 27.99,03:50 05/02/24,"539 Sol Forks, Brownberg, AL 15708",27.99,27.99,27.99,2024-05-02 03:50:00.000,2024-05-02,2024,5,2,55665,[],()
74323,55002,21319,1,54.5USD,09/25/24;06:01,,54.5,54.5,54.5,2024-09-25 06:01:00.000,2024-09-25,2024,9,25,55002,[],()
83022,53610,21459,1,22. USD,2025-01-24T09:41:55.618,NULL,22.0,22.0,22.0,2025-01-24 09:41:55.618,2025-01-24,2025,1,24,53610,[],()
76519,55232,21285,1,65.0 USD,17-April-2025;02:25,"Suite 559 60491 Cummings Flats, Charleneside, NV 51293",65.0,65.0,65.0,2025-04-17 02:25:00.000,2025-04-17,2025,4,17,55232,[],()
82205,54574,21120,1,37$25¢,29-SEP-2025;03:27:08,NULL,3725.0,3725.0,3725.0,2025-09-29 03:27:08.000,2025-09-29,2025,9,29,54736,[],()
81557,54934,21257,2,46.99 EUR,2024-06-21T16:03:09,,56.388,56.388,112.78,2024-06-21 16:03:09.000,2024-06-21,2024,6,21,54934,[],()
76972,53444,20944,1,34.99 EUR,"05:04:44,2025-01-23",,41.988,41.988,41.99,2025-01-23 05:04:44.000,2025-01-23,2025,1,23,53444,[],()
77315,55477,20952,2,40.25 USD,2024-10-23 09:20,,40.25,40.25,80.5,2024-10-23 09:20:00.000,2024-10-23,2024,10,23,54272,[],()
74886,55127,21053,1,USD 52.00,2024-08-03T18:36:24,NULL,52.0,52.0,52.0,2024-08-03 18:36:24.000,2024-08-03,2024,8,3,55127,[],()
80091,54181,21131,1,$ 49.50,"14:00, 06/27/24",,49.5,49.5,49.5,2024-06-27 14:00:00.000,2024-06-27,2024,6,27,54181,[],()
79899,55580,21127,3,$53.5,"15:54, 9-Sep-2024",,53.5,53.5,160.5,2024-09-09 15:54:00.000,2024-09-09,2024,9,9,55580,[],()
82427,55119,21583,1,USD 16.99,06:37:47 am;06/26/24,NULL,16.99,16.99,16.99,2024-06-26 06:37:47.000,2024-06-26,2024,6,26,55119,[],()
75794,53578,20995,1,51.25 $,07:40; 5-Jun-2024,,51.25,51.25,51.25,2024-06-05 07:40:00.000,2024-06-05,2024,6,5,53578,[],()
82558,55485,21333,2,$ 31.5,00:21:43; 4-Nov-2024,NULL,31.5,31.5,63.0,2024-11-04 00:21:43.000,2024-11-04,2024,11,4,55485,[],()
80061,54094,21048,1,$ 65.75," 1-Apr-2025, 03:54:30",,65.75,65.75,65.75,2025-04-01 03:54:30.000,2025-04-01,2025,4,1,54094,[],()
76408,53159,21581,1,28.5EUR,11:02:52;04/23/25,"951 Johnston Ville, Port Desmondland, IN 29072-0163",34.199999999999996,34.199999999999996,34.2,2025-04-23 11:02:52.000,2025-04-23,2025,4,23,53159,[],()
79963,53697,21613,1,$ 28.50,20-Feb-2025 07:38:14 am,"5112 Antwan Haven, South Jack, NJ 12541-4005",28.5,28.5,28.5,2025-02-20 07:38:14.000,2025-02-20,2025,2,20,53697,[],()
79691,55405,21380,4,37.25USD,07:22:46;24-Apr-2024,,37.25,37.25,149.0,2024-04-24 07:22:46.000,2024-04-24,2024,4,24,55405,[],()
74005,55484,21323,1,USD28.75,03:28:28 P.M. 10/22/24,,28.75,28.75,28.75,2024-10-22 15:28:28.000,2024-10-22,2024,10,22,55484,[],()
80423,54026,21169,1,USD 60.,"01/18/25, 07:42",,60.0,60.0,60.0,2025-01-18 07:42:00.000,2025-01-18,2025,1,18,54026,[],()
73888,54419,20955,2,$73¢50,01:23;23-APR-2024,"Apt. 992 1188 Shields Estate, North Georgiannemouth, MO 15797",7350.0,7350.0,14700.0,2024-04-23 01:23:00.000,2024-04-23,2024,4,23,54419,[],()
82499,53270,21165,2,$19.99,24-JUN-2025 13:16,"8977 Kilback Knolls, New Craigborough, WY 83192",19.99,19.99,39.98,2025-06-24 13:16:00.000,2025-06-24,2025,6,24,53270,[],()
83108,54009,21292,1,EUR40.50,"2024-12-14,21:26:53",,48.6,48.6,48.6,2024-12-14 21:26:53.000,2024-12-14,2024,12,14,54009,[],()
74915,54972,21517,1,63.00$,"12:55:13, 2024-11-02",NULL,63.0,63.0,63.0,2024-11-02 12:55:13.000,2024-11-02,2024,11,2,54972,[],()
74278,55507,21655,4,30.99$,2024-11-15T04:38:09,,30.99,30.99,123.96,2024-11-15 04:38:09.000,2024-11-15,2024,11,15,55507,[],()
80949,53904,21248,1,40.5USD,11/17/24 05:36:21 A.M.,NULL,40.5,40.5,40.5,2024-11-17 05:36:21.000,2024-11-17,2024,11,17,53904,[],()
75074,55679,21156,1,$ 73.00,11/15/24;08:07:38,"32767 Garland Park, West Dominica, IN 08921-0294",73.0,73.0,73.0,2024-11-15 08:07:38.000,2024-11-15,2024,11,15,55679,[],()
76084,53428,21356,1,14.5€,2025-03-02 11:52,"397 Herbert Manors, Port Micheal, MN 16114",17.4,17.4,17.4,2025-03-02 11:52:00.000,2025-03-02,2025,3,2,53428,[],()
75748,53408,20918,1,$ 19.75," 1-Feb-2025,04:52:44",,19.75,19.75,19.75,2025-02-01 04:52:44.000,2025-02-01,2025,2,1,53408,[],()
81411,53443,21001,1,36.50$,"2024-10-10,04:56:42",,36.5,36.5,36.5,2024-10-10 04:56:42.000,2024-10-10,2024,10,10,53443,[],()
77353,55409,20998,1,$ 49.50,17:58:19;06/07/24,NULL,49.5,49.5,49.5,2024-06-07 17:58:19.000,2024-06-07,2024,6,7,55409,[],()
82448,55523,21038,1,USD50.00," 8-Dec-2024, 09:34:19",,50.0,50.0,50.0,2024-12-08 09:34:19.000,2024-12-08,2024,12,8,55523,[],()
77904,53078,21276,1,30.00 USD,"01/24/25,01:23:59","Suite 909 36279 Adelle Bridge, South Leeannshire, NC 41989-2987",30.0,30.0,30.0,2025-01-24 01:23:59.000,2025-01-24,2025,1,24,53078,[],()
80166,55295,21262,1,33.75USD,2024-10-14T20:01:29.963,"Suite 999 1747 Ezra Turnpike, Ruthtown, WV 72370",33.75,33.75,33.75,2024-10-14 20:01:29.963,2024-10-14,2024,10,14,55295,[],()
83157,53795,20987,1,68.0$,2025-03-13T02:06:49.746,,68.0,68.0,68.0,2025-03-13 02:06:49.746,2025-03-13,2025,3,13,53795,[],()
77602,54209,21569,1,USD66.00,"2025-06-11, 22:17",,66.0,66.0,66.0,2025-06-11 22:17:00.000,2025-06-11,2025,6,11,54209,[],()
82803,54339,21486,1,38.25$,27-Sep-2024 05:24:05 am,,38.25,38.25,38.25,2024-09-27 05:24:05.000,2024-09-27,2024,9,27,54339,[],()
73794,53220,21253,1,72.€,04:54:45 pm 16-August-2024,"40178 Koch Light, New Lore, NY 97284-4893",86.39999999999999,86.39999999999999,86.4,2024-08-16 16:54:45.000,2024-08-16,2024,8,16,53220,[],()
79986,54200,20917,3,$ 41.0,"21:24:46, 2024-12-03","Suite 298 1763 Ledner Fork, Brettton, IA 56014-9744",41.0,41.0,123.0,2024-12-03 21:24:46.000,2024-12-03,2024,12,3,54200,[],()
77076,53539,21092,1,EUR31.50,"11/19/24,20:30:10",NULL,37.8,37.8,37.8,2024-11-19 20:30:10.000,2024-11-19,2024,11,19,55373,[],()
77208,53236,21237,1,21 USD,09:23:58;2025-05-17,,21.0,21.0,21.0,2025-05-17 09:23:58.000,2025-05-17,2025,5,17,53236,[],()
79237,54663,20960,2,29.0 $,04:51:37 P.M. 18-May-2025,NULL,29.0,29.0,58.0,2025-05-18 16:51:37.000,2025-05-18,2025,5,18,54663,[],()
75966,55012,21158,2,25.50 EUR,2024-11-09T09:00:08.622,NULL,30.599999999999998,30.599999999999998,61.2,2024-11-09 09:00:08.622,2024-11-09,2024,11,9,55012,[],()
73970,54891,21109,3,EUR55.0, 5-Sep-2024;03:06,,66.0,66.0,198.0,2024-09-05 03:06:00.000,2024-09-05,2024,9,5,54891,[],()
80051,54571,21440,1,$32.0,2024-11-14T07:18:42.934,,32.0,32.0,32.0,2024-11-14 07:18:42.934,2024-11-14,2024,11,14,54571,[],()
78165,54822,21000,1,27.50USD,"04:06:03, 11/24/24",NULL,27.5,27.5,27.5,2024-11-24 04:06:03.000,2024-11-24,2024,11,24,54822,[],()
82691,54135,21449,1,63.50USD,02/07/25;04:51:16 am,,63.5,63.5,63.5,2025-02-07 04:51:16.000,2025-02-07,2025,2,7,54135,[],()
77445,55508,21380,1,38.25 $,"18-Dec-2024,08:49","Suite 611 7966 Thersa Road, Irmgardfort, AR 43146",38.25,38.25,38.25,2024-12-18 08:49:00.000,2024-12-18,2024,12,18,55452,[],()
81886,53153,21610,5,44.50€,"07/13/24, 02:03:44",,53.4,53.4,267.0,2024-07-13 02:03:44.000,2024-07-13,2024,7,13,53153,[],()
75977,54281,21642,1,52.25 USD,03:12;06/28/25,,52.25,52.25,52.25,2025-06-28 03:12:00.000,2025-06-28,2025,6,28,54281,[],()
73476,53082,21623,1,$43.5,2025-01-08T09:29:29.411,,43.5,43.5,43.5,2025-01-08 09:29:29.411,2025-01-08,2025,1,8,53082,[],()
81078,54491,21259,3,USD 23.50,"03:46:00, 04/19/25",,23.5,23.5,70.5,2025-04-19 03:46:00.000,2025-04-19,2025,4,19,54491,[],()
82296,53341,21450,1,USD 48.5,"12/08/24, 08:01:33 P.M.",,48.5,48.5,48.5,2024-12-08 20:01:33.000,2024-12-08,2024,12,8,53341,[],()
75422,53750,21052,1,€73.,"18:43:48, 12/14/24","73888 Hester Village, South Arielburgh, ID 80744",87.6,87.6,87.6,2024-12-14 18:43:48.000,2024-12-14,2024,12,14,53750,[],()
80129,53953,21484,1,€53¢99,"17:15:54, 2024-10-03",NULL,6478.8,6478.8,6478.8,2024-10-03 17:15:54.000,2024-10-03,2024,10,3,53953,[],()
81576,55277,21562,2,40. USD,"2025-03-25, 12:55:32 pm",NULL,40.0,40.0,80.0,2025-03-25 12:55:32.000,2025-03-25,2025,3,25,55277,[],()
82385,54671,21633,1,€72.99,"04:35:27 am,03/28/25",,87.588,87.588,87.59,2025-03-28 04:35:27.000,2025-03-28,2025,3,28,54671,[],()
79390,53631,21089,1,$46.50,13-June-2024 20:39,"Apt. 807 417 Gregorio Track, South Willistown, MN 08255-9185",46.5,46.5,46.5,2024-06-13 20:39:00.000,2024-06-13,2024,6,13,53631,[],()
74883,53117,21299,1,USD22.00,"2025-05-26, 12:29:55 pm",NULL,22.0,22.0,22.0,2025-05-26 12:29:55.000,2025-05-26,2025,5,26,53117,[],()
77707,53973,21236,1,USD 73.,2025-02-05T12:54:21.252,NULL,73.0,73.0,73.0,2025-02-05 12:54:21.252,2025-02-05,2025,2,5,53973,[],()
81031,55014,21059,1,47USD,"2025-04-05,17:07","122 Joan Underpass, Port Clinton, ID 96352-7877",47.0,47.0,47.0,2025-04-05 17:07:00.000,2025-04-05,2025,4,5,55014,[],()
76167,55592,20944,1,EUR35.50,08/03/24;16:10:06,NULL,42.6,42.6,42.6,2024-08-03 16:10:06.000,2024-08-03,2024,8,3,55592,[],()
73633,54535,21237,1,€20.5,22:12:34; 7-February-2025,"Apt. 667 1115 Larkin Station, Botsfordshire, NC 65889",24.599999999999998,24.599999999999998,24.6,2025-02-07 22:12:34.000,2025-02-07,2025,2,7,54535,[],()
81760,55692,21586,1,USD 21.75,2025-02-22T02:05:26,"1366 Beier Key, Walshville, NV 72712-1754",21.75,21.75,21.75,2025-02-22 02:05:26.000,2025-02-22,2025,2,22,55829,[],()
79611,53910,21484,1,57.50€,"2024-09-03,03:16:00 A.M.","495 Douglas Port, Franciscotown, WI 97743",69.0,69.0,69.0,2024-09-03 03:16:00.000,2024-09-03,2024,9,3,53910,[],()
75390,53756,21475,1,$35.50,"11:00:03 A.M., 07/04/24",NULL,35.5,35.5,35.5,2024-07-04 11:00:03.000,2024-07-04,2024,7,4,53756,[],()
75211,53356,21319,2,USD51.00,2024-10-17;01:26:39 AM,NULL,51.0,51.0,102.0,2024-10-17 01:26:39.000,2024-10-17,2024,10,17,53356,[],()
80667,53287,21439,1,$ 45.5,2024-11-09T08:21:19.430,,45.5,45.5,45.5,2024-11-09 08:21:19.430,2024-11-09,2024,11,9,53287,[],()
75848,54736,20958,2,USD32.25,18:21;2024-08-13,NULL,32.25,32.25,64.5,2024-08-13 18:21:00.000,2024-08-13,2024,8,13,54736,[],()
79082,53153,21514,3,34.50 USD,30-NOV-2024 02:12:24 pm,NULL,34.5,34.5,103.5,2024-11-30 14:12:24.000,2024-11-30,2024,11,30,53153,[],()
82692,53748,21381,1,32.0$,"18:41:09, 2025-05-01",,32.0,32.0,32.0,2025-05-01 18:41:09.000,2025-05-01,2025,5,1,53748,[],()
79902,54121,21650,1,$ 39.00,"17:30,2025-01-30",,39.0,39.0,39.0,2025-01-30 17:30:00.000,2025-01-30,2025,1,30,54121,[],()
81350,54564,21241,1,18USD,"03:04,17-April-2025",,18.0,18.0,18.0,2025-04-17 03:04:00.000,2025-04-17,2025,4,17,54564,[],()
80168,55073,21400,2,42$00¢,"2024-07-13, 17:33",NULL,4200.0,4200.0,8400.0,2024-07-13 17:33:00.000,2024-07-13,2024,7,13,55073,[],()
75371,53272,21609,1,19€25¢,2024-09-07 06:03:37 PM,,2310.0,2310.0,2310.0,2024-09-07 18:03:37.000,2024-09-07,2024,9,7,53272,[],()
76313,54776,21485,1,€20.,00:14; 6-April-2025,,24.0,24.0,24.0,2025-04-06 00:14:00.000,2025-04-06,2025,4,6,54776,[],()
80648,55781,21055,2,USD48.5,"14-Dec-2024, 05:22:38",,48.5,48.5,97.0,2024-12-14 05:22:38.000,2024-12-14,2024,12,14,55781,[],()
77429,55751,20991,1,40.99 EUR,2024-10-28T18:24:00,,49.188,49.188,49.19,2024-10-28 18:24:00.000,2024-10-28,2024,10,28,55751,[],()
78079,54296,21578,1,EUR 41,10-September-2025;08:41:30,"Suite 799 7064 Wolff Spring, North Aleen, NJ 17375-7066",49.199999999999996,49.199999999999996,49.2,2025-09-10 08:41:30.000,2025-09-10,2025,9,10,54296,[],()
82620,54710,20971,1,$18¢50," 2-January-2025,05:41:41","4608 Kattie Courts, Grahamshire, NC 47796",1850.0,1850.0,1850.0,2025-01-02 05:41:41.000,2025-01-02,2025,1,2,54710,[],()
77174,53900,21147,2,26.50$, 8-Aug-2024;07:50,,26.5,26.5,53.0,2024-08-08 07:50:00.000,2024-08-08,2024,8,8,53900,[],()
80844,54600,20925,1,$42.25,2024-08-25 09:29:58,,42.25,42.25,42.25,2024-08-25 09:29:58.000,2024-08-25,2024,8,25,54600,[],()
74545,54398,21093,2,$65.75,2024-04-13T12:14:06,,65.75,65.75,131.5,2024-04-13 12:14:06.000,2024-04-13,2024,4,13,54398,[],()
80252,55138,21620,1,15.00$,22:58:15 2024-04-12,NULL,15.0,15.0,15.0,2024-04-12 22:58:15.000,2024-04-12,2024,4,12,55138,[],()
75485,54761,21049,1,72 USD,2024-10-05;07:06:59 am,,72.0,72.0,72.0,2024-10-05 07:06:59.000,2024-10-05,2024,10,5,54761,[],()
76794,54983,21624,1,62.00$,08.06.2025 15:10:10,,62.0,62.0,62.0,2025-08-06 15:10:10.000,2025-08-06,2025,8,6,54983,[],()
75783,53615,21631,1,17$,03:25;2024-11-30,"Suite 804 7505 Haley Ferry, East Preston, TN 30069",17.0,17.0,17.0,2024-11-30 03:25:00.000,2024-11-30,2024,11,30,53615,[],()
78619,55363,21270,1,USD 67.99,06:17:59 P.M. 2024-08-15,,67.99,67.99,67.99,2024-08-15 18:17:59.000,2024-08-15,2024,8,15,55363,[],()
80001,54566,21359,1,$72¢99,19-June-2024;14:23:27,"Suite 341 87521 Schamberger Cove, Langland, AZ 76173-4470",7299.0,7299.0,7299.0,2024-06-19 14:23:27.000,2024-06-19,2024,6,19,54566,[],()
80449,54793,21438,3,61.75 €,27-APR-2025;08:54:15 PM,"5998 Sharleen Prairie, Larsonchester, MS 49894-4055",74.1,74.1,222.3,2025-04-27 20:54:15.000,2025-04-27,2025,4,27,54793,[],()
78351,55221,21025,2,54$50¢,19-Apr-2024;10:54:30 A.M.,,5450.0,5450.0,10900.0,2024-04-19 10:54:30.000,2024-04-19,2024,4,19,55221,[],()
75075,55455,21647,1,70.0 USD,04/16/25;13:31:42,"743 Howe Heights, Collinburgh, NE 39956",70.0,70.0,70.0,2025-04-16 13:31:42.000,2025-04-16,2025,4,16,55455,[],()
82214,53676,21368,3,€27¢99,"22-DEC-2024, 18:49:37",,3358.7999999999997,3358.7999999999997,10076.4,2024-12-22 18:49:37.000,2024-12-22,2024,12,22,53057,[],()
76674,55718,21356,4,14.00USD,2024-08-18T02:00:00,"Suite 279 3180 Mercedez Cove, South Kimiko, MA 58124",14.0,14.0,56.0,2024-08-18 02:00:00.000,2024-08-18,2024,8,18,55718,[],()
74014,53645,21247,1,$52.0,Sun Nov  3 22:11:27 2024,"2405 Bailey Squares, Mariselaside, MT 39925-2890",52.0,52.0,52.0,2024-11-03 22:11:27.000,2024-11-03,2024,11,3,53645,[],()
73780,55212,21524,1,63.0 EUR,"17:57,2024-04-16",NULL,75.6,75.6,75.6,2024-04-16 17:57:00.000,2024-04-16,2024,4,16,55212,[],()
81984,54013,21621,3,€45,"01:44:35 A.M., 2024-08-10","644 Hugh Mills, Mayaside, WV 71225-1346",54.0,54.0,162.0,2024-08-10 01:44:35.000,2024-08-10,2024,8,10,54013,[],()
75730,53906,21636,4,$53.75,09:20:01 pm 2025-03-20,,53.75,53.75,215.0,2025-03-20 21:20:01.000,2025-03-20,2025,3,20,53906,[],()
74284,55012,21150,3,65.50USD,01:14:24 PM;2024-06-16,,65.5,65.5,196.5,2024-06-16 13:14:24.000,2024-06-16,2024,6,16,55012,[],()
78251,53362,21428,1,USD 26.00,00:32 13-Aug-2024,NULL,26.0,26.0,26.0,2024-08-13 00:32:00.000,2024-08-13,2024,8,13,53362,[],()
76500,54490,21101,1,$16¢75,04:13:12;09/12/24,,1675.0,1675.0,1675.0,2024-09-12 04:13:12.000,2024-09-12,2024,9,12,54490,[],()
81502,54395,21149,1,$ 14.0,00:08 06/23/24,,14.0,14.0,14.0,2024-06-23 00:08:00.000,2024-06-23,2024,6,23,54395,[],()
82748,54441,21222,1,75.0 USD,"00:21:36,29-JUN-2024",NULL,75.0,75.0,75.0,2024-06-29 00:21:36.000,2024-06-29,2024,6,29,54441,[],()
78744,53967,21633,1,EUR71.5,2024-05-22T04:18:38.621,NULL,85.8,85.8,85.8,2024-05-22 04:18:38.621,2024-05-22,2024,5,22,53967,[],()
75593,53877,21451,2,64.50 USD,2025-04-02T16:51:19,,64.5,64.5,129.0,2025-04-02 16:51:19.000,2025-04-02,2025,4,2,53877,[],()
82822,55293,21525,1,USD49.0,2024-05-17T19:41:50,,49.0,49.0,49.0,2024-05-17 19:41:50.000,2024-05-17,2024,5,17,55293,[],()
79202,54462,21308,1,63.75 $,01:25:44 P.M. 21-January-2025,"53335 Monnie Grove, Lake Sidney, NV 63739",63.75,63.75,63.75,2025-01-21 13:25:44.000,2025-01-21,2025,1,21,54462,[],()
76641,55222,21183,2,47.5 $,"21:19, 04/17/25",,47.5,47.5,95.0,2025-04-17 21:19:00.000,2025-04-17,2025,4,17,55222,[],()
80516,53109,21074,2,$ 68.0,2025-01-29T10:00:44.266,,68.0,68.0,136.0,2025-01-29 10:00:44.266,2025-01-29,2025,1,29,53109,[],()
79337,54776,21161,3,USD40.50,"09/29/24,23:48",,40.5,40.5,121.5,2024-09-29 23:48:00.000,2024-09-29,2024,9,29,54776,[],()
78721,53723,21116,2,USD38.25,06:24:34 PM 25-Oct-2024,"Suite 697 747 Weber Prairie, Brownport, IA 97443-5809",38.25,38.25,76.5,2024-10-25 18:24:34.000,2024-10-25,2024,10,25,53723,[],()
74968,53133,21369,5,€61¢00,"04/07/25, 17:13",,7320.0,7320.0,36600.0,2025-04-07 17:13:00.000,2025-04-07,2025,4,7,53133,[],()
80694,54357,21636,2,EUR 50.99,11:10:30 AM;05/05/24,,61.188,61.188,122.38,2024-05-05 11:10:30.000,2024-05-05,2024,5,5,54220,[],()
79803,53377,21297,1,$ 68.99,"06:27:12 pm,12/19/24",NULL,68.99,68.99,68.99,2024-12-19 18:27:12.000,2024-12-19,2024,12,19,53377,[],()
79190,54259,21196,2,USD 38,2024-09-24T07:28:52,"Apt. 948 8750 Monahan Street, North Meri, NJ 34137",38.0,38.0,76.0,2024-09-24 07:28:52.000,2024-09-24,2024,9,24,54259,[],()
80144,53957,21128,1,65.00USD,"20:08:43,15-May-2025",,65.0,65.0,65.0,2025-05-15 20:08:43.000,2025-05-15,2025,5,15,53957,[],()
79876,55704,21289,1,USD 46.0,17-February-2025 08:43,NULL,46.0,46.0,46.0,2025-02-17 08:43:00.000,2025-02-17,2025,2,17,55704,[],()
79311,53203,20958,1,$ 30.00,18:05 22-Feb-2025,,30.0,30.0,30.0,2025-02-22 18:05:00.000,2025-02-22,2025,2,22,53203,[],()
74896,54411,21643,1,34.75$,14:04:30; 1-Mar-2025,NULL,34.75,34.75,34.75,2025-03-01 14:04:30.000,2025-03-01,2025,3,1,54411,[],()
76754,55324,21145,1,€ 18.50,2025-06-26T02:46:01.246,,22.2,22.2,22.2,2025-06-26 02:46:01.246,2025-06-26,2025,6,26,55324,[],()
74082,54036,21010,1,47.75EUR,"2025-05-31,08:23:46 pm",,57.3,57.3,57.3,2025-05-31 20:23:46.000,2025-05-31,2025,5,31,54036,[],()
80350,53323,21561,2,26.5 €,"08:20, 2024-10-11",NULL,31.799999999999997,31.799999999999997,63.6,2024-10-11 08:20:00.000,2024-10-11,2024,10,11,53323,[],()
73323,54830,21088,2,USD 55.5,20.10.2024 21:17:17,"Suite 512 36567 Barton Knolls, Bartontown, MN 08666-5957",55.5,55.5,111.0,2024-10-20 21:17:17.000,2024-10-20,2024,10,20,54830,[],()
74413,54034,21116,1,$33.,01:15:03 AM 14-Mar-2024,NULL,33.0,33.0,33.0,2024-03-14 01:15:03.000,2024-03-14,2024,3,14,54034,[],()
78944,54152,21567,1,EUR56.00,"00:31, 2024-06-05",,67.2,67.2,67.2,2024-06-05 00:31:00.000,2024-06-05,2024,6,5,54152,[],()
81706,53766,21370,3,$44¢99,2024-11-03T13:03:43,NULL,4499.0,4499.0,13497.0,2024-11-03 13:03:43.000,2024-11-03,2024,11,3,53766,[],()
74146,53260,21421,1,€ 53.99,2024-12-15T18:30:43,"Apt. 318 874 Dibbert Mountains, Port Lavoniastad, UT 44547-5854",64.788,64.788,64.79,2024-12-15 18:30:43.000,2024-12-15,2024,12,15,53260,[],()
83067,55817,21588,1,47.50 USD,"02/19/25,05:06:36 A.M.",,47.5,47.5,47.5,2025-02-19 05:06:36.000,2025-02-19,2025,2,19,55776,[],()
77447,54142,21035,1,$ 38.75,2024-07-19T15:22:47,"50289 Farrell Shoal, Laraeburgh, ND 79333",38.75,38.75,38.75,2024-07-19 15:22:47.000,2024-07-19,2024,7,19,54142,[],()
73700,54976,20918,2,17.0 USD,"07/20/24, 11:55:53 am",NULL,17.0,17.0,34.0,2024-07-20 11:55:53.000,2024-07-20,2024,7,20,54976,[],()
76000,55753,21634,1,27$00¢,07/04/24 16:15:52,NULL,2700.0,2700.0,2700.0,2024-07-04 16:15:52.000,2024-07-04,2024,7,4,55753,[],()
78736,53628,21404,4,35.00 USD,13-JAN-2025;12:48:41 P.M.,"9228 Bruen Corner, Beerhaven, WV 18752",35.0,35.0,140.0,2025-01-13 12:48:41.000,2025-01-13,2025,1,13,53628,[],()
79724,53998,21295,1,€ 12.25,22.04.2025  2:09:09,,14.7,14.7,14.7,2025-04-22 02:09:09.000,2025-04-22,2025,4,22,53998,[],()
77450,55032,21432,2,EUR74.99,2025-05-19 08:12:58 P.M.,NULL,89.98799999999999,89.98799999999999,179.98,2025-05-19 20:12:58.000,2025-05-19,2025,5,19,53088,[],()
73870,54634,21299,1,$ 22.99,01.10.2024 20:32:32,,22.99,22.99,22.99,2024-01-10 20:32:32.000,2024-01-10,2024,1,10,54634,[],()
80162,53317,21397,1,63$00¢,00:32; 6-Sep-2024,NULL,6300.0,6300.0,6300.0,2024-09-06 00:32:00.000,2024-09-06,2024,9,6,53317,[],()
75056,55329,21472,2,64.5 $,20-Feb-2025 06:21:36,"9756 Nicky Dale, Lake Kris, CA 57637",64.5,64.5,129.0,2025-02-20 06:21:36.000,2025-02-20,2025,2,20,55329,[],()
80324,53971,21457,1,76.$,"21-October-2024,06:37:37","97893 Lamonica Valley, Manteview, SD 24949-2334",76.0,76.0,76.0,2024-10-21 06:37:37.000,2024-10-21,2024,10,21,53971,[],()
81588,53127,21199,1,$ 38.99,19-Jan-2025;12:52:54,NULL,38.99,38.99,38.99,2025-01-19 12:52:54.000,2025-01-19,2025,1,19,53127,[],()
73439,55625,21161,1,EUR 36.00,2025-01-15;08:58:20,"Apt. 222 1034 Forest Common, Beattymouth, NC 50353",43.199999999999996,43.199999999999996,43.2,2025-01-15 08:58:20.000,2025-01-15,2025,1,15,55625,[],()
78388,54213,21195,1,38.0EUR,15-Aug-2025;02:06:09 PM,,45.6,45.6,45.6,2025-08-15 14:06:09.000,2025-08-15,2025,8,15,54213,[],()
76589,53484,20967,2,$36.99,04:11:46;01/28/25,,36.99,36.99,73.98,2025-01-28 04:11:46.000,2025-01-28,2025,1,28,53484,[],()
74009,54803,21474,1,51.5USD,2025-03-21T09:59:03.933,,51.5,51.5,51.5,2025-03-21 09:59:03.933,2025-03-21,2025,3,21,54803,[],()
81205,55127,21569,1,$ 66.25,"2024-04-29, 17:23",NULL,66.25,66.25,66.25,2024-04-29 17:23:00.000,2024-04-29,2024,4,29,55127,[],()
74581,53784,21106,1,USD45.00,19:49:43;11-April-2025,,45.0,45.0,45.0,2025-04-11 19:49:43.000,2025-04-11,2025,4,11,53784,[],()
82347,53790,21347,1,$43¢50,2024-12-01T06:19:32,,4350.0,4350.0,4350.0,2024-12-01 06:19:32.000,2024-12-01,2024,12,1,53790,[],()
81243,53040,21388,1,$ 50.75,03:07:30 11/06/24,NULL,50.75,50.75,50.75,2024-11-06 03:07:30.000,2024-11-06,2024,11,6,53040,[],()
74020,55184,21020,1,60. EUR,2024-07-30T04:34:29.694,,72.0,72.0,72.0,2024-07-30 04:34:29.694,2024-07-30,2024,7,30,55184,[],()
74039,54828,21481,2,$ 22,"10:34:58 PM, 26-August-2025",,22.0,22.0,44.0,2025-08-26 22:34:58.000,2025-08-26,2025,8,26,54828,[],()
78315,53305,21084,2,$74.0,"08/26/24, 05:14",,74.0,74.0,148.0,2024-08-26 05:14:00.000,2024-08-26,2024,8,26,53305,[],()
82740,55197,21427,1,62.$,11:20:20 am 08/20/24,,62.0,62.0,62.0,2024-08-20 11:20:20.000,2024-08-20,2024,8,20,55197,[],()
82496,55542,21219,3,$55¢00,"03:53, 11/21/24",,5500.0,5500.0,16500.0,2024-11-21 03:53:00.000,2024-11-21,2024,11,21,55542,[],()
75356,55673,21563,1,54.5 USD," 8-SEP-2024, 04:22","1146 Porfirio Centers, Torphyside, CO 36145-8816",54.5,54.5,54.5,2024-09-08 04:22:00.000,2024-09-08,2024,9,8,55673,[],()
78101,54003,21348,2,25.00$,"01:58:55 pm,11-NOV-2024","9834 Kuhn Mission, Bechtelarview, MD 32336",25.0,25.0,50.0,2024-11-11 13:58:55.000,2024-11-11,2024,11,11,54003,[],()
75154,55317,21225,1,54.99 EUR,2024-06-15T04:50:59,,65.988,65.988,65.99,2024-06-15 04:50:59.000,2024-06-15,2024,6,15,55317,[],()
80012,54914,21240,1,13. $,11:16;06/21/25,NULL,13.0,13.0,13.0,2025-06-21 11:16:00.000,2025-06-21,2025,6,21,54914,[],()
80362,53491,20988,1,62.0$,"22:38,25-Jun-2025","1955 Dibbert Lakes, Allenport, MD 49091",62.0,62.0,62.0,2025-06-25 22:38:00.000,2025-06-25,2025,6,25,53491,[],()
78575,53495,21480,2,€69.99,23.10.2024 23:39:39,NULL,83.98799999999999,83.98799999999999,167.98,2024-10-23 23:39:39.000,2024-10-23,2024,10,23,53495,[],()
73946,53827,21463,4,USD70.50,2025-05-02T19:53:54.766,,70.5,70.5,282.0,2025-05-02 19:53:54.766,2025-05-02,2025,5,2,53827,[],()
76111,55680,21011,1,37.50€,2024-08-22 09:59:10 AM,NULL,45.0,45.0,45.0,2024-08-22 09:59:10.000,2024-08-22,2024,8,22,55680,[],()
76211,53265,21602,1,67.25$,"2025-04-26,01:13","Apt. 542 5104 Toshiko Causeway, East Malcolmborough, WI 35723",67.25,67.25,67.25,2025-04-26 01:13:00.000,2025-04-26,2025,4,26,53265,[],()
75377,53229,20921,1,€19, 8-May-2025 12:43,,22.8,22.8,22.8,2025-05-08 12:43:00.000,2025-05-08,2025,5,8,53229,[],()
73509,54917,21369,1,USD 57,"06:14,2025-07-31",,57.0,57.0,57.0,2025-07-31 06:14:00.000,2025-07-31,2025,7,31,54917,[],()
78838,54246,21276,2,27.0USD,02/19/25;02:47:40 AM,"8497 Bosco Mills, Reynoldsville, OH 84829",27.0,27.0,54.0,2025-02-19 02:47:40.000,2025-02-19,2025,2,19,54246,[],()
74676,55613,21240,1,18.75 EUR,2024-08-09T18:30:11.459,"Apt. 713 14344 Marcus Radial, North Markus, IL 72955",22.5,22.5,22.5,2024-08-09 18:30:11.459,2024-08-09,2024,8,9,55613,[],()
77313,54669,20978,2,$ 60.00,"02/06/25,08:22:48 pm",,60.0,60.0,120.0,2025-02-06 20:22:48.000,2025-02-06,2025,2,6,54669,[],()
75784,54243,21453,1,70.75USD,"28-OCT-2024,18:30:13",,70.75,70.75,70.75,2024-10-28 18:30:13.000,2024-10-28,2024,10,28,54243,[],()
73618,54591,21015,1,$63¢75,"16:01:38, 8-Sep-2024",,6375.0,6375.0,6375.0,2024-09-08 16:01:38.000,2024-09-08,2024,9,8,54591,[],()
74889,53583,21429,1,$36.50,"2024-08-26, 18:52",,36.5,36.5,36.5,2024-08-26 18:52:00.000,2024-08-26,2024,8,26,53583,[],()
82254,55639,21476,1,USD74,"11/26/24,08:08:23 AM","Suite 784 683 Lean Radial, South Shane, VT 51021-6977",74.0,74.0,74.0,2024-11-26 08:08:23.000,2024-11-26,2024,11,26,55639,[],()
80597,55743,21617,3,USD 22.00,2025-02-27;06:40,NULL,22.0,22.0,66.0,2025-02-27 06:40:00.000,2025-02-27,2025,2,27,55743,[],()
80996,54093,21295,1,15 $,"10:20:39 AM,2024-11-28","47714 Bartell Plains, Port Chasity, CA 80840",15.0,15.0,15.0,2024-11-28 10:20:39.000,2024-11-28,2024,11,28,54093,[],()
76402,53352,21336,1,65.0 USD,2024-09-01T21:34:50,,65.0,65.0,65.0,2024-09-01 21:34:50.000,2024-09-01,2024,9,1,53352,[],()
77660,53337,21130,1,€43.75,05/28/25 08:26:49 am,"Apt. 947 9997 Bartoletti Islands, North Karlyn, ND 83068",52.5,52.5,52.5,2025-05-28 08:26:49.000,2025-05-28,2025,5,28,53337,[],()
82072,55185,21557,1,68.5 EUR,2024-07-17T14:26:17,,82.2,82.2,82.2,2024-07-17 14:26:17.000,2024-07-17,2024,7,17,55185,[],()
80917,54809,20979,1,€68¢25,2024-10-05T15:50:06,"Apt. 313 665 Mariano Via, New Leigh, PA 25408",8190.0,8190.0,8190.0,2024-10-05 15:50:06.000,2024-10-05,2024,10,5,54809,[],()
80643,53107,21211,1,41.5 EUR,"18:45,2024-08-22",,49.8,49.8,49.8,2024-08-22 18:45:00.000,2024-08-22,2024,8,22,53107,[],()
73756,54467,21380,1,36EUR,"2025-01-17, 05:31:16","Suite 366 429 Georgiana Motorway, East Reed, HI 67374-1735",43.199999999999996,43.199999999999996,43.2,2025-01-17 05:31:16.000,2025-01-17,2025,1,17,54467,[],()
81242,55095,21359,1,70.25USD,02:28:24 A.M.;09/12/25,,70.25,70.25,70.25,2025-09-12 02:28:24.000,2025-09-12,2025,9,12,55095,[],()
76253,54726,21471,1,22.50 €,"25-Oct-2024,17:39:56",,27.0,27.0,27.0,2024-10-25 17:39:56.000,2024-10-25,2024,10,25,54726,[],()
74058,53935,21615,1,45.5$,"11:27:04 P.M.,2025-05-09",,45.5,45.5,45.5,2025-05-09 23:27:04.000,2025-05-09,2025,5,9,53935,[],()
82078,54283,21238,1,$59.99,"11:24:05,15-Jan-2025",,59.99,59.99,59.99,2025-01-15 11:24:05.000,2025-01-15,2025,1,15,54283,[],()
80862,55774,21096,2,EUR 73.00,"12/10/24,15:51",,87.6,87.6,175.2,2024-12-10 15:51:00.000,2024-12-10,2024,12,10,55774,[],()
75184,53590,21435,4,53.00 $,23:46;01/09/25,,53.0,53.0,212.0,2025-01-09 23:46:00.000,2025-01-09,2025,1,9,53590,[],()
75523,55803,21362,3,EUR49.5,2025-06-24T09:55:43,"545 Parisian Garden, Kozeychester, KY 16105",59.4,59.4,178.2,2025-06-24 09:55:43.000,2025-06-24,2025,6,24,55803,[],()
81490,54755,21200,4,45.0 $,"12:15:11 pm,2025-01-11",,45.0,45.0,180.0,2025-01-11 12:15:11.000,2025-01-11,2025,1,11,53523,[],()
82091,54864,20937,1,USD 25.75,2024-07-29T07:01:20,,25.75,25.75,25.75,2024-07-29 07:01:20.000,2024-07-29,2024,7,29,54864,[],()
80121,54010,21259,1,23$00¢,25-MAY-2024;06:10:46 pm,,2300.0,2300.0,2300.0,2024-05-25 18:10:46.000,2024-05-25,2024,5,25,54010,[],()
75281,55126,21103,1,64$50¢,17:58:26; 4-Oct-2024,,6450.0,6450.0,6450.0,2024-10-04 17:58:26.000,2024-10-04,2024,10,4,55126,[],()
75235,55226,21212,1,33.00USD,2024-09-07;02:26,,33.0,33.0,33.0,2024-09-07 02:26:00.000,2024-09-07,2024,9,7,55226,[],()
82286,53469,21133,1,66.00 €,22:01:37 25-APR-2025,,79.2,79.2,79.2,2025-04-25 22:01:37.000,2025-04-25,2025,4,25,53469,[],()
73856,53073,21022,1,USD65.50," 5-JUL-2025, 02:37:20 A.M.","6448 West Locks, Port Dick, WA 15968",65.5,65.5,65.5,2025-07-05 02:37:20.000,2025-07-05,2025,7,5,53073,[],()
82625,53809,20965,1,58.99 USD,2024-12-05T02:29:11,,58.99,58.99,58.99,2024-12-05 02:29:11.000,2024-12-05,2024,12,5,53809,[],()
74023,55178,20969,1,20.00$,"06:06:56 A.M.,2025-01-03","68709 Balistreri Divide, Port Chasechester, LA 73077",20.0,20.0,20.0,2025-01-03 06:06:56.000,2025-01-03,2025,1,3,55178,[],()
78762,55227,21055,1,$45.," 3-AUG-2024, 16:32:45","7815 Travis Circles, Port Cassey, VT 82665-3251",45.0,45.0,45.0,2024-08-03 16:32:45.000,2024-08-03,2024,8,3,54234,[],()
81619,55371,20971,5,16.0EUR,2024-05-10;04:51:49,,19.2,19.2,96.0,2024-05-10 04:51:49.000,2024-05-10,2024,5,10,55371,[],()
78356,55130,21227,1,72.5€,01:50:04 pm;2024-11-12,NULL,87.0,87.0,87.0,2024-11-12 13:50:04.000,2024-11-12,2024,11,12,55130,[],()
82945,55217,21546,5,€51.99,2024-11-04;12:06,"Apt. 983 4140 Nienow Terrace, Daronfurt, UT 60950",62.388,62.388,311.94,2024-11-04 12:06:00.000,2024-11-04,2024,11,4,55217,[],()
75230,53606,21023,1,$13.5,2024-08-16T18:23:14.579,"Apt. 722 230 Davis Radial, Heaneyville, FL 87032-1474",13.5,13.5,13.5,2024-08-16 18:23:14.579,2024-08-16,2024,8,16,53606,[],()
79968,53106,21229,1,USD 20.00,03/19/25;22:34,,20.0,20.0,20.0,2025-03-19 22:34:00.000,2025-03-19,2025,3,19,53106,[],()
73475,54523,21582,1,60.75 EUR,18:45:23 2025-03-04,,72.89999999999999,72.89999999999999,72.9,2025-03-04 18:45:23.000,2025-03-04,2025,3,4,54523,[],()
82724,53551,21071,1,55.75€,"23-March-2025, 19:13",,66.89999999999999,66.89999999999999,66.9,2025-03-23 19:13:00.000,2025-03-23,2025,3,23,53551,[],()
74737,55239,21504,3,54.5$,"2024-07-31, 09:52:00 pm",,54.5,54.5,163.5,2024-07-31 21:52:00.000,2024-07-31,2024,7,31,55239,[],()
76875,55168,21147,1,26.25USD,02:16;11/30/24,NULL,26.25,26.25,26.25,2024-11-30 02:16:00.000,2024-11-30,2024,11,30,55168,[],()
79317,54555,21333,3,30.25 USD,11:18 2025-04-27,,30.25,30.25,90.75,2025-04-27 11:18:00.000,2025-04-27,2025,4,27,54555,[],()
79916,55116,20968,1,66.25€,2024-09-18T23:56:52,,79.5,79.5,79.5,2024-09-18 23:56:52.000,2024-09-18,2024,9,18,55116,[],()
74629,54964,21263,1,USD57.5,02:34:46 AM;24-November-2024,,57.5,57.5,57.5,2024-11-24 02:34:46.000,2024-11-24,2024,11,24,54964,[],()
81942,55744,21098,1,67.99$,"2025-04-25, 01:38","776 Zieme Hollow, Terrellbury, WI 83516-7617",67.99,67.99,67.99,2025-04-25 01:38:00.000,2025-04-25,2025,4,25,55744,[],()
75113,53309,20969,5,20.0 USD,"06:46, 7-September-2024",,20.0,20.0,100.0,2024-09-07 06:46:00.000,2024-09-07,2024,9,7,53309,[],()
77069,53522,21179,1,$57.00,2025-01-21T02:27:42,"Apt. 765 139 Julius Cove, Lake Emil, MA 81386-9490",57.0,57.0,57.0,2025-01-21 02:27:42.000,2025-01-21,2025,1,21,53522,[],()
75740,53065,21048,2,$61.75,"02/05/25,00:04","Apt. 152 66777 Timothy Canyon, Ivoryborough, MO 92629",61.75,61.75,123.5,2025-02-05 00:04:00.000,2025-02-05,2025,2,5,53065,[],()
76962,53732,21169,3,62.50 USD,"2024-10-10,01:00:10 P.M.",,62.5,62.5,187.5,2024-10-10 13:00:10.000,2024-10-10,2024,10,10,53732,[],()
76463,54669,21050,1,$13.25,2024-09-15T02:30:59,"Apt. 147 80101 Runte Parkways, Shirleenchester, OK 47065-9696",13.25,13.25,13.25,2024-09-15 02:30:59.000,2024-09-15,2024,9,15,54669,[],()
74992,53230,21397,1,USD 63.0,2025-02-28 15:32:01,NULL,63.0,63.0,63.0,2025-02-28 15:32:01.000,2025-02-28,2025,2,28,53230,[],()
73790,53248,21356,1,15.75USD,2024-10-17T11:21:56.802,"67739 Ankunding Crest, South Cyrusfort, CT 30601",15.75,15.75,15.75,2024-10-17 11:21:56.802,2024-10-17,2024,10,17,53248,[],()
83141,54526,21064,1,€ 38.50,10-AUG-2024 12:53:03 am,NULL,46.199999999999996,46.199999999999996,46.2,2024-08-10 00:53:03.000,2024-08-10,2024,8,10,54526,[],()
81497,54403,21281,2,€ 71.50,"16-Aug-2024, 08:51:35 P.M.",,85.8,85.8,171.6,2024-08-16 20:51:35.000,2024-08-16,2024,8,16,54403,[],()
73489,55613,21635,1,$24.50,06:01:55;20-Apr-2024,,24.5,24.5,24.5,2024-04-20 06:01:55.000,2024-04-20,2024,4,20,55613,[],()
80426,54033,21436,1,$ 35,2024-11-13T17:33:03.789,NULL,35.0,35.0,35.0,2024-11-13 17:33:03.789,2024-11-13,2024,11,13,54033,[],()
81054,54167,21648,1,31.99 EUR,"05:28:09 am, 14-AUG-2024",,38.388,38.388,38.39,2024-08-14 05:28:09.000,2024-08-14,2024,8,14,54167,[],()
73914,54913,21049,1,69.0$,2024-10-12T13:54:10.857,NULL,69.0,69.0,69.0,2024-10-12 13:54:10.857,2024-10-12,2024,10,12,54913,[],()
77042,55286,21485,1,$17¢25,2025-01-19;18:30:37,,1725.0,1725.0,1725.0,2025-01-19 18:30:37.000,2025-01-19,2025,1,19,55286,[],()
79336,54145,21057,1,34.25€,12-Dec-2024 06:43:15 A.M.,NULL,41.1,41.1,41.1,2024-12-12 06:43:15.000,2024-12-12,2024,12,12,54145,[],()
82258,53428,21460,4,$ 30.00,03:34:48 am 2025-03-21,,30.0,30.0,120.0,2025-03-21 03:34:48.000,2025-03-21,2025,3,21,53428,[],()
79790,55829,20931,3,$ 58.75,00:24:49 2024-09-16,,58.75,58.75,176.25,2024-09-16 00:24:49.000,2024-09-16,2024,9,16,55829,[],()
80915,55389,21399,3,68.25 EUR,2025-01-15T12:14:33,NULL,81.89999999999999,81.89999999999999,245.7,2025-01-15 12:14:33.000,2025-01-15,2025,1,15,55389,[],()
81287,54610,21521,1,52.75$,"01/29/25, 22:12:19",NULL,52.75,52.75,52.75,2025-01-29 22:12:19.000,2025-01-29,2025,1,29,54610,[],()
79286,54179,21166,2,47.25 USD,Fri Nov 15 20:36:13 2024,,47.25,47.25,94.5,2024-11-15 20:36:13.000,2024-11-15,2024,11,15,54179,[],()
83033,54882,21096,1,$ 73.75,"2025-01-27, 14:05","Apt. 676 82800 Lesch Vista, Lake Juliusmouth, WY 03114",73.75,73.75,73.75,2025-01-27 14:05:00.000,2025-01-27,2025,1,27,54882,[],()
77110,55442,21326,1,71.0EUR,2024-07-16 13:38,,85.2,85.2,85.2,2024-07-16 13:38:00.000,2024-07-16,2024,7,16,55442,[],()
79673,53955,21151,5,36.99 $,26-Sep-2024;10:13,,36.99,36.99,184.95,2024-09-26 10:13:00.000,2024-09-26,2024,9,26,53955,[],()
75876,54377,21065,1,$ 24.75,2025-05-07T02:00:43,,24.75,24.75,24.75,2025-05-07 02:00:43.000,2025-05-07,2025,5,7,54377,[],()
75059,54563,21195,1,€42¢75,2025-07-07T21:43:01,NULL,5130.0,5130.0,5130.0,2025-07-07 21:43:01.000,2025-07-07,2025,7,7,54563,[],()
79401,54322,21038,2,53.99$,2024-07-10 06:18,,53.99,53.99,107.98,2024-07-10 06:18:00.000,2024-07-10,2024,7,10,54322,[],()
81905,53887,21198,2,$37.0,"23:46:24,02/07/25",,37.0,37.0,74.0,2025-02-07 23:46:24.000,2025-02-07,2025,2,7,53887,[],()
73583,54719,21542,1,USD47.50,"27-JAN-2025,02:37:05",,47.5,47.5,47.5,2025-01-27 02:37:05.000,2025-01-27,2025,1,27,54719,[],()
79166,55193,21233,1,44.50 $,2025-06-15T02:13:53,,44.5,44.5,44.5,2025-06-15 02:13:53.000,2025-06-15,2025,6,15,55193,[],()
77112,55478,21568,1,71.00$,"05/17/24,07:32:31 PM","4772 Reinger Street, Raymundobury, VT 41821-1820",71.0,71.0,71.0,2024-05-17 19:32:31.000,2024-05-17,2024,5,17,55478,[],()
75012,54673,21621,1,44€00¢,2024-07-25 04:15:33,NULL,5280.0,5280.0,5280.0,2024-07-25 04:15:33.000,2024-07-25,2024,7,25,54673,[],()
76531,54525,21204,1,18.75 EUR,"06/19/24,08:52:54 P.M.","Apt. 724 92895 Sam Viaduct, Stammstad, FL 21607-8317",22.5,22.5,22.5,2024-06-19 20:52:54.000,2024-06-19,2024,6,19,54525,[],()
76354,53938,21120,1,$38.00,00:47 2024-10-13,NULL,38.0,38.0,38.0,2024-10-13 00:47:00.000,2024-10-13,2024,10,13,53938,[],()
82353,53554,21599,1,USD16.75,2024-11-02T13:59:43.552,NULL,16.75,16.75,16.75,2024-11-02 13:59:43.552,2024-11-02,2024,11,2,53554,[],()
77081,55333,21266,1,61.75EUR,"19:17,04/04/25",NULL,74.1,74.1,74.1,2025-04-04 19:17:00.000,2025-04-04,2025,4,4,55333,[],()
76143,53129,21441,1,15.75USD,"10:12, 07/02/24","Suite 205 5645 Wyman Ridges, Rauberg, OH 37728-6869",15.75,15.75,15.75,2024-07-02 10:12:00.000,2024-07-02,2024,7,2,53129,[],()
81701,53623,21058,5,USD 49.50,"2024-06-11, 11:56:21 PM",,49.5,49.5,247.5,2024-06-11 23:56:21.000,2024-06-11,2024,6,11,53623,[],()
80596,55379,21415,1,USD 21,"08:44:42 AM, 12-January-2025",,21.0,21.0,21.0,2025-01-12 08:44:42.000,2025-01-12,2025,1,12,55379,[],()
73682,55238,20923,2,30.5 €, 9-Nov-2024;04:05:24 pm,"Suite 677 47815 Lenny Locks, Mirthachester, FL 43993",36.6,36.6,73.2,2024-11-09 16:05:24.000,2024-11-09,2024,11,9,55238,[],()
81042,53431,21331,2,64. $,05:29:47 AM;13-November-2024,,64.0,64.0,128.0,2024-11-13 05:29:47.000,2024-11-13,2024,11,13,53431,[],()
80079,53106,21449,1,68.50$,09:41;2024-04-15,"9097 Hettinger Route, Capriceside, WV 25832",68.5,68.5,68.5,2024-04-15 09:41:00.000,2024-04-15,2024,4,15,53106,[],()
74151,53267,20925,1,USD 45.0,2025-03-03T10:38:47.138,,45.0,45.0,45.0,2025-03-03 10:38:47.138,2025-03-03,2025,3,3,53267,[],()
74584,55179,21244,1,14.75 USD,"02:55,2025-05-10",NULL,14.75,14.75,14.75,2025-05-10 02:55:00.000,2025-05-10,2025,5,10,55179,[],()
81848,54026,20941,3,24.0 $,2024-11-18T11:34:47.516,NULL,24.0,24.0,72.0,2024-11-18 11:34:47.516,2024-11-18,2024,11,18,54026,[],()
77024,54760,21109,2,58.0EUR,"00:03:39, 20-October-2024","437 Octavio Pass, Port Ayako, HI 04526",69.6,69.6,139.2,2024-10-20 00:03:39.000,2024-10-20,2024,10,20,54760,[],()
80223,53222,21225,2,$ 55.75,03/21/25;12:12:55 A.M.,,55.75,55.75,111.5,2025-03-21 00:12:55.000,2025-03-21,2025,3,21,53222,[],()
81599,53551,21358,1,41.50 EUR,"22:11,2024-09-14",NULL,49.8,49.8,49.8,2024-09-14 22:11:00.000,2024-09-14,2024,9,14,53551,[],()
79779,54862,21601,1,31.25 €,11/15/24 16:13:49,,37.5,37.5,37.5,2024-11-15 16:13:49.000,2024-11-15,2024,11,15,54862,[],()
76355,54146,21557,1,USD67.,06/12/24 09:49:04 pm,,67.0,67.0,67.0,2024-06-12 21:49:04.000,2024-06-12,2024,6,12,54146,[],()
78871,54007,21327,1,73.75USD,2025-01-05T21:15:57,NULL,73.75,73.75,73.75,2025-01-05 21:15:57.000,2025-01-05,2025,1,5,54007,[],()
80818,55101,21430,5,29.0USD,"2025-01-09, 00:40:05",,29.0,29.0,145.0,2025-01-09 00:40:05.000,2025-01-09,2025,1,9,55101,[],()
78157,53531,21422,1,€24.99,22:43;22-Feb-2025,,29.987999999999996,29.987999999999996,29.99,2025-02-22 22:43:00.000,2025-02-22,2025,2,22,53531,[],()
78213,53963,21500,1,71.00 USD," 9-SEP-2024, 06:37:56",NULL,71.0,71.0,71.0,2024-09-09 06:37:56.000,2024-09-09,2024,9,9,53963,[],()
81040,53953,21011,1,34.50EUR,"09:33:44 A.M., 28-May-2025",,41.4,41.4,41.4,2025-05-28 09:33:44.000,2025-05-28,2025,5,28,53953,[],()
74221,53870,20951,1,59$75¢,2024-05-24 20:56:38,"Suite 804 504 Synthia Lodge, West Jeana, RI 19222",5975.0,5975.0,5975.0,2024-05-24 20:56:38.000,2024-05-24,2024,5,24,55678,[],()
77594,54628,21505,1,USD30.00,2024-11-19T17:52:43.493,"Suite 374 3411 Ullrich Square, South Kirstinfurt, MA 75491-3784",30.0,30.0,30.0,2024-11-19 17:52:43.493,2024-11-19,2024,11,19,54628,[],()
73917,54871,21489,1,60$,"28-November-2024,17:02:16","Apt. 115 174 Dana Key, West Nadabury, ID 20666-2471",60.0,60.0,60.0,2024-11-28 17:02:16.000,2024-11-28,2024,11,28,54871,[],()
76826,54685,21262,1,EUR 35.5,2024-08-12T21:25:07,"Suite 853 582 Schmeler Camp, Lake Nestor, NJ 94596",42.6,42.6,42.6,2024-08-12 21:25:07.000,2024-08-12,2024,8,12,54685,[],()
82426,55212,21305,1,USD45.00,04:15:11 PM; 9-Nov-2024,,45.0,45.0,45.0,2024-11-09 16:15:11.000,2024-11-09,2024,11,9,55212,[],()
80543,54387,21526,1,USD 24.50,"14:20:52,2025-02-03",NULL,24.5,24.5,24.5,2025-02-03 14:20:52.000,2025-02-03,2025,2,3,54387,[],()
80879,55769,21377,1,$ 53.99,"20-October-2024,10:06",NULL,53.99,53.99,53.99,2024-10-20 10:06:00.000,2024-10-20,2024,10,20,55769,[],()
81609,54034,21326,1,USD 75.50,"2024-07-24,06:14",,75.5,75.5,75.5,2024-07-24 06:14:00.000,2024-07-24,2024,7,24,54034,[],()
79948,54965,21146,1,EUR 46.75,03:47:00 AM 09/26/24,"959 Kiehn Lane, West Cleotilde, CA 51390",56.1,56.1,56.1,2024-09-26 03:47:00.000,2024-09-26,2024,9,26,55251,[],()
77879,54671,21223,1,USD 68.0,"19:36,02/10/25",,68.0,68.0,68.0,2025-02-10 19:36:00.000,2025-02-10,2025,2,10,54671,[],()
75934,55384,20928,1,20.5$,"08:41:02 PM,14-Oct-2024",,20.5,20.5,20.5,2024-10-14 20:41:02.000,2024-10-14,2024,10,14,55384,[],()
80920,54925,21387,1,$17.5,03/06/25;01:30:44 A.M.,,17.5,17.5,17.5,2025-03-06 01:30:44.000,2025-03-06,2025,3,6,54925,[],()
80771,54230,21166,1,EUR47.75,"06:00:31, 10-December-2024",NULL,57.3,57.3,57.3,2024-12-10 06:00:31.000,2024-12-10,2024,12,10,54230,[],()
79940,54745,21368,1,€ 22.75,"13-OCT-2024, 11:36:16",,27.3,27.3,27.3,2024-10-13 11:36:16.000,2024-10-13,2024,10,13,54380,[],()
76655,55192,20975,1,69.25€," 9-August-2024,05:56","Apt. 142 6277 Marcelino Unions, Faheyhaven, OR 42296",83.1,83.1,83.1,2024-08-09 05:56:00.000,2024-08-09,2024,8,9,55192,[],()
80107,53187,21297,1,70.$,15:43:28;2024-08-14,,70.0,70.0,70.0,2024-08-14 15:43:28.000,2024-08-14,2024,8,14,53187,[],()
76280,55402,21027,5,$28.00," 2-AUG-2024, 03:03:36 P.M.","39608 Kozey Trace, Mitchborough, GA 80635",28.0,28.0,140.0,2024-08-02 15:03:36.000,2024-08-02,2024,8,2,55402,[],()
75104,55529,21210,5,21.5$,2024-09-02T11:33:42.016,,21.5,21.5,107.5,2024-09-02 11:33:42.016,2024-09-02,2024,9,2,55529,[],()
82812,54944,21576,1,USD50.0,15.03.2025 02:07:07,NULL,50.0,50.0,50.0,2025-03-15 02:07:07.000,2025-03-15,2025,3,15,54944,[],()
81909,54433,21546,2,EUR 48.99,29-Dec-2024 05:36,,58.788,58.788,117.58,2024-12-29 05:36:00.000,2024-12-29,2024,12,29,54433,[],()
73654,54334,21517,3,$ 67.0,"16-February-2025,08:26",,67.0,67.0,201.0,2025-02-16 08:26:00.000,2025-02-16,2025,2,16,54334,[],()
82398,55260,20995,1,54$50¢,10/30/24;11:40:37,,5450.0,5450.0,5450.0,2024-10-30 11:40:37.000,2024-10-30,2024,10,30,53047,[],()
74834,54097,21025,1,51.5 EUR,2024-11-25T10:25:37,,61.8,61.8,61.8,2024-11-25 10:25:37.000,2024-11-25,2024,11,25,54097,[],()
76565,55698,21133,5,€ 67.99,"07:39:35,05/13/25","Apt. 552 47051 Marissa Mountains, West Margo, ND 41032-4325",81.588,81.588,407.94,2025-05-13 07:39:35.000,2025-05-13,2025,5,13,55698,[],()
78425,55337,21498,1,19.50EUR," 6-Jan-2025,10:26","444 Ward Route, West Jarod, NV 11106-9171",23.4,23.4,23.4,2025-01-06 10:26:00.000,2025-01-06,2025,1,6,55337,[],()
81478,54957,21087,1,27.75 EUR,"06/09/25, 06:54:39",NULL,33.3,33.3,33.3,2025-06-09 06:54:39.000,2025-06-09,2025,6,9,54957,[],()
80085,55778,21364,1,64.25USD,"10/11/24, 01:46:17",,64.25,64.25,64.25,2024-10-11 01:46:17.000,2024-10-11,2024,10,11,55778,[],()
74352,54989,21061,1,EUR44.25,2024-07-30;05:47:37 PM,"Apt. 492 38951 Palma Plaza, Port Kimberleychester, WA 12007",53.1,53.1,53.1,2024-07-30 17:47:37.000,2024-07-30,2024,7,30,54989,[],()
76715,54852,21351,3,€ 53.00,"2024-12-08, 09:51:58",NULL,63.599999999999994,63.599999999999994,190.8,2024-12-08 09:51:58.000,2024-12-08,2024,12,8,54852,[],()
77336,54889,21184,1,68.75EUR,"07/20/24,20:39:22","Suite 824 104 Jaime Village, Marlonland, NH 68094",82.5,82.5,82.5,2024-07-20 20:39:22.000,2024-07-20,2024,7,20,54889,[],()
73473,55219,20938,1,26.75 EUR,01:19:09 pm;16-Aug-2024,,32.1,32.1,32.1,2024-08-16 13:19:09.000,2024-08-16,2024,8,16,55219,[],()
80190,54141,21645,2,52.0USD,25-Dec-2024;06:24,"Suite 155 12862 Rory Bypass, West Larrytown, PA 96255",52.0,52.0,104.0,2024-12-25 06:24:00.000,2024-12-25,2024,12,25,54141,[],()
79882,53311,21495,4,USD 24.75,08:45:18 pm 12-Jan-2025,,24.75,24.75,99.0,2025-01-12 20:45:18.000,2025-01-12,2025,1,12,53311,[],()
76234,53996,21280,1,USD20,2025-03-08T19:34:40.845,NULL,20.0,20.0,20.0,2025-03-08 19:34:40.845,2025-03-08,2025,3,8,53996,[],()
74109,53930,20944,3,$ 33.50,"18-Feb-2025,07:33:12",NULL,33.5,33.5,100.5,2025-02-18 07:33:12.000,2025-02-18,2025,2,18,53930,[],()
81718,53382,21070,1,USD26.99,"11/12/24,09:38","Apt. 296 374 Volkman Loop, Lake Sammy, HI 34306-6223",26.99,26.99,26.99,2024-11-12 09:38:00.000,2024-11-12,2024,11,12,53382,[],()
79374,55389,20919,5,€ 71.99,2025-01-20T13:56:20,"Apt. 639 5318 Lehner Skyway, Cormierland, MO 82049-5936",86.38799999999999,86.38799999999999,431.94,2025-01-20 13:56:20.000,2025-01-20,2025,1,20,55389,[],()
79952,55407,20956,1,64.50 €,03:06:44 2025-08-03,,77.39999999999999,77.39999999999999,77.4,2025-08-03 03:06:44.000,2025-08-03,2025,8,3,55407,[],()
80600,53961,21605,1,22.5USD,2024-05-29 05:07:34,,22.5,22.5,22.5,2024-05-29 05:07:34.000,2024-05-29,2024,5,29,53961,[],()
80205,55017,21475,1,€37.00,2024-05-07T09:29:55.842,"26964 Stark Springs, North Neville, CT 84058",44.4,44.4,44.4,2024-05-07 09:29:55.842,2024-05-07,2024,5,7,55017,[],()
77475,55512,21359,1,74.75USD,18:49;2024-04-26,NULL,74.75,74.75,74.75,2024-04-26 18:49:00.000,2024-04-26,2024,4,26,55512,[],()
75996,53660,20953,1,47.0 $,"01:03, 2025-03-26","Apt. 693 9831 George Streets, East Sharenburgh, CO 50970-1557",47.0,47.0,47.0,2025-03-26 01:03:00.000,2025-03-26,2025,3,26,53660,[],()
80457,53330,20947,1,25.00 €,"2024-07-03, 14:58:11",,30.0,30.0,30.0,2024-07-03 14:58:11.000,2024-07-03,2024,7,3,53330,[],()
79148,55583,21359,1,72.75USD,"12/02/24,20:15:23",,72.75,72.75,72.75,2024-12-02 20:15:23.000,2024-12-02,2024,12,2,55583,[],()
81511,54307,21140,1,71.0USD,"11:54:21, 2025-02-09","16402 Ingrid Forge, East Elizbeth, SC 75429",71.0,71.0,71.0,2025-02-09 11:54:21.000,2025-02-09,2025,2,9,54307,[],()
81788,53228,21260,1,USD 55.00,14:54:06 08/31/24,,55.0,55.0,55.0,2024-08-31 14:54:06.000,2024-08-31,2024,8,31,53228,[],()
76768,53848,21187,1,66.00USD,"01:21, 3-FEB-2025","Apt. 799 88318 Haag Mission, Port Cheryll, SC 33429",66.0,66.0,66.0,2025-02-03 01:21:00.000,2025-02-03,2025,2,3,53848,[],()
74716,55353,21610,1,44.75$,"2024-10-19, 09:11:09 P.M.",,44.75,44.75,44.75,2024-10-19 21:11:09.000,2024-10-19,2024,10,19,55353,[],()
81316,54578,21614,1,€ 73.0, 7-Jan-2025;15:42:26,NULL,87.6,87.6,87.6,2025-01-07 15:42:26.000,2025-01-07,2025,1,7,54578,[],()
77672,55386,21630,1,54.25$,2024-06-27T18:54:32,"Apt. 195 9523 Quitzon Islands, South Tyron, IA 53378-2848",54.25,54.25,54.25,2024-06-27 18:54:32.000,2024-06-27,2024,6,27,55386,[],()
83076,54459,21573,1,$ 22.00,2024-05-22T18:24:07,,22.0,22.0,22.0,2024-05-22 18:24:07.000,2024-05-22,2024,5,22,54459,[],()
75024,54154,21286,1,35.USD,08:58:27;2024-08-17,"387 Tien Land, East Arlettafort, MA 52941-6883",35.0,35.0,35.0,2024-08-17 08:58:27.000,2024-08-17,2024,8,17,54154,[],()
80670,53268,21132,1,$ 19.50,11-August-2024;21:11:06,"548 Laraine Cape, New Candida, WY 46707",19.5,19.5,19.5,2024-08-11 21:11:06.000,2024-08-11,2024,8,11,53268,[],()
82342,53561,21118,1,€ 46.00,"03:11:47 am,09/15/24",,55.199999999999996,55.199999999999996,55.2,2024-09-15 03:11:47.000,2024-09-15,2024,9,15,53561,[],()
75005,53287,21423,1,71.0USD,22:33 15-Feb-2025,,71.0,71.0,71.0,2025-02-15 22:33:00.000,2025-02-15,2025,2,15,53287,[],()
77172,54817,20919,1,$70.00,"07:40:13 pm, 07/12/24",,70.0,70.0,70.0,2024-07-12 19:40:13.000,2024-07-12,2024,7,12,54817,[],()
78189,54893,21098,1,$62.5,"05:41:47 AM,01/27/25",,62.5,62.5,62.5,2025-01-27 05:41:47.000,2025-01-27,2025,1,27,54893,[],()
75442,53260,21566,1,€48¢25,12:12:18 pm;03/06/25,,5790.0,5790.0,5790.0,2025-03-06 12:12:18.000,2025-03-06,2025,3,6,53260,[],()
78530,54989,21343,1,19.50EUR,03/10/25;09:17:07,,23.4,23.4,23.4,2025-03-10 09:17:07.000,2025-03-10,2025,3,10,54989,[],()
75448,55562,21137,1,42.99 $,"12:43:09 AM, 2025-01-04",NULL,42.99,42.99,42.99,2025-01-04 00:43:09.000,2025-01-04,2025,1,4,55562,[],()
82237,55805,21073,1,39.0 $,2025-03-03T11:16:22.638,,39.0,39.0,39.0,2025-03-03 11:16:22.638,2025-03-03,2025,3,3,55805,[],()
81862,53697,21618,2,$ 41.75,"13:19:59,29-December-2024",,41.75,41.75,83.5,2024-12-29 13:19:59.000,2024-12-29,2024,12,29,53697,[],()
77023,54322,21347,1,43.5 $,2025-01-12T22:26:07,,43.5,43.5,43.5,2025-01-12 22:26:07.000,2025-01-12,2025,1,12,54322,[],()
75326,54429,20979,1,71€50¢,"30-JUL-2024, 05:26:47 PM",,8580.0,8580.0,8580.0,2024-07-30 17:26:47.000,2024-07-30,2024,7,30,54429,[],()
75634,55533,21306,2,USD 36,2025-01-22T04:50:48,NULL,36.0,36.0,72.0,2025-01-22 04:50:48.000,2025-01-22,2025,1,22,55533,[],()
80276,55053,21611,1,61.75 EUR,2024-09-27 11:23:03 AM,,74.1,74.1,74.1,2024-09-27 11:23:03.000,2024-09-27,2024,9,27,55053,[],()
78589,54338,21005,1,€18.99,25.11.2024 20:55:55,"26314 D'Amore Lodge, Lake Tiaraburgh, SD 89843-7840",22.787999999999997,22.787999999999997,22.79,2024-11-25 20:55:55.000,2024-11-25,2024,11,25,54338,[],()
81489,53649,20952,1,€39.5,13:24:42;20-MAR-2025,NULL,47.4,47.4,47.4,2025-03-20 13:24:42.000,2025-03-20,2025,3,20,53649,[],()
78579,55170,21146,1,49.00$," 3-Oct-2024,22:19:21",,49.0,49.0,49.0,2024-10-03 22:19:21.000,2024-10-03,2024,10,3,55170,[],()
78731,54821,21471,2,23.5$,"2024-11-22, 09:15:05 P.M.",,23.5,23.5,47.0,2024-11-22 21:15:05.000,2024-11-22,2024,11,22,54821,[],()
78456,54249,21013,2,$42¢75,09/12/25 04:29,"Apt. 956 92174 Yolanda Branch, New Zackary, AK 15715",4275.0,4275.0,8550.0,2025-09-12 04:29:00.000,2025-09-12,2025,9,12,54249,[],()
82467,53052,20964,2,73.99 USD,17.10.2024 14:31:31,NULL,73.99,73.99,147.98,2024-10-17 14:31:31.000,2024-10-17,2024,10,17,53052,[],()
81133,55626,21459,2,EUR 20.0,"12/09/24, 10:21",,24.0,24.0,48.0,2024-12-09 10:21:00.000,2024-12-09,2024,12,9,55626,[],()
81069,53967,21572,1,$26¢50,03:02:31 16-August-2024,,2650.0,2650.0,2650.0,2024-08-16 03:02:31.000,2024-08-16,2024,8,16,53967,[],()
76952,55775,21522,1,52.00 USD,18:42:14;08/18/24,,52.0,52.0,52.0,2024-08-18 18:42:14.000,2024-08-18,2024,8,18,55775,[],()
78296,55591,21552,1,33.99 USD,"02:05,2025-02-20",,33.99,33.99,33.99,2025-02-20 02:05:00.000,2025-02-20,2025,2,20,55591,[],()
77432,53630,20924,5,$63.75,2025-06-23 13:44:34,NULL,63.75,63.75,318.75,2025-06-23 13:44:34.000,2025-06-23,2025,6,23,53630,[],()
73886,55367,21227,1,68.5USD,"06:20:28,15-October-2024","Suite 455 160 Chantay Summit, New Bryan, MI 50593-0792",68.5,68.5,68.5,2024-10-15 06:20:28.000,2024-10-15,2024,10,15,55367,[],()
82595,55040,21373,2,23.99USD,"21-Nov-2024, 11:53:06 am",NULL,23.99,23.99,47.98,2024-11-21 11:53:06.000,2024-11-21,2024,11,21,55040,[],()
77218,53299,21292,1,EUR41.25,02/07/25 07:58,"836 Aleida Square, West Margarito, NV 12265",49.5,49.5,49.5,2025-02-07 07:58:00.000,2025-02-07,2025,2,7,53299,[],()
81033,53762,21375,1,USD 32.99,16:54:47;05/16/24,NULL,32.99,32.99,32.99,2024-05-16 16:54:47.000,2024-05-16,2024,5,16,53762,[],()
79566,55142,21509,2,USD 16,2024-03-02T22:29:10.470,NULL,16.0,16.0,32.0,2024-03-02 22:29:10.470,2024-03-02,2024,3,2,55142,[],()
75481,55763,21432,3,72.5 USD,"17:00,  9-Mar-2025","Suite 952 230 Junie Passage, West Christian, AL 01164-2052",72.5,72.5,217.5,2025-03-09 17:00:00.000,2025-03-09,2025,3,9,55763,[],()
82905,54195,21636,1,53.0 $,10-NOV-2024;01:00:45,"20761 Shayla Route, Linneachester, RI 17074",53.0,53.0,53.0,2024-11-10 01:00:45.000,2024-11-10,2024,11,10,54195,[],()
74358,53062,21515,1,74.75USD,03:03;31-JAN-2025,NULL,74.75,74.75,74.75,2025-01-31 03:03:00.000,2025-01-31,2025,1,31,53072,[],()
82197,55183,21534,1,EUR 26.00, 5.06.2024 19:49:49,NULL,31.2,31.2,31.2,2024-05-06 19:49:49.000,2024-05-06,2024,5,6,55183,[],()
81393,54668,21256,1,58.99$," 4-Feb-2025,06:52",,58.99,58.99,58.99,2025-02-04 06:52:00.000,2025-02-04,2025,2,4,54668,[],()
79410,55673,21122,1,62.25 EUR,26-August-2024;23:23,,74.7,74.7,74.7,2024-08-26 23:23:00.000,2024-08-26,2024,8,26,55673,[],()
78682,53811,21315,5,64.75USD,"13:03,07/18/25",,64.75,64.75,323.75,2025-07-18 13:03:00.000,2025-07-18,2025,7,18,53811,[],()
77730,53881,21240,3,$14¢25,12-Apr-2025;21:39,,1425.0,1425.0,4275.0,2025-04-12 21:39:00.000,2025-04-12,2025,4,12,53881,[],()
77710,53746,21481,1,$20.5,2024-11-20T05:07:10.812,NULL,20.5,20.5,20.5,2024-11-20 05:07:10.812,2024-11-20,2024,11,20,53746,[],()
77773,55480,21293,2,€ 57,11:30:45 2025-01-16,NULL,68.39999999999999,68.39999999999999,136.8,2025-01-16 11:30:45.000,2025-01-16,2025,1,16,55480,[],()
73963,53365,21280,3,20.00 USD,"12/14/24,07:52:15 P.M.",,20.0,20.0,60.0,2024-12-14 19:52:15.000,2024-12-14,2024,12,14,53365,[],()
82146,54868,21484,3,€57.25,2025-01-24T03:41:53,NULL,68.7,68.7,206.1,2025-01-24 03:41:53.000,2025-01-24,2025,1,24,53394,[],()
77499,55058,21072,3,70.50EUR,"07/22/24, 18:59:28",NULL,84.6,84.6,253.8,2024-07-22 18:59:28.000,2024-07-22,2024,7,22,53583,[],()
75416,55614,21393,1,43.99USD,2025-05-14T21:26:30,,43.99,43.99,43.99,2025-05-14 21:26:30.000,2025-05-14,2025,5,14,55614,[],()
74976,55408,21467,1,48.0 €,03/31/25 16:34,"Suite 139 9328 Grimes Crest, East Abe, OH 92900",57.599999999999994,57.599999999999994,57.6,2025-03-31 16:34:00.000,2025-03-31,2025,3,31,55059,[],()
75745,55553,21420,2,64.00EUR,2025-05-26T02:34:58.237,,76.8,76.8,153.6,2025-05-26 02:34:58.237,2025-05-26,2025,5,26,55553,[],()
80200,55366,20962,1,EUR 68.,15-November-2024;18:11:28,,81.6,81.6,81.6,2024-11-15 18:11:28.000,2024-11-15,2024,11,15,53102,[],()
76071,53551,21470,3,USD71.25,2024-07-10T14:01:34.755,,71.25,71.25,213.75,2024-07-10 14:01:34.755,2024-07-10,2024,7,10,53551,[],()
81632,54650,21474,1,€52¢75,"09/03/24,05:24:35 pm",NULL,6330.0,6330.0,6330.0,2024-09-03 17:24:35.000,2024-09-03,2024,9,3,53784,[],()
80267,54438,21437,1,65.75 $,"2024-06-09,11:16:42 PM",,65.75,65.75,65.75,2024-06-09 23:16:42.000,2024-06-09,2024,6,9,54438,[],()
78866,53889,21632,4,EUR 21.50,"14:45, 22-December-2024",NULL,25.8,25.8,103.2,2024-12-22 14:45:00.000,2024-12-22,2024,12,22,53889,[],()
74349,55451,21013,1,$ 40.25,"17:17, 06/22/24",,40.25,40.25,40.25,2024-06-22 17:17:00.000,2024-06-22,2024,6,22,55451,[],()
79192,54107,21204,2,USD 20.,2024-08-20T03:36:51,,20.0,20.0,40.0,2024-08-20 03:36:51.000,2024-08-20,2024,8,20,54107,[],()
79256,54623,21172,1,€16.5,16:20;11-Apr-2025,NULL,19.8,19.8,19.8,2025-04-11 16:20:00.000,2025-04-11,2025,4,11,54623,[],()
74144,55821,21021,1,$42.50,"06:41:24, 18-JUN-2024","Apt. 782 8699 Kris Via, Heathcoteborough, HI 65619-0672",42.5,42.5,42.5,2024-06-18 06:41:24.000,2024-06-18,2024,6,18,55821,[],()
75034,54721,21231,1,71.00$,"23-July-2024, 07:26","Apt. 987 6044 Jaskolski Curve, Auershire, MO 12984-0414",71.0,71.0,71.0,2024-07-23 07:26:00.000,2024-07-23,2024,7,23,54721,[],()
76459,53886,21007,1,31.75 USD,03:48:12 pm 12-Jan-2025,"687 Deloise Overpass, East Aleen, WA 57226-2094",31.75,31.75,31.75,2025-01-12 15:48:12.000,2025-01-12,2025,1,12,53886,[],()
77102,55243,21308,1,USD 61.25,2024-11-02T02:21:55.471,"Suite 111 72920 Weldon Motorway, North Lyndsay, DE 39837-2172",61.25,61.25,61.25,2024-11-02 02:21:55.471,2024-11-02,2024,11,2,55243,[],()
73891,55625,21015,1,$63¢75,"18:47:48, 2024-09-06",,6375.0,6375.0,6375.0,2024-09-06 18:47:48.000,2024-09-06,2024,9,6,55625,[],()
79909,53429,21097,4,14.99$,"09/08/24,10:02:42 PM","2031 Gerhold Curve, Haaghaven, DE 40876",14.99,14.99,59.96,2024-09-08 22:02:42.000,2024-09-08,2024,9,8,53429,[],()
76043,54907,21406,1,$53¢75," 5-April-2025,10:25:31 A.M.",NULL,5375.0,5375.0,5375.0,2025-04-05 10:25:31.000,2025-04-05,2025,4,5,54907,[],()
80721,54438,21017,2,EUR 59.,2025-01-07T17:26:09,,70.8,70.8,141.6,2025-01-07 17:26:09.000,2025-01-07,2025,1,7,54438,[],()
75800,55340,21061,1,EUR46.50,"21:21:57, 21-Mar-2025",NULL,55.8,55.8,55.8,2025-03-21 21:21:57.000,2025-03-21,2025,3,21,55340,[],()
73822,53267,20924,1,$68.25,"2024-12-06,18:53",NULL,68.25,68.25,68.25,2024-12-06 18:53:00.000,2024-12-06,2024,12,6,53267,[],()
76824,55649,21209,2,47$25¢,17:29 2024-12-28,,4725.0,4725.0,9450.0,2024-12-28 17:29:00.000,2024-12-28,2024,12,28,55649,[],()
82172,54951,21217,1,31.75USD,2024-06-16;14:10,"52499 Lonny Drive, New Margrett, DE 05760",31.75,31.75,31.75,2024-06-16 14:10:00.000,2024-06-16,2024,6,16,54951,[],()
76225,53805,21241,2,20 USD,2025-01-24T11:10:57.839,"58820 Zboncak Unions, Sylvieside, NE 78587-3949",20.0,20.0,40.0,2025-01-24 11:10:57.839,2025-01-24,2025,1,24,53805,[],()
82434,55491,20976,2,51.75USD,14:36 26-MAR-2025,"991 Yundt Vista, East Kenishaborough, IN 90420-5741",51.75,51.75,103.5,2025-03-26 14:36:00.000,2025-03-26,2025,3,26,55491,[],()
74595,53706,21450,1,€52.0,08/01/24;00:13,,62.4,62.4,62.4,2024-08-01 00:13:00.000,2024-08-01,2024,8,1,53706,[],()
82755,53894,21451,1,USD 59.25,07/30/24;15:54,"Suite 579 731 Margret Gardens, Pedroville, NY 81212",59.25,59.25,59.25,2024-07-30 15:54:00.000,2024-07-30,2024,7,30,53894,[],()
81970,55007,21406,1,€ 57.5,"06:22:12 am,2025-05-13",,69.0,69.0,69.0,2025-05-13 06:22:12.000,2025-05-13,2025,5,13,55007,[],()
76814,55162,21488,1,24. €,04:43:17;07/02/25,,28.799999999999997,28.799999999999997,28.8,2025-07-02 04:43:17.000,2025-07-02,2025,7,2,55162,[],()
81307,53452,21556,1,€24¢50,2025-02-13T07:18:02,NULL,2940.0,2940.0,2940.0,2025-02-13 07:18:02.000,2025-02-13,2025,2,13,53452,[],()
78761,53030,21249,1,69.50 $,"12-SEP-2024, 05:29:16 pm",,69.5,69.5,69.5,2024-09-12 17:29:16.000,2024-09-12,2024,9,12,53030,[],()
82944,54260,21341,1,€48¢25,"16:19:51,10/16/24","Suite 804 19298 Sang Station, Abbottfurt, IL 38455",5790.0,5790.0,5790.0,2024-10-16 16:19:51.000,2024-10-16,2024,10,16,54260,[],()
77540,53346,20944,3,34$00¢,04:15:36 pm 2025-01-11,,3400.0,3400.0,10200.0,2025-01-11 16:15:36.000,2025-01-11,2025,1,11,53346,[],()
76797,55552,21255,1,USD38,"07:13:36,  1-AUG-2024","67880 Federico Trail, McCulloughborough, NV 93479-8341",38.0,38.0,38.0,2024-08-01 07:13:36.000,2024-08-01,2024,8,1,55552,[],()
74298,53321,21272,1,64.75$,2024-06-13T10:19:43.434,,64.75,64.75,64.75,2024-06-13 10:19:43.434,2024-06-13,2024,6,13,53321,[],()
78691,53368,21399,1,EUR66.50,"2025-03-07,21:52:26",NULL,79.8,79.8,79.8,2025-03-07 21:52:26.000,2025-03-07,2025,3,7,53368,[],()
75599,55249,21428,1,29.25€,07:06:12 2024-10-29,,35.1,35.1,35.1,2024-10-29 07:06:12.000,2024-10-29,2024,10,29,55249,[],()
79934,54149,21307,1,$ 65.,06/12/25 03:36:12 am,,65.0,65.0,65.0,2025-06-12 03:36:12.000,2025-06-12,2025,6,12,54149,[],()
78409,53186,21461,1,USD 46.75,07:55:11 am; 4-Sep-2024,,46.75,46.75,46.75,2024-09-04 07:55:11.000,2024-09-04,2024,9,4,53186,[],()
75881,53498,21282,1,59.00 €,21:37:28;02/03/25,,70.8,70.8,70.8,2025-02-03 21:37:28.000,2025-02-03,2025,2,3,53498,[],()
73818,55730,21293,1,60USD,2024-07-09T09:53:04.220,NULL,60.0,60.0,60.0,2024-07-09 09:53:04.220,2024-07-09,2024,7,9,55730,[],()
76850,54435,21364,1,USD 66.5,"17:19:57,26-Nov-2024",,66.5,66.5,66.5,2024-11-26 17:19:57.000,2024-11-26,2024,11,26,54435,[],()
77433,54975,20996,2,45.5 €,"03:27,  7-Oct-2024",,54.6,54.6,109.2,2024-10-07 03:27:00.000,2024-10-07,2024,10,7,54975,[],()
81220,54023,21349,1,$61.0,2024-10-12T04:59:26.512,,61.0,61.0,61.0,2024-10-12 04:59:26.512,2024-10-12,2024,10,12,54023,[],()
77981,53199,21518,2,EUR51.0,03:16:46;2024-10-04,"Apt. 820 12444 Emmy Square, Vonmouth, AL 15847-1536",61.199999999999996,61.199999999999996,122.4,2024-10-04 03:16:46.000,2024-10-04,2024,10,4,53199,[],()
76648,54459,21509,2,15.00 USD,2024-11-24 17:50,"19988 Marielle Rapids, Port Lynneberg, IN 57310",15.0,15.0,30.0,2024-11-24 17:50:00.000,2024-11-24,2024,11,24,54459,[],()
79339,55180,21002,1,38.75$,2025-04-27;01:59:58,NULL,38.75,38.75,38.75,2025-04-27 01:59:58.000,2025-04-27,2025,4,27,55180,[],()
74700,54181,21059,5,46.75 USD,"19:23, 11/11/24",NULL,46.75,46.75,233.75,2024-11-11 19:23:00.000,2024-11-11,2024,11,11,54181,[],()
79315,54385,21511,1,$ 32.99,11-May-2024 04:26:29,NULL,32.99,32.99,32.99,2024-05-11 04:26:29.000,2024-05-11,2024,5,11,54385,[],()
79755,55784,21552,1,32.75 $,06:26:26 P.M. 2024-04-04,"Suite 894 66710 Solomon Shoals, Port Troyport, VT 96298",32.75,32.75,32.75,2024-04-04 18:26:26.000,2024-04-04,2024,4,4,55784,[],()
80871,54747,21126,1,USD 61.00,29-OCT-2024;09:57:55,,61.0,61.0,61.0,2024-10-29 09:57:55.000,2024-10-29,2024,10,29,54747,[],()
82178,54848,20921,1,17.0 USD,2024-06-23T08:49:59.572,"3341 Hane Lakes, Port Brunoshire, MT 27534-7691",17.0,17.0,17.0,2024-06-23 08:49:59.572,2024-06-23,2024,6,23,54848,[],()
81327,53431,20919,1,USD 75.0,10/14/24;23:50:35,NULL,75.0,75.0,75.0,2024-10-14 23:50:35.000,2024-10-14,2024,10,14,53431,[],()
80690,54646,21111,2,$ 32.50,"01:56:05, 2024-09-22","7787 Windler Hollow, Lake Cherelleport, VT 72773",32.5,32.5,65.0,2024-09-22 01:56:05.000,2024-09-22,2024,9,22,54646,[],()
78601,53138,21630,1,$53.00,Wed Jan  8 09:03:30 2025,NULL,53.0,53.0,53.0,2025-01-08 09:03:30.000,2025-01-08,2025,1,8,53138,[],()
79881,55447,21638,1,USD 62.25,"06:34:54 pm,2024-04-05",NULL,62.25,62.25,62.25,2024-04-05 18:34:54.000,2024-04-05,2024,4,5,55447,[],()
77800,53331,21584,3,USD48.50,"01/13/25,21:21","Apt. 228 419 Reilly Stravenue, Rosarioburgh, OH 36202",48.5,48.5,145.5,2025-01-13 21:21:00.000,2025-01-13,2025,1,13,53331,[],()
81141,55529,21240,1,$ 14,2024-09-12T15:23:55.474,"Apt. 177 505 Lindy Streets, Deangelobury, WV 54489-3951",14.0,14.0,14.0,2024-09-12 15:23:55.474,2024-09-12,2024,9,12,55529,[],()
82823,55221,21409,1,€ 69.75,"30-March-2024,18:41","Suite 129 435 Olson Light, East Corneliuschester, SC 91325",83.7,83.7,83.7,2024-03-30 18:41:00.000,2024-03-30,2024,3,30,55221,[],()
78584,53227,20948,1,€ 71.50,"06:50,2024-08-17",,85.8,85.8,85.8,2024-08-17 06:50:00.000,2024-08-17,2024,8,17,53227,[],()
76063,54284,21053,1,48.75 $,2024-07-16T06:28:58,NULL,48.75,48.75,48.75,2024-07-16 06:28:58.000,2024-07-16,2024,7,16,54284,[],()
83138,53934,21315,1,63.99USD,2024-10-24T03:34:10.763,NULL,63.99,63.99,63.99,2024-10-24 03:34:10.763,2024-10-24,2024,10,24,53934,[],()
76289,53743,21275,1,67.0 €,12/04/24 19:11,,80.39999999999999,80.39999999999999,80.4,2024-12-04 19:11:00.000,2024-12-04,2024,12,4,53743,[],()
75320,53030,21586,2,$ 21,03/08/25 04:08,"Suite 331 685 Windler Harbors, Carrieside, FL 19284-3235",21.0,21.0,42.0,2025-03-08 04:08:00.000,2025-03-08,2025,3,8,53030,[],()
81175,53517,21355,1,USD 51.50,2024-11-01T13:43:52.733,"Suite 678 486 Parker Ranch, South Maynard, OK 61011",51.5,51.5,51.5,2024-11-01 13:43:52.733,2024-11-01,2024,11,1,53517,[],()
73338,53201,21088,1,$54.75,2025-03-24T04:45:11,,54.75,54.75,54.75,2025-03-24 04:45:11.000,2025-03-24,2025,3,24,53201,[],()
76948,54841,21378,1,42.50USD,"06:11:01, 2025-04-20",NULL,42.5,42.5,42.5,2025-04-20 06:11:01.000,2025-04-20,2025,4,20,54841,[],()
82293,53545,21381,1,35.75 €,2024-12-07T18:19:59,"Suite 923 90654 Lynch Crossroad, South Domingostad, AZ 66781",42.9,42.9,42.9,2024-12-07 18:19:59.000,2024-12-07,2024,12,7,53545,[],()
75999,53877,21334,1,42.0EUR,Mon Oct 21 21:04:42 2024,,50.4,50.4,50.4,2024-10-21 21:04:42.000,2024-10-21,2024,10,21,53877,[],()
78311,55260,21150,1,USD62,2024-12-27T11:32:48,,62.0,62.0,62.0,2024-12-27 11:32:48.000,2024-12-27,2024,12,27,53047,[],()
82481,55311,21253,1,€71¢75," 2-August-2024,11:21:14","Apt. 547 25121 Weimann Course, Clemmiemouth, KS 33011",8610.0,8610.0,8610.0,2024-08-02 11:21:14.000,2024-08-02,2024,8,2,55311,[],()
76304,53345,21151,1,USD38.99,05:55:34 am 2025-01-06,,38.99,38.99,38.99,2025-01-06 05:55:34.000,2025-01-06,2025,1,6,53345,[],()
78845,55702,21279,3,EUR33.5,2024-12-03;20:40:09,,40.199999999999996,40.199999999999996,120.6,2024-12-03 20:40:09.000,2024-12-03,2024,12,3,55702,[],()
79097,53655,20918,4,€ 20.75,09:07  3-Jun-2024,,24.9,24.9,99.6,2024-06-03 09:07:00.000,2024-06-03,2024,6,3,53655,[],()
82511,54892,21002,2,$38¢99,11/20/24 06:02,,3899.0,3899.0,7798.0,2024-11-20 06:02:00.000,2024-11-20,2024,11,20,54704,[],()
82100,53329,21129,1,EUR37.0,"11:06:37,10/07/24","99197 Mario Coves, South Charlsiemouth, TX 79613",44.4,44.4,44.4,2024-10-07 11:06:37.000,2024-10-07,2024,10,7,53329,[],()
74145,53694,21398,3,USD22.0,"05:37,2024-11-20","Suite 913 22246 Bryant Forges, Humbertofort, MA 96046-5931",22.0,22.0,66.0,2024-11-20 05:37:00.000,2024-11-20,2024,11,20,53694,[],()
73640,55139,21310,1,16.0$,2024-11-29 04:48:45 am,NULL,16.0,16.0,16.0,2024-11-29 04:48:45.000,2024-11-29,2024,11,29,55139,[],()
79529,54355,21120,1,EUR 36.75,"11:32:59 pm, 8-May-2024",NULL,44.1,44.1,44.1,2024-05-08 23:32:59.000,2024-05-08,2024,5,8,54355,[],()
83044,54236,21515,2,€74¢99,01:04:45 pm;2024-10-30,"Suite 991 2645 Jerica Stravenue, West Stephani, NJ 99182-0952",8998.8,8998.8,17997.6,2024-10-30 13:04:45.000,2024-10-30,2024,10,30,54236,[],()
75296,54858,21532,1,EUR39.75,"07:19, 2024-12-09","Apt. 491 25209 Jules Prairie, West Adolfo, UT 79360-4190",47.699999999999996,47.699999999999996,47.7,2024-12-09 07:19:00.000,2024-12-09,2024,12,9,54858,[],()
80294,54031,20973,1,$26.25,08:53:15 09/15/24,"Apt. 528 5912 Joane Shore, Evalynton, NJ 43596-9301",26.25,26.25,26.25,2024-09-15 08:53:15.000,2024-09-15,2024,9,15,54031,[],()
79301,53475,21271,1,23.99 $,2024-09-03T14:46:41,"1664 Pedro Shoals, East Gwyneth, MT 95650",23.99,23.99,23.99,2024-09-03 14:46:41.000,2024-09-03,2024,9,3,53475,[],()
74128,55307,21587,1,15.5 $,17:05:28;22-January-2025,NULL,15.5,15.5,15.5,2025-01-22 17:05:28.000,2025-01-22,2025,1,22,55307,[],()
81476,54631,21349,1,57 USD,"05:26:19, 20-December-2024","877 Block Harbor, Port Katharine, GA 62479",57.0,57.0,57.0,2024-12-20 05:26:19.000,2024-12-20,2024,12,20,54631,[],()
80822,54539,21616,2,65.99$,"17-Dec-2024, 01:44:01",NULL,65.99,65.99,131.98,2024-12-17 01:44:01.000,2024-12-17,2024,12,17,54539,[],()
76369,53100,21301,2,62.75 €,"26-MAY-2025,11:23:03 P.M.",NULL,75.3,75.3,150.6,2025-05-26 23:23:03.000,2025-05-26,2025,5,26,53100,[],()
82004,55611,21464,1,30.5 €,"16:50:58,08/05/24",NULL,36.6,36.6,36.6,2024-08-05 16:50:58.000,2024-08-05,2024,8,5,55611,[],()
74329,54298,21508,1,37USD,"15:30,  3-November-2024",,37.0,37.0,37.0,2024-11-03 15:30:00.000,2024-11-03,2024,11,3,54298,[],()
79835,55063,21566,1,USD52.25,2024-11-30T19:08:08.788,"543 Gabriel Dale, Lake Angel, IN 42232-2722",52.25,52.25,52.25,2024-11-30 19:08:08.788,2024-11-30,2024,11,30,55063,[],()
77413,55339,21302,5,$ 22.50,2025-01-01 15:04,,22.5,22.5,112.5,2025-01-01 15:04:00.000,2025-01-01,2025,1,1,55339,[],()
78380,54580,21571,1,$ 16.0,"04/10/24, 10:50:29 pm",NULL,16.0,16.0,16.0,2024-04-10 22:50:29.000,2024-04-10,2024,4,10,54580,[],()
75348,53930,21517,1,66.50€,"2025-02-14, 01:30:36",,79.8,79.8,79.8,2025-02-14 01:30:36.000,2025-02-14,2025,2,14,53930,[],()
79180,54195,21397,1,€66.50,"02/01/25, 20:20",,79.8,79.8,79.8,2025-02-01 20:20:00.000,2025-02-01,2025,2,1,54195,[],()
78576,54590,21207,1,$ 23.99,05:48 17-MAY-2025,,23.99,23.99,23.99,2025-05-17 05:48:00.000,2025-05-17,2025,5,17,54590,[],()
74305,54396,21472,5,USD63.25,"10/24/24, 23:51:24",,63.25,63.25,316.25,2024-10-24 23:51:24.000,2024-10-24,2024,10,24,54396,[],()
80184,55656,20974,1,EUR61.,"05:39:27 PM, 08/26/25",,73.2,73.2,73.2,2025-08-26 17:39:27.000,2025-08-26,2025,8,26,55656,[],()
79191,53425,21288,1,21.50$,2024-11-06T06:19:43.311,,21.5,21.5,21.5,2024-11-06 06:19:43.311,2024-11-06,2024,11,6,53425,[],()
77052,55462,21545,1,63.99$,"11:51:38 P.M.,23-APR-2025",,63.99,63.99,63.99,2025-04-23 23:51:38.000,2025-04-23,2025,4,23,55462,[],()
78770,55764,21486,1,37.50€,"2025-03-03,19:59",,45.0,45.0,45.0,2025-03-03 19:59:00.000,2025-03-03,2025,3,3,55764,[],()
74091,53317,21331,2,EUR 60.00,"26-Jan-2025,04:29:44 PM",NULL,72.0,72.0,144.0,2025-01-26 16:29:44.000,2025-01-26,2025,1,26,53317,[],()
78980,54321,21087,2,29.99$,"01/19/25,02:08:39 AM",,29.99,29.99,59.98,2025-01-19 02:08:39.000,2025-01-19,2025,1,19,54321,[],()
81727,53935,20973,2,28.50 €,18.10.2024 06:25:25,,34.199999999999996,34.199999999999996,68.4,2024-10-18 06:25:25.000,2024-10-18,2024,10,18,53935,[],()
75007,53925,21398,1,USD 20.99," 1-OCT-2024, 11:03:28",,20.99,20.99,20.99,2024-10-01 11:03:28.000,2024-10-01,2024,10,1,53925,[],()
74829,53420,21116,1,38. EUR,20:33 06/09/24,"76596 Cole Island, New Rodney, IA 49612",45.6,45.6,45.6,2024-06-09 20:33:00.000,2024-06-09,2024,6,9,53420,[],()
82517,54994,21044,1,23.25USD,"20:01,16-March-2025","82771 Lucien Via, South Maxwellport, CT 26333",23.25,23.25,23.25,2025-03-16 20:01:00.000,2025-03-16,2025,3,16,54994,[],()
75832,53425,21474,3,USD49.,"2024-12-02,00:54","Apt. 518 9696 Leon Parks, Lake Bradford, NY 81916",49.0,49.0,147.0,2024-12-02 00:54:00.000,2024-12-02,2024,12,2,53425,[],()
79879,55706,21555,1,63.00USD,"2025-03-13, 10:09:45 P.M.",NULL,63.0,63.0,63.0,2025-03-13 22:09:45.000,2025-03-13,2025,3,13,55706,[],()
80577,53733,21295,1,€16.99,14.07.2024 14:45:45,,20.387999999999998,20.387999999999998,20.39,2024-07-14 14:45:45.000,2024-07-14,2024,7,14,53733,[],()
76102,53404,21036,1,63.00 $,10:26:47 PM  6-November-2024,,63.0,63.0,63.0,2024-11-06 22:26:47.000,2024-11-06,2024,11,6,53404,[],()
78216,55443,21652,1,53.5USD,2025-03-04T04:04:05.607,NULL,53.5,53.5,53.5,2025-03-04 04:04:05.607,2025-03-04,2025,3,4,55443,[],()
74724,53196,21113,1,EUR52.99,2024-10-31T01:45:54.813,"Apt. 777 24901 Chanell Brooks, Port Wilsonland, VT 44030",63.588,63.588,63.59,2024-10-31 01:45:54.813,2024-10-31,2024,10,31,53196,[],()
80388,55693,20940,2,60.99$,15-November-2024;01:16:48,"Suite 719 85390 Johns Pass, South Jermainechester, NM 22095",60.99,60.99,121.98,2024-11-15 01:16:48.000,2024-11-15,2024,11,15,55693,[],()
77789,54809,21477,2,USD45.99,"14-DEC-2024,08:00:57 pm",,45.99,45.99,91.98,2024-12-14 20:00:57.000,2024-12-14,2024,12,14,54809,[],()
81408,55466,21105,1,49.99$,08:00:42 30-MAY-2025,,49.99,49.99,49.99,2025-05-30 08:00:42.000,2025-05-30,2025,5,30,55466,[],()
74165,53852,21377,1,EUR 53.50,"2024-12-14,13:57",,64.2,64.2,64.2,2024-12-14 13:57:00.000,2024-12-14,2024,12,14,53852,[],()
76538,53530,21173,1,USD 20.,07:05;12/18/24,,20.0,20.0,20.0,2024-12-18 07:05:00.000,2024-12-18,2024,12,18,53530,[],()
82899,53083,21191,1,EUR45.00,07:15:44 am 10-March-2025,"8343 Ellan Island, Hassanton, ID 38924",54.0,54.0,54.0,2025-03-10 07:15:44.000,2025-03-10,2025,3,10,53083,[],()
77142,55807,21420,1,EUR 64.99,09:49:36  6-AUG-2024,,77.98799999999999,77.98799999999999,77.99,2024-08-06 09:49:36.000,2024-08-06,2024,8,6,55807,[],()
80508,54260,20975,1,EUR70.99,14.11.2024 01:22:22,"Suite 804 19298 Sang Station, Abbottfurt, IL 38455",85.18799999999999,85.18799999999999,85.19,2024-11-14 01:22:22.000,2024-11-14,2024,11,14,54260,[],()
77061,53202,21546,1,48.0 USD,"01:46:25, 2024-04-29",,48.0,48.0,48.0,2024-04-29 01:46:25.000,2024-04-29,2024,4,29,53202,[],()
76662,55180,21172,3,$ 15.00,05:16 2024-07-29,,15.0,15.0,45.0,2024-07-29 05:16:00.000,2024-07-29,2024,7,29,55180,[],()
73767,53165,21318,2,USD53.25,20:40:06;2024-08-05,,53.25,53.25,106.5,2024-08-05 20:40:06.000,2024-08-05,2024,8,5,53165,[],()
74688,55498,21162,2,USD51.00,2024-11-21T02:55:25,,51.0,51.0,102.0,2024-11-21 02:55:25.000,2024-11-21,2024,11,21,55498,[],()
74250,55155,20970,1,41.75 USD,"10/30/24,07:29:04 P.M.",,41.75,41.75,41.75,2024-10-30 19:29:04.000,2024-10-30,2024,10,30,55155,[],()
81269,54672,21330,1,EUR 45.0, 6-NOV-2024;14:58:51,NULL,54.0,54.0,54.0,2024-11-06 14:58:51.000,2024-11-06,2024,11,6,54672,[],()
76227,53797,21038,1,USD 52.00,"12/31/24,00:47:56",,52.0,52.0,52.0,2024-12-31 00:47:56.000,2024-12-31,2024,12,31,53797,[],()
82001,54355,21557,5,67. EUR,25.12.2024 18:56:56,,80.39999999999999,80.39999999999999,402.0,2024-12-25 18:56:56.000,2024-12-25,2024,12,25,54355,[],()
81264,55085,21242,1,€57.99,12:16:18 AM;07/31/24,"903 Dallas Burg, Timmymouth, AR 74585-1577",69.588,69.588,69.59,2024-07-31 00:16:18.000,2024-07-31,2024,7,31,55085,[],()
75811,54241,21418,1,$ 61.75,"27-June-2024, 06:15:55",,61.75,61.75,61.75,2024-06-27 06:15:55.000,2024-06-27,2024,6,27,54241,[],()
73675,55350,21033,1,$ 67.25,01:52:34;21-MAY-2025,,67.25,67.25,67.25,2025-05-21 01:52:34.000,2025-05-21,2025,5,21,55350,[],()
78226,55741,21487,1,USD 70.0,2024-06-07T07:15:57.247,,70.0,70.0,70.0,2024-06-07 07:15:57.247,2024-06-07,2024,6,7,55741,[],()
78400,54851,21281,1,$66¢75,2024-06-28T04:04:30,,6675.0,6675.0,6675.0,2024-06-28 04:04:30.000,2024-06-28,2024,6,28,54851,[],()
79994,53218,21130,4,$ 43.50,15:10:42;2024-04-20,NULL,43.5,43.5,174.0,2024-04-20 15:10:42.000,2024-04-20,2024,4,20,53218,[],()
82844,53314,21089,2,46.5 USD,2025-03-22T00:59:38,,46.5,46.5,93.0,2025-03-22 00:59:38.000,2025-03-22,2025,3,22,53314,[],()
76488,54843,21630,2,USD54.0,"13:15, 03/02/25",,54.0,54.0,108.0,2025-03-02 13:15:00.000,2025-03-02,2025,3,2,54843,[],()
76339,53244,21621,1,EUR 41.00,2024-12-26;23:17:27,,49.199999999999996,49.199999999999996,49.2,2024-12-26 23:17:27.000,2024-12-26,2024,12,26,53244,[],()
81249,54079,21126,2,$ 61.5,30-OCT-2024 11:25:00 A.M.,"2593 Karin Rapid, Lucinafort, AR 47326",61.5,61.5,123.0,2024-10-30 11:25:00.000,2024-10-30,2024,10,30,54079,[],()
82940,54483,21384,1,EUR50.5,23:40:26;2024-12-02,"5610 Johnnie Brook, Devinfurt, VA 50546",60.599999999999994,60.599999999999994,60.6,2024-12-02 23:40:26.000,2024-12-02,2024,12,2,54483,[],()
81405,54920,21275,1,66.75 $,20-October-2024 15:41,,66.75,66.75,66.75,2024-10-20 15:41:00.000,2024-10-20,2024,10,20,54920,[],()
76247,54843,21103,2,$65.0,"05/05/25, 12:00",NULL,65.0,65.0,130.0,2025-05-05 12:00:00.000,2025-05-05,2025,5,5,54843,[],()
77020,54920,21543,1,26.5USD,"27-SEP-2024, 16:53",,26.5,26.5,26.5,2024-09-27 16:53:00.000,2024-09-27,2024,9,27,54920,[],()
82510,53889,21191,1,USD 42.0,2024-06-06T17:30:50,,42.0,42.0,42.0,2024-06-06 17:30:50.000,2024-06-06,2024,6,6,53889,[],()
76273,53636,21124,3,EUR 38.5,23:38 05/19/25,NULL,46.199999999999996,46.199999999999996,138.6,2025-05-19 23:38:00.000,2025-05-19,2025,5,19,53636,[],()
78791,53464,21562,1,39.00 USD,2024-10-14;09:24:53 pm,NULL,39.0,39.0,39.0,2024-10-14 21:24:53.000,2024-10-14,2024,10,14,53464,[],()
82112,53668,21058,1,50.75$,06:44;09/25/24,"Suite 266 384 Heidenreich Plaza, New Ismael, KY 00029",50.75,50.75,50.75,2024-09-25 06:44:00.000,2024-09-25,2024,9,25,53668,[],()
76914,55397,21185,1,EUR35.5,"08:01:22, 12/08/24",,42.6,42.6,42.6,2024-12-08 08:01:22.000,2024-12-08,2024,12,8,55397,[],()
80989,54136,21223,1,€73.5,"09:17:29, 30-June-2024","Suite 329 1022 Tillman Streets, Jewelmouth, VT 53048-2086",88.2,88.2,88.2,2024-06-30 09:17:29.000,2024-06-30,2024,6,30,54457,[],()
74094,54190,21107,1,EUR66.75,18-AUG-2024;05:23:17 AM,,80.1,80.1,80.1,2024-08-18 05:23:17.000,2024-08-18,2024,8,18,54190,[],()
74537,53939,21613,1,27.25$,07:56:14 AM 28-OCT-2024,,27.25,27.25,27.25,2024-10-28 07:56:14.000,2024-10-28,2024,10,28,53939,[],()
76356,53236,21191,1,€46.99,03:07;23-Sep-2024,,56.388,56.388,56.39,2024-09-23 03:07:00.000,2024-09-23,2024,9,23,53236,[],()
73876,53926,20976,1,51.5€,"08:56:27 pm, 11/25/24",,61.8,61.8,61.8,2024-11-25 20:56:27.000,2024-11-25,2024,11,25,53926,[],()
77056,53885,21162,2,EUR49.75,2024-11-02T16:11:52.687,"Suite 531 164 Dalene Run, Gretchenstad, ME 47337",59.699999999999996,59.699999999999996,119.4,2024-11-02 16:11:52.687,2024-11-02,2024,11,2,53885,[],()
77983,55136,21037,1,$ 55.50,"05:32:41,  2-JUL-2024",,55.5,55.5,55.5,2024-07-02 05:32:41.000,2024-07-02,2024,7,2,55136,[],()
75202,53928,21575,1,49.00 $,10-Apr-2024 09:51:51 pm,,49.0,49.0,49.0,2024-04-10 21:51:51.000,2024-04-10,2024,4,10,53928,[],()
76924,54278,21093,1,69.99 USD,"15:44:48, 10-MAY-2025",NULL,69.99,69.99,69.99,2025-05-10 15:44:48.000,2025-05-10,2025,5,10,54278,[],()
77248,54390,21645,2,52USD,"07/10/25,12:40",,52.0,52.0,104.0,2025-07-10 12:40:00.000,2025-07-10,2025,7,10,54390,[],()
76971,54781,20970,1,€40.0,"2024-10-02,12:42:42 AM","Suite 553 238 Thompson Haven, Lake Nickymouth, OK 04446-1570",48.0,48.0,48.0,2024-10-02 00:42:42.000,2024-10-02,2024,10,2,54781,[],()
76659,55309,21169,4,$62,"02/15/24, 23:33:58","Suite 777 3840 Fatima Ridges, New Wally, NC 93157",62.0,62.0,248.0,2024-02-15 23:33:58.000,2024-02-15,2024,2,15,55309,[],()
78551,54657,21521,1,$ 51,"08:01:50 PM,18-March-2024",,51.0,51.0,51.0,2024-03-18 20:01:50.000,2024-03-18,2024,3,18,53318,[],()
74744,53236,20992,1,55.00 €,04:16:03;04/08/24,,66.0,66.0,66.0,2024-04-08 04:16:03.000,2024-04-08,2024,4,8,53236,[],()
80943,54021,21428,1,EUR25.99,10/02/24 21:29:05,,31.187999999999995,31.187999999999995,31.19,2024-10-02 21:29:05.000,2024-10-02,2024,10,2,54021,[],()
82133,55558,21647,2,EUR 66.50,2025-01-03T04:57:23,,79.8,79.8,159.6,2025-01-03 04:57:23.000,2025-01-03,2025,1,3,55558,[],()
76294,55123,21604,3,USD 51.5,24-DEC-2024;10:56:44,,51.5,51.5,154.5,2024-12-24 10:56:44.000,2024-12-24,2024,12,24,55123,[],()
74764,55617,21065,1,19.00 $,10/11/24;08:22:16 PM,,19.0,19.0,19.0,2024-10-11 20:22:16.000,2024-10-11,2024,10,11,55617,[],()
75940,54282,21352,2,€35¢75,"09/05/24,16:05:23",,4290.0,4290.0,8580.0,2024-09-05 16:05:23.000,2024-09-05,2024,9,5,54282,[],()
78308,55527,21346,1,USD46.99,08:18:19;10-Mar-2025,"Apt. 774 6655 Stokes Dale, South Ardell, AZ 83710-1212",46.99,46.99,46.99,2025-03-10 08:18:19.000,2025-03-10,2025,3,10,55527,[],()
81003,55204,21374,5,EUR22.5,2024-04-22T17:24:57.598,"Suite 840 782 Siobhan Garden, West Marty, WA 03533-3415",27.0,27.0,135.0,2024-04-22 17:24:57.598,2024-04-22,2024,4,22,55204,[],()
80767,55817,21642,1,51.75 EUR,15-March-2025;13:50:07,,62.099999999999994,62.099999999999994,62.1,2025-03-15 13:50:07.000,2025-03-15,2025,3,15,55776,[],()
80695,54450,21015,2,$ 61.75,08:47:46 AM;01/21/25,,61.75,61.75,123.5,2025-01-21 08:47:46.000,2025-01-21,2025,1,21,54450,[],()
77143,54139,21458,1,$46.25,2024-10-18 09:54:00 am,NULL,46.25,46.25,46.25,2024-10-18 09:54:00.000,2024-10-18,2024,10,18,54139,[],()
75684,55689,21036,1,60.00 €,06:49:09 PM;06/16/24,NULL,72.0,72.0,72.0,2024-06-16 18:49:09.000,2024-06-16,2024,6,16,55689,[],()
82900,55648,21306,1,33.0USD,2024-08-01T14:14:53.180,,33.0,33.0,33.0,2024-08-01 14:14:53.180,2024-08-01,2024,8,1,55648,[],()
76598,53487,20986,2,68.50€,2024-04-19;22:10,"Suite 617 996 Kreiger Estate, New Rebeccastad, MI 32717-7227",82.2,82.2,164.4,2024-04-19 22:10:00.000,2024-04-19,2024,4,19,53487,[],()
78065,53261,21127,1,56.99 USD, 5-APR-2025 05:37,"Apt. 398 954 Conchita Bypass, Rickyburgh, TX 94527",56.99,56.99,56.99,2025-04-05 05:37:00.000,2025-04-05,2025,4,5,53261,[],()
81060,55143,21608,1,€61.00,06:47:30;2025-03-16,,73.2,73.2,73.2,2025-03-16 06:47:30.000,2025-03-16,2025,3,16,55143,[],()
79818,54417,21350,2,USD 45.5,"07:01, 2025-04-07",,45.5,45.5,91.0,2025-04-07 07:01:00.000,2025-04-07,2025,4,7,54417,[],()
81331,55360,20971,1,20.75 USD,03:24:02 21-MAR-2025,NULL,20.75,20.75,20.75,2025-03-21 03:24:02.000,2025-03-21,2025,3,21,55360,[],()
75558,54420,21420,1,€67.25,19:01;12/02/24,,80.7,80.7,80.7,2024-12-02 19:01:00.000,2024-12-02,2024,12,2,54420,[],()
81004,54220,21205,2,$29.75,2024-11-21T01:02:16.938,NULL,29.75,29.75,59.5,2024-11-21 01:02:16.938,2024-11-21,2024,11,21,54220,[],()
78417,53033,21501,1,$24.75,2025-05-04 21:32,,24.75,24.75,24.75,2025-05-04 21:32:00.000,2025-05-04,2025,5,4,53033,[],()
79694,55760,21394,2,USD43.00,"07/10/25, 00:45",,43.0,43.0,86.0,2025-07-10 00:45:00.000,2025-07-10,2025,7,10,55760,[],()
80169,55605,21222,1,USD73.5,13:18;02/13/25,"Suite 757 1253 Rodriguez Locks, Leliafort, IN 34092",73.5,73.5,73.5,2025-02-13 13:18:00.000,2025-02-13,2025,2,13,55605,[],()
76840,54919,20930,1,32.0 USD,"15-Sep-2024, 05:28:04",,32.0,32.0,32.0,2024-09-15 05:28:04.000,2024-09-15,2024,9,15,54919,[],()
82829,53952,21507,1,EUR 44.00,2024-12-20 11:07,NULL,52.8,52.8,52.8,2024-12-20 11:07:00.000,2024-12-20,2024,12,20,53952,[],()
81552,54974,21376,1,USD 57.5,12:42:28 A.M.; 4-Oct-2024,,57.5,57.5,57.5,2024-10-04 00:42:28.000,2024-10-04,2024,10,4,54974,[],()
81914,55238,21132,2,EUR 21.50,13:05;03/04/25,,25.8,25.8,51.6,2025-03-04 13:05:00.000,2025-03-04,2025,3,4,55238,[],()
82720,53720,21579,1,USD 56.25,"05:33:04 AM,27-February-2025",NULL,56.25,56.25,56.25,2025-02-27 05:33:04.000,2025-02-27,2025,2,27,53720,[],()
78538,54629,21511,1,33.50 USD,"12/30/24,06:59:00",NULL,33.5,33.5,33.5,2024-12-30 06:59:00.000,2024-12-30,2024,12,30,54629,[],()
82415,54992,21551,1,37.50 $,06:03:34 pm 03/12/25,,37.5,37.5,37.5,2025-03-12 18:03:34.000,2025-03-12,2025,3,12,54992,[],()
75166,54004,21171,1,66.5 €,06/14/24;05:27:01 A.M.,NULL,79.8,79.8,79.8,2024-06-14 05:27:01.000,2024-06-14,2024,6,14,54004,[],()
80108,53262,21268,1,$ 52.75,"16:42, 2024-12-25",,52.75,52.75,52.75,2024-12-25 16:42:00.000,2024-12-25,2024,12,25,53262,[],()
73327,55333,21565,1,$63.0,"01/14/25,04:57:19 PM",,63.0,63.0,63.0,2025-01-14 16:57:19.000,2025-01-14,2025,1,14,55333,[],()
78660,54006,21337,1,$73.75,2025-07-08T11:15:12,"8019 Gerri Ports, Port Benniebury, IA 17222",73.75,73.75,73.75,2025-07-08 11:15:12.000,2025-07-08,2025,7,8,54006,[],()
77337,55641,21501,1,26.99USD,"11:27:35 A.M.,2024-05-13",NULL,26.99,26.99,26.99,2024-05-13 11:27:35.000,2024-05-13,2024,5,13,55641,[],()
74222,55416,21430,1,30.25 $," 3-June-2025, 05:47",NULL,30.25,30.25,30.25,2025-06-03 05:47:00.000,2025-06-03,2025,6,3,55416,[],()
75131,55670,21618,2,42.€,01:15 05/06/25,NULL,50.4,50.4,100.8,2025-05-06 01:15:00.000,2025-05-06,2025,5,6,55670,[],()
81480,53689,21216,2,USD 29.99,2024-09-11T22:03:27.321,NULL,29.99,29.99,59.98,2024-09-11 22:03:27.321,2024-09-11,2024,9,11,53689,[],()
75263,53379,21229,1,EUR 18.0,01:59:37 PM 04/26/25,"5758 Laurena Centers, Kathemouth, IN 53664",21.599999999999998,21.599999999999998,21.6,2025-04-26 13:59:37.000,2025-04-26,2025,4,26,53379,[],()
79859,54926,21292,4,€40.5,05:48:30 A.M.;10/10/24,NULL,48.6,48.6,194.4,2024-10-10 05:48:30.000,2024-10-10,2024,10,10,54926,[],()
82158,53689,20973,2,29.75 USD,12:46:56 AM;02/11/25,"Apt. 450 31046 Larae Bridge, Balistrerifurt, MT 72479",29.75,29.75,59.5,2025-02-11 00:46:56.000,2025-02-11,2025,2,11,53689,[],()
74699,55124,21291,1,EUR30.0,23:30;11/21/24,,36.0,36.0,36.0,2024-11-21 23:30:00.000,2024-11-21,2024,11,21,55124,[],()
75903,53303,21539,1,USD 63.99,23:22:44 2024-11-10,,63.99,63.99,63.99,2024-11-10 23:22:44.000,2024-11-10,2024,11,10,53303,[],()
75623,54177,21081,2,EUR69.50,24-November-2024 02:56:51 AM,"411 Schmidt Green, East Arnetteton, SC 71506-8326",83.39999999999999,83.39999999999999,166.8,2024-11-24 02:56:51.000,2024-11-24,2024,11,24,54177,[],()
83007,54218,20954,1,EUR74.99,10/10/24 23:21:03,NULL,89.98799999999999,89.98799999999999,89.99,2024-10-10 23:21:03.000,2024-10-10,2024,10,10,54218,[],()
77903,53593,20942,1,USD35.5,"19:35, 2024-04-18",,35.5,35.5,35.5,2024-04-18 19:35:00.000,2024-04-18,2024,4,18,53593,[],()
79528,55628,21220,1,13.0 USD,2024-10-16;11:10,NULL,13.0,13.0,13.0,2024-10-16 11:10:00.000,2024-10-16,2024,10,16,55628,[],()
74652,53425,21013,1,42.25USD,03:38:51 am 2025-01-02,,42.25,42.25,42.25,2025-01-02 03:38:51.000,2025-01-02,2025,1,2,53425,[],()
75188,53916,21502,1,EUR 33.50,"13-DEC-2024,09:57:09 A.M.",NULL,40.199999999999996,40.199999999999996,40.2,2024-12-13 09:57:09.000,2024-12-13,2024,12,13,53916,[],()
80082,53677,21471,1,USD20,2024-12-25T01:00:23,,20.0,20.0,20.0,2024-12-25 01:00:23.000,2024-12-25,2024,12,25,53677,[],()
78748,53610,21265,2,USD70.25,"2025-01-30,03:56",,70.25,70.25,140.5,2025-01-30 03:56:00.000,2025-01-30,2025,1,30,53610,[],()
79929,53523,20969,4,17.0$,"2024-12-17, 15:49:39","574 Fred Ranch, Kuphalville, SD 21880",17.0,17.0,68.0,2024-12-17 15:49:39.000,2024-12-17,2024,12,17,53523,[],()
78392,53766,21578,1,€39.,"21-Sep-2024, 07:03:16 A.M.",NULL,46.8,46.8,46.8,2024-09-21 07:03:16.000,2024-09-21,2024,9,21,53766,[],()
79386,55598,21639,5,$17.0," 9-August-2024,05:19:40","26820 Von Forges, Beattyview, MN 85349-9488",17.0,17.0,85.0,2024-08-09 05:19:40.000,2024-08-09,2024,8,9,55598,[],()
81151,54653,20964,2,73. USD,"02/26/25,12:50:45 PM","53750 Eugene Plains, Rutherfordland, IN 54980",73.0,73.0,146.0,2025-02-26 12:50:45.000,2025-02-26,2025,2,26,54653,[],()
82213,53684,21525,2,USD 50.00,17:30:21;17-JAN-2025,,50.0,50.0,100.0,2025-01-17 17:30:21.000,2025-01-17,2025,1,17,53684,[],()
80285,53038,21062,1,USD71.25,2024-09-12T15:51:16.596,,71.25,71.25,71.25,2024-09-12 15:51:16.596,2024-09-12,2024,9,12,53038,[],()
82104,54570,21112,1,27.0$,12:14; 7-Aug-2025,,27.0,27.0,27.0,2025-08-07 12:14:00.000,2025-08-07,2025,8,7,54570,[],()
77637,53696,21296,1,35.5USD,15:16:40;21-Sep-2024,,35.5,35.5,35.5,2024-09-21 15:16:40.000,2024-09-21,2024,9,21,53696,[],()
80981,53601,21561,1,USD 25.50, 4-Mar-2025 14:52,,25.5,25.5,25.5,2025-03-04 14:52:00.000,2025-03-04,2025,3,4,53601,[],()
81293,55198,21529,2,$62.99,"02:21, 01/13/25","Apt. 719 57467 Kim Crescent, South Willard, TX 34360",62.99,62.99,125.98,2025-01-13 02:21:00.000,2025-01-13,2025,1,13,55198,[],()
82738,55354,20967,2,40.25USD, 5-JUL-2024;12:22:23,"Apt. 101 523 Marks Terrace, East Rachael, TN 59931-4104",40.25,40.25,80.5,2024-07-05 12:22:23.000,2024-07-05,2024,7,5,55354,[],()
82758,53071,21341,1,USD 49.0,"03:56:56,25-August-2024",NULL,49.0,49.0,49.0,2024-08-25 03:56:56.000,2024-08-25,2024,8,25,53071,[],()
83019,55299,21106,2,46.50$, 4-Sep-2024 01:29:31 am,,46.5,46.5,93.0,2024-09-04 01:29:31.000,2024-09-04,2024,9,4,55299,[],()
77811,54624,21636,1,50.0USD,"04:51,23-JAN-2025",,50.0,50.0,50.0,2025-01-23 04:51:00.000,2025-01-23,2025,1,23,54624,[],()
78981,55014,21119,1,$ 32.50,2025-03-18T03:32:11.756,,32.5,32.5,32.5,2025-03-18 03:32:11.756,2025-03-18,2025,3,18,55014,[],()
74409,53365,21205,1,$ 27.5,"2024-09-13,05:51","Apt. 460 6727 Brakus Keys, West Ashton, WI 49594",27.5,27.5,27.5,2024-09-13 05:51:00.000,2024-09-13,2024,9,13,53365,[],()
75187,55802,21028,1,53.25 USD,Tue Jan 14 16:50:05 2025,"Apt. 596 2815 Deidra Plains, New Chadwick, NH 13801-1880",53.25,53.25,53.25,2025-01-14 16:50:05.000,2025-01-14,2025,1,14,55802,[],()
81440,54576,21459,1,20.00 €,2024-11-22 01:35:39 am,NULL,24.0,24.0,24.0,2024-11-22 01:35:39.000,2024-11-22,2024,11,22,54576,[],()
78008,55196,21299,1,20.50$,"2024-11-05, 04:55:52 PM",,20.5,20.5,20.5,2024-11-05 16:55:52.000,2024-11-05,2024,11,5,55196,[],()
74309,53991,21566,3,51.25€,30.08.2024  5:06:06,,61.5,61.5,184.5,2024-08-30 05:06:06.000,2024-08-30,2024,8,30,53991,[],()
76283,53223,20981,1,19USD,05:20:00 am  7-January-2025,"Suite 282 5976 Monahan Pine, New Lester, MT 03534",19.0,19.0,19.0,2025-01-07 05:20:00.000,2025-01-07,2025,1,7,53968,[],()
78827,54877,21016,3,76.50 €,"16:17:15,2025-02-17",,91.8,91.8,275.4,2025-02-17 16:17:15.000,2025-02-17,2025,2,17,54877,[],()
74451,54657,20935,1,32.99USD, 7-DEC-2024;20:08:01,,32.99,32.99,32.99,2024-12-07 20:08:01.000,2024-12-07,2024,12,7,53318,[],()
82174,54743,21153,1,39 $,06:16:09;09/05/24,,39.0,39.0,39.0,2024-09-05 06:16:09.000,2024-09-05,2024,9,5,54743,[],()
82710,53185,20923,1,30.25 €,2025-05-09;03:34:32 am,,36.3,36.3,36.3,2025-05-09 03:34:32.000,2025-05-09,2025,5,9,53185,[],()
74791,55173,21409,1,$ 69.00,"21:25:01, 2024-08-27",,69.0,69.0,69.0,2024-08-27 21:25:01.000,2024-08-27,2024,8,27,55173,[],()
75724,53542,21436,2,38$50¢,2024-10-14T23:18:27.224,"670 Thiel Divide, Stoltenbergfurt, UT 80883-3177",3850.0,3850.0,7700.0,2024-10-14 23:18:27.224,2024-10-14,2024,10,14,53542,[],()
81312,54893,21197,2,72.$,"08/06/24, 16:20",,72.0,72.0,144.0,2024-08-06 16:20:00.000,2024-08-06,2024,8,6,54893,[],()
78705,53501,20980,4,€33¢50,"12-November-2024, 06:09:40",,4020.0,4020.0,16080.0,2024-11-12 06:09:40.000,2024-11-12,2024,11,12,53501,[],()
80787,53355,21489,1,63.99USD,2024-10-21T17:55:09.519,NULL,63.99,63.99,63.99,2024-10-21 17:55:09.519,2024-10-21,2024,10,21,53355,[],()
75383,54716,21522,1,52.75 USD,"15:40, 27-Apr-2024",NULL,52.75,52.75,52.75,2024-04-27 15:40:00.000,2024-04-27,2024,4,27,54716,[],()
73770,54328,21397,1,65.25$,"23:54:08, 28-Dec-2024",NULL,65.25,65.25,65.25,2024-12-28 23:54:08.000,2024-12-28,2024,12,28,54328,[],()
75605,53305,21226,1,$61.00,06:06:28 am; 5-SEP-2024,"80641 Sheldon Court, Robertobury, KS 13460-8820",61.0,61.0,61.0,2024-09-05 06:06:28.000,2024-09-05,2024,9,5,53305,[],()
79016,53072,21452,1,19.5€,"04:10, 21-Jul-2024","Apt. 475 9490 Galen Courts, O'Harashire, WY 63192",23.4,23.4,23.4,2024-07-21 04:10:00.000,2024-07-21,2024,7,21,53072,[],()
78971,54846,21107,1,EUR65.99,"05:53:05 AM, 25-JAN-2025",,79.18799999999999,79.18799999999999,79.19,2025-01-25 05:53:05.000,2025-01-25,2025,1,25,54846,[],()
76530,54524,21186,1,€43.50,"04/21/25, 09:48:50 P.M.",,52.199999999999996,52.199999999999996,52.2,2025-04-21 21:48:50.000,2025-04-21,2025,4,21,54524,[],()
80421,54345,21065,1,USD 22.75,"11:33, 2025-07-28",,22.75,22.75,22.75,2025-07-28 11:33:00.000,2025-07-28,2025,7,28,54345,[],()
81367,55445,21494,1,23.99USD,10/08/24 17:38,NULL,23.99,23.99,23.99,2024-10-08 17:38:00.000,2024-10-08,2024,10,8,55445,[],()
73716,55370,21598,1,EUR40,"2025-01-21,15:54:14",NULL,48.0,48.0,48.0,2025-01-21 15:54:14.000,2025-01-21,2025,1,21,55370,[],()
73680,55488,21393,1,$ 43.50,21-JUN-2024;16:30:03,NULL,43.5,43.5,43.5,2024-06-21 16:30:03.000,2024-06-21,2024,6,21,55488,[],()
73951,54108,21270,1,$72.5,10:02 12-NOV-2024,,72.5,72.5,72.5,2024-11-12 10:02:00.000,2024-11-12,2024,11,12,54108,[],()
76199,53617,21475,5,€37¢50,"25-FEB-2025,09:18:50",NULL,4500.0,4500.0,22500.0,2025-02-25 09:18:50.000,2025-02-25,2025,2,25,53617,[],()
77608,53550,21577,1,$24.99,"2024-10-09, 13:53",NULL,24.99,24.99,24.99,2024-10-09 13:53:00.000,2024-10-09,2024,10,9,53550,[],()
78577,54464,21268,1,€50¢75,2025-05-17T04:14:35.256,,6090.0,6090.0,6090.0,2025-05-17 04:14:35.256,2025-05-17,2025,5,17,54464,[],()
76654,53829,21061,1,47.0 USD,"16:47, 01/28/25","Suite 956 7157 Nila View, Lake Issac, WV 66014-0172",47.0,47.0,47.0,2025-01-28 16:47:00.000,2025-01-28,2025,1,28,53999,[],()
81352,53979,21129,1,39.99USD,2024-06-09T15:38:03.091,,39.99,39.99,39.99,2024-06-09 15:38:03.091,2024-06-09,2024,6,9,53979,[],()
81517,54741,21425,3,USD 39.99,2024-09-24T16:51:25,NULL,39.99,39.99,119.97,2024-09-24 16:51:25.000,2024-09-24,2024,9,24,54741,[],()
76188,55175,21279,1,33.25 $,2024-04-25T05:20:20.924,"Apt. 635 3235 Larkin Path, Shanaeburgh, HI 53157-3335",33.25,33.25,33.25,2024-04-25 05:20:20.924,2024-04-25,2024,4,25,55175,[],()
81166,53201,21556,1,22.50 $,"23:50, 11/23/24",,22.5,22.5,22.5,2024-11-23 23:50:00.000,2024-11-23,2024,11,23,53201,[],()
79307,54766,21269,1,$ 37.5,"23:31,07/28/25",,37.5,37.5,37.5,2025-07-28 23:31:00.000,2025-07-28,2025,7,28,54766,[],()
81191,55679,21000,3,EUR28,2025-02-10T06:43:19,"32767 Garland Park, West Dominica, IN 08921-0294",33.6,33.6,100.8,2025-02-10 06:43:19.000,2025-02-10,2025,2,10,55679,[],()
75813,53022,21549,2,53.75 $,09.12.2024 11:49:49,"Apt. 467 2204 Jacobi Lights, Daleburgh, AZ 42182",53.75,53.75,107.5,2024-09-12 11:49:49.000,2024-09-12,2024,9,12,53022,[],()
81370,54143,21478,1,70.25EUR,11:51:17 pm 08/02/24,NULL,84.3,84.3,84.3,2024-08-02 23:51:17.000,2024-08-02,2024,8,2,54143,[],()
75732,54993,21463,5,70.75 $,"05:06:57, 2024-03-08",,70.75,70.75,353.75,2024-03-08 05:06:57.000,2024-03-08,2024,3,8,54993,[],()
75368,55263,21287,1,63.00 USD,2025-02-01T17:50:58.361,,63.0,63.0,63.0,2025-02-01 17:50:58.361,2025-02-01,2025,2,1,55263,[],()
75420,55736,21414,2,USD 31.5,"08/22/24,01:10:26 P.M.","Apt. 240 46206 Howe Passage, Rosenbaumfurt, KS 41656",31.5,31.5,63.0,2024-08-22 13:10:26.000,2024-08-22,2024,8,22,55736,[],()
78060,55580,21363,1,USD 31.,"14-DEC-2024, 00:53",,31.0,31.0,31.0,2024-12-14 00:53:00.000,2024-12-14,2024,12,14,55580,[],()
80023,53032,21066,1,35.0USD,"06:25:47, 2-April-2025",,35.0,35.0,35.0,2025-04-02 06:25:47.000,2025-04-02,2025,4,2,53032,[],()
78771,55324,21502,2,31. EUR,"14:29,23-Apr-2024",,37.199999999999996,37.199999999999996,74.4,2024-04-23 14:29:00.000,2024-04-23,2024,4,23,55324,[],()
83060,54190,21341,5,49$50¢,18:16;12-Sep-2024,NULL,4950.0,4950.0,24750.0,2024-09-12 18:16:00.000,2024-09-12,2024,9,12,54190,[],()
78572,54855,21014,1,EUR 71.50,2025-03-06 04:58:35 P.M.,NULL,85.8,85.8,85.8,2025-03-06 16:58:35.000,2025-03-06,2025,3,6,54855,[],()
81856,54075,21092,1,$ 34.25,11:13:48 P.M. 2025-02-28,"9397 Burton Knoll, Osinskimouth, LA 72181",34.25,34.25,34.25,2025-02-28 23:13:48.000,2025-02-28,2025,2,28,54075,[],()
77938,55089,21055,1,45.0$,16-Mar-2025;12:55:58 PM,,45.0,45.0,45.0,2025-03-16 12:55:58.000,2025-03-16,2025,3,16,55089,[],()
81144,53562,20947,1,EUR25.00,05:17:08 PM 07/21/25,,30.0,30.0,30.0,2025-07-21 17:17:08.000,2025-07-21,2025,7,21,53562,[],()
80037,54837,21549,3,USD 50.75,2025-01-17 09:39:21 pm,NULL,50.75,50.75,152.25,2025-01-17 21:39:21.000,2025-01-17,2025,1,17,54837,[],()
78711,55753,21542,1,47.99USD,00:55:19; 7-Mar-2025,"37727 Rosina Summit, East Scarlet, VT 69023",47.99,47.99,47.99,2025-03-07 00:55:19.000,2025-03-07,2025,3,7,55753,[],()
78433,54849,21196,1,USD42.0,"12/04/24,20:24:46",NULL,42.0,42.0,42.0,2024-12-04 20:24:46.000,2024-12-04,2024,12,4,54849,[],()
76394,54358,21223,5,$69.5,2024-11-02T09:33:59,,69.5,69.5,347.5,2024-11-02 09:33:59.000,2024-11-02,2024,11,2,55218,[],()
82881,54701,20964,1,71.25€,17:34;08/21/24,,85.5,85.5,85.5,2024-08-21 17:34:00.000,2024-08-21,2024,8,21,54701,[],()
74811,54678,21655,1,€ 28.5,2024-10-14 17:51,,34.199999999999996,34.199999999999996,34.2,2024-10-14 17:51:00.000,2024-10-14,2024,10,14,54678,[],()
76862,54588,21570,1,$ 50.25,"18:21:14, 17-Oct-2024",NULL,50.25,50.25,50.25,2024-10-17 18:21:14.000,2024-10-17,2024,10,17,54588,[],()
83055,55190,21186,1,42.75 $,08:23:01 am;2024-07-24,NULL,42.75,42.75,42.75,2024-07-24 08:23:01.000,2024-07-24,2024,7,24,55190,[],()
79581,53821,21439,3,41.5 €,2024-11-09T10:38:34.941,"Apt. 448 54598 Gibson Squares, Grahamfort, ND 53406",49.8,49.8,149.4,2024-11-09 10:38:34.941,2024-11-09,2024,11,9,53821,[],()
78407,53049,21007,1,€32¢00,22-DEC-2024;08:46,NULL,3840.0,3840.0,3840.0,2024-12-22 08:46:00.000,2024-12-22,2024,12,22,53049,[],()
74994,53943,21179,1,55EUR,"09:42, 2025-03-01",NULL,66.0,66.0,66.0,2025-03-01 09:42:00.000,2025-03-01,2025,3,1,54718,[],()
82550,55129,21005,1,USD 13.99,"09:38, 2024-12-18","1274 Jason Spring, Batzbury, WY 20843",13.99,13.99,13.99,2024-12-18 09:38:00.000,2024-12-18,2024,12,18,55129,[],()
83063,53201,21156,5,72.0 USD,"16:48:44,  4-May-2024","Apt. 659 5171 Ryan Fall, Katiaview, OK 04322-9244",72.0,72.0,360.0,2024-05-04 16:48:44.000,2024-05-04,2024,5,4,53201,[],()
82837,55302,21095,4,48.99 EUR,"00:59,12/02/24",,58.788,58.788,235.15,2024-12-02 00:59:00.000,2024-12-02,2024,12,2,55302,[],()
81704,53449,21404,2,€37¢50,2024-11-28T08:23:08,NULL,4500.0,4500.0,9000.0,2024-11-28 08:23:08.000,2024-11-28,2024,11,28,53449,[],()
77411,53943,21497,2,67$25¢,2024-12-12T07:56:06,,6725.0,6725.0,13450.0,2024-12-12 07:56:06.000,2024-12-12,2024,12,12,54718,[],()
79106,54573,21622,2,37$99¢,2025-08-12T20:17:09,"Apt. 362 929 Reynaldo Spring, Kozeymouth, PA 38933-5613",3799.0,3799.0,7598.0,2025-08-12 20:17:09.000,2025-08-12,2025,8,12,54573,[],()
80715,55505,21567,1,EUR58.99,2024-10-13;20:56:33,NULL,70.788,70.788,70.79,2024-10-13 20:56:33.000,2024-10-13,2024,10,13,55505,[],()
81071,55792,21574,2,$26.75," 2-Jun-2025, 02:50:16",NULL,26.75,26.75,53.5,2025-06-02 02:50:16.000,2025-06-02,2025,6,2,55792,[],()
76953,53334,21286,2,USD30.75,15:49:37;25-January-2025,,30.75,30.75,61.5,2025-01-25 15:49:37.000,2025-01-25,2025,1,25,53334,[],()
74379,55759,21385,1,19.25EUR,"09:21:57 PM, 02/18/25",,23.099999999999998,23.099999999999998,23.1,2025-02-18 21:21:57.000,2025-02-18,2025,2,18,55759,[],()
82475,55669,21165,1,17.25EUR,12:55:20 PM 02/07/25,,20.7,20.7,20.7,2025-02-07 12:55:20.000,2025-02-07,2025,2,7,55669,[],()
82868,55637,20919,2,EUR 70.00,16:20:10 10/22/24,,84.0,84.0,168.0,2024-10-22 16:20:10.000,2024-10-22,2024,10,22,55637,[],()
83061,55570,20993,1,USD29.75,2024-12-05T11:37:36.859,NULL,29.75,29.75,29.75,2024-12-05 11:37:36.859,2024-12-05,2024,12,5,55570,[],()
79950,54510,21012,1,€58.0,2024-12-14T03:13:40,"Suite 436 795 Mario Isle, Justinhaven, VT 23672-7010",69.6,69.6,69.6,2024-12-14 03:13:40.000,2024-12-14,2024,12,14,54510,[],()
82599,55207,21398,2,$21¢00,"14:27,2025-03-08",,2100.0,2100.0,4200.0,2025-03-08 14:27:00.000,2025-03-08,2025,3,8,55207,[],()
76697,54728,20991,1,43.0$,2024-12-26T03:57:56.437,,43.0,43.0,43.0,2024-12-26 03:57:56.437,2024-12-26,2024,12,26,54728,[],()
75079,55576,20995,3,51USD,"01/22/25, 15:22",NULL,51.0,51.0,153.0,2025-01-22 15:22:00.000,2025-01-22,2025,1,22,55576,[],()
76633,54841,21353,1,€20¢50,"11:02, 09/08/24",,2460.0,2460.0,2460.0,2024-09-08 11:02:00.000,2024-09-08,2024,9,8,54841,[],()
77869,54216,21561,1,€26.50,"13:10, 02/23/25","Apt. 175 374 Julio Lodge, Lake Roxiefurt, WA 85180",31.799999999999997,31.799999999999997,31.8,2025-02-23 13:10:00.000,2025-02-23,2025,2,23,54216,[],()
82135,55820,21087,1,27.0 USD,2025-03-09T21:42:10,,27.0,27.0,27.0,2025-03-09 21:42:10.000,2025-03-09,2025,3,9,54084,[],()
74786,54546,21423,2,$ 69.50,2024-12-30T15:05:19,"Suite 910 50327 Weber Extension, South Jack, FL 96743-8007",69.5,69.5,139.0,2024-12-30 15:05:19.000,2024-12-30,2024,12,30,54546,[],()
74721,55484,21074,5,$ 70.00,"18:18:42, 7-May-2025",NULL,70.0,70.0,350.0,2025-05-07 18:18:42.000,2025-05-07,2025,5,7,55484,[],()
77546,53971,21278,1,37.75USD,15-AUG-2024;15:50:04,NULL,37.75,37.75,37.75,2024-08-15 15:50:04.000,2024-08-15,2024,8,15,53971,[],()
77302,55425,20987,5,68.99 USD, 8-Feb-2025;17:15,"Suite 166 8952 Byron Square, New Adelaide, KY 02642-1898",68.99,68.99,344.95,2025-02-08 17:15:00.000,2025-02-08,2025,2,8,54527,[],()
79188,55108,21657,1,13. €,"17:53, 5-July-2024",,15.6,15.6,15.6,2024-07-05 17:53:00.000,2024-07-05,2024,7,5,55108,[],()
81936,53571,21386,1,USD46.,05:01:13 P.M.;03/10/25,NULL,46.0,46.0,46.0,2025-03-10 17:01:13.000,2025-03-10,2025,3,10,53571,[],()
81371,54969,20978,1,€56.5,"01:45:58 PM,2024-11-20",,67.8,67.8,67.8,2024-11-20 13:45:58.000,2024-11-20,2024,11,20,54969,[],()
79954,54265,21606,1,22.25€,23:41  3-November-2024,,26.7,26.7,26.7,2024-11-03 23:41:00.000,2024-11-03,2024,11,3,54265,[],()
77022,55314,21403,2,$26.5,"24-Jul-2024, 04:26:32 am","49948 Koch Station, Moonhaven, IL 76683",26.5,26.5,53.0,2024-07-24 04:26:32.000,2024-07-24,2024,7,24,55314,[],()
82077,54952,20917,1,41.5 EUR,"29-April-2025, 01:27:28",NULL,49.8,49.8,49.8,2025-04-29 01:27:28.000,2025-04-29,2025,4,29,54952,[],()
78972,54718,21389,1,35.75$,"09/18/24,11:27:08 P.M.",NULL,35.75,35.75,35.75,2024-09-18 23:27:08.000,2024-09-18,2024,9,18,54718,[],()
80032,53560,21408,1,21.5 USD,"10/02/24,19:39:36","Apt. 567 949 Sporer Place, Blandaport, SC 57416-3338",21.5,21.5,21.5,2024-10-02 19:39:36.000,2024-10-02,2024,10,2,53560,[],()
81716,55478,21527,2,$ 62.00,18-November-2024;06:01:41 PM,,62.0,62.0,124.0,2024-11-18 18:01:41.000,2024-11-18,2024,11,18,55478,[],()
82053,53298,21378,1,€ 43.25,"28-Oct-2024,03:00:28 pm","411 Kathe Cliffs, North Henry, NH 82799-2597",51.9,51.9,51.9,2024-10-28 15:00:28.000,2024-10-28,2024,10,28,53298,[],()
78304,53677,21293,2,USD58.0,2025-03-20;15:46:39,,58.0,58.0,116.0,2025-03-20 15:46:39.000,2025-03-20,2025,3,20,53677,[],()
81045,54530,21338,1,52.75USD,"01:55:00 PM,26-Dec-2024",,52.75,52.75,52.75,2024-12-26 13:55:00.000,2024-12-26,2024,12,26,54530,[],()
81347,55659,21569,1,66.0 $,2024-12-12T14:19:36.782,NULL,66.0,66.0,66.0,2024-12-12 14:19:36.782,2024-12-12,2024,12,12,55659,[],()
74393,54279,21391,1,66.0 $,2025-06-11T03:32:33.582,,66.0,66.0,66.0,2025-06-11 03:32:33.582,2025-06-11,2025,6,11,54279,[],()
76303,55123,21054,1,17.25USD,"05:28:55 am,08/24/24","Suite 968 41583 Ward Trafficway, Vinceland, ND 65052",17.25,17.25,17.25,2024-08-24 05:28:55.000,2024-08-24,2024,8,24,55123,[],()
77007,53257,21505,1,$28.5,"21:28:27, 03/20/24","Suite 417 768 Kris Extensions, Lucasstad, CA 29368",28.5,28.5,28.5,2024-03-20 21:28:27.000,2024-03-20,2024,3,20,53257,[],()
78688,53495,21120,1,35.50$,11-Jan-2025;20:48,,35.5,35.5,35.5,2025-01-11 20:48:00.000,2025-01-11,2025,1,11,53495,[],()
73355,55200,21605,1,22.50EUR,06:09 19-Jun-2024,,27.0,27.0,27.0,2024-06-19 06:09:00.000,2024-06-19,2024,6,19,55200,[],()
78860,55725,21061,1,46.€,21:02;08/05/24,,55.199999999999996,55.199999999999996,55.2,2024-08-05 21:02:00.000,2024-08-05,2024,8,5,54061,[],()
74474,54468,21012,1,€58,17:37:02 03/24/25,,69.6,69.6,69.6,2025-03-24 17:37:02.000,2025-03-24,2025,3,24,54468,[],()
73737,54035,21479,1,61.99USD,2024-10-31T16:19:15,,61.99,61.99,61.99,2024-10-31 16:19:15.000,2024-10-31,2024,10,31,54035,[],()
74164,53354,21233,3,€ 43.75,"2024-10-01,17:31",,52.5,52.5,157.5,2024-10-01 17:31:00.000,2024-10-01,2024,10,1,53354,[],()
80291,53424,21194,1,22.99 $,"2025-07-06, 07:03:25 am",,22.99,22.99,22.99,2025-07-06 07:03:25.000,2025-07-06,2025,7,6,53424,[],()
78939,53918,21471,1,$21¢75,10/25/24;10:31,,2175.0,2175.0,2175.0,2024-10-25 10:31:00.000,2024-10-25,2024,10,25,53918,[],()
78490,54989,21427,2,EUR57.25,"2025-02-07, 03:24:56 PM",,68.7,68.7,137.4,2025-02-07 15:24:56.000,2025-02-07,2025,2,7,54989,[],()
74053,54774,21143,3,42.5 USD,29-May-2024;13:34,NULL,42.5,42.5,127.5,2024-05-29 13:34:00.000,2024-05-29,2024,5,29,54774,[],()
82795,53926,21501,1,21.5 EUR,2024-12-12T06:18:53,NULL,25.8,25.8,25.8,2024-12-12 06:18:53.000,2024-12-12,2024,12,12,53926,[],()
79772,53729,21360,1,50USD,06:23:38;21-Nov-2024,NULL,50.0,50.0,50.0,2024-11-21 06:23:38.000,2024-11-21,2024,11,21,53729,[],()
81014,55343,21555,1,USD65.0,"09/01/24,16:32:32","6350 Ronald Extension, West Nery, TX 08312-6487",65.0,65.0,65.0,2024-09-01 16:32:32.000,2024-09-01,2024,9,1,55343,[],()
77971,54883,21487,1,EUR 71.99, 7-Aug-2024;02:49:13 am,"37717 Manuela Highway, Katherinbury, ME 99764-7179",86.38799999999999,86.38799999999999,86.39,2024-08-07 02:49:13.000,2024-08-07,2024,8,7,54883,[],()
80979,54238,21328,1,33.5USD,2024-09-22T17:34:50,,33.5,33.5,33.5,2024-09-22 17:34:50.000,2024-09-22,2024,9,22,54238,[],()
78434,55083,21132,1,18.0 USD,03:03 24-Jun-2024,"Apt. 419 424 Hoeger River, Lake Tereseberg, NH 48582",18.0,18.0,18.0,2024-06-24 03:03:00.000,2024-06-24,2024,6,24,55083,[],()
76745,53133,21179,1,USD53.99,19:06:20 2024-11-02,,53.99,53.99,53.99,2024-11-02 19:06:20.000,2024-11-02,2024,11,2,53133,[],()
74552,55205,21200,1,$44¢00,"22:51,  2-December-2024","186 Hye River, West Anjanettefurt, MS 89834",4400.0,4400.0,4400.0,2024-12-02 22:51:00.000,2024-12-02,2024,12,2,55205,[],()
73857,54840,21445,1,USD48.5,2024-12-08T01:31:17,,48.5,48.5,48.5,2024-12-08 01:31:17.000,2024-12-08,2024,12,8,54840,[],()
80427,53354,21439,1,€41.50,"30-JAN-2025,05:59:10 AM",,49.8,49.8,49.8,2025-01-30 05:59:10.000,2025-01-30,2025,1,30,53354,[],()
77129,53605,21289,2,€ 51.5,"23-Dec-2024, 11:48",,61.8,61.8,123.6,2024-12-23 11:48:00.000,2024-12-23,2024,12,23,53605,[],()
78848,54699,21050,1,USD 13.25, 1-Oct-2024;07:36,"739 Brittanie Meadow, Georgestad, HI 88488-8779",13.25,13.25,13.25,2024-10-01 07:36:00.000,2024-10-01,2024,10,1,54699,[],()
77238,54154,21125,2,16.0 €,2024-03-27T00:15:09.111,NULL,19.2,19.2,38.4,2024-03-27 00:15:09.111,2024-03-27,2024,3,27,54154,[],()
77140,54163,21188,2,USD 50,13.08.2024 15:10:10,,50.0,50.0,100.0,2024-08-13 15:10:10.000,2024-08-13,2024,8,13,54163,[],()
78435,54786,21230,1,28USD,"13-February-2025,20:27:40",,28.0,28.0,28.0,2025-02-13 20:27:40.000,2025-02-13,2025,2,13,54786,[],()
78317,54919,21422,1,23.50EUR,"2024-11-12,01:15:26",,28.2,28.2,28.2,2024-11-12 01:15:26.000,2024-11-12,2024,11,12,54919,[],()
74030,53059,20953,1,45.50EUR,11/17/24 10:39:01,"Suite 442 993 Kohler Streets, West Lucila, HI 05615",54.6,54.6,54.6,2024-11-17 10:39:01.000,2024-11-17,2024,11,17,53059,[],()
73854,55333,21306,1,36.25EUR,"31-May-2024, 01:54","Suite 297 9010 Schowalter Mews, New Trey, UT 18272",43.5,43.5,43.5,2024-05-31 01:54:00.000,2024-05-31,2024,5,31,55333,[],()
76329,55727,20999,5,€29.0,2024-03-11T11:58:36.956,,34.8,34.8,174.0,2024-03-11 11:58:36.956,2024-03-11,2024,3,11,55727,[],()
78995,54111,21036,1,65. €,Thu Oct 17 03:14:26 2024,"Apt. 630 518 Sam Bypass, Sammiemouth, AZ 56517-4693",78.0,78.0,78.0,2024-10-17 03:14:26.000,2024-10-17,2024,10,17,54111,[],()
81433,55013,21380,1,37.00$,2025-03-21T09:57:49,NULL,37.0,37.0,37.0,2025-03-21 09:57:49.000,2025-03-21,2025,3,21,55013,[],()
74387,53093,21342,3,EUR47.75,08:34:26;09/11/24,,57.3,57.3,171.9,2024-09-11 08:34:26.000,2024-09-11,2024,9,11,53093,[],()
78422,53818,21276,1,$28.,2025-03-13T22:42:29.710,,28.0,28.0,28.0,2025-03-13 22:42:29.710,2025-03-13,2025,3,13,53818,[],()
74821,53666,21503,3,66.25 USD,2024-09-08T21:32:40,"152 Kimberly Way, Johnathonside, OK 06116",66.25,66.25,198.75,2024-09-08 21:32:40.000,2024-09-08,2024,9,8,53666,[],()
74935,54389,21220,1,13.5EUR,09:58:08 am 06/30/24,"Suite 899 8617 Huels Underpass, Spencerport, SD 88263",16.2,16.2,16.2,2024-06-30 09:58:08.000,2024-06-30,2024,6,30,54389,[],()
76660,53971,21647,5,68.50$,"23:34:25, 7-Dec-2024",NULL,68.5,68.5,342.5,2024-12-07 23:34:25.000,2024-12-07,2024,12,7,53971,[],()
81426,55556,21386,1,USD42.0," 2-JAN-2025, 04:43:46 AM",,42.0,42.0,42.0,2025-01-02 04:43:46.000,2025-01-02,2025,1,2,54850,[],()
81005,53348,21565,1,62.5 $,2025-02-16T16:16:57,,62.5,62.5,62.5,2025-02-16 16:16:57.000,2025-02-16,2025,2,16,53348,[],()
78803,53052,21077,4,$63¢75,2024-08-18 03:09:16,,6375.0,6375.0,25500.0,2024-08-18 03:09:16.000,2024-08-18,2024,8,18,53052,[],()
74697,55313,20966,2,€ 39.5,2025-03-13T00:18:00,,47.4,47.4,94.8,2025-03-13 00:18:00.000,2025-03-13,2025,3,13,53102,[],()
74343,55600,21635,1,24.99$,2025-01-11 09:52:30,NULL,24.99,24.99,24.99,2025-01-11 09:52:30.000,2025-01-11,2025,1,11,55600,[],()
83163,53758,21059,1,48.00 $,13:00 12-Mar-2025,,48.0,48.0,48.0,2025-03-12 13:00:00.000,2025-03-12,2025,3,12,53758,[],()
81239,54488,21276,1,30.USD,"07:11:31 PM, 2024-08-31",NULL,30.0,30.0,30.0,2024-08-31 19:11:31.000,2024-08-31,2024,8,31,54488,[],()
82497,53209,20919,1,74$99¢,"02:31:48 AM, 11-Mar-2025",,7499.0,7499.0,7499.0,2025-03-11 02:31:48.000,2025-03-11,2025,3,11,53209,[],()
74098,53096,21543,1,26.00 USD,02:06;03/10/25,,26.0,26.0,26.0,2025-03-10 02:06:00.000,2025-03-10,2025,3,10,53096,[],()
82253,54343,21517,2,64.$,2024-12-07T15:30:32,,64.0,64.0,128.0,2024-12-07 15:30:32.000,2024-12-07,2024,12,7,54343,[],()
80220,53842,21534,1,$26¢50,2025-02-01T16:10:50,NULL,2650.0,2650.0,2650.0,2025-02-01 16:10:50.000,2025-02-01,2025,2,1,53842,[],()
75871,54519,21064,1,41.00 USD," 2-MAY-2025,09:57:10",,41.0,41.0,41.0,2025-05-02 09:57:10.000,2025-05-02,2025,5,2,54519,[],()
80821,55766,21373,1,20.5 $,13:01 17-MAY-2024,,20.5,20.5,20.5,2024-05-17 13:01:00.000,2024-05-17,2024,5,17,55766,[],()
76159,54394,21368,2,25.75USD,"19:47:52, 30-Aug-2024",,25.75,25.75,51.5,2024-08-30 19:47:52.000,2024-08-30,2024,8,30,54394,[],()
77664,53597,21621,2,€ 44.25,"01/29/25,19:35",,53.1,53.1,106.2,2025-01-29 19:35:00.000,2025-01-29,2025,1,29,53597,[],()
81099,55560,21633,1,$73.,2025-06-26T17:11:58.540,,73.0,73.0,73.0,2025-06-26 17:11:58.540,2025-06-26,2025,6,26,55560,[],()
77062,53134,21654,1,16.50$,12:03:20 am 06/30/24,,16.5,16.5,16.5,2024-06-30 00:03:20.000,2024-06-30,2024,6,30,53134,[],()
83054,55705,21436,3,33.99 USD,"04:06:06 P.M., 20-May-2025",,33.99,33.99,101.97,2025-05-20 16:06:06.000,2025-05-20,2025,5,20,55705,[],()
75661,53122,21203,1,$35.50,2025-04-10T11:02:31.811,,35.5,35.5,35.5,2025-04-10 11:02:31.811,2025-04-10,2025,4,10,53122,[],()
78709,53160,21284,5,EUR 20.00,15:21:44  7-June-2024,"Suite 394 691 Schroeder Oval, South Elvin, RI 55571",24.0,24.0,120.0,2024-06-07 15:21:44.000,2024-06-07,2024,6,7,53160,[],()
79829,53321,21596,1,48.00 €,"04:10:14 am, 06/26/25","1148 Frida Groves, Queenton, MD 13673",57.599999999999994,57.599999999999994,57.6,2025-06-26 04:10:14.000,2025-06-26,2025,6,26,53321,[],()
73410,53194,20969,2,17. USD,"06/14/24,10:13:52",NULL,17.0,17.0,34.0,2024-06-14 10:13:52.000,2024-06-14,2024,6,14,53194,[],()
79295,55314,21640,1,54.25 $,"07/24/24,06:42:21 P.M.","49948 Koch Station, Moonhaven, IL 76683",54.25,54.25,54.25,2024-07-24 18:42:21.000,2024-07-24,2024,7,24,55314,[],()
73333,53100,21558,1,$22¢25,01/03/25 01:50:11 A.M.,NULL,2225.0,2225.0,2225.0,2025-01-03 01:50:11.000,2025-01-03,2025,1,3,53100,[],()
82085,55740,21503,1,€ 64.0,"10/02/24,10:32:16 AM",,76.8,76.8,76.8,2024-10-02 10:32:16.000,2024-10-02,2024,10,2,55740,[],()
78696,55277,20922,1,$66.99,24-Oct-2024 00:28,,66.99,66.99,66.99,2024-10-24 00:28:00.000,2024-10-24,2024,10,24,55277,[],()
78267,54024,21022,1,$ 65.5,19:23:20 03/17/25,"Apt. 375 71885 Beatty Walks, Gottliebside, MN 03506-1035",65.5,65.5,65.5,2025-03-17 19:23:20.000,2025-03-17,2025,3,17,54024,[],()
75837,53366,21058,1,$ 49.,2025-02-10 14:30:53,,49.0,49.0,49.0,2025-02-10 14:30:53.000,2025-02-10,2025,2,10,53366,[],()
75208,53561,21615,1,$49.,17:44:26 11/07/25,"Suite 375 471 Deneen Grove, North Johanne, SD 80377",49.0,49.0,49.0,2025-11-07 17:44:26.000,2025-11-07,2025,11,7,53561,[],()
78072,54803,20940,1,EUR 62.75,2024-06-17T17:30:58,"1505 Ned Glens, Lake Kymberlymouth, TX 87651-5022",75.3,75.3,75.3,2024-06-17 17:30:58.000,2024-06-17,2024,6,17,54803,[],()
82016,54331,21142,4,33€75¢,"27-Mar-2025, 11:12:38",NULL,4050.0,4050.0,16200.0,2025-03-27 11:12:38.000,2025-03-27,2025,3,27,54331,[],()
82059,55006,21271,1,25.50 USD,2024-06-28T09:20:17,NULL,25.5,25.5,25.5,2024-06-28 09:20:17.000,2024-06-28,2024,6,28,55006,[],()
80860,53531,21275,2,65.0 EUR,"07:51:20 am,2024-07-03",,78.0,78.0,156.0,2024-07-03 07:51:20.000,2024-07-03,2024,7,3,53531,[],()
76557,53953,21645,3,EUR 52.99,"2024-09-18, 11:55:27 A.M.",NULL,63.588,63.588,190.76,2024-09-18 11:55:27.000,2024-09-18,2024,9,18,53953,[],()
77116,53105,20936,1,USD60.00,07:40 06/01/25,"Suite 247 31016 Greenfelder Land, North Cordell, OK 93296",60.0,60.0,60.0,2025-06-01 07:40:00.000,2025-06-01,2025,6,1,53105,[],()
75169,55424,21344,1,€49¢75,18:37;2024-10-04,"Apt. 845 1797 Tamisha Wells, Ortiztown, OK 16189",5970.0,5970.0,5970.0,2024-10-04 18:37:00.000,2024-10-04,2024,10,4,55424,[],()
79323,54740,21472,3,59.75USD,09/24/24 06:59:20 PM,,59.75,59.75,179.25,2024-09-24 18:59:20.000,2024-09-24,2024,9,24,54950,[],()
78963,54291,21024,1,$35¢25,"2025-03-26,18:17:57",,3525.0,3525.0,3525.0,2025-03-26 18:17:57.000,2025-03-26,2025,3,26,54291,[],()
79670,54882,21304,1,48.5 $,"04/20/25,12:41","Apt. 676 82800 Lesch Vista, Lake Juliusmouth, WY 03114",48.5,48.5,48.5,2025-04-20 12:41:00.000,2025-04-20,2025,4,20,54882,[],()
83045,54209,21654,1,USD17.00,"13-October-2024,03:45:13",,17.0,17.0,17.0,2024-10-13 03:45:13.000,2024-10-13,2024,10,13,54209,[],()
79802,55123,21030,1,USD20.0,18:12:06 01/07/25,,20.0,20.0,20.0,2025-01-07 18:12:06.000,2025-01-07,2025,1,7,55123,[],()
74376,55047,20983,1,€ 19.25,"2024-11-18,05:25:15 P.M.",,23.099999999999998,23.099999999999998,23.1,2024-11-18 17:25:15.000,2024-11-18,2024,11,18,55047,[],()
79621,55062,21112,2,USD31.00,"15:22, 21-AUG-2025",,31.0,31.0,62.0,2025-08-21 15:22:00.000,2025-08-21,2025,8,21,53047,[],()
74820,54324,21148,1,54. EUR,2025-02-10T07:12:34,,64.8,64.8,64.8,2025-02-10 07:12:34.000,2025-02-10,2025,2,10,54324,[],()
75110,53815,20987,1,€70¢99,02:27:39;11-December-2024,NULL,8518.8,8518.8,8518.8,2024-12-11 02:27:39.000,2024-12-11,2024,12,11,53815,[],()
83074,53052,21053,1,52.25 $,"08:53:56 PM,19-Nov-2024",,52.25,52.25,52.25,2024-11-19 20:53:56.000,2024-11-19,2024,11,19,53052,[],()
79541,55648,21059,1,49.25$,"2024-11-30,12:26:59 P.M.",NULL,49.25,49.25,49.25,2024-11-30 12:26:59.000,2024-11-30,2024,11,30,55648,[],()
78193,53091,21264,3,USD 40.50,"11-September-2024, 06:14","7708 Schmeler Mission, Adrienetown, FL 16203-6346",40.5,40.5,121.5,2024-09-11 06:14:00.000,2024-09-11,2024,9,11,53091,[],()
80170,54223,21457,1,71€75¢,17:18;23-May-2024,"84373 Stark Course, West Angle, OK 43852-1048",8610.0,8610.0,8610.0,2024-05-23 17:18:00.000,2024-05-23,2024,5,23,54223,[],()
74783,54728,21370,2,40.5 USD,"07:20, 01/19/25","Suite 337 965 Waters Streets, North Sherikaville, MI 01436-5971",40.5,40.5,81.0,2025-01-19 07:20:00.000,2025-01-19,2025,1,19,54728,[],()
81893,53352,21058,1,€48.50,16-October-2024;02:00:57,,58.199999999999996,58.199999999999996,58.2,2024-10-16 02:00:57.000,2024-10-16,2024,10,16,53352,[],()
79946,53777,21525,4,50.5USD,"2024-10-09, 05:25:10 pm",NULL,50.5,50.5,202.0,2024-10-09 17:25:10.000,2024-10-09,2024,10,9,53777,[],()
77619,54752,21080,1,$ 26.00,2024-07-23T11:08:01.038,NULL,26.0,26.0,26.0,2024-07-23 11:08:01.038,2024-07-23,2024,7,23,54752,[],()
74220,54937,21203,2,34.25 USD,2025-07-11T04:45:55.872,,34.25,34.25,68.5,2025-07-11 04:45:55.872,2025-07-11,2025,7,11,54937,[],()
77482,55058,21063,1,USD 53.5,"10:26, 2024-09-09","3740 Lemke Creek, Konopelskihaven, ME 71939-4348",53.5,53.5,53.5,2024-09-09 10:26:00.000,2024-09-09,2024,9,9,53583,[],()
79156,54397,21185,1,31.50 $,03:08:42 pm 2025-08-29,,31.5,31.5,31.5,2025-08-29 15:08:42.000,2025-08-29,2025,8,29,54397,[],()
82967,54269,20984,1,$35.00,05:42;03/19/25,,35.0,35.0,35.0,2025-03-19 05:42:00.000,2025-03-19,2025,3,19,54269,[],()
79010,53656,21524,3,USD61.00,"13:13:06, 2024-06-05","Suite 994 2026 Marks Mountain, West Melba, TN 86150",61.0,61.0,183.0,2024-06-05 13:13:06.000,2024-06-05,2024,6,5,55640,[],()
77902,54106,21275,2,69.$,01/01/25 06:47,NULL,69.0,69.0,138.0,2025-01-01 06:47:00.000,2025-01-01,2025,1,1,54106,[],()
82794,54179,21495,1,23.75USD,"2024-10-24,01:10:14 PM","699 Thelma Trace, Auerview, ME 26656-9545",23.75,23.75,23.75,2024-10-24 13:10:14.000,2024-10-24,2024,10,24,54179,[],()
79152,54361,20964,1,75.00EUR,"2024-09-01, 16:34:46","Apt. 162 373 Herminia Turnpike, Klockochester, TN 85340",90.0,90.0,90.0,2024-09-01 16:34:46.000,2024-09-01,2024,9,1,54361,[],()
73760,54971,21632,1,19$00¢,2024-05-24;04:07:34 PM,,1900.0,1900.0,1900.0,2024-05-24 16:07:34.000,2024-05-24,2024,5,24,54971,[],()
78849,54700,21104,1,18.00$,"11/17/24, 21:19",,18.0,18.0,18.0,2024-11-17 21:19:00.000,2024-11-17,2024,11,17,54700,[],()
75337,55007,21059,1,€ 46.0,"05:08:33 am, 11-January-2025",NULL,55.199999999999996,55.199999999999996,55.2,2025-01-11 05:08:33.000,2025-01-11,2025,1,11,55007,[],()
81129,54631,21463,1,74.75 $,11:42:42 09/24/24,,74.75,74.75,74.75,2024-09-24 11:42:42.000,2024-09-24,2024,9,24,54631,[],()
75741,54426,21393,1,USD 39.99,"07/21/25,02:37:23 A.M.",,39.99,39.99,39.99,2025-07-21 02:37:23.000,2025-07-21,2025,7,21,54426,[],()
79223,55785,21394,2,42.25USD,06:27:19 AM 2025-03-03,,42.25,42.25,84.5,2025-03-03 06:27:19.000,2025-03-03,2025,3,3,55785,[],()
78921,53027,21500,4,€ 74.75,08:57:46;01/29/25,,89.7,89.7,358.8,2025-01-29 08:57:46.000,2025-01-29,2025,1,29,53027,[],()
77654,55351,21152,1,$27¢00,16-Oct-2024;08:00:23,NULL,2700.0,2700.0,2700.0,2024-10-16 08:00:23.000,2024-10-16,2024,10,16,55351,[],()
80724,55243,21127,1,55.5USD,2024-11-27T15:24:37.852,"Suite 111 72920 Weldon Motorway, North Lyndsay, DE 39837-2172",55.5,55.5,55.5,2024-11-27 15:24:37.852,2024-11-27,2024,11,27,55243,[],()
81670,53629,21223,2,€ 73.99,2025-01-02;01:50:05 AM,NULL,88.788,88.788,177.58,2025-01-02 01:50:05.000,2025-01-02,2025,1,2,53629,[],()
82787,54162,21309,1,USD43.5,"12:35:13 A.M.,2025-02-26",NULL,43.5,43.5,43.5,2025-02-26 00:35:13.000,2025-02-26,2025,2,26,54162,[],()
79022,55320,21107,1,$65¢00,"2025-06-04, 01:54:38","Suite 126 584 Dominic Village, McClureport, IA 22450-5496",6500.0,6500.0,6500.0,2025-06-04 01:54:38.000,2025-06-04,2025,6,4,55320,[],()
82995,53897,21175,3,25.75$,"23-July-2024, 21:51",,25.75,25.75,77.25,2024-07-23 21:51:00.000,2024-07-23,2024,7,23,53897,[],()
75539,54588,21487,1,$68¢99,"23-FEB-2025,16:47:02",NULL,6899.0,6899.0,6899.0,2025-02-23 16:47:02.000,2025-02-23,2025,2,23,54588,[],()
81147,54412,21528,1,USD72.75,2024-11-29T12:15:20.579,,72.75,72.75,72.75,2024-11-29 12:15:20.579,2024-11-29,2024,11,29,54412,[],()
81968,54355,21413,1,$59.00,"10:00:46 pm, 2025-02-14",NULL,59.0,59.0,59.0,2025-02-14 22:00:46.000,2025-02-14,2025,2,14,54355,[],()
82042,55066,21387,2,€14.,17-Jun-2024 12:58:43,"Suite 400 49273 Kathie Valley, Krisside, LA 02417-4051",16.8,16.8,33.6,2024-06-17 12:58:43.000,2024-06-17,2024,6,17,55066,[],()
75333,55059,21287,1,EUR64.25,"17:37,2024-11-28","3323 Tyrone Fords, Reynoldsville, MI 77044",77.1,77.1,77.1,2024-11-28 17:37:00.000,2024-11-28,2024,11,28,55059,[],()
78316,55543,21020,1,61.5USD,Sat Jun 21 03:22:12 2025,,61.5,61.5,61.5,2025-06-21 03:22:12.000,2025-06-21,2025,6,21,55543,[],()
78598,55085,21554,1,33.99 $,"09:26,12-MAR-2025",,33.99,33.99,33.99,2025-03-12 09:26:00.000,2025-03-12,2025,3,12,55085,[],()
75761,54700,21287,1,65.00USD,13:40:27; 2-July-2024,NULL,65.0,65.0,65.0,2024-07-02 13:40:27.000,2024-07-02,2024,7,2,54700,[],()
77233,53350,21431,1,62.25$,"19:54:56, 16-Sep-2024",NULL,62.25,62.25,62.25,2024-09-16 19:54:56.000,2024-09-16,2024,9,16,53131,[],()
80831,54922,21078,1,71.0USD,16:11:07;04/22/25,"Apt. 372 6348 Medhurst Crossroad, West Marcellestad, WV 09088",71.0,71.0,71.0,2025-04-22 16:11:07.000,2025-04-22,2025,4,22,54922,[],()
77322,53900,21040,2,EUR 57.5,2025-03-17T12:22:38.308,NULL,69.0,69.0,138.0,2025-03-17 12:22:38.308,2025-03-17,2025,3,17,53900,[],()
75468,54461,21541,1,€ 54.50,"04/05/25,08:54:02",,65.39999999999999,65.39999999999999,65.4,2025-04-05 08:54:02.000,2025-04-05,2025,4,5,54461,[],()
82241,53502,20952,1,41.75 $,"2024-10-07,17:01:31",,41.75,41.75,41.75,2024-10-07 17:01:31.000,2024-10-07,2024,10,7,53502,[],()
80677,54161,21461,2,USD 46.75,"10:56:53 A.M., 2025-03-23",,46.75,46.75,93.5,2025-03-23 10:56:53.000,2025-03-23,2025,3,23,54161,[],()
82308,53460,21497,1,$ 68.75,2025-01-12T05:45:57.211,,68.75,68.75,68.75,2025-01-12 05:45:57.211,2025-01-12,2025,1,12,53460,[],()
80932,54444,21059,1,49.99USD,18:03:41 08/10/24,NULL,49.99,49.99,49.99,2024-08-10 18:03:41.000,2024-08-10,2024,8,10,54444,[],()
81453,53633,21513,2,€44.75,2024-08-30 11:13:54,NULL,53.699999999999996,53.699999999999996,107.4,2024-08-30 11:13:54.000,2024-08-30,2024,8,30,53633,[],()
80249,54915,21328,1,$ 37.0,01:37:56 pm 11/29/24,NULL,37.0,37.0,37.0,2024-11-29 13:37:56.000,2024-11-29,2024,11,29,54915,[],()
76789,53253,21251,1,24.0 $,23:02;21-Jul-2024,,24.0,24.0,24.0,2024-07-21 23:02:00.000,2024-07-21,2024,7,21,53253,[],()
75713,55662,21266,2,57.75€,2024-04-20;02:13,"63870 Weber Wells, North Jess, NE 53256-9430",69.3,69.3,138.6,2024-04-20 02:13:00.000,2024-04-20,2024,4,20,55662,[],()
80547,53287,21432,3,$74.75,19:03;04/17/24,NULL,74.75,74.75,224.25,2024-04-17 19:03:00.000,2024-04-17,2024,4,17,53287,[],()
79158,54691,21039,1,33€99¢,05/14/25 19:53:38,"Suite 874 74687 Margie Viaduct, Weldonberg, KS 93860",4078.7999999999997,4078.7999999999997,4078.8,2025-05-14 19:53:38.000,2025-05-14,2025,5,14,54691,[],()
76772,54407,21043,1,15.25$,"06:03:31 A.M.,2024-11-23",,15.25,15.25,15.25,2024-11-23 06:03:31.000,2024-11-23,2024,11,23,54407,[],()
79287,55695,21264,1,38.0$,2025-03-20;13:37,"21602 Olene Glens, New Susan, WY 43279",38.0,38.0,38.0,2025-03-20 13:37:00.000,2025-03-20,2025,3,20,55695,[],()
76343,53272,21455,1,$57.0,"23:49,04/04/25","Apt. 523 198 Feeney Villages, Lake Russell, WI 64045",57.0,57.0,57.0,2025-04-04 23:49:00.000,2025-04-04,2025,4,4,53272,[],()
77443,55811,21292,1,EUR 41.5,"01:00:42,23-April-2024",,49.8,49.8,49.8,2024-04-23 01:00:42.000,2024-04-23,2024,4,23,55811,[],()
79947,53800,21536,1,€ 66.00,"2024-09-22, 04:30:30 A.M.","24122 Denesik Brooks, Kuvalisfort, VT 20339-9632",79.2,79.2,79.2,2024-09-22 04:30:30.000,2024-09-22,2024,9,22,53800,[],()
80519,53915,21573,1,24€,2025-01-25T11:23:51,"Suite 952 4246 Wolf Greens, East Dominick, GA 15935",28.799999999999997,28.799999999999997,28.8,2025-01-25 11:23:51.000,2025-01-25,2025,1,25,53915,[],()
76418,54013,21281,5,$ 71.25,2024-09-12 05:24:09,,71.25,71.25,356.25,2024-09-12 05:24:09.000,2024-09-12,2024,9,12,54013,[],()
82752,53935,21414,1,USD35.99,"02:47:48 pm, 16-AUG-2024",,35.99,35.99,35.99,2024-08-16 14:47:48.000,2024-08-16,2024,8,16,53935,[],()
81470,55394,21067,1,USD57,"12:05:36 am,06/03/24",NULL,57.0,57.0,57.0,2024-06-03 00:05:36.000,2024-06-03,2024,6,3,55394,[],()
73977,55606,21539,2,$63.99,09:20:52 A.M.;31-May-2025,NULL,63.99,63.99,127.98,2025-05-31 09:20:52.000,2025-05-31,2025,5,31,55606,[],()
78242,54205,21125,2,€18.,14:23 2024-08-30,NULL,21.599999999999998,21.599999999999998,43.2,2024-08-30 14:23:00.000,2024-08-30,2024,8,30,54205,[],()
80275,53790,21134,3,$ 54.99,2025-01-13T01:04:11,,54.99,54.99,164.97,2025-01-13 01:04:11.000,2025-01-13,2025,1,13,53790,[],()
75020,55223,21099,1,32.75$,02:30:51 P.M. 22-August-2025,"Apt. 957 46976 Kohler Mews, Kochmouth, RI 47600-9969",32.75,32.75,32.75,2025-08-22 14:30:51.000,2025-08-22,2025,8,22,55223,[],()
82698,54961,21368,1,EUR 26.5,"03:08:08 AM,28-DEC-2024",NULL,31.799999999999997,31.799999999999997,31.8,2024-12-28 03:08:08.000,2024-12-28,2024,12,28,54961,[],()
77728,54748,21212,1,32.USD,11:53:35 pm 2025-02-03,NULL,32.0,32.0,32.0,2025-02-03 23:53:35.000,2025-02-03,2025,2,3,54748,[],()
82250,54906,21407,3,EUR30.0,2024-10-28;07:14:45 AM,,36.0,36.0,108.0,2024-10-28 07:14:45.000,2024-10-28,2024,10,28,54906,[],()
78289,55030,21505,1,26.25 €,"2025-01-29, 15:05","634 Reanna Circle, Cremintown, GA 15499",31.5,31.5,31.5,2025-01-29 15:05:00.000,2025-01-29,2025,1,29,55030,[],()
78419,53037,21370,1,42.99USD,2024-09-05T05:22:49,,42.99,42.99,42.99,2024-09-05 05:22:49.000,2024-09-05,2024,9,5,53037,[],()
81881,54047,21331,1,$ 62.0, 7-APR-2025 05:24:55,"6834 Nikolaus Landing, Natalyaport, NM 05463-1339",62.0,62.0,62.0,2025-04-07 05:24:55.000,2025-04-07,2025,4,7,54047,[],()
79071,53493,21005,1,USD 15.00,"21-November-2024,02:39:45 pm",,15.0,15.0,15.0,2024-11-21 14:39:45.000,2024-11-21,2024,11,21,53493,[],()
79766,53902,21405,1,42.5 EUR,02:07:02 PM;12/21/24,,51.0,51.0,51.0,2024-12-21 14:07:02.000,2024-12-21,2024,12,21,54992,[],()
78025,53955,21287,1,USD 65.0,08:27:14 02/08/25,,65.0,65.0,65.0,2025-02-08 08:27:14.000,2025-02-08,2025,2,8,53955,[],()
82994,55542,21148,1,56.75 USD,2025-02-07T10:37:21,,56.75,56.75,56.75,2025-02-07 10:37:21.000,2025-02-07,2025,2,7,55542,[],()
80003,54851,21573,2,25.50USD,22-Nov-2024;02:52,,25.5,25.5,51.0,2024-11-22 02:52:00.000,2024-11-22,2024,11,22,54851,[],()
78415,53882,21600,1,$44¢99,"11:21, 2024-03-29",,4499.0,4499.0,4499.0,2024-03-29 11:21:00.000,2024-03-29,2024,3,29,53882,[],()
82912,55036,21383,3,€37.75,"2025-07-29, 07:55:15",,45.3,45.3,135.9,2025-07-29 07:55:15.000,2025-07-29,2025,7,29,55036,[],()
75799,54225,21119,1,€37¢99,01/30/25 15:29:01,,4558.8,4558.8,4558.8,2025-01-30 15:29:01.000,2025-01-30,2025,1,30,54225,[],()
80374,54299,21233,1,$ 41.50,18.01.2025  8:31:31,NULL,41.5,41.5,41.5,2025-01-18 08:31:31.000,2025-01-18,2025,1,18,54299,[],()
82472,54389,20945,1,33.25USD,2024-06-29T06:26:36,,33.25,33.25,33.25,2024-06-29 06:26:36.000,2024-06-29,2024,6,29,54389,[],()
77630,54980,21341,3,48.00$,"2024-03-16,18:21",NULL,48.0,48.0,144.0,2024-03-16 18:21:00.000,2024-03-16,2024,3,16,54980,[],()
75944,55459,20996,1,€44¢25,"2025-03-04,06:13:41 PM","47201 Bettina Neck, Port Santiago, NH 92164-7449",5310.0,5310.0,5310.0,2025-03-04 18:13:41.000,2025-03-04,2025,3,4,55459,[],()
78354,55092,21605,3,23.5€,"07:56:12, 2025-03-10",,28.2,28.2,84.6,2025-03-10 07:56:12.000,2025-03-10,2025,3,10,55092,[],()
76982,53220,20948,1,76.99 USD,06:05:21 06/22/24,"40178 Koch Light, New Lore, NY 97284-4893",76.99,76.99,76.99,2024-06-22 06:05:21.000,2024-06-22,2024,6,22,53220,[],()
74805,53119,21003,1,USD37.,"01:29:11 A.M.,01/16/25","7174 Stoltenberg Bypass, Bennettborough, AK 44181-1880",37.0,37.0,37.0,2025-01-16 01:29:11.000,2025-01-16,2025,1,16,53119,[],()
74712,53645,21494,5,€23.00,19:00:44;28-Dec-2024,NULL,27.599999999999998,27.599999999999998,138.0,2024-12-28 19:00:44.000,2024-12-28,2024,12,28,53645,[],()
81851,53144,21291,1,29.5USD,10/29/24 03:14:34,,29.5,29.5,29.5,2024-10-29 03:14:34.000,2024-10-29,2024,10,29,53144,[],()
73426,54432,21498,2,$ 21.5,2024-05-04T06:38:06,"Apt. 823 452 Alejandra Wells, Elihaven, MD 49067",21.5,21.5,43.0,2024-05-04 06:38:06.000,2024-05-04,2024,5,4,54432,[],()
76205,55797,21214,5,USD 60.50, 6-AUG-2024 05:22:49 A.M.,NULL,60.5,60.5,302.5,2024-08-06 05:22:49.000,2024-08-06,2024,8,6,55797,[],()
80139,54708,21047,1,55.25$,2024-07-20T18:40:43.818,,55.25,55.25,55.25,2024-07-20 18:40:43.818,2024-07-20,2024,7,20,54708,[],()
80668,55217,21232,1,60.0$,29-APR-2025 10:29:49 P.M.,NULL,60.0,60.0,60.0,2025-04-29 22:29:49.000,2025-04-29,2025,4,29,55217,[],()
79118,54251,21252,1,49.0 USD,2025-01-21T12:27:02,"21478 White Plain, Lasonyaview, OK 44346-6352",49.0,49.0,49.0,2025-01-21 12:27:02.000,2025-01-21,2025,1,21,54251,[],()
75375,55816,21123,1,66.99 USD, 1-DEC-2024 05:39:48,,66.99,66.99,66.99,2024-12-01 05:39:48.000,2024-12-01,2024,12,1,55816,[],()
77985,53125,21381,3,$37.50,2024-12-06T08:42:10,,37.5,37.5,112.5,2024-12-06 08:42:10.000,2024-12-06,2024,12,6,53125,[],()
77531,53674,21030,1,€23¢50,17:57:17;18-October-2024,"135 Herman Ports, South Heriberto, ND 47661-4951",2820.0,2820.0,2820.0,2024-10-18 17:57:17.000,2024-10-18,2024,10,18,53674,[],()
80538,55659,20972,1,$ 59.50, 8-April-2025;03:05:22 P.M.,NULL,59.5,59.5,59.5,2025-04-08 15:05:22.000,2025-04-08,2025,4,8,55659,[],()
76208,55745,21489,1,USD62.00,"12/02/24,18:51:24","Apt. 855 850 Wyman Falls, Lake Edgardofort, DE 34725",62.0,62.0,62.0,2024-12-02 18:51:24.000,2024-12-02,2024,12,2,55745,[],()
76350,55497,21084,3,71.0$,08:16:25 pm;2025-03-05,,71.0,71.0,213.0,2025-03-05 20:16:25.000,2025-03-05,2025,3,5,55497,[],()
80706,54639,20953,1,USD 48.25,"15:10:40, 2025-02-26",,48.25,48.25,48.25,2025-02-26 15:10:40.000,2025-02-26,2025,2,26,54639,[],()
74796,53882,21347,1,$ 45.5,"11:06:26,12/29/24","91843 Simone Passage, Lashandachester, NM 85233-0871",45.5,45.5,45.5,2024-12-29 11:06:26.000,2024-12-29,2024,12,29,53882,[],()
77045,54374,21655,1,EUR 28.00,13.12.2024  8:16:16,,33.6,33.6,33.6,2024-12-13 08:16:16.000,2024-12-13,2024,12,13,54374,[],()
75470,53975,21137,2,USD44.00,"02:32:14, 2025-09-16",,44.0,44.0,88.0,2025-09-16 02:32:14.000,2025-09-16,2025,9,16,53975,[],()
79470,54197,21557,1,USD 64.5,"04:46, 09/02/24",NULL,64.5,64.5,64.5,2024-09-02 04:46:00.000,2024-09-02,2024,9,2,54197,[],()
81463,53961,20983,1,$16¢25,"05:01,25-JUL-2024","7905 Soraya Plaza, South Wilton, NE 83678",1625.0,1625.0,1625.0,2024-07-25 05:01:00.000,2024-07-25,2024,7,25,53961,[],()
80627,54835,21285,1,67.00$,2025-02-14T12:32:36,,67.0,67.0,67.0,2025-02-14 12:32:36.000,2025-02-14,2025,2,14,54835,[],()
77516,54202,21386,1,$42.75,2025-02-06T18:31:43.273,"799 Lesch Lakes, Port Simoneland, KY 92472-8071",42.75,42.75,42.75,2025-02-06 18:31:43.273,2025-02-06,2025,2,6,54202,[],()
74913,53756,21632,1,19.25USD,"10:16:02 pm,26-Jun-2025",,19.25,19.25,19.25,2025-06-26 22:16:02.000,2025-06-26,2025,6,26,53756,[],()
80732,54837,21232,4,$60.,2025-01-20T18:56:57,NULL,60.0,60.0,240.0,2025-01-20 18:56:57.000,2025-01-20,2025,1,20,54837,[],()
81907,53953,21353,1,$ 22.25,17:57:15 29-NOV-2024,NULL,22.25,22.25,22.25,2024-11-29 17:57:15.000,2024-11-29,2024,11,29,53953,[],()
73990,54358,21548,1,69.75 EUR,"22:14,18-November-2024","Suite 414 3635 Sanford Mews, East Marcellus, GA 77188",83.7,83.7,83.7,2024-11-18 22:14:00.000,2024-11-18,2024,11,18,55218,[],()
77455,55231,21625,1,EUR 29.5,2024-10-30 08:15:35 A.M.,,35.4,35.4,35.4,2024-10-30 08:15:35.000,2024-10-30,2024,10,30,55231,[],()
78998,55737,20925,2,$43.00,"2025-01-22, 11:00:00 AM",,43.0,43.0,86.0,2025-01-22 11:00:00.000,2025-01-22,2025,1,22,55737,[],()
74150,53268,21391,1,65.25$,27-JUL-2024 04:01:36,,65.25,65.25,65.25,2024-07-27 04:01:36.000,2024-07-27,2024,7,27,53268,[],()
73996,55091,21517,1,$ 66.5,2024-12-04T13:06:40,"Suite 962 19897 Emmerich Cove, Roseliahaven, MI 95564-3602",66.5,66.5,66.5,2024-12-04 13:06:40.000,2024-12-04,2024,12,4,55091,[],()
73734,53237,21333,1,$28.00,Fri Jun 13 01:22:25 2025,NULL,28.0,28.0,28.0,2025-06-13 01:22:25.000,2025-06-13,2025,6,13,54334,[],()
78048,55276,21428,1,26.0$,"29-April-2025, 05:23",NULL,26.0,26.0,26.0,2025-04-29 05:23:00.000,2025-04-29,2025,4,29,55276,[],()
82790,54697,21611,1,USD 60.50,"2024-08-26, 08:27",,60.5,60.5,60.5,2024-08-26 08:27:00.000,2024-08-26,2024,8,26,54697,[],()
75317,53902,21269,1,$ 32.99,"01/11/25,03:26:25",,32.99,32.99,32.99,2025-01-11 03:26:25.000,2025-01-11,2025,1,11,54992,[],()
75646,54831,21286,1,€35.99,"09:29,2024-10-08","Apt. 433 97902 Edmundo Stravenue, Ernserchester, NC 63669",43.188,43.188,43.19,2024-10-08 09:29:00.000,2024-10-08,2024,10,8,54831,[],()
82339,53923,21307,1,69.50$,"01/31/25, 08:34",NULL,69.5,69.5,69.5,2025-01-31 08:34:00.000,2025-01-31,2025,1,31,53923,[],()
73958,55223,21327,2,74.50USD,02/09/25;17:15,,74.5,74.5,149.0,2025-02-09 17:15:00.000,2025-02-09,2025,2,9,55223,[],()
79130,54496,21380,1,€33¢00,08:29 11/29/24,,3960.0,3960.0,3960.0,2024-11-29 08:29:00.000,2024-11-29,2024,11,29,54496,[],()
82229,54333,20945,1,38.75$,2024-09-11T21:27:47,"6544 Gertrude Expressway, New Rupertfort, AK 77202-2898",38.75,38.75,38.75,2024-09-11 21:27:47.000,2024-09-11,2024,9,11,54333,[],()
77889,53245,21570,1,47.50$,"22:25, 21-Mar-2024","957 Sawayn Walks, Lake Kelvin, NE 06419-2537",47.5,47.5,47.5,2024-03-21 22:25:00.000,2024-03-21,2024,3,21,53245,[],()
74272,53165,21605,1,€ 23.50,2024-10-10;07:33:20 AM,"662 Brooks Dam, West Joshua, SC 13091",28.2,28.2,28.2,2024-10-10 07:33:20.000,2024-10-10,2024,10,10,53165,[],()
82422,54605,21528,1,71.75 €,2024-12-22T09:31:02,,86.1,86.1,86.1,2024-12-22 09:31:02.000,2024-12-22,2024,12,22,54605,[],()
82131,55329,21135,2,72.00$,"12:53:11 P.M., 2024-04-11",NULL,72.0,72.0,144.0,2024-04-11 12:53:11.000,2024-04-11,2024,4,11,55329,[],()
76201,53401,21630,4,€54.50,"16:29, 2024-11-29",,65.39999999999999,65.39999999999999,261.6,2024-11-29 16:29:00.000,2024-11-29,2024,11,29,53401,[],()
73784,54886,21450,1,USD48.0,"2024-08-24,04:54:11","Apt. 901 2216 Kovacek Rue, Armstrongport, TX 90686",48.0,48.0,48.0,2024-08-24 04:54:11.000,2024-08-24,2024,8,24,54886,[],()
80774,55693,21353,2,EUR17.,"18-June-2024,06:31:57 A.M.",NULL,20.4,20.4,40.8,2024-06-18 06:31:57.000,2024-06-18,2024,6,18,55693,[],()
78651,55051,21107,3,EUR 66.75, 6-OCT-2024;10:46:10 PM,"Suite 912 3035 Dorian Skyway, Juliettabury, AR 23448",80.1,80.1,240.3,2024-10-06 22:46:10.000,2024-10-06,2024,10,6,55051,[],()
75400,53819,21067,1,57.00 EUR,"2024-12-18, 02:14:46 P.M.",,68.39999999999999,68.39999999999999,68.4,2024-12-18 14:14:46.000,2024-12-18,2024,12,18,53819,[],()
82961,54131,21426,1,25.0USD,07:16:17 pm;01/21/25,,25.0,25.0,25.0,2025-01-21 19:16:17.000,2025-01-21,2025,1,21,54131,[],()
74965,54649,21496,1,EUR 28.99,"02:34:31 A.M., 30-APR-2025", ,34.788,34.788,34.79,2025-04-30 02:34:31.000,2025-04-30,2025,4,30,54649,[],()
81155,54495,21306,1,$ 35.75,2024-12-29T21:02:40.994,NULL,35.75,35.75,35.75,2024-12-29 21:02:40.994,2024-12-29,2024,12,29,54495,[],()
79308,54304,21477,1,€ 46.99,"08:35:36 AM, 11/16/24",NULL,56.388,56.388,56.39,2024-11-16 08:35:36.000,2024-11-16,2024,11,16,54304,[],()
79785,53597,21320,2,$37¢00,15:34:29  9-Aug-2024,NULL,3700.0,3700.0,7400.0,2024-08-09 15:34:29.000,2024-08-09,2024,8,9,53597,[],()
73939,54499,21284,1,$22¢75,07/17/24 02:22,NULL,2275.0,2275.0,2275.0,2024-07-17 02:22:00.000,2024-07-17,2024,7,17,54499,[],()
81547,55787,21434,1,$ 45.,"06:07:51 am, 2024-07-24",,45.0,45.0,45.0,2024-07-24 06:07:51.000,2024-07-24,2024,7,24,55787,[],()
77751,55180,21386,1,$ 44.5,08:10 19-Mar-2025,NULL,44.5,44.5,44.5,2025-03-19 08:10:00.000,2025-03-19,2025,3,19,55180,[],()
79375,54805,21013,5,USD45.50,21-Oct-2024 22:32,NULL,45.5,45.5,227.5,2024-10-21 22:32:00.000,2024-10-21,2024,10,21,54805,[],()
81495,55572,21209,1,$ 45.00,2024-08-10T06:15:18,NULL,45.0,45.0,45.0,2024-08-10 06:15:18.000,2024-08-10,2024,8,10,55572,[],()
74760,54424,21336,2,61.50 $,2024-12-01T23:26:21.444,,61.5,61.5,123.0,2024-12-01 23:26:21.444,2024-12-01,2024,12,1,54424,[],()
79417,54232,21609,1,17.25 $,2025-05-20 08:17:22 PM,,17.25,17.25,17.25,2025-05-20 20:17:22.000,2025-05-20,2025,5,20,54232,[],()
79347,55451,21645,1,$51.99,"12:43, 2024-07-17",NULL,51.99,51.99,51.99,2024-07-17 12:43:00.000,2024-07-17,2024,7,17,55451,[],()
74765,55349,21483,2,68.99USD,29-December-2024 07:55:59 A.M.,,68.99,68.99,137.98,2024-12-29 07:55:59.000,2024-12-29,2024,12,29,55349,[],()
81219,55000,21186,2,40.00 $,"2025-01-18,22:54",,40.0,40.0,80.0,2025-01-18 22:54:00.000,2025-01-18,2025,1,18,55000,[],()
79368,54194,21146,1,USD 45.50,"21-JUL-2024, 00:08:45","Apt. 822 8018 Robt Crest, South Mylesland, LA 65804",45.5,45.5,45.5,2024-07-21 00:08:45.000,2024-07-21,2024,7,21,54194,[],()
79159,55764,21035,2,42USD,"07:15, 2025-04-10",,42.0,42.0,84.0,2025-04-10 07:15:00.000,2025-04-10,2025,4,10,55764,[],()
80900,53533,21452,1,USD 21.50,"2024-10-17, 12:48",NULL,21.5,21.5,21.5,2024-10-17 12:48:00.000,2024-10-17,2024,10,17,53533,[],()
80640,54673,20958,1,€33.0,00:02;05/21/25,"Apt. 715 3409 Stamm Station, Christianberg, SD 13319-4565",39.6,39.6,39.6,2025-05-21 00:02:00.000,2025-05-21,2025,5,21,54673,[],()
73972,53129,21188,1,EUR50.0,"17:12:52,2024-11-22",,60.0,60.0,60.0,2024-11-22 17:12:52.000,2024-11-22,2024,11,22,53129,[],()
78035,54845,21227,2,EUR 70.00,01:40;2025-01-18,,84.0,84.0,168.0,2025-01-18 01:40:00.000,2025-01-18,2025,1,18,54845,[],()
80193,53698,21470,2,68.50 EUR,"17:05,2024-09-15",NULL,82.2,82.2,164.4,2024-09-15 17:05:00.000,2024-09-15,2024,9,15,53698,[],()
78391,53165,21317,1,USD 48.75,08:23:23 am 02/29/24,NULL,48.75,48.75,48.75,2024-02-29 08:23:23.000,2024-02-29,2024,2,29,53165,[],()
77046,53036,21538,3,EUR 70.75,"07:07:16, 2024-11-23",,84.89999999999999,84.89999999999999,254.7,2024-11-23 07:07:16.000,2024-11-23,2024,11,23,53036,[],()
82742,54192,21374,1,21.50$,"2024-12-06, 19:03","1809 Nga Trail, West Blancaburgh, NC 51856-2450",21.5,21.5,21.5,2024-12-06 19:03:00.000,2024-12-06,2024,12,6,54192,[],()
81221,53268,20979,2,$68.,"04:20:20 A.M.,15-January-2025",NULL,68.0,68.0,136.0,2025-01-15 04:20:20.000,2025-01-15,2025,1,15,53268,[],()
75087,55617,21244,1,18.5 USD,"02:55, 27-OCT-2024",NULL,18.5,18.5,18.5,2024-10-27 02:55:00.000,2024-10-27,2024,10,27,55617,[],()
76792,55801,21378,1,40€99¢,"11:14,2025-03-20",,4918.8,4918.8,4918.8,2025-03-20 11:14:00.000,2025-03-20,2025,3,20,55801,[],()
75972,54754,21517,1,65.50 EUR,11.03.2025 20:16:16,,78.6,78.6,78.6,2025-11-03 20:16:16.000,2025-11-03,2025,11,3,54941,[],()
77182,53034,20921,1,$ 18.5,2024-07-23 18:03,"831 Emil Trace, Port Deannaburgh, AZ 75136",18.5,18.5,18.5,2024-07-23 18:03:00.000,2024-07-23,2024,7,23,53034,[],()
79168,55000,21558,2,22.5 $,"17:17,2024-10-09",,22.5,22.5,45.0,2024-10-09 17:17:00.000,2024-10-09,2024,10,9,55000,[],()
74313,54229,21359,1,74.00EUR,2024-07-14T22:45:33.848,,88.8,88.8,88.8,2024-07-14 22:45:33.848,2024-07-14,2024,7,14,54229,[],()
82642,55309,20998,3,44USD,"22-Sep-2024, 01:49:40",,44.0,44.0,132.0,2024-09-22 01:49:40.000,2024-09-22,2024,9,22,55309,[],()
81475,53380,21189,1,$27,"22-September-2024,04:37:16 P.M.",,27.0,27.0,27.0,2024-09-22 16:37:16.000,2024-09-22,2024,9,22,53380,[],()
81641,53020,21468,1,$ 70.99,"09:56,  2-Apr-2025",,70.99,70.99,70.99,2025-04-02 09:56:00.000,2025-04-02,2025,4,2,53020,[],()
80615,54089,21120,2,39.00 EUR,04/15/25 18:48:01,,46.8,46.8,93.6,2025-04-15 18:48:01.000,2025-04-15,2025,4,15,54089,[],()
80150,53459,21321,3,71.75 €,04/02/25 07:16,,86.1,86.1,258.3,2025-04-02 07:16:00.000,2025-04-02,2025,4,2,53459,[],()
80815,54066,21336,1,€63,"09:34:57,2025-03-16",,75.6,75.6,75.6,2025-03-16 09:34:57.000,2025-03-16,2025,3,16,54066,[],()
77860,54514,21482,1,43.USD,06/25/24;08:09:10,,43.0,43.0,43.0,2024-06-25 08:09:10.000,2024-06-25,2024,6,25,54514,[],()
74655,55478,21592,2,26.25€,20.03.2025 17:13:13,NULL,31.5,31.5,63.0,2025-03-20 17:13:13.000,2025-03-20,2025,3,20,55478,[],()
76434,54866,20936,1,USD 57.75,18:02; 8-JAN-2025,,57.75,57.75,57.75,2025-01-08 18:02:00.000,2025-01-08,2025,1,8,55780,[],()
81076,53052,21088,1,$53.,"03:11:34, 09/27/24",,53.0,53.0,53.0,2024-09-27 03:11:34.000,2024-09-27,2024,9,27,53052,[],()
73557,54429,21321,2,74.99 €,12:08:30 PM 10/29/25,,89.98799999999999,89.98799999999999,179.98,2025-10-29 12:08:30.000,2025-10-29,2025,10,29,54429,[],()
81197,54055,21383,1,37€25¢,"18:36:16, 2024-12-19",NULL,4470.0,4470.0,4470.0,2024-12-19 18:36:16.000,2024-12-19,2024,12,19,54055,[],()
80116,53490,21112,1,USD28.0,"13:05:56, 04/10/25",,28.0,28.0,28.0,2025-04-10 13:05:56.000,2025-04-10,2025,4,10,53490,[],()
77846,55422,21115,1,$ 70,2024-10-25T08:38:45.815,"633 Ali Lights, Jeanettaland, TN 53792-4270",70.0,70.0,70.0,2024-10-25 08:38:45.815,2024-10-25,2024,10,25,55422,[],()
75650,54926,21127,1,54.75€,2024-07-10T01:51:17,,65.7,65.7,65.7,2024-07-10 01:51:17.000,2024-07-10,2024,7,10,54926,[],()
78370,53036,21480,2,USD68.99,2024-09-11T12:22:19,NULL,68.99,68.99,137.98,2024-09-11 12:22:19.000,2024-09-11,2024,9,11,53036,[],()
81661,54885,21493,2,31.99$," 8-October-2024,05:12:27",NULL,31.99,31.99,63.98,2024-10-08 05:12:27.000,2024-10-08,2024,10,8,54885,[],()
78787,54172,21495,1,€ 21.5,20-May-2025;04:06:06,NULL,25.8,25.8,25.8,2025-05-20 04:06:06.000,2025-05-20,2025,5,20,54172,[],()
79126,54054,21394,5,47.25$,"08:04,2025-02-09",,47.25,47.25,236.25,2025-02-09 08:04:00.000,2025-02-09,2025,2,9,54054,[],()
79068,55363,21648,1,32€50¢,2024-09-25;22:26,"Suite 463 82388 Prosacco Pass, Gusfurt, CT 10522",3900.0,3900.0,3900.0,2024-09-25 22:26:00.000,2024-09-25,2024,9,25,55363,[],()
81753,55322,21643,2,$ 30.99,2025-03-31T03:55:13,"4125 Zemlak Stravenue, East Shanti, CA 37646",30.99,30.99,61.98,2025-03-31 03:55:13.000,2025-03-31,2025,3,31,55322,[],()
77361,55524,21198,1,$40¢75,"05:16,2024-11-28",NULL,4075.0,4075.0,4075.0,2024-11-28 05:16:00.000,2024-11-28,2024,11,28,55524,[],()
73936,53043,21643,1,EUR34.,"09/20/24, 11:18",,40.8,40.8,40.8,2024-09-20 11:18:00.000,2024-09-20,2024,9,20,53043,[],()
74171,55464,21210,1,19.0USD,"06:21, 2025-04-17",,19.0,19.0,19.0,2025-04-17 06:21:00.000,2025-04-17,2025,4,17,55464,[],()
79378,53449,21380,1,38.25USD,"2024-10-14,05:54:21 am","Suite 220 303 Macejkovic Curve, West Marcelinemouth, DE 56814-3380",38.25,38.25,38.25,2024-10-14 05:54:21.000,2024-10-14,2024,10,14,53449,[],()
77683,54108,21494,1,25.50$,"17-April-2025,04:36",NULL,25.5,25.5,25.5,2025-04-17 04:36:00.000,2025-04-17,2025,4,17,54108,[],()
77689,53690,21368,5,$ 27.99,"03/07/25, 02:41:25 A.M.",NULL,27.99,27.99,139.95,2025-03-07 02:41:25.000,2025-03-07,2025,3,7,53690,[],()
76469,54133,21539,1,€ 68.99,05/30/25;22:01,,82.788,82.788,82.79,2025-05-30 22:01:00.000,2025-05-30,2025,5,30,54133,[],()
79411,55365,21176,1,23.0EUR,18:42  1-Jan-2025,,27.599999999999998,27.599999999999998,27.6,2025-01-01 18:42:00.000,2025-01-01,2025,1,1,55365,[],()
82412,55533,21238,1,EUR 59.5,"12/17/24,16:52",,71.39999999999999,71.39999999999999,71.4,2024-12-17 16:52:00.000,2024-12-17,2024,12,17,55533,[],()
73809,53300,21445,1,47.25$,22-Sep-2024;03:39,,47.25,47.25,47.25,2024-09-22 03:39:00.000,2024-09-22,2024,9,22,53300,[],()
80298,54867,20989,2,$64.99,11:40:18 18-Jan-2025,,64.99,64.99,129.98,2025-01-18 11:40:18.000,2025-01-18,2025,1,18,54867,[],()
75588,54912,21239,1,33.50 €,20:53:48;2025-05-18,NULL,40.199999999999996,40.199999999999996,40.2,2025-05-18 20:53:48.000,2025-05-18,2025,5,18,54912,[],()
77093,53362,21473,3,60.0$,"12-Jun-2024,02:58:45","Suite 862 7724 Ervin Point, Stromanburgh, DE 09314",60.0,60.0,180.0,2024-06-12 02:58:45.000,2024-06-12,2024,6,12,53362,[],()
75681,55777,21597,1,35.0EUR,"06/13/24, 04:24",,42.0,42.0,42.0,2024-06-13 04:24:00.000,2024-06-13,2024,6,13,55777,[],()
81304,54742,21138,1,USD36.25,"12/19/24,12:16:57 am","34688 Gutmann Mews, Lindville, CO 31271",36.25,36.25,36.25,2024-12-19 00:16:57.000,2024-12-19,2024,12,19,54742,[],()
82501,53120,21454,1,38.75 EUR,2024-09-23 18:00,NULL,46.5,46.5,46.5,2024-09-23 18:00:00.000,2024-09-23,2024,9,23,53120,[],()
80956,53175,21322,1,28 USD,2025-05-30T20:11:26.528,,28.0,28.0,28.0,2025-05-30 20:11:26.528,2025-05-30,2025,5,30,53175,[],()
80479,53034,21041,1,68.00USD,23:37 2024-08-10,NULL,68.0,68.0,68.0,2024-08-10 23:37:00.000,2024-08-10,2024,8,10,53034,[],()
80607,53443,21315,1,USD 63.99,09:47:49 11/11/24,"Suite 340 6980 Darryl Curve, New Bill, WV 88165",63.99,63.99,63.99,2024-11-11 09:47:49.000,2024-11-11,2024,11,11,53443,[],()
77005,54897,21076,3,$ 54.00,"03:57:24 pm,04/13/25","Suite 905 34554 Keeling Locks, South Teshamouth, NY 27860-4310",54.0,54.0,162.0,2025-04-13 15:57:24.000,2025-04-13,2025,4,13,54897,[],()
82160,55161,21269,1,32.00 USD,"20:21:29,03/18/25",,32.0,32.0,32.0,2025-03-18 20:21:29.000,2025-03-18,2025,3,18,55161,[],()
82628,53812,21057,1,36.99€,00:31:48 26-Jul-2025,"Apt. 817 7479 Gigi Via, Kennethville, ME 55804",44.388,44.388,44.39,2025-07-26 00:31:48.000,2025-07-26,2025,7,26,53812,[],()
76138,53583,21039,1,$35.50,"11:13:13, 14-October-2024",NULL,35.5,35.5,35.5,2024-10-14 11:13:13.000,2024-10-14,2024,10,14,53583,[],()
74478,53161,21061,1,€46.00,2024-08-11 08:04:17 A.M.,,55.199999999999996,55.199999999999996,55.2,2024-08-11 08:04:17.000,2024-08-11,2024,8,11,53161,[],()
80336,55710,21346,1,EUR 47.,"20:00,2024-09-23",,56.4,56.4,56.4,2024-09-23 20:00:00.000,2024-09-23,2024,9,23,55710,[],()
77257,53209,20960,1,24.5$,"16-Feb-2025, 22:28:24",,24.5,24.5,24.5,2025-02-16 22:28:24.000,2025-02-16,2025,2,16,53209,[],()
74102,54604,21408,1,€21¢50,12-October-2024 00:03,,2580.0,2580.0,2580.0,2024-10-12 00:03:00.000,2024-10-12,2024,10,12,53551,[],()
81540,55304,21592,2,USD29.99,27-February-2025 00:33,"Suite 319 586 Halvorson Lane, Lucioborough, MO 43284-4515",29.99,29.99,59.98,2025-02-27 00:33:00.000,2025-02-27,2025,2,27,55304,[],()
79761,53687,21368,3,USD 27.00,2024-06-01T02:19:00.871,NULL,27.0,27.0,81.0,2024-06-01 02:19:00.871,2024-06-01,2024,6,1,53687,[],()
83088,54910,21194,2,€ 19.25,"07/04/24,22:41",,23.099999999999998,23.099999999999998,46.2,2024-07-04 22:41:00.000,2024-07-04,2024,7,4,55177,[],()
78015,54142,21610,3,44.99USD,"09:45:09 am, 2024-10-11","50289 Farrell Shoal, Laraeburgh, ND 79333",44.99,44.99,134.97,2024-10-11 09:45:09.000,2024-10-11,2024,10,11,54142,[],()
77814,55158,21263,2,$59.00,07:34:47 13-March-2025,,59.0,59.0,118.0,2025-03-13 07:34:47.000,2025-03-13,2025,3,13,55158,[],()
81616,54538,21314,2,14.25€,16:21;19-March-2024,"Apt. 498 92763 Runolfsdottir Point, East Youlandaport, AR 39462",17.099999999999998,17.099999999999998,34.2,2024-03-19 16:21:00.000,2024-03-19,2024,3,19,54538,[],()
82502,53368,21612,1,66$,11-Sep-2024;08:29,"962 Hector Loaf, West Gladis, IN 56586",66.0,66.0,66.0,2024-09-11 08:29:00.000,2024-09-11,2024,9,11,53368,[],()
75454,53470,21056,1,47.00USD,11:36:25 am;2024-07-18,NULL,47.0,47.0,47.0,2024-07-18 11:36:25.000,2024-07-18,2024,7,18,53470,[],()
80360,53484,21154,1,71.99€,30-MAR-2025;15:02,,86.38799999999999,86.38799999999999,86.39,2025-03-30 15:02:00.000,2025-03-30,2025,3,30,53484,[],()
77603,54934,21617,1,€ 19.99, 5-OCT-2024;11:20:42 PM,,23.987999999999996,23.987999999999996,23.99,2024-10-05 23:20:42.000,2024-10-05,2024,10,5,54934,[],()
74844,54777,21114,1,62.75$,12/03/24 21:41,,62.75,62.75,62.75,2024-12-03 21:41:00.000,2024-12-03,2024,12,3,54777,[],()
80201,55545,21426,1,23.75$,2024-12-14T02:51:12,"Suite 151 91136 O'Connell Estate, Port Derekville, TN 02109",23.75,23.75,23.75,2024-12-14 02:51:12.000,2024-12-14,2024,12,14,55444,[],()
74850,53622,21595,3,50.00 €,"2024-11-21,01:42",NULL,60.0,60.0,180.0,2024-11-21 01:42:00.000,2024-11-21,2024,11,21,53622,[],()
78629,55811,21525,1,50.0 USD,"04:01:21 am,2024-04-23",,50.0,50.0,50.0,2024-04-23 04:01:21.000,2024-04-23,2024,4,23,55811,[],()
77746,53370,20942,1,$35.99,2025-02-21;12:59:59 A.M.,,35.99,35.99,35.99,2025-02-21 00:59:59.000,2025-02-21,2025,2,21,53370,[],()
82645,55430,21317,2,52 USD,2025-05-23T19:01:25.346,,52.0,52.0,104.0,2025-05-23 19:01:25.346,2025-05-23,2025,5,23,55430,[],()
79448,53753,21471,1,21.0 USD,18:31 11/30/24,"Suite 506 73656 Little Drive, Nienowborough, KS 14613-5937",21.0,21.0,21.0,2024-11-30 18:31:00.000,2024-11-30,2024,11,30,53753,[],()
81683,53957,21250,2,24.0$,20-February-2025;08:41,,24.0,24.0,48.0,2025-02-20 08:41:00.000,2025-02-20,2025,2,20,53957,[],()
76873,53644,21537,1,$16.99,09/27/24 12:50:26,,16.99,16.99,16.99,2024-09-27 12:50:26.000,2024-09-27,2024,9,27,53644,[],()
76455,53972,21348,1,USD 25.25,14-March-2025;14:17,NULL,25.25,25.25,25.25,2025-03-14 14:17:00.000,2025-03-14,2025,3,14,53972,[],()
78904,54097,21197,1,$68.,"26-JAN-2025,12:35",NULL,68.0,68.0,68.0,2025-01-26 12:35:00.000,2025-01-26,2025,1,26,54097,[],()
78536,54165,21618,1,EUR41.00,12/22/24 03:18:39,NULL,49.199999999999996,49.199999999999996,49.2,2024-12-22 03:18:39.000,2024-12-22,2024,12,22,54165,[],()
75500,55514,21035,1,42.5USD,"07/24/24, 01:40:05",,42.5,42.5,42.5,2024-07-24 01:40:05.000,2024-07-24,2024,7,24,55514,[],()
82878,55156,20986,1,€63.99,"10:16:57 AM, 28-April-2025",,76.788,76.788,76.79,2025-04-28 10:16:57.000,2025-04-28,2025,4,28,55156,[],()
73795,53229,21184,2,$69¢99,11:49:53 am 06/20/24,NULL,6999.0,6999.0,13998.0,2024-06-20 11:49:53.000,2024-06-20,2024,6,20,53229,[],()
80250,55097,21113,1,€ 51.0,"15:08:42,12-Apr-2025",,61.199999999999996,61.199999999999996,61.2,2025-04-12 15:08:42.000,2025-04-12,2025,4,12,55097,[],()
80293,53112,21585,1,$ 45.5,"17:17:30,08/22/25",,45.5,45.5,45.5,2025-08-22 17:17:30.000,2025-08-22,2025,8,22,53112,[],()
76370,54361,21473,3,$59.50,"2024-02-04, 20:47:44",,59.5,59.5,178.5,2024-02-04 20:47:44.000,2024-02-04,2024,2,4,54361,[],()
80025,53529,20955,1,USD 71.50,2024-12-16T04:56:39,NULL,71.5,71.5,71.5,2024-12-16 04:56:39.000,2024-12-16,2024,12,16,53529,[],()
82262,53881,21143,1,USD39.75,2025-03-04;20:06,,39.75,39.75,39.75,2025-03-04 20:06:00.000,2025-03-04,2025,3,4,53881,[],()
79987,53692,21138,1,€35.00,19:26:40 28-MAY-2024,,42.0,42.0,42.0,2024-05-28 19:26:40.000,2024-05-28,2024,5,28,53692,[],()
82854,54593,21483,1,EUR 69.5,12/20/24 04:25:16 A.M.,,83.39999999999999,83.39999999999999,83.4,2024-12-20 04:25:16.000,2024-12-20,2024,12,20,54593,[],()
75325,53914,21585,1,$45.0,2025-04-23;21:35:36,NULL,45.0,45.0,45.0,2025-04-23 21:35:36.000,2025-04-23,2025,4,23,53914,[],()
78018,53091,21175,2,EUR 23.5,2024-10-17;10:38,,28.2,28.2,56.4,2024-10-17 10:38:00.000,2024-10-17,2024,10,17,53091,[],()
82125,55321,21028,2,53.25 USD,"06/15/25, 23:19",NULL,53.25,53.25,106.5,2025-06-15 23:19:00.000,2025-06-15,2025,6,15,55321,[],()
75835,53805,21125,3,EUR13.0,04:00:15;2025-01-14,"58820 Zboncak Unions, Sylvieside, NE 78587-3949",15.6,15.6,46.8,2025-01-14 04:00:15.000,2025-01-14,2025,1,14,53805,[],()
74696,55576,21377,1,$48¢50,05/04/24 22:29,NULL,4850.0,4850.0,4850.0,2024-05-04 22:29:00.000,2024-05-04,2024,5,4,55576,[],()
82983,54347,21132,2,21.0 €,"01/21/25,03:57:11",,25.2,25.2,50.4,2025-01-21 03:57:11.000,2025-01-21,2025,1,21,54347,[],()
80359,55264,21501,1,25.00€,2025-05-26;23:02,,30.0,30.0,30.0,2025-05-26 23:02:00.000,2025-05-26,2025,5,26,55264,[],()
78032,54533,21272,1,64.25 €, 6-Mar-2025;05:13,NULL,77.1,77.1,77.1,2025-03-06 05:13:00.000,2025-03-06,2025,3,6,54533,[],()
77964,55232,20976,1,51.75$,"13-Feb-2025,03:39:44 pm","Suite 559 60491 Cummings Flats, Charleneside, NV 51293",51.75,51.75,51.75,2025-02-13 15:39:44.000,2025-02-13,2025,2,13,55232,[],()
75149,53365,20959,1,42.75 EUR,"29-MAY-2025, 03:03","Apt. 460 6727 Brakus Keys, West Ashton, WI 49594",51.3,51.3,51.3,2025-05-29 03:03:00.000,2025-05-29,2025,5,29,53365,[],()
74611,54434,21126,1,64 EUR,11:29:05 P.M. 03/31/25,,76.8,76.8,76.8,2025-03-31 23:29:05.000,2025-03-31,2025,3,31,54434,[],()
78646,55070,21271,1,€ 23, 4.02.2025 19:45:45,,27.599999999999998,27.599999999999998,27.6,2025-04-02 19:45:45.000,2025-04-02,2025,4,2,55070,[],()
75914,53609,21044,1,€ 23.50,09:00:31 A.M.;2024-11-10,,28.2,28.2,28.2,2024-11-10 09:00:31.000,2024-11-10,2024,11,10,53609,[],()
77451,55232,21002,1,40.25 USD,13.10.2025 21:09:09,,40.25,40.25,40.25,2025-10-13 21:09:09.000,2025-10-13,2025,10,13,55232,[],()
75677,54740,21427,2,$62¢50,18-November-2024 11:30:33 A.M.,,6250.0,6250.0,12500.0,2024-11-18 11:30:33.000,2024-11-18,2024,11,18,54950,[],()
74679,55217,21060,2,34.75 $,"10:38, 29-May-2025",NULL,34.75,34.75,69.5,2025-05-29 10:38:00.000,2025-05-29,2025,5,29,55217,[],()
76562,54042,21566,1,USD48.75,2024-10-31T04:46:02.746,NULL,48.75,48.75,48.75,2024-10-31 04:46:02.746,2024-10-31,2024,10,31,54042,[],()
81667,53622,21116,1,33.50 USD,"03:33:58 A.M., 2024-05-20",,33.5,33.5,33.5,2024-05-20 03:33:58.000,2024-05-20,2024,5,20,53622,[],()
80304,54644,21231,1,69.0 EUR,05/13/25;05:25:22 P.M.,,82.8,82.8,82.8,2025-05-13 17:25:22.000,2025-05-13,2025,5,13,54644,[],()
77549,55144,21194,3,23.75 USD,17.11.2024 14:48:48,,23.75,23.75,71.25,2024-11-17 14:48:48.000,2024-11-17,2024,11,17,53627,[],()
79617,54780,21222,1,75.50€,"17:35, 04/17/25",,90.6,90.6,90.6,2025-04-17 17:35:00.000,2025-04-17,2025,4,17,54780,[],()
78781,54446,21356,2,$ 13.99,10-NOV-2024;21:23:22,,13.99,13.99,27.98,2024-11-10 21:23:22.000,2024-11-10,2024,11,10,54446,[],()
82902,53313,21630,2,57.99USD, 5-December-2024;04:43:17 PM,,57.99,57.99,115.98,2024-12-05 16:43:17.000,2024-12-05,2024,12,5,53313,[],()
76620,54077,21170,4,USD 75.99,"13:08,27-MAR-2025","Suite 369 66134 Simonis Flats, Smithamshire, HI 41707-9843",75.99,75.99,303.96,2025-03-27 13:08:00.000,2025-03-27,2025,3,27,54077,[],()
75978,54840,21590,1,$30¢25,21:35:13 03/01/25,NULL,3025.0,3025.0,3025.0,2025-03-01 21:35:13.000,2025-03-01,2025,3,1,54840,[],()
83121,55218,21052,1,73.0USD,"01/26/25,15:46:01",,73.0,73.0,73.0,2025-01-26 15:46:01.000,2025-01-26,2025,1,26,55218,[],()
77756,55434,20977,5,21.25 EUR,04/18/25;12:19:52 am,"Suite 496 179 Raymon Port, Feilhaven, WY 08018",25.5,25.5,127.5,2025-04-18 00:19:52.000,2025-04-18,2025,4,18,55434,[],()
77717,55498,20941,1,21.25USD,"29-August-2024,03:20:01",,21.25,21.25,21.25,2024-08-29 03:20:01.000,2024-08-29,2024,8,29,55498,[],()
79115,53728,21263,1,56.0EUR,08/09/24;09:45:52 A.M.,"69910 Garth Drive, Cruickshankville, ID 24193-1514",67.2,67.2,67.2,2024-08-09 09:45:52.000,2024-08-09,2024,8,9,53728,[],()
78505,55768,21462,2,29.0 USD,19:40:02 11/27/24,,29.0,29.0,58.0,2024-11-27 19:40:02.000,2024-11-27,2024,11,27,55768,[],()
76687,54564,21359,1,71.99 $,"03:39:25 pm,12/21/24",,71.99,71.99,71.99,2024-12-21 15:39:25.000,2024-12-21,2024,12,21,54564,[],()
77853,53675,20920,1,USD 17.25, 3-March-2025;22:56:00,,17.25,17.25,17.25,2025-03-03 22:56:00.000,2025-03-03,2025,3,3,53675,[],()
82299,53266,21196,3,$39.25,"02/08/25,22:50",NULL,39.25,39.25,117.75,2025-02-08 22:50:00.000,2025-02-08,2025,2,8,53266,[],()
74794,53388,21122,1,USD 63.00,2025-01-04;07:24,,63.0,63.0,63.0,2025-01-04 07:24:00.000,2025-01-04,2025,1,4,53388,[],()
82716,53229,21263,2,59.0USD,02:44:27 2024-12-04,,59.0,59.0,118.0,2024-12-04 02:44:27.000,2024-12-04,2024,12,4,53229,[],()
74656,54342,21313,2,€ 33,2024-08-07T18:12:07,,39.6,39.6,79.2,2024-08-07 18:12:07.000,2024-08-07,2024,8,7,54342,[],()
73671,55615,20945,1,38.99USD,04:42;2025-04-30,NULL,38.99,38.99,38.99,2025-04-30 04:42:00.000,2025-04-30,2025,4,30,55615,[],()
73612,54356,21614,1,$73.0,12/14/24 21:10,,73.0,73.0,73.0,2024-12-14 21:10:00.000,2024-12-14,2024,12,14,54356,[],()
80475,55225,21173,3,20.0 €,06:29;16-Apr-2024,NULL,24.0,24.0,72.0,2024-04-16 06:29:00.000,2024-04-16,2024,4,16,55225,[],()
76895,55575,21621,4,44.5USD,2025-01-23T02:55:57,,44.5,44.5,178.0,2025-01-23 02:55:57.000,2025-01-23,2025,1,23,55575,[],()
78997,54058,21560,1,$ 55.75,11/17/24 03:01,,55.75,55.75,55.75,2024-11-17 03:01:00.000,2024-11-17,2024,11,17,54058,[],()
76544,55717,20985,1,35.75$,01:50 05/09/25,"Suite 277 2194 Stepanie Pines, New Brunildaside, IA 18173-1301",35.75,35.75,35.75,2025-05-09 01:50:00.000,2025-05-09,2025,5,9,55717,[],()
75126,54951,21041,1,USD 70.5,"02/24/25,13:42:46",,70.5,70.5,70.5,2025-02-24 13:42:46.000,2025-02-24,2025,2,24,54951,[],()
77220,54885,21190,1,36.5 USD,"15:51:14,2024-05-12",NULL,36.5,36.5,36.5,2024-05-12 15:51:14.000,2024-05-12,2024,5,12,54885,[],()
74525,54822,21024,1,$37.25,06:02:57 03/14/24,,37.25,37.25,37.25,2024-03-14 06:02:57.000,2024-03-14,2024,3,14,54822,[],()
78560,55630,21518,1,USD 53.50,13:30:23;17-August-2024,,53.5,53.5,53.5,2024-08-17 13:30:23.000,2024-08-17,2024,8,17,55630,[],()
73445,54493,21025,1,$53.,2025-02-05T05:31:26,NULL,53.0,53.0,53.0,2025-02-05 05:31:26.000,2025-02-05,2025,2,5,54493,[],()
82638,55021,21337,1,72.0 €,04/28/25 03:28:12 am,,86.39999999999999,86.39999999999999,86.4,2025-04-28 03:28:12.000,2025-04-28,2025,4,28,55021,[],()
77542,55708,21482,2,$ 45.00,19:20;04/10/25,"Suite 387 4411 Sylvester Roads, Bartontown, NM 88548",45.0,45.0,90.0,2025-04-10 19:20:00.000,2025-04-10,2025,4,10,55708,[],()
82993,53227,21084,1,71$99¢,12:32:33 AM;09/04/24,,7199.0,7199.0,7199.0,2024-09-04 00:32:33.000,2024-09-04,2024,9,4,53227,[],()
81885,54350,21048,1,$ 65.50, 9-July-2024;01:02:56,NULL,65.5,65.5,65.5,2024-07-09 01:02:56.000,2024-07-09,2024,7,9,54350,[],()
77256,54975,21495,1,19.75 EUR,"08/25/24, 01:50",,23.7,23.7,23.7,2024-08-25 01:50:00.000,2024-08-25,2024,8,25,54975,[],()
81664,55183,21041,2,71€,"2024-12-11,17:03",,85.2,85.2,170.4,2024-12-11 17:03:00.000,2024-12-11,2024,12,11,55183,[],()
80504,54540,20984,1,32.25USD,"23:00:27,23-DEC-2024",NULL,32.25,32.25,32.25,2024-12-23 23:00:27.000,2024-12-23,2024,12,23,54540,[],()
82722,53487,20989,1,68.99 €,"2025-01-21,14:26:18",NULL,82.788,82.788,82.79,2025-01-21 14:26:18.000,2025-01-21,2025,1,21,53487,[],()
76181,55204,20982,1,40.75EUR,"08/19/24, 08:11",,48.9,48.9,48.9,2024-08-19 08:11:00.000,2024-08-19,2024,8,19,55204,[],()
80986,55645,21293,2,$57.50,"09/13/24,12:25:39 pm",NULL,57.5,57.5,115.0,2024-09-13 12:25:39.000,2024-09-13,2024,9,13,55645,[],()
79613,53318,21262,2,USD33.50,2024-11-29T03:27:37.467,,33.5,33.5,67.0,2024-11-29 03:27:37.467,2024-11-29,2024,11,29,53318,[],()
83166,54792,21413,1,57.99 USD,03/24/25;03:25:29,NULL,57.99,57.99,57.99,2025-03-24 03:25:29.000,2025-03-24,2025,3,24,54792,[],()
73378,54187,21122,4,€63¢25,23:01:01;2025-02-19,,7590.0,7590.0,30360.0,2025-02-19 23:01:01.000,2025-02-19,2025,2,19,54187,[],()
76240,53946,20978,1,55.00USD,11:00 28-Nov-2024,NULL,55.0,55.0,55.0,2024-11-28 11:00:00.000,2024-11-28,2024,11,28,53946,[],()
78146,55313,21419,1,USD 67.0,2025-02-15T03:13:55,"Suite 141 88240 Len Crest, Jerrybury, ME 36471",67.0,67.0,67.0,2025-02-15 03:13:55.000,2025-02-15,2025,2,15,53102,[],()
80678,53942,21114,1,$60.99,01/31/25;05:42:00,"Apt. 359 9104 Sherita Union, Shantellemouth, ID 26418",60.99,60.99,60.99,2025-01-31 05:42:00.000,2025-01-31,2025,1,31,53942,[],()
73988,53081,21104,5,22.50 USD,Sun Dec 29 06:34:20 2024,,22.5,22.5,112.5,2024-12-29 06:34:20.000,2024-12-29,2024,12,29,53081,[],()
75353,54810,21375,1,EUR 28.00,11/12/24 05:46:54 AM,NULL,33.6,33.6,33.6,2024-11-12 05:46:54.000,2024-11-12,2024,11,12,54810,[],()
83148,55625,21273,2,€72,2024-08-09T07:53:10.859,,86.39999999999999,86.39999999999999,172.8,2024-08-09 07:53:10.859,2024-08-09,2024,8,9,55625,[],()
82121,55239,21506,1,33.5USD,24-Jan-2025;21:17,NULL,33.5,33.5,33.5,2025-01-24 21:17:00.000,2025-01-24,2025,1,24,55239,[],()
79590,54663,21313,1,36.0EUR,28-NOV-2024;07:39:46 A.M.,,43.199999999999996,43.199999999999996,43.2,2024-11-28 07:39:46.000,2024-11-28,2024,11,28,54663,[],()
73479,55168,21456,5,$51.75,"13:35,27-March-2025",,51.75,51.75,258.75,2025-03-27 13:35:00.000,2025-03-27,2025,3,27,55168,[],()
80299,53972,21514,1,USD34.50,"28-Sep-2024,01:13:00 P.M.",NULL,34.5,34.5,34.5,2024-09-28 13:13:00.000,2024-09-28,2024,9,28,53972,[],()
77629,54410,21628,1,USD26.00,"08:46:38 AM, 2024-05-29",,26.0,26.0,26.0,2024-05-29 08:46:38.000,2024-05-29,2024,5,29,54410,[],()
74018,53481,21620,1,$14.75,"2025-06-29, 05:15:11 am","871 Connelly Expressway, Shanahanborough, NC 98984-1129",14.75,14.75,14.75,2025-06-29 05:15:11.000,2025-06-29,2025,6,29,53481,[],()
77478,53114,21479,2,$ 58.5,"07:17, 09/04/24",NULL,58.5,58.5,117.0,2024-09-04 07:17:00.000,2024-09-04,2024,9,4,53114,[],()
76786,54468,20967,1,EUR 37.5,"31-October-2024,16:55:11",NULL,45.0,45.0,45.0,2024-10-31 16:55:11.000,2024-10-31,2024,10,31,54468,[],()
78823,53239,21649,3,$21.50,02:08:43 pm 2024-08-02,NULL,21.5,21.5,64.5,2024-08-02 14:08:43.000,2024-08-02,2024,8,2,53239,[],()
74029,53290,21173,1,USD19.99,13:15 25-August-2024,"Apt. 284 49962 Roberts Plaza, New Dwaynemouth, NM 82980-1979",19.99,19.99,19.99,2024-08-25 13:15:00.000,2024-08-25,2024,8,25,53290,[],()
81901,55078,21283,2,41.75 €,08/29/24 13:38:20,,50.1,50.1,100.2,2024-08-29 13:38:20.000,2024-08-29,2024,8,29,55078,[],()
82651,53303,21449,2,€67¢99,02/24/25 22:50:36,NULL,8158.799999999999,8158.799999999999,16317.6,2025-02-24 22:50:36.000,2025-02-24,2025,2,24,53303,[],()
77372,55164,21448,2,15.5$,07.01.2025 21:23:23,"Suite 437 66141 Jamie Glen, New Corrie, MT 29335-3474",15.5,15.5,31.0,2025-07-01 21:23:23.000,2025-07-01,2025,7,1,55164,[],()
79942,55182,21238,2,USD56.75,2024-09-24T09:32:27,"Apt. 200 4094 Kathleen Drives, Jarredmouth, ND 89315",56.75,56.75,113.5,2024-09-24 09:32:27.000,2024-09-24,2024,9,24,55182,[],()
82284,54650,21470,1,68.0 $,2024-10-05T23:28:26.270,,68.0,68.0,68.0,2024-10-05 23:28:26.270,2024-10-05,2024,10,5,53784,[],()
80488,55197,21133,1,USD70.99,"31-Aug-2025,08:43:54 PM",NULL,70.99,70.99,70.99,2025-08-31 20:43:54.000,2025-08-31,2025,8,31,55197,[],()
78033,54053,21165,1,15.50$,11:24:46 pm 2025-01-05,,15.5,15.5,15.5,2025-01-05 23:24:46.000,2025-01-05,2025,1,5,54053,[],()
75152,54105,21469,2,67.00 USD,"01:06,2024-11-24","507 Lorriane Ports, Wisozkchester, PA 54883",67.0,67.0,134.0,2024-11-24 01:06:00.000,2024-11-24,2024,11,24,54105,[],()
74437,54636,21567,1,EUR55,"21:17, 03/26/25",,66.0,66.0,66.0,2025-03-26 21:17:00.000,2025-03-26,2025,3,26,54636,[],()
81612,53038,21460,1,$ 33.,"2024-06-11,07:31:41 pm",NULL,33.0,33.0,33.0,2024-06-11 19:31:41.000,2024-06-11,2024,6,11,53038,[],()
77557,55198,21166,1,47.50 $,2025-04-11T20:08:17.405,NULL,47.5,47.5,47.5,2025-04-11 20:08:17.405,2025-04-11,2025,4,11,55198,[],()
80451,54071,21013,1,41.99$,01/31/25 01:07:07 P.M.,,41.99,41.99,41.99,2025-01-31 13:07:07.000,2025-01-31,2025,1,31,54071,[],()
74462,54898,21255,1,$ 39.0,"2024-10-23,18:00:12",NULL,39.0,39.0,39.0,2024-10-23 18:00:12.000,2024-10-23,2024,10,23,54898,[],()
79284,53452,21508,1,USD37.5,"08/21/25,12:21:55",NULL,37.5,37.5,37.5,2025-08-21 12:21:55.000,2025-08-21,2025,8,21,53452,[],()
74206,55655,21376,1,59.25$,23:46:53;20-Oct-2024,,59.25,59.25,59.25,2024-10-20 23:46:53.000,2024-10-20,2024,10,20,55655,[],()
81586,55665,21327,1,EUR75.0,2024-08-14T11:37:03,NULL,90.0,90.0,90.0,2024-08-14 11:37:03.000,2024-08-14,2024,8,14,55665,[],()
77180,54982,21575,1,$48¢00,02:33:56 pm 03/25/25,,4800.0,4800.0,4800.0,2025-03-25 14:33:56.000,2025-03-25,2025,3,25,54982,[],()
83133,53502,21270,1,72.25$,10:52 10-Nov-2024,NULL,72.25,72.25,72.25,2024-11-10 10:52:00.000,2024-11-10,2024,11,10,53502,[],()
74457,53645,21410,1,EUR27.25,"21:56,2024-09-26",,32.699999999999996,32.699999999999996,32.7,2024-09-26 21:56:00.000,2024-09-26,2024,9,26,53645,[],()
76597,55280,20972,3,USD58.0,01:37:36 pm;24-March-2024,"89353 Haag Mills, Dyanmouth, VA 69080",58.0,58.0,174.0,2024-03-24 13:37:36.000,2024-03-24,2024,3,24,55280,[],()
77992,53987,21413,1,$ 58.25,"12/28/24,04:51",,58.25,58.25,58.25,2024-12-28 04:51:00.000,2024-12-28,2024,12,28,53987,[],()
75582,54467,21305,1,48.5$,21-Jul-2024 18:25:31,,48.5,48.5,48.5,2024-07-21 18:25:31.000,2024-07-21,2024,7,21,54467,[],()
78735,54266,21488,2,24.5USD,"14:32,2024-11-01","5543 Dane Flats, Port Eddie, CT 42308-9323",24.5,24.5,49.0,2024-11-01 14:32:00.000,2024-11-01,2024,11,1,54266,[],()
80888,53144,21474,1,53.5$,2025-04-29T11:21:58,NULL,53.5,53.5,53.5,2025-04-29 11:21:58.000,2025-04-29,2025,4,29,53144,[],()
81030,53965,21306,2,32.USD,"10/18/24, 06:42:45","Apt. 969 3985 Hessel Light, Alanfort, SD 20439",32.0,32.0,64.0,2024-10-18 06:42:45.000,2024-10-18,2024,10,18,53965,[],()
75181,54441,21107,1,$ 63.0,11/30/24 16:10,NULL,63.0,63.0,63.0,2024-11-30 16:10:00.000,2024-11-30,2024,11,30,54441,[],()
77187,54513,21368,2,24.75 USD,"05:45:57 P.M., 2025-05-16","804 Dee Key, Port Moises, WA 60509",24.75,24.75,49.5,2025-05-16 17:45:57.000,2025-05-16,2025,5,16,54513,[],()
73399,55589,21337,1,68 USD,2025-01-11;10:59:46 A.M.,NULL,68.0,68.0,68.0,2025-01-11 10:59:46.000,2025-01-11,2025,1,11,55589,[],()
73696,55311,21455,1,55.25 $,"01/27/25,07:49:36",NULL,55.25,55.25,55.25,2025-01-27 07:49:36.000,2025-01-27,2025,1,27,55311,[],()
81301,54629,21570,1,50.0 USD,13:55:42 26-March-2025,"9395 Dinorah Burg, Lake Ezequieltown, AR 68635",50.0,50.0,50.0,2025-03-26 13:55:42.000,2025-03-26,2025,3,26,54629,[],()
73860,55207,21469,2,USD68,08:30:35 08/04/24,NULL,68.0,68.0,136.0,2024-08-04 08:30:35.000,2024-08-04,2024,8,4,55207,[],()
80357,54970,21135,5,76.75EUR,"27-DEC-2024,13:37","Apt. 875 4285 Dominique Prairie, Owenmouth, NH 22871",92.1,92.1,460.5,2024-12-27 13:37:00.000,2024-12-27,2024,12,27,54970,[],()
79391,54655,21620,1,12.99$,08.11.2024 20:21:21,,12.99,12.99,12.99,2024-08-11 20:21:21.000,2024-08-11,2024,8,11,54557,[],()
78322,55550,20984,1,USD 35.75, 1-Oct-2024 02:07:00 A.M.,NULL,35.75,35.75,35.75,2024-10-01 02:07:00.000,2024-10-01,2024,10,1,55550,[],()
77305,55174,21573,2,23.50 $,"2025-02-04, 06:16:15 am",,23.5,23.5,47.0,2025-02-04 06:16:15.000,2025-02-04,2025,2,4,55174,[],()
76474,53625,21321,1,70.25USD,"26-NOV-2024, 01:01:00",,70.25,70.25,70.25,2024-11-26 01:01:00.000,2024-11-26,2024,11,26,55651,[],()
74500,55288,21349,4,€60¢75,00:07 04/05/25,,7290.0,7290.0,29160.0,2025-04-05 00:07:00.000,2025-04-05,2025,4,5,55288,[],()
74361,54114,21036,1,61.25 USD,"07/30/24,15:03",NULL,61.25,61.25,61.25,2024-07-30 15:03:00.000,2024-07-30,2024,7,30,54114,[],()
82956,53201,21421,2,EUR 52.0,"04:13:35,10-MAR-2025","Apt. 659 5171 Ryan Fall, Katiaview, OK 04322-9244",62.4,62.4,124.8,2025-03-10 04:13:35.000,2025-03-10,2025,3,10,53201,[],()
79618,53182,21388,1,$47¢25,"07/27/24, 14:35:15",,4725.0,4725.0,4725.0,2024-07-27 14:35:15.000,2024-07-27,2024,7,27,53182,[],()
81913,55225,21447,1,67.75EUR,2025-04-30;14:15,"62921 Maggio Canyon, Lake Quinn, WY 39087",81.3,81.3,81.3,2025-04-30 14:15:00.000,2025-04-30,2025,4,30,55225,[],()
79624,53613,21414,2,USD32.5,"02/10/25, 07:08:39 am",NULL,32.5,32.5,65.0,2025-02-10 07:08:39.000,2025-02-10,2025,2,10,53613,[],()
75609,55498,21637,1,44.50 EUR,03/10/25 09:54:28,"Apt. 589 5448 Monroe Prairie, Port Hipolitoshire, NJ 40802-2429",53.4,53.4,53.4,2025-03-10 09:54:28.000,2025-03-10,2025,3,10,55498,[],()
80380,53996,21547,1,EUR 20.00,"2024-03-07,12:12:38 pm","Apt. 562 52645 Cole Dam, Wileyborough, CA 09701-4301",24.0,24.0,24.0,2024-03-07 12:12:38.000,2024-03-07,2024,3,7,53996,[],()
74217,54760,21410,1,EUR27.00,22:40:34;05/06/25,,32.4,32.4,32.4,2025-05-06 22:40:34.000,2025-05-06,2025,5,6,54760,[],()
73983,54182,21326,1,$74.50,14:33:45;2025-04-19,,74.5,74.5,74.5,2025-04-19 14:33:45.000,2025-04-19,2025,4,19,54182,[],()
82592,55527,21430,2,USD33.0,10/24/24 14:14:17,,33.0,33.0,66.0,2024-10-24 14:14:17.000,2024-10-24,2024,10,24,55527,[],()
76517,55187,21098,3,63€99¢,01/07/25 05:34,NULL,7678.799999999999,7678.799999999999,23036.4,2025-01-07 05:34:00.000,2025-01-07,2025,1,7,55187,[],()
78053,55175,21604,1,51.$,10/17/24 13:56,"Apt. 635 3235 Larkin Path, Shanaeburgh, HI 53157-3335",51.0,51.0,51.0,2024-10-17 13:56:00.000,2024-10-17,2024,10,17,55175,[],()
74802,54596,20998,1,47.0€,04/14/25;09:27:20 PM,,56.4,56.4,56.4,2025-04-14 21:27:20.000,2025-04-14,2025,4,14,54596,[],()
76970,54779,21184,1,USD 70.5,"04:00:13 P.M., 26-NOV-2024","3820 Torp Drive, East Brandee, CT 57053-9494",70.5,70.5,70.5,2024-11-26 16:00:13.000,2024-11-26,2024,11,26,54779,[],()
80518,54881,21273,1,$75,11/08/24 00:42,,75.0,75.0,75.0,2024-11-08 00:42:00.000,2024-11-08,2024,11,8,54881,[],()
73617,55493,21427,1,58.75€,"02:57:14,2024-07-03",NULL,70.5,70.5,70.5,2024-07-03 02:57:14.000,2024-07-03,2024,7,3,55493,[],()
77966,53868,21453,4,$ 71.5,"17:38:05,08/05/24",NULL,71.5,71.5,286.0,2024-08-05 17:38:05.000,2024-08-05,2024,8,5,53868,[],()
80736,54453,21519,5,50.75 EUR,28-MAY-2024;22:40:49,"Suite 295 5519 Koch Mountain, Binsville, MT 05088",60.9,60.9,304.5,2024-05-28 22:40:49.000,2024-05-28,2024,5,28,54453,[],()
78819,55818,21169,1,USD59.0,"08/05/24, 18:17","Apt. 603 6931 Roberts Glen, Lake Victorburgh, WI 41775",59.0,59.0,59.0,2024-08-05 18:17:00.000,2024-08-05,2024,8,5,55818,[],()
79682,53047,21269,1,32.99 €,Mon Oct 14 20:19:34 2024,"Apt. 323 1896 Windler Station, East Ismael, WA 20792-1706",39.588,39.588,39.59,2024-10-14 20:19:34.000,2024-10-14,2024,10,14,53047,[],()
73751,55132,21580,1,$ 65.00,"11-FEB-2025,09:51:21",NULL,65.0,65.0,65.0,2025-02-11 09:51:21.000,2025-02-11,2025,2,11,55132,[],()
76318,54769,21588,1,47.25 USD,"2025-04-05, 05:38:25",,47.25,47.25,47.25,2025-04-05 05:38:25.000,2025-04-05,2025,4,5,54769,[],()
82718,55786,21606,1,$18.00,"2025-04-13, 05:46:54 am",,18.0,18.0,18.0,2025-04-13 05:46:54.000,2025-04-13,2025,4,13,55786,[],()
75852,53115,21308,1,USD 62.75,26.03.2025 08:14:14,NULL,62.75,62.75,62.75,2025-03-26 08:14:14.000,2025-03-26,2025,3,26,53115,[],()
79695,54312,21250,1,EUR 24.,"09/30/24,13:09:30","961 Melvin Extensions, North Courtney, TX 20947-0624",28.799999999999997,28.799999999999997,28.8,2024-09-30 13:09:30.000,2024-09-30,2024,9,30,54312,[],()
78557,53710,20931,1,$56.0,2025-08-12;09:49:58 P.M.,,56.0,56.0,56.0,2025-08-12 21:49:58.000,2025-08-12,2025,8,12,53710,[],()
80669,54813,21642,1,50€00¢," 3-Aug-2024, 22:09:36",,6000.0,6000.0,6000.0,2024-08-03 22:09:36.000,2024-08-03,2024,8,3,54813,[],()
79194,54076,21549,2,$52.00,"03:52:24, 07/28/24",NULL,52.0,52.0,104.0,2024-07-28 03:52:24.000,2024-07-28,2024,7,28,54076,[],()
80699,54813,21248,1,$42.75," 5-Jun-2024,08:12:59 am",,42.75,42.75,42.75,2024-06-05 08:12:59.000,2024-06-05,2024,6,5,54813,[],()
81339,55584,21006,4,EUR 18,"09:55:33 P.M.,2025-10-12",,21.599999999999998,21.599999999999998,86.4,2025-10-12 21:55:33.000,2025-10-12,2025,10,12,54552,[],()
75929,53407,21131,1,49.75 EUR,"06/11/24,08:47",,59.699999999999996,59.699999999999996,59.7,2024-06-11 08:47:00.000,2024-06-11,2024,6,11,53407,[],()
79099,53027,21608,1,$ 63.75,08:22:26 05/15/25,NULL,63.75,63.75,63.75,2025-05-15 08:22:26.000,2025-05-15,2025,5,15,53027,[],()
74761,54612,21176,1,24. USD,"02:53, 09/30/24",NULL,24.0,24.0,24.0,2024-09-30 02:53:00.000,2024-09-30,2024,9,30,54612,[],()
78625,53245,21165,1,16$,"09/20/24, 07:36:38 pm",,16.0,16.0,16.0,2024-09-20 19:36:38.000,2024-09-20,2024,9,20,53245,[],()
83057,53029,21255,1,USD 37.25,"18:59:11,18-Feb-2025",NULL,37.25,37.25,37.25,2025-02-18 18:59:11.000,2025-02-18,2025,2,18,53029,[],()
79251,53665,21385,5,19.00 USD,06/26/24;18:22,,19.0,19.0,95.0,2024-06-26 18:22:00.000,2024-06-26,2024,6,26,53665,[],()
80431,55351,21070,1,22.0$,2024-08-04T19:24:01.151,"241 Courtney Ridge, New Tuyetfurt, CO 69747",22.0,22.0,22.0,2024-08-04 19:24:01.151,2024-08-04,2024,8,4,55351,[],()
81416,53106,20946,3,$24¢00,"05:01,2025-01-19",,2400.0,2400.0,7200.0,2025-01-19 05:01:00.000,2025-01-19,2025,1,19,53106,[],()
74180,55196,21200,2,USD40.5,"04/20/25,11:14:47 am","Suite 113 89395 Jast Corners, McLaughlinstad, WI 84836",40.5,40.5,81.0,2025-04-20 11:14:47.000,2025-04-20,2025,4,20,55196,[],()
78269,55344,21341,1,€51¢99,"03:59:31 PM,23-February-2025","Apt. 346 8157 Gislason Parkway, Bednarshire, PA 79189",6238.8,6238.8,6238.8,2025-02-23 15:59:31.000,2025-02-23,2025,2,23,55344,[],()
82907,53509,21071,5,52.75€,"00:30:13, 2024-10-13",,63.3,63.3,316.5,2024-10-13 00:30:13.000,2024-10-13,2024,10,13,53509,[],()
82382,53620,20921,1,17.0USD," 7-August-2024, 14:52:13",NULL,17.0,17.0,17.0,2024-08-07 14:52:13.000,2024-08-07,2024,8,7,53620,[],()
75313,53189,21200,1,45.00$,"12:27:04 pm, 03/25/25",,45.0,45.0,45.0,2025-03-25 12:27:04.000,2025-03-25,2025,3,25,53189,[],()
78022,55084,21456,1,55.5 USD,04:23:47;02/18/25,NULL,55.5,55.5,55.5,2025-02-18 04:23:47.000,2025-02-18,2025,2,18,55084,[],()
79027,54020,21011,2,35.0 €,"08:52:39,08/01/24","635 Emery Village, Wilkinsonburgh, MD 54488",42.0,42.0,84.0,2024-08-01 08:52:39.000,2024-08-01,2024,8,1,54020,[],()
73528,55581,21104,1,$19¢25,2024-06-13T07:46:25,,1925.0,1925.0,1925.0,2024-06-13 07:46:25.000,2024-06-13,2024,6,13,55581,[],()
74953,55497,21160,2,EUR18.00,01:52:14 PM;2024-10-24,NULL,21.599999999999998,21.599999999999998,43.2,2024-10-24 13:52:14.000,2024-10-24,2024,10,24,55497,[],()
73486,53106,21362,1,USD 45.0,05/23/24 03:26:47 pm,,45.0,45.0,45.0,2024-05-23 15:26:47.000,2024-05-23,2024,5,23,53106,[],()
76969,54665,20980,1,€ 32.5,11:53:42 am 2025-03-30,"277 Luettgen Curve, Port Linnie, MN 00828-7450",39.0,39.0,39.0,2025-03-30 11:53:42.000,2025-03-30,2025,3,30,54665,[],()
82921,54215,21466,5,USD13.99,07/03/25;18:19,,13.99,13.99,69.95,2025-07-03 18:19:00.000,2025-07-03,2025,7,3,54215,[],()
79509,55047,21222,1,$75.75,2025-02-10T10:06:04.775,"Apt. 846 2530 Eleanor Island, Isaacfurt, DE 62597-2094",75.75,75.75,75.75,2025-02-10 10:06:04.775,2025-02-10,2025,2,10,55047,[],()
82017,55444,21162,1,49.75USD,2024-07-19T22:07:27,"Apt. 896 693 Feest Plaza, Darenchester, VT 03665",49.75,49.75,49.75,2024-07-19 22:07:27.000,2024-07-19,2024,7,19,55444,[],()
79710,53485,21262,1,€36¢00,"18:07, 2024-07-15",,4320.0,4320.0,4320.0,2024-07-15 18:07:00.000,2024-07-15,2024,7,15,53485,[],()
80633,55511,21520,1,46.99USD,15:33:46 10/16/24,,46.99,46.99,46.99,2024-10-16 15:33:46.000,2024-10-16,2024,10,16,55511,[],()
74487,54691,21631,2,$ 15.00,2024-04-02T20:25:53,"Suite 874 74687 Margie Viaduct, Weldonberg, KS 93860",15.0,15.0,30.0,2024-04-02 20:25:53.000,2024-04-02,2024,4,2,54691,[],()
76447,54411,21265,1,73.75 EUR,05:18:09;2024-06-11,"4441 Kiyoko Ridge, Farrellton, OH 63367-7587",88.5,88.5,88.5,2024-06-11 05:18:09.000,2024-06-11,2024,6,11,54411,[],()
77914,53883,21246,1,€ 39.25,2024-09-26T20:36:34,,47.1,47.1,47.1,2024-09-26 20:36:34.000,2024-09-26,2024,9,26,53883,[],()
81825,55400,21545,3,$61.5,19:26 16-March-2025,,61.5,61.5,184.5,2025-03-16 19:26:00.000,2025-03-16,2025,3,16,55400,[],()
80448,53346,21627,1,22.50 $,2024-12-10T17:35:26,"54832 Refugio Isle, North Alexander, MS 61644-2606",22.5,22.5,22.5,2024-12-10 17:35:26.000,2024-12-10,2024,12,10,53346,[],()
79713,55811,21556,1,20.99USD,2024-12-21T20:20:32.345,NULL,20.99,20.99,20.99,2024-12-21 20:20:32.345,2024-12-21,2024,12,21,55811,[],()
79563,53047,21108,1,USD26.99,"06:42:29 P.M.,13-September-2024",,26.99,26.99,26.99,2024-09-13 18:42:29.000,2024-09-13,2024,9,13,53047,[],()
81927,53643,21482,1,42.$,2024-12-13;08:58,NULL,42.0,42.0,42.0,2024-12-13 08:58:00.000,2024-12-13,2024,12,13,53643,[],()
81580,54393,21109,1,57.25€,04:57:11 06/30/24,,68.7,68.7,68.7,2024-06-30 04:57:11.000,2024-06-30,2024,6,30,54393,[],()
81446,55543,21204,1,18.5USD,"2024-12-17,07:47:11 PM",,18.5,18.5,18.5,2024-12-17 19:47:11.000,2024-12-17,2024,12,17,55543,[],()
81841,54208,21381,2,34.00EUR,"07:35, 2024-12-11",NULL,40.8,40.8,81.6,2024-12-11 07:35:00.000,2024-12-11,2024,12,11,54208,[],()
76292,53530,21071,1,52.USD,2024-08-23T20:53:55.668,,52.0,52.0,52.0,2024-08-23 20:53:55.668,2024-08-23,2024,8,23,53530,[],()
81319,54237,21361,1,EUR47.50,"23:12,19-Feb-2025",,57.0,57.0,57.0,2025-02-19 23:12:00.000,2025-02-19,2025,2,19,54237,[],()
79388,54640,21062,1,€ 75.50,"02:15:22,2024-06-26",,90.6,90.6,90.6,2024-06-26 02:15:22.000,2024-06-26,2024,6,26,54640,[],()
73407,53198,20988,3,$58.75,2024-11-21 14:05,"1288 Jeanie Stravenue, East Elisabeth, IA 79228-1593",58.75,58.75,176.25,2024-11-21 14:05:00.000,2024-11-21,2024,11,21,53198,[],()
76845,54479,21059,1,45.0$,2024-07-23T10:45:31,NULL,45.0,45.0,45.0,2024-07-23 10:45:31.000,2024-07-23,2024,7,23,54479,[],()
77792,53560,21400,2,$42.00,"00:39,09/02/24",NULL,42.0,42.0,84.0,2024-09-02 00:39:00.000,2024-09-02,2024,9,2,53560,[],()
78683,54486,21629,1,54.75 $,23-JUN-2024;05:41:29 PM,,54.75,54.75,54.75,2024-06-23 17:41:29.000,2024-06-23,2024,6,23,54486,[],()
73908,53522,21219,2,EUR56.5,30-Nov-2024;02:57:26,"Apt. 765 139 Julius Cove, Lake Emil, MA 81386-9490",67.8,67.8,135.6,2024-11-30 02:57:26.000,2024-11-30,2024,11,30,53522,[],()
80624,54622,21309,5,43.50USD,2024-10-01T05:59:59,"405 Littel Prairie, Chaseview, SC 87877-6949",43.5,43.5,217.5,2024-10-01 05:59:59.000,2024-10-01,2024,10,1,54622,[],()
75639,53273,20947,3,29.50USD, 3-Jul-2024;04:40:30,NULL,29.5,29.5,88.5,2024-07-03 04:40:30.000,2024-07-03,2024,7,3,53273,[],()
74544,55034,21629,1,€52.25,"2025-07-07,01:23:29 PM",NULL,62.699999999999996,62.699999999999996,62.7,2025-07-07 13:23:29.000,2025-07-07,2025,7,7,55034,[],()
73382,54946,21008,2,EUR 23,01:40  3-Jul-2024,NULL,27.599999999999998,27.599999999999998,55.2,2024-07-03 01:40:00.000,2024-07-03,2024,7,3,54946,[],()
77576,53900,21176,2,EUR 24.0,2024-12-23T14:56:34.743,"546 Brekke Mountains, North Frederic, MD 45425",28.799999999999997,28.799999999999997,57.6,2024-12-23 14:56:34.743,2024-12-23,2024,12,23,53900,[],()
80217,54782,21087,1,31.5 $,09/02/25;20:26:42,NULL,31.5,31.5,31.5,2025-09-02 20:26:42.000,2025-09-02,2025,9,2,54782,[],()
80566,54825,21151,5,36.0USD,2024-09-09;19:10,,36.0,36.0,180.0,2024-09-09 19:10:00.000,2024-09-09,2024,9,9,54825,[],()
80772,53585,21030,1,25.75$,"10:24, 2024-04-08",NULL,25.75,25.75,25.75,2024-04-08 10:24:00.000,2024-04-08,2024,4,8,53585,[],()
81892,54625,21072,1,$ 72.5,"19:17,03/01/25", ,72.5,72.5,72.5,2025-03-01 19:17:00.000,2025-03-01,2025,3,1,54625,[],()
81056,54961,21070,1,$26.99,10-Jan-2025 09:43:13 A.M.,NULL,26.99,26.99,26.99,2025-01-10 09:43:13.000,2025-01-10,2025,1,10,54961,[],()
80760,55764,21646,1,15.5USD,15:35:34 12-MAR-2025,,15.5,15.5,15.5,2025-03-12 15:35:34.000,2025-03-12,2025,3,12,55764,[],()
82520,54780,20985,1,34.25USD,"2024-10-16, 05:28",NULL,34.25,34.25,34.25,2024-10-16 05:28:00.000,2024-10-16,2024,10,16,54780,[],()
74955,55106,21270,1,USD68.0,"02:58:21,11/18/24","691 Stormy Station, East Leo, MO 57172",68.0,68.0,68.0,2024-11-18 02:58:21.000,2024-11-18,2024,11,18,53450,[],()
77053,53083,20973,1,USD 31.,"06/05/25,06:45:54 AM",,31.0,31.0,31.0,2025-06-05 06:45:54.000,2025-06-05,2025,6,5,53083,[],()
75863,54449,21189,1,$ 27.50,19-NOV-2024;12:57:18,"12464 Marshall Springs, Leonelburgh, NC 61867",27.5,27.5,27.5,2024-11-19 12:57:18.000,2024-11-19,2024,11,19,54449,[],()
80076,53550,21175,1,€22¢99,"11-MAR-2025,02:33:03 am","Apt. 646 812 O'Connell Union, Ronnieside, KY 04312",2758.7999999999997,2758.7999999999997,2758.8,2025-03-11 02:33:03.000,2025-03-11,2025,3,11,53550,[],()
76153,53953,21052,2,73 €,"03:36:02 PM, 10-September-2024",,87.6,87.6,175.2,2024-09-10 15:36:02.000,2024-09-10,2024,9,10,53953,[],()
79114,53568,21163,1,45.25 $,11/19/24 12:39:16 PM,"Suite 381 3877 Nova Causeway, South Walton, OR 21226-9990",45.25,45.25,45.25,2024-11-19 12:39:16.000,2024-11-19,2024,11,19,53568,[],()
74801,54314,21477,1,$47¢75,2025-01-31T01:58:46.736,,4775.0,4775.0,4775.0,2025-01-31 01:58:46.736,2025-01-31,2025,1,31,54314,[],()
77384,55797,21194,2,USD21.75,"02:03,11/28/24",NULL,21.75,21.75,43.5,2024-11-28 02:03:00.000,2024-11-28,2024,11,28,55797,[],()
75195,55056,20977,1,USD24.,2025-01-02 15:31,,24.0,24.0,24.0,2025-01-02 15:31:00.000,2025-01-02,2025,1,2,55056,[],()
76625,55145,21640,2,55.0 $,2024-08-23T10:08:29.256,"40995 Clifton Station, Port Elroy, UT 40381",55.0,55.0,110.0,2024-08-23 10:08:29.256,2024-08-23,2024,8,23,55145,[],()
78504,55017,21046,1,$14, 7-JAN-2025;08:28,,14.0,14.0,14.0,2025-01-07 08:28:00.000,2025-01-07,2025,1,7,55017,[],()
82209,54819,21230,1,$30.99,"12:05:00 am,25-OCT-2024",NULL,30.99,30.99,30.99,2024-10-25 00:05:00.000,2024-10-25,2024,10,25,54819,[],()
73424,54712,21156,2,EUR72.25,2025-02-08T09:32:47.506,,86.7,86.7,173.4,2025-02-08 09:32:47.506,2025-02-08,2025,2,8,54712,[],()
79253,55707,21171,1,USD63.99,06/13/25;22:44:51,"Apt. 266 827 Mirian Station, Torphyfort, CA 48079-6867",63.99,63.99,63.99,2025-06-13 22:44:51.000,2025-06-13,2025,6,13,55707,[],()
82610,55366,21363,1,32.5USD,"2024-10-12, 17:00:16",,32.5,32.5,32.5,2024-10-12 17:00:16.000,2024-10-12,2024,10,12,53102,[],()
77006,53250,21212,3,$ 32.00,"2024-08-20,15:02:40","Suite 513 41660 Wehner Crest, Isabelleburgh, NM 26104-1145",32.0,32.0,96.0,2024-08-20 15:02:40.000,2024-08-20,2024,8,20,53250,[],()
80570,54305,21336,5,$ 62.0,"12:41:21,2025-04-13",NULL,62.0,62.0,310.0,2025-04-13 12:41:21.000,2025-04-13,2025,4,13,54305,[],()
77077,53410,21171,2,$65.25,2024-10-24;01:57:48 am,NULL,65.25,65.25,130.5,2024-10-24 01:57:48.000,2024-10-24,2024,10,24,53410,[],()
77092,54266,21199,1,$38.25,08:33:40 08/23/24,"5543 Dane Flats, Port Eddie, CT 42308-9323",38.25,38.25,38.25,2024-08-23 08:33:40.000,2024-08-23,2024,8,23,54266,[],()
74575,55617,21226,1,59.25 $,2025-05-07 07:19:06 AM,,59.25,59.25,59.25,2025-05-07 07:19:06.000,2025-05-07,2025,5,7,55617,[],()
76441,53121,21394,1,$46.50,2024-12-06 03:02:24 am,NULL,46.5,46.5,46.5,2024-12-06 03:02:24.000,2024-12-06,2024,12,6,53121,[],()
75328,55525,20951,1,58.99 $,04/01/25;15:25,NULL,58.99,58.99,58.99,2025-04-01 15:25:00.000,2025-04-01,2025,4,1,55525,[],()
75492,55480,21165,1,USD 14.25,05/31/24;10:13:38,,14.25,14.25,14.25,2024-05-31 10:13:38.000,2024-05-31,2024,5,31,55480,[],()
73821,55667,21518,1,USD55.5,05/31/24 10:30:56 am,NULL,55.5,55.5,55.5,2024-05-31 10:30:56.000,2024-05-31,2024,5,31,55667,[],()
79006,54850,21344,1,$ 48.99,22:05:42;02/06/25,,48.99,48.99,48.99,2025-02-06 22:05:42.000,2025-02-06,2025,2,6,54850,[],()
81776,55425,21653,1,€42¢00,2025-02-16T16:00:04.164,,5040.0,5040.0,5040.0,2025-02-16 16:00:04.164,2025-02-16,2025,2,16,54527,[],()
76224,53459,21219,1,57. USD,2025-03-19T02:13:59.065,,57.0,57.0,57.0,2025-03-19 02:13:59.065,2025-03-19,2025,3,19,53459,[],()
78368,53560,21521,3,52.99 €," 4-JUN-2024, 14:55",,63.588,63.588,190.76,2024-06-04 14:55:00.000,2024-06-04,2024,6,4,53560,[],()
75402,54195,21544,2,27.50USD," 7-Oct-2024,18:11:04",,27.5,27.5,55.0,2024-10-07 18:11:04.000,2024-10-07,2024,10,7,54195,[],()
80261,55273,21018,1,USD46.5,"23-FEB-2025,08:57:15 P.M.",,46.5,46.5,46.5,2025-02-23 20:57:15.000,2025-02-23,2025,2,23,55167,[],()
74375,54728,21614,2,73.5EUR,18-Jan-2025;01:06,,88.2,88.2,176.4,2025-01-18 01:06:00.000,2025-01-18,2025,1,18,54728,[],()
75098,53789,21232,1,$59.5,2025-01-10T06:45:57.864,NULL,59.5,59.5,59.5,2025-01-10 06:45:57.864,2025-01-10,2025,1,10,53789,[],()
76410,53041,21226,1,€58.5,2024-10-14T17:55:57.226,,70.2,70.2,70.2,2024-10-14 17:55:57.226,2024-10-14,2024,10,14,53041,[],()
74368,54921,21148,1,56. USD,2025-06-21T12:40:57.398,,56.0,56.0,56.0,2025-06-21 12:40:57.398,2025-06-21,2025,6,21,54921,[],()
76096,55661,21604,1,$ 52.50,2024-09-05T15:26:25,"Apt. 228 97296 Walton Wall, Marcborough, AR 24011-7896",52.5,52.5,52.5,2024-09-05 15:26:25.000,2024-09-05,2024,9,5,55661,[],()
74465,53973,21439,1,€ 40.25," 3-Dec-2024, 11:49:36 AM","Apt. 300 19581 Orville Forge, Parkerfort, WV 00515-1341",48.3,48.3,48.3,2024-12-03 11:49:36.000,2024-12-03,2024,12,3,53973,[],()
73892,53553,21317,3,€52.75,05:21 2025-02-12,,63.3,63.3,189.9,2025-02-12 05:21:00.000,2025-02-12,2025,2,12,53553,[],()
74933,54103,21598,4,USD 38.50,"2024-11-19, 08:04:19",,38.5,38.5,154.0,2024-11-19 08:04:19.000,2024-11-19,2024,11,19,54103,[],()
76276,53385,21459,3,20.75USD,12/02/24;23:18:01,,20.75,20.75,62.25,2024-12-02 23:18:01.000,2024-12-02,2024,12,2,53385,[],()
73847,53141,21475,1,€ 36.00,"12/10/24,15:32",,43.199999999999996,43.199999999999996,43.2,2024-12-10 15:32:00.000,2024-12-10,2024,12,10,53141,[],()
79729,53471,21085,1,24 €,2024-11-09T06:02:01.460,,28.799999999999997,28.799999999999997,28.8,2024-11-09 06:02:01.460,2024-11-09,2024,11,9,53471,[],()
77706,54962,21541,2,56.00 USD,08:35:04 A.M. 03/11/25,,56.0,56.0,112.0,2025-03-11 08:35:04.000,2025-03-11,2025,3,11,54962,[],()
76497,54256,21017,1,63.0$,2024-12-10T20:37:17,NULL,63.0,63.0,63.0,2024-12-10 20:37:17.000,2024-12-10,2024,12,10,54256,[],()
76406,53251,21117,1,35.5$,2024-10-28T08:43:04,"9525 Robin Skyway, New Shela, OK 33303",35.5,35.5,35.5,2024-10-28 08:43:04.000,2024-10-28,2024,10,28,53251,[],()
77010,54597,21588,1,$45.99,19:03;2025-03-28,,45.99,45.99,45.99,2025-03-28 19:03:00.000,2025-03-28,2025,3,28,54597,[],()
82354,55368,21477,4,EUR45.25,"25-DEC-2024,05:13:01 AM","Suite 896 794 King Knolls, Earleview, SD 84865-3301",54.3,54.3,217.2,2024-12-25 05:13:01.000,2024-12-25,2024,12,25,55368,[],()
76365,53407,21433,1,47$75¢,"07:54:19 pm, 15-Sep-2024",,4775.0,4775.0,4775.0,2024-09-15 19:54:19.000,2024-09-15,2024,9,15,53407,[],()
79659,54981,20924,1,USD67.75,"22:57,2024-09-03",,67.75,67.75,67.75,2024-09-03 22:57:00.000,2024-09-03,2024,9,3,54981,[],()
74021,55770,21197,1,69.50$,"12/19/24, 04:32:27","5173 Sammy Rue, Reynoldsmouth, SD 58093",69.5,69.5,69.5,2024-12-19 04:32:27.000,2024-12-19,2024,12,19,55770,[],()
77580,53647,21021,3,EUR 46.50,"14-Mar-2025,19:38","7768 Rene Curve, East Buddy, AL 82773-4113",55.8,55.8,167.4,2025-03-14 19:38:00.000,2025-03-14,2025,3,14,53647,[],()
77101,54021,21256,1,59.5EUR,2025-05-15T01:28:36.134,NULL,71.39999999999999,71.39999999999999,71.4,2025-05-15 01:28:36.134,2025-05-15,2025,5,15,54021,[],()
77008,54204,21120,1,37.25 USD," 3-Sep-2024,14:54",,37.25,37.25,37.25,2024-09-03 14:54:00.000,2024-09-03,2024,9,3,54204,[],()
81873,53146,21073,2,35.0 $,"07/11/25, 09:17",,35.0,35.0,70.0,2025-07-11 09:17:00.000,2025-07-11,2025,7,11,53146,[],()
81172,53791,21235,1,USD47,2025-03-20 17:34,NULL,47.0,47.0,47.0,2025-03-20 17:34:00.000,2025-03-20,2025,3,20,53791,[],()
77876,54867,21626,1,68.50USD,10/21/24 03:37,,68.5,68.5,68.5,2024-10-21 03:37:00.000,2024-10-21,2024,10,21,54867,[],()
73714,54666,21168,1,22.00 $,2025-10-23 16:01,"21749 Stephanie Divide, Rueckerport, MI 13787-4868",22.0,22.0,22.0,2025-10-23 16:01:00.000,2025-10-23,2025,10,23,54666,[],()
79989,53349,21403,2,27 €,"08:25:11 am,2024-12-18",NULL,32.4,32.4,64.8,2024-12-18 08:25:11.000,2024-12-18,2024,12,18,53349,[],()
80759,55306,21438,1,61.99$,"01:36:39 PM, 11/08/24",NULL,61.99,61.99,61.99,2024-11-08 13:36:39.000,2024-11-08,2024,11,8,55306,[],()
75751,54821,21618,1,38.0EUR,11-Jan-2025 04:27:14 am,NULL,45.6,45.6,45.6,2025-01-11 04:27:14.000,2025-01-11,2025,1,11,54821,[],()
79263,55133,21564,1,USD38.25,10:07 2025-01-03,,38.25,38.25,38.25,2025-01-03 10:07:00.000,2025-01-03,2025,1,3,55133,[],()
80491,55429,21447,3,USD 65.99,09:26 19-July-2025,"5890 Collier Cape, East Deandra, NE 79548-6423",65.99,65.99,197.97,2025-07-19 09:26:00.000,2025-07-19,2025,7,19,55429,[],()
81831,54169,21232,1,60.50$,"19:01:33,2024-11-30",NULL,60.5,60.5,60.5,2024-11-30 19:01:33.000,2024-11-30,2024,11,30,54169,[],()
82732,55204,21289,1,51.75EUR,"2025-05-12,02:06:17","Suite 840 782 Siobhan Garden, West Marty, WA 03533-3415",62.099999999999994,62.099999999999994,62.1,2025-05-12 02:06:17.000,2025-05-12,2025,5,12,55204,[],()
81583,53418,21128,1,USD63.75, 2-JAN-2025;08:33:00,,63.75,63.75,63.75,2025-01-02 08:33:00.000,2025-01-02,2025,1,2,53418,[],()
78083,54009,21493,1,30.00EUR,"10:07, 19-JUL-2024",NULL,36.0,36.0,36.0,2024-07-19 10:07:00.000,2024-07-19,2024,7,19,54009,[],()
75943,55564,21243,1,64.0 USD,10:59 08/02/24,,64.0,64.0,64.0,2024-08-02 10:59:00.000,2024-08-02,2024,8,2,55564,[],()
78313,55383,21403,1,USD 28.,"19:01, 2025-03-17",,28.0,28.0,28.0,2025-03-17 19:01:00.000,2025-03-17,2025,3,17,55383,[],()
78259,53672,21144,2,70.5€,Thu Apr 18 04:30:57 2024,"Suite 544 204 O'Hara Flats, Antonettaton, SD 73663",84.6,84.6,169.2,2024-04-18 04:30:57.000,2024-04-18,2024,4,18,53672,[],()
81980,54750,21251,2,USD27.,10:17:24 A.M. 10/16/24,,27.0,27.0,54.0,2024-10-16 10:17:24.000,2024-10-16,2024,10,16,54750,[],()
79480,55202,21152,2,28.0USD,2024-09-22T13:38:25.415,"47971 Bradtke Corner, North Hoytville, AR 65484-2933",28.0,28.0,56.0,2024-09-22 13:38:25.415,2024-09-22,2024,9,22,55202,[],()
76975,55605,21472,1,EUR 64.50,22:40:07 2025-01-13,NULL,77.39999999999999,77.39999999999999,77.4,2025-01-13 22:40:07.000,2025-01-13,2025,1,13,55605,[],()
73649,54702,21247,1,USD 55.5,"07:30, 11-Oct-2024","2314 Odis Walk, East Sari, OR 76888-2597",55.5,55.5,55.5,2024-10-11 07:30:00.000,2024-10-11,2024,10,11,54702,[],()
82693,55293,21073,5,35. $,2024-11-26T10:49:23,NULL,35.0,35.0,175.0,2024-11-26 10:49:23.000,2024-11-26,2024,11,26,55293,[],()
76989,55679,21567,1,59.0USD, 2.05.2025 23:38:38,,59.0,59.0,59.0,2025-02-05 23:38:38.000,2025-02-05,2025,2,5,55679,[],()
76030,53890,21235,4,USD 49.99,"07/29/24,14:52:00",,49.99,49.99,199.96,2024-07-29 14:52:00.000,2024-07-29,2024,7,29,53890,[],()
81434,54923,20939,1,$66.25,2025-05-08T22:21:56.188,"347 Kris Prairie, Jeremytown, VA 27625-2922",66.25,66.25,66.25,2025-05-08 22:21:56.188,2025-05-08,2025,5,8,54923,[],()
79304,53090,21272,2,$ 66.50,2025-03-04T11:55:03.210,,66.5,66.5,133.0,2025-03-04 11:55:03.210,2025-03-04,2025,3,4,53090,[],()
79450,53031,21294,1,21€,18:30 13-MAY-2025,,25.2,25.2,25.2,2025-05-13 18:30:00.000,2025-05-13,2025,5,13,53031,[],()
78188,53319,21504,4,51.5 USD,05:36;2025-02-06,,51.5,51.5,206.0,2025-02-06 05:36:00.000,2025-02-06,2025,2,6,53319,[],()
78271,55172,21267,4,$43.,05/12/25;19:13:09,NULL,43.0,43.0,172.0,2025-05-12 19:13:09.000,2025-05-12,2025,5,12,55172,[],()
79728,54618,21238,1,$ 60.75,"10:14:29 pm, 27-Nov-2024",,60.75,60.75,60.75,2024-11-27 22:14:29.000,2024-11-27,2024,11,27,54618,[],()
75210,53090,21036,1,60.25$,"16:56:14,2024-11-14",NULL,60.25,60.25,60.25,2024-11-14 16:56:14.000,2024-11-14,2024,11,14,53090,[],()
81355,53090,21179,1,58.99 USD,2025-03-13T22:27:58,"36933 Swift Knolls, Marryberg, MS 50837",58.99,58.99,58.99,2025-03-13 22:27:58.000,2025-03-13,2025,3,13,53090,[],()
81496,53527,21317,4,53.50 $,"02/23/24, 02:30:03 am",NULL,53.5,53.5,214.0,2024-02-23 02:30:03.000,2024-02-23,2024,2,23,53527,[],()
80769,54904,21027,1,€30¢50,2024-08-30T15:03:36,,3660.0,3660.0,3660.0,2024-08-30 15:03:36.000,2024-08-30,2024,8,30,53755,[],()
77786,54972,21470,1,71.25 EUR,2025-04-16T08:06:45.091,,85.5,85.5,85.5,2025-04-16 08:06:45.091,2025-04-16,2025,4,16,54972,[],()
82396,54537,21533,3,€50¢50,"05:18:42 AM, 28-Dec-2024",,6060.0,6060.0,18180.0,2024-12-28 05:18:42.000,2024-12-28,2024,12,28,54537,[],()
73329,55536,21185,1,$ 35.5,"03/11/25, 22:19",NULL,35.5,35.5,35.5,2025-03-11 22:19:00.000,2025-03-11,2025,3,11,55536,[],()
80438,55414,21336,1,€62.,2024-11-25 01:06,,74.39999999999999,74.39999999999999,74.4,2024-11-25 01:06:00.000,2024-11-25,2024,11,25,55414,[],()
74555,55672,21483,3,66.50 €,"2024-12-07,20:52",,79.8,79.8,239.4,2024-12-07 20:52:00.000,2024-12-07,2024,12,7,55672,[],()
81780,53711,20967,1,38.99$," 2-Apr-2025,11:18:59 am",NULL,38.99,38.99,38.99,2025-04-02 11:18:59.000,2025-04-02,2025,4,2,53711,[],()
77407,55217,21463,2,$75,09:48:22 04/02/24,,75.0,75.0,150.0,2024-04-02 09:48:22.000,2024-04-02,2024,4,2,55217,[],()
82015,55554,21460,1,€31., 9-September-2024;14:48,NULL,37.199999999999996,37.199999999999996,37.2,2024-09-09 14:48:00.000,2024-09-09,2024,9,9,55554,[],()
73395,53113,21500,2,73.25$,2025-01-13T03:57:13,,73.25,73.25,146.5,2025-01-13 03:57:13.000,2025-01-13,2025,1,13,53113,[],()
82762,54276,21347,1,47.50$,"15-October-2024, 07:21:34",,47.5,47.5,47.5,2024-10-15 07:21:34.000,2024-10-15,2024,10,15,54276,[],()
77338,54443,21285,4,USD64.50,2024-03-31T08:12:07.970,"Apt. 910 662 Rice Coves, Breannmouth, KS 21201",64.5,64.5,258.0,2024-03-31 08:12:07.970,2024-03-31,2024,3,31,54443,[],()
81787,55205,21208,1,USD13,2024-05-27T15:36:03,"186 Hye River, West Anjanettefurt, MS 89834",13.0,13.0,13.0,2024-05-27 15:36:03.000,2024-05-27,2024,5,27,55205,[],()
77698,53631,21609,1,17.0 EUR,"01/19/25,23:14:32",,20.4,20.4,20.4,2025-01-19 23:14:32.000,2025-01-19,2025,1,19,53631,[],()
82798,53752,21450,1,52.0$,27.08.2025 14:31:31,NULL,52.0,52.0,52.0,2025-08-27 14:31:31.000,2025-08-27,2025,8,27,53752,[],()
79737,53047,21367,1,39.25USD,2024-10-28T06:42:07,"Apt. 323 1896 Windler Station, East Ismael, WA 20792-1706",39.25,39.25,39.25,2024-10-28 06:42:07.000,2024-10-28,2024,10,28,53047,[],()
74752,54825,21564,2,37.00 EUR,"01:43:03,2025-02-26","5043 Valarie Island, East Jamie, KY 05889-5881",44.4,44.4,88.8,2025-02-26 01:43:03.000,2025-02-26,2025,2,26,54825,[],()
74587,55531,20921,1,$14.75,04:02:52 AM;2024-03-17,NULL,14.75,14.75,14.75,2024-03-17 04:02:52.000,2024-03-17,2024,3,17,55531,[],()
76650,53140,21407,1,28.99$,09:06:24 PM;29-SEP-2024,,28.99,28.99,28.99,2024-09-29 21:06:24.000,2024-09-29,2024,9,29,53140,[],()
81028,55140,21014,1,75.5 $,02/09/25;11:45:11,,75.5,75.5,75.5,2025-02-09 11:45:11.000,2025-02-09,2025,2,9,55140,[],()
82703,55421,21085,1,€25¢99,26-AUG-2024;18:05:27,"686 Sun Springs, Chuckstad, MA 96214",3118.7999999999997,3118.7999999999997,3118.8,2024-08-26 18:05:27.000,2024-08-26,2024,8,26,55421,[],()
78021,55285,21400,4,46. $,08:40:38 P.M.;02/13/25,NULL,46.0,46.0,184.0,2025-02-13 20:40:38.000,2025-02-13,2025,2,13,55285,[],()
73555,53108,21496,1,USD 27.75,"04/04/24,21:34",NULL,27.75,27.75,27.75,2024-04-04 21:34:00.000,2024-04-04,2024,4,4,53108,[],()
74725,55413,21593,1,USD 59,06:57:05 04/06/25,"4399 Willms Port, Marcoshire, ME 93388",59.0,59.0,59.0,2025-04-06 06:57:05.000,2025-04-06,2025,4,6,55413,[],()
82955,54957,21335,1,70.25USD,Sat May 25 05:44:17 2024,,70.25,70.25,70.25,2024-05-25 05:44:17.000,2024-05-25,2024,5,25,54957,[],()
75062,54638,21485,1,$ 18.25,02/25/25 17:33,,18.25,18.25,18.25,2025-02-25 17:33:00.000,2025-02-25,2025,2,25,54638,[],()
74036,53148,21135,2,EUR73,"01:40:45 P.M., 1-September-2024",,87.6,87.6,175.2,2024-09-01 13:40:45.000,2024-09-01,2024,9,1,53148,[],()
73601,55667,21495,2,$23.75,2025-05-12T17:30:11,,23.75,23.75,47.5,2025-05-12 17:30:11.000,2025-05-12,2025,5,12,55667,[],()
73556,55159,21325,1,$ 69.50,2024-10-12T04:26:30,NULL,69.5,69.5,69.5,2024-10-12 04:26:30.000,2024-10-12,2024,10,12,55159,[],()
81288,53118,20999,2,28.25USD,"2024-06-09, 14:41","Apt. 556 92550 Marion Trace, Harveyfurt, MN 54160-8678",28.25,28.25,56.5,2024-06-09 14:41:00.000,2024-06-09,2024,6,9,53118,[],()
78757,53650,20929,1,$46.0,Thu Jan  2 00:06:31 2025,NULL,46.0,46.0,46.0,2025-01-02 00:06:31.000,2025-01-02,2025,1,2,53650,[],()
73709,54485,21217,2,28.0€,"12/30/24, 12:22",,33.6,33.6,67.2,2024-12-30 12:22:00.000,2024-12-30,2024,12,30,54485,[],()
75372,55802,21234,1,34.25 $,"29-Jul-2024, 15:40:03",,34.25,34.25,34.25,2024-07-29 15:40:03.000,2024-07-29,2024,7,29,55802,[],()
83065,54550,21607,1,72.25 USD,"18:39, 7-Jan-2025","492 Greg Station, Lueilwitzport, TX 80197",72.25,72.25,72.25,2025-01-07 18:39:00.000,2025-01-07,2025,1,7,54550,[],()
75134,55363,21031,3,40. EUR,"12-September-2024, 09:08:49 PM","Suite 463 82388 Prosacco Pass, Gusfurt, CT 10522",48.0,48.0,144.0,2024-09-12 21:08:49.000,2024-09-12,2024,9,12,55363,[],()
75726,53888,21336,2,EUR 64.0," 4-MAR-2025,00:20","Apt. 808 5022 Turcotte Lock, New Kraigfurt, MO 93673-9681",76.8,76.8,153.6,2025-03-04 00:20:00.000,2025-03-04,2025,3,4,53888,[],()
77215,54076,21241,1,21.25 USD,2025-05-25T08:56:58.651,NULL,21.25,21.25,21.25,2025-05-25 08:56:58.651,2025-05-25,2025,5,25,54076,[],()
78207,54697,21157,1,31USD,23:32 29-January-2025,"Suite 134 3178 Onita Grove, North Diane, MN 07074",31.0,31.0,31.0,2025-01-29 23:32:00.000,2025-01-29,2025,1,29,54697,[],()
76164,54918,21099,1,31.0USD, 8.01.2025 23:30:30,,31.0,31.0,31.0,2025-08-01 23:30:30.000,2025-08-01,2025,8,1,54918,[],()
80464,54170,21549,2,53.0€,"12/18/24,11:07:41 A.M.",,63.599999999999994,63.599999999999994,127.2,2024-12-18 11:07:41.000,2024-12-18,2024,12,18,54170,[],()
80912,53593,21132,1,19.50USD,"10:07:27 PM, 2025-05-18",,19.5,19.5,19.5,2025-05-18 22:07:27.000,2025-05-18,2025,5,18,53593,[],()
78792,54138,21115,2,€ 68.75,2025-03-02T04:14:54.069,,82.5,82.5,165.0,2025-03-02 04:14:54.069,2025-03-02,2025,3,2,54138,[],()
77470,53293,21209,1,47.0 $,11:08 11/21/24,"7658 Scott Valley, North Josueland, IN 59000",47.0,47.0,47.0,2024-11-21 11:08:00.000,2024-11-21,2024,11,21,53293,[],()
73916,55475,21400,1,41.00$,18-APR-2025 01:05:17,"Apt. 899 4842 Leannon Walks, Hodkiewiczmouth, MN 28805",41.0,41.0,41.0,2025-04-18 01:05:17.000,2025-04-18,2025,4,18,55475,[],()
78179,55677,21295,1,16.5 EUR,09:53:25 am 2025-04-24,"239 Guillermo Shoals, Sherriemouth, PA 29541",19.8,19.8,19.8,2025-04-24 09:53:25.000,2025-04-24,2025,4,24,55677,[],()
81694,55233,21204,1,$ 19.0,02/04/25;04:31,,19.0,19.0,19.0,2025-02-04 04:31:00.000,2025-02-04,2025,2,4,55233,[],()
73834,53182,21327,1,$71¢00,"07:08:53,2025-01-21",NULL,7100.0,7100.0,7100.0,2025-01-21 07:08:53.000,2025-01-21,2025,1,21,53182,[],()
77880,55459,21618,1,38.75$,2025-02-23T13:46:40,"47201 Bettina Neck, Port Santiago, NH 92164-7449",38.75,38.75,38.75,2025-02-23 13:46:40.000,2025-02-23,2025,2,23,55459,[],()
75093,53570,21227,1,$ 70.00,11:41:35 A.M.;2024-07-01,NULL,70.0,70.0,70.0,2024-07-01 11:41:35.000,2024-07-01,2024,7,1,53570,[],()
80022,53147,21233,1,EUR40.5,2025-05-12T18:44:54.812,"Suite 745 84902 Tana Drive, New Zenaida, ME 48169",48.6,48.6,48.6,2025-05-12 18:44:54.812,2025-05-12,2025,5,12,53147,[],()
74773,53432,21161,4,$39¢00,"09:15:29 AM,2024-10-28",NULL,3900.0,3900.0,15600.0,2024-10-28 09:15:29.000,2024-10-28,2024,10,28,53432,[],()
80656,54792,21419,1,71.50 $,2025-02-14 18:20,NULL,71.5,71.5,71.5,2025-02-14 18:20:00.000,2025-02-14,2025,2,14,54792,[],()
80978,55758,21526,2,20.99EUR,2024-10-05T17:48:35,NULL,25.188,25.188,50.38,2024-10-05 17:48:35.000,2024-10-05,2024,10,5,55758,[],()
79932,53439,21090,1,51.0$,04:43:07 PM 30-May-2025,NULL,51.0,51.0,51.0,2025-05-30 16:43:07.000,2025-05-30,2025,5,30,53439,[],()
77181,53496,21050,3,18.99EUR,"2024-11-19, 03:36:54",,22.787999999999997,22.787999999999997,68.36,2024-11-19 03:36:54.000,2024-11-19,2024,11,19,53496,[],()
73974,55581,21294,1,21.25 $,2024-12-18;23:05,"Suite 570 3758 Rupert Loop, South Rhett, VA 25420",21.25,21.25,21.25,2024-12-18 23:05:00.000,2024-12-18,2024,12,18,55581,[],()
78410,55499,21486,2,38.75USD," 3-DEC-2024, 21:15",,38.75,38.75,77.5,2024-12-03 21:15:00.000,2024-12-03,2024,12,3,55499,[],()
75220,53967,21456,1,$ 52.0,11:11:51 A.M.;24-OCT-2024,"Suite 832 7358 Pfannerstill Pike, West Sashastad, OK 18529-4613",52.0,52.0,52.0,2024-10-24 11:11:51.000,2024-10-24,2024,10,24,53967,[],()
83070,55231,21161,1,37.99€,12:04:05 am 2025-05-08,"Suite 278 432 Dare Manor, Lake Yolando, MS 99203-1907",45.588,45.588,45.59,2025-05-08 00:04:05.000,2025-05-08,2025,5,8,55231,[],()
79671,54495,21596,2,USD 53.50,06:06:10 A.M. 14-OCT-2024,,53.5,53.5,107.0,2024-10-14 06:06:10.000,2024-10-14,2024,10,14,54495,[],()
74662,54285,21292,1,42.5 €,"09:03:11 pm,2024-12-30",NULL,51.0,51.0,51.0,2024-12-30 21:03:11.000,2024-12-30,2024,12,30,54285,[],()
83016,54279,21086,2,67.5$,"15:07:49, 11/11/24",,67.5,67.5,135.0,2024-11-11 15:07:49.000,2024-11-11,2024,11,11,54279,[],()
78141,53894,21427,1,USD61.99,"14-DEC-2024,16:59",,61.99,61.99,61.99,2024-12-14 16:59:00.000,2024-12-14,2024,12,14,53894,[],()
78943,54505,21313,1,$ 37.99,2025-01-02T02:41:38.496,"17831 Heaney Summit, Carrollborough, CA 26632",37.99,37.99,37.99,2025-01-02 02:41:38.496,2025-01-02,2025,1,2,54505,[],()
77113,54079,21013,1,EUR40.5,08:09:23 AM;09/01/24,,48.6,48.6,48.6,2024-09-01 08:09:23.000,2024-09-01,2024,9,1,54079,[],()
80780,54764,21257,1,€ 43.00,04:25:25 pm 23-NOV-2024,"Apt. 974 9861 Yetta Ports, South Ligia, NC 13568",51.6,51.6,51.6,2024-11-23 16:25:25.000,2024-11-23,2024,11,23,54764,[],()
74052,54705,21319,1,52.5$,"07/09/24,08:47:34 A.M.","258 Crona Coves, West Petershire, VA 70331",52.5,52.5,52.5,2024-07-09 08:47:34.000,2024-07-09,2024,7,9,54705,[],()
74186,54006,21044,2,€25,"2025-08-20,18:36:56",,30.0,30.0,60.0,2025-08-20 18:36:56.000,2025-08-20,2025,8,20,54006,[],()
73411,53790,20932,1,USD16.00,"04:45:49 P.M., 2025-01-17",NULL,16.0,16.0,16.0,2025-01-17 16:45:49.000,2025-01-17,2025,1,17,53790,[],()
73940,53153,21614,1,€ 75.0,17:15:45 11-Oct-2024,NULL,90.0,90.0,90.0,2024-10-11 17:15:45.000,2024-10-11,2024,10,11,53153,[],()
77795,54322,21037,2,$ 56.0,"20-February-2025, 12:20:02 pm",,56.0,56.0,112.0,2025-02-20 12:20:02.000,2025-02-20,2025,2,20,54322,[],()
74087,55406,21620,2,$15.50,"2025-02-20, 13:17:32",NULL,15.5,15.5,31.0,2025-02-20 13:17:32.000,2025-02-20,2025,2,20,55406,[],()
80941,54321,21214,1,63. USD," 7-Apr-2025, 16:36",NULL,63.0,63.0,63.0,2025-04-07 16:36:00.000,2025-04-07,2025,4,7,54321,[],()
73548,54170,21013,2,EUR40.0,26-Feb-2025 11:07:54 P.M.,"13902 Leola Dale, Erickton, FL 02013",48.0,48.0,96.0,2025-02-26 23:07:54.000,2025-02-26,2025,2,26,54170,[],()
77449,55739,21373,1,20.0EUR,"2025-03-27,13:00","Suite 367 4510 Evelynn Keys, Candiberg, ID 37918-7430",24.0,24.0,24.0,2025-03-27 13:00:00.000,2025-03-27,2025,3,27,55739,[],()
83020,55390,21433,2,$ 47.00,"05:15:14,12-December-2024",,47.0,47.0,94.0,2024-12-12 05:15:14.000,2024-12-12,2024,12,12,55390,[],()
81551,53812,21286,1,30.25USD,03/22/25;06:39:22 AM,,30.25,30.25,30.25,2025-03-22 06:39:22.000,2025-03-22,2025,3,22,53812,[],()
74416,54218,21396,1,$30¢75,2024-06-24T07:34:30.286,,3075.0,3075.0,3075.0,2024-06-24 07:34:30.286,2024-06-24,2024,6,24,54218,[],()
79672,55127,21542,1,$ 48.75,26-Jan-2025 01:51:02 AM,NULL,48.75,48.75,48.75,2025-01-26 01:51:02.000,2025-01-26,2025,1,26,55127,[],()
81111,53405,21133,1,67.$,2025-01-18;06:15:48,,67.0,67.0,67.0,2025-01-18 06:15:48.000,2025-01-18,2025,1,18,53405,[],()
75488,54071,21532,5,37.75 €,04:28:10 PM;12-March-2025,NULL,45.3,45.3,226.5,2025-03-12 16:28:10.000,2025-03-12,2025,3,12,54071,[],()
81034,53311,21411,5,€22¢25,17:38:56;15-DEC-2024,,2670.0,2670.0,13350.0,2024-12-15 17:38:56.000,2024-12-15,2024,12,15,53311,[],()
74301,55008,20924,1,USD67.75,06:17;27-December-2024,"937 Ross Walk, Kuhicstad, NC 55475",67.75,67.75,67.75,2024-12-27 06:17:00.000,2024-12-27,2024,12,27,55008,[],()
78353,54705,21331,1,64.25EUR,16:49;11-SEP-2024,,77.1,77.1,77.1,2024-09-11 16:49:00.000,2024-09-11,2024,9,11,54705,[],()
76154,53668,20989,1,USD69.5,16:43:47;06/14/25,"Suite 266 384 Heidenreich Plaza, New Ismael, KY 00029",69.5,69.5,69.5,2025-06-14 16:43:47.000,2025-06-14,2025,6,14,53668,[],()
73572,55057,20977,1,19.00 $,2024-11-22T17:52:41,,19.0,19.0,19.0,2024-11-22 17:52:41.000,2024-11-22,2024,11,22,55057,[],()
75987,53388,21349,1,USD 58.99,"09/18/24,02:48:48 P.M.",,58.99,58.99,58.99,2024-09-18 14:48:48.000,2024-09-18,2024,9,18,53388,[],()
77109,53731,21283,3,EUR40.5,"18:54:21,12-November-2024",,48.6,48.6,145.8,2024-11-12 18:54:21.000,2024-11-12,2024,11,12,53731,[],()
74424,53243,21631,1,EUR16.50,"10/30/24, 17:07",,19.8,19.8,19.8,2024-10-30 17:07:00.000,2024-10-30,2024,10,30,53243,[],()
77333,55407,21003,1,38.0€," 8-Jul-2024, 05:06:26","48954 Brittaney Causeway, Bernieburgh, IA 44452-3205",45.6,45.6,45.6,2024-07-08 05:06:26.000,2024-07-08,2024,7,8,55407,[],()
78501,53900,20997,3,EUR 75.0,2025-04-24T19:38:42,NULL,90.0,90.0,270.0,2025-04-24 19:38:42.000,2025-04-24,2025,4,24,53900,[],()
80356,54127,21360,2,EUR46.75,2024-11-11T03:59:00,"Apt. 924 811 Adolph Park, West Queenbury, NE 36602-4678",56.1,56.1,112.2,2024-11-11 03:59:00.000,2024-11-11,2024,11,11,55548,[],()
80902,55022,21609,1,20.50$,14:17:44;01/06/25,,20.5,20.5,20.5,2025-01-06 14:17:44.000,2025-01-06,2025,1,6,55022,[],()
74224,54024,21076,1,$ 57.50,"21-Aug-2025,10:39:09 pm",,57.5,57.5,57.5,2025-08-21 22:39:09.000,2025-08-21,2025,8,21,54024,[],()
79787,53698,21617,1,€ 22.25,19:43;01/17/25,NULL,26.7,26.7,26.7,2025-01-17 19:43:00.000,2025-01-17,2025,1,17,53698,[],()
80752,55349,21574,1,25.0$,"29-May-2025, 07:57:50","9376 Muller Cliffs, Rutherfordchester, AZ 30949-9040",25.0,25.0,25.0,2025-05-29 07:57:50.000,2025-05-29,2025,5,29,55349,[],()
78406,54167,21095,2,USD 51.0,2024-09-07 02:27:42,,51.0,51.0,102.0,2024-09-07 02:27:42.000,2024-09-07,2024,9,7,54167,[],()
75246,53529,21594,3,USD60,"09:39,  6-OCT-2024","4619 Isreal Centers, Rauside, MI 67336-4452",60.0,60.0,180.0,2024-10-06 09:39:00.000,2024-10-06,2024,10,6,53529,[],()
80591,53583,20999,2,33.00$, 6-NOV-2024;05:23:38 A.M.,NULL,33.0,33.0,66.0,2024-11-06 05:23:38.000,2024-11-06,2024,11,6,53583,[],()
73325,54663,21176,1,EUR 23.99,07:18:32 25-Mar-2025,,28.787999999999997,28.787999999999997,28.79,2025-03-25 07:18:32.000,2025-03-25,2025,3,25,54663,[],()
77923,53430,20978,1,EUR 57.,2024-09-01 04:45:40,NULL,68.39999999999999,68.39999999999999,68.4,2024-09-01 04:45:40.000,2024-09-01,2024,9,1,53430,[],()
82102,54545,20983,1,20.0USD,09.09.2024 08:37:37,,20.0,20.0,20.0,2024-09-09 08:37:37.000,2024-09-09,2024,9,9,54545,[],()
75785,54156,21630,1,USD53.00,03:28:56 PM;2025-03-27,NULL,53.0,53.0,53.0,2025-03-27 15:28:56.000,2025-03-27,2025,3,27,54156,[],()
77556,55049,21175,1,USD26.0,06:20:21;04/11/25,"Apt. 526 857 Walsh Falls, Millerport, KS 39301",26.0,26.0,26.0,2025-04-11 06:20:21.000,2025-04-11,2025,4,11,55049,[],()
79061,53448,21499,2,75 $,"2025-06-19, 01:44:27 pm",NULL,75.0,75.0,150.0,2025-06-19 13:44:27.000,2025-06-19,2025,6,19,53448,[],()
82895,54428,21292,2,$42¢75,2024-04-10T19:11:38.901,"Apt. 542 5104 Toshiko Causeway, East Malcolmborough, WI 35723",4275.0,4275.0,8550.0,2024-04-10 19:11:38.901,2024-04-10,2024,4,10,53265,[],()
77091,53432,21468,1,67.00 EUR,"07:43:37,2024-08-24",,80.39999999999999,80.39999999999999,80.4,2024-08-24 07:43:37.000,2024-08-24,2024,8,24,53432,[],()
76958,53900,21221,1,USD 71.25,2024-09-20T13:22:06.575,,71.25,71.25,71.25,2024-09-20 13:22:06.575,2024-09-20,2024,9,20,53900,[],()
79212,53613,21077,1,68.99USD,20-MAY-2025;09:21,,68.99,68.99,68.99,2025-05-20 09:21:00.000,2025-05-20,2025,5,20,53613,[],()
81315,55057,21058,1,$50.99,"05:14:55 PM,  7-Jun-2024",,50.99,50.99,50.99,2024-06-07 17:14:55.000,2024-06-07,2024,6,7,55057,[],()
75851,54987,21241,2,$18.5,2025-05-13;06:40:03,,18.5,18.5,37.0,2025-05-13 06:40:03.000,2025-05-13,2025,5,13,53051,[],()
75717,55539,21554,2,EUR 35.50,08:35:35 am 2024-11-04,,42.6,42.6,85.2,2024-11-04 08:35:35.000,2024-11-04,2024,11,4,55539,[],()
76647,53304,21037,1,53.99 USD,"11-Jul-2024,07:40:03 pm","Apt. 120 47474 Lyndsay Park, Jermaineburgh, MS 47317",53.99,53.99,53.99,2024-07-11 19:40:03.000,2024-07-11,2024,7,11,53304,[],()
78701,54190,21394,1,USD43.5,2024-10-01;23:04,NULL,43.5,43.5,43.5,2024-10-01 23:04:00.000,2024-10-01,2024,10,1,54190,[],()
78831,55664,21604,1,USD52.0,2024-12-15;01:37:17,,52.0,52.0,52.0,2024-12-15 01:37:17.000,2024-12-15,2024,12,15,55664,[],()
78121,55469,21052,1,72.75 €,09/07/24 04:53:26,,87.3,87.3,87.3,2024-09-07 04:53:26.000,2024-09-07,2024,9,7,55469,[],()
81537,54298,21646,2,19.75 $,2025-03-15T21:19:16.726,,19.75,19.75,39.5,2025-03-15 21:19:16.726,2025-03-15,2025,3,15,54298,[],()
80712,53348,21302,1,18.75$,19-Mar-2025;05:57:26,,18.75,18.75,18.75,2025-03-19 05:57:26.000,2025-03-19,2025,3,19,53348,[],()
74339,53213,21545,1,$ 59.00, 5.05.2024 10:01:01,"44125 Emerson Station, Jalisastad, VA 76554",59.0,59.0,59.0,2024-05-05 10:01:01.000,2024-05-05,2024,5,5,53213,[],()
79698,55368,21519,1,50.0USD, 5-Feb-2025;13:38:22,,50.0,50.0,50.0,2025-02-05 13:38:22.000,2025-02-05,2025,2,5,55368,[],()
83125,55755,21599,1,USD19.,2025-07-04;11:45:05 P.M.,NULL,19.0,19.0,19.0,2025-07-04 23:45:05.000,2025-07-04,2025,7,4,55755,[],()
78936,55313,21337,2,$ 71.25,06:31:32;26-November-2024,,71.25,71.25,142.5,2024-11-26 06:31:32.000,2024-11-26,2024,11,26,53102,[],()
77721,54583,21061,2,49.50 $,"2024-10-15,08:56:17 PM","Apt. 389 2243 Fabian Vista, Howellchester, OR 08451",49.5,49.5,99.0,2024-10-15 20:56:17.000,2024-10-15,2024,10,15,54583,[],()
80623,53304,21438,1,63.0 $,2025-05-09T23:36:50,,63.0,63.0,63.0,2025-05-09 23:36:50.000,2025-05-09,2025,5,9,53304,[],()
74202,55021,21456,3,55.50USD,"09/03/25,16:34:29",,55.5,55.5,166.5,2025-09-03 16:34:29.000,2025-09-03,2025,9,3,55021,[],()
80665,53480,21174,5,EUR13.50,"23-Apr-2025, 08:23",,16.2,16.2,81.0,2025-04-23 08:23:00.000,2025-04-23,2025,4,23,53480,[],()
73497,53448,20980,1,34.99EUR,"12-April-2025, 03:46:41 AM","Suite 832 2465 Adams Heights, Claraport, LA 22918-4749",41.988,41.988,41.99,2025-04-12 03:46:41.000,2025-04-12,2025,4,12,53448,[],()
79572,54056,21239,2,32.00 $,05:14; 8-Aug-2025,,32.0,32.0,64.0,2025-08-08 05:14:00.000,2025-08-08,2025,8,8,54056,[],()
80092,55635,21044,5,$ 27.00,"2024-08-14, 02:29:29",NULL,27.0,27.0,135.0,2024-08-14 02:29:29.000,2024-08-14,2024,8,14,54686,[],()
83047,55096,21139,1,$55.5," 1-APR-2024, 16:32:00","Suite 226 5245 Ilene Ridge, East Tishburgh, MN 43215",55.5,55.5,55.5,2024-04-01 16:32:00.000,2024-04-01,2024,4,1,53718,[],()
74089,53594,21553,1,$ 20.75,2025-01-22;22:28:13,,20.75,20.75,20.75,2025-01-22 22:28:13.000,2025-01-22,2025,1,22,53594,[],()
82584,54687,20969,1,USD16.75,"10:53, 2025-01-30",NULL,16.75,16.75,16.75,2025-01-30 10:53:00.000,2025-01-30,2025,1,30,54687,[],()
75850,53822,21436,1,36 $,"06/15/25,16:19:55",,36.0,36.0,36.0,2025-06-15 16:19:55.000,2025-06-15,2025,6,15,53822,[],()
73346,55343,21102,1,52.25 USD," 8-Sep-2024,21:17","6350 Ronald Extension, West Nery, TX 08312-6487",52.25,52.25,52.25,2024-09-08 21:17:00.000,2024-09-08,2024,9,8,55343,[],()
80931,54648,21306,1,USD35.99,02:00:00;2025-01-16,NULL,35.99,35.99,35.99,2025-01-16 02:00:00.000,2025-01-16,2025,1,16,54648,[],()
80068,53187,21162,1,53.99 $,12:29:56 am;13-May-2025,,53.99,53.99,53.99,2025-05-13 00:29:56.000,2025-05-13,2025,5,13,53187,[],()
81891,55594,21542,1,USD 46.0,"15:35:23,08/31/24",NULL,46.0,46.0,46.0,2024-08-31 15:35:23.000,2024-08-31,2024,8,31,55594,[],()
77188,55207,21068,2,62.99$,10:45:08 AM 2024-08-15,NULL,62.99,62.99,125.98,2024-08-15 10:45:08.000,2024-08-15,2024,8,15,55207,[],()
73458,53499,21144,1,€72¢99,21.01.2025 14:51:51,,8758.8,8758.8,8758.8,2025-01-21 14:51:51.000,2025-01-21,2025,1,21,53499,[],()
75928,53487,21114,1,€60¢75,2024-08-29T13:24:06.813,NULL,7290.0,7290.0,7290.0,2024-08-29 13:24:06.813,2024-08-29,2024,8,29,53487,[],()
77396,55336,20984,1,34.50 EUR,20-May-2024 10:34:27 PM,"5198 Hintz Alley, Boscoborough, NH 21384-9997",41.4,41.4,41.4,2024-05-20 22:34:27.000,2024-05-20,2024,5,20,55336,[],()
78372,55701,21146,1,$ 46.25,2024-08-25T10:40:01,NULL,46.25,46.25,46.25,2024-08-25 10:40:01.000,2024-08-25,2024,8,25,55701,[],()
81017,55510,21639,4,14.25 $,"2024-07-12, 11:01:54","Suite 882 557 Balistreri Ways, Evaport, SD 31905-5467",14.25,14.25,57.0,2024-07-12 11:01:54.000,2024-07-12,2024,7,12,55510,[],()
79705,54383,21137,1,$45.5,"14-OCT-2024, 22:24:26",NULL,45.5,45.5,45.5,2024-10-14 22:24:26.000,2024-10-14,2024,10,14,54383,[],()
81074,53384,21456,1,$ 56.25,19-Jan-2025 19:07,,56.25,56.25,56.25,2025-01-19 19:07:00.000,2025-01-19,2025,1,19,53384,[],()
73388,54277,21233,4,EUR 42.25,18:14; 9-Nov-2024,NULL,50.699999999999996,50.699999999999996,202.8,2024-11-09 18:14:00.000,2024-11-09,2024,11,9,54277,[],()
77029,53205,21370,2,44.75$,"07/23/25,22:42",NULL,44.75,44.75,89.5,2025-07-23 22:42:00.000,2025-07-23,2025,7,23,53205,[],()
79074,54489,21522,1,52.50$,2024-12-25T09:48:01.055,"Apt. 565 4836 Kent Turnpike, Lake Jolynstad, MT 95427",52.5,52.5,52.5,2024-12-25 09:48:01.055,2024-12-25,2024,12,25,54489,[],()
76987,53796,21339,1,76€,07:19:50 PM 07/20/24,"Apt. 930 4707 Miguel Estates, South Dionchester, SD 68798",91.2,91.2,91.2,2024-07-20 19:19:50.000,2024-07-20,2024,7,20,53796,[],()
77265,53827,21287,2,62.99 $,01/06/25 11:51:20 pm,,62.99,62.99,125.98,2025-01-06 23:51:20.000,2025-01-06,2025,1,6,53827,[],()
75981,55585,21568,3,$73.0, 9-January-2025 10:59:58 am,"Apt. 652 2785 Lenita Creek, Elinside, OH 24236",73.0,73.0,219.0,2025-01-09 10:59:58.000,2025-01-09,2025,1,9,55585,[],()
76649,53108,21609,1,EUR 20.0,2024-06-29T01:38:52,,24.0,24.0,24.0,2024-06-29 01:38:52.000,2024-06-29,2024,6,29,53108,[],()
82667,54480,21214,3,€ 58.,"10:14, 2024-08-30","84631 Swaniawski Mountains, East Warner, OR 61369",69.6,69.6,208.8,2024-08-30 10:14:00.000,2024-08-30,2024,8,30,54480,[],()
78095,54104,21096,2,€72¢25,"12/14/24,07:45:31 P.M.",,8670.0,8670.0,17340.0,2024-12-14 19:45:31.000,2024-12-14,2024,12,14,54188,[],()
76791,55015,20918,1,18.50$,2025-04-16;17:58:24,,18.5,18.5,18.5,2025-04-16 17:58:24.000,2025-04-16,2025,4,16,55015,[],()
75389,53112,20933,1,18.00 $,"2024-05-25,14:25","Suite 713 272 Frankie Mills, North Catrina, HI 45737-2624",18.0,18.0,18.0,2024-05-25 14:25:00.000,2024-05-25,2024,5,25,53112,[],()
82685,55229,21399,2,71.0$,"05:03, 2024-11-21","96140 Schneider Loaf, East Jeroldhaven, AR 95216",71.0,71.0,142.0,2024-11-21 05:03:00.000,2024-11-21,2024,11,21,55229,[],()
82810,53717,21308,1,58.$,"12:58:00 am, 2024-12-08",,58.0,58.0,58.0,2024-12-08 00:58:00.000,2024-12-08,2024,12,8,53717,[],()
75338,53654,21389,5,$32.,"12-Jun-2024, 11:26",,32.0,32.0,160.0,2024-06-12 11:26:00.000,2024-06-12,2024,6,12,53654,[],()
73569,55624,21293,1,EUR 57.5,"02:53, 3-November-2024",,69.0,69.0,69.0,2024-11-03 02:53:00.000,2024-11-03,2024,11,3,55624,[],()
75107,55804,21407,1,$ 28,11:30:33 2025-01-21,,28.0,28.0,28.0,2025-01-21 11:30:33.000,2025-01-21,2025,1,21,55804,[],()
75973,54874,21607,1,€72.,"29-JAN-2025,10:42","Suite 285 93099 Sheilah Common, Hanebury, VA 48980-9213",86.39999999999999,86.39999999999999,86.4,2025-01-29 10:42:00.000,2025-01-29,2025,1,29,54874,[],()
75071,54785,21460,1,€32.,2024-10-29 06:10:07 pm,,38.4,38.4,38.4,2024-10-29 18:10:07.000,2024-10-29,2024,10,29,54785,[],()
79527,55514,21220,1,18.25$,02:19:35 PM;09/08/24,,18.25,18.25,18.25,2024-09-08 14:19:35.000,2024-09-08,2024,9,8,55514,[],()
79594,54797,21602,2,€67¢75,"09:59:54 P.M., 12/27/24",,8130.0,8130.0,16260.0,2024-12-27 21:59:54.000,2024-12-27,2024,12,27,54797,[],()
77946,54037,21275,1,67.50 EUR,2024-08-21;08:16:13 AM,,81.0,81.0,81.0,2024-08-21 08:16:13.000,2024-08-21,2024,8,21,54037,[],()
78914,55091,21583,3,14.0 €,"12:12:29 PM, 2024-10-23",,16.8,16.8,50.4,2024-10-23 12:12:29.000,2024-10-23,2024,10,23,55091,[],()
74153,55804,21217,2,EUR29.0,09/27/24 07:26:46 am,"576 Doyle Station, Kilbackmouth, AR 51709",34.8,34.8,69.6,2024-09-27 07:26:46.000,2024-09-27,2024,9,27,55804,[],()
81391,55263,21090,1,USD49.99,07:50:20 AM;11-February-2025,NULL,49.99,49.99,49.99,2025-02-11 07:50:20.000,2025-02-11,2025,2,11,55263,[],()
74583,54953,20939,2,67.50USD,"08:32:55, 24-Jan-2025",,67.5,67.5,135.0,2025-01-24 08:32:55.000,2025-01-24,2025,1,24,54953,[],()
80803,55403,21484,5,USD52.50,"03/24/25, 14:12:04",NULL,52.5,52.5,262.5,2025-03-24 14:12:04.000,2025-03-24,2025,3,24,55322,[],()
76122,55356,21384,1,USD49.50,2025-03-08T00:42:50.059,,49.5,49.5,49.5,2025-03-08 00:42:50.059,2025-03-08,2025,3,8,55356,[],()
79827,54408,21089,1,48.50USD,02/23/25 11:51,NULL,48.5,48.5,48.5,2025-02-23 11:51:00.000,2025-02-23,2025,2,23,54408,[],()
80373,55143,21271,3,26.99USD,"11:32:17 PM, 07/30/24",,26.99,26.99,80.97,2024-07-30 23:32:17.000,2024-07-30,2024,7,30,55143,[],()
77806,54816,21035,4,42.00 $,2025-03-09T12:16:29,,42.0,42.0,168.0,2025-03-09 12:16:29.000,2025-03-09,2025,3,9,54816,[],()
81993,53207,21204,1,18.5$,"11:22:41,21-July-2025",,18.5,18.5,18.5,2025-07-21 11:22:41.000,2025-07-21,2025,7,21,53207,[],()
76918,53715,21441,1,17 USD,2024-10-29 05:23:46,NULL,17.0,17.0,17.0,2024-10-29 05:23:46.000,2024-10-29,2024,10,29,53715,[],()
74605,53344,21503,1,€ 64.00,2024-07-21T03:04:04.003,,76.8,76.8,76.8,2024-07-21 03:04:04.003,2024-07-21,2024,7,21,53344,[],()
78459,53773,21633,1,EUR 73.00,"09/12/24,11:09",,87.6,87.6,87.6,2024-09-12 11:09:00.000,2024-09-12,2024,9,12,54065,[],()
78478,53939,21648,1,€28.5,08:20:04;11/05/24,NULL,34.199999999999996,34.199999999999996,34.2,2024-11-05 08:20:04.000,2024-11-05,2024,11,5,53939,[],()
76268,55697,21462,5,$ 30.75,11:02:27 pm 12/23/24,,30.75,30.75,153.75,2024-12-23 23:02:27.000,2024-12-23,2024,12,23,55697,[],()
80764,55640,21092,2,EUR31.75,02:09;2024-08-26,,38.1,38.1,76.2,2024-08-26 02:09:00.000,2024-08-26,2024,8,26,55640,[],()
79079,54994,21411,1,21.5 $,"12:33:01, 11/23/24",,21.5,21.5,21.5,2024-11-23 12:33:01.000,2024-11-23,2024,11,23,54994,[],()
81965,55273,21338,1,50.00 USD,12:33:53 2025-02-18,,50.0,50.0,50.0,2025-02-18 12:33:53.000,2025-02-18,2025,2,18,55167,[],()
73625,55727,21601,1,€ 29.50,"04:23:52 am, 10/10/24",,35.4,35.4,35.4,2024-10-10 04:23:52.000,2024-10-10,2024,10,10,55727,[],()
73918,55702,21254,1,41.75USD,2024-12-23T14:29:33.540,,41.75,41.75,41.75,2024-12-23 14:29:33.540,2024-12-23,2024,12,23,55702,[],()
77119,55698,21452,1,23 $,"2025-01-19,07:43",,23.0,23.0,23.0,2025-01-19 07:43:00.000,2025-01-19,2025,1,19,55698,[],()
78250,55403,21053,1,49.25 USD,2024-05-21;21:41,"4125 Zemlak Stravenue, East Shanti, CA 37646",49.25,49.25,49.25,2024-05-21 21:41:00.000,2024-05-21,2024,5,21,55322,[],()
73641,55787,21144,1,USD72,2024-12-02;10:06,,72.0,72.0,72.0,2024-12-02 10:06:00.000,2024-12-02,2024,12,2,55787,[],()
76123,53218,21225,2,EUR57.,"12:04:29 pm, 03/15/25",NULL,68.39999999999999,68.39999999999999,136.8,2025-03-15 12:04:29.000,2025-03-15,2025,3,15,53218,[],()
74597,55092,21338,2,$ 50.75,17:10;2024-11-24,NULL,50.75,50.75,101.5,2024-11-24 17:10:00.000,2024-11-24,2024,11,24,55092,[],()
76522,55579,21451,1,62.75 USD,Mon Dec  2 19:31:14 2024,NULL,62.75,62.75,62.75,2024-12-02 19:31:14.000,2024-12-02,2024,12,2,55579,[],()
80274,54528,21440,1,36.0USD,26-Jan-2025;03:28:21 A.M.,NULL,36.0,36.0,36.0,2025-01-26 03:28:21.000,2025-01-26,2025,1,26,54528,[],()
77685,54454,21523,2,€46.0,19:58;11/28/24,,55.199999999999996,55.199999999999996,110.4,2024-11-28 19:58:00.000,2024-11-28,2024,11,28,54454,[],()
73406,54861,21115,2,$ 71.,"14:49, 2024-12-25",,71.0,71.0,142.0,2024-12-25 14:49:00.000,2024-12-25,2024,12,25,53224,[],()
76899,55053,21306,1,36.25 €,"01/11/25, 20:03","Suite 518 1231 Rhea Drive, Stantonton, NE 29957",43.5,43.5,43.5,2025-01-11 20:03:00.000,2025-01-11,2025,1,11,55053,[],()
76778,55601,21031,1,43.5 USD,2025-03-13T04:01:13,NULL,43.5,43.5,43.5,2025-03-13 04:01:13.000,2025-03-13,2025,3,13,55601,[],()
79283,54225,20993,1,$28¢75,2024-10-21 02:53:56,,2875.0,2875.0,2875.0,2024-10-21 02:53:56.000,2024-10-21,2024,10,21,54225,[],()
80875,55277,21215,1,16.00$,"07:13:40, 4-Oct-2024",,16.0,16.0,16.0,2024-10-04 07:13:40.000,2024-10-04,2024,10,4,55277,[],()
80790,54145,21480,2,$ 66.50,"2024-12-14,07:01:46",,66.5,66.5,133.0,2024-12-14 07:01:46.000,2024-12-14,2024,12,14,54145,[],()
77098,55636,21204,1,18.25$,"20:35:55,2024-07-22",,18.25,18.25,18.25,2024-07-22 20:35:55.000,2024-07-22,2024,7,22,55636,[],()
80100,53940,21411,1,21 €,"21-AUG-2024,16:56:13",,25.2,25.2,25.2,2024-08-21 16:56:13.000,2024-08-21,2024,8,21,53940,[],()
80389,53802,21242,1,55.50€,"07/27/24,20:22","2896 Mohr Summit, Cristbury, WY 51059-9269",66.6,66.6,66.6,2024-07-27 20:22:00.000,2024-07-27,2024,7,27,53802,[],()
83109,55028,21502,1,33.25 EUR,22:56:47;05/05/25,"98728 Adams Oval, Tammeraport, ND 95774-9770",39.9,39.9,39.9,2025-05-05 22:56:47.000,2025-05-05,2025,5,5,55028,[],()
76949,53092,21231,2,72.99 USD,"25-Jun-2024, 11:14:39 pm","Suite 524 48624 Lorraine Islands, North Odis, AK 05508-6282",72.99,72.99,145.98,2024-06-25 23:14:39.000,2024-06-25,2024,6,25,53092,[],()
79647,54118,21537,1,$ 19.0,2024-06-12T19:04:11.697,,19.0,19.0,19.0,2024-06-12 19:04:11.697,2024-06-12,2024,6,12,54118,[],()
76706,53307,21435,1,57.0EUR,2024-12-02T17:21:57.029,,68.39999999999999,68.39999999999999,68.4,2024-12-02 17:21:57.029,2024-12-02,2024,12,2,53307,[],()
81063,54479,21191,1,41.5USD,"2024-10-25, 03:53",,41.5,41.5,41.5,2024-10-25 03:53:00.000,2024-10-25,2024,10,25,54479,[],()
73449,54641,20995,1,USD51.,07/30/24;16:19,"Suite 894 96737 Eloise Lock, Erynstad, CT 42726",51.0,51.0,51.0,2024-07-30 16:19:00.000,2024-07-30,2024,7,30,54641,[],()
76584,53930,21386,2,$43.00,"21:10, 06/10/25",,43.0,43.0,86.0,2025-06-10 21:10:00.000,2025-06-10,2025,6,10,53930,[],()
76925,54524,21404,2,37.25 $,"27-Jul-2024,03:04",,37.25,37.25,74.5,2024-07-27 03:04:00.000,2024-07-27,2024,7,27,54524,[],()
82057,54302,21306,2,$ 34.0,"11:20:08, 03/18/24","95460 Annemarie Turnpike, North Valbury, IN 06488",34.0,34.0,68.0,2024-03-18 11:20:08.000,2024-03-18,2024,3,18,54302,[],()
74792,53881,21156,2,73.0USD,"22-Mar-2025,04:55:19 PM",,73.0,73.0,146.0,2025-03-22 16:55:19.000,2025-03-22,2025,3,22,53881,[],()
82753,55276,21417,1,$ 14.25,03:54:39 pm;25-OCT-2024,NULL,14.25,14.25,14.25,2024-10-25 15:54:39.000,2024-10-25,2024,10,25,55276,[],()
79746,55376,21533,1,EUR50.25,05:33 2024-11-13,,60.3,60.3,60.3,2024-11-13 05:33:00.000,2024-11-13,2024,11,13,55376,[],()
74397,54645,21043,1,20.75 $,04:50:53 A.M.;10/02/24,"572 Cornelius Brooks, Port Lakeishaville, VT 60207",20.75,20.75,20.75,2024-10-02 04:50:53.000,2024-10-02,2024,10,2,54645,[],()
74366,55038,21515,1,€ 72.99,"25-Aug-2024, 01:56","Apt. 631 759 Eloy Club, South Felton, OR 17187-7968",87.588,87.588,87.59,2024-08-25 01:56:00.000,2024-08-25,2024,8,25,55038,[],()
81645,54493,21255,3,36.99USD,"07:15:21 A.M.,26-April-2025",NULL,36.99,36.99,110.97,2025-04-26 07:15:21.000,2025-04-26,2025,4,26,54493,[],()
80331,53690,21241,1,21.99$,10-October-2024 03:46:04,,21.99,21.99,21.99,2024-10-10 03:46:04.000,2024-10-10,2024,10,10,53690,[],()
78113,53231,21064,1,42.99 $,2024-11-02T19:32:36.427,"784 Goyette Circles, Solburgh, NH 21375",42.99,42.99,42.99,2024-11-02 19:32:36.427,2024-11-02,2024,11,2,53231,[],()
82500,54728,21421,1,€54¢25,28-OCT-2024;12:51:13 am,,6510.0,6510.0,6510.0,2024-10-28 00:51:13.000,2024-10-28,2024,10,28,54728,[],()
77822,53066,21550,1,38.5USD,2024-09-02T13:30:52,,38.5,38.5,38.5,2024-09-02 13:30:52.000,2024-09-02,2024,9,2,53066,[],()
75021,55440,21207,3,$19.50,"03/20/25, 10:55:38","1404 Hagenes Field, Pfannerstillview, IN 86759-7218",19.5,19.5,58.5,2025-03-20 10:55:38.000,2025-03-20,2025,3,20,55440,[],()
74017,54201,21038,1,$ 53.50,"2025-06-28,11:07:28","1654 Gabriele Loaf, North Tifany, CO 38448-5284",53.5,53.5,53.5,2025-06-28 11:07:28.000,2025-06-28,2025,6,28,54201,[],()
80716,55039,20969,1,21.€,29-MAR-2025 07:50:37 pm,"7174 Stoltenberg Bypass, Bennettborough, AK 44181-1880",25.2,25.2,25.2,2025-03-29 19:50:37.000,2025-03-29,2025,3,29,53119,[],()
78411,53508,20936,1,$ 58.25,"03/07/25,03:50:01",NULL,58.25,58.25,58.25,2025-03-07 03:50:01.000,2025-03-07,2025,3,7,53508,[],()
77122,55266,21308,1,USD 62.75,2025-01-27T04:24:05,,62.75,62.75,62.75,2025-01-27 04:24:05.000,2025-01-27,2025,1,27,55266,[],()
77755,53892,21405,1,47.0 $,"22-April-2025,19:54",,47.0,47.0,47.0,2025-04-22 19:54:00.000,2025-04-22,2025,4,22,53892,[],()
79487,55231,21065,2,22€99¢,21:04 30-July-2024,"Suite 278 432 Dare Manor, Lake Yolando, MS 99203-1907",2758.7999999999997,2758.7999999999997,5517.6,2024-07-30 21:04:00.000,2024-07-30,2024,7,30,55231,[],()
79805,54822,21161,3,EUR 37.50,"02:33, 2-DEC-2024","Suite 560 9562 Price Points, North Mi, NM 02191",45.0,45.0,135.0,2024-12-02 02:33:00.000,2024-12-02,2024,12,2,54822,[],()
80975,53622,20967,2,36$25¢,"12:26:23,2024-12-27",,3625.0,3625.0,7250.0,2024-12-27 12:26:23.000,2024-12-27,2024,12,27,53622,[],()
82858,54796,21060,1,$ 35.5,07:51:50;03/08/25,,35.5,35.5,35.5,2025-03-08 07:51:50.000,2025-03-08,2025,3,8,54796,[],()
74345,53761,20973,1,28.75USD,"04/17/25, 01:42:48 am",NULL,28.75,28.75,28.75,2025-04-17 01:42:48.000,2025-04-17,2025,4,17,53761,[],()
79918,53743,21173,3,22€75¢,2024-08-21 02:23:30 pm,NULL,2730.0,2730.0,8190.0,2024-08-21 14:23:30.000,2024-08-21,2024,8,21,53743,[],()
81064,53756,21512,1,$57.50,15:20:01 27-September-2024,"Apt. 958 9320 Omer Village, Corkeryville, ID 89906-9061",57.5,57.5,57.5,2024-09-27 15:20:01.000,2024-09-27,2024,9,27,53756,[],()
77696,54365,21162,1,49.25$,2024-08-16T21:18:56.637,,49.25,49.25,49.25,2024-08-16 21:18:56.637,2024-08-16,2024,8,16,54365,[],()
76411,55006,21273,2,71.50 €,2024-07-04T08:33:36.078,NULL,85.8,85.8,171.6,2024-07-04 08:33:36.078,2024-07-04,2024,7,4,55006,[],()
76746,54245,21625,2,31.5$,"09/28/24,12:12:47 AM",,31.5,31.5,63.0,2024-09-28 00:12:47.000,2024-09-28,2024,9,28,54245,[],()
81535,54350,21397,1,USD65.5,2025-01-17 01:45:53 PM,,65.5,65.5,65.5,2025-01-17 13:45:53.000,2025-01-17,2025,1,17,54350,[],()
78219,54167,21579,2,USD53.25,13:06 2024-10-08,,53.25,53.25,106.5,2024-10-08 13:06:00.000,2024-10-08,2024,10,8,54167,[],()
80520,53057,20970,1,USD 42.75,"15:43,02/01/25",NULL,42.75,42.75,42.75,2025-02-01 15:43:00.000,2025-02-01,2025,2,1,53057,[],()
74556,53143,20956,1,$ 62.,"2025-01-08,19:47",,62.0,62.0,62.0,2025-01-08 19:47:00.000,2025-01-08,2025,1,8,53143,[],()
78545,54469,21007,2,31.50 USD,03:39:24;2024-07-13,,31.5,31.5,63.0,2024-07-13 03:39:24.000,2024-07-13,2024,7,13,54469,[],()
82185,53798,21398,1,23.25 EUR,"16:35,2024-11-27",,27.9,27.9,27.9,2024-11-27 16:35:00.000,2024-11-27,2024,11,27,53798,[],()
74197,53476,21169,1,USD63.99,00:36:00;2025-03-14,,63.99,63.99,63.99,2025-03-14 00:36:00.000,2025-03-14,2025,3,14,53476,[],()
76796,53262,21352,1,37€75¢,"03/11/25, 02:27:42",NULL,4530.0,4530.0,4530.0,2025-03-11 02:27:42.000,2025-03-11,2025,3,11,53262,[],()
74514,54105,21528,3,$69.,"18-Apr-2024,03:47",,69.0,69.0,207.0,2024-04-18 03:47:00.000,2024-04-18,2024,4,18,54105,[],()
80734,54762,21292,2,USD38.5,06:01:00 pm;26-APR-2025,"Suite 943 80911 Kozey Lights, West Brandy, ND 75238-4847",38.5,38.5,77.0,2025-04-26 18:01:00.000,2025-04-26,2025,4,26,54762,[],()
80467,55816,21114,1,58.99 €,23:28:53;29-Dec-2024,NULL,70.788,70.788,70.79,2024-12-29 23:28:53.000,2024-12-29,2024,12,29,55816,[],()
80195,55274,21016,1,75.25 USD,"11:43:56,05/12/25",,75.25,75.25,75.25,2025-05-12 11:43:56.000,2025-05-12,2025,5,12,55274,[],()
83006,53872,20943,1,71.75USD,21:29:20;2024-12-05,NULL,71.75,71.75,71.75,2024-12-05 21:29:20.000,2024-12-05,2024,12,5,53872,[],()
73575,54863,21351,1,49.50 €,02:20:15 P.M. 03/03/25,NULL,59.4,59.4,59.4,2025-03-03 14:20:15.000,2025-03-03,2025,3,3,54863,[],()
78345,55570,21332,1,USD 45.50,"07:37:38,04/09/25","875 Bauch Spring, Daniloville, NV 36284",45.5,45.5,45.5,2025-04-09 07:37:38.000,2025-04-09,2025,4,9,55570,[],()
76813,53968,21541,1,56$50¢,"2024-06-18,11:45","19685 Moen Union, New Pierreside, RI 36022",5650.0,5650.0,5650.0,2024-06-18 11:45:00.000,2024-06-18,2024,6,18,53968,[],()
76831,54500,21217,1,28.25 USD,02:44:32  4-NOV-2024,,28.25,28.25,28.25,2024-11-04 02:44:32.000,2024-11-04,2024,11,4,54500,[],()
82031,53849,21537,5,€16¢50,2025-05-13T17:53:18.015,,1980.0,1980.0,9900.0,2025-05-13 17:53:18.015,2025-05-13,2025,5,13,53849,[],()
79834,54975,21274,1,33.25 USD,26-July-2024 08:17:36 pm,,33.25,33.25,33.25,2024-07-26 20:17:36.000,2024-07-26,2024,7,26,54975,[],()
82159,54530,21463,1,75.5$, 2-NOV-2024 15:44:21,,75.5,75.5,75.5,2024-11-02 15:44:21.000,2024-11-02,2024,11,2,54530,[],()
81964,55791,21251,1,29.75 USD,2024-09-09T21:45:13.194,,29.75,29.75,29.75,2024-09-09 21:45:13.194,2024-09-09,2024,9,9,55791,[],()
73447,55647,21507,1,$44.50,2025-03-06T14:29:29.819,NULL,44.5,44.5,44.5,2025-03-06 14:29:29.819,2025-03-06,2025,3,6,55647,[],()
82532,54773,21091,1,USD27.75,29.01.2025 12:05:05,,27.75,27.75,27.75,2025-01-29 12:05:05.000,2025-01-29,2025,1,29,54773,[],()
83123,55208,20961,2,34.50 $,2025-04-02T18:02:55,"15935 Bartell Road, Considinemouth, VT 18422",34.5,34.5,69.0,2025-04-02 18:02:55.000,2025-04-02,2025,4,2,55208,[],()
74972,55182,21039,2,32.75 USD,12/14/24;18:32:36,NULL,32.75,32.75,65.5,2024-12-14 18:32:36.000,2024-12-14,2024,12,14,55182,[],()
74233,55358,21202,1,74.00 €,2025-04-02T06:11:17,,88.8,88.8,88.8,2025-04-02 06:11:17.000,2025-04-02,2025,4,2,55358,[],()
75976,55114,21409,1,EUR70.25,"21:44, 27-Mar-2025",,84.3,84.3,84.3,2025-03-27 21:44:00.000,2025-03-27,2025,3,27,55114,[],()
82029,55768,21132,1,21.75 $,2025-05-27T13:09:35,,21.75,21.75,21.75,2025-05-27 13:09:35.000,2025-05-27,2025,5,27,55768,[],()
77898,53289,21041,4,72.99$,01/28/25 21:56,"41323 Frami Locks, East Maynard, MN 04845",72.99,72.99,291.96,2025-01-28 21:56:00.000,2025-01-28,2025,1,28,53289,[],()
82632,53301,21134,1,56$,01/25/25;14:30,"2283 Kertzmann Crescent, Lake Janine, NE 58386",56.0,56.0,56.0,2025-01-25 14:30:00.000,2025-01-25,2025,1,25,53301,[],()
79637,53493,21501,2,23.0EUR,"05/06/24,05:49:45 AM","3316 Doyle Parks, Tarynton, NE 55014-8638",27.599999999999998,27.599999999999998,55.2,2024-05-06 05:49:45.000,2024-05-06,2024,5,6,53493,[],()
82026,55257,21531,1,56.00 USD,"09:51, 25-Feb-2025","Suite 762 3563 Aida Brooks, Jacobimouth, WI 22511",56.0,56.0,56.0,2025-02-25 09:51:00.000,2025-02-25,2025,2,25,55257,[],()
75547,53218,20972,1,60.USD,"06:11:45 P.M., 2024-10-14",,60.0,60.0,60.0,2024-10-14 18:11:45.000,2024-10-14,2024,10,14,53218,[],()
76293,53212,21246,1,USD41.5,04/06/25 11:03:36 AM,NULL,41.5,41.5,41.5,2025-04-06 11:03:36.000,2025-04-06,2025,4,6,53212,[],()
75998,54209,21190,1,USD 32.0,03:07:57;16-JUN-2024,,32.0,32.0,32.0,2024-06-16 03:07:57.000,2024-06-16,2024,6,16,54209,[],()
83071,53378,21103,3,66 $,"09:48:14 AM, 2024-03-06",,66.0,66.0,198.0,2024-03-06 09:48:14.000,2024-03-06,2024,3,6,53378,[],()
75498,55101,21078,1,69$99¢,26.02.2025  2:21:21,NULL,6999.0,6999.0,6999.0,2025-02-26 02:21:21.000,2025-02-26,2025,2,26,55101,[],()
81773,53963,20956,1,64.99 USD,04/02/24;20:05:53,,64.99,64.99,64.99,2024-04-02 20:05:53.000,2024-04-02,2024,4,2,53963,[],()
79109,54327,21606,1,USD 17.99,"23:54:18,03/18/25","16758 Chun Glens, South Melaine, FL 07105",17.99,17.99,17.99,2025-03-18 23:54:18.000,2025-03-18,2025,3,18,54327,[],()
82216,53286,21573,2,EUR26.99,2024-10-27T14:13:37.451,,32.388,32.388,64.78,2024-10-27 14:13:37.451,2024-10-27,2024,10,27,53286,[],()
75956,53900,21256,1,USD58.99,"25-APR-2025,09:16:49 pm","546 Brekke Mountains, North Frederic, MD 45425",58.99,58.99,58.99,2025-04-25 21:16:49.000,2025-04-25,2025,4,25,53900,[],()
75686,53847,21133,1,66.EUR,2025-03-28T06:57:32,"73785 Clementina Track, Leuschketon, UT 95847",79.2,79.2,79.2,2025-03-28 06:57:32.000,2025-03-28,2025,3,28,53847,[],()
77666,54645,21227,1,70.50 $,09/29/24;04:22,"572 Cornelius Brooks, Port Lakeishaville, VT 60207",70.5,70.5,70.5,2024-09-29 04:22:00.000,2024-09-29,2024,9,29,54645,[],()
81278,55729,21180,1,EUR20.25,"08:59:14 P.M., 16-JUL-2024",,24.3,24.3,24.3,2024-07-16 20:59:14.000,2024-07-16,2024,7,16,55729,[],()
75859,53978,21001,2,USD33.00,2024-09-25T12:15:18.194,"Suite 436 1938 Mann Rapid, Gislasonbury, AR 08409-9405",33.0,33.0,66.0,2024-09-25 12:15:18.194,2024-09-25,2024,9,25,53978,[],()
81577,54815,21285,2,EUR67.0,"2024-08-31,19:30",,80.39999999999999,80.39999999999999,160.8,2024-08-31 19:30:00.000,2024-08-31,2024,8,31,54815,[],()
78135,54265,21009,4,EUR60.99,04/13/25 10:15:49 pm,"164 Teena Island, South Phil, OR 68112",73.188,73.188,292.75,2025-04-13 22:15:49.000,2025-04-13,2025,4,13,54265,[],()
74296,54258,21234,1,30.25 $,"2024-04-22,09:18:16 AM",,30.25,30.25,30.25,2024-04-22 09:18:16.000,2024-04-22,2024,4,22,54258,[],()
76494,54134,21308,2,€60.25,"30-Jun-2024,05:19:12 P.M.",,72.3,72.3,144.6,2024-06-30 17:19:12.000,2024-06-30,2024,6,30,54134,[],()
77503,54723,21011,2,$33¢25,"12:20:17 A.M.,11-May-2025",,3325.0,3325.0,6650.0,2025-05-11 00:20:17.000,2025-05-11,2025,5,11,54723,[],()
76579,54216,20998,1,$ 48,"03:15:00 am,11/24/24","Apt. 175 374 Julio Lodge, Lake Roxiefurt, WA 85180",48.0,48.0,48.0,2024-11-24 03:15:00.000,2024-11-24,2024,11,24,54216,[],()
77801,53745,20977,1,22.50USD,09:57:44 A.M.;2024-10-08,"Suite 767 55542 Paucek Knoll, Kautzermouth, WV 23094-0989",22.5,22.5,22.5,2024-10-08 09:57:44.000,2024-10-08,2024,10,8,54690,[],()
80906,54394,21340,3,15.00 USD,05:29:23  7-JUN-2025,NULL,15.0,15.0,45.0,2025-06-07 05:29:23.000,2025-06-07,2025,6,7,54394,[],()
81395,54343,20957,1,57€99¢,"02:15:19 P.M., 26-AUG-2024",NULL,6958.8,6958.8,6958.8,2024-08-26 14:15:19.000,2024-08-26,2024,8,26,54343,[],()
74609,55050,21581,1,USD23.00,2025-01-07T21:53:32,"Suite 198 202 O'Reilly Dale, Lonniechester, SD 66203-7638",23.0,23.0,23.0,2025-01-07 21:53:32.000,2025-01-07,2025,1,7,55050,[],()
75347,54674,21428,1,USD 29.50,03:52:59 P.M. 12/01/24,"6161 Mayert Meadow, East Brendanmouth, CO 49504-1457",29.5,29.5,29.5,2024-12-01 15:52:59.000,2024-12-01,2024,12,1,54674,[],()
78856,54322,20918,1,20.0 $,"08/29/24,13:30",,20.0,20.0,20.0,2024-08-29 13:30:00.000,2024-08-29,2024,8,29,54322,[],()
81432,55313,21610,1,43. $,04:56:26 AM;27-Nov-2024,NULL,43.0,43.0,43.0,2024-11-27 04:56:26.000,2024-11-27,2024,11,27,53102,[],()
81488,53895,21173,1,USD17.25,"12/01/24,03:01:42",,17.25,17.25,17.25,2024-12-01 03:01:42.000,2024-12-01,2024,12,1,53895,[],()
82797,54362,20977,4,USD24.,08:57:26 PM 13-March-2025,NULL,24.0,24.0,96.0,2025-03-13 20:57:26.000,2025-03-13,2025,3,13,54362,[],()
82393,53813,21102,1,54.0USD,17:46:04; 7-February-2025,,54.0,54.0,54.0,2025-02-07 17:46:04.000,2025-02-07,2025,2,7,53813,[],()
74488,55253,20993,1,29. EUR,13:59:56 2024-10-07,,34.8,34.8,34.8,2024-10-07 13:59:56.000,2024-10-07,2024,10,7,55253,[],()
77643,54205,21184,1,€70¢25,03:41:43;2025-03-10,NULL,8430.0,8430.0,8430.0,2025-03-10 03:41:43.000,2025-03-10,2025,3,10,54205,[],()
81570,54769,21340,3,18.50USD,"22:10, 31-AUG-2024",,18.5,18.5,55.5,2024-08-31 22:10:00.000,2024-08-31,2024,8,31,54769,[],()
80202,54296,21603,1,$72.50,2024-12-15;13:40,NULL,72.5,72.5,72.5,2024-12-15 13:40:00.000,2024-12-15,2024,12,15,54296,[],()
73692,53298,20956,1,64.75USD,"2024-12-03,06:07:54 am",,64.75,64.75,64.75,2024-12-03 06:07:54.000,2024-12-03,2024,12,3,53298,[],()
83100,53206,21141,2,EUR23.75,"29-SEP-2024,09:52:25 pm",NULL,28.5,28.5,57.0,2024-09-29 21:52:25.000,2024-09-29,2024,9,29,53241,[],()
82076,54534,21475,1,38.0 €,2024-08-07T09:59:54,,45.6,45.6,45.6,2024-08-07 09:59:54.000,2024-08-07,2024,8,7,54534,[],()
73903,53697,21645,1,EUR50.99,08:49;2024-11-01,"5112 Antwan Haven, South Jack, NJ 12541-4005",61.188,61.188,61.19,2024-11-01 08:49:00.000,2024-11-01,2024,11,1,53697,[],()
75797,54014,21146,1,48.USD,16.08.2024  8:08:08,,48.0,48.0,48.0,2024-08-16 08:08:08.000,2024-08-16,2024,8,16,54014,[],()
82206,54856,21323,1,24.50 $," 2-JAN-2025,07:37:36 P.M.",,24.5,24.5,24.5,2025-01-02 19:37:36.000,2025-01-02,2025,1,2,54856,[],()
76034,55826,21465,2,USD 73.5,"2024-10-14, 02:17:28 PM",NULL,73.5,73.5,147.0,2024-10-14 14:17:28.000,2024-10-14,2024,10,14,55826,[],()
77221,55219,21537,1,21.00$,2024-11-28T06:47:18.622,,21.0,21.0,21.0,2024-11-28 06:47:18.622,2024-11-28,2024,11,28,55219,[],()
82593,54283,21482,1,41.75 USD,09:40:47 2025-02-16,"Apt. 957 9211 Jeannetta Gardens, Bessieton, UT 92271",41.75,41.75,41.75,2025-02-16 09:40:47.000,2025-02-16,2025,2,16,54283,[],()
76696,54264,21199,2,$40.0,03:19:47 PM 2025-06-09,,40.0,40.0,80.0,2025-06-09 15:19:47.000,2025-06-09,2025,6,9,55133,[],()
80237,53937,20961,1,34.00 $,2024-12-06 03:22,,34.0,34.0,34.0,2024-12-06 03:22:00.000,2024-12-06,2024,12,6,54777,[],()
80198,53488,21009,1,$ 62,03:28:19 2024-10-31,NULL,62.0,62.0,62.0,2024-10-31 03:28:19.000,2024-10-31,2024,10,31,53488,[],()
73880,53832,21178,2,USD 47.25,2025-02-03T11:03:53.186,"78716 Kub Road, Smithborough, CA 39194",47.25,47.25,94.5,2025-02-03 11:03:53.186,2025-02-03,2025,2,3,53832,[],()
80953,54367,21626,1,$67.50,"2024-10-17, 07:44",,67.5,67.5,67.5,2024-10-17 07:44:00.000,2024-10-17,2024,10,17,54367,[],()
77994,53267,21266,1,€57¢00,17:33:44 2024-11-12,NULL,6840.0,6840.0,6840.0,2024-11-12 17:33:44.000,2024-11-12,2024,11,12,53267,[],()
74782,55610,21570,1,USD 47.75,"07:14,06/04/24",NULL,47.75,47.75,47.75,2024-06-04 07:14:00.000,2024-06-04,2024,6,4,55610,[],()
80905,54837,21088,1,USD 53.00,2025-05-06T14:18:41.095,NULL,53.0,53.0,53.0,2025-05-06 14:18:41.095,2025-05-06,2025,5,6,54837,[],()
80090,55456,21617,1,$ 24.50,"00:08:07, 24-August-2024",,24.5,24.5,24.5,2024-08-24 00:08:07.000,2024-08-24,2024,8,24,55456,[],()
74973,53548,21400,1,43.00USD,2025-04-22T05:46:19,"7427 Odis Drive, Sherriborough, MO 98634",43.0,43.0,43.0,2025-04-22 05:46:19.000,2025-04-22,2025,4,22,53548,[],()
76436,54898,21495,1,20.99 $,"01:26:44 am,10/22/24","Apt. 995 3605 O'Keefe Lakes, Maryfort, MN 42655-6051",20.99,20.99,20.99,2024-10-22 01:26:44.000,2024-10-22,2024,10,22,54898,[],()
78019,54316,21416,2,$16¢25,2025-07-19T01:19:38,NULL,1625.0,1625.0,3250.0,2025-07-19 01:19:38.000,2025-07-19,2025,7,19,54316,[],()
75019,53134,21286,1,32.0$,2025-03-08;10:03,,32.0,32.0,32.0,2025-03-08 10:03:00.000,2025-03-08,2025,3,8,53134,[],()
75967,54407,21573,2,$ 24.00,13-JUL-2024;21:11,,24.0,24.0,48.0,2024-07-13 21:11:00.000,2024-07-13,2024,7,13,54407,[],()
78896,54952,21139,1,€ 55,"05:34:30 P.M., 28-Jul-2024","Apt. 491 3261 Jacobs Run, West Gus, IN 31810",66.0,66.0,66.0,2024-07-28 17:34:30.000,2024-07-28,2024,7,28,54952,[],()
82539,55330,21523,1,€ 48.99,2025-04-05T18:44:30.667,,58.788,58.788,58.79,2025-04-05 18:44:30.667,2025-04-05,2025,4,5,55330,[],()
83029,53834,21118,2,48.00$,2024-04-08T08:15:45.801,,48.0,48.0,96.0,2024-04-08 08:15:45.801,2024-04-08,2024,4,8,53834,[],()
77303,54375,21007,1,$ 32.00," 9-September-2024,17:04",NULL,32.0,32.0,32.0,2024-09-09 17:04:00.000,2024-09-09,2024,9,9,54375,[],()
82452,54013,21117,1,$37.5,05:35:10 am 06/16/24,"644 Hugh Mills, Mayaside, WV 71225-1346",37.5,37.5,37.5,2024-06-16 05:35:10.000,2024-06-16,2024,6,16,54013,[],()
73370,53529,21136,1,$ 74.5,Mon Sep 16 07:24:40 2024,,74.5,74.5,74.5,2024-09-16 07:24:40.000,2024-09-16,2024,9,16,53529,[],()
81809,54189,21106,1,43.99USD,2025-09-13T16:04:24,,43.99,43.99,43.99,2025-09-13 16:04:24.000,2025-09-13,2025,9,13,54189,[],()
81072,54900,21170,2,73.5 $,"07/15/24, 06:30:32",,73.5,73.5,147.0,2024-07-15 06:30:32.000,2024-07-15,2024,7,15,54900,[],()
79780,55740,21205,1,USD28.00,05:46:10 AM 12-JAN-2025,,28.0,28.0,28.0,2025-01-12 05:46:10.000,2025-01-12,2025,1,12,55740,[],()
78253,55141,20991,2,44.50€,2025-01-16T23:53:00.088,,53.4,53.4,106.8,2025-01-16 23:53:00.088,2025-01-16,2025,1,16,55141,[],()
78148,55799,21011,5,$ 38.75,2025-01-29T22:48:39,"Suite 771 321 Weimann Stream, Victorstad, CO 70169",38.75,38.75,193.75,2025-01-29 22:48:39.000,2025-01-29,2025,1,29,55799,[],()
75127,53530,21130,3,40.00 €,2025-07-14T05:45:26,,48.0,48.0,144.0,2025-07-14 05:45:26.000,2025-07-14,2025,7,14,53530,[],()
82785,55000,21644,1,EUR63.0,11:18 12/13/24,NULL,75.6,75.6,75.6,2024-12-13 11:18:00.000,2024-12-13,2024,12,13,55000,[],()
74126,53111,21228,1,25.50 EUR,"2025-06-10, 02:07:09",,30.599999999999998,30.599999999999998,30.6,2025-06-10 02:07:09.000,2025-06-10,2025,6,10,53111,[],()
81982,55454,21121,1,20.50$,2024-07-16T23:14:49,"Suite 888 41186 Talia Extensions, Carterhaven, MD 72615-9292",20.5,20.5,20.5,2024-07-16 23:14:49.000,2024-07-16,2024,7,16,55454,[],()
82677,54971,20928,2,€ 19.25,29.09.2024  8:01:01,"8216 Savanna Manor, Wisozkfort, NE 60556",23.099999999999998,23.099999999999998,46.2,2024-09-29 08:01:01.000,2024-09-29,2024,9,29,54971,[],()
75580,54973,21295,2,13.75$,05:28:11 am;2024-06-07,NULL,13.75,13.75,27.5,2024-06-07 05:28:11.000,2024-06-07,2024,6,7,54973,[],()
79756,55535,21081,4,€73¢25,2024-12-10T02:40:07.276,,8790.0,8790.0,35160.0,2024-12-10 02:40:07.276,2024-12-10,2024,12,10,55535,[],()
76391,53847,20995,3,53.75 €,2024-04-16T05:27:46.890,"73785 Clementina Track, Leuschketon, UT 95847",64.5,64.5,193.5,2024-04-16 05:27:46.890,2024-04-16,2024,4,16,53847,[],()
73450,55820,21154,1,$ 68.00,2025-01-06T06:40:46,"9574 Jones Plaza, West Lelah, AL 84126-7147",68.0,68.0,68.0,2025-01-06 06:40:46.000,2025-01-06,2025,1,6,54084,[],()
77528,55556,21318,2,55.5 €,"05/04/24,12:10:07",,66.6,66.6,133.2,2024-05-04 12:10:07.000,2024-05-04,2024,5,4,54850,[],()
75543,55436,21255,1,41.5EUR,17-Dec-2024;01:45:51,,49.8,49.8,49.8,2024-12-17 01:45:51.000,2024-12-17,2024,12,17,55436,[],()
73512,54275,21630,3,57EUR,00:56:37 2025-01-31,NULL,68.39999999999999,68.39999999999999,205.2,2025-01-31 00:56:37.000,2025-01-31,2025,1,31,54275,[],()
79674,54389,21574,1,€22.00,"09:38, 09/23/24",NULL,26.4,26.4,26.4,2024-09-23 09:38:00.000,2024-09-23,2024,9,23,54389,[],()
79736,53102,21108,2,23.75USD,03:25:59 AM;27-February-2025,NULL,23.75,23.75,47.5,2025-02-27 03:25:59.000,2025-02-27,2025,2,27,53102,[],()
82420,54734,20963,1,$ 61.50,2024-11-17T01:31:39,,61.5,61.5,61.5,2024-11-17 01:31:39.000,2024-11-17,2024,11,17,53523,[],()
77578,53979,21053,1,51.75 $,10/16/24 01:25:13 P.M.,NULL,51.75,51.75,51.75,2024-10-16 13:25:13.000,2024-10-16,2024,10,16,53979,[],()
79032,54872,21151,1,38.5 EUR, 4-August-2024 09:53:10,"293 Nitzsche Trail, North Garyton, HI 30156",46.199999999999996,46.199999999999996,46.2,2024-08-04 09:53:10.000,2024-08-04,2024,8,4,54872,[],()
83000,54820,20960,1,USD26.5,10:23:29 A.M.;01/24/25,"Suite 925 408 Hoeger Plains, New Jacklyn, MO 71356",26.5,26.5,26.5,2025-01-24 10:23:29.000,2025-01-24,2025,1,24,54820,[],()
74441,54489,21201,4,USD 65.75,"11:42:10 AM, 10-December-2024","Apt. 565 4836 Kent Turnpike, Lake Jolynstad, MT 95427",65.75,65.75,263.0,2024-12-10 11:42:10.000,2024-12-10,2024,12,10,54489,[],()
76583,54008,21269,2,$ 35.99,"11:05:39 A.M., 18-AUG-2024","Apt. 414 54462 Hallie Divide, North Adena, NV 12774-1085",35.99,35.99,71.98,2024-08-18 11:05:39.000,2024-08-18,2024,8,18,54008,[],()
77406,53994,21392,2,€73.50,19:25; 3-Jan-2025,,88.2,88.2,176.4,2025-01-03 19:25:00.000,2025-01-03,2025,1,3,53994,[],()
76959,54465,21054,1,20.75USD,18:06 11-JUL-2025,NULL,20.75,20.75,20.75,2025-07-11 18:06:00.000,2025-07-11,2025,7,11,54465,[],()
76685,53848,21284,1,USD 23.99,2025-06-18T09:36:58,,23.99,23.99,23.99,2025-06-18 09:36:58.000,2025-06-18,2025,6,18,53848,[],()
75889,53342,21528,3,69.75EUR,2024-09-27T03:38:20,,83.7,83.7,251.1,2024-09-27 03:38:20.000,2024-09-27,2024,9,27,53342,[],()
74249,55531,21194,4,19.00 $,"09/04/24, 10:43",,19.0,19.0,76.0,2024-09-04 10:43:00.000,2024-09-04,2024,9,4,55531,[],()
79924,55543,21340,5,16.00EUR,15-Jul-2025 19:00,NULL,19.2,19.2,96.0,2025-07-15 19:00:00.000,2025-07-15,2025,7,15,55543,[],()
79054,55726,21306,1,EUR 31.50,"2024-12-26, 06:12:39 A.M.",,37.8,37.8,37.8,2024-12-26 06:12:39.000,2024-12-26,2024,12,26,55726,[],()
81009,54334,21128,1,€ 64.0,14:55:46;10/03/24,,76.8,76.8,76.8,2024-10-03 14:55:46.000,2024-10-03,2024,10,3,54334,[],()
75066,53271,21456,1,$ 54.75,"12:34, 04/19/25",NULL,54.75,54.75,54.75,2025-04-19 12:34:00.000,2025-04-19,2025,4,19,53271,[],()
75270,54163,21088,5,$ 56.5,"01/04/25, 04:07",,56.5,56.5,282.5,2025-01-04 04:07:00.000,2025-01-04,2025,1,4,54163,[],()
74831,55533,20928,3,€21¢75,30-AUG-2024;06:43,NULL,2610.0,2610.0,7830.0,2024-08-30 06:43:00.000,2024-08-30,2024,8,30,55533,[],()
80416,53813,20937,1,23.99 USD," 4-Oct-2024,01:24",NULL,23.99,23.99,23.99,2024-10-04 01:24:00.000,2024-10-04,2024,10,4,53813,[],()
78302,53061,21052,1,74.0USD,"17:23,2024-07-23",,74.0,74.0,74.0,2024-07-23 17:23:00.000,2024-07-23,2024,7,23,53061,[],()
79546,54206,21066,5,USD 33.99,09/04/24 11:31:29 A.M.,,33.99,33.99,169.95,2024-09-04 11:31:29.000,2024-09-04,2024,9,4,54206,[],()
73897,53202,20985,1,USD34.,12:52:17;2025-06-14,,34.0,34.0,34.0,2025-06-14 12:52:17.000,2025-06-14,2025,6,14,53202,[],()
76535,53628,21208,1,EUR 17.50,13:48  7-December-2024,"9228 Bruen Corner, Beerhaven, WV 18752",21.0,21.0,21.0,2024-12-07 13:48:00.000,2024-12-07,2024,12,7,53628,[],()
77223,55335,21075,1,EUR47.25,"05/20/24,01:22:54 A.M.",NULL,56.699999999999996,56.699999999999996,56.7,2024-05-20 01:22:54.000,2024-05-20,2024,5,20,55335,[],()
80880,53284,21464,1,€ 28.00,"07:11, 07/17/25",,33.6,33.6,33.6,2025-07-17 07:11:00.000,2025-07-17,2025,7,17,54285,[],()
76614,53594,21370,2,USD 43.5,"02:48:55,2025-01-23",,43.5,43.5,87.0,2025-01-23 02:48:55.000,2025-01-23,2025,1,23,53594,[],()
77722,53372,21321,4,USD 70.0,05:55:14 P.M.  6-Mar-2024,NULL,70.0,70.0,280.0,2024-03-06 17:55:14.000,2024-03-06,2024,3,6,54179,[],()
74214,54671,21446,3,€ 34.50,2024-08-19 23:40:57,"42956 Lincoln Garden, Kylemouth, MT 38326-1176",41.4,41.4,124.2,2024-08-19 23:40:57.000,2024-08-19,2024,8,19,54671,[],()
75249,55408,20974,1,$65.00,"2025-07-25, 05:10:02 A.M.",NULL,65.0,65.0,65.0,2025-07-25 05:10:02.000,2025-07-25,2025,7,25,55059,[],()
78132,53621,21459,1,€17¢25," 6-November-2024,07:35:23 A.M.",NULL,2070.0,2070.0,2070.0,2024-11-06 07:35:23.000,2024-11-06,2024,11,6,53621,[],()
75461,54405,21526,1,25.5 USD,2025-03-22T22:38:00,,25.5,25.5,25.5,2025-03-22 22:38:00.000,2025-03-22,2025,3,22,54405,[],()
79831,53279,21493,3,USD28.25,"11/15/24,13:39",,28.25,28.25,84.75,2024-11-15 13:39:00.000,2024-11-15,2024,11,15,53279,[],()
74570,55517,20980,2,€32.5,01:36:51 pm; 4-Aug-2025,NULL,39.0,39.0,78.0,2025-08-04 13:36:51.000,2025-08-04,2025,8,4,55517,[],()
75712,53425,21250,1,24.5 $,"12:03:05, 2024-09-25",,24.5,24.5,24.5,2024-09-25 12:03:05.000,2024-09-25,2024,9,25,53425,[],()
80824,54347,21570,1,$46.0,"03:49, 2025-02-08",,46.0,46.0,46.0,2025-02-08 03:49:00.000,2025-02-08,2025,2,8,54347,[],()
78961,53577,21095,1,51.5 $,09:04:30 PM 2024-08-15,,51.5,51.5,51.5,2024-08-15 21:04:30.000,2024-08-15,2024,8,15,53577,[],()
75895,53682,21636,1,51.0 $,2024-08-13 23:18:57,,51.0,51.0,51.0,2024-08-13 23:18:57.000,2024-08-13,2024,8,13,53682,[],()
80526,54474,21591,2,USD57.25,11/13/24;15:17,NULL,57.25,57.25,114.5,2024-11-13 15:17:00.000,2024-11-13,2024,11,13,54474,[],()
78075,55296,21023,1,14 USD,"03:12:21 AM,2025-01-11","Apt. 176 945 Jenkins Islands, Mellisafort, SD 15225-6689",14.0,14.0,14.0,2025-01-11 03:12:21.000,2025-01-11,2025,1,11,53969,[],()
78692,54337,21068,1,62.50USD," 1-July-2025, 04:00",,62.5,62.5,62.5,2025-07-01 04:00:00.000,2025-07-01,2025,7,1,54337,[],()
79981,53166,21539,5,USD 64.75,"01:24:16, 2024-07-13",,64.75,64.75,323.75,2024-07-13 01:24:16.000,2024-07-13,2024,7,13,53166,[],()
76720,53714,20957,1,$ 60.99,"08:36:21 P.M.,02/15/25",NULL,60.99,60.99,60.99,2025-02-15 20:36:21.000,2025-02-15,2025,2,15,53714,[],()
77520,54139,21607,5,EUR 69.75,01:20:06 P.M.;02/09/25,"Suite 974 190 Donnelly Canyon, Streichshire, NH 82778",83.7,83.7,418.5,2025-02-09 13:20:06.000,2025-02-09,2025,2,9,54139,[],()
81075,55048,21296,1,EUR38.0,16:42 12/18/24,,45.6,45.6,45.6,2024-12-18 16:42:00.000,2024-12-18,2024,12,18,55048,[],()
79612,55502,21558,3,27.00 EUR,10/03/24 05:54:26 AM,"Suite 590 75443 Leffler Plaza, Lake Carrollville, IA 03714",32.4,32.4,97.2,2024-10-03 05:54:26.000,2024-10-03,2024,10,3,55502,[],()
82295,53131,21575,3,€ 45.00,15:16  1-Feb-2025,NULL,54.0,54.0,162.0,2025-02-01 15:16:00.000,2025-02-01,2025,2,1,53131,[],()
81146,54527,21460,5,34.25$,"06:44, 01/10/25","Suite 166 8952 Byron Square, New Adelaide, KY 02642-1898",34.25,34.25,171.25,2025-01-10 06:44:00.000,2025-01-10,2025,1,10,54527,[],()
78185,53779,21003,1,38€,Sat Oct 12 00:19:04 2024,NULL,45.6,45.6,45.6,2024-10-12 00:19:04.000,2024-10-12,2024,10,12,53779,[],()
81995,55619,21348,5,USD 28.5,17:12  5-June-2024,"Suite 721 21412 Upton Court, Port Mickeytown, NC 10664",28.5,28.5,142.5,2024-06-05 17:12:00.000,2024-06-05,2024,6,5,55619,[],()
80576,53707,21573,1,USD 24.00,18-Sep-2024;07:19:19,NULL,24.0,24.0,24.0,2024-09-18 07:19:19.000,2024-09-18,2024,9,18,53707,[],()
79912,53652,21416,3,17.50 $,"2024-04-11,17:03","5251 Patrick Ford, Stokesborough, TX 20305",17.5,17.5,52.5,2024-04-11 17:03:00.000,2024-04-11,2024,4,11,53652,[],()
74110,54218,21195,2,37.99USD,"04/02/25,12:34:33 AM",,37.99,37.99,75.98,2025-04-02 00:34:33.000,2025-04-02,2025,4,2,54218,[],()
79688,54188,21573,1,USD 25.5,"21:39, 10/24/24",,25.5,25.5,25.5,2024-10-24 21:39:00.000,2024-10-24,2024,10,24,54188,[],()
77288,53387,21105,1,$48.00,"2024-09-29, 21:53:32","Apt. 304 28712 Cuc Mills, Batzmouth, MT 09329-1931",48.0,48.0,48.0,2024-09-29 21:53:32.000,2024-09-29,2024,9,29,53387,[],()
75971,54469,21108,2,24.25EUR,12-March-2025;02:41:18 am,"78519 Douglass Shoal, South Lannystad, NC 00827",29.099999999999998,29.099999999999998,58.2,2025-03-12 02:41:18.000,2025-03-12,2025,3,12,54469,[],()
81332,55645,21482,1,EUR42.,2025-02-03T21:37:44,"Suite 411 1243 Turner Heights, Wizamouth, NE 38125",50.4,50.4,50.4,2025-02-03 21:37:44.000,2025-02-03,2025,2,3,55645,[],()
75688,54318,20954,1,USD74,"28-April-2024,16:17:05",,74.0,74.0,74.0,2024-04-28 16:17:05.000,2024-04-28,2024,4,28,54318,[],()
74113,55231,21355,1,$ 47.00,2025-01-02T04:28:30,,47.0,47.0,47.0,2025-01-02 04:28:30.000,2025-01-02,2025,1,2,55231,[],()
75537,54365,20998,1,€47.0,02/19/24 09:41,,56.4,56.4,56.4,2024-02-19 09:41:00.000,2024-02-19,2024,2,19,54365,[],()
82225,54680,20942,1,38.25USD, 4-May-2025 18:53:53,,38.25,38.25,38.25,2025-05-04 18:53:53.000,2025-05-04,2025,5,4,54680,[],()
74723,55535,21047,1,USD 52.0,"11:32:38 A.M., 2025-08-08","146 Maximo Loop, Lake Rudolfberg, SC 27046",52.0,52.0,52.0,2025-08-08 11:32:38.000,2025-08-08,2025,8,8,55535,[],()
74447,53880,21127,1,$56¢75,04:41:17 am;20-MAY-2025,,5675.0,5675.0,5675.0,2025-05-20 04:41:17.000,2025-05-20,2025,5,20,53880,[],()
83135,54372,21448,2,14.0 $,"2024-10-21,18:13",,14.0,14.0,28.0,2024-10-21 18:13:00.000,2024-10-21,2024,10,21,54372,[],()
78626,53417,21598,1,EUR37,"17:44, 2025-04-27",,44.4,44.4,44.4,2025-04-27 17:44:00.000,2025-04-27,2025,4,27,53417,[],()
77505,54764,21271,1,26.5 €,"04:31:47,25-NOV-2024","Apt. 974 9861 Yetta Ports, South Ligia, NC 13568",31.799999999999997,31.799999999999997,31.8,2024-11-25 04:31:47.000,2024-11-25,2024,11,25,54764,[],()
78087,54081,21606,1,17.25 $,"02:33, 19-DEC-2024",NULL,17.25,17.25,17.25,2024-12-19 02:33:00.000,2024-12-19,2024,12,19,55560,[],()
75845,54905,21165,2,17.25 €,"06:07,23-OCT-2024",,20.7,20.7,41.4,2024-10-23 06:07:00.000,2024-10-23,2024,10,23,54905,[],()
82767,53893,20974,3,EUR 63.00,08:42:05  7-October-2024,"Suite 200 258 Kunde Keys, South Cynthiaton, AK 41072",75.6,75.6,226.8,2024-10-07 08:42:05.000,2024-10-07,2024,10,7,53893,[],()
82668,53349,21007,1,USD 31.00,18-Aug-2025;00:59:41,,31.0,31.0,31.0,2025-08-18 00:59:41.000,2025-08-18,2025,8,18,53349,[],()
79782,55180,21116,1,33.75 EUR,09:48 28-Sep-2025,,40.5,40.5,40.5,2025-09-28 09:48:00.000,2025-09-28,2025,9,28,55180,[],()
82818,53712,21069,1,USD 25.0,"2025-02-07, 08:08:49 AM",NULL,25.0,25.0,25.0,2025-02-07 08:08:49.000,2025-02-07,2025,2,7,53712,[],()
80270,53779,21243,1,USD 69.00,"2024-10-25,01:50:51 PM",,69.0,69.0,69.0,2024-10-25 13:50:51.000,2024-10-25,2024,10,25,53779,[],()
81344,54725,21044,1,USD22.25,03:33:54 P.M.;2024-06-19,,22.25,22.25,22.25,2024-06-19 15:33:54.000,2024-06-19,2024,6,19,54725,[],()
78753,55174,21378,1,40.25 USD,"13-JUL-2024, 06:56","Apt. 350 238 Lowe Forks, Vibury, IA 01830-1412",40.25,40.25,40.25,2024-07-13 06:56:00.000,2024-07-13,2024,7,13,55174,[],()
76805,54937,21635,1,$ 25.75,2024-09-30T15:18:20.809,,25.75,25.75,25.75,2024-09-30 15:18:20.809,2024-09-30,2024,9,30,54937,[],()
77135,54697,21214,1,59.0USD,2024-04-24T18:13:24,"Suite 134 3178 Onita Grove, North Diane, MN 07074",59.0,59.0,59.0,2024-04-24 18:13:24.000,2024-04-24,2024,4,24,54697,[],()
82268,53453,21270,2,€ 68.25,17-December-2024;15:48,,81.89999999999999,81.89999999999999,163.8,2024-12-17 15:48:00.000,2024-12-17,2024,12,17,53453,[],()
81878,55271,21289,2,50.0 $,2024-09-09;05:06:28 am,,50.0,50.0,100.0,2024-09-09 05:06:28.000,2024-09-09,2024,9,9,55271,[],()
74155,53472,21080,2,23.99$,09.10.2024 03:06:06,,23.99,23.99,47.98,2024-09-10 03:06:06.000,2024-09-10,2024,9,10,53472,[],()
80761,55701,21441,2,USD 17.,24-Oct-2024;04:10:50,,17.0,17.0,34.0,2024-10-24 04:10:50.000,2024-10-24,2024,10,24,55701,[],()
80908,55082,21141,5,USD 20.25,04.11.2024 13:32:32,"5124 Kessler Inlet, Carmeloview, NC 45805-4148",20.25,20.25,101.25,2024-04-11 13:32:32.000,2024-04-11,2024,4,11,55082,[],()
78595,53987,21063,1,USD 50.75,11:23:17 pm 11/16/24,,50.75,50.75,50.75,2024-11-16 23:23:17.000,2024-11-16,2024,11,16,53987,[],()
80704,55450,20922,2,USD 63.00,05:02:46;09/24/24,,63.0,63.0,126.0,2024-09-24 05:02:46.000,2024-09-24,2024,9,24,55450,[],()
77087,53240,21456,1,USD 51.25,2024-07-27T13:18:41,,51.25,51.25,51.25,2024-07-27 13:18:41.000,2024-07-27,2024,7,27,53240,[],()
74389,53623,21306,1,$ 31.00,09:06:42 pm; 2-Jan-2025,"Suite 740 2011 Runolfsson Bridge, Jastburgh, WY 34114-7178",31.0,31.0,31.0,2025-01-02 21:06:42.000,2025-01-02,2025,1,2,53623,[],()
77483,53977,21654,1,USD 12.00,18:13:12 17-Oct-2024,NULL,12.0,12.0,12.0,2024-10-17 18:13:12.000,2024-10-17,2024,10,17,53977,[],()
76988,55619,21105,3,51.75EUR,"09:51:37 am,2025-08-03",NULL,62.099999999999994,62.099999999999994,186.3,2025-08-03 09:51:37.000,2025-08-03,2025,8,3,55619,[],()
79402,53580,21421,3,$ 52.99,2025-01-29T13:20:37,,52.99,52.99,158.97,2025-01-29 13:20:37.000,2025-01-29,2025,1,29,53580,[],()
75511,54021,21646,1,USD15.0, 8-AUG-2024 19:29:26,,15.0,15.0,15.0,2024-08-08 19:29:26.000,2024-08-08,2024,8,8,54021,[],()
75256,55444,21554,1,31.25USD,09:29 04/24/25,,31.25,31.25,31.25,2025-04-24 09:29:00.000,2025-04-24,2025,4,24,55444,[],()
79686,54585,21298,1,USD 26.0,"11:30:06 P.M.,24-September-2025",NULL,26.0,26.0,26.0,2025-09-24 23:30:06.000,2025-09-24,2025,9,24,54585,[],()
81323,53552,20958,1,33.00$,2025-02-09 12:52:08 am,,33.0,33.0,33.0,2025-02-09 00:52:08.000,2025-02-09,2025,2,9,53552,[],()
82275,53735,21119,1,USD35.00,06:54:00 am;28-May-2025,,35.0,35.0,35.0,2025-05-28 06:54:00.000,2025-05-28,2025,5,28,53735,[],()
81259,54128,21539,4,67 €,12/26/24;04:12:04 PM,,80.39999999999999,80.39999999999999,321.6,2024-12-26 16:12:04.000,2024-12-26,2024,12,26,54128,[],()
77485,55672,20945,5,35.75 EUR,08/13/24 11:33:20 AM,NULL,42.9,42.9,214.5,2024-08-13 11:33:20.000,2024-08-13,2024,8,13,55672,[],()
76358,54416,21122,2,65.5EUR,2024-10-19;19:00,,78.6,78.6,157.2,2024-10-19 19:00:00.000,2024-10-19,2024,10,19,54416,[],()
80004,53987,21247,1,53.00EUR,12:54:12 PM 07/13/25,,63.599999999999994,63.599999999999994,63.6,2025-07-13 12:54:12.000,2025-07-13,2025,7,13,53987,[],()
81459,53315,20990,1,24.99USD,"2024-06-18,10:59","11671 Denesik Village, New Cecil, TN 02596-6096",24.99,24.99,24.99,2024-06-18 10:59:00.000,2024-06-18,2024,6,18,53315,[],()
83116,53356,21494,1,EUR 27.0,2024-08-28 10:36:52 pm,,32.4,32.4,32.4,2024-08-28 22:36:52.000,2024-08-28,2024,8,28,53356,[],()
76386,55199,21351,1,€52.25,"03:20:11,27-October-2024",NULL,62.699999999999996,62.699999999999996,62.7,2024-10-27 03:20:11.000,2024-10-27,2024,10,27,55199,[],()
77626,53891,21427,1,59.25USD,04/08/25 03:58,"Apt. 244 1292 Arlen Divide, Kemmerborough, TX 75446-8287",59.25,59.25,59.25,2025-04-08 03:58:00.000,2025-04-08,2025,4,8,53891,[],()
74008,55500,21350,3,$48.5,"08/08/24, 19:27",,48.5,48.5,145.5,2024-08-08 19:27:00.000,2024-08-08,2024,8,8,55500,[],()
77170,53779,21180,1,USD 20.25,"08:31:16 pm,2024-07-21",,20.25,20.25,20.25,2024-07-21 20:31:16.000,2024-07-21,2024,7,21,53779,[],()
78063,54422,21214,1,62.99EUR,"2024-04-29, 12:13:47 A.M.","27184 Mayme Junction, Cristchester, HI 98045",75.588,75.588,75.59,2024-04-29 00:13:47.000,2024-04-29,2024,4,29,54422,[],()
80785,55303,21589,1,$44.99,"2024-11-04,10:22:19",NULL,44.99,44.99,44.99,2024-11-04 10:22:19.000,2024-11-04,2024,11,4,55303,[],()
77272,53911,20993,1,USD 26.5,"09:33:17, 16-Sep-2024","Suite 515 492 Alec Overpass, New Codystad, IA 44050",26.5,26.5,26.5,2024-09-16 09:33:17.000,2024-09-16,2024,9,16,53911,[],()
75873,54916,21560,1,52.25 EUR,"2025-05-23, 02:03:46","49207 Vonnie Island, New Maxwell, SC 24955",62.699999999999996,62.699999999999996,62.7,2025-05-23 02:03:46.000,2025-05-23,2025,5,23,54916,[],()
78739,53250,21412,1,$44.99,"02/24/25,08:36:58",,44.99,44.99,44.99,2025-02-24 08:36:58.000,2025-02-24,2025,2,24,53250,[],()
75287,55662,21554,1,USD 32.0,"04/28/24,09:33:49 pm",,32.0,32.0,32.0,2024-04-28 21:33:49.000,2024-04-28,2024,4,28,55662,[],()
76342,54836,20978,1,USD55.75,10/08/24 06:37:57 AM,"708 Weber Run, Kareemside, GA 81557-1940",55.75,55.75,55.75,2024-10-08 06:37:57.000,2024-10-08,2024,10,8,54836,[],()
78149,54287,21362,1,$48,"22:28,17-Oct-2024",,48.0,48.0,48.0,2024-10-17 22:28:00.000,2024-10-17,2024,10,17,54287,[],()
75644,54221,21143,1,USD 42.99,03:59:26 P.M.;12/21/24,,42.99,42.99,42.99,2024-12-21 15:59:26.000,2024-12-21,2024,12,21,54221,[],()
74956,55512,20946,2,21.99 $,02:11:24 AM;18-May-2024,,21.99,21.99,43.98,2024-05-18 02:11:24.000,2024-05-18,2024,5,18,55512,[],()
75438,54665,21582,2,$ 61.5,2025-04-09 12:02,NULL,61.5,61.5,123.0,2025-04-09 12:02:00.000,2025-04-09,2025,4,9,54665,[],()
77969,53357,20977,1,USD23.75,23:18:29;03/19/25,,23.75,23.75,23.75,2025-03-19 23:18:29.000,2025-03-19,2025,3,19,53357,[],()
78764,55698,21490,1,€41¢75,"2025-01-06,08:01:28","Apt. 552 47051 Marissa Mountains, West Margo, ND 41032-4325",5010.0,5010.0,5010.0,2025-01-06 08:01:28.000,2025-01-06,2025,1,6,55698,[],()
80562,53810,21402,1,70.5$,12/15/24 15:23:09,,70.5,70.5,70.5,2024-12-15 15:23:09.000,2024-12-15,2024,12,15,53810,[],()
82962,55083,21416,1,USD 16.,"03:07:56 pm, 17-AUG-2024","Apt. 419 424 Hoeger River, Lake Tereseberg, NH 48582",16.0,16.0,16.0,2024-08-17 15:07:56.000,2024-08-17,2024,8,17,55083,[],()
75231,54078,21087,3,27.99 $,2025-03-28T00:51:17,,27.99,27.99,83.97,2025-03-28 00:51:17.000,2025-03-28,2025,3,28,54078,[],()
75752,55432,21548,5,$65.75,2024-11-19T01:02:58,NULL,65.75,65.75,328.75,2024-11-19 01:02:58.000,2024-11-19,2024,11,19,55432,[],()
75507,54270,21285,1,67.00$,"03:50,2024-07-16",,67.0,67.0,67.0,2024-07-16 03:50:00.000,2024-07-16,2024,7,16,54270,[],()
77615,55556,21061,1,46.99$," 3-FEB-2025, 02:26:49 P.M.","4604 Kertzmann River, Lake Jarod, MD 59069",46.99,46.99,46.99,2025-02-03 14:26:49.000,2025-02-03,2025,2,3,54850,[],()
82055,54334,20967,3,35.50EUR, 5-JUN-2025 16:54:20,,42.6,42.6,127.8,2025-06-05 16:54:20.000,2025-06-05,2025,6,5,54334,[],()
77211,53993,21257,1,$ 43.5,"24-Jun-2024, 15:47:01",,43.5,43.5,43.5,2024-06-24 15:47:01.000,2024-06-24,2024,6,24,53993,[],()
82143,55439,21256,4,61.50 USD,2025-03-16T19:07:55.736,,61.5,61.5,246.0,2025-03-16 19:07:55.736,2025-03-16,2025,3,16,55439,[],()
82654,55424,21537,1,$18.99,"16:35, 03/21/25","Apt. 845 1797 Tamisha Wells, Ortiztown, OK 16189",18.99,18.99,18.99,2025-03-21 16:35:00.000,2025-03-21,2025,3,21,55424,[],()
76002,55656,21060,1,$ 33.50,22:05:36 2025-02-11,,33.5,33.5,33.5,2025-02-11 22:05:36.000,2025-02-11,2025,2,11,55656,[],()
81837,54755,21295,5,USD16.50,"2025-03-29,15:02",,16.5,16.5,82.5,2025-03-29 15:02:00.000,2025-03-29,2025,3,29,53523,[],()
74667,53716,20932,1,20.99 $,"05/03/25, 12:11:52 AM",,20.99,20.99,20.99,2025-05-03 00:11:52.000,2025-05-03,2025,5,3,53716,[],()
79204,53177,20978,1,58.25 USD,12/01/24 12:10:08 AM,,58.25,58.25,58.25,2024-12-01 00:10:08.000,2024-12-01,2024,12,1,53177,[],()
79160,53994,21540,1,EUR62.50,11-Jan-2025;11:33:53,,75.0,75.0,75.0,2025-01-11 11:33:53.000,2025-01-11,2025,1,11,53994,[],()
75635,54407,21645,1,52.00 USD,2024-09-04T13:49:23.611,NULL,52.0,52.0,52.0,2024-09-04 13:49:23.611,2024-09-04,2024,9,4,54407,[],()
82435,55686,21021,1,€47.75,"02/16/25,01:32",,57.3,57.3,57.3,2025-02-16 01:32:00.000,2025-02-16,2025,2,16,55686,[],()
77555,53273,21586,2,18.25$,18-SEP-2024 06:20:08,,18.25,18.25,36.5,2024-09-18 06:20:08.000,2024-09-18,2024,9,18,53273,[],()
75297,54068,21170,1,72.25EUR,2024-11-05;03:12:41 P.M.,NULL,86.7,86.7,86.7,2024-11-05 15:12:41.000,2024-11-05,2024,11,5,54068,[],()
81888,53085,20962,2,€66¢75,2024-11-15;13:25,,8010.0,8010.0,16020.0,2024-11-15 13:25:00.000,2024-11-15,2024,11,15,53085,[],()
79131,53159,20976,2,€50.75,04:31 2024-07-29,"951 Johnston Ville, Port Desmondland, IN 29072-0163",60.9,60.9,121.8,2024-07-29 04:31:00.000,2024-07-29,2024,7,29,53159,[],()
75404,55340,21618,1,€39.5,07:17:44 2024-08-04,"Suite 354 533 Francesco Wall, Sterlingville, HI 27600",47.4,47.4,47.4,2024-08-04 07:17:44.000,2024-08-04,2024,8,4,55340,[],()
77118,53899,21001,1,37.5 USD,"06:07:36 A.M.,13-August-2025",,37.5,37.5,37.5,2025-08-13 06:07:36.000,2025-08-13,2025,8,13,53899,[],()
80661,53562,21571,2,19.25 USD,05:12:26 PM;2024-07-06,,19.25,19.25,38.5,2024-07-06 17:12:26.000,2024-07-06,2024,7,6,53562,[],()
77389,53668,21046,1,EUR 15.0,05:18:51 PM 2024-07-19,"Suite 266 384 Heidenreich Plaza, New Ismael, KY 00029",18.0,18.0,18.0,2024-07-19 17:18:51.000,2024-07-19,2024,7,19,53668,[],()
82350,54806,21584,1,USD 52.0,2025-05-02 06:42,NULL,52.0,52.0,52.0,2025-05-02 06:42:00.000,2025-05-02,2025,5,2,54806,[],()
79242,53646,21030,1,€ 22.25,2024-10-26T15:23:23.973,NULL,26.7,26.7,26.7,2024-10-26 15:23:23.973,2024-10-26,2024,10,26,53646,[],()
75697,55154,21087,2,28.0 USD,12:18:08;12/25/24,"Suite 815 97097 Sonja Crossing, Lolitaview, OR 22914",28.0,28.0,56.0,2024-12-25 12:18:08.000,2024-12-25,2024,12,25,55154,[],()
80147,54288,21133,1,EUR70.0,"06:14, 13-Sep-2024",,84.0,84.0,84.0,2024-09-13 06:14:00.000,2024-09-13,2024,9,13,54288,[],()
82557,53946,21266,1,$61.25,"05:29:43 PM, 06/23/25",,61.25,61.25,61.25,2025-06-23 17:29:43.000,2025-06-23,2025,6,23,53946,[],()
77145,55588,21133,2,USD 68.5," 9-February-2025,10:09:53 AM","Suite 269 36010 Zulauf Locks, East Kaitlin, CT 99506",68.5,68.5,137.0,2025-02-09 10:09:53.000,2025-02-09,2025,2,9,55588,[],()
79140,55713,21336,2,66 EUR,05/22/24 09:41:24 PM,"42411 Rex Ways, West Chungland, OK 52349",79.2,79.2,158.4,2024-05-22 21:41:24.000,2024-05-22,2024,5,22,55713,[],()
73353,54601,21246,1,41. USD,"2024-09-09, 11:36:06","1259 Collier Throughway, Yajairafurt, RI 38805-1075",41.0,41.0,41.0,2024-09-09 11:36:06.000,2024-09-09,2024,9,9,54601,[],()
76366,53536,21386,1,$ 44.99,24-Nov-2024;03:15:41 A.M.,,44.99,44.99,44.99,2024-11-24 03:15:41.000,2024-11-24,2024,11,24,53536,[],()
78989,55406,21405,1,$ 44.00,2024-11-23 02:54:17 PM,,44.0,44.0,44.0,2024-11-23 14:54:17.000,2024-11-23,2024,11,23,55406,[],()
78899,54866,21357,1,USD 41.00,05/27/24 02:31:03 PM,NULL,41.0,41.0,41.0,2024-05-27 14:31:03.000,2024-05-27,2024,5,27,55780,[],()
76432,54180,21303,2,24.99€,"15:28:20, 03/03/25",NULL,29.987999999999996,29.987999999999996,59.98,2025-03-03 15:28:20.000,2025-03-03,2025,3,3,54180,[],()
74624,54548,20942,5,39.5$,"09:40:19 AM,09/26/24","Apt. 385 424 Bailey Village, New Branda, WA 61031-7875",39.5,39.5,197.5,2024-09-26 09:40:19.000,2024-09-26,2024,9,26,54548,[],()
79350,53774,21413,1,57.99$,04/24/24;01:51:11,,57.99,57.99,57.99,2024-04-24 01:51:11.000,2024-04-24,2024,4,24,53774,[],()
77720,53369,20972,4,$60.25,"12:48:50,09/29/24",NULL,60.25,60.25,241.0,2024-09-29 12:48:50.000,2024-09-29,2024,9,29,53369,[],()
78167,54308,21615,4,EUR 45.00,31-MAR-2025;08:15:29 AM,NULL,54.0,54.0,216.0,2025-03-31 08:15:29.000,2025-03-31,2025,3,31,54308,[],()
78984,55470,21557,1,$ 69.5,10/09/24;07:51:17 am,,69.5,69.5,69.5,2024-10-09 07:51:17.000,2024-10-09,2024,10,9,55470,[],()
79980,55450,21052,1,74.5€,22:18:35;29-Mar-2025,,89.39999999999999,89.39999999999999,89.4,2025-03-29 22:18:35.000,2025-03-29,2025,3,29,55450,[],()
77890,55571,20987,1,$ 70.50,2024-07-03T18:17:36,"Suite 733 64334 Bradtke Trafficway, West Myrtachester, CO 68357-5951",70.5,70.5,70.5,2024-07-03 18:17:36.000,2024-07-03,2024,7,3,53687,[],()
74494,54261,21408,2,USD 23.,"04:39:43, 01/18/25",,23.0,23.0,46.0,2025-01-18 04:39:43.000,2025-01-18,2025,1,18,54261,[],()
80262,54738,21380,1,36.75$,"04:32:59,2025-02-15","2678 Lind Courts, Lake Thomasineberg, SC 70363",36.75,36.75,36.75,2025-02-15 04:32:59.000,2025-02-15,2025,2,15,54738,[],()
80473,53440,21564,1,USD35.75,12:03:41 PM;2024-08-22,,35.75,35.75,35.75,2024-08-22 12:03:41.000,2024-08-22,2024,8,22,53440,[],()
73985,55182,21086,2,USD67.5,"2025-01-01,23:47:00",NULL,67.5,67.5,135.0,2025-01-01 23:47:00.000,2025-01-01,2025,1,1,55182,[],()
76146,53161,21042,1,USD 18.99,"20-Jul-2024,09:41:10 am","2921 Devin Manor, New Wayne, FL 52803-2493",18.99,18.99,18.99,2024-07-20 09:41:10.000,2024-07-20,2024,7,20,53161,[],()
73582,54736,21324,2,46.00 $,Sun Mar  2 01:47:12 2025,,46.0,46.0,92.0,2025-03-02 01:47:12.000,2025-03-02,2025,3,2,54736,[],()
78628,53069,21484,5,$52¢00,"21:18,13-August-2025",NULL,5200.0,5200.0,26000.0,2025-08-13 21:18:00.000,2025-08-13,2025,8,13,53069,[],()
81847,53333,21028,1,56.5 USD,"06/14/25,07:58",,56.5,56.5,56.5,2025-06-14 07:58:00.000,2025-06-14,2025,6,14,53333,[],()
74411,54443,21181,1,48.50 €,"01/28/25, 16:17:58",,58.199999999999996,58.199999999999996,58.2,2025-01-28 16:17:58.000,2025-01-28,2025,1,28,54443,[],()
75465,55809,21500,1,€72¢75,"21-MAY-2024,19:58:45",NULL,8730.0,8730.0,8730.0,2024-05-21 19:58:45.000,2024-05-21,2024,5,21,53875,[],()
77063,53799,21208,2,16.75 EUR,2024-08-26T01:19:31.122,,20.099999999999998,20.099999999999998,40.2,2024-08-26 01:19:31.122,2024-08-26,2024,8,26,53799,[],()
77545,55241,21247,4,USD 52.50,Tue Oct 15 13:12:21 2024,NULL,52.5,52.5,210.0,2024-10-15 13:12:21.000,2024-10-15,2024,10,15,55241,[],()
77988,54385,21033,1,€68¢50,2024-07-08 02:20:21 A.M.,"Apt. 404 40263 Guillermo Island, New Debroahfurt, NY 11464-5427",8220.0,8220.0,8220.0,2024-07-08 02:20:21.000,2024-07-08,2024,7,8,54385,[],()
81381,53324,21238,1,56.50 $,2025-03-30T14:42:47.301,,56.5,56.5,56.5,2025-03-30 14:42:47.301,2025-03-30,2025,3,30,53324,[],()
77507,54052,21002,1,EUR 39.5,02:16:18 pm;27-DEC-2024,,47.4,47.4,47.4,2024-12-27 14:16:18.000,2024-12-27,2024,12,27,54052,[],()
77321,53847,21438,1,€ 63.00,"2025-02-13,05:37",,75.6,75.6,75.6,2025-02-13 05:37:00.000,2025-02-13,2025,2,13,53847,[],()
74485,54522,21283,1,$38¢25,"2024-12-18, 22:09",,3825.0,3825.0,3825.0,2024-12-18 22:09:00.000,2024-12-18,2024,12,18,54522,[],()
78474,55735,21106,1,45.00USD,"13:59:13,2024-11-29",,45.0,45.0,45.0,2024-11-29 13:59:13.000,2024-11-29,2024,11,29,54178,[],()
81877,54615,21490,2,39.00USD,11:36:36 12/20/24,"Suite 806 2234 Charlena Springs, West Carychester, NC 25091-6360",39.0,39.0,78.0,2024-12-20 11:36:36.000,2024-12-20,2024,12,20,54615,[],()
81394,54205,21219,1,56.25 $,"08:21, 2025-06-16",,56.25,56.25,56.25,2025-06-16 08:21:00.000,2025-06-16,2025,6,16,54205,[],()
76416,55173,21017,1,$61.5,"02:01:50,02/06/25",NULL,61.5,61.5,61.5,2025-02-06 02:01:50.000,2025-02-06,2025,2,6,55173,[],()
79665,55717,21030,1,22€50¢,"01/31/25, 21:22","Suite 277 2194 Stepanie Pines, New Brunildaside, IA 18173-1301",2700.0,2700.0,2700.0,2025-01-31 21:22:00.000,2025-01-31,2025,1,31,55717,[],()
74518,53693,20970,4,43.50 EUR,03:27:26 11-SEP-2024,,52.199999999999996,52.199999999999996,208.8,2024-09-11 03:27:26.000,2024-09-11,2024,9,11,53693,[],()
75163,54929,21249,1,72 $,"07:46:15,2024-08-11",,72.0,72.0,72.0,2024-08-11 07:46:15.000,2024-08-11,2024,8,11,54929,[],()
75679,53844,20934,1,22.00 USD,2025-03-21 03:20:58 A.M.,NULL,22.0,22.0,22.0,2025-03-21 03:20:58.000,2025-03-21,2025,3,21,53844,[],()
73853,54587,21553,2,22.USD,2024-06-05T22:07:39.089,NULL,22.0,22.0,44.0,2024-06-05 22:07:39.089,2024-06-05,2024,6,5,54587,[],()
74490,55762,21350,1,€49¢00,03:50:08 2024-08-27,,5880.0,5880.0,5880.0,2024-08-27 03:50:08.000,2024-08-27,2024,8,27,55762,[],()
74392,55078,21574,2,22.00USD,01:50:39 am;10/09/24,,22.0,22.0,44.0,2024-10-09 01:50:39.000,2024-10-09,2024,10,9,55078,[],()
80437,53767,21602,1,68.00USD,16:56:51;2025-07-12,"60770 Clifton Viaduct, Connside, MN 39354",68.0,68.0,68.0,2025-07-12 16:56:51.000,2025-07-12,2025,7,12,53767,[],()
82402,54377,21506,1,$30.0,02/21/25;04:37,"Apt. 626 32155 Leuschke Extension, North Rettaburgh, VA 72893",30.0,30.0,30.0,2025-02-21 04:37:00.000,2025-02-21,2025,2,21,54377,[],()
73819,54022,21437,1,65.99 €,"21:32:58,03/23/25","Suite 524 21607 Jolynn Junction, Hettingerbury, MD 84548-7889",79.18799999999999,79.18799999999999,79.19,2025-03-23 21:32:58.000,2025-03-23,2025,3,23,54022,[],()
76801,53458,21572,1,30.75€,2024-06-24T07:13:12.619,,36.9,36.9,36.9,2024-06-24 07:13:12.619,2024-06-24,2024,6,24,53890,[],()
73565,55737,21646,1,14.25 $,"20:57:52, 03/23/25",,14.25,14.25,14.25,2025-03-23 20:57:52.000,2025-03-23,2025,3,23,55737,[],()
79151,55737,21355,1,49.99 EUR,"2025-01-07,06:16:27 PM","274 Mariano Flats, Lawanashire, AK 17600-3492",59.988,59.988,59.99,2025-01-07 18:16:27.000,2025-01-07,2025,1,7,55737,[],()
78698,53167,20988,1,58.5 $,"2024-02-18, 01:48:23 PM",,58.5,58.5,58.5,2024-02-18 13:48:23.000,2024-02-18,2024,2,18,53167,[],()
76307,55816,21365,2,USD 54.00,17:54:41;29-SEP-2024,NULL,54.0,54.0,108.0,2024-09-29 17:54:41.000,2024-09-29,2024,9,29,55816,[],()
79278,53228,21391,1,$64.50,2025-01-16T18:44:51,,64.5,64.5,64.5,2025-01-16 18:44:51.000,2025-01-16,2025,1,16,53228,[],()
82373,55203,21341,1,51.0 USD,"10/25/24, 12:38:35",,51.0,51.0,51.0,2024-10-25 12:38:35.000,2024-10-25,2024,10,25,55203,[],()
78228,55751,21122,1,66.5 $,2024-09-23 01:06:26,NULL,66.5,66.5,66.5,2024-09-23 01:06:26.000,2024-09-23,2024,9,23,55751,[],()
79134,55048,21210,1,$19.,08:33:31 AM;2025-02-23,,19.0,19.0,19.0,2025-02-23 08:33:31.000,2025-02-23,2025,2,23,55048,[],()
79915,55574,21473,2,58.50USD,"2025-06-09,11:29:41 PM","99825 Herman Drive, North Theo, MN 01915",58.5,58.5,117.0,2025-06-09 23:29:41.000,2025-06-09,2025,6,9,55574,[],()
80893,53827,21316,1,USD24.5,23-Jun-2025 00:43,,24.5,24.5,24.5,2025-06-23 00:43:00.000,2025-06-23,2025,6,23,53827,[],()
75233,53773,21277,1,USD59.99,2025-06-21T14:43:16.424,"Apt. 522 561 Tyree Station, East Erik, SC 63724-2072",59.99,59.99,59.99,2025-06-21 14:43:16.424,2025-06-21,2025,6,21,54065,[],()
81032,54594,21441,4,17$99¢,"05:16:38 pm, 29-August-2024",,1799.0,1799.0,7196.0,2024-08-29 17:16:38.000,2024-08-29,2024,8,29,54594,[],()
74572,54304,21116,1,33.99USD,"2025-03-07,01:36","2508 Victor Run, Wiltonville, GA 13514-3389",33.99,33.99,33.99,2025-03-07 01:36:00.000,2025-03-07,2025,3,7,54304,[],()
76762,53869,21173,1,USD 22.25,"13:23,05/17/25",,22.25,22.25,22.25,2025-05-17 13:23:00.000,2025-05-17,2025,5,17,53869,[],()
76044,54960,21256,1,$63¢75,"23:32:16, 24-Aug-2024","Apt. 138 48582 Velvet Forks, New Wenona, VA 91637-5487",6375.0,6375.0,6375.0,2024-08-24 23:32:16.000,2024-08-24,2024,8,24,54960,[],()
79801,54067,20983,2,15.50 USD,03:04:09 AM;02/12/24,"Apt. 696 76591 Wiza Plains, South Antione, NC 09372-5561",15.5,15.5,31.0,2024-02-12 03:04:09.000,2024-02-12,2024,2,12,54067,[],()
74259,54576,21096,1,74.50 $,17.01.2025 16:15:15,,74.5,74.5,74.5,2025-01-17 16:15:15.000,2025-01-17,2025,1,17,54576,[],()
75727,53141,21391,1,€ 68.5,2024-08-16T06:15:38.239,,82.2,82.2,82.2,2024-08-16 06:15:38.239,2024-08-16,2024,8,16,53141,[],()
77492,54399,21117,1,33.99 EUR,08/14/24 13:00:22,,40.788000000000004,40.788000000000004,40.79,2024-08-14 13:00:22.000,2024-08-14,2024,8,14,54399,[],()
80445,53206,21148,2,€58¢75,"15-MAY-2024,15:41:51","Apt. 463 952 Lockman Lights, South Jayne, MI 15569",7050.0,7050.0,14100.0,2024-05-15 15:41:51.000,2024-05-15,2024,5,15,53241,[],()
82195,53790,21061,1,47.75 €,10/03/24 02:12:43 AM,NULL,57.3,57.3,57.3,2024-10-03 02:12:43.000,2024-10-03,2024,10,3,53790,[],()
75556,55471,21001,1,32.25USD,2024-11-03T19:17:33,"Suite 180 990 Runte River, Kitmouth, CT 90027-4597",32.25,32.25,32.25,2024-11-03 19:17:33.000,2024-11-03,2024,11,3,55471,[],()
77386,55193,21523,1,USD 48.5,19:52;19-Sep-2024,,48.5,48.5,48.5,2024-09-19 19:52:00.000,2024-09-19,2024,9,19,55193,[],()
76457,55413,21305,4,44.5 $,02:39:14 A.M. 15-Oct-2024,"4399 Willms Port, Marcoshire, ME 93388",44.5,44.5,178.0,2024-10-15 02:39:14.000,2024-10-15,2024,10,15,55413,[],()
74463,54526,21590,1,34.00 USD,14:47 2025-05-07,"383 Warner Light, Mrazland, IL 21141-9561",34.0,34.0,34.0,2025-05-07 14:47:00.000,2025-05-07,2025,5,7,54526,[],()
80033,54558,21526,2,25.50 USD,2024-09-25T23:50:44,"734 Tyler Ports, Huelsstad, RI 62837",25.5,25.5,51.0,2024-09-25 23:50:44.000,2024-09-25,2024,9,25,54558,[],()
83080,53866,21179,1,53$75¢,19:01 01/12/25,"41732 Whitney Causeway, Jenkinsport, WV 86680",5375.0,5375.0,5375.0,2025-01-12 19:01:00.000,2025-01-12,2025,1,12,53866,[],()
80714,55637,21281,1,USD 69.25,2024-12-03;18:09:55,NULL,69.25,69.25,69.25,2024-12-03 18:09:55.000,2024-12-03,2024,12,3,55637,[],()
73738,54342,21088,1,58.75EUR,"2024-08-11, 15:53:00",,70.5,70.5,70.5,2024-08-11 15:53:00.000,2024-08-11,2024,8,11,54342,[],()
78152,53641,21322,3,€ 25.99,"17:38:54,12/07/24",NULL,31.187999999999995,31.187999999999995,93.56,2024-12-07 17:38:54.000,2024-12-07,2024,12,7,53641,[],()
76112,54938,21503,2,63.$,"02:14:01 PM,  7-Jul-2024",,63.0,63.0,126.0,2024-07-07 14:14:01.000,2024-07-07,2024,7,7,54938,[],()
81614,53819,21415,1,23.$,2024-11-27;10:50:17 P.M.,"Suite 459 44826 Larry Inlet, Skilesfurt, MD 81920",23.0,23.0,23.0,2024-11-27 22:50:17.000,2024-11-27,2024,11,27,53819,[],()
77126,54997,21123,2,67.00$,"13-Nov-2024, 04:42:15 A.M.","Apt. 942 3258 Dawne Keys, South Leland, TX 20298-9874",67.0,67.0,134.0,2024-11-13 04:42:15.000,2024-11-13,2024,11,13,54997,[],()
77522,55231,21329,1,39.00$,2025-05-04 12:46,,39.0,39.0,39.0,2025-05-04 12:46:00.000,2025-05-04,2025,5,4,55231,[],()
83084,54106,21209,1,€49.75,06:02  4-JAN-2025,"42648 Schaefer Trace, Mortonville, PA 82432-3613",59.699999999999996,59.699999999999996,59.7,2025-01-04 06:02:00.000,2025-01-04,2025,1,4,54106,[],()
81161,53040,21180,1,19.00 $,"07:33:47 PM,  2-APR-2025","57698 Conn Rapid, West Augustusmouth, WV 21994-5313",19.0,19.0,19.0,2025-04-02 19:33:47.000,2025-04-02,2025,4,2,53040,[],()
80992,53489,21177,1,USD23.0,2024-12-22 07:35:25,NULL,23.0,23.0,23.0,2024-12-22 07:35:25.000,2024-12-22,2024,12,22,53489,[],()
79044,53034,21455,2,$ 58.50,06:40 20-August-2024,,58.5,58.5,117.0,2024-08-20 06:40:00.000,2024-08-20,2024,8,20,53034,[],()
77711,54744,21532,1,41.75€,09/02/24 05:55:22 am,,50.1,50.1,50.1,2024-09-02 05:55:22.000,2024-09-02,2024,9,2,54744,[],()
76889,53282,21163,3,USD 48.0,"08:33:31, 09/13/24",,48.0,48.0,144.0,2024-09-13 08:33:31.000,2024-09-13,2024,9,13,53282,[],()
75070,55379,21068,1,63.99€,"09:00:11, 2024-10-26",NULL,76.788,76.788,76.79,2024-10-26 09:00:11.000,2024-10-26,2024,10,26,55379,[],()
77423,53820,21171,1,61.25EUR, 1.05.2025 13:33:33,,73.5,73.5,73.5,2025-01-05 13:33:33.000,2025-01-05,2025,1,5,53820,[],()
74616,54477,21221,1,72.5$,2025-07-23T08:41:59,,72.5,72.5,72.5,2025-07-23 08:41:59.000,2025-07-23,2025,7,23,54477,[],()
80933,54566,21104,1,18.0€,2024-11-06T21:03:39.115,"Suite 341 87521 Schamberger Cove, Langland, AZ 76173-4470",21.599999999999998,21.599999999999998,21.6,2024-11-06 21:03:39.115,2024-11-06,2024,11,6,54566,[],()
75995,54365,21133,1,€68¢75,"23:28:31, 13-OCT-2024",NULL,8250.0,8250.0,8250.0,2024-10-13 23:28:31.000,2024-10-13,2024,10,13,54365,[],()
75170,53491,21207,1,20.0 USD,"14:38:03, 2025-05-24",,20.0,20.0,20.0,2025-05-24 14:38:03.000,2025-05-24,2025,5,24,53491,[],()
82011,55681,21474,1,USD50.5,2024-11-12;21:43:23,,50.5,50.5,50.5,2024-11-12 21:43:23.000,2024-11-12,2024,11,12,55762,[],()
75700,54462,21232,2,$59.75,01/20/25 10:09:01 pm,NULL,59.75,59.75,119.5,2025-01-20 22:09:01.000,2025-01-20,2025,1,20,54462,[],()
76776,55111,20933,1,17.99USD,Wed Jan 15 07:39:40 2025,"Apt. 998 267 Schulist Shoal, Daughertytown, AK 03515",17.99,17.99,17.99,2025-01-15 07:39:40.000,2025-01-15,2025,1,15,55111,[],()
81299,53620,21334,1,€ 44.75,11-Nov-2024 07:05:35 PM,,53.699999999999996,53.699999999999996,53.7,2024-11-11 19:05:35.000,2024-11-11,2024,11,11,53620,[],()
80660,53902,21318,1,55.5 €,14-JAN-2025 12:51,"Suite 477 291 Rohan Prairie, North Twana, WV 40996",66.6,66.6,66.6,2025-01-14 12:51:00.000,2025-01-14,2025,1,14,54992,[],()
80414,53645,21561,1,$ 25.99,"05/11/25, 11:59",NULL,25.99,25.99,25.99,2025-05-11 11:59:00.000,2025-05-11,2025,5,11,53645,[],()
76866,54909,21050,1,€ 14.00,11:55 2025-01-26,,16.8,16.8,16.8,2025-01-26 11:55:00.000,2025-01-26,2025,1,26,54909,[],()
81594,54318,21140,2,USD 70.50,"2024-12-31, 10:10:05 am",,70.5,70.5,141.0,2024-12-31 10:10:05.000,2024-12-31,2024,12,31,54318,[],()
80636,53513,21109,2,$ 58.75,"2025-02-08, 10:41:29 am",,58.75,58.75,117.5,2025-02-08 10:41:29.000,2025-02-08,2025,2,8,53513,[],()
73890,53607,21393,1,42.75 USD,09:05:06;12/02/24,NULL,42.75,42.75,42.75,2024-12-02 09:05:06.000,2024-12-02,2024,12,2,53607,[],()
81897,55529,21231,1,USD68.99,2025-02-14T20:37:04.355,,68.99,68.99,68.99,2025-02-14 20:37:04.355,2025-02-14,2025,2,14,55529,[],()
75363,54314,21590,1,€ 35.75, 2-MAR-2025 01:27:15,NULL,42.9,42.9,42.9,2025-03-02 01:27:15.000,2025-03-02,2025,3,2,54314,[],()
74131,53174,21207,5,€23¢00,22-AUG-2024;13:20,,2760.0,2760.0,13800.0,2024-08-22 13:20:00.000,2024-08-22,2024,8,22,53174,[],()
82717,55118,21277,1,59.50 USD,16:40:32 08/24/24,NULL,59.5,59.5,59.5,2024-08-24 16:40:32.000,2024-08-24,2024,8,24,55118,[],()
81506,55198,20952,1,USD39.99,02/15/25 23:23:24,"Apt. 719 57467 Kim Crescent, South Willard, TX 34360",39.99,39.99,39.99,2025-02-15 23:23:24.000,2025-02-15,2025,2,15,55198,[],()
78806,55236,21437,1,€62¢50,"05/30/24,18:01:21",,7500.0,7500.0,7500.0,2024-05-30 18:01:21.000,2024-05-30,2024,5,30,55236,[],()
77229,55358,21407,2,27.99EUR,2024-02-02;06:47:42 pm,"70025 McDermott Mall, North Macie, VA 62634-7182",33.587999999999994,33.587999999999994,67.18,2024-02-02 18:47:42.000,2024-02-02,2024,2,2,55358,[],()
78888,55497,20945,4,€33.00,23-December-2024 05:48:58 PM,,39.6,39.6,158.4,2024-12-23 17:48:58.000,2024-12-23,2024,12,23,55497,[],()
81986,53771,21476,2,73.99$,2024-10-24;04:25:50 P.M.,"67318 Toy Village, Aufderharview, AK 56398",73.99,73.99,147.98,2024-10-24 16:25:50.000,2024-10-24,2024,10,24,53771,[],()
74445,53278,20924,2,63.99€,"09:41, 12/31/24",,76.788,76.788,153.58,2024-12-31 09:41:00.000,2024-12-31,2024,12,31,53278,[],()
73366,54316,21491,1,62.25 €,"05/14/25,04:19:05 pm",,74.7,74.7,74.7,2025-05-14 16:19:05.000,2025-05-14,2025,5,14,54316,[],()
81801,54003,21251,3,28 $,03:37:56 06/15/25,"9834 Kuhn Mission, Bechtelarview, MD 32336",28.0,28.0,84.0,2025-06-15 03:37:56.000,2025-06-15,2025,6,15,54003,[],()
76896,55198,21546,1,49.99 USD,2024-04-07;03:32:15 PM,,49.99,49.99,49.99,2024-04-07 15:32:15.000,2024-04-07,2024,4,7,55198,[],()
74658,55013,21317,5,50.25 USD,"10/14/25,19:11",,50.25,50.25,251.25,2025-10-14 19:11:00.000,2025-10-14,2025,10,14,55013,[],()
77070,54047,21402,1,67$99¢,2025-02-24T06:43:33,,6799.0,6799.0,6799.0,2025-02-24 06:43:33.000,2025-02-24,2025,2,24,54047,[],()
81676,54306,21101,1,16.5$,19-May-2025 16:23:30,"879 Mari Forges, New Matilda, UT 10303",16.5,16.5,16.5,2025-05-19 16:23:30.000,2025-05-19,2025,5,19,54306,[],()
78873,53455,21203,2,$ 35.25,18:07;21-Jan-2025,"Suite 284 8379 Vandervort Brooks, New Lacytown, UT 69849-4673",35.25,35.25,70.5,2025-01-21 18:07:00.000,2025-01-21,2025,1,21,53455,[],()
82447,55673,21238,2,EUR 55.50,09:08:12 pm;2024-12-13,,66.6,66.6,133.2,2024-12-13 21:08:12.000,2024-12-13,2024,12,13,55673,[],()
77461,54941,21394,1,45.50 EUR,"00:13,2025-04-02",,54.6,54.6,54.6,2025-04-02 00:13:00.000,2025-04-02,2025,4,2,54941,[],()
75424,54906,21320,1,36.99€,2024-11-22T22:05:47.161,,44.388,44.388,44.39,2024-11-22 22:05:47.161,2024-11-22,2024,11,22,54906,[],()
80044,55614,21620,1,17.50$,2024-06-01T00:47:15.467,,17.5,17.5,17.5,2024-06-01 00:47:15.467,2024-06-01,2024,6,1,55614,[],()
79290,54692,21562,1,40.5 €,06/24/25;11:28,"4542 Heidenreich Circle, Ryanhaven, NC 59596",48.6,48.6,48.6,2025-06-24 11:28:00.000,2025-06-24,2025,6,24,54692,[],()
81518,54233,21444,1,$60.99,10:29 05/01/25,,60.99,60.99,60.99,2025-05-01 10:29:00.000,2025-05-01,2025,5,1,54233,[],()
81567,54386,21500,1,70.75EUR,15-November-2024 20:13:01,NULL,84.89999999999999,84.89999999999999,84.9,2024-11-15 20:13:01.000,2024-11-15,2024,11,15,54386,[],()
79982,53330,21441,1,USD 19.50,"02/24/25, 21:07:04",,19.5,19.5,19.5,2025-02-24 21:07:04.000,2025-02-24,2025,2,24,53330,[],()
74682,54742,21320,2,EUR37.5,"10:41:09 pm,04/30/24",NULL,45.0,45.0,90.0,2024-04-30 22:41:09.000,2024-04-30,2024,4,30,54742,[],()
75239,55307,21105,1,$49.75,"2024-05-09,03:52",,49.75,49.75,49.75,2024-05-09 03:52:00.000,2024-05-09,2024,5,9,55307,[],()
79377,54153,20918,1,19.50 EUR,03/25/25;14:10:08,NULL,23.4,23.4,23.4,2025-03-25 14:10:08.000,2025-03-25,2025,3,25,54153,[],()
81875,53694,21020,1,61.$,2025-06-18 18:23:26,NULL,61.0,61.0,61.0,2025-06-18 18:23:26.000,2025-06-18,2025,6,18,53694,[],()
82378,55572,21266,2,57.25$,17:33:56 2024-12-25,NULL,57.25,57.25,114.5,2024-12-25 17:33:56.000,2024-12-25,2024,12,25,55572,[],()
78833,54395,21081,1,USD 74.25,"17:09, 02/05/25",NULL,74.25,74.25,74.25,2025-02-05 17:09:00.000,2025-02-05,2025,2,5,54395,[],()
81606,53538,21637,1,$42.50,29-Oct-2024;11:16:31 pm,NULL,42.5,42.5,42.5,2024-10-29 23:16:31.000,2024-10-29,2024,10,29,53538,[],()
81229,55056,20988,1,$ 63.75,2024-10-12T17:12:03,NULL,63.75,63.75,63.75,2024-10-12 17:12:03.000,2024-10-12,2024,10,12,55056,[],()
77320,54937,21254,1,43.0$,"09:47,08/21/24",,43.0,43.0,43.0,2024-08-21 09:47:00.000,2024-08-21,2024,8,21,54937,[],()
74440,54349,21421,1,$ 52.00,07/21/25 14:44:50,"854 Madaline Burgs, New Elfriedeport, KY 33000-3139",52.0,52.0,52.0,2025-07-21 14:44:50.000,2025-07-21,2025,7,21,54349,[],()
80483,53460,21438,1,USD63.0,10:46:19 A.M.;2025-04-27,NULL,63.0,63.0,63.0,2025-04-27 10:46:19.000,2025-04-27,2025,4,27,53460,[],()
82888,54242,20955,1,71.5$,06/07/25 02:18:52 am,,71.5,71.5,71.5,2025-06-07 02:18:52.000,2025-06-07,2025,6,7,54242,[],()
81190,54548,20985,1,$ 34.,"27-Jun-2025, 08:15:22","Apt. 385 424 Bailey Village, New Branda, WA 61031-7875",34.0,34.0,34.0,2025-06-27 08:15:22.000,2025-06-27,2025,6,27,54548,[],()
75924,53789,20945,2,33.0$,"19-MAR-2025,02:08",NULL,33.0,33.0,66.0,2025-03-19 02:08:00.000,2025-03-19,2025,3,19,53789,[],()
79465,55761,21046,1,15.0$,28-AUG-2024;03:39,,15.0,15.0,15.0,2024-08-28 03:39:00.000,2024-08-28,2024,8,28,55761,[],()
74489,54424,21454,3,37.50 USD, 1-MAR-2025 11:16,,37.5,37.5,112.5,2025-03-01 11:16:00.000,2025-03-01,2025,3,1,54424,[],()
80592,54610,21082,2,21$50¢,07:23;13-August-2024,,2150.0,2150.0,4300.0,2024-08-13 07:23:00.000,2024-08-13,2024,8,13,54610,[],()
82991,53702,21052,1,70.00$,"04:11, 04/01/25",,70.0,70.0,70.0,2025-04-01 04:11:00.000,2025-04-01,2025,4,1,53702,[],()
77368,55189,21236,1,USD70.0,"2024-08-23, 03:54",,70.0,70.0,70.0,2024-08-23 03:54:00.000,2024-08-23,2024,8,23,55189,[],()
79575,55179,21171,2,61.5USD,09/17/24;01:02:05,,61.5,61.5,123.0,2024-09-17 01:02:05.000,2024-09-17,2024,9,17,55179,[],()
73835,54894,21148,5,$58.25,2024-09-13T01:36:43,,58.25,58.25,291.25,2024-09-13 01:36:43.000,2024-09-13,2024,9,13,54894,[],()
75351,54531,21169,1,USD59.25,2024-11-24T13:21:22.743,"2037 Cleveland Wells, North King, KY 26011",59.25,59.25,59.25,2024-11-24 13:21:22.743,2024-11-24,2024,11,24,54531,[],()
77941,54197,21580,4,62.75 USD,"09:14,11/06/24","198 Wolf Avenue, Jaskolskiville, ND 56816",62.75,62.75,251.0,2024-11-06 09:14:00.000,2024-11-06,2024,11,6,54197,[],()
77845,54589,21332,1,USD47.75,03:05:00;2024-08-09,"76693 Brittani Field, Aliciamouth, MT 21007",47.75,47.75,47.75,2024-08-09 03:05:00.000,2024-08-09,2024,8,9,54589,[],()
80335,54378,20927,2,20.25 $,16:50:15 2024-10-12,,20.25,20.25,40.5,2024-10-12 16:50:15.000,2024-10-12,2024,10,12,54378,[],()
75306,55412,21172,2,$ 17.99, 9-AUG-2024;12:07:40 P.M.,"Suite 939 561 Marilu Cove, Faustoport, CO 55721-5523",17.99,17.99,35.98,2024-08-09 12:07:40.000,2024-08-09,2024,8,9,55412,[],()
80143,54150,20988,5,€61¢75,"07:57, 06/21/24","Apt. 886 19507 Wunsch Overpass, North Donnettehaven, MA 07195-8580",7410.0,7410.0,37050.0,2024-06-21 07:57:00.000,2024-06-21,2024,6,21,54150,[],()
76704,55049,21061,1,USD 47.25,2024-12-12T09:47:36,NULL,47.25,47.25,47.25,2024-12-12 09:47:36.000,2024-12-12,2024,12,12,55049,[],()
78869,54869,21172,1,15.25 $,2024-12-19T11:58:01.391,"Suite 123 71604 Kutch Isle, Harlanmouth, GA 04675-0849",15.25,15.25,15.25,2024-12-19 11:58:01.391,2024-12-19,2024,12,19,54869,[],()
76777,54727,20923,3,31.25$,28-February-2025;01:50:05,,31.25,31.25,93.75,2025-02-28 01:50:05.000,2025-02-28,2025,2,28,54727,[],()
75504,55028,21285,1,$69¢50,"2025-01-26, 00:17",,6950.0,6950.0,6950.0,2025-01-26 00:17:00.000,2025-01-26,2025,1,26,55028,[],()
82123,55500,20918,1,16 €,"20:22:09, 05/25/25",,19.2,19.2,19.2,2025-05-25 20:22:09.000,2025-05-25,2025,5,25,55500,[],()
82414,54270,21211,1,42.75 USD,07/13/24;02:06:42,,42.75,42.75,42.75,2024-07-13 02:06:42.000,2024-07-13,2024,7,13,54270,[],()
79413,54479,21007,1,34.25 USD,2025-05-06 01:15:36,,34.25,34.25,34.25,2025-05-06 01:15:36.000,2025-05-06,2025,5,6,54479,[],()
73386,53169,21506,2,€ 33.0,2025-04-21 02:51:02 am,,39.6,39.6,79.2,2025-04-21 02:51:02.000,2025-04-21,2025,4,21,53169,[],()
76524,54042,21172,1,€15¢75, 1-March-2025 11:26:05,"179 Rodolfo Shores, Georgannmouth, AK 61684-2836",1890.0,1890.0,1890.0,2025-03-01 11:26:05.000,2025-03-01,2025,3,1,54042,[],()
81526,55779,21183,1,USD51.50,"07:39:15 PM, 12/01/24",NULL,51.5,51.5,51.5,2024-12-01 19:39:15.000,2024-12-01,2024,12,1,55779,[],()
81538,54912,21264,1,$41¢25,"04/28/24,22:43",,4125.0,4125.0,4125.0,2024-04-28 22:43:00.000,2024-04-28,2024,4,28,54912,[],()
77551,55395,21373,1,23$75¢,"03:24:48, 2025-04-15",,2375.0,2375.0,2375.0,2025-04-15 03:24:48.000,2025-04-15,2025,4,15,55395,[],()
73412,55137,21607,2,$ 71.75,"12:09:32 P.M.,25-Jan-2025",NULL,71.75,71.75,143.5,2025-01-25 12:09:32.000,2025-01-25,2025,1,25,55137,[],()
81653,53789,21259,2,$26.75,01:13:17;2024-11-23,"Apt. 988 6660 Altenwerth Views, New Madaline, MT 37173",26.75,26.75,53.5,2024-11-23 01:13:17.000,2024-11-23,2024,11,23,53789,[],()
77787,53198,20950,2,32.99$,05:19 12/04/24,NULL,32.99,32.99,65.98,2024-12-04 05:19:00.000,2024-12-04,2024,12,4,53198,[],()
79567,54055,21079,1,$58¢50," 5-May-2025, 04:24:26",,5850.0,5850.0,5850.0,2025-05-05 04:24:26.000,2025-05-05,2025,5,5,54055,[],()
78773,54373,21520,2,$ 48.0,"22:51:31,2024-10-25",,48.0,48.0,96.0,2024-10-25 22:51:31.000,2024-10-25,2024,10,25,54373,[],()
74335,53954,21632,1,€ 21.00,28.09.2024 03:04:04,"Apt. 517 962 Collins Streets, Batzport, DE 80854-4356",25.2,25.2,25.2,2024-09-28 03:04:04.000,2024-09-28,2024,9,28,53954,[],()
77048,54552,21213,1,16.5$,"23:01,11/13/24",,16.5,16.5,16.5,2024-11-13 23:01:00.000,2024-11-13,2024,11,13,54552,[],()
78883,53583,21126,1,USD 63.0,02:46:10 PM 03/09/25,NULL,63.0,63.0,63.0,2025-03-09 14:46:10.000,2025-03-09,2025,3,9,53583,[],()
78248,55180,21574,1,23€99¢,20:44;05/05/25,NULL,2878.7999999999997,2878.7999999999997,2878.8,2025-05-05 20:44:00.000,2025-05-05,2025,5,5,55180,[],()
74687,55377,21601,4,29.75 USD,08/19/25 19:58:34,,29.75,29.75,119.0,2025-08-19 19:58:34.000,2025-08-19,2025,8,19,55377,[],()
77581,53630,21081,2,€69¢50,"22-MAR-2025,20:45",NULL,8340.0,8340.0,16680.0,2025-03-22 20:45:00.000,2025-03-22,2025,3,22,53630,[],()
76560,55286,21147,1,28.99 USD,2024-11-07 22:09,"Apt. 332 42961 January Ridge, Jerdebury, TN 07823",28.99,28.99,28.99,2024-11-07 22:09:00.000,2024-11-07,2024,11,7,55286,[],()
78654,53752,21397,1,67.50 €,27-May-2025 22:08,,81.0,81.0,81.0,2025-05-27 22:08:00.000,2025-05-27,2025,5,27,53752,[],()
80492,53685,21406,1,55.5$,18-Sep-2024;01:22:56 PM,"8407 Wunsch Street, Carltonmouth, RI 34566",55.5,55.5,55.5,2024-09-18 13:22:56.000,2024-09-18,2024,9,18,53685,[],()
75520,54479,21314,1,€14¢75,"00:47:05, 2024-09-19",NULL,1770.0,1770.0,1770.0,2024-09-19 00:47:05.000,2024-09-19,2024,9,19,54479,[],()
80891,54332,21319,2,53.0$,"09:48:51 pm, 2025-01-04",,53.0,53.0,106.0,2025-01-04 21:48:51.000,2025-01-04,2025,1,4,54332,[],()
78227,53310,21521,1,49.50€,24-May-2024;08:00:45 am,NULL,59.4,59.4,59.4,2024-05-24 08:00:45.000,2024-05-24,2024,5,24,53310,[],()
74524,55505,21513,1,USD43.99,04/15/24;16:51,,43.99,43.99,43.99,2024-04-15 16:51:00.000,2024-04-15,2024,4,15,55505,[],()
76864,53790,20932,1,17.25 $,"10:03:34 pm, 14-February-2025",NULL,17.25,17.25,17.25,2025-02-14 22:03:34.000,2025-02-14,2025,2,14,53790,[],()
82807,55350,21222,2,73.00 €,2025-01-15T00:36:28,"Suite 960 726 Stokes Fall, Port Vicentabury, CA 86429-3552",87.6,87.6,175.2,2025-01-15 00:36:28.000,2025-01-15,2025,1,15,55350,[],()
78602,54560,21424,1,USD37.25,2025-01-10T16:59:34.237,"66808 Hilton Cliffs, New Hedwig, DE 17634-5285",37.25,37.25,37.25,2025-01-10 16:59:34.237,2025-01-10,2025,1,10,54560,[],()
74262,53161,21465,1,72.0 €,01:48:59 P.M.;08/20/24,,86.39999999999999,86.39999999999999,86.4,2024-08-20 13:48:59.000,2024-08-20,2024,8,20,53161,[],()
80737,54999,21198,1,$38¢25,"12-Jul-2024,12:11:59",NULL,3825.0,3825.0,3825.0,2024-07-12 12:11:59.000,2024-07-12,2024,7,12,54999,[],()
81388,55455,21277,2,60.75€, 5-Mar-2025;12:48:06 A.M.,,72.89999999999999,72.89999999999999,145.8,2025-03-05 00:48:06.000,2025-03-05,2025,3,5,55455,[],()
80008,53640,21613,1,$26¢50,21-June-2025;06:15,NULL,2650.0,2650.0,2650.0,2025-06-21 06:15:00.000,2025-06-21,2025,6,21,53640,[],()
75358,54680,21518,1,53.0EUR,22-Jan-2025 02:03:20,"1692 Abel Unions, North Edgarborough, OR 85954",63.599999999999994,63.599999999999994,63.6,2025-01-22 02:03:20.000,2025-01-22,2025,1,22,54680,[],()
80662,53781,21164,4,USD15.25,Sat Nov  9 20:36:42 2024,NULL,15.25,15.25,61.0,2024-11-09 20:36:42.000,2024-11-09,2024,11,9,53781,[],()
82749,55101,21134,1,55.00 $, 2-JUN-2025;07:17:21 A.M.,,55.0,55.0,55.0,2025-06-02 07:17:21.000,2025-06-02,2025,6,2,55101,[],()
79432,55208,21543,1,$27.5,12:23:12 pm;09/21/24,"15935 Bartell Road, Considinemouth, VT 18422",27.5,27.5,27.5,2024-09-21 12:23:12.000,2024-09-21,2024,9,21,55208,[],()
77251,54649,21265,1,73.99 USD,2025-09-04;21:25:29, ,73.99,73.99,73.99,2025-09-04 21:25:29.000,2025-09-04,2025,9,4,54649,[],()
77954,54306,21128,2,61.25 USD,10-May-2024;08:22:05 am,,61.25,61.25,122.5,2024-05-10 08:22:05.000,2024-05-10,2024,5,10,54306,[],()
76929,54707,21446,4,USD34.75,01:06:15 P.M. 2024-10-05,NULL,34.75,34.75,139.0,2024-10-05 13:06:15.000,2024-10-05,2024,10,5,54707,[],()
79274,55157,21591,1,59 USD,20:35;31-Mar-2025,"333 Wilfredo Row, Boganland, SC 03477-9607",59.0,59.0,59.0,2025-03-31 20:35:00.000,2025-03-31,2025,3,31,55157,[],()
73460,54601,21626,1,67.75 $,"03:57:22 pm,2024-12-01",NULL,67.75,67.75,67.75,2024-12-01 15:57:22.000,2024-12-01,2024,12,1,54601,[],()
74318,53060,21412,1,$ 47.0,"2024-08-12,04:27:56 AM",,47.0,47.0,47.0,2024-08-12 04:27:56.000,2024-08-12,2024,8,12,53060,[],()
77306,55527,21604,1,50.0USD,"2024-10-26, 12:08",,50.0,50.0,50.0,2024-10-26 12:08:00.000,2024-10-26,2024,10,26,55527,[],()
75443,54853,21108,2,USD21.5,"12-MAR-2025,18:59","Apt. 966 1434 Padberg Lock, East Marcelino, ID 50186-1846",21.5,21.5,43.0,2025-03-12 18:59:00.000,2025-03-12,2025,3,12,54853,[],()
76787,54270,21099,1,28.00USD,27.04.2025 14:07:07,"Apt. 872 285 Skye Tunnel, Lake Garlandton, WV 37697",28.0,28.0,28.0,2025-04-27 14:07:07.000,2025-04-27,2025,4,27,54270,[],()
79643,55655,21393,1,41€99¢,"10-May-2025, 06:58:41 am",NULL,5038.8,5038.8,5038.8,2025-05-10 06:58:41.000,2025-05-10,2025,5,10,55655,[],()
73938,54558,20990,1,$19,"05:10:45 P.M.,2024-10-20","734 Tyler Ports, Huelsstad, RI 62837",19.0,19.0,19.0,2024-10-20 17:10:45.000,2024-10-20,2024,10,20,54558,[],()
82833,53607,21612,5,66.00$, 1-MAY-2024 11:34:49 A.M.,,66.0,66.0,330.0,2024-05-01 11:34:49.000,2024-05-01,2024,5,1,53607,[],()
78783,53030,21230,1,€ 30.5,2025-05-16T09:05:23.930,NULL,36.6,36.6,36.6,2025-05-16 09:05:23.930,2025-05-16,2025,5,16,53030,[],()
75088,55713,21403,1,26.25 $,"12:26, 07/29/25",,26.25,26.25,26.25,2025-07-29 12:26:00.000,2025-07-29,2025,7,29,55713,[],()
80594,54152,21313,1,34.0USD,20-May-2025 22:21,,34.0,34.0,34.0,2025-05-20 22:21:00.000,2025-05-20,2025,5,20,54152,[],()
76843,54209,21016,1,75.99USD,2024-07-25T05:42:12,,75.99,75.99,75.99,2024-07-25 05:42:12.000,2024-07-25,2024,7,25,54209,[],()
74357,54141,21348,1,USD 24.0,2024-11-30T08:46:20,NULL,24.0,24.0,24.0,2024-11-30 08:46:20.000,2024-11-30,2024,11,30,54141,[],()
79639,53280,21651,1,52.99$,"2024-12-20, 07:32:36 A.M.",,52.99,52.99,52.99,2024-12-20 07:32:36.000,2024-12-20,2024,12,20,53280,[],()
79675,54916,20991,1,$39¢25,2024-11-03T00:39:16.836,NULL,3925.0,3925.0,3925.0,2024-11-03 00:39:16.836,2024-11-03,2024,11,3,54916,[],()
79498,54754,21410,2,27.25USD,09/27/24 00:45:50,,27.25,27.25,54.5,2024-09-27 00:45:50.000,2024-09-27,2024,9,27,54941,[],()
74149,53395,21549,1,USD52.75,04:05:09 AM  9-Oct-2024,NULL,52.75,52.75,52.75,2024-10-09 04:05:09.000,2024-10-09,2024,10,9,53395,[],()
77961,55132,21109,5,57. USD,11/10/24 22:04:08,,57.0,57.0,285.0,2024-11-10 22:04:08.000,2024-11-10,2024,11,10,55132,[],()
80122,55576,20985,1,32.75 USD,"01/24/25,23:16","Suite 628 6171 Abshire Lodge, Rodshire, MA 85274-3045",32.75,32.75,32.75,2025-01-24 23:16:00.000,2025-01-24,2025,1,24,55576,[],()
74692,53695,21299,1,$ 25.5,2024-09-18 05:21:44 am,"502 Monty Mountain, New Earlburgh, AZ 34015-3985",25.5,25.5,25.5,2024-09-18 05:21:44.000,2024-09-18,2024,9,18,53695,[],()
82454,54100,21144,1,$69.00,2025-04-09T19:27:12.010,,69.0,69.0,69.0,2025-04-09 19:27:12.010,2025-04-09,2025,4,9,54100,[],()
81138,53211,21150,1,$ 65.75,21-NOV-2024;05:21:35,,65.75,65.75,65.75,2024-11-21 05:21:35.000,2024-11-21,2024,11,21,53211,[],()
75455,53398,21170,3,USD70.75,2025-03-01 16:14:21,NULL,70.75,70.75,212.25,2025-03-01 16:14:21.000,2025-03-01,2025,3,1,53398,[],()
75334,54698,20940,2,$58.5,"11:54, 18-Sep-2024","Suite 934 4816 Stracke Squares, Derickside, OH 59642-0869",58.5,58.5,117.0,2024-09-18 11:54:00.000,2024-09-18,2024,9,18,54698,[],()
78398,55603,21470,2,67.0USD,"17:13,2024-09-26",NULL,67.0,67.0,134.0,2024-09-26 17:13:00.000,2024-09-26,2024,9,26,55603,[],()
79119,54916,21260,3,$55.25,2025-03-10;00:57,,55.25,55.25,165.75,2025-03-10 00:57:00.000,2025-03-10,2025,3,10,54916,[],()
77412,54935,21036,1,USD 65.75,"10:19:02, 11-Sep-2024",,65.75,65.75,65.75,2024-09-11 10:19:02.000,2024-09-11,2024,9,11,54935,[],()
76006,53719,20970,1,€42¢00,27-Sep-2024 09:50:33 AM,NULL,5040.0,5040.0,5040.0,2024-09-27 09:50:33.000,2024-09-27,2024,9,27,53719,[],()
79504,55694,21502,1,USD 33.99,00:53 2025-01-29,,33.99,33.99,33.99,2025-01-29 00:53:00.000,2025-01-29,2025,1,29,55694,[],()
79002,54279,21375,1,30.75 EUR,2024-11-24T05:15:54,NULL,36.9,36.9,36.9,2024-11-24 05:15:54.000,2024-11-24,2024,11,24,54279,[],()
78911,54252,21552,1,32.50 $,2024-10-30T16:42:04,"Apt. 467 564 Columbus Island, Port Shadstad, NY 43060-8292",32.5,32.5,32.5,2024-10-30 16:42:04.000,2024-10-30,2024,10,30,54252,[],()
80387,55039,21111,3,31.75$,2025-01-05 06:30:29 P.M.,"7174 Stoltenberg Bypass, Bennettborough, AK 44181-1880",31.75,31.75,95.25,2025-01-05 18:30:29.000,2025-01-05,2025,1,5,53119,[],()
77921,55641,21480,1,USD 68,09:17 22-JUL-2024,NULL,68.0,68.0,68.0,2024-07-22 09:17:00.000,2024-07-22,2024,7,22,55641,[],()
79951,53963,20976,1,49. $,03:06:36 am  1-October-2024,NULL,49.0,49.0,49.0,2024-10-01 03:06:36.000,2024-10-01,2024,10,1,53963,[],()
74406,55364,21340,1,EUR 18.25,"2025-05-22,03:45:51 pm",,21.9,21.9,21.9,2025-05-22 15:45:51.000,2025-05-22,2025,5,22,55364,[],()
81656,55207,21485,2,EUR20.,"08:00:42, 2025-04-24",NULL,24.0,24.0,48.0,2025-04-24 08:00:42.000,2025-04-24,2025,4,24,55207,[],()
77950,54991,21436,1,33.75 USD,2025-02-20T22:25:34,"4428 Hintz Freeway, East Tyronborough, RI 29595",33.75,33.75,33.75,2025-02-20 22:25:34.000,2025-02-20,2025,2,20,54991,[],()
74019,53642,21614,1,USD75.75,02:14:14 A.M. 26-Jun-2025,NULL,75.75,75.75,75.75,2025-06-26 02:14:14.000,2025-06-26,2025,6,26,53642,[],()
77032,55802,20988,1,62.50$,"11:17:31, 2024-12-15",NULL,62.5,62.5,62.5,2024-12-15 11:17:31.000,2024-12-15,2024,12,15,55802,[],()
79447,55048,21200,1,45.00 USD,19:15:11;02/09/25,,45.0,45.0,45.0,2025-02-09 19:15:11.000,2025-02-09,2025,2,9,55048,[],()
76048,55450,21078,1,67.99$,02:38:25 pm 03/30/25,,67.99,67.99,67.99,2025-03-30 14:38:25.000,2025-03-30,2025,3,30,55450,[],()
76652,54014,21315,1,USD 61.25,"13:20,2025-03-30","5464 Roob Corners, West Lauran, NY 19104-4404",61.25,61.25,61.25,2025-03-30 13:20:00.000,2025-03-30,2025,3,30,54014,[],()
75370,54576,21352,1,33.99$,02:33:56 A.M.;08/22/24,,33.99,33.99,33.99,2024-08-22 02:33:56.000,2024-08-22,2024,8,22,54576,[],()
75161,53710,21497,1,USD 67.50,05/13/24;23:24:40,NULL,67.5,67.5,67.5,2024-05-13 23:24:40.000,2024-05-13,2024,5,13,53710,[],()
81582,54861,21599,1,14.0 EUR,22:48;25-SEP-2024,NULL,16.8,16.8,16.8,2024-09-25 22:48:00.000,2024-09-25,2024,9,25,53224,[],()
73335,53515,21147,2,29.00 EUR,22-FEB-2025;17:41,,34.8,34.8,69.6,2025-02-22 17:41:00.000,2025-02-22,2025,2,22,53515,[],()
79415,53853,21576,2,EUR 48.5,2024-11-08T22:14:34.344,NULL,58.199999999999996,58.199999999999996,116.4,2024-11-08 22:14:34.344,2024-11-08,2024,11,8,53853,[],()
82572,55677,21358,1,€45.50,11:05:02 pm 2024-09-14,"239 Guillermo Shoals, Sherriemouth, PA 29541",54.6,54.6,54.6,2024-09-14 23:05:02.000,2024-09-14,2024,9,14,55677,[],()
82341,55136,20947,1,€ 29.,2025-08-19T04:53:03.917,,34.8,34.8,34.8,2025-08-19 04:53:03.917,2025-08-19,2025,8,19,55136,[],()
80866,54663,21025,5,EUR54.75,"07:37:05 pm,15-Sep-2024",,65.7,65.7,328.5,2024-09-15 19:37:05.000,2024-09-15,2024,9,15,54663,[],()
73621,54234,21039,2,33.0 EUR,"2024-08-09,07:18",NULL,39.6,39.6,79.2,2024-08-09 07:18:00.000,2024-08-09,2024,8,9,54234,[],()
76266,53683,21013,1,$43¢99,10:46:22 15-JAN-2025,,4399.0,4399.0,4399.0,2025-01-15 10:46:22.000,2025-01-15,2025,1,15,53683,[],()
79226,54495,21312,1,USD 58.50,23:14:09 28-Jun-2024,,58.5,58.5,58.5,2024-06-28 23:14:09.000,2024-06-28,2024,6,28,54495,[],()
77200,54496,21073,1,38.25$,"21:49, 16-November-2024",,38.25,38.25,38.25,2024-11-16 21:49:00.000,2024-11-16,2024,11,16,54496,[],()
74617,53786,21223,1,73.00USD,"2024-10-11, 04:04","19956 Brandy Summit, East Jeremiah, RI 38414",73.0,73.0,73.0,2024-10-11 04:04:00.000,2024-10-11,2024,10,11,53786,[],()
79517,55594,21025,5,50.50 $,19-Mar-2025 06:47:55 pm,NULL,50.5,50.5,252.5,2025-03-19 18:47:55.000,2025-03-19,2025,3,19,55594,[],()
81920,55290,21041,1,70.75 USD,11/24/24;09:42:35 P.M.,,70.75,70.75,70.75,2024-11-24 21:42:35.000,2024-11-24,2024,11,24,55290,[],()
82429,53784,21075,1,EUR44.25,08:37:46 2024-12-03,,53.1,53.1,53.1,2024-12-03 08:37:46.000,2024-12-03,2024,12,3,53784,[],()
76218,54602,21627,1,EUR23.75,2024-10-09T14:08:37.503,,28.5,28.5,28.5,2024-10-09 14:08:37.503,2024-10-09,2024,10,9,54602,[],()
77230,54735,21408,1,24.00€,"2025-03-04,20:43:03",,28.799999999999997,28.799999999999997,28.8,2025-03-04 20:43:03.000,2025-03-04,2025,3,4,54735,[],()
79683,53565,21256,1,USD58.5,2024-09-14T06:32:47.201,,58.5,58.5,58.5,2024-09-14 06:32:47.201,2024-09-14,2024,9,14,53565,[],()
73924,55509,21007,1,34.25$,"20:06:00, 4-December-2024","2950 Quitzon Gateway, Bernhardhaven, MO 57934-8061",34.25,34.25,34.25,2024-12-04 20:06:00.000,2024-12-04,2024,12,4,55509,[],()
74638,54398,20956,1,61.00 $,12/11/24 15:06:06,NULL,61.0,61.0,61.0,2024-12-11 15:06:06.000,2024-12-11,2024,12,11,54398,[],()
77051,54978,21538,2,USD70.00,"11/21/24, 11:03",NULL,70.0,70.0,140.0,2024-11-21 11:03:00.000,2024-11-21,2024,11,21,54978,[],()
75026,55772,21633,2,73.75 $,"22-Aug-2024, 21:40:47",,73.75,73.75,147.5,2024-08-22 21:40:47.000,2024-08-22,2024,8,22,55772,[],()
82304,53877,21127,2,53.00 USD,"03:35:18 P.M.,19-Sep-2024",NULL,53.0,53.0,106.0,2024-09-19 15:35:18.000,2024-09-19,2024,9,19,53877,[],()
76765,53158,20936,1,57.75$,03/02/25 22:55,,57.75,57.75,57.75,2025-03-02 22:55:00.000,2025-03-02,2025,3,2,53158,[],()
76438,53891,21408,1,USD22.00,"08/28/24, 04:11:15 am","Apt. 244 1292 Arlen Divide, Kemmerborough, TX 75446-8287",22.0,22.0,22.0,2024-08-28 04:11:15.000,2024-08-28,2024,8,28,53891,[],()
82259,53729,21312,1,$59¢99,"03:14:30 A.M.,22-DEC-2024",NULL,5999.0,5999.0,5999.0,2024-12-22 03:14:30.000,2024-12-22,2024,12,22,53729,[],()
81638,53393,21011,2,36.99 USD,02/04/25;00:20,NULL,36.99,36.99,73.98,2025-02-04 00:20:00.000,2025-02-04,2025,2,4,53393,[],()
79228,53062,21167,2,USD 21.0,12:51:01 2024-12-15,"Apt. 475 9490 Galen Courts, O'Harashire, WY 63192",21.0,21.0,42.0,2024-12-15 12:51:01.000,2024-12-15,2024,12,15,53072,[],()
78263,55078,21231,2,$ 71.99,2024-12-22;05:49:58 pm,,71.99,71.99,143.98,2024-12-22 17:49:58.000,2024-12-22,2024,12,22,55078,[],()
75969,55041,21456,1,51.$, 6-Sep-2024;20:31,,51.0,51.0,51.0,2024-09-06 20:31:00.000,2024-09-06,2024,9,6,55041,[],()
79146,55717,21069,1,USD 23.25,07:20:07 am;2025-01-09,"Suite 277 2194 Stepanie Pines, New Brunildaside, IA 18173-1301",23.25,23.25,23.25,2025-01-09 07:20:07.000,2025-01-09,2025,1,9,55717,[],()
82222,53411,20976,1,54.0 $,02:36;22-MAY-2024,,54.0,54.0,54.0,2024-05-22 02:36:00.000,2024-05-22,2024,5,22,53411,[],()
74663,53692,21350,1,EUR48.25,"02/22/25,15:27",,57.9,57.9,57.9,2025-02-22 15:27:00.000,2025-02-22,2025,2,22,53692,[],()
79174,54773,21430,1,€31.50,"04:49:59 PM, 25-August-2024","2397 Shante Lock, Rutherfordtown, MT 20374",37.8,37.8,37.8,2024-08-25 16:49:59.000,2024-08-25,2024,8,25,54773,[],()
80755,53453,21241,1,$ 19.00,00:26;18-Oct-2024,"Suite 198 84082 Hilpert Centers, Skilesstad, CO 87499-6305",19.0,19.0,19.0,2024-10-18 00:26:00.000,2024-10-18,2024,10,18,53453,[],()
73400,55437,21325,1,71.00$,17:15;2025-04-07,"56013 Schroeder Forge, Port Darrell, MD 03919-0469",71.0,71.0,71.0,2025-04-07 17:15:00.000,2025-04-07,2025,4,7,55437,[],()
74348,55817,21430,3,$ 29.25,"06:19:48 am,2024-12-18",NULL,29.25,29.25,87.75,2024-12-18 06:19:48.000,2024-12-18,2024,12,18,55776,[],()
82591,53572,21034,1,43.0EUR,07.04.2025 06:43:43,,51.6,51.6,51.6,2025-07-04 06:43:43.000,2025-07-04,2025,7,4,53572,[],()
79722,55659,21541,1,€55¢25,"11-Jun-2025,21:23:12",,6630.0,6630.0,6630.0,2025-06-11 21:23:12.000,2025-06-11,2025,6,11,55659,[],()
76088,55248,21315,1,USD63.25,"06/24/24,08:00:40 AM",,63.25,63.25,63.25,2024-06-24 08:00:40.000,2024-06-24,2024,6,24,55248,[],()
74539,53482,21340,5,USD20.0,"01/30/25, 10:23:20 pm","Apt. 907 8163 Kozey Rest, Nitzschemouth, RI 97602-9798",20.0,20.0,100.0,2025-01-30 22:23:20.000,2025-01-30,2025,1,30,53482,[],()
81554,53212,21313,1,USD33.0,"16-Aug-2024,09:16:46 AM","64034 Marianna Corner, Steviestad, ME 75279-2983",33.0,33.0,33.0,2024-08-16 09:16:46.000,2024-08-16,2024,8,16,53212,[],()
78362,54164,20996,1,USD43.5,01:51:16 PM;02/06/25,,43.5,43.5,43.5,2025-02-06 13:51:16.000,2025-02-06,2025,2,6,54164,[],()
76209,53233,21523,1,49.5$,2024-07-30T13:55:17.174,"9539 Grady Pass, Schowalterfort, VT 81643",49.5,49.5,49.5,2024-07-30 13:55:17.174,2024-07-30,2024,7,30,53233,[],()
79743,53798,21100,1,$ 26.5,2024-10-28T15:52:30.112,NULL,26.5,26.5,26.5,2024-10-28 15:52:30.112,2024-10-28,2024,10,28,53798,[],()
77196,53842,21361,1,EUR48.25,21:17;2025-02-11,,57.9,57.9,57.9,2025-02-11 21:17:00.000,2025-02-11,2025,2,11,53842,[],()
82391,54868,21125,1,18.00 $,"14-Feb-2025,06:38:17 pm",,18.0,18.0,18.0,2025-02-14 18:38:17.000,2025-02-14,2025,2,14,53394,[],()
80218,53651,21332,1,€46¢99,15.03.2024 19:28:28,"Apt. 396 2199 Kuhn Turnpike, Linnville, AL 42155",5638.8,5638.8,5638.8,2024-03-15 19:28:28.000,2024-03-15,2024,3,15,53651,[],()
79342,53782,21074,1,73.99 USD,11:31:00 A.M. 2024-09-30,,73.99,73.99,73.99,2024-09-30 11:31:00.000,2024-09-30,2024,9,30,53782,[],()
74337,54209,21327,1,73.0 $,"10:02:28 am,15-Feb-2025",NULL,73.0,73.0,73.0,2025-02-15 10:02:28.000,2025-02-15,2025,2,15,54209,[],()
83046,54165,21541,3,USD 57.0,2025-01-20T17:23:16,"Suite 734 3520 Wolff Route, Ondrickaberg, TX 01005-7231",57.0,57.0,171.0,2025-01-20 17:23:16.000,2025-01-20,2025,1,20,54165,[],()
75912,54246,21277,1,60.€,"2024-09-16,15:10","8497 Bosco Mills, Reynoldsville, OH 84829",72.0,72.0,72.0,2024-09-16 15:10:00.000,2024-09-16,2024,9,16,54246,[],()
79730,54630,21155,2,67.50€,2024-06-17T09:30:36,,81.0,81.0,162.0,2024-06-17 09:30:36.000,2024-06-17,2024,6,17,54630,[],()
75965,53485,21246,1,40.50USD," 5-July-2024,04:48",,40.5,40.5,40.5,2024-07-05 04:48:00.000,2024-07-05,2024,7,5,53485,[],()
75386,55700,21411,1,EUR 20.00,"14:57:14, 2025-03-13",,24.0,24.0,24.0,2025-03-13 14:57:14.000,2025-03-13,2025,3,13,55700,[],()
74154,53372,21003,1,€ 39.99,01:36:20 18-JUN-2024,"699 Thelma Trace, Auerview, ME 26656-9545",47.988,47.988,47.99,2024-06-18 01:36:20.000,2024-06-18,2024,6,18,54179,[],()
74466,55453,21158,1,$ 25.5,2024-07-08;04:30,,25.5,25.5,25.5,2024-07-08 04:30:00.000,2024-07-08,2024,7,8,55453,[],()
75747,54661,21104,1,USD19.99,2024-08-31T12:12:44.134,,19.99,19.99,19.99,2024-08-31 12:12:44.134,2024-08-31,2024,8,31,54661,[],()
77331,54057,21250,2,20.50 USD,27.08.2025 15:52:52,,20.5,20.5,41.0,2025-08-27 15:52:52.000,2025-08-27,2025,8,27,54057,[],()
79094,54098,21589,2,$ 42.99,03/08/24;09:05:45 pm,NULL,42.99,42.99,85.98,2024-03-08 21:05:45.000,2024-03-08,2024,3,8,54098,[],()
78685,53637,21123,1,66.99 €,"06:30:19, 10/12/24","Apt. 785 48133 Elwood Knolls, Bradtkefort, WV 25065",80.38799999999999,80.38799999999999,80.39,2024-10-12 06:30:19.000,2024-10-12,2024,10,12,53637,[],()
77862,54518,21273,1,$ 70.99,15:16:00  2-February-2025,"Suite 440 700 Grady Groves, Bartonview, OH 62125",70.99,70.99,70.99,2025-02-02 15:16:00.000,2025-02-02,2025,2,2,54518,[],()
75653,53356,21379,1,USD 63.99,2024-09-20T09:26:37.914,"Apt. 413 84990 Brakus Estates, Jarrodland, AK 38488-5896",63.99,63.99,63.99,2024-09-20 09:26:37.914,2024-09-20,2024,9,20,53356,[],()
82384,53427,21445,1,USD 47.00,2025-01-27T16:04:22.808,"92789 Bradford Alley, Freddaside, OR 51665-6772",47.0,47.0,47.0,2025-01-27 16:04:22.808,2025-01-27,2025,1,27,53427,[],()
77794,54521,21365,1,$53¢50,"16:50,07/01/24","Apt. 197 78460 Feest Mountains, Lindmouth, KY 30831-7165",5350.0,5350.0,5350.0,2024-07-01 16:50:00.000,2024-07-01,2024,7,1,54521,[],()
74433,53720,21068,1,62.25USD,04:04:47 pm 27-November-2024,,62.25,62.25,62.25,2024-11-27 16:04:47.000,2024-11-27,2024,11,27,53720,[],()
81025,55786,21406,2,53.0 EUR,10/28/24;08:34,,63.599999999999994,63.599999999999994,127.2,2024-10-28 08:34:00.000,2024-10-28,2024,10,28,55786,[],()
77734,55537,21004,1,$17.00,"2024-08-24, 01:43:42",NULL,17.0,17.0,17.0,2024-08-24 01:43:42.000,2024-08-24,2024,8,24,55537,[],()
81997,53782,21273,4,$70.5, 1-January-2025 08:04:53 P.M.,,70.5,70.5,282.0,2025-01-01 20:04:53.000,2025-01-01,2025,1,1,53782,[],()
81101,55827,21306,1,33USD,06:17:54 PM;10/20/24,NULL,33.0,33.0,33.0,2024-10-20 18:17:54.000,2024-10-20,2024,10,20,55827,[],()
82166,54207,20944,1,32.50$,10:18:24 P.M.;2024-09-12,"Suite 277 612 Aja Landing, Leschbury, PA 31797",32.5,32.5,32.5,2024-09-12 22:18:24.000,2024-09-12,2024,9,12,54207,[],()
82909,55684,21597,4,USD 35.0,2024-12-10T15:52:04.796,NULL,35.0,35.0,140.0,2024-12-10 15:52:04.796,2024-12-10,2024,12,10,55684,[],()
75698,54716,21061,1,EUR 46.,"14-Oct-2024, 01:54:24 am",,55.199999999999996,55.199999999999996,55.2,2024-10-14 01:54:24.000,2024-10-14,2024,10,14,54716,[],()
78044,53551,21038,1,52.25€,"19:03, 10/13/24",NULL,62.699999999999996,62.699999999999996,62.7,2024-10-13 19:03:00.000,2024-10-13,2024,10,13,53551,[],()
76491,54260,21295,1,USD 14.00,"04:55,10/08/24",NULL,14.0,14.0,14.0,2024-10-08 04:55:00.000,2024-10-08,2024,10,8,54260,[],()
74604,53220,21197,1,67.0 €,"14:38, 08/16/24",,80.39999999999999,80.39999999999999,80.4,2024-08-16 14:38:00.000,2024-08-16,2024,8,16,53220,[],()
74580,54118,21265,1,$ 75.75,"14-DEC-2024,04:59:01 am","Suite 619 6776 Clarita Cliff, West Timika, GA 10529",75.75,75.75,75.75,2024-12-14 04:59:01.000,2024-12-14,2024,12,14,54118,[],()
77075,53504,21466,1,€ 16.75,14:51:10 09/28/24,,20.099999999999998,20.099999999999998,20.1,2024-09-28 14:51:10.000,2024-09-28,2024,9,28,53504,[],()
73331,54623,21374,1,$25.99,26-Jan-2025;02:59:41,NULL,25.99,25.99,25.99,2025-01-26 02:59:41.000,2025-01-26,2025,1,26,54623,[],()
82947,55174,21501,1,24 USD,06:19:46;06/19/25,"Apt. 350 238 Lowe Forks, Vibury, IA 01830-1412",24.0,24.0,24.0,2025-06-19 06:19:46.000,2025-06-19,2025,6,19,55174,[],()
79519,54345,21452,1,$ 24,"01:59:28 P.M., 6-June-2024",NULL,24.0,24.0,24.0,2024-06-06 13:59:28.000,2024-06-06,2024,6,6,54345,[],()
73884,53225,21078,1,$66,"09/11/24, 13:03:53",,66.0,66.0,66.0,2024-09-11 13:03:53.000,2024-09-11,2024,9,11,53225,[],()
82153,53302,21159,1,62.75 $,Wed Sep 18 17:13:49 2024,,62.75,62.75,62.75,2024-09-18 17:13:49.000,2024-09-18,2024,9,18,53302,[],()
74011,55331,21033,1,63. $,2025-07-03T01:50:17,"Suite 151 724 Jones Shores, East Hollis, VT 97627-6366",63.0,63.0,63.0,2025-07-03 01:50:17.000,2025-07-03,2025,7,3,55331,[],()
74982,55815,20920,1,$18.5,22.10.2025 23:00:00,,18.5,18.5,18.5,2025-10-22 23:00:00.000,2025-10-22,2025,10,22,55815,[],()
73522,53193,21103,1,67$75¢,22:19:41 2025-04-23,,6775.0,6775.0,6775.0,2025-04-23 22:19:41.000,2025-04-23,2025,4,23,53193,[],()
77819,54219,20997,2,$ 72.99,"02:42, 2024-07-10",,72.99,72.99,145.98,2024-07-10 02:42:00.000,2024-07-10,2024,7,10,54219,[],()
73962,53779,21309,1,45€75¢,"10/19/24, 07:54:49",,5490.0,5490.0,5490.0,2024-10-19 07:54:49.000,2024-10-19,2024,10,19,53779,[],()
79707,54645,21323,1,29.25USD,"2024-08-12,04:08:57",,29.25,29.25,29.25,2024-08-12 04:08:57.000,2024-08-12,2024,8,12,54645,[],()
80164,53599,21201,3,EUR63,"30-Jan-2025, 23:58:02",NULL,75.6,75.6,226.8,2025-01-30 23:58:02.000,2025-01-30,2025,1,30,53599,[],()
76514,54067,21601,1,€33.25," 9-FEB-2025, 02:14",,39.9,39.9,39.9,2025-02-09 02:14:00.000,2025-02-09,2025,2,9,54067,[],()
81008,55260,21418,4,$61.25,22-August-2024 22:57,,61.25,61.25,245.0,2024-08-22 22:57:00.000,2024-08-22,2024,8,22,53047,[],()
75820,53152,21153,1,$ 41.,"01/27/25,22:36",NULL,41.0,41.0,41.0,2025-01-27 22:36:00.000,2025-01-27,2025,1,27,53152,[],()
74260,54556,21354,1,14.25€,"03:02, 03/12/24","8557 Rosana Haven, Leomaton, AR 03249",17.099999999999998,17.099999999999998,17.1,2024-03-12 03:02:00.000,2024-03-12,2024,3,12,54556,[],()
81708,53994,21220,1,16.75 USD,19:47:59 05/02/25,NULL,16.75,16.75,16.75,2025-05-02 19:47:59.000,2025-05-02,2025,5,2,53994,[],()
81734,55219,21088,3,$56.00,2024-08-24T18:39:40.293,NULL,56.0,56.0,168.0,2024-08-24 18:39:40.293,2024-08-24,2024,8,24,55219,[],()
80480,53335,21571,1,18.25 USD,"06:55:02 am,10-Apr-2025",NULL,18.25,18.25,18.25,2025-04-10 06:55:02.000,2025-04-10,2025,4,10,53335,[],()
79571,53155,21155,1,$ 67.,"29-NOV-2024, 01:54",,67.0,67.0,67.0,2024-11-29 01:54:00.000,2024-11-29,2024,11,29,53155,[],()
77972,54966,21474,2,51.00$,2025-06-03 04:14:28 AM,,51.0,51.0,102.0,2025-06-03 04:14:28.000,2025-06-03,2025,6,3,54966,[],()
79436,53931,21067,1,56.5USD,05:41:31;10-Aug-2025,,56.5,56.5,56.5,2025-08-10 05:41:31.000,2025-08-10,2025,8,10,53931,[],()
79749,55012,21248,1,43$,2024-09-16T08:07:55.996,"656 Feest Forks, South Letitia, TN 57797",43.0,43.0,43.0,2024-09-16 08:07:55.996,2024-09-16,2024,9,16,55012,[],()
82450,55533,21095,1,EUR 49.,"2024-08-16, 05:57:29","570 Audrea Underpass, South Reinaldo, TX 17196",58.8,58.8,58.8,2024-08-16 05:57:29.000,2024-08-16,2024,8,16,55533,[],()
81401,55683,21444,3,57.00 EUR,10:17:25 A.M.;2025-05-07,,68.39999999999999,68.39999999999999,205.2,2025-05-07 10:17:25.000,2025-05-07,2025,5,7,55683,[],()
74635,53417,21471,2,22.25 $,19:19;2024-11-02,NULL,22.25,22.25,44.5,2024-11-02 19:19:00.000,2024-11-02,2024,11,2,53417,[],()
78421,55216,21142,2,USD34.5,14:40:44;02/06/25,"Apt. 318 348 Rosario Flats, Lake Randymouth, PA 34570-2989",34.5,34.5,69.0,2025-02-06 14:40:44.000,2025-02-06,2025,2,6,55216,[],()
80863,54590,21249,3,70.00 $,Mon Sep 16 08:11:55 2024,NULL,70.0,70.0,210.0,2024-09-16 08:11:55.000,2024-09-16,2024,9,16,54590,[],()
73981,54576,21142,1,$ 33.0,"29-October-2024,07:23:21","Suite 694 75878 Susannah Ways, Oraborough, NM 76157",33.0,33.0,33.0,2024-10-29 07:23:21.000,2024-10-29,2024,10,29,54576,[],()
79599,55725,21388,1,€ 47.00,2024-11-04T15:13:30.915,,56.4,56.4,56.4,2024-11-04 15:13:30.915,2024-11-04,2024,11,4,54061,[],()
80364,55558,21338,1,50. USD,"08/04/25,12:23:13 PM","5376 Jacobs Knoll, New Haywoodchester, OR 18874",50.0,50.0,50.0,2025-08-04 12:23:13.000,2025-08-04,2025,8,4,55558,[],()
76085,55121,21353,1,21.5USD,"07:56:33 AM,01/03/25",,21.5,21.5,21.5,2025-01-03 07:56:33.000,2025-01-03,2025,1,3,55121,[],()
81052,55716,20950,4,$30.25,2024-07-07T21:12:13.275,"Apt. 849 16404 McGlynn Harbor, Port Yulandaberg, IL 74592",30.25,30.25,121.0,2024-07-07 21:12:13.275,2024-07-07,2024,7,7,55716,[],()
81618,53124,21332,5,€45.75,09:36 06/06/25,,54.9,54.9,274.5,2025-06-06 09:36:00.000,2025-06-06,2025,6,6,53124,[],()
76104,54346,21482,1,USD 45.50,"09/27/24, 04:59",,45.5,45.5,45.5,2024-09-27 04:59:00.000,2024-09-27,2024,9,27,54346,[],()
76785,54624,21192,2,74.5$,2024-06-02T05:17:14.076,,74.5,74.5,149.0,2024-06-02 05:17:14.076,2024-06-02,2024,6,2,54624,[],()
74142,55003,21044,1,€ 22.00,2025-01-07T19:04:29,"Suite 317 79397 Pam Glen, West Ashliport, NV 10749-1389",26.4,26.4,26.4,2025-01-07 19:04:29.000,2025-01-07,2025,1,7,55003,[],()
77986,54091,21510,1,15.25USD,05:57:47 A.M.;25-May-2025,,15.25,15.25,15.25,2025-05-25 05:57:47.000,2025-05-25,2025,5,25,54091,[],()
80762,54057,21497,1,68.25 €,"09:07:53, 24-Mar-2025",NULL,81.89999999999999,81.89999999999999,81.9,2025-03-24 09:07:53.000,2025-03-24,2025,3,24,54057,[],()
73606,53091,21371,2,€20.99," 1-August-2024, 02:53:48 am",,25.188,25.188,50.38,2024-08-01 02:53:48.000,2024-08-01,2024,8,1,53091,[],()
80950,55557,21594,3,60.00 EUR,20.04.2025 11:49:49,"2690 Doyle Creek, Krajcikland, LA 54581",72.0,72.0,216.0,2025-04-20 11:49:49.000,2025-04-20,2025,4,20,55557,[],()
78778,53222,21333,1,33.99 USD,12:11:55;02/11/25,,33.99,33.99,33.99,2025-02-11 12:11:55.000,2025-02-11,2025,2,11,53222,[],()
79275,55432,21530,4,USD 69.75,"05:53:59 P.M.,06/19/24",NULL,69.75,69.75,279.0,2024-06-19 17:53:59.000,2024-06-19,2024,6,19,55432,[],()
75151,53550,21557,1,67$99¢,2024-11-24 12:19:50,NULL,6799.0,6799.0,6799.0,2024-11-24 12:19:50.000,2024-11-24,2024,11,24,53550,[],()
81465,55575,21211,1,USD 43.99,20:45;2024-08-10, ,43.99,43.99,43.99,2024-08-10 20:45:00.000,2024-08-10,2024,8,10,55575,[],()
79974,55659,21021,1,42.00$,04:20:06 AM 12/28/24,"Apt. 168 462 Julian Union, Weimannport, CA 83820-7015",42.0,42.0,42.0,2024-12-28 04:20:06.000,2024-12-28,2024,12,28,55659,[],()
75191,54969,21551,1,$37.00,06:38 04/05/24,NULL,37.0,37.0,37.0,2024-04-05 06:38:00.000,2024-04-05,2024,4,5,54969,[],()
76556,54116,21400,1,$45¢00,"03:12:24,2024-08-02",,4500.0,4500.0,4500.0,2024-08-02 03:12:24.000,2024-08-02,2024,8,2,54116,[],()
74192,54612,21299,2,21.75 €,"21-December-2024, 09:39:01 AM",NULL,26.099999999999998,26.099999999999998,52.2,2024-12-21 09:39:01.000,2024-12-21,2024,12,21,54612,[],()
80625,54727,21325,2,66.75 USD,02/28/25;11:53:24 A.M.,,66.75,66.75,133.5,2025-02-28 11:53:24.000,2025-02-28,2025,2,28,54727,[],()
74637,55472,21175,1,22.25 USD,"11-JAN-2025,00:53:37",NULL,22.25,22.25,22.25,2025-01-11 00:53:37.000,2025-01-11,2025,1,11,55472,[],()
76338,55752,21430,1,28.75€,00:17:31;29-Jan-2025,,34.5,34.5,34.5,2025-01-29 00:17:31.000,2025-01-29,2025,1,29,55752,[],()
79093,54458,21265,1,75.00USD,2024-06-03T10:11:03.384,NULL,75.0,75.0,75.0,2024-06-03 10:11:03.384,2024-06-03,2024,6,3,54458,[],()
83098,53917,21133,1,$66.,"03/18/25,01:14:16",NULL,66.0,66.0,66.0,2025-03-18 01:14:16.000,2025-03-18,2025,3,18,53917,[],()
78782,53404,21147,1,€28¢99,01.10.2024 03:41:41,NULL,3478.7999999999997,3478.7999999999997,3478.8,2024-01-10 03:41:41.000,2024-01-10,2024,1,10,53404,[],()
81501,53793,21492,1,USD 24.00,25-Jan-2025 03:20,NULL,24.0,24.0,24.0,2025-01-25 03:20:00.000,2025-01-25,2025,1,25,53793,[],()
74125,55168,21427,1,60.00$,18-February-2025;04:15,"Apt. 624 6611 Garrett Village, Manualland, AZ 73017",60.0,60.0,60.0,2025-02-18 04:15:00.000,2025-02-18,2025,2,18,55168,[],()
81214,54766,20936,1,60USD,"09:53:30 pm,02/05/25",,60.0,60.0,60.0,2025-02-05 21:53:30.000,2025-02-05,2025,2,5,54766,[],()
77279,53281,21391,1,USD 65.99,"2024-01-22,05:52","Apt. 388 26979 Rhonda Valleys, Port Mirta, MN 35881",65.99,65.99,65.99,2024-01-22 05:52:00.000,2024-01-22,2024,1,22,53281,[],()
79205,53647,21316,1,USD 25.50,12:21:43;06/26/24,,25.5,25.5,25.5,2024-06-26 12:21:43.000,2024-06-26,2024,6,26,53647,[],()
73351,55039,21041,1,$69.00,"10/02/24,05:40:33 A.M.",,69.0,69.0,69.0,2024-10-02 05:40:33.000,2024-10-02,2024,10,2,53119,[],()
74123,53815,21239,4,€35¢25,"11:00:19,21-Nov-2024",,4230.0,4230.0,16920.0,2024-11-21 11:00:19.000,2024-11-21,2024,11,21,53815,[],()
80060,55012,21464,1,$31¢00,23:51;2025-02-02,,3100.0,3100.0,3100.0,2025-02-02 23:51:00.000,2025-02-02,2025,2,2,55012,[],()
77668,55763,21047,1,55.99 EUR, 5.11.2024 17:18:18,NULL,67.188,67.188,67.19,2024-05-11 17:18:18.000,2024-05-11,2024,5,11,55763,[],()
81000,54057,21493,1,$ 29.50,08:08 12/27/24,NULL,29.5,29.5,29.5,2024-12-27 08:08:00.000,2024-12-27,2024,12,27,54057,[],()
76251,55259,21183,1,$51¢99,"02/20/25,12:21:12 AM",,5199.0,5199.0,5199.0,2025-02-20 00:21:12.000,2025-02-20,2025,2,20,55259,[],()
78233,54153,21577,1,€26¢25,09:34 2025-02-19,,3150.0,3150.0,3150.0,2025-02-19 09:34:00.000,2025-02-19,2025,2,19,54153,[],()
77536,53414,21596,2,51.0$,20-Nov-2024;10:00,"Suite 498 17810 Lesley Pine, North Charlene, NM 08775",51.0,51.0,102.0,2024-11-20 10:00:00.000,2024-11-20,2024,11,20,53414,[],()
78552,53107,20926,1,66.99 USD, 6-Jan-2025;16:32,,66.99,66.99,66.99,2025-01-06 16:32:00.000,2025-01-06,2025,1,6,53107,[],()
81386,54917,21257,1,41.75 $,12:00:46;12/04/24,"4214 Will Dam, East Tommystad, TN 38537",41.75,41.75,41.75,2024-12-04 12:00:46.000,2024-12-04,2024,12,4,54917,[],()
78153,55085,21539,1,68.99EUR,23-May-2024 09:24,,82.788,82.788,82.79,2024-05-23 09:24:00.000,2024-05-23,2024,5,23,55085,[],()
80470,53204,21289,3,47.75 €,13:59:21;08/01/24,NULL,57.3,57.3,171.9,2024-08-01 13:59:21.000,2024-08-01,2024,8,1,53204,[],()
76496,55363,20958,2,34$50¢,2025-02-28T06:49:42.413,"Suite 463 82388 Prosacco Pass, Gusfurt, CT 10522",3450.0,3450.0,6900.0,2025-02-28 06:49:42.413,2025-02-28,2025,2,28,55363,[],()
81845,55118,21536,2,69.5EUR,"2025-06-14,17:22",,83.39999999999999,83.39999999999999,166.8,2025-06-14 17:22:00.000,2025-06-14,2025,6,14,55118,[],()
81563,55307,20953,1,$46.5,21.05.2025 12:43:43,,46.5,46.5,46.5,2025-05-21 12:43:43.000,2025-05-21,2025,5,21,55307,[],()
77194,53866,21193,1,EUR15.00,2024-06-19T01:26:31.285,,18.0,18.0,18.0,2024-06-19 01:26:31.285,2024-06-19,2024,6,19,53866,[],()
81736,54803,21633,2,72 EUR,"2024-12-31,01:51:13 A.M.",,86.39999999999999,86.39999999999999,172.8,2024-12-31 01:51:13.000,2024-12-31,2024,12,31,54803,[],()
79979,55772,21558,1,25.50$,16:35:20 2024-10-13,,25.5,25.5,25.5,2024-10-13 16:35:20.000,2024-10-13,2024,10,13,55772,[],()
80050,55062,21383,2,USD 40.00,"02:08:35, 1-JUL-2024","Apt. 323 1896 Windler Station, East Ismael, WA 20792-1706",40.0,40.0,80.0,2024-07-01 02:08:35.000,2024-07-01,2024,7,1,53047,[],()
74911,55671,21598,1,USD37.75,2024-10-05T03:02:18.138,,37.75,37.75,37.75,2024-10-05 03:02:18.138,2024-10-05,2024,10,5,55671,[],()
79723,53351,21327,5,USD74.99,2025-02-15T12:00:26,NULL,74.99,74.99,374.95,2025-02-15 12:00:26.000,2025-02-15,2025,2,15,53351,[],()
77354,55036,21018,2,$41¢75,2024-11-08;19:01,"Suite 824 738 Satterfield Points, West Terrance, AR 78170-2419",4175.0,4175.0,8350.0,2024-11-08 19:01:00.000,2024-11-08,2024,11,8,55036,[],()
78479,53278,21531,3,55.99 USD,09/27/24;10:51:07 AM,,55.99,55.99,167.97,2024-09-27 10:51:07.000,2024-09-27,2024,9,27,53278,[],()
80798,55340,21591,1,58.99 $,13:52 07/08/24,,58.99,58.99,58.99,2024-07-08 13:52:00.000,2024-07-08,2024,7,8,55340,[],()
75262,53364,21583,3,13. USD,"20:17, 04/11/25",,13.0,13.0,39.0,2025-04-11 20:17:00.000,2025-04-11,2025,4,11,53364,[],()
76279,55357,20972,1,58.5 $,13.03.2024 04:56:56,,58.5,58.5,58.5,2024-03-13 04:56:56.000,2024-03-13,2024,3,13,55357,[],()
77105,55230,21220,1,18USD,2025-03-13T01:18:51.542,,18.0,18.0,18.0,2025-03-13 01:18:51.542,2025-03-13,2025,3,13,55230,[],()
80482,55762,21246,1,42. €,14-Jun-2024;21:52:52,"3184 Gleichner Village, West Buckview, AZ 59354-1119",50.4,50.4,50.4,2024-06-14 21:52:52.000,2024-06-14,2024,6,14,55762,[],()
76197,54942,21064,3,43.0 €,"10/08/24, 22:16",NULL,51.6,51.6,154.8,2024-10-08 22:16:00.000,2024-10-08,2024,10,8,54942,[],()
78379,54545,21222,3,74.0USD,08/03/24;07:10:46,,74.0,74.0,222.0,2024-08-03 07:10:46.000,2024-08-03,2024,8,3,54545,[],()
76892,54563,21510,2,€15.5,2024-11-12T17:43:11,,18.599999999999998,18.599999999999998,37.2,2024-11-12 17:43:11.000,2024-11-12,2024,11,12,54563,[],()
73766,55372,21343,1,$22¢25,2025-02-08T23:43:02,,2225.0,2225.0,2225.0,2025-02-08 23:43:02.000,2025-02-08,2025,2,8,55372,[],()
77623,53142,20941,3,25. EUR,2024-10-21T13:33:35.559,"25445 Austin Estates, South Basil, DE 20328",30.0,30.0,90.0,2024-10-21 13:33:35.559,2024-10-21,2024,10,21,53142,[],()
79211,54698,21202,3,$ 74.5,08:54:37 P.M.;2024-04-30,"Suite 934 4816 Stracke Squares, Derickside, OH 59642-0869",74.5,74.5,223.5,2024-04-30 20:54:37.000,2024-04-30,2024,4,30,54698,[],()
80161,53148,21085,1,25.5USD,"01:05:29 AM, 14-Dec-2024",,25.5,25.5,25.5,2024-12-14 01:05:29.000,2024-12-14,2024,12,14,53148,[],()
80717,55148,21304,1,EUR 48.75, 6-June-2024;19:57:48,,58.5,58.5,58.5,2024-06-06 19:57:48.000,2024-06-06,2024,6,6,55148,[],()
78957,53400,20996,4,44.0EUR,2025-04-28T02:47:41,,52.8,52.8,211.2,2025-04-28 02:47:41.000,2025-04-28,2025,4,28,53400,[],()
73759,55217,21401,1,22USD,"10:34:32 PM, 2024-08-15",,22.0,22.0,22.0,2024-08-15 22:34:32.000,2024-08-15,2024,8,15,55217,[],()
76144,54396,21585,1,41. €,2025-03-20;17:26:45,,49.199999999999996,49.199999999999996,49.2,2025-03-20 17:26:45.000,2025-03-20,2025,3,20,54396,[],()
75975,54399,21153,1,€40¢00,"03:53:07 PM, 14-December-2024",,4800.0,4800.0,4800.0,2024-12-14 15:53:07.000,2024-12-14,2024,12,14,54399,[],()
73811,55288,21576,2,45USD,"02/26/25,01:59",NULL,45.0,45.0,90.0,2025-02-26 01:59:00.000,2025-02-26,2025,2,26,55288,[],()
74878,53233,21472,1,€ 63.75,06:02:28 AM 01/05/25,NULL,76.5,76.5,76.5,2025-01-05 06:02:28.000,2025-01-05,2025,1,5,53233,[],()
82574,53291,21645,1,USD50.0,"12/12/24,09:04","Apt. 939 2627 Stoltenberg Neck, East Mindyside, TN 30917-7512",50.0,50.0,50.0,2024-12-12 09:04:00.000,2024-12-12,2024,12,12,53291,[],()
78830,53238,21492,1,EUR 24.0,2025-02-08T00:30:36,"51847 Rolfson Shores, Alethialand, AK 37207",28.799999999999997,28.799999999999997,28.8,2025-02-08 00:30:36.000,2025-02-08,2025,2,8,53238,[],()
79083,55636,21651,1,€54¢75,"04:23:54,2024-09-07",,6570.0,6570.0,6570.0,2024-09-07 04:23:54.000,2024-09-07,2024,9,7,55636,[],()
79055,53295,20984,5,EUR31,"21:20:22,2024-07-24",,37.199999999999996,37.199999999999996,186.0,2024-07-24 21:20:22.000,2024-07-24,2024,7,24,53295,[],()
80963,55510,21295,1,14.99USD,2024-07-22T06:26:02.769,NULL,14.99,14.99,14.99,2024-07-22 06:26:02.769,2024-07-22,2024,7,22,55510,[],()
74785,54824,21088,1,58.00 EUR, 7-January-2025;21:26,"87892 Balistreri Lake, Port Novella, NV 71678",69.6,69.6,69.6,2025-01-07 21:26:00.000,2025-01-07,2025,1,7,54824,[],()
81650,53292,21372,4,33.5 €,2025-02-06T01:51:44.450,"Suite 306 2455 Keeling Mill, North Terisaview, DE 62175-9207",40.199999999999996,40.199999999999996,160.8,2025-02-06 01:51:44.450,2025-02-06,2025,2,6,53292,[],()
80280,54276,21402,4,70.5 $,"01/02/25,06:50:45 A.M.","Apt. 107 70866 Warner Trail, Earlside, FL 54601-7676",70.5,70.5,282.0,2025-01-02 06:50:45.000,2025-01-02,2025,1,2,54276,[],()
76499,54945,21190,1,USD 35.75,00:16:38 2024-09-01,NULL,35.75,35.75,35.75,2024-09-01 00:16:38.000,2024-09-01,2024,9,1,54945,[],()
74049,53895,20934,4,17.25 $,"22:24:06, 2024-11-12",,17.25,17.25,69.0,2024-11-12 22:24:06.000,2024-11-12,2024,11,12,53895,[],()
76430,53719,21592,1,€26¢00,"08/09/24,02:01",NULL,3120.0,3120.0,3120.0,2024-08-09 02:01:00.000,2024-08-09,2024,8,9,53719,[],()
82463,53911,21563,2,56.USD,2024-08-31T06:06:51,,56.0,56.0,112.0,2024-08-31 06:06:51.000,2024-08-31,2024,8,31,53911,[],()
79964,53703,21441,5,19.99 $,"08:57:36 A.M.,02/27/25",,19.99,19.99,99.95,2025-02-27 08:57:36.000,2025-02-27,2025,2,27,53703,[],()
80763,54588,20940,3,USD58.75,"05:54:54 P.M., 2024-04-30","Apt. 811 8174 Mills Squares, Reubenberg, RI 16475",58.75,58.75,176.25,2024-04-30 17:54:54.000,2024-04-30,2024,4,30,54588,[],()
79533,54193,20965,1,€ 54.0,"10:59,  9-Mar-2025","35253 Robt Mission, New Mindy, NV 32751",64.8,64.8,64.8,2025-03-09 10:59:00.000,2025-03-09,2025,3,9,54193,[],()
80631,55236,21091,1,€28.25, 6-April-2024 00:36:43,NULL,33.9,33.9,33.9,2024-04-06 00:36:43.000,2024-04-06,2024,4,6,55236,[],()
77523,55588,21381,1,33.75 USD,09/23/25;06:57:56 A.M.,"Suite 269 36010 Zulauf Locks, East Kaitlin, CT 99506",33.75,33.75,33.75,2025-09-23 06:57:56.000,2025-09-23,2025,9,23,55588,[],()
80452,53576,21481,1,19.99 USD,2025-04-28T09:30:22,,19.99,19.99,19.99,2025-04-28 09:30:22.000,2025-04-28,2025,4,28,53576,[],()
75410,53869,21004,1,18.25 $,16:17:12 2024-08-23,NULL,18.25,18.25,18.25,2024-08-23 16:17:12.000,2024-08-23,2024,8,23,53869,[],()
73527,53501,20936,1,55.99 EUR,"20-November-2024, 09:00:02 PM",,67.188,67.188,67.19,2024-11-20 21:00:02.000,2024-11-20,2024,11,20,53501,[],()
79164,53663,21304,1,50.25EUR,06/05/24;21:48:38,,60.3,60.3,60.3,2024-06-05 21:48:38.000,2024-06-05,2024,6,5,53663,[],()
80551,53687,21127,1,53.99EUR,23:12 07/16/24,NULL,64.788,64.788,64.79,2024-07-16 23:12:00.000,2024-07-16,2024,7,16,53687,[],()
80279,53844,21007,1,USD33.50,"2024-10-30, 17:48:31",,33.5,33.5,33.5,2024-10-30 17:48:31.000,2024-10-30,2024,10,30,53844,[],()
78359,53692,20968,1,66.0 EUR," 3-Oct-2024, 07:30:37 pm",,79.2,79.2,79.2,2024-10-03 19:30:37.000,2024-10-03,2024,10,3,53692,[],()
82263,53606,21541,1,58.$,"09/30/25, 09:46:18 am",NULL,58.0,58.0,58.0,2025-09-30 09:46:18.000,2025-09-30,2025,9,30,53606,[],()
75512,54116,20969,2,USD17.5,"09:24,20-Mar-2024",NULL,17.5,17.5,35.0,2024-03-20 09:24:00.000,2024-03-20,2024,3,20,54116,[],()
82772,55698,20920,4,15.00 $,01:13:00 11/09/24,"Apt. 552 47051 Marissa Mountains, West Margo, ND 41032-4325",15.0,15.0,60.0,2024-11-09 01:13:00.000,2024-11-09,2024,11,9,55698,[],()
80136,54621,21403,3,$27.0,05:17:35 P.M.;2024-12-03,NULL,27.0,27.0,81.0,2024-12-03 17:17:35.000,2024-12-03,2024,12,3,54621,[],()
77463,54385,21530,4,€72¢50,"03/21/25, 05:42",NULL,8700.0,8700.0,34800.0,2025-03-21 05:42:00.000,2025-03-21,2025,3,21,54385,[],()
74429,54370,20961,3,35.5EUR,12:19:01 AM; 5-Oct-2024,NULL,42.6,42.6,127.8,2024-10-05 00:19:01.000,2024-10-05,2024,10,5,54370,[],()
80030,54652,21482,1,$41.75,"2024-07-26,01:00:25",,41.75,41.75,41.75,2024-07-26 01:00:25.000,2024-07-26,2024,7,26,54652,[],()
76136,55586,21282,1,EUR 60,2024-06-04T21:08:55.105,,72.0,72.0,72.0,2024-06-04 21:08:55.105,2024-06-04,2024,6,4,55586,[],()
77479,53751,21473,2,61€50¢,10/11/24;01:03:19 A.M.,NULL,7380.0,7380.0,14760.0,2024-10-11 01:03:19.000,2024-10-11,2024,10,11,53974,[],()
77518,54541,21104,1,$ 17.50,05:46 23-SEP-2024,,17.5,17.5,17.5,2024-09-23 05:46:00.000,2024-09-23,2024,9,23,54541,[],()
74645,55718,21290,1,55.25€,"01/06/25,03:43","Suite 279 3180 Mercedez Cove, South Kimiko, MA 58124",66.3,66.3,66.3,2025-01-06 03:43:00.000,2025-01-06,2025,1,6,55718,[],()
75907,55129,21536,1,67.5$,"2025-01-04, 10:46:32",,67.5,67.5,67.5,2025-01-04 10:46:32.000,2025-01-04,2025,1,4,55129,[],()
75221,53433,21419,1,69.50$,2024-07-17 05:08,,69.5,69.5,69.5,2024-07-17 05:08:00.000,2024-07-17,2024,7,17,53433,[],()
80731,53506,21209,1,49.0$,"07/17/24,10:07",,49.0,49.0,49.0,2024-07-17 10:07:00.000,2024-07-17,2024,7,17,53506,[],()
73911,55031,21281,1,USD70.00,20:02 2024-11-24,,70.0,70.0,70.0,2024-11-24 20:02:00.000,2024-11-24,2024,11,24,55031,[],()
78030,54332,21049,1,71.5 $,"09:48:15 pm, 08/21/24",NULL,71.5,71.5,71.5,2024-08-21 21:48:15.000,2024-08-21,2024,8,21,54332,[],()
81562,55497,21304,1,$ 51.25,2024-03-23T14:04:07,,51.25,51.25,51.25,2024-03-23 14:04:07.000,2024-03-23,2024,3,23,55497,[],()
76985,54582,21466,1,14.25 $,"06:00:19 P.M., 01/25/25","Suite 733 64334 Bradtke Trafficway, West Myrtachester, CO 68357-5951",14.25,14.25,14.25,2025-01-25 18:00:19.000,2025-01-25,2025,1,25,53687,[],()
76192,55297,21109,2,55.00USD,09/12/24;10:55,,55.0,55.0,110.0,2024-09-12 10:55:00.000,2024-09-12,2024,9,12,55297,[],()
75189,53926,21280,3,18.75EUR,23:35;11-Jun-2024,,22.5,22.5,67.5,2024-06-11 23:35:00.000,2024-06-11,2024,6,11,53926,[],()
81503,54290,20980,1,32.0 EUR,05:44:02 PM 12/08/24,,38.4,38.4,38.4,2024-12-08 17:44:02.000,2024-12-08,2024,12,8,54290,[],()
73867,53605,21336,1,$63.5,02/06/25 16:31,,63.5,63.5,63.5,2025-02-06 16:31:00.000,2025-02-06,2025,2,6,53605,[],()
77858,53467,21045,1,23.25 EUR,13:17:27;06/20/24,"Apt. 500 5811 Becker Circles, West Gerryport, NC 51615",27.9,27.9,27.9,2024-06-20 13:17:27.000,2024-06-20,2024,6,20,53467,[],()
73742,54139,21366,1,USD56.00,"18-March-2024,01:06",,56.0,56.0,56.0,2024-03-18 01:06:00.000,2024-03-18,2024,3,18,54139,[],()
77606,53238,21639,2,€ 12.99,"03:58:48 pm,2024-12-31","51847 Rolfson Shores, Alethialand, AK 37207",15.588,15.588,31.18,2024-12-31 15:58:48.000,2024-12-31,2024,12,31,53238,[],()
76921,55191,21080,1,24.0USD,19:46 2025-03-27,,24.0,24.0,24.0,2025-03-27 19:46:00.000,2025-03-27,2025,3,27,55191,[],()
81303,54045,21359,1,USD 69.25,"2025-01-31,09:03:16 A.M.","Apt. 226 135 Considine Forges, Hyattberg, WV 77481-7209",69.25,69.25,69.25,2025-01-31 09:03:16.000,2025-01-31,2025,1,31,54045,[],()
79171,53660,21547,1,USD20.25,"04:10, 2-November-2024",,20.25,20.25,20.25,2024-11-02 04:10:00.000,2024-11-02,2024,11,2,53660,[],()
82211,55703,20979,1,73.75$,14-April-2025 03:35:47,,73.75,73.75,73.75,2025-04-14 03:35:47.000,2025-04-14,2025,4,14,55703,[],()
76836,54534,21409,1,73.75€,12-Jan-2025;12:20:18,,88.5,88.5,88.5,2025-01-12 12:20:18.000,2025-01-12,2025,1,12,54534,[],()
76756,55798,20970,2,40.99 EUR,"05:11:39 am, 20-Nov-2024",,49.188,49.188,98.38,2024-11-20 05:11:39.000,2024-11-20,2024,11,20,55798,[],()
74422,55462,21441,1,EUR 17.00,08/07/24;03:56:38,NULL,20.4,20.4,20.4,2024-08-07 03:56:38.000,2024-08-07,2024,8,7,55462,[],()
73442,55291,21354,1,€ 19.0,"02:00:21,  4-JUN-2025",,22.8,22.8,22.8,2025-06-04 02:00:21.000,2025-06-04,2025,6,4,55291,[],()
75669,54927,21433,1,46.0 EUR,2024-11-12T22:26:51.940,"Apt. 224 81368 Tyree Brooks, North Kristopher, MO 35770",55.199999999999996,55.199999999999996,55.2,2024-11-12 22:26:51.940,2024-11-12,2024,11,12,54927,[],()
79913,55241,21369,3,59.75 USD,2024-07-28 05:24:37 A.M.,NULL,59.75,59.75,179.25,2024-07-28 05:24:37.000,2024-07-28,2024,7,28,55241,[],()
80128,55792,21335,2,USD 67.0,07/25/24 01:18:43,,67.0,67.0,134.0,2024-07-25 01:18:43.000,2024-07-25,2024,7,25,55792,[],()
76397,53910,21650,2,$37¢25,2024-12-10;20:38,"495 Douglas Port, Franciscotown, WI 97743",3725.0,3725.0,7450.0,2024-12-10 20:38:00.000,2024-12-10,2024,12,10,53910,[],()
78677,54349,21374,3,25.75 $,17-Mar-2025 11:47,"854 Madaline Burgs, New Elfriedeport, KY 33000-3139",25.75,25.75,77.25,2025-03-17 11:47:00.000,2025-03-17,2025,3,17,54349,[],()
74362,54455,21648,1,€31¢00,11/02/24 01:35:40 PM,,3720.0,3720.0,3720.0,2024-11-02 13:35:40.000,2024-11-02,2024,11,2,54455,[],()
82337,54971,21343,1,21.50USD,04/21/25;08:36,"8216 Savanna Manor, Wisozkfort, NE 60556",21.5,21.5,21.5,2025-04-21 08:36:00.000,2025-04-21,2025,4,21,54971,[],()
76461,55123,21454,1,37.5 USD,"10:20,06/03/25","Suite 968 41583 Ward Trafficway, Vinceland, ND 65052",37.5,37.5,37.5,2025-06-03 10:20:00.000,2025-06-03,2025,6,3,55123,[],()
75243,53034,21271,1,22.0EUR,11/21/24;06:51:28 pm,NULL,26.4,26.4,26.4,2024-11-21 18:51:28.000,2024-11-21,2024,11,21,53034,[],()
75241,55303,21217,1,USD28.50,12:24:47 PM 2024-11-14,"86071 Armando Village, West Aracelystad, IN 28721",28.5,28.5,28.5,2024-11-14 12:24:47.000,2024-11-14,2024,11,14,55303,[],()
76360,55175,21097,1,USD 15.75,2024-11-21T08:49:45.746,NULL,15.75,15.75,15.75,2024-11-21 08:49:45.746,2024-11-21,2024,11,21,55175,[],()
73848,54447,21512,1,USD 58.00,06:29:17 P.M.;2025-04-17,,58.0,58.0,58.0,2025-04-17 18:29:17.000,2025-04-17,2025,4,17,54447,[],()
78247,54870,21559,1,USD71.75,"12/17/24,01:19",,71.75,71.75,71.75,2024-12-17 01:19:00.000,2024-12-17,2024,12,17,54870,[],()
80393,55002,21242,1,55.50$,01:44 09/26/24,NULL,55.5,55.5,55.5,2024-09-26 01:44:00.000,2024-09-26,2024,9,26,55002,[],()
73538,54038,21593,2,$61.99,10:28:18 pm;2025-03-23,,61.99,61.99,123.98,2025-03-23 22:28:18.000,2025-03-23,2025,3,23,54038,[],()
82161,53591,21392,1,EUR74.0,2025-06-26T13:39:10,,88.8,88.8,88.8,2025-06-26 13:39:10.000,2025-06-26,2025,6,26,53591,[],()
77213,55344,21412,1,$45.75,2025-01-24T01:39:42,NULL,45.75,45.75,45.75,2025-01-24 01:39:42.000,2025-01-24,2025,1,24,55344,[],()
75714,55474,20936,1,56.00EUR,2024-08-16 04:39:16 PM,,67.2,67.2,67.2,2024-08-16 16:39:16.000,2024-08-16,2024,8,16,55474,[],()
82721,55763,21188,1,$ 50.75,10:17 07/04/24,,50.75,50.75,50.75,2024-07-04 10:17:00.000,2024-07-04,2024,7,4,55763,[],()
76618,53247,21108,1,25.00 $,"19-June-2024,11:37",NULL,25.0,25.0,25.0,2024-06-19 11:37:00.000,2024-06-19,2024,6,19,53247,[],()
75801,53750,21221,1,USD 70.99,2025-01-18;12:35:02 P.M.,,70.99,70.99,70.99,2025-01-18 12:35:02.000,2025-01-18,2025,1,18,53750,[],()
80727,53865,21632,2,17. $,09:41:34 P.M.;15-January-2025,,17.0,17.0,34.0,2025-01-15 21:41:34.000,2025-01-15,2025,1,15,53865,[],()
82865,53778,21169,1,€ 60.75,06:13 08/30/24,,72.89999999999999,72.89999999999999,72.9,2024-08-30 06:13:00.000,2024-08-30,2024,8,30,53778,[],()
82627,54865,21598,1,€37¢00,"23-September-2024, 14:59",NULL,4440.0,4440.0,4440.0,2024-09-23 14:59:00.000,2024-09-23,2024,9,23,54865,[],()
76770,55611,21506,1,USD 30.75,21:41:33;03/17/25,"2951 Buckridge Ford, Lueilwitzchester, KY 24788-7360",30.75,30.75,30.75,2025-03-17 21:41:33.000,2025-03-17,2025,3,17,55611,[],()
82801,53040,20945,1,35.00 $,2025-02-06T16:43:48,NULL,35.0,35.0,35.0,2025-02-06 16:43:48.000,2025-02-06,2025,2,6,53040,[],()
78186,55736,20994,1,€ 19.25,08:43:05  3-Sep-2024,,23.099999999999998,23.099999999999998,23.1,2024-09-03 08:43:05.000,2024-09-03,2024,9,3,55736,[],()
73992,54148,21432,1,75.00 $,"05:42:04 pm, 2024-12-07","40120 Jacobson Shore, Dessieville, MS 84078-4136",75.0,75.0,75.0,2024-12-07 17:42:04.000,2024-12-07,2024,12,7,54148,[],()
74090,53926,21114,1,58.25USD,02:31:41 A.M.;2025-06-19,,58.25,58.25,58.25,2025-06-19 02:31:41.000,2025-06-19,2025,6,19,53926,[],()
79348,54677,21378,1,USD 41.25,"14:41,21-AUG-2024",,41.25,41.25,41.25,2024-08-21 14:41:00.000,2024-08-21,2024,8,21,54677,[],()
82603,54200,21227,2,72.5 USD,2024-12-13T22:09:50,"Suite 298 1763 Ledner Fork, Brettton, IA 56014-9744",72.5,72.5,145.0,2024-12-13 22:09:50.000,2024-12-13,2024,12,13,54200,[],()
76482,54642,21333,1,USD 30,2025-01-13T09:47:05.239,,30.0,30.0,30.0,2025-01-13 09:47:05.239,2025-01-13,2025,1,13,54642,[],()
82336,55342,21069,1,22.0$,"11/19/24, 11:45:03","Apt. 960 4601 Carter Overpass, New Rodrick, PA 80910",22.0,22.0,22.0,2024-11-19 11:45:03.000,2024-11-19,2024,11,19,55342,[],()
79294,54650,21065,1,22. USD,2024-12-12T23:30:22.677,"Apt. 329 808 Eleonora Branch, South Kathlinetown, NE 90332",22.0,22.0,22.0,2024-12-12 23:30:22.677,2024-12-12,2024,12,12,53784,[],()
77280,53670,20990,1,21.75$,"2024-05-04,03:38:01 am",,21.75,21.75,21.75,2024-05-04 03:38:01.000,2024-05-04,2024,5,4,53670,[],()
81165,54031,21553,2,USD22.25,"16:40:23,26-Feb-2025","Apt. 528 5912 Joane Shore, Evalynton, NJ 43596-9301",22.25,22.25,44.5,2025-02-26 16:40:23.000,2025-02-26,2025,2,26,54031,[],()
80481,55730,21403,5,25.25USD,16:39:44;09/09/24,,25.25,25.25,126.25,2024-09-09 16:39:44.000,2024-09-09,2024,9,9,55730,[],()
79326,53289,21296,5,€35.5,13:17:39 2024-09-25,"41323 Frami Locks, East Maynard, MN 04845",42.6,42.6,213.0,2024-09-25 13:17:39.000,2024-09-25,2024,9,25,53289,[],()
77834,53705,21195,1,39.5 $," 5-May-2025,15:35","339 Wilkinson Roads, West Alfredaview, WA 55837",39.5,39.5,39.5,2025-05-05 15:35:00.000,2025-05-05,2025,5,5,53705,[],()
80812,55759,21326,1,USD71.25,2025-01-04T03:33:33.576,,71.25,71.25,71.25,2025-01-04 03:33:33.576,2025-01-04,2025,1,4,55759,[],()
80765,54892,21049,1,€69.0,26-Dec-2024;08:48,,82.8,82.8,82.8,2024-12-26 08:48:00.000,2024-12-26,2024,12,26,54704,[],()
78544,55394,21522,2,51.0€,19:47 25-Jul-2024,"18732 Loren Junctions, North Daina, AZ 00223-4554",61.199999999999996,61.199999999999996,122.4,2024-07-25 19:47:00.000,2024-07-25,2024,7,25,55394,[],()
79291,55337,21179,1,56.75 $,2025-01-01T23:22:37.558,,56.75,56.75,56.75,2025-01-01 23:22:37.558,2025-01-01,2025,1,1,55337,[],()
74007,55814,21445,1,45.50 $,"20:56:33,10/08/24","5989 Fisher Ports, Wardfurt, ND 46622",45.5,45.5,45.5,2024-10-08 20:56:33.000,2024-10-08,2024,10,8,55814,[],()
81322,53223,21098,1,64.5USD,2025-02-28;08:59:23 AM,NULL,64.5,64.5,64.5,2025-02-28 08:59:23.000,2025-02-28,2025,2,28,53968,[],()
78481,55239,21473,1,57.5$,01/26/25 05:03:02 P.M.,,57.5,57.5,57.5,2025-01-26 17:03:02.000,2025-01-26,2025,1,26,55239,[],()
75734,55708,21633,1,$ 71.99,03:45:00 2024-07-25,"Suite 387 4411 Sylvester Roads, Bartontown, NM 88548",71.99,71.99,71.99,2024-07-25 03:45:00.000,2024-07-25,2024,7,25,55708,[],()
79352,54582,21175,2,27.00USD,2025-05-31T12:31:09,"Suite 733 64334 Bradtke Trafficway, West Myrtachester, CO 68357-5951",27.0,27.0,54.0,2025-05-31 12:31:09.000,2025-05-31,2025,5,31,53687,[],()
82443,53130,21406,1,$56.25,2025-01-02T00:59:04.428,"Suite 986 62772 Tatyana Port, McCulloughfort, MA 05722-8472",56.25,56.25,56.25,2025-01-02 00:59:04.428,2025-01-02,2025,1,2,53130,[],()
82848,54210,21083,1,23. $,"04:12:19 AM, 2025-03-12",NULL,23.0,23.0,23.0,2025-03-12 04:12:19.000,2025-03-12,2025,3,12,54210,[],()
75560,53186,21019,1,64.5 USD,05:14:25 04/12/25,"Apt. 896 520 Maximo Fork, North Cedrickland, VA 48871-7109",64.5,64.5,64.5,2025-04-12 05:14:25.000,2025-04-12,2025,4,12,53186,[],()
80789,54764,21042,1,€20.75,"01/24/25,11:47",NULL,24.9,24.9,24.9,2025-01-24 11:47:00.000,2025-01-24,2025,1,24,54764,[],()
79153,53553,21314,2,EUR18.5,12:57:32 2024-10-09,,22.2,22.2,44.4,2024-10-09 12:57:32.000,2024-10-09,2024,10,9,53553,[],()
79693,55572,21443,1,$35.00,"11:26:42 P.M.,2024-12-05",,35.0,35.0,35.0,2024-12-05 23:26:42.000,2024-12-05,2024,12,5,55572,[],()
80590,54833,20969,1,21.75EUR,12/16/24;06:24,,26.099999999999998,26.099999999999998,26.1,2024-12-16 06:24:00.000,2024-12-16,2024,12,16,54833,[],()
78632,53186,21336,2,EUR66.75, 4.04.2024  4:04:04,,80.1,80.1,160.2,2024-04-04 04:04:04.000,2024-04-04,2024,4,4,53186,[],()
75834,53785,20952,1,41.25 $,2024-10-04T03:54:36,,41.25,41.25,41.25,2024-10-04 03:54:36.000,2024-10-04,2024,10,4,53785,[],()
83151,55183,21190,1,EUR33.25,18:15:36 10/07/24,,39.9,39.9,39.9,2024-10-07 18:15:36.000,2024-10-07,2024,10,7,55183,[],()
75124,54504,21108,2,USD 23.5,07:01:52 am 12/13/24,NULL,23.5,23.5,47.0,2024-12-13 07:01:52.000,2024-12-13,2024,12,13,54504,[],()
77610,54775,21075,1,48.99 €,21:51:34;10/22/24,"272 Carter Parks, Lake Hassan, DE 75012",58.788,58.788,58.79,2024-10-22 21:51:34.000,2024-10-22,2024,10,22,54775,[],()
79903,54917,21535,2,USD 67.00," 7-Apr-2025,12:58",NULL,67.0,67.0,134.0,2025-04-07 12:58:00.000,2025-04-07,2025,4,7,54917,[],()
78042,55754,21604,1,€ 52.0,"08/13/25,14:09","537 Retha Extension, Raymondtown, WY 35853",62.4,62.4,62.4,2025-08-13 14:09:00.000,2025-08-13,2025,8,13,55754,[],()
82883,55488,21519,1,USD 50.5,"18:12:06, 12/01/24",NULL,50.5,50.5,50.5,2024-12-01 18:12:06.000,2024-12-01,2024,12,1,55488,[],()
76935,54537,21413,1,60.00€,"09:21:05 am, 09/29/24","886 Arlie Via, Port Shawn, VT 87405-9318",72.0,72.0,72.0,2024-09-29 09:21:05.000,2024-09-29,2024,9,29,54537,[],()
74735,54675,21012,1,$ 61.,12/06/24;22:24,,61.0,61.0,61.0,2024-12-06 22:24:00.000,2024-12-06,2024,12,6,54675,[],()
74311,54864,21023,1,13.50€,"01/21/25,07:02:30 A.M.",NULL,16.2,16.2,16.2,2025-01-21 07:02:30.000,2025-01-21,2025,1,21,54864,[],()
82922,53802,21543,1,€ 25.5,2025-01-23T00:30:02.237,"2896 Mohr Summit, Cristbury, WY 51059-9269",30.599999999999998,30.599999999999998,30.6,2025-01-23 00:30:02.237,2025-01-23,2025,1,23,53802,[],()
81959,55230,21596,2,49.00€,14-February-2025 03:27,,58.8,58.8,117.6,2025-02-14 03:27:00.000,2025-02-14,2025,2,14,55230,[],()
82678,54544,21176,1,USD 26.,Mon Nov  4 10:34:03 2024,,26.0,26.0,26.0,2024-11-04 10:34:03.000,2024-11-04,2024,11,4,54544,[],()
73561,53542,21064,1,$43.,09:42 2024-09-24,NULL,43.0,43.0,43.0,2024-09-24 09:42:00.000,2024-09-24,2024,9,24,53542,[],()
77824,54907,21137,1,EUR 46.50,09:46:07;12/25/24,,55.8,55.8,55.8,2024-12-25 09:46:07.000,2024-12-25,2024,12,25,54907,[],()
73708,55236,21160,3,19.75€,"02:27:22, 2024-07-06",NULL,23.7,23.7,71.1,2024-07-06 02:27:22.000,2024-07-06,2024,7,6,55236,[],()
79427,53167,21210,1,$20¢00,"04/04/25, 09:02:20 AM",,2000.0,2000.0,2000.0,2025-04-04 09:02:20.000,2025-04-04,2025,4,4,53167,[],()
81700,54212,21233,1,42.0 USD,03:05 29-Sep-2024,,42.0,42.0,42.0,2024-09-29 03:05:00.000,2024-09-29,2024,9,29,54212,[],()
82006,53583,21420,4,€ 66.99,"10:59:00,2024-05-19",,80.38799999999999,80.38799999999999,321.55,2024-05-19 10:59:00.000,2024-05-19,2024,5,19,53583,[],()
79704,54406,21058,2,EUR48.50,"14:59, 2025-05-11",,58.199999999999996,58.199999999999996,116.4,2025-05-11 14:59:00.000,2025-05-11,2025,5,11,54406,[],()
76676,53886,21129,1,37.99USD,"01:24:12,2024-11-14",NULL,37.99,37.99,37.99,2024-11-14 01:24:12.000,2024-11-14,2024,11,14,53886,[],()
81698,53380,21610,1,42.25 USD,09:59:19 08/02/24,NULL,42.25,42.25,42.25,2024-08-02 09:59:19.000,2024-08-02,2024,8,2,53380,[],()
78945,54670,20922,2,66$75¢,"21-MAY-2024,04:48",,6675.0,6675.0,13350.0,2024-05-21 04:48:00.000,2024-05-21,2024,5,21,54670,[],()
76229,54607,21654,1,14.99 $,01:07:08 AM;2025-09-26,,14.99,14.99,14.99,2025-09-26 01:07:08.000,2025-09-26,2025,9,26,54607,[],()
78948,53295,21419,1,€69¢25,"14:39:47, 14-SEP-2024",NULL,8310.0,8310.0,8310.0,2024-09-14 14:39:47.000,2024-09-14,2024,9,14,53295,[],()
81216,54838,21037,1,€54.99,02:14:20 AM;17-FEB-2025,NULL,65.988,65.988,65.99,2025-02-17 02:14:20.000,2025-02-17,2025,2,17,54838,[],()
74024,53230,21572,1,30.00EUR,"02/20/25,00:17:58",,36.0,36.0,36.0,2025-02-20 00:17:58.000,2025-02-20,2025,2,20,53230,[],()
78471,55681,21131,1,USD 52.00,"09:25, 2025-04-18","3184 Gleichner Village, West Buckview, AZ 59354-1119",52.0,52.0,52.0,2025-04-18 09:25:00.000,2025-04-18,2025,4,18,55762,[],()
82186,55270,21136,3,71.25 EUR,2024-09-24 04:49:53 AM,,85.5,85.5,256.5,2024-09-24 04:49:53.000,2024-09-24,2024,9,24,55270,[],()
79052,53209,21608,1,€63.99,"2024-11-04,04:03",,76.788,76.788,76.79,2024-11-04 04:03:00.000,2024-11-04,2024,11,4,53209,[],()
75427,53246,21247,2,EUR 56.0,"11/12/24, 04:52:36 A.M.",,67.2,67.2,134.4,2024-11-12 04:52:36.000,2024-11-12,2024,11,12,53246,[],()
82569,55351,21640,1,USD53.99,11:22:05  4-Aug-2024,,53.99,53.99,53.99,2024-08-04 11:22:05.000,2024-08-04,2024,8,4,55351,[],()
77038,54260,21453,4,$71.0,"02/28/25,14:32:13",,71.0,71.0,284.0,2025-02-28 14:32:13.000,2025-02-28,2025,2,28,54260,[],()
76149,55501,20999,2,$ 29.0, 5-March-2025;10:11:20,,29.0,29.0,58.0,2025-03-05 10:11:20.000,2025-03-05,2025,3,5,55501,[],()
82242,55367,21431,1,59.25 EUR,2024-11-09T22:10:13,,71.1,71.1,71.1,2024-11-09 22:10:13.000,2024-11-09,2024,11,9,55367,[],()
81413,53436,21068,5,63.0USD,"12/12/24, 17:49:50",,63.0,63.0,315.0,2024-12-12 17:49:50.000,2024-12-12,2024,12,12,53436,[],()
75664,55274,21109,1,$58¢75,11/17/24;08:25:06 P.M.,NULL,5875.0,5875.0,5875.0,2024-11-17 20:25:06.000,2024-11-17,2024,11,17,55274,[],()
79154,53944,20964,1,USD75.5,"21-DEC-2024,02:47:14 A.M.","88380 Evelyn Walks, West Kaseybury, WV 67502-2090",75.5,75.5,75.5,2024-12-21 02:47:14.000,2024-12-21,2024,12,21,53944,[],()
74431,53267,21014,1,74.25 $,"04:49:31 pm,  7-October-2024","Suite 990 83182 Elene Trail, East Kerry, SC 67579",74.25,74.25,74.25,2024-10-07 16:49:31.000,2024-10-07,2024,10,7,53267,[],()
77324,54183,21188,1,USD 48.00,"23:21:18,19-FEB-2025",,48.0,48.0,48.0,2025-02-19 23:21:18.000,2025-02-19,2025,2,19,54183,[],()
78513,53024,21316,1,USD 22.25,"07:47:39, 15-December-2024",,22.25,22.25,22.25,2024-12-15 07:47:39.000,2024-12-15,2024,12,15,53024,[],()
77799,53648,21082,1,$21.25,2025-02-10 00:15,"Apt. 441 4423 Ondricka Run, East Curtismouth, CO 96842",21.25,21.25,21.25,2025-02-10 00:15:00.000,2025-02-10,2025,2,10,53648,[],()
82208,53633,20981,2,€24.50,"18:04, 11/25/24",,29.4,29.4,58.8,2024-11-25 18:04:00.000,2024-11-25,2024,11,25,53633,[],()
77844,54598,21296,1,40.0 EUR,2024-06-01T01:49:13,NULL,48.0,48.0,48.0,2024-06-01 01:49:13.000,2024-06-01,2024,6,1,54598,[],()
81201,54244,21304,1,USD49.25,2024-08-31T06:05:34.868,,49.25,49.25,49.25,2024-08-31 06:05:34.868,2024-08-31,2024,8,31,54244,[],()
75716,54304,21276,1,€32¢50,"2025-03-26, 04:52:01 A.M.",NULL,3900.0,3900.0,3900.0,2025-03-26 04:52:01.000,2025-03-26,2025,3,26,54304,[],()
80740,53467,20950,1,USD 32.50,05/27/25 02:56:17 AM,,32.5,32.5,32.5,2025-05-27 02:56:17.000,2025-05-27,2025,5,27,53467,[],()
76592,53229,21127,1,€51.75,10/08/24;19:00:05,,62.099999999999994,62.099999999999994,62.1,2024-10-08 19:00:05.000,2024-10-08,2024,10,8,53229,[],()
75479,54514,21074,3,EUR 70.50,2025-04-16T16:42:24,,84.6,84.6,253.8,2025-04-16 16:42:24.000,2025-04-16,2025,4,16,54514,[],()
81374,54798,21109,1,56.00EUR,"18-JAN-2025,14:38",,67.2,67.2,67.2,2025-01-18 14:38:00.000,2025-01-18,2025,1,18,54798,[],()
82700,54922,21596,1,53.00 USD,"12:49:59 AM, 30-Sep-2024",,53.0,53.0,53.0,2024-09-30 00:49:59.000,2024-09-30,2024,9,30,54922,[],()
81283,55145,21137,1,45.0EUR,01/07/25 14:21:45,NULL,54.0,54.0,54.0,2025-01-07 14:21:45.000,2025-01-07,2025,1,7,55145,[],()
77739,54034,21538,3,USD 67.00,2025-02-25;05:23:10 am,,67.0,67.0,201.0,2025-02-25 05:23:10.000,2025-02-25,2025,2,25,54034,[],()
78054,55140,21488,1,$ 24.5,07:42:42;2024-12-19,,24.5,24.5,24.5,2024-12-19 07:42:42.000,2024-12-19,2024,12,19,55140,[],()
77859,54554,21032,1,17.75 $,"16:29, 02/14/25",NULL,17.75,17.75,17.75,2025-02-14 16:29:00.000,2025-02-14,2025,2,14,54554,[],()
79684,53927,21505,1,USD 30.5,"2025-05-31,13:02","Suite 862 4374 McClure Camp, Hammesport, NH 20006",30.5,30.5,30.5,2025-05-31 13:02:00.000,2025-05-31,2025,5,31,53927,[],()
79555,55357,21465,1,€73.75,"04:42:04 am, 2024-05-19",,88.5,88.5,88.5,2024-05-19 04:42:04.000,2024-05-19,2024,5,19,55357,[],()
78533,53779,21598,1,€39.99,2025-02-01 05:51:30,NULL,47.988,47.988,47.99,2025-02-01 05:51:30.000,2025-02-01,2025,2,1,53779,[],()
76729,55289,21407,3,27.99USD,25-JUL-2025 23:47:59,,27.99,27.99,83.97,2025-07-25 23:47:59.000,2025-07-25,2025,7,25,55289,[],()
77565,55762,21640,1,$ 56.5,23-May-2025 05:23:28 A.M.,,56.5,56.5,56.5,2025-05-23 05:23:28.000,2025-05-23,2025,5,23,55762,[],()
76951,53289,20954,1,€ 74.,01/09/25;01:32:53 pm,,88.8,88.8,88.8,2025-01-09 13:32:53.000,2025-01-09,2025,1,9,53289,[],()
75641,55664,21005,2,18.99 USD,10/03/24;10:15:05 AM,,18.99,18.99,37.98,2024-10-03 10:15:05.000,2024-10-03,2024,10,3,55664,[],()
77021,53840,21599,1,$ 16.5,10:52:02 pm; 7-October-2024,,16.5,16.5,16.5,2024-10-07 22:52:02.000,2024-10-07,2024,10,7,53840,[],()
82239,55582,21193,1,USD 17.50,2024-12-14 22:28:21,,17.5,17.5,17.5,2024-12-14 22:28:21.000,2024-12-14,2024,12,14,55582,[],()
78578,55328,21063,1,51.50EUR,11:28:37 PM 14-June-2024,,61.8,61.8,61.8,2024-06-14 23:28:37.000,2024-06-14,2024,6,14,55328,[],()
78525,54972,21496,1,$ 25.0,03/16/25;06:35,"50825 Bergstrom Tunnel, Kevenberg, CO 32979",25.0,25.0,25.0,2025-03-16 06:35:00.000,2025-03-16,2025,3,16,54972,[],()
74461,53131,21051,1,71.25 $,01/29/25;18:20,"Suite 291 5379 Rory Orchard, Port Sebastian, KS 40530-1828",71.25,71.25,71.25,2025-01-29 18:20:00.000,2025-01-29,2025,1,29,53131,[],()
80137,53049,21446,1,$36.0,09:08:20 P.M.;05/05/24,NULL,36.0,36.0,36.0,2024-05-05 21:08:20.000,2024-05-05,2024,5,5,53049,[],()
79928,55232,21604,1,49€75¢,03:09:26 AM;12-August-2024,,5970.0,5970.0,5970.0,2024-08-12 03:09:26.000,2024-08-12,2024,8,12,55232,[],()
77530,54757,21102,1,USD 54.75,12:57:08;10/13/24,,54.75,54.75,54.75,2024-10-13 12:57:08.000,2024-10-13,2024,10,13,54757,[],()
80342,54199,21379,2,$ 66.00,20-November-2024 11:06:41 am,,66.0,66.0,132.0,2024-11-20 11:06:41.000,2024-11-20,2024,11,20,54199,[],()
77403,54202,21392,2,€76.0, 8-May-2024 04:22:44 PM,,91.2,91.2,182.4,2024-05-08 16:22:44.000,2024-05-08,2024,5,8,54202,[],()
77472,55264,20995,4,51.0€,"06:00:15, 14-Dec-2024",,61.199999999999996,61.199999999999996,244.8,2024-12-14 06:00:15.000,2024-12-14,2024,12,14,55264,[],()
83085,53899,21333,1,€32.99,"19:54:32,12/22/24",NULL,39.588,39.588,39.59,2024-12-22 19:54:32.000,2024-12-22,2024,12,22,53899,[],()
81688,54421,20961,1,35.5$,"08:02, 2025-01-31",,35.5,35.5,35.5,2025-01-31 08:02:00.000,2025-01-31,2025,1,31,54421,[],()
76244,53874,20965,1,€ 56.75,09/11/24 07:47:46 pm,,68.1,68.1,68.1,2024-09-11 19:47:46.000,2024-09-11,2024,9,11,53874,[],()
82090,54067,20985,1,$32¢50,01/12/25 01:09:39 A.M.,NULL,3250.0,3250.0,3250.0,2025-01-12 01:09:39.000,2025-01-12,2025,1,12,54067,[],()
73563,54051,21015,2,$ 64.50,2025-03-06T03:48:41.536,,64.5,64.5,129.0,2025-03-06 03:48:41.536,2025-03-06,2025,3,6,53207,[],()
78535,54802,21280,1,USD19.5,"15-Feb-2025,05:23:13 A.M.",NULL,19.5,19.5,19.5,2025-02-15 05:23:13.000,2025-02-15,2025,2,15,54388,[],()
74191,54881,20996,1,47.25 USD,2024-04-13T16:17:42,,47.25,47.25,47.25,2024-04-13 16:17:42.000,2024-04-13,2024,4,13,54881,[],()
73732,54367,21302,1,USD21.5,2024-08-28T01:15:19.944,"66504 Leonardo Mount, South Nonashire, CO 63487",21.5,21.5,21.5,2024-08-28 01:15:19.944,2024-08-28,2024,8,28,54367,[],()
78756,53868,21374,1,USD 26.0,06/18/24 16:08:18,,26.0,26.0,26.0,2024-06-18 16:08:18.000,2024-06-18,2024,6,18,53868,[],()
82938,53718,21375,1,31.75 USD,2024-11-17T11:13:19,NULL,31.75,31.75,31.75,2024-11-17 11:13:19.000,2024-11-17,2024,11,17,53718,[],()
76526,55581,21020,1,€ 60.5,"04:00, 10-Dec-2024","Suite 570 3758 Rupert Loop, South Rhett, VA 25420",72.6,72.6,72.6,2024-12-10 04:00:00.000,2024-12-10,2024,12,10,55581,[],()
73543,55101,21570,3,50.5€,"01:43:38 P.M., 2024-11-15","Apt. 857 744 Roni Squares, New Bufordmouth, NE 50245-0058",60.599999999999994,60.599999999999994,181.8,2024-11-15 13:43:38.000,2024-11-15,2024,11,15,55101,[],()
81241,54048,21353,3,21.5USD,2025-05-17T09:17:37,,21.5,21.5,64.5,2025-05-17 09:17:37.000,2025-05-17,2025,5,17,54048,[],()
76549,53705,21016,2,USD 74.75,2025-03-29T09:14:38.558,NULL,74.75,74.75,149.5,2025-03-29 09:14:38.558,2025-03-29,2025,3,29,53705,[],()
81492,55384,21152,1,29.0USD,09/23/24;02:02:26 P.M.,"Suite 374 36712 Mohammad Port, North Elmo, NY 54707-6348",29.0,29.0,29.0,2024-09-23 14:02:26.000,2024-09-23,2024,9,23,55384,[],()
74541,54865,21612,2,64.99USD,"10/31/24, 02:36:13 P.M.",NULL,64.99,64.99,129.98,2024-10-31 14:36:13.000,2024-10-31,2024,10,31,54865,[],()
79354,53105,21417,2,USD 17.0,18:15;10/11/24,"Suite 247 31016 Greenfelder Land, North Cordell, OK 93296",17.0,17.0,34.0,2024-10-11 18:15:00.000,2024-10-11,2024,10,11,53105,[],()
80935,54592,21076,1,€52¢99,08:24:25 am 2025-02-09,NULL,6358.8,6358.8,6358.8,2025-02-09 08:24:25.000,2025-02-09,2025,2,9,54592,[],()
77648,53926,21386,1,$ 43,06/06/25;11:53:54,,43.0,43.0,43.0,2025-06-06 11:53:54.000,2025-06-06,2025,6,6,53926,[],()
74868,53024,21152,3,26.5 USD,10/25/24;06:27:06,NULL,26.5,26.5,79.5,2024-10-25 06:27:06.000,2024-10-25,2024,10,25,53024,[],()
78099,53233,21023,5,16.50 €,08/04/24;12:33:49 A.M.,,19.8,19.8,99.0,2024-08-04 00:33:49.000,2024-08-04,2024,8,4,53233,[],()
82445,55518,21090,1,47.0 USD,"18:43:52, 19-Apr-2025","Suite 553 943 Leo Wall, South Ferdinand, MO 69440-4449",47.0,47.0,47.0,2025-04-19 18:43:52.000,2025-04-19,2025,4,19,55518,[],()
81285,54896,21043,1,20. USD,08/10/24;19:55,,20.0,20.0,20.0,2024-08-10 19:55:00.000,2024-08-10,2024,8,10,54896,[],()
82744,53904,21218,4,44.0 €,2024-09-25T05:18:37,,52.8,52.8,211.2,2024-09-25 05:18:37.000,2024-09-25,2024,9,25,53904,[],()
81336,54909,21560,1,50.75EUR,"11/10/24, 23:09:53",,60.9,60.9,60.9,2024-11-10 23:09:53.000,2024-11-10,2024,11,10,54909,[],()
81462,53815,21535,1,EUR69.5,"17:52, 07/31/24","18927 Terry Gateway, Darellland, NY 91364-4953",83.39999999999999,83.39999999999999,83.4,2024-07-31 17:52:00.000,2024-07-31,2024,7,31,53815,[],()
78747,54027,21182,2,EUR66.99,"19-MAY-2024, 06:24:53 PM",NULL,80.38799999999999,80.38799999999999,160.78,2024-05-19 18:24:53.000,2024-05-19,2024,5,19,54027,[],()
75324,54856,21311,1,$21.50,2025-02-19T12:25:51,,21.5,21.5,21.5,2025-02-19 12:25:51.000,2025-02-19,2025,2,19,54856,[],()
76712,54342,21427,2,59.5 EUR,"01:57, 2025-01-06","Apt. 185 969 Grady Junctions, West Tinafort, KS 67931",71.39999999999999,71.39999999999999,142.8,2025-01-06 01:57:00.000,2025-01-06,2025,1,6,54342,[],()
77894,54353,21456,2,$ 54.0,09/02/24;06:13,,54.0,54.0,108.0,2024-09-02 06:13:00.000,2024-09-02,2024,9,2,54353,[],()
73632,54126,21645,1,53.0 €,"23:15:15,2025-02-19","8043 Jeffry Spring, Bradlyside, TN 37927",63.599999999999994,63.599999999999994,63.6,2025-02-19 23:15:15.000,2025-02-19,2025,2,19,54126,[],()
76880,55354,21382,1,71.99 €,"2024-12-10,10:49",NULL,86.38799999999999,86.38799999999999,86.39,2024-12-10 10:49:00.000,2024-12-10,2024,12,10,55354,[],()
79604,54051,21312,2,63.00 €,06:40 2025-06-07,NULL,75.6,75.6,151.2,2025-06-07 06:40:00.000,2025-06-07,2025,6,7,53207,[],()
81756,54977,21539,2,66.25 $,2024-10-09T08:52:06,,66.25,66.25,132.5,2024-10-09 08:52:06.000,2024-10-09,2024,10,9,54034,[],()
75789,53478,21360,1,USD45.99,03:45 2024-09-03,"Apt. 183 3675 Nienow Harbor, Brownfurt, WA 36824",45.99,45.99,45.99,2024-09-03 03:45:00.000,2024-09-03,2024,9,3,53478,[],()
74694,55336,21195,2,USD38.50,"02:40:46,2025-02-28",,38.5,38.5,77.0,2025-02-28 02:40:46.000,2025-02-28,2025,2,28,55336,[],()
79966,53560,21314,1,15.50 USD,"22:21:01,11-September-2025",,15.5,15.5,15.5,2025-09-11 22:21:01.000,2025-09-11,2025,9,11,53560,[],()
82761,55683,20989,2,68.$,"12/05/24, 07:00:14",,68.0,68.0,136.0,2024-12-05 07:00:14.000,2024-12-05,2024,12,5,55683,[],()
78638,53124,20925,1,41 €,"08/09/25,04:48:57 AM","36954 Jerry Path, New Kevenberg, MD 99418",49.199999999999996,49.199999999999996,49.2,2025-08-09 04:48:57.000,2025-08-09,2025,8,9,53124,[],()
81810,53828,21151,4,€36.5,2024-12-08;00:54:25,"Suite 797 6453 Hilpert Square, Nienowside, LA 21109-6617",43.8,43.8,175.2,2024-12-08 00:54:25.000,2024-12-08,2024,12,8,53828,[],()
77957,54733,21602,1,$70.0,2025-03-03T16:08:48.878,,70.0,70.0,70.0,2025-03-03 16:08:48.878,2025-03-03,2025,3,3,54733,[],()
76928,55280,21215,4,14$00¢, 5-March-2025 09:48,,1400.0,1400.0,5600.0,2025-03-05 09:48:00.000,2025-03-05,2025,3,5,55280,[],()
77627,54651,21579,3,$ 55.25,"01:21:50 AM,2024-09-21",,55.25,55.25,165.75,2024-09-21 01:21:50.000,2024-09-21,2024,9,21,54651,[],()
76974,53130,21579,1,€54.99,12/21/24 05:28:43 P.M.,"Suite 986 62772 Tatyana Port, McCulloughfort, MA 05722-8472",65.988,65.988,65.99,2024-12-21 17:28:43.000,2024-12-21,2024,12,21,53130,[],()
75535,55768,21177,2,€22¢99,"05:06, 6-July-2024",,2758.7999999999997,2758.7999999999997,5517.6,2024-07-06 05:06:00.000,2024-07-06,2024,7,6,55768,[],()
76611,53642,20949,1,USD49.25,"03/04/25,10:07","16524 Arturo Burgs, Denverport, ME 05046",49.25,49.25,49.25,2025-03-04 10:07:00.000,2025-03-04,2025,3,4,53642,[],()
81250,54544,21245,2,47USD,12:53:24 PM;18-December-2024,,47.0,47.0,94.0,2024-12-18 12:53:24.000,2024-12-18,2024,12,18,54544,[],()
81328,53654,20995,2,$51¢99,"2024-10-16, 15:25",NULL,5199.0,5199.0,10398.0,2024-10-16 15:25:00.000,2024-10-16,2024,10,16,53654,[],()
79163,54202,21269,1,$ 36.99,24-Apr-2024 07:45:30,"799 Lesch Lakes, Port Simoneland, KY 92472-8071",36.99,36.99,36.99,2024-04-24 07:45:30.000,2024-04-24,2024,4,24,54202,[],()
78983,55284,21339,1,€ 71.75,2024-08-20T13:36:19,,86.1,86.1,86.1,2024-08-20 13:36:19.000,2024-08-20,2024,8,20,55284,[],()
76542,55504,21538,3,EUR 70.0,12/27/24 08:33,"Apt. 647 7640 Swift Mountain, Dorthyport, WI 35101-7979",84.0,84.0,252.0,2024-12-27 08:33:00.000,2024-12-27,2024,12,27,55504,[],()
76995,53702,21015,1,61.5 $,04:27:11 P.M. 2024-10-06,,61.5,61.5,61.5,2024-10-06 16:27:11.000,2024-10-06,2024,10,6,53702,[],()
75529,53804,21403,1,EUR 26.25,04:00:36 2024-08-20,,31.5,31.5,31.5,2024-08-20 04:00:36.000,2024-08-20,2024,8,20,53804,[],()
76820,54104,21315,1,$ 65.25,"15-Oct-2024,10:19:10 P.M.","Apt. 558 7552 Ryan Inlet, Margretfurt, CO 95701",65.25,65.25,65.25,2024-10-15 22:19:10.000,2024-10-15,2024,10,15,54188,[],()
79526,55605,20993,1,25.25 USD,12:11:24 am; 3-Mar-2025,,25.25,25.25,25.25,2025-03-03 00:11:24.000,2025-03-03,2025,3,3,55605,[],()
79217,55243,21100,1,$22.25,2025-01-17T10:55:52.349,,22.25,22.25,22.25,2025-01-17 10:55:52.349,2025-01-17,2025,1,17,55243,[],()
74050,54483,21137,1,47.00USD,Fri Aug 16 19:48:15 2024,NULL,47.0,47.0,47.0,2024-08-16 19:48:15.000,2024-08-16,2024,8,16,54483,[],()
80325,55121,21320,2,$ 33.99,"22-APR-2025, 02:33:30 pm","26587 Klein Meadows, Samuelshire, WA 70041-2564",33.99,33.99,67.98,2025-04-22 14:33:30.000,2025-04-22,2025,4,22,55121,[],()
76682,54794,21177,1,24.75 $,25-MAY-2025 23:41:45,,24.75,24.75,24.75,2025-05-25 23:41:45.000,2025-05-25,2025,5,25,54794,[],()
82080,53993,21536,1,EUR69.25,27-NOV-2024;00:06:55,NULL,83.1,83.1,83.1,2024-11-27 00:06:55.000,2024-11-27,2024,11,27,53993,[],()
80864,54475,21212,1,USD35.50,"09/27/24,03:41:24 AM",NULL,35.5,35.5,35.5,2024-09-27 03:41:24.000,2024-09-27,2024,9,27,54475,[],()
81712,53941,21222,1,USD75.0,"08:10:08 A.M.,11/04/24",,75.0,75.0,75.0,2024-11-04 08:10:08.000,2024-11-04,2024,11,4,53941,[],()
78300,54379,21196,1,39.5 $,08/24/24;15:43,,39.5,39.5,39.5,2024-08-24 15:43:00.000,2024-08-24,2024,8,24,54379,[],()
78480,53297,21315,1,EUR 61.75,"14:13:44,2024-11-08",,74.1,74.1,74.1,2024-11-08 14:13:44.000,2024-11-08,2024,11,8,53297,[],()
74364,55067,21400,2,USD44.25,"03:01:34 pm,08/22/24","900 Nathanael Pines, Mosciskiside, WA 47992-6073",44.25,44.25,88.5,2024-08-22 15:01:34.000,2024-08-22,2024,8,22,55067,[],()
76551,55243,21033,1,68 $,"31-JUL-2025, 13:47",,68.0,68.0,68.0,2025-07-31 13:47:00.000,2025-07-31,2025,7,31,55243,[],()
79258,54325,21136,1,75.99€,"2025-07-01, 04:59:43 A.M.",,91.18799999999999,91.18799999999999,91.19,2025-07-01 04:59:43.000,2025-07-01,2025,7,1,54325,[],()
73964,55253,21138,1,38.75 USD,03:55:59;2024-07-28,,38.75,38.75,38.75,2024-07-28 03:55:59.000,2024-07-28,2024,7,28,55253,[],()
80028,53449,21463,1,$ 75.0," 5-Nov-2024, 14:10:36",NULL,75.0,75.0,75.0,2024-11-05 14:10:36.000,2024-11-05,2024,11,5,53449,[],()
73893,55639,20978,4,€55¢75,"09:52:58 A.M., 28-Apr-2024","Suite 784 683 Lean Radial, South Shane, VT 51021-6977",6690.0,6690.0,26760.0,2024-04-28 09:52:58.000,2024-04-28,2024,4,28,55639,[],()
81894,54083,21514,1,EUR37.0,18:40:12;07/24/24,,44.4,44.4,44.4,2024-07-24 18:40:12.000,2024-07-24,2024,7,24,54083,[],()
82010,53368,21295,1,$14.5,19-FEB-2025;10:21:57 AM,,14.5,14.5,14.5,2025-02-19 10:21:57.000,2025-02-19,2025,2,19,53368,[],()
73494,54468,20930,1,$37¢50,2025-01-14T05:27:10.887,,3750.0,3750.0,3750.0,2025-01-14 05:27:10.887,2025-01-14,2025,1,14,54468,[],()
77473,55512,21104,3,21.5EUR,"06:29, 05/13/25","Apt. 615 492 Dale Pike, East Angilabury, UT 35505-3234",25.8,25.8,77.4,2025-05-13 06:29:00.000,2025-05-13,2025,5,13,55512,[],()
82124,54088,21638,1,59.75$,2024-09-08T12:55:30.211,NULL,59.75,59.75,59.75,2024-09-08 12:55:30.211,2024-09-08,2024,9,8,54088,[],()
74287,53376,21384,1,USD 51.25,"29-March-2025,00:06",,51.25,51.25,51.25,2025-03-29 00:06:00.000,2025-03-29,2025,3,29,53376,[],()
78583,54147,21435,2,USD58.50,2024-04-11T13:58:25,NULL,58.5,58.5,117.0,2024-04-11 13:58:25.000,2024-04-11,2024,4,11,54147,[],()
80991,53501,21439,1,43.00 $,"08:19:10, 7-June-2024",,43.0,43.0,43.0,2024-06-07 08:19:10.000,2024-06-07,2024,6,7,53501,[],()
73341,55053,21496,2,$ 26.00,"2025-01-21,02:25",NULL,26.0,26.0,52.0,2025-01-21 02:25:00.000,2025-01-21,2025,1,21,55053,[],()
75821,53991,21611,1,USD 64.00,"01:58:09, 19-AUG-2024",NULL,64.0,64.0,64.0,2024-08-19 01:58:09.000,2024-08-19,2024,8,19,53991,[],()
82328,54115,20939,1,$ 69.5,Sat Sep 21 01:54:45 2024,NULL,69.5,69.5,69.5,2024-09-21 01:54:45.000,2024-09-21,2024,9,21,54115,[],()
80940,53886,21547,1,USD20.75,19-SEP-2024;04:41,NULL,20.75,20.75,20.75,2024-09-19 04:41:00.000,2024-09-19,2024,9,19,53886,[],()
75792,55661,20985,2,$32¢25,"11/03/24,01:42:56 am","Apt. 228 97296 Walton Wall, Marcborough, AR 24011-7896",3225.0,3225.0,6450.0,2024-11-03 01:42:56.000,2024-11-03,2024,11,3,55661,[],()
75172,55581,21353,2,21.25 USD,28.11.2024 00:19:19,,21.25,21.25,42.5,2024-11-28 00:19:19.000,2024-11-28,2024,11,28,55581,[],()
81985,55033,21462,1,26€50¢,"05:48:53 AM,  9-SEP-2024",NULL,3180.0,3180.0,3180.0,2024-09-09 05:48:53.000,2024-09-09,2024,9,9,55033,[],()
75237,55531,21308,1,$ 60.5,2025-03-09 10:26:42 pm,,60.5,60.5,60.5,2025-03-09 22:26:42.000,2025-03-09,2025,3,9,55531,[],()
82665,53171,20969,1,18.00$,13-Jan-2025 02:45:59,NULL,18.0,18.0,18.0,2025-01-13 02:45:59.000,2025-01-13,2025,1,13,53171,[],()
79259,54009,21578,1,43.50 $,"17:21,2025-03-17",,43.5,43.5,43.5,2025-03-17 17:21:00.000,2025-03-17,2025,3,17,54009,[],()
81383,55461,21227,1,USD72.50, 4-Jun-2025 13:53:59,"149 Bradtke Stream, South Alden, OR 91352",72.5,72.5,72.5,2025-06-04 13:53:59.000,2025-06-04,2025,6,4,55461,[],()
83013,55787,21385,1,$ 22.25,02:55 2025-02-16,,22.25,22.25,22.25,2025-02-16 02:55:00.000,2025-02-16,2025,2,16,55787,[],()
80476,53838,21301,1,USD 61.99,12/20/24 09:02,NULL,61.99,61.99,61.99,2024-12-20 09:02:00.000,2024-12-20,2024,12,20,53838,[],()
73849,55244,21653,2,41.99 $,"20:43, 2024-10-04","Apt. 376 4498 Teddy Lodge, Julianland, OK 86883",41.99,41.99,83.98,2024-10-04 20:43:00.000,2024-10-04,2024,10,4,54374,[],()
79531,53481,21574,4,22.25USD, 9-APR-2024 14:09,,22.25,22.25,89.0,2024-04-09 14:09:00.000,2024-04-09,2024,4,9,53481,[],()
79813,53715,21366,1,€ 57.0,"17:05:17, 1-January-2025",,68.39999999999999,68.39999999999999,68.4,2025-01-01 17:05:17.000,2025-01-01,2025,1,1,53715,[],()
80951,53129,21222,1,USD 70.0,"02/20/25,14:18",,70.0,70.0,70.0,2025-02-20 14:18:00.000,2025-02-20,2025,2,20,53129,[],()
76100,53697,20922,1,66$25¢,07:24;02/13/25,,6625.0,6625.0,6625.0,2025-02-13 07:24:00.000,2025-02-13,2025,2,13,53697,[],()
82202,53428,21413,1,USD 59.50,01:26:40;28-Aug-2024,,59.5,59.5,59.5,2024-08-28 01:26:40.000,2024-08-28,2024,8,28,53428,[],()
78385,54619,21270,1,€ 71.5,"11/28/24, 03:44","Suite 553 92414 Hosea Hills, Rueckerton, AZ 74533",85.8,85.8,85.8,2024-11-28 03:44:00.000,2024-11-28,2024,11,28,54619,[],()
75430,54407,21051,1,€68.75,Wed Jan 29 13:15:26 2025,,82.5,82.5,82.5,2025-01-29 13:15:26.000,2025-01-29,2025,1,29,54407,[],()
77059,54667,21196,1,€ 38.5,"25-MAR-2025,22:19","Suite 670 3756 Mertz Points, Jerrellshire, CO 88393-1348",46.199999999999996,46.199999999999996,46.2,2025-03-25 22:19:00.000,2025-03-25,2025,3,25,54667,[],()
73710,54718,21453,1,EUR66.99,16:55;21-NOV-2024,,80.38799999999999,80.38799999999999,80.39,2024-11-21 16:55:00.000,2024-11-21,2024,11,21,54718,[],()
73343,55456,20993,2,28.00 $,08:11:09 PM 2024-08-25,"Apt. 323 71989 Sonia Wall, Abbottburgh, MN 84516-6210",28.0,28.0,56.0,2024-08-25 20:11:09.000,2024-08-25,2024,8,25,55456,[],()
79408,55042,21150,1,EUR 66.0,2025-09-22;18:42,"Suite 932 37015 Cormier Knolls, North Arnettachester, ME 62955-1053",79.2,79.2,79.2,2025-09-22 18:42:00.000,2025-09-22,2025,9,22,55042,[],()
75625,55731,21029,1,€ 48.75,"30-June-2024, 06:32:23 A.M.",,58.5,58.5,58.5,2024-06-30 06:32:23.000,2024-06-30,2024,6,30,55731,[],()
73669,54673,21605,3,USD 25.75,20:21:53;17-July-2024,,25.75,25.75,77.25,2024-07-17 20:21:53.000,2024-07-17,2024,7,17,54673,[],()
76498,53020,21252,1,USD 51.50,00:27:58 2024-12-22,,51.5,51.5,51.5,2024-12-22 00:27:58.000,2024-12-22,2024,12,22,53020,[],()
75089,53447,21215,2,USD 14.5,"11:17,02/08/25","Suite 644 704 Johnny Trail, Augustville, MN 26310",14.5,14.5,29.0,2025-02-08 11:17:00.000,2025-02-08,2025,2,8,53447,[],()
76631,53570,21088,1,€57.,2024-04-11T12:05:24,NULL,68.39999999999999,68.39999999999999,68.4,2024-04-11 12:05:24.000,2024-04-11,2024,4,11,53570,[],()
78155,54309,20995,1,49$,"2025-06-08, 05:45:03",NULL,49.0,49.0,49.0,2025-06-08 05:45:03.000,2025-06-08,2025,6,8,54309,[],()
80711,54069,20973,1,26.USD,"11:56, 2025-06-25",,26.0,26.0,26.0,2025-06-25 11:56:00.000,2025-06-25,2025,6,25,54069,[],()
78569,55718,21531,1,55.5$," 3-Feb-2025,21:10:56",,55.5,55.5,55.5,2025-02-03 21:10:56.000,2025-02-03,2025,2,3,55718,[],()
76728,54057,21537,2,USD 19.50,16:54 2024-08-22,"794 Veum Mews, Boganside, NH 20021",19.5,19.5,39.0,2024-08-22 16:54:00.000,2024-08-22,2024,8,22,54057,[],()
78358,54298,21314,1,13. $,2024-12-16T07:42:44,,13.0,13.0,13.0,2024-12-16 07:42:44.000,2024-12-16,2024,12,16,54298,[],()
74107,53570,21305,3,USD48.0,04:06 08/05/24,"99485 Kunde Forks, West Julesstad, OK 18306",48.0,48.0,144.0,2024-08-05 04:06:00.000,2024-08-05,2024,8,5,53570,[],()
79225,54019,21513,1,USD40.0,2024-07-11T19:46:14,,40.0,40.0,40.0,2024-07-11 19:46:14.000,2024-07-11,2024,7,11,54019,[],()
79699,55051,21386,1,$ 46.0,"01:32, 2025-02-08","Suite 912 3035 Dorian Skyway, Juliettabury, AR 23448",46.0,46.0,46.0,2025-02-08 01:32:00.000,2025-02-08,2025,2,8,55051,[],()
79138,53291,21230,5,26.50 EUR,06:56:13 A.M.;2025-02-06,NULL,31.799999999999997,31.799999999999997,159.0,2025-02-06 06:56:13.000,2025-02-06,2025,2,6,53291,[],()
73746,53739,21191,1,USD 46.75," 7-Jul-2024, 04:37:14","648 Isreal Path, Lake Jeanenemouth, NJ 20448",46.75,46.75,46.75,2024-07-07 04:37:14.000,2024-07-07,2024,7,7,55079,[],()
78774,54508,21259,5,$28.75,17-Aug-2024;09:15:37 PM,"10894 Joel Point, East Lucienport, MS 68846",28.75,28.75,143.75,2024-08-17 21:15:37.000,2024-08-17,2024,8,17,54508,[],()
79444,54287,21256,1,59.75 EUR,2025-06-07T03:22:56,,71.7,71.7,71.7,2025-06-07 03:22:56.000,2025-06-07,2025,6,7,54287,[],()
74051,55541,21192,1,72.25$,"12:10:55 P.M., 10/15/25",,72.25,72.25,72.25,2025-10-15 12:10:55.000,2025-10-15,2025,10,15,55541,[],()
79077,53397,21592,5,26€50¢,"2024-07-30,03:24:54 A.M.",NULL,3180.0,3180.0,15900.0,2024-07-30 03:24:54.000,2024-07-30,2024,7,30,53397,[],()
81821,53886,21175,1,USD24.,"23-AUG-2025, 03:11:13 PM",,24.0,24.0,24.0,2025-08-23 15:11:13.000,2025-08-23,2025,8,23,53886,[],()
75902,55338,20938,1,23.75 €,28-April-2025;04:39:20 AM,"Apt. 548 8876 Israel Wells, Mabelleport, WY 32245-3275",28.5,28.5,28.5,2025-04-28 04:39:20.000,2025-04-28,2025,4,28,55338,[],()
80830,53511,21020,2,€63¢00,2024-11-01T18:16:42.750,,7560.0,7560.0,15120.0,2024-11-01 18:16:42.750,2024-11-01,2024,11,1,53511,[],()
79310,53340,21648,2,USD29.25,"11/21/24, 03:53:19 AM",,29.25,29.25,58.5,2024-11-21 03:53:19.000,2024-11-21,2024,11,21,53340,[],()
76352,55207,21224,1,$ 62.99,Fri Nov  8 00:07:53 2024,NULL,62.99,62.99,62.99,2024-11-08 00:07:53.000,2024-11-08,2024,11,8,55207,[],()
75833,53208,21315,1,61$,"11:31,01/26/25","582 Philip Lane, Floydton, NM 35075",61.0,61.0,61.0,2025-01-26 11:31:00.000,2025-01-26,2025,1,26,53208,[],()
79793,53849,21577,1,22$00¢,"05/24/24,04:19:13 PM",,2200.0,2200.0,2200.0,2024-05-24 16:19:13.000,2024-05-24,2024,5,24,53849,[],()
73358,53443,21524,1,€64.99,"17:16, 26-August-2024",NULL,77.98799999999999,77.98799999999999,77.99,2024-08-26 17:16:00.000,2024-08-26,2024,8,26,53443,[],()
73634,54468,21092,1,31.25 USD,00:06:57;07/09/24,,31.25,31.25,31.25,2024-07-09 00:06:57.000,2024-07-09,2024,7,9,54468,[],()
75920,55360,21127,1,EUR55.99,"03/17/25, 04:47:22",NULL,67.188,67.188,67.19,2025-03-17 04:47:22.000,2025-03-17,2025,3,17,55360,[],()
81866,53230,21314,2,14.25USD,2024-06-09T19:44:05,,14.25,14.25,28.5,2024-06-09 19:44:05.000,2024-06-09,2024,6,9,53230,[],()
77395,53125,21605,1,23. USD,2025-01-01T11:34:18.782,NULL,23.0,23.0,23.0,2025-01-01 11:34:18.782,2025-01-01,2025,1,1,53125,[],()
80014,55330,21012,2,59€,"2025-02-25, 22:06:59",,70.8,70.8,141.6,2025-02-25 22:06:59.000,2025-02-25,2025,2,25,55330,[],()
81261,55342,21083,2,USD23.,"04/09/25, 12:16",,23.0,23.0,46.0,2025-04-09 12:16:00.000,2025-04-09,2025,4,9,55342,[],()
80910,53177,21403,1,27.5 €,2025-05-20T17:53:19.911,NULL,33.0,33.0,33.0,2025-05-20 17:53:19.911,2025-05-20,2025,5,20,53177,[],()
75510,54511,21341,1,€ 52.25,2024-09-29T00:05:19,"68869 Marcellus Loop, Port Janland, ND 09437-8198",62.699999999999996,62.699999999999996,62.7,2024-09-29 00:05:19.000,2024-09-29,2024,9,29,54511,[],()
79623,54334,21102,4,EUR53.,2025-03-21T05:52:20.157,,63.599999999999994,63.599999999999994,254.4,2025-03-21 05:52:20.157,2025-03-21,2025,3,21,54334,[],()
77115,53786,21597,1,USD32.99,06/07/24 04:10,NULL,32.99,32.99,32.99,2024-06-07 04:10:00.000,2024-06-07,2024,6,7,53786,[],()
78990,55596,21260,1,$52.25,"07/11/24,00:20:08",,52.25,52.25,52.25,2024-07-11 00:20:08.000,2024-07-11,2024,7,11,55596,[],()
77352,55259,21484,1,55.00 €,2024-11-02T08:14:19.703,,66.0,66.0,66.0,2024-11-02 08:14:19.703,2024-11-02,2024,11,2,55259,[],()
80312,55074,21150,1,63.50USD," 2-January-2025,07:03:43 P.M.",NULL,63.5,63.5,63.5,2025-01-02 19:03:43.000,2025-01-02,2025,1,2,55074,[],()
79248,53548,20991,2,39.0$,"04:16,2024-04-25","7427 Odis Drive, Sherriborough, MO 98634",39.0,39.0,78.0,2024-04-25 04:16:00.000,2024-04-25,2024,4,25,53548,[],()
82424,53922,21142,1,USD 37.00,"09/16/24,08:01:54 PM","Suite 116 291 Bosco Highway, Gutmannborough, WA 46278-6669",37.0,37.0,37.0,2024-09-16 20:01:54.000,2024-09-16,2024,9,16,53922,[],()
