id,user_id,book_id,quantity,unit_price,timestamp_raw,shipping,unit_price_clean,unit_price_usd,paid_price,timestamp_parsed,date,year,month,day,cluster_id,authors,author_set
80941,47864,21550,1,67.0 €,2025-01-11 09:50:11 PM,,80.39999999999999,80.39999999999999,80.4,2025-01-11 21:50:11.000,2025-01-11,2025,1,11,47864,[],()
81245,47864,22052,2,EUR26.99,2024-03-27T07:46:55.055,,32.388,32.388,64.78,2024-03-27 07:46:55.055,2024-03-27,2024,3,27,47864,[],()
78477,48918,21367,1,30 $,"11:17:51 PM, 29-JUN-2025",,30.0,30.0,30.0,2025-06-29 23:17:51.000,2025-06-29,2025,6,29,48918,[],()
86303,48092,21724,1,18 $,09:29;11/06/24,,18.0,18.0,18.0,2024-11-06 09:29:00.000,2024-11-06,2024,11,6,48092,[],()
81990,48418,21441,1,USD 24.99,2024-09-16;03:05:39 pm,,24.99,24.99,24.99,2024-09-16 15:05:39.000,2024-09-16,2024,9,16,48932,[],()
82785,50265,21459,2,41.50$,2024-06-29T00:13:48.016,,41.5,41.5,83.0,2024-06-29 00:13:48.016,2024-06-29,2024,6,29,50265,[],()
84594,49429,21598,1,19.99 $," 6-JUL-2024,15:27",NULL,19.99,19.99,19.99,2024-07-06 15:27:00.000,2024-07-06,2024,7,6,49429,[],()
86155,49965,21752,1,61.99 $,"11:28:42 AM, 2025-01-08",,61.99,61.99,61.99,2025-01-08 11:28:42.000,2025-01-08,2025,1,8,49965,[],()
82478,50188,21587,1,69.5$,2024-11-08T02:05:08.703,,69.5,69.5,69.5,2024-11-08 02:05:08.703,2024-11-08,2024,11,8,50188,[],()
80811,50433,21899,1,66.99 €,"04:51:52,08/18/24",,80.38799999999999,80.38799999999999,80.39,2024-08-18 04:51:52.000,2024-08-18,2024,8,18,50433,[],()
80319,48403,21729,1,44.99$,21:01;2025-02-22,"605 Durgan Corner, New Marcos, PA 20319-6778",44.99,44.99,44.99,2025-02-22 21:01:00.000,2025-02-22,2025,2,22,48403,[],()
81678,50160,21892,1,USD24.5,"2025-01-31, 15:55:19",NULL,24.5,24.5,24.5,2025-01-31 15:55:19.000,2025-01-31,2025,1,31,50160,[],()
78241,50620,21794,2,$ 32.25,"03:33:23,2025-02-11",NULL,32.25,32.25,64.5,2025-02-11 03:33:23.000,2025-02-11,2025,2,11,50620,[],()
78614,47795,21803,1,$49.50,22-JAN-2025 09:29:50 pm,NULL,49.5,49.5,49.5,2025-01-22 21:29:50.000,2025-01-22,2025,1,22,47795,[],()
84345,50838,21832,1,32.50$,2025-03-21;22:09, ,32.5,32.5,32.5,2025-03-21 22:09:00.000,2025-03-21,2025,3,21,50838,[],()
80911,49908,21881,1,63.5$,2024-08-27T08:15:41.056,NULL,63.5,63.5,63.5,2024-08-27 08:15:41.056,2024-08-27,2024,8,27,49908,[],()
79692,49610,21675,1,USD 18.50,"01:47:03 am,2024-11-04",NULL,18.5,18.5,18.5,2024-11-04 01:47:03.000,2024-11-04,2024,11,4,49333,[],()
81095,50016,21374,1,EUR 71.99,"2025-07-21,10:40:41 pm",NULL,86.38799999999999,86.38799999999999,86.39,2025-07-21 22:40:41.000,2025-07-21,2025,7,21,50016,[],()
79587,49751,21339,4,$ 65.0,16:03 12/04/24,,65.0,65.0,260.0,2024-12-04 16:03:00.000,2024-12-04,2024,12,4,49751,[],()
82696,50196,21584,1,€43¢75,"16:05:16, 6-November-2024",NULL,5250.0,5250.0,5250.0,2024-11-06 16:05:16.000,2024-11-06,2024,11,6,50196,[],()
83541,50147,21816,2,70$50¢,"11:45:28, 03/06/25","Suite 772 5259 Ozie Summit, Cummerataview, IN 87860",7050.0,7050.0,14100.0,2025-03-06 11:45:28.000,2025-03-06,2025,3,6,50147,[],()
77673,50860,21475,1,26.00 $,04/16/25;08:36:11 A.M.,,26.0,26.0,26.0,2025-04-16 08:36:11.000,2025-04-16,2025,4,16,50860,[],()
85884,49197,21976,1,29.00EUR,"2024-09-05,07:02",,34.8,34.8,34.8,2024-09-05 07:02:00.000,2024-09-05,2024,9,5,49197,[],()
82744,50498,21491,1,30 USD,08:57:54;10-Sep-2024,NULL,30.0,30.0,30.0,2024-09-10 08:57:54.000,2024-09-10,2024,9,10,50498,[],()
80411,48273,22026,2,$ 57.50,13:50 12/07/24,NULL,57.5,57.5,115.0,2024-12-07 13:50:00.000,2024-12-07,2024,12,7,48273,[],()
80497,48726,21543,1,EUR 53.25,"03:29:22 P.M., 10-Apr-2025",,63.9,63.9,63.9,2025-04-10 15:29:22.000,2025-04-10,2025,4,10,48726,[],()
83693,50758,21777,1,€31.50,"02/05/25,16:14:04",NULL,37.8,37.8,37.8,2025-02-05 16:14:04.000,2025-02-05,2025,2,5,50758,[],()
86357,49125,21573,2,USD28.00,10:30:57 08/24/24,"78346 Edmundo Heights, Huelshire, VA 41518-0607",28.0,28.0,56.0,2024-08-24 10:30:57.000,2024-08-24,2024,8,24,49125,[],()
83599,47733,22055,1,USD 55.50,2024-08-24;08:24:59,,55.5,55.5,55.5,2024-08-24 08:24:59.000,2024-08-24,2024,8,24,47733,[],()
85921,48883,22033,1,48.75 USD,2024-04-02T15:37:20.585,,48.75,48.75,48.75,2024-04-02 15:37:20.585,2024-04-02,2024,4,2,48883,[],()
78452,48120,21394,1,$68¢50,2025-03-31 22:13,NULL,6850.0,6850.0,6850.0,2025-03-31 22:13:00.000,2025-03-31,2025,3,31,48120,[],()
78567,49847,21824,1,59 $,"06:02:55 AM,18-AUG-2024",,59.0,59.0,59.0,2024-08-18 06:02:55.000,2024-08-18,2024,8,18,49847,[],()
81760,49820,22034,1,75.75 $,2024-11-01 07:49:27 A.M.,,75.75,75.75,75.75,2024-11-01 07:49:27.000,2024-11-01,2024,11,1,49820,[],()
86115,48338,21596,1,$36.25,"13:06,10-JUL-2024",NULL,36.25,36.25,36.25,2024-07-10 13:06:00.000,2024-07-10,2024,7,10,48338,[],()
83127,49203,22008,1,66.75 $,2024-11-01;13:56:17,NULL,66.75,66.75,66.75,2024-11-01 13:56:17.000,2024-11-01,2024,11,1,49203,[],()
79078,48803,21321,1,USD 68.50,"05:32:32 P.M.,14-Jan-2025",,68.5,68.5,68.5,2025-01-14 17:32:32.000,2025-01-14,2025,1,14,48803,[],()
82188,48744,21486,3,€ 25.50,"19:44:52, 12/23/24","70939 Lloyd Fall, Dooleybury, CO 89886",30.599999999999998,30.599999999999998,91.8,2024-12-23 19:44:52.000,2024-12-23,2024,12,23,48744,[],()
85506,50199,22035,3,USD34," 3-June-2025, 11:53:37 AM",,34.0,34.0,102.0,2025-06-03 11:53:37.000,2025-06-03,2025,6,3,50199,[],()
83638,47781,21963,1,38.25USD,08/10/24 23:23,"Suite 852 6071 Frami Grove, Lake Refugiofurt, MI 42887",38.25,38.25,38.25,2024-08-10 23:23:00.000,2024-08-10,2024,8,10,47781,[],()
81421,49252,21481,2,$ 22.25,"21:51, 2025-07-18","7358 Syreeta Prairie, New Pamelabury, DE 91542",22.25,22.25,44.5,2025-07-18 21:51:00.000,2025-07-18,2025,7,18,49252,[],()
84980,49584,21502,2,67.0 USD,2025-04-03 06:29,,67.0,67.0,134.0,2025-04-03 06:29:00.000,2025-04-03,2025,4,3,49584,[],()
83383,50284,21478,2,47.99 USD,Thu Mar 20 05:57:41 2025,NULL,47.99,47.99,95.98,2025-03-20 05:57:41.000,2025-03-20,2025,3,20,50284,[],()
79354,48473,21445,1,USD 18.25,13:00 01/05/25,,18.25,18.25,18.25,2025-01-05 13:00:00.000,2025-01-05,2025,1,5,48473,[],()
78989,50814,22003,1,€57¢25,"18-Nov-2024, 00:04",,6870.0,6870.0,6870.0,2024-11-18 00:04:00.000,2024-11-18,2024,11,18,50814,[],()
79163,50262,21671,1,38.99USD,01:18:27 2024-09-25,NULL,38.99,38.99,38.99,2024-09-25 01:18:27.000,2024-09-25,2024,9,25,50660,[],()
80696,50380,21734,1,$52.75,13:14;2024-08-24,,52.75,52.75,52.75,2024-08-24 13:14:00.000,2024-08-24,2024,8,24,50380,[],()
80970,50465,21914,1,USD70.50,"12/28/24,05:18:09",,70.5,70.5,70.5,2024-12-28 05:18:09.000,2024-12-28,2024,12,28,50465,[],()
77932,48130,21640,1,$42.99,01:10:58 P.M. 2024-09-12,"Suite 969 7846 Rocio Rue, Dachchester, HI 26095-4420",42.99,42.99,42.99,2024-09-12 13:10:58.000,2024-09-12,2024,9,12,48130,[],()
85202,50574,21342,1,$ 60.00,"17:09,2025-03-02",,60.0,60.0,60.0,2025-03-02 17:09:00.000,2025-03-02,2025,3,2,50574,[],()
82723,48276,21490,2,66. $,11:45:59 pm 04/09/24,"Apt. 429 33804 Kathryn Mountains, Joanaburgh, MA 37568-5100",66.0,66.0,132.0,2024-04-09 23:45:59.000,2024-04-09,2024,4,9,48276,[],()
84301,49810,21541,2,USD 36.75,2024-11-14;11:28:01 pm, ,36.75,36.75,73.5,2024-11-14 23:28:01.000,2024-11-14,2024,11,14,49810,[],()
81900,47861,21968,1,$21.50,2024-07-08T15:54:03.687,,21.5,21.5,21.5,2024-07-08 15:54:03.687,2024-07-08,2024,7,8,47861,[],()
79808,50485,21730,2,36. USD,2024-12-27T19:57:22,,36.0,36.0,72.0,2024-12-27 19:57:22.000,2024-12-27,2024,12,27,50485,[],()
80632,50264,21866,1,39.5 EUR,10.02.2025 11:08:08,,47.4,47.4,47.4,2025-10-02 11:08:08.000,2025-10-02,2025,10,2,50264,[],()
79118,49855,21875,1,47.75 $,2024-07-20T05:28:43,NULL,47.75,47.75,47.75,2024-07-20 05:28:43.000,2024-07-20,2024,7,20,49855,[],()
86018,48325,21891,4,$65.75, 5.01.2025  1:19:19,NULL,65.75,65.75,263.0,2025-05-01 01:19:19.000,2025-05-01,2025,5,1,48325,[],()
84510,50205,21738,1,€ 42.75,"01/25/25, 05:42:32",,51.3,51.3,51.3,2025-01-25 05:42:32.000,2025-01-25,2025,1,25,50205,[],()
78479,49638,21306,1,50.0 $,01:14:38 am; 2-December-2024,NULL,50.0,50.0,50.0,2024-12-02 01:14:38.000,2024-12-02,2024,12,2,49638,[],()
79406,48453,21802,1,43.00 USD,20-Apr-2025;04:42:17 PM,,43.0,43.0,43.0,2025-04-20 16:42:17.000,2025-04-20,2025,4,20,48453,[],()
82487,48591,21591,1,$50.0,14-July-2025 09:26:42 PM,"Apt. 659 83330 Schmeler Lodge, Napoleonborough, CO 90847-5961",50.0,50.0,50.0,2025-07-14 21:26:42.000,2025-07-14,2025,7,14,48591,[],()
78571,50095,21328,2,63.5USD,"11:01:40 A.M.,20-November-2024",,63.5,63.5,127.0,2024-11-20 11:01:40.000,2024-11-20,2024,11,20,50095,[],()
77998,48686,21614,1,EUR 51.75,"2024-10-11,01:30:29 A.M.",,62.099999999999994,62.099999999999994,62.1,2024-10-11 01:30:29.000,2024-10-11,2024,10,11,48686,[],()
84704,48082,21888,1,$ 73.99,12.01.2025  5:34:34,,73.99,73.99,73.99,2025-12-01 05:34:34.000,2025-12-01,2025,12,1,48082,[],()
83330,49774,21327,1,EUR20.99,"2024-08-07,05:12:59 am","Apt. 325 62226 Friesen Crossing, Douglaschester, WA 60351",25.188,25.188,25.19,2024-08-07 05:12:59.000,2024-08-07,2024,8,7,49774,[],()
81373,48146,21789,2,€25.00,2025-03-21T10:55:16.690,"Suite 229 8016 Clifton Mission, East Ianburgh, OR 94196-5070",30.0,30.0,60.0,2025-03-21 10:55:16.690,2025-03-21,2025,3,21,48146,[],()
85584,50335,21807,2,EUR 33.00,18:56:23;07/12/24,,39.6,39.6,79.2,2024-07-12 18:56:23.000,2024-07-12,2024,7,12,50335,[],()
83019,48576,21610,2,56.0 EUR,"11:23:27 AM,04/26/24",NULL,67.2,67.2,134.4,2024-04-26 11:23:27.000,2024-04-26,2024,4,26,48576,[],()
82291,48726,21337,1,USD37.25,2024-10-21T06:59:40.808,,37.25,37.25,37.25,2024-10-21 06:59:40.808,2024-10-21,2024,10,21,48726,[],()
81438,50887,21963,1,40.75€,10/14/25;19:06,NULL,48.9,48.9,48.9,2025-10-14 19:06:00.000,2025-10-14,2025,10,14,50887,[],()
80865,48813,21767,1,USD 31.5,"07:40:14,2024-10-10",,31.5,31.5,31.5,2024-10-10 07:40:14.000,2024-10-10,2024,10,10,48813,[],()
85381,48441,21799,1,28.0EUR,12:31;30-Aug-2024,,33.6,33.6,33.6,2024-08-30 12:31:00.000,2024-08-30,2024,8,30,48441,[],()
83560,49965,21788,1,21.0 EUR,2024-12-25T10:10:52,"Suite 539 278 Lida Rapids, Lake Coltonport, IA 27687-9720",25.2,25.2,25.2,2024-12-25 10:10:52.000,2024-12-25,2024,12,25,49965,[],()
79948,48796,21322,1,32.75 USD,2024-06-17T23:34:10.436,,32.75,32.75,32.75,2024-06-17 23:34:10.436,2024-06-17,2024,6,17,48796,[],()
85164,49358,21815,1,USD 17.25,13:37;12/25/24,,17.25,17.25,17.25,2024-12-25 13:37:00.000,2024-12-25,2024,12,25,49358,[],()
80413,50609,21574,1,USD47.5," 8-NOV-2024,16:40:00","Suite 134 64019 Jon Corners, North Alonaport, NV 81038-7338",47.5,47.5,47.5,2024-11-08 16:40:00.000,2024-11-08,2024,11,8,50609,[],()
81408,48832,21722,1,EUR 38.99,2025-01-22T11:46:57.657,,46.788000000000004,46.788000000000004,46.79,2025-01-22 11:46:57.657,2025-01-22,2025,1,22,48832,[],()
81698,48268,21852,1,USD41.0,12:40:14 A.M. 2025-02-19,,41.0,41.0,41.0,2025-02-19 00:40:14.000,2025-02-19,2025,2,19,48268,[],()
78512,49347,21867,1,61.75 EUR,2025-04-08T04:00:43.694,"Suite 220 77811 Davis Plaza, Port Lisaport, IL 97878",74.1,74.1,74.1,2025-04-08 04:00:43.694,2025-04-08,2025,4,8,49347,[],()
84393,48193,22046,1,USD 59.99,"09/28/24, 10:26:39 am",NULL,59.99,59.99,59.99,2024-09-28 10:26:39.000,2024-09-28,2024,9,28,48193,[],()
80530,48078,21380,1,64.5 $,"05:28:55 P.M.,  6-Jul-2024",,64.5,64.5,64.5,2024-07-06 17:28:55.000,2024-07-06,2024,7,6,48078,[],()
80166,49047,21749,1,$71.50,2025-04-06 11:37:30 PM,"225 Carolann Passage, West Anderson, WI 01900",71.5,71.5,71.5,2025-04-06 23:37:30.000,2025-04-06,2025,4,6,49047,[],()
82887,50071,21731,2,51.25USD,"05:22:22 PM,01/18/25",NULL,51.25,51.25,102.5,2025-01-18 17:22:22.000,2025-01-18,2025,1,18,50071,[],()
78037,47973,21631,1,24. EUR,"20:37:29,2024-12-17","56199 Jamey Shoals, Lake Issacville, VT 17712",28.799999999999997,28.799999999999997,28.8,2024-12-17 20:37:29.000,2024-12-17,2024,12,17,47973,[],()
81752,48948,21308,1,36.00 $,14.05.2025 11:03:03,,36.0,36.0,36.0,2025-05-14 11:03:03.000,2025-05-14,2025,5,14,48948,[],()
82569,47961,21929,3,$60¢00,02/12/25;16:58:27,NULL,6000.0,6000.0,18000.0,2025-02-12 16:58:27.000,2025-02-12,2025,2,12,47961,[],()
84896,49339,21947,1,EUR64.0,17:23;2025-01-20,"4469 White Manor, Carsonberg, AK 60694-6854",76.8,76.8,76.8,2025-01-20 17:23:00.000,2025-01-20,2025,1,20,49339,[],()
83429,48866,21740,1,56.50$,2025-03-05T15:51:05,NULL,56.5,56.5,56.5,2025-03-05 15:51:05.000,2025-03-05,2025,3,5,48866,[],()
79902,49843,21851,1,€27.00,"2025-07-14, 08:35:09 AM",,32.4,32.4,32.4,2025-07-14 08:35:09.000,2025-07-14,2025,7,14,49843,[],()
86084,48196,21885,4,EUR47.75,13:58 05/12/24,NULL,57.3,57.3,229.2,2024-05-12 13:58:00.000,2024-05-12,2024,5,12,48196,[],()
79765,48782,21451,1,€73.0,14:19:50;09/29/24,"Apt. 192 969 Krissy Port, South Inger, MS 63584",87.6,87.6,87.6,2024-09-29 14:19:50.000,2024-09-29,2024,9,29,48782,[],()
77797,50918,21602,1,62.25$,2024-03-25 12:17:55 PM,"Suite 992 763 Ronny Prairie, Port Neelytown, NC 43283",62.25,62.25,62.25,2024-03-25 12:17:55.000,2024-03-25,2024,3,25,50918,[],()
81356,50771,21666,1,68.0USD,"2024-10-05, 01:57",,68.0,68.0,68.0,2024-10-05 01:57:00.000,2024-10-05,2024,10,5,50771,[],()
78471,48739,21999,1,$34¢00,"30-August-2024, 01:57:55 pm","24883 Yoshie Curve, North Lashandahaven, AK 84392-4338",3400.0,3400.0,3400.0,2024-08-30 13:57:55.000,2024-08-30,2024,8,30,48739,[],()
82934,47674,21446,1,15.5€,"2024-11-08,04:42:31 A.M.",,18.599999999999998,18.599999999999998,18.6,2024-11-08 04:42:31.000,2024-11-08,2024,11,8,47674,[],()
79420,48571,21919,2,USD 55.,"11:38:50 A.M., 20-JUL-2024",NULL,55.0,55.0,110.0,2024-07-20 11:38:50.000,2024-07-20,2024,7,20,48571,[],()
82553,48650,21693,2,€71.0,14:58:23;2024-05-26,,85.2,85.2,170.4,2024-05-26 14:58:23.000,2024-05-26,2024,5,26,48650,[],()
81598,50719,21348,2,21.00USD," 3-JUL-2025, 04:43:43 A.M.",,21.0,21.0,42.0,2025-07-03 04:43:43.000,2025-07-03,2025,7,3,50719,[],()
85701,49906,22034,1,EUR73.50,"31-March-2024, 05:02",,88.2,88.2,88.2,2024-03-31 05:02:00.000,2024-03-31,2024,3,31,49906,[],()
83605,47837,21490,1,65.75 $,"2024-10-24, 12:25:34 P.M.",NULL,65.75,65.75,65.75,2024-10-24 12:25:34.000,2024-10-24,2024,10,24,47837,[],()
85605,50663,21803,1,52.0 €,"03:30:40, 19-Jan-2024",,62.4,62.4,62.4,2024-01-19 03:30:40.000,2024-01-19,2024,1,19,50663,[],()
83502,48355,21677,1,33.0$,"02:56:39 P.M.,06/20/25",,33.0,33.0,33.0,2025-06-20 14:56:39.000,2025-06-20,2025,6,20,48379,[],()
82764,48961,21343,1,USD71.50,"10/17/24,04:32:37",,71.5,71.5,71.5,2024-10-17 04:32:37.000,2024-10-17,2024,10,17,48961,[],()
81121,50426,21372,1,USD 35.5,"13-NOV-2024, 10:38:55 am",,35.5,35.5,35.5,2024-11-13 10:38:55.000,2024-11-13,2024,11,13,50426,[],()
86254,49635,21522,1,€19¢75,Wed Jan  1 14:12:19 2025,,2370.0,2370.0,2370.0,2025-01-01 14:12:19.000,2025-01-01,2025,1,1,49635,[],()
86473,49625,21870,1,$ 64.0,"08:55,  4-Oct-2024",,64.0,64.0,64.0,2024-10-04 08:55:00.000,2024-10-04,2024,10,4,49625,[],()
78638,48575,21773,1,€39¢25,15-Aug-2025;07:02:01,"Apt. 987 339 Leonora Point, North Mohamedton, ID 54492-4773",4710.0,4710.0,4710.0,2025-08-15 07:02:01.000,2025-08-15,2025,8,15,48575,[],()
80384,49284,21697,2,USD64.25,"02/26/25,21:57:05","Suite 145 168 Weissnat Trail, Port Greta, AZ 37876-3552",64.25,64.25,128.5,2025-02-26 21:57:05.000,2025-02-26,2025,2,26,49284,[],()
84047,48791,21985,1,20.5 USD,2024-08-17T14:20:27.959,,20.5,20.5,20.5,2024-08-17 14:20:27.959,2024-08-17,2024,8,17,48791,[],()
77807,48852,21718,3,47.75USD,"17-May-2025,14:49:02",NULL,47.75,47.75,143.25,2025-05-17 14:49:02.000,2025-05-17,2025,5,17,48852,[],()
84776,48976,21995,2,$ 45.99,20-MAR-2024;05:45,NULL,45.99,45.99,91.98,2024-03-20 05:45:00.000,2024-03-20,2024,3,20,48976,[],()
79045,49453,21315,1,75.00$,18.04.2024 23:08:08,NULL,75.0,75.0,75.0,2024-04-18 23:08:08.000,2024-04-18,2024,4,18,49453,[],()
83607,47762,21760,1,67.25 €,2024-11-08 23:25:52,"Apt. 574 199 Cremin Underpass, Hansenside, MA 45626",80.7,80.7,80.7,2024-11-08 23:25:52.000,2024-11-08,2024,11,8,47762,[],()
78109,48560,21872,3,38$00¢,2024-11-29T23:08:50,NULL,3800.0,3800.0,11400.0,2024-11-29 23:08:50.000,2024-11-29,2024,11,29,48560,[],()
85943,47994,21661,1,USD 66.25,"08:07:16, 2024-04-05",,66.25,66.25,66.25,2024-04-05 08:07:16.000,2024-04-05,2024,4,5,47994,[],()
84304,48745,22034,1,73.0 $,24-Sep-2024 08:25:04 PM,,73.0,73.0,73.0,2024-09-24 20:25:04.000,2024-09-24,2024,9,24,48745,[],()
82544,49839,21918,5,70$,15:19:08;2025-01-03,,70.0,70.0,350.0,2025-01-03 15:19:08.000,2025-01-03,2025,1,3,49839,[],()
78039,48834,21578,1,21.5USD,"13:54,31-October-2024","47149 Marcelene Streets, Kingview, NV 59138-9180",21.5,21.5,21.5,2024-10-31 13:54:00.000,2024-10-31,2024,10,31,48834,[],()
80454,50305,21335,1,32.75$,12-SEP-2024;12:23,,32.75,32.75,32.75,2024-09-12 12:23:00.000,2024-09-12,2024,9,12,50305,[],()
77911,47728,21934,2,€ 42.75,"09:18:05,09/07/24","Suite 370 34918 August Summit, Florinefort, WY 14770",51.3,51.3,102.6,2024-09-07 09:18:05.000,2024-09-07,2024,9,7,50573,[],()
78728,47825,21480,1,53.99 EUR,01:42:10 P.M.  1-OCT-2024,,64.788,64.788,64.79,2024-10-01 13:42:10.000,2024-10-01,2024,10,1,47825,[],()
83523,50625,21924,1,55.5USD,"08/04/24, 19:15:57",NULL,55.5,55.5,55.5,2024-08-04 19:15:57.000,2024-08-04,2024,8,4,50625,[],()
83993,48767,21983,1,$60.75,"16:11, 2024-10-31",,60.75,60.75,60.75,2024-10-31 16:11:00.000,2024-10-31,2024,10,31,48767,[],()
82866,49068,21418,1,29.5 $,2025-01-31T03:04:59,,29.5,29.5,29.5,2025-01-31 03:04:59.000,2025-01-31,2025,1,31,49068,[],()
81988,48933,21464,1,63.00 $,"03:22:31, 5-March-2025",,63.0,63.0,63.0,2025-03-05 03:22:31.000,2025-03-05,2025,3,5,48933,[],()
86359,49247,21300,1,$ 38.5,03:24:20 03/12/25,,38.5,38.5,38.5,2025-03-12 03:24:20.000,2025-03-12,2025,3,12,49247,[],()
79996,48991,21954,2,51$50¢,13-OCT-2024 10:53:47,,5150.0,5150.0,10300.0,2024-10-13 10:53:47.000,2024-10-13,2024,10,13,48991,[],()
84412,51024,21992,2,USD35,2024-12-24 22:41,,35.0,35.0,70.0,2024-12-24 22:41:00.000,2024-12-24,2024,12,24,51024,[],()
82324,50070,21896,1,€22.50,2024-05-13T11:29:19.697,"Suite 502 837 Gleason Spring, Dickensville, AR 82975",27.0,27.0,27.0,2024-05-13 11:29:19.697,2024-05-13,2024,5,13,50070,[],()
82580,47858,21795,2,36.99 $,"05:57:18 A.M.,  6-January-2025",,36.99,36.99,73.98,2025-01-06 05:57:18.000,2025-01-06,2025,1,6,47858,[],()
81060,48405,21395,1,EUR 63.0,"08:55, 2024-12-08",,75.6,75.6,75.6,2024-12-08 08:55:00.000,2024-12-08,2024,12,8,48405,[],()
78935,50761,21495,1,49.0 $,03/15/25 19:00,"Suite 353 8752 Christian Knoll, Hillsfurt, ID 00549-2490",49.0,49.0,49.0,2025-03-15 19:00:00.000,2025-03-15,2025,3,15,50761,[],()
81713,49037,21951,1,$ 30.75,21:58 11-JUL-2025,,30.75,30.75,30.75,2025-07-11 21:58:00.000,2025-07-11,2025,7,11,49037,[],()
78140,50502,21562,1,USD 33.5,"07:34, 06/23/24",,33.5,33.5,33.5,2024-06-23 07:34:00.000,2024-06-23,2024,6,23,50502,[],()
78946,48858,21784,1,USD65.99,"2024-10-18,01:27:07 PM","Suite 244 366 McKenzie Mews, New Shayneland, WV 28559-9464",65.99,65.99,65.99,2024-10-18 13:27:07.000,2024-10-18,2024,10,18,48858,[],()
84118,48116,21406,1,USD 71.25,"03:48, 12/04/24",,71.25,71.25,71.25,2024-12-04 03:48:00.000,2024-12-04,2024,12,4,48116,[],()
80521,49722,22009,1,25.75USD,21:04:52 2024-12-26,,25.75,25.75,25.75,2024-12-26 21:04:52.000,2024-12-26,2024,12,26,49722,[],()
83664,50425,21986,2,$50¢00,2025-01-08T02:35:58.835,"Apt. 687 3527 Rosenbaum Stravenue, Morarmouth, SD 04680",5000.0,5000.0,10000.0,2025-01-08 02:35:58.835,2025-01-08,2025,1,8,50425,[],()
80335,49224,21810,1,$52¢00,2024-04-10T09:01:20.148,,5200.0,5200.0,5200.0,2024-04-10 09:01:20.148,2024-04-10,2024,4,10,49224,[],()
82248,48120,21635,2,$ 39.99,10:45:50 pm 14-February-2025,"370 Lind Extension, Boscomouth, MT 74876",39.99,39.99,79.98,2025-02-14 22:45:50.000,2025-02-14,2025,2,14,48120,[],()
81561,49096,21409,3,$65.75,"01:50:58 P.M.,2024-08-18","Suite 652 385 Aaron Village, South Lucianoburgh, CA 86593",65.75,65.75,197.25,2024-08-18 13:50:58.000,2024-08-18,2024,8,18,49096,[],()
78738,48094,21589,1,63€99¢,"08:40,19-Mar-2025",,7678.799999999999,7678.799999999999,7678.8,2025-03-19 08:40:00.000,2025-03-19,2025,3,19,48094,[],()
85256,47888,21763,1,USD38.5,09:43 13-Feb-2025,,38.5,38.5,38.5,2025-02-13 09:43:00.000,2025-02-13,2025,2,13,47888,[],()
79628,49980,21562,1,USD 34.25,"17:55:15,  8-FEB-2025",,34.25,34.25,34.25,2025-02-08 17:55:15.000,2025-02-08,2025,2,8,49980,[],()
77921,50659,21643,1,USD 13.50,2024-08-27T01:56:31.776,"Suite 863 698 Wisozk Shoals, Trompshire, AK 79391",13.5,13.5,13.5,2024-08-27 01:56:31.776,2024-08-27,2024,8,27,50659,[],()
79328,51059,21695,4,€73¢00,"05:54:29 AM, 05/28/24",NULL,8760.0,8760.0,35040.0,2024-05-28 05:54:29.000,2024-05-28,2024,5,28,51059,[],()
81770,48987,21962,1,66 €,"09/25/24, 04:32",NULL,79.2,79.2,79.2,2024-09-25 04:32:00.000,2024-09-25,2024,9,25,48987,[],()
86019,49041,21702,1,64.50 USD, 9-Jun-2024;03:52:52 P.M.,NULL,64.5,64.5,64.5,2024-06-09 15:52:52.000,2024-06-09,2024,6,9,49041,[],()
83890,49493,21703,1,USD65.50,12-Jan-2025;07:44:50 P.M.,,65.5,65.5,65.5,2025-01-12 19:44:50.000,2025-01-12,2025,1,12,49493,[],()
83588,49230,21703,1,68.50 $,2024-08-21T04:22:06.318,"5680 Heller Port, East Elly, WY 88883-4803",68.5,68.5,68.5,2024-08-21 04:22:06.318,2024-08-21,2024,8,21,49230,[],()
79602,50033,21948,1,USD 64.50,09:08:50 P.M. 01/06/25,,64.5,64.5,64.5,2025-01-06 21:08:50.000,2025-01-06,2025,1,6,50033,[],()
81736,51103,21418,1,$33¢25,"2024-11-21,03:33:51 P.M.",NULL,3325.0,3325.0,3325.0,2024-11-21 15:33:51.000,2024-11-21,2024,11,21,51103,[],()
77920,49433,21307,4,$ 26.25,"14:18:53, 2024-09-28","Suite 870 9680 Rocco Brooks, New Rubin, NC 97192",26.25,26.25,105.0,2024-09-28 14:18:53.000,2024-09-28,2024,9,28,49433,[],()
78586,48801,21802,2,45.00 USD,"08:37:29 am, 2024-12-04",,45.0,45.0,90.0,2024-12-04 08:37:29.000,2024-12-04,2024,12,4,48801,[],()
81805,49275,21833,1,USD67.0,03:38:18 PM 25-JUL-2024,,67.0,67.0,67.0,2024-07-25 15:38:18.000,2024-07-25,2024,7,25,49275,[],()
79175,48166,21344,1,€54.00,13-Nov-2024 11:19:19,"5033 Bert Lodge, Carolview, MT 97859-5923",64.8,64.8,64.8,2024-11-13 11:19:19.000,2024-11-13,2024,11,13,48166,[],()
77682,48404,21617,5,27.50 $,"10/05/24,08:21",,27.5,27.5,137.5,2024-10-05 08:21:00.000,2024-10-05,2024,10,5,48404,[],()
78192,49406,21779,1,31.50USD,06:40:15 am;2025-08-15,"Suite 897 567 Schamberger Trail, West Martyborough, WA 43957-3262",31.5,31.5,31.5,2025-08-15 06:40:15.000,2025-08-15,2025,8,15,51040,[],()
85096,48328,22054,1,67.00EUR,2024-05-18T00:23:18.509,NULL,80.39999999999999,80.39999999999999,80.4,2024-05-18 00:23:18.509,2024-05-18,2024,5,18,48328,[],()
79470,50226,21353,1,26.25 USD,2025-03-13T06:03:33.102,,26.25,26.25,26.25,2025-03-13 06:03:33.102,2025-03-13,2025,3,13,50226,[],()
77795,48832,21752,4,60.00USD,01:59:20 pm;28-JUL-2024,"Apt. 355 3790 Graham Burgs, North Cedricmouth, CA 83909-7628",60.0,60.0,240.0,2024-07-28 13:59:20.000,2024-07-28,2024,7,28,48832,[],()
79330,50998,21339,2,70.75 $,"02:06:09 PM, 2024-03-28",,70.75,70.75,141.5,2024-03-28 14:06:09.000,2024-03-28,2024,3,28,50998,[],()
85071,48535,22033,3,USD 50.5,"06:29, 2024-11-15",,50.5,50.5,151.5,2024-11-15 06:29:00.000,2024-11-15,2024,11,15,48535,[],()
84280,49426,21536,1,€40¢00,"11:40:27 PM,2025-05-14",,4800.0,4800.0,4800.0,2025-05-14 23:40:27.000,2025-05-14,2025,5,14,49426,[],()
79130,48277,22003,2,61.5 $,2024-08-09;00:13,,61.5,61.5,123.0,2024-08-09 00:13:00.000,2024-08-09,2024,8,9,48277,[],()
79120,50136,21548,1,41.0$,2024-11-25T09:29:58.872,,41.0,41.0,41.0,2024-11-25 09:29:58.872,2024-11-25,2024,11,25,50136,[],()
79950,49285,21375,1,$51.50,01/01/25;01:47:17 A.M.,NULL,51.5,51.5,51.5,2025-01-01 01:47:17.000,2025-01-01,2025,1,1,49285,[],()
78332,47792,21948,2,63.0 $,"06:05,2024-11-30",,63.0,63.0,126.0,2024-11-30 06:05:00.000,2024-11-30,2024,11,30,49224,[],()
80585,48976,21615,1,€ 48.25,"07/10/24,00:36",,57.9,57.9,57.9,2024-07-10 00:36:00.000,2024-07-10,2024,7,10,48976,[],()
82808,48097,21814,5,45.75$,02:23;2024-10-04,NULL,45.75,45.75,228.75,2024-10-04 02:23:00.000,2024-10-04,2024,10,4,48097,[],()
81208,47834,21714,2,$42.00,06:49:41;05/13/25,,42.0,42.0,84.0,2025-05-13 06:49:41.000,2025-05-13,2025,5,13,47834,[],()
85889,48551,21525,1,USD33.00,16:17:14;05/20/24,,33.0,33.0,33.0,2024-05-20 16:17:14.000,2024-05-20,2024,5,20,48551,[],()
78433,48704,21937,1,USD52.50,Sat May 25 03:29:30 2024,NULL,52.5,52.5,52.5,2024-05-25 03:29:30.000,2024-05-25,2024,5,25,48704,[],()
84819,48959,21352,1,$31¢00, 7-JUN-2025;09:59:15 A.M.,,3100.0,3100.0,3100.0,2025-06-07 09:59:15.000,2025-06-07,2025,6,7,48959,[],()
78149,49162,21787,1,44.5 $,"21:51,2024-11-10",NULL,44.5,44.5,44.5,2024-11-10 21:51:00.000,2024-11-10,2024,11,10,49162,[],()
83824,49018,21952,2,50.25 $,2025-01-14;15:08:28,"Apt. 973 93069 Yost Forest, New Redashire, CA 36510",50.25,50.25,100.5,2025-01-14 15:08:28.000,2025-01-14,2025,1,14,49018,[],()
84900,49087,21573,1,$32¢50,07:39 2024-11-17,"339 Napoleon Ramp, East Alicamouth, SC 91018",3250.0,3250.0,3250.0,2024-11-17 07:39:00.000,2024-11-17,2024,11,17,49087,[],()
77822,50969,22003,1,58.50€,"20:54:38, 2024-11-25","983 Alana Trail, East Alphonse, AK 12188",70.2,70.2,70.2,2024-11-25 20:54:38.000,2024-11-25,2024,11,25,50969,[],()
83113,50174,21983,2,$60¢25,"09/25/24,12:02","739 Felicia Shores, New Leonardo, MI 50300-4369",6025.0,6025.0,12050.0,2024-09-25 12:02:00.000,2024-09-25,2024,9,25,50174,[],()
85600,49746,21618,1,€45.75,"2025-03-07,02:46:47 PM",,54.9,54.9,54.9,2025-03-07 14:46:47.000,2025-03-07,2025,3,7,49746,[],()
80262,48939,21806,1,USD58.0,2024-07-18 09:22:43 PM,"1885 Clemente Divide, Christiansenland, NV 19823-4941",58.0,58.0,58.0,2024-07-18 21:22:43.000,2024-07-18,2024,7,18,48939,[],()
84289,50052,21558,1,$ 20.0,"28-December-2024,07:10:22","Suite 458 99710 Renner Forks, South Mandieburgh, NE 46946",20.0,20.0,20.0,2024-12-28 07:10:22.000,2024-12-28,2024,12,28,50052,[],()
86449,48725,21528,1,$46.99,03/07/25 20:56,NULL,46.99,46.99,46.99,2025-03-07 20:56:00.000,2025-03-07,2025,3,7,48725,[],()
81991,51056,21467,1,49.0 EUR,07:33:11 04/07/25,,58.8,58.8,58.8,2025-04-07 07:33:11.000,2025-04-07,2025,4,7,51056,[],()
83178,49626,21862,1,USD 54.50,"2025-08-01, 11:25","Apt. 842 191 Gutmann Rest, West Arlene, WI 73743-8405",54.5,54.5,54.5,2025-08-01 11:25:00.000,2025-08-01,2025,8,1,49626,[],()
81716,50544,21958,1,75.0$,03:11;2024-06-29,,75.0,75.0,75.0,2024-06-29 03:11:00.000,2024-06-29,2024,6,29,50544,[],()
85734,48963,21656,1,€ 30.00,"03:06:09,  4-Dec-2024","56061 White Cape, Doriefort, MD 35894-8001",36.0,36.0,36.0,2024-12-04 03:06:09.000,2024-12-04,2024,12,4,48963,[],()
80981,51047,21592,1,$ 60.0,2024-07-21T07:54:42,NULL,60.0,60.0,60.0,2024-07-21 07:54:42.000,2024-07-21,2024,7,21,51047,[],()
77626,50274,21443,1,€23.50,2025-06-03T17:32:50,NULL,28.2,28.2,28.2,2025-06-03 17:32:50.000,2025-06-03,2025,6,3,50274,[],()
81129,48919,21781,1,$68.5," 6-Dec-2024,17:35:15","Suite 795 306 Runolfsson Centers, Lake Gabriel, NJ 60152",68.5,68.5,68.5,2024-12-06 17:35:15.000,2024-12-06,2024,12,6,48919,[],()
82056,47957,21926,2,€44.5,22:10;2025-05-16,"107 Blanda Canyon, Port Sung, TX 87766",53.4,53.4,106.8,2025-05-16 22:10:00.000,2025-05-16,2025,5,16,49304,[],()
79982,50836,21529,3,€ 15.0,08/05/24;12:48,,18.0,18.0,54.0,2024-08-05 12:48:00.000,2024-08-05,2024,8,5,50836,[],()
83175,49656,21427,1,75.75USD,2024-12-26 15:19,,75.75,75.75,75.75,2024-12-26 15:19:00.000,2024-12-26,2024,12,26,49656,[],()
82617,49327,21886,1,47.50€,2025-03-30T16:57:44.170,,57.0,57.0,57.0,2025-03-30 16:57:44.170,2025-03-30,2025,3,30,49327,[],()
80980,49764,21393,5,USD 57.5,2024-03-29T11:26:01.641,,57.5,57.5,287.5,2024-03-29 11:26:01.641,2024-03-29,2024,3,29,49764,[],()
78437,48040,22004,2,EUR68.99,"2024-12-19, 07:36",,82.788,82.788,165.58,2024-12-19 07:36:00.000,2024-12-19,2024,12,19,48040,[],()
80950,50347,21339,2,USD 70,"10:48:57 am, 2024-05-13",,70.0,70.0,140.0,2024-05-13 10:48:57.000,2024-05-13,2024,5,13,50347,[],()
77812,49898,21609,4,€69¢99,23:25;12/17/24,"485 Hoppe Centers, Saranland, AK 05913",8398.8,8398.8,33595.2,2024-12-17 23:25:00.000,2024-12-17,2024,12,17,49898,[],()
83215,49422,21321,3,68.25 $,"10/03/24,01:45:54",,68.25,68.25,204.75,2024-10-03 01:45:54.000,2024-10-03,2024,10,3,49422,[],()
85937,48669,21906,1,39.5EUR,2024-08-23T08:57:39,,47.4,47.4,47.4,2024-08-23 08:57:39.000,2024-08-23,2024,8,23,48669,[],()
81664,50940,21864,4,70.00 €,"03:09:44 pm, 10-AUG-2025",NULL,84.0,84.0,336.0,2025-08-10 15:09:44.000,2025-08-10,2025,8,10,50940,[],()
79841,49299,21614,1,54.99EUR,"14:04:57,01/14/25",,65.988,65.988,65.99,2025-01-14 14:04:57.000,2025-01-14,2025,1,14,49299,[],()
80690,50219,21941,3,$48.5,20:24:53;2025-08-17,NULL,48.5,48.5,145.5,2025-08-17 20:24:53.000,2025-08-17,2025,8,17,50219,[],()
86003,50463,21675,3,18.0€,16-SEP-2025 11:41,,21.599999999999998,21.599999999999998,64.8,2025-09-16 11:41:00.000,2025-09-16,2025,9,16,50463,[],()
80878,50779,21466,1,USD 31.,"08:00, 6-APR-2024","1286 Robt Meadow, South Merideth, IN 12514-4525",31.0,31.0,31.0,2024-04-06 08:00:00.000,2024-04-06,2024,4,6,50779,[],()
80883,47834,21954,1,51 $,"11:23:05, 03/22/25",,51.0,51.0,51.0,2025-03-22 11:23:05.000,2025-03-22,2025,3,22,47834,[],()
85054,49917,21595,1,51.99 €,"2024-09-30, 23:52:53",NULL,62.388,62.388,62.39,2024-09-30 23:52:53.000,2024-09-30,2024,9,30,49917,[],()
81571,50471,21739,1,USD42.75,16:53 11/12/24,NULL,42.75,42.75,42.75,2024-11-12 16:53:00.000,2024-11-12,2024,11,12,50471,[],()
77906,48237,21769,1,65.00 USD,08/07/24;02:44:58 am,NULL,65.0,65.0,65.0,2024-08-07 02:44:58.000,2024-08-07,2024,8,7,48237,[],()
83883,51024,21534,1,19.0USD,"21-DEC-2024,07:51:57 pm",NULL,19.0,19.0,19.0,2024-12-21 19:51:57.000,2024-12-21,2024,12,21,51024,[],()
77733,50431,21645,1,USD 50.0,03/29/25;03:17,"Apt. 870 5950 Kunde Throughway, New Alden, DE 85484-1567",50.0,50.0,50.0,2025-03-29 03:17:00.000,2025-03-29,2025,3,29,50431,[],()
84195,49792,21724,1,17.50€,2025-03-02;10:55,,21.0,21.0,21.0,2025-03-02 10:55:00.000,2025-03-02,2025,3,2,49792,[],()
84847,48075,21415,1,59.50EUR,"16:44:51, 02/25/25",NULL,71.39999999999999,71.39999999999999,71.4,2025-02-25 16:44:51.000,2025-02-25,2025,2,25,48075,[],()
78896,47742,21571,2,USD 18.75,01:32:40 AM 2025-02-20,NULL,18.75,18.75,37.5,2025-02-20 01:32:40.000,2025-02-20,2025,2,20,47742,[],()
78016,50366,21769,1,USD66.25,2024-10-17T07:32:31.315,NULL,66.25,66.25,66.25,2024-10-17 07:32:31.315,2024-10-17,2024,10,17,50366,[],()
79563,49760,21967,1,$40.0,2025-02-22T00:11:58,,40.0,40.0,40.0,2025-02-22 00:11:58.000,2025-02-22,2025,2,22,49760,[],()
83280,48963,21454,1,€ 20.99,"17:12, 23-Feb-2025","56061 White Cape, Doriefort, MD 35894-8001",25.188,25.188,25.19,2025-02-23 17:12:00.000,2025-02-23,2025,2,23,48963,[],()
84253,50455,21300,1,USD 39.5,2024-07-27T04:19:53.885,,39.5,39.5,39.5,2024-07-27 04:19:53.885,2024-07-27,2024,7,27,49774,[],()
82712,49509,21833,1,EUR66.00,01/22/25 09:08:41 pm,,79.2,79.2,79.2,2025-01-22 21:08:41.000,2025-01-22,2025,1,22,49509,[],()
78447,49302,21898,2,54.5 $,2025-09-26 06:41:58,"4484 Kenneth Rue, Julioview, OR 27238",54.5,54.5,109.0,2025-09-26 06:41:58.000,2025-09-26,2025,9,26,49302,[],()
85905,49828,21825,3,€37¢75,23:59 08/09/24,,4530.0,4530.0,13590.0,2024-08-09 23:59:00.000,2024-08-09,2024,8,9,49828,[],()
77722,50609,21706,1,USD21.00,"10:27:00,2024-12-04","Suite 134 64019 Jon Corners, North Alonaport, NV 81038-7338",21.0,21.0,21.0,2024-12-04 10:27:00.000,2024-12-04,2024,12,4,50609,[],()
84435,49504,21415,1,USD 60.00,2025-05-19 07:44:12,NULL,60.0,60.0,60.0,2025-05-19 07:44:12.000,2025-05-19,2025,5,19,49504,[],()
82462,50497,21620,3,USD 31.25,"05/03/24, 00:23:03",,31.25,31.25,93.75,2024-05-03 00:23:03.000,2024-05-03,2024,5,3,50497,[],()
78318,51067,21921,3,63.00€,09/12/24;13:40,"6762 Bahringer Points, Gemafurt, DE 27934-1303",75.6,75.6,226.8,2024-09-12 13:40:00.000,2024-09-12,2024,9,12,51067,[],()
86392,48841,21754,1,$ 27.99,"11-March-2025,07:28:30 A.M.","Suite 567 51176 Pam Freeway, Rashadside, GA 60407",27.99,27.99,27.99,2025-03-11 07:28:30.000,2025-03-11,2025,3,11,48841,[],()
81533,48821,21972,1,$ 18.99,"08:16:48,01/15/25","637 Gino Wells, New Raven, IA 47841",18.99,18.99,18.99,2025-01-15 08:16:48.000,2025-01-15,2025,1,15,48821,[],()
79792,49796,21896,2,USD 17.5,04/30/25 09:48:56 A.M.,,17.5,17.5,35.0,2025-04-30 09:48:56.000,2025-04-30,2025,4,30,49796,[],()
79595,47910,21440,2,USD24.00,01/15/25 18:32,"Apt. 238 106 Yetta Court, Port Cleotildeburgh, ND 13639-5753",24.0,24.0,48.0,2025-01-15 18:32:00.000,2025-01-15,2025,1,15,47910,[],()
78804,50569,21632,1,68.5$,2024-08-06T02:37:56.178,,68.5,68.5,68.5,2024-08-06 02:37:56.178,2024-08-06,2024,8,6,50569,[],()
80434,49587,21625,1,21.5EUR,2024-09-24T20:39:08,,25.8,25.8,25.8,2024-09-24 20:39:08.000,2024-09-24,2024,9,24,49587,[],()
79028,47821,21404,1,USD20.75," 8-MAR-2024, 21:47:06","59967 Heriberto Square, Hilariofort, TX 82380-4388",20.75,20.75,20.75,2024-03-08 21:47:06.000,2024-03-08,2024,3,8,47821,[],()
85972,48493,21697,1,EUR 67,"12:07,10/12/24",NULL,80.39999999999999,80.39999999999999,80.4,2024-10-12 12:07:00.000,2024-10-12,2024,10,12,48493,[],()
83626,50517,22046,4,58.0EUR,"06/21/24,11:07:02 P.M.",NULL,69.6,69.6,278.4,2024-06-21 23:07:02.000,2024-06-21,2024,6,21,50517,[],()
85760,49469,22004,3,69.75 USD,08:45:04 10-AUG-2024,"6731 Simonis Keys, Boyleberg, NY 96661",69.75,69.75,209.25,2024-08-10 08:45:04.000,2024-08-10,2024,8,10,49469,[],()
78147,50082,21758,1,USD 42.50,"16-MAY-2025,12:51:03 PM",,42.5,42.5,42.5,2025-05-16 12:51:03.000,2025-05-16,2025,5,16,50082,[],()
85558,49385,21307,1,23.00 USD,2025-01-28T04:12:11.493,,23.0,23.0,23.0,2025-01-28 04:12:11.493,2025-01-28,2025,1,28,49385,[],()
84720,47999,21567,1,63USD,10:16;2024-11-28,,63.0,63.0,63.0,2024-11-28 10:16:00.000,2024-11-28,2024,11,28,47999,[],()
80817,48249,21663,1,$71.00,2024-09-21;10:01:12,,71.0,71.0,71.0,2024-09-21 10:01:12.000,2024-09-21,2024,9,21,48249,[],()
85922,50810,21922,2,25.50USD,"03:44:36 AM, 06/22/25",,25.5,25.5,51.0,2025-06-22 03:44:36.000,2025-06-22,2025,6,22,50810,[],()
77816,50727,21478,1,46.50€,2025-01-02T10:58:39.019,,55.8,55.8,55.8,2025-01-02 10:58:39.019,2025-01-02,2025,1,2,50727,[],()
82360,48907,21875,1,50.5€,"10:00:30 pm, 25-August-2024",,60.599999999999994,60.599999999999994,60.6,2024-08-25 22:00:30.000,2024-08-25,2024,8,25,48907,[],()
78612,50194,21300,2,USD 40.50,Sat Oct  5 00:01:01 2024,NULL,40.5,40.5,81.0,2024-10-05 00:01:01.000,2024-10-05,2024,10,5,48607,[],()
78450,49180,21840,1,EUR16.,"07:52:25 PM,2025-02-16","110 Koepp Brook, Lake Krystalmouth, WI 43525-3141",19.2,19.2,19.2,2025-02-16 19:52:25.000,2025-02-16,2025,2,16,49180,[],()
84544,50082,21777,1,$ 34.25,"22:32,07/17/24",,34.25,34.25,34.25,2024-07-17 22:32:00.000,2024-07-17,2024,7,17,50082,[],()
84123,50344,21344,1,49.99$,Wed Jan 22 21:40:41 2025,,49.99,49.99,49.99,2025-01-22 21:40:41.000,2025-01-22,2025,1,22,50344,[],()
78905,48539,21969,1,54.25$,"21:45:40,2025-02-12",,54.25,54.25,54.25,2025-02-12 21:45:40.000,2025-02-12,2025,2,12,48539,[],()
79138,49534,21333,1,71.00USD,17:49;2025-04-08,,71.0,71.0,71.0,2025-04-08 17:49:00.000,2025-04-08,2025,4,8,49534,[],()
80238,50448,21798,1,EUR55.0,"01:18,03/28/25",,66.0,66.0,66.0,2025-03-28 01:18:00.000,2025-03-28,2025,3,28,50448,[],()
77752,50947,21562,1,34.75EUR,"05/17/25,23:19","Apt. 640 963 Ronni Skyway, Nigelview, FL 55519-4938",41.699999999999996,41.699999999999996,41.7,2025-05-17 23:19:00.000,2025-05-17,2025,5,17,50947,[],()
83018,49751,21393,1,56.50USD,06:32:34 AM 2024-04-01,,56.5,56.5,56.5,2024-04-01 06:32:34.000,2024-04-01,2024,4,1,49751,[],()
77647,48686,21737,1,USD 21.25,"09/03/24,11:07:19 A.M.","24205 Ledner Glen, Lorenaland, NJ 53567",21.25,21.25,21.25,2024-09-03 11:07:19.000,2024-09-03,2024,9,3,48686,[],()
85531,49571,21386,1,48.75$,06:53:41 PM 23-April-2025,,48.75,48.75,48.75,2025-04-23 18:53:41.000,2025-04-23,2025,4,23,49571,[],()
81547,48848,22037,1,28.00 USD,07/01/24;22:08:30,"Apt. 531 6169 Brandee Locks, Brakusfort, KY 37295-5476",28.0,28.0,28.0,2024-07-01 22:08:30.000,2024-07-01,2024,7,1,48848,[],()
80998,49032,21530,3,51.50USD,11/11/24 13:40,,51.5,51.5,154.5,2024-11-11 13:40:00.000,2024-11-11,2024,11,11,49032,[],()
85845,49629,21337,4,USD37.25," 8-Oct-2024,23:41","Apt. 935 682 Davis Extensions, Fannymouth, KY 04568",37.25,37.25,149.0,2024-10-08 23:41:00.000,2024-10-08,2024,10,8,49629,[],()
85772,51038,21797,1,USD20.75,16:10:42;28-February-2025,,20.75,20.75,20.75,2025-02-28 16:10:42.000,2025-02-28,2025,2,28,51038,[],()
78013,48323,21812,1,48.5USD,"10:20:38,16-Nov-2024",,48.5,48.5,48.5,2024-11-16 10:20:38.000,2024-11-16,2024,11,16,48323,[],()
78256,49783,21904,3,45.75 $,2025-03-10T05:44:36,"Apt. 856 44663 Haydee Villages, Cortezfurt, MA 39618-1688",45.75,45.75,137.25,2025-03-10 05:44:36.000,2025-03-10,2025,3,10,49783,[],()
82074,50416,21795,2,$36¢75,"08:54:18 am,20-Jul-2025",NULL,3675.0,3675.0,7350.0,2025-07-20 08:54:18.000,2025-07-20,2025,7,20,50416,[],()
78338,50244,21389,1,€55.5," 7-JUL-2025,16:54:34",NULL,66.6,66.6,66.6,2025-07-07 16:54:34.000,2025-07-07,2025,7,7,50244,[],()
86328,50630,21484,2,€ 15.75,"2024-12-13, 05:32:25 pm",,18.9,18.9,37.8,2024-12-13 17:32:25.000,2024-12-13,2024,12,13,50630,[],()
85513,48895,21315,1,71.0€,"16:38:21,24-June-2025",,85.2,85.2,85.2,2025-06-24 16:38:21.000,2025-06-24,2025,6,24,48895,[],()
84078,50734,22056,1,€ 23.25,2025-01-30T14:53:30,,27.9,27.9,27.9,2025-01-30 14:53:30.000,2025-01-30,2025,1,30,50734,[],()
84713,50176,21409,1,$ 63.50,"12:16:59 AM, 31-Oct-2024",NULL,63.5,63.5,63.5,2024-10-31 00:16:59.000,2024-10-31,2024,10,31,50176,[],()
84688,48844,22053,1,56.5 $,"2025-09-22, 03:09:06 PM","Suite 753 63621 Fahey Street, Port Kenethview, IN 19012-1628",56.5,56.5,56.5,2025-09-22 15:09:06.000,2025-09-22,2025,9,22,48844,[],()
82013,49692,21790,1,68.0$,15:06;2025-03-15,"91386 Bailey Spur, Teofilaland, RI 07803-5039",68.0,68.0,68.0,2025-03-15 15:06:00.000,2025-03-15,2025,3,15,49692,[],()
80484,49207,21338,3,38.75 USD,"20:12, 2024-09-12","249 Isaura Cape, Kreigerhaven, HI 72811-9706",38.75,38.75,116.25,2024-09-12 20:12:00.000,2024-09-12,2024,9,12,49207,[],()
83423,49118,21390,1,$47.0,07:53:09;10/18/24,,47.0,47.0,47.0,2024-10-18 07:53:09.000,2024-10-18,2024,10,18,49118,[],()
78495,48565,21370,2,USD 62.50,"02:31:29 A.M., 07/06/25",,62.5,62.5,125.0,2025-07-06 02:31:29.000,2025-07-06,2025,7,6,48565,[],()
81633,48861,21354,1,53.50EUR,"14-Dec-2024, 18:39:44","Suite 809 6479 McClure Forges, Eugeneburgh, IA 76155",64.2,64.2,64.2,2024-12-14 18:39:44.000,2024-12-14,2024,12,14,48861,[],()
79017,49626,22049,2,30.99USD,"30-August-2024, 09:32:48",,30.99,30.99,61.98,2024-08-30 09:32:48.000,2024-08-30,2024,8,30,49626,[],()
84987,50148,21955,1,USD52.,2024-08-29T03:37:28,"Suite 742 5376 Harris Terrace, Prohaskaview, NY 44026-1225",52.0,52.0,52.0,2024-08-29 03:37:28.000,2024-08-29,2024,8,29,51004,[],()
85627,48806,21717,1,$ 33.50,07:03:06 AM;2024-11-03,NULL,33.5,33.5,33.5,2024-11-03 07:03:06.000,2024-11-03,2024,11,3,48806,[],()
81277,48634,21378,1,34.25 USD,25.08.2024 23:44:44,"541 Pamelia Ville, Ernieton, IL 29284-0456",34.25,34.25,34.25,2024-08-25 23:44:44.000,2024-08-25,2024,8,25,48634,[],()
85988,48328,21720,1,$25¢50,2024-12-24T03:51:16,,2550.0,2550.0,2550.0,2024-12-24 03:51:16.000,2024-12-24,2024,12,24,48328,[],()
78597,49445,21372,1,38.75$,2024-07-25T23:24:39.871,,38.75,38.75,38.75,2024-07-25 23:24:39.871,2024-07-25,2024,7,25,49445,[],()
79032,48344,21877,1,75.0$,2024-10-23 17:39,NULL,75.0,75.0,75.0,2024-10-23 17:39:00.000,2024-10-23,2024,10,23,48344,[],()
81405,49762,21901,1,62.99 USD,14:41;31-JUL-2025,NULL,62.99,62.99,62.99,2025-07-31 14:41:00.000,2025-07-31,2025,7,31,49762,[],()
85793,48430,21747,4,32.50$,15-Jan-2025 14:59:45,"328 Buckridge Hollow, New Shirleyberg, MI 66027-1958",32.5,32.5,130.0,2025-01-15 14:59:45.000,2025-01-15,2025,1,15,48430,[],()
82078,47822,21422,2,EUR12.75,"09/24/24, 16:08:33",,15.299999999999999,15.299999999999999,30.6,2024-09-24 16:08:33.000,2024-09-24,2024,9,24,47822,[],()
85426,49999,21714,4,42€75¢,18:54:23;12/25/24,"Suite 362 66022 Peggie Burg, Port Mattieport, IA 97339-4561",5130.0,5130.0,20520.0,2024-12-25 18:54:23.000,2024-12-25,2024,12,25,49999,[],()
83440,48596,21471,1,€21.00,"19-MAY-2024, 20:53:55",,25.2,25.2,25.2,2024-05-19 20:53:55.000,2024-05-19,2024,5,19,48596,[],()
83711,48517,21947,2,60.75$,"04:14:44, 05/28/24",,60.75,60.75,121.5,2024-05-28 04:14:44.000,2024-05-28,2024,5,28,48517,[],()
77863,49639,22046,1,58.5USD,"08:52,07/13/25",NULL,58.5,58.5,58.5,2025-07-13 08:52:00.000,2025-07-13,2025,7,13,49639,[],()
81750,49293,22021,1,$15.5,"16:32:26, 29-Aug-2024","6958 Dietrich Valley, New Rhettbury, NH 05494-6957",15.5,15.5,15.5,2024-08-29 16:32:26.000,2024-08-29,2024,8,29,49293,[],()
85249,49582,21709,1,50.25 $,2025-03-06;17:45,NULL,50.25,50.25,50.25,2025-03-06 17:45:00.000,2025-03-06,2025,3,6,49582,[],()
80602,49566,21749,3,73.25 USD,"19-Feb-2025, 10:58:51 pm",NULL,73.25,73.25,219.75,2025-02-19 22:58:51.000,2025-02-19,2025,2,19,49566,[],()
78131,50443,22024,3,EUR 74.0,"07/25/24,22:23:13",NULL,88.8,88.8,266.4,2024-07-25 22:23:13.000,2024-07-25,2024,7,25,50443,[],()
84909,50180,21331,1,42.99 $,06:52:45 P.M.;2024-12-19,"Apt. 465 940 Luettgen Ford, Port Man, AZ 60841",42.99,42.99,42.99,2024-12-19 18:52:45.000,2024-12-19,2024,12,19,50180,[],()
84942,48525,21388,5,17.99 €," 6-OCT-2024, 05:17:25 am",,21.587999999999997,21.587999999999997,107.94,2024-10-06 05:17:25.000,2024-10-06,2024,10,6,48525,[],()
79656,50732,21967,1,$ 42.,2024-12-16;01:41,"Apt. 450 69390 Zboncak Lodge, North Malkabury, NE 83529-4080",42.0,42.0,42.0,2024-12-16 01:41:00.000,2024-12-16,2024,12,16,50732,[],()
81775,49682,21807,1,30.75 USD,"18:46:00, 2024-10-06",NULL,30.75,30.75,30.75,2024-10-06 18:46:00.000,2024-10-06,2024,10,6,49682,[],()
78872,49313,21724,1,$ 17.0,22.02.2025 20:05:05,,17.0,17.0,17.0,2025-02-22 20:05:05.000,2025-02-22,2025,2,22,49313,[],()
84655,48463,21636,1,17.0 USD,2025-08-04T01:36:29,NULL,17.0,17.0,17.0,2025-08-04 01:36:29.000,2025-08-04,2025,8,4,48463,[],()
83618,47720,21552,5,68.0$,07:52:28 am 2024-12-25,,68.0,68.0,340.0,2024-12-25 07:52:28.000,2024-12-25,2024,12,25,47720,[],()
84821,50284,21393,1,57.50€,09/13/24 10:55:31 am,"Apt. 668 822 Alexis Prairie, Kunzemouth, PA 54891-5574",69.0,69.0,69.0,2024-09-13 10:55:31.000,2024-09-13,2024,9,13,50284,[],()
81477,49905,21936,5,16.00 USD,21:28:54 18-September-2024,,16.0,16.0,80.0,2024-09-18 21:28:54.000,2024-09-18,2024,9,18,49905,[],()
86428,48211,21924,1,53.50EUR,2025-02-07;22:13:28,"Apt. 194 217 Pfeffer Route, Port Stacyland, SC 14402",64.2,64.2,64.2,2025-02-07 22:13:28.000,2025-02-07,2025,2,7,48211,[],()
82121,48356,21955,1,54.25 USD,"14-Jun-2025, 07:08:46 AM",,54.25,54.25,54.25,2025-06-14 07:08:46.000,2025-06-14,2025,6,14,48356,[],()
81995,49369,21731,1,46.25USD,27-NOV-2024 04:20,"Suite 498 2647 Sanford Key, East Earle, WI 77108-1277",46.25,46.25,46.25,2024-11-27 04:20:00.000,2024-11-27,2024,11,27,49369,[],()
78279,47825,21467,1,46 $,"05:04:40 A.M.,01/06/25",,46.0,46.0,46.0,2025-01-06 05:04:40.000,2025-01-06,2025,1,6,47825,[],()
83413,49629,21560,1,17.00 €,"22:27:17,2024-10-03",NULL,20.4,20.4,20.4,2024-10-03 22:27:17.000,2024-10-03,2024,10,3,49629,[],()
81431,48900,21542,2,$31.99,"06:24, 2025-01-27",NULL,31.99,31.99,63.98,2025-01-27 06:24:00.000,2025-01-27,2025,1,27,48900,[],()
84955,49721,21486,2,$22¢00,"09/27/24, 18:31",,2200.0,2200.0,4400.0,2024-09-27 18:31:00.000,2024-09-27,2024,9,27,49721,[],()
78215,47985,21799,1,31.0EUR,23:46:04;16-October-2024,,37.199999999999996,37.199999999999996,37.2,2024-10-16 23:46:04.000,2024-10-16,2024,10,16,47985,[],()
84212,50923,21459,1,41.USD,2024-08-15T09:24:51,,41.0,41.0,41.0,2024-08-15 09:24:51.000,2024-08-15,2024,8,15,50923,[],()
84010,48499,22055,1,USD 50.50,2025-01-07T01:26:15.825,,50.5,50.5,50.5,2025-01-07 01:26:15.825,2025-01-07,2025,1,7,48499,[],()
79391,50577,21447,1,48.5USD,"01:49:13,2024-09-28",,48.5,48.5,48.5,2024-09-28 01:49:13.000,2024-09-28,2024,9,28,50577,[],()
81236,48214,21407,1,61.00USD,"19:38, 04/26/25",,61.0,61.0,61.0,2025-04-26 19:38:00.000,2025-04-26,2025,4,26,48214,[],()
83436,48123,21647,1,EUR 41.25,"2024-09-05, 03:37:51",,49.5,49.5,49.5,2024-09-05 03:37:51.000,2024-09-05,2024,9,5,48123,[],()
82373,49379,21684,3,55.5 USD,09:39 2025-01-11,NULL,55.5,55.5,166.5,2025-01-11 09:39:00.000,2025-01-11,2025,1,11,49379,[],()
78349,48536,21300,1,USD 39.75,"2024-06-29, 06:02",NULL,39.75,39.75,39.75,2024-06-29 06:02:00.000,2024-06-29,2024,6,29,48536,[],()
82878,50647,21520,1,17.00USD,"16:22,05/06/25",,17.0,17.0,17.0,2025-05-06 16:22:00.000,2025-05-06,2025,5,6,50647,[],()
80960,50751,22056,1,18.00 USD,"09/18/24, 23:06:57","92251 Hamill Knoll, New Deonna, NY 49247",18.0,18.0,18.0,2024-09-18 23:06:57.000,2024-09-18,2024,9,18,50751,[],()
77992,50051,21637,1,50.5 €,10/24/24;17:18:05,,60.599999999999994,60.599999999999994,60.6,2024-10-24 17:18:05.000,2024-10-24,2024,10,24,50051,[],()
86027,50773,22049,2,28.0$,23:53:05;25-Dec-2024,"162 Mose Place, North Taylor, PA 06717",28.0,28.0,56.0,2024-12-25 23:53:05.000,2024-12-25,2024,12,25,50773,[],()
78499,48097,21879,5,54.0$,"02:15:37 P.M., 07/04/24",NULL,54.0,54.0,270.0,2024-07-04 14:15:37.000,2024-07-04,2024,7,4,48097,[],()
81109,49579,21483,1,USD58.,"02:18:58,22-Jan-2025","146 Bartoletti Ford, East Alvarohaven, WA 64997",58.0,58.0,58.0,2025-01-22 02:18:58.000,2025-01-22,2025,1,22,49579,[],()
83358,49081,22032,2,EUR 39.,"00:53, 4-November-2024",,46.8,46.8,93.6,2024-11-04 00:53:00.000,2024-11-04,2024,11,4,49081,[],()
79635,49824,21757,4,19.5€,13:14;2024-10-27,,23.4,23.4,93.6,2024-10-27 13:14:00.000,2024-10-27,2024,10,27,49824,[],()
78846,50006,21592,1,62.00 EUR,2025-01-22 16:55,NULL,74.39999999999999,74.39999999999999,74.4,2025-01-22 16:55:00.000,2025-01-22,2025,1,22,50006,[],()
82757,48384,21554,1,66.25 USD,"2025-02-24, 10:53","9235 Spencer Shore, Dionnechester, VA 50033",66.25,66.25,66.25,2025-02-24 10:53:00.000,2025-02-24,2025,2,24,48384,[],()
84050,48346,21654,3,44.0 $,2024-09-16T16:00:20,,44.0,44.0,132.0,2024-09-16 16:00:20.000,2024-09-16,2024,9,16,48346,[],()
79349,49062,21738,4,41.5 $,2024-04-21 18:52,"612 Denis Haven, Natishachester, NV 39557-0543",41.5,41.5,166.0,2024-04-21 18:52:00.000,2024-04-21,2024,4,21,49062,[],()
80652,47859,21947,1,64.75EUR,"08/28/24,13:42",,77.7,77.7,77.7,2024-08-28 13:42:00.000,2024-08-28,2024,8,28,47859,[],()
78184,49078,21627,1,68.0 $,"17:59, 12/02/24",,68.0,68.0,68.0,2024-12-02 17:59:00.000,2024-12-02,2024,12,2,49078,[],()
82839,47928,21640,2,USD40.0,2025-01-30T11:56:00.739,,40.0,40.0,80.0,2025-01-30 11:56:00.739,2025-01-30,2025,1,30,47928,[],()
85425,50249,21574,2,$47¢00,Sat Jun 22 11:03:39 2024,"Apt. 194 1858 Darryl Gardens, Bayerville, PA 50407-1901",4700.0,4700.0,9400.0,2024-06-22 11:03:39.000,2024-06-22,2024,6,22,50249,[],()
81663,49324,22051,1,USD 29.50,"08:03:22,08/27/25",,29.5,29.5,29.5,2025-08-27 08:03:22.000,2025-08-27,2025,8,27,48461,[],()
79185,48712,21633,1,34. €,13:50 02/23/25,"Apt. 953 2735 Sal Valley, Stantonmouth, IN 37693-5372",40.8,40.8,40.8,2025-02-23 13:50:00.000,2025-02-23,2025,2,23,48712,[],()
78913,49410,21880,1,37.99EUR,07:04:12;2024-10-28,NULL,45.588,45.588,45.59,2024-10-28 07:04:12.000,2024-10-28,2024,10,28,49410,[],()
79089,48940,21680,2,USD 50.75,"06:24:03 P.M.,10/01/24",,50.75,50.75,101.5,2024-10-01 18:24:03.000,2024-10-01,2024,10,1,48940,[],()
81168,47983,21852,2,45.25$,01:43:17 PM;2024-02-25,,45.25,45.25,90.5,2024-02-25 13:43:17.000,2024-02-25,2024,2,25,47983,[],()
84692,48461,21760,1,69.99$,"2025-05-11,05:37:25",NULL,69.99,69.99,69.99,2025-05-11 05:37:25.000,2025-05-11,2025,5,11,48461,[],()
79929,50930,21333,1,USD 70.99,2024-08-29T12:41:13,NULL,70.99,70.99,70.99,2024-08-29 12:41:13.000,2024-08-29,2024,8,29,50930,[],()
79176,47956,21927,1,EUR 34.,"08/12/24, 06:09:13 AM","8678 Sporer Island, Stantonside, GA 61834",40.8,40.8,40.8,2024-08-12 06:09:13.000,2024-08-12,2024,8,12,47956,[],()
85004,48692,21727,1,16.0$,"13:34:34, 28-Jan-2025",,16.0,16.0,16.0,2025-01-28 13:34:34.000,2025-01-28,2025,1,28,48692,[],()
83159,48891,21665,1,73.50USD,2024-07-07T10:01:05,,73.5,73.5,73.5,2024-07-07 10:01:05.000,2024-07-07,2024,7,7,48891,[],()
79585,48900,21384,1,49USD,"20:22, 13-March-2025",,49.0,49.0,49.0,2025-03-13 20:22:00.000,2025-03-13,2025,3,13,48900,[],()
81204,49687,22002,1,EUR 67,"07:47:20 AM, 12/31/24",,80.39999999999999,80.39999999999999,80.4,2024-12-31 07:47:20.000,2024-12-31,2024,12,31,49687,[],()
82372,48596,21638,4,47.99EUR,"05:34:32,12/24/24",,57.588,57.588,230.35,2024-12-24 05:34:32.000,2024-12-24,2024,12,24,48596,[],()
79838,48349,21456,4,67 EUR,2024-12-31T15:00:38,NULL,80.39999999999999,80.39999999999999,321.6,2024-12-31 15:00:38.000,2024-12-31,2024,12,31,48349,[],()
83213,48817,21710,3,70.0 USD,"10:59:20 am,27-Jun-2025",NULL,70.0,70.0,210.0,2025-06-27 10:59:20.000,2025-06-27,2025,6,27,48817,[],()
86038,49707,21653,2,34.0$,2024-12-26 02:44:32 am,,34.0,34.0,68.0,2024-12-26 02:44:32.000,2024-12-26,2024,12,26,49707,[],()
78324,47907,21505,1,42.0 $,23:31:20;01/01/25,"4144 Moore Highway, Venicestad, MT 39430",42.0,42.0,42.0,2025-01-01 23:31:20.000,2025-01-01,2025,1,1,47907,[],()
78483,49066,21550,1,70.00USD,"2025-08-05,09:32:11",,70.0,70.0,70.0,2025-08-05 09:32:11.000,2025-08-05,2025,8,5,49066,[],()
84606,49943,21765,1,22.5 USD,03:17:44;07/22/24,"Apt. 558 564 Hipolito Station, Nikolaushaven, KY 12949",22.5,22.5,22.5,2024-07-22 03:17:44.000,2024-07-22,2024,7,22,49943,[],()
82303,49084,21601,1,57$,"2025-02-09, 17:29:57",,57.0,57.0,57.0,2025-02-09 17:29:57.000,2025-02-09,2025,2,9,49084,[],()
83559,48639,21626,2,USD 34.75,14:49 2025-03-14,NULL,34.75,34.75,69.5,2025-03-14 14:49:00.000,2025-03-14,2025,3,14,48639,[],()
81933,47895,21555,1,47.75USD,"03:50:53 pm, 10/19/24","58882 Dare Village, New Coy, AK 91053",47.75,47.75,47.75,2024-10-19 15:50:53.000,2024-10-19,2024,10,19,47895,[],()
82042,49038,21973,3,70.5$,"12-Jul-2024, 05:18:27 pm","Suite 993 4178 Fay Mall, Rudolfville, MO 01657-1193",70.5,70.5,211.5,2024-07-12 17:18:27.000,2024-07-12,2024,7,12,49038,[],()
80264,48728,21578,1,$20.0,2025-01-13T16:00:59.345,"Suite 669 63203 Cedric Mountain, Kemmerville, NJ 01062",20.0,20.0,20.0,2025-01-13 16:00:59.345,2025-01-13,2025,1,13,48728,[],()
84151,50628,21426,1,€64.25,"00:19, 09/16/24",,77.1,77.1,77.1,2024-09-16 00:19:00.000,2024-09-16,2024,9,16,50628,[],()
79911,47826,21518,1,USD44.0,18:43 03/28/25,,44.0,44.0,44.0,2025-03-28 18:43:00.000,2025-03-28,2025,3,28,47826,[],()
83741,49014,21943,1,70.99USD,2024-09-07 09:36:24,"Apt. 624 887 Rosa Lane, North Ed, RI 86339",70.99,70.99,70.99,2024-09-07 09:36:24.000,2024-09-07,2024,9,7,49014,[],()
79944,50686,21796,3,USD31.00,04/19/25 07:19,,31.0,31.0,93.0,2025-04-19 07:19:00.000,2025-04-19,2025,4,19,50686,[],()
79954,50306,21546,1,48.00 $,2024-08-20T02:55:29.982,NULL,48.0,48.0,48.0,2024-08-20 02:55:29.982,2024-08-20,2024,8,20,50306,[],()
81344,49543,21620,2,USD34.99,18:24;25-Oct-2024,"Apt. 917 6627 Armstrong Forge, West Abrahambury, LA 47576-7509",34.99,34.99,69.98,2024-10-25 18:24:00.000,2024-10-25,2024,10,25,49543,[],()
79242,48693,21845,3,EUR 69.25,"20:45,01/09/25","60036 Bryant Key, New See, OR 98217-7162",83.1,83.1,249.3,2025-01-09 20:45:00.000,2025-01-09,2025,1,9,48693,[],()
84185,50569,21604,1,EUR71.99,12:49:05 AM;2025-02-13,"Suite 880 2340 Doyle Greens, West Mitsukoburgh, MT 35485",86.38799999999999,86.38799999999999,86.39,2025-02-13 00:49:05.000,2025-02-13,2025,2,13,50569,[],()
78998,48096,21744,1,USD54.99,"27-June-2025,09:36",NULL,54.99,54.99,54.99,2025-06-27 09:36:00.000,2025-06-27,2025,6,27,48096,[],()
79872,50156,21775,1,65.99USD,"2024-07-17, 10:24:22 pm","Suite 487 22361 Ziemann Mount, New Jamarton, MT 44091-4800",65.99,65.99,65.99,2024-07-17 22:24:22.000,2024-07-17,2024,7,17,50088,[],()
84436,48464,22004,2,71.00 USD,2024-09-12T15:22:42.624,,71.0,71.0,142.0,2024-09-12 15:22:42.624,2024-09-12,2024,9,12,48464,[],()
79273,47904,21351,1,37.25€,2025-04-23;17:10,,44.699999999999996,44.699999999999996,44.7,2025-04-23 17:10:00.000,2025-04-23,2025,4,23,47904,[],()
80442,49448,21845,1,71.25 €,27-OCT-2024;19:59:59,NULL,85.5,85.5,85.5,2024-10-27 19:59:59.000,2024-10-27,2024,10,27,49448,[],()
85244,47988,21695,1,€72.50,"00:06:06,23-March-2025",,87.0,87.0,87.0,2025-03-23 00:06:06.000,2025-03-23,2025,3,23,47988,[],()
77650,48328,22055,1,54USD,06:50:31 A.M.;15-Oct-2024,NULL,54.0,54.0,54.0,2024-10-15 06:50:31.000,2024-10-15,2024,10,15,48328,[],()
82299,49981,21748,1,USD 23.,"11:49:34 A.M., 2025-05-08",,23.0,23.0,23.0,2025-05-08 11:49:34.000,2025-05-08,2025,5,8,49981,[],()
83578,49002,21618,1,45.50USD,14:04:29 2025-04-29,NULL,45.5,45.5,45.5,2025-04-29 14:04:29.000,2025-04-29,2025,4,29,49002,[],()
82877,49348,22013,1,44.0USD,10/20/24 17:34,NULL,44.0,44.0,44.0,2024-10-20 17:34:00.000,2024-10-20,2024,10,20,49348,[],()
85446,49978,21923,1,17€75¢,2024-11-13T12:14:05,,2130.0,2130.0,2130.0,2024-11-13 12:14:05.000,2024-11-13,2024,11,13,49978,[],()
78066,49098,21929,1,$ 58.75,"08/16/24,09:17","Apt. 794 879 Erich Fields, Emersonshire, DE 29478",58.75,58.75,58.75,2024-08-16 09:17:00.000,2024-08-16,2024,8,16,49098,[],()
77720,48139,21915,1,€35.5,02/03/25;01:58,"851 McLaughlin Crossroad, Kleinfurt, IN 09478",42.6,42.6,42.6,2025-02-03 01:58:00.000,2025-02-03,2025,2,3,48139,[],()
83542,51048,21788,3,USD 24.0,"01:52:26, 13-Nov-2024",,24.0,24.0,72.0,2024-11-13 01:52:26.000,2024-11-13,2024,11,13,47931,[],()
84725,50584,21860,1,USD 43.0,"05:08:45 A.M., 2025-05-03","Apt. 492 51959 Michiko Row, Barrettfurt, CA 40658-5318",43.0,43.0,43.0,2025-05-03 05:08:45.000,2025-05-03,2025,5,3,50584,[],()
79173,50117,21854,3,63.99 $,"05/21/24,21:32:07","579 Mayer Crest, New Bernice, NV 15060-0293",63.99,63.99,191.97,2024-05-21 21:32:07.000,2024-05-21,2024,5,21,50117,[],()
78242,48458,21533,1,53.50 $,"28-SEP-2024, 14:44:19",,53.5,53.5,53.5,2024-09-28 14:44:19.000,2024-09-28,2024,9,28,48458,[],()
77675,48649,21365,3,30. €,"13:21:04,01/13/25",NULL,36.0,36.0,108.0,2025-01-13 13:21:04.000,2025-01-13,2025,1,13,48649,[],()
78700,48495,21684,1,60.25USD,"09/25/24, 09:54",NULL,60.25,60.25,60.25,2024-09-25 09:54:00.000,2024-09-25,2024,9,25,48495,[],()
84523,50396,21850,1,USD60.25,"04:14:02,2024-06-22",NULL,60.25,60.25,60.25,2024-06-22 04:14:02.000,2024-06-22,2024,6,22,50396,[],()
82986,48745,21588,1,63.25 €,19:34:05;07/31/24,,75.89999999999999,75.89999999999999,75.9,2024-07-31 19:34:05.000,2024-07-31,2024,7,31,48745,[],()
83388,50718,21627,1,72.25 USD,2025-01-31T10:09:38.816,,72.25,72.25,72.25,2025-01-31 10:09:38.816,2025-01-31,2025,1,31,50718,[],()
83673,47999,21563,1,72.99 EUR,"14:07, 4-December-2024","957 Kathey Cape, Murrayview, ME 23512-4859",87.588,87.588,87.59,2024-12-04 14:07:00.000,2024-12-04,2024,12,4,47999,[],()
79989,47826,21779,2,€36.50,Fri Sep  6 13:59:44 2024,,43.8,43.8,87.6,2024-09-06 13:59:44.000,2024-09-06,2024,9,6,47826,[],()
78669,49429,21541,2,36.50 $,"2024-08-15,02:37:24","Apt. 855 48825 Nettie Via, Kuvalischester, ND 06992",36.5,36.5,73.0,2024-08-15 02:37:24.000,2024-08-15,2024,8,15,49429,[],()
86369,50053,21912,1,65.00 $,07:57 23-APR-2025,,65.0,65.0,65.0,2025-04-23 07:57:00.000,2025-04-23,2025,4,23,48119,[],()
85714,49710,21597,1,$65.75,2024-12-20T06:02:55,NULL,65.75,65.75,65.75,2024-12-20 06:02:55.000,2024-12-20,2024,12,20,49710,[],()
79436,49908,21699,1,USD21.00,2024-07-03T02:48:24.506,,21.0,21.0,21.0,2024-07-03 02:48:24.506,2024-07-03,2024,7,3,49908,[],()
81707,47784,21800,1,$ 34.0,2024-10-20T19:03:51,,34.0,34.0,34.0,2024-10-20 19:03:51.000,2024-10-20,2024,10,20,47784,[],()
81041,49079,21438,1,€21.,"07:04,25-Apr-2025",NULL,25.2,25.2,25.2,2025-04-25 07:04:00.000,2025-04-25,2025,4,25,49079,[],()
84213,48915,21517,2,$63¢50,2024-09-04;11:55,,6350.0,6350.0,12700.0,2024-09-04 11:55:00.000,2024-09-04,2024,9,4,48915,[],()
84868,48193,21750,1,€ 31.00,2025-07-28T12:43:18.868,NULL,37.199999999999996,37.199999999999996,37.2,2025-07-28 12:43:18.868,2025-07-28,2025,7,28,48193,[],()
79870,50675,21572,1,EUR56.25,2024-10-28T17:23:39.762,NULL,67.5,67.5,67.5,2024-10-28 17:23:39.762,2024-10-28,2024,10,28,50675,[],()
80141,49968,21357,1,25EUR,2024-07-27 04:34,NULL,30.0,30.0,30.0,2024-07-27 04:34:00.000,2024-07-27,2024,7,27,49968,[],()
83228,49202,21705,1,63. €,12:12:41 AM;2025-03-09,"Apt. 655 6139 Lesley Stravenue, Runtebury, CT 50240-2726",75.6,75.6,75.6,2025-03-09 00:12:41.000,2025-03-09,2025,3,9,49202,[],()
82467,50425,21700,1,€43,12:11:29 am;02/07/25,"Apt. 687 3527 Rosenbaum Stravenue, Morarmouth, SD 04680",51.6,51.6,51.6,2025-02-07 00:11:29.000,2025-02-07,2025,2,7,50425,[],()
81607,48973,21782,1,€ 54.0,"03/14/25,06:32:51 A.M.",NULL,64.8,64.8,64.8,2025-03-14 06:32:51.000,2025-03-14,2025,3,14,48973,[],()
84904,50859,21453,1,57.99USD,20:39 10-April-2024,,57.99,57.99,57.99,2024-04-10 20:39:00.000,2024-04-10,2024,4,10,50859,[],()
80178,48369,21549,1,29.50 EUR,11:29:16 am; 1-April-2025,NULL,35.4,35.4,35.4,2025-04-01 11:29:16.000,2025-04-01,2025,4,1,48369,[],()
81644,49576,21976,1,25.00 EUR,2025-01-16T21:24:14.000,,30.0,30.0,30.0,2025-01-16 21:24:14.000,2025-01-16,2025,1,16,49576,[],()
83375,48164,21530,1,53.75 $,"05:48:32 PM,2025-04-04",,53.75,53.75,53.75,2025-04-04 17:48:32.000,2025-04-04,2025,4,4,47890,[],()
79331,50539,22053,1,55.00 $,04:17:36 2025-06-05,,55.0,55.0,55.0,2025-06-05 04:17:36.000,2025-06-05,2025,6,5,50539,[],()
81042,50070,21599,1,58.75 $," 3-FEB-2025,04:07:49 am","Suite 502 837 Gleason Spring, Dickensville, AR 82975",58.75,58.75,58.75,2025-02-03 04:07:49.000,2025-02-03,2025,2,3,50070,[],()
82619,49524,21864,1,73.75$,2025-05-04;20:59:37,NULL,73.75,73.75,73.75,2025-05-04 20:59:37.000,2025-05-04,2025,5,4,49524,[],()
86336,48380,21796,5,€32.99,04:24:45 P.M.; 4-FEB-2025,NULL,39.588,39.588,197.94,2025-02-04 16:24:45.000,2025-02-04,2025,2,4,48380,[],()
79412,47889,21425,2,$32.25,2025-05-29;01:46:29 pm,,32.25,32.25,64.5,2025-05-29 13:46:29.000,2025-05-29,2025,5,29,47889,[],()
80686,50808,21340,1,EUR 51.99,2025-07-23 08:09:27 AM,"878 Bernie Square, Marvinstad, AK 49250",62.388,62.388,62.39,2025-07-23 08:09:27.000,2025-07-23,2025,7,23,50808,[],()
81526,49056,22055,1,53.00$,2025-02-17T00:35:44.040,"Suite 493 3342 Hermiston Harbor, Metzfort, TN 48404",53.0,53.0,53.0,2025-02-17 00:35:44.040,2025-02-17,2025,2,17,49056,[],()
83863,49156,21305,2,€29¢25,11:59:00 A.M.;12/01/24,"Suite 432 4251 Homer Camp, Emmafurt, FL 40965",3510.0,3510.0,7020.0,2024-12-01 11:59:00.000,2024-12-01,2024,12,1,49156,[],()
81186,50058,21529,1,USD17.00,2024-08-25T05:38:05,"Apt. 229 32718 Felipe Harbors, East Myleshaven, MI 15957",17.0,17.0,17.0,2024-08-25 05:38:05.000,2024-08-25,2024,8,25,50058,[],()
80198,49429,21579,2,€70.50,"11/02/24,11:25:36 pm","Apt. 855 48825 Nettie Via, Kuvalischester, ND 06992",84.6,84.6,169.2,2024-11-02 23:25:36.000,2024-11-02,2024,11,2,49429,[],()
83223,51114,21993,4,$48¢25,"23:49, 01/22/25",NULL,4825.0,4825.0,19300.0,2025-01-22 23:49:00.000,2025-01-22,2025,1,22,51114,[],()
82484,49515,21404,1,22.75 €,"13:33, 18-SEP-2024",NULL,27.3,27.3,27.3,2024-09-18 13:33:00.000,2024-09-18,2024,9,18,49515,[],()
79827,48086,21610,3,52.0USD,2025-03-07;20:05,,52.0,52.0,156.0,2025-03-07 20:05:00.000,2025-03-07,2025,3,7,48086,[],()
85113,48822,21393,1,€ 56.75,17-November-2024;06:26:16 AM,,68.1,68.1,68.1,2024-11-17 06:26:16.000,2024-11-17,2024,11,17,48822,[],()
78766,48280,22026,5,USD58.5,2024-08-28T08:32:44,,58.5,58.5,292.5,2024-08-28 08:32:44.000,2024-08-28,2024,8,28,48280,[],()
83600,50604,21545,1,USD 28,21-Dec-2024;17:30:07,"Apt. 599 11579 Farah Brooks, Catriceside, AL 98839-0677",28.0,28.0,28.0,2024-12-21 17:30:07.000,2024-12-21,2024,12,21,50604,[],()
78988,50190,21632,1,EUR71.,"15:39:39, 11/03/24",,85.2,85.2,85.2,2024-11-03 15:39:39.000,2024-11-03,2024,11,3,50190,[],()
85431,48807,22016,1,53.00$,2025-02-24 09:04:36 AM,"Suite 992 81122 Hodkiewicz Well, West Vergietown, MN 94841",53.0,53.0,53.0,2025-02-24 09:04:36.000,2025-02-24,2025,2,24,48807,[],()
84315,49743,21855,1,$56.99,"15:00,2024-10-30",,56.99,56.99,56.99,2024-10-30 15:00:00.000,2024-10-30,2024,10,30,49743,[],()
81167,48917,21738,1,$ 43.99,"13:25, 14-Jun-2025","Suite 525 91868 Travis Ports, New Alisha, WA 09292-1008",43.99,43.99,43.99,2025-06-14 13:25:00.000,2025-06-14,2025,6,14,48917,[],()
80702,50644,21837,1,61.75 USD,2024-10-14T20:04:51.006,NULL,61.75,61.75,61.75,2024-10-14 20:04:51.006,2024-10-14,2024,10,14,50644,[],()
82793,47918,21551,1,USD 19.00,2025-05-18T09:57:03.460,"56689 Morgan Oval, West Todburgh, ID 82464-7304",19.0,19.0,19.0,2025-05-18 09:57:03.460,2025-05-18,2025,5,18,47918,[],()
78983,49835,21957,1,59.25 USD,04:18;11-Mar-2025,,59.25,59.25,59.25,2025-03-11 04:18:00.000,2025-03-11,2025,3,11,49835,[],()
85813,48032,22036,2,44.75 $,Thu Dec  5 01:49:28 2024,NULL,44.75,44.75,89.5,2024-12-05 01:49:28.000,2024-12-05,2024,12,5,48032,[],()
82995,49541,21507,1,€38¢25,"28-August-2024, 12:35:30 am",,4590.0,4590.0,4590.0,2024-08-28 00:35:30.000,2024-08-28,2024,8,28,49541,[],()
85672,50350,21496,1,67. USD,2024-06-27T05:14:48.723,,67.0,67.0,67.0,2024-06-27 05:14:48.723,2024-06-27,2024,6,27,50350,[],()
83374,48415,21396,1,55.50EUR,11:27;2025-01-19,"Suite 630 1959 Tanya Fall, Port Donashire, NC 87039",66.6,66.6,66.6,2025-01-19 11:27:00.000,2025-01-19,2025,1,19,48415,[],()
86187,49341,22052,2,24.99 €,"12/23/24, 06:04",,29.987999999999996,29.987999999999996,59.98,2024-12-23 06:04:00.000,2024-12-23,2024,12,23,49341,[],()
80618,48295,21891,1,66.25USD,08:06:07 A.M.;2024-12-05,,66.25,66.25,66.25,2024-12-05 08:06:07.000,2024-12-05,2024,12,5,48295,[],()
84129,49693,21324,4,$ 30.0,23:26 2025-06-01,,30.0,30.0,120.0,2025-06-01 23:26:00.000,2025-06-01,2025,6,1,49693,[],()
80893,47746,21738,1,44.00 USD,05:14:16 AM;19-Oct-2024,NULL,44.0,44.0,44.0,2024-10-19 05:14:16.000,2024-10-19,2024,10,19,47746,[],()
84977,48367,21598,1,19.25 €,"04:03:38 pm, 2024-08-20","7124 Errol Loop, Robelbury, IN 15807-5202",23.099999999999998,23.099999999999998,23.1,2024-08-20 16:03:38.000,2024-08-20,2024,8,20,48367,[],()
78387,49967,21684,1,USD60.,16:00;04/17/24,"Apt. 728 74750 Rosenbaum Knoll, Murphyland, OR 09067-7581",60.0,60.0,60.0,2024-04-17 16:00:00.000,2024-04-17,2024,4,17,49967,[],()
83343,49886,21391,3,USD 66.0,10:29:01 pm;2024-08-04,"Apt. 499 351 Artie Port, Patiencefort, CA 28855",66.0,66.0,198.0,2024-08-04 22:29:01.000,2024-08-04,2024,8,4,49886,[],()
78778,49034,21443,1,23€00¢,11:31:24 pm;10-FEB-2025,,2760.0,2760.0,2760.0,2025-02-10 23:31:24.000,2025-02-10,2025,2,10,49034,[],()
81455,48961,21690,3,USD 37.75,"13:01:59,  2-Oct-2024",,37.75,37.75,113.25,2024-10-02 13:01:59.000,2024-10-02,2024,10,2,48961,[],()
80711,49299,21450,2,USD 30.75,2024-09-30T20:27:01.086, ,30.75,30.75,61.5,2024-09-30 20:27:01.086,2024-09-30,2024,9,30,49299,[],()
79300,50873,21546,1,46.00 €,05:13:00 am 2025-07-03,"Apt. 790 942 Gaston Lights, South Shaquitaberg, MD 71153",55.199999999999996,55.199999999999996,55.2,2025-07-03 05:13:00.000,2025-07-03,2025,7,3,50873,[],()
83386,50640,21324,1,27.0 $,09/04/24 12:30:35,"604 Bechtelar Meadows, Sudiefort, CT 85757",27.0,27.0,27.0,2024-09-04 12:30:35.000,2024-09-04,2024,9,4,50640,[],()
78084,48352,21658,1,$ 54.5," 6-November-2024,05:36:20",,54.5,54.5,54.5,2024-11-06 05:36:20.000,2024-11-06,2024,11,6,48352,[],()
84478,50651,21892,1,$24¢75,05:39 10/05/24,,2475.0,2475.0,2475.0,2024-10-05 05:39:00.000,2024-10-05,2024,10,5,50651,[],()
83873,48276,21323,1,47.5 USD,"03/20/25,22:49:23",,47.5,47.5,47.5,2025-03-20 22:49:23.000,2025-03-20,2025,3,20,48276,[],()
82187,48102,21452,3,69.0 $,01/16/25 03:51:05 am,,69.0,69.0,207.0,2025-01-16 03:51:05.000,2025-01-16,2025,1,16,48102,[],()
80555,51067,22056,1,21.75$,07:17;31-May-2025,,21.75,21.75,21.75,2025-05-31 07:17:00.000,2025-05-31,2025,5,31,51067,[],()
85494,49394,21495,2,51.99 EUR,2024-11-10T17:53:41,NULL,62.388,62.388,124.78,2024-11-10 17:53:41.000,2024-11-10,2024,11,10,49394,[],()
78683,50944,21585,1,$ 63.5,2024-07-31T16:05:51.450, ,63.5,63.5,63.5,2024-07-31 16:05:51.450,2024-07-31,2024,7,31,50944,[],()
85910,50787,21323,1,47.25 EUR,2024-08-06T14:11:41,,56.699999999999996,56.699999999999996,56.7,2024-08-06 14:11:41.000,2024-08-06,2024,8,6,50787,[],()
82432,49752,21655,3,$ 14.50,04:16:41 am;2024-10-14,"Suite 712 70652 Katia Port, South Brianaberg, NM 52533",14.5,14.5,43.5,2024-10-14 04:16:41.000,2024-10-14,2024,10,14,49152,[],()
82779,49975,21381,1,24.5EUR,2025-04-22T18:51:16,,29.4,29.4,29.4,2025-04-22 18:51:16.000,2025-04-22,2025,4,22,49975,[],()
78019,48362,21518,1,42.0 $,10:36:55 AM;2024-05-07,,42.0,42.0,42.0,2024-05-07 10:36:55.000,2024-05-07,2024,5,7,48362,[],()
81371,47695,21587,5,$ 69.0,2025-01-26;09:55:46,NULL,69.0,69.0,345.0,2025-01-26 09:55:46.000,2025-01-26,2025,1,26,47695,[],()
82504,48706,21652,1,59.25USD,2024-02-24T12:47:33.183,,59.25,59.25,59.25,2024-02-24 12:47:33.183,2024-02-24,2024,2,24,48706,[],()
82405,50894,22037,2,28EUR,08:54:04 P.M.; 7-May-2024,NULL,33.6,33.6,67.2,2024-05-07 20:54:04.000,2024-05-07,2024,5,7,50894,[],()
78681,51013,21425,1,34.5USD,"12-Mar-2025, 11:45",,34.5,34.5,34.5,2025-03-12 11:45:00.000,2025-03-12,2025,3,12,51013,[],()
79081,49539,21398,1,31.99 $,20-NOV-2024;11:49:10 am,NULL,31.99,31.99,31.99,2024-11-20 11:49:10.000,2024-11-20,2024,11,20,49539,[],()
83507,49211,21862,1,EUR 55.00,2025-02-10;14:00:48,,66.0,66.0,66.0,2025-02-10 14:00:48.000,2025-02-10,2025,2,10,49211,[],()
81701,49473,21441,1,26.00 USD,"2025-01-20,16:39:22",,26.0,26.0,26.0,2025-01-20 16:39:22.000,2025-01-20,2025,1,20,49473,[],()
80757,48263,21581,1,USD44.5,04:11;2025-04-17,"519 McClure Skyway, South Ottoview, DE 41110",44.5,44.5,44.5,2025-04-17 04:11:00.000,2025-04-17,2025,4,17,48263,[],()
79428,48085,21424,1,USD 68.50,2024-11-09T17:36:25,"576 Boehm Wall, Jaspershire, MT 64985",68.5,68.5,68.5,2024-11-09 17:36:25.000,2024-11-09,2024,11,9,48085,[],()
80828,50966,22052,1,24.50 USD,11/14/24;03:47:39 P.M.,"Suite 643 894 Cole Estates, New Levi, DE 84511",24.5,24.5,24.5,2024-11-14 15:47:39.000,2024-11-14,2024,11,14,50966,[],()
78179,50621,21426,3,USD 66.99,"14:05,2024-12-11",,66.99,66.99,200.97,2024-12-11 14:05:00.000,2024-12-11,2024,12,11,50621,[],()
80334,49122,21843,2,EUR62.75,05:23:01 AM  4-February-2025,"519 Norbert Ridges, East Vivienneborough, TN 60637",75.3,75.3,150.6,2025-02-04 05:23:01.000,2025-02-04,2025,2,4,49122,[],()
83812,48442,21644,1,36 $,Sat Jul 20 10:41:10 2024,"Suite 685 87307 Kemmer Cliffs, Eunaville, SD 68250-6135",36.0,36.0,36.0,2024-07-20 10:41:10.000,2024-07-20,2024,7,20,48442,[],()
82705,51111,21887,4,$ 35.75,04:04:15;02/05/25,,35.75,35.75,143.0,2025-02-05 04:04:15.000,2025-02-05,2025,2,5,51111,[],()
82446,48290,22050,2,$ 72.99,12.11.2024 23:25:25,"1040 Cristobal Skyway, New Shaunnashire, CA 50987-8527",72.99,72.99,145.98,2024-12-11 23:25:25.000,2024-12-11,2024,12,11,48290,[],()
82598,48958,21425,4,$35¢99,03/22/24;22:58,,3599.0,3599.0,14396.0,2024-03-22 22:58:00.000,2024-03-22,2024,3,22,48958,[],()
77633,47757,22007,1,46.50 EUR,"15:39, 3-APR-2024",NULL,55.8,55.8,55.8,2024-04-03 15:39:00.000,2024-04-03,2024,4,3,47757,[],()
78601,50419,22025,1,USD 59.00,2025-02-03 08:34:55 P.M.,"Apt. 923 7762 Botsford Mountain, Port Milanside, UT 35281",59.0,59.0,59.0,2025-02-03 20:34:55.000,2025-02-03,2025,2,3,50419,[],()
78173,50642,21543,1,€50,06:07:51 PM 2024-12-17,NULL,60.0,60.0,60.0,2024-12-17 18:07:51.000,2024-12-17,2024,12,17,50642,[],()
83430,50055,21655,2,EUR15.50,2025-01-16 10:30:18 pm,,18.599999999999998,18.599999999999998,37.2,2025-01-16 22:30:18.000,2025-01-16,2025,1,16,50055,[],()
85995,47753,22033,2,$ 47.5,04/05/25;03:00:19 am,"Apt. 822 86901 Pura Mountain, South Shizuemouth, IL 94433-4374",47.5,47.5,95.0,2025-04-05 03:00:19.000,2025-04-05,2025,4,5,47753,[],()
78493,50221,21362,1,22.00 USD,"21:22, 2024-05-09",,22.0,22.0,22.0,2024-05-09 21:22:00.000,2024-05-09,2024,5,9,50221,[],()
82649,47969,21602,1,€63.5,"19:07, 2024-12-23",,76.2,76.2,76.2,2024-12-23 19:07:00.000,2024-12-23,2024,12,23,47969,[],()
80713,48895,21896,1,21.5$,"08:07:24 pm, 2025-07-30",,21.5,21.5,21.5,2025-07-30 20:07:24.000,2025-07-30,2025,7,30,48895,[],()
77871,48417,21760,5,68.0 $,14:46;2025-03-23,,68.0,68.0,340.0,2025-03-23 14:46:00.000,2025-03-23,2025,3,23,48417,[],()
80949,50205,21704,1,50.99 EUR,2024-06-27;06:08:14,NULL,61.188,61.188,61.19,2024-06-27 06:08:14.000,2024-06-27,2024,6,27,50205,[],()
78429,50551,21476,1,37.25 $,"10:48:48 P.M.,03/04/25",,37.25,37.25,37.25,2025-03-04 22:48:48.000,2025-03-04,2025,3,4,50551,[],()
78075,51026,21693,5,USD 72.50,"14:16:16,21-June-2025",NULL,72.5,72.5,362.5,2025-06-21 14:16:16.000,2025-06-21,2025,6,21,51026,[],()
84059,48534,21658,2,57.5 EUR,"2024-12-03, 11:05:16",,69.0,69.0,138.0,2024-12-03 11:05:16.000,2024-12-03,2024,12,3,48534,[],()
84290,47952,21587,4,72.75 USD,"19-DEC-2024,15:23",,72.75,72.75,291.0,2024-12-19 15:23:00.000,2024-12-19,2024,12,19,47952,[],()
81171,51057,21904,1,USD44.25,2025-02-20T06:13:38,NULL,44.25,44.25,44.25,2025-02-20 06:13:38.000,2025-02-20,2025,2,20,51057,[],()
77760,49830,21857,1,EUR 17.25,29-October-2024 15:09:32,NULL,20.7,20.7,20.7,2024-10-29 15:09:32.000,2024-10-29,2024,10,29,49830,[],()
83060,49963,21440,1,$25¢75,02/13/25 07:32:24 AM,,2575.0,2575.0,2575.0,2025-02-13 07:32:24.000,2025-02-13,2025,2,13,49963,[],()
85573,49902,21446,1,$13.00,"2024-11-30, 10:47",,13.0,13.0,13.0,2024-11-30 10:47:00.000,2024-11-30,2024,11,30,49902,[],()
79127,48759,21305,2,28.50 USD,01:12:39 A.M.;06/15/24,"Suite 646 79746 Leroy Flat, Port Paulette, WA 62767",28.5,28.5,57.0,2024-06-15 01:12:39.000,2024-06-15,2024,6,15,48759,[],()
80020,48235,21701,5,49€50¢,09/06/24 23:27:54,,5940.0,5940.0,29700.0,2024-09-06 23:27:54.000,2024-09-06,2024,9,6,48235,[],()
82452,49235,21903,1,38.0 USD,01:52;01/22/25,NULL,38.0,38.0,38.0,2025-01-22 01:52:00.000,2025-01-22,2025,1,22,49235,[],()
78233,49153,21755,2,€21¢00,"09:05:46 AM,12/01/24",NULL,2520.0,2520.0,5040.0,2024-12-01 09:05:46.000,2024-12-01,2024,12,1,49153,[],()
82958,49198,21490,2,USD63.5,08:15:48;2024-09-18,"Apt. 178 666 Marcos Mission, West Rhiannonchester, OH 17104",63.5,63.5,127.0,2024-09-18 08:15:48.000,2024-09-18,2024,9,18,49198,[],()
86147,47709,21725,1,€36¢25,06:20 06/24/25,"51916 Elvis Mews, Desireborough, MI 05965",4350.0,4350.0,4350.0,2025-06-24 06:20:00.000,2025-06-24,2025,6,24,47709,[],()
80778,49569,21818,5,23€,2025-02-17 02:04,NULL,27.599999999999998,27.599999999999998,138.0,2025-02-17 02:04:00.000,2025-02-17,2025,2,17,49569,[],()
82208,50060,21920,1,$23¢50,07:01:11;2025-01-14,"446 Noah Ville, South Fausto, CT 70407-9511",2350.0,2350.0,2350.0,2025-01-14 07:01:11.000,2025-01-14,2025,1,14,50060,[],()
85479,48008,21548,2,$ 37.50,"18:15:42,08/16/24",,37.5,37.5,75.0,2024-08-16 18:15:42.000,2024-08-16,2024,8,16,48008,[],()
79731,48748,21445,3,USD14.25,2025-03-14T08:24:56.344,,14.25,14.25,42.75,2025-03-14 08:24:56.344,2025-03-14,2025,3,14,48748,[],()
83770,50989,21507,1,35.25 $,"02:44, 2025-01-07","2859 Gleason Cliffs, North Eugeniomouth, ID 62801-4791",35.25,35.25,35.25,2025-01-07 02:44:00.000,2025-01-07,2025,1,7,50989,[],()
81604,49305,21347,4,30.0EUR,2025-04-27;04:15:17,,36.0,36.0,144.0,2025-04-27 04:15:17.000,2025-04-27,2025,4,27,49305,[],()
77754,49061,21401,4,30.5 EUR,"18-MAR-2025, 12:06",,36.6,36.6,146.4,2025-03-18 12:06:00.000,2025-03-18,2025,3,18,49061,[],()
83493,48764,21628,1,USD46.,"02:12:16 P.M., 03/12/25",NULL,46.0,46.0,46.0,2025-03-12 14:12:16.000,2025-03-12,2025,3,12,48764,[],()
80310,50774,21625,5,€ 17.25,2024-07-05T13:28:56,NULL,20.7,20.7,103.5,2024-07-05 13:28:56.000,2024-07-05,2024,7,5,50774,[],()
85433,50021,21434,1,30$50¢,06:53:12 AM;10/03/24,,3050.0,3050.0,3050.0,2024-10-03 06:53:12.000,2024-10-03,2024,10,3,50021,[],()
83356,47755,21629,1,$45¢00,07.03.2025 17:07:07,"2654 Elvia Flats, Port Catina, ND 49136-7056",4500.0,4500.0,4500.0,2025-07-03 17:07:07.000,2025-07-03,2025,7,3,47755,[],()
82050,50773,21861,1,38.50 USD,2024-12-18;01:56,,38.5,38.5,38.5,2024-12-18 01:56:00.000,2024-12-18,2024,12,18,50773,[],()
85268,49736,21611,2,$ 50.25,"2025-02-20, 06:17:36 PM",NULL,50.25,50.25,100.5,2025-02-20 18:17:36.000,2025-02-20,2025,2,20,49736,[],()
82577,48721,21814,1,41.00USD,2024-12-16T03:57:28.246,,41.0,41.0,41.0,2024-12-16 03:57:28.246,2024-12-16,2024,12,16,48721,[],()
77758,49128,21609,1,€69.50,"05/08/24,07:41:20 A.M.","Apt. 443 952 Tromp Vista, Stacyfort, NE 68350",83.39999999999999,83.39999999999999,83.4,2024-05-08 07:41:20.000,2024-05-08,2024,5,8,49128,[],()
81365,50200,21499,1,52.00 USD,05:33;02/14/25,,52.0,52.0,52.0,2025-02-14 05:33:00.000,2025-02-14,2025,2,14,47871,[],()
80378,48120,21905,1,€ 26.50,"06:33:59 am,2024-07-01",,31.799999999999997,31.799999999999997,31.8,2024-07-01 06:33:59.000,2024-07-01,2024,7,1,48120,[],()
83234,48987,21507,2,$40¢99,2024-12-06;07:11:23 PM,,4099.0,4099.0,8198.0,2024-12-06 19:11:23.000,2024-12-06,2024,12,6,48987,[],()
84660,50880,21617,2,26.5€, 8-October-2024 10:20:11 A.M.,"847 Sanda Village, Lake Velva, AR 22074",31.799999999999997,31.799999999999997,63.6,2024-10-08 10:20:11.000,2024-10-08,2024,10,8,50880,[],()
85036,49870,21927,1,37.99$,"2024-07-23, 04:49:53 A.M.","Suite 692 4051 Powlowski Prairie, South Pasty, DE 06514",37.99,37.99,37.99,2024-07-23 04:49:53.000,2024-07-23,2024,7,23,49870,[],()
81014,49855,21350,1,USD 34.75,22:40:53;2024-06-27,,34.75,34.75,34.75,2024-06-27 22:40:53.000,2024-06-27,2024,6,27,49855,[],()
82640,49837,21398,1,USD 36.00,10/18/24 11:14:29 A.M.,"Suite 983 2009 Heathcote Squares, Port Raeann, MD 86113-1894",36.0,36.0,36.0,2024-10-18 11:14:29.000,2024-10-18,2024,10,18,49837,[],()
84279,49807,21629,1,$42.,2024-08-12;12:49,"Apt. 579 712 Wiegand Land, New Zelmafort, DE 12957-0037",42.0,42.0,42.0,2024-08-12 12:49:00.000,2024-08-12,2024,8,12,49807,[],()
81694,47796,21802,3,EUR45.00,Sun Dec 22 21:42:43 2024,"Apt. 853 163 Reilly Flat, Vincentmouth, NY 21622-6154",54.0,54.0,162.0,2024-12-22 21:42:43.000,2024-12-22,2024,12,22,47796,[],()
82328,48641,21667,1,55.00 EUR,"2024-06-24, 04:41:58",NULL,66.0,66.0,66.0,2024-06-24 04:41:58.000,2024-06-24,2024,6,24,48641,[],()
81461,48483,21622,1,USD 47.99,"23:25:36, 23-May-2025","Apt. 959 77033 Mayert Neck, Flatleyborough, SC 59504",47.99,47.99,47.99,2025-05-23 23:25:36.000,2025-05-23,2025,5,23,48483,[],()
82700,50463,22012,1,€60¢50,24-SEP-2024;10:33:51,NULL,7260.0,7260.0,7260.0,2024-09-24 10:33:51.000,2024-09-24,2024,9,24,50463,[],()
80953,49618,21318,1,USD 27.0,02:07:04 A.M.  5-SEP-2024,,27.0,27.0,27.0,2024-09-05 02:07:04.000,2024-09-05,2024,9,5,50918,[],()
83623,51048,21435,1,$ 35.75,"12:24,03/01/25","88934 Bechtelar Crossroad, Port Lisette, HI 10313",35.75,35.75,35.75,2025-03-01 12:24:00.000,2025-03-01,2025,3,1,47931,[],()
82203,49986,21945,1,USD13.99,19:17:34;2024-12-15,"Suite 353 98935 Vivien Highway, Dooleyborough, WV 80254-3648",13.99,13.99,13.99,2024-12-15 19:17:34.000,2024-12-15,2024,12,15,49986,[],()
85572,50691,21957,1,57.EUR,06:52 2025-03-08,NULL,68.39999999999999,68.39999999999999,68.4,2025-03-08 06:52:00.000,2025-03-08,2025,3,8,50691,[],()
84996,48586,21582,1,$ 62,"2024-05-23, 00:13","Apt. 197 47567 Nicolas Mews, Stantonmouth, WA 22375-4175",62.0,62.0,62.0,2024-05-23 00:13:00.000,2024-05-23,2024,5,23,48586,[],()
79474,50159,21807,4,USD31.5,2024-12-27T00:22:14,,31.5,31.5,126.0,2024-12-27 00:22:14.000,2024-12-27,2024,12,27,50159,[],()
81133,48842,21648,1,$ 22.25,2024-06-20 07:39:17,,22.25,22.25,22.25,2024-06-20 07:39:17.000,2024-06-20,2024,6,20,47953,[],()
82017,50058,21865,2,USD 67.5,19.12.2024 16:23:23,,67.5,67.5,135.0,2024-12-19 16:23:23.000,2024-12-19,2024,12,19,50058,[],()
77655,48855,21349,1,€ 64.50,10:04:56 A.M. 12/07/24,NULL,77.39999999999999,77.39999999999999,77.4,2024-12-07 10:04:56.000,2024-12-07,2024,12,7,48855,[],()
83491,47739,21379,1,25.75 €,16:19; 5-May-2025,,30.9,30.9,30.9,2025-05-05 16:19:00.000,2025-05-05,2025,5,5,47739,[],()
83102,50853,22029,1,USD 68.5,11:23:28 pm 2024-02-08,,68.5,68.5,68.5,2024-02-08 23:23:28.000,2024-02-08,2024,2,8,50853,[],()
81528,48656,21480,1,51.25USD, 9-September-2024;03:15:04 P.M.,"33679 Corrine Vista, North Elliott, DE 83059-3440",51.25,51.25,51.25,2024-09-09 15:15:04.000,2024-09-09,2024,9,9,50279,[],()
80220,49755,21306,1,48.EUR,04:01:38 02/20/25,"Suite 703 29390 Bashirian Radial, Eboniehaven, AL 24390-5983",57.599999999999994,57.599999999999994,57.6,2025-02-20 04:01:38.000,2025-02-20,2025,2,20,49755,[],()
84400,49532,21439,1,€ 39.75,11:45:39 2024-08-12,"Apt. 191 61129 Sawayn Crest, Maximoberg, VT 27156-0286",47.699999999999996,47.699999999999996,47.7,2024-08-12 11:45:39.000,2024-08-12,2024,8,12,49532,[],()
84402,50102,21925,1,30.5 $,21:11:00;07/03/25,,30.5,30.5,30.5,2025-07-03 21:11:00.000,2025-07-03,2025,7,3,50102,[],()
86477,48154,21932,1,€24¢50,"2025-04-05,04:01:14 pm",NULL,2940.0,2940.0,2940.0,2025-04-05 16:01:14.000,2025-04-05,2025,4,5,48154,[],()
78497,48225,21962,1,63.€,"15:44:26,25-Dec-2024",NULL,75.6,75.6,75.6,2024-12-25 15:44:26.000,2024-12-25,2024,12,25,48225,[],()
78950,48131,21610,1,52.75 $,"28-Jul-2024,14:37:33",,52.75,52.75,52.75,2024-07-28 14:37:33.000,2024-07-28,2024,7,28,48131,[],()
82898,50528,21321,1,$ 63.50,"01:24,03/19/25","7197 Mills Freeway, Port Michaleborough, ME 65103-8025",63.5,63.5,63.5,2025-03-19 01:24:00.000,2025-03-19,2025,3,19,50528,[],()
78027,49467,21614,1,USD54.0,"19:34,11-June-2025","Apt. 326 4315 Littel Forks, Metzstad, TN 15973",54.0,54.0,54.0,2025-06-11 19:34:00.000,2025-06-11,2025,6,11,49467,[],()
84081,49613,21936,4,$19¢75,"08/19/24, 03:31:59 A.M.","Apt. 123 144 Monte Pass, Lake Nelida, NH 91403-2650",1975.0,1975.0,7900.0,2024-08-19 03:31:59.000,2024-08-19,2024,8,19,49613,[],()
80424,49663,21589,4,60.25 USD,"15:31,2025-01-31",,60.25,60.25,241.0,2025-01-31 15:31:00.000,2025-01-31,2025,1,31,49663,[],()
85710,50916,21846,5,USD23.5,25-September-2024 04:11,,23.5,23.5,117.5,2024-09-25 04:11:00.000,2024-09-25,2024,9,25,50916,[],()
77788,50301,21970,1,$ 70.99,"10/17/24,00:53:24",NULL,70.99,70.99,70.99,2024-10-17 00:53:24.000,2024-10-17,2024,10,17,50301,[],()
82890,50983,21964,1,70.5€,2025-02-15 02:43:25 A.M.,,84.6,84.6,84.6,2025-02-15 02:43:25.000,2025-02-15,2025,2,15,50983,[],()
83457,47794,21644,1,USD 32.00,"05/05/25,16:29",,32.0,32.0,32.0,2025-05-05 16:29:00.000,2025-05-05,2025,5,5,47794,[],()
81596,49125,21631,1,27.99EUR,04/23/25;12:31,"78346 Edmundo Heights, Huelshire, VA 41518-0607",33.587999999999994,33.587999999999994,33.59,2025-04-23 12:31:00.000,2025-04-23,2025,4,23,49125,[],()
79135,49641,21355,1,59.25 $,"08/30/24, 22:22:43",NULL,59.25,59.25,59.25,2024-08-30 22:22:43.000,2024-08-30,2024,8,30,49641,[],()
80179,50053,21393,3,$ 57.5,2024-05-15T11:46:47.555,,57.5,57.5,172.5,2024-05-15 11:46:47.555,2024-05-15,2024,5,15,48119,[],()
79370,48580,21957,5,$57.25,"2024-11-16,13:03","904 Ryan Mission, East Thad, NV 72964",57.25,57.25,286.25,2024-11-16 13:03:00.000,2024-11-16,2024,11,16,48580,[],()
78707,50452,22040,1,USD 30.0,"01/04/25,04:26","Apt. 665 49322 Susana Forge, Brittshire, IL 79726-3322",30.0,30.0,30.0,2025-01-04 04:26:00.000,2025-01-04,2025,1,4,50452,[],()
83188,47865,21382,1,€48.99,08/26/24;02:12:51 AM,NULL,58.788,58.788,58.79,2024-08-26 02:12:51.000,2024-08-26,2024,8,26,47865,[],()
83791,49585,21773,2,$37.5,"11:17:14 PM,04/08/25","8953 Franklin Spring, West Alvaville, NH 86852",37.5,37.5,75.0,2025-04-08 23:17:14.000,2025-04-08,2025,4,8,49585,[],()
79433,49186,22004,1,68.00 USD,2024-09-06T05:50:16.724,NULL,68.0,68.0,68.0,2024-09-06 05:50:16.724,2024-09-06,2024,9,6,49186,[],()
78714,47887,21928,1,€17¢99,"17-JUN-2025,12:50:19 am","Suite 112 240 Duncan Trail, West Lauren, WV 36366-5128",2158.7999999999997,2158.7999999999997,2158.8,2025-06-17 00:50:19.000,2025-06-17,2025,6,17,49814,[],()
83979,50469,21578,3,EUR 21.99,"02:53:30 AM,2024-12-26",,26.387999999999998,26.387999999999998,79.16,2024-12-26 02:53:30.000,2024-12-26,2024,12,26,50469,[],()
86072,50319,21863,1,€41.25,18:31 01/04/25,,49.5,49.5,49.5,2025-01-04 18:31:00.000,2025-01-04,2025,1,4,50319,[],()
85170,50436,22027,1,30.00 €," 7-April-2024, 06:58:38 A.M.",NULL,36.0,36.0,36.0,2024-04-07 06:58:38.000,2024-04-07,2024,4,7,50436,[],()
85440,48576,21649,2,67.50 USD,"15:54, 03/23/25",,67.5,67.5,135.0,2025-03-23 15:54:00.000,2025-03-23,2025,3,23,48576,[],()
85908,50659,21522,4,$17,2024-10-18T20:42:16,,17.0,17.0,68.0,2024-10-18 20:42:16.000,2024-10-18,2024,10,18,50659,[],()
82560,50770,21492,5,USD27.75,"03/21/25, 22:10:57",,27.75,27.75,138.75,2025-03-21 22:10:57.000,2025-03-21,2025,3,21,50770,[],()
79962,50209,21316,2,EUR30.99,"17:42,01/03/25",,37.187999999999995,37.187999999999995,74.38,2025-01-03 17:42:00.000,2025-01-03,2025,1,3,50209,[],()
78563,49879,21659,5,34.5 $,12-Nov-2024;17:10,NULL,34.5,34.5,172.5,2024-11-12 17:10:00.000,2024-11-12,2024,11,12,49879,[],()
86343,48922,21907,4,€ 53.50, 7-Mar-2025;03:30:41,NULL,64.2,64.2,256.8,2025-03-07 03:30:41.000,2025-03-07,2025,3,7,48922,[],()
82551,49718,21815,1,USD14.50,03/08/25 16:57,,14.5,14.5,14.5,2025-03-08 16:57:00.000,2025-03-08,2025,3,8,49718,[],()
86508,49181,21438,1,€ 23.50,"17:16:08,11/11/24",NULL,28.2,28.2,28.2,2024-11-11 17:16:08.000,2024-11-11,2024,11,11,49181,[],()
85542,49630,21690,2,$42.00,"06:17:54, 12/22/24",,42.0,42.0,84.0,2024-12-22 06:17:54.000,2024-12-22,2024,12,22,49630,[],()
82903,51010,21496,1,69.00USD,10/03/24;12:00:03 AM,,69.0,69.0,69.0,2024-10-03 00:00:03.000,2024-10-03,2024,10,3,51010,[],()
85644,49855,21489,1,$ 19.99,"00:13,  2-Mar-2025",,19.99,19.99,19.99,2025-03-02 00:13:00.000,2025-03-02,2025,3,2,49855,[],()
80482,49085,21953,1,EUR40.00,10-Sep-2024;04:02:55 pm,,48.0,48.0,48.0,2024-09-10 16:02:55.000,2024-09-10,2024,9,10,49085,[],()
78040,50054,21745,1,$ 18.99,03/19/25 01:39:53,,18.99,18.99,18.99,2025-03-19 01:39:53.000,2025-03-19,2025,3,19,50054,[],()
83915,50702,21326,1,$ 69.5,04:18:35 2024-04-11,,69.5,69.5,69.5,2024-04-11 04:18:35.000,2024-04-11,2024,4,11,50702,[],()
79342,49221,21364,5,72.50€,02:20:02 pm  7-Apr-2025,,87.0,87.0,435.0,2025-04-07 14:20:02.000,2025-04-07,2025,4,7,49221,[],()
84207,50586,21303,2,USD55.0,2024-05-27T03:20:05,"Apt. 707 32276 Will Village, East Ruebenmouth, KY 25829",55.0,55.0,110.0,2024-05-27 03:20:05.000,2024-05-27,2024,5,27,50586,[],()
78333,50507,21685,1,EUR 61.25,"02:14:31,04/08/25",NULL,73.5,73.5,73.5,2025-04-08 02:14:31.000,2025-04-08,2025,4,8,49241,[],()
85040,49789,21408,2,USD42.50,"09:59, 12/03/24",,42.5,42.5,85.0,2024-12-03 09:59:00.000,2024-12-03,2024,12,3,49789,[],()
78148,50992,21628,1,EUR 43.0,"16-July-2024, 22:40","Suite 206 894 Doug Ville, Pacochatown, LA 06048",51.6,51.6,51.6,2024-07-16 22:40:00.000,2024-07-16,2024,7,16,50992,[],()
78345,48681,22015,1,62$,2024-11-26T18:14:24,NULL,62.0,62.0,62.0,2024-11-26 18:14:24.000,2024-11-26,2024,11,26,48681,[],()
77987,47806,21521,4,EUR48.5,2024-11-16T19:04:44.085,,58.199999999999996,58.199999999999996,232.8,2024-11-16 19:04:44.085,2024-11-16,2024,11,16,47806,[],()
81569,50323,21901,1,62 $,08:53:56 P.M.; 7-October-2024,,62.0,62.0,62.0,2024-10-07 20:53:56.000,2024-10-07,2024,10,7,50323,[],()
85313,47697,21461,3,73.0 USD,13:09;06/22/24,,73.0,73.0,219.0,2024-06-22 13:09:00.000,2024-06-22,2024,6,22,47697,[],()
78399,47770,21508,1,26EUR, 8-Oct-2024 04:01:21,"Suite 632 8198 Crona Brooks, West Season, IN 72744-8982",31.2,31.2,31.2,2024-10-08 04:01:21.000,2024-10-08,2024,10,8,47770,[],()
80369,50651,21655,3,EUR16.25,21:34; 5-Aug-2025,,19.5,19.5,58.5,2025-08-05 21:34:00.000,2025-08-05,2025,8,5,50651,[],()
82571,48998,21320,1,$58.75,13.01.2025 17:13:13,,58.75,58.75,58.75,2025-01-13 17:13:13.000,2025-01-13,2025,1,13,48998,[],()
84654,49365,21821,1,67.75USD,2025-04-12;02:47,,67.75,67.75,67.75,2025-04-12 02:47:00.000,2025-04-12,2025,4,12,49365,[],()
84756,49508,21306,1,46.50 €,"08:03:43 P.M.,19-September-2024",,55.8,55.8,55.8,2024-09-19 20:03:43.000,2024-09-19,2024,9,19,49508,[],()
78364,48117,21302,4,USD 24.00,"05:54:31 PM, 17-October-2024",,24.0,24.0,96.0,2024-10-17 17:54:31.000,2024-10-17,2024,10,17,48117,[],()
84551,51057,22049,2,€ 30.00,"02/10/24,02:09:51 PM",,36.0,36.0,72.0,2024-02-10 14:09:51.000,2024-02-10,2024,2,10,51057,[],()
84921,48748,21313,1,40.99$,04:11:53 AM; 4-March-2025,,40.99,40.99,40.99,2025-03-04 04:11:53.000,2025-03-04,2025,3,4,48748,[],()
82799,50037,21553,1,$43.5,2025-07-12 09:09,NULL,43.5,43.5,43.5,2025-07-12 09:09:00.000,2025-07-12,2025,7,12,50037,[],()
85691,51036,21680,1,$49¢00,"18:38:55,10/14/24",,4900.0,4900.0,4900.0,2024-10-14 18:38:55.000,2024-10-14,2024,10,14,51036,[],()
78941,50373,21595,2,€ 56.50,2024-10-26T19:00:30,"3451 Jacobson Trace, South Dalilatown, MS 41191",67.8,67.8,135.6,2024-10-26 19:00:30.000,2024-10-26,2024,10,26,50373,[],()
83795,48922,22028,5,60.00$,"2024-06-06, 05:06","Suite 137 6392 Antonio Rue, Pourosview, UT 76841",60.0,60.0,300.0,2024-06-06 05:06:00.000,2024-06-06,2024,6,6,48922,[],()
83052,50403,21454,3,20.5€,12/11/24 08:03:50 P.M.,"366 Angelic Keys, Sandamouth, NM 49502-9440",24.599999999999998,24.599999999999998,73.8,2024-12-11 20:03:50.000,2024-12-11,2024,12,11,50403,[],()
79840,49808,21538,1,EUR72.0,19:36;24-MAR-2025,,86.39999999999999,86.39999999999999,86.4,2025-03-24 19:36:00.000,2025-03-24,2025,3,24,49808,[],()
79102,48532,21755,1,$ 20.75,"27-MAR-2025, 01:13:31 PM",,20.75,20.75,20.75,2025-03-27 13:13:31.000,2025-03-27,2025,3,27,48532,[],()
84300,49126,21383,1,51.50$,"2024-10-24,18:44",NULL,51.5,51.5,51.5,2024-10-24 18:44:00.000,2024-10-24,2024,10,24,49126,[],()
83942,50158,21519,1,$46¢25,2024-12-03T13:15:40.007,"9791 Haley Gardens, Ritchieberg, DE 73798",4625.0,4625.0,4625.0,2024-12-03 13:15:40.007,2024-12-03,2024,12,3,50158,[],()
78864,50361,21948,4,USD61.75,2024-02-26T14:03:30,,61.75,61.75,247.0,2024-02-26 14:03:30.000,2024-02-26,2024,2,26,50361,[],()
85404,50559,21495,2,49.0$,"30-OCT-2024,04:44:06 AM",,49.0,49.0,98.0,2024-10-30 04:44:06.000,2024-10-30,2024,10,30,50559,[],()
78392,48222,21785,3,62.99 $,07:40;12-MAR-2025,,62.99,62.99,188.97,2025-03-12 07:40:00.000,2025-03-12,2025,3,12,48222,[],()
82174,47954,21972,2,$ 19.50,19:29:24;23-Aug-2024,,19.5,19.5,39.0,2024-08-23 19:29:24.000,2024-08-23,2024,8,23,47954,[],()
78574,50415,22005,1,USD 41.99,2025-01-01;20:07:36,"Suite 904 14277 Mraz Ways, Boylehaven, GA 99570-6360",41.99,41.99,41.99,2025-01-01 20:07:36.000,2025-01-01,2025,1,1,50415,[],()
84449,49529,21543,1,50.0$,Fri Feb 14 05:55:15 2025,,50.0,50.0,50.0,2025-02-14 05:55:15.000,2025-02-14,2025,2,14,49529,[],()
81727,49038,21607,4,36.25 USD,"09:25, 2024-12-16",,36.25,36.25,145.0,2024-12-16 09:25:00.000,2024-12-16,2024,12,16,49038,[],()
84956,49529,21946,1,USD54.25,"2024-07-03, 04:43",NULL,54.25,54.25,54.25,2024-07-03 04:43:00.000,2024-07-03,2024,7,3,49529,[],()
80478,50846,21481,1,19 €,2025-02-10T12:12:31.596,,22.8,22.8,22.8,2025-02-10 12:12:31.596,2025-02-10,2025,2,10,50846,[],()
78921,49737,22043,3,13.50$,2024-10-17T00:15:36.680,,13.5,13.5,40.5,2024-10-17 00:15:36.680,2024-10-17,2024,10,17,49737,[],()
82726,49631,21438,1,18.50 USD,"15:57,04/11/25",,18.5,18.5,18.5,2025-04-11 15:57:00.000,2025-04-11,2025,4,11,47727,[],()
78386,49051,21616,1,41.00USD,01:13:47 P.M. 05/23/25,"2576 Casper Ranch, South Kathy, MI 17170",41.0,41.0,41.0,2025-05-23 13:13:47.000,2025-05-23,2025,5,23,49051,[],()
77929,50131,21721,2,52$25¢,04:22:35 am;2025-06-07,"Suite 160 1378 Leida Corners, Lake Darren, OR 50412",5225.0,5225.0,10450.0,2025-06-07 04:22:35.000,2025-06-07,2025,6,7,50131,[],()
85666,48281,22041,3,38.75 EUR,07:50:06 P.M.;29-Mar-2025,NULL,46.5,46.5,139.5,2025-03-29 19:50:06.000,2025-03-29,2025,3,29,48281,[],()
81157,49750,21358,1,$ 18.75,19.11.2024 17:21:21,"Apt. 739 4624 Farrell Ridges, Michaleberg, PA 01788-8941",18.75,18.75,18.75,2024-11-19 17:21:21.000,2024-11-19,2024,11,19,49750,[],()
83246,49076,21399,1,$ 64.00," 2-MAY-2024, 01:13:02 P.M.",,64.0,64.0,64.0,2024-05-02 13:13:02.000,2024-05-02,2024,5,2,49076,[],()
80479,50876,21786,1,49.50€,"2024-10-18, 01:15:20 PM",,59.4,59.4,59.4,2024-10-18 13:15:20.000,2024-10-18,2024,10,18,50876,[],()
81293,49577,21641,1,30.25$,03:50:16 AM 01/02/25,,30.25,30.25,30.25,2025-01-02 03:50:16.000,2025-01-02,2025,1,2,49577,[],()
78942,49987,21819,1,63.5 USD,07:36:36 P.M.;12/05/24,NULL,63.5,63.5,63.5,2024-12-05 19:36:36.000,2024-12-05,2024,12,5,49987,[],()
83034,47983,21810,1,USD50.50,09:44:39;2024-05-12,,50.5,50.5,50.5,2024-05-12 09:44:39.000,2024-05-12,2024,5,12,47983,[],()
85364,49408,21670,2,USD 21.5,04:45:09 PM  5-OCT-2024,"1702 Schamberger Tunnel, Thielhaven, WV 18566-8616",21.5,21.5,43.0,2024-10-05 16:45:09.000,2024-10-05,2024,10,5,49408,[],()
81397,51056,21793,2,27.50 $,2024-12-01T04:20:30.792,,27.5,27.5,55.0,2024-12-01 04:20:30.792,2024-12-01,2024,12,1,51056,[],()
79052,50569,21439,1,EUR38.99,"2025-06-13,16:16:54",,46.788000000000004,46.788000000000004,46.79,2025-06-13 16:16:54.000,2025-06-13,2025,6,13,50569,[],()
81941,50952,21660,1,30.0€,"01:11,07/26/24",,36.0,36.0,36.0,2024-07-26 01:11:00.000,2024-07-26,2024,7,26,50952,[],()
83270,50710,21925,1,25.00USD,2024-12-22T02:52:48,,25.0,25.0,25.0,2024-12-22 02:52:48.000,2024-12-22,2024,12,22,50710,[],()
82851,50275,21467,1,$46¢99,"23:55:09, 25-July-2024","Suite 600 5502 Corwin Inlet, Tremblayborough, MT 96902",4699.0,4699.0,4699.0,2024-07-25 23:55:09.000,2024-07-25,2024,7,25,50275,[],()
78519,49989,22049,1,USD30.75,01:26:41 pm 2025-03-07,NULL,30.75,30.75,30.75,2025-03-07 13:26:41.000,2025-03-07,2025,3,7,49989,[],()
81279,49035,21328,1,EUR 62.0,01:52:56 AM 2024-11-18,,74.39999999999999,74.39999999999999,74.4,2024-11-18 01:52:56.000,2024-11-18,2024,11,18,49035,[],()
84088,48857,21521,1,$ 49.5,2024-10-09 01:17:20 pm,NULL,49.5,49.5,49.5,2024-10-09 13:17:20.000,2024-10-09,2024,10,9,48857,[],()
83059,49043,21402,1,$ 39.5,"2024-11-02,06:41:01",NULL,39.5,39.5,39.5,2024-11-02 06:41:01.000,2024-11-02,2024,11,2,49043,[],()
77767,49157,21890,1,EUR 68.00,06:35;2025-04-05,NULL,81.6,81.6,81.6,2025-04-05 06:35:00.000,2025-04-05,2025,4,5,49157,[],()
77870,48294,21755,1,USD24.,"2025-04-02, 17:10:33",,24.0,24.0,24.0,2025-04-02 17:10:33.000,2025-04-02,2025,4,2,48294,[],()
78096,49915,21393,1,$ 53.75,12:37:39 PM 2024-10-16,,53.75,53.75,53.75,2024-10-16 12:37:39.000,2024-10-16,2024,10,16,49915,[],()
86082,49391,21555,1,44.00 $,2025-03-23T09:13:18,"5488 Zelma Brooks, Robelstad, NE 21997-2220",44.0,44.0,44.0,2025-03-23 09:13:18.000,2025-03-23,2025,3,23,49391,[],()
85452,50817,21574,2,46.0 $,06:11:07 16-OCT-2024,,46.0,46.0,92.0,2024-10-16 06:11:07.000,2024-10-16,2024,10,16,50817,[],()
84085,49653,21767,1,USD34.99,05:55:20 pm  7-Dec-2024,NULL,34.99,34.99,34.99,2024-12-07 17:55:20.000,2024-12-07,2024,12,7,49653,[],()
85630,48558,21779,1,36.00 USD, 2-Jan-2025;06:51:11 AM,,36.0,36.0,36.0,2025-01-02 06:51:11.000,2025-01-02,2025,1,2,48558,[],()
83720,49393,21472,1,30.50USD,2025-06-11 08:00:48 pm,,30.5,30.5,30.5,2025-06-11 20:00:48.000,2025-06-11,2025,6,11,49393,[],()
82479,49644,21494,1,$62.25,09:33 2024-10-29,,62.25,62.25,62.25,2024-10-29 09:33:00.000,2024-10-29,2024,10,29,49644,[],()
86175,48246,21534,1,18.5 USD,10:11:23 am; 3-Mar-2025,NULL,18.5,18.5,18.5,2025-03-03 10:11:23.000,2025-03-03,2025,3,3,48246,[],()
86006,48721,21779,1,35 $,"2024-10-20, 12:48:20 P.M.","Suite 405 241 Wintheiser Mills, Granvillehaven, NC 07589-1437",35.0,35.0,35.0,2024-10-20 12:48:20.000,2024-10-20,2024,10,20,48721,[],()
84907,50048,21827,2,18$,12/19/24;13:24:56,"403 Mac Extension, West Demetriusview, OH 05740-2654",18.0,18.0,36.0,2024-12-19 13:24:56.000,2024-12-19,2024,12,19,50048,[],()
81940,48632,21386,1,46.0USD,"26-September-2024, 22:03:59",NULL,46.0,46.0,46.0,2024-09-26 22:03:59.000,2024-09-26,2024,9,26,48632,[],()
81475,48420,21407,2,USD58,13:12;01/17/25,,58.0,58.0,116.0,2025-01-17 13:12:00.000,2025-01-17,2025,1,17,49807,[],()
82231,50291,21386,1,USD 46.75,05:31:15 12/24/24,,46.75,46.75,46.75,2024-12-24 05:31:15.000,2024-12-24,2024,12,24,50291,[],()
84769,48937,21849,1,€ 36.5,2024-08-03;13:28,"40334 Mikaela Road, New Scott, SD 95550",43.8,43.8,43.8,2024-08-03 13:28:00.000,2024-08-03,2024,8,3,48937,[],()
79810,51024,21628,1,EUR46.50,2025-02-26 00:08,"318 Goyette Center, New Kaitlinfort, WY 97237",55.8,55.8,55.8,2025-02-26 00:08:00.000,2025-02-26,2025,2,26,51024,[],()
78153,50488,21641,1,€31¢50,12:57:32 am 23-AUG-2024,,3780.0,3780.0,3780.0,2024-08-23 00:57:32.000,2024-08-23,2024,8,23,50488,[],()
84918,50610,21752,1,57.75 €,17-Jan-2025;01:48,,69.3,69.3,69.3,2025-01-17 01:48:00.000,2025-01-17,2025,1,17,50610,[],()
80082,48240,21641,1,32.99 USD,"2024-09-01,19:53:47",,32.99,32.99,32.99,2024-09-01 19:53:47.000,2024-09-01,2024,9,1,48240,[],()
78230,50363,21411,1,34EUR,"07:17, 9-Oct-2024",NULL,40.8,40.8,40.8,2024-10-09 07:17:00.000,2024-10-09,2024,10,9,50363,[],()
79219,47886,22050,1,USD 70.99,13-NOV-2024;15:37:43,,70.99,70.99,70.99,2024-11-13 15:37:43.000,2024-11-13,2024,11,13,47886,[],()
80038,50365,21960,1,EUR 55.,04.10.2024 21:25:25,NULL,66.0,66.0,66.0,2024-04-10 21:25:25.000,2024-04-10,2024,4,10,50365,[],()
84437,48186,21947,5,USD61.,Fri Nov  1 19:13:29 2024,,61.0,61.0,305.0,2024-11-01 19:13:29.000,2024-11-01,2024,11,1,48186,[],()
86291,49666,21762,1,USD 28.50,2024-12-16T10:45:29,,28.5,28.5,28.5,2024-12-16 10:45:29.000,2024-12-16,2024,12,16,49666,[],()
82130,49054,21566,3,24.0 USD,12:07:21 P.M. 06/03/25,"9753 Lawrence Fields, Port Ahmedport, CA 99140",24.0,24.0,72.0,2025-06-03 12:07:21.000,2025-06-03,2025,6,3,49054,[],()
82991,50003,21631,1,26.75USD,2025-02-09 06:42:46 pm,,26.75,26.75,26.75,2025-02-09 18:42:46.000,2025-02-09,2025,2,9,50003,[],()
84162,48527,21703,3,66.0USD,14:38:26 2024-05-23,,66.0,66.0,198.0,2024-05-23 14:38:26.000,2024-05-23,2024,5,23,48527,[],()
85336,50749,21350,2,33.99$,04:58:04 pm;13-June-2024,"Apt. 656 213 Shane Springs, Luettgenfurt, WV 97410",33.99,33.99,67.98,2024-06-13 16:58:04.000,2024-06-13,2024,6,13,50749,[],()
85146,47934,21975,3,69.USD,2024-11-01T17:54:58.940,NULL,69.0,69.0,207.0,2024-11-01 17:54:58.940,2024-11-01,2024,11,1,47934,[],()
84536,49017,21965,3,59.99 USD,"08/27/24, 13:15",NULL,59.99,59.99,179.97,2024-08-27 13:15:00.000,2024-08-27,2024,8,27,49017,[],()
80486,48838,21297,2,26.25 EUR,"07:23,21-Jan-2025",,31.5,31.5,63.0,2025-01-21 07:23:00.000,2025-01-21,2025,1,21,48838,[],()
82486,50791,21999,1,$32¢99,08:38 02/05/25,"Suite 420 264 Walker Light, West Chaunceyborough, OK 62173-1946",3299.0,3299.0,3299.0,2025-02-05 08:38:00.000,2025-02-05,2025,2,5,50791,[],()
79269,48510,21428,1,60. $,11/27/24 11:13:49 A.M.,,60.0,60.0,60.0,2024-11-27 11:13:49.000,2024-11-27,2024,11,27,48510,[],()
80040,50211,21849,2,€34¢75,"21-DEC-2024,12:36:33",,4170.0,4170.0,8340.0,2024-12-21 12:36:33.000,2024-12-21,2024,12,21,50211,[],()
78024,49843,21513,1,$ 15.50,"03:04:23,12/05/24",,15.5,15.5,15.5,2024-12-05 03:04:23.000,2024-12-05,2024,12,5,49843,[],()
86225,48762,21595,1,53€,"11:52,17-FEB-2025","Apt. 107 4533 Kunde Knoll, Schroederburgh, CO 58358",63.599999999999994,63.599999999999994,63.6,2025-02-17 11:52:00.000,2025-02-17,2025,2,17,48762,[],()
85849,48169,21969,1,$ 57.25,04/05/25 10:20:05 P.M.,,57.25,57.25,57.25,2025-04-05 22:20:05.000,2025-04-05,2025,4,5,48169,[],()
82227,51101,21765,1,26.25$,"14:00, 24-December-2024",,26.25,26.25,26.25,2024-12-24 14:00:00.000,2024-12-24,2024,12,24,51101,[],()
81839,49259,21987,2,USD37,"28-AUG-2024, 03:12:21 pm","Suite 870 3141 Raul Trail, South Pamellastad, ND 64510",37.0,37.0,74.0,2024-08-28 15:12:21.000,2024-08-28,2024,8,28,49259,[],()
84407,47899,21996,1,72 EUR,2025-02-03T00:43:49,NULL,86.39999999999999,86.39999999999999,86.4,2025-02-03 00:43:49.000,2025-02-03,2025,2,3,47899,[],()
78006,49374,21510,1,$ 26,"12/20/24, 07:47:33 AM",NULL,26.0,26.0,26.0,2024-12-20 07:47:33.000,2024-12-20,2024,12,20,49374,[],()
85594,49895,21546,1,USD46.75,21:52:05 02/20/25,,46.75,46.75,46.75,2025-02-20 21:52:05.000,2025-02-20,2025,2,20,49895,[],()
85359,47791,21695,1,$75.99,03/23/25;07:53,"Suite 470 539 Morar Ways, North Terresafurt, MD 66539-0923",75.99,75.99,75.99,2025-03-23 07:53:00.000,2025-03-23,2025,3,23,47791,[],()
80048,48798,21531,1,17.99USD,2025-08-13T15:07:31.944,"Apt. 176 81566 Grady Islands, Rafaelview, NV 23601-3743",17.99,17.99,17.99,2025-08-13 15:07:31.944,2025-08-13,2025,8,13,48798,[],()
83615,48842,21389,1,€54¢50,"2024-11-26,01:57:22 pm",NULL,6540.0,6540.0,6540.0,2024-11-26 13:57:22.000,2024-11-26,2024,11,26,47953,[],()
82765,48469,21398,1,35$50¢,11:08:10 P.M.;20-Jan-2025,,3550.0,3550.0,3550.0,2025-01-20 23:08:10.000,2025-01-20,2025,1,20,48469,[],()
86068,50385,21573,1,28.5 EUR,2024-07-10T15:33:31.900,,34.199999999999996,34.199999999999996,34.2,2024-07-10 15:33:31.900,2024-07-10,2024,7,10,50385,[],()
84742,50986,21335,1,€30.00,19:24 2024-06-26,"Apt. 183 1470 Caterina Cape, Trompfurt, OH 69406-2704",36.0,36.0,36.0,2024-06-26 19:24:00.000,2024-06-26,2024,6,26,50986,[],()
84128,49576,21516,2,$58.99,05/12/25 05:51:50,,58.99,58.99,117.98,2025-05-12 05:51:50.000,2025-05-12,2025,5,12,49576,[],()
84618,50962,21815,1,USD 15,"04:06:07 pm,19-January-2025",,15.0,15.0,15.0,2025-01-19 16:06:07.000,2025-01-19,2025,1,19,50962,[],()
79856,48314,21386,1,USD45,00:54:02;07/19/24,"Apt. 987 713 Hudson Station, Geraldobury, SD 60424-2953",45.0,45.0,45.0,2024-07-19 00:54:02.000,2024-07-19,2024,7,19,48314,[],()
79503,49702,21546,3,44.25 EUR,2025-04-29T19:12:37,NULL,53.1,53.1,159.3,2025-04-29 19:12:37.000,2025-04-29,2025,4,29,49702,[],()
86262,48252,21629,1,45.50USD,"26-Jun-2024,12:03:58",NULL,45.5,45.5,45.5,2024-06-26 12:03:58.000,2024-06-26,2024,6,26,48252,[],()
80546,49900,21349,1,€ 67.25,10:31:12 PM;11/26/24,,80.7,80.7,80.7,2024-11-26 22:31:12.000,2024-11-26,2024,11,26,49900,[],()
83846,49943,22042,1,53.00$,12-May-2024;08:51:33 A.M.,"Apt. 558 564 Hipolito Station, Nikolaushaven, KY 12949",53.0,53.0,53.0,2024-05-12 08:51:33.000,2024-05-12,2024,5,12,49943,[],()
84879,49784,21775,1,EUR 69.00,"07/26/25, 07:53",NULL,82.8,82.8,82.8,2025-07-26 07:53:00.000,2025-07-26,2025,7,26,49784,[],()
79769,48530,21614,3,EUR53.75,"23:25:08,2024-06-17","Suite 810 6389 Renner Union, Daughertymouth, MO 06448",64.5,64.5,193.5,2024-06-17 23:25:08.000,2024-06-17,2024,6,17,48530,[],()
85621,48738,21323,1,USD48.5,"03:29, 01/25/25",NULL,48.5,48.5,48.5,2025-01-25 03:29:00.000,2025-01-25,2025,1,25,48738,[],()
79999,50396,21327,1,19.50 USD,2025-03-07T16:51:14.470,,19.5,19.5,19.5,2025-03-07 16:51:14.470,2025-03-07,2025,3,7,50396,[],()
79550,48161,21955,1,$ 55.,"04:00,2024-06-18","Apt. 447 9227 Langosh Flat, South Araceliport, AR 98459-0100",55.0,55.0,55.0,2024-06-18 04:00:00.000,2024-06-18,2024,6,18,48161,[],()
85075,49571,21991,4,71.5 $,10:01:25 05/27/24,NULL,71.5,71.5,286.0,2024-05-27 10:01:25.000,2024-05-27,2024,5,27,49571,[],()
80619,50713,21804,4,$48¢50,2025-01-29T05:22:22,,4850.0,4850.0,19400.0,2025-01-29 05:22:22.000,2025-01-29,2025,1,29,50713,[],()
84462,49372,21525,1,USD37.99,17:25:26 2024-08-16,"Suite 502 51922 Casper Orchard, Shawnchester, KY 16166",37.99,37.99,37.99,2024-08-16 17:25:26.000,2024-08-16,2024,8,16,49372,[],()
78688,49054,21619,4,USD 50.,2024-06-09T04:40:18,NULL,50.0,50.0,200.0,2024-06-09 04:40:18.000,2024-06-09,2024,6,9,49054,[],()
82936,48316,21528,1,USD 44.25,Mon Apr  7 14:53:46 2025,,44.25,44.25,44.25,2025-04-07 14:53:46.000,2025-04-07,2025,4,7,48316,[],()
81446,48244,21560,1,$17,17:49 2025-05-10,,17.0,17.0,17.0,2025-05-10 17:49:00.000,2025-05-10,2025,5,10,48244,[],()
81645,48780,22022,1,54.25USD,2025-06-08T05:24:43.301,,54.25,54.25,54.25,2025-06-08 05:24:43.301,2025-06-08,2025,6,8,48780,[],()
79213,47894,21362,1,€ 21.99,"28-MAR-2025,18:09:38",,26.387999999999998,26.387999999999998,26.39,2025-03-28 18:09:38.000,2025-03-28,2025,3,28,47894,[],()
81641,49418,21568,1,27.00 USD,"07:46,2024-03-26",,27.0,27.0,27.0,2024-03-26 07:46:00.000,2024-03-26,2024,3,26,49418,[],()
83148,49378,21672,1,€69¢00,"07:15:27 am,2024-06-21",NULL,8280.0,8280.0,8280.0,2024-06-21 07:15:27.000,2024-06-21,2024,6,21,49378,[],()
80739,48820,21664,1,47.50$,04:00:58 pm;2025-08-07,NULL,47.5,47.5,47.5,2025-08-07 16:00:58.000,2025-08-07,2025,8,7,48820,[],()
85410,50129,21398,1,EUR31.5,"19:26:01,2024-12-21","Suite 849 997 Stamm Crossing, West Raymondetown, VT 95581",37.8,37.8,37.8,2024-12-21 19:26:01.000,2024-12-21,2024,12,21,50129,[],()
86267,48583,21732,5,$63.00,"17:49,12-November-2024","384 Breana Brooks, West Pearl, NM 13632",63.0,63.0,315.0,2024-11-12 17:49:00.000,2024-11-12,2024,11,12,48583,[],()
80526,50183,21543,1,50.75USD,2024-09-21T01:02:57,,50.75,50.75,50.75,2024-09-21 01:02:57.000,2024-09-21,2024,9,21,50183,[],()
85305,48807,21831,2,€ 53.0,17:36:19 05/03/25,,63.599999999999994,63.599999999999994,127.2,2025-05-03 17:36:19.000,2025-05-03,2025,5,3,48807,[],()
84344,49227,21322,2,€ 30.75,2024-11-30T03:51:29.828,"Apt. 164 618 Terra Ford, Lutherchester, MS 06400-1448",36.9,36.9,73.8,2024-11-30 03:51:29.828,2024-11-30,2024,11,30,49227,[],()
83887,47817,21861,1,$35¢00,"02/18/25, 03:31","Apt. 274 5971 Tomas Rue, Hodkiewiczside, RI 21139-6362",3500.0,3500.0,3500.0,2025-02-18 03:31:00.000,2025-02-18,2025,2,18,47817,[],()
80092,48622,21827,1,$18¢00,19:26:40;26-AUG-2024,,1800.0,1800.0,1800.0,2024-08-26 19:26:40.000,2024-08-26,2024,8,26,48622,[],()
82451,47902,21825,1,38 USD,2025-01-29;17:38:39,NULL,38.0,38.0,38.0,2025-01-29 17:38:39.000,2025-01-29,2025,1,29,47902,[],()
82562,48192,21303,1,54.0EUR,"14-OCT-2024,17:45:34",,64.8,64.8,64.8,2024-10-14 17:45:34.000,2024-10-14,2024,10,14,48192,[],()
82018,50635,21437,1,USD 54.5,2024-12-26 08:36,NULL,54.5,54.5,54.5,2024-12-26 08:36:00.000,2024-12-26,2024,12,26,50635,[],()
77742,49879,21499,1,52.75 USD,2024-12-18T09:31:08,NULL,52.75,52.75,52.75,2024-12-18 09:31:08.000,2024-12-18,2024,12,18,49879,[],()
81550,49886,21898,1,€51.25,02:21:57 25-NOV-2024,"Apt. 499 351 Artie Port, Patiencefort, CA 28855",61.5,61.5,61.5,2024-11-25 02:21:57.000,2024-11-25,2024,11,25,49886,[],()
81047,48585,21315,1,EUR 75.99," 7-April-2025,14:16","14747 Corkery Views, East Ali, MN 48571-1070",91.18799999999999,91.18799999999999,91.19,2025-04-07 14:16:00.000,2025-04-07,2025,4,7,51081,[],()
80150,48791,21790,2,$69¢50,13.08.2024  8:13:13,,6950.0,6950.0,13900.0,2024-08-13 08:13:13.000,2024-08-13,2024,8,13,48791,[],()
86314,47686,21753,1,USD 56.25,03:55:31;15-OCT-2024,,56.25,56.25,56.25,2024-10-15 03:55:31.000,2024-10-15,2024,10,15,47686,[],()
83206,48932,21333,5,€ 66.50,"22-Sep-2025,04:20:09 am",,79.8,79.8,399.0,2025-09-22 04:20:09.000,2025-09-22,2025,9,22,48932,[],()
82802,49066,21481,1,20.99 EUR,"11:42, 02/11/25",,25.188,25.188,25.19,2025-02-11 11:42:00.000,2025-02-11,2025,2,11,49066,[],()
85242,49957,21464,1,66 $,"2025-01-18,22:30:57","3571 Stiedemann Circle, New Canditown, RI 34722",66.0,66.0,66.0,2025-01-18 22:30:57.000,2025-01-18,2025,1,18,49957,[],()
84191,47885,21651,1,66.0 USD,2024-02-20T18:00:56.736,,66.0,66.0,66.0,2024-02-20 18:00:56.736,2024-02-20,2024,2,20,47885,[],()
77713,50969,21442,1,50.99€,2024-09-14;02:55:01,NULL,61.188,61.188,61.19,2024-09-14 02:55:01.000,2024-09-14,2024,9,14,50969,[],()
81657,48690,21687,1,EUR56.25,2024-10-01 04:01,,67.5,67.5,67.5,2024-10-01 04:01:00.000,2024-10-01,2024,10,1,48690,[],()
84396,49613,21631,2,22.75USD,18-March-2025 08:07:28 AM,"Apt. 123 144 Monte Pass, Lake Nelida, NH 91403-2650",22.75,22.75,45.5,2025-03-18 08:07:28.000,2025-03-18,2025,3,18,49613,[],()
85930,49427,21674,1,20.00$,12:17:41 PM;2025-03-11,"97349 Jada Village, Danaburgh, TN 97541-4659",20.0,20.0,20.0,2025-03-11 12:17:41.000,2025-03-11,2025,3,11,49427,[],()
81725,49933,21456,1,63.00 USD,"2024-12-03,05:07",,63.0,63.0,63.0,2024-12-03 05:07:00.000,2024-12-03,2024,12,3,49933,[],()
85474,48002,21551,1,20.75USD,"07:02:50,01/27/25",,20.75,20.75,20.75,2025-01-27 07:02:50.000,2025-01-27,2025,1,27,48002,[],()
83233,48055,21534,1,EUR18.50,"01:21:19 A.M., 02/16/25",,22.2,22.2,22.2,2025-02-16 01:21:19.000,2025-02-16,2025,2,16,48379,[],()
82498,49450,21300,1,€42.0,"23:46:52, 7-May-2024",,50.4,50.4,50.4,2024-05-07 23:46:52.000,2024-05-07,2024,5,7,49450,[],()
79915,50387,21656,1,€ 32.99,"23:36:04,2024-10-11",,39.588,39.588,39.59,2024-10-11 23:36:04.000,2024-10-11,2024,10,11,50387,[],()
79375,48883,21815,1,13.50$,23:58  1-Mar-2025,"2384 Lecia Parkway, East Danille, NM 81132",13.5,13.5,13.5,2025-03-01 23:58:00.000,2025-03-01,2025,3,1,48883,[],()
79653,49588,21345,1,73.00USD,23-May-2024;04:33:37,"96673 Dietrich Ridges, Clarineport, MA 73105",73.0,73.0,73.0,2024-05-23 04:33:37.000,2024-05-23,2024,5,23,49588,[],()
78951,49753,22016,2,49.0$,"08:24:45 A.M., 2025-05-27",,49.0,49.0,98.0,2025-05-27 08:24:45.000,2025-05-27,2025,5,27,49753,[],()
82490,50379,21705,1,65.00EUR,"05:15:04 pm, 06/14/24","6587 Roob Harbors, Schowalterbury, WI 91775",78.0,78.0,78.0,2024-06-14 17:15:04.000,2024-06-14,2024,6,14,50379,[],()
85342,48702,21864,1,€72.25,09:56 11/14/24,,86.7,86.7,86.7,2024-11-14 09:56:00.000,2024-11-14,2024,11,14,48702,[],()
78900,47891,21309,1,27.50$,"01/24/25, 15:25",,27.5,27.5,27.5,2025-01-24 15:25:00.000,2025-01-24,2025,1,24,47891,[],()
78919,50285,21641,2,30. USD,"08:37:44 P.M.,08/27/24",,30.0,30.0,60.0,2024-08-27 20:37:44.000,2024-08-27,2024,8,27,50285,[],()
82978,48917,21835,1,€ 72.0,"2025-01-28, 01:49:47",,86.39999999999999,86.39999999999999,86.4,2025-01-28 01:49:47.000,2025-01-28,2025,1,28,48917,[],()
84365,48409,22044,1,22 EUR,24-October-2024 13:28,"Apt. 862 9769 Robel Cove, East Careyport, MD 67670-3010",26.4,26.4,26.4,2024-10-24 13:28:00.000,2024-10-24,2024,10,24,48409,[],()
79903,49444,21755,1,20.25$," 8-Nov-2024,08:58:21","87090 McClure Point, Binsborough, SD 49703",20.25,20.25,20.25,2024-11-08 08:58:21.000,2024-11-08,2024,11,8,49444,[],()
83462,51029,21492,2,USD25.25,2025-06-02;19:02:33,"Apt. 425 6307 Emanuel Via, Dickstad, PA 19320-6188",25.25,25.25,50.5,2025-06-02 19:02:33.000,2025-06-02,2025,6,2,51029,[],()
85754,49969,21389,1,€52.25,03:28:56 PM;2024-09-23,"1351 Stoltenberg Stravenue, East Arcelia, AZ 35046-9888",62.699999999999996,62.699999999999996,62.7,2024-09-23 15:28:56.000,2024-09-23,2024,9,23,49969,[],()
81309,48025,21370,1,€ 61.99,"2025-04-05,01:44:33","Apt. 604 696 Treutel Union, Torpchester, LA 49623-4781",74.388,74.388,74.39,2025-04-05 01:44:33.000,2025-04-05,2025,4,5,48025,[],()
83620,50717,21622,1,43.50$,"01:48:01 PM, 13-JAN-2025",NULL,43.5,43.5,43.5,2025-01-13 13:48:01.000,2025-01-13,2025,1,13,50717,[],()
79077,48647,22022,1,57.0 EUR, 5-Jan-2025 03:29:52 PM,NULL,68.39999999999999,68.39999999999999,68.4,2025-01-05 15:29:52.000,2025-01-05,2025,1,5,48647,[],()
86455,48936,21784,1,$66.75,03:06;2025-08-02,"Suite 814 212 Hugo Wall, South Jarred, CO 00700-3081",66.75,66.75,66.75,2025-08-02 03:06:00.000,2025-08-02,2025,8,2,48936,[],()
85950,49240,21902,2,€ 24.,"2024-04-12,19:25:54","80403 Littel Drive, South Dana, NM 79107",28.799999999999997,28.799999999999997,57.6,2024-04-12 19:25:54.000,2024-04-12,2024,4,12,49240,[],()
80331,49657,21726,1,EUR48.75,15-Apr-2025;13:47:36,,58.5,58.5,58.5,2025-04-15 13:47:36.000,2025-04-15,2025,4,15,49657,[],()
84355,49089,21753,2,USD58.0,2024-08-26T07:54:36,,58.0,58.0,116.0,2024-08-26 07:54:36.000,2024-08-26,2024,8,26,49089,[],()
79029,50853,21896,1,20.99EUR,09/21/24 09:24:16 A.M.,,25.188,25.188,25.19,2024-09-21 09:24:16.000,2024-09-21,2024,9,21,50853,[],()
85333,48877,21918,1,USD 75.99,2025-02-06T19:24:06,"26501 Dotty Mill, West Gerardohaven, DE 02848",75.99,75.99,75.99,2025-02-06 19:24:06.000,2025-02-06,2025,2,6,48877,[],()
77786,48833,21409,1,USD 64,23:31 09/21/24,NULL,64.0,64.0,64.0,2024-09-21 23:31:00.000,2024-09-21,2024,9,21,48833,[],()
82591,48969,21566,1,EUR24.00,23.06.2024 15:09:09,NULL,28.799999999999997,28.799999999999997,28.8,2024-06-23 15:09:09.000,2024-06-23,2024,6,23,48969,[],()
81867,49123,21440,1,24.99€,"12/02/24,08:24:30",,29.987999999999996,29.987999999999996,29.99,2024-12-02 08:24:30.000,2024-12-02,2024,12,2,49123,[],()
85866,50599,21619,1,52.50 $,2025-07-27T21:24:22.410,,52.5,52.5,52.5,2025-07-27 21:24:22.410,2025-07-27,2025,7,27,50599,[],()
83097,50568,21451,1,€ 75.75,"2025-01-16,07:50:29 A.M.","14681 Claude Crescent, East Juanbury, HI 77617-5124",90.89999999999999,90.89999999999999,90.9,2025-01-16 07:50:29.000,2025-01-16,2025,1,16,50568,[],()
82365,50351,21965,3,$60.25,"2024-05-26,14:54",,60.25,60.25,180.75,2024-05-26 14:54:00.000,2024-05-26,2024,5,26,50351,[],()
79292,50266,21523,2,$ 14.0,"30-JAN-2025,10:26",,14.0,14.0,28.0,2025-01-30 10:26:00.000,2025-01-30,2025,1,30,50412,[],()
83078,50419,21922,1,24.00 $,10/01/24;14:03:06,"Apt. 923 7762 Botsford Mountain, Port Milanside, UT 35281",24.0,24.0,24.0,2024-10-01 14:03:06.000,2024-10-01,2024,10,1,50419,[],()
79713,49490,21393,4,$54.00,22:23;05/21/25,NULL,54.0,54.0,216.0,2025-05-21 22:23:00.000,2025-05-21,2025,5,21,49490,[],()
83379,48620,21385,1,29.99 €,2025-03-28T17:30:41,NULL,35.988,35.988,35.99,2025-03-28 17:30:41.000,2025-03-28,2025,3,28,48620,[],()
81739,49239,21478,1,46.5 USD,"22:13:22, 4-October-2024","Apt. 887 1340 Morar Centers, North Wernerstad, ME 04304",46.5,46.5,46.5,2024-10-04 22:13:22.000,2024-10-04,2024,10,4,49239,[],()
82343,49067,21631,2,27.75 USD,14:46;05/01/25,NULL,27.75,27.75,55.5,2025-05-01 14:46:00.000,2025-05-01,2025,5,1,49067,[],()
79338,49176,21327,3,22.0USD,27.10.2024 18:27:27,,22.0,22.0,66.0,2024-10-27 18:27:27.000,2024-10-27,2024,10,27,49176,[],()
78855,49876,21738,1,$46¢99,2025-04-03 21:48,,4699.0,4699.0,4699.0,2025-04-03 21:48:00.000,2025-04-03,2025,4,3,49876,[],()
83416,50707,21350,2,35.00EUR,08/31/24;22:30:11,"906 Reed Mill, Fritschshire, NV 62622-7620",42.0,42.0,84.0,2024-08-31 22:30:11.000,2024-08-31,2024,8,31,50941,[],()
81857,49512,21948,1,64.50$,2024-10-08T22:38:51.282,NULL,64.5,64.5,64.5,2024-10-08 22:38:51.282,2024-10-08,2024,10,8,49512,[],()
83062,50547,21917,2,63.0 €,"07:37:49,07/20/24","6838 Bins Mountain, Averychester, PA 50500-8814",75.6,75.6,151.2,2024-07-20 07:37:49.000,2024-07-20,2024,7,20,50547,[],()
84452,49509,21349,1,$66.25,"07:59:07 PM,2025-02-26",,66.25,66.25,66.25,2025-02-26 19:59:07.000,2025-02-26,2025,2,26,49509,[],()
80943,50676,21762,1,USD32,03/03/25 16:23,,32.0,32.0,32.0,2025-03-03 16:23:00.000,2025-03-03,2025,3,3,51106,[],()
84848,48811,21763,1,USD35.5,"07/17/24, 03:32:30",,35.5,35.5,35.5,2024-07-17 03:32:30.000,2024-07-17,2024,7,17,48811,[],()
84499,48289,21375,1,USD50.0,"19:42:04,03/05/25",,50.0,50.0,50.0,2025-03-05 19:42:04.000,2025-03-05,2025,3,5,48289,[],()
82224,48245,21941,1,€ 48.75,"2024-11-28, 01:04:59 PM",NULL,58.5,58.5,58.5,2024-11-28 13:04:59.000,2024-11-28,2024,11,28,48245,[],()
77834,48446,22004,1,72.25 USD,"12-Feb-2025, 22:39:46",,72.25,72.25,72.25,2025-02-12 22:39:46.000,2025-02-12,2025,2,12,48446,[],()
82426,48476,21484,1,USD 15.99,19-August-2024 02:25,,15.99,15.99,15.99,2024-08-19 02:25:00.000,2024-08-19,2024,8,19,48476,[],()
86280,50015,21460,1,$64¢99,05:40:24 AM 25-AUG-2024,"4480 Pouros Vista, Markmouth, MO 36832",6499.0,6499.0,6499.0,2024-08-25 05:40:24.000,2024-08-25,2024,8,25,50015,[],()
81257,50688,21445,1,14.99USD,2025-03-19 17:25:00,NULL,14.99,14.99,14.99,2025-03-19 17:25:00.000,2025-03-19,2025,3,19,50688,[],()
85253,47790,21437,2,55.99 $,"04:31, 2024-11-06",NULL,55.99,55.99,111.98,2024-11-06 04:31:00.000,2024-11-06,2024,11,6,47790,[],()
82492,49676,21500,1,28.00 USD,"2025-05-21,08:48:21 pm",NULL,28.0,28.0,28.0,2025-05-21 20:48:21.000,2025-05-21,2025,5,21,49676,[],()
81369,49953,21758,2,$ 44.5,18-Jun-2025 01:46:50 am,"Suite 127 2049 Dinah Divide, Lake Henrytown, LA 36056",44.5,44.5,89.0,2025-06-18 01:46:50.000,2025-06-18,2025,6,18,49953,[],()
80002,48782,21628,1,46.99 USD,"08/10/24, 18:02:45",NULL,46.99,46.99,46.99,2024-08-10 18:02:45.000,2024-08-10,2024,8,10,48782,[],()
83012,47862,21935,1,16.0 €,00:33 2025-05-27,NULL,19.2,19.2,19.2,2025-05-27 00:33:00.000,2025-05-27,2025,5,27,47862,[],()
81786,50365,21919,1,55$,"01:52:43, 2025-05-28",,55.0,55.0,55.0,2025-05-28 01:52:43.000,2025-05-28,2025,5,28,50365,[],()
84205,49654,21927,3,€ 38.25,"09:30, 01/23/25",,45.9,45.9,137.7,2025-01-23 09:30:00.000,2025-01-23,2025,1,23,49654,[],()
80428,47783,21410,1,USD20.5,2024-07-18T14:25:00.693,,20.5,20.5,20.5,2024-07-18 14:25:00.693,2024-07-18,2024,7,18,47783,[],()
85870,50142,21842,2,64.75 USD,29-SEP-2024 04:38,,64.75,64.75,129.5,2024-09-29 04:38:00.000,2024-09-29,2024,9,29,50142,[],()
83460,48330,21434,1,27.0 $,"2024-11-17, 06:29:58 am",NULL,27.0,27.0,27.0,2024-11-17 06:29:58.000,2024-11-17,2024,11,17,48330,[],()
79589,48994,21988,1,47.99 USD,"04:26,07/05/24",,47.99,47.99,47.99,2024-07-05 04:26:00.000,2024-07-05,2024,7,5,48994,[],()
78186,49519,21513,2,€17¢99,"18:26:17, 08/14/24",NULL,2158.7999999999997,2158.7999999999997,4317.6,2024-08-14 18:26:17.000,2024-08-14,2024,8,14,49519,[],()
78412,48375,21928,1,USD 16,2025-02-04T23:24:38.252,NULL,16.0,16.0,16.0,2025-02-04 23:24:38.252,2025-02-04,2025,2,4,48375,[],()
82925,48160,21429,1,29.25 USD,2024-10-12T14:29:06,NULL,29.25,29.25,29.25,2024-10-12 14:29:06.000,2024-10-12,2024,10,12,48160,[],()
83074,49655,21448,1,€20.25,2024-12-04T16:02:11,,24.3,24.3,24.3,2024-12-04 16:02:11.000,2024-12-04,2024,12,4,49655,[],()
82869,49916,21430,1,55.0 EUR,Wed Sep  4 04:24:18 2024,,66.0,66.0,66.0,2024-09-04 04:24:18.000,2024-09-04,2024,9,4,49916,[],()
79092,50088,21384,1,€ 50.0,"2024-09-17,20:28:33","Suite 487 22361 Ziemann Mount, New Jamarton, MT 44091-4800",60.0,60.0,60.0,2024-09-17 20:28:33.000,2024-09-17,2024,9,17,50088,[],()
85824,49809,21311,1,17.0 USD,"05:42,2024-07-13",,17.0,17.0,17.0,2024-07-13 05:42:00.000,2024-07-13,2024,7,13,49809,[],()
83684,48375,21379,2,24.5 $,"2024-03-21,16:10:41","27209 Smith Mews, Lake Rebbeca, VA 21683",24.5,24.5,49.0,2024-03-21 16:10:41.000,2024-03-21,2024,3,21,48375,[],()
83303,50630,21815,1,$15.25,"01/29/25, 01:34","883 Cremin Branch, Nathanialborough, NM 32093",15.25,15.25,15.25,2025-01-29 01:34:00.000,2025-01-29,2025,1,29,50630,[],()
85459,49763,21472,1,$32, 2-April-2025;19:07,,32.0,32.0,32.0,2025-04-02 19:07:00.000,2025-04-02,2025,4,2,49763,[],()
83644,49845,21878,1,54.50USD,"04:25:49 PM, 10/06/24","Suite 414 2744 Chet Squares, New Leticiashire, IN 48521-6815",54.5,54.5,54.5,2024-10-06 16:25:49.000,2024-10-06,2024,10,6,49845,[],()
84297,50388,22031,1,€33¢25,"06:19:31, 03/13/24",NULL,3990.0,3990.0,3990.0,2024-03-13 06:19:31.000,2024-03-13,2024,3,13,50388,[],()
85639,48633,21719,2,60.50 $,18:58 19-Oct-2024,NULL,60.5,60.5,121.0,2024-10-19 18:58:00.000,2024-10-19,2024,10,19,48633,[],()
80626,50965,21428,5,61.75 €,11/10/24;21:58,NULL,74.1,74.1,370.5,2024-11-10 21:58:00.000,2024-11-10,2024,11,10,50965,[],()
83627,49082,21589,1,€ 58.75,25-Aug-2024 09:42,NULL,70.5,70.5,70.5,2024-08-25 09:42:00.000,2024-08-25,2024,8,25,49082,[],()
79218,49937,21693,5,$ 68.99, 7-July-2025 11:09:54 A.M.,,68.99,68.99,344.95,2025-07-07 11:09:54.000,2025-07-07,2025,7,7,49937,[],()
84125,49618,22057,1,EUR52.99,"2024-03-14, 13:54:30","Suite 992 763 Ronny Prairie, Port Neelytown, NC 43283",63.588,63.588,63.59,2024-03-14 13:54:30.000,2024-03-14,2024,3,14,50918,[],()
80511,49725,21790,1,69.USD,2025-03-15T03:55:09,NULL,69.0,69.0,69.0,2025-03-15 03:55:09.000,2025-03-15,2025,3,15,49725,[],()
85900,48460,21676,1,71.99 €, 1-August-2025;11:44:22 A.M.,"512 Abshire Locks, Robelmouth, UT 98895",86.38799999999999,86.38799999999999,86.39,2025-08-01 11:44:22.000,2025-08-01,2025,8,1,48460,[],()
85535,49803,21374,3,70. $,"09/27/24, 06:46",,70.0,70.0,210.0,2024-09-27 06:46:00.000,2024-09-27,2024,9,27,49803,[],()
85288,48717,21951,1,€ 32.0,"17:03,04/04/25","Apt. 304 27477 McKenzie Knolls, New Myrna, MO 43612",38.4,38.4,38.4,2025-04-04 17:03:00.000,2025-04-04,2025,4,4,48717,[],()
82554,50952,21999,1,USD 32.50,10-Dec-2024 09:54,"Apt. 702 5215 Davida Avenue, Nataliefort, MA 42986",32.5,32.5,32.5,2024-12-10 09:54:00.000,2024-12-10,2024,12,10,50952,[],()
78428,50619,21312,2,41$50¢,"30-Dec-2024, 11:02:13 A.M.",,4150.0,4150.0,8300.0,2024-12-30 11:02:13.000,2024-12-30,2024,12,30,50619,[],()
83080,48365,21415,1,62USD,02:44:20 A.M. 27-May-2025,,62.0,62.0,62.0,2025-05-27 02:44:20.000,2025-05-27,2025,5,27,48365,[],()
85027,48360,21573,2,USD 28.5,2024-07-04;13:48:48,NULL,28.5,28.5,57.0,2024-07-04 13:48:48.000,2024-07-04,2024,7,4,48360,[],()
78127,49530,21635,2,USD38.00,"07:23:50 P.M.,2025-03-18","10863 Rozella Lodge, Fredricfort, MS 03922-3512",38.0,38.0,76.0,2025-03-18 19:23:50.000,2025-03-18,2025,3,18,49530,[],()
80417,50311,21791,5,44.75 $,"09:31,17-NOV-2024",NULL,44.75,44.75,223.75,2024-11-17 09:31:00.000,2024-11-17,2024,11,17,48450,[],()
81125,50452,21560,2,€16¢99,"04:00:40 P.M., 2024-10-07",NULL,2038.8,2038.8,4077.6,2024-10-07 16:00:40.000,2024-10-07,2024,10,7,50452,[],()
84622,49951,22024,1,72€25¢,2025-02-13T01:40:19,"Suite 686 3728 Torphy River, East Rob, SC 29580",8670.0,8670.0,8670.0,2025-02-13 01:40:19.000,2025-02-13,2025,2,13,49951,[],()
85006,50182,21941,2,51.00USD,Fri Nov 15 13:31:58 2024,"41489 Harris Street, New Shannon, DE 49251",51.0,51.0,102.0,2024-11-15 13:31:58.000,2024-11-15,2024,11,15,50182,[],()
83557,48107,21686,2,USD 18.,"16:03:32, 17-FEB-2024",NULL,18.0,18.0,36.0,2024-02-17 16:03:32.000,2024-02-17,2024,2,17,48107,[],()
79590,48592,21635,1,$ 38.25,"01:49:01,05/04/24","Apt. 390 184 Stiedemann Shoal, Muellerhaven, GA 33039-5975",38.25,38.25,38.25,2024-05-04 01:49:01.000,2024-05-04,2024,5,4,48592,[],()
83630,49114,21850,1,61.25$,14-DEC-2024 22:25:19,,61.25,61.25,61.25,2024-12-14 22:25:19.000,2024-12-14,2024,12,14,49114,[],()
77616,49876,21870,1,USD 63.0,07/29/24;04:53:40,"7020 McClure Forest, East Jaleesa, TX 97330",63.0,63.0,63.0,2024-07-29 04:53:40.000,2024-07-29,2024,7,29,49876,[],()
84278,48763,22052,1,23.99USD,2024-01-04;15:24,,23.99,23.99,23.99,2024-01-04 15:24:00.000,2024-01-04,2024,1,4,48763,[],()
78985,50657,21799,1,28.5€,"2024-08-28, 05:21",,34.199999999999996,34.199999999999996,34.2,2024-08-28 05:21:00.000,2024-08-28,2024,8,28,50657,[],()
78945,50050,21625,1,17.5USD,"10:07:26 AM,18-December-2024",,17.5,17.5,17.5,2024-12-18 10:07:26.000,2024-12-18,2024,12,18,50050,[],()
84357,48862,21479,1,$61.50,2025-03-02;15:12:16,NULL,61.5,61.5,61.5,2025-03-02 15:12:16.000,2025-03-02,2025,3,2,48862,[],()
77739,50438,21673,1,USD40.,27-May-2025 07:40,,40.0,40.0,40.0,2025-05-27 07:40:00.000,2025-05-27,2025,5,27,50438,[],()
83917,49195,21525,2,$35.00,03:36:31 PM;2025-05-19,"Suite 574 5898 Connelly Canyon, North Leandro, NE 68696",35.0,35.0,70.0,2025-05-19 15:36:31.000,2025-05-19,2025,5,19,49195,[],()
86452,47848,21964,3,USD 69.50,"08/10/24,09:03:13 AM","712 Nathanael Turnpike, Dibbertside, HI 50906",69.5,69.5,208.5,2024-08-10 09:03:13.000,2024-08-10,2024,8,10,47848,[],()
84152,48405,21332,1,12.75 EUR,05:25  1-May-2025,,15.299999999999999,15.299999999999999,15.3,2025-05-01 05:25:00.000,2025-05-01,2025,5,1,48405,[],()
80088,49671,21387,1,$49.5,2025-01-22;19:24:11,,49.5,49.5,49.5,2025-01-22 19:24:11.000,2025-01-22,2025,1,22,49671,[],()
79461,50335,21621,1,70.75 USD,25.06.2024  0:15:15,,70.75,70.75,70.75,2024-06-25 00:15:15.000,2024-06-25,2024,6,25,50335,[],()
86474,50391,21447,1,USD50.5, 8-March-2025;15:24:24,,50.5,50.5,50.5,2025-03-08 15:24:24.000,2025-03-08,2025,3,8,50391,[],()
80263,48080,21670,1,$ 23.0,"15:20,2025-03-03",,23.0,23.0,23.0,2025-03-03 15:20:00.000,2025-03-03,2025,3,3,48080,[],()
78959,50128,21378,1,€34.25,"2025-06-15, 00:26:39","59238 Buckridge Inlet, Lake Eleonora, WV 87319-8042",41.1,41.1,41.1,2025-06-15 00:26:39.000,2025-06-15,2025,6,15,50128,[],()
80385,47720,21749,1,69.0 USD,"20-Mar-2025, 04:03:14",NULL,69.0,69.0,69.0,2025-03-20 04:03:14.000,2025-03-20,2025,3,20,47720,[],()
78776,49281,21385,1,EUR27.25,10-Sep-2024 11:15:22,,32.699999999999996,32.699999999999996,32.7,2024-09-10 11:15:22.000,2024-09-10,2024,9,10,49281,[],()
78023,48696,21820,4,USD30.25,03:14;2024-11-29,,30.25,30.25,121.0,2024-11-29 03:14:00.000,2024-11-29,2024,11,29,48696,[],()
79062,47828,21692,1,64.50USD,2024-08-29T18:16:24.213,"Suite 643 47879 Gottlieb Lodge, Port Sonville, TX 15279-0700",64.5,64.5,64.5,2024-08-29 18:16:24.213,2024-08-29,2024,8,29,47828,[],()
78903,49127,21572,1,54$25¢,"02/15/25,15:08","3936 Blanda Isle, East Vaughn, MA 37116-5826",5425.0,5425.0,5425.0,2025-02-15 15:08:00.000,2025-02-15,2025,2,15,49127,[],()
79640,50802,22049,2,EUR 30.75,"20-Oct-2024, 21:59:16",,36.9,36.9,73.8,2024-10-20 21:59:16.000,2024-10-20,2024,10,20,50802,[],()
79302,47807,21437,4,57. USD,"25-Feb-2025,02:32:58 AM",,57.0,57.0,228.0,2025-02-25 02:32:58.000,2025-02-25,2025,2,25,47807,[],()
82628,47687,21369,1,37$,2025-02-06T19:51:16,,37.0,37.0,37.0,2025-02-06 19:51:16.000,2025-02-06,2025,2,6,47687,[],()
84941,48488,21789,2,$24.75,2024-07-24 05:49:16,,24.75,24.75,49.5,2024-07-24 05:49:16.000,2024-07-24,2024,7,24,48488,[],()
82445,47684,22012,1,62.0EUR,03:34 2024-11-17,,74.39999999999999,74.39999999999999,74.4,2024-11-17 03:34:00.000,2024-11-17,2024,11,17,47684,[],()
77931,50335,21488,1,66.25 $,"10:14,2024-08-08",NULL,66.25,66.25,66.25,2024-08-08 10:14:00.000,2024-08-08,2024,8,8,50335,[],()
80614,50930,21454,2,22.99USD,"05/16/24,02:55:11 AM",,22.99,22.99,45.98,2024-05-16 02:55:11.000,2024-05-16,2024,5,16,50930,[],()
82902,48692,22020,1,€74¢00,03:28:49 am;25-Mar-2025,,8880.0,8880.0,8880.0,2025-03-25 03:28:49.000,2025-03-25,2025,3,25,48692,[],()
78431,50296,22017,1,26.50 USD,06/13/24 02:01:54,"Suite 707 1434 Monahan Lock, Jerrellburgh, MI 56804",26.5,26.5,26.5,2024-06-13 02:01:54.000,2024-06-13,2024,6,13,50296,[],()
83731,47955,21920,1,USD 25.99,2025-06-09 22:48:25,,25.99,25.99,25.99,2025-06-09 22:48:25.000,2025-06-09,2025,6,9,47955,[],()
80683,48571,22028,1,61 USD,05:19:32 P.M.;2024-07-12,,61.0,61.0,61.0,2024-07-12 17:19:32.000,2024-07-12,2024,7,12,48571,[],()
82993,48653,21661,1,69.25 EUR,2024-05-20T23:52:52,"Apt. 594 789 Gerald Forest, Schoenside, WA 47053-6982",83.1,83.1,83.1,2024-05-20 23:52:52.000,2024-05-20,2024,5,20,48653,[],()
79050,48651,21775,1,68.00 $,16.04.2025 13:43:43,,68.0,68.0,68.0,2025-04-16 13:43:43.000,2025-04-16,2025,4,16,48651,[],()
81399,50956,21665,1,USD73.,11:21;21-July-2024,NULL,73.0,73.0,73.0,2024-07-21 11:21:00.000,2024-07-21,2024,7,21,50956,[],()
84406,49701,21361,2,65.00 $,"2024-11-17,01:56:12 pm","13261 Purdy Glens, Shavonmouth, AR 70016-7730",65.0,65.0,130.0,2024-11-17 13:56:12.000,2024-11-17,2024,11,17,49701,[],()
79766,48522,22011,1,$ 73.75,2024-11-15 01:51:45 P.M.,,73.75,73.75,73.75,2024-11-15 13:51:45.000,2024-11-15,2024,11,15,48522,[],()
77900,50667,21996,1,73.99 $,"16:24,15-Mar-2025",NULL,73.99,73.99,73.99,2025-03-15 16:24:00.000,2025-03-15,2025,3,15,50667,[],()
78634,48091,21863,1,41.75EUR,"11/22/24,10:53:34",NULL,50.1,50.1,50.1,2024-11-22 10:53:34.000,2024-11-22,2024,11,22,48091,[],()
86332,50304,21591,1,54 USD,11:35:24;12/10/24,,54.0,54.0,54.0,2024-12-10 11:35:24.000,2024-12-10,2024,12,10,50304,[],()
80276,50854,21803,2,50$00¢,10:48 09/26/24,NULL,5000.0,5000.0,10000.0,2024-09-26 10:48:00.000,2024-09-26,2024,9,26,50854,[],()
83133,49192,21844,2,€39¢25,2024-07-12T09:06:42.272,NULL,4710.0,4710.0,9420.0,2024-07-12 09:06:42.272,2024-07-12,2024,7,12,49192,[],()
86355,48732,21617,1,$22,13:10:15;26-Jun-2025,"746 Fredericka Extension, Reynaldotown, AL 59023-1796",22.0,22.0,22.0,2025-06-26 13:10:15.000,2025-06-26,2025,6,26,48732,[],()
84216,48371,21566,1,28.$,"23-Mar-2025,15:45:46",,28.0,28.0,28.0,2025-03-23 15:45:46.000,2025-03-23,2025,3,23,48371,[],()
84461,49345,21934,4,$ 45.75,23-JUN-2025 23:46,"1505 Greenfelder Fall, West Stephanbury, MI 11548",45.75,45.75,183.0,2025-06-23 23:46:00.000,2025-06-23,2025,6,23,49345,[],()
80269,51121,21605,1,47.0 EUR,Tue May 27 20:59:17 2025,"577 Jordan Rue, Port Sebastianstad, ME 42638-1871",56.4,56.4,56.4,2025-05-27 20:59:17.000,2025-05-27,2025,5,27,51121,[],()
80489,48807,21659,2,33.EUR,"23:14:52,  5-Nov-2024","Suite 992 81122 Hodkiewicz Well, West Vergietown, MN 94841",39.6,39.6,79.2,2024-11-05 23:14:52.000,2024-11-05,2024,11,5,48807,[],()
83777,49771,21828,3,EUR 16.0,25-MAR-2025;18:11,,19.2,19.2,57.6,2025-03-25 18:11:00.000,2025-03-25,2025,3,25,49771,[],()
83983,47791,21555,2,45.25 $,"2025-04-11, 05:55:36 pm",,45.25,45.25,90.5,2025-04-11 17:55:36.000,2025-04-11,2025,4,11,47791,[],()
77803,50436,21818,2,20.$,2024-11-20T11:00:04.173,"970 Tristan Motorway, Sidneybury, LA 76853",20.0,20.0,40.0,2024-11-20 11:00:04.173,2024-11-20,2024,11,20,50436,[],()
82798,50245,21966,3,28.0€,2025-03-27T21:39:25.247,NULL,33.6,33.6,100.8,2025-03-27 21:39:25.247,2025-03-27,2025,3,27,50245,[],()
79775,48110,21373,1,$ 19.00,06:22:20 18-July-2025,NULL,19.0,19.0,19.0,2025-07-18 06:22:20.000,2025-07-18,2025,7,18,50660,[],()
82437,49216,21722,4,€ 33.25,02:01:43 A.M.  6-March-2025,,39.9,39.9,159.6,2025-03-06 02:01:43.000,2025-03-06,2025,3,6,49216,[],()
81254,50354,21701,1,48.5USD,"11:39:05, 18-February-2025","9309 Hassan Manors, Mohrberg, IL 88664-9895",48.5,48.5,48.5,2025-02-18 11:39:05.000,2025-02-18,2025,2,18,50354,[],()
83908,47729,21509,2,USD 41.00,2025-07-10;06:23:12 PM,,41.0,41.0,82.0,2025-07-10 18:23:12.000,2025-07-10,2025,7,10,47729,[],()
81380,49758,21674,1,20.99€,"05/28/25,06:57:47","2673 Madeline Trafficway, Wehnerhaven, AZ 83401",25.188,25.188,25.19,2025-05-28 06:57:47.000,2025-05-28,2025,5,28,49758,[],()
77938,49603,21948,1,65.25 EUR,2025-02-06T03:14:05.072,,78.3,78.3,78.3,2025-02-06 03:14:05.072,2025-02-06,2025,2,6,49603,[],()
84702,47806,21989,1,USD 73.50,03/14/25;16:44,,73.5,73.5,73.5,2025-03-14 16:44:00.000,2025-03-14,2025,3,14,47806,[],()
81538,49924,22039,5,60.50USD,10:16:01 AM 16-Sep-2024,,60.5,60.5,302.5,2024-09-16 10:16:01.000,2024-09-16,2024,9,16,49924,[],()
78801,50314,21939,1,37.5 $,20.05.2024 13:34:34,,37.5,37.5,37.5,2024-05-20 13:34:34.000,2024-05-20,2024,5,20,50314,[],()
81666,48324,21454,1,$24¢25,"02:44:14 A.M.,2024-11-19",,2425.0,2425.0,2425.0,2024-11-19 02:44:14.000,2024-11-19,2024,11,19,48324,[],()
84233,50466,21710,3,71. €,20:20  2-JUN-2024,,85.2,85.2,255.6,2024-06-02 20:20:00.000,2024-06-02,2024,6,2,50466,[],()
83393,49096,21972,1,€18¢00,"2025-04-14, 17:46:22",,2160.0,2160.0,2160.0,2025-04-14 17:46:22.000,2025-04-14,2025,4,14,49096,[],()
85064,48296,21932,1,USD20.75,2024-08-31T01:03:32.990,"62044 Pinkie Keys, Port Willian, IL 80369-2288",20.75,20.75,20.75,2024-08-31 01:03:32.990,2024-08-31,2024,8,31,48296,[],()
80462,49838,21849,1,EUR 34.99,"04:15:19 PM, 2024-08-24",,41.988,41.988,41.99,2024-08-24 16:15:19.000,2024-08-24,2024,8,24,49838,[],()
78545,50158,21371,1,EUR50.99,05:23  9-August-2025,,61.188,61.188,61.19,2025-08-09 05:23:00.000,2025-08-09,2025,8,9,50158,[],()
85566,49376,21937,1,53.0 EUR,2024-10-07 20:20:00,NULL,63.599999999999994,63.599999999999994,63.6,2024-10-07 20:20:00.000,2024-10-07,2024,10,7,49376,[],()
79444,48309,21353,1,$29.00,2024-09-08T17:00:19,,29.0,29.0,29.0,2024-09-08 17:00:19.000,2024-09-08,2024,9,8,48309,[],()
80821,48759,21343,1,75.00 $,11/04/24 10:06:58 A.M.,,75.0,75.0,75.0,2024-11-04 10:06:58.000,2024-11-04,2024,11,4,48759,[],()
81737,48649,21750,1,USD30.5,2024-06-04T22:58:14,NULL,30.5,30.5,30.5,2024-06-04 22:58:14.000,2024-06-04,2024,6,4,48649,[],()
81222,49413,21740,2,56.50USD,01/24/25;19:34,NULL,56.5,56.5,113.0,2025-01-24 19:34:00.000,2025-01-24,2025,1,24,49413,[],()
80501,49914,21625,1,21.5$,"02/05/25,00:45","Suite 417 8864 Karoline Spurs, Lake Daryl, ND 58150",21.5,21.5,21.5,2025-02-05 00:45:00.000,2025-02-05,2025,2,5,49914,[],()
77912,49706,22048,3,$46.00,04/24/24;04:25:59 A.M.,"854 Eric Station, North Lupe, NM 13636",46.0,46.0,138.0,2024-04-24 04:25:59.000,2024-04-24,2024,4,24,49706,[],()
82611,49448,22046,1,USD58.99,12:14  8-August-2024,NULL,58.99,58.99,58.99,2024-08-08 12:14:00.000,2024-08-08,2024,8,8,49448,[],()
86166,50563,21787,2,42.00 USD,15:17;2025-02-13,,42.0,42.0,84.0,2025-02-13 15:17:00.000,2025-02-13,2025,2,13,50563,[],()
85879,48272,21815,1,13.50 $,16.02.2025  8:37:37,"4909 Lisbeth Route, Glennaland, PA 91871",13.5,13.5,13.5,2025-02-16 08:37:37.000,2025-02-16,2025,2,16,48272,[],()
81619,49156,21775,3,$ 66.00,2024-10-07T09:24:02,,66.0,66.0,198.0,2024-10-07 09:24:02.000,2024-10-07,2024,10,7,49156,[],()
79829,50451,21446,1,18.0€,"22:49:08,08/17/24",,21.599999999999998,21.599999999999998,21.6,2024-08-17 22:49:08.000,2024-08-17,2024,8,17,50451,[],()
80113,49306,21936,1,EUR19.99,15.09.2024 19:34:34,NULL,23.987999999999996,23.987999999999996,23.99,2024-09-15 19:34:34.000,2024-09-15,2024,9,15,49306,[],()
80094,49222,21665,1,$69.99,09:35:52 AM 07/01/25,,69.99,69.99,69.99,2025-07-01 09:35:52.000,2025-07-01,2025,7,1,49222,[],()
79111,47996,21578,5,USD18.75,19:54:22 2024-07-29,NULL,18.75,18.75,93.75,2024-07-29 19:54:22.000,2024-07-29,2024,7,29,47996,[],()
84641,47922,21834,1,€30.5,14:35:45;17-April-2025,NULL,36.6,36.6,36.6,2025-04-17 14:35:45.000,2025-04-17,2025,4,17,47922,[],()
79517,48057,21593,1,€ 18.,"12:29:27 P.M., 8-Mar-2025",,21.599999999999998,21.599999999999998,21.6,2025-03-08 12:29:27.000,2025-03-08,2025,3,8,48057,[],()
83884,48071,21712,2,70.0USD,12/19/24 18:46,NULL,70.0,70.0,140.0,2024-12-19 18:46:00.000,2024-12-19,2024,12,19,48071,[],()
84223,51060,21596,2,$35.25,"2024-09-16, 01:06:51 P.M.",NULL,35.25,35.25,70.5,2024-09-16 13:06:51.000,2024-09-16,2024,9,16,51060,[],()
83756,48883,21386,1,EUR46.00,03.07.2025 12:25:25,"2384 Lecia Parkway, East Danille, NM 81132",55.199999999999996,55.199999999999996,55.2,2025-03-07 12:25:25.000,2025-03-07,2025,3,7,48883,[],()
83258,50738,21815,1,$13¢99, 5.04.2025 16:19:19,,1399.0,1399.0,1399.0,2025-05-04 16:19:19.000,2025-05-04,2025,5,4,50738,[],()
80072,48321,21981,1,21.00 €," 6-Jul-2024, 21:12",,25.2,25.2,25.2,2024-07-06 21:12:00.000,2024-07-06,2024,7,6,48321,[],()
81423,50678,21898,1,USD 56,"09/20/24,08:08:57 AM","Suite 295 8050 Bergnaum Walk, Lake Mickeyfurt, RI 53997",56.0,56.0,56.0,2024-09-20 08:08:57.000,2024-09-20,2024,9,20,50678,[],()
80452,48369,21531,1,USD 14.50,2024-06-28T11:21:14,NULL,14.5,14.5,14.5,2024-06-28 11:21:14.000,2024-06-28,2024,6,28,48369,[],()
85427,50148,21590,1,38.5$,2025-01-03T21:41:26.714,NULL,38.5,38.5,38.5,2025-01-03 21:41:26.714,2025-01-03,2025,1,3,51004,[],()
77962,49451,21895,1,$ 17.50,2024-10-26;05:51:06 A.M.,,17.5,17.5,17.5,2024-10-26 05:51:06.000,2024-10-26,2024,10,26,49451,[],()
84329,51017,21662,1,21.5 EUR,10-April-2025 01:48:37,"Apt. 533 906 Jacques Lane, North Reggiehaven, SC 07099",25.8,25.8,25.8,2025-04-10 01:48:37.000,2025-04-10,2025,4,10,51017,[],()
85958,48271,21600,5,24.75€,"23:46:50, 15-FEB-2025",,29.7,29.7,148.5,2025-02-15 23:46:50.000,2025-02-15,2025,2,15,48271,[],()
77685,50855,21687,5,$61¢00,"11/26/24, 04:21:03 PM","553 Alan Dale, Lake Emmanuelton, RI 12999",6100.0,6100.0,30500.0,2024-11-26 16:21:03.000,2024-11-26,2024,11,26,50855,[],()
81621,50108,21850,1,€61,10/14/24 11:12:01,,73.2,73.2,73.2,2024-10-14 11:12:01.000,2024-10-14,2024,10,14,50108,[],()
80892,50423,21597,1,USD 68.5,"12/31/24,15:34",NULL,68.5,68.5,68.5,2024-12-31 15:34:00.000,2024-12-31,2024,12,31,50423,[],()
80637,48923,21976,1,25.99$,"02:45:36 PM, 4-SEP-2024","143 Yen Extension, Noahbury, NV 98629",25.99,25.99,25.99,2024-09-04 14:45:36.000,2024-09-04,2024,9,4,48923,[],()
78034,49546,21396,1,€54¢99,25.10.2024 11:32:32,"261 Jamel Hills, Lake Reina, UT 88015",6598.8,6598.8,6598.8,2024-10-25 11:32:32.000,2024-10-25,2024,10,25,49546,[],()
80285,50501,21966,1,$27¢25,"10/27/24,05:16:36",,2725.0,2725.0,2725.0,2024-10-27 05:16:36.000,2024-10-27,2024,10,27,50501,[],()
80517,48677,21850,1,62.25USD,12/20/24 11:42:03 A.M.,,62.25,62.25,62.25,2024-12-20 11:42:03.000,2024-12-20,2024,12,20,48677,[],()
86479,50879,21731,2,48.25USD,05:16:59 PM;2024-06-14,NULL,48.25,48.25,96.5,2024-06-14 17:16:59.000,2024-06-14,2024,6,14,50879,[],()
78783,49656,21866,1,39.00EUR,"06/15/25, 09:59",NULL,46.8,46.8,46.8,2025-06-15 09:59:00.000,2025-06-15,2025,6,15,49656,[],()
80570,48491,21511,1,25.75$,2024-06-30T07:30:04.186,,25.75,25.75,25.75,2024-06-30 07:30:04.186,2024-06-30,2024,6,30,48491,[],()
81348,50925,21745,4,€ 18.75,2025-04-27T14:57:11,,22.5,22.5,90.0,2025-04-27 14:57:11.000,2025-04-27,2025,4,27,50925,[],()
79933,49766,21727,1,13.99 €,2024-09-09T13:53:08.457,,16.788,16.788,16.79,2024-09-09 13:53:08.457,2024-09-09,2024,9,9,49766,[],()
80085,47947,21952,1,USD 50.50,"03:12:20 am, 03/16/24",,50.5,50.5,50.5,2024-03-16 03:12:20.000,2024-03-16,2024,3,16,47947,[],()
83861,49374,21496,1,69.5USD,2024-07-06T22:25:29.309,,69.5,69.5,69.5,2024-07-06 22:25:29.309,2024-07-06,2024,7,6,49374,[],()
84143,47795,21464,3,USD 62.99,"2025-04-02,16:13",,62.99,62.99,188.97,2025-04-02 16:13:00.000,2025-04-02,2025,4,2,47795,[],()
82461,49118,21907,1,56.5 $,05/15/25;02:27:35,"Apt. 136 6941 Curtis Meadows, New Asleybury, WA 04856-4004",56.5,56.5,56.5,2025-05-15 02:27:35.000,2025-05-15,2025,5,15,49118,[],()
78809,50118,21516,1,€54.50,"08/10/24,07:31:19",NULL,65.39999999999999,65.39999999999999,65.4,2024-08-10 07:31:19.000,2024-08-10,2024,8,10,50118,[],()
82823,48024,21303,2,56.99 USD,"2024-07-31, 16:36",,56.99,56.99,113.98,2024-07-31 16:36:00.000,2024-07-31,2024,7,31,48024,[],()
85201,50125,21755,1,22.25$,"2025-07-27, 09:29:45 A.M.",NULL,22.25,22.25,22.25,2025-07-27 09:29:45.000,2025-07-27,2025,7,27,50125,[],()
77672,48353,21995,2,$42.75,12:24;16-Jan-2025,NULL,42.75,42.75,85.5,2025-01-16 12:24:00.000,2025-01-16,2025,1,16,48353,[],()
81953,49072,21371,1,$53¢00,"13:48:39,  9-January-2025","Apt. 597 76695 McClure Well, Nitzscheburgh, AR 09667-1508",5300.0,5300.0,5300.0,2025-01-09 13:48:39.000,2025-01-09,2025,1,9,49072,[],()
80591,48842,21973,1,USD69.0,03/01/25;07:38,,69.0,69.0,69.0,2025-03-01 07:38:00.000,2025-03-01,2025,3,1,47953,[],()
85568,50891,21547,2,USD 56.75,11:43 23-July-2025,NULL,56.75,56.75,113.5,2025-07-23 11:43:00.000,2025-07-23,2025,7,23,50891,[],()
79202,50372,21497,1,67.0 USD,01:28:26;10/28/24,"Suite 242 91531 Lorenzo Springs, Mattview, MT 33829",67.0,67.0,67.0,2024-10-28 01:28:26.000,2024-10-28,2024,10,28,50372,[],()
80467,47922,21826,1,USD46.99,28-Nov-2024 04:48:09 am,NULL,46.99,46.99,46.99,2024-11-28 04:48:09.000,2024-11-28,2024,11,28,47922,[],()
77667,49988,21779,1,36.75€,31-Aug-2024 07:13:30,,44.1,44.1,44.1,2024-08-31 07:13:30.000,2024-08-31,2024,8,31,49988,[],()
81044,48657,21325,1,EUR 48.00,2025-02-06T10:44:35,"Suite 607 9460 Daren Streets, Priceville, LA 10135",57.599999999999994,57.599999999999994,57.6,2025-02-06 10:44:35.000,2025-02-06,2025,2,6,48657,[],()
84946,48602,21415,2,59.50€,"22:52, 2025-05-16",,71.39999999999999,71.39999999999999,142.8,2025-05-16 22:52:00.000,2025-05-16,2025,5,16,48602,[],()
83855,47824,22000,1,$36.5,13:41:23;09/20/24,,36.5,36.5,36.5,2024-09-20 13:41:23.000,2024-09-20,2024,9,20,47824,[],()
81984,48200,21772,1,44.75EUR,"21:00,2024-10-22","Suite 112 240 Duncan Trail, West Lauren, WV 36366-5128",53.699999999999996,53.699999999999996,53.7,2024-10-22 21:00:00.000,2024-10-22,2024,10,22,49814,[],()
79946,48515,21368,1,42.25USD,"24-December-2024, 23:31:07",,42.25,42.25,42.25,2024-12-24 23:31:07.000,2024-12-24,2024,12,24,48515,[],()
82930,47795,21700,1,42 EUR,2024-11-18T06:26:48,,50.4,50.4,50.4,2024-11-18 06:26:48.000,2024-11-18,2024,11,18,47795,[],()
80565,50058,22018,1,57.25USD,2025-01-13;07:38:23 pm,,57.25,57.25,57.25,2025-01-13 19:38:23.000,2025-01-13,2025,1,13,50058,[],()
84054,50184,21913,1,$44.0,"14:54, 23-July-2024",,44.0,44.0,44.0,2024-07-23 14:54:00.000,2024-07-23,2024,7,23,50184,[],()
80897,48486,21402,1,39.99USD,01:53:53 PM 20-November-2024,,39.99,39.99,39.99,2024-11-20 13:53:53.000,2024-11-20,2024,11,20,48486,[],()
79463,50301,21720,1,USD 27.00,"10:26:26 AM, 08/12/24",,27.0,27.0,27.0,2024-08-12 10:26:26.000,2024-08-12,2024,8,12,50301,[],()
78413,50294,21420,1,€26¢75,2024-11-21T04:18:58.895,,3210.0,3210.0,3210.0,2024-11-21 04:18:58.895,2024-11-21,2024,11,21,50294,[],()
81926,50613,21644,2,37.00$,2025-02-15T01:24:48,,37.0,37.0,74.0,2025-02-15 01:24:48.000,2025-02-15,2025,2,15,50613,[],()
83544,50192,21888,1,75.25 USD,2024-09-23;03:36,,75.25,75.25,75.25,2024-09-23 03:36:00.000,2024-09-23,2024,9,23,50192,[],()
82807,48099,21488,1,66.25€,"07:46:33 AM,  1-November-2024","624 Cremin Mount, Piperburgh, KY 66536-8744",79.5,79.5,79.5,2024-11-01 07:46:33.000,2024-11-01,2024,11,1,48099,[],()
77869,49960,21723,2,47$25¢,12/14/24 23:16,,4725.0,4725.0,9450.0,2024-12-14 23:16:00.000,2024-12-14,2024,12,14,49960,[],()
78684,49570,21704,2,€ 55.0,21-JUL-2024;13:46:03,,66.0,66.0,132.0,2024-07-21 13:46:03.000,2024-07-21,2024,7,21,49570,[],()
82988,50000,21710,1,73.25 $,15:26 2024-10-02,NULL,73.25,73.25,73.25,2024-10-02 15:26:00.000,2024-10-02,2024,10,2,50000,[],()
82543,48132,21813,2,USD 29.75,2024-09-05T02:20:28,NULL,29.75,29.75,59.5,2024-09-05 02:20:28.000,2024-09-05,2024,9,5,48132,[],()
81862,48509,21831,1,50.00USD," 7-Aug-2024,22:15",,50.0,50.0,50.0,2024-08-07 22:15:00.000,2024-08-07,2024,8,7,48509,[],()
78501,49825,21460,2,68.75€,2024-11-07;04:36:21 am,"5440 Rodriguez Loaf, New Robena, LA 84772",82.5,82.5,165.0,2024-11-07 04:36:21.000,2024-11-07,2024,11,7,49825,[],()
80940,50810,21618,1,47€,"2025-04-22, 05:19:18",NULL,56.4,56.4,56.4,2025-04-22 05:19:18.000,2025-04-22,2025,4,22,50810,[],()
82610,49925,21299,1,64.$,2025-06-08T23:26:38,,64.0,64.0,64.0,2025-06-08 23:26:38.000,2025-06-08,2025,6,8,47953,[],()
78560,48643,21872,1,€ 40.00,09/02/24 06:15:39 P.M.,NULL,48.0,48.0,48.0,2024-09-02 18:15:39.000,2024-09-02,2024,9,2,48643,[],()
84340,50915,21455,1,50€99¢,"2025-04-18, 18:58","92021 Medhurst Hollow, Port Wilsontown, KS 56381",6118.8,6118.8,6118.8,2025-04-18 18:58:00.000,2025-04-18,2025,4,18,50915,[],()
85727,47908,21840,1,USD15.99,2024-12-30T05:42:40.891,"Apt. 194 965 Bryan Creek, North Emilioland, ID 77316-5159",15.99,15.99,15.99,2024-12-30 05:42:40.891,2024-12-30,2024,12,30,47908,[],()
81833,49295,22017,1,31€99¢,2024-12-19;06:06:42,,3838.7999999999997,3838.7999999999997,3838.8,2024-12-19 06:06:42.000,2024-12-19,2024,12,19,49295,[],()
82503,48788,21617,1,EUR25.25,20:24 28-Oct-2024,NULL,30.299999999999997,30.299999999999997,30.3,2024-10-28 20:24:00.000,2024-10-28,2024,10,28,48788,[],()
81970,50067,21599,5,57.50 €,"11/12/24, 09:34:55 AM",NULL,69.0,69.0,345.0,2024-11-12 09:34:55.000,2024-11-12,2024,11,12,50067,[],()
80254,49090,21833,1,65.00€,01/11/24 02:17,,78.0,78.0,78.0,2024-01-11 02:17:00.000,2024-01-11,2024,1,11,49090,[],()
78934,50025,21754,1,27USD,2025-04-27T18:12:34.140,,27.0,27.0,27.0,2025-04-27 18:12:34.140,2025-04-27,2025,4,27,50025,[],()
81767,49718,21755,1,24.5 EUR,"2024-08-16,18:57:47",NULL,29.4,29.4,29.4,2024-08-16 18:57:47.000,2024-08-16,2024,8,16,49718,[],()
86334,48607,21530,1,$48¢50,18:32:27;2024-12-22,"Suite 440 27043 Jesse Ways, Huelsberg, OH 04732",4850.0,4850.0,4850.0,2024-12-22 18:32:27.000,2024-12-22,2024,12,22,48607,[],()
79488,48892,21689,1,$16.50,03.02.2025 21:42:42,NULL,16.5,16.5,16.5,2025-03-02 21:42:42.000,2025-03-02,2025,3,2,48892,[],()
82025,50950,21730,1,32.25€,"04/28/25,15:55",NULL,38.699999999999996,38.699999999999996,38.7,2025-04-28 15:55:00.000,2025-04-28,2025,4,28,50950,[],()
80670,50396,21854,1,59€00¢,2025-01-03T03:01:12.119,NULL,7080.0,7080.0,7080.0,2025-01-03 03:01:12.119,2025-01-03,2025,1,3,50396,[],()
84489,49841,21823,1,64.25 USD,05/26/24 13:07,NULL,64.25,64.25,64.25,2024-05-26 13:07:00.000,2024-05-26,2024,5,26,49841,[],()
80470,48441,21869,1,28.99USD,"27-DEC-2024, 07:53:21 A.M.",NULL,28.99,28.99,28.99,2024-12-27 07:53:21.000,2024-12-27,2024,12,27,48441,[],()
85144,50916,21364,1,71.50 EUR,"08/16/24, 06:29:48 PM",,85.8,85.8,85.8,2024-08-16 18:29:48.000,2024-08-16,2024,8,16,50916,[],()
81451,48708,21558,1,17.5 $,21:42  7-Mar-2025,"Apt. 777 71791 Lucienne Bypass, New Vadaview, ID 77164-2435",17.5,17.5,17.5,2025-03-07 21:42:00.000,2025-03-07,2025,3,7,48708,[],()
79850,50871,21926,5,$44.75,2024-05-20T12:17:51,NULL,44.75,44.75,223.75,2024-05-20 12:17:51.000,2024-05-20,2024,5,20,50871,[],()
84284,48968,21816,1,USD68.25,2024-07-12 04:57:53 PM,"5244 Welch Greens, Gavinfurt, CA 07855-2282",68.25,68.25,68.25,2024-07-12 16:57:53.000,2024-07-12,2024,7,12,48968,[],()
84714,48786,21768,4,€20.5,2024-09-29T02:46:54.828,"7316 Taina Village, New Timothy, MO 49817",24.599999999999998,24.599999999999998,98.4,2024-09-29 02:46:54.828,2024-09-29,2024,9,29,48786,[],()
81298,49740,21896,1,17.75$,"12/16/24, 01:02",,17.75,17.75,17.75,2024-12-16 01:02:00.000,2024-12-16,2024,12,16,49740,[],()
77697,49595,21404,1,22.99USD,11:06:46 am; 6-Jan-2025,,22.99,22.99,22.99,2025-01-06 11:06:46.000,2025-01-06,2025,1,6,49595,[],()
77597,48800,21306,1,USD47.0,12/12/24 23:02,NULL,47.0,47.0,47.0,2024-12-12 23:02:00.000,2024-12-12,2024,12,12,48800,[],()
80225,50875,21770,1,$ 21.50,18:59:53 14-January-2025,"Suite 350 64453 Conn Plain, Teddytown, ME 93937-2421",21.5,21.5,21.5,2025-01-14 18:59:53.000,2025-01-14,2025,1,14,50875,[],()
85785,49395,21694,2,USD 28.0,2025-08-01T01:36:43,,28.0,28.0,56.0,2025-08-01 01:36:43.000,2025-08-01,2025,8,1,49395,[],()
84865,49568,21963,1,USD37.99,"26-January-2025, 16:43",NULL,37.99,37.99,37.99,2025-01-26 16:43:00.000,2025-01-26,2025,1,26,49568,[],()
83348,49418,21398,1,33.75 USD,Sat Aug 10 02:28:37 2024,,33.75,33.75,33.75,2024-08-10 02:28:37.000,2024-08-10,2024,8,10,49418,[],()
81341,47679,22013,2,48. $,2025-03-17;08:27,,48.0,48.0,96.0,2025-03-17 08:27:00.000,2025-03-17,2025,3,17,47679,[],()
78504,47803,22021,1,$15¢50,"22:59:12,2025-02-14","Apt. 692 60968 Heriberto Harbor, North Shanae, KS 23344-9937",1550.0,1550.0,1550.0,2025-02-14 22:59:12.000,2025-02-14,2025,2,14,47803,[],()
79576,50945,21734,1,EUR48.5,"03/06/25,21:02:45",,58.199999999999996,58.199999999999996,58.2,2025-03-06 21:02:45.000,2025-03-06,2025,3,6,50945,[],()
81082,48530,21937,5,$51¢50,2025-01-13;16:47,,5150.0,5150.0,25750.0,2025-01-13 16:47:00.000,2025-01-13,2025,1,13,48530,[],()
81470,50017,21346,1,46.75$,"12:17:06 am, 2025-01-10",,46.75,46.75,46.75,2025-01-10 00:17:06.000,2025-01-10,2025,1,10,50017,[],()
85757,49649,21615,1,47.50USD,"30-Oct-2024, 03:11:54",NULL,47.5,47.5,47.5,2024-10-30 03:11:54.000,2024-10-30,2024,10,30,49649,[],()
83914,49300,21660,2,$ 31.,"2025-01-10, 07:30:59 P.M.",,31.0,31.0,62.0,2025-01-10 19:30:59.000,2025-01-10,2025,1,10,49300,[],()
79053,48043,21875,1,48.50 EUR,"21:56:50, 01/10/25",,58.199999999999996,58.199999999999996,58.2,2025-01-10 21:56:50.000,2025-01-10,2025,1,10,48043,[],()
79069,48848,22024,3,72.75 EUR,"00:39:20, 25-JUN-2024","Apt. 531 6169 Brandee Locks, Brakusfort, KY 37295-5476",87.3,87.3,261.9,2024-06-25 00:39:20.000,2024-06-25,2024,6,25,48848,[],()
81719,49036,21720,1,USD30.50,15:01:02 2024-12-13,"Suite 925 27640 Yuko Groves, Hermannborough, KY 14813",30.5,30.5,30.5,2024-12-13 15:01:02.000,2024-12-13,2024,12,13,47727,[],()
86200,49949,21865,1,$69.,13:48:52;2025-01-03,"1464 Anderson Pine, New Leighstad, HI 76610",69.0,69.0,69.0,2025-01-03 13:48:52.000,2025-01-03,2025,1,3,49949,[],()
86394,48409,22001,1,USD60.,"23-May-2025,06:29:26",,60.0,60.0,60.0,2025-05-23 06:29:26.000,2025-05-23,2025,5,23,48409,[],()
85073,50332,21430,2,55.75€,24.07.2024 16:52:52,"236 Cole Walk, North Elvina, ID 20126-1950",66.89999999999999,66.89999999999999,133.8,2024-07-24 16:52:52.000,2024-07-24,2024,7,24,50332,[],()
82806,49053,21615,2,USD 48.75,2024-09-12 07:23:36,"93252 Erwin Points, Vandervortbury, ME 39248-8835",48.75,48.75,97.5,2024-09-12 07:23:36.000,2024-09-12,2024,9,12,49673,[],()
78579,48859,21557,1,€67.00, 8-January-2025 17:01:49,"Apt. 765 260 Langosh Run, Casperbury, HI 67484-6398",80.39999999999999,80.39999999999999,80.4,2025-01-08 17:01:49.000,2025-01-08,2025,1,8,48859,[],()
83098,48241,21498,1,USD 22.25,16:37:17;08/10/24,,22.25,22.25,22.25,2024-08-10 16:37:17.000,2024-08-10,2024,8,10,48241,[],()
81209,48216,21853,1,$55¢25,"2024-08-27, 20:41",,5525.0,5525.0,5525.0,2024-08-27 20:41:00.000,2024-08-27,2024,8,27,48216,[],()
85177,50038,21796,1,EUR28.00," 7-Feb-2025, 02:13:13 PM","24235 Terrence Lodge, Altenwerthside, PA 81211-3429",33.6,33.6,33.6,2025-02-07 14:13:13.000,2025-02-07,2025,2,7,50038,[],()
80451,50857,21456,2,62USD,"16:40,04/12/25",,62.0,62.0,124.0,2025-04-12 16:40:00.000,2025-04-12,2025,4,12,50857,[],()
83390,51059,21922,3,25.99 EUR,22:24:36;13-Jan-2025,,31.187999999999995,31.187999999999995,93.56,2025-01-13 22:24:36.000,2025-01-13,2025,1,13,51059,[],()
81689,48680,21640,1,$44.25,05:23:13  9-April-2025,,44.25,44.25,44.25,2025-04-09 05:23:13.000,2025-04-09,2025,4,9,48680,[],()
78620,49062,21404,2,22.5EUR,2024-10-26T18:31:24.361,,27.0,27.0,54.0,2024-10-26 18:31:24.361,2024-10-26,2024,10,26,49062,[],()
78288,48919,21359,2,23.0 USD,"11:17:14,10/25/24","Suite 795 306 Runolfsson Centers, Lake Gabriel, NJ 60152",23.0,23.0,46.0,2024-10-25 11:17:14.000,2024-10-25,2024,10,25,48919,[],()
80356,49660,21610,2,53€50¢,10:46:56 pm 23-January-2025,NULL,6420.0,6420.0,12840.0,2025-01-23 22:46:56.000,2025-01-23,2025,1,23,49660,[],()
80677,48144,21849,2,33.25 USD,10:04:19 am  4-May-2025,NULL,33.25,33.25,66.5,2025-05-04 10:04:19.000,2025-05-04,2025,5,4,48144,[],()
84611,49064,21517,1,$63.25,09/26/24;03:15:02 am,NULL,63.25,63.25,63.25,2024-09-26 03:15:02.000,2024-09-26,2024,9,26,49064,[],()
78922,49042,21949,1,46.00 $,22:26;2025-01-07,"933 Debra Park, Lake Omegaborough, OR 74989-2928",46.0,46.0,46.0,2025-01-07 22:26:00.000,2025-01-07,2025,1,7,49042,[],()
84740,50078,21414,2,47.00USD,2024-02-01;16:29,,47.0,47.0,94.0,2024-02-01 16:29:00.000,2024-02-01,2024,2,1,50078,[],()
79483,48126,21509,1,$42,2024-10-06 16:09:36,NULL,42.0,42.0,42.0,2024-10-06 16:09:36.000,2024-10-06,2024,10,6,48126,[],()
82871,49506,21529,1,14.00EUR,"10/17/24, 08:03",NULL,16.8,16.8,16.8,2024-10-17 08:03:00.000,2024-10-17,2024,10,17,49506,[],()
78421,48095,22025,1,USD 55.0,2024-07-01;17:44:17,NULL,55.0,55.0,55.0,2024-07-01 17:44:17.000,2024-07-01,2024,7,1,48095,[],()
79093,49207,21970,1,68.75USD,"26-September-2024,05:49:31",,68.75,68.75,68.75,2024-09-26 05:49:31.000,2024-09-26,2024,9,26,49207,[],()
85944,50397,21411,1,32.75 USD,19:56:08 30-Aug-2024,"Suite 153 426 Lannie Stravenue, Effertzbury, ME 14257-6318",32.75,32.75,32.75,2024-08-30 19:56:08.000,2024-08-30,2024,8,30,50397,[],()
80742,47859,21615,1,43.5 $,"2024-11-07, 12:52:26 pm",NULL,43.5,43.5,43.5,2024-11-07 12:52:26.000,2024-11-07,2024,11,7,47859,[],()
83840,48175,21712,1,USD74.25,"18:32,01/11/25",,74.25,74.25,74.25,2025-01-11 18:32:00.000,2025-01-11,2025,1,11,48175,[],()
86069,49589,21743,1,USD 37.25,2025-04-02;03:31:22,,37.25,37.25,37.25,2025-04-02 03:31:22.000,2025-04-02,2025,4,2,49589,[],()
82856,49430,21721,1,$ 55.75,18:58:16 06/20/24,,55.75,55.75,55.75,2024-06-20 18:58:16.000,2024-06-20,2024,6,20,49430,[],()
83943,49693,21627,1,USD 69.99,"04/14/24,01:55",NULL,69.99,69.99,69.99,2024-04-14 01:55:00.000,2024-04-14,2024,4,14,49693,[],()
81892,48255,21774,3,21.$,"18:00, 11-July-2024",NULL,21.0,21.0,63.0,2024-07-11 18:00:00.000,2024-07-11,2024,7,11,48255,[],()
86463,50272,21621,1,$66.,"14:11:43,2025-02-12","Suite 523 99715 Gabrielle Club, Allanfort, OH 51834-3029",66.0,66.0,66.0,2025-02-12 14:11:43.000,2025-02-12,2025,2,12,50272,[],()
84752,50088,21471,2,$26¢99,20:11:52;24-SEP-2024,,2699.0,2699.0,5398.0,2024-09-24 20:11:52.000,2024-09-24,2024,9,24,50088,[],()
78823,48536,21350,1,32.75EUR,2025-05-10 23:05,"Apt. 213 9863 Von Center, Eleanoretown, MD 81804",39.3,39.3,39.3,2025-05-10 23:05:00.000,2025-05-10,2025,5,10,48536,[],()
85962,48508,21719,1,62.25 USD,2025-04-30T19:49:27.302,NULL,62.25,62.25,62.25,2025-04-30 19:49:27.302,2025-04-30,2025,4,30,48508,[],()
82146,47832,21346,3,USD 42.0,2024-11-30;07:21:56 P.M.,NULL,42.0,42.0,126.0,2024-11-30 19:21:56.000,2024-11-30,2024,11,30,47832,[],()
86196,50424,21815,3,$15.25,"20:16, 2025-02-03",NULL,15.25,15.25,45.75,2025-02-03 20:16:00.000,2025-02-03,2025,2,3,50424,[],()
81889,49862,21594,3,EUR14.25,2025-04-23 19:59:29,"124 Isiah Overpass, West Lanellemouth, WI 67772-3275",17.099999999999998,17.099999999999998,51.3,2025-04-23 19:59:29.000,2025-04-23,2025,4,23,48249,[],()
85794,49712,21391,1,$64¢50,"18:37, 11/16/24","Apt. 297 384 Steuber Oval, South Makeda, NJ 46622",6450.0,6450.0,6450.0,2024-11-16 18:37:00.000,2024-11-16,2024,11,16,49712,[],()
84343,50474,21997,2,71.75 $,2024-11-08T12:23:43.038,"Suite 908 528 Heathcote Fields, Port Nisha, VA 87997-3678",71.75,71.75,143.5,2024-11-08 12:23:43.038,2024-11-08,2024,11,8,50474,[],()
78822,51035,21725,5,37$75¢,"03:43, 09/07/24",NULL,3775.0,3775.0,18875.0,2024-09-07 03:43:00.000,2024-09-07,2024,9,7,51035,[],()
83718,48878,21699,2,23.25$,"23:47:59, 16-October-2024",,23.25,23.25,46.5,2024-10-16 23:47:59.000,2024-10-16,2024,10,16,48878,[],()
80255,48413,21616,1,$36.5,07:38:57 P.M.;01/29/25,NULL,36.5,36.5,36.5,2025-01-29 19:38:57.000,2025-01-29,2025,1,29,48413,[],()
83158,50498,21662,2,USD 25.25,07:14:14 PM;2025-02-14,NULL,25.25,25.25,50.5,2025-02-14 19:14:14.000,2025-02-14,2025,2,14,50498,[],()
79990,50632,21433,1,48.5EUR,11-Dec-2024 11:38,,58.199999999999996,58.199999999999996,58.2,2024-12-11 11:38:00.000,2024-12-11,2024,12,11,50632,[],()
81289,49713,21658,1,$57.99,05:12:25 P.M.  4-JAN-2025,"87512 Herman Turnpike, East Nedamouth, MA 73952-0558",57.99,57.99,57.99,2025-01-04 17:12:25.000,2025-01-04,2025,1,4,49713,[],()
84062,50008,21885,1,€ 50.00,Wed Aug 28 09:38:31 2024,,60.0,60.0,60.0,2024-08-28 09:38:31.000,2024-08-28,2024,8,28,50008,[],()
80175,49291,21835,2,$ 73.50,03/24/25 16:51:58,,73.5,73.5,147.0,2025-03-24 16:51:58.000,2025-03-24,2025,3,24,49291,[],()
85123,50952,21805,2,EUR51.25,"08:02:44 A.M., 06/15/24","Apt. 702 5215 Davida Avenue, Nataliefort, MA 42986",61.5,61.5,123.0,2024-06-15 08:02:44.000,2024-06-15,2024,6,15,50952,[],()
80241,48695,21587,3,USD68.5,"07:23:05 PM, 07/28/25","41787 Heathcote Dale, Monnieton, KY 16660-6519",68.5,68.5,205.5,2025-07-28 19:23:05.000,2025-07-28,2025,7,28,48695,[],()
82064,48316,21311,2,$19¢75,"25-AUG-2024, 18:43",,1975.0,1975.0,3950.0,2024-08-25 18:43:00.000,2024-08-25,2024,8,25,48316,[],()
80887,47758,21764,1,€ 50.50,2024-11-08T18:27:14,,60.599999999999994,60.599999999999994,60.6,2024-11-08 18:27:14.000,2024-11-08,2024,11,8,47758,[],()
79928,50823,21599,1,57.0 USD,2024-06-15;05:55:33,,57.0,57.0,57.0,2024-06-15 05:55:33.000,2024-06-15,2024,6,15,50823,[],()
79887,49196,21605,1,USD48.50,16-SEP-2024 04:31,"232 Margarite Via, Lake Valencia, NJ 64331",48.5,48.5,48.5,2024-09-16 04:31:00.000,2024-09-16,2024,9,16,49196,[],()
79538,49998,21330,2,€46¢00,2025-02-24;13:44:02,,5520.0,5520.0,11040.0,2025-02-24 13:44:02.000,2025-02-24,2025,2,24,49998,[],()
84930,50452,21345,1,$ 71.25,Thu Jan 23 21:21:02 2025,,71.25,71.25,71.25,2025-01-23 21:21:02.000,2025-01-23,2025,1,23,50452,[],()
83395,49204,21298,3,$ 52.99,"06/11/24,07:07:10","Suite 232 11075 McGlynn Plaza, Seanfurt, ID 75287-2590",52.99,52.99,158.97,2024-06-11 07:07:10.000,2024-06-11,2024,6,11,49204,[],()
84824,48761,21995,5,41.50 $,08:29:19;05/01/24,"6890 Elsy Place, Justinland, NY 62986-3085",41.5,41.5,207.5,2024-05-01 08:29:19.000,2024-05-01,2024,5,1,48761,[],()
83972,48722,21712,1,75.00 €,"2024-09-10, 02:11:22 am",,90.0,90.0,90.0,2024-09-10 02:11:22.000,2024-09-10,2024,9,10,48722,[],()
79416,49067,21781,1,€ 64.00,"06:07:35 pm, 2025-03-15",,76.8,76.8,76.8,2025-03-15 18:07:35.000,2025-03-15,2025,3,15,49067,[],()
85475,49332,21371,2,EUR 55.50,01:33:38 P.M.  7-NOV-2024,,66.6,66.6,133.2,2024-11-07 13:33:38.000,2024-11-07,2024,11,7,49332,[],()
81766,50022,21608,1,51.0 €, 3-September-2024;02:18:17 PM,NULL,61.199999999999996,61.199999999999996,61.2,2024-09-03 14:18:17.000,2024-09-03,2024,9,3,50022,[],()
86400,47807,21527,1,USD28.25,"01:29:31 PM, 01/28/25","63186 Hauck Mission, Nikolausland, NJ 95817-1549",28.25,28.25,28.25,2025-01-28 13:29:31.000,2025-01-28,2025,1,28,47807,[],()
80660,49708,21823,1,62.75$,05/22/25 16:14:23,NULL,62.75,62.75,62.75,2025-05-22 16:14:23.000,2025-05-22,2025,5,22,49708,[],()
79018,48221,21551,1,18.0USD,"13:19,12-July-2024","4485 Dell Place, O'Haraborough, NV 06131-9713",18.0,18.0,18.0,2024-07-12 13:19:00.000,2024-07-12,2024,7,12,48221,[],()
86306,48085,21364,1,74.00 EUR,"31-Dec-2024, 16:27","576 Boehm Wall, Jaspershire, MT 64985",88.8,88.8,88.8,2024-12-31 16:27:00.000,2024-12-31,2024,12,31,48085,[],()
85948,48440,21947,1,62.50 $,"12:43:50 PM,  4-Aug-2025",,62.5,62.5,62.5,2025-08-04 12:43:50.000,2025-08-04,2025,8,4,48440,[],()
85065,49003,21771,3,72.0 $,2024-10-22T22:26:37,"5526 Shawnta Orchard, East Elbert, WV 67444-9730",72.0,72.0,216.0,2024-10-22 22:26:37.000,2024-10-22,2024,10,22,49003,[],()
79801,49826,21625,1,18.5USD,12:50 10/06/24,,18.5,18.5,18.5,2024-10-06 12:50:00.000,2024-10-06,2024,10,6,49826,[],()
79529,48466,21952,2,USD49.00,2025-04-12T12:49:13.572,"960 Schamberger Vista, Altenwerthberg, CO 30201-5735",49.0,49.0,98.0,2025-04-12 12:49:13.572,2025-04-12,2025,4,12,48466,[],()
82979,50497,21490,2,$66.0,"01/02/25,03:11:05 A.M.",,66.0,66.0,132.0,2025-01-02 03:11:05.000,2025-01-02,2025,1,2,50497,[],()
80629,47711,21558,1,€ 20.75,07:44:09 pm;2025-07-07,NULL,24.9,24.9,24.9,2025-07-07 19:44:09.000,2025-07-07,2025,7,7,47711,[],()
85388,51061,21813,1,32.00$,"07:40:28, 21-January-2025",,32.0,32.0,32.0,2025-01-21 07:40:28.000,2025-01-21,2025,1,21,51061,[],()
78832,50975,21582,2,63 USD,2024-05-03T10:50:08,,63.0,63.0,126.0,2024-05-03 10:50:08.000,2024-05-03,2024,5,3,50975,[],()
83765,48389,21478,1,47.99$,2025-01-04T18:19:06.079,"Suite 141 709 Trent Summit, Mosciskiburgh, AR 02037",47.99,47.99,47.99,2025-01-04 18:19:06.079,2025-01-04,2025,1,4,48389,[],()
86431,50582,21776,1,$74¢00,2025-02-07T14:02:30,,7400.0,7400.0,7400.0,2025-02-07 14:02:30.000,2025-02-07,2025,2,7,50582,[],()
86439,49494,21538,1,71.99$,"07:04:19 AM,  1-December-2024","Apt. 431 709 Corkery Rapids, West Zacherybury, NE 45613-5136",71.99,71.99,71.99,2024-12-01 07:04:19.000,2024-12-01,2024,12,1,49494,[],()
81019,50592,21979,2,USD 31.0,"07/30/24, 20:23:30",,31.0,31.0,62.0,2024-07-30 20:23:30.000,2024-07-30,2024,7,30,50592,[],()
80682,47968,21406,1,71$,2024-09-02T03:42:44.684,,71.0,71.0,71.0,2024-09-02 03:42:44.684,2024-09-02,2024,9,2,47755,[],()
85969,47854,21831,1,53.00 USD,01:50:44 PM;25-June-2024,,53.0,53.0,53.0,2024-06-25 13:50:44.000,2024-06-25,2024,6,25,47854,[],()
81558,51054,21601,4,€ 53.25,2024-10-25T04:06:35.697,NULL,63.9,63.9,255.6,2024-10-25 04:06:35.697,2024-10-25,2024,10,25,51054,[],()
78622,50443,21490,1,€63.25,"04:49:54 pm,27-Jun-2024","943 Kuhlman Manor, Josephfort, MD 65553",75.89999999999999,75.89999999999999,75.9,2024-06-27 16:49:54.000,2024-06-27,2024,6,27,50443,[],()
84728,49353,21875,4,47.75USD,06/29/25 08:25:56,NULL,47.75,47.75,191.0,2025-06-29 08:25:56.000,2025-06-29,2025,6,29,49353,[],()
83481,48411,21411,1,33$,"12-DEC-2024,06:08:51 PM",,33.0,33.0,33.0,2024-12-12 18:08:51.000,2024-12-12,2024,12,12,48411,[],()
80575,47672,22032,1,36€00¢,12:07:53 PM;20-Oct-2024,NULL,4320.0,4320.0,4320.0,2024-10-20 12:07:53.000,2024-10-20,2024,10,20,47672,[],()
83275,48875,21448,1,24.00 EUR,"2024-09-28,10:40",,28.799999999999997,28.799999999999997,28.8,2024-09-28 10:40:00.000,2024-09-28,2024,9,28,48875,[],()
84915,50048,21393,1,53.75 $,08:42;27-Dec-2024,,53.75,53.75,53.75,2024-12-27 08:42:00.000,2024-12-27,2024,12,27,50048,[],()
80975,48197,21836,3,USD48.99,2025-02-05T20:39:59,,48.99,48.99,146.97,2025-02-05 20:39:59.000,2025-02-05,2025,2,5,48197,[],()
78558,48452,21955,1,55.50USD,"26-JUN-2025, 04:24:20 A.M.",,55.5,55.5,55.5,2025-06-26 04:24:20.000,2025-06-26,2025,6,26,48452,[],()
79114,50300,21578,1,22€,06:05:33 29-AUG-2024,,26.4,26.4,26.4,2024-08-29 06:05:33.000,2024-08-29,2024,8,29,50300,[],()
83025,50313,21458,1,EUR 66.75,12:53:18 PM;01/06/25,NULL,80.1,80.1,80.1,2025-01-06 12:53:18.000,2025-01-06,2025,1,6,50313,[],()
80471,48670,21557,1,EUR65.00, 5-May-2025 01:52:42,NULL,78.0,78.0,78.0,2025-05-05 01:52:42.000,2025-05-05,2025,5,5,48670,[],()
83399,49227,21859,1,74.99 $,2025-09-11 21:20:15,,74.99,74.99,74.99,2025-09-11 21:20:15.000,2025-09-11,2025,9,11,49227,[],()
79172,48144,21865,1,71. €,12-MAY-2024 06:40:26 AM,NULL,85.2,85.2,85.2,2024-05-12 06:40:26.000,2024-05-12,2024,5,12,48144,[],()
82267,50141,21422,2,15.25$,"2024-08-15,17:43:22","89743 Emery Via, Noblestad, OR 31801",15.25,15.25,30.5,2024-08-15 17:43:22.000,2024-08-15,2024,8,15,50141,[],()
80557,48496,21821,1,68.99USD,"2024-07-10,06:46:10 PM","Suite 520 796 Raynor Spur, Feeststad, TN 62808",68.99,68.99,68.99,2024-07-10 18:46:10.000,2024-07-10,2024,7,10,48496,[],()
84168,50914,21299,1,$61¢50, 9.05.2024  9:21:21,,6150.0,6150.0,6150.0,2024-09-05 09:21:21.000,2024-09-05,2024,9,5,50914,[],()
81112,48201,21508,1,USD 22.50,2025-05-20 17:08:19,NULL,22.5,22.5,22.5,2025-05-20 17:08:19.000,2025-05-20,2025,5,20,48201,[],()
79033,48141,22022,1,53.99EUR,06:42:41 2024-09-05,"Apt. 398 22366 Sandy Orchard, South Kyrafurt, NH 39582-1412",64.788,64.788,64.79,2024-09-05 06:42:41.000,2024-09-05,2024,9,5,48141,[],()
81030,48690,21347,1,€35¢50,12.05.2025 01:25:25,,4260.0,4260.0,4260.0,2025-12-05 01:25:25.000,2025-12-05,2025,12,5,48690,[],()
82565,48205,21751,4,69.99 USD,"12:32, 2024-12-30",NULL,69.99,69.99,279.96,2024-12-30 12:32:00.000,2024-12-30,2024,12,30,48205,[],()
85165,50862,21967,1,$ 41.00,19:39:32;15-Feb-2025,"Apt. 229 442 Shemika Radial, Elidiaville, AZ 72257",41.0,41.0,41.0,2025-02-15 19:39:32.000,2025-02-15,2025,2,15,50862,[],()
82683,49412,21764,1,47.00$,11/15/24;17:41,,47.0,47.0,47.0,2024-11-15 17:41:00.000,2024-11-15,2024,11,15,49412,[],()
82251,49989,21372,3,37.00 USD,"2025-04-21, 06:09:42 am",,37.0,37.0,111.0,2025-04-21 06:09:42.000,2025-04-21,2025,4,21,49989,[],()
77933,48583,21834,4,€26.0,2025-06-09T11:10:54,,31.2,31.2,124.8,2025-06-09 11:10:54.000,2025-06-09,2025,6,9,48583,[],()
78193,48785,21706,4,$ 17.25,13:48 18-Mar-2025,,17.25,17.25,69.0,2025-03-18 13:48:00.000,2025-03-18,2025,3,18,48785,[],()
78551,49607,21308,2,€36¢50,05/03/24;01:47,NULL,4380.0,4380.0,8760.0,2024-05-03 01:47:00.000,2024-05-03,2024,5,3,49607,[],()
80839,48253,21865,1,67.0 $,"05:53:22 PM,2024-09-06",,67.0,67.0,67.0,2024-09-06 17:53:22.000,2024-09-06,2024,9,6,48253,[],()
82179,48302,21458,1,$64.00,2024-06-19T00:28:52.250,"6041 Lynwood Alley, New Darell, WY 89186-0428",64.0,64.0,64.0,2024-06-19 00:28:52.250,2024-06-19,2024,6,19,48302,[],()
77753,47745,21582,2,62.00$,"14:53:41, 05/17/24",,62.0,62.0,124.0,2024-05-17 14:53:41.000,2024-05-17,2024,5,17,47745,[],()
81575,50618,21685,1,65.99 USD,"2024-06-06, 05:01:50 P.M.",NULL,65.99,65.99,65.99,2024-06-06 17:01:50.000,2024-06-06,2024,6,6,50618,[],()
83105,48762,21949,1,43.5 €,"09/30/24, 11:49:04 AM",,52.199999999999996,52.199999999999996,52.2,2024-09-30 11:49:04.000,2024-09-30,2024,9,30,48762,[],()
83749,49076,21879,1,58.5 USD,2024-09-23T18:02:22,NULL,58.5,58.5,58.5,2024-09-23 18:02:22.000,2024-09-23,2024,9,23,49076,[],()
77645,48604,21862,2,$56¢00,"15:11:44, 2024-10-19",,5600.0,5600.0,11200.0,2024-10-19 15:11:44.000,2024-10-19,2024,10,19,48604,[],()
80889,48396,21803,1,50.0 USD,2024-09-26T03:07:06,"416 Omar Island, South Janene, CO 10938-0597",50.0,50.0,50.0,2024-09-26 03:07:06.000,2024-09-26,2024,9,26,48396,[],()
86252,49707,21681,1,USD 34.5,16-MAY-2025;08:59:36 A.M.,,34.5,34.5,34.5,2025-05-16 08:59:36.000,2025-05-16,2025,5,16,49707,[],()
83960,48297,21356,1,22.99€, 9-Dec-2024;19:19,NULL,27.587999999999997,27.587999999999997,27.59,2024-12-09 19:19:00.000,2024-12-09,2024,12,9,48297,[],()
85457,49752,21794,1,33.0USD,2024-12-05T02:10:35,"Suite 712 70652 Katia Port, South Brianaberg, NM 52533",33.0,33.0,33.0,2024-12-05 02:10:35.000,2024-12-05,2024,12,5,49152,[],()
85951,51064,21514,5,73.75$,"03:49:20, 12/28/24","429 Renner Oval, Port Dexterside, UT 29605-3966",73.75,73.75,368.75,2024-12-28 03:49:20.000,2024-12-28,2024,12,28,51064,[],()
85286,48263,21320,1,58$," 1-OCT-2024,08:53:35 am","519 McClure Skyway, South Ottoview, DE 41110",58.0,58.0,58.0,2024-10-01 08:53:35.000,2024-10-01,2024,10,1,48263,[],()
85806,48936,21788,2,25. €,2025-03-13T22:48:26,,30.0,30.0,60.0,2025-03-13 22:48:26.000,2025-03-13,2025,3,13,48936,[],()
78334,50848,22002,3,USD 64.,06:49:28 am 07/03/24,,64.0,64.0,192.0,2024-07-03 06:49:28.000,2024-07-03,2024,7,3,50848,[],()
82970,49472,21307,1,USD25.25,2025-04-12 17:34, ,25.25,25.25,25.25,2025-04-12 17:34:00.000,2025-04-12,2025,4,12,49472,[],()
84862,50972,22029,2,67.5 EUR,2024-11-28T15:41:21,NULL,81.0,81.0,162.0,2024-11-28 15:41:21.000,2024-11-28,2024,11,28,50972,[],()
83295,50905,21573,1,28 USD,2024-12-07 09:23:26 AM,NULL,28.0,28.0,28.0,2024-12-07 09:23:26.000,2024-12-07,2024,12,7,50905,[],()
86157,49343,21324,1,27$, 5-May-2025 03:23:39 pm,,27.0,27.0,27.0,2025-05-05 15:23:39.000,2025-05-05,2025,5,5,49343,[],()
83170,48975,21758,1,44.0 $,"01/08/25, 12:41:26",,44.0,44.0,44.0,2025-01-08 12:41:26.000,2025-01-08,2025,1,8,48975,[],()
79162,47675,21789,1,USD26.0,"18:01,2024-11-14",,26.0,26.0,26.0,2024-11-14 18:01:00.000,2024-11-14,2024,11,14,47675,[],()
80273,47790,21798,2,$55¢25,08/01/24;04:06,"Suite 247 447 Buckridge Station, North Diedrachester, VT 05147",5525.0,5525.0,11050.0,2024-08-01 04:06:00.000,2024-08-01,2024,8,1,47790,[],()
79409,50012,21803,2,USD 47.,2024-12-13T04:54:55,,47.0,47.0,94.0,2024-12-13 04:54:55.000,2024-12-13,2024,12,13,50012,[],()
77961,50465,21540,1,€ 29,"09:10:34,25-JUN-2024","5316 Wolff Circles, Port Setsuko, OK 32053-4366",34.8,34.8,34.8,2024-06-25 09:10:34.000,2024-06-25,2024,6,25,50465,[],()
77866,49200,21832,1,34.25 EUR,"07:16:58, 17-Jan-2025",,41.1,41.1,41.1,2025-01-17 07:16:58.000,2025-01-17,2025,1,17,49200,[],()
80436,48198,21358,1,15€,12/28/24;12:47:05 P.M.,NULL,18.0,18.0,18.0,2024-12-28 12:47:05.000,2024-12-28,2024,12,28,48198,[],()
78017,49146,21879,2,55.0$,"16:28,12/28/24",,55.0,55.0,110.0,2024-12-28 16:28:00.000,2024-12-28,2024,12,28,49146,[],()
77746,49643,21322,2,32.0USD,2024-10-05T10:58:47.543,NULL,32.0,32.0,64.0,2024-10-05 10:58:47.543,2024-10-05,2024,10,5,49643,[],()
78377,48007,21479,1,€ 61.0,"01:17,10/15/24","660 Daniel Shoal, Ferryborough, MT 17205-2531",73.2,73.2,73.2,2024-10-15 01:17:00.000,2024-10-15,2024,10,15,48007,[],()
79876,47894,21659,2,32.25USD,"10/18/24,09:09:58 P.M.","Suite 146 1538 Okuneva Shoal, Ferryton, NJ 48815-6781",32.25,32.25,64.5,2024-10-18 21:09:58.000,2024-10-18,2024,10,18,47894,[],()
83103,49030,21895,1,€18.5,2024-07-29T02:49:32,"Apt. 860 81983 Rivka Forest, Amaliaview, UT 35036-0268",22.2,22.2,22.2,2024-07-29 02:49:32.000,2024-07-29,2024,7,29,49030,[],()
85911,50463,21364,1,€ 74.5,"06/22/24, 05:46:12","3576 Peg Spring, Port Richard, OH 35984-2244",89.39999999999999,89.39999999999999,89.4,2024-06-22 05:46:12.000,2024-06-22,2024,6,22,50463,[],()
84724,48474,21792,2,EUR61.5, 6-Sep-2025;05:57,,73.8,73.8,147.6,2025-09-06 05:57:00.000,2025-09-06,2025,9,6,48474,[],()
78797,48136,21909,1,28$25¢, 2.06.2025 11:30:30,"98874 Lehner Creek, East Joshuabury, MD 25912-0890",2825.0,2825.0,2825.0,2025-02-06 11:30:30.000,2025-02-06,2025,2,6,48136,[],()
84529,48296,21643,2,14.5 USD,10/31/24 16:57:51,,14.5,14.5,29.0,2024-10-31 16:57:51.000,2024-10-31,2024,10,31,48296,[],()
86139,48966,21668,1,53.75 USD,07:21:37 pm 2024-09-15,,53.75,53.75,53.75,2024-09-15 19:21:37.000,2024-09-15,2024,9,15,48966,[],()
79593,50297,22053,1,52.50 €," 4-Apr-2025, 08:53:32 pm",,63.0,63.0,63.0,2025-04-04 20:53:32.000,2025-04-04,2025,4,4,48332,[],()
81848,48996,21806,1,$61¢00,"13:18, 10-November-2024","Suite 238 6441 Turcotte Inlet, Beerbury, GA 36724-0542",6100.0,6100.0,6100.0,2024-11-10 13:18:00.000,2024-11-10,2024,11,10,48996,[],()
80784,50816,21893,1,70.25€,24-Mar-2025 01:17,NULL,84.3,84.3,84.3,2025-03-24 01:17:00.000,2025-03-24,2025,3,24,50816,[],()
85218,50339,21771,1,74.99 EUR,"2025-03-29, 00:41:12",,89.98799999999999,89.98799999999999,89.99,2025-03-29 00:41:12.000,2025-03-29,2025,3,29,50339,[],()
82555,49742,21981,1,23.25 $,18:38:54 10/31/24,,23.25,23.25,23.25,2024-10-31 18:38:54.000,2024-10-31,2024,10,31,49742,[],()
84774,50005,21624,1,$ 21.,"10:17,  6-JUL-2025","2309 Ismael Stravenue, New Jacob, MS 70373-4201",21.0,21.0,21.0,2025-07-06 10:17:00.000,2025-07-06,2025,7,6,50005,[],()
83647,49329,21352,1,32.5 EUR,"2024-09-29,13:04",,39.0,39.0,39.0,2024-09-29 13:04:00.000,2024-09-29,2024,9,29,49329,[],()
81832,49194,21835,1,$ 68.25,2024-11-21T00:03:42,,68.25,68.25,68.25,2024-11-21 00:03:42.000,2024-11-21,2024,11,21,49194,[],()
81676,49080,21991,3,EUR 75.25,"2025-04-01, 22:21:46","4757 Breana Turnpike, South Sunni, CO 38083",90.3,90.3,270.9,2025-04-01 22:21:46.000,2025-04-01,2025,4,1,49080,[],()
83007,50605,21964,4,69.5$,02:21:03 PM;2025-03-01,,69.5,69.5,278.0,2025-03-01 14:21:03.000,2025-03-01,2025,3,1,50605,[],()
80587,48426,21500,3,$ 30.25," 7-Feb-2025,20:49",NULL,30.25,30.25,90.75,2025-02-07 20:49:00.000,2025-02-07,2025,2,7,48426,[],()
80298,49404,21369,1,37.00$,08:03 2024-03-26,NULL,37.0,37.0,37.0,2024-03-26 08:03:00.000,2024-03-26,2024,3,26,49404,[],()
86272,48896,21332,1,$ 12.25,12:00:18 05/27/25,"63362 Robert Springs, Dickichester, IA 30204-4734",12.25,12.25,12.25,2025-05-27 12:00:18.000,2025-05-27,2025,5,27,48896,[],()
79812,50405,21561,1,70.50 $,2025-01-17T17:24:09,,70.5,70.5,70.5,2025-01-17 17:24:09.000,2025-01-17,2025,1,17,50405,[],()
82207,48911,21441,3,23USD," 3-MAY-2025,15:01","3790 Cletus Spring, New Jameton, MA 16698-8899",23.0,23.0,69.0,2025-05-03 15:01:00.000,2025-05-03,2025,5,3,48911,[],()
82077,49326,21673,1,€ 39.75,"15:20:10, 28-DEC-2024",,47.699999999999996,47.699999999999996,47.7,2024-12-28 15:20:10.000,2024-12-28,2024,12,28,49326,[],()
80843,50072,21904,1,$44.75,"04:11, 2024-08-24",NULL,44.75,44.75,44.75,2024-08-24 04:11:00.000,2024-08-24,2024,8,24,50072,[],()
85214,47827,21979,4,EUR 34.00,"11:23, 17-OCT-2024","Apt. 856 706 Lynn Prairie, Boehmberg, NY 35327",40.8,40.8,163.2,2024-10-17 11:23:00.000,2024-10-17,2024,10,17,47827,[],()
79004,47779,21863,1,$ 44.0,2024-12-01 01:20:34 pm, ,44.0,44.0,44.0,2024-12-01 13:20:34.000,2024-12-01,2024,12,1,47779,[],()
80352,48228,21592,1,63.50$,02/21/25 07:09:59 pm,,63.5,63.5,63.5,2025-02-21 19:09:59.000,2025-02-21,2025,2,21,48228,[],()
85721,48219,21980,5,14.5 USD,"02/12/25,08:02:52 pm",,14.5,14.5,72.5,2025-02-12 20:02:52.000,2025-02-12,2025,2,12,48219,[],()
86159,48062,21744,1,56.0$,"11:29:48 AM,12-JAN-2025","Suite 648 36683 Breitenberg Underpass, New Chet, IA 90233",56.0,56.0,56.0,2025-01-12 11:29:48.000,2025-01-12,2025,1,12,48062,[],()
82817,48056,21945,1,18.99 $,12/27/24 03:20:57 A.M.,"11708 Clifton Knoll, West Guy, PA 50885",18.99,18.99,18.99,2024-12-27 03:20:57.000,2024-12-27,2024,12,27,48056,[],()
81420,48836,21924,5,USD 55.50,27.12.2024 22:29:29,,55.5,55.5,277.5,2024-12-27 22:29:29.000,2024-12-27,2024,12,27,48836,[],()
81541,48804,21688,1,$18.99,"09:20,  6-JAN-2025","Suite 718 4386 Wunsch Points, Kittyton, MD 38921",18.99,18.99,18.99,2025-01-06 09:20:00.000,2025-01-06,2025,1,6,48804,[],()
84579,50754,21467,1,$ 48,2024-12-18T03:34:53,"Apt. 350 744 Karren Rapids, North Tory, PA 61430-8064",48.0,48.0,48.0,2024-12-18 03:34:53.000,2024-12-18,2024,12,18,50754,[],()
79072,49472,21316,1,35. USD,"11:05:33 AM, 2025-02-23", ,35.0,35.0,35.0,2025-02-23 11:05:33.000,2025-02-23,2025,2,23,49472,[],()
83817,47911,21754,1,$ 28,2025-01-21;00:07:04,NULL,28.0,28.0,28.0,2025-01-21 00:07:04.000,2025-01-21,2025,1,21,49582,[],()
84364,48578,21380,1,USD68.0,"17:44:55, 03/21/25",,68.0,68.0,68.0,2025-03-21 17:44:55.000,2025-03-21,2025,3,21,48578,[],()
82997,48753,21353,1,29.99EUR,11-Aug-2024 07:25:45 PM,NULL,35.988,35.988,35.99,2024-08-11 19:25:45.000,2024-08-11,2024,8,11,48753,[],()
83546,48120,21297,3,€27¢75,03/11/25;04:54:57 am,"370 Lind Extension, Boscomouth, MT 74876",3330.0,3330.0,9990.0,2025-03-11 04:54:57.000,2025-03-11,2025,3,11,48120,[],()
82384,50229,21621,1,$68¢99,11/05/24 05:03:06 PM,"Suite 429 11177 Roberta Plains, Starkview, LA 48297",6899.0,6899.0,6899.0,2024-11-05 17:03:06.000,2024-11-05,2024,11,5,50229,[],()
79188,47805,21360,1,60.50USD,07/22/24;12:07:01,NULL,60.5,60.5,60.5,2024-07-22 12:07:01.000,2024-07-22,2024,7,22,47805,[],()
77919,49723,21907,2,USD55.50,2024-09-25 09:47:08 am,"Apt. 738 472 Marco Shores, South Tysonmouth, NE 39763",55.5,55.5,111.0,2024-09-25 09:47:08.000,2024-09-25,2024,9,25,49723,[],()
82852,47717,21395,1,EUR61.50,09/24/24 06:16:47 PM,"Apt. 395 8118 Weimann Radial, Hauckmouth, TX 96209-5581",73.8,73.8,73.8,2024-09-24 18:16:47.000,2024-09-24,2024,9,24,47717,[],()
83998,48814,21451,1,$ 74.75,2025-05-08T00:49:17.178,,74.75,74.75,74.75,2025-05-08 00:49:17.178,2025-05-08,2025,5,8,48814,[],()
83315,50910,21949,2,$41.50,"09/25/24, 17:06","70452 Dominga Isle, West Tressa, MD 40096",41.5,41.5,83.0,2024-09-25 17:06:00.000,2024-09-25,2024,9,25,50910,[],()
80338,47727,21380,1,68EUR,"11:02:07 A.M.,11-May-2025","693 Wunsch Crest, Austinville, NV 75132-4855",81.6,81.6,81.6,2025-05-11 11:02:07.000,2025-05-11,2025,5,11,47727,[],()
85715,50021,21545,1,€31.,"2025-07-30, 14:26",,37.199999999999996,37.199999999999996,37.2,2025-07-30 14:26:00.000,2025-07-30,2025,7,30,50021,[],()
83807,49414,21965,1,61.25USD,"08/04/24, 23:26:01","Apt. 434 86586 Luettgen Springs, South Demarcus, MA 77781-3110",61.25,61.25,61.25,2024-08-04 23:26:01.000,2024-08-04,2024,8,4,49002,[],()
82245,49273,21315,1,$73¢75,2025-01-08;03:36,"388 Arden Point, New Aleenhaven, VA 29633",7375.0,7375.0,7375.0,2025-01-08 03:36:00.000,2025-01-08,2025,1,8,49273,[],()
81182,48868,21756,2,26.5 EUR,2024-08-18T12:08:51,,31.799999999999997,31.799999999999997,63.6,2024-08-18 12:08:51.000,2024-08-18,2024,8,18,48868,[],()
83359,50328,21766,2,58€00¢,2024-08-06;23:31:51,NULL,6960.0,6960.0,13920.0,2024-08-06 23:31:51.000,2024-08-06,2024,8,6,49277,[],()
86023,50242,22013,1,46. EUR,2025-01-15T02:06:37.946,,55.199999999999996,55.199999999999996,55.2,2025-01-15 02:06:37.946,2025-01-15,2025,1,15,50242,[],()
78211,49091,21353,1,27.99 EUR,"03:56:54, 2024-10-21",,33.587999999999994,33.587999999999994,33.59,2024-10-21 03:56:54.000,2024-10-21,2024,10,21,49091,[],()
81140,50410,21578,1,19.25 USD,10:47:23 P.M. 05/08/25,,19.25,19.25,19.25,2025-05-08 22:47:23.000,2025-05-08,2025,5,8,50410,[],()
77875,48132,21883,1,$34.25, 8.12.2024  8:47:47,"Apt. 649 1935 Salvador Lights, Dickensburgh, OK 14139-4051",34.25,34.25,34.25,2024-08-12 08:47:47.000,2024-08-12,2024,8,12,48132,[],()
78416,48970,21447,1,USD46.25,15:56:41; 6-DEC-2024,"27251 Kuhlman Glen, North Madelyn, MA 38192",46.25,46.25,46.25,2024-12-06 15:56:41.000,2024-12-06,2024,12,6,48970,[],()
79547,48231,22027,1,EUR33.75,2024-10-01T08:21:24.375,,40.5,40.5,40.5,2024-10-01 08:21:24.375,2024-10-01,2024,10,1,48231,[],()
78107,48856,22007,1,41.5 €,12:37:07 am 08/23/24,,49.8,49.8,49.8,2024-08-23 00:37:07.000,2024-08-23,2024,8,23,48622,[],()
77750,50334,21388,1,16.00USD,"00:29,2025-05-19",,16.0,16.0,16.0,2025-05-19 00:29:00.000,2025-05-19,2025,5,19,50334,[],()
84816,49085,21950,1,USD52.0,"00:35:46, 04/18/25","Suite 421 442 Kandace Knolls, Port Leonelshire, GA 31667-9432",52.0,52.0,52.0,2025-04-18 00:35:46.000,2025-04-18,2025,4,18,49085,[],()
80477,49329,21563,1,$72.5,2024-07-04;14:37,"Suite 135 606 Jamel Alley, Lake Everetteton, VT 33419",72.5,72.5,72.5,2024-07-04 14:37:00.000,2024-07-04,2024,7,4,49329,[],()
86489,49884,21399,1,$66.50,04:14:39 PM 2024-12-20,,66.5,66.5,66.5,2024-12-20 16:14:39.000,2024-12-20,2024,12,20,49884,[],()
85642,50750,21324,1,USD30,11:37 20-DEC-2024,NULL,30.0,30.0,30.0,2024-12-20 11:37:00.000,2024-12-20,2024,12,20,50750,[],()
77656,50561,21873,1,74.5 USD,2024-08-06T09:17:00.348,,74.5,74.5,74.5,2024-08-06 09:17:00.348,2024-08-06,2024,8,6,50561,[],()
79085,47902,21305,1,€26.00,"23-Jan-2025, 05:42:53 A.M.",,31.2,31.2,31.2,2025-01-23 05:42:53.000,2025-01-23,2025,1,23,47902,[],()
83604,48669,21426,2,65.00€,2024-08-24T15:32:05,,78.0,78.0,156.0,2024-08-24 15:32:05.000,2024-08-24,2024,8,24,48669,[],()
83058,49716,21353,1,27.25$,"05:37:33,17-January-2025",NULL,27.25,27.25,27.25,2025-01-17 05:37:33.000,2025-01-17,2025,1,17,49716,[],()
79606,47694,21344,1,51. $,"03/01/24,18:21:37",NULL,51.0,51.0,51.0,2024-03-01 18:21:37.000,2024-03-01,2024,3,1,47694,[],()
84314,50295,21970,1,70.25USD,2024-08-13T07:11:16,,70.25,70.25,70.25,2024-08-13 07:11:16.000,2024-08-13,2024,8,13,50295,[],()
84750,50421,21828,2,$ 15.25,"02/12/25, 06:02","659 Angel Fields, South Dannyfurt, ID 11003",15.25,15.25,30.5,2025-02-12 06:02:00.000,2025-02-12,2025,2,12,50421,[],()
79670,50964,21583,3,$ 57.25, 8-MAR-2025 08:11:41 am,NULL,57.25,57.25,171.75,2025-03-08 08:11:41.000,2025-03-08,2025,3,8,50964,[],()
78317,47963,21481,1,20.00 EUR,"2025-05-02, 10:03:29",NULL,24.0,24.0,24.0,2025-05-02 10:03:29.000,2025-05-02,2025,5,2,47963,[],()
82743,49991,22051,1,USD 29.99,2024-08-28T05:40:28.224,"270 Harber Garden, New Shaunte, MA 85613-6733",29.99,29.99,29.99,2024-08-28 05:40:28.224,2024-08-28,2024,8,28,49991,[],()
81383,48469,21335,1,USD 33.5,"12:16:20 PM,29-Oct-2024",,33.5,33.5,33.5,2024-10-29 12:16:20.000,2024-10-29,2024,10,29,48469,[],()
83420,49302,21697,1,64.99 €,11:35:45;2024-10-25,,77.98799999999999,77.98799999999999,77.99,2024-10-25 11:35:45.000,2024-10-25,2024,10,25,49302,[],()
82884,48486,21891,1,EUR 67.0,"00:28:33,10/17/24",NULL,80.39999999999999,80.39999999999999,80.4,2024-10-17 00:28:33.000,2024-10-17,2024,10,17,48486,[],()
84292,48095,21785,1,61.0$,"2025-03-21, 11:41:02 A.M.",,61.0,61.0,61.0,2025-03-21 11:41:02.000,2025-03-21,2025,3,21,48095,[],()
78047,50073,21932,4,$19.75,"2025-02-28,08:23:14 P.M.",NULL,19.75,19.75,79.0,2025-02-28 20:23:14.000,2025-02-28,2025,2,28,50073,[],()
85375,50878,21604,3,$ 72.50,10.09.2024 11:26:26,NULL,72.5,72.5,217.5,2024-10-09 11:26:26.000,2024-10-09,2024,10,9,50878,[],()
85203,50022,21605,1,45.0 $,"04/12/25, 12:08:18","Suite 873 41178 Everette Extension, Lake Shaunaberg, NY 22425-6077",45.0,45.0,45.0,2025-04-12 12:08:18.000,2025-04-12,2025,4,12,50022,[],()
82408,49696,21855,2,$ 56.00,2024-06-27T09:20:14,,56.0,56.0,112.0,2024-06-27 09:20:14.000,2024-06-27,2024,6,27,49696,[],()
85595,50821,21737,1,20.00 USD,"2024-11-19,22:14",,20.0,20.0,20.0,2024-11-19 22:14:00.000,2024-11-19,2024,11,19,50821,[],()
77957,50899,21915,1,USD33.75,2024-09-24;11:48:39 pm,,33.75,33.75,33.75,2024-09-24 23:48:39.000,2024-09-24,2024,9,24,50899,[],()
82259,50150,21750,2,USD29.75,24.12.2024 05:39:39,NULL,29.75,29.75,59.5,2024-12-24 05:39:39.000,2024-12-24,2024,12,24,50150,[],()
79265,50052,21307,1,28.0EUR,00:48:49;2025-03-30,"Suite 458 99710 Renner Forks, South Mandieburgh, NE 46946",33.6,33.6,33.6,2025-03-30 00:48:49.000,2025-03-30,2025,3,30,50052,[],()
85628,50522,21890,1,$69.25,18-OCT-2024;06:51:33 PM,,69.25,69.25,69.25,2024-10-18 18:51:33.000,2024-10-18,2024,10,18,50522,[],()
85267,50369,21651,1,$63.0," 1-May-2025,19:37",,63.0,63.0,63.0,2025-05-01 19:37:00.000,2025-05-01,2025,5,1,50369,[],()
84708,50657,21855,1,€59.00,"04:13, 13-APR-2025",,70.8,70.8,70.8,2025-04-13 04:13:00.000,2025-04-13,2025,4,13,50657,[],()
81890,50218,21694,1,25.50€,10/30/24 12:33:17 PM,,30.599999999999998,30.599999999999998,30.6,2024-10-30 12:33:17.000,2024-10-30,2024,10,30,50218,[],()
78295,48943,21752,1,57EUR,2024-06-09T00:52:45.846,NULL,68.39999999999999,68.39999999999999,68.4,2024-06-09 00:52:45.846,2024-06-09,2024,6,9,48943,[],()
81067,50241,21597,2,67.00€,07/25/24 13:38:30,NULL,80.39999999999999,80.39999999999999,160.8,2024-07-25 13:38:30.000,2024-07-25,2024,7,25,50241,[],()
84084,50423,21488,1,USD 66.5,2025-01-22T23:05:25,,66.5,66.5,66.5,2025-01-22 23:05:25.000,2025-01-22,2025,1,22,50423,[],()
86367,48395,21358,1,€17.50,"11-May-2024, 09:18",NULL,21.0,21.0,21.0,2024-05-11 09:18:00.000,2024-05-11,2024,5,11,48395,[],()
77701,49661,21833,2,€67.25,"03:06:23 PM,2024-08-20","Apt. 606 905 Kirlin Crescent, North Cathrineton, CA 82896-1684",80.7,80.7,161.4,2024-08-20 15:06:23.000,2024-08-20,2024,8,20,49661,[],()
78266,49914,21526,2,USD22.0,2025-07-02T03:52:57,,22.0,22.0,44.0,2025-07-02 03:52:57.000,2025-07-02,2025,7,2,49914,[],()
78425,50744,21620,2,USD 34.5,21:05:31 12/21/24,NULL,34.5,34.5,69.0,2024-12-21 21:05:31.000,2024-12-21,2024,12,21,50744,[],()
82671,50488,21535,1,$ 51.75,2024-07-01T07:34:52,NULL,51.75,51.75,51.75,2024-07-01 07:34:52.000,2024-07-01,2024,7,1,50488,[],()
79243,50916,21666,1,64.5EUR,"03:34, 03/16/25",,77.39999999999999,77.39999999999999,77.4,2025-03-16 03:34:00.000,2025-03-16,2025,3,16,50916,[],()
80556,50662,21765,3,26.25 USD,"08:57, 2025-02-24",,26.25,26.25,78.75,2025-02-24 08:57:00.000,2025-02-24,2025,2,24,50662,[],()
84730,50021,21853,1,54€00¢,2024-04-27T02:12:23,,6480.0,6480.0,6480.0,2024-04-27 02:12:23.000,2024-04-27,2024,4,27,50021,[],()
85412,48775,21495,1,50.5 USD,"11:32:03 am, 04/20/25","5681 Pfannerstill Mews, East Brianneborough, SC 06137-3328",50.5,50.5,50.5,2025-04-20 11:32:03.000,2025-04-20,2025,4,20,48775,[],()
83475,50258,21544,1,EUR 14.99,"07:31:11 am, 2-DEC-2024","5518 Normand Land, Juanaborough, NY 09415-3094",17.988,17.988,17.99,2024-12-02 07:31:11.000,2024-12-02,2024,12,2,50258,[],()
86338,49439,21450,1,$ 28.50,"15-July-2024, 21:55:58","60226 Joycelyn Forest, Rebecaborough, CO 50858",28.5,28.5,28.5,2024-07-15 21:55:58.000,2024-07-15,2024,7,15,49439,[],()
80458,48835,21505,1,39.0 $,"00:54,  6-June-2024",,39.0,39.0,39.0,2024-06-06 00:54:00.000,2024-06-06,2024,6,6,48835,[],()
78704,50613,21960,1,€58.5,00:13;2025-01-20,NULL,70.2,70.2,70.2,2025-01-20 00:13:00.000,2025-01-20,2025,1,20,50613,[],()
78996,50236,21980,1,12.99EUR,"22:22, 01/31/25","22744 Harriett Row, Jamarland, ID 23245",15.588,15.588,15.59,2025-01-31 22:22:00.000,2025-01-31,2025,1,31,50236,[],()
85784,49239,22000,1,EUR34.25,10/14/24;07:45,NULL,41.1,41.1,41.1,2024-10-14 07:45:00.000,2024-10-14,2024,10,14,49239,[],()
77862,49604,21766,2,$60.75,10:37:20 PM  2-OCT-2024,,60.75,60.75,121.5,2024-10-02 22:37:20.000,2024-10-02,2024,10,2,49604,[],()
79677,51070,21974,1,USD62.99,2024-11-25T10:55:07.296,,62.99,62.99,62.99,2024-11-25 10:55:07.296,2024-11-25,2024,11,25,51070,[],()
85822,50462,21950,5,$49¢50,"01:20, 05/27/24",NULL,4950.0,4950.0,24750.0,2024-05-27 01:20:00.000,2024-05-27,2024,5,27,50462,[],()
86220,50563,21493,1,28.75 $,2024-07-02;03:51:37,,28.75,28.75,28.75,2024-07-02 03:51:37.000,2024-07-02,2024,7,2,50563,[],()
79633,49281,21390,1,€ 49.5,07:55:38;21-Jul-2024,"Suite 518 94047 Wilkinson Mountain, Port Alva, ND 57007",59.4,59.4,59.4,2024-07-21 07:55:38.000,2024-07-21,2024,7,21,49281,[],()
80420,47997,22047,1,$66.25,2025-05-29T20:29:51,NULL,66.25,66.25,66.25,2025-05-29 20:29:51.000,2025-05-29,2025,5,29,51056,[],()
82320,49605,21463,1,28.00 USD,11:23:44;10/13/24,,28.0,28.0,28.0,2024-10-13 11:23:44.000,2024-10-13,2024,10,13,49605,[],()
84305,50567,21410,1,24.99$,02:24:34 PM 2025-05-01,NULL,24.99,24.99,24.99,2025-05-01 14:24:34.000,2025-05-01,2025,5,1,50567,[],()
78269,48463,21785,1,€62¢99,"12/29/24,10:32:44 am",NULL,7558.799999999999,7558.799999999999,7558.8,2024-12-29 10:32:44.000,2024-12-29,2024,12,29,48463,[],()
84093,48379,21339,3,67.5USD,"01:39:07, 09/08/24",NULL,67.5,67.5,202.5,2024-09-08 01:39:07.000,2024-09-08,2024,9,8,48379,[],()
83895,48071,21713,1,43.75 $,01:13:40;10/12/24,,43.75,43.75,43.75,2024-10-12 01:13:40.000,2024-10-12,2024,10,12,48071,[],()
82943,49792,21796,1,$29.5,30.07.2025 21:56:56,,29.5,29.5,29.5,2025-07-30 21:56:56.000,2025-07-30,2025,7,30,49792,[],()
77989,49948,21876,1,USD 35.99,16:39:49;01/30/25,NULL,35.99,35.99,35.99,2025-01-30 16:39:49.000,2025-01-30,2025,1,30,49948,[],()
85092,48387,21884,1,35.5USD,07:49:35 am 11/15/24,,35.5,35.5,35.5,2024-11-15 07:49:35.000,2024-11-15,2024,11,15,48387,[],()
85945,49650,21689,2,21.00EUR,"2025-06-27, 05:24:39 pm",,25.2,25.2,50.4,2025-06-27 17:24:39.000,2025-06-27,2025,6,27,49650,[],()
79460,50286,21697,1,64.99USD,"2025-05-13, 20:30:19",,64.99,64.99,64.99,2025-05-13 20:30:19.000,2025-05-13,2025,5,13,50286,[],()
77827,50709,21598,1,23.50USD,"08/13/24,02:30:22 PM","Apt. 415 5666 Hudson Parks, South Boyd, MS 42094",23.5,23.5,23.5,2024-08-13 14:30:22.000,2024-08-13,2024,8,13,50709,[],()
81602,48906,22055,1,53.99USD,03/16/25;04:25:54 AM,,53.99,53.99,53.99,2025-03-16 04:25:54.000,2025-03-16,2025,3,16,48906,[],()
78516,47946,22053,1,USD 56.50,"15-Dec-2024,16:32",,56.5,56.5,56.5,2024-12-15 16:32:00.000,2024-12-15,2024,12,15,47946,[],()
81197,49627,22054,5,USD 65.0,12/23/24 18:04:35,"36063 Bula Ferry, Port Danielton, CO 87131",65.0,65.0,325.0,2024-12-23 18:04:35.000,2024-12-23,2024,12,23,49627,[],()
84790,50714,21995,4,$ 45.50,2025-02-06T19:51:41.911,,45.5,45.5,182.0,2025-02-06 19:51:41.911,2025-02-06,2025,2,6,50714,[],()
78427,48049,21480,1,USD 52.00,"02:35:32 A.M., 09/10/24",,52.0,52.0,52.0,2024-09-10 02:35:32.000,2024-09-10,2024,9,10,48049,[],()
86124,48146,21779,1,32.5 €,"04/13/25, 12:54:34 A.M.",,39.0,39.0,39.0,2025-04-13 00:54:34.000,2025-04-13,2025,4,13,48146,[],()
83340,48074,21417,1,$61.75, 3.08.2024  1:07:07,NULL,61.75,61.75,61.75,2024-03-08 01:07:07.000,2024-03-08,2024,3,8,48074,[],()
79885,49262,21357,2,USD 23.50,"15:26:58,03/17/25","Suite 335 2782 Mammie Overpass, West Nathanielville, NE 54210-3406",23.5,23.5,47.0,2025-03-17 15:26:58.000,2025-03-17,2025,3,17,49262,[],()
79457,49977,21801,1,USD 39.5,03/29/25;11:38:19 A.M.,NULL,39.5,39.5,39.5,2025-03-29 11:38:19.000,2025-03-29,2025,3,29,50408,[],()
79150,49942,21772,1,USD 42.99,11:48:47 am;24-Jan-2025,NULL,42.99,42.99,42.99,2025-01-24 11:48:47.000,2025-01-24,2025,1,24,49942,[],()
81632,49255,22016,1,48.99USD,18-MAY-2024;23:03:29,NULL,48.99,48.99,48.99,2024-05-18 23:03:29.000,2024-05-18,2024,5,18,49255,[],()
86059,51085,21535,1,52.0 $,"21:30, 08/10/24","Suite 243 537 Leigh Orchard, New Jacquelyne, ND 25505-6581",52.0,52.0,52.0,2024-08-10 21:30:00.000,2024-08-10,2024,8,10,51085,[],()
84433,49126,21873,1,$ 71.,20:02:52;01/30/25,,71.0,71.0,71.0,2025-01-30 20:02:52.000,2025-01-30,2025,1,30,49126,[],()
82709,50848,21458,1,67 $,"2024-09-09,01:03:46",,67.0,67.0,67.0,2024-09-09 01:03:46.000,2024-09-09,2024,9,9,50848,[],()
83367,50624,21823,4,66€00¢,"15:35,2024-11-03",,7920.0,7920.0,31680.0,2024-11-03 15:35:00.000,2024-11-03,2024,11,3,50624,[],()
84127,47782,21722,2,36.5 $,"17:51,04/02/25",NULL,36.5,36.5,73.0,2025-04-02 17:51:00.000,2025-04-02,2025,4,2,47782,[],()
82250,50574,21701,3,EUR47.00,"01/16/25, 19:07",,56.4,56.4,169.2,2025-01-16 19:07:00.000,2025-01-16,2025,1,16,50574,[],()
83193,50962,21568,1,29.99 €,00:00:31 10-Jan-2025,NULL,35.988,35.988,35.99,2025-01-10 00:00:31.000,2025-01-10,2025,1,10,50962,[],()
79807,48821,21670,3,$ 26.00,"10-May-2024,06:21:10",,26.0,26.0,78.0,2024-05-10 06:21:10.000,2024-05-10,2024,5,10,48821,[],()
81573,50988,21822,1,USD 29.5,"18:16:23, 01/07/25","604 Marquardt Trafficway, Port Ethanmouth, WA 74502-5757",29.5,29.5,29.5,2025-01-07 18:16:23.000,2025-01-07,2025,1,7,50988,[],()
80425,47673,21566,1,USD27.00,"02/04/25, 10:42:10 P.M.",NULL,27.0,27.0,27.0,2025-02-04 22:42:10.000,2025-02-04,2025,2,4,47673,[],()
81823,50485,21480,1,52.00 USD,08/25/25 23:21,NULL,52.0,52.0,52.0,2025-08-25 23:21:00.000,2025-08-25,2025,8,25,50485,[],()
82100,48553,21547,2,57.5€,2024-04-30;11:12,,69.0,69.0,138.0,2024-04-30 11:12:00.000,2024-04-30,2024,4,30,48553,[],()
78660,49565,21850,4,60.75 USD,25.03.2025 13:37:37,"226 Gibson Rest, Leotafort, MD 42872-1487",60.75,60.75,243.0,2025-03-25 13:37:37.000,2025-03-25,2025,3,25,49565,[],()
83950,47831,21580,1,64.75 $,"11:15, 22-MAR-2025",,64.75,64.75,64.75,2025-03-22 11:15:00.000,2025-03-22,2025,3,22,47831,[],()
77611,49215,22009,1,€25.99,14:30:06;07/09/24,"Apt. 571 27643 Gorczany Skyway, Marieland, WY 06911-9771",31.187999999999995,31.187999999999995,31.19,2024-07-09 14:30:06.000,2024-07-09,2024,7,9,49215,[],()
77974,50702,21328,1,62.EUR,20.12.2024 15:45:45,,74.39999999999999,74.39999999999999,74.4,2024-12-20 15:45:45.000,2024-12-20,2024,12,20,50702,[],()
80987,50888,21562,1,€34.99,"08/19/24, 10:17:28 P.M.","Apt. 245 973 Marge Way, Schummton, NH 82211",41.988,41.988,41.99,2024-08-19 22:17:28.000,2024-08-19,2024,8,19,50888,[],()
85394,49396,21589,1,59.25$," 3-FEB-2025, 16:53",,59.25,59.25,59.25,2025-02-03 16:53:00.000,2025-02-03,2025,2,3,49396,[],()
82448,49276,22006,2,$ 27.25,"2024-03-03, 00:01","Suite 417 8778 Bauch Lodge, West Jan, CA 91260",27.25,27.25,54.5,2024-03-03 00:01:00.000,2024-03-03,2024,3,3,49276,[],()
85396,49068,21823,2,€61.75,"07/24/25, 03:43",,74.1,74.1,148.2,2025-07-24 03:43:00.000,2025-07-24,2025,7,24,49068,[],()
84843,48211,21950,2,USD52.25,30-Dec-2024;06:02:06 PM,"Apt. 194 217 Pfeffer Route, Port Stacyland, SC 14402",52.25,52.25,104.5,2024-12-30 18:02:06.000,2024-12-30,2024,12,30,48211,[],()
83268,48357,21675,2,18.5 USD, 5-OCT-2024;14:13:40,,18.5,18.5,37.0,2024-10-05 14:13:40.000,2024-10-05,2024,10,5,48357,[],()
81361,47884,21779,1,32.25 €," 2-Mar-2025, 19:23",,38.699999999999996,38.699999999999996,38.7,2025-03-02 19:23:00.000,2025-03-02,2025,3,2,48825,[],()
86116,50717,21597,1,69.5 USD,"09/15/24,08:43:19",NULL,69.5,69.5,69.5,2024-09-15 08:43:19.000,2024-09-15,2024,9,15,50717,[],()
78582,50992,21736,4,44.75 USD,"19:41, 12/31/24",,44.75,44.75,179.0,2024-12-31 19:41:00.000,2024-12-31,2024,12,31,50992,[],()
84888,49445,21805,5,€50¢75,07/30/24;04:06:45,NULL,6090.0,6090.0,30450.0,2024-07-30 04:06:45.000,2024-07-30,2024,7,30,49445,[],()
83856,50233,21955,1,56 USD,"09:27, 23-Apr-2025","Suite 228 632 Hyatt Common, East Carlieton, CO 27658-3411",56.0,56.0,56.0,2025-04-23 09:27:00.000,2025-04-23,2025,4,23,50233,[],()
82895,48412,21757,1,14.75EUR,"2025-07-19,11:15:33","Suite 600 478 Herzog Stravenue, Monroeberg, WV 31406",17.7,17.7,17.7,2025-07-19 11:15:33.000,2025-07-19,2025,7,19,48412,[],()
83667,48730,21562,2,$34.99,07:55:56 14-Jun-2025,,34.99,34.99,69.98,2025-06-14 07:55:56.000,2025-06-14,2025,6,14,48730,[],()
79732,50540,21871,1,32.5EUR,"02/22/25,20:03:07",,39.0,39.0,39.0,2025-02-22 20:03:07.000,2025-02-22,2025,2,22,50540,[],()
84320,47669,21812,1,45.50$,10:56:27;2024-05-04,"6767 Volkman Shoal, Stefanialand, MS 53376-0102",45.5,45.5,45.5,2024-05-04 10:56:27.000,2024-05-04,2024,5,4,50057,[],()
83823,49563,21641,1,29.99 $,2025-05-07T23:04:29.022,,29.99,29.99,29.99,2025-05-07 23:04:29.022,2025-05-07,2025,5,7,49563,[],()
80427,48203,21474,1,15.75EUR,"2025-02-18, 03:38:50 P.M.",,18.9,18.9,18.9,2025-02-18 15:38:50.000,2025-02-18,2025,2,18,48203,[],()
84027,49843,21798,1,59.99USD,02:26:42 2024-07-25,,59.99,59.99,59.99,2024-07-25 02:26:42.000,2024-07-25,2024,7,25,49843,[],()
84586,50693,21305,1,USD29.5,03:11:07 P.M. 2025-03-19,"Apt. 739 4998 Miller Lane, Chuckmouth, TN 38599",29.5,29.5,29.5,2025-03-19 15:11:07.000,2025-03-19,2025,3,19,50693,[],()
83291,49087,21923,1,EUR 20.99,2024-10-31T19:50:38,,25.188,25.188,25.19,2024-10-31 19:50:38.000,2024-10-31,2024,10,31,49087,[],()
78657,48249,21515,1,48.99 USD,"01/15/25,23:27",,48.99,48.99,48.99,2025-01-15 23:27:00.000,2025-01-15,2025,1,15,48249,[],()
78751,50296,21409,1,63.25USD,"05:52:24 am,12/22/24",,63.25,63.25,63.25,2024-12-22 05:52:24.000,2024-12-22,2024,12,22,50296,[],()
84121,49206,21308,1,35.25 USD,09:34 01/20/25,NULL,35.25,35.25,35.25,2025-01-20 09:34:00.000,2025-01-20,2025,1,20,49206,[],()
80508,51049,21462,2,USD23.00,2025-05-28T08:48:02.921,"894 Lynch Park, Irvinbury, MS 36580-7642",23.0,23.0,46.0,2025-05-28 08:48:02.921,2025-05-28,2025,5,28,51049,[],()
78630,48121,21871,2,28.00 USD,"01:31:48,12-February-2025","575 Willms Roads, West Jonell, MI 10302",28.0,28.0,56.0,2025-02-12 01:31:48.000,2025-02-12,2025,2,12,48121,[],()
82728,47964,22015,2,66 €,"09:12:48, 11/30/24","4687 Senger Groves, Weberville, NC 46579-3565",79.2,79.2,158.4,2024-11-30 09:12:48.000,2024-11-30,2024,11,30,47964,[],()
85303,50927,21899,1,€ 68.25,12/21/24;19:11,"50814 Feeney Crossing, Lake Belindaville, WV 96835-7668",81.89999999999999,81.89999999999999,81.9,2024-12-21 19:11:00.000,2024-12-21,2024,12,21,50927,[],()
82377,49498,21814,1,45.99€,"07/19/25, 05:32","83477 Frami Mill, Erichton, ND 55822-0660",55.188,55.188,55.19,2025-07-19 05:32:00.000,2025-07-19,2025,7,19,49498,[],()
81165,50958,21355,1,60.5USD,"09:27:05 pm,2025-06-13",,60.5,60.5,60.5,2025-06-13 21:27:05.000,2025-06-13,2025,6,13,50958,[],()
81498,49073,22017,5,26.5 $,2024-08-20T00:27:05,"41926 Herzog Lights, East Amee, VT 33524-9649",26.5,26.5,132.5,2024-08-20 00:27:05.000,2024-08-20,2024,8,20,49073,[],()
85598,49864,22044,2,21.99USD,2025-07-06T15:26:24,NULL,21.99,21.99,43.98,2025-07-06 15:26:24.000,2025-07-06,2025,7,6,49864,[],()
77972,50898,21792,1,61.25USD,"00:15,2025-02-21","Suite 577 397 Kassulke Courts, Tyronestad, WI 52530-7865",61.25,61.25,61.25,2025-02-21 00:15:00.000,2025-02-21,2025,2,21,50898,[],()
86092,48997,21875,2,49.50 $,22.01.2025 04:18:18,"866 Reilly Viaduct, Priceshire, NJ 87104",49.5,49.5,99.0,2025-01-22 04:18:18.000,2025-01-22,2025,1,22,50159,[],()
79987,49111,21344,3,€ 54.25,12:20:08  5-April-2025,,65.1,65.1,195.3,2025-04-05 12:20:08.000,2025-04-05,2025,4,5,49111,[],()
78902,49859,21812,1,$47.99,"01:28:02 A.M.,16-Jan-2025",,47.99,47.99,47.99,2025-01-16 01:28:02.000,2025-01-16,2025,1,16,49859,[],()
78348,49116,21582,1,66.50$,"27-JUL-2024,11:09:11 pm",NULL,66.5,66.5,66.5,2024-07-27 23:09:11.000,2024-07-27,2024,7,27,49116,[],()
84046,50126,21316,1,USD30.75,"22-September-2024, 02:40:36","Suite 893 19453 Cathern Isle, Lake Robert, AZ 38360-6880",30.75,30.75,30.75,2024-09-22 02:40:36.000,2024-09-22,2024,9,22,50126,[],()
83857,50513,21805,1,48.00$,"20:17:41, 4-AUG-2024","67509 Krajcik Brooks, Lorieton, CO 17861-4481",48.0,48.0,48.0,2024-08-04 20:17:41.000,2024-08-04,2024,8,4,50513,[],()
83540,48408,21523,1,$14.,19.09.2024 14:31:31,"Apt. 351 899 Beier Radial, Florentinoport, VT 50374-4144",14.0,14.0,14.0,2024-09-19 14:31:31.000,2024-09-19,2024,9,19,48408,[],()
82722,49751,21810,1,55 EUR,22:33:19;05/09/24,NULL,66.0,66.0,66.0,2024-05-09 22:33:19.000,2024-05-09,2024,5,9,49751,[],()
82778,48277,21948,1,€62¢99,11-Nov-2024 13:41:44,"316 Nathanial Key, Kevenview, KY 25947-8966",7558.799999999999,7558.799999999999,7558.8,2024-11-11 13:41:44.000,2024-11-11,2024,11,11,48277,[],()
84095,49013,21666,2,€66.00,"01/27/25,20:51:32",,79.2,79.2,158.4,2025-01-27 20:51:32.000,2025-01-27,2025,1,27,49013,[],()
81893,51068,21608,1,USD54.0,11/10/24;12:24:28,,54.0,54.0,54.0,2024-11-10 12:24:28.000,2024-11-10,2024,11,10,49652,[],()
78296,50161,21895,2,14.99 USD,"02:26, 30-December-2024",,14.99,14.99,29.98,2024-12-30 02:26:00.000,2024-12-30,2024,12,30,50161,[],()
81843,48699,21602,4,$61.5,12/11/24 10:49:51 AM,,61.5,61.5,246.0,2024-12-11 10:49:51.000,2024-12-11,2024,12,11,48699,[],()
77809,48247,21953,1,38.75€,"01/29/25, 03:15:08",,46.5,46.5,46.5,2025-01-29 03:15:08.000,2025-01-29,2025,1,29,48247,[],()
79178,48034,22038,1,36.$,"09:03:38 A.M., 1-Sep-2024","96829 Hackett Avenue, Naderview, MA 51525",36.0,36.0,36.0,2024-09-01 09:03:38.000,2024-09-01,2024,9,1,48034,[],()
83900,48816,21399,1,66.75EUR,"01/24/25,06:59:24 pm","5457 Olson Rapids, Dickensstad, RI 04271",80.1,80.1,80.1,2025-01-24 18:59:24.000,2025-01-24,2025,1,24,48816,[],()
83421,49472,21475,1,$ 24.50,2024-03-28T05:22:23,,24.5,24.5,24.5,2024-03-28 05:22:23.000,2024-03-28,2024,3,28,49472,[],()
81556,49731,21337,1,$ 34.99, 6.11.2024 23:51:51,NULL,34.99,34.99,34.99,2024-06-11 23:51:51.000,2024-06-11,2024,6,11,49731,[],()
82263,48806,21321,1,66.5$,"17:50:18, 06/09/24",,66.5,66.5,66.5,2024-06-09 17:50:18.000,2024-06-09,2024,6,9,48806,[],()
85960,48125,21401,1,USD 27.0,09:19:46;12-OCT-2025,,27.0,27.0,27.0,2025-10-12 09:19:46.000,2025-10-12,2025,10,12,48125,[],()
82090,49830,21386,1,USD45,"01/07/25, 19:11","Suite 545 40491 Freddy Mill, Lilybury, SC 19376",45.0,45.0,45.0,2025-01-07 19:11:00.000,2025-01-07,2025,1,7,49830,[],()
78396,51086,21656,1,€ 28,2025-03-10T00:55:32,NULL,33.6,33.6,33.6,2025-03-10 00:55:32.000,2025-03-10,2025,3,10,51086,[],()
78097,48996,21999,1,$ 31.5,"11/14/24, 12:20",,31.5,31.5,31.5,2024-11-14 12:20:00.000,2024-11-14,2024,11,14,48996,[],()
81913,50929,21383,3,USD 49.75,2024-09-21;04:37:30 AM,,49.75,49.75,149.25,2024-09-21 04:37:30.000,2024-09-21,2024,9,21,50929,[],()
82633,51089,21547,1,EUR 54.0,"06:10,  8-Dec-2024",,64.8,64.8,64.8,2024-12-08 06:10:00.000,2024-12-08,2024,12,8,51089,[],()
82094,50238,21514,1,71.5 USD," 6-MAR-2025, 06:27:26 am",,71.5,71.5,71.5,2025-03-06 06:27:26.000,2025-03-06,2025,3,6,50238,[],()
82872,48127,21853,1,56.5€,08:51;07/10/24,"322 Rutherford Freeway, South Wesleymouth, LA 03541",67.8,67.8,67.8,2024-07-10 08:51:00.000,2024-07-10,2024,7,10,48127,[],()
84815,49080,22056,1,€ 21.25,"18-January-2025, 00:53:45",,25.5,25.5,25.5,2025-01-18 00:53:45.000,2025-01-18,2025,1,18,49080,[],()
80651,49790,21435,1,€33¢99,21:37;09/13/24,,4078.7999999999997,4078.7999999999997,4078.8,2024-09-13 21:37:00.000,2024-09-13,2024,9,13,49790,[],()
79271,48813,21636,2,15. $,2024-08-11T05:01:02,,15.0,15.0,30.0,2024-08-11 05:01:02.000,2024-08-11,2024,8,11,48813,[],()
81907,50029,21540,1,€27¢75,"22:19,  1-November-2024",NULL,3330.0,3330.0,3330.0,2024-11-01 22:19:00.000,2024-11-01,2024,11,1,50029,[],()
81443,50229,21776,1,$72¢25,09/25/24 08:04,,7225.0,7225.0,7225.0,2024-09-25 08:04:00.000,2024-09-25,2024,9,25,50229,[],()
79661,49337,21564,4,72.5 $,2025-08-13;01:54:11 pm,NULL,72.5,72.5,290.0,2025-08-13 13:54:11.000,2025-08-13,2025,8,13,49337,[],()
84044,49919,21341,3,USD 23.00,"11:37:38, 21-JUL-2024","Apt. 247 497 Schaden Union, Port Elvia, VT 03528",23.0,23.0,69.0,2024-07-21 11:37:38.000,2024-07-21,2024,7,21,49919,[],()
81491,50857,21466,1,USD34.5,2024-10-01T10:48:45,,34.5,34.5,34.5,2024-10-01 10:48:45.000,2024-10-01,2024,10,1,50857,[],()
79326,50420,21711,1,25.0$,21:27:55;31-Aug-2024,,25.0,25.0,25.0,2024-08-31 21:27:55.000,2024-08-31,2024,8,31,50420,[],()
83848,48021,21651,1,$63¢75,"11:31:21 PM, 14-JUL-2024",,6375.0,6375.0,6375.0,2024-07-14 23:31:21.000,2024-07-14,2024,7,14,48021,[],()
80583,50853,22057,1,47.50 EUR,"2024-11-17, 09:09:48 am",NULL,57.0,57.0,57.0,2024-11-17 09:09:48.000,2024-11-17,2024,11,17,50853,[],()
79260,48448,21832,1,€35.75,"18-May-2024, 09:13",NULL,42.9,42.9,42.9,2024-05-18 09:13:00.000,2024-05-18,2024,5,18,48448,[],()
86402,49664,21654,1,43.00 €,"07:46:26 pm, 26-Oct-2024",,51.6,51.6,51.6,2024-10-26 19:46:26.000,2024-10-26,2024,10,26,48528,[],()
79148,50822,21477,1,$17¢75,01/08/25 06:37:38,,1775.0,1775.0,1775.0,2025-01-08 06:37:38.000,2025-01-08,2025,1,8,50822,[],()
82604,48676,21421,1,€61¢25,2024-08-09T18:12:10.617,NULL,7350.0,7350.0,7350.0,2024-08-09 18:12:10.617,2024-08-09,2024,8,9,48676,[],()
84087,47681,21879,1,€55.,2025-04-03T14:13:00.071,,66.0,66.0,66.0,2025-04-03 14:13:00.071,2025-04-03,2025,4,3,47681,[],()
79667,49896,21780,1,$ 18.00,07.12.2024 19:06:06,,18.0,18.0,18.0,2024-07-12 19:06:06.000,2024-07-12,2024,7,12,49896,[],()
83013,49059,21876,5,32.25 $,2024-07-15T18:45:54,,32.25,32.25,161.25,2024-07-15 18:45:54.000,2024-07-15,2024,7,15,49059,[],()
78795,47811,22000,3,USD35.25,"15-September-2024,01:10:33 PM",,35.25,35.25,105.75,2024-09-15 13:10:33.000,2024-09-15,2024,9,15,47811,[],()
83092,51034,21509,1,37.50 $," 8-MAR-2025, 04:57:41 P.M.","9647 Simonis Crest, Glentown, FL 92685-5844",37.5,37.5,37.5,2025-03-08 16:57:41.000,2025-03-08,2025,3,8,51034,[],()
83939,50679,21716,1,30.50 €,01/12/25 08:56:52 AM,,36.6,36.6,36.6,2025-01-12 08:56:52.000,2025-01-12,2025,1,12,50679,[],()
84313,48011,21692,1,69.00$,"16-JAN-2025,00:23",,69.0,69.0,69.0,2025-01-16 00:23:00.000,2025-01-16,2025,1,16,48011,[],()
83244,51125,21807,1,34.00USD,2025-09-03T20:54:11.328,"Apt. 323 57859 Jonna Pine, Ardenchester, GA 27915",34.0,34.0,34.0,2025-09-03 20:54:11.328,2025-09-03,2025,9,3,51125,[],()
81080,48650,21919,1,58.75 USD,12:08;12/08/24,NULL,58.75,58.75,58.75,2024-12-08 12:08:00.000,2024-12-08,2024,12,8,48650,[],()
84458,49353,22041,1,USD39.25,2025-07-10 23:31:35,NULL,39.25,39.25,39.25,2025-07-10 23:31:35.000,2025-07-10,2025,7,10,49353,[],()
80173,47844,21764,1,52.0USD,19-November-2024 08:00:36 AM,"Suite 563 1147 Murray Underpass, Littelside, TX 25465",52.0,52.0,52.0,2024-11-19 08:00:36.000,2024-11-19,2024,11,19,47844,[],()
84601,50109,21878,1,59. $,2024-05-31T06:33:19,,59.0,59.0,59.0,2024-05-31 06:33:19.000,2024-05-31,2024,5,31,50109,[],()
77684,47791,21907,1,USD56.00," 7-May-2024, 03:26",,56.0,56.0,56.0,2024-05-07 03:26:00.000,2024-05-07,2024,5,7,47791,[],()
78350,50518,21833,1,64USD,"10:29:11 A.M., 2024-10-20",NULL,64.0,64.0,64.0,2024-10-20 10:29:11.000,2024-10-20,2024,10,20,50518,[],()
85339,48233,21652,1,$ 61.5,"10/15/24, 04:47:45","9649 Rolf View, South Norman, NH 69238-0106",61.5,61.5,61.5,2024-10-15 04:47:45.000,2024-10-15,2024,10,15,48233,[],()
83346,47663,21864,1,75 USD,09:57:24 AM 2025-01-20,"3783 Winfred Mountains, West Sam, NE 47162-7981",75.0,75.0,75.0,2025-01-20 09:57:24.000,2025-01-20,2025,1,20,47663,[],()
86289,49147,21969,1,56.50USD,12:20:22 am 28-Jan-2025,,56.5,56.5,56.5,2025-01-28 00:20:22.000,2025-01-28,2025,1,28,49147,[],()
82427,50804,21778,1,$39.0,19:13 2025-01-07,,39.0,39.0,39.0,2025-01-07 19:13:00.000,2025-01-07,2025,1,7,50804,[],()
80199,48257,21316,1,EUR 31.25,"22:48,2025-03-18","832 Casey Divide, Chelseyland, MT 16872",37.5,37.5,37.5,2025-03-18 22:48:00.000,2025-03-18,2025,3,18,48257,[],()
83152,49164,21383,1,52USD,2024-10-10T08:39:49,"Apt. 297 59771 Johnston Points, South Alberg, ND 02573",52.0,52.0,52.0,2024-10-10 08:39:49.000,2024-10-10,2024,10,10,49164,[],()
82095,48147,22030,1,16.5 USD,2025-03-05;16:15:17,,16.5,16.5,16.5,2025-03-05 16:15:17.000,2025-03-05,2025,3,5,48147,[],()
77882,47880,22005,4,USD 44.25,"14:36:00,2024-11-07","284 Miller Pike, North Luana, WI 73626",44.25,44.25,177.0,2024-11-07 14:36:00.000,2024-11-07,2024,11,7,47880,[],()
85124,48101,21367,5,27.00 €,2024-06-30T03:05:04.091,,32.4,32.4,162.0,2024-06-30 03:05:04.091,2024-06-30,2024,6,30,50132,[],()
84265,48327,22029,1,64.5USD,06:13:08 A.M. 20-FEB-2025,,64.5,64.5,64.5,2025-02-20 06:13:08.000,2025-02-20,2025,2,20,48327,[],()
83660,48569,21721,1,51.5 €,"2025-01-01,02:18:00 am",,61.8,61.8,61.8,2025-01-01 02:18:00.000,2025-01-01,2025,1,1,48569,[],()
85013,49766,21816,2,€ 72.75,03:46;2025-03-02,,87.3,87.3,174.6,2025-03-02 03:46:00.000,2025-03-02,2025,3,2,49766,[],()
85662,49104,21768,2,$21¢50,2024-12-04T02:42:10,,2150.0,2150.0,4300.0,2024-12-04 02:42:10.000,2024-12-04,2024,12,4,49104,[],()
81379,49923,21578,2,USD 20.25,"10:30:14 am, 2025-01-17",,20.25,20.25,40.5,2025-01-17 10:30:14.000,2025-01-17,2025,1,17,49923,[],()
83015,50750,21929,1,58$,2025-02-04T11:52:26,"4421 Reanna Mills, Port Jenice, OH 13336-1358",58.0,58.0,58.0,2025-02-04 11:52:26.000,2025-02-04,2025,2,4,50750,[],()
84451,48159,21604,3,74.99 USD,"21:39:16,01/30/25",,74.99,74.99,224.97,2025-01-30 21:39:16.000,2025-01-30,2025,1,30,48159,[],()
79286,49559,21906,2,USD42,02:35:10 A.M.;28-Nov-2024,NULL,42.0,42.0,84.0,2024-11-28 02:35:10.000,2024-11-28,2024,11,28,49559,[],()
78369,49411,22056,1,EUR 22.00,07:16:19 09/25/24,,26.4,26.4,26.4,2024-09-25 07:16:19.000,2024-09-25,2024,9,25,49411,[],()
82607,47665,21955,4,EUR54.,"16:10,30-AUG-2025","Suite 973 2377 Hayes Mills, Rosarioside, SC 68113-5517",64.8,64.8,259.2,2025-08-30 16:10:00.000,2025-08-30,2025,8,30,47665,[],()
83167,50436,21860,3,46.00€,12/03/24;08:38,,55.199999999999996,55.199999999999996,165.6,2024-12-03 08:38:00.000,2024-12-03,2024,12,3,50436,[],()
83669,48411,21705,1,EUR 66.75,"14:54, 2024-12-11","Suite 671 202 Leia Freeway, North Emeryside, NJ 94591-0705",80.1,80.1,80.1,2024-12-11 14:54:00.000,2024-12-11,2024,12,11,48411,[],()
85548,50785,21918,1,$75¢75,05/18/25 17:22,"Apt. 144 2937 Cary Center, South Jonathonbury, IL 67778-0248",7575.0,7575.0,7575.0,2025-05-18 17:22:00.000,2025-05-18,2025,5,18,50785,[],()
85114,47815,21705,1,$64.00,12/29/24 07:18:29,,64.0,64.0,64.0,2024-12-29 07:18:29.000,2024-12-29,2024,12,29,47815,[],()
77712,49943,21779,1,32.99EUR,2025-04-28T13:14:16,"Apt. 558 564 Hipolito Station, Nikolaushaven, KY 12949",39.588,39.588,39.59,2025-04-28 13:14:16.000,2025-04-28,2025,4,28,49943,[],()
79106,47960,21816,2,68.50 USD,2024-12-26T22:36:26.842,,68.5,68.5,137.0,2024-12-26 22:36:26.842,2024-12-26,2024,12,26,47960,[],()
85729,50821,21751,1,74.00€,"14-Oct-2024, 09:40:31 am",,88.8,88.8,88.8,2024-10-14 09:40:31.000,2024-10-14,2024,10,14,50821,[],()
79836,50536,21371,1,$ 52.99,2025-05-06T14:37:49,,52.99,52.99,52.99,2025-05-06 14:37:49.000,2025-05-06,2025,5,6,50536,[],()
81255,48037,21868,1,USD65.99,16:33:23; 1-JAN-2025,"16481 Dollie Village, New Kristofer, SD 35116-0509",65.99,65.99,65.99,2025-01-01 16:33:23.000,2025-01-01,2025,1,1,48037,[],()
84160,50664,22010,1,USD43.50,"14:57:31,13-October-2024",NULL,43.5,43.5,43.5,2024-10-13 14:57:31.000,2024-10-13,2024,10,13,50664,[],()
78326,48129,21597,1,68.99 USD,2024-09-16;04:06:14 A.M.,NULL,68.99,68.99,68.99,2024-09-16 04:06:14.000,2024-09-16,2024,9,16,48129,[],()
80621,48982,21910,1,EUR 32.75,11/05/24 04:19:26 pm,"78629 Takako Mountains, Carmelitashire, AR 63374-5019",39.3,39.3,39.3,2024-11-05 16:19:26.000,2024-11-05,2024,11,5,48492,[],()
77821,50658,21705,1,62.25€,05:28:09 P.M. 2024-05-15,"3923 Kutch Burg, Hegmannfurt, NJ 51410",74.7,74.7,74.7,2024-05-15 17:28:09.000,2024-05-15,2024,5,15,50658,[],()
80838,48093,21296,2,54.25 $,09/26/24 13:06:35,,54.25,54.25,108.5,2024-09-26 13:06:35.000,2024-09-26,2024,9,26,50782,[],()
83730,47762,21688,2,20.99USD,"21:04:57,21-Mar-2025","Apt. 574 199 Cremin Underpass, Hansenside, MA 45626",20.99,20.99,41.98,2025-03-21 21:04:57.000,2025-03-21,2025,3,21,47762,[],()
79625,49961,21789,4,USD25,2025-01-12T21:06:40,NULL,25.0,25.0,100.0,2025-01-12 21:06:40.000,2025-01-12,2025,1,12,49961,[],()
83737,50407,21610,1,54. €,10:33:30;2025-07-31,,64.8,64.8,64.8,2025-07-31 10:33:30.000,2025-07-31,2025,7,31,50407,[],()
83225,48189,21668,1,EUR49.50,"01/11/25, 09:49",NULL,59.4,59.4,59.4,2025-01-11 09:49:00.000,2025-01-11,2025,1,11,48189,[],()
81610,50517,21509,1,USD40.99,2024-10-21;20:22:21,,40.99,40.99,40.99,2024-10-21 20:22:21.000,2024-10-21,2024,10,21,50517,[],()
85583,49494,21359,1,EUR 26.0,"21:13:08,2025-04-19",NULL,31.2,31.2,31.2,2025-04-19 21:13:08.000,2025-04-19,2025,4,19,49494,[],()
82900,47837,22026,1,€ 56.25,2024-10-25T09:36:52.355,"199 Marlin Fords, West Dyan, RI 26924",67.5,67.5,67.5,2024-10-25 09:36:52.355,2024-10-25,2024,10,25,47837,[],()
80459,50615,21376,1,USD54.99,Fri Jul  5 20:03:10 2024,,54.99,54.99,54.99,2024-07-05 20:03:10.000,2024-07-05,2024,7,5,50615,[],()
85752,50292,21425,1,USD 36.25,16:44;03/25/25,,36.25,36.25,36.25,2025-03-25 16:44:00.000,2025-03-25,2025,3,25,50292,[],()
79223,47722,21913,1,$44.50,2025-01-05 11:44:17 P.M.,"42013 Coy Port, Howeton, OK 26431-5645",44.5,44.5,44.5,2025-01-05 23:44:17.000,2025-01-05,2025,1,5,47722,[],()
80321,50607,21977,5,$ 25.75,"04/04/25,02:16:53 pm",NULL,25.75,25.75,128.75,2025-04-04 14:16:53.000,2025-04-04,2025,4,4,50607,[],()
78924,49788,21838,1,$29.75,2024-11-07T11:34:45.755,"29643 Purdy Coves, Lake Robertoland, UT 64834-4681",29.75,29.75,29.75,2024-11-07 11:34:45.755,2024-11-07,2024,11,7,48609,[],()
80872,49444,21542,1,35.00USD,"12:39:05, 17-Oct-2024",,35.0,35.0,35.0,2024-10-17 12:39:05.000,2024-10-17,2024,10,17,49444,[],()
83009,49375,21343,1,72.0 €,06:57:47 PM;2025-02-04,,86.39999999999999,86.39999999999999,86.4,2025-02-04 18:57:47.000,2025-02-04,2025,2,4,49375,[],()
85076,49551,21864,1,$73.50,"03/10/25, 01:40:23",NULL,73.5,73.5,73.5,2025-03-10 01:40:23.000,2025-03-10,2025,3,10,49551,[],()
79109,49203,21961,1,€ 27.00,02:26; 9-Mar-2024,"Apt. 649 493 Reichel Circle, West Bennie, MD 13238",32.4,32.4,32.4,2024-03-09 02:26:00.000,2024-03-09,2024,3,9,49203,[],()
81539,48076,21812,2,48.25USD,30-Nov-2024;10:25:54,NULL,48.25,48.25,96.5,2024-11-30 10:25:54.000,2024-11-30,2024,11,30,48076,[],()
83055,47906,21895,1,17.25 €,03/20/25;06:30:39 pm,NULL,20.7,20.7,20.7,2025-03-20 18:30:39.000,2025-03-20,2025,3,20,47906,[],()
86120,49664,21362,2,18.25$,11/19/24 19:22,"Apt. 704 149 Hayes Creek, South Cherelle, ND 99766-8324",18.25,18.25,36.5,2024-11-19 19:22:00.000,2024-11-19,2024,11,19,48528,[],()
83085,49929,21431,1,48.0USD,"04:42,27-JAN-2025","604 Gusikowski Mews, South Merrillstad, MI 32679",48.0,48.0,48.0,2025-01-27 04:42:00.000,2025-01-27,2025,1,27,49929,[],()
85067,48264,21692,2,€ 69.75,05:29;2024-11-24,,83.7,83.7,167.4,2024-11-24 05:29:00.000,2024-11-24,2024,11,24,48264,[],()
79236,48960,21505,1,44.50USD,"23:51, 04/15/25","1993 Johns Lodge, Lake Zachary, CT 30350-2195",44.5,44.5,44.5,2025-04-15 23:51:00.000,2025-04-15,2025,4,15,48960,[],()
84096,48361,21652,1,USD60.00,"15-May-2025, 01:15:03 P.M.",NULL,60.0,60.0,60.0,2025-05-15 13:15:03.000,2025-05-15,2025,5,15,48361,[],()
85023,49419,21656,5,32.25 $, 1-JAN-2025;01:50,NULL,32.25,32.25,161.25,2025-01-01 01:50:00.000,2025-01-01,2025,1,1,49419,[],()
80365,48738,21554,3,USD 67.0,"19:26,10/26/24",,67.0,67.0,201.0,2024-10-26 19:26:00.000,2024-10-26,2024,10,26,48738,[],()
85300,49127,21676,1,70.75EUR,"16:23:38,01/15/25","3936 Blanda Isle, East Vaughn, MA 37116-5826",84.89999999999999,84.89999999999999,84.9,2025-01-15 16:23:38.000,2025-01-15,2025,1,15,49127,[],()
81662,50817,21776,1,EUR75.5,"06:27:46, 2024-10-22",,90.6,90.6,90.6,2024-10-22 06:27:46.000,2024-10-22,2024,10,22,50817,[],()
83964,48993,21828,1,USD 19.50,"2024-09-27, 00:15:05",,19.5,19.5,19.5,2024-09-27 00:15:05.000,2024-09-27,2024,9,27,48993,[],()
81011,50149,21396,1,USD51.,2024-07-17;15:43,,51.0,51.0,51.0,2024-07-17 15:43:00.000,2024-07-17,2024,7,17,50149,[],()
78867,50023,21567,1,USD 62.0,23:09:10 24-Feb-2025,,62.0,62.0,62.0,2025-02-24 23:09:10.000,2025-02-24,2025,2,24,50023,[],()
83912,48644,21442,1,49.5 USD,09:44:26 P.M.;13-MAY-2025,"981 Cummerata Ramp, East Lettyborough, MO 31718",49.5,49.5,49.5,2025-05-13 21:44:26.000,2025-05-13,2025,5,13,48644,[],()
77926,49414,21798,1,59.00EUR,"11/24/24,03:15:15 pm",,70.8,70.8,70.8,2024-11-24 15:15:15.000,2024-11-24,2024,11,24,49002,[],()
82151,49514,21890,1,USD 67,2024-11-28T02:27:05,"Suite 263 4748 Ward Lights, South Paulita, AK 82887",67.0,67.0,67.0,2024-11-28 02:27:05.000,2024-11-28,2024,11,28,49514,[],()
85526,48964,21469,1,USD59.75,"08/16/24, 23:52:43",,59.75,59.75,59.75,2024-08-16 23:52:43.000,2024-08-16,2024,8,16,48964,[],()
85646,49266,21508,1,EUR24.25,05:26:15;12/26/24,,29.099999999999998,29.099999999999998,29.1,2024-12-26 05:26:15.000,2024-12-26,2024,12,26,50755,[],()
84100,48590,21888,2,74.50€,01:40:40 am 07/29/24,"445 Haag Dam, East Tod, ID 46797-1837",89.39999999999999,89.39999999999999,178.8,2024-07-29 01:40:40.000,2024-07-29,2024,7,29,51044,[],()
85155,49728,21622,1,47.0 EUR,"24-JUN-2024, 18:01:07",NULL,56.4,56.4,56.4,2024-06-24 18:01:07.000,2024-06-24,2024,6,24,49728,[],()
84370,49921,21645,1,$ 48.5,17:45; 7-MAR-2025,,48.5,48.5,48.5,2025-03-07 17:45:00.000,2025-03-07,2025,3,7,49921,[],()
86223,50422,21469,1,$ 59.5,"01:18:34 am, 03/09/24","Apt. 994 752 Bernarda Stream, Port Michaelmouth, DE 61614",59.5,59.5,59.5,2024-03-09 01:18:34.000,2024-03-09,2024,3,9,50422,[],()
82335,48210,21351,4,36.25 EUR,12/19/24;15:08,,43.5,43.5,174.0,2024-12-19 15:08:00.000,2024-12-19,2024,12,19,48210,[],()
79324,49457,21942,1,USD 14.25,"18-DEC-2024,09:30:11 P.M.","Suite 520 783 Mandie Passage, Port Chariseside, DE 40747",14.25,14.25,14.25,2024-12-18 21:30:11.000,2024-12-18,2024,12,18,49457,[],()
84410,50987,21991,3,USD 75,"2025-03-19,08:35:12 am",NULL,75.0,75.0,225.0,2025-03-19 08:35:12.000,2025-03-19,2025,3,19,50987,[],()
84221,48570,21422,1,EUR 15.0,18:51:35 17-September-2024,,18.0,18.0,18.0,2024-09-17 18:51:35.000,2024-09-17,2024,9,17,48570,[],()
86362,49577,21497,1,69.00$,"2025-01-22,04:57:46 P.M.",NULL,69.0,69.0,69.0,2025-01-22 16:57:46.000,2025-01-22,2025,1,22,49577,[],()
84902,48731,22027,1,$31.25,"25-Dec-2024,20:47:52","3504 Rudy Run, Port Neilport, WA 22402-6389",31.25,31.25,31.25,2024-12-25 20:47:52.000,2024-12-25,2024,12,25,48731,[],()
77873,48219,21352,1,32$00¢,2025-05-15T22:39:44.664,,3200.0,3200.0,3200.0,2025-05-15 22:39:44.664,2025-05-15,2025,5,15,48219,[],()
85481,50059,21762,5,$ 30.5,"2024-12-02, 06:15:19 am",,30.5,30.5,152.5,2024-12-02 06:15:19.000,2024-12-02,2024,12,2,50059,[],()
79329,48156,21417,1,62.00 €,11:29:20 04/20/25,NULL,74.39999999999999,74.39999999999999,74.4,2025-04-20 11:29:20.000,2025-04-20,2025,4,20,48156,[],()
77608,49698,22027,1,29.25 $,10-Jan-2025 18:12,,29.25,29.25,29.25,2025-01-10 18:12:00.000,2025-01-10,2025,1,10,49698,[],()
83477,49187,22042,1,EUR 52.00,12:30 11/23/24,,62.4,62.4,62.4,2024-11-23 12:30:00.000,2024-11-23,2024,11,23,49187,[],()
80015,48813,21477,1,$18.0,2024-12-17;02:49,,18.0,18.0,18.0,2024-12-17 02:49:00.000,2024-12-17,2024,12,17,48813,[],()
83144,50291,21882,1,41.75 €,17:23; 9-SEP-2024,"Apt. 277 174 Xavier Trace, New Rubi, OR 82766",50.1,50.1,50.1,2024-09-09 17:23:00.000,2024-09-09,2024,9,9,50291,[],()
78648,49195,21355,1,$55.75,"15:44, 20-Nov-2024",,55.75,55.75,55.75,2024-11-20 15:44:00.000,2024-11-20,2024,11,20,49195,[],()
77801,47905,22037,2,$25.75,"11/09/24, 11:50",NULL,25.75,25.75,51.5,2024-11-09 11:50:00.000,2024-11-09,2024,11,9,47905,[],()
82438,51031,21893,1,69.0 $,"08/31/25,02:26:42 PM","7597 Anthony Trafficway, East Syreeta, HI 38303-5839",69.0,69.0,69.0,2025-08-31 14:26:42.000,2025-08-31,2025,8,31,51031,[],()
78009,48447,21649,1,$69.50,09:46:59;21-July-2025,"980 Nathanial Trail, Fritschville, IL 97412-5086",69.5,69.5,69.5,2025-07-21 09:46:59.000,2025-07-21,2025,7,21,48447,[],()
84926,47810,21468,1,30.0 USD,24-October-2024 12:53:10 AM,"577 Murazik Skyway, East Jannetfort, MA 44141",30.0,30.0,30.0,2024-10-24 00:53:10.000,2024-10-24,2024,10,24,49149,[],()
79519,48753,21619,1,52.00$," 1-Apr-2024, 03:16:10",,52.0,52.0,52.0,2024-04-01 03:16:10.000,2024-04-01,2024,4,1,48753,[],()
86275,49639,21414,1,€44.0,08:45 30-OCT-2024,,52.8,52.8,52.8,2024-10-30 08:45:00.000,2024-10-30,2024,10,30,49639,[],()
79869,50617,21321,1,USD63.99,13:56;06/05/25,NULL,63.99,63.99,63.99,2025-06-05 13:56:00.000,2025-06-05,2025,6,5,50617,[],()
81142,50369,21722,2,€ 36.99,"08:39:07 PM,06/12/24",,44.388,44.388,88.78,2024-06-12 20:39:07.000,2024-06-12,2024,6,12,50369,[],()
84556,49622,21616,1,36.0$,"09:14:32,25-SEP-2024",NULL,36.0,36.0,36.0,2024-09-25 09:14:32.000,2024-09-25,2024,9,25,49622,[],()
86317,49002,21998,1,USD 17.00,06:27:14 A.M.;14-April-2025,"Apt. 434 86586 Luettgen Springs, South Demarcus, MA 77781-3110",17.0,17.0,17.0,2025-04-14 06:27:14.000,2025-04-14,2025,4,14,49002,[],()
81921,48704,22006,1,€28.0,12:21:39 am 2025-04-02,,33.6,33.6,33.6,2025-04-02 00:21:39.000,2025-04-02,2025,4,2,48704,[],()
83751,49120,21726,2,47.5 EUR,"18:50, 2024-11-27","Apt. 519 61954 Tyrell Ranch, Grahambury, WV 75517-2243",57.0,57.0,114.0,2024-11-27 18:50:00.000,2024-11-27,2024,11,27,49120,[],()
85664,50933,21518,1,40.€,"25-JAN-2025, 12:10:48 P.M.",,48.0,48.0,48.0,2025-01-25 12:10:48.000,2025-01-25,2025,1,25,50933,[],()
78958,50935,21408,1,$44.0,03:08:55 25-OCT-2024,,44.0,44.0,44.0,2024-10-25 03:08:55.000,2024-10-25,2024,10,25,50935,[],()
77887,48073,21970,1,71.0USD,"19:11,10/22/24",,71.0,71.0,71.0,2024-10-22 19:11:00.000,2024-10-22,2024,10,22,48073,[],()
80218,50583,21534,2,18.25$,28-November-2024;14:57:01,"1412 Phillip Vista, South Jefferey, ID 73359",18.25,18.25,36.5,2024-11-28 14:57:01.000,2024-11-28,2024,11,28,50583,[],()
79618,49320,21807,1,USD31.5,2024-08-12 12:56:26 AM,,31.5,31.5,31.5,2024-08-12 00:56:26.000,2024-08-12,2024,8,12,49320,[],()
85602,50838,22046,1,$ 62.25, 9-Mar-2025 06:18:47,NULL,62.25,62.25,62.25,2025-03-09 06:18:47.000,2025-03-09,2025,3,9,50838,[],()
85166,48307,21974,2,61.00€,04:06;24-FEB-2025,NULL,73.2,73.2,146.4,2025-02-24 04:06:00.000,2025-02-24,2025,2,24,48307,[],()
85992,49928,21610,3,$ 54.0,04/10/25;09:33:57,,54.0,54.0,162.0,2025-04-10 09:33:57.000,2025-04-10,2025,4,10,49928,[],()
79345,48829,21547,1,$ 53.0,2024-10-01 11:27:56 P.M.,"7608 Schinner Causeway, Lake Raisa, AL 56729",53.0,53.0,53.0,2024-10-01 23:27:56.000,2024-10-01,2024,10,1,48829,[],()
86075,49773,21867,1,USD 59.25,"04:32, 7-June-2025","1850 Louis Points, Treasaborough, AL 96983",59.25,59.25,59.25,2025-06-07 04:32:00.000,2025-06-07,2025,6,7,49773,[],()
86286,49116,21834,1,EUR 29.50,2025-05-31 16:09:20,"Apt. 722 2476 Williamson Expressway, South Hedwigview, NJ 59274",35.4,35.4,35.4,2025-05-31 16:09:20.000,2025-05-31,2025,5,31,49116,[],()
81037,48970,21357,2,24.00USD,"17:36, 2024-11-28",NULL,24.0,24.0,48.0,2024-11-28 17:36:00.000,2024-11-28,2024,11,28,48970,[],()
79068,49419,21773,1,37€50¢,2024-07-10T07:44:14,"Apt. 855 276 Shizuko Glens, North Maria, NE 26014",4500.0,4500.0,4500.0,2024-07-10 07:44:14.000,2024-07-10,2024,7,10,49419,[],()
80031,48081,22032,2,USD39.00,2024-08-24T14:15:46,"Suite 281 151 Joeann Trail, Lake Micaela, OH 08091-8200",39.0,39.0,78.0,2024-08-24 14:15:46.000,2024-08-24,2024,8,24,48081,[],()
82480,48823,21308,1,33.75 USD,"01/03/25,07:01:59 P.M.",,33.75,33.75,33.75,2025-01-03 19:01:59.000,2025-01-03,2025,1,3,48823,[],()
82107,48815,21457,1,USD 27.99,05/25/24;03:00,NULL,27.99,27.99,27.99,2024-05-25 03:00:00.000,2024-05-25,2024,5,25,48815,[],()
83787,50829,21357,4,€22.25,29-Sep-2024 03:44:34,NULL,26.7,26.7,106.8,2024-09-29 03:44:34.000,2024-09-29,2024,9,29,50829,[],()
80787,50612,21505,3,$42¢00,2024-07-11T14:22:02,NULL,4200.0,4200.0,12600.0,2024-07-11 14:22:02.000,2024-07-11,2024,7,11,50612,[],()
81814,47959,21433,1,$ 43.00,"12/14/24, 09:03",,43.0,43.0,43.0,2024-12-14 09:03:00.000,2024-12-14,2024,12,14,47959,[],()
78552,48606,21925,4,€30¢75,09:16:14 AM 09/09/24,,3690.0,3690.0,14760.0,2024-09-09 09:16:14.000,2024-09-09,2024,9,9,48606,[],()
83068,50028,21981,1,20.5 $,07:11;02/11/25,NULL,20.5,20.5,20.5,2025-02-11 07:11:00.000,2025-02-11,2025,2,11,50028,[],()
79798,50728,21417,1,€ 65.5,"23:26:09, 2024-03-20",,78.6,78.6,78.6,2024-03-20 23:26:09.000,2024-03-20,2024,3,20,50728,[],()
80443,48927,21896,1,€ 19,"01:58:07 PM, 8-April-2025",,22.8,22.8,22.8,2025-04-08 13:58:07.000,2025-04-08,2025,4,8,48927,[],()
85791,49586,21830,1,USD69.99,15:02:45 2025-01-08,NULL,69.99,69.99,69.99,2025-01-08 15:02:45.000,2025-01-08,2025,1,8,49586,[],()
77705,49124,21462,1,28.99$,18:22 04/19/25,NULL,28.99,28.99,28.99,2025-04-19 18:22:00.000,2025-04-19,2025,4,19,49124,[],()
78031,50005,22056,3,18.0$,06/12/24 04:41,,18.0,18.0,54.0,2024-06-12 04:41:00.000,2024-06-12,2024,6,12,50005,[],()
80745,50803,21769,1,62.00 EUR, 2-Dec-2024 18:01:22,NULL,74.39999999999999,74.39999999999999,74.4,2024-12-02 18:01:22.000,2024-12-02,2024,12,2,50803,[],()
78026,50411,21335,1,EUR 33.75,"2025-02-15,20:38",,40.5,40.5,40.5,2025-02-15 20:38:00.000,2025-02-15,2025,2,15,50411,[],()
79823,48443,22051,2,28.0$,2024-08-14;02:53:48,"4234 Hintz Mission, Kevinberg, TN 18870-5282",28.0,28.0,56.0,2024-08-14 02:53:48.000,2024-08-14,2024,8,14,48443,[],()
82237,48304,21720,1,EUR 29.0,"22:30:14, 01/17/25",,34.8,34.8,34.8,2025-01-17 22:30:14.000,2025-01-17,2025,1,17,48304,[],()
80279,50777,21303,1,57.0 €,2025-01-17 06:25,"18312 Mosciski Island, North Idalia, IN 96231",68.39999999999999,68.39999999999999,68.4,2025-01-17 06:25:00.000,2025-01-17,2025,1,17,50777,[],()
86509,48027,21823,1,$61.99,2025-07-13T13:25:41.664,,61.99,61.99,61.99,2025-07-13 13:25:41.664,2025-07-13,2025,7,13,48027,[],()
85497,50421,21640,1,41.00 €,"16-May-2025,17:15",NULL,49.199999999999996,49.199999999999996,49.2,2025-05-16 17:15:00.000,2025-05-16,2025,5,16,50421,[],()
82160,50842,21856,1,39.00$,09:15:06 am;2024-12-22,NULL,39.0,39.0,39.0,2024-12-22 09:15:06.000,2024-12-22,2024,12,22,50842,[],()
80281,50955,21744,1,EUR53.5,16:09 18-DEC-2024,,64.2,64.2,64.2,2024-12-18 16:09:00.000,2024-12-18,2024,12,18,50955,[],()
78642,50635,22020,1,73.25€,2024-03-10T11:37:48.469, ,87.89999999999999,87.89999999999999,87.9,2024-03-10 11:37:48.469,2024-03-10,2024,3,10,50635,[],()
84827,49537,21541,1,USD 31.99,"26-JUN-2024,09:01:44 P.M.","Apt. 717 3536 Steuber Junctions, East Ludivina, MO 27241-9670",31.99,31.99,31.99,2024-06-26 21:01:44.000,2024-06-26,2024,6,26,49537,[],()
79486,50226,21503,3,19.75 €,"01/19/25, 05:32:06",,23.7,23.7,71.1,2025-01-19 05:32:06.000,2025-01-19,2025,1,19,50226,[],()
85137,49219,21497,1,$ 67.25,05:44:51 PM 2024-09-29,,67.25,67.25,67.25,2024-09-29 17:44:51.000,2024-09-29,2024,9,29,49219,[],()
83111,49618,21812,4,€ 48.75,2024-12-17T03:40:51.221,"Suite 992 763 Ronny Prairie, Port Neelytown, NC 43283",58.5,58.5,234.0,2024-12-17 03:40:51.221,2024-12-17,2024,12,17,50918,[],()
80658,49898,21544,3,$14,07:59:08;06/01/24,,14.0,14.0,42.0,2024-06-01 07:59:08.000,2024-06-01,2024,6,1,49898,[],()
85150,49930,21325,3,USD 51.75,12:30:10 11/11/24,,51.75,51.75,155.25,2024-11-11 12:30:10.000,2024-11-11,2024,11,11,49930,[],()
83786,49899,21941,1,USD 50.5,2024-10-24T12:13:40,,50.5,50.5,50.5,2024-10-24 12:13:40.000,2024-10-24,2024,10,24,49899,[],()
77680,48395,22012,1,$62.75,2024-12-01 22:25:34,NULL,62.75,62.75,62.75,2024-12-01 22:25:34.000,2024-12-01,2024,12,1,48395,[],()
86224,50726,22034,2,$72¢00,2025-08-19T11:44:55.575,,7200.0,7200.0,14400.0,2025-08-19 11:44:55.575,2025-08-19,2025,8,19,50726,[],()
78528,49774,21663,1,USD71.50,13-AUG-2025;10:19:28 AM,,71.5,71.5,71.5,2025-08-13 10:19:28.000,2025-08-13,2025,8,13,49774,[],()
82415,50621,21342,1,60.25USD,2025-01-30;08:09,,60.25,60.25,60.25,2025-01-30 08:09:00.000,2025-01-30,2025,1,30,50621,[],()
80111,50787,21559,2,USD41.99,"12:17:54,2025-01-08",,41.99,41.99,83.98,2025-01-08 12:17:54.000,2025-01-08,2025,1,8,50787,[],()
78734,49612,21588,1,60.75$,20.12.2024 01:40:40,"89673 Morton Springs, Margeneview, AL 50206",60.75,60.75,60.75,2024-12-20 01:40:40.000,2024-12-20,2024,12,20,49612,[],()
81322,50525,21974,1,USD 58.25,13.04.2025 20:52:52,,58.25,58.25,58.25,2025-04-13 20:52:52.000,2025-04-13,2025,4,13,50525,[],()
82734,48321,21666,2,66.5€,2025-01-06T05:33:40,,79.8,79.8,159.6,2025-01-06 05:33:40.000,2025-01-06,2025,1,6,48321,[],()
82264,47878,21812,1,€47.75,"2025-05-07,04:33:17 P.M.",,57.3,57.3,57.3,2025-05-07 16:33:17.000,2025-05-07,2025,5,7,47878,[],()
79449,49736,21698,5,EUR50.0,"2025-04-27,11:44:17",NULL,60.0,60.0,300.0,2025-04-27 11:44:17.000,2025-04-27,2025,4,27,49736,[],()
85555,49025,21468,1,31.50USD,10/20/24 05:53:55 AM,,31.5,31.5,31.5,2024-10-20 05:53:55.000,2024-10-20,2024,10,20,49025,[],()
81009,48849,21650,1,USD72.0,"19-MAR-2025, 06:52:26 AM",,72.0,72.0,72.0,2025-03-19 06:52:26.000,2025-03-19,2025,3,19,48849,[],()
79832,49910,21570,1,$31.00,2025-03-21T19:03:45.634,,31.0,31.0,31.0,2025-03-21 19:03:45.634,2025-03-21,2025,3,21,49910,[],()
86028,48127,21874,1,69.99USD,2024-09-04T09:02:19,"322 Rutherford Freeway, South Wesleymouth, LA 03541",69.99,69.99,69.99,2024-09-04 09:02:19.000,2024-09-04,2024,9,4,48127,[],()
82012,47957,21790,1,EUR70.75,"04:27:00 am,12-SEP-2024","107 Blanda Canyon, Port Sung, TX 87766",84.89999999999999,84.89999999999999,84.9,2024-09-12 04:27:00.000,2024-09-12,2024,9,12,49304,[],()
84286,48237,21560,2,17.75€,"04/16/25, 05:15:53","80254 Cami Club, New Daltonstad, WA 79808",21.3,21.3,42.6,2025-04-16 05:15:53.000,2025-04-16,2025,4,16,48237,[],()
80967,50540,21565,1,27.50$,04/22/25 18:00,"Suite 969 22264 Kuhn Isle, West Samfurt, LA 86874-5635",27.5,27.5,27.5,2025-04-22 18:00:00.000,2025-04-22,2025,4,22,50540,[],()
84201,49944,21377,2,€ 57.0,"28-November-2024, 03:49:42",NULL,68.39999999999999,68.39999999999999,136.8,2024-11-28 03:49:42.000,2024-11-28,2024,11,28,49534,[],()
84566,49080,21936,1,$16.50," 9-Mar-2024,05:41",,16.5,16.5,16.5,2024-03-09 05:41:00.000,2024-03-09,2024,3,9,49080,[],()
84828,48001,21324,2,$ 32,2024-06-04T20:20:48.871,,32.0,32.0,64.0,2024-06-04 20:20:48.871,2024-06-04,2024,6,4,48001,[],()
83218,50566,21768,1,24.99USD,"05:03,2024-12-01","Apt. 178 84989 Toy Stravenue, Holliebury, MN 70742",24.99,24.99,24.99,2024-12-01 05:03:00.000,2024-12-01,2024,12,1,50566,[],()
80402,49444,21605,1,USD 44.00," 2-August-2024, 11:36:09 A.M.",,44.0,44.0,44.0,2024-08-02 11:36:09.000,2024-08-02,2024,8,2,49444,[],()
80853,49725,22057,1,USD49.50,2024-06-13T07:47:07.532,"Apt. 869 293 Bettye Freeway, South Rockyland, AZ 66649-5874",49.5,49.5,49.5,2024-06-13 07:47:07.532,2024-06-13,2024,6,13,49725,[],()
85564,49271,21769,1,$62¢75,08/05/24 22:49,"304 Reinaldo Way, East Jacobhaven, HI 10803",6275.0,6275.0,6275.0,2024-08-05 22:49:00.000,2024-08-05,2024,8,5,49271,[],()
77980,47981,21593,1,USD17.25,12/18/24;03:10:59 A.M.,NULL,17.25,17.25,17.25,2024-12-18 03:10:59.000,2024-12-18,2024,12,18,47981,[],()
81816,49484,21499,1,€55.0, 5.11.2024 23:09:09,,66.0,66.0,66.0,2024-05-11 23:09:09.000,2024-05-11,2024,5,11,49484,[],()
79129,49379,21832,5,€ 36.25,"04:41:01 P.M.,2024-10-05",NULL,43.5,43.5,217.5,2024-10-05 16:41:01.000,2024-10-05,2024,10,5,49379,[],()
78082,50579,21494,2,€ 62.99,2024-12-06T09:22:03.201,,75.588,75.588,151.18,2024-12-06 09:22:03.201,2024-12-06,2024,12,6,50579,[],()
80078,50033,21340,1,USD48.25,Mon Dec  2 19:52:28 2024,,48.25,48.25,48.25,2024-12-02 19:52:28.000,2024-12-02,2024,12,2,50033,[],()
86071,48936,22022,1,$54.5,"12:37, 30-May-2025","Suite 814 212 Hugo Wall, South Jarred, CO 00700-3081",54.5,54.5,54.5,2025-05-30 12:37:00.000,2025-05-30,2025,5,30,48936,[],()
79500,50877,22029,1,$65.0,08:26:11 am;07/25/24,,65.0,65.0,65.0,2024-07-25 08:26:11.000,2024-07-25,2024,7,25,50877,[],()
80429,49884,21674,2,20.75 $,22-July-2024 10:17:55 am,,20.75,20.75,41.5,2024-07-22 10:17:55.000,2024-07-22,2024,7,22,49884,[],()
83537,48105,21413,1,USD 42.25,10:18 07/07/25,,42.25,42.25,42.25,2025-07-07 10:18:00.000,2025-07-07,2025,7,7,48105,[],()
79603,50377,21470,1,15.0USD,08/21/24 00:38,NULL,15.0,15.0,15.0,2024-08-21 00:38:00.000,2024-08-21,2024,8,21,50377,[],()
80627,47824,21648,1,19€,"12/19/24,14:07",,22.8,22.8,22.8,2024-12-19 14:07:00.000,2024-12-19,2024,12,19,47824,[],()
78650,51004,21945,1,17.25 USD,2024-12-29T06:31:20.520,NULL,17.25,17.25,17.25,2024-12-29 06:31:20.520,2024-12-29,2024,12,29,51004,[],()
82390,48994,21393,5,USD52.99, 6-February-2025 05:16:00 am,,52.99,52.99,264.95,2025-02-06 05:16:00.000,2025-02-06,2025,2,6,48994,[],()
78214,50297,21970,2,69.5$,06:31:04 am 2024-08-31,"Apt. 744 834 Stracke Route, East Gitaton, CO 61866",69.5,69.5,139.0,2024-08-31 06:31:04.000,2024-08-31,2024,8,31,48332,[],()
82873,50937,21633,1,30.50EUR,"05:44:27, 20-Aug-2024",,36.6,36.6,36.6,2024-08-20 05:44:27.000,2024-08-20,2024,8,20,50937,[],()
80935,48681,21737,1,USD 18.99," 5-December-2024, 03:29:23 A.M.","Suite 239 4124 Billie Overpass, West Wendolynstad, OK 25288-4008",18.99,18.99,18.99,2024-12-05 03:29:23.000,2024-12-05,2024,12,5,48681,[],()
81946,49629,21763,2,$39¢25,2024-09-03T12:21:19,"Apt. 935 682 Davis Extensions, Fannymouth, KY 04568",3925.0,3925.0,7850.0,2024-09-03 12:21:19.000,2024-09-03,2024,9,3,49629,[],()
84108,49502,21321,1,63.25USD,2025-02-23T07:59:02,,63.25,63.25,63.25,2025-02-23 07:59:02.000,2025-02-23,2025,2,23,49502,[],()
83591,49948,21799,1,28.00 $,05:52:47 A.M.  8-March-2025,,28.0,28.0,28.0,2025-03-08 05:52:47.000,2025-03-08,2025,3,8,49948,[],()
82574,50296,22023,1,13.0 EUR,"2025-04-15, 17:27",,15.6,15.6,15.6,2025-04-15 17:27:00.000,2025-04-15,2025,4,15,50296,[],()
78653,50757,21854,1,$ 61.25,"15:33,2024-11-11","Apt. 757 910 Fisher Divide, Corwintown, ID 06384",61.25,61.25,61.25,2024-11-11 15:33:00.000,2024-11-11,2024,11,11,50757,[],()
81872,51057,21997,1,€73¢75,2024-03-05T04:09:07.483,,8850.0,8850.0,8850.0,2024-03-05 04:09:07.483,2024-03-05,2024,3,5,51057,[],()
83974,50890,21862,5,EUR 54.25,"05/13/25,03:10:44 P.M.",,65.1,65.1,325.5,2025-05-13 15:10:44.000,2025-05-13,2025,5,13,50890,[],()
85091,50501,21729,2,46.50€,01/23/25;20:13:19,NULL,55.8,55.8,111.6,2025-01-23 20:13:19.000,2025-01-23,2025,1,23,50501,[],()
85414,48351,21314,1,68.50 USD,2024-11-25;15:08,NULL,68.5,68.5,68.5,2024-11-25 15:08:00.000,2024-11-25,2024,11,25,50932,[],()
83734,50652,21536,1,40.99 EUR,18-Apr-2025 11:35:00,,49.188,49.188,49.19,2025-04-18 11:35:00.000,2025-04-18,2025,4,18,50652,[],()
81065,50948,21723,1,$50.99,08/10/24;06:00:41 P.M.,,50.99,50.99,50.99,2024-08-10 18:00:41.000,2024-08-10,2024,8,10,50948,[],()
81010,47914,21672,1,$67¢75,2025-03-17T03:57:39,NULL,6775.0,6775.0,6775.0,2025-03-17 03:57:39.000,2025-03-17,2025,3,17,47914,[],()
81429,49829,21402,1,40.0 USD,"16-September-2024,05:57",NULL,40.0,40.0,40.0,2024-09-16 05:57:00.000,2024-09-16,2024,9,16,47730,[],()
83292,48934,22015,1,$62.99,"16:25, 23-DEC-2024",NULL,62.99,62.99,62.99,2024-12-23 16:25:00.000,2024-12-23,2024,12,23,48934,[],()
80805,48938,21431,1,52.0 USD,08:36:13 A.M.;2025-03-09,,52.0,52.0,52.0,2025-03-09 08:36:13.000,2025-03-09,2025,3,9,48938,[],()
85447,50823,21865,2,69.99€,"01/26/25,12:25:19 AM",NULL,83.98799999999999,83.98799999999999,167.98,2025-01-26 00:25:19.000,2025-01-26,2025,1,26,50823,[],()
82547,49433,21639,5,47.00$,"08:11:54 PM,09/28/24",,47.0,47.0,235.0,2024-09-28 20:11:54.000,2024-09-28,2024,9,28,49433,[],()
80391,50659,21882,1,USD40.5,"06/27/24, 11:11:53 AM",,40.5,40.5,40.5,2024-06-27 11:11:53.000,2024-06-27,2024,6,27,50659,[],()
85434,48738,21427,2,€71¢99,"2025-02-12,00:49:54",NULL,8638.8,8638.8,17277.6,2025-02-12 00:49:54.000,2025-02-12,2025,2,12,48738,[],()
86438,47833,21597,3,68.0 USD,09:08:17 AM;07/28/25,,68.0,68.0,204.0,2025-07-28 09:08:17.000,2025-07-28,2025,7,28,47833,[],()
80361,48814,21326,2,$ 67.75,"24-February-2025, 05:52:44",,67.75,67.75,135.5,2025-02-24 05:52:44.000,2025-02-24,2025,2,24,48814,[],()
81581,47788,21527,1,27.50USD,"15:13, 11/06/24",,27.5,27.5,27.5,2024-11-06 15:13:00.000,2024-11-06,2024,11,6,47788,[],()
83580,50738,22016,1,51.25 $,31-Dec-2024;00:53,"896 Boris Heights, Herbertstad, NY 35835",51.25,51.25,51.25,2024-12-31 00:53:00.000,2024-12-31,2024,12,31,50738,[],()
83894,48371,21329,2,$46¢25,2025-02-19T04:19:53.480,,4625.0,4625.0,9250.0,2025-02-19 04:19:53.480,2025-02-19,2025,2,19,48371,[],()
79549,50230,21503,1,EUR20,11:56:32;11-Dec-2024,"Apt. 922 7913 Karla Unions, Port Joesphview, KS 11285-8739",24.0,24.0,24.0,2024-12-11 11:56:32.000,2024-12-11,2024,12,11,50230,[],()
79994,50184,21765,2,23.99€,"07/28/24,02:52:58 A.M.",,28.787999999999997,28.787999999999997,57.58,2024-07-28 02:52:58.000,2024-07-28,2024,7,28,50184,[],()
81594,50316,21808,3,$ 54.99,19:11  1-SEP-2024,,54.99,54.99,164.97,2024-09-01 19:11:00.000,2024-09-01,2024,9,1,49304,[],()
79720,50131,21443,1,22.00 €,2025-05-15T20:07:31,,26.4,26.4,26.4,2025-05-15 20:07:31.000,2025-05-15,2025,5,15,50131,[],()
80370,47846,21894,1,USD 49.75,"04:41:26,  3-Oct-2024",,49.75,49.75,49.75,2024-10-03 04:41:26.000,2024-10-03,2024,10,3,47846,[],()
81882,48366,21734,1,50.25 $,"05:06:35 A.M.,08/30/24",,50.25,50.25,50.25,2024-08-30 05:06:35.000,2024-08-30,2024,8,30,48366,[],()
83893,49841,21716,1,€ 33.00,2024-03-14;02:26:34 pm,,39.6,39.6,39.6,2024-03-14 14:26:34.000,2024-03-14,2024,3,14,49841,[],()
85652,48097,21420,1,25.75 USD,2025-01-21T14:03:49,"6958 Mohammed Port, Skilesburgh, RI 20621-7558",25.75,25.75,25.75,2025-01-21 14:03:49.000,2025-01-21,2025,1,21,48097,[],()
84294,50199,21807,1,30.00$,"20:47,12/24/24",,30.0,30.0,30.0,2024-12-24 20:47:00.000,2024-12-24,2024,12,24,50199,[],()
78999,49581,21460,1,EUR64.99,"07:05:32,20-Jun-2025","Suite 622 53274 Bashirian Trail, Goyetteville, IL 04053",77.98799999999999,77.98799999999999,77.99,2025-06-20 07:05:32.000,2025-06-20,2025,6,20,49581,[],()
82776,48151,21662,1,USD 24.99,2025-05-02T19:22:59.624,,24.99,24.99,24.99,2025-05-02 19:22:59.624,2025-05-02,2025,5,2,48151,[],()
85593,47665,21672,1,66.5EUR,01:09:09 AM;2024-11-09,,79.8,79.8,79.8,2024-11-09 01:09:09.000,2024-11-09,2024,11,9,47665,[],()
83910,49696,21905,1,29.25$,2025-07-28T18:18:52.345,NULL,29.25,29.25,29.25,2025-07-28 18:18:52.345,2025-07-28,2025,7,28,49696,[],()
82667,49185,21557,1,USD 63.50,"08:06:12 pm,2024-10-31",NULL,63.5,63.5,63.5,2024-10-31 20:06:12.000,2024-10-31,2024,10,31,49185,[],()
81169,48438,21922,1,26.99 EUR,"2024-08-28,07:54:23 am",,32.388,32.388,32.39,2024-08-28 07:54:23.000,2024-08-28,2024,8,28,48438,[],()
82629,49886,21875,2,€ 47.50, 1-SEP-2024;16:19:00,"Apt. 499 351 Artie Port, Patiencefort, CA 28855",57.0,57.0,114.0,2024-09-01 16:19:00.000,2024-09-01,2024,9,1,49886,[],()
79890,47972,21783,2,€65¢75,11/16/24;09:21:09 pm,NULL,7890.0,7890.0,15780.0,2024-11-16 21:21:09.000,2024-11-16,2024,11,16,47972,[],()
79537,50918,21598,1,20.0 $,2025-02-16T02:30:04.134,"Suite 992 763 Ronny Prairie, Port Neelytown, NC 43283",20.0,20.0,20.0,2025-02-16 02:30:04.134,2025-02-16,2025,2,16,50918,[],()
84409,50341,21518,1,EUR43.25,2025-03-02T14:14:54.035,,51.9,51.9,51.9,2025-03-02 14:14:54.035,2025-03-02,2025,3,2,50341,[],()
84135,50378,21583,1,58.50$,10:30:39 18-OCT-2024,,58.5,58.5,58.5,2024-10-18 10:30:39.000,2024-10-18,2024,10,18,50378,[],()
81389,50831,21817,1,66.99 EUR,19:27 03/12/24,NULL,80.38799999999999,80.38799999999999,80.39,2024-03-12 19:27:00.000,2024-03-12,2024,3,12,50831,[],()
79758,50550,21381,1,24.75 EUR,2024-07-30T01:05:29.930,,29.7,29.7,29.7,2024-07-30 01:05:29.930,2024-07-30,2024,7,30,50550,[],()
80186,48128,21340,1,$ 48.0,"2024-03-01, 07:08:58 pm",,48.0,48.0,48.0,2024-03-01 19:08:58.000,2024-03-01,2024,3,1,48128,[],()
82708,49488,22055,1,$54.,"03/09/25,01:21:48",,54.0,54.0,54.0,2025-03-09 01:21:48.000,2025-03-09,2025,3,9,49488,[],()
85669,48021,21936,1,USD 20.75,04:40;2024-07-28,NULL,20.75,20.75,20.75,2024-07-28 04:40:00.000,2024-07-28,2024,7,28,48021,[],()
77888,50533,21612,2,$ 16.99,06:53:30 PM;27-March-2025,"Suite 231 50778 Bulah Views, West Nathanialbury, NM 98166-6327",16.99,16.99,33.98,2025-03-27 18:53:30.000,2025-03-27,2025,3,27,50533,[],()
82496,50819,21469,1,57.0€,11:41 08/14/24,NULL,68.39999999999999,68.39999999999999,68.4,2024-08-14 11:41:00.000,2024-08-14,2024,8,14,50819,[],()
82489,48590,21884,1,USD35.00,"2024-09-22,04:18:07",,35.0,35.0,35.0,2024-09-22 04:18:07.000,2024-09-22,2024,9,22,51044,[],()
85603,50595,21301,1,USD44.0,2025-01-20T17:16:04.496,,44.0,44.0,44.0,2025-01-20 17:16:04.496,2025-01-20,2025,1,20,50595,[],()
77769,47814,21359,1,USD 27.,22:18:43;2025-01-30,,27.0,27.0,27.0,2025-01-30 22:18:43.000,2025-01-30,2025,1,30,47814,[],()
80770,48566,21704,4,54.5 USD,"11/16/24,10:37",,54.5,54.5,218.0,2024-11-16 10:37:00.000,2024-11-16,2024,11,16,48566,[],()
86078,47778,21993,2,44.0€,20:09:32  7-July-2024,,52.8,52.8,105.6,2024-07-07 20:09:32.000,2024-07-07,2024,7,7,47778,[],()
86391,49567,21353,2,26.99USD,2024-12-06T18:38:39,"Apt. 385 1920 Krissy Extension, East Lennaborough, AK 12985-8094",26.99,26.99,53.98,2024-12-06 18:38:39.000,2024-12-06,2024,12,6,49567,[],()
79386,48629,21883,1,USD35.75,2024-07-08 21:18,NULL,35.75,35.75,35.75,2024-07-08 21:18:00.000,2024-07-08,2024,7,8,48629,[],()
84778,50984,21891,1,$67.5,"18:06,2024-10-19",,67.5,67.5,67.5,2024-10-19 18:06:00.000,2024-10-19,2024,10,19,50984,[],()
81074,48485,21746,1,17.50 $,Wed Dec 18 18:35:40 2024,"2671 See Trail, East Kristopherville, ME 97946-2544",17.5,17.5,17.5,2024-12-18 18:35:40.000,2024-12-18,2024,12,18,48485,[],()
80918,49822,21635,1,39.25 $,27.04.2025  5:55:55,NULL,39.25,39.25,39.25,2025-04-27 05:55:55.000,2025-04-27,2025,4,27,49725,[],()
85418,47925,21947,1,61.00 $,11:21:33 P.M. 02/27/25,,61.0,61.0,61.0,2025-02-27 23:21:33.000,2025-02-27,2025,2,27,47925,[],()
78053,48043,21647,1,43$75¢,2024-09-13 02:15:22,NULL,4375.0,4375.0,4375.0,2024-09-13 02:15:22.000,2024-09-13,2024,9,13,48043,[],()
85472,50863,21385,1,$26¢75,27-Feb-2025 08:24,,2675.0,2675.0,2675.0,2025-02-27 08:24:00.000,2025-02-27,2025,2,27,50863,[],()
86420,51022,21748,1,$25.99,"00:24,01/05/25",,25.99,25.99,25.99,2025-01-05 00:24:00.000,2025-01-05,2025,1,5,51022,[],()
79951,49778,21845,4,$ 67.75,14:57  2-SEP-2024,,67.75,67.75,271.0,2024-09-02 14:57:00.000,2024-09-02,2024,9,2,49778,[],()
83927,48402,21776,2,USD72.25,"21-JUN-2025,05:53:58",,72.25,72.25,144.5,2025-06-21 05:53:58.000,2025-06-21,2025,6,21,48402,[],()
85637,50542,21679,2,28.99 USD,06:28:38;2024-04-15,,28.99,28.99,57.98,2024-04-15 06:28:38.000,2024-04-15,2024,4,15,50542,[],()
79378,48555,21350,1,$ 36.25,"2025-01-19,00:14:51",,36.25,36.25,36.25,2025-01-19 00:14:51.000,2025-01-19,2025,1,19,48555,[],()
86005,50170,21862,1,€57¢99," 9-Oct-2024, 00:57:40","Suite 715 3329 Haley Fords, Boscohaven, CA 67669",6958.8,6958.8,6958.8,2024-10-09 00:57:40.000,2024-10-09,2024,10,9,50170,[],()
85632,48158,21467,2,49.25 $,"16-JAN-2025,04:38:24",NULL,49.25,49.25,98.5,2025-01-16 04:38:24.000,2025-01-16,2025,1,16,48158,[],()
79151,48596,21714,5,43. USD,"11:28:46, 2024-10-24",NULL,43.0,43.0,215.0,2024-10-24 11:28:46.000,2024-10-24,2024,10,24,48596,[],()
78346,51055,21949,1,$44.0,"29-APR-2025,16:22","101 Block Lights, Port Sanfordburgh, VT 92497",44.0,44.0,44.0,2025-04-29 16:22:00.000,2025-04-29,2025,4,29,51055,[],()
84107,48626,21484,1,$ 17.25,"06:02:19,2024-08-03",,17.25,17.25,17.25,2024-08-03 06:02:19.000,2024-08-03,2024,8,3,48626,[],()
80418,47831,21352,1,$ 33.99,"08:59:02 am, 2024-10-26",NULL,33.99,33.99,33.99,2024-10-26 08:59:02.000,2024-10-26,2024,10,26,47831,[],()
82196,47845,21384,1,€ 48.,"2025-06-17, 04:27:00",NULL,57.599999999999994,57.599999999999994,57.6,2025-06-17 04:27:00.000,2025-06-17,2025,6,17,47845,[],()
77960,49884,21576,1,$ 25.5,17-Apr-2025;07:46:56,"Apt. 859 145 Lueilwitz Centers, Kimberyfort, CA 25953",25.5,25.5,25.5,2025-04-17 07:46:56.000,2025-04-17,2025,4,17,49884,[],()
80465,47856,21685,1,$ 63.00,2025-05-09T02:03:49.414,NULL,63.0,63.0,63.0,2025-05-09 02:03:49.414,2025-05-09,2025,5,9,47856,[],()
84444,48921,21965,1,56.75€,"21:22:23, 12/25/24","4114 Christina Light, Collinsside, MN 36904",68.1,68.1,68.1,2024-12-25 21:22:23.000,2024-12-25,2024,12,25,48921,[],()
83441,47777,21707,1,EUR 71.0,"23-FEB-2025, 09:07:52 AM",NULL,85.2,85.2,85.2,2025-02-23 09:07:52.000,2025-02-23,2025,2,23,47777,[],()
78330,48796,21549,1,USD26.50,"06:34,2024-11-19","78149 Lizzie Street, East Malcolm, IA 13609",26.5,26.5,26.5,2024-11-19 06:34:00.000,2024-11-19,2024,11,19,48796,[],()
78581,48023,21960,2,EUR 55.75,2025-04-26T05:38:33.673,,66.89999999999999,66.89999999999999,133.8,2025-04-26 05:38:33.673,2025-04-26,2025,4,26,48023,[],()
82436,47714,21392,2,54.50 €,16:31:53 02/13/25,,65.39999999999999,65.39999999999999,130.8,2025-02-13 16:31:53.000,2025-02-13,2025,2,13,47714,[],()
81372,49243,21600,2,USD 25.50,"09:28:15 A.M.,14-SEP-2024",NULL,25.5,25.5,51.0,2024-09-14 09:28:15.000,2024-09-14,2024,9,14,49243,[],()
80308,50973,22033,1,49.25USD,2024-10-11T13:44:12,NULL,49.25,49.25,49.25,2024-10-11 13:44:12.000,2024-10-11,2024,10,11,50973,[],()
82963,50670,21414,1,€46¢00,21:12;12/18/24,,5520.0,5520.0,5520.0,2024-12-18 21:12:00.000,2024-12-18,2024,12,18,50670,[],()
85703,49779,21554,1,71.EUR,"09:04:27 am,08/11/24","4536 Purdy Estates, West Carrol, NY 13398-6016",85.2,85.2,85.2,2024-08-11 09:04:27.000,2024-08-11,2024,8,11,49779,[],()
78957,47793,21747,1,30.25€," 7-Jul-2024,05:02","Suite 192 772 Keeley Drive, New Carolynfurt, AR 94640-3654",36.3,36.3,36.3,2024-07-07 05:02:00.000,2024-07-07,2024,7,7,47793,[],()
79848,50258,21598,2,19.00 EUR,13:38:54 28-Feb-2025,,22.8,22.8,45.6,2025-02-28 13:38:54.000,2025-02-28,2025,2,28,50258,[],()
83249,50719,21822,1,EUR 29.0,2024-07-14T23:11:26,NULL,34.8,34.8,34.8,2024-07-14 23:11:26.000,2024-07-14,2024,7,14,50719,[],()
84910,51120,21420,1,€23¢50,10/15/24 16:50:22,,2820.0,2820.0,2820.0,2024-10-15 16:50:22.000,2024-10-15,2024,10,15,51120,[],()
80056,48994,21468,1,33.75 USD,"02:45:15 pm, 5-Nov-2024",,33.75,33.75,33.75,2024-11-05 14:45:15.000,2024-11-05,2024,11,5,48994,[],()
84564,49947,21557,1,63.25$,2025-02-17 01:00,NULL,63.25,63.25,63.25,2025-02-17 01:00:00.000,2025-02-17,2025,2,17,49947,[],()
81597,50202,21415,1,60.25 USD,"2024-12-05, 22:03:53",,60.25,60.25,60.25,2024-12-05 22:03:53.000,2024-12-05,2024,12,5,50202,[],()
77891,49611,21889,1,44.0USD,2024-06-05T09:34:17.901,,44.0,44.0,44.0,2024-06-05 09:34:17.901,2024-06-05,2024,6,5,49611,[],()
78788,48567,21606,1,€36¢50,28-MAY-2025;06:59:26 PM,,4380.0,4380.0,4380.0,2025-05-28 18:59:26.000,2025-05-28,2025,5,28,48567,[],()
82748,48079,21463,1,€27.5,10/21/24;21:31,"Suite 873 852 Elton Plains, North Denae, HI 25544",33.0,33.0,33.0,2024-10-21 21:31:00.000,2024-10-21,2024,10,21,48079,[],()
82120,48386,22020,1,73.25USD,13:15;10-January-2025,,73.25,73.25,73.25,2025-01-10 13:15:00.000,2025-01-10,2025,1,10,48386,[],()
85145,49166,21967,1,USD 38.00,2024-11-10T15:00:02.905,,38.0,38.0,38.0,2024-11-10 15:00:02.905,2024-11-10,2024,11,10,49166,[],()
82184,50084,22026,3,53.EUR,"29-July-2024, 02:02:46",,63.599999999999994,63.599999999999994,190.8,2024-07-29 02:02:46.000,2024-07-29,2024,7,29,50084,[],()
85158,50191,21901,2,60.00$,14.02.2025  2:27:27,"947 Fermina Views, Jarrodburgh, MA 99257",60.0,60.0,120.0,2025-02-14 02:27:27.000,2025-02-14,2025,2,14,50191,[],()
82827,48872,21605,1,USD 43.75,"2025-01-09,11:13",NULL,43.75,43.75,43.75,2025-01-09 11:13:00.000,2025-01-09,2025,1,9,48872,[],()
85231,50643,21409,1,61.25 €,02/23/25;08:29,,73.5,73.5,73.5,2025-02-23 08:29:00.000,2025-02-23,2025,2,23,50643,[],()
81837,49393,21499,1,$52.,"04:56, 11/30/24","16653 Crooks Motorway, Simonisborough, PA 21192",52.0,52.0,52.0,2024-11-30 04:56:00.000,2024-11-30,2024,11,30,49393,[],()
78363,50098,21494,1,$63.5,09/04/24 07:38:43 P.M.,,63.5,63.5,63.5,2024-09-04 19:38:43.000,2024-09-04,2024,9,4,50098,[],()
80780,50433,21677,1,€31¢00,2024-09-11T21:35:05,,3720.0,3720.0,3720.0,2024-09-11 21:35:05.000,2024-09-11,2024,9,11,50433,[],()
81110,49655,21474,1,$15.75,2024-12-16T15:50:44,"Suite 384 16125 Heathcote Branch, Lovefurt, AZ 31867-9274",15.75,15.75,15.75,2024-12-16 15:50:44.000,2024-12-16,2024,12,16,49655,[],()
80506,48990,21334,1,EUR 68.75,07.03.2025 14:55:55,,82.5,82.5,82.5,2025-07-03 14:55:55.000,2025-07-03,2025,7,3,48990,[],()
83240,50990,21617,2,25.00$,"06:44:39 A.M.,2024-09-08","Apt. 771 638 Scottie Meadow, Durganburgh, AR 01801",25.0,25.0,50.0,2024-09-08 06:44:39.000,2024-09-08,2024,9,8,50990,[],()
81021,50556,21480,3,52.0$,2025-03-30;23:49:10,NULL,52.0,52.0,156.0,2025-03-30 23:49:10.000,2025-03-30,2025,3,30,50556,[],()
82485,50584,21334,2,65.99$,2024-08-01T11:43:50,"Apt. 492 51959 Michiko Row, Barrettfurt, CA 40658-5318",65.99,65.99,131.98,2024-08-01 11:43:50.000,2024-08-01,2024,8,1,50584,[],()
79504,49065,21383,1,47.00 USD,20:28  2-JUL-2024,,47.0,47.0,47.0,2024-07-02 20:28:00.000,2024-07-02,2024,7,2,49065,[],()
85464,49126,21373,2,$18.50,2024-11-17;04:15,,18.5,18.5,37.0,2024-11-17 04:15:00.000,2024-11-17,2024,11,17,49126,[],()
83267,48568,21328,3,63.00 $,07:04 15-November-2024,,63.0,63.0,189.0,2024-11-15 07:04:00.000,2024-11-15,2024,11,15,48568,[],()
79729,49966,21307,3,$25.75, 2-Feb-2025 01:57:55,"Suite 499 6043 Boyer Walk, West Edward, ND 24010-0335",25.75,25.75,77.25,2025-02-02 01:57:55.000,2025-02-02,2025,2,2,49966,[],()
78466,50084,21964,1,72.75 USD,"10:30:13,10-Sep-2024","Apt. 604 15254 Hilll Cliffs, New Alpha, CA 34434",72.75,72.75,72.75,2024-09-10 10:30:13.000,2024-09-10,2024,9,10,50084,[],()
83016,49668,21608,3,50.50 $,"2024-11-12, 10:18",NULL,50.5,50.5,151.5,2024-11-12 10:18:00.000,2024-11-12,2024,11,12,49668,[],()
85057,47851,21961,1,USD29.,12:20:58 2025-03-30,NULL,29.0,29.0,29.0,2025-03-30 12:20:58.000,2025-03-30,2025,3,30,47851,[],()
84024,49144,21748,1,26.25 €,03:00:35 pm 04/18/25,"666 Landon Field, Webermouth, NH 09296-7456",31.5,31.5,31.5,2025-04-18 15:00:35.000,2025-04-18,2025,4,18,49144,[],()
79973,50835,21377,1,58.€,"01:18:01 P.M.,  7-January-2025","Apt. 417 34624 Schultz Centers, Hueystad, CA 69519",69.6,69.6,69.6,2025-01-07 13:18:01.000,2025-01-07,2025,1,7,50835,[],()
85312,50630,21984,1,EUR 56.0,"2025-03-28,05:28:27 PM",,67.2,67.2,67.2,2025-03-28 17:28:27.000,2025-03-28,2025,3,28,50630,[],()
83253,50408,21986,1,$ 49.5,16:14:21 30-October-2024,"631 Dawn Stravenue, Christopherville, OK 99656-2720",49.5,49.5,49.5,2024-10-30 16:14:21.000,2024-10-30,2024,10,30,50408,[],()
86126,49782,21713,1,USD43.00,"06:47:26,2025-07-10",,43.0,43.0,43.0,2025-07-10 06:47:26.000,2025-07-10,2025,7,10,49782,[],()
85138,50416,21998,4,USD13.99,22:58;18-APR-2025,,13.99,13.99,55.96,2025-04-18 22:58:00.000,2025-04-18,2025,4,18,50416,[],()
78811,49725,21616,1,$40¢25,04:50:07 A.M. 07/05/24,,4025.0,4025.0,4025.0,2024-07-05 04:50:07.000,2024-07-05,2024,7,5,49725,[],()
78176,50631,22053,2,55.50USD,"16:02, 02/24/25",,55.5,55.5,111.0,2025-02-24 16:02:00.000,2025-02-24,2025,2,24,50631,[],()
82911,48895,22014,2,USD 29.0,"16:57:56, 13-SEP-2024",,29.0,29.0,58.0,2024-09-13 16:57:56.000,2024-09-13,2024,9,13,48895,[],()
85373,50960,21483,1,57.$,01:04:12 2024-10-26,,57.0,57.0,57.0,2024-10-26 01:04:12.000,2024-10-26,2024,10,26,50960,[],()
77815,50224,22033,2,€ 46.50,"12:58, 2024-04-12","Suite 577 8908 Shayne Point, Brownton, WI 53568",55.8,55.8,111.6,2024-04-12 12:58:00.000,2024-04-12,2024,4,12,50224,[],()
80014,48865,22052,1,26.75 USD,"09:34:20 pm, 01/21/25","83776 Noah Drive, East Johnton, PA 51158",26.75,26.75,26.75,2025-01-21 21:34:20.000,2025-01-21,2025,1,21,48865,[],()
78720,50651,21591,1,€ 52.5,"04:38:39 am,18-Jan-2025",,63.0,63.0,63.0,2025-01-18 04:38:39.000,2025-01-18,2025,1,18,50651,[],()
86001,48674,21350,1,€34¢75,"09:35:17 am, 2024-10-31",,4170.0,4170.0,4170.0,2024-10-31 09:35:17.000,2024-10-31,2024,10,31,48643,[],()
80990,50127,21656,1,28.75€,"01:01:30,30-SEP-2024",NULL,34.5,34.5,34.5,2024-09-30 01:01:30.000,2024-09-30,2024,9,30,50127,[],()
79704,48242,21495,1,USD 49.5,2025-05-19T09:45:52,"4049 Rohan Springs, Biancastad, ME 84568-0051",49.5,49.5,49.5,2025-05-19 09:45:52.000,2025-05-19,2025,5,19,48242,[],()
85511,50883,21673,1,39.5 USD,"16-Apr-2025, 05:31:29 pm",,39.5,39.5,39.5,2025-04-16 17:31:29.000,2025-04-16,2025,4,16,49435,[],()
81887,50479,22047,3,EUR65.5,"00:58, 02/06/25","4716 Waneta Mission, Powlowskiberg, ND 17807-6169",78.6,78.6,235.8,2025-02-06 00:58:00.000,2025-02-06,2025,2,6,50479,[],()
82240,48639,22011,1,EUR 74.00,10:22;08/09/24,,88.8,88.8,88.8,2024-08-09 10:22:00.000,2024-08-09,2024,8,9,48639,[],()
84165,50938,21881,1,59 $,2024-08-15T20:47:30,NULL,59.0,59.0,59.0,2024-08-15 20:47:30.000,2024-08-15,2024,8,15,50938,[],()
80023,47706,21712,1,$75¢00,2024-10-04T10:01:08,,7500.0,7500.0,7500.0,2024-10-04 10:01:08.000,2024-10-04,2024,10,4,47706,[],()
81934,48623,21815,1,EUR13.50,04:54:28;2025-04-02,,16.2,16.2,16.2,2025-04-02 04:54:28.000,2025-04-02,2025,4,2,48623,[],()
82186,49709,21646,1,USD75.5,"28-July-2024,07:46",,75.5,75.5,75.5,2024-07-28 07:46:00.000,2024-07-28,2024,7,28,49709,[],()
83967,49552,21575,1,69.50USD,2025-08-16 23:01,"Apt. 463 771 Ruecker Mount, Port Juniorburgh, ID 39145",69.5,69.5,69.5,2025-08-16 23:01:00.000,2025-08-16,2025,8,16,49552,[],()
77806,47921,21899,1,$68.5,"20:46:28,22-OCT-2024","Suite 400 52022 Laquanda Trail, Prosaccoview, IA 84755",68.5,68.5,68.5,2024-10-22 20:46:28.000,2024-10-22,2024,10,22,47921,[],()
81024,50080,21715,1,EUR32.99,"12:24:36 AM,25-Nov-2024",,39.588,39.588,39.59,2024-11-25 00:24:36.000,2024-11-25,2024,11,25,50080,[],()
80553,48482,21710,1,€71.5,19:51;03/27/25,NULL,85.8,85.8,85.8,2025-03-27 19:51:00.000,2025-03-27,2025,3,27,48482,[],()
83041,49856,22003,1,USD 61.5,"12/19/24,22:35:37",NULL,61.5,61.5,61.5,2024-12-19 22:35:37.000,2024-12-19,2024,12,19,49856,[],()
78030,50004,21765,2,EUR24.00,"09/30/24,21:45",NULL,28.799999999999997,28.799999999999997,57.6,2024-09-30 21:45:00.000,2024-09-30,2024,9,30,50004,[],()
82317,49934,21659,2,32.00 EUR,16-April-2025;05:11:21,"788 Abel Forest, Williamsonview, IL 07601",38.4,38.4,76.8,2025-04-16 05:11:21.000,2025-04-16,2025,4,16,49934,[],()
84101,50026,21940,1,54.75$,23-Aug-2024;10:32:12 PM,,54.75,54.75,54.75,2024-08-23 22:32:12.000,2024-08-23,2024,8,23,50026,[],()
84012,50812,21702,1,EUR65.0,2024-12-28T22:54:52,"Apt. 925 15138 Corkery Stream, Port Anton, CO 59649",78.0,78.0,78.0,2024-12-28 22:54:52.000,2024-12-28,2024,12,28,50812,[],()
81735,50137,22051,1,28.0€,"05:51:09, 5-Sep-2025",,33.6,33.6,33.6,2025-09-05 05:51:09.000,2025-09-05,2025,9,5,50137,[],()
84493,48118,21702,1,$64.00,2024-11-10T10:28:10.049,NULL,64.0,64.0,64.0,2024-11-10 10:28:10.049,2024-11-10,2024,11,10,48118,[],()
82089,47991,21413,2,37.75 $,"20:33, 27-AUG-2024",,37.75,37.75,75.5,2024-08-27 20:33:00.000,2024-08-27,2024,8,27,47991,[],()
81920,47769,21543,3,51USD," 1-NOV-2024,04:01",,51.0,51.0,153.0,2024-11-01 04:01:00.000,2024-11-01,2024,11,1,47769,[],()
83678,50385,21775,1,69 EUR,"01:31:34 PM,14-Jun-2025",,82.8,82.8,82.8,2025-06-14 13:31:34.000,2025-06-14,2025,6,14,50385,[],()
86427,49194,21627,1,$72,"12:58, 9-Feb-2025",,72.0,72.0,72.0,2025-02-09 12:58:00.000,2025-02-09,2025,2,9,49194,[],()
79554,48979,21905,1,USD 25.75,12:35:16 AM  7-Feb-2025,,25.75,25.75,25.75,2025-02-07 00:35:16.000,2025-02-07,2025,2,7,48979,[],()
81366,49046,21649,3,66.50 USD,"04/11/25, 05:31",NULL,66.5,66.5,199.5,2025-04-11 05:31:00.000,2025-04-11,2025,4,11,49046,[],()
81879,49802,21821,1,$ 69.25,"07/09/24, 16:32",,69.25,69.25,69.25,2024-07-09 16:32:00.000,2024-07-09,2024,7,9,49802,[],()
79472,48009,21794,1,34.5 $,13-March-2025;12:31:33 A.M.,"385 Robin Route, North Hillaryfurt, OK 68901-3725",34.5,34.5,34.5,2025-03-13 00:31:33.000,2025-03-13,2025,3,13,48009,[],()
81004,47812,22014,1,32.00 $,18:36:58;15-Jul-2024,"84697 Mitchell Parks, Port Diegobury, OH 59361",32.0,32.0,32.0,2024-07-15 18:36:58.000,2024-07-15,2024,7,15,47812,[],()
81340,49286,21620,3,32.75EUR," 8-APR-2024, 08:32","Suite 203 7945 Corine Station, New Michale, MA 44651",39.3,39.3,117.9,2024-04-08 08:32:00.000,2024-04-08,2024,4,8,49286,[],()
79715,47847,21316,3,$ 30.75,09:07:56;2024-10-10,,30.75,30.75,92.25,2024-10-10 09:07:56.000,2024-10-10,2024,10,10,49441,[],()
84587,50779,21564,1,$ 76.00,"21:59, 2025-02-11",,76.0,76.0,76.0,2025-02-11 21:59:00.000,2025-02-11,2025,2,11,50779,[],()
84809,47760,22039,1,USD62.99,"08:49:32 PM, 09/10/24",,62.99,62.99,62.99,2024-09-10 20:49:32.000,2024-09-10,2024,9,10,47760,[],()
84060,49398,21555,1,49 $,07:41:16 2025-08-21,,49.0,49.0,49.0,2025-08-21 07:41:16.000,2025-08-21,2025,8,21,48025,[],()
79335,51006,21580,1,€ 62,"05:40:54 AM, 26-JUL-2024",,74.39999999999999,74.39999999999999,74.4,2024-07-26 05:40:54.000,2024-07-26,2024,7,26,51006,[],()
79238,48867,21784,2,USD66.50,2024-05-29 11:44:28 A.M.,,66.5,66.5,133.0,2024-05-29 11:44:28.000,2024-05-29,2024,5,29,50066,[],()
83389,48576,21367,1,€ 31.00,"15:19,2024-11-21",,37.199999999999996,37.199999999999996,37.2,2024-11-21 15:19:00.000,2024-11-21,2024,11,21,48576,[],()
84484,50716,21471,1,USD21.0,"19-Aug-2024,12:15:40 PM",,21.0,21.0,21.0,2024-08-19 12:15:40.000,2024-08-19,2024,8,19,50716,[],()
81106,48567,22055,1,51.0 $,"15:40:43,11/22/24",,51.0,51.0,51.0,2024-11-22 15:40:43.000,2024-11-22,2024,11,22,48567,[],()
81803,50825,21662,1,24.00 $,2024-12-01T04:28:01.358,NULL,24.0,24.0,24.0,2024-12-01 04:28:01.358,2024-12-01,2024,12,1,50825,[],()
85567,48782,21506,1,€ 20.00,2025-04-17 21:37,"Apt. 192 969 Krissy Port, South Inger, MS 63584",24.0,24.0,24.0,2025-04-17 21:37:00.000,2025-04-17,2025,4,17,48782,[],()
83835,48786,21857,1,12 $,15-December-2024 12:23:18 am,"7316 Taina Village, New Timothy, MO 49817",12.0,12.0,12.0,2024-12-15 00:23:18.000,2024-12-15,2024,12,15,48786,[],()
77941,51095,22036,2,USD44.75,2025-02-13T06:39:10,"251 Towne Port, Creminview, WA 24812",44.75,44.75,89.5,2025-02-13 06:39:10.000,2025-02-13,2025,2,13,51095,[],()
81960,49145,21770,2,16.75 $,03:41:50 am 2025-03-20,"357 Brekke Falls, New Tannerborough, OH 07594-9447",16.75,16.75,33.5,2025-03-20 03:41:50.000,2025-03-20,2025,3,20,49145,[],()
84156,49306,21390,1,€ 49.25,"01:52:28, 30-MAY-2025","349 Richard Harbors, Turnerstad, VT 51892",59.099999999999994,59.099999999999994,59.1,2025-05-30 01:52:28.000,2025-05-30,2025,5,30,49306,[],()
78132,49041,21806,1,62.5 USD,"03/13/25, 09:10:33 pm",,62.5,62.5,62.5,2025-03-13 21:10:33.000,2025-03-13,2025,3,13,49041,[],()
85854,51099,21937,1,56.0$,"11/25/24, 04:52",,56.0,56.0,56.0,2024-11-25 04:52:00.000,2024-11-25,2024,11,25,51099,[],()
83456,49731,21702,1,EUR 63.75,"21:06:45,2024-12-30",,76.5,76.5,76.5,2024-12-30 21:06:45.000,2024-12-30,2024,12,30,49731,[],()
78258,48230,21959,1,75.0EUR,"14-Jan-2025,12:20:49 PM",,90.0,90.0,90.0,2025-01-14 12:20:49.000,2025-01-14,2025,1,14,48230,[],()
79346,49436,21302,1,23.50$,2024-07-25T21:04:46,NULL,23.5,23.5,23.5,2024-07-25 21:04:46.000,2024-07-25,2024,7,25,49436,[],()
85946,49690,21306,2,50.0 USD,"04:12:41,2024-11-28",NULL,50.0,50.0,100.0,2024-11-28 04:12:41.000,2024-11-28,2024,11,28,49690,[],()
79899,48133,21815,1,15.75€,2024-12-02T00:23:41,"Suite 945 16813 Emmerich Coves, Lake Edgar, NV 50064",18.9,18.9,18.9,2024-12-02 00:23:41.000,2024-12-02,2024,12,2,48133,[],()
84228,48580,21504,3,USD 58.75,07.01.2025 04:18:18,,58.75,58.75,176.25,2025-07-01 04:18:18.000,2025-07-01,2025,7,1,48580,[],()
84812,48945,21922,1,24.99 USD,"20-JAN-2025, 19:26",NULL,24.99,24.99,24.99,2025-01-20 19:26:00.000,2025-01-20,2025,1,20,48945,[],()
86052,48156,21983,1,62.00 €,"11:37:21 pm, 05/07/25",,74.39999999999999,74.39999999999999,74.4,2025-05-07 23:37:21.000,2025-05-07,2025,5,7,48156,[],()
82217,50041,21866,1,40.75 $,"16:00,  6-December-2024",,40.75,40.75,40.75,2024-12-06 16:00:00.000,2024-12-06,2024,12,6,50041,[],()
79843,50149,21617,4,$26.75,22:16;09/23/24,"26663 Goldner Mountains, West Rubiport, IL 14710",26.75,26.75,107.0,2024-09-23 22:16:00.000,2024-09-23,2024,9,23,50149,[],()
78373,48164,21519,1,49.75 €,2024-06-02;15:20,,59.699999999999996,59.699999999999996,59.7,2024-06-02 15:20:00.000,2024-06-02,2024,6,2,47890,[],()
80377,50805,21583,1,USD56.00,2025-01-26T07:38:22,,56.0,56.0,56.0,2025-01-26 07:38:22.000,2025-01-26,2025,1,26,50805,[],()
84804,50065,21555,1,USD 44.75,20-Feb-2025;12:23,NULL,44.75,44.75,44.75,2025-02-20 12:23:00.000,2025-02-20,2025,2,20,50065,[],()
80598,48170,21421,1,$64.,"02:14:00 pm,12/15/24",,64.0,64.0,64.0,2024-12-15 14:14:00.000,2024-12-15,2024,12,15,50252,[],()
80474,50949,21879,1,$56.00,"15-Feb-2025, 08:11",,56.0,56.0,56.0,2025-02-15 08:11:00.000,2025-02-15,2025,2,15,50949,[],()
79754,49264,21461,1,71.99 USD,02:25;2024-06-28,NULL,71.99,71.99,71.99,2024-06-28 02:25:00.000,2024-06-28,2024,6,28,49264,[],()
78817,49542,21754,1,29.75 EUR,"2024-12-24, 05:31:08","Apt. 662 27490 McKenzie Mountains, North Bessieton, IA 56970",35.699999999999996,35.699999999999996,35.7,2024-12-24 05:31:08.000,2024-12-24,2024,12,24,49542,[],()
79232,50889,21363,2,69.75 USD,"2024-12-02,09:19:32",,69.75,69.75,139.5,2024-12-02 09:19:32.000,2024-12-02,2024,12,2,50889,[],()
79691,50599,21520,1,16. €,12-Aug-2024;08:00:55,NULL,19.2,19.2,19.2,2024-08-12 08:00:55.000,2024-08-12,2024,8,12,50599,[],()
84291,48705,21590,1,€ 37.25,10/13/24;02:24,NULL,44.699999999999996,44.699999999999996,44.7,2024-10-13 02:24:00.000,2024-10-13,2024,10,13,48705,[],()
79389,49324,21786,1,USD 49.75,04/02/25 06:16,"Suite 552 54721 Nader Gateway, North Dwainstad, PA 02685-3687",49.75,49.75,49.75,2025-04-02 06:16:00.000,2025-04-02,2025,4,2,48461,[],()
80567,50881,21520,3,USD 20.50,12/27/24;00:51,"8462 Brown Mission, East Clarisa, CT 05654",20.5,20.5,61.5,2024-12-27 00:51:00.000,2024-12-27,2024,12,27,50881,[],()
81690,48272,21492,4,23.0USD,19.02.2025 19:40:40,NULL,23.0,23.0,92.0,2025-02-19 19:40:40.000,2025-02-19,2025,2,19,48272,[],()
81685,50197,21461,1,75.75$,2025-01-02T21:29:48,,75.75,75.75,75.75,2025-01-02 21:29:48.000,2025-01-02,2025,1,2,50197,[],()
81127,49898,21755,2,19.75USD,"12:29:10 P.M.,2024-08-06",NULL,19.75,19.75,39.5,2024-08-06 12:29:10.000,2024-08-06,2024,8,6,49898,[],()
83467,48472,21980,1,13.5USD,2024-08-21T22:33:41.835,NULL,13.5,13.5,13.5,2024-08-21 22:33:41.835,2024-08-21,2024,8,21,48472,[],()
85653,49809,21724,1,15.99EUR,"11/05/24, 03:20:02 A.M.",,19.188,19.188,19.19,2024-11-05 03:20:02.000,2024-11-05,2024,11,5,49809,[],()
84608,50015,21709,2,USD53.00,"12:52:49 A.M.,04/02/25",NULL,53.0,53.0,106.0,2025-04-02 00:52:49.000,2025-04-02,2025,4,2,50015,[],()
85285,48650,21413,1,38.75 USD," 4-June-2025, 04:41:19 AM",NULL,38.75,38.75,38.75,2025-06-04 04:41:19.000,2025-06-04,2025,6,4,48650,[],()
77621,48677,21304,1,$19,"08:04:50,2025-04-14","4095 Deangelo Light, Torpshire, IA 10969",19.0,19.0,19.0,2025-04-14 08:04:50.000,2025-04-14,2025,4,14,48677,[],()
84787,49411,21449,1,USD49.00, 6-APR-2025 07:58:17 A.M.,"7558 Madelyn Mountain, Federicomouth, ME 07518-4573",49.0,49.0,49.0,2025-04-06 07:58:17.000,2025-04-06,2025,4,6,49411,[],()
79160,50948,21593,3,USD21.50,28-OCT-2024;05:54,NULL,21.5,21.5,64.5,2024-10-28 05:54:00.000,2024-10-28,2024,10,28,50948,[],()
86408,48735,21906,1,EUR40,19-APR-2025;17:23:33,,48.0,48.0,48.0,2025-04-19 17:23:33.000,2025-04-19,2025,4,19,48735,[],()
85174,48985,21931,2,EUR 28.5,2024-04-28;20:53:22,,34.199999999999996,34.199999999999996,68.4,2024-04-28 20:53:22.000,2024-04-28,2024,4,28,48985,[],()
78159,49871,21544,1,18.25 $,03/19/25 14:30:50,,18.25,18.25,18.25,2025-03-19 14:30:50.000,2025-03-19,2025,3,19,49392,[],()
80542,48373,21612,1,17.00 USD,05:19:40 P.M.;17-JUN-2024,,17.0,17.0,17.0,2024-06-17 17:19:40.000,2024-06-17,2024,6,17,48373,[],()
79125,47911,21453,1,EUR53.5,"11:44:16 pm, 08/09/24",,64.2,64.2,64.2,2024-08-09 23:44:16.000,2024-08-09,2024,8,9,49582,[],()
83036,47797,21549,1,€28.5,"06:54:06 A.M.,2024-11-01",,34.199999999999996,34.199999999999996,34.2,2024-11-01 06:54:06.000,2024-11-01,2024,11,1,47797,[],()
85871,48166,21782,1,$57,2024-06-27;10:30:11 am,NULL,57.0,57.0,57.0,2024-06-27 10:30:11.000,2024-06-27,2024,6,27,48166,[],()
81063,49281,21497,1,EUR 68.50,2025-04-12T12:33:12,"Suite 518 94047 Wilkinson Mountain, Port Alva, ND 57007",82.2,82.2,82.2,2025-04-12 12:33:12.000,2025-04-12,2025,4,12,49281,[],()
78908,48724,21834,3,28.0EUR,06:51:59 am 27-AUG-2024,"Apt. 473 67185 Lowell Rapid, Jinport, MT 58568-1777",33.6,33.6,100.8,2024-08-27 06:51:59.000,2024-08-27,2024,8,27,48724,[],()
79967,50830,21712,5,$74.5,25-JAN-2025;07:00:53 am,,74.5,74.5,372.5,2025-01-25 07:00:53.000,2025-01-25,2025,1,25,50830,[],()
85038,48638,21326,1,64.99 $,"01:25,27-Sep-2024",NULL,64.99,64.99,64.99,2024-09-27 01:25:00.000,2024-09-27,2024,9,27,48638,[],()
85966,48471,21763,2,€36¢75,"04/16/25,21:50",,4410.0,4410.0,8820.0,2025-04-16 21:50:00.000,2025-04-16,2025,4,16,49873,[],()
84079,48671,21666,2,$64.5,"12/11/24,03:14:16 AM","7473 Glover Junction, New Alan, DE 38559",64.5,64.5,129.0,2024-12-11 03:14:16.000,2024-12-11,2024,12,11,48828,[],()
84528,48672,21969,1,54.5€,"01/24/25, 02:55",,65.39999999999999,65.39999999999999,65.4,2025-01-24 02:55:00.000,2025-01-24,2025,1,24,48672,[],()
80786,47991,21867,1,61.00USD,2024-06-20 03:28:41,,61.0,61.0,61.0,2024-06-20 03:28:41.000,2024-06-20,2024,6,20,47991,[],()
80858,50732,21996,1,72.0 EUR,2024-06-23T18:31:42.411,,86.39999999999999,86.39999999999999,86.4,2024-06-23 18:31:42.411,2024-06-23,2024,6,23,50732,[],()
79394,50149,21325,2,USD48,"17:59, 11-Sep-2024",NULL,48.0,48.0,96.0,2024-09-11 17:59:00.000,2024-09-11,2024,9,11,50149,[],()
79352,48221,21962,1,65$00¢,"2025-09-04, 01:38:28",,6500.0,6500.0,6500.0,2025-09-04 01:38:28.000,2025-09-04,2025,9,4,48221,[],()
85770,50614,21892,1,USD 28.50,"07/05/25,04:10:10",,28.5,28.5,28.5,2025-07-05 04:10:10.000,2025-07-05,2025,7,5,50614,[],()
78547,48942,22001,1,63.99 USD,16:51;17-NOV-2024,,63.99,63.99,63.99,2024-11-17 16:51:00.000,2024-11-17,2024,11,17,48942,[],()
83966,50519,21874,1,USD 69.75,"14:44:30, 28-Oct-2024",,69.75,69.75,69.75,2024-10-28 14:44:30.000,2024-10-28,2024,10,28,50519,[],()
81033,51098,22011,1,75.00EUR, 9-DEC-2024 07:51,NULL,90.0,90.0,90.0,2024-12-09 07:51:00.000,2024-12-09,2024,12,9,51098,[],()
85272,50831,21763,5,$ 37.75,"2024-09-14,02:38:42","2067 Wilbert Springs, Lake Ward, LA 03571-8262",37.75,37.75,188.75,2024-09-14 02:38:42.000,2024-09-14,2024,9,14,50831,[],()
80594,49206,21692,1,USD68.00,10:21:51;01/09/25,,68.0,68.0,68.0,2025-01-09 10:21:51.000,2025-01-09,2025,1,9,49206,[],()
79992,49178,21536,1,40.50€,05:22;2024-09-26,,48.6,48.6,48.6,2024-09-26 05:22:00.000,2024-09-26,2024,9,26,49178,[],()
80084,47980,22037,1,USD 28.,"2024-12-18, 01:09:25",NULL,28.0,28.0,28.0,2024-12-18 01:09:25.000,2024-12-18,2024,12,18,47980,[],()
85864,48579,21716,1,€ 33.75,2024-10-07;04:21:26 am,"Suite 437 8935 Jamal Ranch, South Aurelio, MO 19628",40.5,40.5,40.5,2024-10-07 04:21:26.000,2024-10-07,2024,10,7,48579,[],()
83637,50390,22047,3,$ 65.0,20:11 03/01/25,"Apt. 857 686 Crooks Squares, Rosenbaumberg, CA 18317",65.0,65.0,195.0,2025-03-01 20:11:00.000,2025-03-01,2025,3,1,50390,[],()
85805,50617,21958,2,76.99USD,"06/24/24, 10:53:52 AM",NULL,76.99,76.99,153.98,2024-06-24 10:53:52.000,2024-06-24,2024,6,24,50617,[],()
85651,50516,21824,2,60.USD,"10:55:47 PM, 03/26/25",,60.0,60.0,120.0,2025-03-26 22:55:47.000,2025-03-26,2025,3,26,50516,[],()
85623,50543,21868,4,USD64.,03:05 10/26/24,,64.0,64.0,256.0,2024-10-26 03:05:00.000,2024-10-26,2024,10,26,50543,[],()
81515,48287,21883,1,EUR 36.5,29-Mar-2025;17:28:08,"Apt. 412 9832 Prosacco Way, Sengerland, DE 01178-9494",43.8,43.8,43.8,2025-03-29 17:28:08.000,2025-03-29,2025,3,29,48287,[],()
80584,48157,21388,1,18.0 $,"04:52:52 A.M., 12-December-2024",,18.0,18.0,18.0,2024-12-12 04:52:52.000,2024-12-12,2024,12,12,48157,[],()
80274,50087,21690,2,€37¢75,"02:29:25 am, 7-Mar-2025",,4530.0,4530.0,9060.0,2025-03-07 02:29:25.000,2025-03-07,2025,3,7,50087,[],()
78852,48320,21643,1,USD17.0,"07:15:19 pm,02/19/24",NULL,17.0,17.0,17.0,2024-02-19 19:15:19.000,2024-02-19,2024,2,19,48320,[],()
85751,49823,21901,1,63.5$,19-May-2024;01:36:21 P.M.,"9886 Kuhic Port, South Jamarshire, KY 85493",63.5,63.5,63.5,2024-05-19 13:36:21.000,2024-05-19,2024,5,19,49823,[],()
78526,49418,21889,1,USD 41.75,"2024-11-21, 23:31:07",NULL,41.75,41.75,41.75,2024-11-21 23:31:07.000,2024-11-21,2024,11,21,49418,[],()
79811,49892,21620,1,34.5$,2025-07-20 03:47:36,,34.5,34.5,34.5,2025-07-20 03:47:36.000,2025-07-20,2025,7,20,49892,[],()
83596,47781,21824,1,EUR64,"11:11:26 AM,2025-01-12",NULL,76.8,76.8,76.8,2025-01-12 11:11:26.000,2025-01-12,2025,1,12,47781,[],()
82199,48456,21410,1,USD21.,11:11 2024-07-31,,21.0,21.0,21.0,2024-07-31 11:11:00.000,2024-07-31,2024,7,31,48456,[],()
84952,48343,21986,2,52.99USD,2024-09-25T08:19:26,"88912 Lakin Fall, West Amadaville, AZ 02683",52.99,52.99,105.98,2024-09-25 08:19:26.000,2024-09-25,2024,9,25,48343,[],()
81954,48724,21924,1,USD54.99," 9-Aug-2025, 11:50:54",NULL,54.99,54.99,54.99,2025-08-09 11:50:54.000,2025-08-09,2025,8,9,48724,[],()
82919,48190,21335,1,34$50¢,05:41:01 pm;17-FEB-2025,,3450.0,3450.0,3450.0,2025-02-17 17:41:01.000,2025-02-17,2025,2,17,48190,[],()
84662,51115,21696,1,USD42.75,2024-10-13T15:16:50,"Apt. 149 883 White Extensions, Champlinland, KY 33631-7589",42.75,42.75,42.75,2024-10-13 15:16:50.000,2024-10-13,2024,10,13,51115,[],()
85761,50967,21870,1,65.50 EUR,"15:40:13, 27-Dec-2024","Suite 548 52704 Anastacia Springs, Lake Jen, HI 59015",78.6,78.6,78.6,2024-12-27 15:40:13.000,2024-12-27,2024,12,27,50967,[],()
81999,51127,21693,1,€70.0,17:51:05; 9-January-2025,,84.0,84.0,84.0,2025-01-09 17:51:05.000,2025-01-09,2025,1,9,51127,[],()
80312,49201,21540,1,USD 29.75,05:17:39 P.M. 2024-09-01,,29.75,29.75,29.75,2024-09-01 17:17:39.000,2024-09-01,2024,9,1,49201,[],()
78981,48638,21775,1,67.00 EUR,2024-05-30T14:33:22.013,NULL,80.39999999999999,80.39999999999999,80.4,2024-05-30 14:33:22.013,2024-05-30,2024,5,30,48638,[],()
83163,48245,21550,1,USD 72.50,2024-12-11T07:24:25,,72.5,72.5,72.5,2024-12-11 07:24:25.000,2024-12-11,2024,12,11,48245,[],()
85667,50081,21432,1,USD37,2025-02-05T19:04:37,"Suite 486 30069 Bartell Prairie, Port Denny, NE 82632-6642",37.0,37.0,37.0,2025-02-05 19:04:37.000,2025-02-05,2025,2,5,50081,[],()
86395,47707,21296,2,EUR 55.0,19-AUG-2024 18:37:48,"Apt. 472 8937 Manual Forks, New Geraldberg, MI 79282-1517",66.0,66.0,132.0,2024-08-19 18:37:48.000,2024-08-19,2024,8,19,47707,[],()
82247,50831,22030,1,USD 14.0,2024-04-22T22:05:07,NULL,14.0,14.0,14.0,2024-04-22 22:05:07.000,2024-04-22,2024,4,22,50831,[],()
80928,48343,21429,1,28. EUR,19:21:53 2024-10-06,,33.6,33.6,33.6,2024-10-06 19:21:53.000,2024-10-06,2024,10,6,48343,[],()
85961,48808,21698,1,€ 46.50," 1-JAN-2025, 12:31:38",,55.8,55.8,55.8,2025-01-01 12:31:38.000,2025-01-01,2025,1,1,48808,[],()
78777,50515,21354,3,EUR55.25,2024-07-12;03:11:45,NULL,66.3,66.3,198.9,2024-07-12 03:11:45.000,2024-07-12,2024,7,12,50515,[],()
81914,48088,21917,1,62.0 $,2024-10-21;10:48:22 pm,NULL,62.0,62.0,62.0,2024-10-21 22:48:22.000,2024-10-21,2024,10,21,48088,[],()
83196,50036,21397,1,70$25¢,18.12.2024 18:29:29,,7025.0,7025.0,7025.0,2024-12-18 18:29:29.000,2024-12-18,2024,12,18,50036,[],()
85462,50823,21417,1,63.99 $,09:41:05 am  2-Aug-2025,,63.99,63.99,63.99,2025-08-02 09:41:05.000,2025-08-02,2025,8,2,50823,[],()
83284,49701,21897,1,$52.25,2024-07-27T08:37:57.387,"13261 Purdy Glens, Shavonmouth, AR 70016-7730",52.25,52.25,52.25,2024-07-27 08:37:57.387,2024-07-27,2024,7,27,49701,[],()
81681,50007,21913,1,41.25 $,02:05 04/20/25,,41.25,41.25,41.25,2025-04-20 02:05:00.000,2025-04-20,2025,4,20,48280,[],()
86020,50153,21736,1,47.0 $,18-April-2025 08:16:25 AM,,47.0,47.0,47.0,2025-04-18 08:16:25.000,2025-04-18,2025,4,18,50153,[],()
84469,50186,21358,2,USD14.50,"01:27:15 pm,2024-08-16",,14.5,14.5,29.0,2024-08-16 13:27:15.000,2024-08-16,2024,8,16,50186,[],()
86242,49868,21361,1,USD62.99, 1-Nov-2024;19:12:43,,62.99,62.99,62.99,2024-11-01 19:12:43.000,2024-11-01,2024,11,1,49868,[],()
83869,49046,21667,1,USD 57.25,2024-08-18T19:43:09,NULL,57.25,57.25,57.25,2024-08-18 19:43:09.000,2024-08-18,2024,8,18,49046,[],()
80164,47690,21468,2,30.75USD,18-Nov-2024;11:10:35,,30.75,30.75,61.5,2024-11-18 11:10:35.000,2024-11-18,2024,11,18,47690,[],()
82290,50053,21441,3,26.$,07:43:02 PM 30-DEC-2024,NULL,26.0,26.0,78.0,2024-12-30 19:43:02.000,2024-12-30,2024,12,30,48119,[],()
83763,49784,21645,1,$51.,10:16:42 A.M.;2024-11-14,NULL,51.0,51.0,51.0,2024-11-14 10:16:42.000,2024-11-14,2024,11,14,49784,[],()
86154,49281,21428,1,60.75USD,08:51:32 2024-08-21,,60.75,60.75,60.75,2024-08-21 08:51:32.000,2024-08-21,2024,8,21,49281,[],()
86496,50367,21604,1,74.99 USD,"05:58:05 am, 26-Nov-2024",,74.99,74.99,74.99,2024-11-26 05:58:05.000,2024-11-26,2024,11,26,50367,[],()
79776,48497,21620,2,30.25EUR, 6-Oct-2024;11:17,"21326 Quintin Islands, West Shaeside, WI 68640-1512",36.3,36.3,72.6,2024-10-06 11:17:00.000,2024-10-06,2024,10,6,48497,[],()
80277,48696,21362,2,17.25USD,"18:23:06,02/27/25",,17.25,17.25,34.5,2025-02-27 18:23:06.000,2025-02-27,2025,2,27,48696,[],()
84878,50184,21636,1,$13.0,"20:37,26-July-2024",NULL,13.0,13.0,13.0,2024-07-26 20:37:00.000,2024-07-26,2024,7,26,50184,[],()
82718,49382,21865,1,71.0USD,12:23:12 A.M.;22-JAN-2025,,71.0,71.0,71.0,2025-01-22 00:23:12.000,2025-01-22,2025,1,22,49382,[],()
80001,50579,21629,1,41.75 USD,03:29:03  2-APR-2024,,41.75,41.75,41.75,2024-04-02 03:29:03.000,2024-04-02,2024,4,2,50579,[],()
83166,48440,21382,1,51.25USD,"17:27,24-MAR-2025",,51.25,51.25,51.25,2025-03-24 17:27:00.000,2025-03-24,2025,3,24,48440,[],()
85983,49645,21728,1,$55.50,15-NOV-2024 10:30:41,NULL,55.5,55.5,55.5,2024-11-15 10:30:41.000,2024-11-15,2024,11,15,49645,[],()
83789,48903,21392,1,54.75 USD,"28-DEC-2024, 06:21:18 A.M.",,54.75,54.75,54.75,2024-12-28 06:21:18.000,2024-12-28,2024,12,28,48903,[],()
82642,49873,21854,3,61.50 EUR,"12:38,2024-04-22",NULL,73.8,73.8,221.4,2024-04-22 12:38:00.000,2024-04-22,2024,4,22,49873,[],()
81593,49690,21442,1,$45.75,"2024-06-08, 22:34:23",,45.75,45.75,45.75,2024-06-08 22:34:23.000,2024-06-08,2024,6,8,49690,[],()
85152,48095,21695,1,USD72.75,Wed Feb 12 14:49:37 2025,"Suite 511 261 Romaguera Cliff, South Miles, WY 80252-2844",72.75,72.75,72.75,2025-02-12 14:49:37.000,2025-02-12,2025,2,12,48095,[],()
78207,48426,21865,2,68. EUR,2025-02-13T20:45:08,"Suite 275 77041 Mraz Walks, New Marin, GA 07431",81.6,81.6,163.2,2025-02-13 20:45:08.000,2025-02-13,2025,2,13,48426,[],()
84281,48119,21881,1,€59¢50,"08:15,24-January-2025",,7140.0,7140.0,7140.0,2025-01-24 08:15:00.000,2025-01-24,2025,1,24,48119,[],()
80952,49426,21644,1,€34.5,"04:11, 20-Aug-2024",NULL,41.4,41.4,41.4,2024-08-20 04:11:00.000,2024-08-20,2024,8,20,49426,[],()
78652,48283,21330,1,EUR 45,"2025-03-19,17:37:47",,54.0,54.0,54.0,2025-03-19 17:37:47.000,2025-03-19,2025,3,19,50228,[],()
78339,47823,21985,1,18.75USD,"2024-06-28,06:07:51 am","122 Asha Mill, Leonardoburgh, CA 26185",18.75,18.75,18.75,2024-06-28 06:07:51.000,2024-06-28,2024,6,28,47823,[],()
79854,49069,21893,1,72.0EUR,12:27:49 A.M.  1-January-2025,"729 Francesco Ranch, Carymouth, MS 29671-2690",86.39999999999999,86.39999999999999,86.4,2025-01-01 00:27:49.000,2025-01-01,2025,1,1,49069,[],()
82727,48404,21684,2,$58,"2024-12-05, 07:34:47",NULL,58.0,58.0,116.0,2024-12-05 07:34:47.000,2024-12-05,2024,12,5,48404,[],()
83932,48680,21484,1,USD 17.25,"23:32, 14-January-2025","7080 Britt Inlet, New Laurence, HI 63992",17.25,17.25,17.25,2025-01-14 23:32:00.000,2025-01-14,2025,1,14,48680,[],()
85080,49464,21970,1,71.5 $,18:21;2024-12-14,"68293 Miller Islands, Port Agripinaland, HI 10834-5548",71.5,71.5,71.5,2024-12-14 18:21:00.000,2024-12-14,2024,12,14,49464,[],()
83703,49635,21686,1,$ 20.50,2025-02-17T02:42:07,,20.5,20.5,20.5,2025-02-17 02:42:07.000,2025-02-17,2025,2,17,49635,[],()
79321,50041,22047,2,€65¢75,2024-12-11T12:59:30,,7890.0,7890.0,15780.0,2024-12-11 12:59:30.000,2024-12-11,2024,12,11,50041,[],()
85259,50465,21419,2,49.50USD,"12-October-2024, 15:44",,49.5,49.5,99.0,2024-10-12 15:44:00.000,2024-10-12,2024,10,12,50465,[],()
83004,48454,21534,5,19.50USD,"2024-07-06,22:37",,19.5,19.5,97.5,2024-07-06 22:37:00.000,2024-07-06,2024,7,6,48454,[],()
80152,48896,21356,1,€ 21.0,"19:38:09, 28-Oct-2024",,25.2,25.2,25.2,2024-10-28 19:38:09.000,2024-10-28,2024,10,28,48896,[],()
86300,49252,21741,1,36.0EUR,24-FEB-2024;10:03:13 P.M.,"7358 Syreeta Prairie, New Pamelabury, DE 91542",43.199999999999996,43.199999999999996,43.2,2024-02-24 22:03:13.000,2024-02-24,2024,2,24,49252,[],()
79795,48540,21951,1,USD 35.5,11:27 25-May-2024,,35.5,35.5,35.5,2024-05-25 11:27:00.000,2024-05-25,2024,5,25,48540,[],()
82545,51075,21746,1,€ 17.5,08:16:31 A.M. 18-March-2025,,21.0,21.0,21.0,2025-03-18 08:16:31.000,2025-03-18,2025,3,18,51075,[],()
81278,50626,21915,1,USD 30.0,08:13:40 AM  8-October-2024,"Apt. 867 1632 Carey Cove, Fadelmouth, CT 62425",30.0,30.0,30.0,2024-10-08 08:13:40.000,2024-10-08,2024,10,8,50626,[],()
77785,48643,21609,1,71.50 €,"18:56, 11/09/24",,85.8,85.8,85.8,2024-11-09 18:56:00.000,2024-11-09,2024,11,9,48643,[],()
78578,50528,21743,2,€38.00,2024-08-22T14:53:57.424,"7197 Mills Freeway, Port Michaleborough, ME 65103-8025",45.6,45.6,91.2,2024-08-22 14:53:57.424,2024-08-22,2024,8,22,50528,[],()
80250,49061,21628,1,$42¢50,13:47;2024-10-26,NULL,4250.0,4250.0,4250.0,2024-10-26 13:47:00.000,2024-10-26,2024,10,26,49061,[],()
79158,51039,21948,1,$63¢99,11:14 2025-06-04,,6399.0,6399.0,6399.0,2025-06-04 11:14:00.000,2025-06-04,2025,6,4,51039,[],()
79422,49146,21385,1,€28.5,31-Oct-2024;20:26,,34.199999999999996,34.199999999999996,34.2,2024-10-31 20:26:00.000,2024-10-31,2024,10,31,49146,[],()
86091,49369,21440,1,USD 25.5,"10/22/24,08:58:40 AM",NULL,25.5,25.5,25.5,2024-10-22 08:58:40.000,2024-10-22,2024,10,22,49369,[],()
84287,50704,21508,1,27.25USD,04:39  9-December-2024,"797 Blair Locks, Boehmborough, KS 65058-5604",27.25,27.25,27.25,2024-12-09 04:39:00.000,2024-12-09,2024,12,9,50704,[],()
81955,48082,21810,2,54.0 USD,"25-February-2025,23:12:38",,54.0,54.0,108.0,2025-02-25 23:12:38.000,2025-02-25,2025,2,25,48082,[],()
84726,48056,21980,1,USD 16.75,"11:27,13-Oct-2024",,16.75,16.75,16.75,2024-10-13 11:27:00.000,2024-10-13,2024,10,13,48056,[],()
79131,50615,21334,1,€ 64.0,08:53:18 2024-07-25,,76.8,76.8,76.8,2024-07-25 08:53:18.000,2024-07-25,2024,7,25,50615,[],()
86058,49471,21734,1,USD 49.75,"2025-03-24, 02:41:47",,49.75,49.75,49.75,2025-03-24 02:41:47.000,2025-03-24,2025,3,24,49471,[],()
79874,48400,21981,2,€18.99,"01:30:13 A.M., 8-Aug-2024",,22.787999999999997,22.787999999999997,45.58,2024-08-08 01:30:13.000,2024-08-08,2024,8,8,48400,[],()
78911,50112,21445,1,USD 18.50,08:37:49 P.M.;08/05/24,"71020 Ondricka Haven, Bergnaumland, IA 26575-1186",18.5,18.5,18.5,2024-08-05 20:37:49.000,2024-08-05,2024,8,5,50112,[],()
82083,48526,21892,1,27. €," 1-Apr-2025, 08:26:03","140 Berge Estates, Hwafurt, VA 04976",32.4,32.4,32.4,2025-04-01 08:26:03.000,2025-04-01,2025,4,1,48526,[],()
80571,48580,21475,1,$ 23.50,"12/25/24, 23:29",,23.5,23.5,23.5,2024-12-25 23:29:00.000,2024-12-25,2024,12,25,48580,[],()
82499,49851,21674,1,17.0 $,2024-10-24;03:49,NULL,17.0,17.0,17.0,2024-10-24 03:49:00.000,2024-10-24,2024,10,24,49851,[],()
84979,48260,21372,1,33.00 USD,07:16:02 pm  1-September-2024,"509 Lang Springs, Lake Andre, AZ 49402-6477",33.0,33.0,33.0,2024-09-01 19:16:02.000,2024-09-01,2024,9,1,48260,[],()
80051,49900,21871,1,$ 30.0,"11:46:48 PM, 22-Feb-2025",,30.0,30.0,30.0,2025-02-22 23:46:48.000,2025-02-22,2025,2,22,49900,[],()
79614,49148,21935,1,$ 16.0,"01/17/24,01:39:03 am","9280 Will Light, Damientown, ME 67802-9192",16.0,16.0,16.0,2024-01-17 01:39:03.000,2024-01-17,2024,1,17,49148,[],()
79336,48212,21712,1,USD73.00,"20-May-2025, 00:25:35",,73.0,73.0,73.0,2025-05-20 00:25:35.000,2025-05-20,2025,5,20,48212,[],()
81414,51110,21930,1,26.99 €,"12/17/24,12:00",,32.388,32.388,32.39,2024-12-17 12:00:00.000,2024-12-17,2024,12,17,51110,[],()
83207,49766,21950,1,EUR47.50,"10/27/24,18:00",,57.0,57.0,57.0,2024-10-27 18:00:00.000,2024-10-27,2024,10,27,49766,[],()
83679,49081,21465,1,69.99 $,2024-11-17T02:43:56,,69.99,69.99,69.99,2024-11-17 02:43:56.000,2024-11-17,2024,11,17,49081,[],()
85730,48442,21503,4,$ 21.99,2024-09-18T22:14:47.326,"Suite 685 87307 Kemmer Cliffs, Eunaville, SD 68250-6135",21.99,21.99,87.96,2024-09-18 22:14:47.326,2024-09-18,2024,9,18,48442,[],()
85716,50826,21471,5,USD 26.0,"09:50:34 am, 10/30/24",,26.0,26.0,130.0,2024-10-30 09:50:34.000,2024-10-30,2024,10,30,50826,[],()
79007,48863,21507,1,€37.50,"2024-07-26,19:24:30",,45.0,45.0,45.0,2024-07-26 19:24:30.000,2024-07-26,2024,7,26,48216,[],()
81531,48081,21812,3,48.75 USD,"2024-12-02, 05:04",NULL,48.75,48.75,146.25,2024-12-02 05:04:00.000,2024-12-02,2024,12,2,48081,[],()
79964,48723,21608,2,USD51.0,26-October-2024;01:33,NULL,51.0,51.0,102.0,2024-10-26 01:33:00.000,2024-10-26,2024,10,26,48723,[],()
84009,50666,21949,1,$46¢00,01/02/25 07:38:39,,4600.0,4600.0,4600.0,2025-01-02 07:38:39.000,2025-01-02,2025,1,2,50666,[],()
77677,47865,21629,1,€45.25,2024-06-16T15:22:24,,54.3,54.3,54.3,2024-06-16 15:22:24.000,2024-06-16,2024,6,16,47865,[],()
83534,50751,21767,1,36.25USD,"15:37, 2024-12-05",,36.25,36.25,36.25,2024-12-05 15:37:00.000,2024-12-05,2024,12,5,50751,[],()
81570,49835,21901,1,€60¢75, 4-FEB-2025;02:54:07 PM,,7290.0,7290.0,7290.0,2025-02-04 14:54:07.000,2025-02-04,2025,2,4,49835,[],()
84082,49323,21795,5,USD35.50,13.07.2024 04:19:19,"269 Kerluke Heights, North Cheri, MO 26203",35.5,35.5,177.5,2024-07-13 04:19:19.000,2024-07-13,2024,7,13,49323,[],()
82774,49547,21967,3,43.0EUR,"2024-10-01, 10:42:46",NULL,51.6,51.6,154.8,2024-10-01 10:42:46.000,2024-10-01,2024,10,1,49547,[],()
86475,48256,21304,1,19.75€,30.12.2024 13:05:05,,23.7,23.7,23.7,2024-12-30 13:05:05.000,2024-12-30,2024,12,30,48256,[],()
82711,49713,21896,1,EUR17.50,06:43:49 am 2024-09-08,,21.0,21.0,21.0,2024-09-08 06:43:49.000,2024-09-08,2024,9,8,49713,[],()
85503,48879,21713,1,€47¢25,"07:26, 2025-01-04",,5670.0,5670.0,5670.0,2025-01-04 07:26:00.000,2025-01-04,2025,1,4,48879,[],()
77663,48536,21819,3,61.0€,2024-11-18T22:43:13,,73.2,73.2,219.6,2024-11-18 22:43:13.000,2024-11-18,2024,11,18,48536,[],()
83444,49985,22023,2,$ 14.75,2024-08-26T08:03:45.408,"2760 Clarissa Pike, Friesenside, DE 88444-4014",14.75,14.75,29.5,2024-08-26 08:03:45.408,2024-08-26,2024,8,26,49985,[],()
80337,49028,22050,1,68.75 €,06/15/24;19:27:44,,82.5,82.5,82.5,2024-06-15 19:27:44.000,2024-06-15,2024,6,15,49028,[],()
78306,49641,21319,1,22.00 USD,"03:02:09 PM,28-OCT-2024","Suite 583 953 Asuncion Lane, Kristelchester, WA 74723-5955",22.0,22.0,22.0,2024-10-28 15:02:09.000,2024-10-28,2024,10,28,49641,[],()
82838,48318,21918,1,75 €,2024-08-10T21:33:37.299,"25117 Buckridge Junctions, Derickshire, MO 77609-6346",90.0,90.0,90.0,2024-08-10 21:33:37.299,2024-08-10,2024,8,10,48318,[],()
78410,48389,21330,2,49.75 $,29-APR-2025;06:41:11 AM,,49.75,49.75,99.5,2025-04-29 06:41:11.000,2025-04-29,2025,4,29,48389,[],()
83122,49831,21554,2,EUR 71.5,05/08/24 12:49:11 A.M.,,85.8,85.8,171.6,2024-05-08 00:49:11.000,2024-05-08,2024,5,8,49831,[],()
81143,48584,21814,1,USD45.50,13-Feb-2025;00:37:41,NULL,45.5,45.5,45.5,2025-02-13 00:37:41.000,2025-02-13,2025,2,13,48584,[],()
84829,48559,21997,1,EUR72.00,03:01:06;04/17/25,NULL,86.39999999999999,86.39999999999999,86.4,2025-04-17 03:01:06.000,2025-04-17,2025,4,17,48559,[],()
86042,48476,21944,1,EUR 34.25,2025-02-25T10:16:05,"Apt. 944 3122 Tony Plains, New Major, MT 79255",41.1,41.1,41.1,2025-02-25 10:16:05.000,2025-02-25,2025,2,25,48476,[],()
80468,48126,21568,3,24.25$,2025-02-18T17:28:58,NULL,24.25,24.25,72.75,2025-02-18 17:28:58.000,2025-02-18,2025,2,18,48126,[],()
78166,47702,21519,1,46.50EUR,10:07:45;12/11/24,,55.8,55.8,55.8,2024-12-11 10:07:45.000,2024-12-11,2024,12,11,47702,[],()
79895,50435,21501,2,$17.5,18:44:27; 8-Jan-2025,,17.5,17.5,35.0,2025-01-08 18:44:27.000,2025-01-08,2025,1,8,50435,[],()
79741,48606,21608,1,53.5 $,2024-12-24;05:48,"Apt. 514 900 Stiedemann Land, Alyshamouth, PA 42279",53.5,53.5,53.5,2024-12-24 05:48:00.000,2024-12-24,2024,12,24,48606,[],()
80219,50379,21349,1,EUR 64.25,"16:33:56, 12/25/24",,77.1,77.1,77.1,2024-12-25 16:33:56.000,2024-12-25,2024,12,25,50379,[],()
77858,49770,21427,3,71.00USD,"16:21, 04/03/25","252 Calista Turnpike, Lake Hyeside, NE 15197-7975",71.0,71.0,213.0,2025-04-03 16:21:00.000,2025-04-03,2025,4,3,49770,[],()
86433,50675,21364,2,USD72.99,2024-09-22T03:49:21,NULL,72.99,72.99,145.98,2024-09-22 03:49:21.000,2024-09-22,2024,9,22,50675,[],()
78260,49626,21473,1,USD37.5,"02/24/24,04:09:57 A.M.",,37.5,37.5,37.5,2024-02-24 04:09:57.000,2024-02-24,2024,2,24,49626,[],()
79561,49384,21596,2,USD 36.99,2024-12-20 07:38,,36.99,36.99,73.98,2024-12-20 07:38:00.000,2024-12-20,2024,12,20,49384,[],()
77766,49082,21764,1,$ 47.0,"10-MAY-2025, 09:22",NULL,47.0,47.0,47.0,2025-05-10 09:22:00.000,2025-05-10,2025,5,10,49082,[],()
80386,49243,21314,1,70.USD,12:24:23 05/16/25,"Suite 778 4915 Reinger Meadow, O'Connerview, VA 76889",70.0,70.0,70.0,2025-05-16 12:24:23.000,2025-05-16,2025,5,16,49243,[],()
83077,51023,22039,1,63USD,2024-04-20 13:02:22,,63.0,63.0,63.0,2024-04-20 13:02:22.000,2024-04-20,2024,4,20,51023,[],()
83530,48922,21832,1,$34.99,"13-Aug-2024,22:19:27",NULL,34.99,34.99,34.99,2024-08-13 22:19:27.000,2024-08-13,2024,8,13,48922,[],()
84992,48001,21910,1,34.25 USD,2024-09-16T14:17:10,,34.25,34.25,34.25,2024-09-16 14:17:10.000,2024-09-16,2024,9,16,48001,[],()
82630,47688,21814,1,41.50 USD,05:33:33;2025-04-10,,41.5,41.5,41.5,2025-04-10 05:33:33.000,2025-04-10,2025,4,10,47688,[],()
81061,50299,21459,1,42.00 $," 2-March-2025, 20:07",NULL,42.0,42.0,42.0,2025-03-02 20:07:00.000,2025-03-02,2025,3,2,50299,[],()
80751,50812,21534,1,18.5EUR,17:34:29;2025-07-19,"Apt. 925 15138 Corkery Stream, Port Anton, CO 59649",22.2,22.2,22.2,2025-07-19 17:34:29.000,2025-07-19,2025,7,19,50812,[],()
83161,47775,21387,1,EUR49.5,2025-09-12T15:01:29,,59.4,59.4,59.4,2025-09-12 15:01:29.000,2025-09-12,2025,9,12,47775,[],()
82005,49528,21481,3,18.5 USD,"09/06/24,23:26",,18.5,18.5,55.5,2024-09-06 23:26:00.000,2024-09-06,2024,9,6,50790,[],()
78134,50547,21353,1,€ 25.50,07:40:19 P.M.;2025-04-11,,30.599999999999998,30.599999999999998,30.6,2025-04-11 19:40:19.000,2025-04-11,2025,4,11,50547,[],()
86211,50851,21727,3,17.0 USD,"09:58,10/18/24","23668 Herman Dam, South Ardentown, AL 89809-7132",17.0,17.0,51.0,2024-10-18 09:58:00.000,2024-10-18,2024,10,18,50851,[],()
83904,48517,21863,3,43.75$,2024-10-24T00:06:36.085,"333 Greenfelder Crescent, West Jefferson, NC 94144",43.75,43.75,131.25,2024-10-24 00:06:36.085,2024-10-24,2024,10,24,48517,[],()
82974,50592,21833,1,65.00$,04/01/25 16:13:37,,65.0,65.0,65.0,2025-04-01 16:13:37.000,2025-04-01,2025,4,1,50592,[],()
81337,48221,22027,1,$30¢75,03/22/25;10:03:51 P.M.,"4485 Dell Place, O'Haraborough, NV 06131-9713",3075.0,3075.0,3075.0,2025-03-22 22:03:51.000,2025-03-22,2025,3,22,48221,[],()
85599,49907,21748,1,25.99 $,2025-02-25T20:23:23,NULL,25.99,25.99,25.99,2025-02-25 20:23:23.000,2025-02-25,2025,2,25,49907,[],()
83049,50500,21752,1,$58.50,"03/22/25, 06:05:26",,58.5,58.5,58.5,2025-03-22 06:05:26.000,2025-03-22,2025,3,22,50500,[],()
82960,48245,21325,2,EUR 51.25,2024-07-15T10:45:33,"Suite 277 35615 Todd Roads, East Delmar, MI 61989-6595",61.5,61.5,123.0,2024-07-15 10:45:33.000,2024-07-15,2024,7,15,48245,[],()
79133,48521,21490,1,$ 65.50,21:57:29;08/30/24,,65.5,65.5,65.5,2024-08-30 21:57:29.000,2024-08-30,2024,8,30,48521,[],()
80634,48349,21548,1,€38¢99,12:02:00 am 14-JAN-2025,,4678.8,4678.8,4678.8,2025-01-14 00:02:00.000,2025-01-14,2025,1,14,48349,[],()
86382,48337,21646,5,75.50 $,"11:36:53,  6-APR-2025",,75.5,75.5,377.5,2025-04-06 11:36:53.000,2025-04-06,2025,4,6,48337,[],()
85089,50902,21831,1,EUR53.0,"05/02/25, 21:25:20",NULL,63.599999999999994,63.599999999999994,63.6,2025-05-02 21:25:20.000,2025-05-02,2025,5,2,50902,[],()
78195,48260,22012,3,$ 60.00,2024-06-21T12:12:43.193,NULL,60.0,60.0,180.0,2024-06-21 12:12:43.193,2024-06-21,2024,6,21,48260,[],()
83180,48350,21963,1,41.5EUR,01/02/25 21:39:27,"49762 Giuseppe Courts, Cristalland, IA 85246-6282",49.8,49.8,49.8,2025-01-02 21:39:27.000,2025-01-02,2025,1,2,48350,[],()
82265,50819,21709,2,USD51.5,"12/06/24, 01:19:26 pm","2390 Powlowski Highway, Jakubowskifort, OR 29800-5476",51.5,51.5,103.0,2024-12-06 13:19:26.000,2024-12-06,2024,12,6,50819,[],()
84144,49733,21308,1,37.5USD,04:34:56 2024-06-25,,37.5,37.5,37.5,2024-06-25 04:34:56.000,2024-06-25,2024,6,25,49733,[],()
84055,49374,21691,1,$ 15.5,10:06:50 A.M. 06/25/25,"550 Stacee Roads, Goldnerhaven, OR 40589",15.5,15.5,15.5,2025-06-25 10:06:50.000,2025-06-25,2025,6,25,49374,[],()
81572,47897,21768,2,20.25EUR,"10:22:47, 02/09/25",NULL,24.3,24.3,48.6,2025-02-09 10:22:47.000,2025-02-09,2025,2,9,47897,[],()
79557,48613,21945,1,17.5 €,2024-09-03T10:39:09,,21.0,21.0,21.0,2024-09-03 10:39:09.000,2024-09-03,2024,9,3,48613,[],()
83606,48711,21749,1,$71.50,04:03 02/11/25,,71.5,71.5,71.5,2025-02-11 04:03:00.000,2025-02-11,2025,2,11,48711,[],()
84869,49231,21389,2,53.00 USD, 4-Aug-2024;20:30:48,NULL,53.0,53.0,106.0,2024-08-04 20:30:48.000,2024-08-04,2024,8,4,49231,[],()
84798,51052,21794,1,USD 31.0,01/10/25 11:13:39,,31.0,31.0,31.0,2025-01-10 11:13:39.000,2025-01-10,2025,1,10,51052,[],()
81247,50058,21971,1,49.0 EUR,03:30:48 AM;2025-05-26,"Apt. 229 32718 Felipe Harbors, East Myleshaven, MI 15957",58.8,58.8,58.8,2025-05-26 03:30:48.000,2025-05-26,2025,5,26,50058,[],()
85878,48758,21539,1,€12.0,08:32:32 A.M. 2024-10-25,,14.399999999999999,14.399999999999999,14.4,2024-10-25 08:32:32.000,2024-10-25,2024,10,25,48758,[],()
80231,48557,22055,1,USD 53,2025-08-11T08:48:57.417,"Suite 344 5961 Kautzer Dale, North Salvatore, TN 79668",53.0,53.0,53.0,2025-08-11 08:48:57.417,2025-08-11,2025,8,11,48557,[],()
86390,50923,21816,2,71.99€,00:03;2024-12-13,NULL,86.38799999999999,86.38799999999999,172.78,2024-12-13 00:03:00.000,2024-12-13,2024,12,13,50923,[],()
78968,51055,21497,4,69.99 USD,04:19:01 A.M.;27-SEP-2024,,69.99,69.99,279.96,2024-09-27 04:19:01.000,2024-09-27,2024,9,27,51055,[],()
80884,49688,21885,1,€ 49.5,2024-07-31T21:48:04,,59.4,59.4,59.4,2024-07-31 21:48:04.000,2024-07-31,2024,7,31,49688,[],()
83450,51075,21820,2,35. USD,2025-08-15T18:23:40,,35.0,35.0,70.0,2025-08-15 18:23:40.000,2025-08-15,2025,8,15,51075,[],()
84148,50801,21808,1,57.99USD,"16:59:35,2025-04-30",,57.99,57.99,57.99,2025-04-30 16:59:35.000,2025-04-30,2025,4,30,50801,[],()
80793,49022,21424,2,USD66.00,"06:33:30,04/12/25","87229 Quincy Coves, Port Milagrosbury, CO 02421-6454",66.0,66.0,132.0,2025-04-12 06:33:30.000,2025-04-12,2025,4,12,49022,[],()
82111,47845,21494,1,EUR 63.0,"08/31/24, 12:28",,75.6,75.6,75.6,2024-08-31 12:28:00.000,2024-08-31,2024,8,31,47845,[],()
80295,48701,21835,1,€72¢00,"11:52:26, 07/20/24",,8640.0,8640.0,8640.0,2024-07-20 11:52:26.000,2024-07-20,2024,7,20,48701,[],()
83995,48108,21670,1,EUR 24.00,"07:57:59 AM,18-MAR-2025",NULL,28.799999999999997,28.799999999999997,28.8,2025-03-18 07:57:59.000,2025-03-18,2025,3,18,48108,[],()
84230,49198,21368,1,€42¢75,13:54;2024-11-11,"Apt. 178 666 Marcos Mission, West Rhiannonchester, OH 17104",5130.0,5130.0,5130.0,2024-11-11 13:54:00.000,2024-11-11,2024,11,11,49198,[],()
80326,48505,21452,1,EUR70.5,13:14:12;01/04/25,"5309 O'Conner Causeway, Port Rick, CO 67830-4107",84.6,84.6,84.6,2025-01-04 13:14:12.000,2025-01-04,2025,1,4,48505,[],()
81040,47987,21358,2,14.00 $,"21:14, 02/03/25","Apt. 159 7535 Margorie Port, Ziemanntown, ID 98090-5153",14.0,14.0,28.0,2025-02-03 21:14:00.000,2025-02-03,2025,2,3,47987,[],()
81462,48818,21489,1,23.00 $,2024-10-30T06:57:13,,23.0,23.0,23.0,2024-10-30 06:57:13.000,2024-10-30,2024,10,30,48818,[],()
84911,48953,21654,1,44. USD,Sat Feb  1 17:45:22 2025,NULL,44.0,44.0,44.0,2025-02-01 17:45:22.000,2025-02-01,2025,2,1,48953,[],()
82864,48118,21717,2,USD34.50,2025-01-20T18:52:12,,34.5,34.5,69.0,2025-01-20 18:52:12.000,2025-01-20,2025,1,20,48118,[],()
84109,48214,21553,1,40.5$,2024-11-03 11:46:41,,40.5,40.5,40.5,2024-11-03 11:46:41.000,2024-11-03,2024,11,3,48214,[],()
78773,48265,21868,1,65€00¢,"2025-04-24,06:54:58","666 Hauck Trace, Jonesland, MT 21700-5252",7800.0,7800.0,7800.0,2025-04-24 06:54:58.000,2025-04-24,2025,4,24,48265,[],()
85397,50181,21735,1,€30.0," 5-January-2025,20:55","690 Lowe Corner, New Geoffrey, KY 66652-6902",36.0,36.0,36.0,2025-01-05 20:55:00.000,2025-01-05,2025,1,5,50181,[],()
82369,50484,21344,1,$ 52.5,"2024-09-23, 10:00:13",,52.5,52.5,52.5,2024-09-23 10:00:13.000,2024-09-23,2024,9,23,50484,[],()
82073,48534,21524,1,USD 49.25,13:44:01 16-Mar-2025,NULL,49.25,49.25,49.25,2025-03-16 13:44:01.000,2025-03-16,2025,3,16,48534,[],()
84113,49583,21500,1,USD27.50,2025-01-05T20:56:36.615,"Apt. 805 8124 Wisoky Spurs, Lake Lisastad, KS 09879-5704",27.5,27.5,27.5,2025-01-05 20:56:36.615,2025-01-05,2025,1,5,49583,[],()
83203,49678,22056,1,USD23.5,07/07/24 12:12:36 AM,NULL,23.5,23.5,23.5,2024-07-07 00:12:36.000,2024-07-07,2024,7,7,49678,[],()
83889,48519,21719,1,60.99EUR,09:28:45 am 03/16/25,,73.188,73.188,73.19,2025-03-16 09:28:45.000,2025-03-16,2025,3,16,48519,[],()
83935,49168,21752,1,€58¢00,"03/15/25,20:11:00",NULL,6960.0,6960.0,6960.0,2025-03-15 20:11:00.000,2025-03-15,2025,3,15,49168,[],()
83549,48596,21690,3,42€25¢,2025-05-18T10:57:10.786,"Suite 387 48419 Florene Estate, Port Jeffereystad, SC 78228",5070.0,5070.0,15210.0,2025-05-18 10:57:10.786,2025-05-18,2025,5,18,48596,[],()
77790,50890,22051,2,29.75$,08/14/25 13:29:00,"156 Hegmann Gardens, North Tyrone, MS 08149-5777",29.75,29.75,59.5,2025-08-14 13:29:00.000,2025-08-14,2025,8,14,50890,[],()
83913,47860,21807,1,34.50USD,"2024-10-25, 23:24",,34.5,34.5,34.5,2024-10-25 23:24:00.000,2024-10-25,2024,10,25,47860,[],()
80123,48275,21823,2,61.00$,2025-03-26;09:13,"122 Carol Trafficway, Jazminestad, IL 39663",61.0,61.0,122.0,2025-03-26 09:13:00.000,2025-03-26,2025,3,26,48275,[],()
82122,47703,21879,3,€ 59.0,"05:23:25, 07/29/24","Suite 750 344 Pfannerstill Crescent, North Kamilahbury, WY 08675",70.8,70.8,212.4,2024-07-29 05:23:25.000,2024-07-29,2024,7,29,47703,[],()
80984,50102,21481,1,$ 21.00,"21:58:24,19-Sep-2024",,21.0,21.0,21.0,2024-09-19 21:58:24.000,2024-09-19,2024,9,19,50102,[],()
80492,50515,21351,1,35.50EUR,02:10;19-AUG-2025,"876 Tamera Junctions, Port Felipe, DE 46268",42.6,42.6,42.6,2025-08-19 02:10:00.000,2025-08-19,2025,8,19,50515,[],()
85101,48155,21961,4,27.50USD,18:40 06/25/25,NULL,27.5,27.5,110.0,2025-06-25 18:40:00.000,2025-06-25,2025,6,25,48155,[],()
83073,49759,21740,1,53.00 $,"23:22:16,  2-Dec-2024","75687 Ryan Street, Schaefertown, OR 38398",53.0,53.0,53.0,2024-12-02 23:22:16.000,2024-12-02,2024,12,2,49759,[],()
81763,49431,21508,1,USD 26.99,10:21:25 01/14/25,"43864 Jeramy Plains, South Anthonyburgh, CT 17313-4753",26.99,26.99,26.99,2025-01-14 10:21:25.000,2025-01-14,2025,1,14,49431,[],()
83289,50835,21400,1,44.99 $,2025-09-05T15:16:18.305,NULL,44.99,44.99,44.99,2025-09-05 15:16:18.305,2025-09-05,2025,9,5,50835,[],()
86331,47764,21383,2,USD 50.25,12/11/24;12:46:01 PM,NULL,50.25,50.25,100.5,2024-12-11 12:46:01.000,2024-12-11,2024,12,11,47764,[],()
79430,50692,22041,1,€38¢00,"25-Sep-2024,12:24:09 am",,4560.0,4560.0,4560.0,2024-09-25 00:24:09.000,2024-09-25,2024,9,25,50692,[],()
82147,49427,21816,2,67.00 EUR,"10:04:02 pm, 2024-09-18",,80.39999999999999,80.39999999999999,160.8,2024-09-18 22:04:02.000,2024-09-18,2024,9,18,49427,[],()
85929,48981,21921,1,62.50$,"10/22/24,10:42:27","Apt. 322 271 Buffy Tunnel, Schummville, SD 63853-5655",62.5,62.5,62.5,2024-10-22 10:42:27.000,2024-10-22,2024,10,22,48981,[],()
82768,48422,21521,3,48.5USD,16-May-2025 05:51,,48.5,48.5,145.5,2025-05-16 05:51:00.000,2025-05-16,2025,5,16,48422,[],()
85046,49002,21500,2,€28¢99,"2024-12-21,02:40:27",,3478.7999999999997,3478.7999999999997,6957.6,2024-12-21 02:40:27.000,2024-12-21,2024,12,21,49002,[],()
84806,50446,21872,2,40.0 $,"05:13:27 pm, 03/15/25","487 Lesch Knolls, Lindgrenport, MD 35045",40.0,40.0,80.0,2025-03-15 17:13:27.000,2025-03-15,2025,3,15,48268,[],()
84310,47914,21966,1,$ 24.50, 3-Mar-2025;02:22:41 AM,,24.5,24.5,24.5,2025-03-03 02:22:41.000,2025-03-03,2025,3,3,47914,[],()
86384,49636,21600,1,USD26.25,"01/18/25, 10:03","Suite 556 6812 Dickens Glen, Krystenbury, MT 42209-4917",26.25,26.25,26.25,2025-01-18 10:03:00.000,2025-01-18,2025,1,18,49636,[],()
79794,49438,21838,5,33.50EUR,10:11  1-May-2024,NULL,40.199999999999996,40.199999999999996,201.0,2024-05-01 10:11:00.000,2024-05-01,2024,5,1,49438,[],()
83645,49730,21620,1,33.99 USD,2025-03-17T10:45:44.907,,33.99,33.99,33.99,2025-03-17 10:45:44.907,2025-03-17,2025,3,17,49730,[],()
83219,48918,21791,5,$45.0,"03:56, 12-November-2024",,45.0,45.0,225.0,2024-11-12 03:56:00.000,2024-11-12,2024,11,12,48918,[],()
83110,50251,21854,1,59.5 €,08/04/24 01:53:42 pm,,71.39999999999999,71.39999999999999,71.4,2024-08-04 13:53:42.000,2024-08-04,2024,8,4,50251,[],()
79913,51059,21512,1,€70¢00,"11:53:25 PM,2024-11-03",,8400.0,8400.0,8400.0,2024-11-03 23:53:25.000,2024-11-03,2024,11,3,51059,[],()
86236,48195,21579,1,69$,03:50:41 05/17/25,,69.0,69.0,69.0,2025-05-17 03:50:41.000,2025-05-17,2025,5,17,48195,[],()
82721,50628,22008,1,68.99$,02:54:42 2024-08-18,NULL,68.99,68.99,68.99,2024-08-18 02:54:42.000,2024-08-18,2024,8,18,50628,[],()
81444,50172,21836,1,46.25 $,"09/14/24,20:10","Apt. 559 683 Shalanda Run, Laurynbury, MD 53143",46.25,46.25,46.25,2024-09-14 20:10:00.000,2024-09-14,2024,9,14,50172,[],()
83866,49224,21495,2,$52.25, 1-July-2025 10:45,,52.25,52.25,104.5,2025-07-01 10:45:00.000,2025-07-01,2025,7,1,49224,[],()
77924,48257,21796,2,33.0 $,03:05:17 P.M. 2025-02-28,,33.0,33.0,66.0,2025-02-28 15:05:17.000,2025-02-28,2025,2,28,48257,[],()
83438,48483,21956,1,USD23.00,"20:52:18, 11/23/24",NULL,23.0,23.0,23.0,2024-11-23 20:52:18.000,2024-11-23,2024,11,23,48483,[],()
80724,48640,21348,1,USD 18.25,"23-Jun-2024, 15:50",NULL,18.25,18.25,18.25,2024-06-23 15:50:00.000,2024-06-23,2024,6,23,48640,[],()
83899,48717,21894,4,47.0 €,22.03.2025 19:50:50,NULL,56.4,56.4,225.6,2025-03-22 19:50:50.000,2025-03-22,2025,3,22,48717,[],()
85500,50530,21919,1,60.50$,2024-11-13T02:37:32.826,,60.5,60.5,60.5,2024-11-13 02:37:32.826,2024-11-13,2024,11,13,50530,[],()
79046,50892,22024,2,69.5USD,2024-10-07T20:47:40,,69.5,69.5,139.0,2024-10-07 20:47:40.000,2024-10-07,2024,10,7,50892,[],()
85463,47985,21715,2,35.75$,2024-04-10T14:55:28,,35.75,35.75,71.5,2024-04-10 14:55:28.000,2024-04-10,2024,4,10,47985,[],()
80630,49342,22042,1,53$50¢,"01:17:01 AM, 2024-09-10",NULL,5350.0,5350.0,5350.0,2024-09-10 01:17:01.000,2024-09-10,2024,9,10,49342,[],()
77751,49183,21916,5,EUR19.0,"16-Oct-2024,04:00:47 PM",,22.8,22.8,114.0,2024-10-16 16:00:47.000,2024-10-16,2024,10,16,49183,[],()
78979,48445,21429,1,$27.75,17:23:04 2024-10-01,"48112 Kutch Parks, Shandihaven, IN 26269-8180",27.75,27.75,27.75,2024-10-01 17:23:04.000,2024-10-01,2024,10,1,48445,[],()
86209,48022,21895,1,EUR 13.50,"20:58,  9-Mar-2025",NULL,16.2,16.2,16.2,2025-03-09 20:58:00.000,2025-03-09,2025,3,9,48022,[],()
81928,50690,21867,1,56. $,10.10.2024 09:23:23,,56.0,56.0,56.0,2024-10-10 09:23:23.000,2024-10-10,2024,10,10,50690,[],()
78508,50712,21415,1,58.0 USD,"17-Jul-2024,07:52:17 AM","634 Batz Camp, Feeneyfort, DE 42785-8019",58.0,58.0,58.0,2024-07-17 07:52:17.000,2024-07-17,2024,7,17,50712,[],()
85277,48173,21961,1,USD27.99,"12:01:48 A.M.,24-Feb-2025",NULL,27.99,27.99,27.99,2025-02-24 00:01:48.000,2025-02-24,2025,2,24,48173,[],()
77688,50523,21686,1,19.5 EUR,"26-Sep-2024,05:00:59 A.M.",,23.4,23.4,23.4,2024-09-26 05:00:59.000,2024-09-26,2024,9,26,50523,[],()
79220,48832,21439,1,€36¢25,16-Jan-2025;23:38,"Apt. 355 3790 Graham Burgs, North Cedricmouth, CA 83909-7628",4350.0,4350.0,4350.0,2025-01-16 23:38:00.000,2025-01-16,2025,1,16,48832,[],()
79015,50392,21866,1,USD40.00,2025-04-20T19:47:37,,40.0,40.0,40.0,2025-04-20 19:47:37.000,2025-04-20,2025,4,20,50392,[],()
79419,49198,22025,3,58.75USD," 3-Apr-2025,08:43:57 PM","Apt. 178 666 Marcos Mission, West Rhiannonchester, OH 17104",58.75,58.75,176.25,2025-04-03 20:43:57.000,2025-04-03,2025,4,3,49198,[],()
83368,48995,21479,1,61.00 USD,06:38 12/20/24,,61.0,61.0,61.0,2024-12-20 06:38:00.000,2024-12-20,2024,12,20,48995,[],()
84929,48322,21891,1,67€,2024-10-22T10:21:23,NULL,80.39999999999999,80.39999999999999,80.4,2024-10-22 10:21:23.000,2024-10-22,2024,10,22,48322,[],()
85051,50779,21521,1,€51¢00,10:34:50;2024-04-02,,6120.0,6120.0,6120.0,2024-04-02 10:34:50.000,2024-04-02,2024,4,2,50779,[],()
86276,50974,21678,5,73.5USD," 2-Mar-2025, 01:59:44 P.M.",,73.5,73.5,367.5,2025-03-02 13:59:44.000,2025-03-02,2025,3,2,50974,[],()
80456,47723,21369,1,$36.0,"08:47:09 P.M., 6-Aug-2024",,36.0,36.0,36.0,2024-08-06 20:47:09.000,2024-08-06,2024,8,6,47723,[],()
80667,49680,21447,1,USD 49.0,02/09/25 01:19:15 pm,NULL,49.0,49.0,49.0,2025-02-09 13:19:15.000,2025-02-09,2025,2,9,49680,[],()
86434,50098,21727,4,$ 15.,"01/11/25,17:09",NULL,15.0,15.0,60.0,2025-01-11 17:09:00.000,2025-01-11,2025,1,11,50098,[],()
83556,47670,22023,2,18.50 $,"13:15, 08/17/24","764 Frami Coves, North Ezekiel, VT 93063",18.5,18.5,37.0,2024-08-17 13:15:00.000,2024-08-17,2024,8,17,47670,[],()
85670,51038,21827,4,$16¢99,"11:08:22 P.M.,23-OCT-2024",,1699.0,1699.0,6796.0,2024-10-23 23:08:22.000,2024-10-23,2024,10,23,51038,[],()
78891,48752,21849,3,34.50 EUR, 7-JUL-2024 05:22:41 PM,,41.4,41.4,124.2,2024-07-07 17:22:41.000,2024-07-07,2024,7,7,48752,[],()
81153,50436,21378,1,36 USD,2024-05-01T03:23:25.311,"970 Tristan Motorway, Sidneybury, LA 76853",36.0,36.0,36.0,2024-05-01 03:23:25.311,2024-05-01,2024,5,1,50436,[],()
81410,47836,21555,1,USD 44.75,2024-09-08T15:37:27,,44.75,44.75,44.75,2024-09-08 15:37:27.000,2024-09-08,2024,9,8,47836,[],()
83141,51121,21377,1,EUR53.75,02:59:18;24-Jul-2025,NULL,64.5,64.5,64.5,2025-07-24 02:59:18.000,2025-07-24,2025,7,24,51121,[],()
79797,50437,21348,1,20.99USD,"10:56:48 am, 2024-11-12",,20.99,20.99,20.99,2024-11-12 10:56:48.000,2024-11-12,2024,11,12,50437,[],()
85280,50850,21900,4,USD72.5,"16:04, 06/19/24","348 Smith Extensions, New Catrice, HI 56757",72.5,72.5,290.0,2024-06-19 16:04:00.000,2024-06-19,2024,6,19,50850,[],()
78213,50558,21413,2,EUR 39.99,"08:08:09 AM,2025-06-06","71702 Schinner Orchard, Arronfort, CO 90435-3072",47.988,47.988,95.98,2025-06-06 08:08:09.000,2025-06-06,2025,6,6,50558,[],()
82707,50890,21515,1,47.5EUR,2024-11-02;11:00:10 A.M.,"156 Hegmann Gardens, North Tyrone, MS 08149-5777",57.0,57.0,57.0,2024-11-02 11:00:10.000,2024-11-02,2024,11,2,50890,[],()
78535,48997,21861,1,38.5 $,11-October-2024;18:25,,38.5,38.5,38.5,2024-10-11 18:25:00.000,2024-10-11,2024,10,11,50159,[],()
84748,50792,21382,2,EUR 53.0,2025-06-20T11:24:35,,63.599999999999994,63.599999999999994,127.2,2025-06-20 11:24:35.000,2025-06-20,2025,6,20,50792,[],()
82054,48282,21603,2,EUR 51.75,2025-06-16T10:37:11,"Apt. 912 743 Marcelo Island, Port Carina, ND 04495-0917",62.099999999999994,62.099999999999994,124.2,2025-06-16 10:37:11.000,2025-06-16,2025,6,16,48282,[],()
85510,49711,21414,1,49.25EUR,"05:00, 2025-07-21",,59.099999999999994,59.099999999999994,59.1,2025-07-21 05:00:00.000,2025-07-21,2025,7,21,49711,[],()
84513,49855,21564,1,EUR 76.50,"14:02, 2024-12-11",,91.8,91.8,91.8,2024-12-11 14:02:00.000,2024-12-11,2024,12,11,49855,[],()
86218,47890,21496,1,66.75€,09:44;2025-01-10,,80.1,80.1,80.1,2025-01-10 09:44:00.000,2025-01-10,2025,1,10,47890,[],()
84404,48699,21332,4,16.75 USD,23:50:57;10/31/24,NULL,16.75,16.75,67.0,2024-10-31 23:50:57.000,2024-10-31,2024,10,31,48699,[],()
82548,49897,21629,1,€46,2025-01-25;11:43,NULL,55.199999999999996,55.199999999999996,55.2,2025-01-25 11:43:00.000,2025-01-25,2025,1,25,49897,[],()
84014,50233,21966,1,27.0$,"11:52:07,2025-06-18",,27.0,27.0,27.0,2025-06-18 11:52:07.000,2025-06-18,2025,6,18,50233,[],()
81545,49672,21921,1,58.00USD,11:07:56 pm;2025-04-03,,58.0,58.0,58.0,2025-04-03 23:07:56.000,2025-04-03,2025,4,3,49672,[],()
81986,48334,21434,1,USD 26,10/28/24 21:43,,26.0,26.0,26.0,2024-10-28 21:43:00.000,2024-10-28,2024,10,28,48334,[],()
82976,48661,21561,1,EUR65.0,22:42 10/22/24,"Apt. 669 880 Carroll Light, Port Marquischester, HI 77735-1406",78.0,78.0,78.0,2024-10-22 22:42:00.000,2024-10-22,2024,10,22,48661,[],()
82289,49776,21939,1,36.00 USD,2024-11-14T15:06:51,NULL,36.0,36.0,36.0,2024-11-14 15:06:51.000,2024-11-14,2024,11,14,49776,[],()
81034,49801,21302,2,22$75¢,"03:42:28 AM,23-APR-2025",,2275.0,2275.0,4550.0,2025-04-23 03:42:28.000,2025-04-23,2025,4,23,49801,[],()
82918,47938,21697,1,EUR64.00,"03/19/25,05:42:44 PM","Apt. 632 25563 Herb Street, East Linnie, GA 04626",76.8,76.8,76.8,2025-03-19 17:42:44.000,2025-03-19,2025,3,19,47938,[],()
81653,48924,21710,3,74.25 $,17:35:13;19-Jul-2024,,74.25,74.25,222.75,2024-07-19 17:35:13.000,2024-07-19,2024,7,19,48924,[],()
85049,47860,21953,2,43.99€,04:58;04/25/24,NULL,52.788000000000004,52.788000000000004,105.58,2024-04-25 04:58:00.000,2024-04-25,2024,4,25,47860,[],()
82483,48815,21567,2,USD 62,"08:36, 2024-07-30",,62.0,62.0,124.0,2024-07-30 08:36:00.000,2024-07-30,2024,7,30,48815,[],()
83548,51076,21519,1,$47.5,10/09/24 11:17,,47.5,47.5,47.5,2024-10-09 11:17:00.000,2024-10-09,2024,10,9,51076,[],()
79356,50880,21686,1,USD 18.,2025-03-17T21:42:07,NULL,18.0,18.0,18.0,2025-03-17 21:42:07.000,2025-03-17,2025,3,17,50880,[],()
77653,49644,22036,1,€ 49.5,07:26;2024-09-29,"Suite 728 23825 Ward Roads, East Theodora, MN 30660",59.4,59.4,59.4,2024-09-29 07:26:00.000,2024-09-29,2024,9,29,49644,[],()
85517,47724,21810,2,USD 55.0,"01:36:05 A.M., 22-FEB-2025",,55.0,55.0,110.0,2025-02-22 01:36:05.000,2025-02-22,2025,2,22,47724,[],()
77740,48698,21737,1,22$,12-Oct-2024 11:43:32 pm,"Suite 298 8534 Corwin Junctions, Parkershire, UT 52490",22.0,22.0,22.0,2024-10-12 23:43:32.000,2024-10-12,2024,10,12,50261,[],()
83050,48041,21471,1,25.0€,17:01;05/30/24,,30.0,30.0,30.0,2024-05-30 17:01:00.000,2024-05-30,2024,5,30,48041,[],()
85550,49163,21684,5,USD59.5,"08:45:30 PM, 11/12/24",NULL,59.5,59.5,297.5,2024-11-12 20:45:30.000,2024-11-12,2024,11,12,49163,[],()
82639,48020,21696,1,43.25 $,2025-04-12T08:11:43.895,NULL,43.25,43.25,43.25,2025-04-12 08:11:43.895,2025-04-12,2025,4,12,48020,[],()
80401,49282,21501,1,16.25USD,28-Dec-2024;08:27:56 pm,NULL,16.25,16.25,16.25,2024-12-28 20:27:56.000,2024-12-28,2024,12,28,50280,[],()
84385,48722,22034,1,73.25USD,"2024-09-10,18:20:52",NULL,73.25,73.25,73.25,2024-09-10 18:20:52.000,2024-09-10,2024,9,10,48722,[],()
79169,49556,21587,4,68.0$,2024-12-24T08:54:28,,68.0,68.0,272.0,2024-12-24 08:54:28.000,2024-12-24,2024,12,24,49556,[],()
78679,48748,21871,1,$29¢99,2024-11-07T00:40:33.727,,2999.0,2999.0,2999.0,2024-11-07 00:40:33.727,2024-11-07,2024,11,7,48748,[],()
81807,48215,21777,1,$ 31.75,08:41:38 PM;01/06/25,NULL,31.75,31.75,31.75,2025-01-06 20:41:38.000,2025-01-06,2025,1,6,48215,[],()
81880,49112,21457,3,25.00$," 4-September-2024, 04:03:30 am",NULL,25.0,25.0,75.0,2024-09-04 04:03:30.000,2024-09-04,2024,9,4,49112,[],()
77964,50699,21870,3,EUR65.99,Mon Jan 20 17:05:52 2025,NULL,79.18799999999999,79.18799999999999,237.56,2025-01-20 17:05:52.000,2025-01-20,2025,1,20,50699,[],()
82011,49964,21496,1,$70¢25,2024-10-29T09:07:29,NULL,7025.0,7025.0,7025.0,2024-10-29 09:07:29.000,2024-10-29,2024,10,29,49964,[],()
85720,50866,22003,3,60.99USD,17:38:24 05/29/25,,60.99,60.99,182.97,2025-05-29 17:38:24.000,2025-05-29,2025,5,29,49215,[],()
81764,50939,21584,2,$41¢00,"09:20:22 PM, 2024-09-21",NULL,4100.0,4100.0,8200.0,2024-09-21 21:20:22.000,2024-09-21,2024,9,21,50939,[],()
79498,49975,21589,1,63€75¢,2024-04-13T11:24:16.437,"Suite 340 6149 Edmund Terrace, Breitenbergtown, MA 91618-6864",7650.0,7650.0,7650.0,2024-04-13 11:24:16.437,2024-04-13,2024,4,13,49975,[],()
79075,47742,21485,2,49.00$,31.08.2024 08:58:58,,49.0,49.0,98.0,2024-08-31 08:58:58.000,2024-08-31,2024,8,31,47742,[],()
79059,48598,21691,1,€18¢50,2024-10-28;06:18:05 PM,NULL,2220.0,2220.0,2220.0,2024-10-28 18:18:05.000,2024-10-28,2024,10,28,48598,[],()
82901,49476,21491,2,29.00€,"2024-11-25, 03:45",,34.8,34.8,69.6,2024-11-25 03:45:00.000,2024-11-25,2024,11,25,49476,[],()
80245,50891,21503,1,$ 19.00,08/23/24 19:29:49,NULL,19.0,19.0,19.0,2024-08-23 19:29:49.000,2024-08-23,2024,8,23,50891,[],()
78947,49113,21696,2,38.0 USD,2024-09-29;11:41:12 am,NULL,38.0,38.0,76.0,2024-09-29 11:41:12.000,2024-09-29,2024,9,29,49113,[],()
80790,49940,21515,1,€49¢99,29-Apr-2024;09:32,,5998.8,5998.8,5998.8,2024-04-29 09:32:00.000,2024-04-29,2024,4,29,49940,[],()
78370,49544,21799,1,€31¢25,10/13/24;12:57,"Apt. 544 3741 Swift Dam, South Geniechester, LA 52147-8517",3750.0,3750.0,3750.0,2024-10-13 12:57:00.000,2024-10-13,2024,10,13,49544,[],()
80249,48310,21417,1,USD63.75,23:35:38 02/22/25,,63.75,63.75,63.75,2025-02-22 23:35:38.000,2025-02-22,2025,2,22,48310,[],()
83182,48402,21613,1,$53.0,01/31/25 22:56:19,,53.0,53.0,53.0,2025-01-31 22:56:19.000,2025-01-31,2025,1,31,48402,[],()
77666,50741,21720,3,27.50$,"03/31/25,08:28:10 AM",NULL,27.5,27.5,82.5,2025-03-31 08:28:10.000,2025-03-31,2025,3,31,50741,[],()
84672,50863,22011,1,73.50 USD,07:12:12 A.M.;2025-06-04,NULL,73.5,73.5,73.5,2025-06-04 07:12:12.000,2025-06-04,2025,6,4,50863,[],()
82606,49103,21477,1,20.25 €,22:31 03/09/25,,24.3,24.3,24.3,2025-03-09 22:31:00.000,2025-03-09,2025,3,9,49103,[],()
84612,50923,21977,1,22.25 EUR,"11/17/24,22:12:29",NULL,26.7,26.7,26.7,2024-11-17 22:12:29.000,2024-11-17,2024,11,17,50923,[],()
80824,48289,22056,1,18.99USD,"23:29,11-October-2024",,18.99,18.99,18.99,2024-10-11 23:29:00.000,2024-10-11,2024,10,11,48289,[],()
82528,50949,21454,1,USD 25.00,2024-05-23T07:15:52.877,"9780 Connelly Valleys, South Jonathonborough, NY 59721",25.0,25.0,25.0,2024-05-23 07:15:52.877,2024-05-23,2024,5,23,50949,[],()
77614,49927,21695,2,75.25$,22:21:11 03/25/25,,75.25,75.25,150.5,2025-03-25 22:21:11.000,2025-03-25,2025,3,25,49927,[],()
80195,48930,21689,1,16$,04:45:09 AM;15-May-2024,"Suite 970 2868 Cruickshank Summit, Hammesview, MI 06535-1724",16.0,16.0,16.0,2024-05-15 04:45:09.000,2024-05-15,2024,5,15,48930,[],()
80703,50663,21917,2,$ 63.,19:45;11/14/24,,63.0,63.0,126.0,2024-11-14 19:45:00.000,2024-11-14,2024,11,14,50663,[],()
78518,48242,21837,4,60.5 USD,2025-01-31 23:00,"4049 Rohan Springs, Biancastad, ME 84568-0051",60.5,60.5,242.0,2025-01-31 23:00:00.000,2025-01-31,2025,1,31,48242,[],()
83543,50323,21570,2,31.99 USD,2024-09-06T18:38:58.190,NULL,31.99,31.99,63.98,2024-09-06 18:38:58.190,2024-09-06,2024,9,6,50323,[],()
85868,47969,21808,1,USD59.0,14-Jan-2025;11:16:09 P.M.,,59.0,59.0,59.0,2025-01-14 23:16:09.000,2025-01-14,2025,1,14,47969,[],()
79210,48943,22016,1,51.50$,2024-11-07T00:58:06,,51.5,51.5,51.5,2024-11-07 00:58:06.000,2024-11-07,2024,11,7,48943,[],()
79161,50867,21432,1,$38.99,08/31/25 10:06:31 am,,38.99,38.99,38.99,2025-08-31 10:06:31.000,2025-08-31,2025,8,31,50867,[],()
84919,50471,21705,1,61.99USD,"19:05, 10/17/24",,61.99,61.99,61.99,2024-10-17 19:05:00.000,2024-10-17,2024,10,17,50471,[],()
81512,49828,21568,3,$ 25.99,2024-10-01 02:18:15 P.M.,,25.99,25.99,77.97,2024-10-01 14:18:15.000,2024-10-01,2024,10,1,49828,[],()
85819,48863,21312,1,38.75$,07:09:02 PM;15-AUG-2024,"Apt. 596 8120 Senger Underpass, Joyaport, AZ 44788-4814",38.75,38.75,38.75,2024-08-15 19:09:02.000,2024-08-15,2024,8,15,48216,[],()
83370,49361,21358,1,18.5USD,"12:47:34 PM,  9-Jun-2025",,18.5,18.5,18.5,2025-06-09 12:47:34.000,2025-06-09,2025,6,9,49361,[],()
80901,49755,21982,2,USD 41.50,2025-02-04T23:35:04,,41.5,41.5,83.0,2025-02-04 23:35:04.000,2025-02-04,2025,2,4,49755,[],()
83513,50467,21821,1,65.25 €,"2024-06-17,03:48:03 P.M.",NULL,78.3,78.3,78.3,2024-06-17 15:48:03.000,2024-06-17,2024,6,17,50467,[],()
81740,48982,21956,1,24.00 €,"20:37:41, 2024-11-01","78629 Takako Mountains, Carmelitashire, AR 63374-5019",28.799999999999997,28.799999999999997,28.8,2024-11-01 20:37:41.000,2024-11-01,2024,11,1,48492,[],()
82189,48365,21985,1,19.25 $,12/12/24;12:26:09 am,NULL,19.25,19.25,19.25,2024-12-12 00:26:09.000,2024-12-12,2024,12,12,48365,[],()
79159,48662,21956,1,24.99EUR,03:20:39 am;2025-01-10,"8549 Hoppe Unions, Port Geneborough, IN 78613",29.987999999999996,29.987999999999996,29.99,2025-01-10 03:20:39.000,2025-01-10,2025,1,10,48662,[],()
81481,48914,21674,1,20.99 USD, 2-Mar-2025 15:56:12,"Apt. 967 411 Jakubowski Lodge, Lorettafurt, TN 91831-7324",20.99,20.99,20.99,2025-03-02 15:56:12.000,2025-03-02,2025,3,2,48914,[],()
85099,50881,21872,2,36.99USD,"08/04/25,07:31:43 AM",,36.99,36.99,73.98,2025-08-04 07:31:43.000,2025-08-04,2025,8,4,50881,[],()
77676,48340,21336,1,72.25€,05/31/25;01:51:03 PM,NULL,86.7,86.7,86.7,2025-05-31 13:51:03.000,2025-05-31,2025,5,31,48340,[],()
86330,48921,21629,1,41.25$,10:56 2024-10-29,,41.25,41.25,41.25,2024-10-29 10:56:00.000,2024-10-29,2024,10,29,48921,[],()
84822,47664,22038,1,USD34.5,2024-12-17;16:43:15,,34.5,34.5,34.5,2024-12-17 16:43:15.000,2024-12-17,2024,12,17,47664,[],()
77599,49022,21601,1,EUR55.0,"2025-01-11, 12:20:36",,66.0,66.0,66.0,2025-01-11 12:20:36.000,2025-01-11,2025,1,11,49022,[],()
81306,49320,21784,1,USD63.50,2024-11-01T12:16:06.298,,63.5,63.5,63.5,2024-11-01 12:16:06.298,2024-11-01,2024,11,1,49320,[],()
79768,48627,22011,3,75.25EUR,"12-January-2025,06:03:54 PM","8643 Nicolas Plaza, East Pathaven, VT 45180",90.3,90.3,270.9,2025-01-12 18:03:54.000,2025-01-12,2025,1,12,48627,[],()
86174,47826,21764,1,$52.75,"04/06/25,19:20:00",NULL,52.75,52.75,52.75,2025-04-06 19:20:00.000,2025-04-06,2025,4,6,47826,[],()
84346,50848,21311,1,18.00USD,02/06/25;16:20:06,,18.0,18.0,18.0,2025-02-06 16:20:06.000,2025-02-06,2025,2,6,50848,[],()
84376,50014,21752,2,59.99$,14:47 07/09/24,"7575 Aurelio Creek, West Beatris, OH 18515",59.99,59.99,119.98,2024-07-09 14:47:00.000,2024-07-09,2024,7,9,50014,[],()
84434,49600,21600,1,26.75 $,09:15:25 am;13-OCT-2024,,26.75,26.75,26.75,2024-10-13 09:15:25.000,2024-10-13,2024,10,13,49600,[],()
80389,49157,22033,3,USD49.99,08/14/24 14:17:19,"Apt. 559 37960 Boehm Pines, New Ola, UT 11673",49.99,49.99,149.97,2024-08-14 14:17:19.000,2024-08-14,2024,8,14,49157,[],()
86397,47666,21960,1,USD 59.5,"04:11:30 PM, 2025-08-10",NULL,59.5,59.5,59.5,2025-08-10 16:11:30.000,2025-08-10,2025,8,10,50303,[],()
85999,48526,21865,1,$70,"19:09,04/08/25",,70.0,70.0,70.0,2025-04-08 19:09:00.000,2025-04-08,2025,4,8,48526,[],()
82862,48385,21977,2,USD25.00,2024-11-19T03:11:00,NULL,25.0,25.0,50.0,2024-11-19 03:11:00.000,2024-11-19,2024,11,19,48385,[],()
79524,50935,21749,1,USD 71.75,2025-02-16T14:15:08.878,,71.75,71.75,71.75,2025-02-16 14:15:08.878,2025-02-16,2025,2,16,50935,[],()
80622,48912,22056,2,$22.00,15-Dec-2024 07:30:07,,22.0,22.0,44.0,2024-12-15 07:30:07.000,2024-12-15,2024,12,15,48912,[],()
81790,48391,21334,1,$65.00,"11:41, 2024-08-15",NULL,65.0,65.0,65.0,2024-08-15 11:41:00.000,2024-08-15,2024,8,15,48391,[],()
78252,50710,22046,5,€60¢50,2024-06-27T09:00:05,"Apt. 419 5059 Sachiko Loop, East Norberttown, AR 13282",7260.0,7260.0,36300.0,2024-06-27 09:00:05.000,2024-06-27,2024,6,27,50710,[],()
85680,49794,21580,1,€67¢00,09:50:51;2025-01-12,NULL,8040.0,8040.0,8040.0,2025-01-12 09:50:51.000,2025-01-12,2025,1,12,49794,[],()
82163,48986,21573,1,28.00$,08:04;2025-04-03,NULL,28.0,28.0,28.0,2025-04-03 08:04:00.000,2025-04-03,2025,4,3,48986,[],()
80589,48079,21597,1,$ 67.00,"03/11/25,04:22",NULL,67.0,67.0,67.0,2025-03-11 04:22:00.000,2025-03-11,2025,3,11,48079,[],()
80354,47789,21551,1,$ 18.75,"05:52:08 A.M., 26-APR-2025",,18.75,18.75,18.75,2025-04-26 05:52:08.000,2025-04-26,2025,4,26,47789,[],()
85569,49805,21481,2,19.99 EUR,2024-11-04 12:26,,23.987999999999996,23.987999999999996,47.98,2024-11-04 12:26:00.000,2024-11-04,2024,11,4,49805,[],()
81559,48970,21951,1,35.25$,12.04.2025 19:20:20,,35.25,35.25,35.25,2025-12-04 19:20:20.000,2025-12-04,2025,12,4,48970,[],()
84441,50828,21948,3,62$99¢,Sat Apr 19 03:00:21 2025,NULL,6299.0,6299.0,18897.0,2025-04-19 03:00:21.000,2025-04-19,2025,4,19,50828,[],()
85120,49859,21791,2,USD 48,09.11.2024 06:50:50,,48.0,48.0,96.0,2024-09-11 06:50:50.000,2024-09-11,2024,9,11,49859,[],()
81668,49211,21626,1,35.0 EUR,2024-07-18T03:39:50.239,NULL,42.0,42.0,42.0,2024-07-18 03:39:50.239,2024-07-18,2024,7,18,49211,[],()
81160,48026,21406,2,68.99$,09:02 01/25/25,,68.99,68.99,137.98,2025-01-25 09:02:00.000,2025-01-25,2025,1,25,48026,[],()
82363,49517,21959,3,70.99 EUR,25-JAN-2025 18:44:55,,85.18799999999999,85.18799999999999,255.56,2025-01-25 18:44:55.000,2025-01-25,2025,1,25,49517,[],()
78969,49417,21483,1,USD54.25,2024-08-07;21:25,NULL,54.25,54.25,54.25,2024-08-07 21:25:00.000,2024-08-07,2024,8,7,49417,[],()
84203,48224,21902,2,19$75¢,2024-11-08T00:46:04,NULL,1975.0,1975.0,3950.0,2024-11-08 00:46:04.000,2024-11-08,2024,11,8,48224,[],()
83733,47951,21826,2,46.0USD,2024-06-16 07:26:26 AM,,46.0,46.0,92.0,2024-06-16 07:26:26.000,2024-06-16,2024,6,16,47951,[],()
79123,50625,21525,3,35.00 $,"24-May-2025, 03:22",NULL,35.0,35.0,105.0,2025-05-24 03:22:00.000,2025-05-24,2025,5,24,50625,[],()
79891,48502,21524,1,USD46.50,"11/10/24,10:04:09 PM",,46.5,46.5,46.5,2024-11-10 22:04:09.000,2024-11-10,2024,11,10,48502,[],()
82944,50048,21721,1,54.99 $,2024-09-16 10:10,,54.99,54.99,54.99,2024-09-16 10:10:00.000,2024-09-16,2024,9,16,50048,[],()
78923,50753,21461,2,75.5 USD,25-Aug-2025;04:34:34,NULL,75.5,75.5,151.0,2025-08-25 04:34:34.000,2025-08-25,2025,8,25,50753,[],()
82834,48046,21524,3,47.00 $,"16-September-2024,00:46:27",,47.0,47.0,141.0,2024-09-16 00:46:27.000,2024-09-16,2024,9,16,48046,[],()
78837,50113,21742,1,$35.50,"05/05/25,14:05","Suite 948 34829 Junko Forges, Port Wm, OR 73584",35.5,35.5,35.5,2025-05-05 14:05:00.000,2025-05-05,2025,5,5,50113,[],()
81691,50211,21929,1,56.25 $," 3-November-2024,07:09:55 A.M.",NULL,56.25,56.25,56.25,2024-11-03 07:09:55.000,2024-11-03,2024,11,3,50211,[],()
86090,49724,21548,1,39.50 USD,07:19 2024-07-28,,39.5,39.5,39.5,2024-07-28 07:19:00.000,2024-07-28,2024,7,28,49724,[],()
82434,49487,21692,3,USD69.25,2024-09-05T12:38:24,"8525 Mitchel Points, North Adamborough, WY 43584-9505",69.25,69.25,207.75,2024-09-05 12:38:24.000,2024-09-05,2024,9,5,49487,[],()
81449,49541,21349,1,$67.25,"05:16:39 am,09/17/24",,67.25,67.25,67.25,2024-09-17 05:16:39.000,2024-09-17,2024,9,17,49541,[],()
82912,50734,22021,1,USD 20.,2025-01-28T09:59:16,,20.0,20.0,20.0,2025-01-28 09:59:16.000,2025-01-28,2025,1,28,50734,[],()
80657,50816,21551,1,20.75 €,06:08;2024-09-13,NULL,24.9,24.9,24.9,2024-09-13 06:08:00.000,2024-09-13,2024,9,13,50816,[],()
85409,50217,21915,1,33.99 €,"12:12:32 PM,08/04/24",NULL,40.788000000000004,40.788000000000004,40.79,2024-08-04 12:12:32.000,2024-08-04,2024,8,4,50217,[],()
83650,49740,21493,1,€28.99,"01/21/25, 16:47:04",NULL,34.788,34.788,34.79,2025-01-21 16:47:04.000,2025-01-21,2025,1,21,49740,[],()
83376,48133,21669,1,USD 23.00,23:58;2024-12-30,"Suite 945 16813 Emmerich Coves, Lake Edgar, NV 50064",23.0,23.0,23.0,2024-12-30 23:58:00.000,2024-12-30,2024,12,30,48133,[],()
84447,49816,21877,3,USD 71.25,"2025-01-03,00:16:22","Suite 200 5036 Howard Island, West Christopher, VA 47896",71.25,71.25,213.75,2025-01-03 00:16:22.000,2025-01-03,2025,1,3,49816,[],()
79230,49906,21751,1,69.75EUR,2024-10-12T13:32:56.809,"Apt. 524 508 Gary Rapid, Dickensborough, CA 18647",83.7,83.7,83.7,2024-10-12 13:32:56.809,2024-10-12,2024,10,12,49906,[],()
85957,50144,21415,2,62.00$,01:01;10/12/24,,62.0,62.0,124.0,2024-10-12 01:01:00.000,2024-10-12,2024,10,12,50144,[],()
82097,48623,21418,2,31€99¢,"29-Oct-2024, 18:06:28",,3838.7999999999997,3838.7999999999997,7677.6,2024-10-29 18:06:28.000,2024-10-29,2024,10,29,48623,[],()
81643,50744,21582,1,€63.,"07/12/24,03:17",,75.6,75.6,75.6,2024-07-12 03:17:00.000,2024-07-12,2024,7,12,50744,[],()
80114,50928,21659,2,33.99USD, 2-Sep-2024;09:17:07 A.M.,NULL,33.99,33.99,67.98,2024-09-02 09:17:07.000,2024-09-02,2024,9,2,50928,[],()
80323,50994,21906,2,40.50USD,"02:06,12/01/24",,40.5,40.5,81.0,2024-12-01 02:06:00.000,2024-12-01,2024,12,1,50994,[],()
85193,48202,21597,1,65.5€,"2025-02-28, 01:12",NULL,78.6,78.6,78.6,2025-02-28 01:12:00.000,2025-02-28,2025,2,28,48202,[],()
83959,49827,21760,1,$71.,"16:00,2025-11-12",NULL,71.0,71.0,71.0,2025-11-12 16:00:00.000,2025-11-12,2025,11,12,49827,[],()
80372,50822,21564,1,USD 72.25,"11:12, 2025-07-23",,72.25,72.25,72.25,2025-07-23 11:12:00.000,2025-07-23,2025,7,23,50822,[],()
81493,48906,21392,1,USD52.75,"01:43:25 pm,01/03/25",,52.75,52.75,52.75,2025-01-03 13:43:25.000,2025-01-03,2025,1,3,48906,[],()
78949,49268,21567,2,$ 60.50,2024-07-18T05:04:28.398,NULL,60.5,60.5,121.0,2024-07-18 05:04:28.398,2024-07-18,2024,7,18,49268,[],()
84042,48249,21434,1,27.75EUR,"2024-10-13, 07:44",NULL,33.3,33.3,33.3,2024-10-13 07:44:00.000,2024-10-13,2024,10,13,48249,[],()
78426,47925,21610,1,EUR 52.99,"03/05/25,14:56",,63.588,63.588,63.59,2025-03-05 14:56:00.000,2025-03-05,2025,3,5,47925,[],()
84597,48508,21611,2,USD51.50,"07/19/24, 16:11:18",NULL,51.5,51.5,103.0,2024-07-19 16:11:18.000,2024-07-19,2024,7,19,48508,[],()
81987,48769,21398,2,$34¢25,"21-Jun-2025,04:30:26",,3425.0,3425.0,6850.0,2025-06-21 04:30:26.000,2025-06-21,2025,6,21,48769,[],()
79014,48776,21464,1,$ 65.75,2024-11-03;04:47:40 A.M.,"Suite 941 1647 Vernon Road, North Archiestad, OH 65015-9407",65.75,65.75,65.75,2024-11-03 04:47:40.000,2024-11-03,2024,11,3,48776,[],()
84031,50463,21479,1,58.25 EUR,"12:18:57 P.M.,  8-Nov-2024",NULL,69.89999999999999,69.89999999999999,69.9,2024-11-08 12:18:57.000,2024-11-08,2024,11,8,50463,[],()
79137,48267,21532,1,15.75 USD,"02/05/25, 09:44:35",,15.75,15.75,15.75,2025-02-05 09:44:35.000,2025-02-05,2025,2,5,48267,[],()
84845,48544,22036,1,€46.50,2024-12-31T19:39:28,,55.8,55.8,55.8,2024-12-31 19:39:28.000,2024-12-31,2024,12,31,48544,[],()
86118,48672,21354,1,USD 52.00,"12/14/24,01:38:49",,52.0,52.0,52.0,2024-12-14 01:38:49.000,2024-12-14,2024,12,14,48672,[],()
81499,48070,21316,1,31.5EUR,12:18:04 A.M. 2024-12-21,NULL,37.8,37.8,37.8,2024-12-21 00:18:04.000,2024-12-21,2024,12,21,48070,[],()
80481,49008,21429,2,$28,06:35:22 am;26-September-2024,,28.0,28.0,56.0,2024-09-26 06:35:22.000,2024-09-26,2024,9,26,49008,[],()
86096,50010,21736,1,47EUR,19:04:56;2024-11-21,,56.4,56.4,56.4,2024-11-21 19:04:56.000,2024-11-21,2024,11,21,50010,[],()
83273,48566,22016,2,51.0 EUR,01/12/25;14:33,,61.199999999999996,61.199999999999996,122.4,2025-01-12 14:33:00.000,2025-01-12,2025,1,12,48566,[],()
85909,48017,22038,1,€32¢00,"08:10, 2025-01-29",NULL,3840.0,3840.0,3840.0,2025-01-29 08:10:00.000,2025-01-29,2025,1,29,48017,[],()
79531,48228,21434,1,USD 30.00,2024-11-22T08:24:19,,30.0,30.0,30.0,2024-11-22 08:24:19.000,2024-11-22,2024,11,22,48228,[],()
78789,50287,22041,1,USD40.25,Mon Dec  2 22:29:04 2024,"636 Moen Tunnel, Elijahborough, WV 97874-3940",40.25,40.25,40.25,2024-12-02 22:29:04.000,2024-12-02,2024,12,2,50287,[],()
84842,50321,21605,1,43.5$,"09/05/24, 15:08:38","Suite 282 433 Reichel Spurs, Bertramberg, WY 15200-6265",43.5,43.5,43.5,2024-09-05 15:08:38.000,2024-09-05,2024,9,5,50321,[],()
83593,47894,21373,1,EUR19.0,"31-May-2024,09:24:38 A.M.",,22.8,22.8,22.8,2024-05-31 09:24:38.000,2024-05-31,2024,5,31,47894,[],()
86499,47707,21872,1,€39.75,04:44:51 A.M.  2-November-2024,"Apt. 472 8937 Manual Forks, New Geraldberg, MI 79282-1517",47.699999999999996,47.699999999999996,47.7,2024-11-02 04:44:51.000,2024-11-02,2024,11,2,47707,[],()
84678,48945,21592,1,58.5 $,2024-12-31T16:24:23.585,NULL,58.5,58.5,58.5,2024-12-31 16:24:23.585,2024-12-31,2024,12,31,48945,[],()
83922,48322,21350,1,€37.0,16-March-2025 01:58:59 P.M.,NULL,44.4,44.4,44.4,2025-03-16 13:58:59.000,2025-03-16,2025,3,16,48322,[],()
84700,48162,21945,1,14.50€, 6-MAR-2025;21:27:25,,17.4,17.4,17.4,2025-03-06 21:27:25.000,2025-03-06,2025,3,6,48162,[],()
82702,50035,21826,1,48.99$,01:55:26 15-Jun-2024,NULL,48.99,48.99,48.99,2024-06-15 01:55:26.000,2024-06-15,2024,6,15,50035,[],()
81488,49406,21817,1,$63¢25,2025-08-17T18:21:22,NULL,6325.0,6325.0,6325.0,2025-08-17 18:21:22.000,2025-08-17,2025,8,17,51040,[],()
80635,48563,21921,4,63.50 EUR,01/12/25;09:57:38 PM,"Apt. 219 719 Danette Manor, Port Linwood, MN 04868",76.2,76.2,304.8,2025-01-12 21:57:38.000,2025-01-12,2025,1,12,48563,[],()
83766,50596,21597,1,66.$,"05:27:49,  1-February-2025","5675 Luettgen Trace, Gloverland, VT 83750-4521",66.0,66.0,66.0,2025-02-01 05:27:49.000,2025-02-01,2025,2,1,48017,[],()
80322,48549,22052,1,EUR25.75,23:09 03/23/25,"Suite 241 72999 Isreal Mews, Mariaview, MD 01948",30.9,30.9,30.9,2025-03-23 23:09:00.000,2025-03-23,2025,3,23,48549,[],()
85982,49603,21847,1,USD 67.25,"05/24/24,06:45",,67.25,67.25,67.25,2024-05-24 06:45:00.000,2024-05-24,2024,5,24,49603,[],()
85372,50819,21303,3,USD57.75,16-JAN-2025 19:16:55,,57.75,57.75,173.25,2025-01-16 19:16:55.000,2025-01-16,2025,1,16,50819,[],()
80091,48002,21335,1,USD33.00,2024-02-05T15:36:28.740,"Apt. 653 972 Jacquetta Wall, Lake Sidney, CT 17257",33.0,33.0,33.0,2024-02-05 15:36:28.740,2024-02-05,2024,2,5,48002,[],()
80148,49583,21383,1,EUR 52.0,13-Jul-2024;08:04,,62.4,62.4,62.4,2024-07-13 08:04:00.000,2024-07-13,2024,7,13,49583,[],()
81818,49984,21715,1,32.USD,"11/10/24, 01:39",NULL,32.0,32.0,32.0,2024-11-10 01:39:00.000,2024-11-10,2024,11,10,49984,[],()
85836,49233,21352,1,$ 33.00,01:15:44 2025-01-27,"51706 Gino Expressway, Lake Hildegard, UT 72216-3912",33.0,33.0,33.0,2025-01-27 01:15:44.000,2025-01-27,2025,1,27,49233,[],()
82800,48080,21370,1,62.0USD,"2025-01-12,07:21:58 am",,62.0,62.0,62.0,2025-01-12 07:21:58.000,2025-01-12,2025,1,12,48080,[],()
85722,50599,21667,1,$55¢50,20:42;2025-05-23,,5550.0,5550.0,5550.0,2025-05-23 20:42:00.000,2025-05-23,2025,5,23,50599,[],()
85316,49331,21824,1,$63.00,"2025-05-24, 04:16",,63.0,63.0,63.0,2025-05-24 04:16:00.000,2025-05-24,2025,5,24,48943,[],()
86081,49552,21343,3,71.00$,13-NOV-2024 15:26,"Apt. 463 771 Ruecker Mount, Port Juniorburgh, ID 39145",71.0,71.0,213.0,2024-11-13 15:26:00.000,2024-11-13,2024,11,13,49552,[],()
84954,49501,21385,1,25.99$,"07:00:23 am, 2025-09-19",,25.99,25.99,25.99,2025-09-19 07:00:23.000,2025-09-19,2025,9,19,49501,[],()
80835,47954,21401,1,$ 28.75,00:43:46;07/18/24,,28.75,28.75,28.75,2024-07-18 00:43:46.000,2024-07-18,2024,7,18,47954,[],()
85821,48039,22022,3,USD55.25,"19:01:53,2024-06-15","13951 Benedict Causeway, North Mathaland, AL 81257-7535",55.25,55.25,165.75,2024-06-15 19:01:53.000,2024-06-15,2024,6,15,48039,[],()
79285,51037,21446,1,USD 15.0,05/23/24;18:23:34,"Suite 776 95059 Shawnna Streets, Beerfort, MT 13687-6042",15.0,15.0,15.0,2024-05-23 18:23:34.000,2024-05-23,2024,5,23,51037,[],()
82266,49454,21892,1,27.00$,"10:34:11, 2025-05-06",NULL,27.0,27.0,27.0,2025-05-06 10:34:11.000,2025-05-06,2025,5,6,49454,[],()
78716,49920,21554,1,€70¢50,03:51:39 AM 08/13/25,,8460.0,8460.0,8460.0,2025-08-13 03:51:39.000,2025-08-13,2025,8,13,49920,[],()
79957,50801,21489,3,19.50$,14:10; 5-JUL-2024,,19.5,19.5,58.5,2024-07-05 14:10:00.000,2024-07-05,2024,7,5,50801,[],()
84394,48416,21588,1,$ 62.99,2024-06-30T13:16:40.216,"Apt. 321 564 O'Reilly Wells, East Annabell, WI 17705-4989",62.99,62.99,62.99,2024-06-30 13:16:40.216,2024-06-30,2024,6,30,48416,[],()
84169,50630,21968,1,€19¢50,2025-03-29 10:17:45 A.M.,NULL,2340.0,2340.0,2340.0,2025-03-29 10:17:45.000,2025-03-29,2025,3,29,50630,[],()
77799,50840,21924,1,54.25 USD,12/18/24;13:55:37,NULL,54.25,54.25,54.25,2024-12-18 13:55:37.000,2024-12-18,2024,12,18,50840,[],()
85163,47690,21377,1,USD57.00, 1-MAR-2025 06:33:07 P.M.,NULL,57.0,57.0,57.0,2025-03-01 18:33:07.000,2025-03-01,2025,3,1,47690,[],()
83778,49841,21367,1,$ 29.99,2025-02-01T11:35:12,NULL,29.99,29.99,29.99,2025-02-01 11:35:12.000,2025-02-01,2025,2,1,49841,[],()
79098,48282,21383,2,EUR52.99, 8.09.2024 16:31:31,,63.588,63.588,127.18,2024-08-09 16:31:31.000,2024-08-09,2024,8,9,48282,[],()
78393,48660,21544,1,$ 14.0,03:17:34 07/14/24,"75461 Luettgen Islands, East Dominga, NE 03542",14.0,14.0,14.0,2024-07-14 03:17:34.000,2024-07-14,2024,7,14,48660,[],()
83670,49822,21482,1,64.00$, 8-Jul-2024 05:07,"Apt. 869 293 Bettye Freeway, South Rockyland, AZ 66649-5874",64.0,64.0,64.0,2024-07-08 05:07:00.000,2024-07-08,2024,7,8,49725,[],()
80340,51122,21872,1,$ 37.25,2025-01-30T13:10:30.562,NULL,37.25,37.25,37.25,2025-01-30 13:10:30.562,2025-01-30,2025,1,30,51122,[],()
78656,48676,21476,3,35.5 USD,2024-05-07 23:21,,35.5,35.5,106.5,2024-05-07 23:21:00.000,2024-05-07,2024,5,7,48676,[],()
85863,51107,21736,1,48. USD," 2-September-2024,04:23",NULL,48.0,48.0,48.0,2024-09-02 04:23:00.000,2024-09-02,2024,9,2,51107,[],()
84539,47853,21880,4,38.00 USD,02:36;04/10/25,"1418 Feest Burg, East Jeromy, ID 22202",38.0,38.0,152.0,2025-04-10 02:36:00.000,2025-04-10,2025,4,10,47853,[],()
80076,49270,21582,4,67.99 USD,26.11.2024 01:31:31,"Suite 341 5505 Reta Court, Port Lizabethtown, CO 17223-7085",67.99,67.99,271.96,2024-11-26 01:31:31.000,2024-11-26,2024,11,26,49270,[],()
82583,50408,21435,3,USD 33.0,"22:36:37,  8-January-2025",,33.0,33.0,99.0,2025-01-08 22:36:37.000,2025-01-08,2025,1,8,50408,[],()
84418,48377,21362,1,EUR22.0,"19:48:17, 1-November-2024",,26.4,26.4,26.4,2024-11-01 19:48:17.000,2024-11-01,2024,11,1,48377,[],()
83712,50749,21801,1,€ 41.99,"10:37:45,2024-08-25",NULL,50.388,50.388,50.39,2024-08-25 10:37:45.000,2024-08-25,2024,8,25,50749,[],()
79966,50303,21868,4,$66.25,"02/22/25,07:16:29 pm",,66.25,66.25,265.0,2025-02-22 19:16:29.000,2025-02-22,2025,2,22,50303,[],()
85978,48914,21335,1,29.0USD,2025-07-30T05:48:17.355,"Apt. 967 411 Jakubowski Lodge, Lorettafurt, TN 91831-7324",29.0,29.0,29.0,2025-07-30 05:48:17.355,2025-07-30,2025,7,30,48914,[],()
84985,50520,21688,1,21.99€,09/01/24 05:11,,26.387999999999998,26.387999999999998,26.39,2024-09-01 05:11:00.000,2024-09-01,2024,9,1,50520,[],()
79505,50540,22001,1,$61¢25, 8-Aug-2024 17:49:28,"Suite 969 22264 Kuhn Isle, West Samfurt, LA 86874-5635",6125.0,6125.0,6125.0,2024-08-08 17:49:28.000,2024-08-08,2024,8,8,50540,[],()
82314,49664,21506,4,USD21.00,12/15/24;16:13:26,,21.0,21.0,84.0,2024-12-15 16:13:26.000,2024-12-15,2024,12,15,48528,[],()
82375,48593,21537,1,24.00 USD,2024-03-03T23:54:32.403,,24.0,24.0,24.0,2024-03-03 23:54:32.403,2024-03-03,2024,3,3,48593,[],()
78511,48800,22041,1,40.99 USD," 9-August-2024,12:02:28",NULL,40.99,40.99,40.99,2024-08-09 12:02:28.000,2024-08-09,2024,8,9,48800,[],()
78244,48705,21770,1,USD 19.50,01/13/25;03:50:38 AM,"Suite 167 60722 Margarett Mountains, North Gerardoburgh, NH 50129",19.5,19.5,19.5,2025-01-13 03:50:38.000,2025-01-13,2025,1,13,48705,[],()
79742,49683,21557,1,63.0$,"10:45:46 AM,08/05/24","94357 Nga Isle, South Isaias, PA 85722-2984",63.0,63.0,63.0,2024-08-05 10:45:46.000,2024-08-05,2024,8,5,49683,[],()
80207,48348,21882,2,$39.,09:03:37 AM;12/16/24,"98465 Feeney Island, Port Michaelemouth, VA 61522-9935",39.0,39.0,78.0,2024-12-16 09:03:37.000,2024-12-16,2024,12,16,48348,[],()
77839,50661,21365,1,33.5 $,2024-12-08 19:12,NULL,33.5,33.5,33.5,2024-12-08 19:12:00.000,2024-12-08,2024,12,8,49784,[],()
79556,48282,21799,1,€ 31.0,25-January-2025 21:14:07,NULL,37.199999999999996,37.199999999999996,37.2,2025-01-25 21:14:07.000,2025-01-25,2025,1,25,48282,[],()
79937,49989,22027,1,$30¢99,2024-10-22T07:08:02.086,,3099.0,3099.0,3099.0,2024-10-22 07:08:02.086,2024-10-22,2024,10,22,49989,[],()
84706,49951,21976,1,USD27.5,01:13 2024-11-15,"Suite 686 3728 Torphy River, East Rob, SC 29580",27.5,27.5,27.5,2024-11-15 01:13:00.000,2024-11-15,2024,11,15,49951,[],()
83173,48121,21684,2,$58.25,"01:02, 03/04/25",,58.25,58.25,116.5,2025-03-04 01:02:00.000,2025-03-04,2025,3,4,48121,[],()
82201,47763,21534,1,18.0$,2024-07-16T13:08:54,"Suite 612 723 Larhonda Square, Shauntehaven, TX 55075-9041",18.0,18.0,18.0,2024-07-16 13:08:54.000,2024-07-16,2024,7,16,47763,[],()
82526,49253,21922,1,USD22.00,"18:09,  1-FEB-2025",,22.0,22.0,22.0,2025-02-01 18:09:00.000,2025-02-01,2025,2,1,50108,[],()
84623,50378,21438,1,USD 18.0,2024-08-25;23:51,,18.0,18.0,18.0,2024-08-25 23:51:00.000,2024-08-25,2024,8,25,50378,[],()
78651,48371,21762,3,€ 29.99,2024-10-03;09:38:14 AM,,35.988,35.988,107.96,2024-10-03 09:38:14.000,2024-10-03,2024,10,3,48371,[],()
85679,49411,21493,1,€ 26.75,2025-08-25;02:42:51 A.M.,,32.1,32.1,32.1,2025-08-25 02:42:51.000,2025-08-25,2025,8,25,49411,[],()
84568,50343,21848,3,57 USD,13:47 2024-08-24,NULL,57.0,57.0,171.0,2024-08-24 13:47:00.000,2024-08-24,2024,8,24,50343,[],()
82512,49219,21504,1,58.75$,"05/06/25, 05:08:38 A.M.",,58.75,58.75,58.75,2025-05-06 05:08:38.000,2025-05-06,2025,5,6,49219,[],()
82449,48879,21758,2,44.25 $,2025-05-02 19:09:20,"Apt. 251 1870 Leannon Avenue, South Wilbertfort, NC 85653-1020",44.25,44.25,88.5,2025-05-02 19:09:20.000,2025-05-02,2025,5,2,48879,[],()
80515,48846,21395,1,USD 63.00,"06:52,2025-03-07",,63.0,63.0,63.0,2025-03-07 06:52:00.000,2025-03-07,2025,3,7,48846,[],()
84032,47917,21691,1,18$75¢,01/10/25 02:36:59 A.M.,,1875.0,1875.0,1875.0,2025-01-10 02:36:59.000,2025-01-10,2025,1,10,47917,[],()
81874,50686,21782,5,€54.0,2024-10-03T11:34:23,NULL,64.8,64.8,324.0,2024-10-03 11:34:23.000,2024-10-03,2024,10,3,50686,[],()
81755,49724,21587,1,73.5 USD,"2025-01-31,10:13:15 am",NULL,73.5,73.5,73.5,2025-01-31 10:13:15.000,2025-01-31,2025,1,31,49724,[],()
82292,49627,21764,1,EUR49.0,2024-10-03T19:09:10.365,,58.8,58.8,58.8,2024-10-03 19:09:10.365,2024-10-03,2024,10,3,49627,[],()
85629,49481,21789,1,23.25 €,"2024-08-16, 06:53:43",,27.9,27.9,27.9,2024-08-16 06:53:43.000,2024-08-16,2024,8,16,49481,[],()
79956,47725,21452,1,USD70.75," 6-Nov-2024, 05:07",,70.75,70.75,70.75,2024-11-06 05:07:00.000,2024-11-06,2024,11,6,47725,[],()
78703,47909,21355,1,56.5USD,"2025-02-09,12:52:07 am",NULL,56.5,56.5,56.5,2025-02-09 00:52:07.000,2025-02-09,2025,2,9,47909,[],()
79201,48925,21896,1,19.5$,"05:15:11 pm, 08/10/24",,19.5,19.5,19.5,2024-08-10 17:15:11.000,2024-08-10,2024,8,10,48925,[],()
78254,51020,21411,1,36.75$,"2024-03-24,04:40:28 A.M.",,36.75,36.75,36.75,2024-03-24 04:40:28.000,2024-03-24,2024,3,24,51020,[],()
84039,51044,21538,1,70.5 €,13-September-2024;07:10:14 am,,84.6,84.6,84.6,2024-09-13 07:10:14.000,2024-09-13,2024,9,13,51044,[],()
79076,48132,21875,1,EUR 50.00,23:29 2024-11-20,,60.0,60.0,60.0,2024-11-20 23:29:00.000,2024-11-20,2024,11,20,48132,[],()
78506,48921,21563,2,71.50 $,2024-08-02T23:13:08.566,,71.5,71.5,143.0,2024-08-02 23:13:08.566,2024-08-02,2024,8,2,48921,[],()
79980,48246,21343,1,EUR 76.00,2025-03-01T00:46:57.463,"88628 Carter Road, East Lavona, NM 63338-6592",91.2,91.2,91.2,2025-03-01 00:46:57.463,2025-03-01,2025,3,1,48246,[],()
85159,48220,21385,2,26.0EUR,02:46:42 A.M.;10-December-2024,,31.2,31.2,62.4,2024-12-10 02:46:42.000,2024-12-10,2024,12,10,48220,[],()
78697,49757,21415,2,60.00 €,07:24:57 A.M. 2024-11-17,"Suite 704 2976 Derrick Run, Lachelleville, WY 15932",72.0,72.0,144.0,2024-11-17 07:24:57.000,2024-11-17,2024,11,17,49757,[],()
81085,48643,22006,1,€31¢25,2025-05-21T02:19:03,NULL,3750.0,3750.0,3750.0,2025-05-21 02:19:03.000,2025-05-21,2025,5,21,48643,[],()
82941,49755,21953,1,42.5$,"2024-10-10,00:57:25","Suite 703 29390 Bashirian Radial, Eboniehaven, AL 24390-5983",42.5,42.5,42.5,2024-10-10 00:57:25.000,2024-10-10,2024,10,10,49755,[],()
81333,49334,21513,2,17.€,"05:52:48 AM,2025-05-10",,20.4,20.4,40.8,2025-05-10 05:52:48.000,2025-05-10,2025,5,10,49334,[],()
78564,49600,21306,1,€ 47.00,2024-08-18T22:41:03.384,NULL,56.4,56.4,56.4,2024-08-18 22:41:03.384,2024-08-18,2024,8,18,49600,[],()
85881,49702,21545,1,$31¢99, 5-November-2024;08:32:44 A.M.,,3199.0,3199.0,3199.0,2024-11-05 08:32:44.000,2024-11-05,2024,11,5,49702,[],()
81308,49768,21547,5,USD 55.0,"05/13/24, 10:36:52","Suite 205 96783 Ryan Underpass, Flatleyland, ME 25217",55.0,55.0,275.0,2024-05-13 10:36:52.000,2024-05-13,2024,5,13,49768,[],()
78990,48074,21731,3,USD51,"21:52:05,2024-06-07",NULL,51.0,51.0,153.0,2024-06-07 21:52:05.000,2024-06-07,2024,6,7,48074,[],()
77935,50505,21356,1,USD 21.0,"01/31/25, 05:00:00",,21.0,21.0,21.0,2025-01-31 05:00:00.000,2025-01-31,2025,1,31,50505,[],()
78374,48624,21679,2,USD25.75,16-Apr-2025 05:56,NULL,25.75,25.75,51.5,2025-04-16 05:56:00.000,2025-04-16,2025,4,16,48624,[],()
83492,47838,21964,1,71.00 $,09:52:16 AM;11-July-2024,"Suite 910 54746 Hackett Plain, Barrowsfort, UT 27878",71.0,71.0,71.0,2024-07-11 09:52:16.000,2024-07-11,2024,7,11,47838,[],()
82613,48034,21956,1,21.0 USD, 6.03.2025  1:12:12,,21.0,21.0,21.0,2025-06-03 01:12:12.000,2025-06-03,2025,6,3,48034,[],()
78717,49197,22050,5,$ 70.25,11-Mar-2025;03:04,,70.25,70.25,351.25,2025-03-11 03:04:00.000,2025-03-11,2025,3,11,49197,[],()
78602,47984,21469,1,57.25 USD,09:22; 4-Feb-2025,"Apt. 214 71537 Adeline Forge, Alexanderstad, MT 03355-3299",57.25,57.25,57.25,2025-02-04 09:22:00.000,2025-02-04,2025,2,4,47984,[],()
84649,48127,21763,2,€39¢75,"07:05, 19-February-2025",,4770.0,4770.0,9540.0,2025-02-19 07:05:00.000,2025-02-19,2025,2,19,48127,[],()
82180,49005,21814,1,43.00 $,"01/20/25, 16:04","3482 Stevie Hills, East Shizukoview, KY 81963-0029",43.0,43.0,43.0,2025-01-20 16:04:00.000,2025-01-20,2025,1,20,49005,[],()
78529,50455,21733,1,15.$,"17:25:25, 2024-08-08","3267 Kuvalis Bypass, Port Lucienchester, AL 28295",15.0,15.0,15.0,2024-08-08 17:25:25.000,2024-08-08,2024,8,8,49774,[],()
85374,48050,21898,1,54.25 €,"06/04/24,14:49",,65.1,65.1,65.1,2024-06-04 14:49:00.000,2024-06-04,2024,6,4,48050,[],()
83665,50772,21580,1,66.00 EUR,"31-Dec-2024, 03:19:23","658 Jenkins Spring, North Joaquin, IN 26673-0571",79.2,79.2,79.2,2024-12-31 03:19:23.000,2024-12-31,2024,12,31,50772,[],()
84758,50493,21952,2,54.75 USD,12:06;12/10/24,,54.75,54.75,109.5,2024-12-10 12:06:00.000,2024-12-10,2024,12,10,50493,[],()
83162,50997,21661,1,66.99 €,"06:00,10-April-2024",NULL,80.38799999999999,80.38799999999999,80.39,2024-04-10 06:00:00.000,2024-04-10,2024,4,10,50997,[],()
86261,47814,22003,1,$ 60.25,"13-Feb-2025,10:04:19 P.M.",,60.25,60.25,60.25,2025-02-13 22:04:19.000,2025-02-13,2025,2,13,47814,[],()
86215,48595,21460,1,68.75$,19:18:10 2024-04-25,,68.75,68.75,68.75,2024-04-25 19:18:10.000,2024-04-25,2024,4,25,48595,[],()
84180,48001,21675,1,$ 18.00,"19:02, 04/13/25",NULL,18.0,18.0,18.0,2025-04-13 19:02:00.000,2025-04-13,2025,4,13,48001,[],()
86128,50978,21815,1,16.EUR,08:57:53 AM;2024-07-12,,19.2,19.2,19.2,2024-07-12 08:57:53.000,2024-07-12,2024,7,12,50405,[],()
82584,48354,21414,2,USD49.50,23-March-2025 12:31,NULL,49.5,49.5,99.0,2025-03-23 12:31:00.000,2025-03-23,2025,3,23,48354,[],()
80132,50201,21519,1,USD46.75,"21:17,  2-MAY-2025","Apt. 110 209 Howe Locks, Croninmouth, AK 18378-7950",46.75,46.75,46.75,2025-05-02 21:17:00.000,2025-05-02,2025,5,2,50201,[],()
83728,50117,21648,1,18.99USD,06/02/24;11:09:04,,18.99,18.99,18.99,2024-06-02 11:09:04.000,2024-06-02,2024,6,2,50117,[],()
80666,49850,21692,1,64.75 USD,"03/16/25,07:48","Apt. 239 1525 Fahey Crossing, Hermannland, MA 16283-6240",64.75,64.75,64.75,2025-03-16 07:48:00.000,2025-03-16,2025,3,16,49850,[],()
79058,51058,21754,1,EUR 29.25,"02:46:03 am, 12/10/24","803 Kunze Islands, Port Paigeview, LA 96671-9761",35.1,35.1,35.1,2024-12-10 02:46:03.000,2024-12-10,2024,12,10,51058,[],()
81400,50248,21839,1,$71¢00,2024-05-28;07:16:32 P.M.,,7100.0,7100.0,7100.0,2024-05-28 19:16:32.000,2024-05-28,2024,5,28,50248,[],()
81155,49750,21610,4,$ 56.50,"07/12/24, 19:08","Apt. 739 4624 Farrell Ridges, Michaleberg, PA 01788-8941",56.5,56.5,226.0,2024-07-12 19:08:00.000,2024-07-12,2024,7,12,49750,[],()
84067,50557,21452,1,71.99€,20:01:09 02/15/25,,86.38799999999999,86.38799999999999,86.39,2025-02-15 20:01:09.000,2025-02-15,2025,2,15,50557,[],()
81519,51117,21761,1,28.75EUR,11:08:08 15-OCT-2024,,34.5,34.5,34.5,2024-10-15 11:08:08.000,2024-10-15,2024,10,15,51117,[],()
84210,50446,21830,1,EUR 67.50,"11:39:49 pm,2024-08-10","487 Lesch Knolls, Lindgrenport, MD 35045",81.0,81.0,81.0,2024-08-10 23:39:49.000,2024-08-10,2024,8,10,48268,[],()
80800,48037,21873,2,71.99 USD,2024-09-20;14:00:22,,71.99,71.99,143.98,2024-09-20 14:00:22.000,2024-09-20,2024,9,20,48037,[],()
80563,48886,21965,2,€59.5,2024-12-28T02:35:24.052,,71.39999999999999,71.39999999999999,142.8,2024-12-28 02:35:24.052,2024-12-28,2024,12,28,48886,[],()
85376,50000,21705,1,EUR 62.5,21:21 21-October-2024,,75.0,75.0,75.0,2024-10-21 21:21:00.000,2024-10-21,2024,10,21,50000,[],()
81137,50325,21717,1,USD34.75,2025-04-17T17:28:05,NULL,34.75,34.75,34.75,2025-04-17 17:28:05.000,2025-04-17,2025,4,17,50325,[],()
84679,50102,21423,1,€ 40.99,"03/27/24, 19:23:55",NULL,49.188,49.188,49.19,2024-03-27 19:23:55.000,2024-03-27,2024,3,27,50102,[],()
83064,48100,21833,1,USD67.99,"11:15:40, 2024-12-14","Apt. 451 1247 DuBuque Trail, Mamouth, MO 04493",67.99,67.99,67.99,2024-12-14 11:15:40.000,2024-12-14,2024,12,14,48100,[],()
77635,48488,21358,1,14.USD,"2025-03-04,10:21",,14.0,14.0,14.0,2025-03-04 10:21:00.000,2025-03-04,2025,3,4,48488,[],()
81591,47699,22034,1,$ 74.75,2024-07-05T23:44:45.891,"35141 Kohler Tunnel, Jonnastad, IN 33575",74.75,74.75,74.75,2024-07-05 23:44:45.891,2024-07-05,2024,7,5,47699,[],()
79949,48737,21338,1,$37.00,20:24 2024-08-10,,37.0,37.0,37.0,2024-08-10 20:24:00.000,2024-08-10,2024,8,10,48737,[],()
79253,48736,21370,2,59.99 $,04:09:39 A.M.;2024-11-23,,59.99,59.99,119.98,2024-11-23 04:09:39.000,2024-11-23,2024,11,23,48736,[],()
79308,50942,21669,2,USD19.99,01/13/25;15:27:11,"2346 Darrel Corners, New Nathanial, UT 78893-8257",19.99,19.99,39.98,2025-01-13 15:27:11.000,2025-01-13,2025,1,13,50942,[],()
85156,50921,21777,1,32.50 €,2024-11-15T03:57:03.706,"Apt. 376 78250 Ulysses Inlet, Lake Unbury, MI 01680",39.0,39.0,39.0,2024-11-15 03:57:03.706,2024-11-15,2024,11,15,50921,[],()
82675,48858,21421,1,USD 63.0,"2025-04-25, 07:57:05 P.M.","Suite 244 366 McKenzie Mews, New Shayneland, WV 28559-9464",63.0,63.0,63.0,2025-04-25 19:57:05.000,2025-04-25,2025,4,25,48858,[],()
77843,50542,21789,1,24.00USD,"09:08:56 AM, 2024-10-10",NULL,24.0,24.0,24.0,2024-10-10 09:08:56.000,2024-10-10,2024,10,10,50542,[],()
78435,49200,21365,3,29€99¢,"02:56:58 A.M., 08/03/24",NULL,3598.7999999999997,3598.7999999999997,10796.4,2024-08-03 02:56:58.000,2024-08-03,2024,8,3,49200,[],()
80104,49145,21601,1,52.75EUR,2024-11-12 09:07,,63.3,63.3,63.3,2024-11-12 09:07:00.000,2024-11-12,2024,11,12,49145,[],()
80128,49372,21389,1,EUR 55,03/11/25;09:52,,66.0,66.0,66.0,2025-03-11 09:52:00.000,2025-03-11,2025,3,11,49372,[],()
80224,48779,22027,1,$32.5,"17:34,12-JUL-2024",NULL,32.5,32.5,32.5,2024-07-12 17:34:00.000,2024-07-12,2024,7,12,48779,[],()
81347,51036,21876,1,$32.0,2024-07-16T07:45:49,,32.0,32.0,32.0,2024-07-16 07:45:49.000,2024-07-16,2024,7,16,51036,[],()
85192,50443,21737,3,€ 18.50,2024-09-07T17:50:38.020,NULL,22.2,22.2,66.6,2024-09-07 17:50:38.020,2024-09-07,2024,9,7,50443,[],()
83653,47952,21345,1,EUR74,2024-09-09T23:17:16.326,NULL,88.8,88.8,88.8,2024-09-09 23:17:16.326,2024-09-09,2024,9,9,47952,[],()
85362,48303,21646,1,$ 75.50,11.01.2025 10:18:18,"Suite 641 5556 Gibson Throughway, Alfonzoburgh, NV 69354-7297",75.5,75.5,75.5,2025-11-01 10:18:18.000,2025-11-01,2025,11,1,48303,[],()
81782,48613,21766,4,58. USD,27.12.2024  7:50:50,,58.0,58.0,232.0,2024-12-27 07:50:50.000,2024-12-27,2024,12,27,48613,[],()
82023,48439,21878,1,59 EUR,"16:54:38, 2024-09-19",NULL,70.8,70.8,70.8,2024-09-19 16:54:38.000,2024-09-19,2024,9,19,48439,[],()
79567,48072,21685,1,64.5USD,2024-11-24T08:04:42.621,NULL,64.5,64.5,64.5,2024-11-24 08:04:42.621,2024-11-24,2024,11,24,48072,[],()
84105,50857,21441,2,27.0 USD,"17:00:02, 13-DEC-2024",,27.0,27.0,54.0,2024-12-13 17:00:02.000,2024-12-13,2024,12,13,50857,[],()
81417,50473,21686,1,€18.5,07/20/24 15:06:32,NULL,22.2,22.2,22.2,2024-07-20 15:06:32.000,2024-07-20,2024,7,20,50473,[],()
85443,50253,21628,1,46$50¢,2025-01-19;02:29:50 PM,,4650.0,4650.0,4650.0,2025-01-19 14:29:50.000,2025-01-19,2025,1,19,50253,[],()
85438,50287,21571,1,21.75$,08/01/24 05:32:02 PM,,21.75,21.75,21.75,2024-08-01 17:32:02.000,2024-08-01,2024,8,1,50287,[],()
80903,50323,22020,2,$73.99,"00:54,  1-September-2024","7152 Kristofer Land, South Reuben, SD 95155",73.99,73.99,147.98,2024-09-01 00:54:00.000,2024-09-01,2024,9,1,50323,[],()
86228,49174,22005,1,43.00$,"2024-04-28,17:22:07",,43.0,43.0,43.0,2024-04-28 17:22:07.000,2024-04-28,2024,4,28,49174,[],()
78180,49065,21405,1,EUR 19.75,04/30/24;15:50,"Apt. 111 41216 Graham Valleys, Runolfssonberg, KS 96004-8277",23.7,23.7,23.7,2024-04-30 15:50:00.000,2024-04-30,2024,4,30,49065,[],()
82092,48207,21723,1,50.0 $,"08:58,2025-04-24",NULL,50.0,50.0,50.0,2025-04-24 08:58:00.000,2025-04-24,2025,4,24,48207,[],()
84053,48073,21818,1,€18.5,19:36:06;12/14/24,,22.2,22.2,22.2,2024-12-14 19:36:06.000,2024-12-14,2024,12,14,48073,[],()
80923,48964,21334,1,$65.99,09/28/24 11:10:29 PM,NULL,65.99,65.99,65.99,2024-09-28 23:10:29.000,2024-09-28,2024,9,28,48964,[],()
77627,50700,21490,1,USD 62.50,"25-December-2024, 15:07:50",NULL,62.5,62.5,62.5,2024-12-25 15:07:50.000,2024-12-25,2024,12,25,50995,[],()
84187,49182,21605,1,48.0 €,24-Jan-2025;03:45:44 am,,57.599999999999994,57.599999999999994,57.6,2025-01-24 03:45:44.000,2025-01-24,2025,1,24,49182,[],()
84780,48676,21989,2,USD70.99,"2025-03-14, 01:37:34 am","9801 Efrain Circles, Lake Percybury, MS 56886",70.99,70.99,141.98,2025-03-14 01:37:34.000,2025-03-14,2025,3,14,48676,[],()
83090,47994,21466,3,$35.5,"11-September-2024,06:53:09 PM",,35.5,35.5,106.5,2024-09-11 18:53:09.000,2024-09-11,2024,9,11,47994,[],()
80675,49876,21574,2,$ 45.0,"30-Jul-2024, 10:36:52",NULL,45.0,45.0,90.0,2024-07-30 10:36:52.000,2024-07-30,2024,7,30,49876,[],()
78709,49758,21374,2,USD 69.50,2025-01-08T21:18:15.125,,69.5,69.5,139.0,2025-01-08 21:18:15.125,2025-01-08,2025,1,8,49758,[],()
81103,50898,21727,1,EUR 13.99,13-February-2025 02:09:52,NULL,16.788,16.788,16.79,2025-02-13 02:09:52.000,2025-02-13,2025,2,13,50898,[],()
79726,48754,21709,1,49.00 $,16.11.2024 12:43:43,NULL,49.0,49.0,49.0,2024-11-16 12:43:43.000,2024-11-16,2024,11,16,48754,[],()
79688,49603,21938,1,72.50 USD,"03/18/25, 06:37:36 PM",,72.5,72.5,72.5,2025-03-18 18:37:36.000,2025-03-18,2025,3,18,49603,[],()
86176,50760,21645,1,USD 51.50,11:11 10-May-2025,,51.5,51.5,51.5,2025-05-10 11:11:00.000,2025-05-10,2025,5,10,50760,[],()
80822,49216,21918,1,74.5 $,2024-11-29 03:11:41,NULL,74.5,74.5,74.5,2024-11-29 03:11:41.000,2024-11-29,2024,11,29,49216,[],()
79376,47721,21538,1,€75.50,11.04.2025 13:27:27,,90.6,90.6,90.6,2025-11-04 13:27:27.000,2025-11-04,2025,11,4,47721,[],()
79530,50219,21787,1,€44.25," 3-June-2025,21:09",NULL,53.1,53.1,53.1,2025-06-03 21:09:00.000,2025-06-03,2025,6,3,50219,[],()
79697,47926,21729,1,EUR42,05:01;01/12/25,,50.4,50.4,50.4,2025-01-12 05:01:00.000,2025-01-12,2025,1,12,47926,[],()
78342,49424,21974,1,€57.75,19-March-2025 09:50:41 am,,69.3,69.3,69.3,2025-03-19 09:50:41.000,2025-03-19,2025,3,19,49424,[],()
83365,51045,21574,2,€ 43, 6-Jun-2024;02:33:10 AM,,51.6,51.6,103.2,2024-06-06 02:33:10.000,2024-06-06,2024,6,6,51045,[],()
80966,48936,21967,1,41.75USD,2024-09-23T11:28:17.101,NULL,41.75,41.75,41.75,2024-09-23 11:28:17.101,2024-09-23,2024,9,23,48936,[],()
85332,50139,21393,2,USD53,"04/05/25,01:43",,53.0,53.0,106.0,2025-04-05 01:43:00.000,2025-04-05,2025,4,5,50139,[],()
78010,50887,21514,2,€75¢00,23:24;16-April-2025,,9000.0,9000.0,18000.0,2025-04-16 23:24:00.000,2025-04-16,2025,4,16,50887,[],()
80655,50967,21391,1,67.50$,10.09.2024 02:19:19,,67.5,67.5,67.5,2024-10-09 02:19:19.000,2024-10-09,2024,10,9,50967,[],()
80368,49762,21965,5,USD 56.75,"08:12:34 A.M., 30-August-2024","Suite 447 13192 Runolfsdottir Village, Murphychester, VT 44294",56.75,56.75,283.75,2024-08-30 08:12:34.000,2024-08-30,2024,8,30,49762,[],()
79889,49925,21833,5,€ 65.5,2025-07-16;13:06:52,,78.6,78.6,393.0,2025-07-16 13:06:52.000,2025-07-16,2025,7,16,47953,[],()
82645,49436,21950,1,49.99$,"2024-12-15,01:34:19","920 Ned Shore, West Madieside, MN 35596-1549",49.99,49.99,49.99,2024-12-15 01:34:19.000,2024-12-15,2024,12,15,49436,[],()
78388,50237,21703,1,USD 65.99,11:11:29 AM 2024-11-06,"387 Eduardo Summit, North Heidyside, CA 53793",65.99,65.99,65.99,2024-11-06 11:11:29.000,2024-11-06,2024,11,6,50237,[],()
85281,50100,21340,1,USD 49.0,30-Jan-2025;07:20,,49.0,49.0,49.0,2025-01-30 07:20:00.000,2025-01-30,2025,1,30,50100,[],()
84316,47823,21461,1,74.0 $,10:25:40 P.M. 16-Jun-2024,,74.0,74.0,74.0,2024-06-16 22:25:40.000,2024-06-16,2024,6,16,47823,[],()
86505,48126,21910,1,USD34.25,07:40;2025-03-31,,34.25,34.25,34.25,2025-03-31 07:40:00.000,2025-03-31,2025,3,31,48126,[],()
78617,49300,21794,1,USD 33.0,"07:33:56 PM,28-Apr-2024","Apt. 425 2618 Julio Camp, New Sam, AL 55761",33.0,33.0,33.0,2024-04-28 19:33:56.000,2024-04-28,2024,4,28,49300,[],()
84753,48057,21811,1,33.00€, 4-April-2025;21:03,"84753 Padberg Shore, Weberberg, VT 12554",39.6,39.6,39.6,2025-04-04 21:03:00.000,2025-04-04,2025,4,4,48057,[],()
80209,49804,21851,1,$23¢25,2024-08-23 09:48:30 P.M.,,2325.0,2325.0,2325.0,2024-08-23 21:48:30.000,2024-08-23,2024,8,23,49804,[],()
80754,50009,21610,5,53.5 $,"2024-09-06,18:15:56",,53.5,53.5,267.5,2024-09-06 18:15:56.000,2024-09-06,2024,9,6,50009,[],()
82655,47769,21848,1,57.25USD," 9-November-2024, 16:47",,57.25,57.25,57.25,2024-11-09 16:47:00.000,2024-11-09,2024,11,9,47769,[],()
81467,51045,21541,1,USD 35.25,"21:15:20,  7-JUN-2025","Suite 433 109 Louetta Plain, Lake Samualland, TN 14297-3932",35.25,35.25,35.25,2025-06-07 21:15:20.000,2025-06-07,2025,6,7,51045,[],()
80102,48750,21454,1,USD 24.5,12/11/24;17:12:24,,24.5,24.5,24.5,2024-12-11 17:12:24.000,2024-12-11,2024,12,11,49086,[],()
85147,49561,22010,1,44EUR,"10:43:36,2024-09-15",NULL,52.8,52.8,52.8,2024-09-15 10:43:36.000,2024-09-15,2024,9,15,49561,[],()
86457,50423,21821,1,$69¢75,11:24:04 2025-04-18,,6975.0,6975.0,6975.0,2025-04-18 11:24:04.000,2025-04-18,2025,4,18,50423,[],()
82858,49884,21691,5,$ 19.00,"24-APR-2025, 12:37:03 AM",,19.0,19.0,95.0,2025-04-24 00:37:03.000,2025-04-24,2025,4,24,49884,[],()
85816,48358,21601,1,$54.50,2024-05-14;14:53,,54.5,54.5,54.5,2024-05-14 14:53:00.000,2024-05-14,2024,5,14,48358,[],()
81086,49670,21880,2,38.75USD," 7-Jan-2025, 07:23:41",NULL,38.75,38.75,77.5,2025-01-07 07:23:41.000,2025-01-07,2025,1,7,49670,[],()
85647,49288,21608,1,49.0 $,16-MAY-2025;17:55,,49.0,49.0,49.0,2025-05-16 17:55:00.000,2025-05-16,2025,5,16,49288,[],()
80645,49068,21355,5,EUR58.50,"03:30:38 PM,2025-04-12",,70.2,70.2,351.0,2025-04-12 15:30:38.000,2025-04-12,2025,4,12,49068,[],()
85391,48485,21836,1,€46¢99,01:23; 1-DEC-2024,,5638.8,5638.8,5638.8,2024-12-01 01:23:00.000,2024-12-01,2024,12,1,48485,[],()
81684,51071,21616,1,$ 40,2024-09-18T15:49:39.464,NULL,40.0,40.0,40.0,2024-09-18 15:49:39.464,2024-09-18,2024,9,18,51071,[],()
82969,51085,21308,1,EUR37.50,"14:45:27,28-January-2025",,45.0,45.0,45.0,2025-01-28 14:45:27.000,2025-01-28,2025,1,28,51085,[],()
80320,49551,21459,2,43.0USD,2024-09-11 03:04:14 am,,43.0,43.0,86.0,2024-09-11 03:04:14.000,2024-09-11,2024,9,11,49551,[],()
78573,48993,21746,2,21. $,20-Nov-2024 02:37:33 PM,"6661 Baumbach Lodge, South Heideview, GA 88907",21.0,21.0,42.0,2024-11-20 14:37:33.000,2024-11-20,2024,11,20,48993,[],()
86436,50710,21346,1,USD42.25,"07/24/24,12:06:01 pm",,42.25,42.25,42.25,2024-07-24 12:06:01.000,2024-07-24,2024,7,24,50710,[],()
81299,47769,21828,2,EUR 17.5,"2025-09-05,12:31",,21.0,21.0,42.0,2025-09-05 12:31:00.000,2025-09-05,2025,9,5,47769,[],()
80898,49998,21615,2,47.75 USD,"04:50:46 P.M., 02/14/25",,47.75,47.75,95.5,2025-02-14 16:50:46.000,2025-02-14,2025,2,14,49998,[],()
78711,48630,21870,1,65.99EUR,"10/30/24,02:31:44 P.M.",NULL,79.18799999999999,79.18799999999999,79.19,2024-10-30 14:31:44.000,2024-10-30,2024,10,30,48630,[],()
85228,48346,21496,1,67.0 €,"20:56:14, 18-December-2024","Apt. 390 2423 Murray Overpass, Hermistonfort, MO 75440",80.39999999999999,80.39999999999999,80.4,2024-12-18 20:56:14.000,2024-12-18,2024,12,18,48346,[],()
86309,48703,21626,1,USD35.,2024-11-20T02:56:26,"Apt. 110 594 Larson Corner, Herzogton, KY 23690",35.0,35.0,35.0,2024-11-20 02:56:26.000,2024-11-20,2024,11,20,48703,[],()
84835,49432,21887,1,€37.50,31-JAN-2025 05:56,,45.0,45.0,45.0,2025-01-31 05:56:00.000,2025-01-31,2025,1,31,49432,[],()
82059,49630,21571,1,22.50 $,06/23/24 05:25:46 AM,,22.5,22.5,22.5,2024-06-23 05:25:46.000,2024-06-23,2024,6,23,49630,[],()
78986,50882,21636,1,$17.25,21-APR-2024 12:51,,17.25,17.25,17.25,2024-04-21 12:51:00.000,2024-04-21,2024,4,21,50882,[],()
78197,50706,21552,1,67.25 USD,01:43 25-November-2024,"Apt. 788 80491 Walsh Field, Vandervortport, WI 22764",67.25,67.25,67.25,2024-11-25 01:43:00.000,2024-11-25,2024,11,25,50706,[],()
84245,51039,22039,1,65.0 USD,"09:19:54 PM,2024-06-03","314 Simonne Course, North Edmondport, CO 13601",65.0,65.0,65.0,2024-06-03 21:19:54.000,2024-06-03,2024,6,3,51039,[],()
79658,48970,21660,4,28.00 EUR,2024-08-24 07:32:04 am,,33.6,33.6,134.4,2024-08-24 07:32:04.000,2024-08-24,2024,8,24,48970,[],()
78885,48188,22022,1,54.50 USD,11:58:04 25-Jul-2024,"3418 Alberto Crossing, Port Nickolasview, MS 87911-4882",54.5,54.5,54.5,2024-07-25 11:58:04.000,2024-07-25,2024,7,25,48188,[],()
86307,48038,21649,1,66.50$,29.04.2024 18:02:02,,66.5,66.5,66.5,2024-04-29 18:02:02.000,2024-04-29,2024,4,29,48979,[],()
78048,51110,21986,2,$53,08/02/25;05:55,NULL,53.0,53.0,106.0,2025-08-02 05:55:00.000,2025-08-02,2025,8,2,51110,[],()
78862,50580,21705,1,$65.00,15-Mar-2025;12:22:00,,65.0,65.0,65.0,2025-03-15 12:22:00.000,2025-03-15,2025,3,15,50580,[],()
78276,48160,21347,1,$35.5,01:08;2024-11-11,,35.5,35.5,35.5,2024-11-11 01:08:00.000,2024-11-11,2024,11,11,48160,[],()
85353,47800,21782,1,58.25 USD,"07:24:31,2024-03-13",,58.25,58.25,58.25,2024-03-13 07:24:31.000,2024-03-13,2024,3,13,50777,[],()
83569,49846,21575,3,$71.99,2025-06-02 14:38,,71.99,71.99,215.97,2025-06-02 14:38:00.000,2025-06-02,2025,6,2,49846,[],()
85831,50713,21556,1,€49.00,15-OCT-2024;08:25:25 am,,58.8,58.8,58.8,2024-10-15 08:25:25.000,2024-10-15,2024,10,15,50713,[],()
84145,49566,21931,1,27.99USD,03:59:22 PM 2024-06-27,,27.99,27.99,27.99,2024-06-27 15:59:22.000,2024-06-27,2024,6,27,49566,[],()
77965,48072,21444,1,14.75USD,2025-02-28 00:48,,14.75,14.75,14.75,2025-02-28 00:48:00.000,2025-02-28,2025,2,28,48072,[],()
78596,50000,21557,1,$65¢75,19-November-2024;22:54,"Suite 122 8393 Donnelly Greens, Jaredbury, IL 86488",6575.0,6575.0,6575.0,2024-11-19 22:54:00.000,2024-11-19,2024,11,19,50000,[],()
83723,51008,21415,1,EUR63.5,"09:48:55, 2024-02-03",NULL,76.2,76.2,76.2,2024-02-03 09:48:55.000,2024-02-03,2024,2,3,51008,[],()
79447,49801,21340,2,52.00 $,08:58:42 am;06/07/25,NULL,52.0,52.0,104.0,2025-06-07 08:58:42.000,2025-06-07,2025,6,7,49801,[],()
81620,49283,21975,1,68.00 USD,"10:48, 13-March-2025",NULL,68.0,68.0,68.0,2025-03-13 10:48:00.000,2025-03-13,2025,3,13,49283,[],()
81362,49004,21426,1,65€50¢,"2024-11-20,01:25:43",NULL,7860.0,7860.0,7860.0,2024-11-20 01:25:43.000,2024-11-20,2024,11,20,49004,[],()
81959,48993,21630,1,$35.00,2025-01-29;04:34:26,"6661 Baumbach Lodge, South Heideview, GA 88907",35.0,35.0,35.0,2025-01-29 04:34:26.000,2025-01-29,2025,1,29,48993,[],()
79687,50651,21426,1,65.5 USD,21-APR-2024 02:15:03 PM,,65.5,65.5,65.5,2024-04-21 14:15:03.000,2024-04-21,2024,4,21,50651,[],()
82992,48858,21994,1,36.99USD,2024-07-15T21:19:41.043,,36.99,36.99,36.99,2024-07-15 21:19:41.043,2024-07-15,2024,7,15,48858,[],()
83565,49708,21614,4,USD 55,"12:19,2024-08-10",,55.0,55.0,220.0,2024-08-10 12:19:00.000,2024-08-10,2024,8,10,49708,[],()
80435,49057,21481,1,$20.00,17:34:37; 8-Jun-2024,NULL,20.0,20.0,20.0,2024-06-08 17:34:37.000,2024-06-08,2024,6,8,49057,[],()
78257,48854,21679,1,25. $,2024-07-21T00:31:38,NULL,25.0,25.0,25.0,2024-07-21 00:31:38.000,2024-07-21,2024,7,21,48854,[],()
84041,51074,21329,2,45.00EUR,01/27/25;18:55,,54.0,54.0,108.0,2025-01-27 18:55:00.000,2025-01-27,2025,1,27,51074,[],()
85167,50263,21920,1,EUR 22.99,02/06/25 11:57:38 A.M.,,27.587999999999997,27.587999999999997,27.59,2025-02-06 11:57:38.000,2025-02-06,2025,2,6,50872,[],()
79883,48655,21434,2,31.25 USD,"2024-12-23, 04:19:55 AM","206 Howe Forge, North Julene, IL 68896",31.25,31.25,62.5,2024-12-23 04:19:55.000,2024-12-23,2024,12,23,48655,[],()
81822,49868,21301,2,USD44.50,"19:50, 2025-01-03","Apt. 532 38256 Rutherford Knoll, West Asa, AL 21872-2513",44.5,44.5,89.0,2025-01-03 19:50:00.000,2025-01-03,2025,1,3,49868,[],()
85208,48577,21361,3,€ 61.25,2025-04-11T12:18:02.611,,73.5,73.5,220.5,2025-04-11 12:18:02.611,2025-04-11,2025,4,11,48577,[],()
81345,48228,21665,1,$ 70.99,2024-07-25 02:09:49,"Suite 746 407 Janyce Camp, Schuppeburgh, WI 37399",70.99,70.99,70.99,2024-07-25 02:09:49.000,2024-07-25,2024,7,25,48228,[],()
81188,51064,21459,1,$ 38.99,01:49:03 PM 12/25/24,,38.99,38.99,38.99,2024-12-25 13:49:03.000,2024-12-25,2024,12,25,51064,[],()
81616,49510,21747,1,€ 32.0,"04/20/25,04:42",NULL,38.4,38.4,38.4,2025-04-20 04:42:00.000,2025-04-20,2025,4,20,49510,[],()
80701,50991,21544,1,14.5 USD, 4-September-2024 17:46:31,,14.5,14.5,14.5,2024-09-04 17:46:31.000,2024-09-04,2024,9,4,50991,[],()
84086,50850,21502,3,66.00 USD,2025-06-18 07:51:50 pm,NULL,66.0,66.0,198.0,2025-06-18 19:51:50.000,2025-06-18,2025,6,18,50850,[],()
85365,48576,21694,4,USD24.25,"2024-04-02,10:14:43",,24.25,24.25,97.0,2024-04-02 10:14:43.000,2024-04-02,2024,4,2,48576,[],()
79049,49418,21429,1,30.EUR,2024-07-17T17:47:19,"4997 Kathyrn Stravenue, West Dario, MA 74068-9613",36.0,36.0,36.0,2024-07-17 17:47:19.000,2024-07-17,2024,7,17,49418,[],()
80503,48505,21920,1,25USD,"19:23:37,01/18/25",,25.0,25.0,25.0,2025-01-18 19:23:37.000,2025-01-18,2025,1,18,48505,[],()
80261,48833,21412,4,17.25 $,2025-04-13 10:35,,17.25,17.25,69.0,2025-04-13 10:35:00.000,2025-04-13,2025,4,13,48833,[],()
85676,50978,21902,3,24.5EUR,2025-02-10T11:15:28,NULL,29.4,29.4,88.2,2025-02-10 11:15:28.000,2025-02-10,2025,2,10,50405,[],()
77988,49351,22025,1,57.00 $,"01:20:10, 12/07/24","587 Kieth Hollow, South Leona, OR 32400",57.0,57.0,57.0,2024-12-07 01:20:10.000,2024-12-07,2024,12,7,49351,[],()
82638,49371,21730,1,$33¢75,2024-05-05T17:00:16.470,"Apt. 620 4555 Youlanda Prairie, West Cristobalhaven, KS 66237",3375.0,3375.0,3375.0,2024-05-05 17:00:16.470,2024-05-05,2024,5,5,49371,[],()
86426,49321,21847,1,$ 71,2024-09-10T20:22:22.667,"Apt. 902 884 Janene Fords, Randalchester, SD 59808",71.0,71.0,71.0,2024-09-10 20:22:22.667,2024-09-10,2024,9,10,50829,[],()
84727,50966,21858,1,$ 22.50,"09:20,2025-04-07",NULL,22.5,22.5,22.5,2025-04-07 09:20:00.000,2025-04-07,2025,4,7,50966,[],()
80814,50947,21772,1,46.5 €,2024-10-07T10:39:06.329,"Apt. 640 963 Ronni Skyway, Nigelview, FL 55519-4938",55.8,55.8,55.8,2024-10-07 10:39:06.329,2024-10-07,2024,10,7,50947,[],()
80844,48523,21533,5,$ 56.5,2024-07-02T19:26:11,"565 Quinn Villages, East Hilario, OK 16244-3035",56.5,56.5,282.5,2024-07-02 19:26:11.000,2024-07-02,2024,7,2,48523,[],()
84411,47721,21858,1,USD21,"02:22:07, 21-March-2025", ,21.0,21.0,21.0,2025-03-21 02:22:07.000,2025-03-21,2025,3,21,47721,[],()
79043,47744,21328,5,$62.25,03/22/25 02:48:55 PM,,62.25,62.25,311.25,2025-03-22 14:48:55.000,2025-03-22,2025,3,22,47744,[],()
86377,51059,22026,1,$ 53.00,02/27/25 07:38:41 A.M.,"Suite 881 53907 Hessel Shore, Antonport, LA 51495",53.0,53.0,53.0,2025-02-27 07:38:41.000,2025-02-27,2025,2,27,51059,[],()
81272,48967,21815,3,$ 17.00,"02/25/25, 21:23:16",,17.0,17.0,51.0,2025-02-25 21:23:16.000,2025-02-25,2025,2,25,48967,[],()
83045,49127,21790,1,71.25 USD,2025-04-03T23:57:22.976,,71.25,71.25,71.25,2025-04-03 23:57:22.976,2025-04-03,2025,4,3,49127,[],()
82863,50541,21725,1,€ 40.00,"04:09:49 P.M., 09/13/25",,48.0,48.0,48.0,2025-09-13 16:09:49.000,2025-09-13,2025,9,13,50541,[],()
85993,50462,21827,1,16.0 $,17:54:22 2024-11-10,"20029 Mosciski Mount, Kohlerfort, AL 22806-1846",16.0,16.0,16.0,2024-11-10 17:54:22.000,2024-11-10,2024,11,10,50462,[],()
85986,48785,21803,2,€52.25,2024-06-02;23:06:44,"Apt. 575 40968 Lakin Station, Yostmouth, AK 13920-5620",62.699999999999996,62.699999999999996,125.4,2024-06-02 23:06:44.000,2024-06-02,2024,6,2,48785,[],()
83518,50843,21569,1,$ 40,2024-11-12T10:44:24.377,"883 Coy Village, New Hai, PA 82419",40.0,40.0,40.0,2024-11-12 10:44:24.377,2024-11-12,2024,11,12,50843,[],()
84383,48706,21428,1,61.25 $,01/01/25;10:21,NULL,61.25,61.25,61.25,2025-01-01 10:21:00.000,2025-01-01,2025,1,1,48706,[],()
85142,48493,21578,1,22.25EUR,10/23/24 08:05:02 pm,NULL,26.7,26.7,26.7,2024-10-23 20:05:02.000,2024-10-23,2024,10,23,48493,[],()
86251,48966,21747,1,33€50¢," 8-Jul-2025, 02:58:54","Suite 836 6022 Treutel Manors, Lake Aaron, NM 19458",4020.0,4020.0,4020.0,2025-07-08 02:58:54.000,2025-07-08,2025,7,8,48966,[],()
85923,48363,21831,3,54.00 $,04:10:50 P.M. 18-July-2024,,54.0,54.0,162.0,2024-07-18 16:10:50.000,2024-07-18,2024,7,18,48363,[],()
86342,49735,22001,1,60.99 USD,"2024-10-22,09:41:06 pm","236 Donella Lights, Deckowmouth, VT 74899-4026",60.99,60.99,60.99,2024-10-22 21:41:06.000,2024-10-22,2024,10,22,49735,[],()
82868,49520,21399,5,63.0 USD,17:47;2025-04-17,"Suite 898 257 Floyd Club, Ciramouth, CO 05825",63.0,63.0,315.0,2025-04-17 17:47:00.000,2025-04-17,2025,4,17,49520,[],()
81013,48928,21429,3,€27¢00,"2024-12-14,21:40","7243 Simonis Extensions, Pfefferfort, VT 77479",3240.0,3240.0,9720.0,2024-12-14 21:40:00.000,2024-12-14,2024,12,14,48928,[],()
84743,48593,21797,1,21$50¢,"08:15, 05/16/24",,2150.0,2150.0,2150.0,2024-05-16 08:15:00.000,2024-05-16,2024,5,16,48593,[],()
80864,48630,21719,2,$64.00,2024-08-09T06:30:22.858,,64.0,64.0,128.0,2024-08-09 06:30:22.858,2024-08-09,2024,8,9,48630,[],()
81756,47854,21856,1,$ 41.,04:14 19-JAN-2025,,41.0,41.0,41.0,2025-01-19 04:14:00.000,2025-01-19,2025,1,19,47854,[],()
86134,50654,21387,1,$53¢50,2024-04-15T22:52:47.341,,5350.0,5350.0,5350.0,2024-04-15 22:52:47.341,2024-04-15,2024,4,15,50654,[],()
82621,50256,21964,1,€69¢50,"03:27:34, 07/30/24",,8340.0,8340.0,8340.0,2024-07-30 03:27:34.000,2024-07-30,2024,7,30,50256,[],()
80353,48631,21477,1,21.50 USD,07:08 12/24/24,,21.5,21.5,21.5,2024-12-24 07:08:00.000,2024-12-24,2024,12,24,48631,[],()
80416,49931,21472,1,34.0 $,21:51 12/18/24,NULL,34.0,34.0,34.0,2024-12-18 21:51:00.000,2024-12-18,2024,12,18,49931,[],()
84131,48490,21429,2,$ 28.,"06/15/24, 10:39:30 AM",NULL,28.0,28.0,56.0,2024-06-15 10:39:30.000,2024-06-15,2024,6,15,48490,[],()
85317,50467,21542,1,USD34.,"18:40:51,  3-May-2025","8821 Rodriguez Centers, Port Claretha, OH 70322",34.0,34.0,34.0,2025-05-03 18:40:51.000,2025-05-03,2025,5,3,50467,[],()
79686,48342,21836,1,$ 50.,00:32;2025-02-18,"Suite 682 135 Mitsuko Valley, Sporerhaven, UT 24215",50.0,50.0,50.0,2025-02-18 00:32:00.000,2025-02-18,2025,2,18,48342,[],()
85932,50471,21851,1,$ 24.25,2024-10-25 12:37:34 pm,,24.25,24.25,24.25,2024-10-25 12:37:34.000,2024-10-25,2024,10,25,50471,[],()
77727,51016,21583,1,€ 60.50,2025-02-02T08:03:42,NULL,72.6,72.6,72.6,2025-02-02 08:03:42.000,2025-02-02,2025,2,2,51016,[],()
85122,48678,21823,1,$ 63,17:11:11 2024-09-22,"3340 Phil Ports, Marvinfurt, WV 00291-0173",63.0,63.0,63.0,2024-09-22 17:11:11.000,2024-09-22,2024,9,22,48678,[],()
84548,49630,21994,1,32.5 €,19:59:34 2025-05-28,,39.0,39.0,39.0,2025-05-28 19:59:34.000,2025-05-28,2025,5,28,49630,[],()
83947,49545,21607,1,33.25 EUR,"08:44:49 AM,30-Jan-2025",,39.9,39.9,39.9,2025-01-30 08:44:49.000,2025-01-30,2025,1,30,49545,[],()
82924,48595,21412,1,USD17,"01:33,2025-02-13","1004 Prosacco Brooks, Arnetteton, NJ 36922",17.0,17.0,17.0,2025-02-13 01:33:00.000,2025-02-13,2025,2,13,48595,[],()
82729,48443,21908,1,EUR 20.50,19:19:29 10-Mar-2025,,24.599999999999998,24.599999999999998,24.6,2025-03-10 19:19:29.000,2025-03-10,2025,3,10,48443,[],()
83722,47814,21453,1,58.EUR,2024-09-07T02:33:29,NULL,69.6,69.6,69.6,2024-09-07 02:33:29.000,2024-09-07,2024,9,7,47814,[],()
82307,48143,21778,1,40.50$,02:47:24 2024-08-24,,40.5,40.5,40.5,2024-08-24 02:47:24.000,2024-08-24,2024,8,24,48143,[],()
81613,48347,21355,1,USD 57.99,2024-11-16 09:11:15 AM,NULL,57.99,57.99,57.99,2024-11-16 09:11:15.000,2024-11-16,2024,11,16,48347,[],()
82910,49093,21798,3,$58¢00,2024-09-19;03:09:15 AM,NULL,5800.0,5800.0,17400.0,2024-09-19 03:09:15.000,2024-09-19,2024,9,19,49093,[],()
78682,50116,21699,1,21.50 $,2025-08-01T05:57:23.614,,21.5,21.5,21.5,2025-08-01 05:57:23.614,2025-08-01,2025,8,1,50116,[],()
78608,50812,21999,2,31.75€,2025-05-15 07:40,"Apt. 925 15138 Corkery Stream, Port Anton, CO 59649",38.1,38.1,76.2,2025-05-15 07:40:00.000,2025-05-15,2025,5,15,50812,[],()
83221,48434,21585,1,$58.50,06:13:48 08/06/24,NULL,58.5,58.5,58.5,2024-08-06 06:13:48.000,2024-08-06,2024,8,6,48434,[],()
83243,50117,21533,1,57.5 EUR,12:46:11 pm 03/05/25,,69.0,69.0,69.0,2025-03-05 12:46:11.000,2025-03-05,2025,3,5,50117,[],()
79613,49549,21695,4,$71.,"01/04/25,09:26:44",NULL,71.0,71.0,284.0,2025-01-04 09:26:44.000,2025-01-04,2025,1,4,49549,[],()
84017,50076,21755,1,EUR24.5,19:09:39;13-Oct-2024,NULL,29.4,29.4,29.4,2024-10-13 19:09:39.000,2024-10-13,2024,10,13,50076,[],()
79439,51057,21401,1,€ 30.,"00:11,  7-January-2025",,36.0,36.0,36.0,2025-01-07 00:11:00.000,2025-01-07,2025,1,7,51057,[],()
78021,50457,21736,1,45.0 $,"23-APR-2024,20:38",NULL,45.0,45.0,45.0,2024-04-23 20:38:00.000,2024-04-23,2024,4,23,50457,[],()
81688,49857,21794,2,33€50¢,09:36:30 03/22/25,NULL,4020.0,4020.0,8040.0,2025-03-22 09:36:30.000,2025-03-22,2025,3,22,49857,[],()
86201,49296,21557,1,65.50 EUR,10/11/24 11:31:27 pm,,78.6,78.6,78.6,2024-10-11 23:31:27.000,2024-10-11,2024,10,11,49296,[],()
82961,48825,21637,1,48.99$,2024-05-25T22:20:37,,48.99,48.99,48.99,2024-05-25 22:20:37.000,2024-05-25,2024,5,25,48825,[],()
85435,48540,21492,1,24.5 USD,29-Dec-2024;06:29:27,,24.5,24.5,24.5,2024-12-29 06:29:27.000,2024-12-29,2024,12,29,48540,[],()
84621,50972,21855,1,57.USD,"14:10, 01/06/25",,57.0,57.0,57.0,2025-01-06 14:10:00.000,2025-01-06,2025,1,6,50972,[],()
79893,47818,21605,1,44.00EUR,"05:18:42 pm,05/14/24",,52.8,52.8,52.8,2024-05-14 17:18:42.000,2024-05-14,2024,5,14,47818,[],()
85547,47999,21513,1,USD 17.5,"02:14:50 am, 2025-01-19",,17.5,17.5,17.5,2025-01-19 02:14:50.000,2025-01-19,2025,1,19,47999,[],()
78004,49783,21656,1,€ 28., 9.11.2024 19:14:14,NULL,33.6,33.6,33.6,2024-09-11 19:14:14.000,2024-09-11,2024,9,11,49783,[],()
78463,49901,21531,4,17.75€,"03/25/25,07:25:08",NULL,21.3,21.3,85.2,2025-03-25 07:25:08.000,2025-03-25,2025,3,25,49901,[],()
79717,50543,21930,2,EUR 26.5,"14-Feb-2024, 01:30:11",,31.799999999999997,31.799999999999997,63.6,2024-02-14 01:30:11.000,2024-02-14,2024,2,14,50543,[],()
82052,49431,21512,1,USD69.00,"23-May-2025, 04:31:57",,69.0,69.0,69.0,2025-05-23 04:31:57.000,2025-05-23,2025,5,23,49431,[],()
77781,48697,21977,1,27.0 EUR,"2025-01-05, 18:44:02",,32.4,32.4,32.4,2025-01-05 18:44:02.000,2025-01-05,2025,1,5,48697,[],()
85390,50676,21782,1,53.75 EUR,"12/06/24, 19:29","Apt. 657 9032 Treasa Rue, New Bennettmouth, LA 74026-7809",64.5,64.5,64.5,2024-12-06 19:29:00.000,2024-12-06,2024,12,6,51106,[],()
80100,49957,21731,1,48.99USD,"06:58, 2025-01-17","3571 Stiedemann Circle, New Canditown, RI 34722",48.99,48.99,48.99,2025-01-17 06:58:00.000,2025-01-17,2025,1,17,49957,[],()
84080,50469,22030,1,$18.75,07:48:55 2025-01-24,,18.75,18.75,18.75,2025-01-24 07:48:55.000,2025-01-24,2025,1,24,50469,[],()
82476,47901,21349,1,66.75 USD,"2025-04-29,01:42:45 AM",,66.75,66.75,66.75,2025-04-29 01:42:45.000,2025-04-29,2025,4,29,47901,[],()
82368,50948,21835,1,69. EUR,10:59:35 pm  1-MAR-2025,"547 Bins Route, Kiehnland, VT 03453-4519",82.8,82.8,82.8,2025-03-01 22:59:35.000,2025-03-01,2025,3,1,50948,[],()
82044,48633,21501,1,USD 14.0,"22:37:06, 25-November-2024","9013 Waters Row, East Doretheashire, HI 40221",14.0,14.0,14.0,2024-11-25 22:37:06.000,2024-11-25,2024,11,25,48633,[],()
86074,51107,21944,3,37.50 USD,"2024-10-05, 11:47:07",,37.5,37.5,112.5,2024-10-05 11:47:07.000,2024-10-05,2024,10,5,51107,[],()
81338,50387,21571,1,€20,2025-01-06T13:21:48,,24.0,24.0,24.0,2025-01-06 13:21:48.000,2025-01-06,2025,1,6,50387,[],()
82515,49049,21636,2,18.USD,"15-July-2024,09:40:51 P.M.","6211 Caren Flat, Jannafurt, NE 42105-0673",18.0,18.0,36.0,2024-07-15 21:40:51.000,2024-07-15,2024,7,15,49049,[],()
84104,50018,21414,1,USD 49.75,2025-01-14 14:45:53,"15799 Kutch Street, Thielshire, MD 26581",49.75,49.75,49.75,2025-01-14 14:45:53.000,2025-01-14,2025,1,14,50018,[],()
86208,49322,21635,1,$ 40.00,17:40:23 2024-08-01,,40.0,40.0,40.0,2024-08-01 17:40:23.000,2024-08-01,2024,8,1,49322,[],()
84866,47972,21815,5,17.75USD,05:13 08/14/24,,17.75,17.75,88.75,2024-08-14 05:13:00.000,2024-08-14,2024,8,14,47972,[],()
80538,50973,21380,1,64.50 EUR,22:11 13-Mar-2024,,77.39999999999999,77.39999999999999,77.4,2024-03-13 22:11:00.000,2024-03-13,2024,3,13,50973,[],()
82234,50572,21479,1,USD59.99,04:17  1-SEP-2024,,59.99,59.99,59.99,2024-09-01 04:17:00.000,2024-09-01,2024,9,1,50572,[],()
86379,49409,21326,2,$69¢75,"2025-09-07, 00:00:09",NULL,6975.0,6975.0,13950.0,2025-09-07 00:00:09.000,2025-09-07,2025,9,7,49409,[],()
78955,51116,21816,3,$ 68.25,01/18/25;08:10,,68.25,68.25,204.75,2025-01-18 08:10:00.000,2025-01-18,2025,1,18,51116,[],()
85955,50497,21467,1,51.0USD,31-Jan-2025 14:21:48,NULL,51.0,51.0,51.0,2025-01-31 14:21:48.000,2025-01-31,2025,1,31,50497,[],()
81292,48791,21460,2,68.€,"08:58,2024-12-27",NULL,81.6,81.6,163.2,2024-12-27 08:58:00.000,2024-12-27,2024,12,27,48791,[],()
81841,47953,21622,1,48.00 $,"21:32:23,15-May-2024",NULL,48.0,48.0,48.0,2024-05-15 21:32:23.000,2024-05-15,2024,5,15,47953,[],()
82967,49543,21514,1,74.50$,"15:02, 2025-03-04","Apt. 917 6627 Armstrong Forge, West Abrahambury, LA 47576-7509",74.5,74.5,74.5,2025-03-04 15:02:00.000,2025-03-04,2025,3,4,49543,[],()
80963,48069,22042,1,€ 51.75,2025-03-30;01:59:03 pm,,62.099999999999994,62.099999999999994,62.1,2025-03-30 13:59:03.000,2025-03-30,2025,3,30,48069,[],()
79743,49298,21961,1,27.$,02:15:08 AM 17-APR-2025,"Suite 655 4848 Borer Hill, North Vicentaberg, RI 67001",27.0,27.0,27.0,2025-04-17 02:15:08.000,2025-04-17,2025,4,17,49298,[],()
81273,48969,21404,1,21.25$,"10/30/24,19:17",,21.25,21.25,21.25,2024-10-30 19:17:00.000,2024-10-30,2024,10,30,48969,[],()
85711,50007,21675,3,18.50 $,"26-Nov-2024, 16:38",NULL,18.5,18.5,55.5,2024-11-26 16:38:00.000,2024-11-26,2024,11,26,48280,[],()
83031,50990,21758,1,USD 47.75,25-JUL-2025 14:04:31,"Apt. 771 638 Scottie Meadow, Durganburgh, AR 01801",47.75,47.75,47.75,2025-07-25 14:04:31.000,2025-07-25,2025,7,25,50990,[],()
81915,48575,21827,1,€17.75," 5-November-2024, 03:50:57","Apt. 987 339 Leonora Point, North Mohamedton, ID 54492-4773",21.3,21.3,21.3,2024-11-05 03:50:57.000,2024-11-05,2024,11,5,48575,[],()
80438,51024,21793,1,$31¢99,2024-10-09T22:21:28,,3199.0,3199.0,3199.0,2024-10-09 22:21:28.000,2024-10-09,2024,10,9,51024,[],()
85221,48681,21451,1,70 EUR,2024-12-11;14:28,"Suite 239 4124 Billie Overpass, West Wendolynstad, OK 25288-4008",84.0,84.0,84.0,2024-12-11 14:28:00.000,2024-12-11,2024,12,11,48681,[],()
78444,50431,21720,1,26.75USD,2024-12-29 16:11,NULL,26.75,26.75,26.75,2024-12-29 16:11:00.000,2024-12-29,2024,12,29,50431,[],()
79894,50943,21929,1,60 EUR,"06/03/24,23:01",,72.0,72.0,72.0,2024-06-03 23:01:00.000,2024-06-03,2024,6,3,50943,[],()
81069,47995,21815,1,€16¢50,01:58:43 PM;2024-10-19,,1980.0,1980.0,1980.0,2024-10-19 13:58:43.000,2024-10-19,2024,10,19,47995,[],()
81835,49794,21564,1,$ 71.5,20:37:18 02/05/25,,71.5,71.5,71.5,2025-02-05 20:37:18.000,2025-02-05,2025,2,5,49794,[],()
79723,49735,21973,1,EUR 67.,02/12/25 11:11,"236 Donella Lights, Deckowmouth, VT 74899-4026",80.39999999999999,80.39999999999999,80.4,2025-02-12 11:11:00.000,2025-02-12,2025,2,12,49735,[],()
81757,48338,21699,1,EUR 25.00,"18:12, 10/03/24",,30.0,30.0,30.0,2024-10-03 18:12:00.000,2024-10-03,2024,10,3,48338,[],()
85940,48675,21932,1,$20.00,"02/12/25, 01:29:07 pm","357 Schuster Square, West Calebton, WY 60789-8884",20.0,20.0,20.0,2025-02-12 13:29:07.000,2025-02-12,2025,2,12,48675,[],()
79117,48488,21665,1,USD69.00,04:22:51 AM;06/08/25,"Suite 875 92650 Beer Rapid, Chasshire, FL 04688-6527",69.0,69.0,69.0,2025-06-08 04:22:51.000,2025-06-08,2025,6,8,48488,[],()
80681,50773,21428,1,€60.00,2024-09-19;13:16,NULL,72.0,72.0,72.0,2024-09-19 13:16:00.000,2024-09-19,2024,9,19,50773,[],()
80460,50455,21518,2,€ 40.50,12/30/24 02:24:59 P.M.,,48.6,48.6,97.2,2024-12-30 14:24:59.000,2024-12-30,2024,12,30,49774,[],()
78432,50629,21888,1,74USD,2024-07-18T14:16:08,NULL,74.0,74.0,74.0,2024-07-18 14:16:08.000,2024-07-18,2024,7,18,50629,[],()
77591,47788,21610,3,57.5USD,09:14:01 22-September-2024,,57.5,57.5,172.5,2024-09-22 09:14:01.000,2024-09-22,2024,9,22,47788,[],()
81696,49712,21586,1,42.00$,12.12.2024 15:56:56,,42.0,42.0,42.0,2024-12-12 15:56:56.000,2024-12-12,2024,12,12,49712,[],()
81260,48068,21457,1,28.75 $,04/25/25;12:02,,28.75,28.75,28.75,2025-04-25 12:02:00.000,2025-04-25,2025,4,25,48068,[],()
85133,50982,21864,1,€ 72.5,2025-09-19T03:02:49.992,,87.0,87.0,87.0,2025-09-19 03:02:49.992,2025-09-19,2025,9,19,50982,[],()
86136,49006,21848,1,EUR 56,24.09.2024 01:54:54,,67.2,67.2,67.2,2024-09-24 01:54:54.000,2024-09-24,2024,9,24,49006,[],()
78779,48965,21740,1,54.5 $,2024-07-15T21:41:04,NULL,54.5,54.5,54.5,2024-07-15 21:41:04.000,2024-07-15,2024,7,15,48965,[],()
85393,48950,21796,1,29.75 $,04:44:11 2024-10-09,"3366 Chadwick Ford, Rashadmouth, HI 98496-1795",29.75,29.75,29.75,2024-10-09 04:44:11.000,2024-10-09,2024,10,9,48950,[],()
80211,48889,21699,1,22.75EUR,03/16/25 17:12:13,,27.3,27.3,27.3,2025-03-16 17:12:13.000,2025-03-16,2025,3,16,48889,[],()
81211,50468,22057,1,€51.75,03:55:45;10-FEB-2025,"5380 Kuvalis Knolls, New Refugia, AL 09839-9443",62.099999999999994,62.099999999999994,62.1,2025-02-10 03:55:45.000,2025-02-10,2025,2,10,50468,[],()
81520,49381,21433,1,USD45.75,"08:02:57 PM,09/17/24",,45.75,45.75,45.75,2024-09-17 20:02:57.000,2024-09-17,2024,9,17,49381,[],()
82113,48447,21802,1,EUR44.25,02:35:08 2024-12-04,"980 Nathanial Trail, Fritschville, IL 97412-5086",53.1,53.1,53.1,2024-12-04 02:35:08.000,2024-12-04,2024,12,4,48447,[],()
79652,47898,21548,1,EUR41.0,07/22/24 13:37:01,NULL,49.199999999999996,49.199999999999996,49.2,2024-07-22 13:37:01.000,2024-07-22,2024,7,22,47898,[],()
79684,48005,21796,3,32.0 USD,2024-06-21T15:32:44.668,,32.0,32.0,96.0,2024-06-21 15:32:44.668,2024-06-21,2024,6,21,48005,[],()
81390,48813,21570,3,$ 28.75,"08:55:21 PM, 9-December-2024",NULL,28.75,28.75,86.25,2024-12-09 20:55:21.000,2024-12-09,2024,12,9,48813,[],()
78818,48684,21773,1,41.0$,09:26 2024-09-01,"78091 Bradtke Plain, Lake Garretfurt, NY 11434",41.0,41.0,41.0,2024-09-01 09:26:00.000,2024-09-01,2024,9,1,48684,[],()
84656,49883,21349,5,USD64.50,08/08/25;14:38:44,NULL,64.5,64.5,322.5,2025-08-08 14:38:44.000,2025-08-08,2025,8,8,49883,[],()
81868,50469,21805,1,50.50 €,"25-JUN-2025, 01:20:55 pm",,60.599999999999994,60.599999999999994,60.6,2025-06-25 13:20:55.000,2025-06-25,2025,6,25,50469,[],()
83448,50208,21460,1,USD65.5,"00:00:03, 2024-08-29","491 Littel Fork, Port Vernview, NV 82292-0577",65.5,65.5,65.5,2024-08-29 00:00:03.000,2024-08-29,2024,8,29,50208,[],()
82306,49415,21952,1,49.99 $,2024-07-03T12:28:44,"Suite 512 2332 Marian Path, Bergnaummouth, WV 04238",49.99,49.99,49.99,2024-07-03 12:28:44.000,2024-07-03,2024,7,3,49415,[],()
78133,48766,21969,1,USD 57.25,"2024-12-13, 06:00:58 am",NULL,57.25,57.25,57.25,2024-12-13 06:00:58.000,2024-12-13,2024,12,13,48766,[],()
85237,50621,21705,1,65.50$,2024-09-25;05:01:53 am,NULL,65.5,65.5,65.5,2024-09-25 05:01:53.000,2024-09-25,2024,9,25,50621,[],()
78115,50001,21433,1,€ 47.99,2024-12-15T22:08:38,,57.588,57.588,57.59,2024-12-15 22:08:38.000,2024-12-15,2024,12,15,50001,[],()
82646,48612,21367,1,$30¢75,"10/06/24,09:35:57 am",NULL,3075.0,3075.0,3075.0,2024-10-06 09:35:57.000,2024-10-06,2024,10,6,48137,[],()
78487,49770,21800,2,USD 34.5,"19-FEB-2025,09:46:29",,34.5,34.5,69.0,2025-02-19 09:46:29.000,2025-02-19,2025,2,19,49770,[],()
80579,49072,22044,1,$23.5,"13:13:06,2025-02-05","Apt. 597 76695 McClure Well, Nitzscheburgh, AR 09667-1508",23.5,23.5,23.5,2025-02-05 13:13:06.000,2025-02-05,2025,2,5,49072,[],()
79910,48832,22039,2,65.50 USD,2025-05-12 01:42,,65.5,65.5,131.0,2025-05-12 01:42:00.000,2025-05-12,2025,5,12,48832,[],()
79288,48345,21956,1,USD 20.00,12:48 12/08/24,"Suite 836 359 Myrta Prairie, Anthonyland, NH 56972",20.0,20.0,20.0,2024-12-08 12:48:00.000,2024-12-08,2024,12,8,50362,[],()
82096,49051,21827,1,EUR16.99,10:52:48 AM;2024-03-19,"2576 Casper Ranch, South Kathy, MI 17170",20.387999999999998,20.387999999999998,20.39,2024-03-19 10:52:48.000,2024-03-19,2024,3,19,49051,[],()
82491,48913,21890,2,70USD,"06:32, 24-October-2024",NULL,70.0,70.0,140.0,2024-10-24 06:32:00.000,2024-10-24,2024,10,24,48913,[],()
78216,49412,21935,1,€16¢25,2024-10-24T17:40:29.079,NULL,1950.0,1950.0,1950.0,2024-10-24 17:40:29.079,2024-10-24,2024,10,24,49412,[],()
80347,49054,21721,2,53$75¢,"15:18:22, 07/18/25",NULL,5375.0,5375.0,10750.0,2025-07-18 15:18:22.000,2025-07-18,2025,7,18,49054,[],()
78375,50023,21345,1,$72.25, 8-October-2024;07:47:18 P.M.,"Apt. 339 5965 Cletus Lock, Delisachester, IL 04684",72.25,72.25,72.25,2024-10-08 19:47:18.000,2024-10-08,2024,10,8,50023,[],()
78693,47859,21790,1,72.75$,17-Aug-2024;00:28:23,NULL,72.75,72.75,72.75,2024-08-17 00:28:23.000,2024-08-17,2024,8,17,47859,[],()
79718,48963,22034,3,71.99EUR,23:46:11 2024-07-24,"56061 White Cape, Doriefort, MD 35894-8001",86.38799999999999,86.38799999999999,259.16,2024-07-24 23:46:11.000,2024-07-24,2024,7,24,48963,[],()
86456,48164,21472,1,USD 33.0,2024-10-14T16:39:41.091,,33.0,33.0,33.0,2024-10-14 16:39:41.091,2024-10-14,2024,10,14,47890,[],()
85902,49448,21454,1,USD 24.99,10:22 18-Sep-2024,,24.99,24.99,24.99,2024-09-18 10:22:00.000,2024-09-18,2024,9,18,49448,[],()
83400,49809,21749,1,EUR74.00,2024-09-16T10:37:13.219,"Apt. 151 10745 Loren Via, Hyattport, AK 87074-9979",88.8,88.8,88.8,2024-09-16 10:37:13.219,2024-09-16,2024,9,16,49809,[],()
80068,49745,21833,1,68.50 $,07:09:55 25-March-2025,"Apt. 569 12697 Bartell Turnpike, Boscotown, OH 81787",68.5,68.5,68.5,2025-03-25 07:09:55.000,2025-03-25,2025,3,25,48118,[],()
85963,49277,21471,4,$ 21.5,03:12:25 PM 2025-01-09,,21.5,21.5,86.0,2025-01-09 15:12:25.000,2025-01-09,2025,1,9,49277,[],()
82502,50954,21814,1,$40.,12:24:25; 4-January-2025,"2298 Wisozk Village, Cammiebury, MI 02783-9791",40.0,40.0,40.0,2025-01-04 12:24:25.000,2025-01-04,2025,1,4,50954,[],()
82965,50870,21658,4,56.75$,14.08.2024 11:03:03,NULL,56.75,56.75,227.0,2024-08-14 11:03:03.000,2024-08-14,2024,8,14,50870,[],()
83748,48572,21479,1,59.00USD,06:54:42;2024-09-29,,59.0,59.0,59.0,2024-09-29 06:54:42.000,2024-09-29,2024,9,29,50029,[],()
83048,48888,21606,3,USD36.99,"05:37:26,11-Oct-2024","Apt. 170 1374 Powlowski Creek, Bernierfort, AK 78899-2112",36.99,36.99,110.97,2024-10-11 05:37:26.000,2024-10-11,2024,10,11,48888,[],()
83944,50882,21414,1,USD 46.0,"12/26/24,19:00:30",,46.0,46.0,46.0,2024-12-26 19:00:30.000,2024-12-26,2024,12,26,50882,[],()
82308,50196,21484,1,12.25$,Tue Nov 26 20:09:54 2024,,12.25,12.25,12.25,2024-11-26 20:09:54.000,2024-11-26,2024,11,26,50196,[],()
85560,50900,21574,1,$42.25,"2024-10-23,03:01:06 am",,42.25,42.25,42.25,2024-10-23 03:01:06.000,2024-10-23,2024,10,23,50900,[],()
83758,48173,21515,1,49.75 €,02:34:30;2024-12-11,,59.699999999999996,59.699999999999996,59.7,2024-12-11 02:34:30.000,2024-12-11,2024,12,11,48173,[],()
79344,48239,21709,1,$ 54.99,"06/25/25, 01:19:37 PM","3912 Flora Shore, South Doyleland, OK 09639-0366",54.99,54.99,54.99,2025-06-25 13:19:37.000,2025-06-25,2025,6,25,48239,[],()
77811,50793,22054,1,$ 69.25,17:41:19 2024-10-22,,69.25,69.25,69.25,2024-10-22 17:41:19.000,2024-10-22,2024,10,22,48526,[],()
78325,48352,21430,1,58.25$,"2025-01-15,14:24:28",,58.25,58.25,58.25,2025-01-15 14:24:28.000,2025-01-15,2025,1,15,48352,[],()
84693,47921,21783,1,$ 63,21:00;06/01/24,"Suite 400 52022 Laquanda Trail, Prosaccoview, IA 84755",63.0,63.0,63.0,2024-06-01 21:00:00.000,2024-06-01,2024,6,1,47921,[],()
80461,50459,21623,2,35.25 $,"10/23/24, 16:59",,35.25,35.25,70.5,2024-10-23 16:59:00.000,2024-10-23,2024,10,23,51096,[],()
82190,49962,21341,1,USD 22.50,"18-Jan-2025, 00:51:59","Apt. 655 62881 Prosacco Isle, Goyetteport, OH 74479-9133",22.5,22.5,22.5,2025-01-18 00:51:59.000,2025-01-18,2025,1,18,49962,[],()
77852,49685,21749,1,71.25EUR," 8-Jan-2025,20:23","6719 Kautzer Stream, South Alice, WV 07992-3860",85.5,85.5,85.5,2025-01-08 20:23:00.000,2025-01-08,2025,1,8,49685,[],()
83699,51088,22038,1,€32.,06:09 2024-04-25,,38.4,38.4,38.4,2024-04-25 06:09:00.000,2024-04-25,2024,4,25,51088,[],()
78336,49801,21493,1,EUR29.0,"08:23:32 am,08/27/24",NULL,34.8,34.8,34.8,2024-08-27 08:23:32.000,2024-08-27,2024,8,27,49801,[],()
78459,50654,22051,2,USD32.99,"04/10/25,10:47:53",,32.99,32.99,65.98,2025-04-10 10:47:53.000,2025-04-10,2025,4,10,50654,[],()
81043,48921,22027,1,32.USD,18-Sep-2024 09:29:29 PM,,32.0,32.0,32.0,2024-09-18 21:29:29.000,2024-09-18,2024,9,18,48921,[],()
81639,50884,21368,1,USD 43.5,"01/10/25, 15:31",,43.5,43.5,43.5,2025-01-10 15:31:00.000,2025-01-10,2025,1,10,50884,[],()
85917,47827,21804,5,EUR 50.5,2025-03-26;08:28:52 pm,NULL,60.599999999999994,60.599999999999994,303.0,2025-03-26 20:28:52.000,2025-03-26,2025,3,26,47827,[],()
81151,47851,21642,1,40.0$,"18-JUN-2024,08:18:17 P.M.",NULL,40.0,40.0,40.0,2024-06-18 20:18:17.000,2024-06-18,2024,6,18,47851,[],()
79675,49339,21383,1,52.00 EUR,"02:31:05,2024-10-03",,62.4,62.4,62.4,2024-10-03 02:31:05.000,2024-10-03,2024,10,3,49339,[],()
86070,49613,21884,1,33.USD,19:27:03 09/11/24,"Apt. 123 144 Monte Pass, Lake Nelida, NH 91403-2650",33.0,33.0,33.0,2024-09-11 19:27:03.000,2024-09-11,2024,9,11,49613,[],()
85675,49686,22057,3,€52.50,18:29:36 02/02/25,NULL,63.0,63.0,189.0,2025-02-02 18:29:36.000,2025-02-02,2025,2,2,49686,[],()
81624,48741,21380,2,USD 64.25,06:45;06/21/24,,64.25,64.25,128.5,2024-06-21 06:45:00.000,2024-06-21,2024,6,21,48741,[],()
79448,48799,21352,1,32.0USD,"07:34:03 P.M., 05/04/25","528 Mickey Green, East Virgilport, WI 23880-2056",32.0,32.0,32.0,2025-05-04 19:34:03.000,2025-05-04,2025,5,4,49625,[],()
82697,47839,21987,1,41.50 $,Sun Aug 11 05:41:30 2024,,41.5,41.5,41.5,2024-08-11 05:41:30.000,2024-08-11,2024,8,11,47839,[],()
78307,50213,21689,1,20.75 $,04:27 2024-06-08,NULL,20.75,20.75,20.75,2024-06-08 04:27:00.000,2024-06-08,2024,6,8,50213,[],()
81003,50053,21515,1,52.00 $,2024-11-04T11:28:43.611,,52.0,52.0,52.0,2024-11-04 11:28:43.611,2024-11-04,2024,11,4,48119,[],()
80329,47673,21750,1,$31¢00,12:49 05/18/24,"311 Sharleen Mount, Crisberg, AR 19907-5204",3100.0,3100.0,3100.0,2024-05-18 12:49:00.000,2024-05-18,2024,5,18,47673,[],()
79231,49165,21679,1,27.99 $," 1-Feb-2025, 09:52:11 AM",,27.99,27.99,27.99,2025-02-01 09:52:11.000,2025-02-01,2025,2,1,50307,[],()
81931,48087,21751,1,71.25 $,Wed Oct 16 17:52:59 2024, ,71.25,71.25,71.25,2024-10-16 17:52:59.000,2024-10-16,2024,10,16,48087,[],()
83435,49246,21598,4,20.0EUR,10/03/24 16:49,"449 Doug Cliff, Pierreberg, NE 55684",24.0,24.0,96.0,2024-10-03 16:49:00.000,2024-10-03,2024,10,3,49246,[],()
77744,49473,21617,1,USD 27.99,00:00:25;2024-12-19,"8058 VonRueden Loaf, Olinberg, FL 01667",27.99,27.99,27.99,2024-12-19 00:00:25.000,2024-12-19,2024,12,19,49473,[],()
78018,47845,21299,1,62$99¢,19:20:00 01/17/25,"571 Bergstrom Gardens, Catharineview, NM 94091-8730",6299.0,6299.0,6299.0,2025-01-17 19:20:00.000,2025-01-17,2025,1,17,47845,[],()
85176,49527,21453,1,USD 57.,"2024-11-07, 06:46:33",,57.0,57.0,57.0,2024-11-07 06:46:33.000,2024-11-07,2024,11,7,49527,[],()
82710,49981,21748,1,23.25 €,15:12:53;2025-03-28,"1502 Bauch Causeway, East Isaiasburgh, NV 76961-7124",27.9,27.9,27.9,2025-03-28 15:12:53.000,2025-03-28,2025,3,28,49981,[],()
84397,49455,21913,5,USD 41.0,2025-02-11T03:19:18,,41.0,41.0,205.0,2025-02-11 03:19:18.000,2025-02-11,2025,2,11,49455,[],()
83232,50638,21523,1,$ 14.5,"15:30,06/24/24",,14.5,14.5,14.5,2024-06-24 15:30:00.000,2024-06-24,2024,6,24,50638,[],()
82469,49018,21847,1,$ 68.25,"2024-10-02,18:10",,68.25,68.25,68.25,2024-10-02 18:10:00.000,2024-10-02,2024,10,2,49018,[],()
82093,48093,22039,1,64.75USD,"2025-03-21,11:42:43","846 Sipes Circle, East Nicolette, MT 47807",64.75,64.75,64.75,2025-03-21 11:42:43.000,2025-03-21,2025,3,21,50782,[],()
83968,50320,21630,1,EUR 30.00,"02:07:07 pm,2025-03-25",NULL,36.0,36.0,36.0,2025-03-25 14:07:07.000,2025-03-25,2025,3,25,50320,[],()
80251,50248,21772,1,USD43,2025-06-20 03:06:47,"3688 Stracke Key, Brainbury, MO 03455",43.0,43.0,43.0,2025-06-20 03:06:47.000,2025-06-20,2025,6,20,50248,[],()
79477,50610,21435,1,USD 36.75,"14:14, 2024-06-11",,36.75,36.75,36.75,2024-06-11 14:14:00.000,2024-06-11,2024,6,11,50610,[],()
78725,49533,22045,3,USD34.99,07:47;10/16/24,"91578 Herschel Island, West Kelsie, WY 00381-5051",34.99,34.99,104.97,2024-10-16 07:47:00.000,2024-10-16,2024,10,16,49533,[],()
85469,50538,21307,1,28.25 USD,2024-12-15T22:58:54,"45971 Alayna Isle, East Marquis, DE 91040",28.25,28.25,28.25,2024-12-15 22:58:54.000,2024-12-15,2024,12,15,50538,[],()
82981,49906,21788,4,USD 26.75,2025-07-07T17:10:28,NULL,26.75,26.75,107.0,2025-07-07 17:10:28.000,2025-07-07,2025,7,7,49906,[],()
78774,49582,21782,1,$58.99,"16-October-2024,02:12:23 P.M.",,58.99,58.99,58.99,2024-10-16 14:12:23.000,2024-10-16,2024,10,16,49582,[],()
85037,48288,21434,1,30.50 $,2024-04-12;23:10,,30.5,30.5,30.5,2024-04-12 23:10:00.000,2024-04-12,2024,4,12,48288,[],()
78624,48502,21918,1,$73¢00,11/04/24 03:58:53 pm,,7300.0,7300.0,7300.0,2024-11-04 15:58:53.000,2024-11-04,2024,11,4,48502,[],()
83689,48038,21448,1,$21.00,2024-08-06T10:47:15,,21.0,21.0,21.0,2024-08-06 10:47:15.000,2024-08-06,2024,8,6,48979,[],()
84274,49380,21864,2,$72.5,"10:18:52 am, 26-Jul-2024",,72.5,72.5,145.0,2024-07-26 10:18:52.000,2024-07-26,2024,7,26,49380,[],()
84934,50110,21496,1,67.99 USD,"2025-08-01,11:14:14",,67.99,67.99,67.99,2025-08-01 11:14:14.000,2025-08-01,2025,8,1,50110,[],()
83149,50670,21762,5,USD 27.50, 5-Dec-2024;17:23:07,,27.5,27.5,137.5,2024-12-05 17:23:07.000,2024-12-05,2024,12,5,50670,[],()
77833,49381,21592,1,EUR61.25,"06:23:46,2024-12-23",NULL,73.5,73.5,73.5,2024-12-23 06:23:46.000,2024-12-23,2024,12,23,49381,[],()
77642,48699,21983,2,USD59.5,"12/05/24,14:30",,59.5,59.5,119.0,2024-12-05 14:30:00.000,2024-12-05,2024,12,5,48699,[],()
81189,48365,21358,1,€16.5,2025-01-18T00:18:59,,19.8,19.8,19.8,2025-01-18 00:18:59.000,2025-01-18,2025,1,18,48365,[],()
86269,50064,21956,3,EUR24.75,2024-12-07T17:01:05,,29.7,29.7,89.1,2024-12-07 17:01:05.000,2024-12-07,2024,12,7,50064,[],()
80573,48851,21962,1,63.25 €,17.10.2024 21:56:56,"Apt. 703 71670 Mauro Springs, Port Sherwood, VT 21865-4301",75.89999999999999,75.89999999999999,75.9,2024-10-17 21:56:56.000,2024-10-17,2024,10,17,48851,[],()
83478,48087,21703,1,67.99$,"02:02:11,08/04/24",,67.99,67.99,67.99,2024-08-04 02:02:11.000,2024-08-04,2024,8,4,48087,[],()
79564,48687,21875,1,45.$,"2024-09-29, 21:48:11",NULL,45.0,45.0,45.0,2024-09-29 21:48:11.000,2024-09-29,2024,9,29,48687,[],()
85828,50540,21542,1,31.50USD,2024-12-25;02:06:59 am,NULL,31.5,31.5,31.5,2024-12-25 02:06:59.000,2024-12-25,2024,12,25,50540,[],()
84163,48692,21372,1,USD33.99, 2-April-2025 04:45:28,"Apt. 344 14450 Risa Stream, Langmouth, NH 22790",33.99,33.99,33.99,2025-04-02 04:45:28.000,2025-04-02,2025,4,2,48692,[],()
83210,49045,21970,2,$ 71.00,"09/12/24,09:07:54 PM",NULL,71.0,71.0,142.0,2024-09-12 21:07:54.000,2024-09-12,2024,9,12,49045,[],()
85086,49459,21543,2,$49.00, 9-SEP-2024;18:05:38,,49.0,49.0,98.0,2024-09-09 18:05:38.000,2024-09-09,2024,9,9,49459,[],()
78538,51006,21436,5,USD63.,2024-08-10T08:49:49,,63.0,63.0,315.0,2024-08-10 08:49:49.000,2024-08-10,2024,8,10,51006,[],()
79437,48754,21663,1,USD67.00,06/26/24 18:35:38,,67.0,67.0,67.0,2024-06-26 18:35:38.000,2024-06-26,2024,6,26,48754,[],()
84072,50110,21342,1,61.5 $,"02:25:02 am, 2024-08-12","Suite 747 5359 Mertz Brooks, North Cody, NC 98291-2678",61.5,61.5,61.5,2024-08-12 02:25:02.000,2024-08-12,2024,8,12,50110,[],()
77703,50692,21908,2,$ 20.99,20-November-2024;23:24,,20.99,20.99,41.98,2024-11-20 23:24:00.000,2024-11-20,2024,11,20,50692,[],()
79749,49888,21490,5,64.0USD,08/21/24;10:35,,64.0,64.0,320.0,2024-08-21 10:35:00.000,2024-08-21,2024,8,21,49888,[],()
79348,48972,21890,1,€70¢25,02:06:49 PM;2025-02-28,,8430.0,8430.0,8430.0,2025-02-28 14:06:49.000,2025-02-28,2025,2,28,48972,[],()
86112,49765,21502,1,USD 67.0," 4-Oct-2024,02:49:25",,67.0,67.0,67.0,2024-10-04 02:49:25.000,2024-10-04,2024,10,4,49765,[],()
85495,49691,21441,1,$ 26.25,06:36:50;04/09/24,,26.25,26.25,26.25,2024-04-09 06:36:50.000,2024-04-09,2024,4,9,49691,[],()
80985,49024,21498,1,$ 21.0,"07:27:57 am,08/15/24",,21.0,21.0,21.0,2024-08-15 07:27:57.000,2024-08-15,2024,8,15,49024,[],()
82999,49184,21300,5,EUR 41.5,06:00:39 am 2024-11-15,NULL,49.8,49.8,249.0,2024-11-15 06:00:39.000,2024-11-15,2024,11,15,49184,[],()
79778,50214,21482,1,68.25 USD,2024-04-15;04:57:05,NULL,68.25,68.25,68.25,2024-04-15 04:57:05.000,2024-04-15,2024,4,15,50214,[],()
78189,49784,21757,3,14.25USD,"00:31:50,2025-01-21",NULL,14.25,14.25,42.75,2025-01-21 00:31:50.000,2025-01-21,2025,1,21,49784,[],()
82204,49462,21871,1,28.25$,"09:30:13,05/25/24",NULL,28.25,28.25,28.25,2024-05-25 09:30:13.000,2024-05-25,2024,5,25,49462,[],()
84256,48226,21559,4,USD38.5,2024-04-14T06:12:39,,38.5,38.5,154.0,2024-04-14 06:12:39.000,2024-04-14,2024,4,14,48226,[],()
81695,49573,21956,4,$25¢75,04:53; 8-Aug-2024,,2575.0,2575.0,10300.0,2024-08-08 04:53:00.000,2024-08-08,2024,8,8,49573,[],()
85970,49434,21564,1,€75¢75,2025-04-11;11:30:04 pm,"Apt. 409 8020 Mack Light, North Lucioview, VA 79375",9090.0,9090.0,9090.0,2025-04-11 23:30:04.000,2025-04-11,2025,4,11,49434,[],()
83937,49947,21589,2,$63,2025-03-16T11:30:36.510,"5720 Larkin Row, Bartonstad, NM 93251",63.0,63.0,126.0,2025-03-16 11:30:36.510,2025-03-16,2025,3,16,49947,[],()
81450,51071,21431,2,USD53.99,02:30:18 PM  5-JUN-2024,,53.99,53.99,107.98,2024-06-05 14:30:18.000,2024-06-05,2024,6,5,51071,[],()
80502,49654,21449,4,€49¢50,"02:39:50 PM,22-September-2024","5971 Corine Spurs, Port Destiny, MA 91797",5940.0,5940.0,23760.0,2024-09-22 14:39:50.000,2024-09-22,2024,9,22,49654,[],()
85799,49058,21640,5,45.5$,"27-Oct-2024, 21:17:54",NULL,45.5,45.5,227.5,2024-10-27 21:17:54.000,2024-10-27,2024,10,27,49058,[],()
85779,48239,21834,4,29.0$,29-Sep-2024;03:43:33,,29.0,29.0,116.0,2024-09-29 03:43:33.000,2024-09-29,2024,9,29,48239,[],()
82931,49889,21865,1,EUR70,12:38:36 pm 2025-05-09,,84.0,84.0,84.0,2025-05-09 12:38:36.000,2025-05-09,2025,5,9,49889,[],()
79490,49609,21623,2,33 USD,"05:41:35, 06/07/25",,33.0,33.0,66.0,2025-06-07 05:41:35.000,2025-06-07,2025,6,7,49609,[],()
82138,47744,22005,1,EUR44.25,01:55  7-September-2024, ,53.1,53.1,53.1,2024-09-07 01:55:00.000,2024-09-07,2024,9,7,47744,[],()
82796,47894,21407,3,61.99$,03:53;01/14/25,,61.99,61.99,185.97,2025-01-14 03:53:00.000,2025-01-14,2025,1,14,47894,[],()
80866,48042,22042,1,48.0 €,15:30 2025-04-06,NULL,57.599999999999994,57.599999999999994,57.6,2025-04-06 15:30:00.000,2025-04-06,2025,4,6,48042,[],()
85095,47837,21738,2,44.99 USD,2024-09-06;22:25:54,,44.99,44.99,89.98,2024-09-06 22:25:54.000,2024-09-06,2024,9,6,47837,[],()
82654,50140,21951,3,31.99EUR,08:43 2025-03-18,"Suite 476 32368 Alfonzo Estate, Port Carmelobury, MN 09055-9522",38.388,38.388,115.16,2025-03-18 08:43:00.000,2025-03-18,2025,3,18,50140,[],()
78641,49594,21587,5,70.5 EUR,"10:59:35, 1-Jun-2024",,84.6,84.6,423.0,2024-06-01 10:59:35.000,2024-06-01,2024,6,1,49594,[],()
84285,50617,21893,3,€ 71.25,2024-12-14T08:16:58,,85.5,85.5,256.5,2024-12-14 08:16:58.000,2024-12-14,2024,12,14,50617,[],()
78503,49819,21501,1,18.5USD,09:08:30 PM; 9-Jan-2025,,18.5,18.5,18.5,2025-01-09 21:08:30.000,2025-01-09,2025,1,9,49819,[],()
83114,48628,21623,1,37.75 $,2024-06-12T05:37:27.220,"Apt. 216 8852 Muller Pines, New Albertchester, IN 67746-3211",37.75,37.75,37.75,2024-06-12 05:37:27.220,2024-06-12,2024,6,12,48628,[],()
77771,48519,21693,3,$71.0,2024-11-24 22:34,,71.0,71.0,213.0,2024-11-24 22:34:00.000,2024-11-24,2024,11,24,48519,[],()
83750,49244,21594,3,USD17.00,2025-01-05T19:50:34.538,,17.0,17.0,51.0,2025-01-05 19:50:34.538,2025-01-05,2025,1,5,49244,[],()
84126,49469,21856,1,$ 41.25,2025-05-06;12:07:27,NULL,41.25,41.25,41.25,2025-05-06 12:07:27.000,2025-05-06,2025,5,6,49469,[],()
82846,49838,21771,1,USD 74.00,"02/11/25, 05:31:46 AM",NULL,74.0,74.0,74.0,2025-02-11 05:31:46.000,2025-02-11,2025,2,11,49838,[],()
85924,49007,21740,1,58.99 USD,10:21;21-JUN-2024,,58.99,58.99,58.99,2024-06-21 10:21:00.000,2024-06-21,2024,6,21,49007,[],()
81206,48738,21726,1,€51¢75,"05/15/25,06:25","Apt. 629 574 Kuvalis Street, Damionland, RI 00889-5493",6210.0,6210.0,6210.0,2025-05-15 06:25:00.000,2025-05-15,2025,5,15,48738,[],()
84588,49414,21997,5,73€50¢,2025-02-03;09:55:45,,8820.0,8820.0,44100.0,2025-02-03 09:55:45.000,2025-02-03,2025,2,3,49002,[],()
79491,47911,21753,1,$57.50,"06:12:13 am,10-MAR-2025","Suite 747 4887 Ardella Pass, Evelynnmouth, AR 21033-1348",57.5,57.5,57.5,2025-03-10 06:12:13.000,2025-03-10,2025,3,10,49582,[],()
78323,47845,21312,1,$ 37.75, 6.10.2024 14:07:07,NULL,37.75,37.75,37.75,2024-06-10 14:07:07.000,2024-06-10,2024,6,10,47845,[],()
83269,49454,21452,2,$72¢75,"09:53:30,2025-10-07","974 Pollich Union, Hamillland, LA 75549-4884",7275.0,7275.0,14550.0,2025-10-07 09:53:30.000,2025-10-07,2025,10,7,49454,[],()
83328,50238,21744,1,$ 52," 4-Jan-2025,04:24:25",NULL,52.0,52.0,52.0,2025-01-04 04:24:25.000,2025-01-04,2025,1,4,50238,[],()
85906,51040,21342,1,57.99 €,"09/11/24, 01:14:05 A.M.",NULL,69.588,69.588,69.59,2024-09-11 01:14:05.000,2024-09-11,2024,9,11,51040,[],()
85029,49095,21553,1,€39¢25,"04:19,2025-03-08",NULL,4710.0,4710.0,4710.0,2025-03-08 04:19:00.000,2025-03-08,2025,3,8,49095,[],()
83263,48121,21490,1,63.00USD,"19:47,06/18/24",,63.0,63.0,63.0,2024-06-18 19:47:00.000,2024-06-18,2024,6,18,48121,[],()
85295,47952,21610,1,$54.75,01:07 23-January-2025,,54.75,54.75,54.75,2025-01-23 01:07:00.000,2025-01-23,2025,1,23,47952,[],()
78721,49575,22001,5,58$,11:49:24 A.M.;05/21/25,,58.0,58.0,290.0,2025-05-21 11:49:24.000,2025-05-21,2025,5,21,49575,[],()
79545,49879,22029,3,EUR66.5,"14:30:44, 14-May-2024",NULL,79.8,79.8,239.4,2024-05-14 14:30:44.000,2024-05-14,2024,5,14,49879,[],()
78247,50601,21947,1,63.75EUR,2025-01-18;17:57,,76.5,76.5,76.5,2025-01-18 17:57:00.000,2025-01-18,2025,1,18,50601,[],()
84820,50716,21351,1,$39.50,"02:36:20 AM, 14-Jul-2024",,39.5,39.5,39.5,2024-07-14 02:36:20.000,2024-07-14,2024,7,14,50716,[],()
82002,50509,21973,1,$ 68.25,"09/12/24, 18:10","Apt. 398 22366 Sandy Orchard, South Kyrafurt, NH 39582-1412",68.25,68.25,68.25,2024-09-12 18:10:00.000,2024-09-12,2024,9,12,48141,[],()
79101,50046,21770,1,USD 18.00,"08:20:44, 9-Apr-2025",,18.0,18.0,18.0,2025-04-09 08:20:44.000,2025-04-09,2025,4,9,50046,[],()
84075,48906,21636,1,14.75USD,Mon Aug 26 06:34:30 2024,"Suite 135 1445 Pfeffer Brook, Edwintown, MO 49830-7316",14.75,14.75,14.75,2024-08-26 06:34:30.000,2024-08-26,2024,8,26,48906,[],()
79506,48235,21299,1,64.99EUR,"15-OCT-2024, 05:54:32",NULL,77.98799999999999,77.98799999999999,77.99,2024-10-15 05:54:32.000,2024-10-15,2024,10,15,48235,[],()
81436,50387,21650,2,USD 73.25,"11/30/24,06:52:07","616 Nader Estate, West Howard, NC 66201-5460",73.25,73.25,146.5,2024-11-30 06:52:07.000,2024-11-30,2024,11,30,50387,[],()
80344,48525,21950,1,48.50 EUR,10:22:14 PM 26-March-2025,,58.199999999999996,58.199999999999996,58.2,2025-03-26 22:22:14.000,2025-03-26,2025,3,26,48525,[],()
81225,50523,21735,1,32.5EUR,"03/31/25,08:04:56","Suite 255 1951 Jones Throughway, East Leonoraburgh, NM 21151",39.0,39.0,39.0,2025-03-31 08:04:56.000,2025-03-31,2025,3,31,50523,[],()
83784,49536,21810,1,50.75 $,2025-04-07T03:44:27.338,,50.75,50.75,50.75,2025-04-07 03:44:27.338,2025-04-07,2025,4,7,49536,[],()
78589,48268,21695,1,71.0 $,11-September-2024 09:26,"487 Lesch Knolls, Lindgrenport, MD 35045",71.0,71.0,71.0,2024-09-11 09:26:00.000,2024-09-11,2024,9,11,48268,[],()
81134,49661,21580,1,$62¢75,"2024-10-31, 03:27:47 P.M.","Apt. 606 905 Kirlin Crescent, North Cathrineton, CA 82896-1684",6275.0,6275.0,6275.0,2024-10-31 15:27:47.000,2024-10-31,2024,10,31,49661,[],()
78183,51090,21777,1,$ 33.5,"06:01,11/07/24",,33.5,33.5,33.5,2024-11-07 06:01:00.000,2024-11-07,2024,11,7,51090,[],()
86482,49783,21841,3,58.50 $,2024-12-30T13:36:53.691,,58.5,58.5,175.5,2024-12-30 13:36:53.691,2024-12-30,2024,12,30,49783,[],()
78327,50567,21429,1,29.0$,2025-01-13T03:53:31,,29.0,29.0,29.0,2025-01-13 03:53:31.000,2025-01-13,2025,1,13,50567,[],()
80029,48602,21328,1,€ 59.25,"18:17:11,2024-09-25","Apt. 971 9695 Coy Mews, Batztown, ND 53982-4938",71.1,71.1,71.1,2024-09-25 18:17:11.000,2024-09-25,2024,9,25,48602,[],()
77762,48297,21332,1,USD 12.50,"04/05/25,13:55",,12.5,12.5,12.5,2025-04-05 13:55:00.000,2025-04-05,2025,4,5,48297,[],()
80847,48596,21689,1,19 USD,"02:04,2025-05-16",,19.0,19.0,19.0,2025-05-16 02:04:00.000,2025-05-16,2025,5,16,48596,[],()
84684,49428,21551,1,19.$,"10/26/24,04:31:26 pm",,19.0,19.0,19.0,2024-10-26 16:31:26.000,2024-10-26,2024,10,26,49428,[],()
77800,50779,21813,1,28.00 €,"12/17/24, 09:20:34 AM","1286 Robt Meadow, South Merideth, IN 12514-4525",33.6,33.6,33.6,2024-12-17 09:20:34.000,2024-12-17,2024,12,17,50779,[],()
83702,47919,21629,1,46.5$,"01/01/25, 09:52:45",NULL,46.5,46.5,46.5,2025-01-01 09:52:45.000,2025-01-01,2025,1,1,47919,[],()
84617,48241,21936,1,EUR19.75,24.06.2024 11:59:59,,23.7,23.7,23.7,2024-06-24 11:59:59.000,2024-06-24,2024,6,24,48241,[],()
86050,50626,21549,1,$ 26,2024-12-02T21:48:32.749,"Apt. 867 1632 Carey Cove, Fadelmouth, CT 62425",26.0,26.0,26.0,2024-12-02 21:48:32.749,2024-12-02,2024,12,2,50626,[],()
78423,50963,21494,5,USD60.50,2024-07-29T16:53:37,"Apt. 755 91534 Edgar Dale, Gradyland, AL 98124",60.5,60.5,302.5,2024-07-29 16:53:37.000,2024-07-29,2024,7,29,49715,[],()
78858,50382,21637,2,USD48.75,12/04/24;10:47:49,"Apt. 474 78969 Kuhic Way, Sherylton, AL 98813-4306",48.75,48.75,97.5,2024-12-04 10:47:49.000,2024-12-04,2024,12,4,48014,[],()
78541,50897,21588,1,64.75$,"05:30, 2024-09-26",,64.75,64.75,64.75,2024-09-26 05:30:00.000,2024-09-26,2024,9,26,50897,[],()
82327,49903,21352,1,USD 34.0,2024-12-18T16:19:23,NULL,34.0,34.0,34.0,2024-12-18 16:19:23.000,2024-12-18,2024,12,18,49903,[],()
83517,48169,21646,3,76.5$,"30-November-2024,11:51",,76.5,76.5,229.5,2024-11-30 11:51:00.000,2024-11-30,2024,11,30,48169,[],()
81146,47704,21352,2,€ 33.00,"12/07/24, 16:14:30","Apt. 708 350 Lanny Mission, Kristleport, ID 88157",39.6,39.6,79.2,2024-12-07 16:14:30.000,2024-12-07,2024,12,7,47704,[],()
83195,48932,21469,2,57.50 $,15.04.2025 08:44:44,"731 Prosacco Street, Adalinehaven, ME 58660",57.5,57.5,115.0,2025-04-15 08:44:44.000,2025-04-15,2025,4,15,48932,[],()
85415,49746,21470,1,€ 16.,"07:20:59 AM,2024-11-06",,19.2,19.2,19.2,2024-11-06 07:20:59.000,2024-11-06,2024,11,6,49746,[],()
85252,50778,22006,2,USD 28.00,"08:58:38 AM,10/24/24","4636 Hintz Valleys, Asleymouth, TX 41419",28.0,28.0,56.0,2024-10-24 08:58:38.000,2024-10-24,2024,10,24,50778,[],()
78509,50756,21428,1,64.0 USD,18:05:48;2025-07-16,,64.0,64.0,64.0,2025-07-16 18:05:48.000,2025-07-16,2025,7,16,50756,[],()
83921,49580,21664,3,$ 44.00,"03:38:14 pm,03/04/25","Apt. 158 678 Sporer Springs, Sterlingview, KY 71137-2385",44.0,44.0,132.0,2025-03-04 15:38:14.000,2025-03-04,2025,3,4,49580,[],()
83948,49550,21566,1,€ 28,04:38:35 P.M. 07/29/24,,33.6,33.6,33.6,2024-07-29 16:38:35.000,2024-07-29,2024,7,29,49550,[],()
78966,50357,21858,1,19.99USD,03/08/25 01:16,NULL,19.99,19.99,19.99,2025-03-08 01:16:00.000,2025-03-08,2025,3,8,50357,[],()
79320,49521,21607,1,36USD,2024-12-29T00:59:53,NULL,36.0,36.0,36.0,2024-12-29 00:59:53.000,2024-12-29,2024,12,29,49521,[],()
85719,50734,21887,1,EUR37.,"2024-08-29,07:25:41","40162 Hilll Meadows, West Ira, NH 94474-0381",44.4,44.4,44.4,2024-08-29 07:25:41.000,2024-08-29,2024,8,29,50734,[],()
78283,48940,21604,1,69.50EUR,2025-05-09T19:17:41.638,NULL,83.39999999999999,83.39999999999999,83.4,2025-05-09 19:17:41.638,2025-05-09,2025,5,9,48940,[],()
78078,48158,21965,1,USD 60.0,2024-12-12T22:46:40.188,,60.0,60.0,60.0,2024-12-12 22:46:40.188,2024-12-12,2024,12,12,48158,[],()
82735,50067,21878,1,USD57.5,23:54 2024-11-04,"89360 O'Hara Mountains, West Christa, IA 36224-6900",57.5,57.5,57.5,2024-11-04 23:54:00.000,2024-11-04,2024,11,4,50067,[],()
82542,49526,21946,1,58.00 $,"2024-10-14,15:51",NULL,58.0,58.0,58.0,2024-10-14 15:51:00.000,2024-10-14,2024,10,14,49526,[],()
82624,49678,21494,1,61.75USD,2024-07-17T23:09:07,NULL,61.75,61.75,61.75,2024-07-17 23:09:07.000,2024-07-17,2024,7,17,49678,[],()
85116,48791,21542,2,$ 30.5,2025-02-12T09:52:53,NULL,30.5,30.5,61.0,2025-02-12 09:52:53.000,2025-02-12,2025,2,12,48791,[],()
78155,49136,21766,1,61.75$,"19:41:29, 06/11/24",,61.75,61.75,61.75,2024-06-11 19:41:29.000,2024-06-11,2024,6,11,49136,[],()
77953,50402,21566,1,€ 28.25,2025-03-09T15:10:46,"1538 Kuhn Unions, Stracketon, CO 01865-4634",33.9,33.9,33.9,2025-03-09 15:10:46.000,2025-03-09,2025,3,9,48713,[],()
80519,47741,21518,4,$ 43.0,"2024-06-06, 01:58:34",,43.0,43.0,172.0,2024-06-06 01:58:34.000,2024-06-06,2024,6,6,47741,[],()
79534,49951,21712,1,USD70.,04/09/25 18:15,,70.0,70.0,70.0,2025-04-09 18:15:00.000,2025-04-09,2025,4,9,49951,[],()
81642,50652,21919,1,USD 59.75, 5-SEP-2024;10:29:19,,59.75,59.75,59.75,2024-09-05 10:29:19.000,2024-09-05,2024,9,5,50652,[],()
79641,49027,21908,1,$21.50,07:50 2024-10-09,"166 Refugio Meadows, Gorczanyberg, WA 07287",21.5,21.5,21.5,2024-10-09 07:50:00.000,2024-10-09,2024,10,9,49027,[],()
78415,50279,21421,1,62. USD,"02/11/25,09:43",,62.0,62.0,62.0,2025-02-11 09:43:00.000,2025-02-11,2025,2,11,50279,[],()
82678,50343,21512,2,72.0 €,2025-01-11T11:01:34.602,NULL,86.39999999999999,86.39999999999999,172.8,2025-01-11 11:01:34.602,2025-01-11,2025,1,11,50343,[],()
81787,49275,21854,1,60.5USD,"12:29:52, 03/06/25",,60.5,60.5,60.5,2025-03-06 12:29:52.000,2025-03-06,2025,3,6,49275,[],()
78239,51036,21431,1,$49.75,2024-11-29 23:43,NULL,49.75,49.75,49.75,2024-11-29 23:43:00.000,2024-11-29,2024,11,29,51036,[],()
79680,47709,21296,2,54.75USD,08:56:57 PM 2024-06-05,,54.75,54.75,109.5,2024-06-05 20:56:57.000,2024-06-05,2024,6,5,47709,[],()
78926,49170,21335,3,32.75USD,"04:59:17 AM, 12/17/24",,32.75,32.75,98.25,2024-12-17 04:59:17.000,2024-12-17,2024,12,17,49170,[],()
85796,49152,21874,1,$67.5,"30-Oct-2024,22:47:24",NULL,67.5,67.5,67.5,2024-10-30 22:47:24.000,2024-10-30,2024,10,30,49152,[],()
85746,51029,21505,1,EUR39.5,"05:27:24 AM, 09/23/24",NULL,47.4,47.4,47.4,2024-09-23 05:27:24.000,2024-09-23,2024,9,23,51029,[],()
81975,49460,21387,1,EUR50.5,2024-12-08;06:16:01 PM,,60.599999999999994,60.599999999999994,60.6,2024-12-08 18:16:01.000,2024-12-08,2024,12,8,49460,[],()
86179,50905,21660,2,26.75 USD," 6-Jul-2024, 12:09:57",,26.75,26.75,53.5,2024-07-06 12:09:57.000,2024-07-06,2024,7,6,50905,[],()
78736,51002,21552,1,USD66.5,"04:29:56, 12-FEB-2025",NULL,66.5,66.5,66.5,2025-02-12 04:29:56.000,2025-02-12,2025,2,12,51002,[],()
77995,49484,21826,4,51.25$,2024-04-03T10:17:24,"Suite 221 822 Arvilla Way, Lake Laurettaview, ND 15443-0018",51.25,51.25,205.0,2024-04-03 10:17:24.000,2024-04-03,2024,4,3,49484,[],()
78841,50607,21456,1,67.75 EUR,29-OCT-2024;20:49,,81.3,81.3,81.3,2024-10-29 20:49:00.000,2024-10-29,2024,10,29,50607,[],()
78201,50640,21958,1,USD74.25,24.09.2024 02:57:57,"604 Bechtelar Meadows, Sudiefort, CT 85757",74.25,74.25,74.25,2024-09-24 02:57:57.000,2024-09-24,2024,9,24,50640,[],()
83337,50323,21309,1,$ 27.5,05:58:12 pm 30-Jun-2024,"7152 Kristofer Land, South Reuben, SD 95155",27.5,27.5,27.5,2024-06-30 17:58:12.000,2024-06-30,2024,6,30,50323,[],()
83305,50308,21301,5,41.5 €,14:48:26;2024-11-30,,49.8,49.8,249.0,2024-11-30 14:48:26.000,2024-11-30,2024,11,30,50308,[],()
82085,48648,22052,1,USD 26.75,"04:21:20 P.M., 2024-12-23",,26.75,26.75,26.75,2024-12-23 16:21:20.000,2024-12-23,2024,12,23,48648,[],()
80432,50101,21553,1,USD39.5,14:38 03/05/25,NULL,39.5,39.5,39.5,2025-03-05 14:38:00.000,2025-03-05,2025,3,5,50101,[],()
84682,49708,21597,1,$69¢25,"2025-02-11, 19:20",NULL,6925.0,6925.0,6925.0,2025-02-11 19:20:00.000,2025-02-11,2025,2,11,49708,[],()
79435,48507,21507,2,40$75¢,"2024-07-18,04:22:02 PM",NULL,4075.0,4075.0,8150.0,2024-07-18 16:22:02.000,2024-07-18,2024,7,18,48507,[],()
84260,49288,21901,2,USD 60.00,2025-05-19;12:10:25 pm,,60.0,60.0,120.0,2025-05-19 12:10:25.000,2025-05-19,2025,5,19,49288,[],()
82537,48840,21937,2,USD55.50,2025-03-22T02:19:02.512,,55.5,55.5,111.0,2025-03-22 02:19:02.512,2025-03-22,2025,3,22,48840,[],()
84517,48556,21597,1,USD66.,"2025-01-06,05:50:34","Suite 502 968 Jina Drive, Lake Perryshire, NE 27236",66.0,66.0,66.0,2025-01-06 05:50:34.000,2025-01-06,2025,1,6,48556,[],()
79380,48882,21657,1,22.€,2024-12-24 03:12:23 am,"571 Estela Row, Reubenfurt, OR 73300-9904",26.4,26.4,26.4,2024-12-24 03:12:23.000,2024-12-24,2024,12,24,48882,[],()
81936,51091,21575,1,69.0$,2024-07-14;16:54,,69.0,69.0,69.0,2024-07-14 16:54:00.000,2024-07-14,2024,7,14,51091,[],()
83687,48309,21750,1,$29.99,2025-01-08 17:02,,29.99,29.99,29.99,2025-01-08 17:02:00.000,2025-01-08,2025,1,8,48309,[],()
84226,49824,21749,4,$74.25,11:37:14 P.M.;2025-03-14,NULL,74.25,74.25,297.0,2025-03-14 23:37:14.000,2025-03-14,2025,3,14,49824,[],()
83179,51032,22005,5,$42., 5-FEB-2025;04:46,"50496 Denesik Pike, West Rey, AZ 95608-2514",42.0,42.0,210.0,2025-02-05 04:46:00.000,2025-02-05,2025,2,5,51032,[],()
84881,49229,21475,1,$26.25,15-April-2025 00:08:05,,26.25,26.25,26.25,2025-04-15 00:08:05.000,2025-04-15,2025,4,15,48957,[],()
83573,50798,21664,1,46.25 $,07:01;04/19/25,,46.25,46.25,46.25,2025-04-19 07:01:00.000,2025-04-19,2025,4,19,50798,[],()
83404,48760,21876,2,USD31.,09/25/24;10:52:18 P.M.,"95845 Ward Centers, New Casey, VA 02186-1672",31.0,31.0,62.0,2024-09-25 22:52:18.000,2024-09-25,2024,9,25,48760,[],()
78151,50664,21657,1,20.25€,"2024-08-01, 12:00",,24.3,24.3,24.3,2024-08-01 12:00:00.000,2024-08-01,2024,8,1,50664,[],()
77946,49847,21413,1,USD41,"2024-11-08,07:09:39 A.M.",,41.0,41.0,41.0,2024-11-08 07:09:39.000,2024-11-08,2024,11,8,49847,[],()
83827,49935,21949,1,USD 44.99,"2024-08-16, 04:19",,44.99,44.99,44.99,2024-08-16 04:19:00.000,2024-08-16,2024,8,16,49935,[],()
79842,50031,21879,1,59.75USD,"11:49, 12/23/24","3254 Stoltenberg Manors, Thomasport, NC 07978",59.75,59.75,59.75,2024-12-23 11:49:00.000,2024-12-23,2024,12,23,50031,[],()
85298,49369,21849,1,$36.00,"05/31/24, 09:29:46 A.M.",,36.0,36.0,36.0,2024-05-31 09:29:46.000,2024-05-31,2024,5,31,49369,[],()
83326,50565,21951,1,USD 32.50,02/01/25;08:15:38 PM,,32.5,32.5,32.5,2025-02-01 20:15:38.000,2025-02-01,2025,2,1,49394,[],()
86045,48238,21858,1,22.5 EUR,07:10:13 A.M. 03/18/25,,27.0,27.0,27.0,2025-03-18 07:10:13.000,2025-03-18,2025,3,18,48238,[],()
78476,47992,21973,2,70. USD,"2024-10-11, 11:51:57",,70.0,70.0,140.0,2024-10-11 11:51:57.000,2024-10-11,2024,10,11,47992,[],()
77969,50312,21949,1,44.0$,"16:17, 21-April-2025",,44.0,44.0,44.0,2025-04-21 16:17:00.000,2025-04-21,2025,4,21,50312,[],()
81239,49414,21413,1,€37.75,2024-10-06T21:29:09.661,NULL,45.3,45.3,45.3,2024-10-06 21:29:09.661,2024-10-06,2024,10,6,49002,[],()
80707,48490,21299,3,64.25$,29-OCT-2024 13:43:41,,64.25,64.25,192.75,2024-10-29 13:43:41.000,2024-10-29,2024,10,29,48490,[],()
78157,49866,21579,3,USD 71.75,14:37:58;29-OCT-2024,,71.75,71.75,215.25,2024-10-29 14:37:58.000,2024-10-29,2024,10,29,49866,[],()
79859,49345,21555,1,48.0 USD,04:46:34 P.M.;07/08/25,"1505 Greenfelder Fall, West Stephanbury, MI 11548",48.0,48.0,48.0,2025-07-08 16:46:34.000,2025-07-08,2025,7,8,49345,[],()
86388,50834,21896,1,USD17.25,10:15:57 am 2025-01-28,,17.25,17.25,17.25,2025-01-28 10:15:57.000,2025-01-28,2025,1,28,50834,[],()
84516,49134,21436,1,$62.75,"22:10,2024-06-12",,62.75,62.75,62.75,2024-06-12 22:10:00.000,2024-06-12,2024,6,12,49134,[],()
83252,47771,21298,1,51.50$,"02/15/25, 12:25",,51.5,51.5,51.5,2025-02-15 12:25:00.000,2025-02-15,2025,2,15,47771,[],()
86216,48597,21606,1,39. $,"2024-12-04,20:19:43",,39.0,39.0,39.0,2024-12-04 20:19:43.000,2024-12-04,2024,12,4,48597,[],()
81774,48299,21525,3,37.0USD,06/24/24;10:08:14 PM,NULL,37.0,37.0,111.0,2024-06-24 22:08:14.000,2024-06-24,2024,6,24,48299,[],()
84521,48588,21696,1,$38.00,2025-03-26;19:03,,38.0,38.0,38.0,2025-03-26 19:03:00.000,2025-03-26,2025,3,26,48588,[],()
82394,50513,21353,1,28.25 €,2024-10-15;14:17,,33.9,33.9,33.9,2024-10-15 14:17:00.000,2024-10-15,2024,10,15,50513,[],()
86021,50706,21327,1,$20.00,"2025-04-11,04:30","Apt. 788 80491 Walsh Field, Vandervortport, WI 22764",20.0,20.0,20.0,2025-04-11 04:30:00.000,2025-04-11,2025,4,11,50706,[],()
86502,48661,21802,1,45.5 €,13-April-2025 11:57:36 P.M.,NULL,54.6,54.6,54.6,2025-04-13 23:57:36.000,2025-04-13,2025,4,13,48661,[],()
82192,50558,21666,1,65. $,2025-02-08T09:35:58.253,,65.0,65.0,65.0,2025-02-08 09:35:58.253,2025-02-08,2025,2,8,50558,[],()
77749,50540,21338,2,EUR40.99,08/21/24;06:47,"Suite 969 22264 Kuhn Isle, West Samfurt, LA 86874-5635",49.188,49.188,98.38,2024-08-21 06:47:00.000,2024-08-21,2024,8,21,50540,[],()
82366,50361,21890,1,€69,2024-09-21 01:14:13 pm,,82.8,82.8,82.8,2024-09-21 13:14:13.000,2024-09-21,2024,9,21,50361,[],()
80248,48159,22045,1,USD38.75,"08/26/24, 14:25",NULL,38.75,38.75,38.75,2024-08-26 14:25:00.000,2024-08-26,2024,8,26,48159,[],()
82210,49376,21986,3,$50¢25,"2024-10-03, 22:38:13",,5025.0,5025.0,15075.0,2024-10-03 22:38:13.000,2024-10-03,2024,10,3,49376,[],()
81235,48935,21639,1,44.50 $,11:45;2024-04-08,NULL,44.5,44.5,44.5,2024-04-08 11:45:00.000,2024-04-08,2024,4,8,48935,[],()
84368,50476,21634,4,€ 72.99,2025-06-27T13:38:24,"Suite 175 182 Upton Avenue, New Delmerberg, IL 41182-4825",87.588,87.588,350.35,2025-06-27 13:38:24.000,2025-06-27,2025,6,27,50476,[],()
80087,48120,21781,1,66.25$,23:44;07/16/25,,66.25,66.25,66.25,2025-07-16 23:44:00.000,2025-07-16,2025,7,16,48120,[],()
84852,49645,21923,1,15.25€,2025-06-01;06:18:32 pm,,18.3,18.3,18.3,2025-06-01 18:18:32.000,2025-06-01,2025,6,1,49645,[],()
79054,47856,21542,1,$ 31.5,"2025-02-01,12:17",NULL,31.5,31.5,31.5,2025-02-01 12:17:00.000,2025-02-01,2025,2,1,47856,[],()
80041,48373,21340,3,47.5$,"2024-07-30, 10:46:27 P.M.",,47.5,47.5,142.5,2024-07-30 22:46:27.000,2024-07-30,2024,7,30,48373,[],()
83296,48708,21908,1,18.99$,"2024-12-17,08:08:29 A.M.",,18.99,18.99,18.99,2024-12-17 08:08:29.000,2024-12-17,2024,12,17,48708,[],()
80067,48215,21793,1,30.0 $,"10/12/24,03:07:54 am",NULL,30.0,30.0,30.0,2024-10-12 03:07:54.000,2024-10-12,2024,10,12,48215,[],()
85977,50326,21995,1,USD 45.50,05:17:36 P.M.;2024-08-12,NULL,45.5,45.5,45.5,2024-08-12 17:17:36.000,2024-08-12,2024,8,12,50326,[],()
78309,48497,21451,1,$ 73.5,02/01/25;10:41,,73.5,73.5,73.5,2025-02-01 10:41:00.000,2025-02-01,2025,2,1,48497,[],()
84211,48368,21341,1,$ 19.75,2024-04-16T11:41:10.562,,19.75,19.75,19.75,2024-04-16 11:41:10.562,2024-04-16,2024,4,16,48368,[],()
80721,47667,21949,1,46.50 $,"10:40:11 PM, 09/21/24","91389 Renna Pine, West Irena, IA 05904",46.5,46.5,46.5,2024-09-21 22:40:11.000,2024-09-21,2024,9,21,47667,[],()
77835,50405,21591,1,€51¢99,25.07.2024 13:36:36,,6238.8,6238.8,6238.8,2024-07-25 13:36:36.000,2024-07-25,2024,7,25,50405,[],()
84718,48712,21587,1,USD 69.0,10/14/24;01:09,NULL,69.0,69.0,69.0,2024-10-14 01:09:00.000,2024-10-14,2024,10,14,48712,[],()
80063,49867,21508,2,$26.25,"2025-01-05,22:26:58",,26.25,26.25,52.5,2025-01-05 22:26:58.000,2025-01-05,2025,1,5,49867,[],()
84178,48394,21403,5,USD 53,08:00:00 A.M. 2025-01-20,,53.0,53.0,265.0,2025-01-20 08:00:00.000,2025-01-20,2025,1,20,48394,[],()
86032,49240,21588,5,62.99EUR,02:39;24-Apr-2024,NULL,75.588,75.588,377.94,2024-04-24 02:39:00.000,2024-04-24,2024,4,24,49240,[],()
81709,49881,21411,1,USD 33.25,"09/30/24,19:20",NULL,33.25,33.25,33.25,2024-09-30 19:20:00.000,2024-09-30,2024,9,30,49881,[],()
79599,48251,21773,1,USD 41,"25-Dec-2024, 04:58:31",,41.0,41.0,41.0,2024-12-25 04:58:31.000,2024-12-25,2024,12,25,48251,[],()
83844,49689,21417,1,$64,2024-11-06T08:20:28,NULL,64.0,64.0,64.0,2024-11-06 08:20:28.000,2024-11-06,2024,11,6,49689,[],()
81909,48949,21669,1,20.00 $,14:57 24-OCT-2024,"Apt. 900 7908 Klocko Dam, Luciuschester, NV 37026",20.0,20.0,20.0,2024-10-24 14:57:00.000,2024-10-24,2024,10,24,48949,[],()
82506,49077,21734,1,USD48.0,"09/11/24,04:27:37 A.M.",,48.0,48.0,48.0,2024-09-11 04:27:37.000,2024-09-11,2024,9,11,49077,[],()
80674,48300,21636,1,USD 14.0,20:02:39 29-Sep-2024,,14.0,14.0,14.0,2024-09-29 20:02:39.000,2024-09-29,2024,9,29,51081,[],()
78613,48809,21905,1,30.75 USD,2024-04-03T21:19:21.644,,30.75,30.75,30.75,2024-04-03 21:19:21.644,2024-04-03,2024,4,3,48809,[],()
83082,48259,21989,1,EUR73.,18.10.2025 02:34:34,NULL,87.6,87.6,87.6,2025-10-18 02:34:34.000,2025-10-18,2025,10,18,48259,[],()
83310,50530,21919,1,59.0 EUR,2024-10-27T22:34:41,"Suite 173 935 Gulgowski Canyon, Dareberg, CA 63104",70.8,70.8,70.8,2024-10-27 22:34:41.000,2024-10-27,2024,10,27,50530,[],()
80258,51036,21328,1,60.99EUR,"05:42:13 A.M., 2024-12-28",,73.188,73.188,73.19,2024-12-28 05:42:13.000,2024-12-28,2024,12,28,51036,[],()
83342,48296,21369,1,38.5 $,"06/13/25,10:18:04",,38.5,38.5,38.5,2025-06-13 10:18:04.000,2025-06-13,2025,6,13,48296,[],()
85578,50276,21376,1,USD54.50,2025-04-15T03:34:10.927,,54.5,54.5,54.5,2025-04-15 03:34:10.927,2025-04-15,2025,4,15,50276,[],()
83561,50762,21958,1,76. $,2024-07-27T04:00:54,,76.0,76.0,76.0,2024-07-27 04:00:54.000,2024-07-27,2024,7,27,50762,[],()
82027,49021,21933,1,$54.50,2024-09-05T04:11:58.088,,54.5,54.5,54.5,2024-09-05 04:11:58.088,2024-09-05,2024,9,5,49021,[],()
86100,50477,22048,1,$ 41.75,"28-Nov-2024,12:26:42 am",,41.75,41.75,41.75,2024-11-28 00:26:42.000,2024-11-28,2024,11,28,50131,[],()
81905,49868,21768,1,23.0$,"06/12/25,05:00","Apt. 532 38256 Rutherford Knoll, West Asa, AL 21872-2513",23.0,23.0,23.0,2025-06-12 05:00:00.000,2025-06-12,2025,6,12,49868,[],()
85263,49611,21601,1,52.99€,"04:49, 18-May-2025",,63.588,63.588,63.59,2025-05-18 04:49:00.000,2025-05-18,2025,5,18,49611,[],()
84885,48050,21566,1,$24.0,00:26:11 2024-11-19,"Suite 106 68865 Hermiston Forest, Alyshaport, FL 17749",24.0,24.0,24.0,2024-11-19 00:26:11.000,2024-11-19,2024,11,19,48050,[],()
81529,48561,21401,2,€ 28.0,01/18/25 12:12:44,NULL,33.6,33.6,67.2,2025-01-18 12:12:44.000,2025-01-18,2025,1,18,48561,[],()
81871,51015,21508,2,27.00 €,12-Aug-2024;05:36:15,"49790 Ira Fields, Littlehaven, KS 33772",32.4,32.4,64.8,2024-08-12 05:36:15.000,2024-08-12,2024,8,12,51015,[],()
84825,48205,21369,1,USD38.5,"00:46,2024-05-17",NULL,38.5,38.5,38.5,2024-05-17 00:46:00.000,2024-05-17,2024,5,17,48205,[],()
81776,48401,21966,1,USD23,"30-MAR-2025,03:12:32 P.M.",NULL,23.0,23.0,23.0,2025-03-30 15:12:32.000,2025-03-30,2025,3,30,48401,[],()
83697,48541,21840,1,17.5USD,"03:59:49 A.M., 07/25/24",NULL,17.5,17.5,17.5,2024-07-25 03:59:49.000,2024-07-25,2024,7,25,49932,[],()
81849,50488,21583,3,$ 56.,2024-10-10T06:56:29,"533 Hipolito Burg, New Jennineshire, CT 03883",56.0,56.0,168.0,2024-10-10 06:56:29.000,2024-10-10,2024,10,10,50488,[],()
83443,48553,22023,1,EUR17.75,2024-11-27T21:44:39.211,,21.3,21.3,21.3,2024-11-27 21:44:39.211,2024-11-27,2024,11,27,48553,[],()
85890,49325,21765,2,USD 24.50,2025-06-12 16:23,,24.5,24.5,49.0,2025-06-12 16:23:00.000,2025-06-12,2025,6,12,49325,[],()
79725,50839,21518,1,€41¢25,"04/12/25,20:04:43",,4950.0,4950.0,4950.0,2025-04-12 20:04:43.000,2025-04-12,2025,4,12,50839,[],()
84990,47882,21898,1,$ 52.99,09:44:26 AM 16-APR-2025,NULL,52.99,52.99,52.99,2025-04-16 09:44:26.000,2025-04-16,2025,4,16,47882,[],()
82953,49005,21750,1,34. USD,"06:20:24 A.M., 2025-02-28",,34.0,34.0,34.0,2025-02-28 06:20:24.000,2025-02-28,2025,2,28,49005,[],()
78001,50473,21390,1,46 $,"20:29:54,08/06/24","Apt. 567 24407 Dickens Junctions, New Tinytown, AR 19603-1428",46.0,46.0,46.0,2024-08-06 20:29:54.000,2024-08-06,2024,8,6,50473,[],()
80499,48182,21906,3,41.75 €,"08:09, 01/06/25",,50.1,50.1,150.3,2025-01-06 08:09:00.000,2025-01-06,2025,1,6,48182,[],()
85899,50058,21598,1,22.0$,2024-08-28T07:06:12,NULL,22.0,22.0,22.0,2024-08-28 07:06:12.000,2024-08-28,2024,8,28,50058,[],()
78953,48023,21839,1,70.0 USD,09:13:42;2025-01-27,"Suite 150 8581 Jesse Unions, Lake Owenstad, IA 67194-2474",70.0,70.0,70.0,2025-01-27 09:13:42.000,2025-01-27,2025,1,27,48023,[],()
80955,49448,22056,1,20.75 USD,2025-02-12;06:53,,20.75,20.75,20.75,2025-02-12 06:53:00.000,2025-02-12,2025,2,12,49448,[],()
80047,48619,21974,2,EUR 61,"2024-05-23, 04:49:33 PM",,73.2,73.2,146.4,2024-05-23 16:49:33.000,2024-05-23,2024,5,23,48619,[],()
82066,48258,21355,1,56.$,04:48 2025-07-05,,56.0,56.0,56.0,2025-07-05 04:48:00.000,2025-07-05,2025,7,5,48258,[],()
83907,48211,21603,1,51. $,"10:16, 03/26/25",,51.0,51.0,51.0,2025-03-26 10:16:00.000,2025-03-26,2025,3,26,48211,[],()
84119,47950,21634,1,USD 71.75,07/19/24 03:47,,71.75,71.75,71.75,2024-07-19 03:47:00.000,2024-07-19,2024,7,19,47950,[],()
83825,49303,21912,1,66$75¢,01:32:04 am 2024-08-30,NULL,6675.0,6675.0,6675.0,2024-08-30 01:32:04.000,2024-08-30,2024,8,30,49303,[],()
82620,49001,21304,1,14.25$,"27-February-2025, 08:32:04 am",,14.25,14.25,14.25,2025-02-27 08:32:04.000,2025-02-27,2025,2,27,49620,[],()
78607,49549,21428,1,64.75€,"09:50, 24-OCT-2024",,77.7,77.7,77.7,2024-10-24 09:50:00.000,2024-10-24,2024,10,24,49549,[],()
86389,48781,21505,1,$44.,2024-09-04 15:49:39,NULL,44.0,44.0,44.0,2024-09-04 15:49:39.000,2024-09-04,2024,9,4,48781,[],()
79400,48809,22028,1,63 $,2025-09-18;10:38:09 PM,NULL,63.0,63.0,63.0,2025-09-18 22:38:09.000,2025-09-18,2025,9,18,48809,[],()
81521,49511,21481,2,$ 17.99,03:17:40 P.M.;2025-10-04,NULL,17.99,17.99,35.98,2025-10-04 15:17:40.000,2025-10-04,2025,10,4,49511,[],()
82477,50180,21598,2,19.00USD,"07:03,2024-10-15","Apt. 465 940 Luettgen Ford, Port Man, AZ 60841",19.0,19.0,38.0,2024-10-15 07:03:00.000,2024-10-15,2024,10,15,50180,[],()
83826,49041,21600,1,22.0$,03:53:07;11-Nov-2024,,22.0,22.0,22.0,2024-11-11 03:53:07.000,2024-11-11,2024,11,11,49041,[],()
77669,49475,21560,3,$14.25,"2024-12-25,04:22:04",NULL,14.25,14.25,42.75,2024-12-25 04:22:04.000,2024-12-25,2024,12,25,49475,[],()
80656,48516,21709,2,52.99USD,2025-01-10T15:01:45,,52.99,52.99,105.98,2025-01-10 15:01:45.000,2025-01-10,2025,1,10,48516,[],()
80859,49432,21893,3,USD 70.75,"2025-04-24,09:11",,70.75,70.75,212.25,2025-04-24 09:11:00.000,2025-04-24,2025,4,24,49432,[],()
79724,49683,21663,1,€68¢25,"15:14:52, 2024-10-15","94357 Nga Isle, South Isaias, PA 85722-2984",8190.0,8190.0,8190.0,2024-10-15 15:14:52.000,2024-10-15,2024,10,15,49683,[],()
82596,48393,21465,1,USD71.5,"14:32,2025-08-16",NULL,71.5,71.5,71.5,2025-08-16 14:32:00.000,2025-08-16,2025,8,16,48393,[],()
80957,48945,21945,1,USD18.99,2024-08-18T23:53:31.835,"Suite 101 9661 Thelma Streets, East Ianhaven, MS 99577",18.99,18.99,18.99,2024-08-18 23:53:31.835,2024-08-18,2024,8,18,48945,[],()
86368,47875,21434,1,USD 26.99,"10:09, 9-Apr-2025",,26.99,26.99,26.99,2025-04-09 10:09:00.000,2025-04-09,2025,4,9,47875,[],()
82401,48044,21401,1,$ 31.75,"2024-10-21,11:22:11",NULL,31.75,31.75,31.75,2024-10-21 11:22:11.000,2024-10-21,2024,10,21,48044,[],()
79367,50832,21386,1,USD 44.99,"15:23,2025-02-01",,44.99,44.99,44.99,2025-02-01 15:23:00.000,2025-02-01,2025,2,1,50832,[],()
85232,49597,21941,1,$ 51.75,2024-10-01;01:44:12,,51.75,51.75,51.75,2024-10-01 01:44:12.000,2024-10-01,2024,10,1,49597,[],()
80441,50419,21335,2,33.0 USD,11:01:52 am 23-December-2024,NULL,33.0,33.0,66.0,2024-12-23 11:01:52.000,2024-12-23,2024,12,23,50419,[],()
78746,51068,22017,1,USD 27.50,05:51:48 2024-12-22,,27.5,27.5,27.5,2024-12-22 05:51:48.000,2024-12-22,2024,12,22,49652,[],()
79226,48010,21305,1,30.99$,"07/13/25, 02:59","9144 Prohaska Course, Lannyfort, IN 35270-1206",30.99,30.99,30.99,2025-07-13 02:59:00.000,2025-07-13,2025,7,13,48010,[],()
77689,48761,21644,2,32.0 EUR,13:38 2024-08-18,"6890 Elsy Place, Justinland, NY 62986-3085",38.4,38.4,76.8,2024-08-18 13:38:00.000,2024-08-18,2024,8,18,48761,[],()
82983,49511,21480,1,USD 48.50," 6-Aug-2024,03:43:00",NULL,48.5,48.5,48.5,2024-08-06 03:43:00.000,2024-08-06,2024,8,6,49511,[],()
82393,48852,21570,3,28.25USD,04:34:46 P.M.;14-APR-2025,,28.25,28.25,84.75,2025-04-14 16:34:46.000,2025-04-14,2025,4,14,48852,[],()
78263,47763,21655,5,€ 17.50,"05:15:21 AM, 2024-11-13",NULL,21.0,21.0,105.0,2024-11-13 05:15:21.000,2024-11-13,2024,11,13,47763,[],()
82886,48466,21442,1,$46¢00,"00:12, 02/11/25",,4600.0,4600.0,4600.0,2025-02-11 00:12:00.000,2025-02-11,2025,2,11,48466,[],()
81046,50799,21644,1,37.00 $,2024-10-11 05:10:45 am,NULL,37.0,37.0,37.0,2024-10-11 05:10:45.000,2024-10-11,2024,10,11,50799,[],()
83609,48259,21429,1,€27.5, 4-Mar-2025 21:25:01,,33.0,33.0,33.0,2025-03-04 21:25:01.000,2025-03-04,2025,3,4,48259,[],()
80408,48073,21642,1,35.0€,"15-Aug-2024,07:37:05",,42.0,42.0,42.0,2024-08-15 07:37:05.000,2024-08-15,2024,8,15,48073,[],()
84739,48168,21461,2,76.50$,"11:08, 10-DEC-2024",NULL,76.5,76.5,153.0,2024-12-10 11:08:00.000,2024-12-10,2024,12,10,48168,[],()
84360,48102,21613,1,$54.75,"08/31/24, 08:04:16 PM",NULL,54.75,54.75,54.75,2024-08-31 20:04:16.000,2024-08-31,2024,8,31,48102,[],()
81001,48700,21476,1,USD 34.99,"2025-03-26,08:34:36 am","29313 Charles Ranch, South Clair, VA 62232",34.99,34.99,34.99,2025-03-26 08:34:36.000,2025-03-26,2025,3,26,48700,[],()
85847,47763,21591,2,54.75$,05:53:32 AM 10/12/24,"Suite 612 723 Larhonda Square, Shauntehaven, TX 55075-9041",54.75,54.75,109.5,2024-10-12 05:53:32.000,2024-10-12,2024,10,12,47763,[],()
79634,50533,21952,1,USD 50.0,"2024-07-27,16:07",NULL,50.0,50.0,50.0,2024-07-27 16:07:00.000,2024-07-27,2024,7,27,50533,[],()
79747,48856,21733,1,€17.5,2024-09-01 00:44:53,NULL,21.0,21.0,21.0,2024-09-01 00:44:53.000,2024-09-01,2024,9,1,48622,[],()
86466,47733,21587,1,69.25 $,04:03:21 2025-01-02,"193 Pollich Centers, New Doloris, NJ 06979",69.25,69.25,69.25,2025-01-02 04:03:21.000,2025-01-02,2025,1,2,47733,[],()
81503,51100,21938,5,71.75 EUR,"22-Oct-2024,18:48:35","Suite 670 291 Wolff Rue, Chasemouth, HI 36369",86.1,86.1,430.5,2024-10-22 18:48:35.000,2024-10-22,2024,10,22,51100,[],()
83314,48409,22004,1,USD 67.25,06:27:59 A.M.;07/11/25,,67.25,67.25,67.25,2025-07-11 06:27:59.000,2025-07-11,2025,7,11,48409,[],()
83350,49880,21427,1,74.25 USD,28.05.2024  4:18:18,,74.25,74.25,74.25,2024-05-28 04:18:18.000,2024-05-28,2024,5,28,49880,[],()
84414,47727,21539,1,USD16.99,09/25/24 07:21:12 PM,,16.99,16.99,16.99,2024-09-25 19:21:12.000,2024-09-25,2024,9,25,47727,[],()
82662,48687,21843,5,64.00€,17:04:07;04/24/25,,76.8,76.8,384.0,2025-04-24 17:04:07.000,2025-04-24,2025,4,24,48687,[],()
77595,50153,21371,1,54.0 USD,2024-07-23T13:36:27,"1749 Cartwright Street, Altonborough, MA 08540-4989",54.0,54.0,54.0,2024-07-23 13:36:27.000,2024-07-23,2024,7,23,50153,[],()
83027,49500,21311,1,USD18.5,"17:33,13-Nov-2024","1125 Otha Prairie, South Kathlenetown, AR 37930",18.5,18.5,18.5,2024-11-13 17:33:00.000,2024-11-13,2024,11,13,49500,[],()
84785,50534,21620,1,33.0EUR,"00:53,02/16/25","Apt. 275 53000 Soon Key, South Albert, NH 90077",39.6,39.6,39.6,2025-02-16 00:53:00.000,2025-02-16,2025,2,16,50534,[],()
78054,51024,21473,1,USD 38.,"2024-12-31, 03:27:10 pm","318 Goyette Center, New Kaitlinfort, WY 97237",38.0,38.0,38.0,2024-12-31 15:27:10.000,2024-12-31,2024,12,31,51024,[],()
85787,47782,21717,1,$35¢75,"21-July-2025,18:08:38",,3575.0,3575.0,3575.0,2025-07-21 18:08:38.000,2025-07-21,2025,7,21,47782,[],()
84642,48672,21351,1,40.99USD,19:20;17-Dec-2024,"660 McCullough Coves, Mohammedbury, NC 94662-4005",40.99,40.99,40.99,2024-12-17 19:20:00.000,2024-12-17,2024,12,17,48672,[],()
81459,47797,21488,1,EUR 71.75,10:11:52;28-AUG-2024,NULL,86.1,86.1,86.1,2024-08-28 10:11:52.000,2024-08-28,2024,8,28,47797,[],()
84198,47942,21316,1,34.50 EUR,"2024-12-13,04:50:30 A.M.",,41.4,41.4,41.4,2024-12-13 04:50:30.000,2024-12-13,2024,12,13,47942,[],()
79041,48980,21493,1,USD 24.50,2024-10-24;20:32:45,,24.5,24.5,24.5,2024-10-24 20:32:45.000,2024-10-24,2024,10,24,48980,[],()
80122,50266,21994,1,€ 31.0,"15-DEC-2024,15:24",NULL,37.199999999999996,37.199999999999996,37.2,2024-12-15 15:24:00.000,2024-12-15,2024,12,15,50412,[],()
83353,49845,21776,1,$73.99,"03:56:05 P.M.,30-January-2025",,73.99,73.99,73.99,2025-01-30 15:56:05.000,2025-01-30,2025,1,30,49845,[],()
85521,49845,21960,1,57.25 USD,16:49 2024-11-30,NULL,57.25,57.25,57.25,2024-11-30 16:49:00.000,2024-11-30,2024,11,30,49845,[],()
80653,49871,21843,1,65.5€,"2024-08-28, 19:43",,78.6,78.6,78.6,2024-08-28 19:43:00.000,2024-08-28,2024,8,28,49392,[],()
84887,50548,21437,1,$55.5,19-May-2025 17:51:09,NULL,55.5,55.5,55.5,2025-05-19 17:51:09.000,2025-05-19,2025,5,19,50548,[],()
83100,48096,21437,5,54.0€,2024-11-21T03:56:09,,64.8,64.8,324.0,2024-11-21 03:56:09.000,2024-11-21,2024,11,21,48096,[],()
84421,48814,21460,1,64.50 $,05/08/25;09:18:54 pm,NULL,64.5,64.5,64.5,2025-05-08 21:18:54.000,2025-05-08,2025,5,8,48814,[],()
80791,50735,21677,1,€ 34.0,2024-12-24T23:19:04.108,"Apt. 616 7277 Arden Pines, North Howard, NC 98598",40.8,40.8,40.8,2024-12-24 23:19:04.108,2024-12-24,2024,12,24,50179,[],()
86512,50345,21956,1,USD 21.5,2024-09-19;05:01:16 PM,"Apt. 762 163 Oralia Extension, Keelytown, OR 16000",21.5,21.5,21.5,2024-09-19 17:01:16.000,2024-09-19,2024,9,19,50345,[],()
85352,50023,21984,1,USD55.25,"18:11:01, 09/29/24","Apt. 339 5965 Cletus Lock, Delisachester, IL 04684",55.25,55.25,55.25,2024-09-29 18:11:01.000,2024-09-29,2024,9,29,50023,[],()
85334,50831,21683,2,47.75$,2024-10-08;08:13:24,"2067 Wilbert Springs, Lake Ward, LA 03571-8262",47.75,47.75,95.5,2024-10-08 08:13:24.000,2024-10-08,2024,10,8,50831,[],()
84832,49818,21908,1,18.99 €,2025-03-03;14:46:46,,22.787999999999997,22.787999999999997,22.79,2025-03-03 14:46:46.000,2025-03-03,2025,3,3,49818,[],()
78314,49925,22036,4,USD 48.99,Tue Dec 17 21:45:59 2024,,48.99,48.99,195.96,2024-12-17 21:45:59.000,2024-12-17,2024,12,17,47953,[],()
81163,50380,21912,1,EUR69.99,11:09:19 PM 07/21/25,,83.98799999999999,83.98799999999999,83.99,2025-07-21 23:09:19.000,2025-07-21,2025,7,21,50380,[],()
77970,48580,21482,5,EUR 66.5,11:27:21 am;11/08/24,,79.8,79.8,399.0,2024-11-08 11:27:21.000,2024-11-08,2024,11,8,48580,[],()
84988,48499,21429,2,€ 27.0,23:51 12-September-2024,NULL,32.4,32.4,64.8,2024-09-12 23:51:00.000,2024-09-12,2024,9,12,48499,[],()
79551,48269,21841,1,€59.75,"2025-01-05, 20:35:32",NULL,71.7,71.7,71.7,2025-01-05 20:35:32.000,2025-01-05,2025,1,5,48269,[],()
77832,50878,21489,1,EUR 22.50,13:25:37;2024-12-26,,27.0,27.0,27.0,2024-12-26 13:25:37.000,2024-12-26,2024,12,26,50878,[],()
84788,50706,21886,1,$ 49.5,"08:49:42 pm,2024-12-03",,49.5,49.5,49.5,2024-12-03 20:49:42.000,2024-12-03,2024,12,3,50706,[],()
85507,48549,21433,3,44.75$,22:17:15 02/08/25,"Suite 241 72999 Isreal Mews, Mariaview, MD 01948",44.75,44.75,134.25,2025-02-08 22:17:15.000,2025-02-08,2025,2,8,48549,[],()
83816,48390,21910,1,37.0 €,2024-07-22T22:12:22.035,"Suite 914 60921 Prosacco Crossroad, Watersland, WI 77297-1764",44.4,44.4,44.4,2024-07-22 22:12:22.035,2024-07-22,2024,7,22,48390,[],()
81490,49876,21489,1,€23¢99,"11-Jan-2025, 11:15:20 AM",NULL,2878.7999999999997,2878.7999999999997,2878.8,2025-01-11 11:15:20.000,2025-01-11,2025,1,11,49876,[],()
85367,48840,21717,1,33.0€,10-SEP-2024 11:52:25,"Suite 786 87261 Mariela Wall, North Vernbury, CT 66069-0789",39.6,39.6,39.6,2024-09-10 11:52:25.000,2024-09-10,2024,9,10,48840,[],()
78592,48825,21401,2,28.5 USD,11:49:29 A.M.;29-MAY-2025,,28.5,28.5,57.0,2025-05-29 11:49:29.000,2025-05-29,2025,5,29,48825,[],()
81509,49076,21851,3,USD24,2025-02-07T04:36:19.941,"Suite 178 32484 Mellisa Stream, East Eusebio, KY 94602",24.0,24.0,72.0,2025-02-07 04:36:19.941,2025-02-07,2025,2,7,49076,[],()
84209,49051,21468,1,USD 31,"11:03:03 pm, 18-FEB-2024","2576 Casper Ranch, South Kathy, MI 17170",31.0,31.0,31.0,2024-02-18 23:03:03.000,2024-02-18,2024,2,18,49051,[],()
84506,49647,21501,1,€17¢50,"05:04:03,2024-09-22",,2100.0,2100.0,2100.0,2024-09-22 05:04:03.000,2024-09-22,2024,9,22,49647,[],()
81702,50890,21548,1,37.50USD,2024-08-17;08:49:12 PM,,37.5,37.5,37.5,2024-08-17 20:49:12.000,2024-08-17,2024,8,17,50890,[],()
78505,47949,21506,1,24.50USD,14:43:20  3-Dec-2024,,24.5,24.5,24.5,2024-12-03 14:43:20.000,2024-12-03,2024,12,3,47949,[],()
81532,49705,21562,1,€30¢75,20:32 10/25/24,,3690.0,3690.0,3690.0,2024-10-25 20:32:00.000,2024-10-25,2024,10,25,49705,[],()
77954,48234,22023,1,13.5 USD," 9-August-2024, 16:13",,13.5,13.5,13.5,2024-08-09 16:13:00.000,2024-08-09,2024,8,9,48234,[],()
79357,49613,22004,5,70.25USD,2025-01-04T12:32:41.690,"Apt. 123 144 Monte Pass, Lake Nelida, NH 91403-2650",70.25,70.25,351.25,2025-01-04 12:32:41.690,2025-01-04,2025,1,4,49613,[],()
84175,49237,21399,1,65.5 USD,2025-04-19;16:56:17,,65.5,65.5,65.5,2025-04-19 16:56:17.000,2025-04-19,2025,4,19,49237,[],()
82795,48183,21435,1,$ 35.00,"08/29/24, 02:04",,35.0,35.0,35.0,2024-08-29 02:04:00.000,2024-08-29,2024,8,29,48183,[],()
84099,50307,21357,1,23.0USD,"13:52:09, 7-MAR-2025","558 Ivette Harbors, Raleighchester, IN 91053",23.0,23.0,23.0,2025-03-07 13:52:09.000,2025-03-07,2025,3,7,50307,[],()
80740,50903,21795,1,35.5 USD,"15:15:00,09/27/24",NULL,35.5,35.5,35.5,2024-09-27 15:15:00.000,2024-09-27,2024,9,27,50903,[],()
78122,50055,21376,1,54. $,"09:57:12 pm,09/26/24",,54.0,54.0,54.0,2024-09-26 21:57:12.000,2024-09-26,2024,9,26,50055,[],()
79379,50674,21907,1,USD56.0,03:53:46 am  9-March-2025,NULL,56.0,56.0,56.0,2025-03-09 03:53:46.000,2025-03-09,2025,3,9,50674,[],()
79678,49082,21542,3,32.25 EUR,14:07 2025-05-19,NULL,38.699999999999996,38.699999999999996,116.1,2025-05-19 14:07:00.000,2025-05-19,2025,5,19,49082,[],()
81055,50613,21585,1,61.75EUR,20:20:05;28-June-2024,"Suite 858 2872 Stanley Greens, East Valentine, PA 05359",74.1,74.1,74.1,2024-06-28 20:20:05.000,2024-06-28,2024,6,28,50613,[],()
83006,49267,21573,1,$27.75,26-OCT-2024 06:39:19 AM,,27.75,27.75,27.75,2024-10-26 06:39:19.000,2024-10-26,2024,10,26,49267,[],()
85195,51069,21863,2,€44.75,2024-12-07T22:01:12,"Apt. 286 14818 Manuel Curve, Carleyside, WA 45292",53.699999999999996,53.699999999999996,107.4,2024-12-07 22:01:12.000,2024-12-07,2024,12,7,51069,[],()
83140,50839,21722,1,USD33.25,"10:37,27-NOV-2024",,33.25,33.25,33.25,2024-11-27 10:37:00.000,2024-11-27,2024,11,27,50839,[],()
79605,48333,22055,4,$ 52.99,2025-01-16;06:58:23 AM,,52.99,52.99,211.96,2025-01-16 06:58:23.000,2025-01-16,2025,1,16,48333,[],()
78695,49851,21595,1,52.99 €,"12/03/24, 11:37",,63.588,63.588,63.59,2024-12-03 11:37:00.000,2024-12-03,2024,12,3,49851,[],()
83754,49749,21694,1,28.50 €,25-Jul-2024;12:27:08 pm,NULL,34.199999999999996,34.199999999999996,34.2,2024-07-25 12:27:08.000,2024-07-25,2024,7,25,49749,[],()
78077,47855,21745,1,€21.,"06:17:17,  8-Oct-2024",,25.2,25.2,25.2,2024-10-08 06:17:17.000,2024-10-08,2024,10,8,47855,[],()
81888,50809,21462,1,$24.99,Mon Nov 25 16:43:42 2024,NULL,24.99,24.99,24.99,2024-11-25 16:43:42.000,2024-11-25,2024,11,25,50809,[],()
81768,50426,22040,1,USD29.75,2024-08-28T08:06:44,,29.75,29.75,29.75,2024-08-28 08:06:44.000,2024-08-28,2024,8,28,50426,[],()
82755,50162,21491,1,30.75 EUR,2024-04-19T01:41:11.575,NULL,36.9,36.9,36.9,2024-04-19 01:41:11.575,2024-04-19,2024,4,19,50162,[],()
80374,49440,22008,2,67.5$,"03:44:46 am,2024-08-26", ,67.5,67.5,135.0,2024-08-26 03:44:46.000,2024-08-26,2024,8,26,49440,[],()
84574,50483,21326,2,64.0€,"08/04/24, 12:39","Apt. 106 692 Koepp Road, Erdmanton, TX 36600-0158",76.8,76.8,153.6,2024-08-04 12:39:00.000,2024-08-04,2024,8,4,50483,[],()
78781,48545,21539,1,€16¢50,2025-03-10T21:53:33,NULL,1980.0,1980.0,1980.0,2025-03-10 21:53:33.000,2025-03-10,2025,3,10,48545,[],()
79249,48621,21748,1,26.50€,12:14:19 2025-06-02,,31.799999999999997,31.799999999999997,31.8,2025-06-02 12:14:19.000,2025-06-02,2025,6,2,48621,[],()
81130,50272,21761,1,32.50 $,22-AUG-2024;12:08:42 pm,NULL,32.5,32.5,32.5,2024-08-22 12:08:42.000,2024-08-22,2024,8,22,50272,[],()
77952,48482,21637,1,$49.0,11/22/24;08:35:12 pm,,49.0,49.0,49.0,2024-11-22 20:35:12.000,2024-11-22,2024,11,22,48482,[],()
85685,50080,21330,1,$46.25,10-November-2024 04:53:29 PM,,46.25,46.25,46.25,2024-11-10 16:53:29.000,2024-11-10,2024,11,10,50080,[],()
78626,50343,21303,1,57.5 USD,09:26 09/19/24,NULL,57.5,57.5,57.5,2024-09-19 09:26:00.000,2024-09-19,2024,9,19,50343,[],()
79116,47681,21385,5,$28¢99,"12:35:43 am,12/23/24",NULL,2899.0,2899.0,14495.0,2024-12-23 00:35:43.000,2024-12-23,2024,12,23,47681,[],()
81437,48256,21482,1,EUR 67.5,24-Dec-2024 13:44,,81.0,81.0,81.0,2024-12-24 13:44:00.000,2024-12-24,2024,12,24,48256,[],()
78319,50788,21319,1,$ 22.00,2024-09-09T01:22:17,,22.0,22.0,22.0,2024-09-09 01:22:17.000,2024-09-09,2024,9,9,50788,[],()
83320,49275,21883,1,$ 33.00,"28-Sep-2024,12:19:45",,33.0,33.0,33.0,2024-09-28 12:19:45.000,2024-09-28,2024,9,28,49275,[],()
83970,50513,22025,2,55.0USD, 1.06.2025 23:03:03,,55.0,55.0,110.0,2025-01-06 23:03:03.000,2025-01-06,2025,1,6,50513,[],()
79922,50200,21314,2,68.50USD,"06:37:42 A.M.,07/04/24","Suite 361 61633 Mia Coves, Greenholtton, PA 79821-0791",68.5,68.5,137.0,2024-07-04 06:37:42.000,2024-07-04,2024,7,4,47871,[],()
77784,50485,21619,1,49.USD,2024-10-03T06:22:00,,49.0,49.0,49.0,2024-10-03 06:22:00.000,2024-10-03,2024,10,3,50485,[],()
78136,48985,21429,1,$29¢25,"2025-08-24, 07:23:33 am",NULL,2925.0,2925.0,2925.0,2025-08-24 07:23:33.000,2025-08-24,2025,8,24,48985,[],()
81313,48944,21969,1,$ 57.25,10.11.2024  0:21:21,,57.25,57.25,57.25,2024-10-11 00:21:21.000,2024-10-11,2024,10,11,48944,[],()
81505,48869,21674,2,USD 19.50, 7-Nov-2024 15:09:16,,19.5,19.5,39.0,2024-11-07 15:09:16.000,2024-11-07,2024,11,7,48869,[],()
80299,49829,21505,1,43.00 USD,"16:02,20-NOV-2024",NULL,43.0,43.0,43.0,2024-11-20 16:02:00.000,2024-11-20,2024,11,20,47730,[],()
77592,51022,21348,5,USD23.25,Tue May 13 00:30:03 2025,NULL,23.25,23.25,116.25,2025-05-13 00:30:03.000,2025-05-13,2025,5,13,51022,[],()
85125,50175,21837,1,62.5 €,07:29:25 2025-03-13,,75.0,75.0,75.0,2025-03-13 07:29:25.000,2025-03-13,2025,3,13,50175,[],()
81232,51116,21516,2,USD 53.75,2024-10-19;16:27,NULL,53.75,53.75,107.5,2024-10-19 16:27:00.000,2024-10-19,2024,10,19,51116,[],()
79784,49016,21554,1,EUR 71.50,"12/28/24,04:13",,85.8,85.8,85.8,2024-12-28 04:13:00.000,2024-12-28,2024,12,28,49016,[],()
79000,48498,21517,1,USD 67.25,"2024-07-16,02:06:35 P.M.",,67.25,67.25,67.25,2024-07-16 14:06:35.000,2024-07-16,2024,7,16,48498,[],()
85306,49421,21402,2,40.50$,"26-November-2024, 14:08:28","23551 Deandre Port, East Randa, WA 23751-3371",40.5,40.5,81.0,2024-11-26 14:08:28.000,2024-11-26,2024,11,26,49421,[],()
80983,49437,21721,5,54. USD,2025-01-25T17:51:56,"3797 Leuschke Mountains, Port Sherlynfurt, NM 00789",54.0,54.0,270.0,2025-01-25 17:51:56.000,2025-01-25,2025,1,25,49437,[],()
80586,50226,21687,1,57EUR,02:11:46 P.M.;21-December-2024,"8670 Derick Lights, New Gil, RI 28330",68.39999999999999,68.39999999999999,68.4,2024-12-21 14:11:46.000,2024-12-21,2024,12,21,50226,[],()
81950,51038,21533,1,$56¢00,"02/20/25,06:22",NULL,5600.0,5600.0,5600.0,2025-02-20 06:22:00.000,2025-02-20,2025,2,20,51038,[],()
86076,49710,21646,1,€75.0,2024-10-24T13:40:36.296,,90.0,90.0,90.0,2024-10-24 13:40:36.296,2024-10-24,2024,10,24,49710,[],()
82430,48845,21682,1,USD74.00,"2025-02-07, 08:12:30 A.M.",,74.0,74.0,74.0,2025-02-07 08:12:30.000,2025-02-07,2025,2,7,48845,[],()
80430,47796,21343,1,71$,01:12 2025-03-07,"Apt. 853 163 Reilly Flat, Vincentmouth, NY 21622-6154",71.0,71.0,71.0,2025-03-07 01:12:00.000,2025-03-07,2025,3,7,47796,[],()
85766,50758,21802,2,EUR47.50,"04:15:52 A.M.,  1-January-2025",NULL,57.0,57.0,114.0,2025-01-01 04:15:52.000,2025-01-01,2025,1,1,50758,[],()
82142,49954,21690,1,USD 38.75,2024-06-15T23:10:58.706,NULL,38.75,38.75,38.75,2024-06-15 23:10:58.706,2024-06-15,2024,6,15,49954,[],()
85187,50957,21542,1,USD35.,"19:32,2024-11-30",NULL,35.0,35.0,35.0,2024-11-30 19:32:00.000,2024-11-30,2024,11,30,50957,[],()
81554,49644,21504,1,57.0 USD,27-MAR-2025 03:08,,57.0,57.0,57.0,2025-03-27 03:08:00.000,2025-03-27,2025,3,27,49644,[],()
80364,48097,21684,1,56$50¢,11/04/24;04:20:56,,5650.0,5650.0,5650.0,2024-11-04 04:20:56.000,2024-11-04,2024,11,4,48097,[],()
84138,50625,21691,3,$ 14., 1-JAN-2025;05:04:45 am,"Suite 753 37034 Kreiger Turnpike, North Nadenefort, MN 93111-7234",14.0,14.0,42.0,2025-01-01 05:04:45.000,2025-01-01,2025,1,1,50625,[],()
84372,49381,21835,1,EUR 73.5,01:45;20-APR-2025,"4495 Emmitt Harbor, West Armand, VT 56771-3794",88.2,88.2,88.2,2025-04-20 01:45:00.000,2025-04-20,2025,4,20,49381,[],()
82176,47999,21508,1,26.75 €,"04:34:46, 01/19/25","957 Kathey Cape, Murrayview, ME 23512-4859",32.1,32.1,32.1,2025-01-19 04:34:46.000,2025-01-19,2025,1,19,47999,[],()
79407,48544,21930,1,24.25USD,"01:28:48,12/10/24",,24.25,24.25,24.25,2024-12-10 01:28:48.000,2024-12-10,2024,12,10,48544,[],()
80464,50005,21903,1,41.50USD,"13-Feb-2025, 07:22:51 A.M.","2309 Ismael Stravenue, New Jacob, MS 70373-4201",41.5,41.5,41.5,2025-02-13 07:22:51.000,2025-02-13,2025,2,13,50005,[],()
85967,51000,21515,2,EUR 52.25,"26-FEB-2025, 05:01",,62.699999999999996,62.699999999999996,125.4,2025-02-26 05:01:00.000,2025-02-26,2025,2,26,51000,[],()
77804,50387,21861,3,37.EUR,"01:04:53 PM,30-AUG-2024",,44.4,44.4,133.2,2024-08-30 13:04:53.000,2024-08-30,2024,8,30,50387,[],()
78474,48245,21571,1,18.USD, 2-Jan-2025 02:04:45 PM,,18.0,18.0,18.0,2025-01-02 14:04:45.000,2025-01-02,2025,1,2,48245,[],()
79796,49687,22052,1,$ 26.,2025-01-16;21:51,"90702 Gaston Crossing, New Lannie, CT 66473",26.0,26.0,26.0,2025-01-16 21:51:00.000,2025-01-16,2025,1,16,49687,[],()
80112,49520,21970,3,70.50$,05:36:22 am 12/02/24,,70.5,70.5,211.5,2024-12-02 05:36:22.000,2024-12-02,2024,12,2,49520,[],()
85984,48716,21493,1,$24¢50,2024-08-21T17:52:31.279,,2450.0,2450.0,2450.0,2024-08-21 17:52:31.279,2024-08-21,2024,8,21,48716,[],()
81250,50958,21824,1,62.75$,06:03:15 27-Jun-2025,NULL,62.75,62.75,62.75,2025-06-27 06:03:15.000,2025-06-27,2025,6,27,50958,[],()
78170,50396,21508,1,22.99€,2024-09-16;03:05:34 P.M.,NULL,27.587999999999997,27.587999999999997,27.59,2024-09-16 15:05:34.000,2024-09-16,2024,9,16,50396,[],()
77601,50972,21995,5,€ 45.99,2024-10-27;00:07:19,,55.188,55.188,275.94,2024-10-27 00:07:19.000,2024-10-27,2024,10,27,50972,[],()
84474,49381,21966,2,$ 24.00,2024-06-08 06:51:17 am,NULL,24.0,24.0,48.0,2024-06-08 06:51:17.000,2024-06-08,2024,6,8,49381,[],()
84582,47828,21363,1,$70.0,02/11/25 12:38:48 PM,,70.0,70.0,70.0,2025-02-11 12:38:48.000,2025-02-11,2025,2,11,47828,[],()
85750,50400,21923,1,17.25 €,"05:52:14 A.M., 2025-01-26",,20.7,20.7,20.7,2025-01-26 05:52:14.000,2025-01-26,2025,1,26,50400,[],()
78555,49542,21449,1,50.99$,01:06:29 A.M.;09/16/24,,50.99,50.99,50.99,2024-09-16 01:06:29.000,2024-09-16,2024,9,16,49542,[],()
81465,49243,21432,1,34.$,2024-07-29T11:12:24.750,,34.0,34.0,34.0,2024-07-29 11:12:24.750,2024-07-29,2024,7,29,49243,[],()
78139,50344,21566,1,26€00¢,15:30 30-October-2024,NULL,3120.0,3120.0,3120.0,2024-10-30 15:30:00.000,2024-10-30,2024,10,30,50344,[],()
82464,48322,22044,1,23.00 $,20:28;16-April-2025,NULL,23.0,23.0,23.0,2025-04-16 20:28:00.000,2025-04-16,2025,4,16,48322,[],()
81051,50149,21774,1,USD20.75,"10/29/24, 04:38:04 A.M.",NULL,20.75,20.75,20.75,2024-10-29 04:38:04.000,2024-10-29,2024,10,29,50149,[],()
78543,49912,21436,1,61.5$,26.03.2024 22:42:42,"Suite 788 330 Don Gardens, Lenitahaven, OH 63213-4573",61.5,61.5,61.5,2024-03-26 22:42:42.000,2024-03-26,2024,3,26,49912,[],()
82701,50034,21606,1,38.€, 1-October-2024;13:14:32,,45.6,45.6,45.6,2024-10-01 13:14:32.000,2024-10-01,2024,10,1,50034,[],()
81178,49755,21426,5,65.99 EUR,"2024-09-07,01:21:35",NULL,79.18799999999999,79.18799999999999,395.94,2024-09-07 01:21:35.000,2024-09-07,2024,9,7,49755,[],()
79588,50313,21508,1,USD27.0,"2024-11-10, 22:19",NULL,27.0,27.0,27.0,2024-11-10 22:19:00.000,2024-11-10,2024,11,10,50313,[],()
79398,51048,21634,1,73.25 $,01/06/25;23:20:18,,73.25,73.25,73.25,2025-01-06 23:20:18.000,2025-01-06,2025,1,6,47931,[],()
86135,50669,21901,1,60.75$,2024-03-13T16:54:08,,60.75,60.75,60.75,2024-03-13 16:54:08.000,2024-03-13,2024,3,13,50669,[],()
77641,47944,21946,1,USD 54.0,"2024-12-20,08:37:09",,54.0,54.0,54.0,2024-12-20 08:37:09.000,2024-12-20,2024,12,20,47944,[],()
85039,50013,21761,1,$27.99,"09:42:28, 3-December-2024",,27.99,27.99,27.99,2024-12-03 09:42:28.000,2024-12-03,2024,12,3,50013,[],()
83514,51046,21583,5,56.5€,"21-May-2025,13:01:00","2645 Macejkovic Rest, East Judson, IL 51410-9436",67.8,67.8,339.0,2025-05-21 13:01:00.000,2025-05-21,2025,5,21,51046,[],()
84631,49552,21381,1,€27¢75,21:32;19-November-2024,,3330.0,3330.0,3330.0,2024-11-19 21:32:00.000,2024-11-19,2024,11,19,49552,[],()
77708,48699,21869,2,USD 33.75,21-August-2024 17:22:57,,33.75,33.75,67.5,2024-08-21 17:22:57.000,2024-08-21,2024,8,21,48699,[],()
77777,50337,21934,2,$46.50,11:13:07;12/09/24,NULL,46.5,46.5,93.0,2024-12-09 11:13:07.000,2024-12-09,2024,12,9,50337,[],()
81860,47895,21480,3,$53.00,20:45:45;14-July-2024,,53.0,53.0,159.0,2024-07-14 20:45:45.000,2024-07-14,2024,7,14,47895,[],()
86429,49786,21353,1,24.5 $," 2-FEB-2025, 15:39:59","2466 Langosh Forges, Port Abbeyton, WA 98102-0777",24.5,24.5,24.5,2025-02-02 15:39:59.000,2025-02-02,2025,2,2,49786,[],()
81353,48141,21998,1,€18¢50,2024-10-08T19:09:44,"Apt. 398 22366 Sandy Orchard, South Kyrafurt, NH 39582-1412",2220.0,2220.0,2220.0,2024-10-08 19:09:44.000,2024-10-08,2024,10,8,48141,[],()
79212,51066,21507,1,USD 35.25,"19-April-2025, 18:39",,35.25,35.25,35.25,2025-04-19 18:39:00.000,2025-04-19,2025,4,19,51066,[],()
86478,50781,21864,2,74.5€,19.06.2025  4:42:42,,89.39999999999999,89.39999999999999,178.8,2025-06-19 04:42:42.000,2025-06-19,2025,6,19,50781,[],()
80531,50770,21662,1,€22¢25,2024-09-25T07:23:32.519,"Apt. 308 43011 Marvin Meadows, Bertshire, SC 32907",2670.0,2670.0,2670.0,2024-09-25 07:23:32.519,2024-09-25,2024,9,25,50770,[],()
80154,49681,21680,3,$ 49.25,"05/21/25, 11:11:20 AM",,49.25,49.25,147.75,2025-05-21 11:11:20.000,2025-05-21,2025,5,21,49681,[],()
81207,48308,21437,1,€52.00,"07/08/24, 15:04",,62.4,62.4,62.4,2024-07-08 15:04:00.000,2024-07-08,2024,7,8,48308,[],()
80910,49418,21631,1,EUR 22.00,"22:18:20, 06/22/24","4997 Kathyrn Stravenue, West Dario, MA 74068-9613",26.4,26.4,26.4,2024-06-22 22:18:20.000,2024-06-22,2024,6,22,49418,[],()
84241,49660,21597,5,EUR 67.99,04:36:01 P.M.;26-December-2024,,81.588,81.588,407.94,2024-12-26 16:36:01.000,2024-12-26,2024,12,26,49660,[],()
79481,48861,21606,1,37.50USD,12:38  4-February-2025,,37.5,37.5,37.5,2025-02-04 12:38:00.000,2025-02-04,2025,2,4,48861,[],()
83198,48076,21686,4,18. USD,"07:00:04, 23-December-2024","Apt. 521 509 Yong Parkway, South Ruthanneside, VT 40270-4544",18.0,18.0,72.0,2024-12-23 07:00:04.000,2024-12-23,2024,12,23,48076,[],()
78521,50927,21955,5,56.75EUR,2024-03-25T16:10:29,"50814 Feeney Crossing, Lake Belindaville, WV 96835-7668",68.1,68.1,340.5,2024-03-25 16:10:29.000,2024-03-25,2024,3,25,50927,[],()
81976,48137,21540,1,28.0 $,2024-10-15;02:16:15 pm,NULL,28.0,28.0,28.0,2024-10-15 14:16:15.000,2024-10-15,2024,10,15,48137,[],()
83366,49804,21346,5,USD 43.25,09.11.2024 13:32:32,NULL,43.25,43.25,216.25,2024-09-11 13:32:32.000,2024-09-11,2024,9,11,49804,[],()
85857,50577,22011,1,74 $,19.06.2024 22:17:17,,74.0,74.0,74.0,2024-06-19 22:17:17.000,2024-06-19,2024,6,19,50577,[],()
82653,47980,21508,1,$ 26.5,"2024-09-22,18:46:23",NULL,26.5,26.5,26.5,2024-09-22 18:46:23.000,2024-09-22,2024,9,22,47980,[],()
80071,48718,21553,1,42$50¢,18-Dec-2024 05:29:14 am,NULL,4250.0,4250.0,4250.0,2024-12-18 05:29:14.000,2024-12-18,2024,12,18,48718,[],()
83398,50534,22017,1,USD 30.5,12:04:19 pm;26-DEC-2024,"Apt. 275 53000 Soon Key, South Albert, NH 90077",30.5,30.5,30.5,2024-12-26 12:04:19.000,2024-12-26,2024,12,26,50534,[],()
84838,49583,22043,1,13.5 USD,09:31:15; 9-DEC-2024,"Apt. 805 8124 Wisoky Spurs, Lake Lisastad, KS 09879-5704",13.5,13.5,13.5,2024-12-09 09:31:15.000,2024-12-09,2024,12,9,49583,[],()
85087,50013,21639,1,48.00$,02:04:27;2024-08-14,"Apt. 818 853 Jamel Light, Wendyport, NY 11209",48.0,48.0,48.0,2024-08-14 02:04:27.000,2024-08-14,2024,8,14,50013,[],()
80767,48447,21432,2,USD33.,2024-03-20T04:51:35.528,,33.0,33.0,66.0,2024-03-20 04:51:35.528,2024-03-20,2024,3,20,48447,[],()
83815,49052,21922,1,27.5$,2024-08-20T14:28:57,"22908 Kihn Forks, Patricefurt, WY 33453",27.5,27.5,27.5,2024-08-20 14:28:57.000,2024-08-20,2024,8,20,49052,[],()
84311,48001,21576,2,USD28.25,"20:31,10/06/24","Apt. 314 53166 Wyman Cliff, Bradtkeshire, NY 89140",28.25,28.25,56.5,2024-10-06 20:31:00.000,2024-10-06,2024,10,6,48001,[],()
80795,50783,21972,1,EUR19.75,07:00:49 2024-05-10,,23.7,23.7,23.7,2024-05-10 07:00:49.000,2024-05-10,2024,5,10,50783,[],()
85206,49194,21807,1,33.99$,01.08.2025 22:50:50,,33.99,33.99,33.99,2025-01-08 22:50:50.000,2025-01-08,2025,1,8,49194,[],()
79079,49077,21382,3,$48¢00,06:15:27 A.M. 17-NOV-2024,NULL,4800.0,4800.0,14400.0,2024-11-17 06:15:27.000,2024-11-17,2024,11,17,49077,[],()
80159,50590,21862,2,58.25 EUR,2024-12-27 06:30:27 am,,69.89999999999999,69.89999999999999,139.8,2024-12-27 06:30:27.000,2024-12-27,2024,12,27,50590,[],()
79730,50091,21848,4,61. USD,"16:32:13,2024-11-01",NULL,61.0,61.0,244.0,2024-11-01 16:32:13.000,2024-11-01,2024,11,1,50091,[],()
79805,47797,21447,5,EUR51.5,"14-Oct-2024,01:28:50",NULL,61.8,61.8,309.0,2024-10-14 01:28:50.000,2024-10-14,2024,10,14,47797,[],()
77780,49579,21504,1,57.75$,"22:36:55,10-February-2025",,57.75,57.75,57.75,2025-02-10 22:36:55.000,2025-02-10,2025,2,10,49579,[],()
80025,48563,21969,1,USD 55.50, 1-February-2025 07:27:58 P.M.,"Apt. 219 719 Danette Manor, Port Linwood, MN 04868",55.5,55.5,55.5,2025-02-01 19:27:58.000,2025-02-01,2025,2,1,48563,[],()
82656,50045,21367,1,$31¢75,Thu Jan  9 18:10:38 2025,,3175.0,3175.0,3175.0,2025-01-09 18:10:38.000,2025-01-09,2025,1,9,50045,[],()
80447,48454,21508,1,€ 23.50,17:16 10/13/24,,28.2,28.2,28.2,2024-10-13 17:16:00.000,2024-10-13,2024,10,13,48454,[],()
80221,49985,21992,1,USD 34.50,08:26:45 PM;2025-01-21,"2760 Clarissa Pike, Friesenside, DE 88444-4014",34.5,34.5,34.5,2025-01-21 20:26:45.000,2025-01-21,2025,1,21,49985,[],()
85318,50159,21310,1,69.00 $,"11:48:36,07/29/24",NULL,69.0,69.0,69.0,2024-07-29 11:48:36.000,2024-07-29,2024,7,29,50159,[],()
83601,48002,21777,5,33.5USD,2024-12-18;09:39:18,"Apt. 653 972 Jacquetta Wall, Lake Sidney, CT 17257",33.5,33.5,167.5,2024-12-18 09:39:18.000,2024-12-18,2024,12,18,48002,[],()
84427,49678,21716,1,31.0€,12/07/24;11:18:58 AM,NULL,37.199999999999996,37.199999999999996,37.2,2024-12-07 11:18:58.000,2024-12-07,2024,12,7,49678,[],()
79396,50676,21487,1,38USD,09:35:19 AM 2025-02-10,NULL,38.0,38.0,38.0,2025-02-10 09:35:19.000,2025-02-10,2025,2,10,51106,[],()
82411,50118,21694,1,USD 25.0,2024-03-09T11:08:32.016,,25.0,25.0,25.0,2024-03-09 11:08:32.016,2024-03-09,2024,3,9,50118,[],()
85817,48866,22004,1,68 EUR,04/11/25;05:02:01 pm,"Apt. 484 3830 Luettgen Oval, South Jamelside, WY 19320-8220",81.6,81.6,81.6,2025-04-11 17:02:01.000,2025-04-11,2025,4,11,48866,[],()
82597,50032,21377,1,53.5$,"09/26/24, 17:23:02","Suite 460 95052 Barton Dam, Ashleighborough, ND 82099",53.5,53.5,53.5,2024-09-26 17:23:02.000,2024-09-26,2024,9,26,50032,[],()
81230,48507,21865,1,70.75 €,"02:06:20 AM,06/13/25",,84.89999999999999,84.89999999999999,84.9,2025-06-13 02:06:20.000,2025-06-13,2025,6,13,48507,[],()
78735,50619,21830,1,EUR 67.75,02:17:01 P.M.;09/28/24,"Apt. 164 90189 Nitzsche Track, Dooleystad, WV 59474-5893",81.3,81.3,81.3,2024-09-28 14:17:01.000,2024-09-28,2024,9,28,50619,[],()
86140,48646,21695,2,$75.," 8-February-2025, 10:12:39 A.M.",,75.0,75.0,150.0,2025-02-08 10:12:39.000,2025-02-08,2025,2,8,48646,[],()
85400,48504,21696,2,39.EUR,"05:18:50 A.M., 2025-07-07","7355 Schowalter Courts, East Ronaldland, MT 92367",46.8,46.8,93.6,2025-07-07 05:18:50.000,2025-07-07,2025,7,7,48504,[],()
80886,50310,22045,1,38.25$,"02/24/25,08:23:11 am","Suite 286 42631 Lonnie Glen, West Brigid, MI 95612-2343",38.25,38.25,38.25,2025-02-24 08:23:11.000,2025-02-24,2025,2,24,50310,[],()
79657,50560,21387,1,USD 52.5,"2024-10-09, 05:24:51","Suite 743 6675 Willard Ports, North Milantown, WI 61609",52.5,52.5,52.5,2024-10-09 05:24:51.000,2024-10-09,2024,10,9,50560,[],()
77997,49938,21485,1,USD 48.25,"06:30:57 P.M., 10-February-2025",,48.25,48.25,48.25,2025-02-10 18:30:57.000,2025-02-10,2025,2,10,49938,[],()
77959,47700,21921,1,USD60.00,"19:31:43,2024-10-27",NULL,60.0,60.0,60.0,2024-10-27 19:31:43.000,2024-10-27,2024,10,27,47700,[],()
79940,50991,21528,2,$42.75,2025-06-02T12:03:44.565,,42.75,42.75,85.5,2025-06-02 12:03:44.565,2025-06-02,2025,6,2,50991,[],()
83142,47780,21755,1,USD 22.0,"05:58:04 pm,2024-08-23",,22.0,22.0,22.0,2024-08-23 17:58:04.000,2024-08-23,2024,8,23,47780,[],()
85826,51046,21629,1,USD 41.,26.08.2025 10:19:19,,41.0,41.0,41.0,2025-08-26 10:19:19.000,2025-08-26,2025,8,26,51046,[],()
83788,48213,21391,1,$ 66.75,"2025-07-21, 04:45:23 am",,66.75,66.75,66.75,2025-07-21 04:45:23.000,2025-07-21,2025,7,21,50732,[],()
79708,50458,21712,1,73.00EUR,2024-11-25T11:48:50,,87.6,87.6,87.6,2024-11-25 11:48:50.000,2024-11-25,2024,11,25,50458,[],()
79497,49551,21622,1,43.25 €, 8.09.2024 20:49:49,,51.9,51.9,51.9,2024-08-09 20:49:49.000,2024-08-09,2024,8,9,49551,[],()
80673,49993,21546,3,$47¢99,"19:54,2025-08-24","Suite 521 5507 Rob Ridges, Hellermouth, AK 43754-5616",4799.0,4799.0,14397.0,2025-08-24 19:54:00.000,2025-08-24,2025,8,24,49993,[],()
83079,49944,22027,1,$31.99,16:34:04 2024-11-11,"254 Gino Grove, Swaniawskitown, AR 11399-8693",31.99,31.99,31.99,2024-11-11 16:34:04.000,2024-11-11,2024,11,11,49534,[],()
81330,49796,21524,1,USD 45,"15:28,2024-10-20",,45.0,45.0,45.0,2024-10-20 15:28:00.000,2024-10-20,2024,10,20,49796,[],()
86247,47964,21867,1,$57.99,18:03 09/25/24,,57.99,57.99,57.99,2024-09-25 18:03:00.000,2024-09-25,2024,9,25,47964,[],()
81269,49749,21901,1,63.50 USD,Sun Feb 16 00:49:23 2025,,63.5,63.5,63.5,2025-02-16 00:49:23.000,2025-02-16,2025,2,16,49749,[],()
80332,50664,21359,1,USD27.,2025-08-03;23:30,NULL,27.0,27.0,27.0,2025-08-03 23:30:00.000,2025-08-03,2025,8,3,50664,[],()
83808,49374,21322,3,30.25 USD,05:16:30 P.M. 2025-02-11,NULL,30.25,30.25,90.75,2025-02-11 17:16:30.000,2025-02-11,2025,2,11,49374,[],()
83675,50276,22009,1,25.USD,07/30/24 09:40:05,,25.0,25.0,25.0,2024-07-30 09:40:05.000,2024-07-30,2024,7,30,50276,[],()
83646,49947,22036,5,48.00 $,11:58:46 AM;10/08/24,,48.0,48.0,240.0,2024-10-08 11:58:46.000,2024-10-08,2024,10,8,49947,[],()
81335,50670,21609,1,72$99¢,08:06 10/09/24,"Suite 826 4200 Zofia Crossroad, Wunschside, ID 78241-7661",7299.0,7299.0,7299.0,2024-10-09 08:06:00.000,2024-10-09,2024,10,9,50670,[],()
78523,48128,22043,1,13.USD,10/10/24 18:34,,13.0,13.0,13.0,2024-10-10 18:34:00.000,2024-10-10,2024,10,10,48128,[],()
80608,48669,21712,1,$ 73.00,2024-08-06T17:30:14.372,"3751 Kathrin Turnpike, Wuckertland, NE 57120",73.0,73.0,73.0,2024-08-06 17:30:14.372,2024-08-06,2024,8,6,48669,[],()
80223,49306,21954,1,EUR 48.,23:27;06/04/25,NULL,57.599999999999994,57.599999999999994,57.6,2025-06-04 23:27:00.000,2025-06-04,2025,6,4,49306,[],()
84508,49283,21798,1,USD59.5,25-JUL-2024;11:08,NULL,59.5,59.5,59.5,2024-07-25 11:08:00.000,2024-07-25,2024,7,25,49283,[],()
83830,50468,21725,1,38.25 $,26-Nov-2024 05:14:06 AM,,38.25,38.25,38.25,2024-11-26 05:14:06.000,2024-11-26,2024,11,26,50468,[],()
82955,49513,21459,1,38.0€,04/30/25 05:18:43,"6422 Catherine Cliff, Nieshaport, FL 70613-2544",45.6,45.6,45.6,2025-04-30 05:18:43.000,2025-04-30,2025,4,30,49513,[],()
83125,49783,21647,1,44.00 $,"18-SEP-2024, 09:05:57 A.M.",,44.0,44.0,44.0,2024-09-18 09:05:57.000,2024-09-18,2024,9,18,49783,[],()
85585,50274,21517,1,EUR 65.5,"06/20/24,08:14",,78.6,78.6,78.6,2024-06-20 08:14:00.000,2024-06-20,2024,6,20,50274,[],()
77996,49840,21740,1,56 €,2024-11-24 05:29:37 P.M.,,67.2,67.2,67.2,2024-11-24 17:29:37.000,2024-11-24,2024,11,24,49840,[],()
80373,49758,21342,2,€60¢99,06:01:19 09/14/24,,7318.8,7318.8,14637.6,2024-09-14 06:01:19.000,2024-09-14,2024,9,14,49758,[],()
78965,48188,22017,1,29.50 EUR,2024-11-20;01:03:33,,35.4,35.4,35.4,2024-11-20 01:03:33.000,2024-11-20,2024,11,20,48188,[],()
81942,48152,21524,3,50.50USD,"20-MAY-2024,13:44","Apt. 620 9627 Goldner Radial, Port Arnette, NM 74494-8163",50.5,50.5,151.5,2024-05-20 13:44:00.000,2024-05-20,2024,5,20,48152,[],()
85238,49396,21582,4,$65.,2025-02-25T20:55:59,"7548 Kreiger Plain, East Kip, CT 87617",65.0,65.0,260.0,2025-02-25 20:55:59.000,2025-02-25,2025,2,25,49396,[],()
82826,50145,21910,4,33.75€,"21:37:01, 2-November-2024",NULL,40.5,40.5,162.0,2024-11-02 21:37:01.000,2024-11-02,2024,11,2,50145,[],()
83005,47887,21846,5,25.USD,2025-01-03;14:02:42,NULL,25.0,25.0,125.0,2025-01-03 14:02:42.000,2025-01-03,2025,1,3,49814,[],()
77984,48173,21431,1,USD53.75,09:00:31 P.M. 2024-11-04,,53.75,53.75,53.75,2024-11-04 21:00:31.000,2024-11-04,2024,11,4,48173,[],()
78285,50115,21308,2,USD34, 9-February-2025 05:29:44 PM,"38954 Dalia Landing, West Kathrinville, OR 17321-6796",34.0,34.0,68.0,2025-02-09 17:29:44.000,2025-02-09,2025,2,9,50115,[],()
81480,50910,21945,1,$17.,07/19/24;04:47,"70452 Dominga Isle, West Tressa, MD 40096",17.0,17.0,17.0,2024-07-19 04:47:00.000,2024-07-19,2024,7,19,50910,[],()
85524,48732,21567,2,60.99$,"20-DEC-2024, 13:34:16","746 Fredericka Extension, Reynaldotown, AL 59023-1796",60.99,60.99,121.98,2024-12-20 13:34:16.000,2024-12-20,2024,12,20,48732,[],()
79803,51086,21495,1,50.50$,"09:02:03 AM,  9-NOV-2024",,50.5,50.5,50.5,2024-11-09 09:02:03.000,2024-11-09,2024,11,9,51086,[],()
79355,48504,21415,1,USD59.75,"07:02:34 A.M., 2025-02-22",,59.75,59.75,59.75,2025-02-22 07:02:34.000,2025-02-22,2025,2,22,48504,[],()
85496,48341,21782,1,58.50 USD,08:13;2024-07-02,,58.5,58.5,58.5,2024-07-02 08:13:00.000,2024-07-02,2024,7,2,48341,[],()
77999,49474,21488,1,68EUR,"06:51:39, 12-Feb-2025","Apt. 199 49497 Schuppe Overpass, South Joselyn, MO 56371",81.6,81.6,81.6,2025-02-12 06:51:39.000,2025-02-12,2025,2,12,49474,[],()
81386,50107,21375,1,USD47.,Sat Sep 21 14:27:29 2024,,47.0,47.0,47.0,2024-09-21 14:27:29.000,2024-09-21,2024,9,21,50107,[],()
83205,49273,22057,1,$ 48.00,18:20 2025-01-30,,48.0,48.0,48.0,2025-01-30 18:20:00.000,2025-01-30,2025,1,30,49273,[],()
79574,47823,21605,3,$45.99,"09:57:24, 2024-08-01","122 Asha Mill, Leonardoburgh, CA 26185",45.99,45.99,137.97,2024-08-01 09:57:24.000,2024-08-01,2024,8,1,47823,[],()
81317,49173,21644,5,USD33.99,09/11/24;19:02:56,"Suite 165 408 Bennie Station, Rustyfurt, TN 20905",33.99,33.99,169.95,2024-09-11 19:02:56.000,2024-09-11,2024,9,11,49173,[],()
78456,50175,21667,1,59.99 $,04/23/25;03:22,,59.99,59.99,59.99,2025-04-23 03:22:00.000,2025-04-23,2025,4,23,50175,[],()
82193,50762,21956,1,23.75 $,2025-04-24T16:11:08.230,,23.75,23.75,23.75,2025-04-24 16:11:08.230,2025-04-24,2025,4,24,50762,[],()
83281,51059,21692,4,66.99$,2025-04-12;03:00:10 am,NULL,66.99,66.99,267.96,2025-04-12 03:00:10.000,2025-04-12,2025,4,12,51059,[],()
85767,48577,21849,1,€37¢25,09.07.2025 16:02:02,"Suite 545 26468 Lance Fords, East Nickolaschester, TX 35873",4470.0,4470.0,4470.0,2025-09-07 16:02:02.000,2025-09-07,2025,9,7,48577,[],()
78632,50247,21859,3,$ 72,16:39 2024-07-06,"Apt. 945 92871 Ryan Trafficway, Anyastad, VT 57044-6838",72.0,72.0,216.0,2024-07-06 16:39:00.000,2024-07-06,2024,7,6,50247,[],()
79858,48539,21852,5,$ 43.,"18:40,09/04/24",,43.0,43.0,215.0,2024-09-04 18:40:00.000,2024-09-04,2024,9,4,48539,[],()
79970,48598,21346,1,€44¢50,"30-Oct-2024, 07:22:11",NULL,5340.0,5340.0,5340.0,2024-10-30 07:22:11.000,2024-10-30,2024,10,30,48598,[],()
86472,49514,21775,1,$ 68.99,"04:57:21, 2024-11-11",,68.99,68.99,68.99,2024-11-11 04:57:21.000,2024-11-11,2024,11,11,49514,[],()
83520,50798,21682,2,70.50 USD,"06/25/25, 07:04:59 PM",,70.5,70.5,141.0,2025-06-25 19:04:59.000,2025-06-25,2025,6,25,50798,[],()
78130,51103,21794,1,32.25 $,11/19/24;05:25:05 A.M.,,32.25,32.25,32.25,2024-11-19 05:25:05.000,2024-11-19,2024,11,19,51103,[],()
83483,49360,21825,2,$ 36.50,"29-NOV-2024,13:07","Suite 242 91531 Lorenzo Springs, Mattview, MT 33829",36.5,36.5,73.0,2024-11-29 13:07:00.000,2024-11-29,2024,11,29,50372,[],()
84634,47933,21637,2,52.0EUR, 4-Jan-2025 04:50,NULL,62.4,62.4,124.8,2025-01-04 04:50:00.000,2025-01-04,2025,1,4,47933,[],()
80992,48589,21443,1,EUR24.99,2025-05-03T07:00:30.832,"Apt. 387 42899 Hansen Ports, Kozeyside, OH 46202-8494",29.987999999999996,29.987999999999996,29.99,2025-05-03 07:00:30.832,2025-05-03,2025,5,3,48589,[],()
83949,49706,21986,4,53.5 $,2024-03-01 06:08:52 PM,,53.5,53.5,214.0,2024-03-01 18:08:52.000,2024-03-01,2024,3,1,49706,[],()
84158,49005,22017,1,29.USD,18-May-2024;07:02:12 P.M.,,29.0,29.0,29.0,2024-05-18 19:02:12.000,2024-05-18,2024,5,18,49005,[],()
80450,50332,21889,1,USD46.75,2024-10-09;11:45:05 pm,NULL,46.75,46.75,46.75,2024-10-09 23:45:05.000,2024-10-09,2024,10,9,50332,[],()
77734,49209,21605,1,USD47.75,12/27/24;06:50:09 A.M.,"Suite 982 762 Anita Locks, North Mariano, MS 88328",47.75,47.75,47.75,2024-12-27 06:50:09.000,2024-12-27,2024,12,27,49209,[],()
81555,49913,21640,1,45.0 €,02/08/25;04:53:11,NULL,54.0,54.0,54.0,2025-02-08 04:53:11.000,2025-02-08,2025,2,8,49913,[],()
78676,48864,21576,1,$23,2025-07-04;06:12:36,,23.0,23.0,23.0,2025-07-04 06:12:36.000,2025-07-04,2025,7,4,48864,[],()
84341,48816,21649,3,$ 67.0,2024-07-09T00:50:32,"5457 Olson Rapids, Dickensstad, RI 04271",67.0,67.0,201.0,2024-07-09 00:50:32.000,2024-07-09,2024,7,9,48816,[],()
78290,47786,21431,1,USD 49.75,07/24/24 02:02:37 PM,"Suite 696 84740 Daron Green, Batzmouth, GA 27349",49.75,49.75,49.75,2024-07-24 14:02:37.000,2024-07-24,2024,7,24,47786,[],()
81667,50650,21523,1,$13.5,"01/01/25, 03:50:48",,13.5,13.5,13.5,2025-01-01 03:50:48.000,2025-01-01,2025,1,1,50650,[],()
86258,48189,22018,1,$ 56.5,13:29:19;14-August-2024,"76984 Schamberger Stream, Port Logan, IN 60801",56.5,56.5,56.5,2024-08-14 13:29:19.000,2024-08-14,2024,8,14,48189,[],()
84936,50198,21706,1,USD 17.5,"03:05:40,10/08/24","911 Juan Pines, Blandabury, TN 28553-1430",17.5,17.5,17.5,2024-10-08 03:05:40.000,2024-10-08,2024,10,8,50198,[],()
86162,47982,21771,4,71.5 $, 6.02.2025 13:06:06,NULL,71.5,71.5,286.0,2025-06-02 13:06:06.000,2025-06-02,2025,6,2,47982,[],()
77826,49507,21517,1,67EUR,"2024-09-18, 22:32",,80.39999999999999,80.39999999999999,80.4,2024-09-18 22:32:00.000,2024-09-18,2024,9,18,49507,[],()
79073,50416,21462,2,$ 23.25,10.06.2025 06:31:31,,23.25,23.25,46.5,2025-10-06 06:31:31.000,2025-10-06,2025,10,6,50416,[],()
83662,50207,21739,1,USD 43.99,17-JAN-2025 03:53:12,,43.99,43.99,43.99,2025-01-17 03:53:12.000,2025-01-17,2025,1,17,50207,[],()
78719,48611,21406,1,68.25 EUR,01:30:18 A.M. 11-February-2025,NULL,81.89999999999999,81.89999999999999,81.9,2025-02-11 01:30:18.000,2025-02-11,2025,2,11,48611,[],()
86245,49773,21359,1,$24¢25,09/14/24 11:05:21,,2425.0,2425.0,2425.0,2024-09-14 11:05:21.000,2024-09-14,2024,9,14,49773,[],()
81733,47750,21535,1,52.50EUR,"12:19:51 PM, 2024-12-07",,63.0,63.0,63.0,2024-12-07 12:19:51.000,2024-12-07,2024,12,7,47750,[],()
80336,50026,21570,1,27.00$,2025-02-09 09:36:28,,27.0,27.0,27.0,2025-02-09 09:36:28.000,2025-02-09,2025,2,9,50026,[],()
83143,49031,21759,1,54.50 €,"30-April-2024,21:43",NULL,65.39999999999999,65.39999999999999,65.4,2024-04-30 21:43:00.000,2024-04-30,2024,4,30,49031,[],()
81601,48062,21738,5,41.75$,2024-09-14T11:08:29,"Suite 648 36683 Breitenberg Underpass, New Chet, IA 90233",41.75,41.75,208.75,2024-09-14 11:08:29.000,2024-09-14,2024,9,14,48062,[],()
80819,48290,21363,1,USD 68.5,02/13/25;13:56:06,,68.5,68.5,68.5,2025-02-13 13:56:06.000,2025-02-13,2025,2,13,48290,[],()
86014,49458,21825,2,EUR36.50,"01/02/25,08:16:34 AM",NULL,43.8,43.8,87.6,2025-01-02 08:16:34.000,2025-01-02,2025,1,2,49458,[],()
83642,48605,21972,1,$17¢00,"09:20,09/03/24","Suite 910 75039 Keeling Hills, North Mandi, MI 79579-8421",1700.0,1700.0,1700.0,2024-09-03 09:20:00.000,2024-09-03,2024,9,3,48605,[],()
81081,50900,21663,2,$ 69.0,07/27/24 09:30:12,,69.0,69.0,138.0,2024-07-27 09:30:12.000,2024-07-27,2024,7,27,50900,[],()
83199,48007,21444,1,15.50$,10:10:31 AM 04/22/24,,15.5,15.5,15.5,2024-04-22 10:10:31.000,2024-04-22,2024,4,22,48007,[],()
85677,49077,21714,2,43.00 EUR,"03:03:48, 2024-09-13",NULL,51.6,51.6,103.2,2024-09-13 03:03:48.000,2024-09-13,2024,9,13,49077,[],()
78092,48692,21325,2,$ 53.99, 2-Feb-2024 10:37:54 P.M.,"Apt. 344 14450 Risa Stream, Langmouth, NH 22790",53.99,53.99,107.98,2024-02-02 22:37:54.000,2024-02-02,2024,2,2,48692,[],()
80544,50713,21646,1,$ 72.99,"10/08/24, 09:44:31 P.M.",NULL,72.99,72.99,72.99,2024-10-08 21:44:31.000,2024-10-08,2024,10,8,50713,[],()
85663,49357,21550,1,$72.,"2025-04-02, 04:21:21 PM","Suite 714 979 Gibson Falls, West Mark, CO 85843-5836",72.0,72.0,72.0,2025-04-02 16:21:21.000,2025-04-02,2025,4,2,49357,[],()
81426,48095,21908,4,USD 19.99,2025-02-04T18:51:16.565,"Suite 511 261 Romaguera Cliff, South Miles, WY 80252-2844",19.99,19.99,79.96,2025-02-04 18:51:16.565,2025-02-04,2025,2,4,48095,[],()
82079,48900,21896,3,22.00 EUR,"17:40,2024-04-09",,26.4,26.4,79.2,2024-04-09 17:40:00.000,2024-04-09,2024,4,9,48900,[],()
82787,50090,21655,2,14 EUR,"2024-10-29, 13:25",NULL,16.8,16.8,33.6,2024-10-29 13:25:00.000,2024-10-29,2024,10,29,50090,[],()
84957,49639,21462,1,25.00 USD,"01:25:32, 20-October-2024","743 Mitzi Lodge, South Domitila, OK 17518",25.0,25.0,25.0,2024-10-20 01:25:32.000,2024-10-20,2024,10,20,49639,[],()
79919,50238,21420,1,21 USD,"2025-01-15, 16:25",,21.0,21.0,21.0,2025-01-15 16:25:00.000,2025-01-15,2025,1,15,50238,[],()
86109,50144,21467,1,51. $,"16:52:26,23-JAN-2025",,51.0,51.0,51.0,2025-01-23 16:52:26.000,2025-01-23,2025,1,23,50144,[],()
82951,49893,21536,2,USD38.0,2024-12-01T17:59:16,NULL,38.0,38.0,76.0,2024-12-01 17:59:16.000,2024-12-01,2024,12,1,49893,[],()
85839,50062,21664,2,44.99USD,24.02.2025 18:04:04,"523 Volkman Grove, Valhaven, TX 48291",44.99,44.99,89.98,2025-02-24 18:04:04.000,2025-02-24,2025,2,24,50062,[],()
83800,50959,21735,1,$33.50,2024-12-15;04:57:52 am,NULL,33.5,33.5,33.5,2024-12-15 04:57:52.000,2024-12-15,2024,12,15,50959,[],()
86378,49897,21309,1,$27.,"12/04/24,20:00",,27.0,27.0,27.0,2024-12-04 20:00:00.000,2024-12-04,2024,12,4,49897,[],()
80144,49420,21992,1,$ 32.25,11/26/24;09:42,,32.25,32.25,32.25,2024-11-26 09:42:00.000,2024-11-26,2024,11,26,49420,[],()
79142,50714,21424,1,63.0EUR,20:46 2025-05-10,,75.6,75.6,75.6,2025-05-10 20:46:00.000,2025-05-10,2025,5,10,50714,[],()
84805,51018,21338,1,37.00EUR,04/23/25;13:50,,44.4,44.4,44.4,2025-04-23 13:50:00.000,2025-04-23,2025,4,23,51018,[],()
84174,48983,21828,1,17.75$,2024-12-28T23:46:11.332,"Apt. 225 93776 Denae Mountain, Dickfort, AR 42907-2889",17.75,17.75,17.75,2024-12-28 23:46:11.332,2024-12-28,2024,12,28,48983,[],()
78654,47971,21598,1,USD 19.,"09:35:50, 06/23/25",NULL,19.0,19.0,19.0,2025-06-23 09:35:50.000,2025-06-23,2025,6,23,47971,[],()
85708,48631,21534,2,USD 15,2024-12-06 14:41,,15.0,15.0,30.0,2024-12-06 14:41:00.000,2024-12-06,2024,12,6,48631,[],()
86188,50516,21511,2,$25¢99,04:51;09/15/24,"43869 Precious Way, South Jeramytown, NV 58748-6527",2599.0,2599.0,5198.0,2024-09-15 04:51:00.000,2024-09-15,2024,9,15,50516,[],()
77893,50007,21566,1,24.75$,2025-03-24T04:32:02.865,,24.75,24.75,24.75,2025-03-24 04:32:02.865,2025-03-24,2025,3,24,48280,[],()
85230,50152,21751,1,74.50 USD,"20-JAN-2025,01:20:07 A.M.",NULL,74.5,74.5,74.5,2025-01-20 01:20:07.000,2025-01-20,2025,1,20,50152,[],()
79145,51125,21458,1,68.00 $,24-Dec-2024;01:27:54,,68.0,68.0,68.0,2024-12-24 01:27:54.000,2024-12-24,2024,12,24,51125,[],()
80764,50370,21804,1,48.0$,02/22/25;16:46:34,,48.0,48.0,48.0,2025-02-22 16:46:34.000,2025-02-22,2025,2,22,50370,[],()
81728,47823,21347,1,34.0€,"22:39:57,08/03/24",NULL,40.8,40.8,40.8,2024-08-03 22:39:57.000,2024-08-03,2024,8,3,47823,[],()
79209,47928,21894,3,EUR 50.25,2024-09-28T09:30:08,,60.3,60.3,180.9,2024-09-28 09:30:08.000,2024-09-28,2024,9,28,47928,[],()
85322,49603,21931,1,$ 25.50,01/24/25 07:02,,25.5,25.5,25.5,2025-01-24 07:02:00.000,2025-01-24,2025,1,24,49603,[],()
77819,48812,21298,1,50.00 USD,10:16:45 PM;07/02/25,,50.0,50.0,50.0,2025-07-02 22:16:45.000,2025-07-02,2025,7,2,48812,[],()
81275,47914,21756,2,30.99USD,"21:00,  3-Oct-2024",,30.99,30.99,61.98,2024-10-03 21:00:00.000,2024-10-03,2024,10,3,47914,[],()
81058,49046,21922,1,26.00€,2025-02-21T21:21:15,NULL,31.2,31.2,31.2,2025-02-21 21:21:15.000,2025-02-21,2025,2,21,49046,[],()
85325,49822,21525,2,€36.00,09/18/24;23:56,NULL,43.199999999999996,43.199999999999996,86.4,2024-09-18 23:56:00.000,2024-09-18,2024,9,18,49725,[],()
78507,50101,21423,1,42.0 USD,2024-11-29T14:28:30.394,NULL,42.0,42.0,42.0,2024-11-29 14:28:30.394,2024-11-29,2024,11,29,50101,[],()
85411,50936,21794,1,EUR 31.75, 6-Apr-2025 10:08:00 AM,,38.1,38.1,38.1,2025-04-06 10:08:00.000,2025-04-06,2025,4,6,50936,[],()
85575,49231,21605,2,48.75€,08:26:56 18-Apr-2025,,58.5,58.5,117.0,2025-04-18 08:26:56.000,2025-04-18,2025,4,18,49231,[],()
79494,50195,21886,4,44.25EUR,"21:20,2024-07-10",,53.1,53.1,212.4,2024-07-10 21:20:00.000,2024-07-10,2024,7,10,50195,[],()
77899,48917,21607,3,35.75 USD,15:01 19-December-2024,,35.75,35.75,107.25,2024-12-19 15:01:00.000,2024-12-19,2024,12,19,48917,[],()
83081,49184,21535,2,$ 51,"07/27/25, 14:29",,51.0,51.0,102.0,2025-07-27 14:29:00.000,2025-07-27,2025,7,27,49184,[],()
81447,51106,21316,1,33.00$,"03:35:14 am,13-Dec-2024",,33.0,33.0,33.0,2024-12-13 03:35:14.000,2024-12-13,2024,12,13,51106,[],()
80488,50416,21467,1,USD51.0,2025-03-22T20:35:32.184,NULL,51.0,51.0,51.0,2025-03-22 20:35:32.184,2025-03-22,2025,3,22,50416,[],()
86363,50674,21636,2,$ 15.00,02:48;2025-06-18,"Apt. 697 922 McKenzie Lodge, South Glenna, MT 60865",15.0,15.0,30.0,2025-06-18 02:48:00.000,2025-06-18,2025,6,18,50674,[],()
80073,50394,21579,1,USD 71.5,"03/24/25,15:46",,71.5,71.5,71.5,2025-03-24 15:46:00.000,2025-03-24,2025,3,24,50394,[],()
77857,51084,21364,1,€70.0,01:07:31 P.M. 2025-03-31,,84.0,84.0,84.0,2025-03-31 13:07:31.000,2025-03-31,2025,3,31,51084,[],()
79299,48449,21912,4,68.00EUR,06:31:16 P.M.;2024-10-25,NULL,81.6,81.6,326.4,2024-10-25 18:31:16.000,2024-10-25,2024,10,25,48449,[],()
84465,50445,21845,1,72.5USD,"2024-09-01,11:14:46 PM",,72.5,72.5,72.5,2024-09-01 23:14:46.000,2024-09-01,2024,9,1,50445,[],()
84751,48204,22018,1,53€75¢,13:05;10/18/24,,6450.0,6450.0,6450.0,2024-10-18 13:05:00.000,2024-10-18,2024,10,18,48204,[],()
79638,50159,21299,2,USD61.0,"11:25:34,2024-10-04",,61.0,61.0,122.0,2024-10-04 11:25:34.000,2024-10-04,2024,10,4,50159,[],()
80744,49337,21809,4,16.99 $,"06/13/24, 12:53:35 am","Apt. 644 216 Schinner Club, Lake Kaseyport, TN 55074-6587",16.99,16.99,67.96,2024-06-13 00:53:35.000,2024-06-13,2024,6,13,49337,[],()
83037,48709,21648,2,19.50 $,03/06/25 09:52:15,"200 Herzog Isle, Seymourmouth, ND 84794",19.5,19.5,39.0,2025-03-06 09:52:15.000,2025-03-06,2025,3,6,48709,[],()
80720,48715,21889,1,41. USD,21-Jun-2024;07:24,NULL,41.0,41.0,41.0,2024-06-21 07:24:00.000,2024-06-21,2024,6,21,48715,[],()
80528,49275,21600,1,$ 24.50,2024-06-10 22:02,,24.5,24.5,24.5,2024-06-10 22:02:00.000,2024-06-10,2024,6,10,49275,[],()
78063,49307,21850,3,€63¢75,"23-Jun-2024,21:07:04",NULL,7650.0,7650.0,22950.0,2024-06-23 21:07:04.000,2024-06-23,2024,6,23,49307,[],()
82424,49837,21894,2,47.5 USD,17-FEB-2025;21:53:52,,47.5,47.5,95.0,2025-02-17 21:53:52.000,2025-02-17,2025,2,17,49837,[],()
86129,50468,21558,2,22.00USD,"04:13:31 AM,2025-04-19","5380 Kuvalis Knolls, New Refugia, AL 09839-9443",22.0,22.0,44.0,2025-04-19 04:13:31.000,2025-04-19,2025,4,19,50468,[],()
81828,50921,21449,1,USD 52.0,21-May-2024 18:55:15,"Apt. 376 78250 Ulysses Inlet, Lake Unbury, MI 01680",52.0,52.0,52.0,2024-05-21 18:55:15.000,2024-05-21,2024,5,21,50921,[],()
79532,48770,21930,1,27.75EUR,"2025-01-10,12:31:45 PM",NULL,33.3,33.3,33.3,2025-01-10 12:31:45.000,2025-01-10,2025,1,10,48770,[],()
85914,48001,21884,1,31.25 €,2025-01-16T04:13:45.740,NULL,37.5,37.5,37.5,2025-01-16 04:13:45.740,2025-01-16,2025,1,16,48001,[],()
78143,50736,21798,1,USD56.99,"14:27:51,2024-07-22",NULL,56.99,56.99,56.99,2024-07-22 14:27:51.000,2024-07-22,2024,7,22,50736,[],()
85728,49015,21751,1,USD70.0,23:27 2024-11-14,"916 Homenick Oval, Korifort, OK 47069",70.0,70.0,70.0,2024-11-14 23:27:00.000,2024-11-14,2024,11,14,49015,[],()
77916,50840,21694,1,23.99 USD,"09:34:39, 1-May-2025",,23.99,23.99,23.99,2025-05-01 09:34:39.000,2025-05-01,2025,5,1,50840,[],()
80233,50745,21651,1,62.75 EUR,2025-04-26T15:59:23,NULL,75.3,75.3,75.3,2025-04-26 15:59:23.000,2025-04-26,2025,4,26,50745,[],()
81846,48332,21779,1,EUR 34.0,"19:20, 28-October-2024",,40.8,40.8,40.8,2024-10-28 19:20:00.000,2024-10-28,2024,10,28,48332,[],()
79845,47825,21492,1,26.50 $,18-JAN-2025;03:46,NULL,26.5,26.5,26.5,2025-01-18 03:46:00.000,2025-01-18,2025,1,18,47825,[],()
79263,48730,21300,2,37 $,"06:03:37 AM,21-APR-2025",,37.0,37.0,74.0,2025-04-21 06:03:37.000,2025-04-21,2025,4,21,48730,[],()
84002,49088,21338,1,38.75EUR,2025-04-25;04:42,"36552 Bauch Junctions, Dickiport, RI 94836-9265",46.5,46.5,46.5,2025-04-25 04:42:00.000,2025-04-25,2025,4,25,49088,[],()
82938,48172,21301,1,USD41.,2024-03-31T06:20:54,NULL,41.0,41.0,41.0,2024-03-31 06:20:54.000,2024-03-31,2024,3,31,48172,[],()
85689,47877,21555,1,EUR 47,01:12:34 am;2024-06-11,NULL,56.4,56.4,56.4,2024-06-11 01:12:34.000,2024-06-11,2024,6,11,47877,[],()
78414,51046,21634,3,68.00 €,01:53:52 am 23-May-2025,NULL,81.6,81.6,244.8,2025-05-23 01:53:52.000,2025-05-23,2025,5,23,51046,[],()
80445,49754,21889,4,43.00USD,"09:00:35 A.M.,25-NOV-2024","Apt. 998 89231 Sporer Trafficway, Windlerfort, NY 17102-9044",43.0,43.0,172.0,2024-11-25 09:00:35.000,2024-11-25,2024,11,25,49754,[],()
81243,48755,22040,1,EUR 27.0,2024-10-10T06:53:16,"43049 Jolene Orchard, Torritown, CO 97940",32.4,32.4,32.4,2024-10-10 06:53:16.000,2024-10-10,2024,10,10,48755,[],()
82258,48931,21520,1,USD 19.25,2024-08-16;01:28:38 A.M.,,19.25,19.25,19.25,2024-08-16 01:28:38.000,2024-08-16,2024,8,16,48931,[],()
80929,49799,21911,1,$ 63.0,"2025-01-16, 02:07",NULL,63.0,63.0,63.0,2025-01-16 02:07:00.000,2025-01-16,2025,1,16,48400,[],()
81311,49252,21769,1,EUR64.75,09:49:28;2025-08-24,,77.7,77.7,77.7,2025-08-24 09:49:28.000,2025-08-24,2025,8,24,49252,[],()
80504,49595,21842,2,59.75 €,16.03.2024 10:06:06,NULL,71.7,71.7,143.4,2024-03-16 10:06:06.000,2024-03-16,2024,3,16,49595,[],()
85103,49715,21844,4,$37.0,"2024-08-28,01:34:31 AM",NULL,37.0,37.0,148.0,2024-08-28 01:34:31.000,2024-08-28,2024,8,28,49715,[],()
86117,50027,21658,1,54.0$,2025-01-17T08:15:01.224,NULL,54.0,54.0,54.0,2025-01-17 08:15:01.224,2025-01-17,2025,1,17,50027,[],()
83978,50277,21918,1,USD74.50,17:43 25-March-2025,,74.5,74.5,74.5,2025-03-25 17:43:00.000,2025-03-25,2025,3,25,50277,[],()
78887,48082,21347,1,35.$,"22:29:37, 2024-12-04",,35.0,35.0,35.0,2024-12-04 22:29:37.000,2024-12-04,2024,12,4,48082,[],()
83532,50422,21811,2,USD 31.50,2025-05-08 05:43:11 pm,,31.5,31.5,63.0,2025-05-08 17:43:11.000,2025-05-08,2025,5,8,50422,[],()
85292,50165,21595,1,56EUR,"11:45:07, 09/04/24",,67.2,67.2,67.2,2024-09-04 11:45:07.000,2024-09-04,2024,9,4,50165,[],()
83510,50201,21902,1,€21.99,"08/24/24, 19:56","Apt. 110 209 Howe Locks, Croninmouth, AK 18378-7950",26.387999999999998,26.387999999999998,26.39,2024-08-24 19:56:00.000,2024-08-24,2024,8,24,50201,[],()
81875,50985,21719,3,64$00¢,"2024-09-11, 20:44",,6400.0,6400.0,19200.0,2024-09-11 20:44:00.000,2024-09-11,2024,9,11,50985,[],()
78565,50737,21843,1,$ 60.75,"16:00:22, 02/19/25",,60.75,60.75,60.75,2025-02-19 16:00:22.000,2025-02-19,2025,2,19,50737,[],()
80289,49487,21864,1,USD 74.50,2025-05-17T14:59:16,NULL,74.5,74.5,74.5,2025-05-17 14:59:16.000,2025-05-17,2025,5,17,49487,[],()
82664,48809,21686,2,$15.25,2025-02-16 08:52:44 pm,,15.25,15.25,30.5,2025-02-16 20:52:44.000,2025-02-16,2025,2,16,48809,[],()
84479,49957,21844,2,40.5$,"10:56:24, 01/10/25",NULL,40.5,40.5,81.0,2025-01-10 10:56:24.000,2025-01-10,2025,1,10,49957,[],()
83452,49911,21876,1,34.25USD,18:18 10-July-2025,,34.25,34.25,34.25,2025-07-10 18:18:00.000,2025-07-10,2025,7,10,49911,[],()
84638,50861,21839,1,72.25 USD,23:32;09/08/25,,72.25,72.25,72.25,2025-09-08 23:32:00.000,2025-09-08,2025,9,8,50861,[],()
77648,49029,21641,1,USD 34.50,2024-10-01T09:27:27.423,"1875 Jacobs Trafficway, Lake Tristan, NC 43292-6085",34.5,34.5,34.5,2024-10-01 09:27:27.423,2024-10-01,2024,10,1,49029,[],()
82084,49724,21561,1,EUR65.0,27-Jun-2024 18:59,,78.0,78.0,78.0,2024-06-27 18:59:00.000,2024-06-27,2024,6,27,49724,[],()
77782,48372,21806,1,62.0$,2024-09-15T19:18:21.688,,62.0,62.0,62.0,2024-09-15 19:18:21.688,2024-09-15,2024,9,15,48372,[],()
79113,49963,21455,2,$48.00,29.07.2024 15:27:27,NULL,48.0,48.0,96.0,2024-07-29 15:27:27.000,2024-07-29,2024,7,29,49963,[],()
85582,50456,21597,1,68€,04:17:57 AM 11/03/24,"77983 Bettye Port, East Kerriport, OK 13743-2420",81.6,81.6,81.6,2024-11-03 04:17:57.000,2024-11-03,2024,11,3,50456,[],()
79825,47928,21449,2,USD50.0,Sat Sep 28 09:59:21 2024,NULL,50.0,50.0,100.0,2024-09-28 09:59:21.000,2024-09-28,2024,9,28,47928,[],()
84698,48947,21315,1,70.75 €,"2024-05-11, 12:43:13 AM","7982 Cornelius Dale, Port Eugenioberg, IA 44696",84.89999999999999,84.89999999999999,84.9,2024-05-11 00:43:13.000,2024-05-11,2024,5,11,48947,[],()
78198,49385,21329,2,45.00USD,09:33:42 pm;19-December-2024,"7760 Fahey Estate, Keshiaberg, NJ 09207-5923",45.0,45.0,90.0,2024-12-19 21:33:42.000,2024-12-19,2024,12,19,49385,[],()
83480,50799,21618,4,47.75EUR,2025-05-10T15:10:30.184,,57.3,57.3,229.2,2025-05-10 15:10:30.184,2025-05-10,2025,5,10,50799,[],()
78859,47986,22049,2,29.5 USD,Thu Aug 15 18:53:02 2024,,29.5,29.5,59.0,2024-08-15 18:53:02.000,2024-08-15,2024,8,15,47986,[],()
78340,50152,21341,1,24.75 $,"00:02, 01/17/25",,24.75,24.75,24.75,2025-01-17 00:02:00.000,2025-01-17,2025,1,17,50152,[],()
83797,48014,21533,1,55.50 USD,04:05 2025-05-01,,55.5,55.5,55.5,2025-05-01 04:05:00.000,2025-05-01,2025,5,1,48014,[],()
78629,49132,21352,1,EUR29.0,"12/06/24, 06:29:26 A.M.",NULL,34.8,34.8,34.8,2024-12-06 06:29:26.000,2024-12-06,2024,12,6,49132,[],()
78002,49940,21690,3,USD38.5,"23:02:46,2025-08-19",NULL,38.5,38.5,115.5,2025-08-19 23:02:46.000,2025-08-19,2025,8,19,49940,[],()
78812,48498,21649,1,€69¢00,"06:08:04, 05/27/25",,8280.0,8280.0,8280.0,2025-05-27 06:08:04.000,2025-05-27,2025,5,27,48498,[],()
83260,48055,21356,1,24.0USD,2025-03-04T11:45:22,NULL,24.0,24.0,24.0,2025-03-04 11:45:22.000,2025-03-04,2025,3,4,48379,[],()
78591,48105,21721,1,€52.25,08/17/24 19:55,"Apt. 586 808 Caleb Field, East Dominic, NE 87671-8052",62.699999999999996,62.699999999999996,62.7,2024-08-17 19:55:00.000,2024-08-17,2024,8,17,48105,[],()
81979,48801,21332,1,15.75 EUR,2025-03-24;06:24:58 am,"545 Fritz Club, Lake Gene, NJ 62620",18.9,18.9,18.9,2025-03-24 06:24:58.000,2025-03-24,2025,3,24,48801,[],()
81079,49991,21863,1,44.5 EUR,"21-November-2024, 12:51","270 Harber Garden, New Shaunte, MA 85613-6733",53.4,53.4,53.4,2024-11-21 12:51:00.000,2024-11-21,2024,11,21,49991,[],()
81600,50618,21415,1,EUR 61.5,"05/28/25,06:54:25 PM",,73.8,73.8,73.8,2025-05-28 18:54:25.000,2025-05-28,2025,5,28,50618,[],()
79087,50460,21360,2,EUR 64.00,"11/07/24, 06:24:11 P.M.",NULL,76.8,76.8,153.6,2024-11-07 18:24:11.000,2024-11-07,2024,11,7,50460,[],()
84190,50122,21675,1,18.99USD,04/12/24 11:56:51 P.M.,NULL,18.99,18.99,18.99,2024-04-12 23:56:51.000,2024-04-12,2024,4,12,50122,[],()
84242,48458,21705,2,65.0$,2024-07-06;12:14:58 A.M.,"Apt. 962 9357 Efrain Point, Port Mathildastad, MI 29758",65.0,65.0,130.0,2024-07-06 00:14:58.000,2024-07-06,2024,7,6,48458,[],()
82752,48037,21918,1,$72,"13:00:12, 2024-08-16","16481 Dollie Village, New Kristofer, SD 35116-0509",72.0,72.0,72.0,2024-08-16 13:00:12.000,2024-08-16,2024,8,16,48037,[],()
79722,48310,21452,3,74.5USD,"11:31:36 P.M.,2024-11-20",NULL,74.5,74.5,223.5,2024-11-20 23:31:36.000,2024-11-20,2024,11,20,48310,[],()
85580,49594,21504,1,59.99 $,"06:17:16 PM, 2024-12-31",,59.99,59.99,59.99,2024-12-31 18:17:16.000,2024-12-31,2024,12,31,49594,[],()
77851,50280,21429,1,$27¢00,10-Dec-2024 03:07,,2700.0,2700.0,2700.0,2024-12-10 03:07:00.000,2024-12-10,2024,12,10,50280,[],()
77719,47826,21325,1,€ 51.0,"01/08/25, 23:49",,61.199999999999996,61.199999999999996,61.2,2025-01-08 23:49:00.000,2025-01-08,2025,1,8,47826,[],()
83721,50816,21333,1,USD69.0,"01/30/25, 08:28:54 A.M.",,69.0,69.0,69.0,2025-01-30 08:28:54.000,2025-01-30,2025,1,30,50816,[],()
78298,49396,21502,3,$70.0,"19:42:52,2025-06-26",NULL,70.0,70.0,210.0,2025-06-26 19:42:52.000,2025-06-26,2025,6,26,49396,[],()
84600,50207,21694,3,$ 28.50,05/15/24 12:49:11 PM,NULL,28.5,28.5,85.5,2024-05-15 12:49:11.000,2024-05-15,2024,5,15,50207,[],()
78702,48228,21440,1,$25.5,2024-11-21 16:39,"Suite 746 407 Janyce Camp, Schuppeburgh, WI 37399",25.5,25.5,25.5,2024-11-21 16:39:00.000,2024-11-21,2024,11,21,48228,[],()
77757,49743,21798,1,56. €,"08:55,  9-Jul-2024",,67.2,67.2,67.2,2024-07-09 08:55:00.000,2024-07-09,2024,7,9,49743,[],()
78395,50155,21556,3,46.0USD,05:24;31-Jan-2025,NULL,46.0,46.0,138.0,2025-01-31 05:24:00.000,2025-01-31,2025,1,31,50155,[],()
80448,49971,21317,1,€ 61.0,"07:35:23, 05/10/25",,73.2,73.2,73.2,2025-05-10 07:35:23.000,2025-05-10,2025,5,10,49971,[],()
82419,48753,21978,1,25.25$,"17-Jan-2025, 15:58:26",NULL,25.25,25.25,25.25,2025-01-17 15:58:26.000,2025-01-17,2025,1,17,48753,[],()
84417,48483,21864,1,€72¢50,2025-04-15T16:16:45.131,,8700.0,8700.0,8700.0,2025-04-15 16:16:45.131,2025-04-15,2025,4,15,48483,[],()
86184,49041,21964,1,$ 73.0,"23:38, 2024-12-15",NULL,73.0,73.0,73.0,2024-12-15 23:38:00.000,2024-12-15,2024,12,15,49041,[],()
85135,48020,21666,1,$67.00,"11/13/24, 01:51:52 AM","619 Alexis Cliff, South Lavon, TN 31857",67.0,67.0,67.0,2024-11-13 01:51:52.000,2024-11-13,2024,11,13,48020,[],()
86361,47828,21923,1,17.99 USD,2025-09-18T23:42:56.792,NULL,17.99,17.99,17.99,2025-09-18 23:42:56.792,2025-09-18,2025,9,18,47828,[],()
85355,47784,21324,2,$ 30.99,"11/04/24, 21:39","24264 Brian Port, Yundtbury, NE 87859-8277",30.99,30.99,61.98,2024-11-04 21:39:00.000,2024-11-04,2024,11,4,47784,[],()
84533,50876,21640,1,€44.50,12:16:42 am 2024-09-14,,53.4,53.4,53.4,2024-09-14 00:16:42.000,2024-09-14,2024,9,14,50876,[],()
84502,47738,21979,1,USD 34.75,07/11/24 23:20,,34.75,34.75,34.75,2024-07-11 23:20:00.000,2024-07-11,2024,7,11,47738,[],()
79450,49601,21662,2,USD 21.99,23-February-2025;06:32,"33919 Bryon Harbor, Johnsshire, AL 45645",21.99,21.99,43.98,2025-02-23 06:32:00.000,2025-02-23,2025,2,23,49601,[],()
83976,48454,22005,1,$40¢25,"2025-02-02,02:01:27 PM","Suite 536 64876 Jeremy Estate, East Kerry, WI 75121",4025.0,4025.0,4025.0,2025-02-02 14:01:27.000,2025-02-02,2025,2,2,48454,[],()
78713,49257,21325,1,EUR48,05:28:49;02/22/25,NULL,57.599999999999994,57.599999999999994,57.6,2025-02-22 05:28:49.000,2025-02-22,2025,2,22,49257,[],()
80997,49169,21345,1,USD 76.5,03:09:58 P.M. 10/28/24,,76.5,76.5,76.5,2024-10-28 15:09:58.000,2024-10-28,2024,10,28,49169,[],()
79610,50101,21320,1,€ 62.00,15:43:51;2025-01-16,,74.39999999999999,74.39999999999999,74.4,2025-01-16 15:43:51.000,2025-01-16,2025,1,16,50101,[],()
80151,48207,21768,1,$21.0,"05:47:00 AM, 10/05/24","1372 Osinski Islands, Champlinville, MI 55701-3755",21.0,21.0,21.0,2024-10-05 05:47:00.000,2024-10-05,2024,10,5,48207,[],()
78595,47837,21583,3,$58.99,04/17/24;08:13:16 PM,,58.99,58.99,176.97,2024-04-17 20:13:16.000,2024-04-17,2024,4,17,47837,[],()
85055,47747,21917,1,67.50EUR,Mon Sep 30 09:38:16 2024,,81.0,81.0,81.0,2024-09-30 09:38:16.000,2024-09-30,2024,9,30,47747,[],()
79199,50957,21845,3,71.5 €,2025-02-07T11:08:43.948,,85.8,85.8,257.4,2025-02-07 11:08:43.948,2025-02-07,2025,2,7,50957,[],()
83020,49939,21329,1,USD 42.00,"2025-06-26,16:36",NULL,42.0,42.0,42.0,2025-06-26 16:36:00.000,2025-06-26,2025,6,26,49939,[],()
81612,47947,21979,1,31.25$,02/08/25;09:55:25 AM,"Suite 912 437 Gerlach Camp, East Arlene, VA 83451-6889",31.25,31.25,31.25,2025-02-08 09:55:25.000,2025-02-08,2025,2,8,47947,[],()
81316,47789,21421,2,€ 60.75,"2024-12-15,16:24:24",,72.89999999999999,72.89999999999999,145.8,2024-12-15 16:24:24.000,2024-12-15,2024,12,15,47789,[],()
84255,50138,21459,2,€43.5,"2025-03-01,09:52:54 AM",NULL,52.199999999999996,52.199999999999996,104.4,2025-03-01 09:52:54.000,2025-03-01,2025,3,1,50138,[],()
79177,50873,21595,2,€55.50,"06:09:05 pm,  6-Feb-2025","Apt. 790 942 Gaston Lights, South Shaquitaberg, MD 71153",66.6,66.6,133.2,2025-02-06 18:09:05.000,2025-02-06,2025,2,6,50873,[],()
82422,49319,21805,1,48.99$,13-Jan-2024 07:54,"Apt. 719 867 Yolanda Pines, West Birdietown, NC 61340",48.99,48.99,48.99,2024-01-13 07:54:00.000,2024-01-13,2024,1,13,49319,[],()
80765,50844,21675,1,EUR 16.00,01:23; 3-SEP-2024,,19.2,19.2,19.2,2024-09-03 01:23:00.000,2024-09-03,2024,9,3,50844,[],()
84000,50239,21976,1,25.75 $,"27-Sep-2024,06:29",,25.75,25.75,25.75,2024-09-27 06:29:00.000,2024-09-27,2024,9,27,50239,[],()
82688,48922,21787,1,USD 44.00,04:28:53 A.M.; 5-Sep-2024,,44.0,44.0,44.0,2024-09-05 04:28:53.000,2024-09-05,2024,9,5,48922,[],()
86206,48908,21381,1,EUR24.50,"06:30:43, 2025-07-18",,29.4,29.4,29.4,2025-07-18 06:30:43.000,2025-07-18,2025,7,18,48908,[],()
82825,49241,21630,2,32EUR,"21:57:14, 2024-11-01",NULL,38.4,38.4,76.8,2024-11-01 21:57:14.000,2024-11-01,2024,11,1,49241,[],()
83725,48894,21724,1,16.50$,2024-05-30T09:39:52.924,,16.5,16.5,16.5,2024-05-30 09:39:52.924,2024-05-30,2024,5,30,48894,[],()
82155,48519,22030,1,€14.5,13:16:35;11-February-2025,,17.4,17.4,17.4,2025-02-11 13:16:35.000,2025-02-11,2025,2,11,48519,[],()
78536,48186,21465,3,70.25$,07:25:50;2025-05-07,,70.25,70.25,210.75,2025-05-07 07:25:50.000,2025-05-07,2025,5,7,48186,[],()
78014,50359,21373,1,21.99 $,"02/19/25,22:54",,21.99,21.99,21.99,2025-02-19 22:54:00.000,2025-02-19,2025,2,19,50359,[],()
83779,49550,21990,1,EUR48.00,"2024-08-05,14:27",,57.599999999999994,57.599999999999994,57.6,2024-08-05 14:27:00.000,2024-08-05,2024,8,5,49550,[],()
83150,49889,21425,1,EUR 32.00,07.02.2025 03:35:35,"Apt. 147 7365 Jacobson Light, Winfredborough, DE 92301",38.4,38.4,38.4,2025-07-02 03:35:35.000,2025-07-02,2025,7,2,49889,[],()
85151,49620,21343,2,$75.00,"03:42:42 AM,2024-08-17",,75.0,75.0,150.0,2024-08-17 03:42:42.000,2024-08-17,2024,8,17,49620,[],()
83369,50294,21847,1,$ 71.5,2024-11-05 14:37:38,NULL,71.5,71.5,71.5,2024-11-05 14:37:38.000,2024-11-05,2024,11,5,50294,[],()
84962,48419,21601,4,57$00¢,16-JUL-2024;06:27:31 AM,,5700.0,5700.0,22800.0,2024-07-16 06:27:31.000,2024-07-16,2024,7,16,48419,[],()
81448,47995,21954,2,USD47,"03:00,10/21/24",,47.0,47.0,94.0,2024-10-21 03:00:00.000,2024-10-21,2024,10,21,47995,[],()
84744,49073,21320,1,58.25EUR,2025-07-24 08:46:22 A.M.,,69.89999999999999,69.89999999999999,69.9,2025-07-24 08:46:22.000,2025-07-24,2025,7,24,49073,[],()
82272,48687,21992,3,35.50$,16:20:42 17-Oct-2024,NULL,35.5,35.5,106.5,2024-10-17 16:20:42.000,2024-10-17,2024,10,17,48687,[],()
83427,48574,21872,1,$39,08:47:45 P.M. 2025-01-03,,39.0,39.0,39.0,2025-01-03 20:47:45.000,2025-01-03,2025,1,3,48574,[],()
81270,51116,21878,5,56.25 EUR,"31-January-2025,04:43:25 am",,67.5,67.5,337.5,2025-01-31 04:43:25.000,2025-01-31,2025,1,31,51116,[],()
78032,51056,21624,1,€21.00,"02/14/25, 01:18",,25.2,25.2,25.2,2025-02-14 01:18:00.000,2025-02-14,2025,2,14,51056,[],()
77665,50444,21738,1,46.50€,15-Mar-2024 18:39,"Suite 205 848 Cyrus Island, Lake Nenitabury, OR 31736-0163",55.8,55.8,55.8,2024-03-15 18:39:00.000,2024-03-15,2024,3,15,50444,[],()
83858,49760,21851,1,28.5 $,2025-01-10T13:59:26,"Apt. 363 21548 Carmon Ports, Parkerberg, WA 98298-0556",28.5,28.5,28.5,2025-01-10 13:59:26.000,2025-01-10,2025,1,10,49760,[],()
78753,48940,21343,4,USD74.75,13:20 21-August-2024,"Suite 426 21407 Emmitt Crossing, North Nathanael, ID 69711",74.75,74.75,299.0,2024-08-21 13:20:00.000,2024-08-21,2024,8,21,48940,[],()
84074,49626,21302,1,23. USD,09/15/24;18:40,,23.0,23.0,23.0,2024-09-15 18:40:00.000,2024-09-15,2024,9,15,49626,[],()
80037,48889,21900,3,USD73.,"12/16/24, 09:25",,73.0,73.0,219.0,2024-12-16 09:25:00.000,2024-12-16,2024,12,16,48889,[],()
79197,49758,21557,1,€ 67.75,2024-07-06T21:22:53.493,,81.3,81.3,81.3,2024-07-06 21:22:53.493,2024-07-06,2024,7,6,49758,[],()
78881,51014,21679,1,29.5 EUR,"21-May-2024,07:49",NULL,35.4,35.4,35.4,2024-05-21 07:49:00.000,2024-05-21,2024,5,21,51014,[],()
81304,49250,21751,1,69.0€,"09/26/24,21:55","Apt. 803 221 Cummings Wells, Carlofurt, NE 01826-1737",82.8,82.8,82.8,2024-09-26 21:55:00.000,2024-09-26,2024,9,26,48078,[],()
83381,50524,21823,1,62.75 $,06:43 2024-10-12,,62.75,62.75,62.75,2024-10-12 06:43:00.000,2024-10-12,2024,10,12,49378,[],()
78502,48246,21905,2,29$75¢,"11/25/24,00:03",,2975.0,2975.0,5950.0,2024-11-25 00:03:00.000,2024-11-25,2024,11,25,48246,[],()
82865,47703,21770,1,21.50 USD," 6-Jan-2025,00:51",,21.5,21.5,21.5,2025-01-06 00:51:00.000,2025-01-06,2025,1,6,47703,[],()
80212,50235,21648,1,USD21.25,"03/17/25,00:26",NULL,21.25,21.25,21.25,2025-03-17 00:26:00.000,2025-03-17,2025,3,17,50235,[],()
85417,50431,22030,2,EUR16.75,2025-05-01T03:20:18.249,,20.099999999999998,20.099999999999998,40.2,2025-05-01 03:20:18.249,2025-05-01,2025,5,1,50431,[],()
81482,49340,21937,1,€55.5,"2025-03-20,12:32:26 am",NULL,66.6,66.6,66.6,2025-03-20 00:32:26.000,2025-03-20,2025,3,20,49340,[],()
82605,50503,21316,1,$ 31.00,"2024-11-12, 07:37:48",,31.0,31.0,31.0,2024-11-12 07:37:48.000,2024-11-12,2024,11,12,50503,[],()
85454,48483,21889,1,$41¢50,2025-01-14T16:30:27.437,,4150.0,4150.0,4150.0,2025-01-14 16:30:27.437,2025-01-14,2025,1,14,48483,[],()
81360,50536,21496,1,USD67.99,08:07;2024-12-11,,67.99,67.99,67.99,2024-12-11 08:07:00.000,2024-12-11,2024,12,11,50536,[],()
84519,50846,21314,1,70. USD,12/23/24;03:06:25 AM,NULL,70.0,70.0,70.0,2024-12-23 03:06:25.000,2024-12-23,2024,12,23,50846,[],()
84240,51009,22040,1,28 USD,"2025-03-12, 03:29:20",NULL,28.0,28.0,28.0,2025-03-12 03:29:20.000,2025-03-12,2025,3,12,51009,[],()
84029,50422,21570,2,$ 31.99,"19:52:25, 7-Apr-2025",,31.99,31.99,63.98,2025-04-07 19:52:25.000,2025-04-07,2025,4,7,50422,[],()
81966,50817,21406,2,$ 69.0,"27-Dec-2024, 14:30:02",,69.0,69.0,138.0,2024-12-27 14:30:02.000,2024-12-27,2024,12,27,50817,[],()
81674,48636,21785,1,€62.0,06:15 12-July-2024,,74.39999999999999,74.39999999999999,74.4,2024-07-12 06:15:00.000,2024-07-12,2024,7,12,48636,[],()
80153,50082,21610,1,USD55.,"02:15:02, 2024-03-24",,55.0,55.0,55.0,2024-03-24 02:15:02.000,2024-03-24,2024,3,24,50082,[],()
83072,49833,21923,1,17.50€,02/14/25 05:10:25 A.M.,NULL,21.0,21.0,21.0,2025-02-14 05:10:25.000,2025-02-14,2025,2,14,49833,[],()
78468,48759,21498,1,20.5EUR,"29-Aug-2024, 15:48:27",,24.599999999999998,24.599999999999998,24.6,2024-08-29 15:48:27.000,2024-08-29,2024,8,29,48759,[],()
84860,50034,21374,5,$71.5,2024-07-20T14:54:07,"Apt. 213 9808 Little Inlet, Leuschkeborough, IA 88360",71.5,71.5,357.5,2024-07-20 14:54:07.000,2024-07-20,2024,7,20,50034,[],()
79044,48749,21419,3,48.25 €,2025-01-19T06:02:35.871,,57.9,57.9,173.7,2025-01-19 06:02:35.871,2025-01-19,2025,1,19,48749,[],()
79881,49975,21693,1,$ 71.75,22:04:13;2024-08-14,,71.75,71.75,71.75,2024-08-14 22:04:13.000,2024-08-14,2024,8,14,49975,[],()
82048,49300,21324,1,$29.5,23:05 2024-12-02,"Apt. 425 2618 Julio Camp, New Sam, AL 55761",29.5,29.5,29.5,2024-12-02 23:05:00.000,2024-12-02,2024,12,2,49300,[],()
79520,50930,21626,1,USD33,17:02 2024-12-14,"25042 Miquel Wall, Pagacville, TX 17275-1972",33.0,33.0,33.0,2024-12-14 17:02:00.000,2024-12-14,2024,12,14,50930,[],()
78303,51105,21572,1,$ 53.00, 3.11.2024 23:37:37,"Apt. 957 59925 Ondricka Crest, Alysaberg, ID 63559-2707",53.0,53.0,53.0,2024-03-11 23:37:37.000,2024-03-11,2024,3,11,51105,[],()
86422,48618,21847,1,67.25USD,"2024-10-15, 04:32:10",,67.25,67.25,67.25,2024-10-15 04:32:10.000,2024-10-15,2024,10,15,48618,[],()
78938,48247,21641,2,$32¢99,23-August-2024;04:32:54 PM,"5829 Amada Motorway, Kemmershire, MN 10541-5506",3299.0,3299.0,6598.0,2024-08-23 16:32:54.000,2024-08-23,2024,8,23,48247,[],()
85633,50781,21770,1,EUR18.5,04/20/25;10:47,"8760 Toy Ways, North Clintfort, AL 11717",22.2,22.2,22.2,2025-04-20 10:47:00.000,2025-04-20,2025,4,20,50781,[],()
85330,48549,21558,1,21.75 USD,19-Feb-2025;16:38:55,,21.75,21.75,21.75,2025-02-19 16:38:55.000,2025-02-19,2025,2,19,48549,[],()
83494,49773,21355,2,$55.5,2024-09-24 08:36:00,"1850 Louis Points, Treasaborough, AL 96983",55.5,55.5,111.0,2024-09-24 08:36:00.000,2024-09-24,2024,9,24,49773,[],()
79025,49618,21836,2,USD 45.25,11:19  4-Oct-2024,"Suite 992 763 Ronny Prairie, Port Neelytown, NC 43283",45.25,45.25,90.5,2024-10-04 11:19:00.000,2024-10-04,2024,10,4,50918,[],()
86266,49780,21696,1,41.00 $,2024-12-21T01:17:18.463,,41.0,41.0,41.0,2024-12-21 01:17:18.463,2024-12-21,2024,12,21,49780,[],()
79548,47956,21727,2,$ 16.00,12:52:47 2025-04-15,"8678 Sporer Island, Stantonside, GA 61834",16.0,16.0,32.0,2025-04-15 12:52:47.000,2025-04-15,2025,4,15,47956,[],()
78527,49588,21659,1,33.99 $,00:50:37;2025-09-20,,33.99,33.99,33.99,2025-09-20 00:50:37.000,2025-09-20,2025,9,20,49588,[],()
82049,50480,21411,3,36 $,"24-JAN-2025,10:43:13 PM",,36.0,36.0,108.0,2025-01-24 22:43:13.000,2025-01-24,2025,1,24,50480,[],()
80217,50542,21916,2,18.5USD,"04:03:59 pm, 28-November-2024",,18.5,18.5,37.0,2024-11-28 16:03:59.000,2024-11-28,2024,11,28,50542,[],()
82119,49156,21994,1,34.25€," 4-May-2025,10:37:40",,41.1,41.1,41.1,2025-05-04 10:37:40.000,2025-05-04,2025,5,4,49156,[],()
81759,50532,21742,1,31 $,"05:39:16 AM,10/04/24",,31.0,31.0,31.0,2024-10-04 05:39:16.000,2024-10-04,2024,10,4,50532,[],()
79660,49785,21439,1,USD34.75,2024-11-13 07:24:10,,34.75,34.75,34.75,2024-11-13 07:24:10.000,2024-11-13,2024,11,13,49785,[],()
84392,47920,21876,1,33.75 EUR,"09/11/24,19:37",,40.5,40.5,40.5,2024-09-11 19:37:00.000,2024-09-11,2024,9,11,47920,[],()
78353,50313,21404,2,$ 19.5,21-JUN-2025 07:38:10 P.M.,"64714 Witting Port, Kiehntown, OK 26171-8184",19.5,19.5,39.0,2025-06-21 19:38:10.000,2025-06-21,2025,6,21,50313,[],()
85712,50057,21695,3,73€99¢,Fri Oct 25 00:03:10 2024,"31005 Viola Manor, Port Nicolaton, RI 08736-9276",8878.8,8878.8,26636.4,2024-10-25 00:03:10.000,2024-10-25,2024,10,25,50057,[],()
84426,51114,21447,1,$48.75,"09:09:55, 08/23/24","13615 Glover Mount, North Joe, VA 25873-0267",48.75,48.75,48.75,2024-08-23 09:09:55.000,2024-08-23,2024,8,23,51114,[],()
83245,49138,21564,2,71.5 $,02/20/25 09:43:03 AM,,71.5,71.5,143.0,2025-02-20 09:43:03.000,2025-02-20,2025,2,20,49138,[],()
86098,50352,21630,3,$30.50,"01/14/25, 12:48",,30.5,30.5,91.5,2025-01-14 12:48:00.000,2025-01-14,2025,1,14,50352,[],()
78203,47781,21417,1,$64¢00,04:49:05 P.M.;2025-01-22,,6400.0,6400.0,6400.0,2025-01-22 16:49:05.000,2025-01-22,2025,1,22,47781,[],()
81100,48744,21485,1,$45.00,"17:37:41, 2024-09-25",,45.0,45.0,45.0,2024-09-25 17:37:41.000,2024-09-25,2024,9,25,48744,[],()
78492,51094,21482,1,64.5USD,"08:48:33, 01/06/25","Suite 820 851 Wolf Row, North Edisonport, FL 57465",64.5,64.5,64.5,2025-01-06 08:48:33.000,2025-01-06,2025,1,6,51094,[],()
85895,48192,21441,1,$22.,04:51:54 A.M. 2025-02-27,NULL,22.0,22.0,22.0,2025-02-27 04:51:54.000,2025-02-27,2025,2,27,48192,[],()
86233,49575,21604,1,69.00 €,21:42:32 2024-08-31,NULL,82.8,82.8,82.8,2024-08-31 21:42:32.000,2024-08-31,2024,8,31,49575,[],()
79207,48231,21403,1,55.75USD,"12/10/24, 11:47:31 A.M.",,55.75,55.75,55.75,2024-12-10 11:47:31.000,2024-12-10,2024,12,10,48231,[],()
80850,50647,21297,2,$27.25,2024-12-08T13:51:01,,27.25,27.25,54.5,2024-12-08 13:51:01.000,2024-12-08,2024,12,8,50647,[],()
84837,50949,21441,1,25.25 €,12:41 19-MAY-2024,"9780 Connelly Valleys, South Jonathonborough, NY 59721",30.299999999999997,30.299999999999997,30.3,2024-05-19 12:41:00.000,2024-05-19,2024,5,19,50949,[],()
77716,49268,21491,1,EUR31.0,2024-11-23;17:59,,37.199999999999996,37.199999999999996,37.2,2024-11-23 17:59:00.000,2024-11-23,2024,11,23,49268,[],()
81262,48185,21470,1,19.99$,2025-07-25T11:50:06.252,,19.99,19.99,19.99,2025-07-25 11:50:06.252,2025-07-25,2025,7,25,48185,[],()
80961,51115,21459,2,43$99¢," 8-Oct-2024, 19:59:42",NULL,4399.0,4399.0,8798.0,2024-10-08 19:59:42.000,2024-10-08,2024,10,8,51115,[],()
82035,49123,21530,1,USD 48.99,"10/25/24, 00:21","506 Rickie Path, East Merrillhaven, MT 78876-7129",48.99,48.99,48.99,2024-10-25 00:21:00.000,2024-10-25,2024,10,25,49123,[],()
83490,50997,21829,5,USD71,17:39:22;2025-03-03,,71.0,71.0,355.0,2025-03-03 17:39:22.000,2025-03-03,2025,3,3,50997,[],()
79804,47879,21635,1,USD 43,2024-10-11T22:11:00.155,,43.0,43.0,43.0,2024-10-11 22:11:00.155,2024-10-11,2024,10,11,47879,[],()
83362,50330,22046,1,61.0 EUR,Sun Sep 22 11:50:31 2024,,73.2,73.2,73.2,2024-09-22 11:50:31.000,2024-09-22,2024,9,22,50330,[],()
82797,49116,21822,1,$31¢99,"19-OCT-2024,18:15:27",,3199.0,3199.0,3199.0,2024-10-19 18:15:27.000,2024-10-19,2024,10,19,49116,[],()
85596,50893,21491,1,$30.75,"21:58, 09/12/24",NULL,30.75,30.75,30.75,2024-09-12 21:58:00.000,2024-09-12,2024,9,12,50893,[],()
78733,50119,21809,1,15.0$, 8-Oct-2024;05:39:56 am,,15.0,15.0,15.0,2024-10-08 05:39:56.000,2024-10-08,2024,10,8,50119,[],()
80578,50756,21515,2,48. $,06:00:24 am 2025-06-18,,48.0,48.0,96.0,2025-06-18 06:00:24.000,2025-06-18,2025,6,18,50756,[],()
85191,47782,21676,1,€ 71.50,"2024-11-10, 10:43:04 PM","9851 Ziemann Tunnel, South Willie, PA 01800-9465",85.8,85.8,85.8,2024-11-10 22:43:04.000,2024-11-10,2024,11,10,47782,[],()
85168,50643,21683,1,$ 51.99,"02:00,07/01/24",NULL,51.99,51.99,51.99,2024-07-01 02:00:00.000,2024-07-01,2024,7,1,50643,[],()
80802,47669,21430,1,USD 54.50,"2025-01-21, 06:21",,54.5,54.5,54.5,2025-01-21 06:21:00.000,2025-01-21,2025,1,21,50057,[],()
81114,48755,21328,1,USD 62.00,24-September-2024 02:16,,62.0,62.0,62.0,2024-09-24 02:16:00.000,2024-09-24,2024,9,24,48755,[],()
85309,48433,21442,1,$ 48.0,04:54;02/03/25,,48.0,48.0,48.0,2025-02-03 04:54:00.000,2025-02-03,2025,2,3,48433,[],()
80257,48219,21668,1,54.99 $,14:51;2024-07-10,,54.99,54.99,54.99,2024-07-10 14:51:00.000,2024-07-10,2024,7,10,48219,[],()
80937,49880,21551,1,USD 21.50, 1-Sep-2024 12:51:10 pm,,21.5,21.5,21.5,2024-09-01 12:51:10.000,2024-09-01,2024,9,1,49880,[],()
84803,47943,21872,3,EUR 40.00,2024-09-28T08:21:15,,48.0,48.0,144.0,2024-09-28 08:21:15.000,2024-09-28,2024,9,28,47943,[],()
80228,49138,21604,1,€70.0,"02/16/25,10:34:30 P.M.",,84.0,84.0,84.0,2025-02-16 22:34:30.000,2025-02-16,2025,2,16,49138,[],()
80161,47832,21877,4,76.99 €,23:11:14;16-November-2024,,92.38799999999999,92.38799999999999,369.55,2024-11-16 23:11:14.000,2024-11-16,2024,11,16,47832,[],()
82749,49580,21750,1,$34.00, 7-May-2024;10:13:24 P.M.,NULL,34.0,34.0,34.0,2024-05-07 22:13:24.000,2024-05-07,2024,5,7,49580,[],()
79156,50329,21670,1,€21.5,"10-January-2025,07:50:02 pm",NULL,25.8,25.8,25.8,2025-01-10 19:50:02.000,2025-01-10,2025,1,10,50329,[],()
80931,49665,21935,1,17.75 $,"20-January-2025, 12:29:43 AM","Suite 422 80432 Gleason Fork, Lienhaven, TX 55509-0182",17.75,17.75,17.75,2025-01-20 00:29:43.000,2025-01-20,2025,1,20,49665,[],()
82699,50506,21787,1,$ 45.50,09/28/24 16:54,,45.5,45.5,45.5,2024-09-28 16:54:00.000,2024-09-28,2024,9,28,50506,[],()
79900,49669,21941,2,EUR 52.5,10/17/24;12:25,"7790 Dena Ridge, West Lucasmouth, NJ 34741-8381",63.0,63.0,126.0,2024-10-17 12:25:00.000,2024-10-17,2024,10,17,49669,[],()
77909,48470,22002,1,$ 66.5,07:40:49;14-July-2024,NULL,66.5,66.5,66.5,2024-07-14 07:40:49.000,2024-07-14,2024,7,14,48470,[],()
84916,48966,21953,1,38.50€,05:29:34 pm 10/25/24,,46.199999999999996,46.199999999999996,46.2,2024-10-25 17:29:34.000,2024-10-25,2024,10,25,48966,[],()
80815,50872,21311,1,€ 20.0,"22:45:21,27-Jan-2025",,24.0,24.0,24.0,2025-01-27 22:45:21.000,2025-01-27,2025,1,27,50872,[],()
85650,48141,21757,1,18€25¢,04/13/25;02:07:04 A.M.,,2190.0,2190.0,2190.0,2025-04-13 02:07:04.000,2025-04-13,2025,4,13,48141,[],()
78918,48109,22045,1,$35.25,"07/16/24, 06:41:41","Apt. 783 9845 Annita Pike, Beerhaven, HI 70833-9587",35.25,35.25,35.25,2024-07-16 06:41:41.000,2024-07-16,2024,7,16,48109,[],()
79334,49239,21978,2,USD27.5,"2025-02-08, 10:30:03 pm",,27.5,27.5,55.0,2025-02-08 22:30:03.000,2025-02-08,2025,2,8,49239,[],()
85759,50999,21753,2,USD56.00,23:21;2024-10-22,NULL,56.0,56.0,112.0,2024-10-22 23:21:00.000,2024-10-22,2024,10,22,50999,[],()
79147,49884,21904,1,44.25 $,"11/02/24, 00:14",,44.25,44.25,44.25,2024-11-02 00:14:00.000,2024-11-02,2024,11,2,49884,[],()
85471,50125,21327,2,USD21.75,"28-JAN-2025, 06:32:14",NULL,21.75,21.75,43.5,2025-01-28 06:32:14.000,2025-01-28,2025,1,28,50125,[],()
83821,47978,21809,1,15.25USD,"04:26:38,11/25/24",NULL,15.25,15.25,15.25,2024-11-25 04:26:38.000,2024-11-25,2024,11,25,47978,[],()
80689,50793,21845,1,€70¢50,"23-Oct-2024,09:50:46 am",NULL,8460.0,8460.0,8460.0,2024-10-23 09:50:46.000,2024-10-23,2024,10,23,48526,[],()
80350,49066,21401,2,27.0EUR,"23:32:52, 4-Feb-2025",,32.4,32.4,64.8,2025-02-04 23:32:52.000,2025-02-04,2025,2,4,49066,[],()
84874,49035,21584,1,$43.0,"22-June-2025, 11:46:21",,43.0,43.0,43.0,2025-06-22 11:46:21.000,2025-06-22,2025,6,22,49035,[],()
81568,49375,21995,2,40.5USD,"2024-12-12, 08:49:39 am",,40.5,40.5,81.0,2024-12-12 08:49:39.000,2024-12-12,2024,12,12,49375,[],()
79648,48720,21792,1,USD59.99,"08:03,12/17/24",NULL,59.99,59.99,59.99,2024-12-17 08:03:00.000,2024-12-17,2024,12,17,48720,[],()
78162,49065,21764,1,47.0$,"14:29:13,  1-Aug-2024",,47.0,47.0,47.0,2024-08-01 14:29:13.000,2024-08-01,2024,8,1,49065,[],()
86454,48510,21537,4,USD 25.50,"08:16:42, 2024-11-15",NULL,25.5,25.5,102.0,2024-11-15 08:16:42.000,2024-11-15,2024,11,15,48510,[],()
85702,48016,21920,1,USD 26.00,"18-FEB-2025,08:50:02","Suite 984 8116 Glynis Lane, Turnermouth, VT 58651",26.0,26.0,26.0,2025-02-18 08:50:02.000,2025-02-18,2025,2,18,48016,[],()
78931,50187,21860,1,USD47.75,10:19:07 A.M.;10/31/24,"5201 Roberts Expressway, Port Ayannashire, GA 76895",47.75,47.75,47.75,2024-10-31 10:19:07.000,2024-10-31,2024,10,31,50187,[],()
78227,47888,21415,1,$ 61.50,07:06;06/13/24,"Suite 444 1467 Rosalinda Rapid, New Hsiu, TN 26126-2090",61.5,61.5,61.5,2024-06-13 07:06:00.000,2024-06-13,2024,6,13,47888,[],()
85445,49159,21783,2,61.50$,"19-July-2025, 06:24:58 PM",,61.5,61.5,123.0,2025-07-19 18:24:58.000,2025-07-19,2025,7,19,49159,[],()
78916,50187,21750,2,32.25 USD,"03:00:33 am, 2024-11-29",,32.25,32.25,64.5,2024-11-29 03:00:33.000,2024-11-29,2024,11,29,50187,[],()
78160,47833,21987,1,€ 36.75,2024-08-17;01:04,,44.1,44.1,44.1,2024-08-17 01:04:00.000,2024-08-17,2024,8,17,47833,[],()
85131,48235,21757,2,15.25USD,"00:36, 11-DEC-2024",,15.25,15.25,30.5,2024-12-11 00:36:00.000,2024-12-11,2024,12,11,48235,[],()
82136,50436,21679,1,€ 25.0,"11:39,08/16/25",,30.0,30.0,30.0,2025-08-16 11:39:00.000,2025-08-16,2025,8,16,50436,[],()
85190,48262,21337,3,€32.75,07:36:40 pm;15-Aug-2024,NULL,39.3,39.3,117.9,2024-08-15 19:36:40.000,2024-08-15,2024,8,15,48262,[],()
86199,50301,21616,5,EUR 41.0,2025-04-09 11:37,,49.199999999999996,49.199999999999996,246.0,2025-04-09 11:37:00.000,2025-04-09,2025,4,9,50301,[],()
86290,49652,21382,1,€53¢50,2025-01-25;05:37:54 pm,"Apt. 783 2267 Tillman Key, Gottliebtown, OH 42454-4106",6420.0,6420.0,6420.0,2025-01-25 17:37:54.000,2025-01-25,2025,1,25,49652,[],()
84136,48655,21887,2,33.0 EUR,2025-03-06T00:28:48,,39.6,39.6,79.2,2025-03-06 00:28:48.000,2025-03-06,2025,3,6,48655,[],()
80397,48176,21299,2,EUR 65.5,2025-07-23;12:18:19 AM,,78.6,78.6,157.2,2025-07-23 00:18:19.000,2025-07-23,2025,7,23,48176,[],()
83727,50296,21986,1,50.5 €,10/04/24 10:06,,60.599999999999994,60.599999999999994,60.6,2024-10-04 10:06:00.000,2024-10-04,2024,10,4,50296,[],()
82254,48270,21474,1,€20.25,10:30:59 P.M. 04/24/25,NULL,24.3,24.3,24.3,2025-04-24 22:30:59.000,2025-04-24,2025,4,24,48270,[],()
85162,48483,21727,1,12.0 $,"08/01/25,18:22:28",NULL,12.0,12.0,12.0,2025-08-01 18:22:28.000,2025-08-01,2025,8,1,48483,[],()
84170,48149,21710,3,€74¢75,01/29/25 09:27:35,,8970.0,8970.0,26910.0,2025-01-29 09:27:35.000,2025-01-29,2025,1,29,48149,[],()
86183,50024,21532,1,18. $,2024-08-23T03:14:08,,18.0,18.0,18.0,2024-08-23 03:14:08.000,2024-08-23,2024,8,23,50024,[],()
78237,48704,22027,3,33.99$,"02:26, 17-Jan-2025",,33.99,33.99,101.97,2025-01-17 02:26:00.000,2025-01-17,2025,1,17,48704,[],()
84445,48332,21949,1,44.99USD,"15:28,2025-04-09",NULL,44.99,44.99,44.99,2025-04-09 15:28:00.000,2025-04-09,2025,4,9,48332,[],()
77841,49511,21450,1,$ 30.25,07:15:45 pm;12/13/24,,30.25,30.25,30.25,2024-12-13 19:15:45.000,2024-12-13,2024,12,13,49511,[],()
79654,49730,21665,1,$ 69.25,"09:09:39 AM,16-FEB-2025",NULL,69.25,69.25,69.25,2025-02-16 09:09:39.000,2025-02-16,2025,2,16,49730,[],()
80146,48716,21986,1,USD52.00,"05:14, 27-MAR-2025","5337 Tad Stravenue, Balistreriland, WI 16804-1253",52.0,52.0,52.0,2025-03-27 05:14:00.000,2025-03-27,2025,3,27,48716,[],()
82507,49867,21496,2,70.0 USD,2024-09-09 04:38:36,"3339 Pouros Oval, East Maurice, IA 90891",70.0,70.0,140.0,2024-09-09 04:38:36.000,2024-09-09,2024,9,9,49867,[],()
78020,49414,21645,1,49.50USD,17:05:29 2025-03-21,NULL,49.5,49.5,49.5,2025-03-21 17:05:29.000,2025-03-21,2025,3,21,49002,[],()
77607,50121,21433,1,47.25 USD,"21:51,27-Jan-2025",,47.25,47.25,47.25,2025-01-27 21:51:00.000,2025-01-27,2025,1,27,50121,[],()
86088,47887,21913,3,45.5$,"04/04/25,03:10:57 pm",NULL,45.5,45.5,136.5,2025-04-04 15:10:57.000,2025-04-04,2025,4,4,49814,[],()
82945,49203,21414,1,45.50 $,23:32:12;2024-10-21,,45.5,45.5,45.5,2024-10-21 23:32:12.000,2024-10-21,2024,10,21,49203,[],()
81059,51057,21499,2,USD54.0,17-May-2025 00:53,,54.0,54.0,108.0,2025-05-17 00:53:00.000,2025-05-17,2025,5,17,51057,[],()
81105,47714,21820,5,€30.,20:54:48;26-Dec-2024,"Apt. 408 77004 Hans Path, Meldashire, ID 32325",36.0,36.0,180.0,2024-12-26 20:54:48.000,2024-12-26,2024,12,26,47714,[],()
78856,49023,21923,2,20.99 $,12:02:11 PM  5-June-2024,,20.99,20.99,41.98,2024-06-05 12:02:11.000,2024-06-05,2024,6,5,49023,[],()
81560,47785,22052,4,USD21.75,2024-07-30T10:46:01,"Apt. 321 380 Ramiro Corners, Yolondaport, CT 66764-3813",21.75,21.75,87.0,2024-07-30 10:46:01.000,2024-07-30,2024,7,30,47785,[],()
80825,49422,21554,1,$68.,"17-Sep-2024,23:46",NULL,68.0,68.0,68.0,2024-09-17 23:46:00.000,2024-09-17,2024,9,17,49422,[],()
84683,48983,21703,1,66.0 $,28-March-2025;04:46:48 pm,"Apt. 225 93776 Denae Mountain, Dickfort, AR 42907-2889",66.0,66.0,66.0,2025-03-28 16:46:48.000,2025-03-28,2025,3,28,48983,[],()
83867,51032,21517,2,EUR 66.99,"12:15:08, 2024-12-30",,80.38799999999999,80.38799999999999,160.78,2024-12-30 12:15:08.000,2024-12-30,2024,12,30,51032,[],()
84293,47868,22054,1,68.0 USD,"03:25,2025-03-10","833 Delphine Fort, West Galina, MN 98911",68.0,68.0,68.0,2025-03-10 03:25:00.000,2025-03-10,2025,3,10,47868,[],()
84336,48798,21845,1,USD 72,11:01:54 AM;19-OCT-2024,"Apt. 176 81566 Grady Islands, Rafaelview, NV 23601-3743",72.0,72.0,72.0,2024-10-19 11:01:54.000,2024-10-19,2024,10,19,48798,[],()
80423,48560,21603,1,USD50.99,2025-03-05T17:29:51,NULL,50.99,50.99,50.99,2025-03-05 17:29:51.000,2025-03-05,2025,3,5,48560,[],()
80868,49946,22054,1,70.0 $,"06:22:38,04/20/25",,70.0,70.0,70.0,2025-04-20 06:22:38.000,2025-04-20,2025,4,20,49946,[],()
77659,49409,21666,1,€68¢00,2024-09-19 11:34:22 AM,NULL,8160.0,8160.0,8160.0,2024-09-19 11:34:22.000,2024-09-19,2024,9,19,49409,[],()
84267,48663,21880,3,39.5USD,08/09/24;22:07:10,NULL,39.5,39.5,118.5,2024-08-09 22:07:10.000,2024-08-09,2024,8,9,48663,[],()
78834,50002,21348,1,USD 20.50,12/08/24 08:31:52 P.M.,NULL,20.5,20.5,20.5,2024-12-08 20:31:52.000,2024-12-08,2024,12,8,50002,[],()
77810,48048,21516,1,$53.75,"25-February-2025,18:29:24",,53.75,53.75,53.75,2025-02-25 18:29:24.000,2025-02-25,2025,2,25,48048,[],()
86347,47958,21703,1,USD 69.00,14:12:23;06/15/24,NULL,69.0,69.0,69.0,2024-06-15 14:12:23.000,2024-06-15,2024,6,15,47958,[],()
85896,50788,21821,1,USD70.50,11/10/24;13:58:13,"Apt. 703 941 Kiehn Road, Kreigerfurt, OK 43743-6121",70.5,70.5,70.5,2024-11-10 13:58:13.000,2024-11-10,2024,11,10,50788,[],()
80107,50000,21381,3,€26¢00,04:02;2024-08-07,,3120.0,3120.0,9360.0,2024-08-07 04:02:00.000,2024-08-07,2024,8,7,50000,[],()
85973,47662,21759,5,€55¢75,"21:03:18,02/25/25",,6690.0,6690.0,33450.0,2025-02-25 21:03:18.000,2025-02-25,2025,2,25,47662,[],()
79395,49774,21441,1,26.75 $," 9-MAY-2025, 13:06:51",,26.75,26.75,26.75,2025-05-09 13:06:51.000,2025-05-09,2025,5,9,49774,[],()
85790,48351,21825,1,35.25 €,12/24/24;10:03:36 pm,"Suite 213 11610 Kelsey Islands, West Gaynell, KS 40224-0543",42.3,42.3,42.3,2024-12-24 22:03:36.000,2024-12-24,2024,12,24,50932,[],()
79879,49075,21607,2,EUR32.50,"04/01/25, 07:41:52","82726 Lubowitz Plaza, Danielmouth, HI 49455",39.0,39.0,78.0,2025-04-01 07:41:52.000,2025-04-01,2025,4,1,49075,[],()
83833,48540,21795,1,EUR35.50," 2-JUN-2025, 02:17",,42.6,42.6,42.6,2025-06-02 02:17:00.000,2025-06-02,2025,6,2,48540,[],()
84507,49397,21495,1,USD48.5,"04:05, 2024-11-06",NULL,48.5,48.5,48.5,2024-11-06 04:05:00.000,2024-11-06,2024,11,6,49397,[],()
81772,48730,21640,1,€ 41.5,2024-09-12T12:50:44.559,,49.8,49.8,49.8,2024-09-12 12:50:44.559,2024-09-12,2024,9,12,48730,[],()
85920,48517,21734,1,49.0USD,18:48;2024-05-26,,49.0,49.0,49.0,2024-05-26 18:48:00.000,2024-05-26,2024,5,26,48517,[],()
85894,51028,21440,2,26.5$,"04:03:18,2024-05-10",NULL,26.5,26.5,53.0,2024-05-10 04:03:18.000,2024-05-10,2024,5,10,51028,[],()
81801,48069,21862,2,59.25$,12-August-2024 01:33:44,"2370 Spinka Fords, South Delmarborough, ME 43777-9332",59.25,59.25,118.5,2024-08-12 01:33:44.000,2024-08-12,2024,8,12,48069,[],()
85541,49041,21867,1,59.25$,"07/19/24,02:08:27 P.M.",NULL,59.25,59.25,59.25,2024-07-19 14:08:27.000,2024-07-19,2024,7,19,49041,[],()
81352,48682,21717,1,€36¢75,20-Jan-2025;03:24:18 AM,NULL,4410.0,4410.0,4410.0,2025-01-20 03:24:18.000,2025-01-20,2025,1,20,48682,[],()
83002,49814,21690,2,40.50€,"12/10/24, 09:36:51 pm",,48.6,48.6,97.2,2024-12-10 21:36:51.000,2024-12-10,2024,12,10,49814,[],()
83713,48225,21322,2,$27¢25,"2024-09-19,08:58:29 AM",NULL,2725.0,2725.0,5450.0,2024-09-19 08:58:29.000,2024-09-19,2024,9,19,48225,[],()
79540,49231,21994,2,$34.99,"2025-03-20,05:13",NULL,34.99,34.99,69.98,2025-03-20 05:13:00.000,2025-03-20,2025,3,20,49231,[],()
85561,48636,21749,1,69.50$,"00:11:55,28-Sep-2024",,69.5,69.5,69.5,2024-09-28 00:11:55.000,2024-09-28,2024,9,28,48636,[],()
82980,50440,21484,1,EUR 13.0,23:16:01; 5-Jun-2025,NULL,15.6,15.6,15.6,2025-06-05 23:16:01.000,2025-06-05,2025,6,5,50440,[],()
83355,50740,21886,1,EUR45.75,21-January-2025 17:43:54,NULL,54.9,54.9,54.9,2025-01-21 17:43:54.000,2025-01-21,2025,1,21,50740,[],()
81908,48955,21542,1,€30.00,03/01/25 11:46:09 am,NULL,36.0,36.0,36.0,2025-03-01 11:46:09.000,2025-03-01,2025,3,1,48955,[],()
85661,48859,21799,2,30.00$,2025-02-12;02:56,NULL,30.0,30.0,60.0,2025-02-12 02:56:00.000,2025-02-12,2025,2,12,48859,[],()
81522,50299,21476,1,USD34.00,"28-Dec-2024,15:10:41",,34.0,34.0,34.0,2024-12-28 15:10:41.000,2024-12-28,2024,12,28,50299,[],()
83136,49150,21877,1,EUR 74,"12/05/24,03:27:29",,88.8,88.8,88.8,2024-12-05 03:27:29.000,2024-12-05,2024,12,5,49150,[],()
77976,48160,21308,2,USD33.,"2025-08-06, 18:12:06",,33.0,33.0,66.0,2025-08-06 18:12:06.000,2025-08-06,2025,8,6,48160,[],()
83704,48627,21770,1,€21.0,2024-12-22T00:09:59,,25.2,25.2,25.2,2024-12-22 00:09:59.000,2024-12-22,2024,12,22,48627,[],()
86320,50568,21641,1,33.0EUR,"2024-12-26, 05:16:38",,39.6,39.6,39.6,2024-12-26 05:16:38.000,2024-12-26,2024,12,26,50568,[],()
84069,48668,21443,1,USD23.0,04:39:52 2024-06-09,NULL,23.0,23.0,23.0,2024-06-09 04:39:52.000,2024-06-09,2024,6,9,48668,[],()
86417,50568,21402,1,41.0$,"2024-08-17, 19:53:04",,41.0,41.0,41.0,2024-08-17 19:53:04.000,2024-08-17,2024,8,17,50568,[],()
83973,50508,21622,1,$ 46.00,2024-05-22T15:14:10.430,"Suite 439 53783 Raleigh Stream, South Ulysses, NV 90220-1531",46.0,46.0,46.0,2024-05-22 15:14:10.430,2024-05-22,2024,5,22,50508,[],()
79454,50422,21783,1,64.0 USD,"04:17:42, 2025-02-27",,64.0,64.0,64.0,2025-02-27 04:17:42.000,2025-02-27,2025,2,27,50422,[],()
82989,48306,21429,1,28.5 $,"07:53,05/13/24",,28.5,28.5,28.5,2024-05-13 07:53:00.000,2024-05-13,2024,5,13,48306,[],()
85574,48990,21897,1,57.00 USD,"2025-05-15,22:38:21","53872 Tish Landing, South Justin, NY 50736",57.0,57.0,57.0,2025-05-15 22:38:21.000,2025-05-15,2025,5,15,48990,[],()
78028,50583,21599,1,59.25€,15:17;06/19/24,,71.1,71.1,71.1,2024-06-19 15:17:00.000,2024-06-19,2024,6,19,50583,[],()
80004,48193,21409,1,66 USD,2024-05-09T03:55:04,"Apt. 822 25530 Spencer Landing, Jaysonport, MT 40297-9486",66.0,66.0,66.0,2024-05-09 03:55:04.000,2024-05-09,2024,5,9,48193,[],()
82243,47725,21311,1,17.75 $,2024-08-13T03:38:37.822,,17.75,17.75,17.75,2024-08-13 03:38:37.822,2024-08-13,2024,8,13,47725,[],()
78628,49313,21982,1,41.0EUR,2024-08-28T02:46:57.809,NULL,49.199999999999996,49.199999999999996,49.2,2024-08-28 02:46:57.809,2024-08-28,2024,8,28,49313,[],()
79455,50204,22003,1,58.75EUR,2025-02-22 15:09,NULL,70.5,70.5,70.5,2025-02-22 15:09:00.000,2025-02-22,2025,2,22,50204,[],()
79930,49351,21315,3,$ 70.99,"20:14, 23-OCT-2024",,70.99,70.99,212.97,2024-10-23 20:14:00.000,2024-10-23,2024,10,23,49351,[],()
85964,49019,21920,1,23 USD,"03:32:52 am, 04/24/25",,23.0,23.0,23.0,2025-04-24 03:32:52.000,2025-04-24,2025,4,24,49019,[],()
83570,49483,21529,1,EUR19.0,"04/05/25, 12:07",,22.8,22.8,22.8,2025-04-05 12:07:00.000,2025-04-05,2025,4,5,49483,[],()
84159,50704,21421,1,63.25$,Thu Aug 29 01:17:34 2024,"797 Blair Locks, Boehmborough, KS 65058-5604",63.25,63.25,63.25,2024-08-29 01:17:34.000,2024-08-29,2024,8,29,50704,[],()
82387,49375,21777,2,31.25$,11/26/24 12:16,,31.25,31.25,62.5,2024-11-26 12:16:00.000,2024-11-26,2024,11,26,49375,[],()
83700,47900,21979,1,USD33.,"16:16:32, 18-OCT-2024",NULL,33.0,33.0,33.0,2024-10-18 16:16:32.000,2024-10-18,2024,10,18,50619,[],()
83209,49732,21750,3,32.99 €,"08:17:53,2025-04-01",,39.588,39.588,118.76,2025-04-01 08:17:53.000,2025-04-01,2025,4,1,49732,[],()
83838,50582,21849,2,$32.0,"12:55:47 am, 10/11/24",,32.0,32.0,64.0,2024-10-11 00:55:47.000,2024-10-11,2024,10,11,50582,[],()
80693,48827,21900,2,EUR 71.,25.11.2024 12:40:40,NULL,85.2,85.2,170.4,2024-11-25 12:40:40.000,2024-11-25,2024,11,25,48827,[],()
79445,49755,21810,1,51.50 USD,"10-MAY-2025, 08:02",,51.5,51.5,51.5,2025-05-10 08:02:00.000,2025-05-10,2025,5,10,49755,[],()
79284,48660,21765,1,USD 22.99,"07:42:32 A.M., 25-APR-2025",,22.99,22.99,22.99,2025-04-25 07:42:32.000,2025-04-25,2025,4,25,48660,[],()
83628,50463,22029,1,67.99$,"21-February-2025, 20:15",,67.99,67.99,67.99,2025-02-21 20:15:00.000,2025-02-21,2025,2,21,50463,[],()
79388,47766,22014,1,30.75 USD,09:46 01/07/25,NULL,30.75,30.75,30.75,2025-01-07 09:46:00.000,2025-01-07,2025,1,7,47766,[],()
81016,50364,22052,1,25.0 $,2025-03-06 08:28,"Apt. 267 62011 Hilll Shore, Lake Kattiefurt, NH 92408",25.0,25.0,25.0,2025-03-06 08:28:00.000,2025-03-06,2025,3,6,50364,[],()
84571,50800,22030,1,14.25EUR,08/16/24;17:14,NULL,17.099999999999998,17.099999999999998,17.1,2024-08-16 17:14:00.000,2024-08-16,2024,8,16,50800,[],()
86468,48681,21658,1,55€99¢,12:22:09 P.M. 01/04/25,"Suite 239 4124 Billie Overpass, West Wendolynstad, OK 25288-4008",6718.8,6718.8,6718.8,2025-01-04 12:22:09.000,2025-01-04,2025,1,4,48681,[],()
79066,49638,22009,1,$28¢75,19:19;2025-03-29,,2875.0,2875.0,2875.0,2025-03-29 19:19:00.000,2025-03-29,2025,3,29,49638,[],()
85117,50793,21708,1,27.99$,31.05.2025  4:11:11,,27.99,27.99,27.99,2025-05-31 04:11:11.000,2025-05-31,2025,5,31,48526,[],()
82019,48595,22035,1,USD 34.25,15:43 2024-11-12,,34.25,34.25,34.25,2024-11-12 15:43:00.000,2024-11-12,2024,11,12,48595,[],()
81916,50129,21352,1,$ 32.75,04:13:40 P.M.;11/28/24,,32.75,32.75,32.75,2024-11-28 16:13:40.000,2024-11-28,2024,11,28,50129,[],()
78367,50818,21728,1,52.00 USD,"11/02/24, 06:50:54 A.M.",NULL,52.0,52.0,52.0,2024-11-02 06:50:54.000,2024-11-02,2024,11,2,50818,[],()
80357,50689,21435,1,$33.25,"03/05/25,07:57","Apt. 553 73290 Dach Via, West Shirelyfurt, NM 82545",33.25,33.25,33.25,2025-03-05 07:57:00.000,2025-03-05,2025,3,5,50689,[],()
80774,49962,21897,1,53.5$,04:47:55 PM;02/09/25,"Apt. 655 62881 Prosacco Isle, Goyetteport, OH 74479-9133",53.5,53.5,53.5,2025-02-09 16:47:55.000,2025-02-09,2025,2,9,49962,[],()
80680,50359,21823,4,62.5 $,03/27/24 06:54:40 P.M.,,62.5,62.5,250.0,2024-03-27 18:54:40.000,2024-03-27,2024,3,27,50359,[],()
84157,49032,21655,1,USD 16.50,11-DEC-2024;04:03:16 AM,"Apt. 249 336 O'Conner Valleys, Lake Kenview, AK 99108-2313",16.5,16.5,16.5,2024-12-11 04:03:16.000,2024-12-11,2024,12,11,49032,[],()
83076,49953,21356,1,26.00 USD,2024-06-05 07:58,,26.0,26.0,26.0,2024-06-05 07:58:00.000,2024-06-05,2024,6,5,49953,[],()
77934,48675,21753,1,USD 56.,06:07;12/09/24,"357 Schuster Square, West Calebton, WY 60789-8884",56.0,56.0,56.0,2024-12-09 06:07:00.000,2024-12-09,2024,12,9,48675,[],()
84917,48301,21452,1,$ 71.5, 5-Aug-2025;05:37:23 PM,"Apt. 877 863 Frami Walks, South Joane, AR 42938-8874",71.5,71.5,71.5,2025-08-05 17:37:23.000,2025-08-05,2025,8,5,48301,[],()
78235,50540,21702,1,USD62.99,"2024-08-27,05:45:12 A.M.",,62.99,62.99,62.99,2024-08-27 05:45:12.000,2024-08-27,2024,8,27,50540,[],()
83506,50437,21945,2,13.5 EUR,2025-01-12;09:44,,16.2,16.2,32.4,2025-01-12 09:44:00.000,2025-01-12,2025,1,12,50437,[],()
83834,50337,21509,1,41.5 $,30-Sep-2024;12:55:30 am,NULL,41.5,41.5,41.5,2024-09-30 00:55:30.000,2024-09-30,2024,9,30,50337,[],()
82966,50832,21385,4,28.50 €,10:32;02/01/25,,34.199999999999996,34.199999999999996,136.8,2025-02-01 10:32:00.000,2025-02-01,2025,2,1,50832,[],()
82849,47723,21428,2,60.€,"06:20:03 am,  4-May-2024",,72.0,72.0,144.0,2024-05-04 06:20:03.000,2024-05-04,2024,5,4,47723,[],()
79914,50320,21365,1,$ 31.0,"22:09:34, 23-APR-2025",,31.0,31.0,31.0,2025-04-23 22:09:34.000,2025-04-23,2025,4,23,50320,[],()
78525,49111,21987,1,$ 37.00,15:24 04/11/25,,37.0,37.0,37.0,2025-04-11 15:24:00.000,2025-04-11,2025,4,11,49111,[],()
85200,50647,21321,1,€ 63.75,"12/02/24, 11:33",,76.5,76.5,76.5,2024-12-02 11:33:00.000,2024-12-02,2024,12,2,50647,[],()
82238,50022,21349,1,USD64.25,"04:45:27,2025-04-06",,64.25,64.25,64.25,2025-04-06 04:45:27.000,2025-04-06,2025,4,6,50022,[],()
84172,49715,21598,1,20.99 USD,30-MAY-2025;14:45,,20.99,20.99,20.99,2025-05-30 14:45:00.000,2025-05-30,2025,5,30,49715,[],()
78065,48190,22018,1,55$,09:30:22;2025-02-09,,55.0,55.0,55.0,2025-02-09 09:30:22.000,2025-02-09,2025,2,9,48190,[],()
84425,51008,21706,1,USD 22.99," 2-Jul-2025,10:33:51",,22.99,22.99,22.99,2025-07-02 10:33:51.000,2025-07-02,2025,7,2,51008,[],()
81020,49313,22051,1,USD 32.00,"2024-03-30,12:32",,32.0,32.0,32.0,2024-03-30 12:32:00.000,2024-03-30,2024,3,30,49313,[],()
82608,49824,21658,1,56.0 $, 8-FEB-2025;19:46:54,,56.0,56.0,56.0,2025-02-08 19:46:54.000,2025-02-08,2025,2,8,49824,[],()
82609,48920,21605,1,$48.5,2024-05-20T07:18:52.073,NULL,48.5,48.5,48.5,2024-05-20 07:18:52.073,2024-05-20,2024,5,20,48920,[],()
85901,50024,21657,2,18.00€,"07/26/25, 05:41:08 pm","16698 Weissnat Estate, North Abramfurt, NV 55310",21.599999999999998,21.599999999999998,43.2,2025-07-26 17:41:08.000,2025-07-26,2025,7,26,50024,[],()
78808,48326,21323,3,USD 43.25,"12:35,2024-09-29",NULL,43.25,43.25,129.75,2024-09-29 12:35:00.000,2024-09-29,2024,9,29,48326,[],()
84970,48682,21509,1,USD40.75,2024-07-05T12:29:52,,40.75,40.75,40.75,2024-07-05 12:29:52.000,2024-07-05,2024,7,5,48682,[],()
79592,50373,21819,3,59.75USD,16:33:43 2025-03-05,"3451 Jacobson Trace, South Dalilatown, MS 41191",59.75,59.75,179.25,2025-03-05 16:33:43.000,2025-03-05,2025,3,5,50373,[],()
78036,50730,21505,1,43.50 USD,"05:25,2024-07-06",NULL,43.5,43.5,43.5,2024-07-06 05:25:00.000,2024-07-06,2024,7,6,50730,[],()
84025,48099,21959,4,$ 71.99,03/19/25;17:02,,71.99,71.99,287.96,2025-03-19 17:02:00.000,2025-03-19,2025,3,19,48099,[],()
79039,48382,21463,5,27.50USD,06:44:39;12/21/24,NULL,27.5,27.5,137.5,2024-12-21 06:44:39.000,2024-12-21,2024,12,21,48382,[],()
80324,48117,21654,1,46.75€,23:12 2024-07-06,NULL,56.1,56.1,56.1,2024-07-06 23:12:00.000,2024-07-06,2024,7,6,48117,[],()
78281,48727,21542,1,€35¢00,2024-12-03 23:28,NULL,4200.0,4200.0,4200.0,2024-12-03 23:28:00.000,2024-12-03,2024,12,3,48727,[],()
77864,47836,21699,1,USD 25.5,"08/02/24, 09:48",,25.5,25.5,25.5,2024-08-02 09:48:00.000,2024-08-02,2024,8,2,47836,[],()
80303,47849,21575,1,73.75 $,"26-Mar-2025,05:40",NULL,73.75,73.75,73.75,2025-03-26 05:40:00.000,2025-03-26,2025,3,26,47849,[],()
78362,49165,21452,1,69.25 $,06:41:15 AM 2024-12-18,,69.25,69.25,69.25,2024-12-18 06:41:15.000,2024-12-18,2024,12,18,50307,[],()
78546,50925,21500,1,27.5 USD,2025-02-03 17:42:00,,27.5,27.5,27.5,2025-02-03 17:42:00.000,2025-02-03,2025,2,3,50925,[],()
83801,49505,21923,1,€ 18.25,02/26/25;06:17:33 PM,,21.9,21.9,21.9,2025-02-26 18:17:33.000,2025-02-26,2025,2,26,49505,[],()
81145,48393,21567,1,62.5$," 8-JAN-2025,00:22","Apt. 590 90240 Haywood Cliffs, Gislasonview, MT 91435",62.5,62.5,62.5,2025-01-08 00:22:00.000,2025-01-08,2025,1,8,48393,[],()
80550,49428,21407,3,$ 61.25,12:35:29 A.M. 2024-07-13,,61.25,61.25,183.75,2024-07-13 00:35:29.000,2024-07-13,2024,7,13,49428,[],()
85533,48325,21579,1,€70.00,06:02:33;14-June-2025,,84.0,84.0,84.0,2025-06-14 06:02:33.000,2025-06-14,2025,6,14,48325,[],()
81226,49219,21486,2,23.5USD,"19:30:06,23-March-2025",,23.5,23.5,47.0,2025-03-23 19:30:06.000,2025-03-23,2025,3,23,49219,[],()
79359,50192,21425,4,$ 33.50,08:26:02 am; 9-July-2024,,33.5,33.5,134.0,2024-07-09 08:26:02.000,2024-07-09,2024,7,9,50192,[],()
85028,48520,21319,3,€23.00,"21:32:55,17-Oct-2024",,27.599999999999998,27.599999999999998,82.8,2024-10-17 21:32:55.000,2024-10-17,2024,10,17,48520,[],()
